[
  {
    "context": "At the 57th Annual Grammy Awards in February 2015, Beyonc\u00e9 was nominated for six awards, ultimately winning three: Best R&B Performance and Best R&B Song for \"Drunk in Love\", and Best Surround Sound Album for Beyonc\u00e9. She was nominated for Album of the Year but the award was won by Beck for his Morning Phase album. In August, the cover of the September issue of Vogue magazine was unveiled online, Beyonc\u00e9 as the cover star, becoming the first African-American artist and third African-American woman in general to cover the September issue. She headlined the 2015 Made in America festival in early September and also the Global Citizen Festival later that month. Beyonc\u00e9 made an uncredited featured appearance on the track \"Hymn for the Weekend\" by British rock band Coldplay, on their seventh studio album A Head Full of Dreams (2015), which saw release in December. On January 7, 2016, Pepsi announced Beyonc\u00e9 would perform alongside Coldplay at Super Bowl 50 in February. Knowles has previously performed at four Super Bowl shows throughout her career, serving as the main headliner of the 47th Super Bowl halftime show in 2013.",
    "topic": "The collaboration between Beyonc\u00e9 and Coldplay on \"Hymn for the Weekend\" and its release on A Head Full of Dreams.",
    "response": "<document_analysis>\nTo generate a highly insightful and probing question-answer pair, a careful analysis of the provided context is necessary. The context discusses Beyonc\u00e9's activities and achievements in 2015, including her nominations and wins at the 57th Annual Grammy Awards, her appearance on the cover of Vogue magazine, and her performances at various festivals. Additionally, it mentions her uncredited featured appearance on Coldplay's track \"Hymn for the Weekend\" from their album A Head Full of Dreams. \n\nGiven the information, a question that encourages deep engagement and critical reflection could involve the specifics of Beyonc\u00e9's collaboration with Coldplay or the details surrounding the release of A Head Full of Dreams. The question should be challenging, requiring a high level of understanding and insight into the topic.\n\nUpon examining the context, it becomes clear that the question should focus on the collaboration between Beyonc\u00e9 and Coldplay, as this is a unique aspect of the provided information. The difficulty level of the question should be high (8-10), ensuring that it challenges even the smartest domain experts.\n\nThoughtful consideration suggests that the question could involve the specifics of the collaboration, such as the nature of Beyonc\u00e9's contribution to \"Hymn for the Weekend\" or the circumstances surrounding her feature on the track. However, to ensure the question is highly challenging and requires deep understanding, it might be more effective to ask about the broader context of the album's release or the significance of the collaboration within Beyonc\u00e9's or Coldplay's discography.\n\nThe question should be self-contained, clear, and conversational, with answer options that are plausible and distinct. Ensuring that at least one incorrect answer is subtly wrong will add to the question's difficulty and require careful consideration from the respondent.\n\nGiven these guidelines, a potential question could explore the specifics of the album A Head Full of Dreams, the collaboration between Beyonc\u00e9 and Coldplay, or the impact of \"Hymn for the Weekend\" on either artist's career. The question should be crafted to inspire thoughtful engagement and demonstrate a deep understanding of the subject matter.\n</document_analysis>\n\n<output_format>\nQuestion: What was the significance of Beyonc\u00e9's uncredited feature on Coldplay's \"Hymn for the Weekend\" in terms of her career trajectory and musical collaborations?\nA: It marked her first foray into rock music collaborations.\nB: It was a strategic move to appeal to a broader audience before her Super Bowl 50 performance.\nC: It represented a continuation of her experimental approach to music genres, following her previous work on Beyonc\u00e9.\nD: It was a one-time contribution with no lasting impact on her musical direction.\n\nExplanation: The correct answer, C, reflects an understanding of Beyonc\u00e9's career and her approach to musical collaborations and genres. The feature on \"Hymn for the Weekend\" can be seen as part of her broader strategy of experimenting with different sounds and collaborations, which is evident in her previous work, such as the album Beyonc\u00e9. This question requires a deep understanding of Beyonc\u00e9's musical trajectory and her collaborative efforts, making it challenging for domain experts.\n\nCorrect Answer: C\n</output_format>",
    "question": "What was the significance of Beyonc\u00e9's uncredited feature on Coldplay's \"Hymn for the Weekend\" in terms of her career trajectory and musical collaborations?",
    "choices": {
      "A": "It marked her first foray into rock music collaborations.",
      "B": "It was a strategic move to appeal to a broader audience before her Super Bowl 50 performance.",
      "C": "It represented a continuation of her experimental approach to music genres, following her previous work on Beyonc\u00e9.",
      "D": "It was a one-time contribution with no lasting impact on her musical direction."
    },
    "answer": "C",
    "explanation": "The correct answer, C, reflects an understanding of Beyonc\u00e9's career and her approach to musical collaborations and genres. The feature on \"Hymn for the Weekend\" can be seen as part of her broader strategy of experimenting with different sounds and collaborations, which is evident in her previous work, such as the album Beyonc\u00e9. This question requires a deep understanding of Beyonc\u00e9's musical trajectory and her collaborative efforts, making it challenging for domain experts.",
    "question_token_count": 34,
    "answer_correctness_score": 9,
    "explanation_validity_score": 9,
    "question_clarity_score": 7,
    "question_difficulty_score": 8,
    "question_groundedness_score": 6,
    "avg_answer_token_count": 17
  },
  {
    "context": "Although this period had been productive, the bad weather had such a detrimental effect on Chopin's health that Sand determined to leave the island. To avoid further customs duties, Sand sold the piano to a local French couple, the Canuts.[n 8] The group traveled first to Barcelona, then to Marseilles, where they stayed for a few months while Chopin convalesced. In May 1839 they headed for the summer to Sand's estate at Nohant, where they spent most summers until 1846. In autumn they returned to Paris, where Chopin's apartment at 5 rue Tronchet was close to Sand's rented accommodation at the rue Pigalle. He frequently visited Sand in the evenings, but both retained some independence. In 1842 he and Sand moved to the Square d'Orl\u00e9ans, living in adjacent buildings.",
    "topic": "The impact of bad weather on Chopin's health and how it influenced his decisions and movements during this period.",
    "response": "<document_analysis>\nThe context provided revolves around the life of Chopin, focusing on the period when he was affected by bad weather on an island, which had a significant impact on his health. The key points include the decision to leave the island due to health concerns, the sale of a piano to avoid customs duties, and the subsequent movements to various locations such as Barcelona, Marseilles, Nohant, and Paris. The relationship between Chopin and Sand is also highlighted, including their living arrangements and the effort to maintain some independence.\n\nTo generate a challenging question, we need to delve into the implications of the bad weather on Chopin's health and how it influenced his decisions and movements. The question should require a deep understanding of the context and its nuances, as well as the ability to analyze the situation critically.\n\nGiven the information, a potential question could explore the motivations behind the decisions made by Chopin and Sand, particularly in relation to their health, financial considerations, and personal relationship. The question should be designed to test the ability to synthesize information, understand the complexities of the situation, and make informed judgments.\n\nThe difficulty level of the question should be high (8/10), requiring the test-taker to demonstrate a sophisticated understanding of the context and its underlying themes. The question should be self-contained, with the answer options being plausible and distinct, and the correct answer should be verifiable based on the provided context.\n</document_analysis>\n\n<output_format>\nQuestion: What was the primary factor that influenced Chopin's decision to leave the island, and how did this decision impact his subsequent movements and living arrangements?\nA: The desire to be closer to Sand's family\nB: The need to escape the bad weather that was detrimental to his health\nC: The wish to explore new musical inspirations in different cities\nD: The requirement to fulfill concert engagements in various European cities\n\nExplanation: The correct answer can be inferred from the context, which explicitly states that \"the bad weather had such a detrimental effect on Chopin's health that Sand determined to leave the island.\" This decision directly led to their movements to Barcelona, Marseilles, and eventually to Nohant and Paris, where they settled into a pattern of spending summers at Nohant and winters in Paris.\n\nCorrect Answer: B\n</output_format>",
    "question": "What was the primary factor that influenced Chopin's decision to leave the island, and how did this decision impact his subsequent movements and living arrangements?",
    "choices": {
      "A": "The desire to be closer to Sand's family",
      "B": "The need to escape the bad weather that was detrimental to his health",
      "C": "The wish to explore new musical inspirations in different cities",
      "D": "The requirement to fulfill concert engagements in various European cities"
    },
    "answer": "B",
    "explanation": "The correct answer can be inferred from the context, which explicitly states that \"the bad weather had such a detrimental effect on Chopin's health that Sand determined to leave the island.\" This decision directly led to their movements to Barcelona, Marseilles, and eventually to Nohant and Paris, where they settled into a pattern of spending summers at Nohant and winters in Paris.",
    "question_token_count": 29,
    "answer_correctness_score": 10,
    "explanation_validity_score": 10,
    "question_clarity_score": 6,
    "question_difficulty_score": 5,
    "question_groundedness_score": 9,
    "avg_answer_token_count": 11
  },
  {
    "context": "The league eventually narrowed the bids to three sites: New Orleans' Mercedes-Benz Superdome, Miami's Sun Life Stadium, and the San Francisco Bay Area's Levi's Stadium.",
    "topic": "The process of narrowing down bids for event venues, including the factors that influence the selection of specific stadiums like Mercedes-Benz Superdome, Sun Life Stadium, and Levi's Stadium.",
    "response": "<document_analysis>\nThe provided context is brief and to the point, mentioning the narrowing down of bids for event venues to three specific sites: Mercedes-Benz Superdome in New Orleans, Sun Life Stadium in Miami, and Levi's Stadium in the San Francisco Bay Area. To generate a highly insightful and probing question, we need to consider the factors that might influence the selection of such stadiums for events. These factors could include venue capacity, location, accessibility, amenities, past experiences with events, and the overall appeal of the venue to both the event organizers and the attendees. \n\nGiven the information and the goal to create a challenging question, we should focus on the strategic and logistical aspects of venue selection. The question should be designed to test the understanding of what makes a venue like Mercedes-Benz Superdome, Sun Life Stadium, or Levi's Stadium appealing for significant events, considering the broader context of event management and venue selection criteria.\n\nThe difficulty level of the question should be high (8/10) to challenge even the smartest domain experts, requiring them to think critically about the nuances of event venue selection. The question should encourage a deep engagement with the content, reflecting on the implications of choosing one venue over another and demonstrating a clear understanding of the factors involved in such decisions.\n\nConsidering the above analysis, a suitable question could be formulated to probe the domain expert's knowledge on the critical factors influencing the selection of specific stadiums for major events.\n</document_analysis>\n\n<output_format>\nQuestion: What is the primary factor that venue selection committees often prioritize when choosing between stadiums like Mercedes-Benz Superdome, Sun Life Stadium, and Levi's Stadium for large-scale events?\nA: Venue Capacity and Seating Arrangements\nB: Proximity to Major Transportation Hubs\nC: Availability of Premium Amenities and Services\nD: Historical Success of Previous Events Hosted\nExplanation: The primary factor often involves a combination of elements, but venue capacity and seating arrangements are crucial as they directly impact the event's potential revenue and attendee experience. While other factors like proximity to transportation hubs, availability of amenities, and historical success are important, they are secondary to the fundamental need for sufficient and appropriately arranged seating.\nCorrect Answer: A\n</output_format>",
    "question": "What is the primary factor that venue selection committees often prioritize when choosing between stadiums like Mercedes-Benz Superdome, Sun Life Stadium, and Levi's Stadium for large-scale events?",
    "choices": {
      "A": "Venue Capacity and Seating Arrangements",
      "B": "Proximity to Major Transportation Hubs",
      "C": "Availability of Premium Amenities and Services",
      "D": "Historical Success of Previous Events Hosted"
    },
    "answer": "A",
    "explanation": "The primary factor often involves a combination of elements, but venue capacity and seating arrangements are crucial as they directly impact the event's potential revenue and attendee experience. While other factors like proximity to transportation hubs, availability of amenities, and historical success are important, they are secondary to the fundamental need for sufficient and appropriately arranged seating.",
    "question_token_count": 37,
    "answer_correctness_score": 10,
    "explanation_validity_score": 9,
    "question_clarity_score": 1,
    "question_difficulty_score": 5,
    "question_groundedness_score": 1,
    "avg_answer_token_count": 8
  },
  {
    "context": "Victoria later described her childhood as \"rather melancholy\". Her mother was extremely protective, and Victoria was raised largely isolated from other children under the so-called \"Kensington System\", an elaborate set of rules and protocols devised by the Duchess and her ambitious and domineering comptroller, Sir John Conroy, who was rumoured to be the Duchess's lover. The system prevented the princess from meeting people whom her mother and Conroy deemed undesirable (including most of her father's family), and was designed to render her weak and dependent upon them. The Duchess avoided the court because she was scandalised by the presence of King William's bastard children, and perhaps prompted the emergence of Victorian morality by insisting that her daughter avoid any appearance of sexual impropriety. Victoria shared a bedroom with her mother every night, studied with private tutors to a regular timetable, and spent her play-hours with her dolls and her King Charles spaniel, Dash. Her lessons included French, German, Italian, and Latin, but she spoke only English at home.",
    "topic": "The role of the Duchess of Kent and Sir John Conroy in devising and implementing the \"Kensington System\", and their motivations for doing so.",
    "response": "<document_analysis>\nThe provided context describes the \"Kensington System\", a set of rules and protocols devised by the Duchess of Kent and Sir John Conroy to raise Princess Victoria. The system was designed to keep Victoria isolated from undesirable people, render her weak and dependent on her mother and Conroy, and avoid any appearance of sexual impropriety. The context also hints at the motivations behind the system, including the Duchess's desire to protect her daughter and Conroy's ambition. To generate a question, we need to consider the implications of the \"Kensington System\" and the motivations of the Duchess and Conroy. \n\nThe question should encourage deep engagement with the content, critical reflection, and nuanced understanding. We should avoid easy questions and focus on generating a highly challenging and thought-provoking question that requires a deep understanding of the context and the motivations of the characters involved.\n\nGiven the complexity of the topic and the need for a highly challenging question, the difficulty rating of the question would be 8 out of 10. The question will require the test-taker to analyze the motivations of the Duchess and Conroy, understand the implications of the \"Kensington System\", and demonstrate a nuanced understanding of the historical context.\n\n</document_analysis>\n\n<output_format>\nQuestion: What was the primary motivation behind the Duchess of Kent and Sir John Conroy's decision to implement the \"Kensington System\", and how did this motivation reflect their broader social and moral values?\nA: To protect Victoria from the corrupting influence of the royal court and ensure her marriage to a European prince.\nB: To render Victoria weak and dependent on them, thereby securing their own power and influence over her.\nC: To promote Victorian morality and avoid any appearance of sexual impropriety, reflecting their own conservative social values.\nD: To provide Victoria with a comprehensive education and prepare her for her future role as monarch, while also promoting their own ambitions.\n\nExplanation: The correct answer, B, reflects the context's description of the \"Kensington System\" as designed to render Victoria \"weak and dependent\" on her mother and Conroy. This motivation is rooted in their ambition and desire for power and influence over the future monarch. The other options, while plausible, do not accurately capture the primary motivation behind the \"Kensington System\".\n\nCorrect Answer: B\n</output_format>",
    "question": "What was the primary motivation behind the Duchess of Kent and Sir John Conroy's decision to implement the \"Kensington System\", and how did this motivation reflect their broader social and moral values?",
    "choices": {
      "A": "To protect Victoria from the corrupting influence of the royal court and ensure her marriage to a European prince.",
      "B": "To render Victoria weak and dependent on them, thereby securing their own power and influence over her.",
      "C": "To promote Victorian morality and avoid any appearance of sexual impropriety, reflecting their own conservative social values.",
      "D": "To provide Victoria with a comprehensive education and prepare her for her future role as monarch, while also promoting their own ambitions."
    },
    "answer": "B",
    "explanation": "The correct answer, B, reflects the context's description of the \"Kensington System\" as designed to render Victoria \"weak and dependent\" on her mother and Conroy. This motivation is rooted in their ambition and desire for power and influence over the future monarch. The other options, while plausible, do not accurately capture the primary motivation behind the \"Kensington System\".",
    "question_token_count": 41,
    "answer_correctness_score": 10,
    "explanation_validity_score": 10,
    "question_clarity_score": 7,
    "question_difficulty_score": 8,
    "question_groundedness_score": 9,
    "avg_answer_token_count": 22
  },
  {
    "context": "In 1839, Melbourne resigned after Radicals and Tories (both of whom Victoria detested) voted against a bill to suspend the constitution of Jamaica. The bill removed political power from plantation owners who were resisting measures associated with the abolition of slavery. The Queen commissioned a Tory, Sir Robert Peel, to form a new ministry. At the time, it was customary for the prime minister to appoint members of the Royal Household, who were usually his political allies and their spouses. Many of the Queen's ladies of the bedchamber were wives of Whigs, and Peel expected to replace them with wives of Tories. In what became known as the bedchamber crisis, Victoria, advised by Melbourne, objected to their removal. Peel refused to govern under the restrictions imposed by the Queen, and consequently resigned his commission, allowing Melbourne to return to office.",
    "topic": "The significance of the Whig and Tory parties in the context of the bedchamber crisis and their roles in shaping British politics during this period.",
    "response": "<document_analysis>\nThe context provided revolves around the bedchamber crisis of 1839, a pivotal event in British political history involving the conflict between the Whig and Tory parties, as well as the young Queen Victoria's exercise of her royal prerogatives. To craft a question that probes deep understanding and insight into this period, we must first identify the central ideas, nuanced themes, and significant relationships within the context.\n\nThe key elements here include the resignation of Melbourne, the commissioning of Sir Robert Peel to form a new ministry, the customary practice of appointing members of the Royal Household based on political alliances, the Queen's objection to replacing Whig ladies of the bedchamber with Tory wives, and the eventual resignation of Peel due to these restrictions. \n\nThe question should encourage a deep engagement with the content, critically reflect on the implications of the bedchamber crisis, and clearly demonstrate an understanding of the roles of the Whig and Tory parties during this period. Considering the complexity and the need for a high level of domain expertise, the difficulty rating of the question should be around 8 or 9 out of 10.\n\nGiven these considerations, the question should not only test the knowledge of the events surrounding the bedchamber crisis but also the understanding of the political climate, the power dynamics between the monarch, the prime minister, and the political parties, and the implications of such crises on the governance and political stability of Britain at the time.\n</document_analysis>\n\n<output_format>\nQuestion: What was the primary factor that led to Sir Robert Peel's resignation after being commissioned to form a new ministry in 1839, reflecting the underlying political tensions of the time?\nA: Disagreement over the abolition of slavery and its associated measures.\nB: The Queen's refusal to replace Whig ladies of the bedchamber with wives of Tories.\nC: Conflict over the suspension of the Jamaican constitution.\nD: Radical and Tory opposition to Melbourne's economic policies.\n\nExplanation: The correct answer, B, directly addresses the core of the bedchamber crisis, which was the Queen's insistence, advised by Melbourne, on retaining her existing ladies of the bedchamber, who were predominantly wives of Whigs, against Peel's wish to appoint Tory wives. This event highlights the significant role of personal and political relationships in shaping British politics, especially in the context of the monarch's powers and the evolving landscape of party politics.\n\nCorrect Answer: B\n</output_format>",
    "question": "What was the primary factor that led to Sir Robert Peel's resignation after being commissioned to form a new ministry in 1839, reflecting the underlying political tensions of the time?",
    "choices": {
      "A": "Disagreement over the abolition of slavery and its associated measures.",
      "B": "The Queen's refusal to replace Whig ladies of the bedchamber with wives of Tories.",
      "C": "Conflict over the suspension of the Jamaican constitution.",
      "D": "Radical and Tory opposition to Melbourne's economic policies."
    },
    "answer": "B",
    "explanation": "The correct answer, B, directly addresses the core of the bedchamber crisis, which was the Queen's insistence, advised by Melbourne, on retaining her existing ladies of the bedchamber, who were predominantly wives of Whigs, against Peel's wish to appoint Tory wives. This event highlights the significant role of personal and political relationships in shaping British politics, especially in the context of the monarch's powers and the evolving landscape of party politics.",
    "question_token_count": 36,
    "answer_correctness_score": 10,
    "explanation_validity_score": 10,
    "question_clarity_score": 8,
    "question_difficulty_score": 7,
    "question_groundedness_score": 10,
    "avg_answer_token_count": 14
  },
  {
    "context": "Gladstone returned to power after the 1892 general election; he was 82 years old. Victoria objected when Gladstone proposed appointing the Radical MP Henry Labouchere to the Cabinet, so Gladstone agreed not to appoint him. In 1894, Gladstone retired and, without consulting the outgoing prime minister, Victoria appointed Lord Rosebery as prime minister. His government was weak, and the following year Lord Salisbury replaced him. Salisbury remained prime minister for the remainder of Victoria's reign.",
    "topic": "The legacy of Gladstone's final term as prime minister and its contribution to the political landscape of the late 19th century.",
    "response": "<document_analysis>\nThe provided context revolves around the final term of Gladstone as prime minister, his retirement, and the subsequent political developments. To generate a highly insightful and probing question, it's crucial to analyze the key elements and their implications on the political landscape of the late 19th century. \n\nFirst, Gladstone's return to power at 82 years old and his eventual retirement are significant. His advanced age and the decision to retire suggest a transition period in British politics. The mention of Victoria's objection to Henry Labouchere's appointment and her direct appointment of Lord Rosebery without consulting Gladstone indicate a strong monarchical influence during this period. \n\nThe weakness of Rosebery's government and his quick replacement by Lord Salisbury further highlight the political instability and power dynamics at play. Considering these points, a question that invites deeper understanding and critical engagement could explore the implications of Gladstone's legacy and the monarchical influence on the political stability of the late 19th century.\n\nGiven the context, a thoughtful question might consider the broader impact of Gladstone's final term and retirement on the political landscape, potentially touching on themes of leadership transition, monarchical power, and party stability. \n\nThe difficulty level of such a question would be high (8/10), as it requires not only an understanding of the specific events mentioned but also the ability to analyze their broader implications and significance within the context of late 19th-century British politics.\n\n</document_analysis>\n\n<output_format>\nQuestion: What significant political consequence arose from the transition of power following Gladstone's retirement, reflecting both the monarch's influence and the instability of the subsequent governments?\nA: A lasting Liberal majority in Parliament\nB: An increased Conservative dominance under Lord Salisbury\nC: A period of political neutrality under Lord Rosebery\nD: The dissolution of the monarchical system of government\n\nExplanation: The correct answer reflects the outcome of the political transitions and power struggles following Gladstone's retirement. Lord Salisbury's government, which replaced Rosebery's weak administration, marked a period of Conservative dominance. This question requires the test-taker to understand the implications of Gladstone's retirement, the role of the monarch in appointing Lord Rosebery, and the eventual rise of Lord Salisbury, demonstrating a deep understanding of the political landscape of the time.\n\nCorrect Answer: B\n</output_format>",
    "question": "What significant political consequence arose from the transition of power following Gladstone's retirement, reflecting both the monarch's influence and the instability of the subsequent governments?",
    "choices": {
      "A": "A lasting Liberal majority in Parliament",
      "B": "An increased Conservative dominance under Lord Salisbury",
      "C": "A period of political neutrality under Lord Rosebery",
      "D": "The dissolution of the monarchical system of government"
    },
    "answer": "B",
    "explanation": "The correct answer reflects the outcome of the political transitions and power struggles following Gladstone's retirement. Lord Salisbury's government, which replaced Rosebery's weak administration, marked a period of Conservative dominance. This question requires the test-taker to understand the implications of Gladstone's retirement, the role of the monarch in appointing Lord Rosebery, and the eventual rise of Lord Salisbury, demonstrating a deep understanding of the political landscape of the time.",
    "question_token_count": 31,
    "answer_correctness_score": 10,
    "explanation_validity_score": 9,
    "question_clarity_score": 7,
    "question_difficulty_score": 6,
    "question_groundedness_score": 10,
    "avg_answer_token_count": 8
  },
  {
    "context": "The league eventually narrowed the bids to three sites: New Orleans' Mercedes-Benz Superdome, Miami's Sun Life Stadium, and the San Francisco Bay Area's Levi's Stadium.",
    "topic": "Evaluating the financial implications of selecting one venue over another for a large event, including costs associated with venue rental, security, and crowd management.",
    "response": "<document_analysis>\nTo generate a highly insightful and probing question-answer pair, we first need to analyze the provided context carefully. The context mentions three potential venues for a large event: Mercedes-Benz Superdome in New Orleans, Sun Life Stadium in Miami, and Levi's Stadium in the San Francisco Bay Area. \n\nGiven the topic of evaluating the financial implications of selecting one venue over another, we should consider various costs associated with each venue, such as venue rental, security, and crowd management. However, the provided context does not offer specific details about these costs or any financial implications.\n\nDespite the lack of detailed financial information, we can still generate a question that encourages deep engagement with the content and critically reflects on the implications of venue selection. We need to consider what factors would influence the financial implications of choosing one venue over another and how these factors might vary between the mentioned locations.\n\nThe question should be highly challenging, even for domain experts, and require a synthesis of high-level general understanding beyond the specific context. It should also be self-contained, clear, and conversational, with a focus on educational impact and deep understanding.\n\nConsidering these requirements, a potential question could explore the comparative analysis of venue selection based on unspecified but critical factors that influence financial outcomes.\n\n</document_analysis>\n\n<output_format>\nQuestion: What factor would most significantly influence the comparative financial viability of selecting Levi's Stadium over Sun Life Stadium for a large event, assuming all other factors are equal?\nA: Proximity to major transportation hubs\nB: Local tax incentives for event organizers\nC: Differences in venue rental fees\nD: Variations in regional crowd demographics\nExplanation: The correct answer, \"Differences in venue rental fees,\" is a critical factor because rental fees can significantly impact the overall cost of hosting an event. Other options, while potentially relevant, are not as directly influential on the financial viability as the rental fees. Proximity to transportation hubs (A) and local tax incentives (B) can affect costs but are not as directly impactful as rental fees. Variations in regional crowd demographics (D) might influence revenue but are less directly related to the comparative financial viability of venue selection based on costs.\nCorrect Answer: C\n</output_format>",
    "question": "What factor would most significantly influence the comparative financial viability of selecting Levi's Stadium over Sun Life Stadium for a large event, assuming all other factors are equal?",
    "choices": {
      "A": "Proximity to major transportation hubs",
      "B": "Local tax incentives for event organizers",
      "C": "Differences in venue rental fees",
      "D": "Variations in regional crowd demographics"
    },
    "answer": "C",
    "explanation": "The correct answer, \"Differences in venue rental fees,\" is a critical factor because rental fees can significantly impact the overall cost of hosting an event. Other options, while potentially relevant, are not as directly influential on the financial viability as the rental fees. Proximity to transportation hubs (A) and local tax incentives (B) can affect costs but are not as directly impactful as rental fees. Variations in regional crowd demographics (D) might influence revenue but are less directly related to the comparative financial viability of venue selection based on costs.",
    "question_token_count": 32,
    "answer_correctness_score": 10,
    "explanation_validity_score": 10,
    "question_clarity_score": 2,
    "question_difficulty_score": 5,
    "question_groundedness_score": 1,
    "avg_answer_token_count": 7
  },
  {
    "context": "Although this period had been productive, the bad weather had such a detrimental effect on Chopin's health that Sand determined to leave the island. To avoid further customs duties, Sand sold the piano to a local French couple, the Canuts.[n 8] The group traveled first to Barcelona, then to Marseilles, where they stayed for a few months while Chopin convalesced. In May 1839 they headed for the summer to Sand's estate at Nohant, where they spent most summers until 1846. In autumn they returned to Paris, where Chopin's apartment at 5 rue Tronchet was close to Sand's rented accommodation at the rue Pigalle. He frequently visited Sand in the evenings, but both retained some independence. In 1842 he and Sand moved to the Square d'Orl\u00e9ans, living in adjacent buildings.",
    "topic": "The reasons behind Sand's decision to sell the piano to the Canuts and the implications of this action on their financial situation and customs duties.",
    "response": "<document_analysis>\nTo generate a highly insightful and probing question-answer pair, I will carefully analyze the provided context. The central idea of the context revolves around George Sand's decision to sell the piano to the Canuts and its implications. \n\nFirst, I identify the key elements: Sand's decision to leave the island due to Chopin's health, the sale of the piano to the Canuts to avoid customs duties, and the subsequent travels of the group. \n\nUpon examining the context, it becomes clear that the sale of the piano was a strategic move to evade additional financial burdens in the form of customs duties. This decision suggests Sand was mindful of the financial implications of their actions and was seeking to minimize expenses.\n\nConsidering the complexity and the need for a challenging question, I will aim to create a query that requires a deep understanding of the motivations behind Sand's actions and the potential consequences of such decisions. \n\nThe question should be designed to encourage critical thinking about the financial situation of Sand and Chopin, as well as the customs duties they sought to avoid. It should also be self-contained, allowing a domain expert to answer without referencing the original context.\n\nGiven these considerations, the difficulty level of the question should be around 8 out of 10, as it requires not only an understanding of the events but also the ability to analyze the motivations and implications of Sand's decision.\n\n</document_analysis>\n\n<output_format>\nQuestion: What primary financial consideration motivated George Sand to sell the piano to the Canuts?\nA: To generate immediate cash for travel expenses\nB: To avoid incurring additional customs duties upon leaving the island\nC: To invest in a newer, more suitable piano for Chopin\nD: To help the local French couple, the Canuts, acquire a valuable asset\n\nExplanation: The correct answer, B, reflects the information provided in the context that Sand sold the piano to avoid further customs duties, indicating a strategic financial decision to minimize expenses related to customs.\n\nCorrect Answer: B\n</output_format>",
    "question": "What primary financial consideration motivated George Sand to sell the piano to the Canuts?",
    "choices": {
      "A": "To generate immediate cash for travel expenses",
      "B": "To avoid incurring additional customs duties upon leaving the island",
      "C": "To invest in a newer, more suitable piano for Chopin",
      "D": "To help the local French couple, the Canuts, acquire a valuable asset"
    },
    "answer": "B",
    "explanation": "The correct answer, B, reflects the information provided in the context that Sand sold the piano to avoid further customs duties, indicating a strategic financial decision to minimize expenses related to customs.",
    "question_token_count": 17,
    "answer_correctness_score": 10,
    "explanation_validity_score": 10,
    "question_clarity_score": 8,
    "question_difficulty_score": 6,
    "question_groundedness_score": 6,
    "avg_answer_token_count": 12
  },
  {
    "context": "Fr\u00e9d\u00e9ric Fran\u00e7ois Chopin (/\u02c8\u0283o\u028ap\u00e6n/; French pronunciation: \u200b[f\u0281e.de.\u0281ik f\u0281\u0251\u0303.swa \u0283\u0254.p\u025b\u0303]; 22 February or 1 March 1810 \u2013 17 October 1849), born Fryderyk Franciszek Chopin,[n 1] was a Polish and French (by citizenship and birth of father) composer and a virtuoso pianist of the Romantic era, who wrote primarily for the solo piano. He gained and has maintained renown worldwide as one of the leading musicians of his era, whose \"poetic genius was based on a professional technique that was without equal in his generation.\" Chopin was born in what was then the Duchy of Warsaw, and grew up in Warsaw, which after 1815 became part of Congress Poland. A child prodigy, he completed his musical education and composed his earlier works in Warsaw before leaving Poland at the age of 20, less than a month before the outbreak of the November 1830 Uprising.",
    "topic": "The relationship between Chopin's technical skill as a pianist and his poetic genius in composition.",
    "response": "<document_analysis>\nThe provided context discusses the life and career of Fr\u00e9d\u00e9ric Chopin, a renowned Polish and French composer and pianist of the Romantic era. To generate a question that probes the relationship between Chopin's technical skill as a pianist and his poetic genius in composition, we need to carefully analyze the given information and identify the central ideas and nuanced themes. \n\nThe context highlights Chopin's exceptional technical skill as a pianist, stating that his \"poetic genius was based on a professional technique that was without equal in his generation.\" This suggests a strong connection between his technical proficiency and his ability to compose poetic music. \n\nHowever, the context does not provide explicit information on how Chopin's technical skill influenced his poetic genius. Therefore, we need to consider implicit assumptions and subtle details to generate a question that encourages deep engagement with the content. \n\nOne possible approach is to explore the concept of \"poetic genius\" and how it relates to technical skill. We can ask a question that requires the test-taker to think critically about the relationship between these two aspects of Chopin's music. \n\nThe difficulty level of the question should be high (8-10), as we aim to challenge even the smartest domain experts. The question should be thought-provoking, encouraging the test-taker to reflect on the implications of Chopin's technical skill on his poetic genius. \n\nAfter careful consideration, we can generate a question that meets the required criteria.\n</document_analysis>\n\n<output_format>\nQuestion: What aspect of Chopin's piano compositions is most directly influenced by his exceptional technical skill as a pianist?\nA: Expressive nuance\nB: Harmonic complexity\nC: Melodic simplicity\nD: Rhythmic innovation\nExplanation: Chopin's technical skill as a pianist is most directly influential on the harmonic complexity of his compositions, as his mastery of intricate fingerwork and pedaling techniques allowed him to create rich, nuanced harmonies that were unparalleled in his generation.\nCorrect Answer: B\n</output_format>",
    "question": "What aspect of Chopin's piano compositions is most directly influenced by his exceptional technical skill as a pianist?",
    "choices": {
      "A": "Expressive nuance",
      "B": "Harmonic complexity",
      "C": "Melodic simplicity",
      "D": "Rhythmic innovation"
    },
    "answer": "B",
    "explanation": "Chopin's technical skill as a pianist is most directly influential on the harmonic complexity of his compositions, as his mastery of intricate fingerwork and pedaling techniques allowed him to create rich, nuanced harmonies that were unparalleled in his generation.",
    "question_token_count": 21,
    "answer_correctness_score": 8,
    "explanation_validity_score": 9,
    "question_clarity_score": 8,
    "question_difficulty_score": 6,
    "question_groundedness_score": 8,
    "avg_answer_token_count": 4
  },
  {
    "context": "For the third straight season, the number one seeds from both conferences met in the Super Bowl. The Carolina Panthers became one of only ten teams to have completed a regular season with only one loss, and one of only six teams to have acquired a 15\u20131 record, while the Denver Broncos became one of four teams to have made eight appearances in the Super Bowl. The Broncos made their second Super Bowl appearance in three years, having reached Super Bowl XLVIII, while the Panthers made their second Super Bowl appearance in franchise history, their other appearance being Super Bowl XXXVIII. Coincidentally, both teams were coached by John Fox in their last Super Bowl appearance prior to Super Bowl 50.",
    "topic": "The NFL's competitive balance, considering the frequent appearances of top-seeded teams in the Super Bowl.",
    "response": "<document_analysis>\nTo generate a highly insightful and probing question-answer pair, I will conduct a thorough analysis of the provided context. The central idea of the context revolves around the competitive balance in the NFL, specifically highlighting the frequent appearances of top-seeded teams in the Super Bowl. Notable details include the Carolina Panthers' impressive 15-1 regular season record and the Denver Broncos' multiple Super Bowl appearances. \n\nUpon examining the context, I notice that it provides specific examples of teams' performance and their appearances in the Super Bowl, rather than directly discussing the competitive balance in the NFL. However, these examples can be used to infer information about the competitive landscape of the league.\n\nTo create a challenging question, I will consider the implicit assumptions and subtle details within the context. One potential area of exploration is the relationship between a team's regular season performance and their likelihood of appearing in the Super Bowl. \n\nGiven the information provided, I will plan a question that invites deeper understanding and critical engagement with the content. The question should be purposeful and encourage the domain expert to think critically about the implications of the information presented.\n\nThe difficulty level of the question will be rated as an 8 out of 10, as it requires the domain expert to make connections between the specific examples provided and the broader concept of competitive balance in the NFL.\n\nThoughtfully considering the context and the desired level of complexity, I will generate a question that is both challenging and relevant to the topic.\n</document_analysis>\n\n<output_format>\nQuestion: What is a potential consequence of a team achieving a 15-1 regular season record on their competitive balance in the playoffs?\nA: Increased likelihood of being upset in the early rounds\nB: Improved chances of appearing in the Super Bowl\nC: No impact on their playoff performance\nD: Guaranteed victory in the Super Bowl\n\nExplanation: The question requires the domain expert to consider the relationship between a team's regular season performance and their likelihood of appearing in the Super Bowl. A 15-1 regular season record, such as the one achieved by the Carolina Panthers, may indicate a strong team that is well-positioned for playoff success. Therefore, the correct answer is B) Improved chances of appearing in the Super Bowl.\n\nCorrect Answer: B\n</output_format>",
    "question": "What is a potential consequence of a team achieving a 15-1 regular season record on their competitive balance in the playoffs?",
    "choices": {
      "A": "Increased likelihood of being upset in the early rounds",
      "B": "Improved chances of appearing in the Super Bowl",
      "C": "No impact on their playoff performance",
      "D": "Guaranteed victory in the Super Bowl"
    },
    "answer": "B",
    "explanation": "The question requires the domain expert to consider the relationship between a team's regular season performance and their likelihood of appearing in the Super Bowl. A 15-1 regular season record, such as the one achieved by the Carolina Panthers, may indicate a strong team that is well-positioned for playoff success. Therefore, the correct answer is B) Improved chances of appearing in the Super Bowl.",
    "question_token_count": 26,
    "answer_correctness_score": 9,
    "explanation_validity_score": 9,
    "question_clarity_score": 7,
    "question_difficulty_score": 6,
    "question_groundedness_score": 6,
    "avg_answer_token_count": 8
  },
  {
    "context": "Antibiotics revolutionized medicine in the 20th century, and have together with vaccination led to the near eradication of diseases such as tuberculosis in the developed world. Their effectiveness and easy access led to overuse, especially in livestock raising, prompting bacteria to develop resistance. This has led to widespread problems with antimicrobial and antibiotic resistance, so much as to prompt the World Health Organization to classify antimicrobial resistance as a \"serious threat [that] is no longer a prediction for the future, it is happening right now in every region of the world and has the potential to affect anyone, of any age, in any country\".",
    "topic": "The comparison of antibiotic use in human medicine versus livestock raising and the ethical considerations surrounding these practices.",
    "response": "<document_analysis>\nThe provided context discusses the impact of antibiotic use in human medicine and livestock raising, highlighting the issue of antimicrobial resistance. The central idea is that the overuse of antibiotics, particularly in livestock, has led to the development of resistant bacteria, posing a significant threat to global health. The context cites the World Health Organization's classification of antimicrobial resistance as a \"serious threat\" and notes its potential to affect anyone, regardless of age or country.\n\nUpon examining the context, it becomes clear that the topic requires a nuanced understanding of the ethical considerations surrounding antibiotic use in human medicine and livestock raising. The question should encourage critical thinking and reflection on the implications of these practices.\n\nTo generate a challenging question, I will consider the following factors:\n\n1. Thoughtful Content Examination: The context highlights the overuse of antibiotics in livestock raising as a primary contributor to antimicrobial resistance.\n2. Concept Exploration: The underlying theory is that the misuse of antibiotics in livestock has significant consequences for human health.\n3. Strategic Complexity Calibration: I rate the difficulty of this topic as an 8 out of 10, given the need to understand the complex relationships between antibiotic use, resistance, and global health.\n4. Intentional Question Planning: The question should invite deeper understanding and critical engagement with the content, encouraging the respondent to consider the ethical implications of antibiotic use in different contexts.\n\nGiven these considerations, I will generate a question that requires the respondent to think critically about the comparison of antibiotic use in human medicine versus livestock raising and the ethical considerations surrounding these practices.\n</document_analysis>\n\n<output_format>\nQuestion: What is the primary ethical concern driving the distinction between antibiotic use in human medicine and livestock raising, in terms of promoting antimicrobial resistance?\nA: Minimizing economic losses in livestock production\nB: Ensuring equitable access to antibiotics for human populations\nC: Preventing the development of antibiotic-resistant bacteria in humans\nD: Protecting animal welfare in agricultural practices\nExplanation: The correct answer, C, reflects the primary ethical concern driving the distinction between antibiotic use in human medicine and livestock raising. The overuse of antibiotics in livestock has led to the development of resistant bacteria, posing a significant threat to human health. This concern is rooted in the ethical principle of protecting human health and preventing harm.\nCorrect Answer: C\n</output_format>",
    "question": "What is the primary ethical concern driving the distinction between antibiotic use in human medicine and livestock raising, in terms of promoting antimicrobial resistance?",
    "choices": {
      "A": "Minimizing economic losses in livestock production",
      "B": "Ensuring equitable access to antibiotics for human populations",
      "C": "Preventing the development of antibiotic-resistant bacteria in humans",
      "D": "Protecting animal welfare in agricultural practices"
    },
    "answer": "C",
    "explanation": "The correct answer, C, reflects the primary ethical concern driving the distinction between antibiotic use in human medicine and livestock raising. The overuse of antibiotics in livestock has led to the development of resistant bacteria, posing a significant threat to human health. This concern is rooted in the ethical principle of protecting human health and preventing harm.",
    "question_token_count": 27,
    "answer_correctness_score": 10,
    "explanation_validity_score": 10,
    "question_clarity_score": 6,
    "question_difficulty_score": 7,
    "question_groundedness_score": 2,
    "avg_answer_token_count": 9
  },
  {
    "context": "From September 1823 to 1826 Chopin attended the Warsaw Lyceum, where he received organ lessons from the Czech musician Wilhelm W\u00fcrfel during his first year. In the autumn of 1826 he began a three-year course under the Silesian composer J\u00f3zef Elsner at the Warsaw Conservatory, studying music theory, figured bass and composition.[n 3] Throughout this period he continued to compose and to give recitals in concerts and salons in Warsaw. He was engaged by the inventors of a mechanical organ, the \"eolomelodicon\", and on this instrument in May 1825 he performed his own improvisation and part of a concerto by Moscheles. The success of this concert led to an invitation to give a similar recital on the instrument before Tsar Alexander I, who was visiting Warsaw; the Tsar presented him with a diamond ring. At a subsequent eolomelodicon concert on 10 June 1825, Chopin performed his Rondo Op. 1. This was the first of his works to be commercially published and earned him his first mention in the foreign press, when the Leipzig Allgemeine Musikalische Zeitung praised his \"wealth of musical ideas\".",
    "topic": "The relationship between Chopin's early musical successes and his future career, including how these experiences may have influenced his compositional style and professional trajectory.",
    "response": "<document_analysis>\nThe provided context discusses Chopin's early musical education and successes, highlighting his time at the Warsaw Lyceum and the Warsaw Conservatory. It mentions his studies under Wilhelm W\u00fcrfel and J\u00f3zef Elsner, as well as his compositional activities and performances during this period. Notably, the context describes Chopin's successful recitals on the eolomelodicon, including one before Tsar Alexander I, which led to recognition and praise in the foreign press. To generate a challenging question, we need to consider how these early experiences might have influenced Chopin's compositional style and professional trajectory. \n\nGiven the information about Chopin's early successes, particularly with the eolomelodicon and the praise he received for his \"wealth of musical ideas,\" a thoughtful question could explore how these experiences might have shaped his approach to composition. The difficulty rating for such a question would be high (8-10), as it requires not only an understanding of Chopin's early career but also an ability to analyze the potential impact of these experiences on his compositional development.\n\nA potential question could delve into the relationship between Chopin's early performances, the recognition he received, and how these factors might have influenced his compositional style, encouraging a deep engagement with the content and a nuanced understanding of Chopin's career development.\n</document_analysis>\n\n<output_format>\nQuestion: What potential impact might Chopin's early successes with the eolomelodicon, including the praise for his \"wealth of musical ideas,\" have had on the evolution of his compositional style and approach to musical innovation?\nA: They likely constrained his style to mechanical organ compositions.\nB: They had no significant impact on his compositional development.\nC: They encouraged experimentation with novel instrumental timbres and expressive depths.\nD: They led to a focus solely on concertos, limiting his musical range.\n\nExplanation: The correct answer, C, suggests that Chopin's early successes, particularly the positive reception of his improvisation and compositional skills as evidenced by the praise for his \"wealth of musical ideas,\" would have emboldened him to continue exploring and pushing the boundaries of musical expression. This is consistent with the development of a composer who becomes known for innovative and emotionally deep works. The incorrect options (A, B, and D) either misrepresent the potential impact of these successes or suggest limitations that are not supported by Chopin's subsequent career and compositional output.\n\nCorrect Answer: C\n</output_format>",
    "question": "What potential impact might Chopin's early successes with the eolomelodicon, including the praise for his \"wealth of musical ideas,\" have had on the evolution of his compositional style and approach to musical innovation?",
    "choices": {
      "A": "They likely constrained his style to mechanical organ compositions.",
      "B": "They had no significant impact on his compositional development.",
      "C": "They encouraged experimentation with novel instrumental timbres and expressive depths.",
      "D": "They led to a focus solely on concertos, limiting his musical range."
    },
    "answer": "C",
    "explanation": "The correct answer, C, suggests that Chopin's early successes, particularly the positive reception of his improvisation and compositional skills as evidenced by the praise for his \"wealth of musical ideas,\" would have emboldened him to continue exploring and pushing the boundaries of musical expression. This is consistent with the development of a composer who becomes known for innovative and emotionally deep works. The incorrect options (A, B, and D) either misrepresent the potential impact of these successes or suggest limitations that are not supported by Chopin's subsequent career and compositional output.",
    "question_token_count": 44,
    "answer_correctness_score": 10,
    "explanation_validity_score": 10,
    "question_clarity_score": 8,
    "question_difficulty_score": 8,
    "question_groundedness_score": 4,
    "avg_answer_token_count": 13
  },
  {
    "context": "Antibiotics are screened for any negative effects on humans or other mammals before approval for clinical use, and are usually considered safe and most are well tolerated. However, some antibiotics have been associated with a range of adverse side effects. Side-effects range from mild to very serious depending on the antibiotics used, the microbial organisms targeted, and the individual patient. Side effects may reflect the pharmacological or toxicological properties of the antibiotic or may involve hypersensitivity reactions or anaphylaxis. Safety profiles of newer drugs are often not as well established as for those that have a long history of use. Adverse effects range from fever and nausea to major allergic reactions, including photodermatitis and anaphylaxis. Common side-effects include diarrhea, resulting from disruption of the species composition in the intestinal flora, resulting, for example, in overgrowth of pathogenic bacteria, such as Clostridium difficile. Antibacterials can also affect the vaginal flora, and may lead to overgrowth of yeast species of the genus Candida in the vulvo-vaginal area. Additional side-effects can result from interaction with other drugs, such as elevated risk of tendon damage from administration of a quinolone antibiotic with a systemic corticosteroid. Some scientists have hypothesized that the indiscriminate use of antibiotics alter the host microbiota and this has been associated with chronic disease.",
    "topic": "The potential interactions between antibiotics and other drugs, such as systemic corticosteroids, and the resulting side effects.",
    "response": "<document_analysis>\nThe provided context discusses the potential side effects and interactions of antibiotics with other drugs, such as systemic corticosteroids. It highlights the range of adverse effects associated with antibiotics, from mild to severe, and notes that safety profiles of newer drugs may not be as well established as those with a long history of use. The context also mentions specific side effects, including diarrhea, disruption of intestinal flora, and interactions with other drugs that can lead to elevated risks of certain conditions, such as tendon damage when quinolone antibiotics are administered with systemic corticosteroids.\n\nGiven this information, the goal is to generate a question that probes deep understanding and insight into the potential interactions between antibiotics and other drugs, and the resulting side effects. The question should be highly challenging, requiring the synthesis of high-level general understanding and nuance in considering the implications of these interactions.\n\nThoughtful content examination reveals that the context provides a foundation for exploring complex interactions between antibiotics and other medications, emphasizing the importance of considering these interactions to mitigate adverse effects. Concept exploration suggests that implicit assumptions about drug interactions and their consequences on patient health are critical. Strategic complexity calibration indicates that a question rating of 8 out of 10 in terms of difficulty would be appropriate, as it needs to challenge even the smartest domain experts without being impossibly obscure.\n\nIntentional question planning involves crafting a question that invites deeper understanding and critical engagement with the content, focusing on the nuanced aspects of drug interactions and their implications for patient care.\n</document_analysis>\n\n<output_format>\nQuestion: What is a potential consequence of co-administering a quinolone antibiotic with a systemic corticosteroid that highlights the need for careful consideration of drug interactions in antibiotic therapy?\nA: Increased risk of photodermatitis\nB: Elevated risk of tendon damage\nC: Higher likelihood of Clostridium difficile overgrowth\nD: Enhanced efficacy against Candida species\n\nExplanation: The correct answer, \"Elevated risk of tendon damage,\" is supported by the context, which explicitly mentions this as a potential side effect of combining quinolone antibiotics with systemic corticosteroids. This question requires the test-taker to understand the specific interaction between these drug classes and the potential consequences for patient health, demonstrating a deep understanding of the content.\n\nCorrect Answer: B\n</output_format>",
    "question": "What is a potential consequence of co-administering a quinolone antibiotic with a systemic corticosteroid that highlights the need for careful consideration of drug interactions in antibiotic therapy?",
    "choices": {
      "A": "Increased risk of photodermatitis",
      "B": "Elevated risk of tendon damage",
      "C": "Higher likelihood of Clostridium difficile overgrowth",
      "D": "Enhanced efficacy against Candida species"
    },
    "answer": "B",
    "explanation": "The correct answer, \"Elevated risk of tendon damage,\" is supported by the context, which explicitly mentions this as a potential side effect of combining quinolone antibiotics with systemic corticosteroids. This question requires the test-taker to understand the specific interaction between these drug classes and the potential consequences for patient health, demonstrating a deep understanding of the content.",
    "question_token_count": 34,
    "answer_correctness_score": 10,
    "explanation_validity_score": 10,
    "question_clarity_score": 8,
    "question_difficulty_score": 7,
    "question_groundedness_score": 10,
    "avg_answer_token_count": 7
  },
  {
    "context": "Fryderyk Chopin was born in \u017belazowa Wola, 46 kilometres (29 miles) west of Warsaw, in what was then the Duchy of Warsaw, a Polish state established by Napoleon. The parish baptismal record gives his birthday as 22 February 1810, and cites his given names in the Latin form Fridericus Franciscus (in Polish, he was Fryderyk Franciszek). However, the composer and his family used the birthdate 1 March,[n 2] which is now generally accepted as the correct date.",
    "topic": "The relationship between historical events, such as the establishment of the Duchy of Warsaw, and the lives of notable figures, like Chopin, who were born during that time.",
    "response": "<document_analysis>\nTo generate a highly insightful and probing question-answer pair, a careful analysis of the provided context is necessary. The context discusses Fryderyk Chopin's birth, specifically the location and date, and mentions the historical context of the Duchy of Warsaw. \n\n1. **Thoughtful Content Examination**: The central idea here is the connection between historical events (the establishment of the Duchy of Warsaw) and the life of a notable figure (Fryderyk Chopin). The nuances include the specific details about Chopin's birthdate and the political entity (Duchy of Warsaw) in which he was born.\n\n2. **Concept Exploration**: Implicit in this context is the influence of political and historical events on individual lives. The establishment of the Duchy of Warsaw by Napoleon is a significant historical event that sets the stage for Chopin's life and possibly influences his upbringing and career. The mention of different birthdates (22 February 1810, and 1 March 1810) suggests there might be complexities or uncertainties in historical records.\n\n3. **Strategic Complexity Calibration**: The difficulty of the question should be high (around 8-9 out of 10) to challenge domain experts. This requires crafting a question that not only tests knowledge of Chopin and the Duchy of Warsaw but also encourages critical thinking about how historical contexts shape individual biographies.\n\n4. **Intentional Question Planning**: A question that invites deeper understanding could explore the implications of being born in the Duchy of Warsaw on Chopin's life and work. This involves considering how the political climate, cultural norms, and historical events of that specific time and place might have influenced his musical compositions or personal beliefs.\n\nGiven these considerations, the question should be designed to provoke thought on the intersection of historical events and personal biography, ensuring it is challenging, educational, and relevant to the topic.\n</document_analysis>\n\n<output_format>\nQuestion: What potential impact might the political and cultural environment of the Duchy of Warsaw have had on the early life and musical development of Fryderyk Chopin?\nA: It would have had no significant impact on his life or music.\nB: It exposed him to a unique blend of Polish and French cultural influences that shaped his compositions.\nC: It led to his family's relocation to France, where he began his musical training.\nD: It resulted in his music being primarily focused on patriotic themes related to the Duchy of Warsaw.\n\nExplanation: The correct answer, B, reflects an understanding that the Duchy of Warsaw, as a Polish state under Napoleon's influence, would have presented a distinct cultural and political environment. This environment could have exposed Chopin to a variety of musical and artistic influences, potentially shaping his style and compositions. Options A, C, and D are incorrect because they either dismiss the potential impact altogether, introduce unfounded assumptions about his family's relocation, or misrepresent the focus of his music.\n\nCorrect Answer: B\n</output_format>",
    "question": "What potential impact might the political and cultural environment of the Duchy of Warsaw have had on the early life and musical development of Fryderyk Chopin?",
    "choices": {
      "A": "It would have had no significant impact on his life or music.",
      "B": "It exposed him to a unique blend of Polish and French cultural influences that shaped his compositions.",
      "C": "It led to his family's relocation to France, where he began his musical training.",
      "D": "It resulted in his music being primarily focused on patriotic themes related to the Duchy of Warsaw."
    },
    "answer": "B",
    "explanation": "The correct answer, B, reflects an understanding that the Duchy of Warsaw, as a Polish state under Napoleon's influence, would have presented a distinct cultural and political environment. This environment could have exposed Chopin to a variety of musical and artistic influences, potentially shaping his style and compositions. Options A, C, and D are incorrect because they either dismiss the potential impact altogether, introduce unfounded assumptions about his family's relocation, or misrepresent the focus of his music.",
    "question_token_count": 32,
    "answer_correctness_score": 9,
    "explanation_validity_score": 9,
    "question_clarity_score": 6,
    "question_difficulty_score": 7,
    "question_groundedness_score": 4,
    "avg_answer_token_count": 17
  },
  {
    "context": "Palmerston died in 1865, and after a brief ministry led by Russell, Derby returned to power. In 1866, Victoria attended the State Opening of Parliament for the first time since Albert's death. The following year she supported the passing of the Reform Act 1867 which doubled the electorate by extending the franchise to many urban working men, though she was not in favour of votes for women. Derby resigned in 1868, to be replaced by Benjamin Disraeli, who charmed Victoria. \"Everyone likes flattery,\" he said, \"and when you come to royalty you should lay it on with a trowel.\" With the phrase \"we authors, Ma'am\", he complimented her. Disraeli's ministry only lasted a matter of months, and at the end of the year his Liberal rival, William Ewart Gladstone, was appointed prime minister. Victoria found Gladstone's demeanour far less appealing; he spoke to her, she is thought to have complained, as though she were \"a public meeting rather than a woman\".",
    "topic": "The implications of the Reform Act 1867 on the British electoral system and the representation of urban working men.",
    "response": "<document_analysis>\nThe context provided revolves around the period following Palmerston's death in 1865 and the subsequent political shifts, including the passage of the Reform Act 1867. This act is highlighted as a significant event that doubled the electorate by extending the franchise to many urban working men. The analysis focuses on understanding the implications of this act on the British electoral system and the representation of urban working men.\n\nGiven the context, it is essential to consider the underlying social and political dynamics that led to the Reform Act 1867 and its consequences. The act's extension of the franchise to urban working men marks a crucial step in the evolution of democratic representation in Britain. However, the context also notes Victoria's stance against votes for women, indicating the act's limitations in terms of universal suffrage.\n\nThe question generation process involves identifying the central ideas and nuances within the context. The Reform Act 1867 is the pivotal element, and understanding its implications requires considering both the expansion of the electorate and the continued exclusions, such as women's suffrage. The goal is to craft a question that probes the domain expert's knowledge on the intricate dynamics of electoral reform, representation, and the social-political climate of the time.\n\nThe decision to focus on the implications of the Reform Act 1867 is based on its significance as a landmark legislative event that altered the British electoral landscape. By exploring the effects of this act, the question aims to assess the domain expert's ability to analyze historical events, understand their consequences, and reflect on the broader societal and political shifts they precipitated.\n\nDifficulty rating: 8/10. The question requires a deep understanding of the historical context, the specifics of the Reform Act 1867, and its implications for the representation of urban working men. It demands the ability to analyze complex historical information, identify key legislative impacts, and consider the social and political nuances of the era.\n</document_analysis>\n\n<output_format>\nQuestion: What was the primary demographic group that benefited from the extension of the franchise under the Reform Act 1867, and how did this reflect the broader social and political changes of the time?\nA: Rural landowners\nB: Urban working men\nC: Women from all social classes\nD: Industrial capitalists\n\nExplanation: The Reform Act 1867 is specifically noted in the context as extending the franchise to many urban working men, thus doubling the electorate. This reflects the broader social and political changes aimed at increasing democratic representation among previously disenfranchised groups.\n\nCorrect Answer: B\n</output_format>",
    "question": "What was the primary demographic group that benefited from the extension of the franchise under the Reform Act 1867, and how did this reflect the broader social and political changes of the time?",
    "choices": {
      "A": "Rural landowners",
      "B": "Urban working men",
      "C": "Women from all social classes",
      "D": "Industrial capitalists"
    },
    "answer": "B",
    "explanation": "The Reform Act 1867 is specifically noted in the context as extending the franchise to many urban working men, thus doubling the electorate. This reflects the broader social and political changes aimed at increasing democratic representation among previously disenfranchised groups.",
    "question_token_count": 38,
    "answer_correctness_score": 10,
    "explanation_validity_score": 10,
    "question_clarity_score": 8,
    "question_difficulty_score": 6,
    "question_groundedness_score": 9,
    "avg_answer_token_count": 4
  },
  {
    "context": "Antibiotics are screened for any negative effects on humans or other mammals before approval for clinical use, and are usually considered safe and most are well tolerated. However, some antibiotics have been associated with a range of adverse side effects. Side-effects range from mild to very serious depending on the antibiotics used, the microbial organisms targeted, and the individual patient. Side effects may reflect the pharmacological or toxicological properties of the antibiotic or may involve hypersensitivity reactions or anaphylaxis. Safety profiles of newer drugs are often not as well established as for those that have a long history of use. Adverse effects range from fever and nausea to major allergic reactions, including photodermatitis and anaphylaxis. Common side-effects include diarrhea, resulting from disruption of the species composition in the intestinal flora, resulting, for example, in overgrowth of pathogenic bacteria, such as Clostridium difficile. Antibacterials can also affect the vaginal flora, and may lead to overgrowth of yeast species of the genus Candida in the vulvo-vaginal area. Additional side-effects can result from interaction with other drugs, such as elevated risk of tendon damage from administration of a quinolone antibiotic with a systemic corticosteroid. Some scientists have hypothesized that the indiscriminate use of antibiotics alter the host microbiota and this has been associated with chronic disease.",
    "topic": "The relationship between antibiotic use and the development of antibiotic-resistant bacteria.",
    "response": "<document_analysis>\nThe provided context discusses the relationship between antibiotic use and their potential side effects, including the disruption of intestinal flora and the potential for overgrowth of pathogenic bacteria. It also touches upon the idea that the indiscriminate use of antibiotics may alter the host microbiota, potentially leading to chronic disease. However, the context does not directly address the development of antibiotic-resistant bacteria. \n\nTo generate a question that is highly insightful and probing, we need to consider the implicit assumptions and subtle details within the context. One potential area of exploration is the relationship between antibiotic use, disruption of intestinal flora, and the development of antibiotic-resistant bacteria. \n\nThe difficulty level of the question should be high (8-10), as it requires the test-taker to make connections between different concepts and think critically about the potential consequences of antibiotic use.\n\nThe question should be designed to encourage deep engagement with the content, critical reflection, and nuanced understanding. It should also be self-contained, clear, and concise, with sufficient context for the test-taker to understand the question without referencing external materials.\n</document_analysis>\n\n<output_format>\nQuestion: What is a potential long-term consequence of disrupting the balance of intestinal flora through antibiotic use, in terms of the development of antibiotic-resistant bacterial populations?\nA: Increased susceptibility to viral infections\nB: Enhanced immune system function\nC: Selection pressure for antibiotic-resistant bacterial strains\nD: Improved nutrient absorption\n\nExplanation: The correct answer, C, is based on the understanding that disrupting the balance of intestinal flora can lead to the overgrowth of pathogenic bacteria, which can then be subjected to selection pressure from antibiotic use, driving the development of antibiotic-resistant strains.\n\nCorrect Answer: C\n</output_format>",
    "question": "What is a potential long-term consequence of disrupting the balance of intestinal flora through antibiotic use, in terms of the development of antibiotic-resistant bacterial populations?",
    "choices": {
      "A": "Increased susceptibility to viral infections",
      "B": "Enhanced immune system function",
      "C": "Selection pressure for antibiotic-resistant bacterial strains",
      "D": "Improved nutrient absorption"
    },
    "answer": "C",
    "explanation": "The correct answer, C, is based on the understanding that disrupting the balance of intestinal flora can lead to the overgrowth of pathogenic bacteria, which can then be subjected to selection pressure from antibiotic use, driving the development of antibiotic-resistant strains.",
    "question_token_count": 31,
    "answer_correctness_score": 10,
    "explanation_validity_score": 10,
    "question_clarity_score": 7,
    "question_difficulty_score": 8,
    "question_groundedness_score": 4,
    "avg_answer_token_count": 5
  },
  {
    "context": "Following their loss in the divisional round of the previous season's playoffs, the Denver Broncos underwent numerous coaching changes, including a mutual parting with head coach John Fox (who had won four divisional championships in his four years as Broncos head coach), and the hiring of Gary Kubiak as the new head coach. Under Kubiak, the Broncos planned to install a run-oriented offense with zone blocking to blend in with quarterback Peyton Manning's shotgun passing skills, but struggled with numerous changes and injuries to the offensive line, as well as Manning having his worst statistical season since his rookie year with the Indianapolis Colts in 1998, due to a plantar fasciitis injury in his heel that he had suffered since the summer, and the simple fact that Manning was getting old, as he turned 39 in the 2015 off-season. Although the team had a 7\u20130 start, Manning led the NFL in interceptions. In week 10, Manning suffered a partial tear of the plantar fasciitis in his left foot. He set the NFL's all-time record for career passing yards in this game, but was benched after throwing four interceptions in favor of backup quarterback Brock Osweiler, who took over as the starter for most of the remainder of the regular season. Osweiler was injured, however, leading to Manning's return during the Week 17 regular season finale, where the Broncos were losing 13\u20137 against the 4\u201311 San Diego Chargers, resulting in Manning re-claiming the starting quarterback position for the playoffs by leading the team to a key 27\u201320 win that enabled the team to clinch the number one overall AFC seed. Under defensive coordinator Wade Phillips, the Broncos' defense ranked number one in total yards allowed, passing yards allowed and sacks, and like the previous three seasons, the team has continued to set numerous individual, league and franchise records. With the defense carrying the team despite the issues with the offense, the Broncos finished the regular season with a 12\u20134 record and earned home-field advantage throughout the AFC playoffs.",
    "topic": "The effects of Peyton Manning's plantar fasciitis injury on his performance and the team's overall success, including his benching in favor of Brock Osweiler.",
    "response": "<document_analysis>\nThe provided context discusses the Denver Broncos' 2015 season, with a focus on Peyton Manning's performance and the team's overall success. Manning suffered from a plantar fasciitis injury, which significantly impacted his play, leading to him being benched in favor of Brock Osweiler. The team's coaching changes, including the hiring of Gary Kubiak, and the implementation of a new offense, are also mentioned. The context highlights the Broncos' defensive strengths, which helped the team finish with a 12-4 record and earn home-field advantage in the AFC playoffs. \n\nTo generate a question, we need to identify the central ideas, nuanced themes, and significant relationships within the context. The key points include Manning's injury, his benching, the team's coaching changes, and the defensive performance. \n\nThe question should encourage deep engagement with the content, critically reflect on implications, and demonstrate understanding and competency. It should be highly challenging, even for domain experts, and require a synthesis of high-level general understanding beyond the specific context. \n\nConsidering these factors, a potential question could explore the impact of Manning's injury on the team's strategy and performance. \n\nThoughtful engagement with the content suggests that the question should delve into the nuances of Manning's condition, the coaching decisions, and the team's overall success. \n\nHigh complexity and difficulty can be achieved by making the question open-ended, requiring the test-taker to analyze the situation, consider multiple factors, and provide a thoughtful response. \n\nThe question should be self-contained, with sufficient context provided, and should not require external references. \n\nThe answer options should be plausible, reasonable, and distinct, with at least one incorrect option being subtly wrong, making it challenging to distinguish from the correct answer.\n</document_analysis>\n\n<output_format>\nQuestion: What was the primary factor that led to Peyton Manning being benched in favor of Brock Osweiler during the 2015 season?\nA: Manning's advancing age\nB: A partial tear of the plantar fasciitis in his left foot\nC: The team's struggles with the new run-oriented offense\nD: Manning's four interceptions in a single game\nExplanation: The correct answer is D) Manning's four interceptions in a single game, as this is explicitly stated in the context as the reason for his benching. While Manning's age and injury (options A and B) contributed to his poor performance, they were not the direct cause of his benching. The team's struggles with the new offense (option C) are also mentioned, but this is not the primary factor that led to Manning being benched.\nCorrect Answer: D\n</output_format>",
    "question": "What was the primary factor that led to Peyton Manning being benched in favor of Brock Osweiler during the 2015 season?",
    "choices": {
      "A": "Manning's advancing age",
      "B": "A partial tear of the plantar fasciitis in his left foot",
      "C": "The team's struggles with the new run-oriented offense",
      "D": "Manning's four interceptions in a single game"
    },
    "answer": "D",
    "explanation": "The correct answer is D) Manning's four interceptions in a single game, as this is explicitly stated in the context as the reason for his benching. While Manning's age and injury (options A and B) contributed to his poor performance, they were not the direct cause of his benching. The team's struggles with the new offense (option C) are also mentioned, but this is not the primary factor that led to Manning being benched.",
    "question_token_count": 27,
    "answer_correctness_score": 10,
    "explanation_validity_score": 10,
    "question_clarity_score": 8,
    "question_difficulty_score": 6,
    "question_groundedness_score": 10,
    "avg_answer_token_count": 10
  },
  {
    "context": "Antibiotics are screened for any negative effects on humans or other mammals before approval for clinical use, and are usually considered safe and most are well tolerated. However, some antibiotics have been associated with a range of adverse side effects. Side-effects range from mild to very serious depending on the antibiotics used, the microbial organisms targeted, and the individual patient. Side effects may reflect the pharmacological or toxicological properties of the antibiotic or may involve hypersensitivity reactions or anaphylaxis. Safety profiles of newer drugs are often not as well established as for those that have a long history of use. Adverse effects range from fever and nausea to major allergic reactions, including photodermatitis and anaphylaxis. Common side-effects include diarrhea, resulting from disruption of the species composition in the intestinal flora, resulting, for example, in overgrowth of pathogenic bacteria, such as Clostridium difficile. Antibacterials can also affect the vaginal flora, and may lead to overgrowth of yeast species of the genus Candida in the vulvo-vaginal area. Additional side-effects can result from interaction with other drugs, such as elevated risk of tendon damage from administration of a quinolone antibiotic with a systemic corticosteroid. Some scientists have hypothesized that the indiscriminate use of antibiotics alter the host microbiota and this has been associated with chronic disease.",
    "topic": "The hypothesis that indiscriminate antibiotic use alters the host microbiota and its potential association with chronic disease.",
    "response": "<document_analysis>\nThe context provided discusses the potential side effects of antibiotics, ranging from mild to severe, and their impact on the host microbiota. It highlights the importance of considering the safety profiles of antibiotics, particularly newer ones, and the potential for adverse effects such as diarrhea, allergic reactions, and disruption of the intestinal flora. The text also touches on the hypothesis that indiscriminate antibiotic use may alter the host microbiota, potentially leading to chronic disease. \n\nUpon analyzing the context, it is clear that the central idea revolves around the consequences of antibiotic use on human health, specifically the balance of microbiota and the potential for chronic diseases. The context provides a foundation for understanding the complex relationships between antibiotic use, microbiota disruption, and health outcomes.\n\nThe thought process behind generating a question from this context involves identifying the key concepts and their interrelations. The question should encourage a deep understanding of the subject matter, inviting the respondent to reflect on the implications of antibiotic use beyond the immediate treatment of infections.\n\nGiven the complexity of the topic and the need for a question that challenges domain experts, the difficulty level of the question is rated as 8 out of 10. The question aims to probe the respondent's ability to synthesize information about the effects of antibiotics on microbiota and their potential long-term health consequences.\n\n</document_analysis>\n\n<output_format>\nQuestion: What potential long-term health consequence is hypothesized to result from the disruption of the host microbiota due to indiscriminate antibiotic use?\nA: Acute inflammatory responses\nB: Chronic disease development\nC: Enhanced immune system function\nD: Improved antibiotic resistance\n\nExplanation: The correct answer, \"Chronic disease development,\" is supported by the hypothesis mentioned in the context that the indiscriminate use of antibiotics alters the host microbiota and has been associated with chronic disease. This question requires the respondent to understand the potential long-term effects of antibiotic use on human health, beyond the immediate side effects.\n\nCorrect Answer: B\n</output_format>",
    "question": "What potential long-term health consequence is hypothesized to result from the disruption of the host microbiota due to indiscriminate antibiotic use?",
    "choices": {
      "A": "Acute inflammatory responses",
      "B": "Chronic disease development",
      "C": "Enhanced immune system function",
      "D": "Improved antibiotic resistance"
    },
    "answer": "B",
    "explanation": "The correct answer, \"Chronic disease development,\" is supported by the hypothesis mentioned in the context that the indiscriminate use of antibiotics alters the host microbiota and has been associated with chronic disease. This question requires the respondent to understand the potential long-term effects of antibiotic use on human health, beyond the immediate side effects.",
    "question_token_count": 26,
    "answer_correctness_score": 10,
    "explanation_validity_score": 10,
    "question_clarity_score": 8,
    "question_difficulty_score": 6,
    "question_groundedness_score": 9,
    "avg_answer_token_count": 4
  },
  {
    "context": "Gladstone returned to power after the 1892 general election; he was 82 years old. Victoria objected when Gladstone proposed appointing the Radical MP Henry Labouchere to the Cabinet, so Gladstone agreed not to appoint him. In 1894, Gladstone retired and, without consulting the outgoing prime minister, Victoria appointed Lord Rosebery as prime minister. His government was weak, and the following year Lord Salisbury replaced him. Salisbury remained prime minister for the remainder of Victoria's reign.",
    "topic": "The relationship between Queen Victoria and her prime ministers, especially Gladstone and Lord Rosebery, and how their interactions affected political decisions and stability during her reign.",
    "response": "<document_analysis>\nThe provided context revolves around the interactions between Queen Victoria and her prime ministers, specifically Gladstone and Lord Rosebery, during her reign. To generate a highly insightful and probing question, it's essential to analyze the relationships and dynamics between these historical figures. \n\nThoughtful content examination reveals that Queen Victoria played an active role in shaping her government, as seen in her objection to Gladstone's proposal to appoint Henry Labouchere to the Cabinet. This indicates that Victoria was not afraid to exert her influence when she disagreed with her prime ministers' decisions.\n\nConcept exploration suggests that the relationships between Victoria and her prime ministers were complex and multifaceted. Gladstone's agreement not to appoint Labouchere demonstrates a level of compromise and cooperation between the monarch and her prime minister. However, Victoria's decision to appoint Lord Rosebery without consulting Gladstone highlights the power dynamics at play and the potential for tension between the monarch and her government.\n\nStrategic complexity calibration rates the difficulty of this topic as an 8 out of 10, given the nuanced nature of the relationships and the need to understand the historical context and power dynamics involved.\n\nIntentional question planning aims to create a question that invites deeper understanding and critical engagement with the topic. A suitable question should encourage the respondent to think critically about the implications of Victoria's actions on the stability of her government and the relationships with her prime ministers.\n</document_analysis>\n\n<output_format>\nQuestion: What was the primary consequence of Queen Victoria's appointment of Lord Rosebery as prime minister without consulting Gladstone?\nA: It led to a strengthening of the monarchy's power and influence over the government.\nB: It resulted in a period of political instability and weakened the government.\nC: It had no significant impact on the government or the relationships between Victoria and her prime ministers.\nD: It marked the beginning of a new era of cooperation and harmony between the monarch and her government.\n\nExplanation: The correct answer, B, is supported by the context, which states that Lord Rosebery's government was weak, and he was replaced by Lord Salisbury the following year. This suggests that Victoria's appointment of Rosebery without consulting Gladstone contributed to a period of political instability.\n\nCorrect Answer: B\n</output_format>",
    "question": "What was the primary consequence of Queen Victoria's appointment of Lord Rosebery as prime minister without consulting Gladstone?",
    "choices": {
      "A": "It led to a strengthening of the monarchy's power and influence over the government.",
      "B": "It resulted in a period of political instability and weakened the government.",
      "C": "It had no significant impact on the government or the relationships between Victoria and her prime ministers.",
      "D": "It marked the beginning of a new era of cooperation and harmony between the monarch and her government."
    },
    "answer": "B",
    "explanation": "The correct answer, B, is supported by the context, which states that Lord Rosebery's government was weak, and he was replaced by Lord Salisbury the following year. This suggests that Victoria's appointment of Rosebery without consulting Gladstone contributed to a period of political instability.",
    "question_token_count": 23,
    "answer_correctness_score": 10,
    "explanation_validity_score": 10,
    "question_clarity_score": 7,
    "question_difficulty_score": 6,
    "question_groundedness_score": 10,
    "avg_answer_token_count": 17
  },
  {
    "context": "Beyonc\u00e9 Giselle Knowles-Carter (/bi\u02d0\u02c8j\u0252nse\u026a/ bee-YON-say) (born September 4, 1981) is an American singer, songwriter, record producer and actress. Born and raised in Houston, Texas, she performed in various singing and dancing competitions as a child, and rose to fame in the late 1990s as lead singer of R&B girl-group Destiny's Child. Managed by her father, Mathew Knowles, the group became one of the world's best-selling girl groups of all time. Their hiatus saw the release of Beyonc\u00e9's debut album, Dangerously in Love (2003), which established her as a solo artist worldwide, earned five Grammy Awards and featured the Billboard Hot 100 number-one singles \"Crazy in Love\" and \"Baby Boy\".",
    "topic": "An analysis of the musical and cultural contributions of Destiny's Child as one of the world's best-selling girl groups.",
    "response": "<document_analysis>\nTo generate a highly insightful and probing question-answer pair, a careful analysis of the provided context is necessary. The context discusses Beyonc\u00e9's background, her rise to fame as the lead singer of Destiny's Child, and her subsequent success as a solo artist. \n\nGiven the question topic is about the musical and cultural contributions of Destiny's Child, it's essential to consider what significant impacts or achievements the group had that would be worth exploring in a question. The context mentions that Destiny's Child became one of the world's best-selling girl groups of all time, indicating their substantial commercial success and popularity. However, it does not delve deeply into their musical or cultural contributions beyond this.\n\nA thoughtful engagement with the content suggests that a question about the group's influence or legacy could inspire deeper thought and nuanced consideration. Considering the context provided, a question that explores the broader impact of Destiny's Child, beyond just their sales figures, could be highly relevant and challenging for domain experts.\n\nThe difficulty of the question should be calibrated to ensure it is highly challenging, even for the smartest domain experts. This means avoiding straightforward or factual questions that could be easily answered by recalling basic information about the group. Instead, the question should require synthesis, analysis, or critical thinking about the group's contributions and their lasting effects on music or culture.\n\nGiven these considerations, a potential question could explore the ways in which Destiny's Child's music or message influenced subsequent female artists or the music industry as a whole. This would require a deep understanding of the group's significance and their role in shaping the musical landscape.\n\nHowever, since the provided context does not explicitly discuss the musical or cultural contributions of Destiny's Child in depth, the question generated will need to be crafted carefully to ensure it remains answerable based on general knowledge about the group and their impact, without relying on the specific details of the context provided.\n</document_analysis>\n\n<output_format>\nQuestion: What aspect of the music industry did Destiny's Child most significantly influence through their performances and message?\nA: The resurgence of boy bands in the 2000s\nB: The empowerment of women in R&B and pop music\nC: The evolution of hip-hop towards more aggressive lyrics\nD: The decline of physical album sales with the rise of digital platforms\n\nExplanation: Destiny's Child, through their music and performances, promoted themes of female empowerment, independence, and solidarity, which resonated with a wide audience and inspired a generation of female artists. Their influence can be seen in the confidence and message of empowerment conveyed by many subsequent female musicians.\n\nCorrect Answer: B\n</output_format>",
    "question": "What aspect of the music industry did Destiny's Child most significantly influence through their performances and message?",
    "choices": {
      "A": "The resurgence of boy bands in the 2000s",
      "B": "The empowerment of women in R&B and pop music",
      "C": "The evolution of hip-hop towards more aggressive lyrics",
      "D": "The decline of physical album sales with the rise of digital platforms"
    },
    "answer": "B",
    "explanation": "Destiny's Child, through their music and performances, promoted themes of female empowerment, independence, and solidarity, which resonated with a wide audience and inspired a generation of female artists. Their influence can be seen in the confidence and message of empowerment conveyed by many subsequent female musicians.",
    "question_token_count": 20,
    "answer_correctness_score": 10,
    "explanation_validity_score": 10,
    "question_clarity_score": 4,
    "question_difficulty_score": 6,
    "question_groundedness_score": 5,
    "avg_answer_token_count": 11
  },
  {
    "context": "In 1887, the British Empire celebrated Victoria's Golden Jubilee. Victoria marked the fiftieth anniversary of her accession on 20 June with a banquet to which 50 kings and princes were invited. The following day, she participated in a procession and attended a thanksgiving service in Westminster Abbey. By this time, Victoria was once again extremely popular. Two days later on 23 June, she engaged two Indian Muslims as waiters, one of whom was Abdul Karim. He was soon promoted to \"Munshi\": teaching her Hindustani, and acting as a clerk. Her family and retainers were appalled, and accused Abdul Karim of spying for the Muslim Patriotic League, and biasing the Queen against the Hindus. Equerry Frederick Ponsonby (the son of Sir Henry) discovered that the Munshi had lied about his parentage, and reported to Lord Elgin, Viceroy of India, \"the Munshi occupies very much the same position as John Brown used to do.\" Victoria dismissed their complaints as racial prejudice. Abdul Karim remained in her service until he returned to India with a pension on her death.",
    "topic": "The cultural and social implications of the Queen's engagement with Indian culture and her interactions with Abdul Karim.",
    "response": "<document_analysis>\nTo generate a question that probes the domain expert's understanding of the cultural and social implications of the Queen's engagement with Indian culture and her interactions with Abdul Karim, we must carefully analyze the context provided. The key elements to consider include the Queen's celebration of her Golden Jubilee, her employment of Indian Muslims as waiters, Abdul Karim's promotion to \"Munshi,\" and the reactions of her family and retainers to these developments.\n\nThoughtful content examination reveals that the Queen's interactions with Abdul Karim and her interest in Indian culture were significant, given the historical context of the British Empire's complex relationship with India. The appointment of Abdul Karim as \"Munshi\" and his role in teaching the Queen Hindustani underscore her personal engagement with Indian culture, distinct from the broader colonial dynamics.\n\nConcept exploration involves considering the implicit assumptions and subtle details within the context. For instance, the accusations against Abdul Karim of spying and biasing the Queen against Hindus reflect deeper racial and religious tensions within the Empire. The comparison of Abdul Karim's position to that of John Brown suggests a level of intimacy and influence that was uncommon for someone of his background, highlighting the Queen's personal preferences over societal norms.\n\nStrategic complexity calibration requires rating the difficulty of the question. Given the need to understand historical context, cultural dynamics, and personal relationships within the royal household, the difficulty level is high, around 8 out of 10.\n\nIntentional question planning involves crafting a question that invites deeper understanding and critical engagement. The question should reflect on the implications of the Queen's actions and the reactions they provoked, encouraging the domain expert to synthesize information about cultural exchange, personal relationships, and societal attitudes during the Victorian era.\n</document_analysis>\n\n<output_format>\nQuestion: What societal attitude did the Queen's family and retainers exhibit towards Abdul Karim, and what does this reveal about the broader cultural context of the British Empire during Victoria's reign?\nA: Acceptance and admiration for Indian culture\nB: Racial prejudice and suspicion towards Muslims\nC: Indifference to the Queen's personal relationships\nD: Envy of Abdul Karim's influence over the Queen\n\nExplanation: The context provided shows that the Queen's family and retainers accused Abdul Karim of spying and were appalled by his influence, which the Queen attributed to racial prejudice. This reaction highlights the underlying racial and religious tensions within the British Empire, reflecting a broader societal attitude of suspicion and prejudice towards Indians and Muslims.\n\nCorrect Answer: B\n</output_format>",
    "question": "What societal attitude did the Queen's family and retainers exhibit towards Abdul Karim, and what does this reveal about the broader cultural context of the British Empire during Victoria's reign?",
    "choices": {
      "A": "Acceptance and admiration for Indian culture",
      "B": "Racial prejudice and suspicion towards Muslims",
      "C": "Indifference to the Queen's personal relationships",
      "D": "Envy of Abdul Karim's influence over the Queen"
    },
    "answer": "B",
    "explanation": "The context provided shows that the Queen's family and retainers accused Abdul Karim of spying and were appalled by his influence, which the Queen attributed to racial prejudice. This reaction highlights the underlying racial and religious tensions within the British Empire, reflecting a broader societal attitude of suspicion and prejudice towards Indians and Muslims.",
    "question_token_count": 36,
    "answer_correctness_score": 10,
    "explanation_validity_score": 10,
    "question_clarity_score": 7,
    "question_difficulty_score": 7,
    "question_groundedness_score": 10,
    "avg_answer_token_count": 9
  },
  {
    "context": "Multiracial Americans are Americans who have mixed ancestry of \"two or more races\". The term may also include Americans of mixed-race ancestry who self-identify with just one group culturally and socially (cf. the one-drop rule). In the 2010 US census, approximately 9 million individuals, or 2.9% of the population, self-identified as multiracial. There is evidence that an accounting by genetic ancestry would produce a higher number, but people live according to social and cultural identities, not DNA. Historical reasons, including slavery creating a racial caste and the European-American suppression of Native Americans, often led people to identify or be classified by only one ethnicity, generally that of the culture in which they were raised. Prior to the mid-20th century, many people hid their multiracial heritage because of racial discrimination against minorities. While many Americans may be biologically multiracial, they often do not know it or do not identify so culturally, any more than they maintain all the differing traditions of a variety of national ancestries.",
    "topic": "The ways in which multiracial individuals navigate multiple cultural traditions and national ancestries, and the challenges or benefits associated with this navigation.",
    "response": "<document_analysis>\nThe provided context discusses the concept of multiracial Americans, their self-identification, and the historical reasons behind the suppression of multiracial heritage. It highlights the complexities of navigating multiple cultural traditions and national ancestries. The text also touches upon the idea that people's social and cultural identities may not necessarily align with their genetic ancestry. \n\nUpon analyzing the context, it becomes clear that the topic revolves around the challenges and benefits associated with being multiracial in America. The historical context of slavery, racial discrimination, and the suppression of Native Americans has led to a complex landscape of identity formation. The fact that many Americans may be biologically multiracial but do not identify as such culturally raises important questions about the nature of identity, culture, and ancestry.\n\nThe difficulty level of the question should be high (8/10) to challenge domain experts and encourage nuanced understanding. The question should be designed to inspire thoughtful engagement and reflection on the implications of being multiracial in America.\n\nAfter careful consideration, a question that meets the criteria is formulated. The question is designed to be self-contained, clear, and concise, with a focus on encouraging deep understanding and insight.\n</document_analysis>\n\n<output_format>\nQuestion: What is a primary reason why many multiracial Americans may not identify with all of their national ancestries culturally?\nA: Lack of genetic ancestry information\nB: Historical racial discrimination and suppression of minority cultures\nC: Insufficient cultural education and awareness\nD: Voluntary rejection of ancestral heritage\n\nExplanation: The correct answer, B, is supported by the context, which explains how historical reasons such as slavery and the suppression of Native Americans led people to identify or be classified by only one ethnicity. This reason is rooted in the social and cultural context of America, rather than genetic ancestry or personal choice.\n\nCorrect Answer: B\n</output_format>",
    "question": "What is a primary reason why many multiracial Americans may not identify with all of their national ancestries culturally?",
    "choices": {
      "A": "Lack of genetic ancestry information",
      "B": "Historical racial discrimination and suppression of minority cultures",
      "C": "Insufficient cultural education and awareness",
      "D": "Voluntary rejection of ancestral heritage"
    },
    "answer": "B",
    "explanation": "The correct answer, B, is supported by the context, which explains how historical reasons such as slavery and the suppression of Native Americans led people to identify or be classified by only one ethnicity. This reason is rooted in the social and cultural context of America, rather than genetic ancestry or personal choice.",
    "question_token_count": 24,
    "answer_correctness_score": 10,
    "explanation_validity_score": 10,
    "question_clarity_score": 8,
    "question_difficulty_score": 6,
    "question_groundedness_score": 9,
    "avg_answer_token_count": 7
  },
  {
    "context": "Beyonc\u00e9 has received numerous awards. As a solo artist she has sold over 15 million albums in the US, and over 118 million records worldwide (a further 60 million additionally with Destiny's Child), making her one of the best-selling music artists of all time. The Recording Industry Association of America (RIAA) listed Beyonc\u00e9 as the top certified artist of the 2000s, with a total of 64 certifications. Her songs \"Crazy in Love\", \"Single Ladies (Put a Ring on It)\", \"Halo\", and \"Irreplaceable\" are some of the best-selling singles of all time worldwide. In 2009, The Observer named her the Artist of the Decade and Billboard named her the Top Female Artist and Top Radio Songs Artist of the Decade. In 2010, Billboard named her in their \"Top 50 R&B/Hip-Hop Artists of the Past 25 Years\" list at number 15. In 2012 VH1 ranked her third on their list of the \"100 Greatest Women in Music\". Beyonc\u00e9 was the first female artist to be honored with the International Artist Award at the American Music Awards. She has also received the Legend Award at the 2008 World Music Awards and the Billboard Millennium Award at the 2011 Billboard Music Awards.",
    "topic": "Beyonc\u00e9's recognition as the Artist of the Decade by The Observer and as the Top Female Artist and Top Radio Songs Artist of the Decade by Billboard in 2009.",
    "response": "<document_analysis>\nTo generate a highly insightful and probing question-answer pair, I will carefully analyze the provided context. The central idea of the context is Beyonc\u00e9's numerous awards and recognition as one of the best-selling music artists of all time. The context highlights her achievements, including being named the Artist of the Decade by The Observer and the Top Female Artist and Top Radio Songs Artist of the Decade by Billboard in 2009.\n\nI will consider implicit assumptions, such as the significance of these awards and recognition in the music industry. I will also explore underlying theories, such as the impact of Beyonc\u00e9's music on the industry and her legacy as an artist.\n\nThe difficulty level of the question will be rated as 8 out of 10, ensuring it is challenging for even the smartest domain experts.\n\nThe question will be designed to invite deeper understanding, meaningful reflection, or critical engagement, ensuring it is purposeful and encourages thoughtful engagement.\n</document_analysis>\n\n<output_format>\nQuestion: What prestigious award did Beyonc\u00e9 receive at the 2011 Billboard Music Awards, recognizing her contributions to the music industry?\nA: Legend Award\nB: International Artist Award\nC: Billboard Millennium Award\nD: Artist of the Decade Award\n\nExplanation: The correct answer is the Billboard Millennium Award, which Beyonc\u00e9 received at the 2011 Billboard Music Awards. This award recognizes her outstanding contributions to the music industry, solidifying her position as one of the most successful artists of all time.\n\nCorrect Answer: C\n</output_format>",
    "question": "What prestigious award did Beyonc\u00e9 receive at the 2011 Billboard Music Awards, recognizing her contributions to the music industry?",
    "choices": {
      "A": "Legend Award",
      "B": "International Artist Award",
      "C": "Billboard Millennium Award",
      "D": "Artist of the Decade Award"
    },
    "answer": "C",
    "explanation": "The correct answer is the Billboard Millennium Award, which Beyonc\u00e9 received at the 2011 Billboard Music Awards. This award recognizes her outstanding contributions to the music industry, solidifying her position as one of the most successful artists of all time.",
    "question_token_count": 25,
    "answer_correctness_score": 10,
    "explanation_validity_score": 10,
    "question_clarity_score": 9,
    "question_difficulty_score": 6,
    "question_groundedness_score": 5,
    "avg_answer_token_count": 4
  },
  {
    "context": "Palmerston died in 1865, and after a brief ministry led by Russell, Derby returned to power. In 1866, Victoria attended the State Opening of Parliament for the first time since Albert's death. The following year she supported the passing of the Reform Act 1867 which doubled the electorate by extending the franchise to many urban working men, though she was not in favour of votes for women. Derby resigned in 1868, to be replaced by Benjamin Disraeli, who charmed Victoria. \"Everyone likes flattery,\" he said, \"and when you come to royalty you should lay it on with a trowel.\" With the phrase \"we authors, Ma'am\", he complimented her. Disraeli's ministry only lasted a matter of months, and at the end of the year his Liberal rival, William Ewart Gladstone, was appointed prime minister. Victoria found Gladstone's demeanour far less appealing; he spoke to her, she is thought to have complained, as though she were \"a public meeting rather than a woman\".",
    "topic": "The role of Russell's brief ministry and its implications for the return of Derby to power.",
    "response": "<document_analysis>\nThe provided context revolves around the period following Palmerston's death in 1865 and its implications on British politics, particularly focusing on the brief ministry of Russell and the return of Derby to power. To generate a highly insightful and probing question-answer pair, it's essential to analyze the central ideas, nuanced themes, and significant relationships within the given text.\n\nThe key elements in this context include the transition of power after Palmerston's death, the impact of Russell's brief ministry, and the subsequent return of Derby to power. Additionally, the context touches upon Victoria's involvement in political events, such as her attendance at the State Opening of Parliament and her support for the Reform Act 1867, despite her personal reservations about certain political issues, like women's suffrage.\n\nGiven the complexity and the historical depth of the information, the question should aim to encourage a deep engagement with the content, critically reflecting on the implications of these political shifts and Victoria's role within them. The difficulty level of the question should be high (rating: 8/10) to challenge even the smartest domain experts.\n\nConsidering the need for thoughtful engagement, high complexity, and the requirement for the question to be answerable without the context, a potential question could delve into the strategic or political implications of Russell's brief ministry and its role in Derby's return to power, or it could explore Victoria's political stance and influence during this period.\n\nHowever, to ensure the question is highly challenging and requires a deep understanding of the content, it might be more effective to focus on the less explicit aspects of the context, such as the implications of these political maneuvers on the broader political landscape of Britain at the time, or the subtle interactions between Victoria and the various political leaders mentioned.\n\nGiven these considerations, the question should be designed to probe the domain expert's understanding of the historical context, political strategies, and the monarch's influence during this specific period in British history.\n</document_analysis>\n\n<output_format>\nQuestion: What significant political consequence arose from the brief transition of power from Palmerston to Russell, and subsequently to Derby, in terms of the extension of voting rights in Britain?\nA: The immediate implementation of universal suffrage.\nB: The passage of the Reform Act 1867, doubling the electorate.\nC: The reduction of the voting age to 18.\nD: The granting of voting rights to women.\n\nExplanation: The correct answer, B, reflects the information provided in the context about the Reform Act 1867, which was passed during this period of political transition and doubled the electorate by extending the franchise to many urban working men. This demonstrates an understanding of the significant political consequence of this period, which was the expansion of voting rights, albeit limited to urban working men and not including women.\n\nCorrect Answer: B\n</output_format>",
    "question": "What significant political consequence arose from the brief transition of power from Palmerston to Russell, and subsequently to Derby, in terms of the extension of voting rights in Britain?",
    "choices": {
      "A": "The immediate implementation of universal suffrage.",
      "B": "The passage of the Reform Act 1867, doubling the electorate.",
      "C": "The reduction of the voting age to 18.",
      "D": "The granting of voting rights to women."
    },
    "answer": "B",
    "explanation": "The correct answer, B, reflects the information provided in the context about the Reform Act 1867, which was passed during this period of political transition and doubled the electorate by extending the franchise to many urban working men. This demonstrates an understanding of the significant political consequence of this period, which was the expansion of voting rights, albeit limited to urban working men and not including women.",
    "question_token_count": 34,
    "answer_correctness_score": 10,
    "explanation_validity_score": 10,
    "question_clarity_score": 8,
    "question_difficulty_score": 6,
    "question_groundedness_score": 9,
    "avg_answer_token_count": 11
  },
  {
    "context": "The league eventually narrowed the bids to three sites: New Orleans' Mercedes-Benz Superdome, Miami's Sun Life Stadium, and the San Francisco Bay Area's Levi's Stadium.",
    "topic": "Comparing and contrasting the Mercedes-Benz Superdome, Sun Life Stadium, and Levi's Stadium in terms of their suitability for hosting large events, considering factors like capacity, location, and amenities.",
    "response": "<document_analysis>\nTo generate a question that inspires thoughtful engagement and reflection, we need to consider the key factors that make a stadium suitable for hosting large events. The context mentions three stadiums: Mercedes-Benz Superdome, Sun Life Stadium, and Levi's Stadium. However, it does not provide detailed information about their capacity, location, or amenities. \n\nGiven the lack of specific details in the provided context, we must rely on general knowledge about these stadiums to craft a meaningful question. The question should be designed to test the domain expert's understanding of what makes a stadium suitable for large events and their ability to compare and contrast different venues.\n\nThoughtful content examination reveals that the context does not offer explicit comparisons or contrasts between the stadiums. Therefore, the question must be framed in a way that encourages the expert to draw upon their external knowledge of these stadiums and the factors that contribute to their suitability for large events.\n\nConcept exploration suggests that the question could delve into the nuances of stadium design, location, and amenities that impact their ability to host successful large-scale events. Strategic complexity calibration indicates that the question should be challenging, requiring the expert to synthesize information and think critically about the characteristics of each stadium.\n\nIntentional question planning leads to the development of a question that invites deeper understanding and meaningful reflection on the part of the domain expert. The question should be purposeful, encouraging the expert to demonstrate their competency in evaluating stadium suitability.\n</document_analysis>\n\n<output_format>\nQuestion: Which of the following stadiums is most likely to offer an optimal combination of seating capacity, accessibility, and state-of-the-art amenities for hosting a high-profile event like the Super Bowl?\nA: Mercedes-Benz Superdome\nB: Sun Life Stadium\nC: Levi's Stadium\nD: AT&T Stadium\nExplanation: The correct answer can be determined by considering the general characteristics of each stadium. Levi's Stadium, being a newer venue with advanced amenities and a significant seating capacity, is well-suited for large events. However, without explicit details in the context, this question requires the domain expert to apply their external knowledge of these stadiums.\nCorrect Answer: C\n</output_format>",
    "question": "Which of the following stadiums is most likely to offer an optimal combination of seating capacity, accessibility, and state-of-the-art amenities for hosting a high-profile event like the Super Bowl?",
    "choices": {
      "A": "Mercedes-Benz Superdome",
      "B": "Sun Life Stadium",
      "C": "Levi's Stadium",
      "D": "AT&T Stadium"
    },
    "answer": "C",
    "explanation": "The correct answer can be determined by considering the general characteristics of each stadium. Levi's Stadium, being a newer venue with advanced amenities and a significant seating capacity, is well-suited for large events. However, without explicit details in the context, this question requires the domain expert to apply their external knowledge of these stadiums.",
    "question_token_count": 38,
    "answer_correctness_score": 8,
    "explanation_validity_score": 8,
    "question_clarity_score": 6,
    "question_difficulty_score": 7,
    "question_groundedness_score": 8,
    "avg_answer_token_count": 4
  },
  {
    "context": "In the United States, the game was televised by CBS, as part of a cycle between the three main broadcast television partners of the NFL. The network's lead broadcast team of Jim Nantz and Phil Simms called the contest, with Tracy Wolfson and Evan Washburn on the sidelines. CBS introduced new features during the telecast, including pylon cameras and microphones along with EyeVision 360\u2014an array of 36 cameras along the upper deck that can be used to provide a 360-degree view of plays and \"bullet time\" effects. (An earlier version of EyeVision was last used in Super Bowl XXXV; for Super Bowl 50, the cameras were upgraded to 5K resolution.)",
    "topic": "The strategic decision-making behind CBS's introduction of new broadcast features and technologies, and their potential influence on future sports broadcasting.",
    "response": "<document_analysis>\nTo generate a highly insightful and probing question-answer pair, a thorough analysis of the provided context is necessary. The context discusses CBS's introduction of new broadcast features and technologies during a football game telecast, including pylon cameras, microphones, and EyeVision 360. This technology provides a 360-degree view of plays and \"bullet time\" effects, enhancing the viewer's experience. \n\nThe key aspects to consider are the strategic decision-making behind introducing these features and their potential influence on future sports broadcasting. This involves understanding the potential impact of such technologies on viewer engagement, the competitive advantage they might offer CBS, and how they could change the way sports events are broadcast.\n\nGiven the information, the question should encourage a deep engagement with the content, critically reflecting on the implications of these technological advancements. It's essential to consider the potential challenges and benefits associated with implementing such technologies and how they might influence the future of sports broadcasting.\n\nThe difficulty of the question should be high (8-10), ensuring it challenges even the smartest domain experts. The question type could be analytical or application-based, focusing on the strategic implications of CBS's decision and the potential long-term effects on the industry.\n\nThoughtful consideration of the context and the desired question characteristics leads to the generation of a question that requires a deep understanding of the subject matter and encourages meaningful reflection.\n</document_analysis>\n\n<output_format>\nQuestion: What significant technological enhancement did CBS introduce during the telecast, which utilized an array of 36 cameras to provide a unique viewing experience?\nA: EyeVision 180\nB: EyeVision 360\nC: PylonCam 5K\nD: BroadcastView 4K\n\nExplanation: The correct answer is EyeVision 360, as it is specifically mentioned in the context as the technology that uses an array of 36 cameras to provide a 360-degree view of plays and \"bullet time\" effects.\n\nCorrect Answer: B\n</output_format>",
    "question": "What significant technological enhancement did CBS introduce during the telecast, which utilized an array of 36 cameras to provide a unique viewing experience?",
    "choices": {
      "A": "EyeVision 180",
      "B": "EyeVision 360",
      "C": "PylonCam 5K",
      "D": "BroadcastView 4K"
    },
    "answer": "B",
    "explanation": "The correct answer is EyeVision 360, as it is specifically mentioned in the context as the technology that uses an array of 36 cameras to provide a 360-degree view of plays and \"bullet time\" effects.",
    "question_token_count": 28,
    "answer_correctness_score": 10,
    "explanation_validity_score": 10,
    "question_clarity_score": 4,
    "question_difficulty_score": 6,
    "question_groundedness_score": 8,
    "avg_answer_token_count": 5
  },
  {
    "context": "In 1853, Victoria gave birth to her eighth child, Leopold, with the aid of the new anaesthetic, chloroform. Victoria was so impressed by the relief it gave from the pain of childbirth that she used it again in 1857 at the birth of her ninth and final child, Beatrice, despite opposition from members of the clergy, who considered it against biblical teaching, and members of the medical profession, who thought it dangerous. Victoria may have suffered from post-natal depression after many of her pregnancies. Letters from Albert to Victoria intermittently complain of her loss of self-control. For example, about a month after Leopold's birth Albert complained in a letter to Victoria about her \"continuance of hysterics\" over a \"miserable trifle\".",
    "topic": "The relationship between Queen Victoria's use of chloroform and the broader acceptance of anaesthesia in medical practice during the 19th century.",
    "response": "<document_analysis>\nThe provided context revolves around Queen Victoria's use of chloroform during childbirth and its potential impact on the broader acceptance of anesthesia in medical practice during the 19th century. To generate a question, we need to consider the implications of Victoria's actions, the opposition she faced, and the potential effects on medical practices of the time.\n\nFirst, it's crucial to identify the central ideas and nuanced themes within the context. The key points include Queen Victoria's positive experience with chloroform, the opposition from clergy and some medical professionals, and the potential for her to have suffered from post-natal depression. \n\nThe difficulty of the question should be rated high (8-10) to challenge even the smartest domain experts. This requires crafting a question that not only tests knowledge of the historical event but also encourages critical thinking about the societal, medical, and personal factors at play.\n\nWhen planning the question, it's essential to ensure it invites deeper understanding and meaningful reflection. The question should be purposeful, encouraging the respondent to consider the broader implications of Queen Victoria's use of chloroform beyond the immediate context of her personal experience.\n\nGiven the context, a potential question could explore the relationship between Queen Victoria's endorsement of chloroform and the shift in medical and societal attitudes towards anesthesia. This would require the respondent to synthesize information about historical medical practices, the influence of royal endorsements, and the challenges faced by innovators in medicine during the 19th century.\n</document_analysis>\n\n<output_format>\nQuestion: What significant societal factor, influenced by Queen Victoria's personal experience, contributed to the gradual acceptance of anesthesia in 19th-century medical practice, despite initial religious and professional opposition?\nA: The emergence of modern nursing practices\nB: The royal family's public endorsement of medical innovations\nC: The growing awareness of post-natal depression among women\nD: The publication of detailed clinical trials on chloroform's efficacy\n\nExplanation: The correct answer, \"The royal family's public endorsement of medical innovations,\" reflects the historical significance of Queen Victoria's use of chloroform. Her positive experience and subsequent endorsement helped shift public and medical perceptions of anesthesia, contributing to its broader acceptance. This question requires the respondent to consider the intersection of royal influence, medical innovation, and societal attitudes, making it a challenging and insightful query.\n\nCorrect Answer: B\n</output_format>",
    "question": "What significant societal factor, influenced by Queen Victoria's personal experience, contributed to the gradual acceptance of anesthesia in 19th-century medical practice, despite initial religious and professional opposition?",
    "choices": {
      "A": "The emergence of modern nursing practices",
      "B": "The royal family's public endorsement of medical innovations",
      "C": "The growing awareness of post-natal depression among women",
      "D": "The publication of detailed clinical trials on chloroform's efficacy"
    },
    "answer": "B",
    "explanation": "The correct answer, \"The royal family's public endorsement of medical innovations,\" reflects the historical significance of Queen Victoria's use of chloroform. Her positive experience and subsequent endorsement helped shift public and medical perceptions of anesthesia, contributing to its broader acceptance. This question requires the respondent to consider the intersection of royal influence, medical innovation, and societal attitudes, making it a challenging and insightful query.",
    "question_token_count": 36,
    "answer_correctness_score": 8,
    "explanation_validity_score": 9,
    "question_clarity_score": 7,
    "question_difficulty_score": 6,
    "question_groundedness_score": 8,
    "avg_answer_token_count": 9
  },
  {
    "context": "On June 4, 2014, the NFL announced that the practice of branding Super Bowl games with Roman numerals, a practice established at Super Bowl V, would be temporarily suspended, and that the game would be named using Arabic numerals as Super Bowl 50 as opposed to Super Bowl L. The use of Roman numerals will be reinstated for Super Bowl LI. Jaime Weston, the league's vice president of brand and creative, explained that a primary reason for the change was the difficulty of designing an aesthetically pleasing logo with the letter \"L\" using the standardized logo template introduced at Super Bowl XLV. The logo also deviates from the template by featuring large numerals, colored in gold, behind the Vince Lombardi Trophy, instead of underneath and in silver as in the standard logo.",
    "topic": "The importance of logo design in sports branding, using the Super Bowl 50 logo as a case study.",
    "response": "<document_analysis>\nThe provided context discusses the decision to temporarily suspend the use of Roman numerals for Super Bowl 50, opting for Arabic numerals instead. This change was primarily driven by the aesthetic challenges posed by the letter \"L\" in the standardized logo template. The context highlights the importance of logo design in sports branding, using the Super Bowl 50 logo as a case study. It mentions the deviation from the standard logo template, featuring large gold numerals behind the Vince Lombardi Trophy. \n\nUpon analyzing the context, it becomes clear that the logo design for Super Bowl 50 was a deliberate choice, influenced by the difficulties of incorporating the Roman numeral \"L\" into the existing template. The use of Arabic numerals and the unique design elements, such as the gold color and positioning of the numerals, demonstrate the consideration given to the visual appeal and brand identity of the Super Bowl.\n\nThe question generation process should focus on the nuances of logo design, the impact of typography on brand identity, and the strategic decisions involved in creating a visually appealing logo. A thoughtful and challenging question would encourage the domain expert to reflect on the implications of logo design choices and the role of aesthetics in sports branding.\n\nGiven the context, a suitable question would be one that requires the domain expert to think critically about the relationship between logo design, typography, and brand identity. The question should be self-contained, clear, and concise, with answer options that are plausible and distinct.\n\nThought_process: The question should inspire genuine curiosity and reflection on the importance of logo design in sports branding. It should require the domain expert to consider the nuances of typography, the impact of design choices on brand identity, and the strategic decisions involved in creating a visually appealing logo. The correct answer should demonstrate a deep understanding of the context and the principles of effective logo design.\n</document_analysis>\n\n<output_format>\nQuestion: What primary design consideration led to the temporary suspension of Roman numerals for Super Bowl 50?\nA: The desire to introduce a new color scheme\nB: The difficulty of designing an aesthetically pleasing logo with the letter \"L\"\nC: The need to reduce production costs\nD: The intention to create a more minimalist design\n\nExplanation: The correct answer, B, is supported by the context, which states that the primary reason for the change was the difficulty of designing an aesthetically pleasing logo with the letter \"L\" using the standardized logo template.\n\nCorrect Answer: B\n</output_format>",
    "question": "What primary design consideration led to the temporary suspension of Roman numerals for Super Bowl 50?",
    "choices": {
      "A": "The desire to introduce a new color scheme",
      "B": "The difficulty of designing an aesthetically pleasing logo with the letter \"L\"",
      "C": "The need to reduce production costs",
      "D": "The intention to create a more minimalist design"
    },
    "answer": "B",
    "explanation": "The correct answer, B, is supported by the context, which states that the primary reason for the change was the difficulty of designing an aesthetically pleasing logo with the letter \"L\" using the standardized logo template.",
    "question_token_count": 19,
    "answer_correctness_score": 10,
    "explanation_validity_score": 10,
    "question_clarity_score": 8,
    "question_difficulty_score": 6,
    "question_groundedness_score": 10,
    "avg_answer_token_count": 10
  },
  {
    "context": "On May 21, 2013, NFL owners at their spring meetings in Boston voted and awarded the game to Levi's Stadium. The $1.2 billion stadium opened in 2014. It is the first Super Bowl held in the San Francisco Bay Area since Super Bowl XIX in 1985, and the first in California since Super Bowl XXXVII took place in San Diego in 2003.",
    "topic": "The construction and opening of Levi's Stadium, including its cost and the year it became operational.",
    "response": "<document_analysis>\nThe provided context discusses the construction and opening of Levi's Stadium, including its cost and the year it became operational. The central idea is that Levi's Stadium, which cost $1.2 billion, opened in 2014 and was awarded the hosting rights for a Super Bowl in 2013. The context also provides historical information about previous Super Bowls held in the San Francisco Bay Area and California.\n\nUpon analyzing the context, it becomes clear that the question should focus on the specifics of Levi's Stadium, such as its construction cost, opening year, or its significance in hosting major events like the Super Bowl. To create a challenging question, we need to consider implicit assumptions, subtle details, and potential applications of the provided information.\n\nOne potential approach is to ask about the timing and cost of the stadium's construction, which could invite deeper understanding and critical engagement. However, to make the question more challenging, we could explore the implications of the stadium's opening on the local sports scene or its impact on the NFL's decision-making process.\n\nGiven the provided context, a thoughtful and complex question could be generated by focusing on the relationship between the stadium's construction and its hosting of major events. This would require the domain expert to demonstrate a deep understanding of the content and its implications.\n\nThe difficulty level of the question should be around 8 out of 10, as it requires careful analysis and consideration of the context. The question should be designed to encourage meaningful reflection and critical engagement, rather than simply recalling factual information.\n\nAfter careful consideration, a question that meets the guidelines and instructions can be generated.\n</document_analysis>\n\n<output_format>\nQuestion: What was the approximate cost of constructing Levi's Stadium, which opened in 2014 and hosted a Super Bowl awarded in 2013?\nA: $800 million\nB: $1.2 billion\nC: $1.5 billion\nD: $2.0 billion\nExplanation: The correct answer is $1.2 billion, as stated in the context. This question requires the domain expert to recall specific information about the stadium's construction cost, which is a critical aspect of its history and significance.\nCorrect Answer: B\n</output_format>",
    "question": "What was the approximate cost of constructing Levi's Stadium, which opened in 2014 and hosted a Super Bowl awarded in 2013?",
    "choices": {
      "A": "$800 million",
      "B": "$1.2 billion",
      "C": "$1.5 billion",
      "D": "$2.0 billion"
    },
    "answer": "B",
    "explanation": "The correct answer is $1.2 billion, as stated in the context. This question requires the domain expert to recall specific information about the stadium's construction cost, which is a critical aspect of its history and significance.",
    "question_token_count": 29,
    "answer_correctness_score": 10,
    "explanation_validity_score": 10,
    "question_clarity_score": 6,
    "question_difficulty_score": 2,
    "question_groundedness_score": 10,
    "avg_answer_token_count": 5
  },
  {
    "context": "The main passenger airport serving the metropolis and the state is Melbourne Airport (also called Tullamarine Airport), which is the second busiest in Australia, and the Port of Melbourne is Australia's busiest seaport for containerised and general cargo. Melbourne has an extensive transport network. The main metropolitan train terminus is Flinders Street Station, and the main regional train and coach terminus is Southern Cross Station. Melbourne is also home to Australia's most extensive freeway network and has the world's largest urban tram network.",
    "topic": "The integration of Melbourne's transportation modes, including how different networks (air, sea, rail, road, and tram) work together to provide comprehensive transportation services.",
    "response": "<document_analysis>\nTo generate a highly insightful and probing question-answer pair, a thorough analysis of the provided context is necessary. The context discusses Melbourne's transportation modes, including its airport, seaport, train network, and tram system. \n\n1. **Thoughtful Content Examination**: The central idea is the comprehensive transportation services provided by Melbourne's integrated networks. Notable details include Melbourne Airport being the second busiest in Australia, the Port of Melbourne being the busiest seaport for containerized and general cargo, and the city having the world's largest urban tram network.\n\n2. **Concept Exploration**: Implicit assumptions include the importance of efficient transportation for a metropolis and its economy. The underlying theory could be about how integrated transportation systems contribute to a city's development and livability. Potential applications of this information could involve urban planning, transportation management, and economic development strategies.\n\n3. **Strategic Complexity Calibration**: The difficulty of the question should be high (8/10) to challenge domain experts. This requires crafting a question that not only tests knowledge of Melbourne's transportation network but also encourages critical thinking about its implications or potential optimizations.\n\n4. **Intentional Question Planning**: The question should invite deeper understanding and reflection on how different transportation modes integrate to serve the city's needs. This could involve considering the efficiency, accessibility, or environmental impact of the current system.\n\nGiven the context, a question that stands out as particularly challenging and insightful would involve understanding the integration and efficiency of Melbourne's transportation networks. The question should be answerable by a domain expert without referencing the provided context, indicating a genuine test of their knowledge and understanding of comprehensive transportation systems.\n</document_analysis>\n\n<output_format>\nQuestion: What primary factor contributes to the efficiency of Melbourne's comprehensive transportation network, considering its integration of air, sea, rail, road, and tram services?\nA: Strategic Location of Transportation Hubs\nB: Extensive Freeway Network\nC: High Volume of Containerized Cargo\nD: World's Largest Urban Tram Network\nExplanation: The correct answer, \"Strategic Location of Transportation Hubs,\" implies that the positioning of key transportation infrastructure (like airports, seaports, and major train stations) in relation to each other and the city's layout is crucial for efficient movement of people and goods. This requires a deep understanding of urban planning and transportation systems. While options B and D are true statements about Melbourne's transportation, they are components rather than the primary factor contributing to the network's efficiency. Option C is misleading as it focuses on cargo volume rather than the integration or efficiency of the transportation network.\nCorrect Answer: A\n</output_format>",
    "question": "What primary factor contributes to the efficiency of Melbourne's comprehensive transportation network, considering its integration of air, sea, rail, road, and tram services?",
    "choices": {
      "A": "Strategic Location of Transportation Hubs",
      "B": "Extensive Freeway Network",
      "C": "High Volume of Containerized Cargo",
      "D": "World's Largest Urban Tram Network"
    },
    "answer": "A",
    "explanation": "The correct answer, \"Strategic Location of Transportation Hubs,\" implies that the positioning of key transportation infrastructure (like airports, seaports, and major train stations) in relation to each other and the city's layout is crucial for efficient movement of people and goods. This requires a deep understanding of urban planning and transportation systems. While options B and D are true statements about Melbourne's transportation, they are components rather than the primary factor contributing to the network's efficiency. Option C is misleading as it focuses on cargo volume rather than the integration or efficiency of the transportation network.",
    "question_token_count": 31,
    "answer_correctness_score": 9,
    "explanation_validity_score": 9,
    "question_clarity_score": 5,
    "question_difficulty_score": 7,
    "question_groundedness_score": 1,
    "avg_answer_token_count": 7
  },
  {
    "context": "Fr\u00e9d\u00e9ric Fran\u00e7ois Chopin (/\u02c8\u0283o\u028ap\u00e6n/; French pronunciation: \u200b[f\u0281e.de.\u0281ik f\u0281\u0251\u0303.swa \u0283\u0254.p\u025b\u0303]; 22 February or 1 March 1810 \u2013 17 October 1849), born Fryderyk Franciszek Chopin,[n 1] was a Polish and French (by citizenship and birth of father) composer and a virtuoso pianist of the Romantic era, who wrote primarily for the solo piano. He gained and has maintained renown worldwide as one of the leading musicians of his era, whose \"poetic genius was based on a professional technique that was without equal in his generation.\" Chopin was born in what was then the Duchy of Warsaw, and grew up in Warsaw, which after 1815 became part of Congress Poland. A child prodigy, he completed his musical education and composed his earlier works in Warsaw before leaving Poland at the age of 20, less than a month before the outbreak of the November 1830 Uprising.",
    "topic": "The characteristics of Chopin's compositional style and how it reflects the Romantic era in which he lived.",
    "response": "<document_analysis>\nTo generate a question that probes the domain expert's understanding of Chopin's compositional style and its reflection of the Romantic era, it's essential to analyze the context provided carefully. The context gives us an overview of Chopin's life, his nationality, and his profession as a composer and pianist. However, it does not directly delve into the specifics of his compositional style or how it embodies the characteristics of the Romantic era. \n\nGiven the information, we can infer that Chopin's work, being part of the Romantic era, likely includes elements such as emotional depth, individuality, and perhaps a focus on the expressive capabilities of the solo piano. The Romantic era in music is characterized by an emphasis on emotion, imagination, and the exploration of new expressive possibilities. \n\nSince the context does not explicitly discuss Chopin's compositional style, we must consider what aspects of the Romantic era might be reflected in his music. This includes the use of nuanced dynamics, expressive melodies, and complex harmonies, all of which were hallmarks of the Romantic musical aesthetic.\n\nTo create a challenging question, we should focus on the subtleties of Chopin's style and how they reflect broader trends in Romantic music. This requires considering not just the technical aspects of his compositions but also their emotional and expressive qualities.\n\nThoughtfully rating the difficulty of such a question, I would place it at an 8 out of 10, given that it requires not only knowledge of Chopin's life and general characteristics of the Romantic era but also an understanding of how these elements are specifically reflected in his compositional style.\n\nThe question should be designed to encourage a deep engagement with the content, critically reflecting on the implications of Chopin's style within the context of the Romantic era. It should be phrased in such a way that it invites meaningful reflection and demonstrates a clear understanding of the subject matter.\n\nGiven these considerations, a suitable question could explore the specific ways in which Chopin's music reflects the ideals of the Romantic era, such as the emphasis on individual expression, the exploration of new emotional depths, or the technical innovations that allowed for greater expressivity.\n\n</document_analysis>\n\n<output_format>\nQuestion: What characteristic of Chopin's compositional style most distinctly reflects the Romantic era's emphasis on expressive individuality?\nA: Use of folk melodies\nB: Experimentation with atonal harmony\nC: Development of intricate fingering techniques\nD: Emphasis on programmatic composition\n\nExplanation: The correct answer, \"Use of folk melodies,\" reflects the Romantic era's focus on national identity and the incorporation of folk elements into high art music. Chopin's use of Polish folk melodies and rhythms in his compositions, such as the mazurkas and polonaises, is a prime example of how his music embodies the spirit of the Romantic era, with its emphasis on individual expression and national pride.\n\nCorrect Answer: A\n</output_format>",
    "question": "What characteristic of Chopin's compositional style most distinctly reflects the Romantic era's emphasis on expressive individuality?",
    "choices": {
      "A": "Use of folk melodies",
      "B": "Experimentation with atonal harmony",
      "C": "Development of intricate fingering techniques",
      "D": "Emphasis on programmatic composition"
    },
    "answer": "A",
    "explanation": "The correct answer, \"Use of folk melodies,\" reflects the Romantic era's focus on national identity and the incorporation of folk elements into high art music. Chopin's use of Polish folk melodies and rhythms in his compositions, such as the mazurkas and polonaises, is a prime example of how his music embodies the spirit of the Romantic era, with its emphasis on individual expression and national pride.",
    "question_token_count": 22,
    "answer_correctness_score": 9,
    "explanation_validity_score": 9,
    "question_clarity_score": 6,
    "question_difficulty_score": 8,
    "question_groundedness_score": 4,
    "avg_answer_token_count": 6
  },
  {
    "context": "In June 1837 Chopin visited London incognito in the company of the piano manufacturer Camille Pleyel where he played at a musical soir\u00e9e at the house of English piano maker James Broadwood. On his return to Paris, his association with Sand began in earnest, and by the end of June 1838 they had become lovers. Sand, who was six years older than the composer, and who had had a series of lovers, wrote at this time: \"I must say I was confused and amazed at the effect this little creature had on me ... I have still not recovered from my astonishment, and if I were a proud person I should be feeling humiliated at having been carried away ...\" The two spent a miserable winter on Majorca (8 November 1838 to 13 February 1839), where, together with Sand's two children, they had journeyed in the hope of improving the health of Chopin and that of Sand's 15-year-old son Maurice, and also to escape the threats of Sand's former lover F\u00e9licien Mallefille. After discovering that the couple were not married, the deeply traditional Catholic people of Majorca became inhospitable, making accommodation difficult to find. This compelled the group to take lodgings in a former Carthusian monastery in Valldemossa, which gave little shelter from the cold winter weather.",
    "topic": "The contribution of Chopin's time on Majorca to his musical compositions, including any inspirations or challenges that the environment and his personal circumstances presented.",
    "response": "<document_analysis>\nThe context provided revolves around the life and experiences of Chopin, particularly focusing on his visit to Majorca with George Sand and her children. The primary elements to consider include the challenges they faced due to the local population's reaction to their unmarried status and the harsh winter conditions. To generate a question that probes the domain expert's understanding of how Chopin's time on Majorca contributed to his musical compositions, we need to consider the potential inspirations and challenges posed by the environment and his personal circumstances.\n\nGiven the information, it's crucial to identify the subtle influences that such an experience could have on a composer's work, including the isolation, the natural beauty of Majorca, and the personal dynamics within the group. The question should encourage a deep engagement with the content, reflecting on how these factors might have shaped Chopin's musical output during or following this period.\n\nThe difficulty rating for the question should be high (8/10) to ensure it challenges even the smartest domain experts. The question type should be analytical, requiring the expert to synthesize information about Chopin's life, the context of his visit to Majorca, and the potential impact on his compositions.\n\nAfter careful consideration, the question should be designed to explore the nuanced relationship between Chopin's personal experiences and his musical creativity, avoiding any explicit references to the source material and ensuring that the answer options are plausible and distinct.\n</document_analysis>\n\n<output_format>\nQuestion: How might the juxtaposition of natural beauty and personal hardship during Chopin's winter on Majorca have influenced the expressive qualities of his subsequent musical compositions?\nA: By inducing a period of creative silence due to the harsh conditions.\nB: Through the incorporation of folk melodies inspired by the local culture.\nC: By enhancing the introspective and emotionally complex nature of his music.\nD: By prompting a shift towards composing music for larger ensembles to reflect the communal aspect of his stay.\nExplanation: The correct answer, C, reflects an understanding that challenging personal circumstances, combined with the aesthetic inspiration of a new and beautiful environment, could deepen the emotional complexity and introspection in Chopin's music. This is a reasonable inference given the context of his visit and the nature of his relationship with George Sand, as well as the general understanding of how artists' personal experiences can influence their work.\nCorrect Answer: C\n</output_format>",
    "question": "How might the juxtaposition of natural beauty and personal hardship during Chopin's winter on Majorca have influenced the expressive qualities of his subsequent musical compositions?",
    "choices": {
      "A": "By inducing a period of creative silence due to the harsh conditions.",
      "B": "Through the incorporation of folk melodies inspired by the local culture.",
      "C": "By enhancing the introspective and emotionally complex nature of his music.",
      "D": "By prompting a shift towards composing music for larger ensembles to reflect the communal aspect of his stay."
    },
    "answer": "C",
    "explanation": "The correct answer, C, reflects an understanding that challenging personal circumstances, combined with the aesthetic inspiration of a new and beautiful environment, could deepen the emotional complexity and introspection in Chopin's music. This is a reasonable inference given the context of his visit and the nature of his relationship with George Sand, as well as the general understanding of how artists' personal experiences can influence their work.",
    "question_token_count": 31,
    "answer_correctness_score": 10,
    "explanation_validity_score": 9,
    "question_clarity_score": 6,
    "question_difficulty_score": 8,
    "question_groundedness_score": 4,
    "avg_answer_token_count": 15
  },
  {
    "context": "The league announced on October 16, 2012, that the two finalists were Sun Life Stadium and Levi's Stadium. The South Florida/Miami area has previously hosted the event 10 times (tied for most with New Orleans), with the most recent one being Super Bowl XLIV in 2010. The San Francisco Bay Area last hosted in 1985 (Super Bowl XIX), held at Stanford Stadium in Stanford, California, won by the home team 49ers. The Miami bid depended on whether the stadium underwent renovations. However, on May 3, 2013, the Florida legislature refused to approve the funding plan to pay for the renovations, dealing a significant blow to Miami's chances.",
    "topic": "A comparative analysis of the San Francisco Bay Area and the South Florida/Miami area as hosts for the Super Bowl, considering their past experiences and future potentials.",
    "response": "<document_analysis>\nThe context provided compares the San Francisco Bay Area and the South Florida/Miami area as hosts for the Super Bowl, highlighting their past experiences and future potentials. A thoughtful examination reveals that both areas have a history of hosting the Super Bowl, with the South Florida/Miami area having hosted the event 10 times, most recently in 2010, and the San Francisco Bay Area last hosting in 1985. The context also mentions the dependency of the Miami bid on stadium renovations and the subsequent refusal of the Florida legislature to approve the funding plan, which impacted Miami's chances. \n\nUpon analyzing the content, it becomes clear that the question should focus on the comparative analysis of the two areas, considering their past experiences and the factors that influence their future potentials as Super Bowl hosts. The question should be designed to encourage a deep understanding of the context and the ability to synthesize information to make informed judgments.\n\nThe difficulty of the question should be rated as an 8 out of 10, given the need to consider multiple factors, including past hosting experiences, stadium conditions, and legislative decisions. The question should be phrased in a way that requires the test-taker to demonstrate a nuanced understanding of the context and the ability to think critically about the implications of the information provided.\n</document_analysis>\n\n<output_format>\nQuestion: What was a crucial factor that negatively impacted the Miami bid to host the Super Bowl, despite its extensive experience in hosting the event?\nA: The high cost of stadium renovations\nB: The refusal of the Florida legislature to approve the funding plan for stadium renovations\nC: The lack of suitable stadiums in the area\nD: The proximity of the Super Bowl date to other major events in the city\nExplanation: The correct answer is based on the information provided in the context, which states that the Miami bid depended on stadium renovations and that the Florida legislature refused to approve the funding plan, dealing a significant blow to Miami's chances.\nCorrect Answer: B\n</output_format>",
    "question": "What was a crucial factor that negatively impacted the Miami bid to host the Super Bowl, despite its extensive experience in hosting the event?",
    "choices": {
      "A": "The high cost of stadium renovations",
      "B": "The refusal of the Florida legislature to approve the funding plan for stadium renovations",
      "C": "The lack of suitable stadiums in the area",
      "D": "The proximity of the Super Bowl date to other major events in the city"
    },
    "answer": "B",
    "explanation": "The correct answer is based on the information provided in the context, which states that the Miami bid depended on stadium renovations and that the Florida legislature refused to approve the funding plan, dealing a significant blow to Miami's chances.",
    "question_token_count": 27,
    "answer_correctness_score": 10,
    "explanation_validity_score": 10,
    "question_clarity_score": 1,
    "question_difficulty_score": 6,
    "question_groundedness_score": 9,
    "avg_answer_token_count": 11
  },
  {
    "context": "Multiracial Americans are Americans who have mixed ancestry of \"two or more races\". The term may also include Americans of mixed-race ancestry who self-identify with just one group culturally and socially (cf. the one-drop rule). In the 2010 US census, approximately 9 million individuals, or 2.9% of the population, self-identified as multiracial. There is evidence that an accounting by genetic ancestry would produce a higher number, but people live according to social and cultural identities, not DNA. Historical reasons, including slavery creating a racial caste and the European-American suppression of Native Americans, often led people to identify or be classified by only one ethnicity, generally that of the culture in which they were raised. Prior to the mid-20th century, many people hid their multiracial heritage because of racial discrimination against minorities. While many Americans may be biologically multiracial, they often do not know it or do not identify so culturally, any more than they maintain all the differing traditions of a variety of national ancestries.",
    "topic": "The demographic statistics of multiracial Americans, including the number of individuals who self-identify as multiracial and the potential discrepancy between self-identification and genetic ancestry.",
    "response": "<document_analysis>\nThe context provided discusses the demographic statistics of multiracial Americans, focusing on the number of individuals who self-identify as multiracial and the potential discrepancy between self-identification and genetic ancestry. The key points include the approximately 9 million individuals (2.9% of the population) who self-identified as multiracial in the 2010 US census, the distinction between social/cultural identity and genetic ancestry, and historical reasons for the underreporting of multiracial heritage.\n\nUpon analyzing the context, it becomes clear that the complexity of multiracial identity in America is influenced by a combination of historical, social, and cultural factors. The decision to self-identify as multiracial can be affected by personal experiences, societal perceptions, and the legacy of racial discrimination. Furthermore, the text highlights the difference between genetic ancestry and self-identification, suggesting that while many Americans may have multiracial genetic ancestry, they may not identify as such due to various reasons, including cultural upbringing and historical suppression of minority identities.\n\nGiven the nuanced discussion of multiracial identity and its complexities, the question should aim to probe the respondent's understanding of these intricacies and their implications on demographic statistics and individual identity. The question should be challenging, encouraging deep reflection on the interplay between genetic ancestry, social identity, and the historical context of racial classification in America.\n\nDifficulty rating: 8/10, due to the need to understand both the statistical aspect of multiracial identification and the deeper social and historical contexts that influence these numbers.\n\nThought process: The question should invite the respondent to consider the implications of the discrepancy between genetic ancestry and self-identification on the demographic representation of multiracial Americans. It should also require an understanding of how historical and social factors contribute to this discrepancy, making it a question that requires both factual knowledge and analytical thinking.\n</document_analysis>\n\n<output_format>\nQuestion: What factor contributes to the discrepancy between the number of Americans with multiracial genetic ancestry and those who self-identify as multiracial?\nA: Lack of genetic testing infrastructure\nB: Historical racial discrimination and social identity formation\nC: Insufficient representation in media\nD: High rate of interracial marriages in recent decades\n\nExplanation: The correct answer, B, reflects the historical and social factors mentioned in the context, such as slavery, the suppression of Native Americans, and the one-drop rule, which have led to the underreporting of multiracial heritage. This option requires the respondent to understand the complex interplay between genetic ancestry, social identity, and historical context.\n\nCorrect Answer: B\n</output_format>",
    "question": "What factor contributes to the discrepancy between the number of Americans with multiracial genetic ancestry and those who self-identify as multiracial?",
    "choices": {
      "A": "Lack of genetic testing infrastructure",
      "B": "Historical racial discrimination and social identity formation",
      "C": "Insufficient representation in media",
      "D": "High rate of interracial marriages in recent decades"
    },
    "answer": "B",
    "explanation": "The correct answer, B, reflects the historical and social factors mentioned in the context, such as slavery, the suppression of Native Americans, and the one-drop rule, which have led to the underreporting of multiracial heritage. This option requires the respondent to understand the complex interplay between genetic ancestry, social identity, and historical context.",
    "question_token_count": 29,
    "answer_correctness_score": 10,
    "explanation_validity_score": 10,
    "question_clarity_score": 8,
    "question_difficulty_score": 6,
    "question_groundedness_score": 9,
    "avg_answer_token_count": 8
  },
  {
    "context": "Beyonc\u00e9 Giselle Knowles-Carter (/bi\u02d0\u02c8j\u0252nse\u026a/ bee-YON-say) (born September 4, 1981) is an American singer, songwriter, record producer and actress. Born and raised in Houston, Texas, she performed in various singing and dancing competitions as a child, and rose to fame in the late 1990s as lead singer of R&B girl-group Destiny's Child. Managed by her father, Mathew Knowles, the group became one of the world's best-selling girl groups of all time. Their hiatus saw the release of Beyonc\u00e9's debut album, Dangerously in Love (2003), which established her as a solo artist worldwide, earned five Grammy Awards and featured the Billboard Hot 100 number-one singles \"Crazy in Love\" and \"Baby Boy\".",
    "topic": "The role of Mathew Knowles in managing Destiny's Child and its impact on the group's success.",
    "response": "<document_analysis>\nTo generate a highly insightful and probing question-answer pair, a thorough analysis of the provided context is necessary. The context discusses Beyonc\u00e9's background, her rise to fame as the lead singer of Destiny's Child, and her subsequent solo career. It mentions that Destiny's Child was managed by Mathew Knowles, Beyonc\u00e9's father, and notes the group's significant commercial success under his management.\n\nThe central idea here is the role of Mathew Knowles in managing Destiny's Child and the impact of his management on the group's success. To create a challenging question, we need to consider the implications of his management style, the decisions he made for the group, and how these factors contributed to Destiny's Child becoming one of the world's best-selling girl groups.\n\nGiven the information provided, a question that encourages deep engagement and critical reflection could involve analyzing the strategic decisions made by Mathew Knowles and their outcomes. However, the context does not delve deeply into specific management strategies or decisions, making it necessary to infer the significance of his role based on the group's overall success.\n\nTherefore, the question should be designed to test the understanding of how management can influence a group's success, using Destiny's Child as a case study, without requiring specific details from the context that are not provided.\n</document_analysis>\n\n<output_format>\nQuestion: What critical factor in Mathew Knowles' management of Destiny's Child likely contributed most significantly to the group's commercial success and enduring legacy?\nA: His ability to negotiate favorable recording contracts\nB: His strategic decision to emphasize the group's visual appeal and choreography\nC: His focus on developing a distinctive sound that blended different musical genres\nD: His capacity to foster a collaborative and supportive environment among group members\n\nExplanation: While the context does not explicitly outline Mathew Knowles' management strategies, the success of Destiny's Child can be attributed to a combination of factors including their unique sound, visual appeal, and internal group dynamics. However, developing a distinctive sound that blends different musical genres (option C) is a critical factor that can significantly contribute to a group's success, as it helps them stand out in a competitive market and appeal to a broader audience. This is a plausible reason for Destiny's Child's success, given the context's implication that the group achieved worldwide recognition and became one of the best-selling girl groups of all time.\n\nCorrect Answer: C\n</output_format>",
    "question": "What critical factor in Mathew Knowles' management of Destiny's Child likely contributed most significantly to the group's commercial success and enduring legacy?",
    "choices": {
      "A": "His ability to negotiate favorable recording contracts",
      "B": "His strategic decision to emphasize the group's visual appeal and choreography",
      "C": "His focus on developing a distinctive sound that blended different musical genres",
      "D": "His capacity to foster a collaborative and supportive environment among group members"
    },
    "answer": "C",
    "explanation": "While the context does not explicitly outline Mathew Knowles' management strategies, the success of Destiny's Child can be attributed to a combination of factors including their unique sound, visual appeal, and internal group dynamics. However, developing a distinctive sound that blends different musical genres (option C) is a critical factor that can significantly contribute to a group's success, as it helps them stand out in a competitive market and appeal to a broader audience. This is a plausible reason for Destiny's Child's success, given the context's implication that the group achieved worldwide recognition and became one of the best-selling girl groups of all time.",
    "question_token_count": 28,
    "answer_correctness_score": 8,
    "explanation_validity_score": 8,
    "question_clarity_score": 6,
    "question_difficulty_score": 7,
    "question_groundedness_score": 8,
    "avg_answer_token_count": 11
  },
  {
    "context": "CBS broadcast Super Bowl 50 in the U.S., and charged an average of $5 million for a 30-second commercial during the game. The Super Bowl 50 halftime show was headlined by the British rock group Coldplay with special guest performers Beyonc\u00e9 and Bruno Mars, who headlined the Super Bowl XLVII and Super Bowl XLVIII halftime shows, respectively. It was the third-most watched U.S. broadcast ever.",
    "topic": "The economic benefits and drawbacks of hosting and broadcasting the Super Bowl, considering both the local impact on the host city and the broader national and international effects.",
    "response": "<document_analysis>\nTo generate a highly insightful and probing question-answer pair, we first need to carefully analyze the provided context. The context discusses Super Bowl 50, its broadcasting by CBS, the cost of commercials during the game, and the halftime show performers. However, it lacks explicit information on the economic benefits and drawbacks of hosting and broadcasting the Super Bowl, which is the specified question topic.\n\nGiven the information provided, we can infer some economic implications. For instance, the high cost of commercials ($5 million for a 30-second spot) suggests significant revenue generation for the broadcaster. The fact that it was the third-most watched U.S. broadcast ever implies a large audience, which can have various economic effects, including increased advertising revenue and potential boosts to the local economy of the host city through tourism and event spending.\n\nHowever, to address the question topic directly, we must consider the broader economic impacts not explicitly mentioned in the context, such as job creation, infrastructure development, and potential economic drawbacks like increased costs for security, traffic management, and the strain on local resources.\n\nThe question should encourage deep engagement with the content, critical reflection on implications, and clear demonstration of understanding and competency in the economic aspects of hosting and broadcasting the Super Bowl.\n\nConsidering the above analysis, a thoughtful and challenging question can be formulated to probe domain expert knowledge on the economic benefits and drawbacks of the Super Bowl, focusing on aspects that require synthesis of general understanding beyond the specific context provided.\n</document_analysis>\n\n<output_format>\nQuestion: What primary economic benefit do host cities of the Super Bowl often experience in the short term, despite potential long-term economic drawbacks?\nA: Increased tax revenue from permanent resident income\nB: Boost in local employment opportunities\nC: Significant surge in tourism and event-related spending\nD: Reduced expenditure on city infrastructure development\n\nExplanation: The correct answer, \"Significant surge in tourism and event-related spending,\" reflects a common short-term economic benefit for host cities. The Super Bowl attracts a large number of visitors, leading to increased spending on accommodations, food, transportation, and merchandise, which can provide a temporary economic boost. The other options are incorrect because while host cities may experience some of these effects, they are not the primary short-term economic benefit associated with hosting the Super Bowl.\n\nCorrect Answer: C\n</output_format>",
    "question": "What primary economic benefit do host cities of the Super Bowl often experience in the short term, despite potential long-term economic drawbacks?",
    "choices": {
      "A": "Increased tax revenue from permanent resident income",
      "B": "Boost in local employment opportunities",
      "C": "Significant surge in tourism and event-related spending",
      "D": "Reduced expenditure on city infrastructure development"
    },
    "answer": "C",
    "explanation": "The correct answer, \"Significant surge in tourism and event-related spending,\" reflects a common short-term economic benefit for host cities. The Super Bowl attracts a large number of visitors, leading to increased spending on accommodations, food, transportation, and merchandise, which can provide a temporary economic boost. The other options are incorrect because while host cities may experience some of these effects, they are not the primary short-term economic benefit associated with hosting the Super Bowl.",
    "question_token_count": 26,
    "answer_correctness_score": 10,
    "explanation_validity_score": 10,
    "question_clarity_score": 8,
    "question_difficulty_score": 6,
    "question_groundedness_score": 1,
    "avg_answer_token_count": 7
  },
  {
    "context": "Fryderyk Chopin was born in \u017belazowa Wola, 46 kilometres (29 miles) west of Warsaw, in what was then the Duchy of Warsaw, a Polish state established by Napoleon. The parish baptismal record gives his birthday as 22 February 1810, and cites his given names in the Latin form Fridericus Franciscus (in Polish, he was Fryderyk Franciszek). However, the composer and his family used the birthdate 1 March,[n 2] which is now generally accepted as the correct date.",
    "topic": "The significance of the Duchy of Warsaw, established by Napoleon, in understanding the political climate at the time of Chopin's birth.",
    "response": "<document_analysis>\nTo generate a question that probes the domain expert's understanding of the significance of the Duchy of Warsaw in the context of Chopin's birth, it's crucial to analyze the given context carefully. The Duchy of Warsaw, established by Napoleon, is mentioned as the political entity within which Chopin was born. This historical detail is significant because it sets the stage for understanding the political climate of the time. \n\nThe context provided is rich in specific details about Chopin's birth but does not directly elaborate on the broader implications of the Duchy of Warsaw's establishment by Napoleon. However, it implies that the Duchy of Warsaw was a relevant geopolitical entity at the time of Chopin's birth, suggesting that its existence had implications for the political and possibly cultural landscape of the region.\n\nGiven the information and the goal to create a challenging question, the focus should be on the broader historical and political context that the Duchy of Warsaw represents, rather than the specific details of Chopin's birth. A domain expert should be able to reflect on the significance of the Duchy of Warsaw beyond its mere establishment, considering its impact on Polish history, European politics at the time, and potentially the cultural developments that could influence a figure like Chopin.\n\nThe question should encourage a deep understanding of historical context, political implications, and potentially the cultural ambiance of the era. It's essential to craft a question that is not only challenging but also requires a synthesis of historical knowledge, political awareness, and an understanding of how such factors could influence artistic and cultural figures like Chopin.\n\nConsidering the above analysis, the question should be designed to test the domain expert's ability to think critically about historical events, their consequences, and their potential influence on cultural and artistic development. \n\nThe difficulty rating of the question should be high (8-10), reflecting the need for in-depth knowledge of European history, specifically the Napoleonic era, and the ability to analyze the broader implications of historical events on cultural figures.\n\nGiven these considerations, the question should be phrased in a way that invites the domain expert to demonstrate a nuanced understanding of the historical context and its potential impact on the life and work of Chopin, without directly referencing the provided context but rather requiring an application of broader historical knowledge.\n</document_analysis>\n\n<output_format>\nQuestion: What significant geopolitical implication of Napoleon's establishment of the Duchy of Warsaw would most likely have influenced the sociopolitical environment in which Chopin grew up?\nA: It marked the beginning of a long period of Polish independence from European powers.\nB: It led to a brief period of Polish autonomy under French protection, influencing local culture and politics.\nC: It resulted in the immediate and permanent annexation of Polish territories by Russia.\nD: It had no significant impact on the political or cultural landscape of the region during Chopin's lifetime.\n\nExplanation: The correct answer requires an understanding of the historical context of the Duchy of Warsaw and its implications for the region's political and cultural landscape. The Duchy of Warsaw, established by Napoleon, represented a brief period of autonomy for Poland under French influence, which would have had cultural and political implications for the region, including the environment in which Chopin grew up.\n\nCorrect Answer: B\n</output_format>",
    "question": "What significant geopolitical implication of Napoleon's establishment of the Duchy of Warsaw would most likely have influenced the sociopolitical environment in which Chopin grew up?",
    "choices": {
      "A": "It marked the beginning of a long period of Polish independence from European powers.",
      "B": "It led to a brief period of Polish autonomy under French protection, influencing local culture and politics.",
      "C": "It resulted in the immediate and permanent annexation of Polish territories by Russia.",
      "D": "It had no significant impact on the political or cultural landscape of the region during Chopin's lifetime."
    },
    "answer": "B",
    "explanation": "The correct answer requires an understanding of the historical context of the Duchy of Warsaw and its implications for the region's political and cultural landscape. The Duchy of Warsaw, established by Napoleon, represented a brief period of autonomy for Poland under French influence, which would have had cultural and political implications for the region, including the environment in which Chopin grew up.",
    "question_token_count": 32,
    "answer_correctness_score": 10,
    "explanation_validity_score": 10,
    "question_clarity_score": 8,
    "question_difficulty_score": 9,
    "question_groundedness_score": 4,
    "avg_answer_token_count": 18
  },
  {
    "context": "Victoria married her first cousin, Prince Albert of Saxe-Coburg and Gotha, in 1840. Their nine children married into royal and noble families across the continent, tying them together and earning her the sobriquet \"the grandmother of Europe\". After Albert's death in 1861, Victoria plunged into deep mourning and avoided public appearances. As a result of her seclusion, republicanism temporarily gained strength, but in the latter half of her reign her popularity recovered. Her Golden and Diamond Jubilees were times of public celebration.",
    "topic": "The role of Queen Victoria as a symbol of national identity and unity, including how her public appearances and celebrations, such as her Golden and Diamond Jubilees, contributed to this image.",
    "response": "<document_analysis>\nTo generate a question that probes the domain expert's understanding of Queen Victoria's role as a symbol of national identity and unity, it's crucial to analyze the provided context carefully. The context mentions Victoria's marriage to Prince Albert, the birth of their nine children, and how these children married into various royal and noble families, thereby earning Victoria the title \"the grandmother of Europe\". Additionally, it discusses the impact of Prince Albert's death on Victoria's public appearances and her subsequent recovery in popularity, particularly highlighting her Golden and Diamond Jubilees as times of public celebration.\n\nGiven this information, the question should delve into how these events and Victoria's role contributed to her image as a symbol of national identity and unity. It's also important to consider the implications of her public appearances and celebrations on the British public's perception of her and the monarchy.\n\nThe difficulty of the question should be calibrated to challenge even the smartest domain experts, requiring a deep understanding of the historical context, the psychological impact of public figures, and the mechanisms by which national identity is shaped and maintained.\n\nThoughtfully, the question should be designed to encourage reflection on the broader implications of Victoria's actions and the celebrations surrounding her jubilees, rather than merely recalling factual information. This involves considering the subtle interplay between the monarchy, public opinion, and national sentiment during Victoria's reign.\n\nGiven the context and the goal of generating a highly insightful and probing question, it's clear that the question must be carefully crafted to avoid giving away the answer and to ensure that all answer options are plausible and reasonable, with at least one incorrect option being subtly wrong.\n</document_analysis>\n\n<output_format>\nQuestion: What significant factor contributed to the temporary strengthening of republicanism during Queen Victoria's reign, and how did her subsequent public celebrations counteract this trend?\nA: The death of Prince Albert and her prolonged mourning period.\nB: The marriage of her children into European royal families.\nC: The economic downturn of the British Empire.\nD: The rise of the British parliamentary system.\n\nExplanation: The correct answer, A, is supported by the context which mentions that after Albert's death in 1861, Victoria plunged into deep mourning and avoided public appearances, as a result of which republicanism temporarily gained strength. Her Golden and Diamond Jubilees, mentioned as times of public celebration, would have contributed to recovering her popularity and reinforcing her role as a symbol of national unity.\n\nCorrect Answer: A\n</output_format>",
    "question": "What significant factor contributed to the temporary strengthening of republicanism during Queen Victoria's reign, and how did her subsequent public celebrations counteract this trend?",
    "choices": {
      "A": "The death of Prince Albert and her prolonged mourning period.",
      "B": "The marriage of her children into European royal families.",
      "C": "The economic downturn of the British Empire.",
      "D": "The rise of the British parliamentary system."
    },
    "answer": "A",
    "explanation": "The correct answer, A, is supported by the context which mentions that after Albert's death in 1861, Victoria plunged into deep mourning and avoided public appearances, as a result of which republicanism temporarily gained strength. Her Golden and Diamond Jubilees, mentioned as times of public celebration, would have contributed to recovering her popularity and reinforcing her role as a symbol of national unity.",
    "question_token_count": 31,
    "answer_correctness_score": 10,
    "explanation_validity_score": 10,
    "question_clarity_score": 7,
    "question_difficulty_score": 8,
    "question_groundedness_score": 9,
    "avg_answer_token_count": 10
  },
  {
    "context": "On 2 March 1882, Roderick Maclean, a disgruntled poet apparently offended by Victoria's refusal to accept one of his poems, shot at the Queen as her carriage left Windsor railway station. Two schoolboys from Eton College struck him with their umbrellas, until he was hustled away by a policeman. Victoria was outraged when he was found not guilty by reason of insanity, but was so pleased by the many expressions of loyalty after the attack that she said it was \"worth being shot at\u2014to see how much one is loved\".",
    "topic": "The potential consequences of the incident on the security measures and protocols surrounding the British monarch, considering the relatively public nature of the attack.",
    "response": "<document_analysis>\nThe provided context describes an incident where Queen Victoria was shot at by Roderick Maclean, a disgruntled poet, as her carriage left Windsor railway station. The attack was thwarted by two schoolboys from Eton College, who struck Maclean with their umbrellas until he was taken away by a policeman. The context also mentions that Maclean was found not guilty by reason of insanity, which outraged the Queen. However, the outpouring of loyalty and support from the public after the attack pleased her greatly.\n\nUpon analyzing the context, it becomes clear that the incident highlights the potential vulnerabilities in the security measures surrounding the British monarch, particularly in public settings. The fact that Maclean was able to get close enough to the Queen's carriage to shoot at her raises questions about the effectiveness of the security protocols in place at the time.\n\nConsidering the relatively public nature of the attack, it is likely that the incident would have led to a review and potential overhaul of the security measures surrounding the monarch. This could have included increases in the number of guards, improved screening of individuals in close proximity to the Queen, and enhanced surveillance of public areas where the monarch is likely to be present.\n\nIn generating a question based on this context, it is essential to consider the potential consequences of the incident on the security measures and protocols surrounding the British monarch. A domain expert should be able to reflect on the implications of the attack and the measures that might have been taken to prevent similar incidents in the future.\n</document_analysis>\n\n<output_format>\nQuestion: What would be the most critical aspect of security protocol to reevaluate following a public attack on a head of state, such as the one on Queen Victoria in 1882?\nA: The number of guards present at public events\nB: The mental health evaluation process for individuals in close proximity to the monarch\nC: The protocol for screening and monitoring individuals in the surrounding area\nD: The use of armored vehicles for transportation\n\nExplanation: The correct answer, C, is the most appropriate because it directly addresses a critical vulnerability exposed by the incident - the ability of an individual to get close enough to the monarch to pose a threat. Screening and monitoring protocols are crucial in preventing such incidents and would likely be a key focus of any security review following the attack.\n\nCorrect Answer: C\n</output_format>",
    "question": "What would be the most critical aspect of security protocol to reevaluate following a public attack on a head of state, such as the one on Queen Victoria in 1882?",
    "choices": {
      "A": "The number of guards present at public events",
      "B": "The mental health evaluation process for individuals in close proximity to the monarch",
      "C": "The protocol for screening and monitoring individuals in the surrounding area",
      "D": "The use of armored vehicles for transportation"
    },
    "answer": "C",
    "explanation": "The correct answer, C, is the most appropriate because it directly addresses a critical vulnerability exposed by the incident - the ability of an individual to get close enough to the monarch to pose a threat. Screening and monitoring protocols are crucial in preventing such incidents and would likely be a key focus of any security review following the attack.",
    "question_token_count": 36,
    "answer_correctness_score": 10,
    "explanation_validity_score": 10,
    "question_clarity_score": 6,
    "question_difficulty_score": 8,
    "question_groundedness_score": 4,
    "avg_answer_token_count": 11
  },
  {
    "context": "Although this period had been productive, the bad weather had such a detrimental effect on Chopin's health that Sand determined to leave the island. To avoid further customs duties, Sand sold the piano to a local French couple, the Canuts.[n 8] The group traveled first to Barcelona, then to Marseilles, where they stayed for a few months while Chopin convalesced. In May 1839 they headed for the summer to Sand's estate at Nohant, where they spent most summers until 1846. In autumn they returned to Paris, where Chopin's apartment at 5 rue Tronchet was close to Sand's rented accommodation at the rue Pigalle. He frequently visited Sand in the evenings, but both retained some independence. In 1842 he and Sand moved to the Square d'Orl\u00e9ans, living in adjacent buildings.",
    "topic": "The financial and logistical considerations that influenced Chopin and Sand's living arrangements, including the decision to live in adjacent buildings in the Square d'Orl\u00e9ans.",
    "response": "<document_analysis>\nThe context provided revolves around the living arrangements of Chopin and Sand, particularly their decision to reside in adjacent buildings in the Square d'Orl\u00e9ans. To generate a question that probes domain expert knowledge, we must consider the financial and logistical factors that influenced this decision. \n\nUpon examining the context, it becomes clear that Chopin's health issues played a significant role in their relocation decisions. The sale of the piano to avoid customs duties and the choice of destinations for convalescence (e.g., Marseilles, Nohant) suggest that financial considerations were also important. The fact that they maintained separate apartments, even when living in close proximity, implies a need for independence.\n\nGiven these details, a thoughtful question might explore the balance between financial constraints, health concerns, and the desire for independence in their choice of living arrangements. \n\nThe difficulty rating for such a question would be high (8/10) due to the need to synthesize information about their lifestyle, financial situation, and personal preferences.\n\nThe question should be designed to encourage deep engagement with the content, critically reflecting on the implications of their decisions and demonstrating a nuanced understanding of the factors at play.\n</document_analysis>\n\n<output_format>\nQuestion: What was the primary financial consideration that likely influenced Chopin and Sand's decision to live in adjacent buildings rather than sharing a single residence?\nA: To reduce the cost of renting a large single apartment\nB: To avoid the financial burden of Chopin's frequent travel for health reasons\nC: To minimize customs duties on personal belongings\nD: To split household expenses while maintaining personal space and independence\n\nExplanation: The correct answer requires an understanding of the financial and logistical factors that influenced Chopin and Sand's living arrangements. While all options seem plausible, the most relevant financial consideration in this context would be the desire to split household expenses (such as rent, utilities, and maintenance) while still maintaining their personal space and independence. This arrangement would allow them to optimize their financial resources without compromising their need for separate living quarters.\n\nCorrect Answer: D\n</output_format>",
    "question": "What was the primary financial consideration that likely influenced Chopin and Sand's decision to live in adjacent buildings rather than sharing a single residence?",
    "choices": {
      "A": "To reduce the cost of renting a large single apartment",
      "B": "To avoid the financial burden of Chopin's frequent travel for health reasons",
      "C": "To minimize customs duties on personal belongings",
      "D": "To split household expenses while maintaining personal space and independence"
    },
    "answer": "D",
    "explanation": "The correct answer requires an understanding of the financial and logistical factors that influenced Chopin and Sand's living arrangements. While all options seem plausible, the most relevant financial consideration in this context would be the desire to split household expenses (such as rent, utilities, and maintenance) while still maintaining their personal space and independence. This arrangement would allow them to optimize their financial resources without compromising their need for separate living quarters.",
    "question_token_count": 28,
    "answer_correctness_score": 10,
    "explanation_validity_score": 10,
    "question_clarity_score": 6,
    "question_difficulty_score": 8,
    "question_groundedness_score": 4,
    "avg_answer_token_count": 11
  },
  {
    "context": "The league eventually narrowed the bids to three sites: New Orleans' Mercedes-Benz Superdome, Miami's Sun Life Stadium, and the San Francisco Bay Area's Levi's Stadium.",
    "topic": "Analyzing the potential consequences of selecting a venue based on criteria such as weather conditions, political stability, and local support for the event, using the selected venues as case studies.",
    "response": "<document_analysis>\nTo generate a highly insightful and probing question-answer pair, we must carefully analyze the given context and identify central ideas, nuanced themes, and significant relationships within it. The context provided discusses the selection of venues for a league event, narrowing down the options to three sites: New Orleans' Mercedes-Benz Superdome, Miami's Sun Life Stadium, and the San Francisco Bay Area's Levi's Stadium.\n\nGiven the topic of analyzing potential consequences of selecting a venue based on criteria such as weather conditions, political stability, and local support for the event, we can explore the implications of choosing each of these venues. However, the context itself does not provide detailed information on these aspects for each venue. Therefore, we need to consider what factors would be crucial in selecting a venue and how they might impact the event.\n\nThe question should encourage deep engagement with the content, critically reflect on implications, and clearly demonstrate understanding and competency. It should be highly challenging, even for domain experts, and require a synthesis of high-level general understanding beyond the specific context.\n\nConsidering the factors of weather conditions, political stability, and local support, a question that invites deeper understanding and meaningful reflection could involve evaluating the potential risks or benefits associated with each venue based on these criteria.\n\nThoughtfully rating the difficulty, we aim for a question that is complex and requires nuanced consideration of the subject matter, placing it at a higher level of difficulty, around 8 or 9 out of 10.\n\nThe rationale behind the question generation is to create a scenario that requires the domain expert to think critically about the venue selection process, considering multiple factors and their potential consequences on the event's success.\n\nGiven the context does not explicitly provide information on the weather conditions, political stability, or local support for the event at each venue, we must craft a question that is answerable based on general knowledge of these locations and the factors that could influence venue selection.\n\nThus, the question should be designed to test the domain expert's ability to analyze potential consequences of venue selection based on general principles and knowledge of the factors involved.\n</document_analysis>\n\n<output_format>\nQuestion: What factor would most significantly influence the selection of New Orleans' Mercedes-Benz Superdome over Miami's Sun Life Stadium for an outdoor event, considering typical weather patterns?\nA: Political Stability\nB: Local Support\nC: Hurricane Season\nD: Venue Capacity\n\nExplanation: The correct answer, Hurricane Season, is the most relevant factor because New Orleans is more prone to hurricanes than Miami, which could significantly impact an outdoor event. Although both cities can experience severe weather, the specific concern of hurricane season makes it a critical consideration for event planning in these locations.\n\nCorrect Answer: C\n</output_format>",
    "question": "What factor would most significantly influence the selection of New Orleans' Mercedes-Benz Superdome over Miami's Sun Life Stadium for an outdoor event, considering typical weather patterns?",
    "choices": {
      "A": "Political Stability",
      "B": "Local Support",
      "C": "Hurricane Season",
      "D": "Venue Capacity"
    },
    "answer": "C",
    "explanation": "The correct answer, Hurricane Season, is the most relevant factor because New Orleans is more prone to hurricanes than Miami, which could significantly impact an outdoor event. Although both cities can experience severe weather, the specific concern of hurricane season makes it a critical consideration for event planning in these locations.",
    "question_token_count": 34,
    "answer_correctness_score": 8,
    "explanation_validity_score": 7,
    "question_clarity_score": 4,
    "question_difficulty_score": 6,
    "question_groundedness_score": 1,
    "avg_answer_token_count": 3
  },
  {
    "context": "On May 21, 2013, NFL owners at their spring meetings in Boston voted and awarded the game to Levi's Stadium. The $1.2 billion stadium opened in 2014. It is the first Super Bowl held in the San Francisco Bay Area since Super Bowl XIX in 1985, and the first in California since Super Bowl XXXVII took place in San Diego in 2003.",
    "topic": "The historical significance of Super Bowl events held in the San Francisco Bay Area, including the last time a Super Bowl was held in this region before the one at Levi's Stadium.",
    "response": "<document_analysis>\nTo generate a question that probes the domain expert's knowledge about the historical significance of Super Bowl events held in the San Francisco Bay Area, we first need to carefully analyze the provided context. The key points from the context include the awarding of a Super Bowl to Levi's Stadium in 2013, the opening of the stadium in 2014, and the fact that it is the first Super Bowl in the San Francisco Bay Area since Super Bowl XIX in 1985. \n\nThe context also mentions that the last Super Bowl held in California before the one at Levi's Stadium was Super Bowl XXXVII in San Diego in 2003. This information provides a backdrop for understanding the significance of Super Bowl events in the region and the time gap between these significant sporting events.\n\nGiven this analysis, the goal is to craft a question that not only tests the expert's knowledge of these events but also encourages a deeper understanding of their historical significance and the impact on the region. \n\nThe question should be challenging, requiring the synthesis of information about Super Bowl events, their locations, and the time frames involved. It should also be self-contained, clear, and concise, without giving away the answer or being too obvious.\n\nAfter careful consideration, a question that fits these criteria can be formulated, focusing on the historical aspect and the specific details provided in the context.\n</document_analysis>\n\n<output_format>\nQuestion: What was the year of the last Super Bowl held in the San Francisco Bay Area before the game at Levi's Stadium?\nA: 1995\nB: 1985\nC: 2003\nD: 2010\nExplanation: The correct answer is based on the information provided in the context, which states that the Super Bowl held at Levi's Stadium was the first in the San Francisco Bay Area since Super Bowl XIX in 1985.\nCorrect Answer: B\n</output_format>",
    "question": "What was the year of the last Super Bowl held in the San Francisco Bay Area before the game at Levi's Stadium?",
    "choices": {
      "A": "1995",
      "B": "1985",
      "C": "2003",
      "D": "2010"
    },
    "answer": "B",
    "explanation": "The correct answer is based on the information provided in the context, which states that the Super Bowl held at Levi's Stadium was the first in the San Francisco Bay Area since Super Bowl XIX in 1985.",
    "question_token_count": 25,
    "answer_correctness_score": 10,
    "explanation_validity_score": 10,
    "question_clarity_score": 6,
    "question_difficulty_score": 5,
    "question_groundedness_score": 10,
    "avg_answer_token_count": 3
  },
  {
    "context": "The Panthers finished the regular season with a 15\u20131 record, and quarterback Cam Newton was named the NFL Most Valuable Player (MVP). They defeated the Arizona Cardinals 49\u201315 in the NFC Championship Game and advanced to their second Super Bowl appearance since the franchise was founded in 1995. The Broncos finished the regular season with a 12\u20134 record, and denied the New England Patriots a chance to defend their title from Super Bowl XLIX by defeating them 20\u201318 in the AFC Championship Game. They joined the Patriots, Dallas Cowboys, and Pittsburgh Steelers as one of four teams that have made eight appearances in the Super Bowl.",
    "topic": "The historical context of the Broncos' eighth Super Bowl appearance and its significance in NFL history.",
    "response": "<document_analysis>\nTo generate a highly insightful and probing question-answer pair, I will conduct a thorough analysis of the provided context. The central idea of the context is the historical context of the Broncos' eighth Super Bowl appearance and its significance in NFL history. \n\nUpon examining the context, I notice that it provides information about the Panthers' and Broncos' performance in the regular season and their paths to the Super Bowl. The context also highlights the Broncos' achievement of making eight Super Bowl appearances, joining an elite group of teams.\n\nTo create a challenging question, I will focus on the significance of the Broncos' eighth Super Bowl appearance and its implications in NFL history. I will consider implicit assumptions, subtle details, and underlying themes within the context.\n\nThe difficulty level of the question will be rated as 8 out of 10, ensuring that it is highly challenging for even the smartest domain experts.\n\nThe question will be designed to invite deeper understanding, meaningful reflection, and critical engagement with the content. It will require the synthesis of high-level general understanding above and beyond the specific context.\n\n</document_analysis>\n\n<output_format>\nQuestion: What distinction did the Broncos achieve by making their eighth Super Bowl appearance?\nA: They became the team with the most Super Bowl wins.\nB: They joined the Patriots, Cowboys, and Steelers as one of four teams with eight Super Bowl appearances.\nC: They set a record for the most consecutive Super Bowl appearances.\nD: They became the first team to appear in the Super Bowl in three different decades.\nExplanation: The correct answer is supported by the context, which states that the Broncos \"joined the Patriots, Dallas Cowboys, and Pittsburgh Steelers as one of four teams that have made eight appearances in the Super Bowl.\"\nCorrect Answer: B\n</output_format>",
    "question": "What distinction did the Broncos achieve by making their eighth Super Bowl appearance?",
    "choices": {
      "A": "They became the team with the most Super Bowl wins.",
      "B": "They joined the Patriots, Cowboys, and Steelers as one of four teams with eight Super Bowl appearances.",
      "C": "They set a record for the most consecutive Super Bowl appearances.",
      "D": "They became the first team to appear in the Super Bowl in three different decades."
    },
    "answer": "B",
    "explanation": "The correct answer is supported by the context, which states that the Broncos \"joined the Patriots, Dallas Cowboys, and Pittsburgh Steelers as one of four teams that have made eight appearances in the Super Bowl.\"",
    "question_token_count": 15,
    "answer_correctness_score": 10,
    "explanation_validity_score": 10,
    "question_clarity_score": 4,
    "question_difficulty_score": 5,
    "question_groundedness_score": 6,
    "avg_answer_token_count": 15
  },
  {
    "context": "On May 21, 2013, NFL owners at their spring meetings in Boston voted and awarded the game to Levi's Stadium. The $1.2 billion stadium opened in 2014. It is the first Super Bowl held in the San Francisco Bay Area since Super Bowl XIX in 1985, and the first in California since Super Bowl XXXVII took place in San Diego in 2003.",
    "topic": "The impact of hosting a Super Bowl at Levi's Stadium on the local community and the NFL, considering economic, social, and sporting aspects.",
    "response": "<document_analysis>\nTo generate a highly insightful and probing question-answer pair, a thorough analysis of the provided context is necessary. The context discusses the awarding of a Super Bowl to Levi's Stadium, its opening year, and the cost of the stadium. It also mentions the history of Super Bowls in the San Francisco Bay Area and California. \n\nGiven the topic of the impact of hosting a Super Bowl at Levi's Stadium on the local community and the NFL, considering economic, social, and sporting aspects, the context provides a foundation for exploring these impacts. However, the context itself is more factual and historical, lacking direct discussion on the economic, social, and sporting impacts.\n\nThoughtful content examination reveals that the central idea is the hosting of a Super Bowl at Levi's Stadium, with nuanced themes potentially including the economic benefits of such a large event, the social implications for the local community, and the sporting significance for the NFL and its fans.\n\nConcept exploration suggests considering the implicit assumptions, such as the potential for increased revenue for local businesses, the possible strain on local infrastructure, and the enhancement of the NFL's reputation by hosting the event in a state-of-the-art stadium like Levi's.\n\nStrategic complexity calibration rates the difficulty of generating a question that probes these aspects without direct information from the context as high (8/10), requiring the synthesis of general knowledge about the impacts of large sporting events.\n\nIntentional question planning aims to invite deeper understanding and critical engagement by focusing on the broader implications of hosting a Super Bowl, beyond the factual information provided.\n\nGiven the lack of explicit information on economic, social, and sporting impacts in the context, the question will need to be designed to encourage the application of general knowledge about the effects of major sporting events on local communities and the NFL.\n</document_analysis>\n\n<output_format>\nQuestion: What is a primary economic benefit that the local community around Levi's Stadium might experience as a direct result of hosting a Super Bowl?\nA: Increased long-term infrastructure costs\nB: Enhanced local reputation without financial gain\nC: Significant short-term boost in local business revenue\nD: Permanent relocation of NFL teams to the area\n\nExplanation: Hosting a Super Bowl can bring a significant influx of visitors, leading to increased spending in local businesses such as hotels, restaurants, and shops. This can result in a short-term economic boost for the area. While long-term benefits can occur, such as increased infrastructure and a enhanced reputation, the most direct and immediate economic benefit is typically the short-term revenue increase.\n\nCorrect Answer: C\n</output_format>",
    "question": "What is a primary economic benefit that the local community around Levi's Stadium might experience as a direct result of hosting a Super Bowl?",
    "choices": {
      "A": "Increased long-term infrastructure costs",
      "B": "Enhanced local reputation without financial gain",
      "C": "Significant short-term boost in local business revenue",
      "D": "Permanent relocation of NFL teams to the area"
    },
    "answer": "C",
    "explanation": "Hosting a Super Bowl can bring a significant influx of visitors, leading to increased spending in local businesses such as hotels, restaurants, and shops. This can result in a short-term economic boost for the area. While long-term benefits can occur, such as increased infrastructure and a enhanced reputation, the most direct and immediate economic benefit is typically the short-term revenue increase.",
    "question_token_count": 27,
    "answer_correctness_score": 10,
    "explanation_validity_score": 10,
    "question_clarity_score": 6,
    "question_difficulty_score": 5,
    "question_groundedness_score": 6,
    "avg_answer_token_count": 7
  },
  {
    "context": "All of Chopin's compositions include the piano. Most are for solo piano, though he also wrote two piano concertos, a few chamber pieces, and some songs to Polish lyrics. His keyboard style is highly individual and often technically demanding; his own performances were noted for their nuance and sensitivity. Chopin invented the concept of instrumental ballade. His major piano works also include mazurkas, waltzes, nocturnes, polonaises, \u00e9tudes, impromptus, scherzos, preludes and sonatas, some published only after his death. Influences on his compositional style include Polish folk music, the classical tradition of J. S. Bach, Mozart and Schubert, the music of all of whom he admired, as well as the Paris salons where he was a frequent guest. His innovations in style, musical form, and harmony, and his association of music with nationalism, were influential throughout and after the late Romantic period.",
    "topic": "The significance of Chopin's invention of the instrumental ballade and its impact on the development of musical form.",
    "response": "<document_analysis>\nThe provided context discusses the significance of Chopin's compositions and his impact on the development of musical form. It highlights his invention of the instrumental ballade and his unique keyboard style, which is characterized by nuance and sensitivity. The context also mentions the various influences on his compositional style, including Polish folk music, classical tradition, and the Paris salons. To generate a question that inspires genuine curiosity and thoughtful engagement, I will focus on the concept of instrumental ballade and its impact on musical form. \n\nThe thought process behind the question generation involves analyzing the context to identify the central idea, which is Chopin's contribution to musical form through his invention of the instrumental ballade. The question should be designed to encourage a deep understanding of the concept and its implications on the development of musical form. \n\nThe difficulty level of the question should be high (8-10) to challenge even the smartest domain experts. The question should require the synthesis of high-level general understanding and should be self-contained, with sufficient context to be clearly understandable independently of external references.\n\nThe permitted question types that fit the content and instructions include analytical, conceptual, and implication questions. The question should be formulated in a conversational tone, with a short and factual answer that is a single phrase or sentence.\n</document_analysis>\n\n<output_format>\nQuestion: What notable innovation did Chopin introduce to the realm of musical composition that expanded the expressive possibilities of instrumental music?\nA: The instrumental sonata\nB: The instrumental ballade\nC: The piano concerto\nD: The symphonic poem\nExplanation: Chopin's invention of the instrumental ballade is a significant innovation in musical composition, as it introduced a new form of expressive instrumental music that expanded the possibilities of musical storytelling.\nCorrect Answer: B\n</output_format>",
    "question": "What notable innovation did Chopin introduce to the realm of musical composition that expanded the expressive possibilities of instrumental music?",
    "choices": {
      "A": "The instrumental sonata",
      "B": "The instrumental ballade",
      "C": "The piano concerto",
      "D": "The symphonic poem"
    },
    "answer": "B",
    "explanation": "Chopin's invention of the instrumental ballade is a significant innovation in musical composition, as it introduced a new form of expressive instrumental music that expanded the possibilities of musical storytelling.",
    "question_token_count": 23,
    "answer_correctness_score": 10,
    "explanation_validity_score": 10,
    "question_clarity_score": 8,
    "question_difficulty_score": 7,
    "question_groundedness_score": 9,
    "avg_answer_token_count": 5
  },
  {
    "context": "Antibiotics revolutionized medicine in the 20th century, and have together with vaccination led to the near eradication of diseases such as tuberculosis in the developed world. Their effectiveness and easy access led to overuse, especially in livestock raising, prompting bacteria to develop resistance. This has led to widespread problems with antimicrobial and antibiotic resistance, so much as to prompt the World Health Organization to classify antimicrobial resistance as a \"serious threat [that] is no longer a prediction for the future, it is happening right now in every region of the world and has the potential to affect anyone, of any age, in any country\".",
    "topic": "Potential future strategies for combating antibiotic resistance, including new drug development, improved prescribing practices, and public health initiatives.",
    "response": "<document_analysis>\nThe provided context discusses the impact of antibiotics on medicine, their overuse, and the resulting issue of antimicrobial and antibiotic resistance. The World Health Organization's classification of antimicrobial resistance as a serious threat highlights the gravity of the situation. To generate a question that inspires thoughtful engagement and reflection, we need to consider the potential strategies for combating antibiotic resistance. \n\nThe context mentions the overuse of antibiotics, especially in livestock raising, as a primary cause of antibiotic resistance. Therefore, a question that probes the domain expert's understanding of potential future strategies for combating antibiotic resistance, including new drug development, improved prescribing practices, and public health initiatives, would be highly relevant.\n\nGiven the complexity of the issue, a question that requires the synthesis of high-level general understanding and nuanced consideration of the potential strategies would be appropriate. The question should be self-contained, clear, and concise, with sufficient context for the domain expert to provide a thoughtful answer.\n\nAfter careful analysis, a potential question that meets these criteria could be: What is a crucial public health initiative that could potentially mitigate the spread of antibiotic-resistant bacteria in the general population?\n\nThis question requires the domain expert to think critically about the potential strategies for combating antibiotic resistance and to consider the role of public health initiatives in addressing this issue. The correct answer should demonstrate a deep understanding of the topic and the ability to synthesize information to provide a thoughtful response.\n</document_analysis>\n\n<output_format>\nQuestion: What public health initiative could help mitigate the spread of antibiotic-resistant bacteria?\nA: Improved antibiotic prescribing practices for humans\nB: Mandatory vaccination of livestock\nC: Enhanced infection control measures in healthcare settings\nD: Promotion of antibiotic use in agriculture\nExplanation: The correct answer, Enhanced infection control measures in healthcare settings, is a crucial public health initiative that can help prevent the spread of antibiotic-resistant bacteria. This initiative is supported by the context, which highlights the need for strategies to combat antibiotic resistance. The other options, while related to antibiotic use or resistance, are not directly focused on public health initiatives to mitigate the spread of resistant bacteria in the general population.\nCorrect Answer: C\n</output_format>",
    "question": "What public health initiative could help mitigate the spread of antibiotic-resistant bacteria?",
    "choices": {
      "A": "Improved antibiotic prescribing practices for humans",
      "B": "Mandatory vaccination of livestock",
      "C": "Enhanced infection control measures in healthcare settings",
      "D": "Promotion of antibiotic use in agriculture"
    },
    "answer": "C",
    "explanation": "The correct answer, Enhanced infection control measures in healthcare settings, is a crucial public health initiative that can help prevent the spread of antibiotic-resistant bacteria. This initiative is supported by the context, which highlights the need for strategies to combat antibiotic resistance. The other options, while related to antibiotic use or resistance, are not directly focused on public health initiatives to mitigate the spread of resistant bacteria in the general population.",
    "question_token_count": 15,
    "answer_correctness_score": 10,
    "explanation_validity_score": 10,
    "question_clarity_score": 5,
    "question_difficulty_score": 6,
    "question_groundedness_score": 1,
    "avg_answer_token_count": 6
  },
  {
    "context": "Antibiotics revolutionized medicine in the 20th century, and have together with vaccination led to the near eradication of diseases such as tuberculosis in the developed world. Their effectiveness and easy access led to overuse, especially in livestock raising, prompting bacteria to develop resistance. This has led to widespread problems with antimicrobial and antibiotic resistance, so much as to prompt the World Health Organization to classify antimicrobial resistance as a \"serious threat [that] is no longer a prediction for the future, it is happening right now in every region of the world and has the potential to affect anyone, of any age, in any country\".",
    "topic": "The global health implications of antimicrobial and antibiotic resistance as identified by the World Health Organization.",
    "response": "<document_analysis>\nTo generate a highly insightful and probing question-answer pair, a careful analysis of the provided context is necessary. The central idea of the context revolves around the global health implications of antimicrobial and antibiotic resistance, as highlighted by the World Health Organization. The text touches on the historical significance of antibiotics, their overuse, and the consequent development of resistance in bacteria. \n\nThe key concepts here include the revolution antibiotics brought to medicine, the issue of overuse (especially in livestock), and the World Health Organization's stance on antimicrobial resistance as a serious and current global threat. \n\nGiven the complexity and the urgency of the issue, a question that probes the understanding of the implications of antimicrobial resistance on a global scale, considering the historical context and the current stance of major health organizations, would be appropriate. \n\nThe difficulty level of such a question should be high (rated 8 out of 10) to challenge even the smartest domain experts, requiring a deep understanding of the subject matter and its global health implications.\n\nThe question should be designed to encourage a thoughtful engagement with the content, reflecting on the implications and demonstrating a clear understanding of the competency in the domain of global health and antimicrobial resistance.\n</document_analysis>\n\n<output_format>\nQuestion: What significant factor has contributed to bacteria developing resistance, as indicated by the global health crisis of antimicrobial and antibiotic resistance?\nA: Overprescription in human medicine\nB: Natural evolution of bacteria\nC: Overuse in livestock raising\nD: Lack of vaccination programs\n\nExplanation: The correct answer, \"Overuse in livestock raising,\" is supported by the context as a primary factor leading to the development of resistance in bacteria. This is because the widespread use of antibiotics in livestock not only treats diseases but also promotes growth, leading to a selective pressure that favors the survival and proliferation of resistant bacterial strains.\n\nCorrect Answer: C\n</output_format>",
    "question": "What significant factor has contributed to bacteria developing resistance, as indicated by the global health crisis of antimicrobial and antibiotic resistance?",
    "choices": {
      "A": "Overprescription in human medicine",
      "B": "Natural evolution of bacteria",
      "C": "Overuse in livestock raising",
      "D": "Lack of vaccination programs"
    },
    "answer": "C",
    "explanation": "The correct answer, \"Overuse in livestock raising,\" is supported by the context as a primary factor leading to the development of resistance in bacteria. This is because the widespread use of antibiotics in livestock not only treats diseases but also promotes growth, leading to a selective pressure that favors the survival and proliferation of resistant bacterial strains.",
    "question_token_count": 24,
    "answer_correctness_score": 10,
    "explanation_validity_score": 10,
    "question_clarity_score": 2,
    "question_difficulty_score": 5,
    "question_groundedness_score": 8,
    "avg_answer_token_count": 6
  },
  {
    "context": "In March 1861, Victoria's mother died, with Victoria at her side. Through reading her mother's papers, Victoria discovered that her mother had loved her deeply; she was heart-broken, and blamed Conroy and Lehzen for \"wickedly\" estranging her from her mother. To relieve his wife during her intense and deep grief, Albert took on most of her duties, despite being ill himself with chronic stomach trouble. In August, Victoria and Albert visited their son, the Prince of Wales, who was attending army manoeuvres near Dublin, and spent a few days holidaying in Killarney. In November, Albert was made aware of gossip that his son had slept with an actress in Ireland. Appalled, Albert travelled to Cambridge, where his son was studying, to confront him. By the beginning of December, Albert was very unwell. He was diagnosed with typhoid fever by William Jenner, and died on 14 December 1861. Victoria was devastated. She blamed her husband's death on worry over the Prince of Wales's philandering. He had been \"killed by that dreadful business\", she said. She entered a state of mourning and wore black for the remainder of her life. She avoided public appearances, and rarely set foot in London in the following years. Her seclusion earned her the nickname \"widow of Windsor\".",
    "topic": "The role of Albert in supporting Victoria during her grief and his efforts to address their son's philandering, including the potential consequences of these actions on his health.",
    "response": "<document_analysis>\nTo generate a highly insightful and probing question-answer pair, I will conduct a thorough analysis of the provided context. The central idea of the context revolves around the role of Albert in supporting Victoria during her grief and his efforts to address their son's philandering, including the potential consequences of these actions on his health.\n\nThe context highlights Albert's selfless nature as he takes on most of Victoria's duties despite being ill himself. It also showcases his concern for their son's behavior and his efforts to confront him about the gossip surrounding his relationships. However, these actions may have taken a toll on Albert's health, ultimately leading to his death.\n\nUpon careful examination, I have identified the key themes and relationships within the context. The question should encourage a deep engagement with the content, critically reflect on implications, and clearly demonstrate understanding and competency.\n\nConsidering the implicit assumptions and subtle details, I will plan a question that invites deeper understanding and meaningful reflection. The question should be highly challenging, even for the smartest domain experts, and should require a deep understanding of the content.\n\nI have rated the difficulty of the question as 8 out of 10, ensuring that it is highly complex and thought-provoking.\n\n</document_analysis>\n\n<output_format>\nQuestion: What was the primary factor that Victoria believed contributed to Albert's death, and how did this event impact her subsequent behavior and public appearances?\nA: The death of her mother and her subsequent grief\nB: The Prince of Wales's philandering and Albert's worry over it\nC: Albert's chronic stomach trouble and typhoid fever diagnosis\nD: The strain of taking on most of Victoria's duties during her grief\n\nExplanation: The correct answer, B, is supported by the context, which states that Victoria blamed her husband's death on worry over the Prince of Wales's philandering, saying he had been \"killed by that dreadful business\". This event had a significant impact on Victoria, leading her to enter a state of mourning, wear black for the remainder of her life, and avoid public appearances.\n\nCorrect Answer: B\n</output_format>",
    "question": "What was the primary factor that Victoria believed contributed to Albert's death, and how did this event impact her subsequent behavior and public appearances?",
    "choices": {
      "A": "The death of her mother and her subsequent grief",
      "B": "The Prince of Wales's philandering and Albert's worry over it",
      "C": "Albert's chronic stomach trouble and typhoid fever diagnosis",
      "D": "The strain of taking on most of Victoria's duties during her grief"
    },
    "answer": "B",
    "explanation": "The correct answer, B, is supported by the context, which states that Victoria blamed her husband's death on worry over the Prince of Wales's philandering, saying he had been \"killed by that dreadful business\". This event had a significant impact on Victoria, leading her to enter a state of mourning, wear black for the remainder of her life, and avoid public appearances.",
    "question_token_count": 28,
    "answer_correctness_score": 10,
    "explanation_validity_score": 10,
    "question_clarity_score": 9,
    "question_difficulty_score": 7,
    "question_groundedness_score": 10,
    "avg_answer_token_count": 12
  },
  {
    "context": "Super Bowl 50 was an American football game to determine the champion of the National Football League (NFL) for the 2015 season. The American Football Conference (AFC) champion Denver Broncos defeated the National Football Conference (NFC) champion Carolina Panthers 24\u201310 to earn their third Super Bowl title. The game was played on February 7, 2016, at Levi's Stadium in the San Francisco Bay Area at Santa Clara, California. As this was the 50th Super Bowl, the league emphasized the \"golden anniversary\" with various gold-themed initiatives, as well as temporarily suspending the tradition of naming each Super Bowl game with Roman numerals (under which the game would have been known as \"Super Bowl L\"), so that the logo could prominently feature the Arabic numerals 50.",
    "topic": "The historical context of the Denver Broncos' third Super Bowl title and its place in the team's overall history and legacy.",
    "response": "<document_analysis>\nThe provided context discusses Super Bowl 50, where the Denver Broncos defeated the Carolina Panthers to earn their third Super Bowl title. The game was played on February 7, 2016, at Levi's Stadium in Santa Clara, California. The league emphasized the \"golden anniversary\" of the Super Bowl with various gold-themed initiatives. To generate a question, we need to consider the historical context of the Denver Broncos' third Super Bowl title and its place in the team's overall history and legacy. \n\nGiven the information, a potential question could explore the significance of this win in the broader context of the Broncos' history. The question should be challenging, requiring a deep understanding of the team's legacy and the impact of this specific Super Bowl win. \n\nOne approach is to consider how this third Super Bowl title reflects on the team's performance over the years, especially in relation to other significant moments or achievements in their history. This could involve understanding the team's previous Super Bowl wins, their overall season performances, and how this particular win contributes to their legacy.\n\nThe difficulty rating for such a question would be high (8 or 9 out of 10), as it requires not just knowledge of the specific event but also an understanding of the team's history and how different events contribute to their overall legacy.\n\nIn terms of question types, an analytical or understanding question would be most appropriate, as it would require the test-taker to think critically about the information provided and its implications for the team's history and legacy.\n\n</document_analysis>\n\n<output_format>\nQuestion: What does the Denver Broncos' third Super Bowl title signify in terms of their legacy and historical performance in the NFL?\nA: It marks the beginning of their dominance in the league.\nB: It solidifies their position as one of the most successful teams in the 21st century.\nC: It underscores their consistency and ability to perform under pressure across different eras.\nD: It is an isolated achievement with little impact on their overall historical standing.\n\nExplanation: The correct answer, \"It underscores their consistency and ability to perform under pressure across different eras,\" requires an understanding of how the third Super Bowl title contributes to the team's legacy, indicating their ability to succeed over time. This answer choice demonstrates a deep understanding of the team's historical performance and the significance of this win.\n\nCorrect Answer: C\n</output_format>",
    "question": "What does the Denver Broncos' third Super Bowl title signify in terms of their legacy and historical performance in the NFL?",
    "choices": {
      "A": "It marks the beginning of their dominance in the league.",
      "B": "It solidifies their position as one of the most successful teams in the 21st century.",
      "C": "It underscores their consistency and ability to perform under pressure across different eras.",
      "D": "It is an isolated achievement with little impact on their overall historical standing."
    },
    "answer": "C",
    "explanation": "The correct answer, \"It underscores their consistency and ability to perform under pressure across different eras,\" requires an understanding of how the third Super Bowl title contributes to the team's legacy, indicating their ability to succeed over time. This answer choice demonstrates a deep understanding of the team's historical performance and the significance of this win.",
    "question_token_count": 24,
    "answer_correctness_score": 10,
    "explanation_validity_score": 10,
    "question_clarity_score": 6,
    "question_difficulty_score": 7,
    "question_groundedness_score": 6,
    "avg_answer_token_count": 15
  },
  {
    "context": "Antibiotics revolutionized medicine in the 20th century, and have together with vaccination led to the near eradication of diseases such as tuberculosis in the developed world. Their effectiveness and easy access led to overuse, especially in livestock raising, prompting bacteria to develop resistance. This has led to widespread problems with antimicrobial and antibiotic resistance, so much as to prompt the World Health Organization to classify antimicrobial resistance as a \"serious threat [that] is no longer a prediction for the future, it is happening right now in every region of the world and has the potential to affect anyone, of any age, in any country\".",
    "topic": "International collaborations and policies aimed at mitigating the threat of antibiotic resistance.",
    "response": "<document_analysis>\nTo generate a highly insightful and probing question-answer pair, a thorough analysis of the provided context is necessary. The context discusses the impact of antibiotics on medicine, the overuse of antibiotics, and the subsequent development of antibiotic resistance in bacteria. It highlights the severity of the issue, citing the World Health Organization's classification of antimicrobial resistance as a serious threat. \n\nThe central idea is the threat posed by antibiotic resistance, which is a result of the overuse of antibiotics. The context implies that this is a global issue, affecting all regions and potentially anyone, regardless of age or country. \n\nUpon examining the context, it becomes clear that the question should focus on the implications of antibiotic resistance, the role of international collaborations, or the policies aimed at mitigating this threat. The question should be designed to encourage deep engagement with the content, critical reflection on the implications, and a clear demonstration of understanding and competency in the domain.\n\nGiven the context, a question that probes the domain expert's knowledge on the policies or strategies for mitigating antibiotic resistance would be highly relevant. The question should be challenging, requiring a deep understanding of the subject matter, and should not be answerable by simply recalling information from the context. \n\nThe difficulty level of the question should be high (8-10), ensuring that it challenges even the smartest domain experts. The question should be self-contained, clear, and concise, with answer options that are plausible and reasonable, yet distinct from one another.\n</document_analysis>\n\n<output_format>\nQuestion: What is a critical strategy that international collaborations can employ to effectively mitigate the threat of antibiotic resistance, considering the complex interplay between human, animal, and environmental health?\nA: Implementing stringent regulations on antibiotic use in human medicine only\nB: Promoting the development and use of antimicrobial stewardship programs across different sectors\nC: Focusing solely on the development of new antibiotics\nD: Encouraging the overuse of antibiotics in livestock to meet immediate food production demands\n\nExplanation: The correct answer, promoting the development and use of antimicrobial stewardship programs, is a comprehensive approach that addresses the multifaceted nature of antibiotic resistance. It involves educating healthcare professionals, farmers, and the public about the appropriate use of antibiotics, monitoring antibiotic use and resistance patterns, and implementing policies to reduce unnecessary antibiotic use. This strategy requires international collaboration and acknowledges the intricate relationships between human, animal, and environmental health.\n\nCorrect Answer: B\n</output_format>",
    "question": "What is a critical strategy that international collaborations can employ to effectively mitigate the threat of antibiotic resistance, considering the complex interplay between human, animal, and environmental health?",
    "choices": {
      "A": "Implementing stringent regulations on antibiotic use in human medicine only",
      "B": "Promoting the development and use of antimicrobial stewardship programs across different sectors",
      "C": "Focusing solely on the development of new antibiotics",
      "D": "Encouraging the overuse of antibiotics in livestock to meet immediate food production demands"
    },
    "answer": "B",
    "explanation": "The correct answer, promoting the development and use of antimicrobial stewardship programs, is a comprehensive approach that addresses the multifaceted nature of antibiotic resistance. It involves educating healthcare professionals, farmers, and the public about the appropriate use of antibiotics, monitoring antibiotic use and resistance patterns, and implementing policies to reduce unnecessary antibiotic use. This strategy requires international collaboration and acknowledges the intricate relationships between human, animal, and environmental health.",
    "question_token_count": 33,
    "answer_correctness_score": 10,
    "explanation_validity_score": 10,
    "question_clarity_score": 8,
    "question_difficulty_score": 9,
    "question_groundedness_score": 2,
    "avg_answer_token_count": 13
  },
  {
    "context": "The main passenger airport serving the metropolis and the state is Melbourne Airport (also called Tullamarine Airport), which is the second busiest in Australia, and the Port of Melbourne is Australia's busiest seaport for containerised and general cargo. Melbourne has an extensive transport network. The main metropolitan train terminus is Flinders Street Station, and the main regional train and coach terminus is Southern Cross Station. Melbourne is also home to Australia's most extensive freeway network and has the world's largest urban tram network.",
    "topic": "A comparative analysis of Melbourne's transportation infrastructure with other major cities in Australia and worldwide, highlighting unique features and best practices.",
    "response": "<document_analysis>\nTo generate a highly insightful and probing question-answer pair, a thorough analysis of the provided context is necessary. The context discusses Melbourne's transportation infrastructure, highlighting its main passenger airport, seaport, and extensive transport network including train terminuses and the world's largest urban tram network.\n\n1. **Thoughtful Content Examination**: The central idea is Melbourne's comprehensive transportation system, including its airport, seaport, train stations, and tram network. Nuanced themes include the comparison of Melbourne's infrastructure to other major cities in terms of busyness and extent of the network.\n\n2. **Concept Exploration**: Implicit assumptions include the importance of efficient transportation for a metropolis and its economy. Subtle details like the specific names of train stations (Flinders Street Station and Southern Cross Station) and the airport (Melbourne Airport or Tullamarine Airport) provide depth. Underlying theories might involve urban planning and logistics. Potential applications include studying best practices for other cities to improve their transportation systems.\n\n3. **Strategic Complexity Calibration**: The difficulty level of the question should be high (8/10) to challenge domain experts. This involves formulating a question that requires not just factual knowledge but also analytical or comparative thinking.\n\n4. **Intentional Question Planning**: The question should invite deeper understanding or meaningful reflection on the implications of Melbourne's transportation infrastructure. For example, considering how its unique features (like the world's largest urban tram network) impact the city's functionality or comparing its seaport's efficiency with others worldwide.\n\nGiven the context's focus on Melbourne's transportation infrastructure and its comparison to other cities, a question that encourages a deep engagement with these concepts and their implications is necessary. The question should be challenging, requiring a synthesis of general understanding beyond the specific details provided in the context.\n</document_analysis>\n\n<output_format>\nQuestion: What characteristic of Melbourne's transportation network is most emblematic of its status as a globally significant urban center, and how does this feature compare to similar infrastructure in other major cities?\nA: Its extensive freeway network, which is among the most complex in the Asia-Pacific region.\nB: The world's largest urban tram network, facilitating comprehensive public transportation.\nC: The busiest seaport in the Southern Hemisphere, surpassing those in Sydney and Brisbane.\nD: Its high-speed rail connections to neighboring cities, setting a precedent for regional transit.\n\nExplanation: The correct answer highlights a unique feature of Melbourne's transportation infrastructure that distinguishes it as a significant urban center. The world's largest urban tram network is emblematic of Melbourne's commitment to public transportation and urban mobility, setting it apart from other cities.\n\nCorrect Answer: B\n</output_format>",
    "question": "What characteristic of Melbourne's transportation network is most emblematic of its status as a globally significant urban center, and how does this feature compare to similar infrastructure in other major cities?",
    "choices": {
      "A": "Its extensive freeway network, which is among the most complex in the Asia-Pacific region.",
      "B": "The world's largest urban tram network, facilitating comprehensive public transportation.",
      "C": "The busiest seaport in the Southern Hemisphere, surpassing those in Sydney and Brisbane.",
      "D": "Its high-speed rail connections to neighboring cities, setting a precedent for regional transit."
    },
    "answer": "B",
    "explanation": "The correct answer highlights a unique feature of Melbourne's transportation infrastructure that distinguishes it as a significant urban center. The world's largest urban tram network is emblematic of Melbourne's commitment to public transportation and urban mobility, setting it apart from other cities.",
    "question_token_count": 36,
    "answer_correctness_score": 10,
    "explanation_validity_score": 9,
    "question_clarity_score": 4,
    "question_difficulty_score": 6,
    "question_groundedness_score": 3,
    "avg_answer_token_count": 17
  },
  {
    "context": "In 1870, republican sentiment in Britain, fed by the Queen's seclusion, was boosted after the establishment of the Third French Republic. A republican rally in Trafalgar Square demanded Victoria's removal, and Radical MPs spoke against her. In August and September 1871, she was seriously ill with an abscess in her arm, which Joseph Lister successfully lanced and treated with his new antiseptic carbolic acid spray. In late November 1871, at the height of the republican movement, the Prince of Wales contracted typhoid fever, the disease that was believed to have killed his father, and Victoria was fearful her son would die. As the tenth anniversary of her husband's death approached, her son's condition grew no better, and Victoria's distress continued. To general rejoicing, he pulled through. Mother and son attended a public parade through London and a grand service of thanksgiving in St Paul's Cathedral on 27 February 1872, and republican feeling subsided.",
    "topic": "The symbolic importance of public parades and royal appearances in maintaining monarchic support during periods of political unrest.",
    "response": "<document_analysis>\nTo generate a highly insightful and probing question-answer pair, a careful analysis of the provided context is necessary. The central idea of the context revolves around the symbolic importance of public parades and royal appearances in maintaining monarchic support during periods of political unrest in Britain, specifically during Queen Victoria's reign. The context highlights a period of republican sentiment and the Queen's strategic use of public appearances to counter such sentiments.\n\nThe key elements in the context include the Queen's seclusion, the establishment of the Third French Republic, a republican rally in Trafalgar Square, the Queen's illness, the Prince of Wales's typhoid fever, and the public parade and service of thanksgiving that followed his recovery. These events are intricately linked to the maintenance of monarchic support and the dampening of republican feelings through strategic public appearances.\n\nUpon examination, it becomes clear that the context provides a nuanced exploration of how monarchic figures can leverage public events and appearances to influence public opinion and maintain support during challenging political times. The difficulty rating of the question should be high (8/10) to challenge domain experts and encourage deep engagement with the content.\n\nGiven the context and the goal of generating a question that inspires thoughtful engagement and requires a deep understanding of the topic, the question should be designed to probe the strategic importance of public appearances in monarchies, particularly in times of political unrest. The question should be self-contained, clear, and concise, with answer options that are plausible yet challenging to distinguish from one another.\n</document_analysis>\n\n<output_format>\nQuestion: What strategic benefit do public parades and royal appearances offer monarchies during periods of political unrest?\nA: They serve to undermine republican movements by showcasing the monarch's military strength.\nB: They provide an opportunity for the monarch to directly address and alleviate public concerns, thereby bolstering support.\nC: They allow monarchs to symbolically reconnect with their subjects, potentially dampening dissent through displays of unity and celebration.\nD: They are primarily used to distract the public from political issues by creating spectacles that divert attention.\n\nExplanation: The correct answer, C, reflects the idea that public parades and royal appearances can be used by monarchs to symbolically reconnect with their subjects, showcasing unity and potentially reducing dissent. This is evident in the context where the Queen and the Prince of Wales's public appearance after his recovery led to a subsiding of republican feelings. The other options, while plausible, do not accurately capture the strategic benefit of such appearances as described in the context.\n\nCorrect Answer: C\n</output_format>",
    "question": "What strategic benefit do public parades and royal appearances offer monarchies during periods of political unrest?",
    "choices": {
      "A": "They serve to undermine republican movements by showcasing the monarch's military strength.",
      "B": "They provide an opportunity for the monarch to directly address and alleviate public concerns, thereby bolstering support.",
      "C": "They allow monarchs to symbolically reconnect with their subjects, potentially dampening dissent through displays of unity and celebration.",
      "D": "They are primarily used to distract the public from political issues by creating spectacles that divert attention."
    },
    "answer": "C",
    "explanation": "The correct answer, C, reflects the idea that public parades and royal appearances can be used by monarchs to symbolically reconnect with their subjects, showcasing unity and potentially reducing dissent. This is evident in the context where the Queen and the Prince of Wales's public appearance after his recovery led to a subsiding of republican feelings. The other options, while plausible, do not accurately capture the strategic benefit of such appearances as described in the context.",
    "question_token_count": 20,
    "answer_correctness_score": 10,
    "explanation_validity_score": 10,
    "question_clarity_score": 8,
    "question_difficulty_score": 7,
    "question_groundedness_score": 9,
    "avg_answer_token_count": 20
  },
  {
    "context": "Antibiotics revolutionized medicine in the 20th century, and have together with vaccination led to the near eradication of diseases such as tuberculosis in the developed world. Their effectiveness and easy access led to overuse, especially in livestock raising, prompting bacteria to develop resistance. This has led to widespread problems with antimicrobial and antibiotic resistance, so much as to prompt the World Health Organization to classify antimicrobial resistance as a \"serious threat [that] is no longer a prediction for the future, it is happening right now in every region of the world and has the potential to affect anyone, of any age, in any country\".",
    "topic": "The historical significance of antibiotics in the 20th century and their impact on the eradication of diseases such as tuberculosis.",
    "response": "<document_analysis>\nThe provided context discusses the significant impact of antibiotics on medicine in the 20th century, particularly in the eradication of diseases like tuberculosis. It highlights the overuse of antibiotics, especially in livestock, leading to antimicrobial and antibiotic resistance, which the World Health Organization considers a serious global threat. To generate a challenging question, we need to delve into the nuances of antibiotic resistance, its implications, and the historical context of disease eradication.\n\nThoughtful content examination reveals that the central idea is the double-edged sword of antibiotics: while they have been instrumental in eradicating diseases, their overuse has led to a significant global health issue. Concept exploration suggests considering the underlying factors contributing to antibiotic resistance, such as misuse in human medicine and agriculture, and the potential consequences of this resistance on public health.\n\nStrategic complexity calibration rates the difficulty of the question as an 8 out of 10, given the need to understand both the historical significance of antibiotics and the complex issue of antibiotic resistance. Intentional question planning aims to invite a deeper understanding of the interplay between antibiotic use, disease eradication, and the emergence of resistance.\n\nGiven the context, a meaningful and challenging question can be crafted to probe the domain expert's understanding of the historical and current implications of antibiotic use and resistance.\n</document_analysis>\n\n<output_format>\nQuestion: What is the primary factor contributing to the development of antibiotic resistance, as highlighted by the global health community in response to the historical overuse of antibiotics in both human and veterinary medicine?\nA: Inadequate public health infrastructure\nB: Misuse and overuse of antibiotics in human medicine and agriculture\nC: Lack of investment in antibiotic research and development\nD: Insufficient awareness campaigns about the risks of antibiotic resistance\n\nExplanation: The correct answer is supported by the context, which mentions the overuse of antibiotics, especially in livestock, as a primary cause of antibiotic resistance. This is further emphasized by the World Health Organization's classification of antimicrobial resistance as a serious global threat.\n\nCorrect Answer: B\n</output_format>",
    "question": "What is the primary factor contributing to the development of antibiotic resistance, as highlighted by the global health community in response to the historical overuse of antibiotics in both human and veterinary medicine?",
    "choices": {
      "A": "Inadequate public health infrastructure",
      "B": "Misuse and overuse of antibiotics in human medicine and agriculture",
      "C": "Lack of investment in antibiotic research and development",
      "D": "Insufficient awareness campaigns about the risks of antibiotic resistance"
    },
    "answer": "B",
    "explanation": "The correct answer is supported by the context, which mentions the overuse of antibiotics, especially in livestock, as a primary cause of antibiotic resistance. This is further emphasized by the World Health Organization's classification of antimicrobial resistance as a serious global threat.",
    "question_token_count": 37,
    "answer_correctness_score": 10,
    "explanation_validity_score": 10,
    "question_clarity_score": 6,
    "question_difficulty_score": 7,
    "question_groundedness_score": 8,
    "avg_answer_token_count": 10
  },
  {
    "context": "Gladstone returned to power after the 1892 general election; he was 82 years old. Victoria objected when Gladstone proposed appointing the Radical MP Henry Labouchere to the Cabinet, so Gladstone agreed not to appoint him. In 1894, Gladstone retired and, without consulting the outgoing prime minister, Victoria appointed Lord Rosebery as prime minister. His government was weak, and the following year Lord Salisbury replaced him. Salisbury remained prime minister for the remainder of Victoria's reign.",
    "topic": "The significance of Gladstone's return to power at the age of 82 after the 1892 general election and its implications for British politics.",
    "response": "<document_analysis>\nTo generate a highly insightful and probing question-answer pair, a careful analysis of the provided context is necessary. The central idea of the context revolves around Gladstone's return to power at the age of 82 after the 1892 general election and its implications for British politics. \n\nThoughtful content examination reveals that Gladstone's appointment and subsequent actions, such as proposing Henry Labouchere for the Cabinet, were significant. However, the context also highlights the limitations of Gladstone's power, as evidenced by Victoria's objection to Labouchere's appointment. \n\nConcept exploration indicates that Gladstone's return to power at an advanced age and the dynamics between Gladstone and Victoria are crucial aspects. The underlying theory here could be the balance of power between the prime minister and the monarch during that period. \n\nStrategic complexity calibration suggests that the question should be rated an 8 out of 10 in terms of difficulty, as it requires understanding the nuances of British political history and the specific circumstances of Gladstone's return to power.\n\nIntentional question planning involves creating a question that invites deeper understanding and critical engagement. A potential question could explore the implications of Gladstone's return to power on the British political landscape, considering the monarch's influence and the transition of power that followed his retirement.\n</document_analysis>\n\n<output_format>\nQuestion: What was the primary consequence of Gladstone's retirement in 1894 for the British government?\nA: It led to a period of political instability with frequent changes in prime ministers.\nB: It resulted in the immediate appointment of Lord Salisbury as prime minister.\nC: It allowed for the monarch, Victoria, to appoint Lord Rosebery without consulting the outgoing prime minister.\nD: It marked the beginning of a coalition government between the Radicals and the Conservatives.\nExplanation: The correct answer requires understanding the sequence of events following Gladstone's retirement, as described in the context. The key point is that Victoria appointed Lord Rosebery as prime minister without consulting Gladstone, indicating a significant aspect of the transition of power.\nCorrect Answer: C\n</output_format>",
    "question": "What was the primary consequence of Gladstone's retirement in 1894 for the British government?",
    "choices": {
      "A": "It led to a period of political instability with frequent changes in prime ministers.",
      "B": "It resulted in the immediate appointment of Lord Salisbury as prime minister.",
      "C": "It allowed for the monarch, Victoria, to appoint Lord Rosebery without consulting the outgoing prime minister.",
      "D": "It marked the beginning of a coalition government between the Radicals and the Conservatives."
    },
    "answer": "C",
    "explanation": "The correct answer requires understanding the sequence of events following Gladstone's retirement, as described in the context. The key point is that Victoria appointed Lord Rosebery as prime minister without consulting Gladstone, indicating a significant aspect of the transition of power.",
    "question_token_count": 20,
    "answer_correctness_score": 10,
    "explanation_validity_score": 10,
    "question_clarity_score": 8,
    "question_difficulty_score": 6,
    "question_groundedness_score": 8,
    "avg_answer_token_count": 17
  },
  {
    "context": "Fr\u00e9d\u00e9ric Fran\u00e7ois Chopin (/\u02c8\u0283o\u028ap\u00e6n/; French pronunciation: \u200b[f\u0281e.de.\u0281ik f\u0281\u0251\u0303.swa \u0283\u0254.p\u025b\u0303]; 22 February or 1 March 1810 \u2013 17 October 1849), born Fryderyk Franciszek Chopin,[n 1] was a Polish and French (by citizenship and birth of father) composer and a virtuoso pianist of the Romantic era, who wrote primarily for the solo piano. He gained and has maintained renown worldwide as one of the leading musicians of his era, whose \"poetic genius was based on a professional technique that was without equal in his generation.\" Chopin was born in what was then the Duchy of Warsaw, and grew up in Warsaw, which after 1815 became part of Congress Poland. A child prodigy, he completed his musical education and composed his earlier works in Warsaw before leaving Poland at the age of 20, less than a month before the outbreak of the November 1830 Uprising.",
    "topic": "The circumstances surrounding Chopin's departure from Poland at the age of 20 and its relation to the November 1830 Uprising.",
    "response": "<document_analysis>\nThe provided context revolves around the life and background of Fr\u00e9d\u00e9ric Fran\u00e7ois Chopin, a renowned Polish and French composer and pianist of the Romantic era. To generate a question that is both challenging and insightful regarding the circumstances surrounding Chopin's departure from Poland at the age of 20 and its relation to the November 1830 Uprising, we must carefully analyze the given information.\n\nFirst, it's essential to understand that Chopin left Poland at a critical moment in its history, less than a month before the outbreak of the November 1830 Uprising. This uprising was a significant event in Polish history, reflecting the nation's struggle for independence and self-governance. Chopin's departure, therefore, is not just a personal event but also a historical one, potentially influenced by or influencing the political and social climate of the time.\n\nGiven this context, a thoughtful and challenging question would need to delve into the motivations behind Chopin's departure, the impact of the uprising on his decision, or how his departure reflects or influences his later work and reputation. However, the provided context does not explicitly discuss the motivations or direct influences of the uprising on Chopin's decision to leave. It merely states that he left less than a month before the uprising, implying a potential but unexplored connection.\n\nTherefore, a question that encourages deeper thought and reflection might consider the broader implications of Chopin's departure in relation to his career, personal life, and the historical context of Poland during that time. It's crucial to craft a question that is answerable based on general knowledge of Chopin's life and historical context, without requiring specific details from the provided context that are not present.\n\nConsidering these aspects, the question should aim to explore the intersection of Chopin's personal and professional life with historical events, inviting the respondent to demonstrate a nuanced understanding of both the individual's experiences and the broader historical context in which they lived.\n</document_analysis>\n\n<output_format>\nQuestion: What significant historical event occurred in Poland less than a month after Chopin's departure from the country at the age of 20, and how might this event have influenced his decision to leave or his subsequent career?\nA: The January 1831 Uprising\nB: The November 1830 Uprising\nC: The Polish-Russian War\nD: The Congress of Vienna\n\nExplanation: The correct answer is based on the understanding that Chopin left Poland at a pivotal moment in its history. The November 1830 Uprising was a crucial event in Poland's struggle for independence, and its occurrence shortly after Chopin's departure suggests a potential connection between the political climate and his personal decisions. This question requires the respondent to demonstrate knowledge of Chopin's biography and its intersection with historical events.\n\nCorrect Answer: B\n</output_format>",
    "question": "What significant historical event occurred in Poland less than a month after Chopin's departure from the country at the age of 20, and how might this event have influenced his decision to leave or his subsequent career?",
    "choices": {
      "A": "The January 1831 Uprising",
      "B": "The November 1830 Uprising",
      "C": "The Polish-Russian War",
      "D": "The Congress of Vienna"
    },
    "answer": "B",
    "explanation": "The correct answer is based on the understanding that Chopin left Poland at a pivotal moment in its history. The November 1830 Uprising was a crucial event in Poland's struggle for independence, and its occurrence shortly after Chopin's departure suggests a potential connection between the political climate and his personal decisions. This question requires the respondent to demonstrate knowledge of Chopin's biography and its intersection with historical events.",
    "question_token_count": 42,
    "answer_correctness_score": 10,
    "explanation_validity_score": 9,
    "question_clarity_score": 6,
    "question_difficulty_score": 7,
    "question_groundedness_score": 9,
    "avg_answer_token_count": 6
  },
  {
    "context": "The Broncos took an early lead in Super Bowl 50 and never trailed. Newton was limited by Denver's defense, which sacked him seven times and forced him into three turnovers, including a fumble which they recovered for a touchdown. Denver linebacker Von Miller was named Super Bowl MVP, recording five solo tackles, 2\u00bd sacks, and two forced fumbles.",
    "topic": "The role of early leads in football games, such as the one taken by the Broncos, and how they influence subsequent team strategies and player performances.",
    "response": "<document_analysis>\nTo generate a highly insightful and probing question-answer pair, we must carefully analyze the provided context. The central idea of the context revolves around the Broncos' early lead in Super Bowl 50 and its impact on the game's outcome, particularly on the performance of the opposing team's key player, Newton, and the strategies employed by both teams. \n\nThe context highlights the crucial role of Denver's defense in securing their win, mentioning the sacking of Newton seven times, forcing him into three turnovers, and the recovery of a fumble for a touchdown. It also mentions Von Miller's outstanding performance, which earned him the Super Bowl MVP title.\n\nGiven this information, we need to explore concepts that delve into the strategic implications of taking an early lead in football games, such as Super Bowl 50, and how this influences subsequent team strategies and player performances. \n\nThe question should be designed to encourage deep engagement with the content, critical reflection on the implications of early leads, and a clear demonstration of understanding and competency in football strategies and their psychological impacts on players.\n\nConsidering the difficulty level, we aim for a question that is highly challenging, around an 8 or 9 out of 10, ensuring it requires a nuanced understanding of football tactics, team dynamics, and psychological factors affecting player performance.\n\nAfter thoughtful consideration, the planned question will invite analysis of how early leads, like the one taken by the Broncos, influence team strategies and player performances, focusing on the psychological and tactical adjustments made in response to such leads.\n</document_analysis>\n\n<output_format>\nQuestion: What strategic adjustment is most likely made by a team that falls behind early in a game, like the Panthers in Super Bowl 50, in terms of play-calling and risk tolerance?\nA: They become more conservative in their play-calling to minimize further losses.\nB: They increase their aggressiveness in play-calling and become more risk-tolerant to quickly close the gap.\nC: They maintain their original game plan without significant adjustments.\nD: They focus solely on defensive strategies to prevent further scoring.\n\nExplanation: Falling behind early in a game often prompts teams to reassess their strategy, typically leading to more aggressive play-calling and a higher tolerance for risk. This is because the urgency to score and close the gap increases, making teams more likely to attempt riskier plays that could result in larger gains but also in turnovers or losses if unsuccessful.\n\nCorrect Answer: B\n</output_format>",
    "question": "What strategic adjustment is most likely made by a team that falls behind early in a game, like the Panthers in Super Bowl 50, in terms of play-calling and risk tolerance?",
    "choices": {
      "A": "They become more conservative in their play-calling to minimize further losses.",
      "B": "They increase their aggressiveness in play-calling and become more risk-tolerant to quickly close the gap.",
      "C": "They maintain their original game plan without significant adjustments.",
      "D": "They focus solely on defensive strategies to prevent further scoring."
    },
    "answer": "B",
    "explanation": "Falling behind early in a game often prompts teams to reassess their strategy, typically leading to more aggressive play-calling and a higher tolerance for risk. This is because the urgency to score and close the gap increases, making teams more likely to attempt riskier plays that could result in larger gains but also in turnovers or losses if unsuccessful.",
    "question_token_count": 38,
    "answer_correctness_score": 10,
    "explanation_validity_score": 10,
    "question_clarity_score": 8,
    "question_difficulty_score": 7,
    "question_groundedness_score": 6,
    "avg_answer_token_count": 15
  },
  {
    "context": "Despite waiving longtime running back DeAngelo Williams and losing top wide receiver Kelvin Benjamin to a torn ACL in the preseason, the Carolina Panthers had their best regular season in franchise history, becoming the seventh team to win at least 15 regular season games since the league expanded to a 16-game schedule in 1978. Carolina started the season 14\u20130, not only setting franchise records for the best start and the longest single-season winning streak, but also posting the best start to a season by an NFC team in NFL history, breaking the 13\u20130 record previously shared with the 2009 New Orleans Saints and the 2011 Green Bay Packers. With their NFC-best 15\u20131 regular season record, the Panthers clinched home-field advantage throughout the NFC playoffs for the first time in franchise history. Ten players were selected to the Pro Bowl (the most in franchise history) along with eight All-Pro selections.",
    "topic": "The broader implications of the Panthers' successful season for the NFL, including effects on fan engagement, league competitiveness, and future team strategies.",
    "response": "<document_analysis>\nTo generate a highly insightful and probing question-answer pair, a thorough analysis of the provided context is necessary. The context discusses the Carolina Panthers' successful season, highlighting their best regular season in franchise history, despite facing significant challenges such as the loss of key players. The team's achievements include setting franchise records for the best start and the longest single-season winning streak, as well as securing home-field advantage throughout the NFC playoffs for the first time.\n\nThe central idea of this context is the Panthers' historic season and its implications for the team and the league. Nuanced themes include the impact of player losses, the significance of setting records, and the importance of home-field advantage in the playoffs. Significant relationships within the context involve the connection between the team's performance and their standings in the league, as well as the recognition of individual players through Pro Bowl and All-Pro selections.\n\nConcept exploration reveals implicit assumptions about the importance of team resilience, strategic planning, and player talent in achieving success. Underlying theories might include the idea that a strong team culture and effective leadership can overcome significant obstacles, and that a dominant regular season performance can set a team up for postseason success. Potential applications of this information could involve future team strategies, such as how to build a resilient team and how to capitalize on a strong regular season.\n\nStrategic complexity calibration suggests that this question should be rated highly in terms of difficulty, likely an 8 or 9 out of 10, as it requires a deep understanding of the NFL, team dynamics, and strategic planning. Intentional question planning involves crafting a question that invites deeper understanding and critical engagement, ensuring the question is purposeful and challenging.\n\nGiven the context, a question that probes the broader implications of the Panthers' successful season for the NFL could involve the potential effects on fan engagement, league competitiveness, and future team strategies. This question should be designed to encourage thoughtful engagement and require a high level of understanding of the subject matter.\n</document_analysis>\n\n<output_format>\nQuestion: What potential strategic adjustment might NFL teams consider in response to the Panthers' historic season, particularly in terms of balancing player talent with team resilience?\nA: Focusing solely on acquiring high-profile free agents to immediately improve roster strength.\nB: Investing in depth and versatility across the roster to better withstand injuries and other setbacks.\nC: Prioritizing the development of a strong team culture over strategic player acquisitions.\nD: Adopting a more conservative approach to player contracts to minimize financial risk.\n\nExplanation: The correct answer requires an understanding of the implications of the Panthers' season, including the importance of team resilience and strategic planning. The Panthers' success despite significant player losses highlights the value of depth and versatility in withstanding setbacks, making option B the most appropriate strategic adjustment for other teams to consider.\n\nCorrect Answer: B\n</output_format>",
    "question": "What potential strategic adjustment might NFL teams consider in response to the Panthers' historic season, particularly in terms of balancing player talent with team resilience?",
    "choices": {
      "A": "Focusing solely on acquiring high-profile free agents to immediately improve roster strength.",
      "B": "Investing in depth and versatility across the roster to better withstand injuries and other setbacks.",
      "C": "Prioritizing the development of a strong team culture over strategic player acquisitions.",
      "D": "Adopting a more conservative approach to player contracts to minimize financial risk."
    },
    "answer": "B",
    "explanation": "The correct answer requires an understanding of the implications of the Panthers' season, including the importance of team resilience and strategic planning. The Panthers' success despite significant player losses highlights the value of depth and versatility in withstanding setbacks, making option B the most appropriate strategic adjustment for other teams to consider.",
    "question_token_count": 29,
    "answer_correctness_score": 10,
    "explanation_validity_score": 10,
    "question_clarity_score": 6,
    "question_difficulty_score": 7,
    "question_groundedness_score": 5,
    "avg_answer_token_count": 16
  },
  {
    "context": "The game's media day, which was typically held on the Tuesday afternoon prior to the game, was moved to the Monday evening and re-branded as Super Bowl Opening Night. The event was held on February 1, 2016 at SAP Center in San Jose. Alongside the traditional media availabilities, the event featured an opening ceremony with player introductions on a replica of the Golden Gate Bridge.",
    "topic": "The selection of the SAP Center in San Jose as the venue for Super Bowl Opening Night and its potential impact on local engagement and economic benefits.",
    "response": "<document_analysis>\nThe provided context discusses the relocation and rebranding of the traditional Super Bowl media day to Super Bowl Opening Night, held at the SAP Center in San Jose. This event was a part of the pre-game festivities for Super Bowl 50 and included an opening ceremony with player introductions on a replica of the Golden Gate Bridge. To generate a meaningful and challenging question, we need to consider the potential impact of selecting the SAP Center as the venue for this event, focusing on local engagement and economic benefits.\n\nThoughtful content examination reveals that the event's move to the SAP Center could have significant implications for local businesses and community engagement. The choice of venue might influence the level of participation and enthusiasm from the local population, potentially affecting the overall economic impact of the event. \n\nConcept exploration suggests considering the underlying factors that could contribute to the success of the event in terms of local engagement and economic benefits. These might include the venue's capacity, accessibility, and the appeal of the event's format, including the opening ceremony and media availabilities.\n\nStrategic complexity calibration rates the difficulty of understanding these dynamics as high (8/10), given the need to synthesize information about event management, local economics, and community engagement.\n\nIntentional question planning aims to craft a question that invites reflection on the strategic decision-making behind choosing the SAP Center and its potential consequences. The question should be purposeful, encouraging deep understanding and insight into the event's organization and its effects on the local community.\n</document_analysis>\n\n<output_format>\nQuestion: What primary factor would most significantly influence the economic benefits to the local community resulting from hosting Super Bowl Opening Night at the SAP Center in San Jose?\nA: The number of out-of-town visitors attending the event\nB: The overall attendance capacity of the SAP Center\nC: The level of local business involvement in event sponsorship and services\nD: The duration of the event and its associated festivities\nExplanation: The level of local business involvement in event sponsorship and services would be crucial as it directly impacts how much of the spending associated with the event stays within the local economy, benefiting local businesses and contributing to economic growth.\nCorrect Answer: C\n</output_format>",
    "question": "What primary factor would most significantly influence the economic benefits to the local community resulting from hosting Super Bowl Opening Night at the SAP Center in San Jose?",
    "choices": {
      "A": "The number of out-of-town visitors attending the event",
      "B": "The overall attendance capacity of the SAP Center",
      "C": "The level of local business involvement in event sponsorship and services",
      "D": "The duration of the event and its associated festivities"
    },
    "answer": "C",
    "explanation": "The level of local business involvement in event sponsorship and services would be crucial as it directly impacts how much of the spending associated with the event stays within the local economy, benefiting local businesses and contributing to economic growth.",
    "question_token_count": 30,
    "answer_correctness_score": 9,
    "explanation_validity_score": 9,
    "question_clarity_score": 6,
    "question_difficulty_score": 7,
    "question_groundedness_score": 3,
    "avg_answer_token_count": 11
  },
  {
    "context": "The league eventually narrowed the bids to three sites: New Orleans' Mercedes-Benz Superdome, Miami's Sun Life Stadium, and the San Francisco Bay Area's Levi's Stadium.",
    "topic": "The role of logistical considerations, such as accessibility and accommodation options, in the selection of event venues like those in New Orleans, Miami, and the San Francisco Bay Area.",
    "response": "<document_analysis>\nTo generate a highly insightful and probing question-answer pair, we must carefully analyze the provided context. The central idea here is the selection of event venues, specifically the narrowing down of bids to three sites: New Orleans' Mercedes-Benz Superdome, Miami's Sun Life Stadium, and the San Francisco Bay Area's Levi's Stadium. \n\nUpon examining the context, it becomes apparent that logistical considerations such as accessibility and accommodation options are crucial in the selection of event venues. However, the provided text does not explicitly mention these factors. Therefore, we must infer their importance based on general knowledge of event planning.\n\nThe question should encourage a deep engagement with the content, critically reflecting on implications and demonstrating a clear understanding of the role logistical considerations play in venue selection. \n\nGiven the information provided and the need to create a question that is both challenging and relevant to domain experts, we should consider how logistical factors influence the decision-making process in selecting venues like those mentioned.\n\nStrategic complexity calibration suggests that a question rating an 8 out of 10 in terms of difficulty would be appropriate, as it needs to challenge even the smartest domain experts without being unanswerable.\n\nIntentional question planning involves crafting a question that invites deeper understanding and meaningful reflection on the part of the respondent. This could involve exploring the trade-offs between different logistical considerations or evaluating the relative importance of accessibility versus accommodation options in the context of large event venues.\n</document_analysis>\n\n<output_format>\nQuestion: What logistical factor is most critical for event organizers to consider when selecting between venues like the Mercedes-Benz Superdome, Sun Life Stadium, and Levi's Stadium, and why?\nA: Proximity to major transportation hubs\nB: Availability of on-site parking\nC: Quality of in-stadium amenities\nD: Compliance with ADA accessibility standards\nExplanation: The correct answer, proximity to major transportation hubs, is critical because it directly impacts the accessibility of the venue for attendees, which in turn affects the overall success of the event. While all options are important, transportation proximity is fundamental in ensuring that a large number of attendees can easily reach the venue.\nCorrect Answer: A\n</output_format>",
    "question": "What logistical factor is most critical for event organizers to consider when selecting between venues like the Mercedes-Benz Superdome, Sun Life Stadium, and Levi's Stadium, and why?",
    "choices": {
      "A": "Proximity to major transportation hubs",
      "B": "Availability of on-site parking",
      "C": "Quality of in-stadium amenities",
      "D": "Compliance with ADA accessibility standards"
    },
    "answer": "A",
    "explanation": "The correct answer, proximity to major transportation hubs, is critical because it directly impacts the accessibility of the venue for attendees, which in turn affects the overall success of the event. While all options are important, transportation proximity is fundamental in ensuring that a large number of attendees can easily reach the venue.",
    "question_token_count": 37,
    "answer_correctness_score": 9,
    "explanation_validity_score": 9,
    "question_clarity_score": 6,
    "question_difficulty_score": 5,
    "question_groundedness_score": 1,
    "avg_answer_token_count": 6
  },
  {
    "context": "CBS broadcast Super Bowl 50 in the U.S., and charged an average of $5 million for a 30-second commercial during the game. The Super Bowl 50 halftime show was headlined by the British rock group Coldplay with special guest performers Beyonc\u00e9 and Bruno Mars, who headlined the Super Bowl XLVII and Super Bowl XLVIII halftime shows, respectively. It was the third-most watched U.S. broadcast ever.",
    "topic": "The evolution of the Super Bowl halftime show over the years, including changes in performer selection, production quality, and audience reception.",
    "response": "<document_analysis>\nThe provided context discusses Super Bowl 50, its broadcasting, commercial costs, and the halftime show. To generate a question that encourages deep engagement and reflection, we need to analyze the central ideas, nuances, and significant relationships within this context. \n\nThe key elements here include the broadcaster (CBS), the cost of commercials ($5 million for 30 seconds), the headliner of the halftime show (Coldplay), and the special guest performers (Beyonc\u00e9 and Bruno Mars). The fact that it was the third-most watched U.S. broadcast ever adds to the significance of the event.\n\nTo create a challenging question, we should consider the evolution of the Super Bowl halftime show, changes in performer selection, production quality, and audience reception over the years. The question should be thought-provoking, requiring the synthesis of high-level general understanding beyond the specific context of Super Bowl 50.\n\nGiven the information, a potential question could delve into the strategic selection of performers for the halftime show, considering factors like audience appeal, past performances, and the overall production quality. It's also important to ensure the question is self-contained, clear, and does not give away the answer.\n\nUpon careful consideration, the question should invite a deep understanding of the content, reflecting meaningful objectives and genuine content comprehension. The answer options should be plausible, distinct, and challenging, with at least one incorrect option being subtly wrong.\n\n</document_analysis>\n\n<output_format>\nQuestion: What factor is most critical in selecting the headlining performers for the Super Bowl halftime show, considering the event's massive audience and high production standards?\nA: The performer's ability to appeal to a broad demographic audience.\nB: The performer's recent chart-topping releases and trending popularity.\nC: The performer's experience in handling large-scale, high-pressure live performances.\nD: The performer's willingness to perform for a lower fee than their usual rate.\nExplanation: The correct answer requires an understanding of the Super Bowl halftime show's nature, which demands performers who can handle the immense pressure and expectations of a live, massive-scale event. While appealing to a broad audience and having recent popularity are important, the ability to deliver under high pressure is crucial.\nCorrect Answer: C\n</output_format>",
    "question": "What factor is most critical in selecting the headlining performers for the Super Bowl halftime show, considering the event's massive audience and high production standards?",
    "choices": {
      "A": "The performer's ability to appeal to a broad demographic audience.",
      "B": "The performer's recent chart-topping releases and trending popularity.",
      "C": "The performer's experience in handling large-scale, high-pressure live performances.",
      "D": "The performer's willingness to perform for a lower fee than their usual rate."
    },
    "answer": "C",
    "explanation": "The correct answer requires an understanding of the Super Bowl halftime show's nature, which demands performers who can handle the immense pressure and expectations of a live, massive-scale event. While appealing to a broad audience and having recent popularity are important, the ability to deliver under high pressure is crucial.",
    "question_token_count": 31,
    "answer_correctness_score": 10,
    "explanation_validity_score": 10,
    "question_clarity_score": 8,
    "question_difficulty_score": 8,
    "question_groundedness_score": 2,
    "avg_answer_token_count": 14
  },
  {
    "context": "Fr\u00e9d\u00e9ric Fran\u00e7ois Chopin (/\u02c8\u0283o\u028ap\u00e6n/; French pronunciation: \u200b[f\u0281e.de.\u0281ik f\u0281\u0251\u0303.swa \u0283\u0254.p\u025b\u0303]; 22 February or 1 March 1810 \u2013 17 October 1849), born Fryderyk Franciszek Chopin,[n 1] was a Polish and French (by citizenship and birth of father) composer and a virtuoso pianist of the Romantic era, who wrote primarily for the solo piano. He gained and has maintained renown worldwide as one of the leading musicians of his era, whose \"poetic genius was based on a professional technique that was without equal in his generation.\" Chopin was born in what was then the Duchy of Warsaw, and grew up in Warsaw, which after 1815 became part of Congress Poland. A child prodigy, he completed his musical education and composed his earlier works in Warsaw before leaving Poland at the age of 20, less than a month before the outbreak of the November 1830 Uprising.",
    "topic": "The comparison of Chopin's musical education in Warsaw to the standards of musical education during the Romantic era.",
    "response": "<document_analysis>\nTo generate a question that compares Chopin's musical education in Warsaw to the standards of musical education during the Romantic era, we must first identify the key elements of Chopin's education and the broader context of musical education during that time. The provided context mentions that Chopin completed his musical education and composed his earlier works in Warsaw before leaving Poland at the age of 20. However, it does not provide detailed information about the specifics of his education or how it compared to the standards of the Romantic era.\n\nGiven the lack of explicit comparison in the provided context, we must consider what is known about musical education during the Romantic era and how Chopin's experiences might have aligned with or diverged from these standards. Musical education during the Romantic era was characterized by a focus on technical proficiency, composition, and performance, often within the context of conservatories or under the tutelage of renowned musicians.\n\nTo craft a question that encourages deep engagement and nuanced understanding, we should consider the implications of Chopin's educational background on his compositional style and how it reflects or challenges the norms of musical education during his time. \n\nThe difficulty level of the question should be high (8-10), requiring the respondent to have a deep understanding of both Chopin's biography and the broader musical educational landscape of the Romantic era.\n\n</document_analysis>\n\n<output_format>\nQuestion: What aspect of Chopin's musical education in Warsaw would have been most influential in shaping his unique compositional voice within the context of Romantic era musical standards?\nA: Emphasis on folk music incorporation\nB: Rigorous training in classical piano repertoire\nC: Focus on operatic composition\nD: Experimentation with orchestral conducting\n\nExplanation: Chopin's education in Warsaw, particularly his exposure to and incorporation of Polish folk music elements, would have significantly contributed to his distinctive compositional style. This aspect of his education aligns with the Romantic era's interest in nationalism and folk culture, setting him apart from other composers of his time.\n\nCorrect Answer: A\n</output_format>",
    "question": "What aspect of Chopin's musical education in Warsaw would have been most influential in shaping his unique compositional voice within the context of Romantic era musical standards?",
    "choices": {
      "A": "Emphasis on folk music incorporation",
      "B": "Rigorous training in classical piano repertoire",
      "C": "Focus on operatic composition",
      "D": "Experimentation with orchestral conducting"
    },
    "answer": "A",
    "explanation": "Chopin's education in Warsaw, particularly his exposure to and incorporation of Polish folk music elements, would have significantly contributed to his distinctive compositional style. This aspect of his education aligns with the Romantic era's interest in nationalism and folk culture, setting him apart from other composers of his time.",
    "question_token_count": 31,
    "answer_correctness_score": 9,
    "explanation_validity_score": 9,
    "question_clarity_score": 7,
    "question_difficulty_score": 8,
    "question_groundedness_score": 4,
    "avg_answer_token_count": 7
  },
  {
    "context": "The Broncos defeated the Pittsburgh Steelers in the divisional round, 23\u201316, by scoring 11 points in the final three minutes of the game. They then beat the defending Super Bowl XLIX champion New England Patriots in the AFC Championship Game, 20\u201318, by intercepting a pass on New England's 2-point conversion attempt with 17 seconds left on the clock. Despite Manning's problems with interceptions during the season, he didn't throw any in their two playoff games.",
    "topic": "The analysis of Manning's performance during the season, including his problems with interceptions, and how it compares to his interception-free playoff games.",
    "response": "<document_analysis>\nTo generate a highly insightful and probing question-answer pair, I will carefully analyze the provided context. The central idea of the context is the Broncos' performance in the playoffs, specifically their victories over the Pittsburgh Steelers and the New England Patriots. A nuanced theme within this context is Peyton Manning's performance, particularly his ability to avoid throwing interceptions in the playoff games despite struggling with this issue during the season. \n\nThe context implies that Manning's improvement in avoiding interceptions was crucial to the Broncos' success in the playoffs. The underlying theory here could be that Manning's experience and ability to perform under pressure allowed him to adapt and improve his game in critical situations. \n\nGiven the information and the goal to create a challenging question, I will rate the difficulty of the question as an 8 out of 10, ensuring it is highly technical and encourages deep engagement with the content. The question should invite reflection on Manning's performance and its implications for the team's success.\n\nA potential question could explore the factors contributing to Manning's interception-free playoff games, considering his season-long struggles with interceptions. This would require the test-taker to think critically about Manning's performance, the team's strategy, and the pressures of playoff games.\n\n</document_analysis>\n\n<output_format>\nQuestion: What factor likely contributed most significantly to Peyton Manning's ability to avoid throwing interceptions in the playoff games?\nA: Increased practice time focusing on interception avoidance\nB: Adaptation of the team's offense to minimize long passes\nC: Manning's experience and ability to perform under pressure\nD: The defensive strategies employed by the Steelers and Patriots\n\nExplanation: The correct answer, \"Manning's experience and ability to perform under pressure,\" suggests that his veteran status and capacity to handle high-pressure situations were key to avoiding interceptions in the playoffs. This answer requires an understanding of Manning's career and performance under pressure, as well as the implications of his interception-free playoff games on the team's success.\n\nCorrect Answer: C\n</output_format>",
    "question": "What factor likely contributed most significantly to Peyton Manning's ability to avoid throwing interceptions in the playoff games?",
    "choices": {
      "A": "Increased practice time focusing on interception avoidance",
      "B": "Adaptation of the team's offense to minimize long passes",
      "C": "Manning's experience and ability to perform under pressure",
      "D": "The defensive strategies employed by the Steelers and Patriots"
    },
    "answer": "C",
    "explanation": "The correct answer, \"Manning's experience and ability to perform under pressure,\" suggests that his veteran status and capacity to handle high-pressure situations were key to avoiding interceptions in the playoffs. This answer requires an understanding of Manning's career and performance under pressure, as well as the implications of his interception-free playoff games on the team's success.",
    "question_token_count": 22,
    "answer_correctness_score": 9,
    "explanation_validity_score": 9,
    "question_clarity_score": 1,
    "question_difficulty_score": 6,
    "question_groundedness_score": 1,
    "avg_answer_token_count": 10
  },
  {
    "context": "The league announced on October 16, 2012, that the two finalists were Sun Life Stadium and Levi's Stadium. The South Florida/Miami area has previously hosted the event 10 times (tied for most with New Orleans), with the most recent one being Super Bowl XLIV in 2010. The San Francisco Bay Area last hosted in 1985 (Super Bowl XIX), held at Stanford Stadium in Stanford, California, won by the home team 49ers. The Miami bid depended on whether the stadium underwent renovations. However, on May 3, 2013, the Florida legislature refused to approve the funding plan to pay for the renovations, dealing a significant blow to Miami's chances.",
    "topic": "The factors that influence the selection of a host stadium for the Super Bowl, including historical hosting experience, stadium condition, and financial support.",
    "response": "<document_analysis>\nThe provided context discusses the selection of a host stadium for the Super Bowl, specifically focusing on the 2012 announcement of Sun Life Stadium and Levi's Stadium as finalists. Historical hosting experience, stadium condition, and financial support are key factors influencing this selection. The South Florida/Miami area has a rich history of hosting the Super Bowl, with 10 previous events, while the San Francisco Bay Area last hosted in 1985. The Miami bid was contingent upon stadium renovations, which were ultimately not funded by the Florida legislature, negatively impacting Miami's chances.\n\nThoughtful content examination reveals that the NFL considers multiple factors when selecting a host stadium, including past experience and the condition of the stadium. Concept exploration suggests that financial support is crucial, as evidenced by the impact of the Florida legislature's decision on Miami's bid. Strategic complexity calibration rates the difficulty of understanding these factors as an 8 out of 10, given the need to consider multiple variables and their interplay. Intentional question planning aims to craft a question that invites deeper understanding of these factors and their implications for host stadium selection.\n</document_analysis>\n\n<output_format>\nQuestion: What is the primary factor that can significantly disadvantage a stadium's bid to host the Super Bowl, despite its historical hosting experience?\nA: Lack of financial support\nB: Insufficient seating capacity\nC: Poor location\nD: Limited parking facilities\nExplanation: The correct answer, lack of financial support, is evident from the context where the Miami bid was negatively impacted by the refusal of funding for renovations. This factor outweighs historical experience, as seen in the case of the South Florida/Miami area, which had hosted the event 10 times but still needed renovations to remain a viable candidate.\nCorrect Answer: A\n</output_format>",
    "question": "What is the primary factor that can significantly disadvantage a stadium's bid to host the Super Bowl, despite its historical hosting experience?",
    "choices": {
      "A": "Lack of financial support",
      "B": "Insufficient seating capacity",
      "C": "Poor location",
      "D": "Limited parking facilities"
    },
    "answer": "A",
    "explanation": "The correct answer, lack of financial support, is evident from the context where the Miami bid was negatively impacted by the refusal of funding for renovations. This factor outweighs historical experience, as seen in the case of the South Florida/Miami area, which had hosted the event 10 times but still needed renovations to remain a viable candidate.",
    "question_token_count": 26,
    "answer_correctness_score": 10,
    "explanation_validity_score": 10,
    "question_clarity_score": 6,
    "question_difficulty_score": 6,
    "question_groundedness_score": 9,
    "avg_answer_token_count": 4
  },
  {
    "context": "At the age of 21 he settled in Paris. Thereafter, during the last 18 years of his life, he gave only some 30 public performances, preferring the more intimate atmosphere of the salon. He supported himself by selling his compositions and teaching piano, for which he was in high demand. Chopin formed a friendship with Franz Liszt and was admired by many of his musical contemporaries, including Robert Schumann. In 1835 he obtained French citizenship. After a failed engagement to Maria Wodzi\u0144ska, from 1837 to 1847 he maintained an often troubled relationship with the French writer George Sand. A brief and unhappy visit to Majorca with Sand in 1838\u201339 was one of his most productive periods of composition. In his last years, he was financially supported by his admirer Jane Stirling, who also arranged for him to visit Scotland in 1848. Through most of his life, Chopin suffered from poor health. He died in Paris in 1849, probably of tuberculosis.",
    "topic": "The financial and emotional support provided by Jane Stirling in Chopin's last years and its effect on his well-being and productivity.",
    "response": "<document_analysis>\nTo generate a highly insightful and probing question-answer pair, a thoughtful analysis of the provided context is necessary. The central idea of the context revolves around the life of Chopin, focusing on his career, personal relationships, and health issues. \n\nA key aspect of the context is the financial and emotional support provided by Jane Stirling during Chopin's last years. This support is crucial as it directly impacts his well-being and productivity. \n\nConsidering the implicit assumptions and subtle details, it's clear that Chopin's life was marked by both creative brilliance and personal struggles, including health issues and tumultuous relationships. The support from Jane Stirling emerges as a significant factor in his later life, suggesting a positive impact on his ability to continue composing despite his health challenges.\n\nThe difficulty of the question should be calibrated to ensure it is highly challenging, requiring a deep understanding of the context and its implications. Thus, a question that probes the specifics of Jane Stirling's support and its effects on Chopin's well-being and productivity would be appropriate.\n\nGiven the context, a question that encourages deep engagement and critical reflection could involve the nature of Jane Stirling's support and how it influenced Chopin's final years. This would require the synthesis of information about Chopin's life, his relationship with Jane Stirling, and the broader context of his health and productivity.\n\nThoughtfully, the question should be designed to inspire genuine curiosity and reflection, without giving away the answer or being too obvious. It should also ensure that all answer options are plausible and reasonable, with at least one incorrect answer being subtly wrong.\n\nThe correct answer should reflect a deep understanding of the content, demonstrating competency in the topic domain. The question and answer should be self-contained, clear, and concise, with a conversational tone that is engaging and appropriate for instructional purposes.\n</document_analysis>\n\n<output_format>\nQuestion: What was the primary way in which Jane Stirling's support influenced Chopin's life during his final years?\nA: By introducing him to new musical influences\nB: By providing financial assistance that enabled him to compose more freely\nC: By helping him secure more public performances\nD: By facilitating his travel to new locations for inspiration\n\nExplanation: Jane Stirling's support was crucial for Chopin as it provided him with the financial stability he needed to focus on his compositions without the burden of financial stress, especially during a time when his health was declining.\n\nCorrect Answer: B\n</output_format>",
    "question": "What was the primary way in which Jane Stirling's support influenced Chopin's life during his final years?",
    "choices": {
      "A": "By introducing him to new musical influences",
      "B": "By providing financial assistance that enabled him to compose more freely",
      "C": "By helping him secure more public performances",
      "D": "By facilitating his travel to new locations for inspiration"
    },
    "answer": "B",
    "explanation": "Jane Stirling's support was crucial for Chopin as it provided him with the financial stability he needed to focus on his compositions without the burden of financial stress, especially during a time when his health was declining.",
    "question_token_count": 21,
    "answer_correctness_score": 10,
    "explanation_validity_score": 10,
    "question_clarity_score": 8,
    "question_difficulty_score": 6,
    "question_groundedness_score": 8,
    "avg_answer_token_count": 9
  },
  {
    "context": "The Broncos took an early lead in Super Bowl 50 and never trailed. Newton was limited by Denver's defense, which sacked him seven times and forced him into three turnovers, including a fumble which they recovered for a touchdown. Denver linebacker Von Miller was named Super Bowl MVP, recording five solo tackles, 2\u00bd sacks, and two forced fumbles.",
    "topic": "Evaluation of Newton's performance under pressure from Denver's defense, including his ability to adapt and overcome defensive strategies.",
    "response": "<document_analysis>\nTo generate a highly insightful and probing question-answer pair, I will conduct a thorough analysis of the provided context. The central idea of the context is the performance of Newton in Super Bowl 50, particularly under pressure from Denver's defense. The key points include Newton being limited by Denver's defense, being sacked seven times, and forced into three turnovers. Additionally, Von Miller's outstanding performance as a linebacker is highlighted, earning him the Super Bowl MVP award.\n\nConsidering implicit assumptions and subtle details, it is clear that Denver's defensive strategy was effective in containing Newton. The context also implies that Newton struggled to adapt and overcome the defensive pressure. The underlying theory here could be related to the importance of a strong defense in high-pressure games like the Super Bowl.\n\nGiven the information and the goal to create a challenging question, I will rate the difficulty level as 8 out of 10. The question should invite deeper understanding and critical engagement, focusing on Newton's performance under pressure and the effectiveness of Denver's defense.\n\nThe thought process behind the question generation involves identifying the key factors that contributed to Newton's limited performance and how Denver's defense exploited his weaknesses. The question should be purposeful, encouraging the domain expert to reflect on the strategic aspects of the game and the players' performances.\n\nIn terms of irrelevant or bogus information, there is none apparent in the provided context. The information is coherent, educationally valuable, and directly related to the topic of Newton's performance in Super Bowl 50.\n\nThe decision criteria for question generation are met, as the context contains meaningful and relevant content. Therefore, I will proceed to generate a question-answer pair based on the analysis.\n</document_analysis>\n\n<output_format>\nQuestion: What defensive tactic is most likely to be employed by a team like Denver to neutralize a mobile quarterback like Newton, considering the success of their strategy in Super Bowl 50?\nA: Blitzing with defensive backs\nB: Utilizing a strong pass rush with linebackers\nC: Employing man-to-man coverage with cornerbacks\nD: Playing a prevent defense with deep safeties\n\nExplanation: The correct answer is based on the information provided in the context, which highlights Denver's successful defensive strategy against Newton in Super Bowl 50. The key to their success was the strong pass rush, particularly from linebackers like Von Miller, who recorded 2\u00bd sacks and forced two fumbles. This tactic would be most effective in neutralizing a mobile quarterback like Newton, as it puts pressure on him quickly and limits his ability to escape and make plays outside of the pocket.\n\nCorrect Answer: B\n</output_format>",
    "question": "What defensive tactic is most likely to be employed by a team like Denver to neutralize a mobile quarterback like Newton, considering the success of their strategy in Super Bowl 50?",
    "choices": {
      "A": "Blitzing with defensive backs",
      "B": "Utilizing a strong pass rush with linebackers",
      "C": "Employing man-to-man coverage with cornerbacks",
      "D": "Playing a prevent defense with deep safeties"
    },
    "answer": "B",
    "explanation": "The correct answer is based on the information provided in the context, which highlights Denver's successful defensive strategy against Newton in Super Bowl 50. The key to their success was the strong pass rush, particularly from linebackers like Von Miller, who recorded 2\u00bd sacks and forced two fumbles. This tactic would be most effective in neutralizing a mobile quarterback like Newton, as it puts pressure on him quickly and limits his ability to escape and make plays outside of the pocket.",
    "question_token_count": 35,
    "answer_correctness_score": 10,
    "explanation_validity_score": 10,
    "question_clarity_score": 6,
    "question_difficulty_score": 7,
    "question_groundedness_score": 8,
    "avg_answer_token_count": 9
  },
  {
    "context": "The main passenger airport serving the metropolis and the state is Melbourne Airport (also called Tullamarine Airport), which is the second busiest in Australia, and the Port of Melbourne is Australia's busiest seaport for containerised and general cargo. Melbourne has an extensive transport network. The main metropolitan train terminus is Flinders Street Station, and the main regional train and coach terminus is Southern Cross Station. Melbourne is also home to Australia's most extensive freeway network and has the world's largest urban tram network.",
    "topic": "Future development plans for Melbourne's transportation infrastructure, including potential expansions, technological innovations, and sustainability initiatives.",
    "response": "<document_analysis>\nTo generate a highly insightful and probing question-answer pair, a thorough analysis of the provided context is necessary. The context discusses Melbourne's transportation infrastructure, highlighting key components such as Melbourne Airport, the Port of Melbourne, and the city's extensive train, tram, and freeway networks. \n\nGiven the topic of future development plans for Melbourne's transportation infrastructure, the analysis should focus on potential expansions, technological innovations, and sustainability initiatives that could be integrated into the existing network. \n\nA thoughtful examination reveals that while the context provides a solid foundation for understanding Melbourne's current transportation infrastructure, it does not explicitly mention future plans or initiatives. However, this omission presents an opportunity to craft a question that encourages deep engagement with the content, critical reflection on implications, and clear demonstration of understanding and competency in the domain of transportation infrastructure development.\n\nThe question should be designed to challenge even the smartest domain experts, requiring a synthesis of high-level general understanding beyond the specific context provided. Considering the emphasis on future development, the question could explore potential strategies for enhancing sustainability, incorporating technological innovations, or expanding the network to meet growing demands.\n\nAfter careful consideration, a question that fits these criteria can be formulated, focusing on the application of general knowledge about transportation infrastructure development to the specific case of Melbourne, without requiring direct reference to the provided context.\n</document_analysis>\n\n<output_format>\nQuestion: What technological innovation could potentially be integrated into Melbourne's tram network to significantly enhance its sustainability and efficiency?\nA: Implementing advanced solar panel roofs on trams\nB: Introduction of hydrogen fuel cell technology\nC: Upgrading to fully autonomous tram operation\nD: Implementing advanced regenerative braking systems\n\nExplanation: The correct answer, implementing advanced regenerative braking systems, is a technological innovation that can significantly enhance the sustainability and efficiency of a tram network. Regenerative braking systems capture kinetic energy and convert it into electrical energy, which can then be used to power the tram, thereby reducing energy consumption and emissions. This technology is plausible, reasonable, and aligns with sustainability and efficiency goals. The other options, while potentially beneficial, are either less directly applicable to enhancing sustainability and efficiency in the context of tram networks or are more complex and less readily implementable solutions.\n\nCorrect Answer: D\n</output_format>",
    "question": "What technological innovation could potentially be integrated into Melbourne's tram network to significantly enhance its sustainability and efficiency?",
    "choices": {
      "A": "Implementing advanced solar panel roofs on trams",
      "B": "Introduction of hydrogen fuel cell technology",
      "C": "Upgrading to fully autonomous tram operation",
      "D": "Implementing advanced regenerative braking systems"
    },
    "answer": "D",
    "explanation": "The correct answer, implementing advanced regenerative braking systems, is a technological innovation that can significantly enhance the sustainability and efficiency of a tram network. Regenerative braking systems capture kinetic energy and convert it into electrical energy, which can then be used to power the tram, thereby reducing energy consumption and emissions. This technology is plausible, reasonable, and aligns with sustainability and efficiency goals. The other options, while potentially beneficial, are either less directly applicable to enhancing sustainability and efficiency in the context of tram networks or are more complex and less readily implementable solutions.",
    "question_token_count": 21,
    "answer_correctness_score": 10,
    "explanation_validity_score": 10,
    "question_clarity_score": 8,
    "question_difficulty_score": 6,
    "question_groundedness_score": 1,
    "avg_answer_token_count": 8
  },
  {
    "context": "Antibiotics are screened for any negative effects on humans or other mammals before approval for clinical use, and are usually considered safe and most are well tolerated. However, some antibiotics have been associated with a range of adverse side effects. Side-effects range from mild to very serious depending on the antibiotics used, the microbial organisms targeted, and the individual patient. Side effects may reflect the pharmacological or toxicological properties of the antibiotic or may involve hypersensitivity reactions or anaphylaxis. Safety profiles of newer drugs are often not as well established as for those that have a long history of use. Adverse effects range from fever and nausea to major allergic reactions, including photodermatitis and anaphylaxis. Common side-effects include diarrhea, resulting from disruption of the species composition in the intestinal flora, resulting, for example, in overgrowth of pathogenic bacteria, such as Clostridium difficile. Antibacterials can also affect the vaginal flora, and may lead to overgrowth of yeast species of the genus Candida in the vulvo-vaginal area. Additional side-effects can result from interaction with other drugs, such as elevated risk of tendon damage from administration of a quinolone antibiotic with a systemic corticosteroid. Some scientists have hypothesized that the indiscriminate use of antibiotics alter the host microbiota and this has been associated with chronic disease.",
    "topic": "The common side effects of antibiotics, including diarrhea and disruption of intestinal flora.",
    "response": "<document_analysis>\nThe provided context discusses the common side effects of antibiotics, including diarrhea and disruption of intestinal flora. To generate a highly insightful and probing question-answer pair, I will conduct a thorough analysis of the context.\n\nFirstly, I will identify the central ideas and nuanced themes within the context. The text highlights that antibiotics can have adverse side effects, ranging from mild to serious, and that these effects can be due to the pharmacological or toxicological properties of the antibiotic or hypersensitivity reactions. The context also mentions that common side effects include diarrhea, resulting from disruption of the intestinal flora, and that antibacterials can affect the vaginal flora, leading to overgrowth of yeast species.\n\nNext, I will consider implicit assumptions, subtle details, and underlying theories within the context. One assumption is that the use of antibiotics can have long-term consequences on the host microbiota, potentially leading to chronic disease. A subtle detail is that the safety profiles of newer drugs are not as well established as those with a long history of use.\n\nTo calibrate the complexity of the question, I will rate the difficulty level as 8 out of 10, ensuring that the question is challenging for domain experts. The question should invite deeper understanding, meaningful reflection, or critical engagement with the content.\n\nAfter careful consideration, I have planned a question that meets the requirements. The question is designed to be thought-provoking, encouraging the domain expert to think critically about the implications of antibiotic use on the host microbiota.\n</document_analysis>\n\n<output_format>\nQuestion: What is a potential long-term consequence of the indiscriminate use of antibiotics on the host microbiota?\nA: Development of antibiotic-resistant bacterial strains\nB: Increased risk of acute infections\nC: Association with chronic disease\nD: Enhancement of the immune system\n\nExplanation: The correct answer, \"Association with chronic disease\", is supported by the context, which mentions that some scientists have hypothesized that the indiscriminate use of antibiotics alters the host microbiota and this has been associated with chronic disease. The other options are plausible but incorrect, with option A being a well-known consequence of antibiotic overuse, option B being a potential short-term consequence, and option D being the opposite of the actual effect.\n\nCorrect Answer: C\n</output_format>",
    "question": "What is a potential long-term consequence of the indiscriminate use of antibiotics on the host microbiota?",
    "choices": {
      "A": "Development of antibiotic-resistant bacterial strains",
      "B": "Increased risk of acute infections",
      "C": "Association with chronic disease",
      "D": "Enhancement of the immune system"
    },
    "answer": "C",
    "explanation": "The correct answer, \"Association with chronic disease\", is supported by the context, which mentions that some scientists have hypothesized that the indiscriminate use of antibiotics alters the host microbiota and this has been associated with chronic disease. The other options are plausible but incorrect, with option A being a well-known consequence of antibiotic overuse, option B being a potential short-term consequence, and option D being the opposite of the actual effect.",
    "question_token_count": 21,
    "answer_correctness_score": 10,
    "explanation_validity_score": 10,
    "question_clarity_score": 8,
    "question_difficulty_score": 7,
    "question_groundedness_score": 9,
    "avg_answer_token_count": 6
  },
  {
    "context": "The Broncos defeated the Pittsburgh Steelers in the divisional round, 23\u201316, by scoring 11 points in the final three minutes of the game. They then beat the defending Super Bowl XLIX champion New England Patriots in the AFC Championship Game, 20\u201318, by intercepting a pass on New England's 2-point conversion attempt with 17 seconds left on the clock. Despite Manning's problems with interceptions during the season, he didn't throw any in their two playoff games.",
    "topic": "The role of Manning's leadership in the Broncos' success during the playoff games, including his ability to perform under pressure and avoid interceptions.",
    "response": "<document_analysis>\nThe provided context discusses the Denver Broncos' success in the playoff games, specifically highlighting their victories over the Pittsburgh Steelers and the New England Patriots. The key aspect of this context is Peyton Manning's leadership and his ability to perform under pressure, particularly his avoidance of interceptions in these crucial games. \n\nTo generate a question that probes domain expert knowledge, we must consider the implications of Manning's performance and the significance of his ability to avoid interceptions in the context of the Broncos' overall success. The question should encourage a deep understanding of the relationship between Manning's leadership, his performance under pressure, and the team's outcome in the playoff games.\n\nGiven the information, a thoughtful question could explore the strategic importance of Manning's interception-free performance in the playoffs, considering the high-pressure nature of these games and the potential impact of interceptions on the team's chances of winning.\n\nThe difficulty level of this question should be high (8-10), as it requires the synthesis of information about Manning's performance, the team's strategy, and the implications of his actions on the game's outcome. The question should be designed to challenge even the most knowledgeable domain experts, inviting them to reflect on the nuances of Manning's leadership and its contribution to the Broncos' success.\n</document_analysis>\n\n<output_format>\nQuestion: What critical aspect of Peyton Manning's performance was most instrumental in the Broncos' playoff victories, considering the high stakes and pressure of those games?\nA: His ability to throw touchdown passes in the final minutes of the game\nB: His capacity to avoid interceptions and maintain possession\nC: His skill in reading defensive formations and calling audibles\nD: His speed and agility in escaping sacks and making runs\n\nExplanation: The correct answer, \"His capacity to avoid interceptions and maintain possession,\" is supported by the context, which highlights Manning's avoidance of interceptions as a key factor in the Broncos' success. This aspect of his performance is critical because interceptions can significantly impact the momentum and outcome of a game, especially in high-pressure playoff situations.\n\nCorrect Answer: B\n</output_format>",
    "question": "What critical aspect of Peyton Manning's performance was most instrumental in the Broncos' playoff victories, considering the high stakes and pressure of those games?",
    "choices": {
      "A": "His ability to throw touchdown passes in the final minutes of the game",
      "B": "His capacity to avoid interceptions and maintain possession",
      "C": "His skill in reading defensive formations and calling audibles",
      "D": "His speed and agility in escaping sacks and making runs"
    },
    "answer": "B",
    "explanation": "The correct answer, \"His capacity to avoid interceptions and maintain possession,\" is supported by the context, which highlights Manning's avoidance of interceptions as a key factor in the Broncos' success. This aspect of his performance is critical because interceptions can significantly impact the momentum and outcome of a game, especially in high-pressure playoff situations.",
    "question_token_count": 29,
    "answer_correctness_score": 10,
    "explanation_validity_score": 10,
    "question_clarity_score": 1,
    "question_difficulty_score": 5,
    "question_groundedness_score": 1,
    "avg_answer_token_count": 11
  },
  {
    "context": "The game's media day, which was typically held on the Tuesday afternoon prior to the game, was moved to the Monday evening and re-branded as Super Bowl Opening Night. The event was held on February 1, 2016 at SAP Center in San Jose. Alongside the traditional media availabilities, the event featured an opening ceremony with player introductions on a replica of the Golden Gate Bridge.",
    "topic": "The re-branding of the Super Bowl's media day event to Super Bowl Opening Night and its implications for player and team exposure.",
    "response": "<document_analysis>\nThe provided context discusses the re-branding of the Super Bowl's media day event to Super Bowl Opening Night. This change was implemented in 2016, with the event being moved from Tuesday afternoon to Monday evening. The event included traditional media availabilities, as well as an opening ceremony featuring player introductions on a replica of the Golden Gate Bridge. \n\nUpon examining the context, it becomes clear that the re-branding of the event is aimed at increasing player and team exposure. By moving the event to the evening and adding an opening ceremony, the NFL is attempting to create a more spectacle-driven experience that can attract a wider audience. This could have significant implications for how players and teams are perceived by the public, as well as how they choose to present themselves.\n\nThe difficulty level of the question should be around 8 out of 10, as it requires an understanding of the context and the potential implications of the event's re-branding. \n\nA thoughtful question that encourages deeper understanding and insight into the topic could be: What is the primary motivation behind the NFL's decision to re-brand the Super Bowl's media day event as Super Bowl Opening Night, and how might this impact player and team exposure?\n</document_analysis>\n\n<output_format>\nQuestion: What is the primary motivation behind re-branding the Super Bowl's media day event, and how might this impact player exposure?\nA: To reduce player fatigue and minimize media obligations.\nB: To increase player and team exposure through a more spectacle-driven experience.\nC: To accommodate scheduling conflicts with other major sporting events.\nD: To decrease the overall cost of hosting the event.\n\nExplanation: The correct answer, B, suggests that the re-branding is aimed at creating a more engaging experience that can attract a wider audience, thereby increasing player and team exposure. This is supported by the context, which highlights the addition of an opening ceremony and the move to a more prime-time slot.\n\nCorrect Answer: B\n</output_format>",
    "question": "What is the primary motivation behind re-branding the Super Bowl's media day event, and how might this impact player exposure?",
    "choices": {
      "A": "To reduce player fatigue and minimize media obligations.",
      "B": "To increase player and team exposure through a more spectacle-driven experience.",
      "C": "To accommodate scheduling conflicts with other major sporting events.",
      "D": "To decrease the overall cost of hosting the event."
    },
    "answer": "B",
    "explanation": "The correct answer, B, suggests that the re-branding is aimed at creating a more engaging experience that can attract a wider audience, thereby increasing player and team exposure. This is supported by the context, which highlights the addition of an opening ceremony and the move to a more prime-time slot.",
    "question_token_count": 26,
    "answer_correctness_score": 9,
    "explanation_validity_score": 9,
    "question_clarity_score": 8,
    "question_difficulty_score": 6,
    "question_groundedness_score": 4,
    "avg_answer_token_count": 11
  },
  {
    "context": "After a lengthy period of formal racial segregation in the former Confederacy following the Reconstruction Era, and bans on interracial marriage in various parts of the country, more people are openly forming interracial unions. In addition, social conditions have changed and many multiracial people do not believe it is socially advantageous to try to \"pass\" as white. Diverse immigration has brought more mixed-race people into the United States, such as the large population of Hispanics identifying as mestizos. Since the 1980s, the United States has had a growing multiracial identity movement (cf. Loving Day). Because more Americans have insisted on being allowed to acknowledge their mixed racial origins, the 2000 census for the first time allowed residents to check more than one ethno-racial identity and thereby identify as multiracial. In 2008 Barack Obama was elected as the first multiracial President of the United States; he acknowledges both sides of his family and identifies as African American.",
    "topic": "The intersection of multiracial identity with other social categories, such as ethnicity, class, and gender.",
    "response": "<document_analysis>\nThe context provided explores the intersection of multiracial identity with other social categories, discussing historical and contemporary aspects of interracial relationships and multiracial identification in the United States. Key points include the shift away from racial segregation, changes in social attitudes towards interracial unions, and the growing recognition of multiracial identities, culminating in the 2000 census allowing individuals to identify with more than one ethno-racial category. The analysis highlights the increasing visibility and acceptance of multiracial individuals, symbolized by the election of Barack Obama, the first multiracial President of the United States. \n\nGiven the complexity and the nuances of multiracial identity, the question should delve into the implications of these shifts on societal structures and individual identities, requiring a deep understanding of the interplay between race, ethnicity, class, and gender. The difficulty rating for such a question would be high (8-10), as it necessitates not only an understanding of the historical and contemporary context of multiracial identity but also the ability to analyze the broader social implications of these changes.\n\nThe rationale behind the question generation is to encourage thoughtful engagement with the content, prompting the respondent to consider the multifaceted nature of identity and its intersectionality. By doing so, the question aims to assess the respondent's ability to think critically about the societal and personal implications of multiracial identity, reflecting a high level of competency in understanding the topic domain.\n</document_analysis>\n\n<output_format>\nQuestion: How does the increasing recognition and acceptance of multiracial identities in the United States reflect and challenge traditional notions of race, ethnicity, and social categorization?\nA: It reinforces binary racial classifications.\nB: It highlights the fluidity and complexity of racial and ethnic identities.\nC: It diminishes the importance of racial categorization altogether.\nD: It solely impacts political representations without affecting social attitudes.\n\nExplanation: The correct answer, B, acknowledges the complexity and fluidity introduced by multiracial identities, challenging the traditional, more rigid classifications of race and ethnicity. This choice requires an understanding of how multiracial identities intersect with and complicate existing social categories.\n\nCorrect Answer: B\n</output_format>",
    "question": "How does the increasing recognition and acceptance of multiracial identities in the United States reflect and challenge traditional notions of race, ethnicity, and social categorization?",
    "choices": {
      "A": "It reinforces binary racial classifications.",
      "B": "It highlights the fluidity and complexity of racial and ethnic identities.",
      "C": "It diminishes the importance of racial categorization altogether.",
      "D": "It solely impacts political representations without affecting social attitudes."
    },
    "answer": "B",
    "explanation": "The correct answer, B, acknowledges the complexity and fluidity introduced by multiracial identities, challenging the traditional, more rigid classifications of race and ethnicity. This choice requires an understanding of how multiracial identities intersect with and complicate existing social categories.",
    "question_token_count": 32,
    "answer_correctness_score": 10,
    "explanation_validity_score": 10,
    "question_clarity_score": 9,
    "question_difficulty_score": 8,
    "question_groundedness_score": 4,
    "avg_answer_token_count": 11
  },
  {
    "context": "In June 1837 Chopin visited London incognito in the company of the piano manufacturer Camille Pleyel where he played at a musical soir\u00e9e at the house of English piano maker James Broadwood. On his return to Paris, his association with Sand began in earnest, and by the end of June 1838 they had become lovers. Sand, who was six years older than the composer, and who had had a series of lovers, wrote at this time: \"I must say I was confused and amazed at the effect this little creature had on me ... I have still not recovered from my astonishment, and if I were a proud person I should be feeling humiliated at having been carried away ...\" The two spent a miserable winter on Majorca (8 November 1838 to 13 February 1839), where, together with Sand's two children, they had journeyed in the hope of improving the health of Chopin and that of Sand's 15-year-old son Maurice, and also to escape the threats of Sand's former lover F\u00e9licien Mallefille. After discovering that the couple were not married, the deeply traditional Catholic people of Majorca became inhospitable, making accommodation difficult to find. This compelled the group to take lodgings in a former Carthusian monastery in Valldemossa, which gave little shelter from the cold winter weather.",
    "topic": "The ways in which the relationship between Chopin and Sand reflects or challenges the societal norms of their time, particularly regarding marriage, love, and the roles of men and women.",
    "response": "<document_analysis>\nThe context provided revolves around the relationship between Chopin and Sand, set against the backdrop of societal norms of their time. To generate a question that reflects or challenges these norms, particularly regarding marriage, love, and the roles of men and women, it's crucial to analyze the key elements of their relationship as presented. \n\nFirstly, the fact that Sand was six years older than Chopin and had a series of lovers before him already challenges traditional societal norms of the time, where women were expected to be younger and less experienced than their male partners. Additionally, the societal reaction to their unmarried status in Majorca highlights the strict expectations around marriage and cohabitation.\n\nGiven these considerations, a thoughtful question would need to delve into the implications of their relationship on the societal norms, requiring a deep understanding of the historical context and the challenges faced by individuals, particularly women, who did not conform to these norms.\n\nThe difficulty level of such a question should be high (8/10), as it requires not only an understanding of the specific relationship dynamics between Chopin and Sand but also a broader knowledge of the societal norms of the time and how they impacted personal relationships.\n\nThe question should encourage a nuanced understanding of how historical figures navigated and sometimes challenged the societal expectations of their era, reflecting on the implications of their actions for our understanding of love, marriage, and gender roles today.\n</document_analysis>\n\n<output_format>\nQuestion: What societal norm did the relationship between Chopin and Sand most directly challenge, given the context of their time?\nA: The expectation of women to prioritize domestic duties over personal relationships\nB: The tradition of men being the primary initiators in romantic relationships\nC: The requirement for couples to be married before cohabiting\nD: The convention that men should be older and more experienced than their female partners\n\nExplanation: The correct answer, C, reflects the direct challenge posed by Chopin and Sand's relationship to the societal norm of requiring marriage before cohabitation, as evidenced by the inhospitable reaction they faced in Majorca upon discovery of their unmarried status.\n\nCorrect Answer: C\n</output_format>",
    "question": "What societal norm did the relationship between Chopin and Sand most directly challenge, given the context of their time?",
    "choices": {
      "A": "The expectation of women to prioritize domestic duties over personal relationships",
      "B": "The tradition of men being the primary initiators in romantic relationships",
      "C": "The requirement for couples to be married before cohabiting",
      "D": "The convention that men should be older and more experienced than their female partners"
    },
    "answer": "C",
    "explanation": "The correct answer, C, reflects the direct challenge posed by Chopin and Sand's relationship to the societal norm of requiring marriage before cohabitation, as evidenced by the inhospitable reaction they faced in Majorca upon discovery of their unmarried status.",
    "question_token_count": 23,
    "answer_correctness_score": 10,
    "explanation_validity_score": 10,
    "question_clarity_score": 7,
    "question_difficulty_score": 6,
    "question_groundedness_score": 8,
    "avg_answer_token_count": 13
  },
  {
    "context": "The Hellenistic period covers the period of ancient Greek (Hellenic) history and Mediterranean history between the death of Alexander the Great in 323 BC and the emergence of the Roman Empire as signified by the Battle of Actium in 31 BC and the subsequent conquest of Ptolemaic Egypt the following year. At this time, Greek cultural influence and power was at its peak in Europe, Africa and Asia, experiencing prosperity and progress in the arts, exploration, literature, theatre, architecture, music, mathematics, philosophy, and science. For example, competitive public games took place, ideas in biology, and popular entertainment in theaters. It is often considered a period of transition, sometimes even of decadence or degeneration, compared to the enlightenment of the Greek Classical era. The Hellenistic period saw the rise of New Comedy, Alexandrian poetry, the Septuagint and the philosophies of Stoicism and Epicureanism. Greek Science was advanced by the works of the mathematician Euclid and the polymath Archimedes. The religious sphere expanded to include new gods such as the Greco-Egyptian Serapis, eastern deities such as Attis and Cybele and the Greek adoption of Buddhism.",
    "topic": "The role of Alexander the Great's death in marking the beginning of the Hellenistic period and the subsequent power struggles that shaped the Mediterranean world.",
    "response": "<document_analysis>\nTo generate a highly insightful and probing question-answer pair, a thorough analysis of the provided context is necessary. The context discusses the Hellenistic period, which began with the death of Alexander the Great in 323 BC and ended with the emergence of the Roman Empire in 31 BC. This period is characterized by the peak of Greek cultural influence and power in Europe, Africa, and Asia, marked by significant advancements in various fields such as arts, literature, philosophy, and science.\n\nThe key elements to consider include the historical timeline, the cultural and scientific achievements of the Hellenistic period, and the transition from the Classical era to a period often viewed as one of decadence or degeneration. The rise of new philosophical schools like Stoicism and Epicureanism, along with advancements in mathematics by Euclid and the works of Archimedes, are notable aspects of this era.\n\nGiven the complexity and breadth of the Hellenistic period, a question that encourages deep engagement and critical reflection should ideally touch upon the nuances of its cultural, philosophical, or scientific developments, and how these elements interacted to shape the Mediterranean world.\n\nA potential question could delve into the implications of Alexander's death on the subsequent power struggles and how these influenced the cultural and scientific landscape of the Hellenistic world. However, to ensure the question is highly challenging and requires a deep understanding of the subject matter, it should be crafted to invite a thoughtful consideration of the period's complexities and the interplay between its various aspects.\n\nConsidering the above analysis, the difficulty level of the question should be rated high (8-10) to challenge even the smartest domain experts. The question should be designed to test not just factual knowledge but the ability to synthesize information, understand implications, and critically evaluate the significance of historical events and cultural movements.\n\nThe thought process behind generating the question involves identifying the central ideas and significant relationships within the context, exploring implicit assumptions and subtle details, and calibrating the complexity to ensure the question is highly challenging yet answerable by a domain expert without referencing the context paragraph.\n\n</document_analysis>\n\n<output_format>\nQuestion: What significant cultural and philosophical shift occurred during the Hellenistic period that reflected both a continuity with and a departure from the ideals of the Greek Classical era?\nA: The rise of Athenian democracy\nB: The emergence of Stoicism and Epicureanism as dominant philosophical schools\nC: The decline of theatrical performances and public games\nD: The exclusive adoption of Buddhism throughout the Mediterranean\n\nExplanation: The correct answer, B, reflects the Hellenistic period's characteristic philosophical developments, which included the rise of Stoicism and Epicureanism. These schools of thought represented a shift from the Classical era's focus on politics and civic virtue, emphasizing instead individual virtue, self-sufficiency, and the pursuit of happiness. This shift signifies both a continuity with the Greek tradition of philosophical inquiry and a departure from the Classical ideals, as it adapted to the changed political and social landscape of the Hellenistic world.\n\nCorrect Answer: B\n</output_format>",
    "question": "What significant cultural and philosophical shift occurred during the Hellenistic period that reflected both a continuity with and a departure from the ideals of the Greek Classical era?",
    "choices": {
      "A": "The rise of Athenian democracy",
      "B": "The emergence of Stoicism and Epicureanism as dominant philosophical schools",
      "C": "The decline of theatrical performances and public games",
      "D": "The exclusive adoption of Buddhism throughout the Mediterranean"
    },
    "answer": "B",
    "explanation": "The correct answer, B, reflects the Hellenistic period's characteristic philosophical developments, which included the rise of Stoicism and Epicureanism. These schools of thought represented a shift from the Classical era's focus on politics and civic virtue, emphasizing instead individual virtue, self-sufficiency, and the pursuit of happiness. This shift signifies both a continuity with the Greek tradition of philosophical inquiry and a departure from the Classical ideals, as it adapted to the changed political and social landscape of the Hellenistic world.",
    "question_token_count": 31,
    "answer_correctness_score": 10,
    "explanation_validity_score": 10,
    "question_clarity_score": 7,
    "question_difficulty_score": 8,
    "question_groundedness_score": 4,
    "avg_answer_token_count": 10
  },
  {
    "context": "Buddhism /\u02c8bud\u026az\u0259m/ is a nontheistic religion[note 1] or philosophy (Sanskrit: \u0927\u0930\u094d\u092e dharma; Pali: \u0927\u092e\u094d\u092e dhamma) that encompasses a variety of traditions, beliefs and spiritual practices largely based on teachings attributed to Gautama Buddha, commonly known as the Buddha (\"the awakened one\"). According to Buddhist tradition, the Buddha lived and taught in the eastern part of the Indian subcontinent, present-day Nepal sometime between the 6th and 4th centuries BCE.[note 1] He is recognized by Buddhists as an awakened or enlightened teacher who shared his insights to help sentient beings end their suffering through the elimination of ignorance and craving. Buddhists believe that this is accomplished through the direct understanding and perception of dependent origination and the Four Noble Truths.",
    "topic": "The similarities and differences between Buddhist philosophy and other nontheistic or philosophical traditions.",
    "response": "<document_analysis>\nTo generate a highly insightful and probing question-answer pair, we must first analyze the provided context. The context discusses Buddhism as a nontheistic religion or philosophy, its origins, and its core teachings. It mentions the Buddha, the Four Noble Truths, and the concept of dependent origination. \n\nGiven the topic of similarities and differences between Buddhist philosophy and other nontheistic or philosophical traditions, we should consider how Buddhism's core teachings, such as the elimination of ignorance and craving to end suffering, compare to other philosophies. \n\nA thoughtful question would encourage deep engagement with the content, critical reflection on implications, and a clear demonstration of understanding and competency. It should be highly challenging, even for the smartest domain experts, and invite meaningful reflection or critical engagement.\n\nConsidering the context and the goal, the question should explore the nuances of Buddhist philosophy in relation to other nontheistic traditions, focusing on key concepts like the Four Noble Truths and dependent origination. \n\nThe difficulty rating for such a question would be high, around 8 or 9 out of 10, as it requires not only a deep understanding of Buddhist philosophy but also a broad knowledge of other philosophical traditions to identify subtle similarities and differences.\n\nGiven these considerations, the question should be designed to test the ability to synthesize information, recognize patterns, and apply knowledge of philosophical concepts to new situations, all while maintaining a high level of complexity and challenge.\n</document_analysis>\n\n<output_format>\nQuestion: What fundamental aspect of Buddhist philosophy, related to the cessation of suffering, distinguishes it from other nontheistic traditions that also aim to alleviate human distress?\nA: The rejection of a creator deity\nB: The emphasis on mindfulness and meditation\nC: The concept of anatman, or no-self\nD: The doctrine of karma and rebirth\n\nExplanation: The correct answer, \"The concept of anatman, or no-self,\" highlights a central tenet of Buddhism that distinguishes it from many other philosophical traditions. Anatman, or the doctrine of no permanent self, is a unique aspect of Buddhist teaching that directly relates to the understanding and elimination of suffering. While other traditions may share some similarities with Buddhism in their nontheistic approaches or practices like mindfulness, the concept of anatman is particularly distinctive.\n\nCorrect Answer: C\n</output_format>",
    "question": "What fundamental aspect of Buddhist philosophy, related to the cessation of suffering, distinguishes it from other nontheistic traditions that also aim to alleviate human distress?",
    "choices": {
      "A": "The rejection of a creator deity",
      "B": "The emphasis on mindfulness and meditation",
      "C": "The concept of anatman, or no-self",
      "D": "The doctrine of karma and rebirth"
    },
    "answer": "C",
    "explanation": "The correct answer, \"The concept of anatman, or no-self,\" highlights a central tenet of Buddhism that distinguishes it from many other philosophical traditions. Anatman, or the doctrine of no permanent self, is a unique aspect of Buddhist teaching that directly relates to the understanding and elimination of suffering. While other traditions may share some similarities with Buddhism in their nontheistic approaches or practices like mindfulness, the concept of anatman is particularly distinctive.",
    "question_token_count": 31,
    "answer_correctness_score": 10,
    "explanation_validity_score": 10,
    "question_clarity_score": 8,
    "question_difficulty_score": 9,
    "question_groundedness_score": 8,
    "avg_answer_token_count": 8
  },
  {
    "context": "Following their loss in the divisional round of the previous season's playoffs, the Denver Broncos underwent numerous coaching changes, including a mutual parting with head coach John Fox (who had won four divisional championships in his four years as Broncos head coach), and the hiring of Gary Kubiak as the new head coach. Under Kubiak, the Broncos planned to install a run-oriented offense with zone blocking to blend in with quarterback Peyton Manning's shotgun passing skills, but struggled with numerous changes and injuries to the offensive line, as well as Manning having his worst statistical season since his rookie year with the Indianapolis Colts in 1998, due to a plantar fasciitis injury in his heel that he had suffered since the summer, and the simple fact that Manning was getting old, as he turned 39 in the 2015 off-season. Although the team had a 7\u20130 start, Manning led the NFL in interceptions. In week 10, Manning suffered a partial tear of the plantar fasciitis in his left foot. He set the NFL's all-time record for career passing yards in this game, but was benched after throwing four interceptions in favor of backup quarterback Brock Osweiler, who took over as the starter for most of the remainder of the regular season. Osweiler was injured, however, leading to Manning's return during the Week 17 regular season finale, where the Broncos were losing 13\u20137 against the 4\u201311 San Diego Chargers, resulting in Manning re-claiming the starting quarterback position for the playoffs by leading the team to a key 27\u201320 win that enabled the team to clinch the number one overall AFC seed. Under defensive coordinator Wade Phillips, the Broncos' defense ranked number one in total yards allowed, passing yards allowed and sacks, and like the previous three seasons, the team has continued to set numerous individual, league and franchise records. With the defense carrying the team despite the issues with the offense, the Broncos finished the regular season with a 12\u20134 record and earned home-field advantage throughout the AFC playoffs.",
    "topic": "The Broncos' ultimate achievement of earning home-field advantage throughout the AFC playoffs, despite the issues with the offense, and the significance of this accomplishment in the context of the season.",
    "response": "<document_analysis>\nThe provided context discusses the Denver Broncos' 2015 season, highlighting their coaching changes, struggles with their offense, and the significance of earning home-field advantage throughout the AFC playoffs. The team faced numerous challenges, including injuries to key players such as Peyton Manning, who suffered a plantar fasciitis injury, and changes to the offensive line. Despite these issues, the Broncos finished the regular season with a 12-4 record, thanks in large part to their strong defense, which ranked number one in total yards allowed, passing yards allowed, and sacks. The team's ultimate achievement of earning home-field advantage is notable, given their offensive struggles. \n\nTo generate a question that inspires thoughtful engagement and reflection, I will focus on the implications of the Broncos' home-field advantage in the context of their season. The question should require a deep understanding of the content and encourage critical thinking about the team's performance.\n\nThoughtful consideration of the context reveals that the Broncos' defense was a key factor in their success, and the team's ability to earn home-field advantage despite their offensive struggles is a testament to the strength of their defense. The question should probe the domain expert's understanding of the team's performance and the significance of their achievement.\n\nThe difficulty level of the question should be high (8-10), as it requires a nuanced understanding of the team's season and the factors that contributed to their success. The question should be self-contained, with sufficient context provided to allow the domain expert to answer without referencing external information.\n\nGiven these considerations, a suitable question could explore the relationship between the Broncos' defensive performance and their ability to earn home-field advantage, requiring the domain expert to think critically about the team's strengths and weaknesses.\n</document_analysis>\n\n<output_format>\nQuestion: What was the primary factor that enabled the Broncos to earn home-field advantage throughout the AFC playoffs, despite struggles with their offense?\nA: Peyton Manning's record-breaking passing yards\nB: The team's strong defensive performance, which ranked number one in total yards allowed, passing yards allowed, and sacks\nC: The coaching changes, including the hiring of Gary Kubiak as head coach\nD: The team's 7-0 start to the season\nExplanation: The correct answer, B, highlights the significance of the Broncos' defensive performance in earning home-field advantage. The team's defense carried them throughout the season, despite struggles with their offense, and was a key factor in their ultimate achievement.\nCorrect Answer: B\n</output_format>",
    "question": "What was the primary factor that enabled the Broncos to earn home-field advantage throughout the AFC playoffs, despite struggles with their offense?",
    "choices": {
      "A": "Peyton Manning's record-breaking passing yards",
      "B": "The team's strong defensive performance, which ranked number one in total yards allowed, passing yards allowed, and sacks",
      "C": "The coaching changes, including the hiring of Gary Kubiak as head coach",
      "D": "The team's 7-0 start to the season"
    },
    "answer": "B",
    "explanation": "The correct answer, B, highlights the significance of the Broncos' defensive performance in earning home-field advantage. The team's defense carried them throughout the season, despite struggles with their offense, and was a key factor in their ultimate achievement.",
    "question_token_count": 26,
    "answer_correctness_score": 10,
    "explanation_validity_score": 10,
    "question_clarity_score": 4,
    "question_difficulty_score": 6,
    "question_groundedness_score": 8,
    "avg_answer_token_count": 14
  },
  {
    "context": "In 1853, Victoria gave birth to her eighth child, Leopold, with the aid of the new anaesthetic, chloroform. Victoria was so impressed by the relief it gave from the pain of childbirth that she used it again in 1857 at the birth of her ninth and final child, Beatrice, despite opposition from members of the clergy, who considered it against biblical teaching, and members of the medical profession, who thought it dangerous. Victoria may have suffered from post-natal depression after many of her pregnancies. Letters from Albert to Victoria intermittently complain of her loss of self-control. For example, about a month after Leopold's birth Albert complained in a letter to Victoria about her \"continuance of hysterics\" over a \"miserable trifle\".",
    "topic": "The historical significance of Queen Victoria's use of chloroform as an anaesthetic during childbirth in the 19th century.",
    "response": "<document_analysis>\nThe context provided discusses the historical significance of Queen Victoria's use of chloroform as an anaesthetic during childbirth in the 19th century. The key points in this context include Queen Victoria's use of chloroform in 1853 and 1857 for the births of her eighth and ninth children, respectively, despite opposition from clergy and some medical professionals. Additionally, it mentions Queen Victoria's potential struggles with post-natal depression and her emotional state following childbirth.\n\nUpon examining the context, it becomes clear that the use of chloroform by Queen Victoria was a pivotal moment in the history of obstetrics, marking a significant shift in the approach to pain management during childbirth. The fact that she used chloroform despite opposition underscores her influence and the evolving attitudes towards pain relief in childbirth.\n\nThe mention of Queen Victoria's potential post-natal depression and her emotional struggles adds a layer of complexity to the discussion, highlighting the multifaceted nature of her experiences with childbirth. However, the primary focus of the context remains on the historical significance of her use of chloroform.\n\nGiven this analysis, the question should aim to probe the domain expert's understanding of the implications and consequences of Queen Victoria's use of chloroform, as well as its broader impact on medical practices and societal attitudes towards childbirth and pain management.\n\nThoughtful consideration of the context and the desired level of complexity leads to the generation of a question that requires the synthesis of historical knowledge, medical understanding, and social insight. The question should be designed to challenge the domain expert, encouraging a deep engagement with the content and a nuanced understanding of the subject matter.\n\nDifficulty rating: 8/10\n\nThe question generated from this analysis is intended to be highly challenging, requiring the domain expert to demonstrate a profound understanding of the historical context, the medical implications of chloroform use, and the societal factors influencing its adoption.\n\n</document_analysis>\n\n<output_format>\nQuestion: What was the primary medical significance of Queen Victoria's publicized use of chloroform during childbirth in the 19th century?\nA: It led to a widespread acceptance of chloroform as a treatment for post-natal depression.\nB: It paved the way for the development of modern anaesthetics by popularizing the concept of pain relief during childbirth.\nC: It resulted in a significant reduction in maternal mortality rates due to the decreased risk of complications from anaesthesia.\nD: It marked a turning point in the medical community's acceptance of anaesthesia for obstetric procedures, challenging previous religious and professional objections.\nExplanation: The correct answer, D, reflects the historical significance of Queen Victoria's use of chloroform in challenging prevailing objections to anaesthesia in childbirth, thereby influencing medical practice. The other options are incorrect because they either misrepresent the consequences of her actions or introduce unrelated medical concepts.\nCorrect Answer: D\n</output_format>",
    "question": "What was the primary medical significance of Queen Victoria's publicized use of chloroform during childbirth in the 19th century?",
    "choices": {
      "A": "It led to a widespread acceptance of chloroform as a treatment for post-natal depression.",
      "B": "It paved the way for the development of modern anaesthetics by popularizing the concept of pain relief during childbirth.",
      "C": "It resulted in a significant reduction in maternal mortality rates due to the decreased risk of complications from anaesthesia.",
      "D": "It marked a turning point in the medical community's acceptance of anaesthesia for obstetric procedures, challenging previous religious and professional objections."
    },
    "answer": "D",
    "explanation": "The correct answer, D, reflects the historical significance of Queen Victoria's use of chloroform in challenging prevailing objections to anaesthesia in childbirth, thereby influencing medical practice. The other options are incorrect because they either misrepresent the consequences of her actions or introduce unrelated medical concepts.",
    "question_token_count": 27,
    "answer_correctness_score": 10,
    "explanation_validity_score": 10,
    "question_clarity_score": 8,
    "question_difficulty_score": 6,
    "question_groundedness_score": 7,
    "avg_answer_token_count": 23
  },
  {
    "context": "All of Chopin's compositions include the piano. Most are for solo piano, though he also wrote two piano concertos, a few chamber pieces, and some songs to Polish lyrics. His keyboard style is highly individual and often technically demanding; his own performances were noted for their nuance and sensitivity. Chopin invented the concept of instrumental ballade. His major piano works also include mazurkas, waltzes, nocturnes, polonaises, \u00e9tudes, impromptus, scherzos, preludes and sonatas, some published only after his death. Influences on his compositional style include Polish folk music, the classical tradition of J. S. Bach, Mozart and Schubert, the music of all of whom he admired, as well as the Paris salons where he was a frequent guest. His innovations in style, musical form, and harmony, and his association of music with nationalism, were influential throughout and after the late Romantic period.",
    "topic": "The influence of the classical tradition, including the music of J. S. Bach, Mozart, and Schubert, on Chopin's compositional style and his unique interpretation of classical forms.",
    "response": "<document_analysis>\nTo generate a highly insightful and probing question-answer pair, a careful analysis of the provided context is necessary. The context discusses Chopin's compositional style, his unique interpretation of classical forms, and the influences on his music, including Polish folk music and the classical tradition of J. S. Bach, Mozart, and Schubert.\n\nThe central idea of the context is the description of Chopin's musical style and the various influences that shaped it. The nuanced themes include the incorporation of Polish folk music elements, the classical tradition, and the innovative nature of his compositions. Significant relationships within the context include the connection between Chopin's music and the music of J. S. Bach, Mozart, and Schubert, as well as the impact of the Paris salons on his compositional style.\n\nUpon examining the context, it is clear that the difficulty level of the question should be high (8-10), as it requires a deep understanding of Chopin's music, the classical tradition, and the influences on his compositional style.\n\nThe question should invite deeper understanding, meaningful reflection, or critical engagement with the content. A potential question could explore the ways in which Chopin's music reflects the classical tradition, while also incorporating innovative elements and Polish folk music influences.\n\nThe thought process behind generating this question involves considering the implicit assumptions about Chopin's music, the subtle details about his compositional style, and the underlying theories about the influence of the classical tradition on his work. The question should be purposeful, encouraging the domain expert to think critically about the relationships between Chopin's music, the classical tradition, and Polish folk music.\n\nIn terms of question types, an analytical or conceptual question would be suitable, as it would require the domain expert to synthesize information and think critically about the relationships between different musical styles and influences.\n</document_analysis>\n\n<output_format>\nQuestion: What aspect of Chopin's compositional style most clearly reflects the influence of the classical tradition, while also demonstrating his innovative approach to musical form and harmony?\nA: His use of sonata form in his piano concertos\nB: His incorporation of Polish folk music elements in his mazurkas and polonaises\nC: His development of complex and nuanced harmonies in his nocturnes and preludes\nD: His use of counterpoint and fugue in his \u00e9tudes and scherzos\n\nExplanation: The correct answer, C, reflects the influence of the classical tradition on Chopin's music, while also demonstrating his innovative approach to musical form and harmony. Chopin's nocturnes and preludes are characterized by complex and nuanced harmonies, which were influenced by the classical tradition, but also showcase his unique and innovative approach to harmony.\n\nCorrect Answer: C\n</output_format>",
    "question": "What aspect of Chopin's compositional style most clearly reflects the influence of the classical tradition, while also demonstrating his innovative approach to musical form and harmony?",
    "choices": {
      "A": "His use of sonata form in his piano concertos",
      "B": "His incorporation of Polish folk music elements in his mazurkas and polonaises",
      "C": "His development of complex and nuanced harmonies in his nocturnes and preludes",
      "D": "His use of counterpoint and fugue in his \u00e9tudes and scherzos"
    },
    "answer": "C",
    "explanation": "The correct answer, C, reflects the influence of the classical tradition on Chopin's music, while also demonstrating his innovative approach to musical form and harmony. Chopin's nocturnes and preludes are characterized by complex and nuanced harmonies, which were influenced by the classical tradition, but also showcase his unique and innovative approach to harmony.",
    "question_token_count": 31,
    "answer_correctness_score": 9,
    "explanation_validity_score": 9,
    "question_clarity_score": 8,
    "question_difficulty_score": 8,
    "question_groundedness_score": 2,
    "avg_answer_token_count": 15
  },
  {
    "context": "In 1887, the British Empire celebrated Victoria's Golden Jubilee. Victoria marked the fiftieth anniversary of her accession on 20 June with a banquet to which 50 kings and princes were invited. The following day, she participated in a procession and attended a thanksgiving service in Westminster Abbey. By this time, Victoria was once again extremely popular. Two days later on 23 June, she engaged two Indian Muslims as waiters, one of whom was Abdul Karim. He was soon promoted to \"Munshi\": teaching her Hindustani, and acting as a clerk. Her family and retainers were appalled, and accused Abdul Karim of spying for the Muslim Patriotic League, and biasing the Queen against the Hindus. Equerry Frederick Ponsonby (the son of Sir Henry) discovered that the Munshi had lied about his parentage, and reported to Lord Elgin, Viceroy of India, \"the Munshi occupies very much the same position as John Brown used to do.\" Victoria dismissed their complaints as racial prejudice. Abdul Karim remained in her service until he returned to India with a pension on her death.",
    "topic": "The reaction of the Queen's family and retainers to her relationship with Abdul Karim and their concerns about racial prejudice.",
    "response": "<document_analysis>\nThe provided context revolves around Queen Victoria's relationship with Abdul Karim, an Indian Muslim who served as her \"Munshi,\" teaching her Hindustani and acting as a clerk. The key points of analysis include the celebration of Victoria's Golden Jubilee, her engagement of Abdul Karim, and the concerns raised by her family and retainers regarding his influence and potential spying. They accused him of biasing the Queen against Hindus and discovered that he had lied about his parentage. Despite these complaints, Victoria defended Abdul Karim, attributing the criticism to racial prejudice. This context provides a rich backdrop for exploring themes of cultural exchange, racial prejudice, and the complexities of royal relationships.\n\nGiven the information, a thoughtful and probing question can be crafted to assess the domain expert's understanding of the historical context, the dynamics of the royal court, and the societal attitudes of the time. The question should be designed to encourage deep reflection and nuanced consideration of the factors at play.\n\nThe decision to generate a question is justified because the provided context contains meaningful, coherent, and educationally valuable content. The context offers insights into historical events, cultural interactions, and the personal relationships of Queen Victoria, making it an appropriate basis for a challenging and insightful question.\n\nThe difficulty rating of the question is calibrated to be high (8 out of 10) to ensure that it challenges even the smartest domain experts. The question is planned to invite deeper understanding and critical engagement with the content, requiring the synthesis of high-level general understanding beyond the specific context.\n\n</document_analysis>\n\n<output_format>\nQuestion: What was the primary concern of Queen Victoria's family and retainers regarding Abdul Karim's influence on her, and how did she respond to these concerns?\nA: They believed he was a Hindu fanatic and she dismissed their concerns as unfounded.\nB: They believed he was spying for the Muslim Patriotic League and she defended him as a loyal servant.\nC: They believed he was biased against Muslims and she shared their concerns.\nD: They believed he was a British loyalist and she was indifferent to his influence.\n\nExplanation: The correct answer requires an understanding of the historical context and the specific concerns raised by Queen Victoria's family and retainers. They accused Abdul Karim of spying for the Muslim Patriotic League and biasing the Queen against Hindus, which she defended as racial prejudice.\n\nCorrect Answer: B\n</output_format>",
    "question": "What was the primary concern of Queen Victoria's family and retainers regarding Abdul Karim's influence on her, and how did she respond to these concerns?",
    "choices": {
      "A": "They believed he was a Hindu fanatic and she dismissed their concerns as unfounded.",
      "B": "They believed he was spying for the Muslim Patriotic League and she defended him as a loyal servant.",
      "C": "They believed he was biased against Muslims and she shared their concerns.",
      "D": "They believed he was a British loyalist and she was indifferent to his influence."
    },
    "answer": "B",
    "explanation": "The correct answer requires an understanding of the historical context and the specific concerns raised by Queen Victoria's family and retainers. They accused Abdul Karim of spying for the Muslim Patriotic League and biasing the Queen against Hindus, which she defended as racial prejudice.",
    "question_token_count": 31,
    "answer_correctness_score": 10,
    "explanation_validity_score": 9,
    "question_clarity_score": 1,
    "question_difficulty_score": 5,
    "question_groundedness_score": 10,
    "avg_answer_token_count": 17
  },
  {
    "context": "From September 1823 to 1826 Chopin attended the Warsaw Lyceum, where he received organ lessons from the Czech musician Wilhelm W\u00fcrfel during his first year. In the autumn of 1826 he began a three-year course under the Silesian composer J\u00f3zef Elsner at the Warsaw Conservatory, studying music theory, figured bass and composition.[n 3] Throughout this period he continued to compose and to give recitals in concerts and salons in Warsaw. He was engaged by the inventors of a mechanical organ, the \"eolomelodicon\", and on this instrument in May 1825 he performed his own improvisation and part of a concerto by Moscheles. The success of this concert led to an invitation to give a similar recital on the instrument before Tsar Alexander I, who was visiting Warsaw; the Tsar presented him with a diamond ring. At a subsequent eolomelodicon concert on 10 June 1825, Chopin performed his Rondo Op. 1. This was the first of his works to be commercially published and earned him his first mention in the foreign press, when the Leipzig Allgemeine Musikalische Zeitung praised his \"wealth of musical ideas\".",
    "topic": "The historical context of musical education and performance in early 19th-century Warsaw, including the influence of Czech and Silesian musicians like Wilhelm W\u00fcrfel and J\u00f3zef Elsner.",
    "response": "<document_analysis>\nThe provided context offers a glimpse into the early 19th-century musical education and performance scene in Warsaw, with a focus on the influences of Czech and Silesian musicians like Wilhelm W\u00fcrfel and J\u00f3zef Elsner on Fr\u00e9d\u00e9ric Chopin. The period from 1823 to 1826 is highlighted, during which Chopin attended the Warsaw Lyceum and later the Warsaw Conservatory, studying under these influential musicians. Notable events during this time include Chopin's performances on the \"eolomelodicon,\" a mechanical organ, and the recognition he received, including a diamond ring from Tsar Alexander I and praise from the Leipzig Allgemeine Musikalische Zeitung for his Rondo Op. 1.\n\nThoughtful examination of the context reveals the significance of musical education and the impact of international influences on Warsaw's musical scene. The mention of specific instruments, like the \"eolomelodicon,\" and the praise from foreign press, underscore the evolving nature of musical performance and composition during this era. The influence of W\u00fcrfel and Elsner on Chopin's development as a composer and performer is also a crucial aspect, reflecting the cross-cultural exchange that enriched musical education in Warsaw.\n\nGiven the complexity and richness of this historical context, a question that probes the depth of understanding of the domain expert regarding the intersections of musical influence, educational development, and performance innovation in early 19th-century Warsaw would be highly relevant. The question should be crafted to encourage a nuanced understanding of how figures like W\u00fcrfel and Elsner contributed to Chopin's artistic growth and the broader musical landscape of the time.\n\nStrategic complexity calibration suggests that a question rated at a difficulty level of 8 out of 10 would be appropriate, given the specialized knowledge required about the historical context of musical education, the specific influences on Chopin, and the innovative musical instruments of the era.\n\nIntentional question planning involves creating a query that not only tests factual knowledge but also invites the domain expert to reflect on the implications of these historical events and figures on the development of music in Warsaw and beyond. This could involve considering how the presence of Czech and Silesian musicians in Warsaw reflects broader cultural exchange patterns, or how Chopin's early performances and compositions signal the emergence of new musical trends.\n\nThe decision criteria for question generation emphasize the need for meaningful, coherent, and educationally valuable content. The provided context meets these criteria by offering specific details about Chopin's education, his interactions with influential musicians, and the reception of his early works, all set against the backdrop of Warsaw's vibrant musical scene in the early 19th century.\n\nIn generating the question, it's essential to avoid including phrases that give away the answer or making the question too obvious. The goal is to create a challenging yet answerable question that demonstrates a deep understanding of the subject matter. Ensuring that all answer options are plausible and that at least one incorrect answer is subtly wrong will add to the question's complexity and require the domain expert to exhibit a high level of knowledge and discernment.\n</document_analysis>\n\n<output_format>\nQuestion: What significant event in 1825 marked the first commercial publication of Chopin's work and garnered him international recognition in the musical press?\nA: Performance for Tsar Alexander I\nB: Publication of his Rondo Op. 1\nC: Recital on the eolomelodicon\nD: Graduation from the Warsaw Conservatory\n\nExplanation: The correct answer, \"Publication of his Rondo Op. 1,\" is significant because it was not only Chopin's first commercially published work but also earned him his first mention in the foreign press, specifically praise from the Leipzig Allgemeine Musikalische Zeitung for his \"wealth of musical ideas.\" This event is a milestone in Chopin's career, marking the beginning of his international recognition.\n\nCorrect Answer: B\n</output_format>",
    "question": "What significant event in 1825 marked the first commercial publication of Chopin's work and garnered him international recognition in the musical press?",
    "choices": {
      "A": "Performance for Tsar Alexander I",
      "B": "Publication of his Rondo Op. 1",
      "C": "Recital on the eolomelodicon",
      "D": "Graduation from the Warsaw Conservatory"
    },
    "answer": "B",
    "explanation": "The correct answer, \"Publication of his Rondo Op. 1,\" is significant because it was not only Chopin's first commercially published work but also earned him his first mention in the foreign press, specifically praise from the Leipzig Allgemeine Musikalische Zeitung for his \"wealth of musical ideas.\" This event is a milestone in Chopin's career, marking the beginning of his international recognition.",
    "question_token_count": 27,
    "answer_correctness_score": 10,
    "explanation_validity_score": 10,
    "question_clarity_score": 8,
    "question_difficulty_score": 6,
    "question_groundedness_score": 9,
    "avg_answer_token_count": 8
  },
  {
    "context": "Multiracial Americans are Americans who have mixed ancestry of \"two or more races\". The term may also include Americans of mixed-race ancestry who self-identify with just one group culturally and socially (cf. the one-drop rule). In the 2010 US census, approximately 9 million individuals, or 2.9% of the population, self-identified as multiracial. There is evidence that an accounting by genetic ancestry would produce a higher number, but people live according to social and cultural identities, not DNA. Historical reasons, including slavery creating a racial caste and the European-American suppression of Native Americans, often led people to identify or be classified by only one ethnicity, generally that of the culture in which they were raised. Prior to the mid-20th century, many people hid their multiracial heritage because of racial discrimination against minorities. While many Americans may be biologically multiracial, they often do not know it or do not identify so culturally, any more than they maintain all the differing traditions of a variety of national ancestries.",
    "topic": "The implications of the one-drop rule on racial identity and how it compares to other methods of determining racial classification.",
    "response": "<document_analysis>\nThe provided context discusses multiracial Americans, their self-identification, and the implications of historical events on racial identity. The one-drop rule is mentioned as a factor that influences how individuals with mixed ancestry identify themselves culturally and socially. To generate a challenging question, we need to explore the concept of racial classification, the one-drop rule, and its comparison to other methods.\n\nThe context highlights that approximately 9 million individuals in the 2010 US census self-identified as multiracial, but notes that genetic ancestry might reveal a higher number of multiracial individuals. It also touches upon the historical reasons behind people identifying with only one ethnicity, such as slavery and the suppression of Native Americans. The one-drop rule is significant in this context as it has historically classified individuals with any African American ancestry as black, regardless of their other ancestries.\n\nTo create a thought-provoking question, we should consider the implications of the one-drop rule on racial identity and how it compares to other methods of determining racial classification. This requires an understanding of the social, cultural, and historical contexts that shape racial identity.\n\nGiven the complexity of the topic and the need for a challenging question, the difficulty level of the question should be rated as 8 out of 10. The question should encourage deep engagement with the content, critical reflection on the implications of the one-drop rule, and a nuanced understanding of its comparison to other racial classification methods.\n</document_analysis>\n\n<output_format>\nQuestion: What fundamental difference exists between the one-drop rule and genetic ancestry in determining an individual's racial identity, and how does this difference impact the social and cultural identification of multiracial individuals?\nA: The one-drop rule focuses on social and cultural identity, while genetic ancestry emphasizes biological heritage, leading to discrepancies in self-identification.\nB: The one-drop rule classifies individuals based on visible traits, whereas genetic ancestry relies on DNA testing, resulting in inconsistent racial categorizations.\nC: The one-drop rule is used exclusively for African American ancestry, while genetic ancestry accounts for all racial backgrounds, affecting how multiracial individuals perceive their identity.\nD: The one-drop rule determines racial identity based on parental ancestry, whereas genetic ancestry considers the individual's entire genetic makeup, influencing their racial self-identification.\n\nExplanation: The correct answer, A, highlights the core distinction between the one-drop rule, which historically classified individuals based on any African American ancestry, and genetic ancestry, which looks at the overall biological makeup. This difference significantly impacts how multiracial individuals identify themselves socially and culturally, as they may not always align with their genetic ancestry due to the influence of the one-drop rule and other social factors.\n\nCorrect Answer: A\n</output_format>",
    "question": "What fundamental difference exists between the one-drop rule and genetic ancestry in determining an individual's racial identity, and how does this difference impact the social and cultural identification of multiracial individuals?",
    "choices": {
      "A": "The one-drop rule focuses on social and cultural identity, while genetic ancestry emphasizes biological heritage, leading to discrepancies in self-identification.",
      "B": "The one-drop rule classifies individuals based on visible traits, whereas genetic ancestry relies on DNA testing, resulting in inconsistent racial categorizations.",
      "C": "The one-drop rule is used exclusively for African American ancestry, while genetic ancestry accounts for all racial backgrounds, affecting how multiracial individuals perceive their identity.",
      "D": "The one-drop rule determines racial identity based on parental ancestry, whereas genetic ancestry considers the individual's entire genetic makeup, influencing their racial self-identification."
    },
    "answer": "A",
    "explanation": "The correct answer, A, highlights the core distinction between the one-drop rule, which historically classified individuals based on any African American ancestry, and genetic ancestry, which looks at the overall biological makeup. This difference significantly impacts how multiracial individuals identify themselves socially and culturally, as they may not always align with their genetic ancestry due to the influence of the one-drop rule and other social factors.",
    "question_token_count": 37,
    "answer_correctness_score": 9,
    "explanation_validity_score": 9,
    "question_clarity_score": 6,
    "question_difficulty_score": 8,
    "question_groundedness_score": 6,
    "avg_answer_token_count": 29
  },
  {
    "context": "In 1853, Victoria gave birth to her eighth child, Leopold, with the aid of the new anaesthetic, chloroform. Victoria was so impressed by the relief it gave from the pain of childbirth that she used it again in 1857 at the birth of her ninth and final child, Beatrice, despite opposition from members of the clergy, who considered it against biblical teaching, and members of the medical profession, who thought it dangerous. Victoria may have suffered from post-natal depression after many of her pregnancies. Letters from Albert to Victoria intermittently complain of her loss of self-control. For example, about a month after Leopold's birth Albert complained in a letter to Victoria about her \"continuance of hysterics\" over a \"miserable trifle\".",
    "topic": "The analysis of the intersection of gender, medicine, and social class in the experiences of Queen Victoria and other women of her time.",
    "response": "<document_analysis>\nThe provided context offers a unique glimpse into the life of Queen Victoria, particularly her experiences with childbirth and the societal attitudes towards women's health during her time. The intersection of gender, medicine, and social class is evident in her use of chloroform despite opposition from clergy and some medical professionals, highlighting the complex dynamics at play. The mention of potential post-natal depression and the language used by Prince Albert (\"continuance of hysterics\") also underscores the gendered expectations and medical understandings of women's mental and physical health during the 19th century.\n\nThe analysis of this context requires careful consideration of the historical, medical, and social factors influencing women's experiences, particularly those of high social status like Queen Victoria. The question should invite a deep understanding of these intersections and how they impacted the lives of women during this period.\n\nThoughtfully rating the difficulty of the question to ensure it is challenging even for domain experts, a score of 8 out of 10 is appropriate due to the need for nuanced understanding of historical medical practices, gender roles, and social class dynamics.\n\nGiven the context, a question that probes the domain expert's knowledge of the historical and medical nuances, as well as the social implications of Queen Victoria's experiences, would be highly insightful. The question should be designed to encourage reflection on the broader implications of these experiences for understanding the intersection of gender, medicine, and social class during the 19th century.\n</document_analysis>\n\n<output_format>\nQuestion: What does Queen Victoria's use of chloroform during childbirth, despite societal opposition, reveal about the tensions between medical innovation, gender roles, and social class in the 19th century?\nA: It highlights the absolute power of the monarch in adopting medical innovations.\nB: It shows the significant role of women in shaping medical practices, regardless of social class.\nC: It underscores the complex interplay between medical progress, gender expectations, and social status, influencing women's health experiences.\nD: It demonstrates the uniform acceptance of new medical practices among all social classes during this period.\nExplanation: The correct answer, C, reflects an understanding of how Queen Victoria's decision to use chloroform, despite opposition, illustrates the intricate relationships between advances in medicine, the societal roles and expectations of women, and the influence of social class on health care experiences during the 19th century.\nCorrect Answer: C\n</output_format>",
    "question": "What does Queen Victoria's use of chloroform during childbirth, despite societal opposition, reveal about the tensions between medical innovation, gender roles, and social class in the 19th century?",
    "choices": {
      "A": "It highlights the absolute power of the monarch in adopting medical innovations.",
      "B": "It shows the significant role of women in shaping medical practices, regardless of social class.",
      "C": "It underscores the complex interplay between medical progress, gender expectations, and social status, influencing women's health experiences.",
      "D": "It demonstrates the uniform acceptance of new medical practices among all social classes during this period."
    },
    "answer": "C",
    "explanation": "The correct answer, C, reflects an understanding of how Queen Victoria's decision to use chloroform, despite opposition, illustrates the intricate relationships between advances in medicine, the societal roles and expectations of women, and the influence of social class on health care experiences during the 19th century.",
    "question_token_count": 39,
    "answer_correctness_score": 10,
    "explanation_validity_score": 10,
    "question_clarity_score": 8,
    "question_difficulty_score": 9,
    "question_groundedness_score": 6,
    "avg_answer_token_count": 18
  },
  {
    "context": "Palmerston died in 1865, and after a brief ministry led by Russell, Derby returned to power. In 1866, Victoria attended the State Opening of Parliament for the first time since Albert's death. The following year she supported the passing of the Reform Act 1867 which doubled the electorate by extending the franchise to many urban working men, though she was not in favour of votes for women. Derby resigned in 1868, to be replaced by Benjamin Disraeli, who charmed Victoria. \"Everyone likes flattery,\" he said, \"and when you come to royalty you should lay it on with a trowel.\" With the phrase \"we authors, Ma'am\", he complimented her. Disraeli's ministry only lasted a matter of months, and at the end of the year his Liberal rival, William Ewart Gladstone, was appointed prime minister. Victoria found Gladstone's demeanour far less appealing; he spoke to her, she is thought to have complained, as though she were \"a public meeting rather than a woman\".",
    "topic": "The key provisions and consequences of the Reform Act 1867, including the extension of the franchise to urban working men.",
    "response": "<document_analysis>\nThe provided context discusses the period of Queen Victoria's reign, specifically the events surrounding the Reform Act 1867. The key points to consider are the extension of the franchise to urban working men, the doubling of the electorate, and the reactions of various political figures to Queen Victoria. To generate a meaningful and challenging question, we must delve into the implications and consequences of the Reform Act 1867, considering the social, political, and historical context. \n\nThoughtful content examination reveals that the Reform Act 1867 was a significant piece of legislation that expanded voting rights, but it did not include votes for women. Concept exploration suggests that this act had profound implications for the political landscape of Britain, potentially altering the balance of power and representation. Strategic complexity calibration indicates that a question about the specific provisions and consequences of the Reform Act 1867, particularly in relation to the extension of the franchise, would be highly challenging and require a deep understanding of the subject matter.\n\nGiven the information and the goal to create a question that inspires thoughtful engagement and deep understanding, we should focus on the nuances of the Reform Act's impact on British society and politics. The decision criteria for question generation emphasize the need for meaningful content and educational value, which this topic certainly provides. \n\nTherefore, the rationale for the question generation is to probe the domain expert's understanding of the Reform Act 1867's key provisions and its consequences, particularly the extension of the franchise to urban working men, and to assess their ability to reflect critically on the historical context and implications of this legislation.\n</document_analysis>\n\n<output_format>\nQuestion: What was the primary demographic group that benefited from the extension of the franchise as a result of the Reform Act 1867?\nA: Rural landowners\nB: Urban working men\nC: Women of all social classes\nD: Members of the aristocracy\n\nExplanation: The Reform Act 1867 is known for doubling the electorate by extending voting rights to many urban working men, thus significantly altering the political landscape by giving more representation to this demographic.\n\nCorrect Answer: B\n</output_format>",
    "question": "What was the primary demographic group that benefited from the extension of the franchise as a result of the Reform Act 1867?",
    "choices": {
      "A": "Rural landowners",
      "B": "Urban working men",
      "C": "Women of all social classes",
      "D": "Members of the aristocracy"
    },
    "answer": "B",
    "explanation": "The Reform Act 1867 is known for doubling the electorate by extending voting rights to many urban working men, thus significantly altering the political landscape by giving more representation to this demographic.",
    "question_token_count": 26,
    "answer_correctness_score": 10,
    "explanation_validity_score": 10,
    "question_clarity_score": 8,
    "question_difficulty_score": 6,
    "question_groundedness_score": 8,
    "avg_answer_token_count": 5
  },
  {
    "context": "Victoria later described her childhood as \"rather melancholy\". Her mother was extremely protective, and Victoria was raised largely isolated from other children under the so-called \"Kensington System\", an elaborate set of rules and protocols devised by the Duchess and her ambitious and domineering comptroller, Sir John Conroy, who was rumoured to be the Duchess's lover. The system prevented the princess from meeting people whom her mother and Conroy deemed undesirable (including most of her father's family), and was designed to render her weak and dependent upon them. The Duchess avoided the court because she was scandalised by the presence of King William's bastard children, and perhaps prompted the emergence of Victorian morality by insisting that her daughter avoid any appearance of sexual impropriety. Victoria shared a bedroom with her mother every night, studied with private tutors to a regular timetable, and spent her play-hours with her dolls and her King Charles spaniel, Dash. Her lessons included French, German, Italian, and Latin, but she spoke only English at home.",
    "topic": "The historical context of the time, including the emergence of Victorian morality and the social norms that governed the behavior of women, particularly those of royal blood.",
    "response": "<document_analysis>\nThe context provided describes the childhood of Queen Victoria, highlighting the strict and isolating upbringing she experienced under the \"Kensington System\" devised by her mother, the Duchess, and Sir John Conroy. This system was designed to keep Victoria dependent on her mother and Conroy, limiting her interactions with others, including her father's family, and emphasizing the importance of avoiding any appearance of sexual impropriety. This upbringing is noted to have contributed to the emergence of Victorian morality. The context also details Victoria's educational and daily routine, which included studying multiple languages and spending time with her dolls and dog.\n\nGiven this information, the goal is to craft a question that probes the domain expert's understanding of the historical context and its implications on Victorian society, particularly in relation to the social norms governing women's behavior. The question should be challenging, encouraging deep reflection and insight into the subject matter.\n\nThoughtful consideration suggests that an analytical question focusing on the implications of the Duchess's actions and the \"Kensington System\" on the broader societal norms of the time would be appropriate. This could involve exploring how the strict upbringing of Victoria, with its emphasis on avoiding sexual impropriety, might have influenced or reflected the changing moral landscape of Victorian England.\n\nThe difficulty level of such a question would be high (8/10), as it requires not only an understanding of Victoria's childhood and the \"Kensington System\" but also the ability to analyze its broader societal implications and how it might have contributed to the emergence of Victorian morality.\n\nGiven the context and the goal of generating a challenging question, the following question-answer pair is proposed:\n</document_analysis>\n\n<output_format>\nQuestion: What societal factor, influenced by the strict moral code imposed on Queen Victoria during her upbringing, is likely to have contributed significantly to the development of Victorian morality?\nA: The rise of industrialization and urbanization\nB: The emphasis on female purity and domesticity\nC: The decline of the British Empire\nD: The increase in religious diversity\n\nExplanation: The correct answer, \"The emphasis on female purity and domesticity,\" reflects the context's description of Victoria's upbringing, where avoiding any appearance of sexual impropriety was a key concern. This emphasis would have reinforced societal norms prioritizing female modesty and domestic roles, contributing to the broader moral strictures of the Victorian era.\n\nCorrect Answer: B\n</output_format>",
    "question": "What societal factor, influenced by the strict moral code imposed on Queen Victoria during her upbringing, is likely to have contributed significantly to the development of Victorian morality?",
    "choices": {
      "A": "The rise of industrialization and urbanization",
      "B": "The emphasis on female purity and domesticity",
      "C": "The decline of the British Empire",
      "D": "The increase in religious diversity"
    },
    "answer": "B",
    "explanation": "The correct answer, \"The emphasis on female purity and domesticity,\" reflects the context's description of Victoria's upbringing, where avoiding any appearance of sexual impropriety was a key concern. This emphasis would have reinforced societal norms prioritizing female modesty and domestic roles, contributing to the broader moral strictures of the Victorian era.",
    "question_token_count": 34,
    "answer_correctness_score": 10,
    "explanation_validity_score": 10,
    "question_clarity_score": 6,
    "question_difficulty_score": 7,
    "question_groundedness_score": 9,
    "avg_answer_token_count": 7
  },
  {
    "context": "Antibiotics are screened for any negative effects on humans or other mammals before approval for clinical use, and are usually considered safe and most are well tolerated. However, some antibiotics have been associated with a range of adverse side effects. Side-effects range from mild to very serious depending on the antibiotics used, the microbial organisms targeted, and the individual patient. Side effects may reflect the pharmacological or toxicological properties of the antibiotic or may involve hypersensitivity reactions or anaphylaxis. Safety profiles of newer drugs are often not as well established as for those that have a long history of use. Adverse effects range from fever and nausea to major allergic reactions, including photodermatitis and anaphylaxis. Common side-effects include diarrhea, resulting from disruption of the species composition in the intestinal flora, resulting, for example, in overgrowth of pathogenic bacteria, such as Clostridium difficile. Antibacterials can also affect the vaginal flora, and may lead to overgrowth of yeast species of the genus Candida in the vulvo-vaginal area. Additional side-effects can result from interaction with other drugs, such as elevated risk of tendon damage from administration of a quinolone antibiotic with a systemic corticosteroid. Some scientists have hypothesized that the indiscriminate use of antibiotics alter the host microbiota and this has been associated with chronic disease.",
    "topic": "The importance of considering the potential long-term consequences of antibiotic use in clinical practice.",
    "response": "<document_analysis>\nTo generate a highly insightful and probing question-answer pair, a careful analysis of the provided context is necessary. The central idea of the context revolves around the importance of considering the potential long-term consequences of antibiotic use in clinical practice, highlighting the various adverse side effects associated with antibiotics, ranging from mild to severe. The context also touches upon the disruption of intestinal flora, interactions with other drugs, and the potential link between antibiotic use and chronic disease.\n\nThe key concepts to explore in this context include the pharmacological and toxicological properties of antibiotics, hypersensitivity reactions, and the impact of antibiotics on the host microbiota. It is crucial to consider the strategic complexity calibration, ensuring that the question is highly challenging for domain experts, with a difficulty rating of 8 or 9 out of 10.\n\nUpon analyzing the context, it becomes apparent that the question should invite deeper understanding, meaningful reflection, or critical engagement with the content. The thought process behind generating the question involves identifying the subtle details and underlying theories related to antibiotic use and its consequences.\n\nThe context does not contain any irrelevant or bogus information, and all the provided information is meaningful and coherent. Therefore, it is possible to generate a question-answer pair based on the given context.\n</document_analysis>\n\n<output_format>\nQuestion: What is a potential long-term consequence of disrupting the host microbiota through the indiscriminate use of antibiotics?\nA: Development of antibiotic-resistant bacterial strains\nB: Increased risk of chronic diseases, such as inflammatory bowel disease\nC: Enhanced immune system function\nD: Improved species composition in the intestinal flora\n\nExplanation: The correct answer, B, is supported by the context, which states that some scientists have hypothesized that the indiscriminate use of antibiotics alters the host microbiota, and this has been associated with chronic disease. The other options are incorrect because while antibiotic resistance (A) is a concern, it is not directly related to the disruption of the host microbiota. Option C is incorrect because disrupting the host microbiota is unlikely to enhance immune system function. Option D is also incorrect because the use of antibiotics can lead to an overgrowth of pathogenic bacteria, rather than improving the species composition in the intestinal flora.\n\nCorrect Answer: B\n</output_format>",
    "question": "What is a potential long-term consequence of disrupting the host microbiota through the indiscriminate use of antibiotics?",
    "choices": {
      "A": "Development of antibiotic-resistant bacterial strains",
      "B": "Increased risk of chronic diseases, such as inflammatory bowel disease",
      "C": "Enhanced immune system function",
      "D": "Improved species composition in the intestinal flora"
    },
    "answer": "B",
    "explanation": "The correct answer, B, is supported by the context, which states that some scientists have hypothesized that the indiscriminate use of antibiotics alters the host microbiota, and this has been associated with chronic disease. The other options are incorrect because while antibiotic resistance (A) is a concern, it is not directly related to the disruption of the host microbiota. Option C is incorrect because disrupting the host microbiota is unlikely to enhance immune system function. Option D is also incorrect because the use of antibiotics can lead to an overgrowth of pathogenic bacteria, rather than improving the species composition in the intestinal flora.",
    "question_token_count": 23,
    "answer_correctness_score": 10,
    "explanation_validity_score": 10,
    "question_clarity_score": 8,
    "question_difficulty_score": 7,
    "question_groundedness_score": 9,
    "avg_answer_token_count": 8
  },
  {
    "context": "Victoria wrote to her uncle Leopold, whom Victoria considered her \"best and kindest adviser\", to thank him \"for the prospect of great happiness you have contributed to give me, in the person of dear Albert ... He possesses every quality that could be desired to render me perfectly happy. He is so sensible, so kind, and so good, and so amiable too. He has besides the most pleasing and delightful exterior and appearance you can possibly see.\" However at 17, Victoria, though interested in Albert, was not yet ready to marry. The parties did not undertake a formal engagement, but assumed that the match would take place in due time.",
    "topic": "The development of Victoria's feelings towards Albert over time, from initial interest to a deeper understanding of his character and their potential compatibility.",
    "response": "<document_analysis>\nTo develop a question that probes the domain expert's understanding of Victoria's feelings towards Albert, it's essential to analyze the context provided. The key elements in this context include Victoria's initial impression of Albert, her description of his qualities, and the assumption of a future marriage without a formal engagement. \n\nThe context suggests that Victoria had a positive initial impression of Albert, highlighting his sensible, kind, and good nature, as well as his amiable and pleasing exterior. This description indicates that Victoria was drawn to both Albert's character and his physical appearance. However, it's also mentioned that at 17, Victoria was not yet ready to marry, implying that her feelings towards Albert were still developing.\n\nTo craft a challenging question, we need to consider the nuances of Victoria's emotions and the factors influencing her perception of Albert. A domain expert should be able to reflect on the implications of Victoria's age, her uncle's influence, and the societal expectations of the time on her feelings towards Albert.\n\nThe question should encourage the expert to think critically about the development of Victoria's feelings, considering both the explicit descriptions provided and the implicit suggestions about her maturity and readiness for marriage. \n\nGiven these considerations, the difficulty level of the question should be high (8/10), as it requires a deep understanding of the context, the ability to infer Victoria's emotional state, and knowledge of the historical and social context in which these events took place.\n\n</document_analysis>\n\n<output_format>\nQuestion: What aspect of Albert's character would have been most crucial for Victoria to understand and appreciate as she transitioned from initial interest to a deeper emotional engagement?\nA: His political ambitions\nB: His kind and sensible nature\nC: His views on women's roles in society\nD: His financial management skills\n\nExplanation: The correct answer, \"His kind and sensible nature,\" is supported by Victoria's own description of Albert, highlighting these qualities as essential to her perception of him. Understanding and appreciating these aspects of his character would have been vital for Victoria as she developed deeper feelings for Albert, given her initial positive impression of his personality and the potential for a long-term relationship.\n\nCorrect Answer: B\n</output_format>",
    "question": "What aspect of Albert's character would have been most crucial for Victoria to understand and appreciate as she transitioned from initial interest to a deeper emotional engagement?",
    "choices": {
      "A": "His political ambitions",
      "B": "His kind and sensible nature",
      "C": "His views on women's roles in society",
      "D": "His financial management skills"
    },
    "answer": "B",
    "explanation": "The correct answer, \"His kind and sensible nature,\" is supported by Victoria's own description of Albert, highlighting these qualities as essential to her perception of him. Understanding and appreciating these aspects of his character would have been vital for Victoria as she developed deeper feelings for Albert, given her initial positive impression of his personality and the potential for a long-term relationship.",
    "question_token_count": 31,
    "answer_correctness_score": 10,
    "explanation_validity_score": 10,
    "question_clarity_score": 6,
    "question_difficulty_score": 7,
    "question_groundedness_score": 8,
    "avg_answer_token_count": 5
  },
  {
    "context": "The main passenger airport serving the metropolis and the state is Melbourne Airport (also called Tullamarine Airport), which is the second busiest in Australia, and the Port of Melbourne is Australia's busiest seaport for containerised and general cargo. Melbourne has an extensive transport network. The main metropolitan train terminus is Flinders Street Station, and the main regional train and coach terminus is Southern Cross Station. Melbourne is also home to Australia's most extensive freeway network and has the world's largest urban tram network.",
    "topic": "The characteristics and benefits of Melbourne's extensive freeway network, including its contribution to the city's transportation efficiency.",
    "response": "<document_analysis>\nTo generate a highly insightful and probing question-answer pair, a thorough analysis of the provided context is necessary. The context discusses Melbourne's transportation network, highlighting its main passenger airport, seaport, train terminus, and extensive freeway and tram networks. \n\nThe central idea here is Melbourne's comprehensive transportation system, which includes its freeway network. The context, however, does not delve deeply into the specifics of the freeway network's characteristics or its benefits to the city's transportation efficiency. \n\nGiven the information provided and the goal to create a challenging question, it's essential to consider implicit assumptions and potential applications of an extensive freeway network in a metropolitan setting. This includes thinking about how such a network might impact traffic flow, travel times, economic activity, and urban planning.\n\nThe difficulty of the question should be rated high (8-10) to ensure it challenges even the smartest domain experts. This means the question should require not just factual knowledge but also the ability to analyze, infer, and apply understanding of urban transportation systems and their impacts on city dynamics.\n\nIn planning the question, it's crucial to invite deeper understanding and critical engagement. This could involve exploring the potential effects of Melbourne's freeway network on the city's overall transportation efficiency, considering factors like congestion reduction, travel time savings, and how these might influence economic and social activities within the city.\n\nGiven the context does not explicitly discuss the characteristics and benefits of the freeway network, the question will need to be crafted in a way that assumes some general knowledge about urban transportation systems and their potential impacts on city efficiency.\n</document_analysis>\n\n<output_format>\nQuestion: What primary factor contributes to the efficiency of a city's transportation network when it has an extensive freeway system like Melbourne's?\nA: Increased Public Transit Options\nB: Reduced Traffic Congestion\nC: Enhanced Pedestrian Infrastructure\nD: Improved Freight Logistics\nExplanation: An extensive freeway network can significantly reduce traffic congestion by providing multiple routes for vehicles, thus decreasing travel times and increasing the overall efficiency of the transportation network. This is a key factor in how such a network contributes to a city's transportation efficiency.\nCorrect Answer: B\n</output_format>",
    "question": "What primary factor contributes to the efficiency of a city's transportation network when it has an extensive freeway system like Melbourne's?",
    "choices": {
      "A": "Increased Public Transit Options",
      "B": "Reduced Traffic Congestion",
      "C": "Enhanced Pedestrian Infrastructure",
      "D": "Improved Freight Logistics"
    },
    "answer": "B",
    "explanation": "An extensive freeway network can significantly reduce traffic congestion by providing multiple routes for vehicles, thus decreasing travel times and increasing the overall efficiency of the transportation network. This is a key factor in how such a network contributes to a city's transportation efficiency.",
    "question_token_count": 25,
    "answer_correctness_score": 8,
    "explanation_validity_score": 8,
    "question_clarity_score": 4,
    "question_difficulty_score": 6,
    "question_groundedness_score": 3,
    "avg_answer_token_count": 4
  },
  {
    "context": "The Hellenistic period covers the period of ancient Greek (Hellenic) history and Mediterranean history between the death of Alexander the Great in 323 BC and the emergence of the Roman Empire as signified by the Battle of Actium in 31 BC and the subsequent conquest of Ptolemaic Egypt the following year. At this time, Greek cultural influence and power was at its peak in Europe, Africa and Asia, experiencing prosperity and progress in the arts, exploration, literature, theatre, architecture, music, mathematics, philosophy, and science. For example, competitive public games took place, ideas in biology, and popular entertainment in theaters. It is often considered a period of transition, sometimes even of decadence or degeneration, compared to the enlightenment of the Greek Classical era. The Hellenistic period saw the rise of New Comedy, Alexandrian poetry, the Septuagint and the philosophies of Stoicism and Epicureanism. Greek Science was advanced by the works of the mathematician Euclid and the polymath Archimedes. The religious sphere expanded to include new gods such as the Greco-Egyptian Serapis, eastern deities such as Attis and Cybele and the Greek adoption of Buddhism.",
    "topic": "The emergence and influence of New Comedy, Alexandrian poetry, Stoicism, and Epicureanism during the Hellenistic period.",
    "response": "<document_analysis>\nThe provided context discusses the Hellenistic period, which spans from the death of Alexander the Great in 323 BC to the emergence of the Roman Empire in 31 BC. This era is characterized by the peak of Greek cultural influence and power, marked by significant advancements in various fields such as arts, literature, theatre, architecture, music, mathematics, philosophy, and science. The context highlights the emergence of New Comedy, Alexandrian poetry, Stoicism, and Epicureanism as key philosophical and literary developments during this period. \n\nTo generate a question that inspires thoughtful engagement and reflection, it's essential to identify the central ideas and nuanced themes within the context. The Hellenistic period is often viewed as a transitional phase, sometimes perceived as a decline from the Classical era's enlightenment. However, this period also witnessed remarkable progress in science, philosophy, and the arts. \n\nGiven the complexity and richness of the Hellenistic period, a question that probes the domain expert's understanding of the philosophical underpinnings and their influence on the cultural and literary landscape would be highly relevant. The question should be designed to encourage a deep engagement with the content, critically reflecting on the implications of these philosophical movements on the broader cultural context.\n\nThe difficulty level of the question should be calibrated to challenge even the smartest domain experts, requiring a synthesis of high-level general understanding beyond the specific context provided. \n\nTherefore, the planned question will focus on the intersection of Stoicism and Epicureanism with the literary and cultural developments of the Hellenistic period, aiming to elicit a nuanced understanding of their impact on the era's intellectual and artistic landscape.\n</document_analysis>\n\n<output_format>\nQuestion: What significant philosophical tenet did Stoicism and Epicureanism share, which influenced the thematic focus of New Comedy during the Hellenistic period?\nA: Rejection of divine intervention in human affairs\nB: Emphasis on the pursuit of wealth and power\nC: Belief in an afterlife as a moral incentive\nD: Focus on the individual's pursuit of virtue and self-control\n\nExplanation: Both Stoicism and Epicureanism, despite their differences, emphasized the importance of individual virtue and self-control as a means to achieve happiness or inner peace. This philosophical tenet is reflected in the themes of New Comedy, which often explored personal relationships, moral dilemmas, and the individual's struggle for virtue in a changing world.\n\nCorrect Answer: D\n</output_format>",
    "question": "What significant philosophical tenet did Stoicism and Epicureanism share, which influenced the thematic focus of New Comedy during the Hellenistic period?",
    "choices": {
      "A": "Rejection of divine intervention in human affairs",
      "B": "Emphasis on the pursuit of wealth and power",
      "C": "Belief in an afterlife as a moral incentive",
      "D": "Focus on the individual's pursuit of virtue and self-control"
    },
    "answer": "D",
    "explanation": "Both Stoicism and Epicureanism, despite their differences, emphasized the importance of individual virtue and self-control as a means to achieve happiness or inner peace. This philosophical tenet is reflected in the themes of New Comedy, which often explored personal relationships, moral dilemmas, and the individual's struggle for virtue in a changing world.",
    "question_token_count": 30,
    "answer_correctness_score": 10,
    "explanation_validity_score": 10,
    "question_clarity_score": 2,
    "question_difficulty_score": 8,
    "question_groundedness_score": 2,
    "avg_answer_token_count": 10
  },
  {
    "context": "Beyonc\u00e9 has received numerous awards. As a solo artist she has sold over 15 million albums in the US, and over 118 million records worldwide (a further 60 million additionally with Destiny's Child), making her one of the best-selling music artists of all time. The Recording Industry Association of America (RIAA) listed Beyonc\u00e9 as the top certified artist of the 2000s, with a total of 64 certifications. Her songs \"Crazy in Love\", \"Single Ladies (Put a Ring on It)\", \"Halo\", and \"Irreplaceable\" are some of the best-selling singles of all time worldwide. In 2009, The Observer named her the Artist of the Decade and Billboard named her the Top Female Artist and Top Radio Songs Artist of the Decade. In 2010, Billboard named her in their \"Top 50 R&B/Hip-Hop Artists of the Past 25 Years\" list at number 15. In 2012 VH1 ranked her third on their list of the \"100 Greatest Women in Music\". Beyonc\u00e9 was the first female artist to be honored with the International Artist Award at the American Music Awards. She has also received the Legend Award at the 2008 World Music Awards and the Billboard Millennium Award at the 2011 Billboard Music Awards.",
    "topic": "The criteria used by music industry organizations, such as the RIAA and Billboard, to determine certifications and rankings, and how these criteria relate to Beyonc\u00e9's achievements.",
    "response": "<document_analysis>\nTo generate a highly insightful and probing question-answer pair, we must carefully analyze the provided context. The central idea of the context revolves around Beyonc\u00e9's achievements in the music industry, including her numerous awards, record sales, and rankings. \n\nThe context mentions specific criteria used by music industry organizations, such as the RIAA and Billboard, to determine certifications and rankings. For instance, the RIAA listed Beyonc\u00e9 as the top certified artist of the 2000s, with a total of 64 certifications. Additionally, Billboard named her the Top Female Artist and Top Radio Songs Artist of the Decade in 2009.\n\nUpon closer examination, we notice that the context highlights Beyonc\u00e9's impressive record sales, with over 15 million albums sold in the US and over 118 million records worldwide. Her songs, such as \"Crazy in Love\" and \"Single Ladies (Put a Ring on It)\", are also mentioned as some of the best-selling singles of all time worldwide.\n\nTo create a challenging question, we must delve deeper into the criteria used by these organizations and how they relate to Beyonc\u00e9's achievements. We should consider implicit assumptions, subtle details, and underlying theories that might influence the determination of certifications and rankings.\n\nOne potential area of exploration is the methodology used by the RIAA to certify artists. What specific criteria do they use to determine certifications, and how does Beyonc\u00e9's sales data contribute to her ranking as the top certified artist of the 2000s?\n\nAnother possible angle is to examine the relationship between Beyonc\u00e9's record sales and her rankings on Billboard's charts. How do her sales figures impact her positioning on the Top Female Artist and Top Radio Songs Artist of the Decade lists?\n\nBy carefully analyzing these aspects, we can craft a question that encourages deep engagement with the content, critical reflection, and nuanced understanding of the music industry's criteria for determining certifications and rankings.\n\nThe question should be designed to challenge even the smartest domain experts, with a difficulty rating of 8 out of 10. The correct answer should require a deep understanding of the context and the ability to synthesize information from various sources.\n\nThoughtful engagement with the content is crucial, as the question should inspire genuine curiosity and reflection. The question should be self-contained, with sufficient context provided to ensure clarity and understanding.\n\nIn terms of question type, an analytical or application-based question would be suitable, as it would require the test-taker to apply their knowledge of the music industry's criteria to a specific scenario or problem.\n\nOverall, the goal is to create a question that not only assesses the test-taker's knowledge of Beyonc\u00e9's achievements but also their ability to think critically and make connections between different pieces of information.\n</document_analysis>\n\n<output_format>\nQuestion: What primary factor does the RIAA consider when certifying artists, and how did this factor contribute to Beyonc\u00e9's ranking as the top certified artist of the 2000s?\nA: Album sales and streaming data\nB: Radio airplay and touring revenue\nC: Sales data and album certifications\nD: Critical acclaim and award nominations\n\nExplanation: The RIAA considers sales data and album certifications when certifying artists. Beyonc\u00e9's ranking as the top certified artist of the 2000s can be attributed to her impressive sales figures, with over 15 million albums sold in the US and over 118 million records worldwide, as well as her 64 certifications.\n\nCorrect Answer: C\n</output_format>",
    "question": "What primary factor does the RIAA consider when certifying artists, and how did this factor contribute to Beyonc\u00e9's ranking as the top certified artist of the 2000s?",
    "choices": {
      "A": "Album sales and streaming data",
      "B": "Radio airplay and touring revenue",
      "C": "Sales data and album certifications",
      "D": "Critical acclaim and award nominations"
    },
    "answer": "C",
    "explanation": "The RIAA considers sales data and album certifications when certifying artists. Beyonc\u00e9's ranking as the top certified artist of the 2000s can be attributed to her impressive sales figures, with over 15 million albums sold in the US and over 118 million records worldwide, as well as her 64 certifications.",
    "question_token_count": 37,
    "answer_correctness_score": 10,
    "explanation_validity_score": 10,
    "question_clarity_score": 4,
    "question_difficulty_score": 6,
    "question_groundedness_score": 4,
    "avg_answer_token_count": 6
  },
  {
    "context": "The Panthers finished the regular season with a 15\u20131 record, and quarterback Cam Newton was named the NFL Most Valuable Player (MVP). They defeated the Arizona Cardinals 49\u201315 in the NFC Championship Game and advanced to their second Super Bowl appearance since the franchise was founded in 1995. The Broncos finished the regular season with a 12\u20134 record, and denied the New England Patriots a chance to defend their title from Super Bowl XLIX by defeating them 20\u201318 in the AFC Championship Game. They joined the Patriots, Dallas Cowboys, and Pittsburgh Steelers as one of four teams that have made eight appearances in the Super Bowl.",
    "topic": "The implications of the Broncos' win over the New England Patriots in the AFC Championship Game.",
    "response": "<document_analysis>\nThe provided context discusses the outcomes of the NFC and AFC Championship Games, leading up to Super Bowl 50. The key information includes the Panthers' 15-1 regular season record, Cam Newton being named MVP, and their victory over the Arizona Cardinals in the NFC Championship. For the Broncos, their 12-4 regular season record and their win over the New England Patriots in the AFC Championship Game are highlighted. The analysis will focus on the implications of the Broncos' win over the Patriots, considering the strategic and competitive aspects of this victory.\n\nThoughtful content examination reveals that the Broncos' win signifies their strength and capability to overcome strong opponents like the Patriots. Concept exploration suggests that this victory could have psychological implications, boosting the Broncos' confidence heading into the Super Bowl. Strategic complexity calibration rates the difficulty of understanding the implications of this win as an 8 out of 10, given the need to consider both the immediate effects on team morale and the broader competitive landscape of the NFL.\n\nIntentional question planning aims to craft a question that invites reflection on the competitive dynamics and strategic decisions influenced by the Broncos' victory. The question should be challenging, requiring a deep understanding of NFL dynamics, team performance, and the psychological factors at play in high-stakes competitions.\n</document_analysis>\n\n<output_format>\nQuestion: What significant advantage did the Broncos gain by defeating the Patriots in the AFC Championship Game, in terms of their Super Bowl preparation and team psyche?\nA: Home-field advantage in the Super Bowl\nB: Momentum and psychological edge over potential opponents\nC: Additional week of rest before the Super Bowl\nD: Opportunity to face a weaker NFC team\n\nExplanation: The correct answer, \"Momentum and psychological edge over potential opponents,\" reflects the understanding that defeating a strong team like the Patriots would significantly boost the Broncos' confidence and momentum heading into the Super Bowl. This psychological advantage can impact team performance, as a win over a formidable opponent can enhance belief in their abilities and strategies.\n\nCorrect Answer: B\n</output_format>",
    "question": "What significant advantage did the Broncos gain by defeating the Patriots in the AFC Championship Game, in terms of their Super Bowl preparation and team psyche?",
    "choices": {
      "A": "Home-field advantage in the Super Bowl",
      "B": "Momentum and psychological edge over potential opponents",
      "C": "Additional week of rest before the Super Bowl",
      "D": "Opportunity to face a weaker NFC team"
    },
    "answer": "B",
    "explanation": "The correct answer, \"Momentum and psychological edge over potential opponents,\" reflects the understanding that defeating a strong team like the Patriots would significantly boost the Broncos' confidence and momentum heading into the Super Bowl. This psychological advantage can impact team performance, as a win over a formidable opponent can enhance belief in their abilities and strategies.",
    "question_token_count": 30,
    "answer_correctness_score": 9,
    "explanation_validity_score": 9,
    "question_clarity_score": 2,
    "question_difficulty_score": 6,
    "question_groundedness_score": 2,
    "avg_answer_token_count": 8
  },
  {
    "context": "Multiracial Americans are Americans who have mixed ancestry of \"two or more races\". The term may also include Americans of mixed-race ancestry who self-identify with just one group culturally and socially (cf. the one-drop rule). In the 2010 US census, approximately 9 million individuals, or 2.9% of the population, self-identified as multiracial. There is evidence that an accounting by genetic ancestry would produce a higher number, but people live according to social and cultural identities, not DNA. Historical reasons, including slavery creating a racial caste and the European-American suppression of Native Americans, often led people to identify or be classified by only one ethnicity, generally that of the culture in which they were raised. Prior to the mid-20th century, many people hid their multiracial heritage because of racial discrimination against minorities. While many Americans may be biologically multiracial, they often do not know it or do not identify so culturally, any more than they maintain all the differing traditions of a variety of national ancestries.",
    "topic": "The role of genetic ancestry in understanding multiracial identity, and how it intersects with or diverges from social and cultural identities.",
    "response": "<document_analysis>\nThe provided context discusses the concept of multiracial identity in America, highlighting the distinction between genetic ancestry and social/cultural identities. It mentions the 2010 US census data, where approximately 9 million individuals self-identified as multiracial, and notes that an accounting by genetic ancestry might yield a higher number. The context also touches upon historical reasons, such as slavery and the suppression of Native Americans, which led people to identify with only one ethnicity. Furthermore, it acknowledges that many Americans may be biologically multiracial but do not know it or do not identify as such culturally.\n\nGiven the complexity of the topic and the need to encourage deep understanding and insight, the question should probe the intersection of genetic ancestry with social and cultural identities. A challenging question would require the synthesis of high-level general understanding and the ability to think critically about the implications of genetic ancestry on multiracial identity.\n\nThe thought process behind generating the question involves considering the nuances of multiracial identity, the role of genetic ancestry, and how these intersect with or diverge from social and cultural identities. The question should be designed to inspire thoughtful engagement and reflection, encouraging the respondent to think critically about the complexities of multiracial identity.\n\nIn terms of difficulty calibration, the question should be rated as highly challenging (8-10), requiring the respondent to demonstrate a deep understanding of the subject matter and the ability to think critically about the implications of genetic ancestry on multiracial identity.\n</document_analysis>\n\n<output_format>\nQuestion: What phenomenon occurs when individuals of mixed ancestry identify with a single ethnic group due to historical and social factors, despite potentially having a more complex genetic ancestry?\nA: Ethnic assimilation\nB: Cultural homogenization\nC: Racial passing\nD: Ancestral suppression\n\nExplanation: The correct answer, \"Racial passing,\" refers to the phenomenon where individuals of mixed ancestry identify with a single ethnic group, often to avoid discrimination or social stigma. This concept is relevant to the context, which discusses how historical reasons, such as slavery and the suppression of Native Americans, led people to identify with only one ethnicity. The other options, while related to issues of identity and culture, do not specifically capture the phenomenon described in the question.\n\nCorrect Answer: D: Ancestral suppression is not correct, the correct answer is actually \"Racial passing\" which is option C.\n</output_format>",
    "question": "What phenomenon occurs when individuals of mixed ancestry identify with a single ethnic group due to historical and social factors, despite potentially having a more complex genetic ancestry?",
    "choices": {
      "A": "Ethnic assimilation",
      "B": "Cultural homogenization",
      "C": "Racial passing",
      "D": "Ancestral suppression"
    },
    "answer": "D",
    "explanation": "The correct answer, \"Racial passing,\" refers to the phenomenon where individuals of mixed ancestry identify with a single ethnic group, often to avoid discrimination or social stigma. This concept is relevant to the context, which discusses how historical reasons, such as slavery and the suppression of Native Americans, led people to identify with only one ethnicity. The other options, while related to issues of identity and culture, do not specifically capture the phenomenon described in the question.",
    "question_token_count": 31,
    "answer_correctness_score": 1,
    "explanation_validity_score": 6,
    "question_clarity_score": 6,
    "question_difficulty_score": 6,
    "question_groundedness_score": 9,
    "avg_answer_token_count": 4
  },
  {
    "context": "In 1897, Victoria had written instructions for her funeral, which was to be military as befitting a soldier's daughter and the head of the army, and white instead of black. On 25 January, Edward VII, the Kaiser and Prince Arthur, Duke of Connaught, helped lift her body into the coffin. She was dressed in a white dress and her wedding veil. An array of mementos commemorating her extended family, friends and servants were laid in the coffin with her, at her request, by her doctor and dressers. One of Albert's dressing gowns was placed by her side, with a plaster cast of his hand, while a lock of John Brown's hair, along with a picture of him, was placed in her left hand concealed from the view of the family by a carefully positioned bunch of flowers. Items of jewellery placed on Victoria included the wedding ring of John Brown's mother, given to her by Brown in 1883. Her funeral was held on Saturday, 2 February, in St George's Chapel, Windsor Castle, and after two days of lying-in-state, she was interred beside Prince Albert in Frogmore Mausoleum at Windsor Great Park. As she was laid to rest at the mausoleum, it began to snow.",
    "topic": "The symbolism of the various items included in Queen Victoria's coffin, including the wedding ring of John Brown's mother and the plaster cast of Prince Albert's hand.",
    "response": "<document_analysis>\nThe context provided revolves around the funeral of Queen Victoria, specifically the items included in her coffin as per her instructions. These items hold sentimental value and symbolize her relationships with various individuals, including Prince Albert, John Brown, and her family. The inclusion of a plaster cast of Prince Albert's hand, a lock of John Brown's hair, and the wedding ring of John Brown's mother are notable examples. To generate a question that inspires thoughtful engagement and deep understanding, we must delve into the symbolic meanings behind these items and their significance in the context of Queen Victoria's life and relationships.\n\nGiven the complexity of the topic and the need for a high level of domain expertise, the question should be designed to challenge even the most knowledgeable individuals. It should require not only an understanding of the historical context but also an ability to analyze the symbolic significance of the items included in Queen Victoria's coffin.\n\nThe correct approach involves identifying the underlying themes and relationships that these items represent and then crafting a question that probes the depth of understanding of these themes. Since the question needs to be self-contained and answerable without referencing the context paragraph, it must be carefully worded to include all necessary information implicitly.\n\nConsidering the above, a question that could meet these criteria would involve the analysis of the symbolic items and their implications on our understanding of Queen Victoria's personal life and relationships. The question should be open-ended enough to encourage thoughtful reflection yet specific enough to require a precise and accurate answer.\n\nDifficulty rating: 8/10\n\nThe question is challenging because it requires not only knowledge of the items included in Queen Victoria's coffin but also an understanding of their symbolic significance and the relationships they represent. The answer options should be plausible and require careful consideration to distinguish the correct answer from the incorrect ones.\n</document_analysis>\n\n<output_format>\nQuestion: What symbolic significance can be inferred from the inclusion of the wedding ring of John Brown's mother in Queen Victoria's coffin, and how does this reflect her relationship with John Brown?\nA: It symbolized her deep respect for John Brown as a servant and friend, highlighting the professional bond between them.\nB: It represented a familial bond, signifying that John Brown was considered part of the royal family by Queen Victoria.\nC: It was a token of her affection and close personal relationship with John Brown, underscoring the emotional support he provided.\nD: It marked her appreciation for John Brown's mother, whom she had known personally and admired greatly.\n\nExplanation: The inclusion of the wedding ring of John Brown's mother in Queen Victoria's coffin suggests a deep personal and emotional bond between Queen Victoria and John Brown. This act symbolizes the significant role John Brown played in Queen Victoria's life, particularly in the period following Prince Albert's death. The ring, given to her by John Brown, would have held sentimental value, representing the comfort, companionship, and possibly romantic feelings she had for him. This interpretation reflects the complex and intimate nature of their relationship, which was a subject of much speculation and gossip during Queen Victoria's lifetime.\n\nCorrect Answer: C\n</output_format>",
    "question": "What symbolic significance can be inferred from the inclusion of the wedding ring of John Brown's mother in Queen Victoria's coffin, and how does this reflect her relationship with John Brown?",
    "choices": {
      "A": "It symbolized her deep respect for John Brown as a servant and friend, highlighting the professional bond between them.",
      "B": "It represented a familial bond, signifying that John Brown was considered part of the royal family by Queen Victoria.",
      "C": "It was a token of her affection and close personal relationship with John Brown, underscoring the emotional support he provided.",
      "D": "It marked her appreciation for John Brown's mother, whom she had known personally and admired greatly."
    },
    "answer": "C",
    "explanation": "The inclusion of the wedding ring of John Brown's mother in Queen Victoria's coffin suggests a deep personal and emotional bond between Queen Victoria and John Brown. This act symbolizes the significant role John Brown played in Queen Victoria's life, particularly in the period following Prince Albert's death. The ring, given to her by John Brown, would have held sentimental value, representing the comfort, companionship, and possibly romantic feelings she had for him. This interpretation reflects the complex and intimate nature of their relationship, which was a subject of much speculation and gossip during Queen Victoria's lifetime.",
    "question_token_count": 37,
    "answer_correctness_score": 10,
    "explanation_validity_score": 10,
    "question_clarity_score": 6,
    "question_difficulty_score": 7,
    "question_groundedness_score": 10,
    "avg_answer_token_count": 22
  },
  {
    "context": "The annual NFL Experience was held at the Moscone Center in San Francisco. In addition, \"Super Bowl City\" opened on January 30 at Justin Herman Plaza on The Embarcadero, featuring games and activities that will highlight the Bay Area's technology, culinary creations, and cultural diversity. More than 1 million people are expected to attend the festivities in San Francisco during Super Bowl Week. San Francisco mayor Ed Lee said of the highly visible homeless presence in this area \"they are going to have to leave\". San Francisco city supervisor Jane Kim unsuccessfully lobbied for the NFL to reimburse San Francisco for city services in the amount of $5 million.",
    "topic": "The economic benefits and costs of hosting the Super Bowl in a major city like San Francisco, including the expected attendance and revenue generated.",
    "response": "<document_analysis>\nThe provided context discusses the economic benefits and costs of hosting the Super Bowl in a major city like San Francisco. It highlights the various events and activities that took place, such as the NFL Experience at the Moscone Center and \"Super Bowl City\" at Justin Herman Plaza. The expected attendance is over 1 million people, which suggests a significant potential for revenue generation. However, the context also mentions the issue of homelessness in the area and the city's request for reimbursement from the NFL for city services, which was unsuccessful. \n\nUpon analyzing the context, it becomes clear that the economic benefits of hosting the Super Bowl are substantial, with a large number of attendees expected to generate significant revenue. However, there are also costs associated with hosting the event, such as the need for city services and the impact on homelessness. \n\nThe question should encourage a deep engagement with the content, critically reflect on implications, and clearly demonstrate understanding and competency. A suitable question could be one that requires the synthesis of high-level general understanding above and beyond the specific context, and is very difficult to answer correctly, even for the smartest domain experts.\n</document_analysis>\n\n<output_format>\nQuestion: What is the primary economic cost that San Francisco city supervisor Jane Kim attempted to have reimbursed by the NFL, in relation to hosting the Super Bowl?\nA: Revenue lost due to homelessness\nB: City services in the amount of $5 million\nC: Costs associated with building new infrastructure\nD: Revenue generated from ticket sales\n\nExplanation: The correct answer is B, as the context explicitly states that Jane Kim lobbied for the NFL to reimburse San Francisco for city services in the amount of $5 million. This requires a deep understanding of the economic costs associated with hosting a major event like the Super Bowl.\n\nCorrect Answer: B\n</output_format>",
    "question": "What is the primary economic cost that San Francisco city supervisor Jane Kim attempted to have reimbursed by the NFL, in relation to hosting the Super Bowl?",
    "choices": {
      "A": "Revenue lost due to homelessness",
      "B": "City services in the amount of $5 million",
      "C": "Costs associated with building new infrastructure",
      "D": "Revenue generated from ticket sales"
    },
    "answer": "B",
    "explanation": "The correct answer is B, as the context explicitly states that Jane Kim lobbied for the NFL to reimburse San Francisco for city services in the amount of $5 million. This requires a deep understanding of the economic costs associated with hosting a major event like the Super Bowl.",
    "question_token_count": 32,
    "answer_correctness_score": 10,
    "explanation_validity_score": 10,
    "question_clarity_score": 4,
    "question_difficulty_score": 4,
    "question_groundedness_score": 10,
    "avg_answer_token_count": 7
  },
  {
    "context": "In 1887, the British Empire celebrated Victoria's Golden Jubilee. Victoria marked the fiftieth anniversary of her accession on 20 June with a banquet to which 50 kings and princes were invited. The following day, she participated in a procession and attended a thanksgiving service in Westminster Abbey. By this time, Victoria was once again extremely popular. Two days later on 23 June, she engaged two Indian Muslims as waiters, one of whom was Abdul Karim. He was soon promoted to \"Munshi\": teaching her Hindustani, and acting as a clerk. Her family and retainers were appalled, and accused Abdul Karim of spying for the Muslim Patriotic League, and biasing the Queen against the Hindus. Equerry Frederick Ponsonby (the son of Sir Henry) discovered that the Munshi had lied about his parentage, and reported to Lord Elgin, Viceroy of India, \"the Munshi occupies very much the same position as John Brown used to do.\" Victoria dismissed their complaints as racial prejudice. Abdul Karim remained in her service until he returned to India with a pension on her death.",
    "topic": "The significance of Abdul Karim's promotion to \"Munshi\" and his teaching of Hindustani to the Queen.",
    "response": "<document_analysis>\nThe context provided revolves around Queen Victoria's Golden Jubilee and her interaction with an Indian Muslim, Abdul Karim, who was promoted to \"Munshi\" and taught her Hindustani. The significance of Abdul Karim's promotion and his role in teaching the Queen Hindustani is intertwined with the societal and familial reactions to their relationship. The family and retainers of the Queen were appalled by Abdul Karim's influence, accusing him of spying and biasing the Queen against Hindus. However, the Queen dismissed these complaints as racial prejudice, highlighting a complex dynamic of cultural, racial, and power relations. \n\nGiven the context, a thoughtful and probing question would need to delve into the implications of Abdul Karim's position and the Queen's stance on racial prejudice, considering the historical and social context of the British Empire during Victoria's reign. The question should encourage reflection on the power dynamics, cultural exchange, and the challenges faced by individuals from different racial and cultural backgrounds within the imperial structure.\n\nThe difficulty level of the question should be high (8-10), requiring a deep understanding of historical context, cultural sensitivity, and the ability to analyze complex power dynamics. The question should be self-contained, clear, and conversational, without giving away the answer or including irrelevant information.\n\nThought_process: The question generation process involves identifying key themes such as cultural exchange, power dynamics, and racial prejudice, and then crafting a question that requires the synthesis of these themes to demonstrate a deep understanding of the context and its implications. The question should be challenging, encouraging the domain expert to reflect critically on the historical context and the significance of Abdul Karim's role in the Queen's life.\n</document_analysis>\n\n<output_format>\nQuestion: What does Abdul Karim's promotion to \"Munshi\" and his teaching of Hindustani to Queen Victoria symbolize in terms of cultural exchange and power dynamics within the British Empire during the late 19th century?\nA: A reinforcement of British cultural superiority\nB: An attempt to bridge cultural divides and challenge racial prejudices\nC: A strategic move to garner support from Indian Muslims for the Empire\nD: A personal preference of the Queen with no broader implications\n\nExplanation: Abdul Karim's promotion and role in teaching the Queen Hindustani signify an attempt to bridge cultural divides and challenge racial prejudices, as evidenced by the Queen's dismissal of complaints against him as racial prejudice. This reflects a complex and nuanced dynamic within the Empire, where personal relationships and cultural exchanges could influence and challenge broader societal attitudes.\n\nCorrect Answer: B\n</output_format>",
    "question": "What does Abdul Karim's promotion to \"Munshi\" and his teaching of Hindustani to Queen Victoria symbolize in terms of cultural exchange and power dynamics within the British Empire during the late 19th century?",
    "choices": {
      "A": "A reinforcement of British cultural superiority",
      "B": "An attempt to bridge cultural divides and challenge racial prejudices",
      "C": "A strategic move to garner support from Indian Muslims for the Empire",
      "D": "A personal preference of the Queen with no broader implications"
    },
    "answer": "B",
    "explanation": "Abdul Karim's promotion and role in teaching the Queen Hindustani signify an attempt to bridge cultural divides and challenge racial prejudices, as evidenced by the Queen's dismissal of complaints against him as racial prejudice. This reflects a complex and nuanced dynamic within the Empire, where personal relationships and cultural exchanges could influence and challenge broader societal attitudes.",
    "question_token_count": 44,
    "answer_correctness_score": 9,
    "explanation_validity_score": 9,
    "question_clarity_score": 7,
    "question_difficulty_score": 8,
    "question_groundedness_score": 9,
    "avg_answer_token_count": 10
  },
  {
    "context": "In 1853, Victoria gave birth to her eighth child, Leopold, with the aid of the new anaesthetic, chloroform. Victoria was so impressed by the relief it gave from the pain of childbirth that she used it again in 1857 at the birth of her ninth and final child, Beatrice, despite opposition from members of the clergy, who considered it against biblical teaching, and members of the medical profession, who thought it dangerous. Victoria may have suffered from post-natal depression after many of her pregnancies. Letters from Albert to Victoria intermittently complain of her loss of self-control. For example, about a month after Leopold's birth Albert complained in a letter to Victoria about her \"continuance of hysterics\" over a \"miserable trifle\".",
    "topic": "The historical context of women's rights and healthcare during the Victorian era and its relevance to Queen Victoria's experiences.",
    "response": "<document_analysis>\nThe provided context offers a glimpse into the life of Queen Victoria, specifically her experiences with childbirth and healthcare during the Victorian era. The use of chloroform as an anaesthetic during childbirth is highlighted, along with the opposition it faced from clergy and medical professionals. Additionally, the context touches upon the possibility of Queen Victoria suffering from post-natal depression, as evidenced by letters from Albert complaining about her \"hysterics\" and loss of self-control. \n\nTo generate a question that inspires thoughtful engagement and reflection, it is essential to consider the historical context of women's rights and healthcare during the Victorian era. The question should encourage the domain expert to think critically about the implications of Queen Victoria's experiences on the broader societal attitudes towards women's healthcare and rights.\n\nGiven the context, a potential question could explore the significance of Queen Victoria's use of chloroform during childbirth, particularly in relation to the opposition it faced. This could lead to a deeper discussion about the role of women in shaping healthcare practices and challenging societal norms during the Victorian era.\n\nThe question should be designed to be challenging, yet answerable by a domain expert without requiring the context paragraph. It should also ensure that all answer options are plausible and reasonable, with at least one incorrect answer being subtly wrong.\n\nThoughtful consideration of the context and the desired question characteristics suggests that a question focusing on the societal implications of Queen Victoria's experiences with chloroform and post-natal depression could be particularly effective in encouraging nuanced understanding and insight.\n</document_analysis>\n\n<output_format>\nQuestion: What was the primary concern of the clergy regarding Queen Victoria's use of chloroform during childbirth?\nA: It was believed to be a sin to interfere with the natural process of childbirth\nB: It was thought to be a threat to the authority of the medical profession\nC: It was considered a luxury only accessible to the wealthy\nD: It was deemed to be a violation of the biblical teaching that women should suffer in silence\n\nExplanation: The correct answer, A, reflects the context's mention of opposition from clergy who considered chloroform to be against biblical teaching. This question requires the domain expert to understand the historical context of women's rights and healthcare during the Victorian era and the specific concerns surrounding Queen Victoria's use of chloroform.\n\nCorrect Answer: A\n</output_format>",
    "question": "What was the primary concern of the clergy regarding Queen Victoria's use of chloroform during childbirth?",
    "choices": {
      "A": "It was believed to be a sin to interfere with the natural process of childbirth",
      "B": "It was thought to be a threat to the authority of the medical profession",
      "C": "It was considered a luxury only accessible to the wealthy",
      "D": "It was deemed to be a violation of the biblical teaching that women should suffer in silence"
    },
    "answer": "A",
    "explanation": "The correct answer, A, reflects the context's mention of opposition from clergy who considered chloroform to be against biblical teaching. This question requires the domain expert to understand the historical context of women's rights and healthcare during the Victorian era and the specific concerns surrounding Queen Victoria's use of chloroform.",
    "question_token_count": 21,
    "answer_correctness_score": 8,
    "explanation_validity_score": 7,
    "question_clarity_score": 8,
    "question_difficulty_score": 4,
    "question_groundedness_score": 10,
    "avg_answer_token_count": 15
  },
  {
    "context": "In July 2002, Beyonc\u00e9 continued her acting career playing Foxxy Cleopatra alongside Mike Myers in the comedy film, Austin Powers in Goldmember, which spent its first weekend atop the US box office and grossed $73 million. Beyonc\u00e9 released \"Work It Out\" as the lead single from its soundtrack album which entered the top ten in the UK, Norway, and Belgium. In 2003, Beyonc\u00e9 starred opposite Cuba Gooding, Jr., in the musical comedy The Fighting Temptations as Lilly, a single mother whom Gooding's character falls in love with. The film received mixed reviews from critics but grossed $30 million in the U.S. Beyonc\u00e9 released \"Fighting Temptation\" as the lead single from the film's soundtrack album, with Missy Elliott, MC Lyte, and Free which was also used to promote the film. Another of Beyonc\u00e9's contributions to the soundtrack, \"Summertime\", fared better on the US charts.",
    "topic": "The commercial success of \"Austin Powers in Goldmember\" and how it compares to other films in the Austin Powers series.",
    "response": "<document_analysis>\nThe provided context discusses Beyonc\u00e9's acting career, specifically her role in the film \"Austin Powers in Goldmember\" and its commercial success. It also mentions her contributions to the soundtrack and her work in another film, \"The Fighting Temptations\". To generate a question, we need to carefully analyze the given information and identify the central ideas and significant relationships within it.\n\nThe context states that \"Austin Powers in Goldmember\" spent its first weekend atop the US box office and grossed $73 million. This suggests that the film was commercially successful. However, to generate a challenging question, we need to consider the broader context of the Austin Powers series and how \"Goldmember\" compares to other films in the series.\n\nOne possible question could be about the commercial success of \"Goldmember\" in relation to other films in the series. However, we need to ensure that the question is answerable by a domain expert without the context paragraph and that the answer options are plausible and reasonable.\n\nAfter careful consideration, a possible question could be about the ranking of \"Goldmember\" in terms of box office performance compared to other films in the Austin Powers series.\n</document_analysis>\n\n<output_format>\nQuestion: What is the box office ranking of \"Austin Powers in Goldmember\" among the films in the Austin Powers series?\nA: Highest-grossing film in the series\nB: Second-highest-grossing film in the series\nC: Third-highest-grossing film in the series\nD: Lowest-grossing film in the series\nExplanation: The correct answer requires knowledge of the commercial performance of the Austin Powers films. According to box office data, \"Austin Powers in Goldmember\" is actually the highest-grossing film in the series.\nCorrect Answer: A\n</output_format>",
    "question": "What is the box office ranking of \"Austin Powers in Goldmember\" among the films in the Austin Powers series?",
    "choices": {
      "A": "Highest-grossing film in the series",
      "B": "Second-highest-grossing film in the series",
      "C": "Third-highest-grossing film in the series",
      "D": "Lowest-grossing film in the series"
    },
    "answer": "A",
    "explanation": "The correct answer requires knowledge of the commercial performance of the Austin Powers films. According to box office data, \"Austin Powers in Goldmember\" is actually the highest-grossing film in the series.",
    "question_token_count": 24,
    "answer_correctness_score": 1,
    "explanation_validity_score": 1,
    "question_clarity_score": 1,
    "question_difficulty_score": 7,
    "question_groundedness_score": 1,
    "avg_answer_token_count": 10
  },
  {
    "context": "Super Bowl 50 was an American football game to determine the champion of the National Football League (NFL) for the 2015 season. The American Football Conference (AFC) champion Denver Broncos defeated the National Football Conference (NFC) champion Carolina Panthers 24\u201310 to earn their third Super Bowl title. The game was played on February 7, 2016, at Levi's Stadium in the San Francisco Bay Area at Santa Clara, California. As this was the 50th Super Bowl, the league emphasized the \"golden anniversary\" with various gold-themed initiatives, as well as temporarily suspending the tradition of naming each Super Bowl game with Roman numerals (under which the game would have been known as \"Super Bowl L\"), so that the logo could prominently feature the Arabic numerals 50.",
    "topic": "The NFL's decision to temporarily suspend the tradition of naming each Super Bowl game with Roman numerals for Super Bowl 50 and the reasoning behind this choice.",
    "response": "<document_analysis>\nThe context provided revolves around Super Bowl 50, highlighting its significance as the 50th edition of the Super Bowl and the NFL's decision to deviate from the traditional Roman numeral naming convention for this particular game. The key points to analyze include the reason behind the temporary suspension of the Roman numeral tradition and the emphasis on the \"golden anniversary.\" \n\nUpon examination, it becomes clear that the primary motivation for this decision was to emphasize the milestone of reaching the 50th Super Bowl, leveraging the visual and thematic appeal of the Arabic numeral \"50\" to celebrate this occasion. The use of Arabic numerals allowed for a more direct and visually striking representation of the anniversary, aligning with the gold-themed initiatives to mark the event.\n\nGiven this context, the challenge lies in crafting a question that probes the understanding of this decision and its implications, requiring a deep engagement with the subject matter and an ability to reflect on the marketing and branding strategies employed by the NFL.\n\nThe thought process behind generating the question involves considering the strategic and symbolic significance of the NFL's decision, the potential impact on brand identity and fan perception, and the ways in which this decision reflects broader trends in sports marketing and event management.\n\nDifficulty rating: 8/10, as the question requires not only an understanding of the specific event but also an insight into the strategic thinking behind branding and marketing decisions in professional sports.\n</document_analysis>\n\n<output_format>\nQuestion: What strategic marketing consideration led the NFL to temporarily abandon its Roman numeral naming convention for Super Bowl 50?\nA: To align with the AFC's 50th-anniversary celebrations\nB: To emphasize the game's \"golden anniversary\" through prominent use of the number 50\nC: Due to fan confusion with Roman numerals\nD: As part of a permanent shift to Arabic numerals for all Super Bowls\n\nExplanation: The correct answer reflects the NFL's decision to visually and thematically emphasize the 50th anniversary of the Super Bowl, leveraging the gold-themed initiatives and the direct representation of \"50\" in Arabic numerals for marketing and branding purposes.\n\nCorrect Answer: B\n</output_format>",
    "question": "What strategic marketing consideration led the NFL to temporarily abandon its Roman numeral naming convention for Super Bowl 50?",
    "choices": {
      "A": "To align with the AFC's 50th-anniversary celebrations",
      "B": "To emphasize the game's \"golden anniversary\" through prominent use of the number 50",
      "C": "Due to fan confusion with Roman numerals",
      "D": "As part of a permanent shift to Arabic numerals for all Super Bowls"
    },
    "answer": "B",
    "explanation": "The correct answer reflects the NFL's decision to visually and thematically emphasize the 50th anniversary of the Super Bowl, leveraging the gold-themed initiatives and the direct representation of \"50\" in Arabic numerals for marketing and branding purposes.",
    "question_token_count": 22,
    "answer_correctness_score": 10,
    "explanation_validity_score": 10,
    "question_clarity_score": 9,
    "question_difficulty_score": 2,
    "question_groundedness_score": 10,
    "avg_answer_token_count": 13
  },
  {
    "context": "Gladstone returned to power after the 1892 general election; he was 82 years old. Victoria objected when Gladstone proposed appointing the Radical MP Henry Labouchere to the Cabinet, so Gladstone agreed not to appoint him. In 1894, Gladstone retired and, without consulting the outgoing prime minister, Victoria appointed Lord Rosebery as prime minister. His government was weak, and the following year Lord Salisbury replaced him. Salisbury remained prime minister for the remainder of Victoria's reign.",
    "topic": "The comparison of the political styles and policies of Gladstone, Lord Rosebery, and Lord Salisbury, and their respective impacts on British politics during Queen Victoria's reign.",
    "response": "<document_analysis>\nTo generate a highly insightful and probing question-answer pair, I will carefully analyze the provided context. The central idea of the context is the comparison of the political styles and policies of Gladstone, Lord Rosebery, and Lord Salisbury, and their respective impacts on British politics during Queen Victoria's reign.\n\nThe context highlights the significant events and decisions made by these prime ministers, including Gladstone's return to power, his retirement, and the subsequent appointments of Lord Rosebery and Lord Salisbury. It also mentions the objections and influences of Queen Victoria on the prime ministers' decisions.\n\nTo create a challenging question, I will consider the implicit assumptions and subtle details within the context. One key aspect is the relationship between the prime ministers and Queen Victoria, particularly the extent of her influence on their decisions.\n\nThe difficulty level of the question should be high (8-10), as it needs to encourage deep engagement with the content and critically reflect on the implications of the prime ministers' policies and Queen Victoria's influence.\n\nAfter careful consideration, I have planned a question that invites deeper understanding and meaningful reflection on the topic.\n</document_analysis>\n\n<output_format>\nQuestion: What was the primary factor that contributed to the weakness of Lord Rosebery's government, which ultimately led to his replacement by Lord Salisbury?\nA: Disagreements with Queen Victoria over cabinet appointments\nB: Lack of support from the Radical MP Henry Labouchere\nC: Inability to maintain a strong coalition with other political parties\nD: Insufficient experience in handling foreign policy issues\nExplanation: The context implies that Lord Rosebery's government was weak, but it does not explicitly state the reason. However, it can be inferred that the lack of a strong foundation, possibly due to Queen Victoria's influence and the absence of a clear mandate, contributed to his government's weakness. The correct answer is not explicitly stated, but option C is a plausible explanation, as it is a common factor that can lead to a government's weakness.\nCorrect Answer: C\n</output_format>",
    "question": "What was the primary factor that contributed to the weakness of Lord Rosebery's government, which ultimately led to his replacement by Lord Salisbury?",
    "choices": {
      "A": "Disagreements with Queen Victoria over cabinet appointments",
      "B": "Lack of support from the Radical MP Henry Labouchere",
      "C": "Inability to maintain a strong coalition with other political parties",
      "D": "Insufficient experience in handling foreign policy issues"
    },
    "answer": "C",
    "explanation": "The context implies that Lord Rosebery's government was weak, but it does not explicitly state the reason. However, it can be inferred that the lack of a strong foundation, possibly due to Queen Victoria's influence and the absence of a clear mandate, contributed to his government's weakness. The correct answer is not explicitly stated, but option C is a plausible explanation, as it is a common factor that can lead to a government's weakness.",
    "question_token_count": 28,
    "answer_correctness_score": 8,
    "explanation_validity_score": 7,
    "question_clarity_score": 6,
    "question_difficulty_score": 5,
    "question_groundedness_score": 1,
    "avg_answer_token_count": 11
  },
  {
    "context": "The Broncos took an early lead in Super Bowl 50 and never trailed. Newton was limited by Denver's defense, which sacked him seven times and forced him into three turnovers, including a fumble which they recovered for a touchdown. Denver linebacker Von Miller was named Super Bowl MVP, recording five solo tackles, 2\u00bd sacks, and two forced fumbles.",
    "topic": "Analysis of the psychological factors influencing player performance in high-pressure games like Super Bowl 50, including the impact of defensive pressure on quarterbacks.",
    "response": "<document_analysis>\nTo generate a question that probes the domain expert's understanding of the psychological factors influencing player performance in high-pressure games, we must first analyze the context provided. The context discusses Super Bowl 50, focusing on the performance of the Broncos and Panthers, particularly the impact of Denver's defense on Cam Newton. Key points include the Broncos' early lead, Newton's limitations due to Denver's defensive pressure, and the notable performance of Von Miller, who was named Super Bowl MVP.\n\nGiven this context, the question should delve into the psychological aspects of performance under pressure, specifically how defensive pressure can affect a quarterback's decision-making and overall game performance. The difficulty level of the question should be high (8/10) to challenge even the most knowledgeable domain experts.\n\nThe question planning involves considering how the psychological factors of pressure, stress, and momentum can influence player performance. It's also crucial to explore how these factors can be leveraged by defensive teams to gain an advantage, as seen in the context with Denver's strategy against Newton.\n\nIn terms of question characteristics, we aim for a question that encourages thoughtful engagement, is highly complex, and requires a deep understanding of psychological factors in sports performance. The question should be self-contained, clear, and of high educational impact, reflecting a genuine comprehension of the subject matter.\n\nGiven these considerations, the question should be designed to test the domain expert's ability to analyze the psychological dynamics at play in high-pressure situations like Super Bowl 50 and to understand how defensive strategies can psychologically impact quarterback performance.\n</document_analysis>\n\n<output_format>\nQuestion: What psychological mechanism is most likely to explain how defensive pressure, such as that applied by the Broncos in Super Bowl 50, impacts a quarterback's decision-making process during a game?\nA: Increased arousal leading to improved focus\nB: Enhanced stress perception leading to risk aversion\nC: Reduced working memory capacity due to anxiety\nD: Elevated confidence from past successes under pressure\n\nExplanation: Defensive pressure can significantly increase a quarterback's stress and anxiety levels, which in turn can affect cognitive functions such as decision-making. Among the options, reduced working memory capacity due to anxiety is a well-documented psychological effect of pressure, which can lead to poorer decision-making on the field.\n\nCorrect Answer: C\n</output_format>",
    "question": "What psychological mechanism is most likely to explain how defensive pressure, such as that applied by the Broncos in Super Bowl 50, impacts a quarterback's decision-making process during a game?",
    "choices": {
      "A": "Increased arousal leading to improved focus",
      "B": "Enhanced stress perception leading to risk aversion",
      "C": "Reduced working memory capacity due to anxiety",
      "D": "Elevated confidence from past successes under pressure"
    },
    "answer": "C",
    "explanation": "Defensive pressure can significantly increase a quarterback's stress and anxiety levels, which in turn can affect cognitive functions such as decision-making. Among the options, reduced working memory capacity due to anxiety is a well-documented psychological effect of pressure, which can lead to poorer decision-making on the field.",
    "question_token_count": 37,
    "answer_correctness_score": 9,
    "explanation_validity_score": 9,
    "question_clarity_score": 6,
    "question_difficulty_score": 8,
    "question_groundedness_score": 2,
    "avg_answer_token_count": 8
  },
  {
    "context": "In 1839, Melbourne resigned after Radicals and Tories (both of whom Victoria detested) voted against a bill to suspend the constitution of Jamaica. The bill removed political power from plantation owners who were resisting measures associated with the abolition of slavery. The Queen commissioned a Tory, Sir Robert Peel, to form a new ministry. At the time, it was customary for the prime minister to appoint members of the Royal Household, who were usually his political allies and their spouses. Many of the Queen's ladies of the bedchamber were wives of Whigs, and Peel expected to replace them with wives of Tories. In what became known as the bedchamber crisis, Victoria, advised by Melbourne, objected to their removal. Peel refused to govern under the restrictions imposed by the Queen, and consequently resigned his commission, allowing Melbourne to return to office.",
    "topic": "The role of Queen Victoria in the bedchamber crisis and her interactions with Melbourne and Sir Robert Peel, including the advice she received and the decisions she made.",
    "response": "<document_analysis>\nThe context provided revolves around the bedchamber crisis of 1839, involving Queen Victoria, Lord Melbourne, and Sir Robert Peel. The crisis stemmed from the Queen's objection to replacing her ladies of the bedchamber, who were predominantly wives of Whigs, with wives of Tories as expected by Peel upon his appointment to form a new ministry. This situation highlights the Queen's early exercise of power and her reliance on Melbourne's advice.\n\nUpon analyzing the context, several key points emerge:\n1. **The Political Landscape**: The resignation of Melbourne and the subsequent attempt by Peel to form a ministry underscore the political tensions of the time, including the divisions between Radicals, Tories, and Whigs.\n2. **Queen Victoria's Influence**: The bedchamber crisis showcases Queen Victoria's assertion of her will, particularly in resisting changes to her household staff based on political affiliations.\n3. **Advisory Roles**: Melbourne's advice to the Queen played a significant role in her decision-making, illustrating the influence of prime ministers on monarchs during this period.\n4. **Constitutional Implications**: The crisis touches on constitutional matters, such as the balance of power between the monarch and the prime minister, and the conventions surrounding the formation of ministries and the appointment of royal household members.\n\nGiven these considerations, the question should delve into the nuances of the Queen's decision-making process, the political implications of the bedchamber crisis, and the advisory role of Melbourne. It should challenge the respondent to demonstrate a deep understanding of the historical context, the personalities involved, and the constitutional principles at play.\n\nThe difficulty level of the question should be high (8/10), requiring the respondent to synthesize information about the political climate of the time, the specific events of the bedchamber crisis, and the roles of key figures like Melbourne and Peel. The question should be designed to encourage thoughtful engagement with the subject matter, beyond mere recall of facts, and to assess the respondent's ability to analyze complex historical situations and their constitutional implications.\n</document_analysis>\n\n<output_format>\nQuestion: What significant political and constitutional principle was underscored by Queen Victoria's resistance to Sir Robert Peel's expected changes to her ladies of the bedchamber in 1839?\nA: The absolute power of the monarch in appointing royal household staff.\nB: The convention of the prime minister advising on but not dictating royal household appointments.\nC: The political neutrality of the royal household in party political matters.\nD: The limitation on the monarch's ability to influence the formation of a ministry based on personal preference.\n\nExplanation: The correct answer reflects the understanding that the bedchamber crisis highlighted the monarch's resistance to political pressure from the prime minister regarding appointments to the royal household, which has implications for the balance of power and constitutional conventions.\n\nCorrect Answer: B\n</output_format>",
    "question": "What significant political and constitutional principle was underscored by Queen Victoria's resistance to Sir Robert Peel's expected changes to her ladies of the bedchamber in 1839?",
    "choices": {
      "A": "The absolute power of the monarch in appointing royal household staff.",
      "B": "The convention of the prime minister advising on but not dictating royal household appointments.",
      "C": "The political neutrality of the royal household in party political matters.",
      "D": "The limitation on the monarch's ability to influence the formation of a ministry based on personal preference."
    },
    "answer": "B",
    "explanation": "The correct answer reflects the understanding that the bedchamber crisis highlighted the monarch's resistance to political pressure from the prime minister regarding appointments to the royal household, which has implications for the balance of power and constitutional conventions.",
    "question_token_count": 35,
    "answer_correctness_score": 10,
    "explanation_validity_score": 9,
    "question_clarity_score": 8,
    "question_difficulty_score": 7,
    "question_groundedness_score": 9,
    "avg_answer_token_count": 16
  },
  {
    "context": "Victoria's father was Prince Edward, Duke of Kent and Strathearn, the fourth son of the reigning King of the United Kingdom, George III. Until 1817, Edward's niece, Princess Charlotte of Wales, was the only legitimate grandchild of George III. Her death in 1817 precipitated a succession crisis that brought pressure on the Duke of Kent and his unmarried brothers to marry and have children. In 1818 he married Princess Victoria of Saxe-Coburg-Saalfeld, a widowed German princess with two children\u2014Carl (1804\u20131856) and Feodora (1807\u20131872)\u2014by her first marriage to the Prince of Leiningen. Her brother Leopold was Princess Charlotte's widower. The Duke and Duchess of Kent's only child, Victoria, was born at 4.15 a.m. on 24 May 1819 at Kensington Palace in London.",
    "topic": "The historical context of the British monarchy in the early 19th century, including the reign of King George III and the implications of the succession crisis for the royal family.",
    "response": "<document_analysis>\nThe provided context revolves around the historical context of the British monarchy in the early 19th century, specifically focusing on the reign of King George III and the implications of the succession crisis for the royal family. The key points include the death of Princess Charlotte of Wales in 1817, which led to a succession crisis, and the subsequent marriage of Prince Edward, Duke of Kent and Strathearn, to Princess Victoria of Saxe-Coburg-Saalfeld in 1818. Their child, Victoria, was born in 1819. \n\nThe central idea here is the succession crisis faced by the British monarchy following the death of Princess Charlotte, who was the only legitimate grandchild of King George III at the time. This event prompted the unmarried sons of King George III, including Prince Edward, to marry and produce heirs to secure the lineage of the monarchy.\n\nUpon analyzing the context, it becomes clear that the question should delve into the intricacies of the succession crisis and its implications for the royal family, rather than merely recalling factual information. A thoughtful and challenging question would require the test-taker to understand the underlying dynamics and pressures faced by the royal family during this period.\n\nGiven the complexity of the historical context and the need for a question that encourages deep engagement and reflection, the difficulty level of the question should be rated as 8 out of 10. The question should be designed to challenge even the most knowledgeable domain experts, requiring them to demonstrate a nuanced understanding of the historical events and their implications for the British monarchy.\n\nIn planning the question, it's essential to ensure that it invites a deeper understanding of the context, meaningful reflection, or critical engagement with the subject matter. The question should be purposeful, encouraging the test-taker to think critically about the succession crisis and its impact on the royal family.\n</document_analysis>\n\n<output_format>\nQuestion: What significant event in 1817 led to a succession crisis in the British monarchy, prompting Prince Edward, Duke of Kent and Strathearn, to marry and have children?\nA: The death of King George III\nB: The marriage of Princess Charlotte of Wales\nC: The death of Princess Charlotte of Wales\nD: The birth of Queen Victoria\n\nExplanation: The correct answer is supported by the context, which states that Princess Charlotte's death in 1817 precipitated a succession crisis. This event led to pressure on the Duke of Kent and his unmarried brothers to marry and have children, ultimately resulting in the birth of Queen Victoria.\n\nCorrect Answer: C\n</output_format>",
    "question": "What significant event in 1817 led to a succession crisis in the British monarchy, prompting Prince Edward, Duke of Kent and Strathearn, to marry and have children?",
    "choices": {
      "A": "The death of King George III",
      "B": "The marriage of Princess Charlotte of Wales",
      "C": "The death of Princess Charlotte of Wales",
      "D": "The birth of Queen Victoria"
    },
    "answer": "C",
    "explanation": "The correct answer is supported by the context, which states that Princess Charlotte's death in 1817 precipitated a succession crisis. This event led to pressure on the Duke of Kent and his unmarried brothers to marry and have children, ultimately resulting in the birth of Queen Victoria.",
    "question_token_count": 37,
    "answer_correctness_score": 10,
    "explanation_validity_score": 10,
    "question_clarity_score": 8,
    "question_difficulty_score": 6,
    "question_groundedness_score": 10,
    "avg_answer_token_count": 7
  },
  {
    "context": "It was temporarily under the control of the Tibetan empire and Chinese from 650\u2013680 and then under the control of the Umayyads in 710. The Samanid Empire, 819 to 999, restored Persian control of the region and enlarged the cities of Samarkand and Bukhara (both cities are today part of Uzbekistan) which became the cultural centers of Iran and the region was known as Khorasan. The Kara-Khanid Khanate conquered Transoxania (which corresponds approximately with modern-day Uzbekistan, Tajikistan, southern Kyrgyzstan and southwest Kazakhstan) and ruled between 999\u20131211. Their arrival in Transoxania signaled a definitive shift from Iranian to Turkic predominance in Central Asia, but gradually the Kara-khanids became assimilated into the Perso-Arab Muslim culture of the region.",
    "topic": "The impact of the Kara-Khanid Khanate's rule on the region's politics, economy, and society, including the shift from Iranian to Turkic predominance.",
    "response": "<document_analysis>\nThe provided context discusses the historical transitions of control in the region of Transoxania, which corresponds to modern-day Uzbekistan, Tajikistan, southern Kyrgyzstan, and southwest Kazakhstan. It mentions the temporary control by the Tibetan empire, Chinese, Umayyads, and the restoration of Persian control by the Samanid Empire. The key event highlighted is the conquest by the Kara-Khanid Khanate from 999 to 1211, marking a shift from Iranian to Turkic predominance. However, it's noted that the Kara-khanids gradually assimilated into the Perso-Arab Muslim culture of the region.\n\nThe central idea here revolves around the political, economic, and societal impacts of the Kara-Khanid Khanate's rule, particularly the transition from Iranian to Turkic influence. To generate a highly insightful and probing question, we must consider the implicit assumptions and subtle details within this context. The question should invite a deep understanding of the historical events, their implications on the region's culture, and the significance of the shift towards Turkic predominance.\n\nGiven the complexity of the topic and the need for a challenging question, a suitable approach would be to explore the consequences of the Kara-Khanid Khanate's assimilation into the Perso-Arab Muslim culture. This could involve analyzing how this assimilation affected the political structure, economic practices, and societal norms of the region, considering both the short-term and long-term effects.\n\nThe difficulty level of the question should be high (8-10), aiming to challenge even the most knowledgeable domain experts. The question should be self-contained, requiring no external references to be understood, and should naturally integrate the content without giving away the answer.\n\nIn terms of question types, an analytical or conceptual question would be most appropriate, as it would require the synthesis of high-level understanding and general knowledge beyond the specific context provided.\n</document_analysis>\n\n<output_format>\nQuestion: What was the primary cultural outcome of the Kara-Khanid Khanate's gradual assimilation into the Perso-Arab Muslim culture of Transoxania during their rule from 999 to 1211?\nA: Complete eradication of Iranian cultural influences\nB: Emergence of a distinct Turkic-Perso-Arab cultural identity\nC: Reversion to pre-Samanid Empire cultural practices\nD: Isolation of Turkic cultural elements from Perso-Arab influences\n\nExplanation: The correct answer, \"Emergence of a distinct Turkic-Perso-Arab cultural identity,\" reflects the historical outcome of the Kara-Khanid Khanate's assimilation. This assimilation led to a blending of cultures, resulting in a unique cultural identity that was distinct from both the preceding Iranian dominance and the incoming Turkic influences. This outcome is a direct consequence of the Kara-Khanid Khanate's interaction with the existing Perso-Arab Muslim culture of the region.\n\nCorrect Answer: B\n</output_format>",
    "question": "What was the primary cultural outcome of the Kara-Khanid Khanate's gradual assimilation into the Perso-Arab Muslim culture of Transoxania during their rule from 999 to 1211?",
    "choices": {
      "A": "Complete eradication of Iranian cultural influences",
      "B": "Emergence of a distinct Turkic-Perso-Arab cultural identity",
      "C": "Reversion to pre-Samanid Empire cultural practices",
      "D": "Isolation of Turkic cultural elements from Perso-Arab influences"
    },
    "answer": "B",
    "explanation": "The correct answer, \"Emergence of a distinct Turkic-Perso-Arab cultural identity,\" reflects the historical outcome of the Kara-Khanid Khanate's assimilation. This assimilation led to a blending of cultures, resulting in a unique cultural identity that was distinct from both the preceding Iranian dominance and the incoming Turkic influences. This outcome is a direct consequence of the Kara-Khanid Khanate's interaction with the existing Perso-Arab Muslim culture of the region.",
    "question_token_count": 40,
    "answer_correctness_score": 10,
    "explanation_validity_score": 10,
    "question_clarity_score": 1,
    "question_difficulty_score": 8,
    "question_groundedness_score": 6,
    "avg_answer_token_count": 11
  }
]