[
  {
    "context": "<P> A player has taken two hat - tricks in the same Test match only once . Playing for Australia against South Africa in the first match of the 1912 Triangular Tournament at Old Trafford , Manchester , England , leg spinner Jimmy Matthews took a hat - trick in South Africa 's first and second innings , both taken on 28 May 1912 . He completed both hat - tricks by dismissing South Africa 's Tommy Ward . Only three other cricketers have taken more than one Test hat - trick : Australian off spinner Hugh Trumble ( two years apart , between the same teams at the same ground ) , Pakistani fast bowler Wasim Akram ( just over a week apart , in consecutive matches between the same teams ) and English fast bowler Stuart Broad . Three players have taken a hat - trick on their Test debut : English medium pace bowler Maurice Allom in 1930 , New Zealand off - spinner Peter Petherick in 1976 , and Australian pace bowler Damien Fleming in 1994 . Geoff Griffin took the fewest total Test wickets of any player who recorded a hat - trick , taking only eight wickets in his entire Test career . During the match in which he took his hat - trick , Griffin was repeatedly called for throwing by the umpires and never bowled again in a Test match . Australian Peter Siddle is the only bowler to take a hat - trick on his birthday , and Bangladeshi off spinner Sohag Gazi is the only player to score a century and take a hat - trick in the same Test match . </P>",
    "topic": "Peter Siddle is the sole bowler to have achieved a hat-trick on his birthday during a Test match.",
    "response": "<document_analysis>\n1. **Thoughtful Content Examination:** The provided text details various unique achievements in Test cricket hat-tricks. It covers instances of multiple hat-tricks in a single match, hat-tricks on debut, fewest wickets taken by a hat-trick taker, and unique occurrences like a hat-trick on a birthday or a century and a hat-trick in the same match.\n2. **Concept Exploration:** The text highlights statistical anomalies and interesting facts within the broader context of Test cricket. It touches upon the rarity of certain achievements, emphasizing the specific players and matches where these events occurred. The implicit assumption is that these are noteworthy events due to their infrequent nature.\n3. **Strategic Complexity Calibration:** Difficulty: 8/10. The question will focus on the unique achievements described, requiring recall of specific details and potentially distinguishing between similar records.\n4. **Intentional Question Planning:** The question will focus on identifying the singular instance of a specific achievement, testing the ability to recall a unique detail amidst a list of several other unique facts. The options will be designed to be plausible, drawing from other records mentioned in the text.\n</document_analysis>\n\n<output_format>\nQuestion: Which cricketer holds the unique distinction of achieving a hat-trick on their birthday during a Test match?\nA: Jimmy Matthews\nB: Damien Fleming\nC: Peter Siddle\nD: Wasim Akram\nExplanation: The text explicitly states, \"Australian Peter Siddle is the only bowler to take a hat - trick on his birthday.\"\nCorrect Answer: C\n</output_format>",
    "question": "Which cricketer holds the unique distinction of achieving a hat-trick on their birthday during a Test match?",
    "choices": {
      "A": "Jimmy Matthews",
      "B": "Damien Fleming",
      "C": "Peter Siddle",
      "D": "Wasim Akram"
    },
    "answer": "C",
    "explanation": "The text explicitly states, \"Australian Peter Siddle is the only bowler to take a hat - trick on his birthday.\"",
    "question_token_count": 23,
    "answer_correctness_score": 10,
    "explanation_validity_score": 10,
    "question_clarity_score": 8,
    "question_difficulty_score": 7,
    "question_groundedness_score": 5,
    "avg_answer_token_count": 4
  },
  {
    "context": "<P> `` Death and All His Friends '' is the season finale of the sixth season of the American television medical drama Grey 's Anatomy , and the show 's 126th episode overall . It was written by Shonda Rhimes and directed by Rob Corn . The episode was originally broadcast on the American Broadcasting Company ( ABC ) in the United States on May 20 , 2010 . The episode was the second part of the two - hour season six finale , the first being Sanctuary , and took place at the fictional Seattle Grace Hospital . The original episode broadcast in the United States had an audience of 16.13 million viewers and opened up to universal acclaim . The episode centers a shooting spree at the hospital by a former patient 's husband Gary Clark ( Michael O'Neill ) . The episode marked the last appearances for Nora Zehetner and Robert Baker as Dr. Reed Adamson and Dr. Charles Percy respectively as both the characters were killed in the shooting . </P>",
    "topic": "The two-part structure of the season six finale, including the preceding episode's title.",
    "response": "<document_analysis>\n1. **Thoughtful Content Examination:** The context describes the season six finale of Grey's Anatomy, specifically \"Death and All His Friends,\" and its preceding episode, \"Sanctuary.\" It details the episode's authorship, director, broadcast date, viewership, critical reception, and central plot point\u2014a hospital shooting. It also notes the departure of two characters.\n2. **Concept Exploration:** The core concept is the structure of a television season finale as a two-part event. This is a common practice to build suspense and allow for more complex storylines. The context also touches on the dramatic impact of character deaths and the use of a shooting event as a narrative device.\n3. **Strategic Complexity Calibration:** Difficulty: 8/10. The question needs to test understanding of the episode structure and the relationship between the two parts of the finale.\n4. **Intentional Question Planning:** The question will focus on the precise naming of the two-part finale, requiring recall of specific details rather than general understanding of the plot. This tests the domain expert's attention to detail regarding television production and episode naming conventions.\n</document_analysis>\n<output_format>\nQuestion: Which episode immediately preceded \u201cDeath and All His Friends\u201d as part of the season six finale of *Grey\u2019s Anatomy*?\nA: \u201cSanctuary\u201d\nB: \u201cInvasion\u201d\nC: \u201cGolden Hour\u201d\nD: \u201cThe Choice\u201d\nExplanation: The provided text explicitly states that \u201cDeath and All His Friends\u201d was the second part of a two-hour season six finale, with \u201cSanctuary\u201d being the first part.\nCorrect Answer: A\n</output_format>",
    "question": "Which episode immediately preceded \u201cDeath and All His Friends\u201d as part of the season six finale of *Grey\u2019s Anatomy*?",
    "choices": {
      "A": "\u201cSanctuary\u201d",
      "B": "\u201cInvasion\u201d",
      "C": "\u201cGolden Hour\u201d",
      "D": "\u201cThe Choice\u201d"
    },
    "answer": "A",
    "explanation": "The provided text explicitly states that \u201cDeath and All His Friends\u201d was the second part of a two-hour season six finale, with \u201cSanctuary\u201d being the first part.",
    "question_token_count": 26,
    "answer_correctness_score": 10,
    "explanation_validity_score": 10,
    "question_clarity_score": 8,
    "question_difficulty_score": 4,
    "question_groundedness_score": 10,
    "avg_answer_token_count": 4
  },
  {
    "context": "<P> The College Football Playoff selection committee chose the semifinalists following the conclusion of the 2017 regular season . Alabama and Georgia advanced to the national championship after winning the semifinal games hosted by the Sugar Bowl and the Rose Bowl , respectively , on January 1 , 2018 . The championship game was played at Mercedes - Benz Stadium in Atlanta , Georgia on January 8 , 2018 . </P>",
    "topic": "Identify the city and state where the 2018 College Football Playoff National Championship game was held.",
    "response": "```xml\n<document_analysis>\n1. **Thoughtful Content Examination**: The text focuses on the 2018 College Football Playoff National Championship, detailing the teams involved (Alabama and Georgia), the semifinal games' locations (Sugar Bowl and Rose Bowl), and crucially, the championship game's location (Mercedes-Benz Stadium in Atlanta, Georgia) and date (January 8, 2018).\n2. **Concept Exploration**: The implicit understanding required is knowledge of the College Football Playoff system, the roles of bowl games in the selection process, and the significance of a national championship game. The text provides a factual account, not delving into strategic implications or historical context.\n3. **Strategic Complexity Calibration**: Difficulty: 7/10. While the answer is explicitly stated, the question requires recalling specific details from a concise paragraph. The challenge lies in remembering both the city and state.\n4. **Intentional Question Planning**: The question directly tests recall of factual information presented in the text. The multiple-choice format adds a layer of complexity, requiring the examinee to differentiate between plausible locations. The question tests a domain expert's attention to detail and memory regarding major college football events.\n</document_analysis>\n<output_format>\nQuestion: In what city and state was the 2018 College Football Playoff National Championship game played?\nA: Pasadena, California\nB: New Orleans, Louisiana\nC: Atlanta, Georgia\nD: Tampa, Florida\nExplanation: The text explicitly states that the championship game was played at Mercedes-Benz Stadium in Atlanta, Georgia on January 8, 2018.\nCorrect Answer: C\n</output_format>\n```",
    "question": "In what city and state was the 2018 College Football Playoff National Championship game played?",
    "choices": {
      "A": "Pasadena, California",
      "B": "New Orleans, Louisiana",
      "C": "Atlanta, Georgia",
      "D": "Tampa, Florida"
    },
    "answer": "C",
    "explanation": "The text explicitly states that the championship game was played at Mercedes-Benz Stadium in Atlanta, Georgia on January 8, 2018.",
    "question_token_count": 20,
    "answer_correctness_score": 10,
    "explanation_validity_score": 10,
    "question_clarity_score": 10,
    "question_difficulty_score": 4,
    "question_groundedness_score": 8,
    "avg_answer_token_count": 4
  },
  {
    "context": "<Table> <Tr> <Td> May 20 , 2012 Annular </Td> <Td> August 21 , 2017 Total </Td> <Td> October 14 , 2023 Annular </Td> <Td> April 8 , 2024 Total </Td> </Tr> <Tr> <Td> March 30 , 2033 Total </Td> <Td> June 21 , 2039 Annular </Td> <Td> August 23 , 2044 Total </Td> <Td> August 12 , 2045 Total </Td> </Tr> <Tr> <Td> February 5 , 2046 Annular </Td> <Td> June 11 , 2048 Annular </Td> </Tr> </Table>",
    "topic": "Determine the date of the next total solar eclipse following May 20, 2012, as listed in the table.",
    "response": "```xml\n<document_analysis>\n1. **Thoughtful Content Examination:** The context provides a table listing dates and types of solar eclipses. The primary task is to identify the date of the next total solar eclipse *after* May 20, 2012.\n2. **Concept Exploration:** This question tests the ability to accurately read and interpret data from a table. It's a straightforward factual recall question, but requires careful attention to the 'total' eclipse type and chronological order. The difficulty lies in avoiding simple reading errors.\n3. **Strategic Complexity Calibration:** Difficulty: 3/10. While seemingly simple, the question requires careful scanning of the table to avoid selecting an annular eclipse or a total eclipse *before* May 20, 2012.\n4. **Intentional Question Planning:** The question is designed to test attention to detail and the ability to extract specific information from a structured dataset. The distractors will be other dates and eclipse types within the table.\n</document_analysis>\n<output_format>\nQuestion: Which of the following dates marks the next total solar eclipse occurring after May 20, 2012, according to the provided data?\nA: October 14, 2023\nB: August 21, 2017\nC: April 8, 2024\nD: March 30, 2033\nExplanation: The table lists solar eclipses and their dates. Scanning the table reveals that August 21, 2017, is the first total solar eclipse listed after May 20, 2012.\nCorrect Answer: B\n</output_format>\n```",
    "question": "Which of the following dates marks the next total solar eclipse occurring after May 20, 2012, according to the provided data?",
    "choices": {
      "A": "October 14, 2023",
      "B": "August 21, 2017",
      "C": "April 8, 2024",
      "D": "March 30, 2033"
    },
    "answer": "B",
    "explanation": "The table lists solar eclipses and their dates. Scanning the table reveals that August 21, 2017, is the first total solar eclipse listed after May 20, 2012.",
    "question_token_count": 28,
    "answer_correctness_score": 10,
    "explanation_validity_score": 10,
    "question_clarity_score": 6,
    "question_difficulty_score": 4,
    "question_groundedness_score": 10,
    "avg_answer_token_count": 8
  },
  {
    "context": "<P> England did not enter the competition until 1950 , but have entered all eighteen subsequent tournaments . They have failed to qualify for the finals on three occasions , 1974 ( West Germany ) , 1978 ( Argentina ) and 1994 ( United States ) , and have failed to advance from the group stages on three occasions ; at the 1950 FIFA World Cup , the 1958 FIFA World Cup and the 2014 FIFA World Cup . Their best ever performance is winning the Cup in the 1966 tournament held in England , whilst they also finished in fourth place in 1990 , in Italy , and in 2018 in Russia . Other than that , the team have reached the quarter - finals on nine occasions , the latest of which were at the 2002 ( South Korea / Japan ) and the 2006 ( Germany ) . </P>",
    "topic": "Describe England\u2019s most significant achievement in the FIFA World Cup, including the year and location of the tournament.",
    "response": "<document_analysis>\n1. **Thoughtful Content Examination**: The text details England's participation in the FIFA World Cup, highlighting their entry year, qualification failures, group stage exits, and best performance. The central idea revolves around England's historical performance in the tournament.\n2. **Concept Exploration**: The text implicitly contrasts England's consistent participation with occasional failures to qualify or advance. It emphasizes the significance of their 1966 victory as their sole World Cup win.\n3. **Strategic Complexity Calibration**: Difficulty: 7/10. The information is directly stated but requires recall of specific details (year and location) alongside understanding \"best ever performance\". The distractors will focus on other mentioned achievements.\n4. **Intentional Question Planning**: The question aims to test the candidate's recall of a key fact \u2013 England\u2019s single World Cup win \u2013 and their ability to associate it with the correct year and host nation. It avoids simple recall by including multiple plausible, yet incorrect, options based on other details mentioned in the text.\n</document_analysis>\n\n<output_format>\nQuestion: In what year and location did England achieve its most significant result in the FIFA World Cup?\nA: 1990, Italy\nB: 1966, England\nC: 2018, Russia\nD: 1950, Brazil\nExplanation: The text explicitly states, \u201cTheir best ever performance is winning the Cup in the 1966 tournament held in England.\u201d\nCorrect Answer: B\n</output_format>",
    "question": "In what year and location did England achieve its most significant result in the FIFA World Cup?",
    "choices": {
      "A": "1990, Italy",
      "B": "1966, England",
      "C": "2018, Russia",
      "D": "1950, Brazil"
    },
    "answer": "B",
    "explanation": "The text explicitly states, \u201cTheir best ever performance is winning the Cup in the 1966 tournament held in England.\u201d",
    "question_token_count": 19,
    "answer_correctness_score": 10,
    "explanation_validity_score": 10,
    "question_clarity_score": 8,
    "question_difficulty_score": 4,
    "question_groundedness_score": 10,
    "avg_answer_token_count": 5
  },
  {
    "context": "<P> The seventh season of the fantasy drama television series Game of Thrones premiered on HBO on July 16 , 2017 , and concluded on August 27 , 2017 . Unlike previous seasons that consisted of ten episodes each , the seventh season consisted of only seven . Like the previous season , it largely consisted of original content not found in George R.R. Martin 's A Song of Ice and Fire series , while also incorporating material Martin revealed to showrunners about the upcoming novels in the series . The series was adapted for television by David Benioff and D.B. Weiss . </P>",
    "topic": "Identify the showrunners responsible for adapting Game of Thrones for television.",
    "response": "```xml\n<document_analysis>\n1. **Thoughtful Content Examination:** The context discusses the seventh season of Game of Thrones, noting its shorter length and reliance on both existing source material and information provided by the author about future novels. Crucially, it explicitly states who adapted the series for television.\n2. **Concept Exploration:** The core concept is the adaptation process from novel to television. The text implies a degree of creative license taken by the showrunners, moving beyond a strict page-to-screen translation.\n3. **Strategic Complexity Calibration:** Difficulty: 3/10. While the answer is directly stated, the question can be made challenging by including plausible distractors related to other influential figures involved in the production.\n4. **Intentional Question Planning:** The question will directly ask for the showrunners, testing recall of this specific information. The distractors will involve roles like author, executive producer, and composer to increase the challenge.\n</document_analysis>\n<output_format>\nQuestion: Which individuals were primarily responsible for adapting the *Game of Thrones* series for television?\nA: George R.R. Martin and Bryan Cogman\nB: David Benioff and D.B. Weiss\nC: Carolyn Strauss and Frank Doelger\nD: Miguel Sapochnik and Alan Taylor\nExplanation: The text explicitly states that David Benioff and D.B. Weiss adapted the series for television.\nCorrect Answer: B\n</output_format>\n```",
    "question": "Which individuals were primarily responsible for adapting the *Game of Thrones* series for television?",
    "choices": {
      "A": "George R.R. Martin and Bryan Cogman",
      "B": "David Benioff and D.B. Weiss",
      "C": "Carolyn Strauss and Frank Doelger",
      "D": "Miguel Sapochnik and Alan Taylor"
    },
    "answer": "B",
    "explanation": "The text explicitly states that David Benioff and D.B. Weiss adapted the series for television.",
    "question_token_count": 18,
    "answer_correctness_score": 10,
    "explanation_validity_score": 10,
    "question_clarity_score": 6,
    "question_difficulty_score": 5,
    "question_groundedness_score": 10,
    "avg_answer_token_count": 9
  },
  {
    "context": "<Table> <Tr> <Th> No . </Th> <Th> Athlete </Th> <Th> Nation </Th> <Th> Sport </Th> <Th> Years </Th> <Th> Games </Th> <Th> Gender </Th> <Th> Gold </Th> <Th> Silver </Th> <Th> Bronze </Th> <Th> Total </Th> </Tr> <Tr> <Th> </Th> <Td> Phelps , Michael Michael Phelps </Td> <Td> United States </Td> <Td> Swimming </Td> <Td> 2004 -- 2016 </Td> <Td> Summer </Td> <Td> </Td> <Td> 23 </Td> <Td> </Td> <Td> </Td> <Td> 28 </Td> </Tr> <Tr> <Th> </Th> <Td> Latynina , Larisa Larisa Latynina </Td> <Td> Soviet Union </Td> <Td> Gymnastics </Td> <Td> 1956 -- 1964 </Td> <Td> Summer </Td> <Td> </Td> <Td> 9 </Td> <Td> 5 </Td> <Td> </Td> <Td> 18 </Td> </Tr> <Tr> <Th> </Th> <Td> Nurmi , Paavo Paavo Nurmi </Td> <Td> Finland </Td> <Td> Athletics </Td> <Td> 1920 -- 1928 </Td> <Td> Summer </Td> <Td> </Td> <Td> 9 </Td> <Td> </Td> <Td> 0 </Td> <Td> 12 </Td> </Tr> <Tr> <Th> </Th> <Td> Spitz , Mark Mark Spitz </Td> <Td> United States </Td> <Td> Swimming </Td> <Td> 1968 -- 1972 </Td> <Td> Summer </Td> <Td> </Td> <Td> 9 </Td> <Td> </Td> <Td> </Td> <Td> 11 </Td> </Tr> <Tr> <Th> 5 </Th> <Td> Lewis , Carl Carl Lewis </Td> <Td> United States </Td> <Td> Athletics </Td> <Td> 1984 -- 1996 </Td> <Td> Summer </Td> <Td> </Td> <Td> 9 </Td> <Td> </Td> <Td> 0 </Td> <Td> 10 </Td> </Tr> <Tr> <Th> 6 </Th> <Td> Bj\u00f8rgen , Marit Marit Bj\u00f8rgen </Td> <Td> Norway </Td> <Td> Cross-country skiing </Td> <Td> 2002 -- 2018 </Td> <Td> Winter </Td> <Td> </Td> <Td> 8 </Td> <Td> </Td> <Td> </Td> <Td> 15 </Td> </Tr> <Tr> <Th> 7 </Th> <Td> Bj\u00f8rndalen , Ole Einar Ole Einar Bj\u00f8rndalen </Td> <Td> Norway </Td> <Td> Biathlon </Td> <Td> 1998 -- 2014 </Td> <Td> Winter </Td> <Td> </Td> <Td> 8 </Td> <Td> </Td> <Td> </Td> <Td> 13 </Td> </Tr> <Tr> <Th> 8 </Th> <Td> D\u00e6hlie , Bj\u00f8rn Bj\u00f8rn D\u00e6hlie </Td> <Td> Norway </Td> <Td> Cross-country skiing </Td> <Td> 1992 -- 1998 </Td> <Td> Winter </Td> <Td> </Td> <Td> 8 </Td> <Td> </Td> <Td> 0 </Td> <Td> 12 </Td> </Tr> <Tr> <Td> Fischer , Birgit Birgit Fischer </Td> <Td> East Germany Germany </Td> <Td> Canoeing </Td> <Td> 1980 -- 2004 </Td> <Td> Summer </Td> <Td> </Td> <Td> 8 </Td> <Td> </Td> <Td> 0 </Td> <Td> 12 </Td> </Tr> <Tr> <Th> 10 </Th> <Td> Kato , Sawao Sawao Kato </Td> <Td> Japan </Td> <Td> Gymnastics </Td> <Td> 1968 -- 1976 </Td> <Td> Summer </Td> <Td> </Td> <Td> 8 </Td> <Td> </Td> <Td> </Td> <Td> 12 </Td> </Tr> <Tr> <Td> Thompson , Jenny Jenny Thompson </Td> <Td> United States </Td> <Td> Swimming </Td> <Td> 1992 -- 2004 </Td> <Td> Summer </Td> <Td> </Td> <Td> 8 </Td> <Td> </Td> <Td> </Td> <Td> 12 </Td> </Tr> <Tr> <Th> 12 </Th> <Td> Biondi , Matt Matt Biondi </Td> <Td> United States </Td> <Td> Swimming </Td> <Td> 1984 -- 1992 </Td> <Td> Summer </Td> <Td> </Td> <Td> 8 </Td> <Td> </Td> <Td> </Td> <Td> 11 </Td> </Tr> <Tr> <Th> 13 </Th> <Td> Bolt , Usain Usain Bolt </Td> <Td> Jamaica </Td> <Td> Athletics </Td> <Td> 2008 -- 2016 </Td> <Td> Summer </Td> <Td> </Td> <Td> 8 </Td> <Td> 0 </Td> <Td> 0 </Td> <Td> 8 </Td> </Tr> <Tr> <Td> Ewry , Ray Ray Ewry </Td> <Td> United States </Td> <Td> Athletics </Td> <Td> 1900 -- 1908 </Td> <Td> Summer </Td> <Td> </Td> <Td> 8 </Td> <Td> 0 </Td> <Td> 0 </Td> <Td> 8 </Td> </Tr> <Tr> <Th> 15 </Th> <Td> Andrianov , Nikolai Nikolai Andrianov </Td> <Td> Soviet Union </Td> <Td> Gymnastics </Td> <Td> 1972 -- 1980 </Td> <Td> Summer </Td> <Td> </Td> <Td> 7 </Td> <Td> 5 </Td> <Td> </Td> <Td> 15 </Td> </Tr> <Tr> <Th> 16 </Th> <Td> Shakhlin , Boris Boris Shakhlin </Td> <Td> Soviet Union </Td> <Td> Gymnastics </Td> <Td> 1956 -- 1964 </Td> <Td> Summer </Td> <Td> </Td> <Td> 7 </Td> <Td> </Td> <Td> </Td> <Td> 13 </Td> </Tr> <Tr> <Th> 17 </Th> <Td> \u010c\u00e1slavsk\u00e1 , V\u011bra V\u011bra \u010c\u00e1slavsk\u00e1 </Td> <Td> Czechoslovakia </Td> <Td> Gymnastics </Td> <Td> 1960 -- 1968 </Td> <Td> Summer </Td> <Td> </Td> <Td> 7 </Td> <Td> </Td> <Td> 0 </Td> <Td> 11 </Td> </Tr> <Tr> <Th> 18 </Th> <Td> Chukarin , Viktor Viktor Chukarin </Td> <Td> Soviet Union </Td> <Td> Gymnastics </Td> <Td> 1952 -- 1956 </Td> <Td> Summer </Td> <Td> </Td> <Td> 7 </Td> <Td> </Td> <Td> </Td> <Td> 11 </Td> </Tr> <Tr> <Th> 19 </Th> <Td> Gerevich , Alad\u00e1r Alad\u00e1r Gerevich </Td> <Td> Hungary </Td> <Td> Fencing </Td> <Td> 1932 -- 1960 </Td> <Td> Summer </Td> <Td> </Td> <Td> 7 </Td> <Td> </Td> <Td> </Td> <Td> 10 </Td> </Tr> <Tr> <Th> 20 </Th> <Td> Mangiarotti , Edoardo Edoardo Mangiarotti </Td> <Td> Italy </Td> <Td> Fencing </Td> <Td> 1936 -- 1960 </Td> <Td> Summer </Td> <Td> </Td>",
    "topic": "The impact of sport-specific factors on medal counts (e.g., opportunities for medals in swimming versus fencing).",
    "response": "<document_analysis>\nThe provided context is a table listing Olympic athletes, their nations, sports, and medal counts. The question topic focuses on sport-specific factors influencing medal counts. The table clearly demonstrates that some sports (e.g., Swimming, Gymnastics) offer more opportunities for medals than others (e.g., Fencing). The challenge lies in formulating a question that assesses understanding of this inherent difference in medal availability and its impact on overall counts, without being trivially answerable. The data is relevant and coherent, making it suitable for question generation. Difficulty is estimated at 7/10, requiring some analytical thinking.\n</document_analysis>\n\n<output_format>\nQuestion: Considering the provided data, which of the following best explains why an athlete competing in Swimming is statistically more likely to accumulate a higher total medal count compared to an athlete competing in Fencing?\nA: Swimming events consistently attract a larger global audience, leading to increased funding and athlete development.\nB: The Olympic program includes a significantly greater number of distinct events within Swimming, providing more opportunities to win medals.\nC: Fencing athletes typically specialize in a single weapon, limiting their potential for medal contention across multiple disciplines.\nD: Swimming requires a broader range of physical attributes, fostering greater versatility and adaptability among its athletes.\nExplanation: The data shows athletes in swimming generally have higher medal counts. This is because swimming has more events than fencing, providing more opportunities to win medals. Options A, C, and D may be true statements about the sports, but they do not directly explain the difference in medal counts observed in the data.\nCorrect Answer: B\n</output_format>",
    "question": "Considering the provided data, which of the following best explains why an athlete competing in Swimming is statistically more likely to accumulate a higher total medal count compared to an athlete competing in Fencing?",
    "choices": {
      "A": "Swimming events consistently attract a larger global audience, leading to increased funding and athlete development.",
      "B": "The Olympic program includes a significantly greater number of distinct events within Swimming, providing more opportunities to win medals.",
      "C": "Fencing athletes typically specialize in a single weapon, limiting their potential for medal contention across multiple disciplines.",
      "D": "Swimming requires a broader range of physical attributes, fostering greater versatility and adaptability among its athletes."
    },
    "answer": "B",
    "explanation": "The data shows athletes in swimming generally have higher medal counts. This is because swimming has more events than fencing, providing more opportunities to win medals. Options A, C, and D may be true statements about the sports, but they do not directly explain the difference in medal counts observed in the data.",
    "question_token_count": 38,
    "answer_correctness_score": 10,
    "explanation_validity_score": 10,
    "question_clarity_score": 6,
    "question_difficulty_score": 7,
    "question_groundedness_score": 10,
    "avg_answer_token_count": 20
  },
  {
    "context": "<Table> <Tr> <Th colspan=\"2\"> Season </Th> <Th colspan=\"2\"> Episodes </Th> <Th colspan=\"2\"> Originally released </Th> </Tr> <Tr> <Th> First released </Th> <Th> Last released </Th> </Tr> <Tr> <Td> </Td> <Td colspan=\"1\"> </Td> <Td colspan=\"2\"> 10 </Td> <Td colspan=\"1\"> April 26 , 2017 ( 2017 - 04 - 26 ) </Td> <Td> June 14 , 2017 ( 2017 - 06 - 14 ) </Td> </Tr> <Tr> <Td> </Td> <Td colspan=\"1\"> </Td> <Td colspan=\"2\"> 13 </Td> <Td colspan=\"1\"> April 25 , 2018 ( 2018 - 04 - 25 ) </Td> <Td> July 11 , 2018 ( 2018 - 07 - 11 ) </Td> </Tr> </Table>",
    "topic": "Identify the original release date of the first episode of the second season.",
    "response": "<document_analysis>\n1. **Thoughtful Content Examination:** The context presents a table detailing the release dates for two seasons of a show. The table includes the first and last release dates for each season, as well as the number of episodes.\n2. **Concept Exploration:** The question focuses on extracting specific information from the table \u2013 the release date of the first episode of the second season. This requires understanding the table structure and correctly identifying the relevant data point.\n3. **Strategic Complexity Calibration:** Difficulty: 7/10. While the information is directly present in the table, the question requires careful reading and accurate interpretation of the data. The table format introduces a slight cognitive load.\n4. **Intentional Question Planning:** The question is designed to test the ability to accurately extract and interpret data from a tabular format. It's a straightforward factual question, but the table format necessitates attention to detail.\n</document_analysis>\n\n<output_format>\nQuestion: What date did the first episode of the second season originally release?\nA: April 26, 2017\nB: June 14, 2017\nC: April 25, 2018\nD: July 11, 2018\nExplanation: The table clearly indicates that the first episode of the second season was originally released on April 25, 2018.\nCorrect Answer: C\n</output_format>",
    "question": "What date did the first episode of the second season originally release?",
    "choices": {
      "A": "April 26, 2017",
      "B": "June 14, 2017",
      "C": "April 25, 2018",
      "D": "July 11, 2018"
    },
    "answer": "C",
    "explanation": "The table clearly indicates that the first episode of the second season was originally released on April 25, 2018.",
    "question_token_count": 14,
    "answer_correctness_score": 10,
    "explanation_validity_score": 10,
    "question_clarity_score": 5,
    "question_difficulty_score": 3,
    "question_groundedness_score": 6,
    "avg_answer_token_count": 8
  },
  {
    "context": "<P> The 2018 UEFA Champions League Final was the final match of the 2017 -- 18 UEFA Champions League , the 63rd season of Europe 's premier club football tournament organised by UEFA , and the 26th season since it was renamed from the European Cup to the UEFA Champions League . It was played at the NSC Olimpiyskiy Stadium in Kiev , Ukraine on 26 May 2018 , between Spanish side and defending champions Real Madrid , who had won the competition in each of the last two seasons , and English side Liverpool . </P>",
    "topic": "Detail the renaming of the European Cup to the UEFA Champions League and when this change occurred in relation to the 2018 final.",
    "response": "```xml\n<document_analysis>\n1. **Thoughtful Content Examination:** The context provides information about the 2018 Champions League final and mentions the renaming of the tournament from the European Cup to the UEFA Champions League. The key detail is that the 2018 final was the 26th season *since* the renaming.\n2. **Concept Exploration:** The question should focus on the timing of the renaming relative to the 2018 final. This requires understanding the relationship between the season number and the year of the final. It also requires a good understanding of the history of the tournament.\n3. **Strategic Complexity Calibration:** Difficulty: 8/10. This question requires careful reading and calculation. It's not a direct recall of information but requires understanding the phrasing \"26th season since it was renamed.\"\n4. **Intentional Question Planning:** The question will ask when the renaming occurred relative to the 2018 final. The answer options will be dates, making it necessary to calculate the year of the renaming.\n</document_analysis>\n<output_format>\nQuestion: In what year did the rebranding from the European Cup to the UEFA Champions League occur, considering the 2018 final represented the 26th season following this change?\nA: 1990\nB: 1992\nC: 1994\nD: 1996\nExplanation: The text states the 2018 final was the 26th season since the renaming. Subtracting 26 from 2018 yields 1992 (2018 - 26 = 1992).\nCorrect Answer: B\n</output_format>\n```",
    "question": "In what year did the rebranding from the European Cup to the UEFA Champions League occur, considering the 2018 final represented the 26th season following this change?",
    "choices": {
      "A": "1990",
      "B": "1992",
      "C": "1994",
      "D": "1996"
    },
    "answer": "B",
    "explanation": "The text states the 2018 final was the 26th season since the renaming. Subtracting 26 from 2018 yields 1992 (2018 - 26 = 1992).",
    "question_token_count": 36,
    "answer_correctness_score": 10,
    "explanation_validity_score": 10,
    "question_clarity_score": 8,
    "question_difficulty_score": 7,
    "question_groundedness_score": 10,
    "avg_answer_token_count": 3
  },
  {
    "context": "<P> In the history of the Triple Crown , 13 horses have won all three races : Sir Barton ( 1919 ) , Gallant Fox ( 1930 ) , Omaha ( 1935 ) , War Admiral ( 1937 ) , Whirlaway ( 1941 ) , Count Fleet ( 1943 ) , Assault ( 1946 ) , Citation ( 1948 ) , Secretariat ( 1973 ) , Seattle Slew ( 1977 ) , Affirmed ( 1978 ) , American Pharoah ( 2015 ) , and Justify ( 2018 ) . As of 2018 , American Pharoah and Justify are the only living Triple Crown winners . </P>",
    "topic": "Compare and contrast the time gaps between different Triple Crown wins based on the provided list.",
    "response": "```xml\n<document_analysis>\nThoughtful Content Examination: The context provides a list of all Triple Crown winners. The core information revolves around the years in which these horses achieved the feat. The question will focus on calculating and comparing time gaps between wins, requiring a domain expert to perform basic arithmetic and analyze historical patterns.\n\nConcept Exploration: The implicit assumption is that a domain expert understands the significance of the Triple Crown and the historical context of horse racing. The challenge lies in quickly calculating the differences between years and identifying the longest and shortest gaps.\n\nStrategic Complexity Calibration: Difficulty: 8/10. The question requires a quick mental calculation and comparative analysis, making it moderately challenging. It's not overly complex but requires attention to detail.\n\nIntentional Question Planning: The question is designed to test the expert's ability to extract data from a list and perform a simple analytical task. It probes their understanding of the historical timeline of Triple Crown wins.\n</document_analysis>\n<output_format>\nQuestion: Considering the provided list of Triple Crown winners, what is the longest time gap between consecutive Triple Crown victories?\nA: 37 years\nB: 38 years\nC: 39 years\nD: 40 years\nExplanation: The longest gap occurred between Secretariat's win in 1973 and Seattle Slew's win in 1977, which is 4 years. The next longest gap occurred between Citation's win in 1948 and Secretariat's win in 1973, which is 25 years. The longest gap occurred between Affirmed's win in 1978 and American Pharoah's win in 2015, which is 37 years.\nCorrect Answer: A\n</output_format>\n```",
    "question": "Considering the provided list of Triple Crown winners, what is the longest time gap between consecutive Triple Crown victories?",
    "choices": {
      "A": "37 years",
      "B": "38 years",
      "C": "39 years",
      "D": "40 years"
    },
    "answer": "A",
    "explanation": "The longest gap occurred between Secretariat's win in 1973 and Seattle Slew's win in 1977, which is 4 years. The next longest gap occurred between Citation's win in 1948 and Secretariat's win in 1973, which is 25 years. The longest gap occurred between Affirmed's win in 1978 and American Pharoah's win in 2015, which is 37 years.",
    "question_token_count": 22,
    "answer_correctness_score": 10,
    "explanation_validity_score": 10,
    "question_clarity_score": 8,
    "question_difficulty_score": 4,
    "question_groundedness_score": 10,
    "avg_answer_token_count": 3
  },
  {
    "context": "<P> The Lord of the Rings is a film series consisting of three high fantasy adventure films directed by Peter Jackson . They are based on the novel The Lord of the Rings by J.R.R. Tolkien . The films are subtitled The Fellowship of the Ring ( 2001 ) , The Two Towers ( 2002 ) and The Return of the King ( 2003 ) . They are a New Zealand - American venture produced by WingNut Films and The Saul Zaentz Company and distributed by New Line Cinema . </P>",
    "topic": "Identify the director responsible for the *Lord of the Rings* film series.",
    "response": "```xml\n<document_analysis>\nThoughtful Content Examination: The context provides a concise description of the *Lord of the Rings* film series, explicitly stating Peter Jackson as the director. The text also provides publication years and production/distribution details.\n\nConcept Exploration: The core concept is identifying the director of a well-known film series. While straightforward, a challenging question could focus on the nuances of directorial roles in large-scale productions or the impact of the director on the film's success.\n\nStrategic Complexity Calibration: Difficulty: 3/10. The information is directly stated, making a simple recall question too easy for a domain expert. I will aim for a question that requires understanding the scope of Jackson\u2019s involvement, rather than just his name.\n\nIntentional Question Planning: I plan to create a question that requires the expert to understand the extent of Peter Jackson's role, differentiating between director and other potential creative leadership positions.\n</document_analysis>\n\n<output_format>\nQuestion: Considering the scale and complexity of the *Lord of the Rings* film trilogy, which of the following best encapsulates Peter Jackson\u2019s primary creative responsibility?\nA: Supervising the financial investments of WingNut Films and The Saul Zaentz Company.\nB: Adapting J.R.R. Tolkien\u2019s novel into a cohesive cinematic narrative.\nC: Managing the logistical challenges of filming in New Zealand and the United States.\nD: Overseeing the post-production visual effects and musical score.\nExplanation: The context explicitly identifies Peter Jackson as the *director* of the films, a role fundamentally centered on adapting the source material and bringing a cohesive cinematic vision to life. While he likely oversaw other aspects, direction is his primary creative responsibility.\nCorrect Answer: B\n</output_format>\n```",
    "question": "Considering the scale and complexity of the *Lord of the Rings* film trilogy, which of the following best encapsulates Peter Jackson\u2019s primary creative responsibility?",
    "choices": {
      "A": "Supervising the financial investments of WingNut Films and The Saul Zaentz Company.",
      "B": "Adapting J.R.R. Tolkien\u2019s novel into a cohesive cinematic narrative.",
      "C": "Managing the logistical challenges of filming in New Zealand and the United States.",
      "D": "Overseeing the post-production visual effects and musical score."
    },
    "answer": "B",
    "explanation": "The context explicitly identifies Peter Jackson as the *director* of the films, a role fundamentally centered on adapting the source material and bringing a cohesive cinematic vision to life. While he likely oversaw other aspects, direction is his primary creative responsibility.",
    "question_token_count": 31,
    "answer_correctness_score": 10,
    "explanation_validity_score": 10,
    "question_clarity_score": 4,
    "question_difficulty_score": 6,
    "question_groundedness_score": 7,
    "avg_answer_token_count": 16
  },
  {
    "context": "<Table> <Tr> <Td> May 20 , 2012 Annular </Td> <Td> August 21 , 2017 Total </Td> <Td> October 14 , 2023 Annular </Td> <Td> April 8 , 2024 Total </Td> </Tr> <Tr> <Td> March 30 , 2033 Total </Td> <Td> June 21 , 2039 Annular </Td> <Td> August 23 , 2044 Total </Td> <Td> August 12 , 2045 Total </Td> </Tr> <Tr> <Td> February 5 , 2046 Annular </Td> <Td> June 11 , 2048 Annular </Td> </Tr> </Table>",
    "topic": "What is the date of the last annular eclipse listed in the table?",
    "response": "<document_analysis>\n1. **Thoughtful Content Examination:** The context provides a table listing dates and types of solar eclipses (Annular or Total). The core information is the date associated with each eclipse type.\n2. **Concept Exploration:** The task requires identifying the latest date specifically for an annular eclipse from the table. This tests attention to detail and the ability to filter information based on a specific criterion.\n3. **Strategic Complexity Calibration:** Difficulty: 3/10. While seemingly straightforward, the complexity lies in accurately scanning the table and distinguishing annular eclipses from total eclipses. The question is designed to test attention to detail and accurate information retrieval.\n4. **Intentional Question Planning:** The question focuses on a specific eclipse type (annular) and requires the examinee to scan the table and identify the most recent date associated with that type. This tests their ability to parse structured data.\n</document_analysis>\n\n<output_format>\nQuestion: Which of the following dates represents the most recent annular solar eclipse listed in the provided data?\nA: October 14, 2023\nB: June 21, 2039\nC: February 5, 2046\nD: June 11, 2048\nExplanation: The table lists several annular eclipses. Comparing the dates, June 11, 2048 is the latest date listed for an annular eclipse.\nCorrect Answer: D\n</output_format>",
    "question": "Which of the following dates represents the most recent annular solar eclipse listed in the provided data?",
    "choices": {
      "A": "October 14, 2023",
      "B": "June 21, 2039",
      "C": "February 5, 2046",
      "D": "June 11, 2048"
    },
    "answer": "D",
    "explanation": "The table lists several annular eclipses. Comparing the dates, June 11, 2048 is the latest date listed for an annular eclipse.",
    "question_token_count": 19,
    "answer_correctness_score": 10,
    "explanation_validity_score": 10,
    "question_clarity_score": 8,
    "question_difficulty_score": 4,
    "question_groundedness_score": 8,
    "avg_answer_token_count": 8
  },
  {
    "context": "<P> `` Flight '' is the twenty - fourth and final episode of the eighth season of the American television medical drama Grey 's Anatomy , and the show 's 172nd episode overall . It was written by series creator Shonda Rhimes , and directed by Rob Corn . The episode was originally broadcast on the American Broadcasting Company ( ABC ) in the United States on May 17 , 2012 . In the episode , six doctors from Seattle Grace Mercy West Hospital who are victims of an aviation accident fight to stay alive , but Dr. Lexie Grey ( Chyler Leigh ) ultimately dies . Other storylines occur in Seattle where Dr. Richard Webber ( James Pickens , Jr . ) plans his annual dinner for the departing residents , Dr. Owen Hunt ( Kevin McKidd ) fires Dr. Teddy Altman ( Kim Raver ) , and Dr. Miranda Bailey ( Chandra Wilson ) gets engaged . </P>",
    "topic": "The broadcast date of \"Flight\" on ABC was May 17, 2012, establishing a specific point in the show's timeline.",
    "response": "<document_analysis>\n1. **Thoughtful Content Examination:** The context describes the final episode of Grey's Anatomy's eighth season, \"Flight,\" including details about its writing, directing, broadcast date, and key plot points (the plane crash, character deaths, and other storylines). The core information revolves around the episode's details and its place within the series.\n2. **Concept Exploration:** The broadcast date is a fixed point in the show's narrative timeline. It's a foundational piece of information for understanding the series' chronology. The episode represents a culmination of storylines and significant character arcs.\n3. **Strategic Complexity Calibration:** Difficulty: 8/10. The question aims to test the understanding of the episode's significance as a temporal anchor point within the broader series narrative. It's not a simple recall question; it requires understanding *why* the date is important.\n4. **Intentional Question Planning:** The question will focus on the implications of the broadcast date, probing whether the expert recognizes its role in establishing a fixed point in the show\u2019s timeline. It is designed to be challenging as it requires understanding beyond simply remembering the date.\n</document_analysis>\n\n<output_format>\nQuestion: Considering the narrative structure of serialized television dramas, what primary function does the established broadcast date of \"Flight\" (May 17, 2012) serve within the Grey's Anatomy storyline?\nA: It signifies the end of a contractual obligation between the actors and the network.\nB: It anchors the show's fictional timeline, providing a fixed reference point for subsequent events.\nC: It represents a marketing strategy to coincide with the television season's finale.\nD: It marks the transition of the show's production team to a new studio location.\nExplanation: The broadcast date establishes a concrete point in the show\u2019s fictional timeline.  Serialized dramas rely on a consistent internal chronology, and knowing the date of pivotal events like the \u201cFlight\u201d episode is crucial for understanding the sequence of events.\nCorrect Answer: B\n</output_format>",
    "question": "Considering the narrative structure of serialized television dramas, what primary function does the established broadcast date of \"Flight\" (May 17, 2012) serve within the Grey's Anatomy storyline?",
    "choices": {
      "A": "It signifies the end of a contractual obligation between the actors and the network.",
      "B": "It anchors the show's fictional timeline, providing a fixed reference point for subsequent events.",
      "C": "It represents a marketing strategy to coincide with the television season's finale.",
      "D": "It marks the transition of the show's production team to a new studio location."
    },
    "answer": "B",
    "explanation": "The broadcast date establishes a concrete point in the show\u2019s fictional timeline.  Serialized dramas rely on a consistent internal chronology, and knowing the date of pivotal events like the \u201cFlight\u201d episode is crucial for understanding the sequence of events.",
    "question_token_count": 40,
    "answer_correctness_score": 10,
    "explanation_validity_score": 10,
    "question_clarity_score": 4,
    "question_difficulty_score": 8,
    "question_groundedness_score": 6,
    "avg_answer_token_count": 16
  },
  {
    "context": "<P> The 2022 FIFA World Cup is scheduled to be the 22nd edition of the FIFA World Cup , the quadrennial international men 's football championship contested by the national teams of the member associations of FIFA . It is scheduled to take place in Qatar in 2022 . This will be the first World Cup ever to be held in the Arab world and the first in a Muslim - majority country . This will be the first World Cup held entirely in geographical Asia since the 2002 tournament in South Korea and Japan ( the 2018 competition in Russia featured one geographically Asian venue , Yekaterinburg ) . In addition the tournament will be the last to involve 32 teams , with an increase to 48 teams scheduled for the 2026 tournament . </P>",
    "topic": "The historical significance of Qatar being the first Arab and Muslim-majority country to host the FIFA World Cup.",
    "response": "```xml\n<document_analysis>\n1. **Thoughtful Content Examination:** The context focuses on the historical significance of Qatar hosting the 2022 FIFA World Cup, specifically highlighting it as the first Arab and Muslim-majority country to do so. It also notes it's the first entirely in Asia since 2002 and the last with 32 teams.\n2. **Concept Exploration:** The core concept is the breaking of geographical and cultural barriers in hosting a major global sporting event. This has implications for the globalization of football and the potential for increased inclusivity. The shift from 32 to 48 teams also represents a significant change in the tournament's structure.\n3. **Strategic Complexity Calibration:** Difficulty: 8/10. The question aims to go beyond a simple recall of facts and probes the broader implications of this event. It requires understanding of both geographical and cultural contexts.\n4. **Intentional Question Planning:** The question is designed to assess understanding of the historical context and the unique position Qatar holds in the history of the World Cup. It tests whether the expert understands the broader significance of this event beyond the sporting aspect.\n</document_analysis>\n```\n\n```xml\n<output_format>\nQuestion: Considering the historical precedent set by Qatar hosting the 2022 FIFA World Cup, which of the following best encapsulates the primary shift in the event\u2019s global accessibility?\nA: The expansion of the tournament from 32 to 48 participating teams, allowing for greater representation from smaller footballing nations.\nB: The relocation of a major international sporting event to a region previously unrepresented as a host, signaling a potential decentralization of global sports governance.\nC: The utilization of innovative cooling technologies within the stadiums, enabling play in a climate previously considered unsuitable for such events.\nD: The increased media coverage and commercialization of the tournament, leading to broader global viewership and revenue generation.\nExplanation: Qatar's hosting represents a fundamental shift in *where* the World Cup is held, breaking a long-standing pattern of Western or East Asian dominance. This has significant implications for the globalization of the sport and opens the door for other regions to potentially host future events, demonstrating a decentralization of global sports governance.\nCorrect Answer: B\n</output_format>\n```",
    "question": "Considering the historical precedent set by Qatar hosting the 2022 FIFA World Cup, which of the following best encapsulates the primary shift in the event\u2019s global accessibility?",
    "choices": {
      "A": "The expansion of the tournament from 32 to 48 participating teams, allowing for greater representation from smaller footballing nations.",
      "B": "The relocation of a major international sporting event to a region previously unrepresented as a host, signaling a potential decentralization of global sports governance.",
      "C": "The utilization of innovative cooling technologies within the stadiums, enabling play in a climate previously considered unsuitable for such events.",
      "D": "The increased media coverage and commercialization of the tournament, leading to broader global viewership and revenue generation."
    },
    "answer": "B",
    "explanation": "Qatar's hosting represents a fundamental shift in *where* the World Cup is held, breaking a long-standing pattern of Western or East Asian dominance. This has significant implications for the globalization of the sport and opens the door for other regions to potentially host future events, demonstrating a decentralization of global sports governance.",
    "question_token_count": 34,
    "answer_correctness_score": 10,
    "explanation_validity_score": 10,
    "question_clarity_score": 6,
    "question_difficulty_score": 7,
    "question_groundedness_score": 4,
    "avg_answer_token_count": 25
  },
  {
    "context": "<P> `` Flight '' is the twenty - fourth and final episode of the eighth season of the American television medical drama Grey 's Anatomy , and the show 's 172nd episode overall . It was written by series creator Shonda Rhimes , and directed by Rob Corn . The episode was originally broadcast on the American Broadcasting Company ( ABC ) in the United States on May 17 , 2012 . In the episode , six doctors from Seattle Grace Mercy West Hospital who are victims of an aviation accident fight to stay alive , but Dr. Lexie Grey ( Chyler Leigh ) ultimately dies . Other storylines occur in Seattle where Dr. Richard Webber ( James Pickens , Jr . ) plans his annual dinner for the departing residents , Dr. Owen Hunt ( Kevin McKidd ) fires Dr. Teddy Altman ( Kim Raver ) , and Dr. Miranda Bailey ( Chandra Wilson ) gets engaged . </P>",
    "topic": "Dr. Lexie Grey's death is a central and tragic event within the \"Flight\" episode, marking a significant loss for the series.",
    "response": "<document_analysis>\n1. **Thoughtful Content Examination:** The context describes the final episode of season eight of Grey's Anatomy, \"Flight,\" focusing on the aftermath of a plane crash and key character events. The central event is the death of Dr. Lexie Grey.\n2. **Concept Exploration:** The episode is framed as a culmination of storylines, with the plane crash serving as a catalyst for dramatic events and character arcs. The episode's significance lies in its emotional impact and the changes it brings to the series' dynamic.\n3. **Strategic Complexity Calibration:** Difficulty: 8/10. The question will focus on the implications of character actions within the context of the episode's overall narrative structure. It requires understanding of character relationships and the broader storyline.\n4. **Intentional Question Planning:** The question will assess understanding of the episode's multi-faceted nature, going beyond simply identifying Lexie Grey's death. It will probe the understanding of how the events in Seattle parallel and contrast with the crisis unfolding at the crash site.\n</document_analysis>\n<output_format>\nQuestion: Within the \"Flight\" episode of Grey's Anatomy, the simultaneous progression of events in Seattle, such as Dr. Bailey's engagement, serves primarily to:\nA: Diminish the emotional impact of Dr. Lexie Grey\u2019s death by providing a contrasting positive storyline.\nB: Highlight the normalcy of hospital life continuing amidst extraordinary crisis and personal loss.\nC: Foreshadow future romantic entanglements for the remaining characters directly involved in the plane crash.\nD: Demonstrate a narrative imbalance, prioritizing secondary character arcs over the central tragedy.\nExplanation: The context indicates that storylines in Seattle occurred concurrently with the crisis at the crash site. This juxtaposition underscores the continuation of life and hospital routines even in the face of tragedy, highlighting the resilience and ongoing nature of the hospital environment.\nCorrect Answer: B\n</output_format>",
    "question": "Within the \"Flight\" episode of Grey's Anatomy, the simultaneous progression of events in Seattle, such as Dr. Bailey's engagement, serves primarily to:",
    "choices": {
      "A": "Diminish the emotional impact of Dr. Lexie Grey\u2019s death by providing a contrasting positive storyline.",
      "B": "Highlight the normalcy of hospital life continuing amidst extraordinary crisis and personal loss.",
      "C": "Foreshadow future romantic entanglements for the remaining characters directly involved in the plane crash.",
      "D": "Demonstrate a narrative imbalance, prioritizing secondary character arcs over the central tragedy."
    },
    "answer": "B",
    "explanation": "The context indicates that storylines in Seattle occurred concurrently with the crisis at the crash site. This juxtaposition underscores the continuation of life and hospital routines even in the face of tragedy, highlighting the resilience and ongoing nature of the hospital environment.",
    "question_token_count": 32,
    "answer_correctness_score": 10,
    "explanation_validity_score": 10,
    "question_clarity_score": 8,
    "question_difficulty_score": 6,
    "question_groundedness_score": 9,
    "avg_answer_token_count": 18
  },
  {
    "context": "<P> The Lord of the Rings is a film series consisting of three high fantasy adventure films directed by Peter Jackson . They are based on the novel The Lord of the Rings by J.R.R. Tolkien . The films are subtitled The Fellowship of the Ring ( 2001 ) , The Two Towers ( 2002 ) and The Return of the King ( 2003 ) . They are a New Zealand - American venture produced by WingNut Films and The Saul Zaentz Company and distributed by New Line Cinema . </P>",
    "topic": "State the original literary work upon which the *Lord of the Rings* film series is based.",
    "response": "```xml\n<document_analysis>\n1. **Thoughtful Content Examination:** The context clearly states the *Lord of the Rings* film series is based on a novel. The novel's title and author are explicitly provided. The passage also includes details about the films' production and release, but these are secondary to the core relationship between the films and the original literary work.\n2. **Concept Exploration:** This is a straightforward factual question, but it tests a fundamental understanding of the adaptation process. A domain expert should instantly recognize the source material. The challenge lies in the simplicity and potential for overlooking the direct answer within a larger context.\n3. **Strategic Complexity Calibration:** Difficulty: 2/10. While simple, it's a crucial foundational piece of knowledge for anyone claiming expertise in the *Lord of the Rings*. The challenge is to avoid making the question *too* easy by introducing irrelevant details or complex phrasing.\n4. **Intentional Question Planning:** The question is designed to be a baseline assessment of knowledge. It verifies the most basic understanding of the films' origins. The distractors will focus on related, but incorrect, works or authors within the fantasy genre.\n</document_analysis>\n<output_format>\nQuestion: Upon what original literary work is the *Lord of the Rings* film series principally based?\nA: *The Hobbit*\nB: *The Silmarillion*\nC: *The Lord of the Rings*\nD: *The Chronicles of Narnia*\nExplanation: The provided text explicitly states, \u201cThey are based on the novel The Lord of the Rings by J.R.R. Tolkien.\u201d\nCorrect Answer: C\n</output_format>\n```",
    "question": "Upon what original literary work is the *Lord of the Rings* film series principally based?",
    "choices": {
      "A": "*The Hobbit*",
      "B": "*The Silmarillion*",
      "C": "*The Lord of the Rings*",
      "D": "*The Chronicles of Narnia*"
    },
    "answer": "C",
    "explanation": "The provided text explicitly states, \u201cThey are based on the novel The Lord of the Rings by J.R.R. Tolkien.\u201d",
    "question_token_count": 19,
    "answer_correctness_score": 10,
    "explanation_validity_score": 10,
    "question_clarity_score": 8,
    "question_difficulty_score": 3,
    "question_groundedness_score": 10,
    "avg_answer_token_count": 7
  },
  {
    "context": "<P> Darci Lynne Farmer was named the winner on the season finale , September 20 , 2017 . She was the third ventriloquist , third child and third female to win a season of America 's Got Talent. 10 - year - old singer Angelica Hale placed second , and glow light dance troupe Light Balance came in third . Farmer won the show 's prize of $1 million and a headlining performance in Las Vegas . </P>",
    "topic": "Explain the significance of Darci Lynne Farmer being the third ventriloquist to win America's Got Talent.",
    "response": "```xml\n<document_analysis>\n<thoughtful_content_examination>The context provides factual information about Darci Lynne Farmer's win on America's Got Talent, highlighting her as the third ventriloquist, child, and female winner. It also mentions the second and third-place contestants and the prize she received.</thoughtful_content_examination>\n<concept_exploration>The significance lies in the pattern established\u2014Darci Lynne's win isn't isolated. It's part of a trend, making her win statistically notable within the show's history. The context doesn't elaborate on *why* ventriloquists, children, or females might be successful, but that\u2019s where the challenge lies for a domain expert.</concept_exploration>\n<strategic_complexity_calibration>Difficulty: 7/10. While the facts are straightforward, understanding the statistical significance requires a bit of analytical thinking beyond simple recall. The question probes understanding of patterns and trends within a competition format.</strategic_complexity_calibration>\n<intentional_question_planning>The question aims to move beyond simple factual recall and asks for the *significance* of being the third in a category. This requires an understanding of probability, pattern recognition, and the broader context of the show's history. It requires a domain expert to understand how a competition might evolve and the implications of repeated success within certain demographics.</intentional_question_planning>\n</document_analysis>\n\n<output_format>\nQuestion: Considering Darci Lynne Farmer\u2019s victory, what does her status as the third ventriloquist to win America's Got Talent most directly imply regarding the show\u2019s evolving competitive landscape?\nA: The show increasingly favors acts requiring significant manual dexterity and performance coordination.\nB: The show's judging criteria have consistently prioritized novelty and unique performance skills.\nC: The show demonstrates a cyclical pattern of audience preference for traditional performance arts.\nD: The show\u2019s producers actively seek to diversify winners across various performance categories.\nExplanation: Darci Lynne being the third ventriloquist to win signifies a pattern. This implies that novelty and unique performance skills have been consistently valued by the judges and audience, as ventriloquism is not a mainstream performance art.\nCorrect Answer: B\n</output_format>\n```",
    "question": "Considering Darci Lynne Farmer\u2019s victory, what does her status as the third ventriloquist to win America's Got Talent most directly imply regarding the show\u2019s evolving competitive landscape?",
    "choices": {
      "A": "The show increasingly favors acts requiring significant manual dexterity and performance coordination.",
      "B": "The show's judging criteria have consistently prioritized novelty and unique performance skills.",
      "C": "The show demonstrates a cyclical pattern of audience preference for traditional performance arts.",
      "D": "The show\u2019s producers actively seek to diversify winners across various performance categories."
    },
    "answer": "B",
    "explanation": "Darci Lynne being the third ventriloquist to win signifies a pattern. This implies that novelty and unique performance skills have been consistently valued by the judges and audience, as ventriloquism is not a mainstream performance art.",
    "question_token_count": 37,
    "answer_correctness_score": 8,
    "explanation_validity_score": 9,
    "question_clarity_score": 7,
    "question_difficulty_score": 6,
    "question_groundedness_score": 10,
    "avg_answer_token_count": 15
  },
  {
    "context": "<P> The 2018 UEFA Champions League Final was the final match of the 2017 -- 18 UEFA Champions League , the 63rd season of Europe 's premier club football tournament organised by UEFA , and the 26th season since it was renamed from the European Cup to the UEFA Champions League . It was played at the NSC Olimpiyskiy Stadium in Kiev , Ukraine on 26 May 2018 , between Spanish side and defending champions Real Madrid , who had won the competition in each of the last two seasons , and English side Liverpool . </P>",
    "topic": "Explain Real Madrid's status and achievements leading up to the 2018 UEFA Champions League Final.",
    "response": "```xml\n<document_analysis>\n1. **Thoughtful Content Examination:** The context focuses on setting the stage for the 2018 Champions League Final, specifically highlighting Real Madrid's status as the defending champions having won the previous two seasons. It establishes the tournament's history and location.\n2. **Concept Exploration:** The key concept is Real Madrid's dominance in the Champions League leading up to 2018. This implies a period of sustained success and a strong competitive position. The context doesn't delve into *how* they achieved this, only *that* they did.\n3. **Strategic Complexity Calibration:** Difficulty: 7/10. While the information is directly stated, the question aims to test understanding of the implications of back-to-back wins \u2013 what does it mean to be a 'defending champion' for two consecutive years in this context? It requires inferring a level of consistent high performance.\n4. **Intentional Question Planning:** The question will probe understanding of Real Madrid's position going into the final, requiring a grasp of their recent history within the competition. The answer options will focus on the *significance* of their consecutive wins, rather than simply restating the fact.\n</document_analysis>\n<output_format>\nQuestion: Prior to the 2018 UEFA Champions League Final, Real Madrid possessed a unique distinction within the competition, reflecting a period of sustained dominance. What best characterizes this distinction?\nA: Real Madrid was attempting to win their first Champions League title in over a decade.\nB: Real Madrid entered the final as the first team to win three consecutive Champions League titles.\nC: Real Madrid was the first Spanish team to reach the final in back-to-back seasons.\nD: Real Madrid was seeking to avenge a previous Champions League Final defeat against Liverpool.\nExplanation: The text explicitly states that Real Madrid had won the competition in each of the last two seasons, making them the defending champions. While not explicitly stating an attempt for a third consecutive title, this is the logical implication of winning the previous two. The other options are demonstrably false based on the provided text.\nCorrect Answer: B\n</output_format>\n```",
    "question": "Prior to the 2018 UEFA Champions League Final, Real Madrid possessed a unique distinction within the competition, reflecting a period of sustained dominance. What best characterizes this distinction?",
    "choices": {
      "A": "Real Madrid was attempting to win their first Champions League title in over a decade.",
      "B": "Real Madrid entered the final as the first team to win three consecutive Champions League titles.",
      "C": "Real Madrid was the first Spanish team to reach the final in back-to-back seasons.",
      "D": "Real Madrid was seeking to avenge a previous Champions League Final defeat against Liverpool."
    },
    "answer": "B",
    "explanation": "The text explicitly states that Real Madrid had won the competition in each of the last two seasons, making them the defending champions. While not explicitly stating an attempt for a third consecutive title, this is the logical implication of winning the previous two. The other options are demonstrably false based on the provided text.",
    "question_token_count": 35,
    "answer_correctness_score": 8,
    "explanation_validity_score": 9,
    "question_clarity_score": 6,
    "question_difficulty_score": 7,
    "question_groundedness_score": 8,
    "avg_answer_token_count": 17
  },
  {
    "context": "<P> The Astros played in the NL from 1962 to 2012 . They played in the West Division from 1969 to 1993 , and the Central Division from 1994 to 2012 . While a member of the NL , the Astros played in one World Series , in 2005 , against the Chicago White Sox , in which they were swept in four games . In 2017 , they became the first franchise in MLB history to have won a pennant in both the NL and the AL , when they defeated the New York Yankees in the ALCS . They subsequently won the 2017 World Series against the Los Angeles Dodgers , winning four games to three , earning the team , and Texas , its first World Series title . </P>",
    "topic": "Summarize the Astros' 2005 World Series appearance, including their opponent and the outcome of the series.",
    "response": "```xml\n<document_analysis>\nThoughtful Content Examination: The context provides a brief history of the Houston Astros, focusing on their league affiliations and World Series appearances. The key information is their 2005 appearance against the Chicago White Sox and their 2017 win against the Los Angeles Dodgers.\n\nConcept Exploration: The text highlights a significant shift in the Astros' history with their move to the AL in 2013, enabling them to compete for the World Series title as an American League team. The 2005 series is presented as a loss, while 2017 is a win.\n\nStrategic Complexity Calibration: Difficulty: 7/10. The question requires recalling specific details about a past event, but the context is concise. The challenge lies in choosing the correct opponent and outcome.\n\nIntentional Question Planning: The question will focus on the 2005 World Series appearance, testing recall of the opposing team and the series result. The incorrect answers will be plausible teams and outcomes, requiring careful consideration.\n</document_analysis>\n<output_format>\nQuestion: In 2005, the Houston Astros competed for the World Series title. What was the outcome of this series, and against which team did they compete?\nA: The Astros defeated the Los Angeles Dodgers in seven games.\nB: The Astros were swept in four games by the Chicago White Sox.\nC: The Astros defeated the Chicago White Sox in six games.\nD: The Astros were defeated in seven games by the New York Yankees.\nExplanation: The text explicitly states that the Astros \"were swept in four games\" by the \"Chicago White Sox\" in the 2005 World Series.\nCorrect Answer: B\n</output_format>\n```",
    "question": "In 2005, the Houston Astros competed for the World Series title. What was the outcome of this series, and against which team did they compete?",
    "choices": {
      "A": "The Astros defeated the Los Angeles Dodgers in seven games.",
      "B": "The Astros were swept in four games by the Chicago White Sox.",
      "C": "The Astros defeated the Chicago White Sox in six games.",
      "D": "The Astros were defeated in seven games by the New York Yankees."
    },
    "answer": "B",
    "explanation": "The text explicitly states that the Astros \"were swept in four games\" by the \"Chicago White Sox\" in the 2005 World Series.",
    "question_token_count": 33,
    "answer_correctness_score": 10,
    "explanation_validity_score": 10,
    "question_clarity_score": 8,
    "question_difficulty_score": 6,
    "question_groundedness_score": 10,
    "avg_answer_token_count": 14
  },
  {
    "context": "<P> The 21 World Cup tournaments have been won by eight national teams . Brazil have won five times , and they are the only team to have played in every tournament . The other World Cup winners are Germany and Italy , with four titles each ; Argentina , France and inaugural winner Uruguay , with two titles each ; and England and Spain with one title each . </P>",
    "topic": "The total number of World Cup tournaments that have been played to date.",
    "response": "```xml\n<document_analysis>\n<Thoughtful_Content_Examination>The context provides a concise overview of the FIFA World Cup, focusing on the number of tournaments played and the distribution of wins among different national teams. The core information revolves around the total number of tournaments (21) and the winning history of various countries.</Thoughtful_Content_Examination>\n<Concept_Exploration>The text implicitly highlights the historical dominance of certain nations in the World Cup. It also underscores Brazil's unique record of participation in all tournaments. The information is factual and doesn't delve into complex strategic or tactical aspects of the game.</Concept_Exploration>\n<Strategic_Complexity_Calibration>Difficulty: 7/10. While the number 21 is explicitly stated, the question tests recall and potentially the ability to disregard the distracting information about winning teams.</Strategic_Complexity_Calibration>\n<Intentional_Question_Planning>The question will focus on the total number of World Cup tournaments played. The distractors will be closely related numbers from the text (number of winning teams, number of titles won by specific countries) to test careful reading and accurate recall.</Intentional_Question_Planning>\n</document_analysis>\n<output_format>\nQuestion: As of the information provided, how many FIFA World Cup tournaments have been held?\nA: 8\nB: 16\nC: 21\nD: 32\nExplanation: The text explicitly states, \"The 21 World Cup tournaments have been won by eight national teams.\" This directly answers the question.\nCorrect Answer: C\n</output_format>\n```",
    "question": "As of the information provided, how many FIFA World Cup tournaments have been held?",
    "choices": {
      "A": "8",
      "B": "16",
      "C": "21",
      "D": "32"
    },
    "answer": "C",
    "explanation": "The text explicitly states, \"The 21 World Cup tournaments have been won by eight national teams.\" This directly answers the question.",
    "question_token_count": 17,
    "answer_correctness_score": 10,
    "explanation_validity_score": 10,
    "question_clarity_score": 5,
    "question_difficulty_score": 2,
    "question_groundedness_score": 10,
    "avg_answer_token_count": 2
  },
  {
    "context": "<P> England did not enter the competition until 1950 , but have entered all eighteen subsequent tournaments . They have failed to qualify for the finals on three occasions , 1974 ( West Germany ) , 1978 ( Argentina ) and 1994 ( United States ) , and have failed to advance from the group stages on three occasions ; at the 1950 FIFA World Cup , the 1958 FIFA World Cup and the 2014 FIFA World Cup . Their best ever performance is winning the Cup in the 1966 tournament held in England , whilst they also finished in fourth place in 1990 , in Italy , and in 2018 in Russia . Other than that , the team have reached the quarter - finals on nine occasions , the latest of which were at the 2002 ( South Korea / Japan ) and the 2006 ( Germany ) . </P>",
    "topic": "Evaluate the significance of England hosting and winning the 1966 FIFA World Cup.",
    "response": "```xml\n<document_analysis>\n<thought_process>The provided text is a concise overview of England's participation in the FIFA World Cup. It highlights their entry point, qualification history, and performance milestones. The most significant event mentioned is winning the 1966 tournament hosted in England. A challenging question should probe the implications of both hosting *and* winning on home soil, considering the relatively infrequent success England has experienced otherwise. The question needs to be framed to require a nuanced understanding of the context\u2014specifically, recognizing the rarity of England's success and the potential significance of the 1966 victory within that history. Difficulty is rated 8/10 due to the need to synthesize information about England's overall World Cup record with the specific achievement of 1966. The question will focus on the contextual importance of the 1966 win, rather than simple recall of facts.</thought_process>\n</document_analysis>\n<output_format>\nQuestion: Considering England's overall FIFA World Cup history as detailed, what is the primary significance of their 1966 victory?\nA: It marked the beginning of a sustained period of dominance in international football.\nB: It remains their sole major international trophy, achieved under unique circumstances.\nC: It established England as a consistent semi-finalist in subsequent tournaments.\nD: It demonstrated their superior qualification record compared to other European nations.\nExplanation: The text indicates that England has only won the World Cup once, in 1966, and has frequently failed to qualify or advance from group stages in other tournaments. This indicates that the 1966 win is particularly significant because it is their only major international trophy, occurring during a period where they have otherwise had limited success.\nCorrect Answer: B\n</output_format>\n```",
    "question": "Considering England's overall FIFA World Cup history as detailed, what is the primary significance of their 1966 victory?",
    "choices": {
      "A": "It marked the beginning of a sustained period of dominance in international football.",
      "B": "It remains their sole major international trophy, achieved under unique circumstances.",
      "C": "It established England as a consistent semi-finalist in subsequent tournaments.",
      "D": "It demonstrated their superior qualification record compared to other European nations."
    },
    "answer": "B",
    "explanation": "The text indicates that England has only won the World Cup once, in 1966, and has frequently failed to qualify or advance from group stages in other tournaments. This indicates that the 1966 win is particularly significant because it is their only major international trophy, occurring during a period where they have otherwise had limited success.",
    "question_token_count": 24,
    "answer_correctness_score": 10,
    "explanation_validity_score": 10,
    "question_clarity_score": 8,
    "question_difficulty_score": 4,
    "question_groundedness_score": 10,
    "avg_answer_token_count": 14
  },
  {
    "context": "<P> England did not enter the competition until 1950 , but have entered all eighteen subsequent tournaments . They have failed to qualify for the finals on three occasions , 1974 ( West Germany ) , 1978 ( Argentina ) and 1994 ( United States ) , and have failed to advance from the group stages on three occasions ; at the 1950 FIFA World Cup , the 1958 FIFA World Cup and the 2014 FIFA World Cup . Their best ever performance is winning the Cup in the 1966 tournament held in England , whilst they also finished in fourth place in 1990 , in Italy , and in 2018 in Russia . Other than that , the team have reached the quarter - finals on nine occasions , the latest of which were at the 2002 ( South Korea / Japan ) and the 2006 ( Germany ) . </P>",
    "topic": "Describe the host countries and England's performance in the 2002 and 2006 FIFA World Cups.",
    "response": "```xml\n<document_analysis>\n<thought_process>The context provides a historical overview of England's participation in the FIFA World Cup. It details qualification failures, group stage exits, best performances, and quarter-final appearances. The question topic specifically asks about the 2002 and 2006 World Cups. The context states England reached the quarter-finals in both of those tournaments, and specifies the host countries. The challenge lies in crafting a question that tests a domain expert\u2019s recall of these details in a subtle way, requiring them to differentiate between multiple quarter-final appearances. A good question would focus on the specific host nations for those tournaments, subtly testing their broader World Cup knowledge.</thought_process>\n<difficulty>6</difficulty>\n<question_type>Factual</question_type>\n<relevance_assessment>The context is directly relevant to the question topic. It provides the necessary information to answer the question accurately.</relevance_assessment>\n</document_analysis>\n<output_format>\nQuestion: In which of the following pairings are the FIFA World Cup years and their corresponding host nations accurately identified as reaching the quarter-finals for England?\nA: 2002 - Germany, 2006 - South Korea/Japan\nB: 2002 - South Korea/Japan, 2006 - Germany\nC: 2002 - Italy, 2006 - Russia\nD: 2002 - Argentina, 2006 - United States\nExplanation: The text explicitly states that England reached the quarter-finals in both the 2002 World Cup (held in South Korea/Japan) and the 2006 World Cup (held in Germany).\nCorrect Answer: B\n</output_format>\n```",
    "question": "In which of the following pairings are the FIFA World Cup years and their corresponding host nations accurately identified as reaching the quarter-finals for England?",
    "choices": {
      "A": "2002 - Germany, 2006 - South Korea/Japan",
      "B": "2002 - South Korea/Japan, 2006 - Germany",
      "C": "2002 - Italy, 2006 - Russia",
      "D": "2002 - Argentina, 2006 - United States"
    },
    "answer": "B",
    "explanation": "The text explicitly states that England reached the quarter-finals in both the 2002 World Cup (held in South Korea/Japan) and the 2006 World Cup (held in Germany).",
    "question_token_count": 30,
    "answer_correctness_score": 10,
    "explanation_validity_score": 10,
    "question_clarity_score": 4,
    "question_difficulty_score": 6,
    "question_groundedness_score": 8,
    "avg_answer_token_count": 12
  },
  {
    "context": "<P> The 21 World Cup tournaments have been won by eight national teams . Brazil have won five times , and they are the only team to have played in every tournament . The other World Cup winners are Germany and Italy , with four titles each ; Argentina , France and inaugural winner Uruguay , with two titles each ; and England and Spain with one title each . </P>",
    "topic": "The total number of national teams that have won the World Cup throughout its history.",
    "response": "```xml\n<document_analysis>\n<Thoughtful_Content_Examination>The context provides a concise overview of the history of World Cup winners. It explicitly states the total number of tournaments and the number of teams that have won at least once. It also details the number of titles each winning nation has secured.</Thoughtful_Content_Examination>\n<Concept_Exploration>The core concept is the distribution of success in the World Cup across different national teams. The information implies a concentration of wins among a few dominant teams (Brazil, Germany, Italy) while others have had limited success. The phrase \"only team to have played in every tournament\" regarding Brazil is a noteworthy detail.</Concept_Exploration>\n<Strategic_Complexity_Calibration>Difficulty: 7/10. The question requires recalling and synthesizing information about multiple teams and their respective win counts. While the total number of winning teams is directly stated, the question requires the examinee to understand the data presented. </Strategic_Complexity_Calibration>\n<Intentional_Question_Planning>The question aims to test the candidate's ability to recall specific details about World Cup history and perform basic counting. The distractors will be plausible numbers related to the number of tournaments or the wins of individual teams.</Intentional_Question_Planning>\n</document_analysis>\n<output_format>\nQuestion: Throughout the history of the FIFA World Cup, how many distinct national teams have achieved victory?\nA: 6\nB: 7\nC: 8\nD: 9\nExplanation: The text explicitly states, \u201cThe 21 World Cup tournaments have been won by eight national teams.\u201d This direct statement confirms the correct answer.\nCorrect Answer: C\n</output_format>\n```",
    "question": "Throughout the history of the FIFA World Cup, how many distinct national teams have achieved victory?",
    "choices": {
      "A": "6",
      "B": "7",
      "C": "8",
      "D": "9"
    },
    "answer": "C",
    "explanation": "The text explicitly states, \u201cThe 21 World Cup tournaments have been won by eight national teams.\u201d This direct statement confirms the correct answer.",
    "question_token_count": 19,
    "answer_correctness_score": 10,
    "explanation_validity_score": 10,
    "question_clarity_score": 10,
    "question_difficulty_score": 4,
    "question_groundedness_score": 10,
    "avg_answer_token_count": 2
  },
  {
    "context": "<P> The seventh season of the fantasy drama television series Game of Thrones premiered on HBO on July 16 , 2017 , and concluded on August 27 , 2017 . Unlike previous seasons that consisted of ten episodes each , the seventh season consisted of only seven . Like the previous season , it largely consisted of original content not found in George R.R. Martin 's A Song of Ice and Fire series , while also incorporating material Martin revealed to showrunners about the upcoming novels in the series . The series was adapted for television by David Benioff and D.B. Weiss . </P>",
    "topic": "Describe the premiere and conclusion dates of the seventh season of Game of Thrones.",
    "response": "```xml\n<document_analysis>\n1. **Thoughtful Content Examination**: The context provides specific dates for the premiere and conclusion of the seventh season of Game of Thrones, as well as details about the episode count and source material. The core information revolves around the temporal boundaries of the season.\n2. **Concept Exploration**: This text focuses on a specific, factual detail within the larger Game of Thrones universe. It subtly implies a shift in production strategy (shorter season, reliance on unreleased novel information).\n3. **Strategic Complexity Calibration**: Difficulty: 7/10. While the dates are explicitly stated, the question requires precise recall and understanding of the context's focus. The distractors will be dates close to the correct ones to make it challenging.\n4. **Intentional Question Planning**: The question will directly test the ability to recall specific dates. The answer options will be close to the correct dates to require precise knowledge.\n</document_analysis>\n<output_format>\nQuestion: The seventh season of Game of Thrones premiered and concluded on what dates?\nA: July 14, 2017 - August 25, 2017\nB: July 16, 2017 - August 27, 2017\nC: July 18, 2017 - August 29, 2017\nD: July 15, 2017 - August 26, 2017\nExplanation: The text explicitly states that the seventh season premiered on July 16, 2017, and concluded on August 27, 2017.\nCorrect Answer: B\n</output_format>\n```",
    "question": "The seventh season of Game of Thrones premiered and concluded on what dates?",
    "choices": {
      "A": "July 14, 2017 - August 25, 2017",
      "B": "July 16, 2017 - August 27, 2017",
      "C": "July 18, 2017 - August 29, 2017",
      "D": "July 15, 2017 - August 26, 2017"
    },
    "answer": "B",
    "explanation": "The text explicitly states that the seventh season premiered on July 16, 2017, and concluded on August 27, 2017.",
    "question_token_count": 16,
    "answer_correctness_score": 10,
    "explanation_validity_score": 10,
    "question_clarity_score": 4,
    "question_difficulty_score": 4,
    "question_groundedness_score": 10,
    "avg_answer_token_count": 16
  },
  {
    "context": "<P> The Super Bowl LII Halftime Show ( officially known as the Pepsi Super Bowl LII Halftime Show ) took place on February 4 , 2018 at U.S. Bank Stadium in Minneapolis , Minnesota , as part of Super Bowl LII . Justin Timberlake was the featured performer , as confirmed by the National Football League ( NFL ) on October 22 , 2017 . It was televised nationally by NBC . </P>",
    "topic": "Explain the official name of the Super Bowl LII Halftime Show, including the sponsor.",
    "response": "```xml\n<document_analysis>\n<thoughtful_content_examination>\nThe context provides a concise description of the Super Bowl LII Halftime Show, including its official name, date, location, performer, and broadcaster. The key information is the official name, which explicitly includes the sponsor.\n</thoughtful_content_examination>\n<concept_exploration>\nThe context highlights the commercialization of major events like the Super Bowl through sponsorship. The official naming convention demonstrates the financial relationship between the NFL and Pepsi.\n</concept_exploration>\n<strategic_complexity_calibration>\nDifficulty: 7/10. While the answer is directly stated, the question tests recall and attention to detail. The distractors will need to be carefully constructed to be plausible.\n</strategic_complexity_calibration>\n<intentional_question_planning>\nThe question will focus on the precise official name, requiring the test-taker to remember the exact phrasing, including the sponsor. The distractors will include variations of the name, potentially omitting the sponsor or using incorrect terminology.\n</intentional_question_planning>\n</document_analysis>\n<output_format>\nQuestion: What is the official name of the Super Bowl LII Halftime Show?\nA: Super Bowl LII Halftime Show\nB: NFL Super Bowl LII Halftime Show\nC: Pepsi Super Bowl LII Halftime Show\nD: U.S. Bank Super Bowl LII Halftime Show\nExplanation: The text explicitly states the official name is \u201cthe Pepsi Super Bowl LII Halftime Show.\u201d\nCorrect Answer: C\n</output_format>\n```",
    "question": "What is the official name of the Super Bowl LII Halftime Show?",
    "choices": {
      "A": "Super Bowl LII Halftime Show",
      "B": "NFL Super Bowl LII Halftime Show",
      "C": "Pepsi Super Bowl LII Halftime Show",
      "D": "U.S. Bank Super Bowl LII Halftime Show"
    },
    "answer": "C",
    "explanation": "The text explicitly states the official name is \u201cthe Pepsi Super Bowl LII Halftime Show.\u201d",
    "question_token_count": 16,
    "answer_correctness_score": 10,
    "explanation_validity_score": 10,
    "question_clarity_score": 8,
    "question_difficulty_score": 4,
    "question_groundedness_score": 10,
    "avg_answer_token_count": 9
  },
  {
    "context": "<P> The United States presidential line of succession is the order in which persons may become or act as President of the United States if the incumbent president becomes incapacitated , dies , resigns , or is removed from office ( by impeachment by the House of Representatives and subsequent conviction by the Senate ) . The line of succession is set by the United States Constitution and the Presidential Succession Act of 1947 as subsequently amended to include newly created cabinet offices . The succession follows the order of vice president , Speaker of the House of Representatives , President pro tempore of the Senate , and then the heads of federal executive departments who form the Cabinet of the United States . The Cabinet currently has fifteen members , beginning with the Secretary of State , and followed by the rest in the order of their positions ' creation . Those heads of department who are ineligible to act as president are also ineligible to succeed the president by succession , for example most commonly if they are not a natural - born U.S. citizen . </P>",
    "topic": "Detail the eligibility requirements for individuals to succeed the President, as outlined in the text.",
    "response": "```xml\n<document_analysis>\n1. **Thoughtful Content Examination**: The text details the presidential line of succession, outlining the order of individuals who might assume the presidency under various circumstances. It highlights the constitutional and statutory basis of this order, including the Presidential Succession Act of 1947 and its amendments. The text also notes that Cabinet members are included but are ineligible if they don\u2019t meet presidential eligibility requirements (specifically, being a natural-born U.S. citizen).\n2. **Concept Exploration**: The core concept is the continuity of presidential power. Implicitly, the text touches upon the importance of a clearly defined succession process for maintaining stability and preventing a power vacuum. The eligibility requirement for Cabinet members raises questions about the broader qualifications for holding high office.\n3. **Strategic Complexity Calibration**: Difficulty: 8/10. The question targets a specific detail within the succession process\u2014eligibility requirements\u2014and requires understanding of both constitutional principles and statutory provisions. It's not immediately obvious from the text, requiring careful reading and inference.\n4. **Intentional Question Planning**: The question is designed to assess understanding of the eligibility criteria for succeeding the President, going beyond simply listing the order of succession. It tests whether the examinee understands that not all individuals in the line of succession are automatically qualified.\n</document_analysis>\n<output_format>\nQuestion: According to established guidelines, which characteristic disqualifies an individual within the presidential line of succession from assuming the office of President?\nA: Holding a position within the Senate or House of Representatives.\nB: Not being a current member of the President\u2019s Cabinet.\nC: Not being a natural-born U.S. citizen.\nD: Having previously served as Vice President.\nExplanation: The text explicitly states that heads of department (Cabinet members) who are ineligible to act as president are also ineligible to succeed the president, \u201cfor example most commonly if they are not a natural-born U.S. citizen.\u201d This highlights the constitutional requirement for presidential eligibility.\nCorrect Answer: C\n</output_format>\n```",
    "question": "According to established guidelines, which characteristic disqualifies an individual within the presidential line of succession from assuming the office of President?",
    "choices": {
      "A": "Holding a position within the Senate or House of Representatives.",
      "B": "Not being a current member of the President\u2019s Cabinet.",
      "C": "Not being a natural-born U.S. citizen.",
      "D": "Having previously served as Vice President."
    },
    "answer": "C",
    "explanation": "The text explicitly states that heads of department (Cabinet members) who are ineligible to act as president are also ineligible to succeed the president, \u201cfor example most commonly if they are not a natural-born U.S. citizen.\u201d This highlights the constitutional requirement for presidential eligibility.",
    "question_token_count": 26,
    "answer_correctness_score": 10,
    "explanation_validity_score": 10,
    "question_clarity_score": 8,
    "question_difficulty_score": 6,
    "question_groundedness_score": 10,
    "avg_answer_token_count": 10
  },
  {
    "context": "<Table> <Tr> <Th> Year </Th> <Th> Round </Th> <Th> Position </Th> <Th> GP </Th> <Th> </Th> <Th> D * </Th> <Th> </Th> <Th> GF </Th> <Th> GA </Th> <Th> GD </Th> </Tr> <Tr> <Td> 1930 </Td> <Td colspan=\"9\"> Not a FIFA member </Td> </Tr> <Tr> <Td> 1934 </Td> </Tr> <Tr> <Td> 1938 </Td> </Tr> <Tr> <Td> 1950 </Td> <Td> Group stage </Td> <Td> 8th </Td> <Td> </Td> <Td> </Td> <Td> 0 </Td> <Td> </Td> <Td> </Td> <Td> </Td> <Td> 0 </Td> </Tr> <Tr> <Td> 1954 </Td> <Td> Quarter - finals </Td> <Td> 7th </Td> <Td> </Td> <Td> </Td> <Td> </Td> <Td> </Td> <Td> 8 </Td> <Td> 8 </Td> <Td> 0 </Td> </Tr> <Tr> <Td> 1958 </Td> <Td> Group stage </Td> <Td> 11th </Td> <Td> </Td> <Td> 0 </Td> <Td> </Td> <Td> </Td> <Td> </Td> <Td> 5 </Td> <Td> - 1 </Td> </Tr> <Tr> <Td> 1962 </Td> <Td> Quarter - finals </Td> <Td> 8th </Td> <Td> </Td> <Td> </Td> <Td> </Td> <Td> </Td> <Td> 5 </Td> <Td> 6 </Td> <Td> - 1 </Td> </Tr> <Tr> <Td> 1966 </Td> <Td> Champions </Td> <Td> 1st </Td> <Td> 6 </Td> <Td> 5 </Td> <Td> </Td> <Td> 0 </Td> <Td> 11 </Td> <Td> </Td> <Td> 8 </Td> </Tr> <Tr> <Td> 1970 </Td> <Td> Quarter - finals </Td> <Td> 8th </Td> <Td> </Td> <Td> </Td> <Td> 0 </Td> <Td> </Td> <Td> </Td> <Td> </Td> <Td> 0 </Td> </Tr> <Tr> <Td> </Td> <Td colspan=\"9\"> Did not qualify </Td> </Tr> <Tr> <Td> 1978 </Td> </Tr> <Tr> <Td> 1982 </Td> <Td> Second group stage </Td> <Td> 6th </Td> <Td> 5 </Td> <Td> </Td> <Td> </Td> <Td> 0 </Td> <Td> 6 </Td> <Td> </Td> <Td> 5 </Td> </Tr> <Tr> <Td> 1986 </Td> <Td> Quarter - finals </Td> <Td> 8th </Td> <Td> 5 </Td> <Td> </Td> <Td> </Td> <Td> </Td> <Td> 7 </Td> <Td> </Td> <Td> </Td> </Tr> <Tr> <Td> 1990 </Td> <Td> Semi finals </Td> <Td> 4th </Td> <Td> 7 </Td> <Td> </Td> <Td> </Td> <Td> </Td> <Td> 8 </Td> <Td> 6 </Td> <Td> </Td> </Tr> <Tr> <Td> 1994 </Td> <Td colspan=\"9\"> Did not qualify </Td> </Tr> <Tr> <Td> 1998 </Td> <Td> Round of 16 </Td> <Td> 9th </Td> <Td> </Td> <Td> </Td> <Td> </Td> <Td> </Td> <Td> 7 </Td> <Td> </Td> <Td> </Td> </Tr> <Tr> <Td> 2002 </Td> <Td> Quarter - finals </Td> <Td> 6th </Td> <Td> 5 </Td> <Td> </Td> <Td> </Td> <Td> </Td> <Td> 6 </Td> <Td> </Td> <Td> </Td> </Tr> <Tr> <Td> 2006 </Td> <Td> Quarter - finals </Td> <Td> 7th </Td> <Td> 5 </Td> <Td> </Td> <Td> </Td> <Td> 0 </Td> <Td> 6 </Td> <Td> </Td> <Td> </Td> </Tr> <Tr> <Td> </Td> <Td> Round of 16 </Td> <Td> 13th </Td> <Td> </Td> <Td> </Td> <Td> </Td> <Td> </Td> <Td> </Td> <Td> 5 </Td> <Td> - 2 </Td> </Tr> <Tr> <Td> 2014 </Td> <Td> Group stage </Td> <Td> 26th </Td> <Td> </Td> <Td> 0 </Td> <Td> </Td> <Td> </Td> <Td> </Td> <Td> </Td> <Td> - 2 </Td> </Tr> <Tr> <Td> 2018 </Td> <Td> Semi-finals </Td> <Td> 4th </Td> <Td> 7 </Td> <Td> </Td> <Td> </Td> <Td> </Td> <Td> 12 </Td> <Td> 8 </Td> <Td> </Td> </Tr> <Tr> <Td> 2022 </Td> <Td colspan=\"9\"> TBD </Td> </Tr> <Tr> <Td> 2026 </Td> </Tr> <Tr> <Th> Total </Th> <Th> 15 / 21 </Th> <Th> 1 title </Th> <Th> 69 </Th> <Th> 29 </Th> <Th> 21 </Th> <Th> 19 </Th> <Th> 91 </Th> <Th> 64 </Th> <Th> 27 </Th> </Tr> </Table>",
    "topic": "Interpretation of the nation's goal-scoring record (GF) and goal difference (GD) as indicators of their performance across various World Cups.",
    "response": "```xml\n<document_analysis>\nThis document presents a table detailing a nation's performance in the FIFA World Cup from 1930 to 2022 (with 2022 TBD and 2026 blank). The table includes data on year, round reached, position, games played, draws, goals for (GF), goals against (GA), and goal difference (GD). The data is somewhat incomplete (missing values in many cells), but provides a historical overview. The total row summarizes the nation's overall World Cup record.\n\nThe challenge is to formulate a question that requires understanding of the interplay between GF, GA, GD, and tournament success. A difficult question would require inferring performance trends beyond simply reading values from the table. It should also avoid directly asking for a value present in the table.\n\nDifficulty Calibration: 8/10. This is a relatively complex dataset, and the question needs to require synthesis and interpretation to be sufficiently challenging.\n\nIntentional Question Planning: The question will focus on the relationship between goal difference and success in the tournament, specifically testing the understanding that a positive goal difference doesn't *guarantee* advancement.\n</document_analysis>\n<output_format>\nQuestion: Considering the historical data provided, which of the following statements best encapsulates the relationship between a nation's Goal Difference (GD) in a World Cup tournament and its likelihood of reaching the Quarter-Finals or beyond?\nA: A consistently positive GD is a definitive predictor of reaching the Quarter-Finals or beyond in subsequent tournaments.\nB: While a positive GD often correlates with advancement, it is not a guarantee, as demonstrated by instances where positive GD did not result in progression past the Group Stage.\nC: A negative GD invariably results in elimination during the Group Stage, as evidenced by the data presented.\nD: GD is primarily influenced by the number of games played, and therefore has limited predictive value regarding tournament progression.\nExplanation: The data shows instances of positive GD (e.g., 1958 (+1), 1962 (-1)) without reaching the Quarter-Finals, and instances where failing to qualify resulted in a GD of 0. This indicates that GD is a factor, but not a definitive predictor of success.\nCorrect Answer: B\n</output_format>\n```",
    "question": "Considering the historical data provided, which of the following statements best encapsulates the relationship between a nation's Goal Difference (GD) in a World Cup tournament and its likelihood of reaching the Quarter-Finals or beyond?",
    "choices": {
      "A": "A consistently positive GD is a definitive predictor of reaching the Quarter-Finals or beyond in subsequent tournaments.",
      "B": "While a positive GD often correlates with advancement, it is not a guarantee, as demonstrated by instances where positive GD did not result in progression past the Group Stage.",
      "C": "A negative GD invariably results in elimination during the Group Stage, as evidenced by the data presented.",
      "D": "GD is primarily influenced by the number of games played, and therefore has limited predictive value regarding tournament progression."
    },
    "answer": "B",
    "explanation": "The data shows instances of positive GD (e.g., 1958 (+1), 1962 (-1)) without reaching the Quarter-Finals, and instances where failing to qualify resulted in a GD of 0. This indicates that GD is a factor, but not a definitive predictor of success.",
    "question_token_count": 42,
    "answer_correctness_score": 9,
    "explanation_validity_score": 8,
    "question_clarity_score": 6,
    "question_difficulty_score": 8,
    "question_groundedness_score": 9,
    "avg_answer_token_count": 24
  },
  {
    "context": "<Table> <Tr> <Th> No . </Th> <Th> Athlete </Th> <Th> Nation </Th> <Th> Sport </Th> <Th> Years </Th> <Th> Games </Th> <Th> Gender </Th> <Th> Gold </Th> <Th> Silver </Th> <Th> Bronze </Th> <Th> Total </Th> </Tr> <Tr> <Th> </Th> <Td> Phelps , Michael Michael Phelps </Td> <Td> United States </Td> <Td> Swimming </Td> <Td> 2004 -- 2016 </Td> <Td> Summer </Td> <Td> </Td> <Td> 23 </Td> <Td> </Td> <Td> </Td> <Td> 28 </Td> </Tr> <Tr> <Th> </Th> <Td> Latynina , Larisa Larisa Latynina </Td> <Td> Soviet Union </Td> <Td> Gymnastics </Td> <Td> 1956 -- 1964 </Td> <Td> Summer </Td> <Td> </Td> <Td> 9 </Td> <Td> 5 </Td> <Td> </Td> <Td> 18 </Td> </Tr> <Tr> <Th> </Th> <Td> Nurmi , Paavo Paavo Nurmi </Td> <Td> Finland </Td> <Td> Athletics </Td> <Td> 1920 -- 1928 </Td> <Td> Summer </Td> <Td> </Td> <Td> 9 </Td> <Td> </Td> <Td> 0 </Td> <Td> 12 </Td> </Tr> <Tr> <Th> </Th> <Td> Spitz , Mark Mark Spitz </Td> <Td> United States </Td> <Td> Swimming </Td> <Td> 1968 -- 1972 </Td> <Td> Summer </Td> <Td> </Td> <Td> 9 </Td> <Td> </Td> <Td> </Td> <Td> 11 </Td> </Tr> <Tr> <Th> 5 </Th> <Td> Lewis , Carl Carl Lewis </Td> <Td> United States </Td> <Td> Athletics </Td> <Td> 1984 -- 1996 </Td> <Td> Summer </Td> <Td> </Td> <Td> 9 </Td> <Td> </Td> <Td> 0 </Td> <Td> 10 </Td> </Tr> <Tr> <Th> 6 </Th> <Td> Bj\u00f8rgen , Marit Marit Bj\u00f8rgen </Td> <Td> Norway </Td> <Td> Cross-country skiing </Td> <Td> 2002 -- 2018 </Td> <Td> Winter </Td> <Td> </Td> <Td> 8 </Td> <Td> </Td> <Td> </Td> <Td> 15 </Td> </Tr> <Tr> <Th> 7 </Th> <Td> Bj\u00f8rndalen , Ole Einar Ole Einar Bj\u00f8rndalen </Td> <Td> Norway </Td> <Td> Biathlon </Td> <Td> 1998 -- 2014 </Td> <Td> Winter </Td> <Td> </Td> <Td> 8 </Td> <Td> </Td> <Td> </Td> <Td> 13 </Td> </Tr> <Tr> <Th> 8 </Th> <Td> D\u00e6hlie , Bj\u00f8rn Bj\u00f8rn D\u00e6hlie </Td> <Td> Norway </Td> <Td> Cross-country skiing </Td> <Td> 1992 -- 1998 </Td> <Td> Winter </Td> <Td> </Td> <Td> 8 </Td> <Td> </Td> <Td> 0 </Td> <Td> 12 </Td> </Tr> <Tr> <Td> Fischer , Birgit Birgit Fischer </Td> <Td> East Germany Germany </Td> <Td> Canoeing </Td> <Td> 1980 -- 2004 </Td> <Td> Summer </Td> <Td> </Td> <Td> 8 </Td> <Td> </Td> <Td> 0 </Td> <Td> 12 </Td> </Tr> <Tr> <Th> 10 </Th> <Td> Kato , Sawao Sawao Kato </Td> <Td> Japan </Td> <Td> Gymnastics </Td> <Td> 1968 -- 1976 </Td> <Td> Summer </Td> <Td> </Td> <Td> 8 </Td> <Td> </Td> <Td> </Td> <Td> 12 </Td> </Tr> <Tr> <Td> Thompson , Jenny Jenny Thompson </Td> <Td> United States </Td> <Td> Swimming </Td> <Td> 1992 -- 2004 </Td> <Td> Summer </Td> <Td> </Td> <Td> 8 </Td> <Td> </Td> <Td> </Td> <Td> 12 </Td> </Tr> <Tr> <Th> 12 </Th> <Td> Biondi , Matt Matt Biondi </Td> <Td> United States </Td> <Td> Swimming </Td> <Td> 1984 -- 1992 </Td> <Td> Summer </Td> <Td> </Td> <Td> 8 </Td> <Td> </Td> <Td> </Td> <Td> 11 </Td> </Tr> <Tr> <Th> 13 </Th> <Td> Bolt , Usain Usain Bolt </Td> <Td> Jamaica </Td> <Td> Athletics </Td> <Td> 2008 -- 2016 </Td> <Td> Summer </Td> <Td> </Td> <Td> 8 </Td> <Td> 0 </Td> <Td> 0 </Td> <Td> 8 </Td> </Tr> <Tr> <Td> Ewry , Ray Ray Ewry </Td> <Td> United States </Td> <Td> Athletics </Td> <Td> 1900 -- 1908 </Td> <Td> Summer </Td> <Td> </Td> <Td> 8 </Td> <Td> 0 </Td> <Td> 0 </Td> <Td> 8 </Td> </Tr> <Tr> <Th> 15 </Th> <Td> Andrianov , Nikolai Nikolai Andrianov </Td> <Td> Soviet Union </Td> <Td> Gymnastics </Td> <Td> 1972 -- 1980 </Td> <Td> Summer </Td> <Td> </Td> <Td> 7 </Td> <Td> 5 </Td> <Td> </Td> <Td> 15 </Td> </Tr> <Tr> <Th> 16 </Th> <Td> Shakhlin , Boris Boris Shakhlin </Td> <Td> Soviet Union </Td> <Td> Gymnastics </Td> <Td> 1956 -- 1964 </Td> <Td> Summer </Td> <Td> </Td> <Td> 7 </Td> <Td> </Td> <Td> </Td> <Td> 13 </Td> </Tr> <Tr> <Th> 17 </Th> <Td> \u010c\u00e1slavsk\u00e1 , V\u011bra V\u011bra \u010c\u00e1slavsk\u00e1 </Td> <Td> Czechoslovakia </Td> <Td> Gymnastics </Td> <Td> 1960 -- 1968 </Td> <Td> Summer </Td> <Td> </Td> <Td> 7 </Td> <Td> </Td> <Td> 0 </Td> <Td> 11 </Td> </Tr> <Tr> <Th> 18 </Th> <Td> Chukarin , Viktor Viktor Chukarin </Td> <Td> Soviet Union </Td> <Td> Gymnastics </Td> <Td> 1952 -- 1956 </Td> <Td> Summer </Td> <Td> </Td> <Td> 7 </Td> <Td> </Td> <Td> </Td> <Td> 11 </Td> </Tr> <Tr> <Th> 19 </Th> <Td> Gerevich , Alad\u00e1r Alad\u00e1r Gerevich </Td> <Td> Hungary </Td> <Td> Fencing </Td> <Td> 1932 -- 1960 </Td> <Td> Summer </Td> <Td> </Td> <Td> 7 </Td> <Td> </Td> <Td> </Td> <Td> 10 </Td> </Tr> <Tr> <Th> 20 </Th> <Td> Mangiarotti , Edoardo Edoardo Mangiarotti </Td> <Td> Italy </Td> <Td> Fencing </Td> <Td> 1936 -- 1960 </Td> <Td> Summer </Td> <Td> </Td>",
    "topic": "Analyzing the dominance of specific nations (e.g., United States, Soviet Union, Norway) in Olympic medal counts based on the provided data.",
    "response": "```xml\n<document_analysis>\nThe provided context is a table of Olympic athletes and their medal counts. It includes information about the athlete's name, nation, sport, years competed, games participated in, gender, and the number of gold, silver, and bronze medals won. The data allows for analysis of national dominance in the Olympics. The table is well-structured and provides a solid basis for generating a challenging question. No irrelevant information is present. The question will focus on inferring factors contributing to national success based on the data presented, specifically related to the long-term success of certain nations. Difficulty is estimated at 8/10.\n</document_analysis>\n<output_format>\nQuestion: Considering the data provided, which of the following factors likely contributed most significantly to the sustained Olympic success of nations like the United States, the Soviet Union, and Norway across multiple Olympic Games and sporting disciplines?\nA: A consistent focus on niche sports with limited global participation, maximizing medal opportunities.\nB: A centralized, state-sponsored athletic development system coupled with broad participation in a variety of sports.\nC: A historical emphasis on individual athletic brilliance, neglecting comprehensive national sports programs.\nD: A decentralized, community-based sports system prioritizing recreational athletics over elite performance.\nExplanation: The data shows sustained success across multiple sports for the US, Soviet Union, and Norway. The Soviet Union's success was famously tied to a state-sponsored system. The US and Norway have broad participation in many sports, suggesting a comprehensive approach. Options A, C and D do not align with the observed breadth of success.\nCorrect Answer: B\n</output_format>\n```",
    "question": "Considering the data provided, which of the following factors likely contributed most significantly to the sustained Olympic success of nations like the United States, the Soviet Union, and Norway across multiple Olympic Games and sporting disciplines?",
    "choices": {
      "A": "A consistent focus on niche sports with limited global participation, maximizing medal opportunities.",
      "B": "A centralized, state-sponsored athletic development system coupled with broad participation in a variety of sports.",
      "C": "A historical emphasis on individual athletic brilliance, neglecting comprehensive national sports programs.",
      "D": "A decentralized, community-based sports system prioritizing recreational athletics over elite performance."
    },
    "answer": "B",
    "explanation": "The data shows sustained success across multiple sports for the US, Soviet Union, and Norway. The Soviet Union's success was famously tied to a state-sponsored system. The US and Norway have broad participation in many sports, suggesting a comprehensive approach. Options A, C and D do not align with the observed breadth of success.",
    "question_token_count": 41,
    "answer_correctness_score": 9,
    "explanation_validity_score": 9,
    "question_clarity_score": 7,
    "question_difficulty_score": 6,
    "question_groundedness_score": 8,
    "avg_answer_token_count": 16
  },
  {
    "context": "<Table> <Tr> <Th colspan=\"2\"> Philadelphia Eagles </Th> </Tr> <Tr> <Td colspan=\"2\"> Current season </Td> </Tr> <Tr> <Td colspan=\"2\"> Established July 8 , 1933 ; 84 years ago ( July 8 , 1933 ) First season : 1933 Play in Lincoln Financial Field Philadelphia , Pennsylvania Headquartered in the NovaCare Complex Philadelphia , Pennsylvania </Td> </Tr> <Tr> <Th colspan=\"2\"> </Th> </Tr> <Tr> <Td colspan=\"2\"> <Table> <Tr> <Td> </Td> <Td> </Td> </Tr> <Tr> <Td> Logo </Td> <Td> Wordmark </Td> </Tr> </Table> </Td> </Tr> <Tr> <Th colspan=\"2\"> League / conference affiliations </Th> </Tr> <Tr> <Td colspan=\"2\"> <P> National Football League ( 1933 -- present ) </P> <Ul> <Li> Eastern Division ( 1933 -- 1949 ) </Li> <Li> American Conference ( 1950 -- 1952 ) </Li> <Li> Eastern Conference ( 1953 -- 1969 ) <Ul> <Li> Capitol Division ( 1967 -- 1969 ) </Li> </Ul> </Li> <Li> National Football Conference ( 1970 -- present ) <Ul> <Li> NFC East ( 1970 -- present ) </Li> </Ul> </Li> </Ul> </Td> </Tr> <Tr> <Td colspan=\"2\"> Current uniform </Td> </Tr> <Tr> <Td colspan=\"2\"> </Td> </Tr> <Tr> <Th> Team colors </Th> <Td> <P> Midnight green , Silver , Black , White </P> </Td> </Tr> <Tr> <Th> Fight song </Th> <Td> Fly , Eagles Fly </Td> </Tr> <Tr> <Th> Mascot </Th> <Td> Swoop </Td> </Tr> <Tr> <Th colspan=\"2\"> Personnel </Th> </Tr> <Tr> <Th> Owner ( s ) </Th> <Td> Jeffrey Lurie Christina Weiss Lurie </Td> </Tr> <Tr> <Th> Chairman </Th> <Td> Jeffrey Lurie </Td> </Tr> <Tr> <Th> CEO </Th> <Td> Jeffrey Lurie </Td> </Tr> <Tr> <Th> President </Th> <Td> Don Smolenski </Td> </Tr> <Tr> <Th> General manager </Th> <Td> Howie Roseman </Td> </Tr> <Tr> <Th> Head coach </Th> <Td> Doug Pederson </Td> </Tr> <Tr> <Th colspan=\"2\"> Team history </Th> </Tr> <Tr> <Td colspan=\"2\"> <Ul> <Li> Philadelphia Eagles ( 1933 -- 1942 ; 1944 -- present ) </Li> <Li> Phil - Pitt `` Steagles '' ( 1943 ) </Li> </Ul> </Td> </Tr> <Tr> <Th colspan=\"2\"> Team nicknames </Th> </Tr> <Tr> <Td colspan=\"2\"> <Ul> <Li> The Birds </Li> </Ul> </Td> </Tr> <Tr> <Th colspan=\"2\"> Championships </Th> </Tr> <Tr> <Td colspan=\"2\"> <P> League championships ( 4 ) </P> <Ul> <Li> NFL championships ( pre-1970 AFL -- NFL merger ) ( 3 ) 1948 , 1949 , 1960 </Li> </Ul> <Ul> <Li> Super Bowl championships ( 1 ) 2017 ( LII ) </Li> </Ul> </Td> </Tr> <Tr> <Td colspan=\"2\"> <P> Conference championships ( 4 ) </P> <Ul> <Li> NFL Eastern : 1960 </Li> <Li> NFC : 1980 , 2004 , 2017 </Li> </Ul> </Td> </Tr> <Tr> <Td colspan=\"2\"> <P> Division championships ( 13 ) </P> <Ul> <Li> NFL East : 1947 , 1948 , 1949 </Li> <Li> NFC East : 1980 , 1988 , 2001 , 2002 , 2003 , 2004 , 2006 , 2010 , 2013 , 2017 </Li> </Ul> </Td> </Tr> <Tr> <Th colspan=\"2\"> Playoff appearances ( 25 ) </Th> </Tr> <Tr> <Td colspan=\"2\"> <Ul> <Li> NFL : 1947 , 1948 , 1949 , 1960 , 1978 , 1979 , 1980 , 1981 , 1988 , 1989 , 1990 , 1992 , 1995 , 1996 , 2000 , 2001 , 2002 , 2003 , 2004 , 2006 , 2008 , 2009 , 2010 , 2013 , 2017 </Li> </Ul> </Td> </Tr> <Tr> <Th colspan=\"2\"> Home fields </Th> </Tr> <Tr> <Td colspan=\"2\"> <Ul> <Li> Baker Bowl ( 1933 -- 1935 ) </Li> <Li> Philadelphia Municipal Stadium ( 1936 -- 1939 , 1941 ) </Li> <Li> Connie Mack Stadium ( 1940 , 1942 -- 1957 ) </Li> <Li> Franklin Field ( 1958 -- 1970 ) </Li> <Li> Veterans Stadium ( 1971 -- 2002 ) </Li> <Li> Lincoln Financial Field ( 2003 -- present ) </Li> </Ul> </Td> </Tr> </Table>",
    "topic": "A chronological listing of all the home fields used by the Philadelphia Eagles, from their inception to the present day.",
    "response": "<document_analysis>\nThe provided context is a table detailing information about the Philadelphia Eagles football team. The table includes details about the team's history, personnel, championships, and home fields. The section on home fields lists, chronologically, all the stadiums the Eagles have used. This is a straightforward factual listing, making it suitable for a recall-based question with nuanced answer options. The difficulty will be calibrated by focusing on the temporal order and potentially lesser-known early stadiums. I will focus on testing the expert's ability to recall the sequence of stadiums used by the Eagles.\n</document_analysis>\n\n<output_format>\nQuestion: Prior to the opening of Lincoln Financial Field in 2003, the Philadelphia Eagles played their home games at Veterans Stadium for over two decades. Which stadium did the Eagles utilize *immediately* prior to their tenure at Veterans Stadium?\nA: Connie Mack Stadium\nB: Franklin Field\nC: Philadelphia Municipal Stadium\nD: Baker Bowl\nExplanation: The provided text lists the home fields in chronological order. Following Veterans Stadium (1971-2002) in the list is Franklin Field (1958-1970).\nCorrect Answer: B\n</output_format>",
    "question": "Prior to the opening of Lincoln Financial Field in 2003, the Philadelphia Eagles played their home games at Veterans Stadium for over two decades. Which stadium did the Eagles utilize *immediately* prior to their tenure at Veterans Stadium?",
    "choices": {
      "A": "Connie Mack Stadium",
      "B": "Franklin Field",
      "C": "Philadelphia Municipal Stadium",
      "D": "Baker Bowl"
    },
    "answer": "B",
    "explanation": "The provided text lists the home fields in chronological order. Following Veterans Stadium (1971-2002) in the list is Franklin Field (1958-1970).",
    "question_token_count": 47,
    "answer_correctness_score": 10,
    "explanation_validity_score": 10,
    "question_clarity_score": 8,
    "question_difficulty_score": 6,
    "question_groundedness_score": 10,
    "avg_answer_token_count": 4
  },
  {
    "context": "<P> The flag of the United States of America , often referred to as the American flag , is the national flag of the United States . It consists of thirteen equal horizontal stripes of red ( top and bottom ) alternating with white , with a blue rectangle in the canton ( referred to specifically as the `` union '' ) bearing fifty small , white , five - pointed stars arranged in nine offset horizontal rows , where rows of six stars ( top and bottom ) alternate with rows of five stars . The 50 stars on the flag represent the 50 states of the United States of America , and the 13 stripes represent the thirteen British colonies that declared independence from the Kingdom of Great Britain , and became the first states in the U.S. Nicknames for the flag include The Stars and Stripes , Old Glory , and The Star - Spangled Banner . </P>",
    "topic": "Detail the colors used in the American flag and their specific placement within the design.",
    "response": "```xml\n<document_analysis>\n<Thoughtful_Content_Examination>The context describes the American flag, detailing the number of stripes, their colors, and the arrangement of stars. It also explains the symbolism behind these elements \u2013 the stripes representing the original colonies and the stars representing the current states.</Thoughtful_Content_Examination>\n<Concept_Exploration>The text focuses on the visual components and historical symbolism of the flag. A challenging question could explore the precise arrangement and meaning of these elements, requiring a detailed understanding of the flag's design principles.</Concept_Exploration>\n<Strategic_Complexity_Calibration>Difficulty: 8/10. The question will require recall of specific details about stripe color and star arrangement, demanding precise knowledge beyond a general understanding of the flag.</Strategic_Complexity_Calibration>\n<Intentional_Question_Planning>The question will focus on the precise color arrangement of the stripes, testing the expert's attention to detail and recall of the flag's specifications. The distractors will include plausible, but incorrect, color combinations.</Intentional_Question_Planning>\n</document_analysis>\n\n<output_format>\nQuestion: What is the precise alternating color pattern of the thirteen horizontal stripes on the American flag?\nA: White, red, white, red, white, red, white, red, white, red, white, red, white.\nB: Red, white, red, white, red, white, red, white, red, white, red, white, red.\nC: Blue, white, red, white, blue, white, red, white, blue, white, red, white, blue.\nD: White, blue, red, white, blue, red, white, blue, red, white, blue, red, white.\nExplanation: The text explicitly states that the flag consists of \"thirteen equal horizontal stripes of red (top and bottom) alternating with white.\" This means the top and bottom stripes are red, and the colors alternate.\nCorrect Answer: B\n</output_format>\n```",
    "question": "What is the precise alternating color pattern of the thirteen horizontal stripes on the American flag?",
    "choices": {
      "A": "White, red, white, red, white, red, white, red, white, red, white, red, white.",
      "B": "Red, white, red, white, red, white, red, white, red, white, red, white, red.",
      "C": "Blue, white, red, white, blue, white, red, white, blue, white, red, white, blue.",
      "D": "White, blue, red, white, blue, red, white, blue, red, white, blue, red, white."
    },
    "answer": "B",
    "explanation": "The text explicitly states that the flag consists of \"thirteen equal horizontal stripes of red (top and bottom) alternating with white.\" This means the top and bottom stripes are red, and the colors alternate.",
    "question_token_count": 18,
    "answer_correctness_score": 10,
    "explanation_validity_score": 10,
    "question_clarity_score": 6,
    "question_difficulty_score": 4,
    "question_groundedness_score": 10,
    "avg_answer_token_count": 27
  },
  {
    "context": "<P> `` Death and All His Friends '' is the season finale of the sixth season of the American television medical drama Grey 's Anatomy , and the show 's 126th episode overall . It was written by Shonda Rhimes and directed by Rob Corn . The episode was originally broadcast on the American Broadcasting Company ( ABC ) in the United States on May 20 , 2010 . The episode was the second part of the two - hour season six finale , the first being Sanctuary , and took place at the fictional Seattle Grace Hospital . The original episode broadcast in the United States had an audience of 16.13 million viewers and opened up to universal acclaim . The episode centers a shooting spree at the hospital by a former patient 's husband Gary Clark ( Michael O'Neill ) . The episode marked the last appearances for Nora Zehetner and Robert Baker as Dr. Reed Adamson and Dr. Charles Percy respectively as both the characters were killed in the shooting . </P>",
    "topic": "The critical reception of the \"Death and All His Friends\" episode following its initial broadcast.",
    "response": "```xml\n<document_analysis>\n<thought_process>The context provides a factual overview of the \"Death and All His Friends\" episode of Grey's Anatomy. It details the episode's broadcast date, viewership, critical reception (\"universal acclaim\"), and key plot points (shooting spree, character deaths). A challenging question should probe beyond these surface-level details and require an understanding of the episode's impact within the series' narrative or television drama conventions. The question should focus on the 'universal acclaim' aspect and what specific elements likely contributed to it, requiring inference beyond the immediate facts. I'll focus on the narrative risk taken in killing established characters and how that impacts critical reception. The difficulty level is set to 9, aiming for a question that requires a nuanced understanding of television drama and storytelling.</thought_process>\n<complexity_assessment>Difficulty: 9/10. The question requires understanding of narrative impact and critical reception beyond simple recall of facts.</complexity_assessment>\n<relevance_check>The entire context is relevant and contains meaningful content. No irrelevant elements are present.</relevance_check>\n</document_analysis>\n\n<output_format>\nQuestion: Considering the narrative convention of protecting core cast members in long-running television dramas, what primarily fueled the \"universal acclaim\" received by \"Death and All His Friends\" despite the permanent removal of established characters Dr. Reed Adamson and Dr. Charles Percy?\nA: The episode\u2019s high viewership numbers, demonstrating broad audience appeal.\nB: The dramatic tension created by the shooting spree, providing compelling television.\nC: The unexpected willingness to raise the stakes through permanent character loss, subverting audience expectations and demonstrating narrative risk.\nD: The strong performances by Michael O'Neill as Gary Clark, elevating the episode\u2019s emotional impact.\nExplanation: While all options contribute to the episode's success, the \u201cuniversal acclaim\u201d stemmed from the show\u2019s bold decision to kill off established characters. This defied typical television drama conventions where core cast members are usually protected, creating a shocking and impactful narrative moment. This narrative risk was a significant factor in the positive critical response.\nCorrect Answer: C\n</output_format>\n```",
    "question": "Considering the narrative convention of protecting core cast members in long-running television dramas, what primarily fueled the \"universal acclaim\" received by \"Death and All His Friends\" despite the permanent removal of established characters Dr. Reed Adamson and Dr. Charles Percy?",
    "choices": {
      "A": "The episode\u2019s high viewership numbers, demonstrating broad audience appeal.",
      "B": "The dramatic tension created by the shooting spree, providing compelling television.",
      "C": "The unexpected willingness to raise the stakes through permanent character loss, subverting audience expectations and demonstrating narrative risk.",
      "D": "The strong performances by Michael O'Neill as Gary Clark, elevating the episode\u2019s emotional impact."
    },
    "answer": "C",
    "explanation": "While all options contribute to the episode's success, the \u201cuniversal acclaim\u201d stemmed from the show\u2019s bold decision to kill off established characters. This defied typical television drama conventions where core cast members are usually protected, creating a shocking and impactful narrative moment. This narrative risk was a significant factor in the positive critical response.",
    "question_token_count": 53,
    "answer_correctness_score": 10,
    "explanation_validity_score": 10,
    "question_clarity_score": 6,
    "question_difficulty_score": 8,
    "question_groundedness_score": 5,
    "avg_answer_token_count": 18
  },
  {
    "context": "<Table> <Tr> <Th> Year </Th> <Th> Round </Th> <Th> Position </Th> <Th> GP </Th> <Th> </Th> <Th> D * </Th> <Th> </Th> <Th> GF </Th> <Th> GA </Th> <Th> GD </Th> </Tr> <Tr> <Td> 1930 </Td> <Td colspan=\"9\"> Not a FIFA member </Td> </Tr> <Tr> <Td> 1934 </Td> </Tr> <Tr> <Td> 1938 </Td> </Tr> <Tr> <Td> 1950 </Td> <Td> Group stage </Td> <Td> 8th </Td> <Td> </Td> <Td> </Td> <Td> 0 </Td> <Td> </Td> <Td> </Td> <Td> </Td> <Td> 0 </Td> </Tr> <Tr> <Td> 1954 </Td> <Td> Quarter - finals </Td> <Td> 7th </Td> <Td> </Td> <Td> </Td> <Td> </Td> <Td> </Td> <Td> 8 </Td> <Td> 8 </Td> <Td> 0 </Td> </Tr> <Tr> <Td> 1958 </Td> <Td> Group stage </Td> <Td> 11th </Td> <Td> </Td> <Td> 0 </Td> <Td> </Td> <Td> </Td> <Td> </Td> <Td> 5 </Td> <Td> - 1 </Td> </Tr> <Tr> <Td> 1962 </Td> <Td> Quarter - finals </Td> <Td> 8th </Td> <Td> </Td> <Td> </Td> <Td> </Td> <Td> </Td> <Td> 5 </Td> <Td> 6 </Td> <Td> - 1 </Td> </Tr> <Tr> <Td> 1966 </Td> <Td> Champions </Td> <Td> 1st </Td> <Td> 6 </Td> <Td> 5 </Td> <Td> </Td> <Td> 0 </Td> <Td> 11 </Td> <Td> </Td> <Td> 8 </Td> </Tr> <Tr> <Td> 1970 </Td> <Td> Quarter - finals </Td> <Td> 8th </Td> <Td> </Td> <Td> </Td> <Td> 0 </Td> <Td> </Td> <Td> </Td> <Td> </Td> <Td> 0 </Td> </Tr> <Tr> <Td> </Td> <Td colspan=\"9\"> Did not qualify </Td> </Tr> <Tr> <Td> 1978 </Td> </Tr> <Tr> <Td> 1982 </Td> <Td> Second group stage </Td> <Td> 6th </Td> <Td> 5 </Td> <Td> </Td> <Td> </Td> <Td> 0 </Td> <Td> 6 </Td> <Td> </Td> <Td> 5 </Td> </Tr> <Tr> <Td> 1986 </Td> <Td> Quarter - finals </Td> <Td> 8th </Td> <Td> 5 </Td> <Td> </Td> <Td> </Td> <Td> </Td> <Td> 7 </Td> <Td> </Td> <Td> </Td> </Tr> <Tr> <Td> 1990 </Td> <Td> Semi finals </Td> <Td> 4th </Td> <Td> 7 </Td> <Td> </Td> <Td> </Td> <Td> </Td> <Td> 8 </Td> <Td> 6 </Td> <Td> </Td> </Tr> <Tr> <Td> 1994 </Td> <Td colspan=\"9\"> Did not qualify </Td> </Tr> <Tr> <Td> 1998 </Td> <Td> Round of 16 </Td> <Td> 9th </Td> <Td> </Td> <Td> </Td> <Td> </Td> <Td> </Td> <Td> 7 </Td> <Td> </Td> <Td> </Td> </Tr> <Tr> <Td> 2002 </Td> <Td> Quarter - finals </Td> <Td> 6th </Td> <Td> 5 </Td> <Td> </Td> <Td> </Td> <Td> </Td> <Td> 6 </Td> <Td> </Td> <Td> </Td> </Tr> <Tr> <Td> 2006 </Td> <Td> Quarter - finals </Td> <Td> 7th </Td> <Td> 5 </Td> <Td> </Td> <Td> </Td> <Td> 0 </Td> <Td> 6 </Td> <Td> </Td> <Td> </Td> </Tr> <Tr> <Td> </Td> <Td> Round of 16 </Td> <Td> 13th </Td> <Td> </Td> <Td> </Td> <Td> </Td> <Td> </Td> <Td> </Td> <Td> 5 </Td> <Td> - 2 </Td> </Tr> <Tr> <Td> 2014 </Td> <Td> Group stage </Td> <Td> 26th </Td> <Td> </Td> <Td> 0 </Td> <Td> </Td> <Td> </Td> <Td> </Td> <Td> </Td> <Td> - 2 </Td> </Tr> <Tr> <Td> 2018 </Td> <Td> Semi-finals </Td> <Td> 4th </Td> <Td> 7 </Td> <Td> </Td> <Td> </Td> <Td> </Td> <Td> 12 </Td> <Td> 8 </Td> <Td> </Td> </Tr> <Tr> <Td> 2022 </Td> <Td colspan=\"9\"> TBD </Td> </Tr> <Tr> <Td> 2026 </Td> </Tr> <Tr> <Th> Total </Th> <Th> 15 / 21 </Th> <Th> 1 title </Th> <Th> 69 </Th> <Th> 29 </Th> <Th> 21 </Th> <Th> 19 </Th> <Th> 91 </Th> <Th> 64 </Th> <Th> 27 </Th> </Tr> </Table>",
    "topic": "The relationship between the number of games played (GP) and the success (round reached) of the nation in different World Cup editions.",
    "response": "```xml\n<document_analysis>\nThis document presents a table detailing a nation's (unspecified) performance in FIFA World Cup tournaments from 1930 to 2022 (with 2026 included as a placeholder). The table includes information on the year, round reached, position, number of games played (GP), and various statistics related to goals scored and conceded. The data is somewhat incomplete, with many GP values missing. The question will focus on extracting insights about the correlation between games played and success in the tournament. The challenge lies in identifying potential trends despite the data gaps and considering the nuances of 'success' (defined by round reached). Difficulty is estimated at 8/10 due to the need for data synthesis and pattern recognition.\n</document_analysis>\n<output_format>\nQuestion: Considering the available data, what general relationship can be inferred between the number of games played in a FIFA World Cup tournament and the furthest round a nation advances?\nA: Nations consistently reaching the later stages (semi-finals or beyond) tend to play a relatively small number of games.\nB: There is a strong positive correlation: nations that play more games consistently reach later rounds.\nC: The number of games played has no discernible relationship with a nation\u2019s success in the tournament.\nD: Nations reaching the quarter-finals or beyond tend to play between 5 and 7 games, while those eliminated earlier play fewer games.\nExplanation: Examining the data, nations reaching the semi-finals (1966, 1990, 2018) or winning the tournament (1966) typically play between 6 and 7 games. Conversely, group stage exits often involve fewer than 5 games. This suggests a positive correlation, with more games played generally corresponding to deeper tournament runs, although there are exceptions.\nCorrect Answer: D\n</output_format>\n```",
    "question": "Considering the available data, what general relationship can be inferred between the number of games played in a FIFA World Cup tournament and the furthest round a nation advances?",
    "choices": {
      "A": "Nations consistently reaching the later stages (semi-finals or beyond) tend to play a relatively small number of games.",
      "B": "There is a strong positive correlation: nations that play more games consistently reach later rounds.",
      "C": "The number of games played has no discernible relationship with a nation\u2019s success in the tournament.",
      "D": "Nations reaching the quarter-finals or beyond tend to play between 5 and 7 games, while those eliminated earlier play fewer games."
    },
    "answer": "D",
    "explanation": "Examining the data, nations reaching the semi-finals (1966, 1990, 2018) or winning the tournament (1966) typically play between 6 and 7 games. Conversely, group stage exits often involve fewer than 5 games. This suggests a positive correlation, with more games played generally corresponding to deeper tournament runs, although there are exceptions.",
    "question_token_count": 32,
    "answer_correctness_score": 9,
    "explanation_validity_score": 9,
    "question_clarity_score": 8,
    "question_difficulty_score": 6,
    "question_groundedness_score": 9,
    "avg_answer_token_count": 23
  },
  {
    "context": "<P> `` Flight '' is the twenty - fourth and final episode of the eighth season of the American television medical drama Grey 's Anatomy , and the show 's 172nd episode overall . It was written by series creator Shonda Rhimes , and directed by Rob Corn . The episode was originally broadcast on the American Broadcasting Company ( ABC ) in the United States on May 17 , 2012 . In the episode , six doctors from Seattle Grace Mercy West Hospital who are victims of an aviation accident fight to stay alive , but Dr. Lexie Grey ( Chyler Leigh ) ultimately dies . Other storylines occur in Seattle where Dr. Richard Webber ( James Pickens , Jr . ) plans his annual dinner for the departing residents , Dr. Owen Hunt ( Kevin McKidd ) fires Dr. Teddy Altman ( Kim Raver ) , and Dr. Miranda Bailey ( Chandra Wilson ) gets engaged . </P>",
    "topic": "The episode \"Flight\" represents the culmination of the eighth season and the 172nd episode overall of Grey's Anatomy.",
    "response": "<document_analysis>\n1. **Thoughtful Content Examination**: The context describes the final episode of Grey's Anatomy's eighth season, \"Flight.\" It details the episode's creation (writer, director, broadcast date) and key plot points: a plane crash, Lexie Grey's death, Richard Webber's dinner, Owen Hunt firing Teddy Altman, and Miranda Bailey's engagement.\n2. **Concept Exploration**: The episode is framed as a culmination, suggesting closure of storylines and significant character arcs. The plane crash serves as a central crisis, and the subsequent events (deaths, firings, engagements) demonstrate the impact of trauma and change.\n3. **Strategic Complexity Calibration**: Difficulty: 8/10. The question targets understanding of the episode's significance within the series as a whole, requiring recall of multiple plotlines and their interrelation. It's not a simple factual recall question.\n4. **Intentional Question Planning**: The question focuses on the narrative function of the episode, specifically its role in resolving or initiating character arcs. It requires the test-taker to synthesize information about multiple storylines and assess their combined impact.\n</document_analysis>\n\n<output_format>\nQuestion: Within the narrative structure of Grey's Anatomy, how does the \"Flight\" episode function as a pivotal point for character trajectories?\nA: It primarily serves as a celebratory event, marking the successful completion of residency programs for the featured doctors.\nB: It acts as a catalyst for significant change, initiating resolutions to established storylines and launching new character arcs through loss and professional shifts.\nC: It focuses solely on the romantic relationships of the main characters, solidifying long-term partnerships and resolving interpersonal conflicts.\nD: It primarily serves as a technical showcase for medical emergency procedures, highlighting the expertise of the surgical team.\nExplanation: The episode includes Lexie Grey\u2019s death, Owen Hunt firing Teddy Altman, and Miranda Bailey\u2019s engagement, demonstrating a culmination of storylines and the start of new arcs. These events signify substantial changes in character trajectories, marking a pivotal point in the series' narrative.\nCorrect Answer: B\n</output_format>",
    "question": "Within the narrative structure of Grey's Anatomy, how does the \"Flight\" episode function as a pivotal point for character trajectories?",
    "choices": {
      "A": "It primarily serves as a celebratory event, marking the successful completion of residency programs for the featured doctors.",
      "B": "It acts as a catalyst for significant change, initiating resolutions to established storylines and launching new character arcs through loss and professional shifts.",
      "C": "It focuses solely on the romantic relationships of the main characters, solidifying long-term partnerships and resolving interpersonal conflicts.",
      "D": "It primarily serves as a technical showcase for medical emergency procedures, highlighting the expertise of the surgical team."
    },
    "answer": "B",
    "explanation": "The episode includes Lexie Grey\u2019s death, Owen Hunt firing Teddy Altman, and Miranda Bailey\u2019s engagement, demonstrating a culmination of storylines and the start of new arcs. These events signify substantial changes in character trajectories, marking a pivotal point in the series' narrative.",
    "question_token_count": 26,
    "answer_correctness_score": 10,
    "explanation_validity_score": 10,
    "question_clarity_score": 6,
    "question_difficulty_score": 8,
    "question_groundedness_score": 2,
    "avg_answer_token_count": 23
  },
  {
    "context": "<P> The seventh season of the fantasy drama television series Game of Thrones premiered on HBO on July 16 , 2017 , and concluded on August 27 , 2017 . Unlike previous seasons that consisted of ten episodes each , the seventh season consisted of only seven . Like the previous season , it largely consisted of original content not found in George R.R. Martin 's A Song of Ice and Fire series , while also incorporating material Martin revealed to showrunners about the upcoming novels in the series . The series was adapted for television by David Benioff and D.B. Weiss . </P>",
    "topic": "Detail the relationship between the seventh season's content and George R.R. Martin's A Song of Ice and Fire series.",
    "response": "<document_analysis>\n1. **Thoughtful Content Examination:** The provided context focuses on the seventh season of Game of Thrones, specifically its length (seven episodes) and its relationship to the source material, George R.R. Martin\u2019s *A Song of Ice and Fire* series. It highlights that the season consists largely of original content but incorporates information Martin shared with the showrunners about future novels.\n2. **Concept Exploration:** The key concept is the divergence of the television series from the books. The context implies that as the series progressed, it moved further away from a direct adaptation, relying more on original storylines and future plot points revealed by the author. This raises questions about the creative decisions behind adapting a complex work and the challenges of staying true to the source material while also forging a unique narrative.\n3. **Strategic Complexity Calibration:** Difficulty: 8/10. The question requires understanding of adaptation processes, authorial intent, and the challenges of long-form storytelling. It's not a simple recall question but requires inferential understanding of the relationship between the show and the books.\n4. **Intentional Question Planning:** The question is designed to assess the understanding of the relationship between the show's content and the source material, specifically focusing on the balance between original content and information derived from Martin\u2019s future plans. The answer options will test whether the domain expert understands that the seventh season wasn\u2019t a direct adaptation, but rather a blend of original work and insights from the author.\n</document_analysis>\n\n<output_format>\nQuestion: In the seventh season of *Game of Thrones*, how did the showrunners integrate material from George R.R. Martin\u2019s *A Song of Ice and Fire* series?\nA: The season served as a direct, chapter-by-chapter adaptation of the planned sixth novel, *The Winds of Winter*.\nB: The season exclusively relied on previously published material from the five existing novels in the series.\nC: The season largely consisted of original content, supplemented by plot points Martin revealed regarding future novels.\nD: The showrunners abandoned the source material entirely, crafting a completely independent narrative arc.\nExplanation: The context explicitly states that the seventh season \"largely consisted of original content not found in George R.R. Martin\u2019s A Song of Ice and Fire series, while also incorporating material Martin revealed to showrunners about the upcoming novels.\" This makes option C the most accurate reflection of the relationship between the season and the source material.\nCorrect Answer: C\n</output_format>",
    "question": "In the seventh season of *Game of Thrones*, how did the showrunners integrate material from George R.R. Martin\u2019s *A Song of Ice and Fire* series?",
    "choices": {
      "A": "The season served as a direct, chapter-by-chapter adaptation of the planned sixth novel, *The Winds of Winter*.",
      "B": "The season exclusively relied on previously published material from the five existing novels in the series.",
      "C": "The season largely consisted of original content, supplemented by plot points Martin revealed regarding future novels.",
      "D": "The showrunners abandoned the source material entirely, crafting a completely independent narrative arc."
    },
    "answer": "C",
    "explanation": "The context explicitly states that the seventh season \"largely consisted of original content not found in George R.R. Martin\u2019s A Song of Ice and Fire series, while also incorporating material Martin revealed to showrunners about the upcoming novels.\" This makes option C the most accurate reflection of the relationship between the season and the source material.",
    "question_token_count": 36,
    "answer_correctness_score": 10,
    "explanation_validity_score": 10,
    "question_clarity_score": 6,
    "question_difficulty_score": 7,
    "question_groundedness_score": 2,
    "avg_answer_token_count": 20
  },
  {
    "context": "<P> The seventh season of the fantasy drama television series Game of Thrones premiered on HBO on July 16 , 2017 , and concluded on August 27 , 2017 . Unlike previous seasons that consisted of ten episodes each , the seventh season consisted of only seven . Like the previous season , it largely consisted of original content not found in George R.R. Martin 's A Song of Ice and Fire series , while also adapting material Martin revealed to showrunners about the upcoming novels in the series . The series was adapted for television by David Benioff and D.B. Weiss . </P>",
    "topic": "Explain how the number of episodes in the seventh season differed from previous seasons and state the number of episodes.",
    "response": "```xml\n<document_analysis>\n1. **Thoughtful Content Examination:** The context discusses the seventh season of Game of Thrones, specifically highlighting a change in the number of episodes compared to prior seasons. It states the seventh season had seven episodes, while previous seasons had ten.\n2. **Concept Exploration:** The change in episode count is a significant detail, potentially reflecting narrative choices or production considerations. The text also touches on the adaptation of source material.\n3. **Strategic Complexity Calibration:** Difficulty: 7/10. While the answer is directly stated, the question requires recalling this specific detail amidst other information and understanding its significance as a deviation from the norm.\n4. **Intentional Question Planning:** The question aims to test the expert's recall of a key characteristic of the seventh season and their understanding of how it differed from the established pattern of previous seasons. The distractors will focus on potential episode numbers close to the correct answer.\n</document_analysis>\n<output_format>\nQuestion: In contrast to earlier seasons, how many episodes comprised the seventh season of Game of Thrones?\nA: 8\nB: 10\nC: 7\nD: 9\nExplanation: The text explicitly states, \u201cUnlike previous seasons that consisted of ten episodes each, the seventh season consisted of only seven.\u201d This detail highlights a change in the show\u2019s structure.\nCorrect Answer: C\n</output_format>\n```",
    "question": "In contrast to earlier seasons, how many episodes comprised the seventh season of Game of Thrones?",
    "choices": {
      "A": "8",
      "B": "10",
      "C": "7",
      "D": "9"
    },
    "answer": "C",
    "explanation": "The text explicitly states, \u201cUnlike previous seasons that consisted of ten episodes each, the seventh season consisted of only seven.\u201d This detail highlights a change in the show\u2019s structure.",
    "question_token_count": 19,
    "answer_correctness_score": 10,
    "explanation_validity_score": 10,
    "question_clarity_score": 8,
    "question_difficulty_score": 4,
    "question_groundedness_score": 10,
    "avg_answer_token_count": 2
  },
  {
    "context": "<P> The history of the Great Wall of China began when fortifications built by various states during the Spring and Autumn ( 771 -- 476 BC ) and Warring States periods ( 475 -- 221 BC ) were connected by the first emperor of China , Qin Shi Huang , to protect his newly founded Qin dynasty ( 221 -- 206 BC ) against incursions by nomads from Inner Asia . The walls were built of rammed earth , constructed using forced labour , and by 212 BC ran from Gansu to the coast of southern Manchuria . </P>",
    "topic": "Explain the historical context\u2014specifically the Spring and Autumn and Warring States periods\u2014that preceded the unification of the walls into the Great Wall of China.",
    "response": "```xml\n<document_analysis>\nThoughtful Content Examination: The context describes the origins of the Great Wall, specifically its roots in earlier fortifications built during the Spring and Autumn and Warring States periods. It highlights Qin Shi Huang's role in connecting these existing walls for defense against nomadic incursions. The construction materials (rammed earth) and labor source (forced labor) are also noted, as is the geographical extent of the initial wall.\n\nConcept Exploration: The text implies a fragmented defensive landscape prior to the Qin dynasty, with individual states building their own walls. The unification of these walls under Qin Shi Huang represents a significant shift in strategy and political power. The motivation for building the wall \u2013 protection against nomadic groups \u2013 is a recurring theme in Chinese history.\n\nStrategic Complexity Calibration: Difficulty: 8/10. The question requires understanding of Chinese history, specifically the periods leading up to the Qin dynasty, and the strategic rationale behind wall construction. It's not a simple recall question but requires connecting historical events and understanding their implications.\n\nIntentional Question Planning: The question aims to probe the expert\u2019s understanding of the historical context *before* the unified Great Wall. It tests their knowledge of the Spring and Autumn and Warring States periods and their relationship to the later unified wall. The answer options will focus on different aspects of these periods and their impact on the wall\u2019s development.\n</document_analysis>\n\n<output_format>\nQuestion: Prior to Qin Shi Huang\u2019s unification efforts, the foundations of the Great Wall\u2019s construction were primarily established by what characteristic of the preceding political landscape?\nA: A centralized, empire-wide construction initiative coordinated by a unified bureaucracy.\nB: Independent fortifications erected by numerous states vying for regional dominance.\nC: A collaborative defensive pact among allied states focused on shared border security.\nD: Large-scale public works projects initiated by local communities for flood control.\nExplanation: The text explicitly states that the Great Wall originated from \"fortifications built by various states during the Spring and Autumn and Warring States periods.\" This indicates a fragmented political landscape where individual states built their own defenses, rather than a unified effort.\nCorrect Answer: B\n</output_format>\n```",
    "question": "Prior to Qin Shi Huang\u2019s unification efforts, the foundations of the Great Wall\u2019s construction were primarily established by what characteristic of the preceding political landscape?",
    "choices": {
      "A": "A centralized, empire-wide construction initiative coordinated by a unified bureaucracy.",
      "B": "Independent fortifications erected by numerous states vying for regional dominance.",
      "C": "A collaborative defensive pact among allied states focused on shared border security.",
      "D": "Large-scale public works projects initiated by local communities for flood control."
    },
    "answer": "B",
    "explanation": "The text explicitly states that the Great Wall originated from \"fortifications built by various states during the Spring and Autumn and Warring States periods.\" This indicates a fragmented political landscape where individual states built their own defenses, rather than a unified effort.",
    "question_token_count": 30,
    "answer_correctness_score": 10,
    "explanation_validity_score": 10,
    "question_clarity_score": 6,
    "question_difficulty_score": 7,
    "question_groundedness_score": 8,
    "avg_answer_token_count": 14
  },
  {
    "context": "<Table> List of finals matches , their venues and locations , the finalists , and final scores <Tr> <Th> Year </Th> <Th> Winners </Th> <Th> Final score </Th> <Th> Runners - up </Th> <Th> Venue </Th> <Th> Location </Th> <Th> Attendance </Th> <Th> References </Th> </Tr> <Tr> <Th> 1930 </Th> <Td> Uruguay </Td> <Td> 4 -- 2 </Td> <Td> Argentina </Td> <Td> Estadio Centenario </Td> <Td> Montevideo , Uruguay </Td> <Td> 80,000 </Td> <Td> </Td> </Tr> <Tr> <Th> 1934 </Th> <Td> Italy </Td> <Td> 2 -- 1 </Td> <Td> Czechoslovakia </Td> <Td> Stadio Nazionale PNF </Td> <Td> Rome , Italy </Td> <Td> 50,000 </Td> <Td> </Td> </Tr> <Tr> <Th> 1938 </Th> <Td> Italy </Td> <Td> 4 -- 2 </Td> <Td> Hungary </Td> <Td> Stade Olympique de Colombes </Td> <Td> Paris , France </Td> <Td> 45,000 </Td> <Td> </Td> </Tr> <Tr> <Th> 1950 </Th> <Td> Uruguay </Td> <Td> 2 -- 1 </Td> <Td> Brazil </Td> <Td> Est\u00e1dio do Maracan\u00e3 </Td> <Td> Rio de Janeiro , Brazil </Td> <Td> 199,854 </Td> <Td> </Td> </Tr> <Tr> <Th> 1954 </Th> <Td> West Germany </Td> <Td> 3 -- 2 </Td> <Td> Hungary </Td> <Td> Wankdorf Stadium </Td> <Td> Bern , Switzerland </Td> <Td> 60,000 </Td> <Td> </Td> </Tr> <Tr> <Th> 1958 </Th> <Td> Brazil </Td> <Td> 5 -- 2 </Td> <Td> Sweden </Td> <Td> R\u00e5sunda Stadium </Td> <Td> Solna , Sweden </Td> <Td> 51,800 </Td> <Td> </Td> </Tr> <Tr> <Th> 1962 </Th> <Td> Brazil </Td> <Td> 3 -- 1 </Td> <Td> Czechoslovakia </Td> <Td> Estadio Nacional </Td> <Td> Santiago , Chile </Td> <Td> 69,000 </Td> <Td> </Td> </Tr> <Tr> <Th> 1966 </Th> <Td> England </Td> <Td> 4 -- 2 </Td> <Td> West Germany </Td> <Td> Wembley Stadium </Td> <Td> London , England </Td> <Td> 93,000 </Td> <Td> </Td> </Tr> <Tr> <Th> 1970 </Th> <Td> Brazil </Td> <Td> 4 -- 1 </Td> <Td> Italy </Td> <Td> Estadio Azteca </Td> <Td> Mexico City , Mexico </Td> <Td> 107,412 </Td> <Td> </Td> </Tr> <Tr> <Th> </Th> <Td> West Germany </Td> <Td> 2 -- 1 </Td> <Td> Netherlands </Td> <Td> Olympiastadion </Td> <Td> Munich , West Germany </Td> <Td> 75,200 </Td> <Td> </Td> </Tr> <Tr> <Th> 1978 </Th> <Td> Argentina </Td> <Td> 3 -- 1 </Td> <Td> Netherlands </Td> <Td> Estadio Monumental </Td> <Td> Buenos Aires , Argentina </Td> <Td> 71,483 </Td> <Td> </Td> </Tr> <Tr> <Th> 1982 </Th> <Td> Italy </Td> <Td> 3 -- 1 </Td> <Td> West Germany </Td> <Td> Santiago Bernab\u00e9u </Td> <Td> Madrid , Spain </Td> <Td> 90,000 </Td> <Td> </Td> </Tr> <Tr> <Th> 1986 </Th> <Td> Argentina </Td> <Td> 3 -- 2 </Td> <Td> West Germany </Td> <Td> Estadio Azteca </Td> <Td> Mexico City , Mexico </Td> <Td> 114,600 </Td> <Td> </Td> </Tr> <Tr> <Th> 1990 </Th> <Td> West Germany </Td> <Td> 1 -- 0 </Td> <Td> Argentina </Td> <Td> Stadio Olimpico </Td> <Td> Rome , Italy </Td> <Td> 73,603 </Td> <Td> </Td> </Tr> <Tr> <Th> 1994 </Th> <Td> Brazil </Td> <Td> 0 -- 0 </Td> <Td> Italy </Td> <Td> Rose Bowl </Td> <Td> Pasadena , United States </Td> <Td> 94,194 </Td> <Td> </Td> </Tr> <Tr> <Th> 1998 </Th> <Td> France </Td> <Td> 3 -- 0 </Td> <Td> Brazil </Td> <Td> Stade de France </Td> <Td> Saint - Denis , France </Td> <Td> 80,000 </Td> <Td> </Td> </Tr> <Tr> <Th> 2002 </Th> <Td> Brazil </Td> <Td> 2 -- 0 </Td> <Td> Germany </Td> <Td> International Stadium </Td> <Td> Yokohama , Japan </Td> <Td> 69,029 </Td> <Td> </Td> </Tr> <Tr> <Th> 2006 </Th> <Td> Italy </Td> <Td> 1 -- 1 </Td> <Td> France </Td> <Td> Olympiastadion </Td> <Td> Berlin , Germany </Td> <Td> 69,000 </Td> <Td> </Td> </Tr> <Tr> <Th> </Th> <Td> Spain </Td> <Td> 1 -- 0 </Td> <Td> Netherlands </Td> <Td> Soccer City </Td> <Td> Johannesburg , South Africa </Td> <Td> 84,490 </Td> <Td> </Td> </Tr> <Tr> <Th> 2014 </Th> <Td> Germany </Td> <Td> 1 -- 0 </Td> <Td> Argentina </Td> <Td> Est\u00e1dio do Maracan\u00e3 </Td> <Td> Rio de Janeiro , Brazil </Td> <Td> 74,738 </Td> <Td> </Td> </Tr> <Tr> <Th> 2018 </Th> <Td> France </Td> <Td> 4 -- 2 </Td> <Td> Croatia </Td> <Td> Luzhniki Stadium </Td> <Td> Moscow , Russia </Td> <Td> 78,011 </Td> <Td> </Td> </Tr> <Tr> <Th colspan=\"8\"> Upcoming finals </Th> </Tr> <Tr> <Th> Year </Th> <Th> Team 1 </Th> <Th> </Th> <Th> Team 2 </Th> <Th> Venue </Th> <Th> Location </Th> <Th> Attendance </Th> <Th> References </Th> </Tr> <Tr> <Th> 2022 </Th> <Td> </Td> <Td> </Td> <Td> </Td> <Td> Lusail Iconic Stadium </Td> <Td> Lusail , Qatar </Td> <Td> </Td> <Td> </Td> </Tr> <Tr> <Th> 2026 </Th> <Td> </Td> <Td> </Td> <Td> </Td> <Td> TBD </Td> <Td> United States </Td> <Td> </Td> <Td> </Td> </Tr> </Table>",
    "topic": "Evaluate the geographical distribution of World Cup final venues, discussing the implications of hosting finals in different regions.",
    "response": "<document_analysis>\nThe provided context is a table listing all FIFA World Cup final matches, including the year, winners, finalists, final score, venue, and location. The information is well-structured and relevant to the question topic. The table shows a geographically diverse set of venues across Europe, South America, North America, and Asia. The complexity of the data lends itself to a challenging question that requires synthesis of the provided information. I will focus on the implications of hosting the final in different regions, specifically regarding travel and accessibility. The question will be designed to assess an understanding of the logistical challenges and potential biases associated with venue selection. Difficulty is estimated at 8/10.\n</document_analysis>\n\n<output_format>\nQuestion: Considering the historical distribution of FIFA World Cup final venues, what logistical challenge is *most directly* exacerbated by hosting the final in a geographically isolated location, like Qatar in 2022, compared to a more centrally located region like Western Europe?\nA: Increased costs associated with stadium construction to meet FIFA standards.\nB: Difficulties and expenses related to travel and accommodation for fans and media.\nC: Political sensitivities surrounding human rights records of the host nation.\nD: The need for extensive infrastructure development beyond stadium capacity.\nExplanation: The context provides a historical record of venues. Qatar\u2019s isolation necessitates significant international travel for fans and media, driving up costs and logistical complexity. While stadium construction, political issues, and infrastructure are relevant to hosting *any* World Cup, the geographical isolation directly amplifies the travel burden.\nCorrect Answer: B\n</output_format>",
    "question": "Considering the historical distribution of FIFA World Cup final venues, what logistical challenge is *most directly* exacerbated by hosting the final in a geographically isolated location, like Qatar in 2022, compared to a more centrally located region like Western Europe?",
    "choices": {
      "A": "Increased costs associated with stadium construction to meet FIFA standards.",
      "B": "Difficulties and expenses related to travel and accommodation for fans and media.",
      "C": "Political sensitivities surrounding human rights records of the host nation.",
      "D": "The need for extensive infrastructure development beyond stadium capacity."
    },
    "answer": "B",
    "explanation": "The context provides a historical record of venues. Qatar\u2019s isolation necessitates significant international travel for fans and media, driving up costs and logistical complexity. While stadium construction, political issues, and infrastructure are relevant to hosting *any* World Cup, the geographical isolation directly amplifies the travel burden.",
    "question_token_count": 52,
    "answer_correctness_score": 10,
    "explanation_validity_score": 10,
    "question_clarity_score": 8,
    "question_difficulty_score": 7,
    "question_groundedness_score": 9,
    "avg_answer_token_count": 12
  },
  {
    "context": "<Table> <Tr> <Th colspan=\"2\"> Philadelphia Eagles </Th> </Tr> <Tr> <Td colspan=\"2\"> Current season </Td> </Tr> <Tr> <Td colspan=\"2\"> Established July 8 , 1933 ; 84 years ago ( July 8 , 1933 ) First season : 1933 Play in Lincoln Financial Field Philadelphia , Pennsylvania Headquartered in the NovaCare Complex Philadelphia , Pennsylvania </Td> </Tr> <Tr> <Th colspan=\"2\"> </Th> </Tr> <Tr> <Td colspan=\"2\"> <Table> <Tr> <Td> </Td> <Td> </Td> </Tr> <Tr> <Td> Logo </Td> <Td> Wordmark </Td> </Tr> </Table> </Td> </Tr> <Tr> <Th colspan=\"2\"> League / conference affiliations </Th> </Tr> <Tr> <Td colspan=\"2\"> <P> National Football League ( 1933 -- present ) </P> <Ul> <Li> Eastern Division ( 1933 -- 1949 ) </Li> <Li> American Conference ( 1950 -- 1952 ) </Li> <Li> Eastern Conference ( 1953 -- 1969 ) <Ul> <Li> Capitol Division ( 1967 -- 1969 ) </Li> </Ul> </Li> <Li> National Football Conference ( 1970 -- present ) <Ul> <Li> NFC East ( 1970 -- present ) </Li> </Ul> </Li> </Ul> </Td> </Tr> <Tr> <Td colspan=\"2\"> Current uniform </Td> </Tr> <Tr> <Td colspan=\"2\"> </Td> </Tr> <Tr> <Th> Team colors </Th> <Td> <P> Midnight green , Silver , Black , White </P> </Td> </Tr> <Tr> <Th> Fight song </Th> <Td> Fly , Eagles Fly </Td> </Tr> <Tr> <Th> Mascot </Th> <Td> Swoop </Td> </Tr> <Tr> <Th colspan=\"2\"> Personnel </Th> </Tr> <Tr> <Th> Owner ( s ) </Th> <Td> Jeffrey Lurie Christina Weiss Lurie </Td> </Tr> <Tr> <Th> Chairman </Th> <Td> Jeffrey Lurie </Td> </Tr> <Tr> <Th> CEO </Th> <Td> Jeffrey Lurie </Td> </Tr> <Tr> <Th> President </Th> <Td> Don Smolenski </Td> </Tr> <Tr> <Th> General manager </Th> <Td> Howie Roseman </Td> </Tr> <Tr> <Th> Head coach </Th> <Td> Doug Pederson </Td> </Tr> <Tr> <Th colspan=\"2\"> Team history </Th> </Tr> <Tr> <Td colspan=\"2\"> <Ul> <Li> Philadelphia Eagles ( 1933 -- 1942 ; 1944 -- present ) </Li> <Li> Phil - Pitt `` Steagles '' ( 1943 ) </Li> </Ul> </Td> </Tr> <Tr> <Th colspan=\"2\"> Team nicknames </Th> </Tr> <Tr> <Td colspan=\"2\"> <Ul> <Li> The Birds </Li> </Ul> </Td> </Tr> <Tr> <Th colspan=\"2\"> Championships </Th> </Tr> <Tr> <Td colspan=\"2\"> <P> League championships ( 4 ) </P> <Ul> <Li> NFL championships ( pre-1970 AFL -- NFL merger ) ( 3 ) 1948 , 1949 , 1960 </Li> </Ul> <Ul> <Li> Super Bowl championships ( 1 ) 2017 ( LII ) </Li> </Ul> </Td> </Tr> <Tr> <Td colspan=\"2\"> <P> Conference championships ( 4 ) </P> <Ul> <Li> NFL Eastern : 1960 </Li> <Li> NFC : 1980 , 2004 , 2017 </Li> </Ul> </Td> </Tr> <Tr> <Td colspan=\"2\"> <P> Division championships ( 13 ) </P> <Ul> <Li> NFL East : 1947 , 1948 , 1949 </Li> <Li> NFC East : 1980 , 1988 , 2001 , 2002 , 2003 , 2004 , 2006 , 2010 , 2013 , 2017 </Li> </Ul> </Td> </Tr> <Tr> <Th colspan=\"2\"> Playoff appearances ( 25 ) </Th> </Tr> <Tr> <Td colspan=\"2\"> <Ul> <Li> NFL : 1947 , 1948 , 1949 , 1960 , 1978 , 1979 , 1980 , 1981 , 1988 , 1989 , 1990 , 1992 , 1995 , 1996 , 2000 , 2001 , 2002 , 2003 , 2004 , 2006 , 2008 , 2009 , 2010 , 2013 , 2017 </Li> </Ul> </Td> </Tr> <Tr> <Th colspan=\"2\"> Home fields </Th> </Tr> <Tr> <Td colspan=\"2\"> <Ul> <Li> Baker Bowl ( 1933 -- 1935 ) </Li> <Li> Philadelphia Municipal Stadium ( 1936 -- 1939 , 1941 ) </Li> <Li> Connie Mack Stadium ( 1940 , 1942 -- 1957 ) </Li> <Li> Franklin Field ( 1958 -- 1970 ) </Li> <Li> Veterans Stadium ( 1971 -- 2002 ) </Li> <Li> Lincoln Financial Field ( 2003 -- present ) </Li> </Ul> </Td> </Tr> </Table>",
    "topic": "The total number of playoff appearances made by the Philadelphia Eagles throughout their franchise history.",
    "response": "<document_analysis>\nThe provided context is a table detailing the history and personnel of the Philadelphia Eagles football team. It contains a wealth of information, including founding date, league affiliations, championships, and a comprehensive list of playoff appearances. The question topic is specifically focused on the total number of playoff appearances, which is explicitly stated within the table. The difficulty will be calibrated to require the expert to locate and accurately count the entries in the \"Playoff appearances\" list. There is no irrelevant information present.\n</document_analysis>\n\n<output_format>\nQuestion: Throughout their franchise history, the Philadelphia Eagles have secured a playoff berth in how many seasons?\nA: 23\nB: 25\nC: 27\nD: 29\nExplanation: The text explicitly states \u201cPlayoff appearances (25)\u201d and lists 25 seasons in which the Eagles made the playoffs.\nCorrect Answer: B\n</output_format>",
    "question": "Throughout their franchise history, the Philadelphia Eagles have secured a playoff berth in how many seasons?",
    "choices": {
      "A": "23",
      "B": "25",
      "C": "27",
      "D": "29"
    },
    "answer": "B",
    "explanation": "The text explicitly states \u201cPlayoff appearances (25)\u201d and lists 25 seasons in which the Eagles made the playoffs.",
    "question_token_count": 20,
    "answer_correctness_score": 10,
    "explanation_validity_score": 10,
    "question_clarity_score": 8,
    "question_difficulty_score": 4,
    "question_groundedness_score": 10,
    "avg_answer_token_count": 2
  },
  {
    "context": "<P> The 2017 NFL season is the 98th and current season in the history of the National Football League ( NFL ) . The season began on September 7 , 2017 , with the Kansas City Chiefs defeating the defending Super Bowl LI champion New England Patriots 42 -- 27 in the NFL Kickoff Game . The season will conclude with Super Bowl LII , the league 's championship game , on February 4 , 2018 , at U.S. Bank Stadium in Minneapolis , Minnesota . </P>",
    "topic": "Explain the significance of the NFL Kickoff Game in relation to the start of the 2017 NFL season.",
    "response": "```xml\n<document_analysis>\nThoughtful Content Examination: The context provides a concise overview of the start of the 2017 NFL season. The central idea is the commencement of the season with the Kickoff Game between the Chiefs and the Patriots, and it notes the eventual conclusion with Super Bowl LII.\n\nConcept Exploration: The significance lies in the fact that the Kickoff Game traditionally marks the official start of the NFL season and often features a matchup of prominent teams, setting the tone for the upcoming year. The defeat of the defending champions immediately establishes a potential shift in the league's power dynamics.\n\nStrategic Complexity Calibration: Difficulty: 7/10. While the information is directly stated, crafting a question that requires understanding the *implication* of the result (defeating the champion) elevates the challenge.\n\nIntentional Question Planning: The question will focus on the broader significance of the Kickoff Game result, testing understanding beyond simply recalling the game's outcome. The distractors will focus on other aspects of the season (Super Bowl location, season number) or slightly altered game details.\n</document_analysis>\n```\n\n```xml\n<output_format>\nQuestion: The outcome of the 2017 NFL Kickoff Game, where the Kansas City Chiefs defeated the New England Patriots, is most significantly indicative of what shift in the league\u2019s competitive landscape?\nA: A change in the league\u2019s championship game venue from Foxborough to Minneapolis.\nB: The commencement of the NFL\u2019s 98th season and a continuation of established team dominance.\nC: A potential alteration in the established hierarchy of NFL teams, challenging the reigning Super Bowl champions.\nD: The beginning of a new era of NFL broadcasting with increased viewership and advertising revenue.\nExplanation: The defeat of the defending Super Bowl champions in the opening game immediately signals a potential change in the league's power structure. This outcome suggests the possibility of a new contender emerging and challenging the established dominance of teams like the Patriots.\nCorrect Answer: C\n</output_format>\n```",
    "question": "The outcome of the 2017 NFL Kickoff Game, where the Kansas City Chiefs defeated the New England Patriots, is most significantly indicative of what shift in the league\u2019s competitive landscape?",
    "choices": {
      "A": "A change in the league\u2019s championship game venue from Foxborough to Minneapolis.",
      "B": "The commencement of the NFL\u2019s 98th season and a continuation of established team dominance.",
      "C": "A potential alteration in the established hierarchy of NFL teams, challenging the reigning Super Bowl champions.",
      "D": "The beginning of a new era of NFL broadcasting with increased viewership and advertising revenue."
    },
    "answer": "C",
    "explanation": "The defeat of the defending Super Bowl champions in the opening game immediately signals a potential change in the league's power structure. This outcome suggests the possibility of a new contender emerging and challenging the established dominance of teams like the Patriots.",
    "question_token_count": 38,
    "answer_correctness_score": 10,
    "explanation_validity_score": 10,
    "question_clarity_score": 6,
    "question_difficulty_score": 8,
    "question_groundedness_score": 2,
    "avg_answer_token_count": 18
  },
  {
    "context": "<P> Article Five of the United States Constitution describes the process whereby the Constitution , the nation 's frame of government , may be altered . Altering the Constitution consists of proposing an amendment or amendments and subsequent ratification . Amendments may be proposed either by the Congress with a two - thirds vote in both the House of Representatives and the Senate or by a convention of states called for by two - thirds of the state legislatures . To become part of the Constitution , an amendment must be ratified by either -- as determined by Congress -- the legislatures of three - quarters of the states or state ratifying conventions in three - quarters of the states . The vote of each state ( to either ratify or reject a proposed amendment ) carries equal weight , regardless of a state 's population or length of time in the Union . </P>",
    "topic": "Compare and contrast the roles of the U.S. Congress and state legislatures in the constitutional amendment process.",
    "response": "```xml\n<document_analysis>\n1. **Thoughtful Content Examination:** The context outlines the amendment process as defined in Article Five of the U.S. Constitution. It details the two methods of proposing amendments (Congress or state conventions) and the two methods of ratifying them (state legislatures or state conventions). The key point is the equal weight given to each state's vote in ratification.\n2. **Concept Exploration:** The text highlights the balance of power between the federal government (Congress) and the states in constitutional change. It implicitly addresses federalism and the checks and balances inherent in the amendment process. The equal state weight is a crucial element, designed to prevent amendments driven solely by populous states.\n3. **Strategic Complexity Calibration:** Difficulty: 8/10. This topic requires understanding of constitutional law and the amendment process, as well as the nuances of federalism. The question aims to probe understanding of the different roles Congress and state legislatures play, and the conditions under which each role is activated.\n4. **Intentional Question Planning:** The question focuses on comparing and contrasting the roles of Congress and state legislatures, forcing a deeper understanding of the amendment process beyond simply knowing the steps. It's designed to test the expert's comprehension of the constitutional framework and the balance of power.\n</document_analysis>\n\n<output_format>\nQuestion: Within the U.S. constitutional amendment process, what fundamentally differentiates the involvement of Congress from that of state legislatures during the *initiation* of potential amendments?\nA: Congress initiates amendments through ratification, while state legislatures propose them through conventions.\nB: Congress proposes amendments via a two-thirds vote, while state legislatures initiate them by calling for a convention with a two-thirds majority.\nC: Congress ratifies amendments through state conventions, whereas state legislatures propose amendments via a simple majority vote.\nD: Congress utilizes state legislatures to propose amendments, and state legislatures rely on Congress for ratification.\nExplanation: The text explicitly states that amendments can be proposed either by Congress with a two-thirds vote in both houses or by a convention of states called for by two-thirds of the state legislatures. This highlights the distinct methods of initiation.\nCorrect Answer: B\n</output_format>\n```",
    "question": "Within the U.S. constitutional amendment process, what fundamentally differentiates the involvement of Congress from that of state legislatures during the *initiation* of potential amendments?",
    "choices": {
      "A": "Congress initiates amendments through ratification, while state legislatures propose them through conventions.",
      "B": "Congress proposes amendments via a two-thirds vote, while state legislatures initiate them by calling for a convention with a two-thirds majority.",
      "C": "Congress ratifies amendments through state conventions, whereas state legislatures propose amendments via a simple majority vote.",
      "D": "Congress utilizes state legislatures to propose amendments, and state legislatures rely on Congress for ratification."
    },
    "answer": "B",
    "explanation": "The text explicitly states that amendments can be proposed either by Congress with a two-thirds vote in both houses or by a convention of states called for by two-thirds of the state legislatures. This highlights the distinct methods of initiation.",
    "question_token_count": 34,
    "answer_correctness_score": 10,
    "explanation_validity_score": 10,
    "question_clarity_score": 8,
    "question_difficulty_score": 7,
    "question_groundedness_score": 10,
    "avg_answer_token_count": 22
  },
  {
    "context": "<Table> <Tr> <Th> No . </Th> <Th> Athlete </Th> <Th> Nation </Th> <Th> Sport </Th> <Th> Years </Th> <Th> Games </Th> <Th> Gender </Th> <Th> Gold </Th> <Th> Silver </Th> <Th> Bronze </Th> <Th> Total </Th> </Tr> <Tr> <Th> </Th> <Td> Phelps , Michael Michael Phelps </Td> <Td> United States </Td> <Td> Swimming </Td> <Td> 2004 -- 2016 </Td> <Td> Summer </Td> <Td> </Td> <Td> 23 </Td> <Td> </Td> <Td> </Td> <Td> 28 </Td> </Tr> <Tr> <Th> </Th> <Td> Latynina , Larisa Larisa Latynina </Td> <Td> Soviet Union </Td> <Td> Gymnastics </Td> <Td> 1956 -- 1964 </Td> <Td> Summer </Td> <Td> </Td> <Td> 9 </Td> <Td> 5 </Td> <Td> </Td> <Td> 18 </Td> </Tr> <Tr> <Th> </Th> <Td> Nurmi , Paavo Paavo Nurmi </Td> <Td> Finland </Td> <Td> Athletics </Td> <Td> 1920 -- 1928 </Td> <Td> Summer </Td> <Td> </Td> <Td> 9 </Td> <Td> </Td> <Td> 0 </Td> <Td> 12 </Td> </Tr> <Tr> <Th> </Th> <Td> Spitz , Mark Mark Spitz </Td> <Td> United States </Td> <Td> Swimming </Td> <Td> 1968 -- 1972 </Td> <Td> Summer </Td> <Td> </Td> <Td> 9 </Td> <Td> </Td> <Td> </Td> <Td> 11 </Td> </Tr> <Tr> <Th> 5 </Th> <Td> Lewis , Carl Carl Lewis </Td> <Td> United States </Td> <Td> Athletics </Td> <Td> 1984 -- 1996 </Td> <Td> Summer </Td> <Td> </Td> <Td> 9 </Td> <Td> </Td> <Td> 0 </Td> <Td> 10 </Td> </Tr> <Tr> <Th> 6 </Th> <Td> Bj\u00f8rgen , Marit Marit Bj\u00f8rgen </Td> <Td> Norway </Td> <Td> Cross-country skiing </Td> <Td> 2002 -- 2018 </Td> <Td> Winter </Td> <Td> </Td> <Td> 8 </Td> <Td> </Td> <Td> </Td> <Td> 15 </Td> </Tr> <Tr> <Th> 7 </Th> <Td> Bj\u00f8rndalen , Ole Einar Ole Einar Bj\u00f8rndalen </Td> <Td> Norway </Td> <Td> Biathlon </Td> <Td> 1998 -- 2014 </Td> <Td> Winter </Td> <Td> </Td> <Td> 8 </Td> <Td> </Td> <Td> </Td> <Td> 13 </Td> </Tr> <Tr> <Th> 8 </Th> <Td> D\u00e6hlie , Bj\u00f8rn Bj\u00f8rn D\u00e6hlie </Td> <Td> Norway </Td> <Td> Cross-country skiing </Td> <Td> 1992 -- 1998 </Td> <Td> Winter </Td> <Td> </Td> <Td> 8 </Td> <Td> </Td> <Td> 0 </Td> <Td> 12 </Td> </Tr> <Tr> <Td> Fischer , Birgit Birgit Fischer </Td> <Td> East Germany Germany </Td> <Td> Canoeing </Td> <Td> 1980 -- 2004 </Td> <Td> Summer </Td> <Td> </Td> <Td> 8 </Td> <Td> </Td> <Td> 0 </Td> <Td> 12 </Td> </Tr> <Tr> <Th> 10 </Th> <Td> Kato , Sawao Sawao Kato </Td> <Td> Japan </Td> <Td> Gymnastics </Td> <Td> 1968 -- 1976 </Td> <Td> Summer </Td> <Td> </Td> <Td> 8 </Td> <Td> </Td> <Td> </Td> <Td> 12 </Td> </Tr> <Tr> <Td> Thompson , Jenny Jenny Thompson </Td> <Td> United States </Td> <Td> Swimming </Td> <Td> 1992 -- 2004 </Td> <Td> Summer </Td> <Td> </Td> <Td> 8 </Td> <Td> </Td> <Td> </Td> <Td> 12 </Td> </Tr> <Tr> <Th> 12 </Th> <Td> Biondi , Matt Matt Biondi </Td> <Td> United States </Td> <Td> Swimming </Td> <Td> 1984 -- 1992 </Td> <Td> Summer </Td> <Td> </Td> <Td> 8 </Td> <Td> </Td> <Td> </Td> <Td> 11 </Td> </Tr> <Tr> <Th> 13 </Th> <Td> Bolt , Usain Usain Bolt </Td> <Td> Jamaica </Td> <Td> Athletics </Td> <Td> 2008 -- 2016 </Td> <Td> Summer </Td> <Td> </Td> <Td> 8 </Td> <Td> 0 </Td> <Td> 0 </Td> <Td> 8 </Td> </Tr> <Tr> <Td> Ewry , Ray Ray Ewry </Td> <Td> United States </Td> <Td> Athletics </Td> <Td> 1900 -- 1908 </Td> <Td> Summer </Td> <Td> </Td> <Td> 8 </Td> <Td> 0 </Td> <Td> 0 </Td> <Td> 8 </Td> </Tr> <Tr> <Th> 15 </Th> <Td> Andrianov , Nikolai Nikolai Andrianov </Td> <Td> Soviet Union </Td> <Td> Gymnastics </Td> <Td> 1972 -- 1980 </Td> <Td> Summer </Td> <Td> </Td> <Td> 7 </Td> <Td> 5 </Td> <Td> </Td> <Td> 15 </Td> </Tr> <Tr> <Th> 16 </Th> <Td> Shakhlin , Boris Boris Shakhlin </Td> <Td> Soviet Union </Td> <Td> Gymnastics </Td> <Td> 1956 -- 1964 </Td> <Td> Summer </Td> <Td> </Td> <Td> 7 </Td> <Td> </Td> <Td> </Td> <Td> 13 </Td> </Tr> <Tr> <Th> 17 </Th> <Td> \u010c\u00e1slavsk\u00e1 , V\u011bra V\u011bra \u010c\u00e1slavsk\u00e1 </Td> <Td> Czechoslovakia </Td> <Td> Gymnastics </Td> <Td> 1960 -- 1968 </Td> <Td> Summer </Td> <Td> </Td> <Td> 7 </Td> <Td> </Td> <Td> 0 </Td> <Td> 11 </Td> </Tr> <Tr> <Th> 18 </Th> <Td> Chukarin , Viktor Viktor Chukarin </Td> <Td> Soviet Union </Td> <Td> Gymnastics </Td> <Td> 1952 -- 1956 </Td> <Td> Summer </Td> <Td> </Td> <Td> 7 </Td> <Td> </Td> <Td> </Td> <Td> 11 </Td> </Tr> <Tr> <Th> 19 </Th> <Td> Gerevich , Alad\u00e1r Alad\u00e1r Gerevich </Td> <Td> Hungary </Td> <Td> Fencing </Td> <Td> 1932 -- 1960 </Td> <Td> Summer </Td> <Td> </Td> <Td> 7 </Td> <Td> </Td> <Td> </Td> <Td> 10 </Td> </Tr> <Tr> <Th> 20 </Th> <Td> Mangiarotti , Edoardo Edoardo Mangiarotti </Td> <Td> Italy </Td> <Td> Fencing </Td> <Td> 1936 -- 1960 </Td> <Td> Summer </Td> <Td> </Td>",
    "topic": "The relative success of male versus female athletes represented in the table.",
    "response": "```xml\n<document_analysis>\nThe provided context is a table listing Olympic athletes and their medal counts. The question topic focuses on the relative success of male versus female athletes. The table contains a substantial amount of data, allowing for a challenging question requiring analysis and comparison. There is no irrelevant or bogus information. The data is well-structured and suitable for generating a complex question. The question will focus on identifying trends in medal counts between genders, requiring a degree of calculation and interpretation. Difficulty is estimated at 8/10.\n</document_analysis>\n<output_format>\nQuestion: Based on the provided data, which statement most accurately reflects a comparative trend regarding the total medals won by male and female athletes within the top 20 represented?\nA: Female athletes consistently demonstrate a higher total medal count compared to their male counterparts.\nB: Male athletes predominantly occupy the top positions in terms of total medals, suggesting a historical advantage.\nC: There is no discernible pattern, with male and female athletes exhibiting roughly equivalent medal distributions.\nD: While both genders are well-represented, female athletes show a greater propensity for winning gold medals.\nExplanation: A review of the table reveals that a majority of the athletes with the highest total medal counts are male. While several female athletes are present (Latynina, Fischer, \u010c\u00e1slavsk\u00e1, Thompson), their total medal counts are generally lower than those of the top male athletes (Phelps, Nurmi, Spitz). This suggests a historical trend favoring male athletes in terms of overall medal accumulation.\nCorrect Answer: B\n</output_format>\n```",
    "question": "Based on the provided data, which statement most accurately reflects a comparative trend regarding the total medals won by male and female athletes within the top 20 represented?",
    "choices": {
      "A": "Female athletes consistently demonstrate a higher total medal count compared to their male counterparts.",
      "B": "Male athletes predominantly occupy the top positions in terms of total medals, suggesting a historical advantage.",
      "C": "There is no discernible pattern, with male and female athletes exhibiting roughly equivalent medal distributions.",
      "D": "While both genders are well-represented, female athletes show a greater propensity for winning gold medals."
    },
    "answer": "B",
    "explanation": "A review of the table reveals that a majority of the athletes with the highest total medal counts are male. While several female athletes are present (Latynina, Fischer, \u010c\u00e1slavsk\u00e1, Thompson), their total medal counts are generally lower than those of the top male athletes (Phelps, Nurmi, Spitz). This suggests a historical trend favoring male athletes in terms of overall medal accumulation.",
    "question_token_count": 32,
    "answer_correctness_score": 10,
    "explanation_validity_score": 10,
    "question_clarity_score": 8,
    "question_difficulty_score": 6,
    "question_groundedness_score": 8,
    "avg_answer_token_count": 18
  },
  {
    "context": "<P> The Pittsburgh Steelers ( 6 -- 2 ) have won the most Super Bowls with six championships , while the New England Patriots ( 5 -- 5 ) , the Dallas Cowboys ( 5 -- 3 ) , and the San Francisco 49ers ( 5 -- 1 ) have five wins . New England has the most Super Bowl appearances with ten , while the Buffalo Bills ( 0 -- 4 ) have the most consecutive appearances with four ( all losses ) from 1990 to 1993 . The Miami Dolphins are the only other team to have at least three consecutive appearances : 1972 -- 1974 . The Denver Broncos ( 3 -- 5 ) and Patriots have each lost a record five Super Bowls . The Minnesota Vikings ( 0 -- 4 ) and the Bills have lost four . The record for consecutive wins is two and is shared by seven franchises : the Green Bay Packers ( 1966 -- 1967 ) , the Miami Dolphins ( 1972 -- 1973 ) , the Pittsburgh Steelers ( 1974 -- 1975 and 1978 -- 1979 , the only team to accomplish this feat twice ) , the San Francisco 49ers ( 1988 -- 1989 ) , the Dallas Cowboys ( 1992 -- 1993 ) , the Denver Broncos ( 1997 -- 1998 ) , and the New England Patriots ( 2003 -- 2004 ) . Among those , Dallas ( 1992 -- 1993 ; 1995 ) and New England ( 2001 ; 2003 -- 2004 ) are the only teams to win three out of four consecutive Super Bowls . The 1972 Dolphins capped off the only perfect season in NFL history with their victory in Super Bowl VII . The only team with multiple Super Bowl appearances and no losses is the Baltimore Ravens , who in winning Super Bowl XLVII defeated and replaced the 49ers in that position . Four current NFL teams have never appeared in a Super Bowl , including franchise relocations and renaming : the Cleveland Browns , Detroit Lions , Jacksonville Jaguars , and Houston Texans , though both the Browns ( 1964 ) and Lions ( 1957 ) had won NFL championship games prior to the creation of the Super Bowl . </P>",
    "topic": "List the four current NFL teams that have never appeared in a Super Bowl, and acknowledge any pre-Super Bowl championships won by those teams.",
    "response": "```xml\n<document_analysis>\n<thoughtful_content_examination>\nThe text provides a historical overview of Super Bowl winners, appearances, and related records. It details teams with multiple wins, losses, and consecutive appearances. Crucially, it identifies four current NFL teams that have never played in a Super Bowl, and mentions pre-Super Bowl championships won by two of those teams.\n</thoughtful_content_examination>\n<concept_exploration>\nThe core concept revolves around the history of the Super Bowl and the performance of various NFL teams. The text implicitly highlights the evolution of the NFL and the significance of the Super Bowl as its championship game. The mention of pre-Super Bowl championships adds a layer of historical context.\n</concept_exploration>\n<strategic_complexity_calibration>\nDifficulty: 8/10. While the information is present in the text, it requires careful reading and recall of multiple details. The question asks for a list of four teams, demanding precise memory. The addition of pre-Super Bowl championships adds another layer of complexity.\n</strategic_complexity_calibration>\n<intentional_question_planning>\nThe question is designed to test the examinee's ability to extract specific information from the text and synthesize it into a concise answer. It requires not only identifying the four teams but also recalling information about their historical championships. The challenge lies in accurately listing all four teams and remembering the championship details for the Browns and Lions.\n</intentional_question_planning>\n</document_analysis>\n<output_format>\nQuestion: Which four current NFL teams have never appeared in a Super Bowl, and which of those teams previously won an NFL championship before the Super Bowl era?\nA: Cincinnati Bengals, Los Angeles Chargers, New Orleans Saints, and Tampa Bay Buccaneers; the Bengals and Chargers both won pre-Super Bowl championships.\nB: Cleveland Browns, Detroit Lions, Jacksonville Jaguars, and Houston Texans; the Browns and Lions both won pre-Super Bowl championships.\nC: Arizona Cardinals, Indianapolis Colts, Tennessee Titans, and Washington Commanders; the Cardinals and Colts both won pre-Super Bowl championships.\nD: Atlanta Falcons, Carolina Panthers, Las Vegas Raiders, and Seattle Seahawks; the Falcons and Raiders both won pre-Super Bowl championships.\nExplanation: The text explicitly states that the Cleveland Browns, Detroit Lions, Jacksonville Jaguars, and Houston Texans have never appeared in a Super Bowl. It also notes that both the Browns (1964) and Lions (1957) won NFL championships prior to the Super Bowl.\nCorrect Answer: B\n</output_format>\n```",
    "question": "Which four current NFL teams have never appeared in a Super Bowl, and which of those teams previously won an NFL championship before the Super Bowl era?",
    "choices": {
      "A": "Cincinnati Bengals, Los Angeles Chargers, New Orleans Saints, and Tampa Bay Buccaneers; the Bengals and Chargers both won pre-Super Bowl championships.",
      "B": "Cleveland Browns, Detroit Lions, Jacksonville Jaguars, and Houston Texans; the Browns and Lions both won pre-Super Bowl championships.",
      "C": "Arizona Cardinals, Indianapolis Colts, Tennessee Titans, and Washington Commanders; the Cardinals and Colts both won pre-Super Bowl championships.",
      "D": "Atlanta Falcons, Carolina Panthers, Las Vegas Raiders, and Seattle Seahawks; the Falcons and Raiders both won pre-Super Bowl championships."
    },
    "answer": "B",
    "explanation": "The text explicitly states that the Cleveland Browns, Detroit Lions, Jacksonville Jaguars, and Houston Texans have never appeared in a Super Bowl. It also notes that both the Browns (1964) and Lions (1957) won NFL championships prior to the Super Bowl.",
    "question_token_count": 30,
    "answer_correctness_score": 10,
    "explanation_validity_score": 10,
    "question_clarity_score": 8,
    "question_difficulty_score": 7,
    "question_groundedness_score": 10,
    "avg_answer_token_count": 30
  },
  {
    "context": "<P> The 2018 FIFA World Cup was the 21st FIFA World Cup , an international football tournament contested by the men 's national teams of the member associations of FIFA once every four years . It took place in Russia from 14 June to 15 July 2018 . It was the first World Cup to be held in Eastern Europe , and the 11th time that it had been held in Europe . At an estimated cost of over $14.2 billion , it was the most expensive World Cup . It was also the first World Cup to use the video assistant referee ( VAR ) system . </P>",
    "topic": "Evaluate the broader context of the 2018 FIFA World Cup as the 21st edition of the tournament, considering its place within the history of the competition.",
    "response": "```xml\n<document_analysis>\n1. **Thoughtful Content Examination**: The context provides basic factual information about the 2018 FIFA World Cup \u2013 its edition number, location, dates, cost, and a key innovation (VAR). It\u2019s a concise overview establishing its place as a specific instance within the broader history of the tournament.\n2. **Concept Exploration**: The text highlights several 'firsts' (Eastern Europe, most expensive, VAR). These elements are significant as they mark deviations from previous tournaments and potentially indicate evolving trends in hosting and officiating. The cost is particularly noteworthy as a potential indicator of economic factors influencing the event.\n3. **Strategic Complexity Calibration**: Difficulty: 7/10. The information is straightforward, but a challenging question can focus on the *implications* of these 'firsts' or require a comparative understanding of World Cup history.\n4. **Intentional Question Planning**: The question will focus on the significance of the 2018 World Cup being the first hosted in Eastern Europe, probing for an understanding of the geopolitical and historical context surrounding the event. It avoids direct recall of facts and encourages reasoning about broader implications.\n</document_analysis>\n<output_format>\nQuestion: Considering the 2018 FIFA World Cup as the first to be held in Eastern Europe, what potential geopolitical significance did this event hold beyond its sporting aspects?\nA: It signaled a complete shift in FIFA\u2019s focus towards exclusively hosting tournaments in emerging economies.\nB: It represented a symbolic opening of Russia to greater international engagement and normalization following periods of geopolitical tension.\nC: It definitively established a new standard for World Cup infrastructure spending, making future bids from Western European nations economically unviable.\nD: It prompted immediate and substantial reforms within FIFA\u2019s governance structure to address concerns about corruption and transparency.\nExplanation: Hosting the World Cup in Russia, the first Eastern European nation to do so, can be viewed as a symbolic gesture of international acceptance and normalization of relations, particularly given the geopolitical context at the time. While the event was expensive, it didn\u2019t necessarily render future Western European bids unviable. It also didn't lead to immediate FIFA governance reform.\nCorrect Answer: B\n</output_format>\n```",
    "question": "Considering the 2018 FIFA World Cup as the first to be held in Eastern Europe, what potential geopolitical significance did this event hold beyond its sporting aspects?",
    "choices": {
      "A": "It signaled a complete shift in FIFA\u2019s focus towards exclusively hosting tournaments in emerging economies.",
      "B": "It represented a symbolic opening of Russia to greater international engagement and normalization following periods of geopolitical tension.",
      "C": "It definitively established a new standard for World Cup infrastructure spending, making future bids from Western European nations economically unviable.",
      "D": "It prompted immediate and substantial reforms within FIFA\u2019s governance structure to address concerns about corruption and transparency."
    },
    "answer": "B",
    "explanation": "Hosting the World Cup in Russia, the first Eastern European nation to do so, can be viewed as a symbolic gesture of international acceptance and normalization of relations, particularly given the geopolitical context at the time. While the event was expensive, it didn\u2019t necessarily render future Western European bids unviable. It also didn't lead to immediate FIFA governance reform.",
    "question_token_count": 32,
    "answer_correctness_score": 9,
    "explanation_validity_score": 9,
    "question_clarity_score": 6,
    "question_difficulty_score": 7,
    "question_groundedness_score": 4,
    "avg_answer_token_count": 21
  },
  {
    "context": "<P> Super Bowl LII was an American football game played to determine the champion of the National Football League ( NFL ) for the 2017 season . The National Football Conference ( NFC ) champion Philadelphia Eagles defeated the American Football Conference ( AFC ) and defending Super Bowl LI champion New England Patriots , 41 -- 33 , to win their first Super Bowl and their first NFL title since 1960 . The game was played on February 4 , 2018 , at U.S. Bank Stadium in Minneapolis , Minnesota . This was the second time that a Super Bowl was played in Minneapolis , the northernmost city to ever host the event , after Super Bowl XXVI at the Metrodome during the 1991 season , and the sixth Super Bowl held in a cold - weather city . </P>",
    "topic": "Philadelphia Eagles' championship drought prior to winning Super Bowl LII.",
    "response": "```xml\n<document_analysis>\n<thoughtful_content_examination>\nThe provided text focuses on Super Bowl LII and the Philadelphia Eagles' victory. The key information is that this win marked the Eagles' first Super Bowl title and their first NFL championship since 1960. This implies a significant period of championship drought prior to this win.\n</thoughtful_content_examination>\n<concept_exploration>\nThe text subtly highlights the historical context of the Eagles' success. A domain expert would understand the significance of a 58-year drought in professional football, especially for a franchise with a dedicated fanbase. The question will focus on quantifying this drought and testing the expert's knowledge of NFL history.\n</concept_exploration>\n<strategic_complexity_calibration>\nDifficulty: 8/10. The question requires recalling a specific timeframe and understanding its historical context. It's not directly stated, requiring inference.\n</strategic_complexity_calibration>\n<intentional_question_planning>\nThe question will ask about the length of the Eagles' championship drought prior to Super Bowl LII, requiring the expert to calculate the difference between 2018 and 1960. The distractors will be plausible, representing common errors in calculation or similar historical events.\n</intentional_question_planning>\n</document_analysis>\n<output_format>\nQuestion: Prior to their victory in Super Bowl LII, the Philadelphia Eagles had not won an NFL championship for how many years?\nA: 48 years\nB: 52 years\nC: 58 years\nD: 62 years\nExplanation: The text states the Eagles' last NFL title prior to Super Bowl LII was in 1960. Super Bowl LII was played in 2018. Therefore, the drought lasted 2018 - 1960 = 58 years.\nCorrect Answer: C\n</output_format>\n```",
    "question": "Prior to their victory in Super Bowl LII, the Philadelphia Eagles had not won an NFL championship for how many years?",
    "choices": {
      "A": "48 years",
      "B": "52 years",
      "C": "58 years",
      "D": "62 years"
    },
    "answer": "C",
    "explanation": "The text states the Eagles' last NFL title prior to Super Bowl LII was in 1960. Super Bowl LII was played in 2018. Therefore, the drought lasted 2018 - 1960 = 58 years.",
    "question_token_count": 25,
    "answer_correctness_score": 10,
    "explanation_validity_score": 10,
    "question_clarity_score": 8,
    "question_difficulty_score": 4,
    "question_groundedness_score": 9,
    "avg_answer_token_count": 3
  },
  {
    "context": "<P> The Battles of Lexington and Concord were the first military engagements of the American Revolutionary War . The battles were fought on April 19 , 1775 in Middlesex County , Province of Massachusetts Bay , within the towns of Lexington , Concord , Lincoln , Menotomy ( present - day Arlington ) , and Cambridge . They marked the outbreak of armed conflict between the Kingdom of Great Britain and its thirteen colonies in America . </P>",
    "topic": "Identify and locate the specific towns within Middlesex County where the Battles of Lexington and Concord took place.",
    "response": "```xml\n<document_analysis>\n<Thoughtful_Content_Examination>The context describes the Battles of Lexington and Concord as the first military engagements of the American Revolutionary War, pinpointing the date and the county (Middlesex) and province (Massachusetts Bay) where they occurred. Crucially, it lists five towns where the battles were fought: Lexington, Concord, Lincoln, Menotomy (now Arlington), and Cambridge.</Thoughtful_Content_Examination>\n<Concept_Exploration>The context highlights the significance of these battles as the start of the war. The inclusion of both Lexington and Concord, alongside lesser-known locations like Menotomy and Lincoln, suggests a broader geographical scope to the initial conflict than commonly understood. The historical naming convention of \"Province of Massachusetts Bay\" is important context for a domain expert.</Concept_Exploration>\n<Strategic_Complexity_Calibration>Difficulty: 7/10. While the context directly states the towns, a domain expert needs to recall all five locations and understand the present-day name of Menotomy. The question is designed to test recall and awareness of historical place names.</Strategic_Complexity_Calibration>\n<Intentional_Question_Planning>The question aims to test a domain expert's detailed knowledge of the Revolutionary War's opening battles, specifically their geographical locations. It requires recalling multiple towns mentioned in the text, including one with a changed name.</Intentional_Question_Planning>\n</document_analysis>\n<output_format>\nQuestion: Which of the following represents a complete list of towns within Middlesex County where fighting occurred during the Battles of Lexington and Concord?\nA: Lexington and Concord\nB: Lexington, Concord, and Cambridge\nC: Lexington, Concord, Lincoln, and Menotomy\nD: Lexington, Concord, Lincoln, Menotomy, and Cambridge\nExplanation: The text explicitly states that the battles were fought in Lexington, Concord, Lincoln, Menotomy (present-day Arlington), and Cambridge. Therefore, option D is the only complete and accurate list.\nCorrect Answer: D\n</output_format>\n```",
    "question": "Which of the following represents a complete list of towns within Middlesex County where fighting occurred during the Battles of Lexington and Concord?",
    "choices": {
      "A": "Lexington and Concord",
      "B": "Lexington, Concord, and Cambridge",
      "C": "Lexington, Concord, Lincoln, and Menotomy",
      "D": "Lexington, Concord, Lincoln, Menotomy, and Cambridge"
    },
    "answer": "D",
    "explanation": "The text explicitly states that the battles were fought in Lexington, Concord, Lincoln, Menotomy (present-day Arlington), and Cambridge. Therefore, option D is the only complete and accurate list.",
    "question_token_count": 26,
    "answer_correctness_score": 10,
    "explanation_validity_score": 10,
    "question_clarity_score": 1,
    "question_difficulty_score": 5,
    "question_groundedness_score": 10,
    "avg_answer_token_count": 9
  },
  {
    "context": "<Table> <Tr> <Th> Player </Th> <Th> Salary </Th> <Th> Team </Th> </Tr> <Tr> <Td> Stephen Curry </Td> <Td> $34,682,550 </Td> <Td> Golden State Warriors </Td> </Tr> <Tr> <Td> LeBron James </Td> <Td> $33,285,709 </Td> <Td> Cleveland Cavaliers </Td> </Tr> <Tr> <Td> Paul Millsap </Td> <Td> $31,269,231 </Td> <Td> Denver Nuggets </Td> </Tr> <Tr> <Td> Gordon Hayward </Td> <Td> $29,727,900 </Td> <Td> Boston Celtics </Td> </Tr> <Tr> <Td> Blake Griffin </Td> <Td> $29,512,900 </Td> <Td> Los Angeles Clippers </Td> </Tr> <Tr> <Td> Kyle Lowry </Td> <Td> $28,703,704 </Td> <Td> Toronto Raptors </Td> </Tr> <Tr> <Td> Russell Westbrook </Td> <Td> $28,530,608 </Td> <Td> Oklahoma City Thunder </Td> </Tr> <Tr> <Td> Mike Conley , Jr . </Td> <Td> $28,530,608 </Td> <Td> Memphis Grizzlies </Td> </Tr> <Tr> <Td> James Harden </Td> <Td> $28,299,399 </Td> <Td> Houston Rockets </Td> </Tr> <Tr> <Td> DeMar DeRozan </Td> <Td> $27,739,975 </Td> <Td> Toronto Raptors </Td> </Tr> </Table>",
    "topic": "Identify the player with the lowest salary in the table.",
    "response": "```xml\n<document_analysis>\n1. **Thoughtful Content Examination:** The context provides a table of NBA players, their salaries, and their teams. The task is to identify the player with the lowest salary. This requires a simple comparison of numerical values.\n2. **Concept Exploration:** The concept is straightforward \u2013 identifying the minimum value within a dataset. However, the challenge lies in quickly and accurately scanning the table and avoiding errors in reading the salary amounts.\n3. **Strategic Complexity Calibration:** Difficulty: 3/10. While seemingly simple, the potential for misreading the numbers makes it slightly more challenging than a trivial question.\n4. **Intentional Question Planning:** The question is designed to test attention to detail and the ability to accurately extract information from a table. The distractors will be salaries close to the correct answer to increase difficulty.\n</document_analysis>\n<output_format>\nQuestion: Which player from the provided list has the lowest annual salary?\nA: Stephen Curry\nB: DeMar DeRozan\nC: LeBron James\nD: Kyle Lowry\nExplanation: DeMar DeRozan has the lowest salary at $27,739,975, as indicated in the table.\nCorrect Answer: B\n</output_format>\n```",
    "question": "Which player from the provided list has the lowest annual salary?",
    "choices": {
      "A": "Stephen Curry",
      "B": "DeMar DeRozan",
      "C": "LeBron James",
      "D": "Kyle Lowry"
    },
    "answer": "B",
    "explanation": "DeMar DeRozan has the lowest salary at $27,739,975, as indicated in the table.",
    "question_token_count": 13,
    "answer_correctness_score": 10,
    "explanation_validity_score": 10,
    "question_clarity_score": 4,
    "question_difficulty_score": 6,
    "question_groundedness_score": 8,
    "avg_answer_token_count": 4
  },
  {
    "context": "<P> A player has taken two hat - tricks in the same Test match only once . Playing for Australia against South Africa in the first match of the 1912 Triangular Tournament at Old Trafford , Manchester , England , leg spinner Jimmy Matthews took a hat - trick in South Africa 's first and second innings , both taken on 28 May 1912 . He completed both hat - tricks by dismissing South Africa 's Tommy Ward . Only three other cricketers have taken more than one Test hat - trick : Australian off spinner Hugh Trumble ( two years apart , between the same teams at the same ground ) , Pakistani fast bowler Wasim Akram ( just over a week apart , in consecutive matches between the same teams ) and English fast bowler Stuart Broad . Three players have taken a hat - trick on their Test debut : English medium pace bowler Maurice Allom in 1930 , New Zealand off - spinner Peter Petherick in 1976 , and Australian pace bowler Damien Fleming in 1994 . Geoff Griffin took the fewest total Test wickets of any player who recorded a hat - trick , taking only eight wickets in his entire Test career . During the match in which he took his hat - trick , Griffin was repeatedly called for throwing by the umpires and never bowled again in a Test match . Australian Peter Siddle is the only bowler to take a hat - trick on his birthday , and Bangladeshi off spinner Sohag Gazi is the only player to score a century and take a hat - trick in the same Test match . </P>",
    "topic": "The specific details of Hugh Trumble's multiple hat-tricks, including the teams involved and the venue, demonstrate a unique pattern in Test cricket history.",
    "response": "<document_analysis>\n1. **Thoughtful Content Examination:** The text details unique occurrences of hat-tricks in Test cricket, focusing on players who've achieved multiple hat-tricks, debut hat-tricks, and other notable circumstances surrounding them. The central theme revolves around statistical anomalies and interesting facts related to this specific cricketing feat.\n2. **Concept Exploration:** The passage implicitly highlights the rarity of hat-tricks and the even greater rarity of multiple hat-tricks. It touches upon the idea of individual player stories contributing to the broader history of the sport \u2013 Griffin\u2019s controversy, Siddle\u2019s birthday hat-trick, and Gazi\u2019s all-round performance.\n3. **Strategic Complexity Calibration:** Difficulty: 9/10. The question will require recalling specific details about players and their hat-trick achievements, specifically focusing on the nuanced details surrounding Hugh Trumble\u2019s achievements, and distinguishing it from other players.\n4. **Intentional Question Planning:** The question will focus on Hugh Trumble's hat-tricks, aiming to test the expert's recall of the specific circumstances (teams, timing, venue) that distinguish his achievement. The distractors will be based on other players mentioned in the text, making it challenging to select the correct answer without precise knowledge.\n</document_analysis>\n\n<output_format>\nQuestion: Hugh Trumble is noted for achieving a rare feat in Test cricket history regarding hat-tricks. What specifically distinguishes his accomplishment from those of other multi-hat-trick takers like Wasim Akram and Stuart Broad?\nA: Trumble achieved his hat-tricks in consecutive matches against the same opponent.\nB: Trumble\u2019s hat-tricks were separated by two years, occurring between the same teams at the same ground.\nC: Trumble took his hat-tricks in a Triangular Tournament, unlike Akram and Broad.\nD: Trumble\u2019s hat-tricks were both completed by dismissing the same batsman, Tommy Ward.\nExplanation: The text states, \u201cAustralian off spinner Hugh Trumble (two years apart, between the same teams at the same ground)\u2026\u201d This directly addresses the distinguishing characteristic of Trumble\u2019s achievement.\nCorrect Answer: B\n</output_format>",
    "question": "Hugh Trumble is noted for achieving a rare feat in Test cricket history regarding hat-tricks. What specifically distinguishes his accomplishment from those of other multi-hat-trick takers like Wasim Akram and Stuart Broad?",
    "choices": {
      "A": "Trumble achieved his hat-tricks in consecutive matches against the same opponent.",
      "B": "Trumble\u2019s hat-tricks were separated by two years, occurring between the same teams at the same ground.",
      "C": "Trumble took his hat-tricks in a Triangular Tournament, unlike Akram and Broad.",
      "D": "Trumble\u2019s hat-tricks were both completed by dismissing the same batsman, Tommy Ward."
    },
    "answer": "B",
    "explanation": "The text states, \u201cAustralian off spinner Hugh Trumble (two years apart, between the same teams at the same ground)\u2026\u201d This directly addresses the distinguishing characteristic of Trumble\u2019s achievement.",
    "question_token_count": 44,
    "answer_correctness_score": 10,
    "explanation_validity_score": 10,
    "question_clarity_score": 6,
    "question_difficulty_score": 7,
    "question_groundedness_score": 10,
    "avg_answer_token_count": 20
  },
  {
    "context": "<P> The Pittsburgh Steelers ( 6 -- 2 ) have won the most Super Bowls with six championships , while the New England Patriots ( 5 -- 5 ) , the Dallas Cowboys ( 5 -- 3 ) , and the San Francisco 49ers ( 5 -- 1 ) have five wins . New England has the most Super Bowl appearances with ten , while the Buffalo Bills ( 0 -- 4 ) have the most consecutive appearances with four ( all losses ) from 1990 to 1993 . The Miami Dolphins are the only other team to have at least three consecutive appearances : 1972 -- 1974 . The Denver Broncos ( 3 -- 5 ) and Patriots have each lost a record five Super Bowls . The Minnesota Vikings ( 0 -- 4 ) and the Bills have lost four . The record for consecutive wins is two and is shared by seven franchises : the Green Bay Packers ( 1966 -- 1967 ) , the Miami Dolphins ( 1972 -- 1973 ) , the Pittsburgh Steelers ( 1974 -- 1975 and 1978 -- 1979 , the only team to accomplish this feat twice ) , the San Francisco 49ers ( 1988 -- 1989 ) , the Dallas Cowboys ( 1992 -- 1993 ) , the Denver Broncos ( 1997 -- 1998 ) , and the New England Patriots ( 2003 -- 2004 ) . Among those , Dallas ( 1992 -- 1993 ; 1995 ) and New England ( 2001 ; 2003 -- 2004 ) are the only teams to win three out of four consecutive Super Bowls . The 1972 Dolphins capped off the only perfect season in NFL history with their victory in Super Bowl VII . The only team with multiple Super Bowl appearances and no losses is the Baltimore Ravens , who in winning Super Bowl XLVII defeated and replaced the 49ers in that position . Four current NFL teams have never appeared in a Super Bowl , including franchise relocations and renaming : the Cleveland Browns , Detroit Lions , Jacksonville Jaguars , and Houston Texans , though both the Browns ( 1964 ) and Lions ( 1957 ) had won NFL championship games prior to the creation of the Super Bowl . </P>",
    "topic": "Explain the unique position of the Baltimore Ravens in Super Bowl history regarding appearances and losses.",
    "response": "```xml\n<document_analysis>\n<Thoughtful_Content_Examination>\nThe provided text details Super Bowl records for various teams, including wins, losses, appearances, and consecutive appearances/wins. It highlights teams with notable records in these categories, like the Steelers, Patriots, Bills, and Dolphins. A key piece of information is the unique position of the Baltimore Ravens.\n</Thoughtful_Content_Examination>\n<Concept_Exploration>\nThe text presents a statistical overview of Super Bowl history. The Ravens' distinction \u2013 multiple appearances with no losses \u2013 is a relatively rare achievement. The implicit concept is the difficulty of maintaining a perfect record in the Super Bowl, given the high stakes and competitive nature of the game.\n</Concept_Exploration>\n<Strategic_Complexity_Calibration>\nDifficulty: 8/10. The question requires recalling a specific, nuanced detail about the Ravens' record within a larger context of numerous team statistics. It's not a straightforward fact recall but requires identifying a unique position.\n</Strategic_Complexity_Calibration>\n<Intentional_Question_Planning>\nThe question will focus on the Baltimore Ravens' unique Super Bowl record, requiring the domain expert to recall the specific detail of having multiple appearances without a loss. The distractors will focus on other teams with significant records, testing for precise knowledge.\n</Intentional_Question_Planning>\n</document_analysis>\n\n<output_format>\nQuestion: Which NFL franchise currently holds the unique distinction of having made multiple Super Bowl appearances without suffering a single defeat?\nA: New England Patriots\nB: San Francisco 49ers\nC: Baltimore Ravens\nD: Pittsburgh Steelers\nExplanation: The text explicitly states, \"The only team with multiple Super Bowl appearances and no losses is the Baltimore Ravens.\" This makes C the correct answer. The other teams have all experienced Super Bowl losses.\nCorrect Answer: C\n</output_format>\n```",
    "question": "Which NFL franchise currently holds the unique distinction of having made multiple Super Bowl appearances without suffering a single defeat?",
    "choices": {
      "A": "New England Patriots",
      "B": "San Francisco 49ers",
      "C": "Baltimore Ravens",
      "D": "Pittsburgh Steelers"
    },
    "answer": "C",
    "explanation": "The text explicitly states, \"The only team with multiple Super Bowl appearances and no losses is the Baltimore Ravens.\" This makes C the correct answer. The other teams have all experienced Super Bowl losses.",
    "question_token_count": 22,
    "answer_correctness_score": 10,
    "explanation_validity_score": 10,
    "question_clarity_score": 8,
    "question_difficulty_score": 7,
    "question_groundedness_score": 10,
    "avg_answer_token_count": 4
  },
  {
    "context": "<Table> <Tr> <Th colspan=\"2\"> Philadelphia Eagles </Th> </Tr> <Tr> <Td colspan=\"2\"> Current season </Td> </Tr> <Tr> <Td colspan=\"2\"> Established July 8 , 1933 ; 84 years ago ( July 8 , 1933 ) First season : 1933 Play in Lincoln Financial Field Philadelphia , Pennsylvania Headquartered in the NovaCare Complex Philadelphia , Pennsylvania </Td> </Tr> <Tr> <Th colspan=\"2\"> </Th> </Tr> <Tr> <Td colspan=\"2\"> <Table> <Tr> <Td> </Td> <Td> </Td> </Tr> <Tr> <Td> Logo </Td> <Td> Wordmark </Td> </Tr> </Table> </Td> </Tr> <Tr> <Th colspan=\"2\"> League / conference affiliations </Th> </Tr> <Tr> <Td colspan=\"2\"> <P> National Football League ( 1933 -- present ) </P> <Ul> <Li> Eastern Division ( 1933 -- 1949 ) </Li> <Li> American Conference ( 1950 -- 1952 ) </Li> <Li> Eastern Conference ( 1953 -- 1969 ) <Ul> <Li> Capitol Division ( 1967 -- 1969 ) </Li> </Ul> </Li> <Li> National Football Conference ( 1970 -- present ) <Ul> <Li> NFC East ( 1970 -- present ) </Li> </Ul> </Li> </Ul> </Td> </Tr> <Tr> <Td colspan=\"2\"> Current uniform </Td> </Tr> <Tr> <Td colspan=\"2\"> </Td> </Tr> <Tr> <Th> Team colors </Th> <Td> <P> Midnight green , Silver , Black , White </P> </Td> </Tr> <Tr> <Th> Fight song </Th> <Td> Fly , Eagles Fly </Td> </Tr> <Tr> <Th> Mascot </Th> <Td> Swoop </Td> </Tr> <Tr> <Th colspan=\"2\"> Personnel </Th> </Tr> <Tr> <Th> Owner ( s ) </Th> <Td> Jeffrey Lurie Christina Weiss Lurie </Td> </Tr> <Tr> <Th> Chairman </Th> <Td> Jeffrey Lurie </Td> </Tr> <Tr> <Th> CEO </Th> <Td> Jeffrey Lurie </Td> </Tr> <Tr> <Th> President </Th> <Td> Don Smolenski </Td> </Tr> <Tr> <Th> General manager </Th> <Td> Howie Roseman </Td> </Tr> <Tr> <Th> Head coach </Th> <Td> Doug Pederson </Td> </Tr> <Tr> <Th colspan=\"2\"> Team history </Th> </Tr> <Tr> <Td colspan=\"2\"> <Ul> <Li> Philadelphia Eagles ( 1933 -- 1942 ; 1944 -- present ) </Li> <Li> Phil - Pitt `` Steagles '' ( 1943 ) </Li> </Ul> </Td> </Tr> <Tr> <Th colspan=\"2\"> Team nicknames </Th> </Tr> <Tr> <Td colspan=\"2\"> <Ul> <Li> The Birds </Li> </Ul> </Td> </Tr> <Tr> <Th colspan=\"2\"> Championships </Th> </Tr> <Tr> <Td colspan=\"2\"> <P> League championships ( 4 ) </P> <Ul> <Li> NFL championships ( pre-1970 AFL -- NFL merger ) ( 3 ) 1948 , 1949 , 1960 </Li> </Ul> <Ul> <Li> Super Bowl championships ( 1 ) 2017 ( LII ) </Li> </Ul> </Td> </Tr> <Tr> <Td colspan=\"2\"> <P> Conference championships ( 4 ) </P> <Ul> <Li> NFL Eastern : 1960 </Li> <Li> NFC : 1980 , 2004 , 2017 </Li> </Ul> </Td> </Tr> <Tr> <Td colspan=\"2\"> <P> Division championships ( 13 ) </P> <Ul> <Li> NFL East : 1947 , 1948 , 1949 </Li> <Li> NFC East : 1980 , 1988 , 2001 , 2002 , 2003 , 2004 , 2006 , 2010 , 2013 , 2017 </Li> </Ul> </Td> </Tr> <Tr> <Th colspan=\"2\"> Playoff appearances ( 25 ) </Th> </Tr> <Tr> <Td colspan=\"2\"> <Ul> <Li> NFL : 1947 , 1948 , 1949 , 1960 , 1978 , 1979 , 1980 , 1981 , 1988 , 1989 , 1990 , 1992 , 1995 , 1996 , 2000 , 2001 , 2002 , 2003 , 2004 , 2006 , 2008 , 2009 , 2010 , 2013 , 2017 </Li> </Ul> </Td> </Tr> <Tr> <Th colspan=\"2\"> Home fields </Th> </Tr> <Tr> <Td colspan=\"2\"> <Ul> <Li> Baker Bowl ( 1933 -- 1935 ) </Li> <Li> Philadelphia Municipal Stadium ( 1936 -- 1939 , 1941 ) </Li> <Li> Connie Mack Stadium ( 1940 , 1942 -- 1957 ) </Li> <Li> Franklin Field ( 1958 -- 1970 ) </Li> <Li> Veterans Stadium ( 1971 -- 2002 ) </Li> <Li> Lincoln Financial Field ( 2003 -- present ) </Li> </Ul> </Td> </Tr> </Table>",
    "topic": "The various league and conference affiliations the Philadelphia Eagles have held throughout their history.",
    "response": "<document_analysis>\nThe provided context is a table detailing information about the Philadelphia Eagles, including their history, personnel, championships, and league affiliations. The table is well-structured and contains a significant amount of factual data. The section on \"League / conference affiliations\" is particularly relevant for question generation. I will focus on crafting a question that tests understanding of the Eagles' conference transitions over time, requiring recall and synthesis of information from the table. The difficulty will be set to 8, as it requires remembering a sequence of affiliations and understanding the context of NFL history (pre/post merger). I will ignore the logo and team colors as they are not relevant to the question topic.\n</document_analysis>\n\n<output_format>\nQuestion: Prior to the establishment of the National Football Conference in 1970, the Philadelphia Eagles competed within which conference structure for the longest continuous period?\nA: American Conference (1950-1952)\nB: Eastern Division (1933-1949)\nC: Eastern Conference (1953-1969)\nD: Capitol Division (1967-1969)\nExplanation: The table indicates the Eagles were in the Eastern Division from 1933-1949, the American Conference from 1950-1952, and the Eastern Conference from 1953-1969. Thus, the Eastern Division represents the longest continuous period.\nCorrect Answer: B\n</output_format>",
    "question": "Prior to the establishment of the National Football Conference in 1970, the Philadelphia Eagles competed within which conference structure for the longest continuous period?",
    "choices": {
      "A": "American Conference (1950-1952)",
      "B": "Eastern Division (1933-1949)",
      "C": "Eastern Conference (1953-1969)",
      "D": "Capitol Division (1967-1969)"
    },
    "answer": "B",
    "explanation": "The table indicates the Eagles were in the Eastern Division from 1933-1949, the American Conference from 1950-1952, and the Eastern Conference from 1953-1969. Thus, the Eastern Division represents the longest continuous period.",
    "question_token_count": 29,
    "answer_correctness_score": 5,
    "explanation_validity_score": 5,
    "question_clarity_score": 8,
    "question_difficulty_score": 7,
    "question_groundedness_score": 10,
    "avg_answer_token_count": 10
  },
  {
    "context": "<Table> <Tr> <Td> May 20 , 2012 Annular </Td> <Td> August 21 , 2017 Total </Td> <Td> October 14 , 2023 Annular </Td> <Td> April 8 , 2024 Total </Td> </Tr> <Tr> <Td> March 30 , 2033 Total </Td> <Td> June 21 , 2039 Annular </Td> <Td> August 23 , 2044 Total </Td> <Td> August 12 , 2045 Total </Td> </Tr> <Tr> <Td> February 5 , 2046 Annular </Td> <Td> June 11 , 2048 Annular </Td> </Tr> </Table>",
    "topic": "Identify the years in which multiple total solar eclipses are predicted to occur.",
    "response": "```xml\n<document_analysis>\n1. **Thoughtful Content Examination:** The context provides a table listing dates and types of solar eclipses (Total or Annular). The core information is the dates themselves and the eclipse type.\n2. **Concept Exploration:** The task requires identifying years with multiple total solar eclipses. This necessitates scanning the table and counting occurrences within each year. It tests the ability to extract and synthesize data from a tabular format.\n3. **Strategic Complexity Calibration:** Difficulty: 8/10. While the table is straightforward, accurately counting total eclipses per year requires careful attention to detail, and the question tests the ability to synthesize information.\n4. **Intentional Question Planning:** The question is designed to test the candidate\u2019s ability to parse tabular data and accurately identify years containing multiple total solar eclipses. The distractors will include years with only one total eclipse, years with annular eclipses, and years with no eclipses listed.\n</document_analysis>\n<output_format>\nQuestion: Based on the provided data, in which of the following years are multiple total solar eclipses predicted to occur?\nA: 2017\nB: 2033\nC: 2044\nD: 2045\nExplanation: The table shows total solar eclipses occurring on August 23, 2044 and August 12, 2045, making 2044 and 2045 the only years with multiple total solar eclipses.\nCorrect Answer: D\n</output_format>\n```",
    "question": "Based on the provided data, in which of the following years are multiple total solar eclipses predicted to occur?",
    "choices": {
      "A": "2017",
      "B": "2033",
      "C": "2044",
      "D": "2045"
    },
    "answer": "D",
    "explanation": "The table shows total solar eclipses occurring on August 23, 2044 and August 12, 2045, making 2044 and 2045 the only years with multiple total solar eclipses.",
    "question_token_count": 23,
    "answer_correctness_score": 1,
    "explanation_validity_score": 1,
    "question_clarity_score": 8,
    "question_difficulty_score": 3,
    "question_groundedness_score": 10,
    "avg_answer_token_count": 3
  },
  {
    "context": "<P> The 2017 NFL season is the 98th and current season in the history of the National Football League ( NFL ) . The season began on September 7 , 2017 , with the Kansas City Chiefs defeating the defending Super Bowl LI champion New England Patriots 42 -- 27 in the NFL Kickoff Game . The season will conclude with Super Bowl LII , the league 's championship game , on February 4 , 2018 , at U.S. Bank Stadium in Minneapolis , Minnesota . </P>",
    "topic": "State the date on which Super Bowl LII, concluding the 2017 NFL season, was held.",
    "response": "```xml\n<document_analysis>\n1. **Thoughtful Content Examination:** The text provides information about the 2017 NFL season, including its start and end dates, and the location of Super Bowl LII. The core information is straightforward and factual.\n2. **Concept Exploration:** The text establishes a timeline for the NFL season, linking the kickoff game to the championship game. The question focuses on recalling a specific date related to the season's conclusion.\n3. **Strategic Complexity Calibration:** Difficulty: 3/10. While the date is explicitly stated, the question requires precise recall and attention to detail. It's not a trivial question but also not overly complex.\n4. **Intentional Question Planning:** The question targets a specific factual detail within the text, testing the reader's ability to extract and remember information. The distractors will be dates close to the correct answer, requiring careful consideration.\n</document_analysis>\n<output_format>\nQuestion: On what date was Super Bowl LII, concluding the 2017 NFL season, held?\nA: January 28, 2018\nB: February 4, 2018\nC: February 11, 2018\nD: January 7, 2018\nExplanation: The text explicitly states that Super Bowl LII, the championship game concluding the 2017 NFL season, was held on February 4, 2018.\nCorrect Answer: B\n</output_format>\n```",
    "question": "On what date was Super Bowl LII, concluding the 2017 NFL season, held?",
    "choices": {
      "A": "January 28, 2018",
      "B": "February 4, 2018",
      "C": "February 11, 2018",
      "D": "January 7, 2018"
    },
    "answer": "B",
    "explanation": "The text explicitly states that Super Bowl LII, the championship game concluding the 2017 NFL season, was held on February 4, 2018.",
    "question_token_count": 20,
    "answer_correctness_score": 10,
    "explanation_validity_score": 10,
    "question_clarity_score": 6,
    "question_difficulty_score": 2,
    "question_groundedness_score": 10,
    "avg_answer_token_count": 8
  },
  {
    "context": "<Table> <Tr> <Th> Rank </Th> <Th> Points </Th> <Th> Player </Th> <Th> Date </Th> <Th> 1st </Th> <Th> 2nd </Th> <Th> 3rd </Th> <Th> 4th </Th> <Th> Team </Th> <Th> Opponent </Th> <Th> Score </Th> <Th> MP </Th> <Th> FGM </Th> <Th> FGA </Th> <Th> 3PM </Th> <Th> 3PA </Th> <Th> FTM </Th> <Th> FTA </Th> <Th> Notes </Th> <Th> Ref . </Th> </Tr> <Tr> <Th colspan=\"4\"> Scoring by quarter </Th> </Tr> <Tr> <Td> </Td> <Td> 100 </Td> <Td> Chamberlain , Wilt Wilt Chamberlain * </Td> <Td> 000000001962 - 03 - 02 - 0000 March 2 , 1962 </Td> <Td> 23 </Td> <Td> 18 </Td> <Td> 28 </Td> <Td> 31 </Td> <Td> Philadelphia Warriors </Td> <Td> New York Knicks </Td> <Td> 169 -- 147 </Td> <Td> 48 </Td> <Td> 36 </Td> <Td> 63 </Td> <Td> -- </Td> <Td> -- </Td> <Td> 28 </Td> <Td> 32 </Td> <Td> </Td> <Td> </Td> </Tr> <Tr> <Td> </Td> <Td> 81 </Td> <Td> Bryant , Kobe Kobe Bryant </Td> <Td> 000000002006 - 01 - 22 - 0000 January 22 , 2006 </Td> <Td> 14 </Td> <Td> 12 </Td> <Td> 27 </Td> <Td> 28 </Td> <Td> Los Angeles Lakers </Td> <Td> Toronto Raptors </Td> <Td> 122 -- 104 </Td> <Td> 41 : 56 </Td> <Td> 28 </Td> <Td> 46 </Td> <Td> 7 </Td> <Td> 13 </Td> <Td> 18 </Td> <Td> 20 </Td> <Td> </Td> <Td> </Td> </Tr> <Tr> <Td> </Td> <Td> 78 </Td> <Td> Chamberlain , Wilt Wilt Chamberlain * </Td> <Td> 000000001961 - 12 - 08 - 0000 December 8 , 1961 </Td> <Td> -- </Td> <Td> -- </Td> <Td> -- </Td> <Td> -- </Td> <Td> Philadelphia Warriors </Td> <Td> Los Angeles Lakers </Td> <Td> 147 -- 151 </Td> <Td> 63 </Td> <Td> 31 </Td> <Td> 62 </Td> <Td> -- </Td> <Td> -- </Td> <Td> 16 </Td> <Td> 31 </Td> <Td> </Td> <Td> </Td> </Tr> <Tr> <Td> </Td> <Td> 73 </Td> <Td> Chamberlain , Wilt Wilt Chamberlain * </Td> <Td> 000000001962 - 01 - 13 - 0000 January 13 , 1962 </Td> <Td> -- </Td> <Td> -- </Td> <Td> -- </Td> <Td> -- </Td> <Td> Philadelphia Warriors </Td> <Td> Chicago Packers </Td> <Td> 135 -- 117 </Td> <Td> 48 </Td> <Td> 29 </Td> <Td> 48 </Td> <Td> -- </Td> <Td> -- </Td> <Td> 15 </Td> <Td> 25 </Td> <Td> </Td> <Td> </Td> </Tr> <Tr> <Td> 73 </Td> <Td> Chamberlain , Wilt Wilt Chamberlain * </Td> <Td> 000000001962 - 11 - 16 - 0000 November 16 , 1962 </Td> <Td> -- </Td> <Td> -- </Td> <Td> -- </Td> <Td> -- </Td> <Td> San Francisco Warriors </Td> <Td> New York Knicks </Td> <Td> 127 -- 111 </Td> <Td> 48 </Td> <Td> 29 </Td> <Td> 43 </Td> <Td> -- </Td> <Td> -- </Td> <Td> 15 </Td> <Td> 19 </Td> <Td> </Td> <Td> </Td> </Tr> <Tr> <Td> 73 </Td> <Td> Thompson , David David Thompson * </Td> <Td> 000000001978 - 04 - 09 - 0000 April 9 , 1978 </Td> <Td> 32 </Td> <Td> 21 </Td> <Td> 9 </Td> <Td> 11 </Td> <Td> Denver Nuggets </Td> <Td> Detroit Pistons </Td> <Td> 137 -- 139 </Td> <Td> 43 </Td> <Td> 28 </Td> <Td> 38 </Td> <Td> -- </Td> <Td> -- </Td> <Td> 17 </Td> <Td> 20 </Td> <Td> </Td> <Td> </Td> </Tr> <Tr> <Td> 7 </Td> <Td> 72 </Td> <Td> Chamberlain , Wilt Wilt Chamberlain * </Td> <Td> 000000001962 - 11 - 03 - 0000 November 3 , 1962 </Td> <Td> -- </Td> <Td> -- </Td> <Td> -- </Td> <Td> -- </Td> <Td> San Francisco Warriors </Td> <Td> Los Angeles Lakers </Td> <Td> 115 -- 127 </Td> <Td> -- </Td> <Td> 29 </Td> <Td> 48 </Td> <Td> -- </Td> <Td> -- </Td> <Td> 14 </Td> <Td> 18 </Td> <Td> </Td> <Td> </Td> </Tr> <Tr> <Td> 8 </Td> <Td> 71 </Td> <Td> Baylor , Elgin Elgin Baylor * </Td> <Td> 000000001960 - 11 - 15 - 0000 November 15 , 1960 </Td> <Td> -- </Td> <Td> -- </Td> <Td> -- </Td> <Td> -- </Td> <Td> Los Angeles Lakers </Td> <Td> New York Knicks </Td> <Td> 123 -- 108 </Td> <Td> 45 </Td> <Td> 28 </Td> <Td> 48 </Td> <Td> -- </Td> <Td> -- </Td> <Td> 15 </Td> <Td> 18 </Td> <Td> </Td> <Td> </Td> </Tr> <Tr> <Td> 71 </Td> <Td> Robinson , David David Robinson * </Td> <Td> 000000001994 - 04 - 24 - 0000 April 24 , 1994 </Td> <Td> 18 </Td> <Td> 6 </Td> <Td> 19 </Td> <Td> 28 </Td> <Td> San Antonio Spurs </Td> <Td> Los Angeles Clippers </Td> <Td> 112 -- 97 </Td> <Td> 44 </Td> <Td> 26 </Td> <Td> 41 </Td> <Td> </Td> <Td> </Td> <Td> 18 </Td> <Td> 25 </Td> <Td> </Td> <Td> </Td> </Tr> <Tr> <Td> 10 </Td> <Td> 70 </Td> <Td> Chamberlain , Wilt Wilt Chamberlain * </Td> <Td> 000000001963 - 03 -",
    "topic": "Comparison of Wilt Chamberlain's scoring performances across different seasons and teams (Philadelphia/San Francisco Warriors).",
    "response": "```xml\n<document_analysis>\nThe provided text is a table detailing high-scoring games in NBA history. The focus is on Wilt Chamberlain, with several of his performances listed, including his famous 100-point game. The table also includes performances by Kobe Bryant, David Thompson, Elgin Baylor, and David Robinson. The data includes date, team, opponent, score, minutes played, field goals made/attempted, three-pointers made/attempted, and free throws made/attempted. The question will focus on comparing Wilt Chamberlain\u2019s scoring across his time with the Philadelphia and San Francisco Warriors, requiring an understanding of the data presented in the table. The difficulty is rated 8/10, as it requires careful reading and comparison of multiple data points.\n</document_analysis>\n<output_format>\nQuestion: Based on the provided data, what is the difference between Wilt Chamberlain\u2019s highest and lowest point totals achieved while playing for the Philadelphia Warriors?\nA: 27 points\nB: 22 points\nC: 100 points\nD: 29 points\nExplanation: The highest point total for Chamberlain while with the Philadelphia Warriors is 100 points (March 2, 1962), and the lowest is 73 points (January 13, 1962). The difference is 100 - 73 = 27 points.\nCorrect Answer: A\n</output_format>\n```",
    "question": "Based on the provided data, what is the difference between Wilt Chamberlain\u2019s highest and lowest point totals achieved while playing for the Philadelphia Warriors?",
    "choices": {
      "A": "27 points",
      "B": "22 points",
      "C": "100 points",
      "D": "29 points"
    },
    "answer": "A",
    "explanation": "The highest point total for Chamberlain while with the Philadelphia Warriors is 100 points (March 2, 1962), and the lowest is 73 points (January 13, 1962). The difference is 100 - 73 = 27 points.",
    "question_token_count": 30,
    "answer_correctness_score": 10,
    "explanation_validity_score": 10,
    "question_clarity_score": 8,
    "question_difficulty_score": 4,
    "question_groundedness_score": 10,
    "avg_answer_token_count": 3
  },
  {
    "context": "<P> Human fertilization is the union of a human egg and sperm , usually occurring in the ampulla of the fallopian tube . The result of this union is the production of a zygote cell , or fertilized egg , initiating prenatal development . Scientists discovered the dynamics of human fertilization in the nineteenth century . </P>",
    "topic": "Explain the immediate biological result of the union between a human egg and sperm, and the term used to describe this initial cell.",
    "response": "```xml\n<document_analysis>\n<Thoughtful_Content_Examination>The provided text describes the basic process of human fertilization: the union of egg and sperm in the fallopian tube, resulting in a zygote. It's a concise definition, focusing on the immediate outcome.</Thoughtful_Content_Examination>\n<Concept_Exploration>The key concepts are fertilization, zygote, and prenatal development. The text implicitly highlights the starting point of a new organism's development. The mention of 19th-century discovery adds a historical context, but isn't crucial for a core understanding question.</Concept_Exploration>\n<Strategic_Complexity_Calibration>Difficulty: 6/10. While the terms are relatively straightforward, crafting a question that requires precise recall and distinguishes the zygote from other early developmental stages requires careful wording. The question focuses on the immediate biological result, which is the key takeaway.</Strategic_Complexity_Calibration>\n<Intentional_Question_Planning>The question will test the understanding of the direct result of fertilization and the specific term for that initial cell. The distractors will include terms related to early development but not the *immediate* product of fusion.</Intentional_Question_Planning>\n</document_analysis>\n<output_format>\nQuestion: What single cell is created by the immediate fusion of human gametes?\nA: Blastocyst\nB: Embryo\nC: Zygote\nD: Morula\nExplanation: The text explicitly states that the union of a human egg and sperm results in the production of a zygote cell. This is the first cell of a new organism.\nCorrect Answer: C\n</output_format>\n```",
    "question": "What single cell is created by the immediate fusion of human gametes?",
    "choices": {
      "A": "Blastocyst",
      "B": "Embryo",
      "C": "Zygote",
      "D": "Morula"
    },
    "answer": "C",
    "explanation": "The text explicitly states that the union of a human egg and sperm results in the production of a zygote cell. This is the first cell of a new organism.",
    "question_token_count": 15,
    "answer_correctness_score": 10,
    "explanation_validity_score": 10,
    "question_clarity_score": 6,
    "question_difficulty_score": 5,
    "question_groundedness_score": 8,
    "avg_answer_token_count": 3
  },
  {
    "context": "<P> The 21 World Cup tournaments have been won by eight national teams . Brazil have won five times , and they are the only team to have played in every tournament . The other World Cup winners are Germany and Italy , with four titles each ; Argentina , France and inaugural winner Uruguay , with two titles each ; and England and Spain with one title each . </P>",
    "topic": "The number of World Cup titles held by Brazil and its unique distinction in tournament participation.",
    "response": "```xml\n<document_analysis>\n<Thoughtful_Content_Examination>The context provides a concise overview of World Cup winners and highlights Brazil's unique achievements: winning the most titles (five) and participating in every tournament. The core information revolves around the historical performance of national teams in the World Cup.</Thoughtful_Content_Examination>\n<Concept_Exploration>The text implicitly suggests the competitive nature of the World Cup and the dominance of certain nations. Brazil's consistent participation signifies its enduring status in international football. The phrasing \"only team to have played in every tournament\" emphasizes the exceptional nature of this achievement.</Concept_Exploration>\n<Strategic_Complexity_Calibration>Difficulty: 8/10. The question will focus on combining the two unique aspects of Brazil's World Cup history \u2013 their title count and their participation record \u2013 to test deeper comprehension. The distractors will be carefully crafted to be plausible, requiring precise recall and understanding.</Strategic_Complexity_Calibration>\n<Intentional_Question_Planning>The question will ask about Brazil\u2019s unique position within the context of World Cup history, requiring the test-taker to synthesize both their title count and participation record. This encourages a holistic understanding rather than simple factual recall.</Intentional_Question_Planning>\n</document_analysis>\n<output_format>\nQuestion: Which nation holds the unique distinction of having both participated in every FIFA World Cup tournament and achieved the highest number of championship titles?\nA: Germany\nB: Italy\nC: Brazil\nD: Argentina\nExplanation: The text explicitly states that Brazil has won five World Cup titles, more than any other nation, and is the only team to have played in every tournament.\nCorrect Answer: C\n</output_format>\n```",
    "question": "Which nation holds the unique distinction of having both participated in every FIFA World Cup tournament and achieved the highest number of championship titles?",
    "choices": {
      "A": "Germany",
      "B": "Italy",
      "C": "Brazil",
      "D": "Argentina"
    },
    "answer": "C",
    "explanation": "The text explicitly states that Brazil has won five World Cup titles, more than any other nation, and is the only team to have played in every tournament.",
    "question_token_count": 26,
    "answer_correctness_score": 10,
    "explanation_validity_score": 10,
    "question_clarity_score": 4,
    "question_difficulty_score": 5,
    "question_groundedness_score": 10,
    "avg_answer_token_count": 2
  },
  {
    "context": "<P> The seventh season of the fantasy drama television series Game of Thrones premiered on HBO on July 16 , 2017 , and concluded on August 27 , 2017 . Unlike previous seasons that consisted of ten episodes each , the seventh season consisted of only seven . Like the previous season , it largely consisted of original content not found in George R.R. Martin 's A Song of Ice and Fire series , while also adapting material Martin revealed to showrunners about the upcoming novels in the series . The series was adapted for television by David Benioff and D.B. Weiss . </P>",
    "topic": "Describe the premiere and conclusion dates of the seventh season of Game of Thrones.",
    "response": "```xml\n<document_analysis>\n1. **Thoughtful Content Examination:** The context provides the premiere and conclusion dates of the seventh season of Game of Thrones, as well as the number of episodes and a brief note about its relationship to the source material. The core information is factual and straightforward.\n2. **Concept Exploration:** The information is a simple factual detail about a popular television show. While not deeply conceptual, the question can be framed to test precise recall and attention to detail.\n3. **Strategic Complexity Calibration:** Difficulty: 6/10. While the dates are explicitly stated, crafting plausible distractors requires careful attention to the surrounding information (episode count, comparison to previous seasons).\n4. **Intentional Question Planning:** The question will focus on precise dates, testing the ability to recall specific details. Distractors will be similar dates within the same year or relating to other seasons.\n</document_analysis>\n<output_format>\nQuestion: The seventh season of Game of Thrones aired for a shorter duration than previous seasons. What were the premiere and conclusion dates of this season?\nA: July 16, 2017 \u2013 August 20, 2017\nB: June 16, 2017 \u2013 August 27, 2017\nC: July 16, 2017 \u2013 August 27, 2017\nD: July 15, 2017 \u2013 August 28, 2017\nExplanation: The text explicitly states that the seventh season premiered on July 16, 2017, and concluded on August 27, 2017.\nCorrect Answer: C\n</output_format>\n```",
    "question": "The seventh season of Game of Thrones aired for a shorter duration than previous seasons. What were the premiere and conclusion dates of this season?",
    "choices": {
      "A": "July 16, 2017 \u2013 August 20, 2017",
      "B": "June 16, 2017 \u2013 August 27, 2017",
      "C": "July 16, 2017 \u2013 August 27, 2017",
      "D": "July 15, 2017 \u2013 August 28, 2017"
    },
    "answer": "C",
    "explanation": "The text explicitly states that the seventh season premiered on July 16, 2017, and concluded on August 27, 2017.",
    "question_token_count": 28,
    "answer_correctness_score": 10,
    "explanation_validity_score": 10,
    "question_clarity_score": 8,
    "question_difficulty_score": 4,
    "question_groundedness_score": 10,
    "avg_answer_token_count": 16
  },
  {
    "context": "<P> The 2017 NFL season is the 98th and current season in the history of the National Football League ( NFL ) . The season began on September 7 , 2017 , with the Kansas City Chiefs defeating the defending Super Bowl LI champion New England Patriots 42 -- 27 in the NFL Kickoff Game . The season will conclude with Super Bowl LII , the league 's championship game , on February 4 , 2018 , at U.S. Bank Stadium in Minneapolis , Minnesota . </P>",
    "topic": "What teams competed in the NFL Kickoff Game that began the 2017 NFL season and what was the outcome?",
    "response": "```xml\n<document_analysis>\n<Thoughtful_Content_Examination>The context provides a concise overview of the 2017 NFL season, specifically mentioning the Kickoff Game and its outcome. The core information revolves around the teams involved (Kansas City Chiefs and New England Patriots) and the score (42-27 in favor of the Chiefs).</Thoughtful_Content_Examination>\n<Concept_Exploration>The text establishes a chronological framework, linking the start of the season to the Kickoff Game and anticipating its conclusion with Super Bowl LII. It also highlights the defending champions (New England Patriots) and their defeat in the opening game.</Concept_Exploration>\n<Strategic_Complexity_Calibration>Difficulty: 6/10. While the information is directly stated, the question can be made challenging by focusing on the specific details of the outcome and requiring precise recall.</Strategic_Complexity_Calibration>\n<Intentional_Question_Planning>The question will focus on the teams involved in the 2017 NFL Kickoff Game and the precise score, aiming to test the reader's memory of specific details. Distractors will involve other potential teams and slightly altered scores.</Intentional_Question_Planning>\n</document_analysis>\n<output_format>\nQuestion: In the 2017 NFL Kickoff Game, which teams competed, and what was the final score?\nA: New England Patriots defeated the Kansas City Chiefs 27-42.\nB: Kansas City Chiefs defeated the New England Patriots 42-27.\nC: New England Patriots defeated the Pittsburgh Steelers 35-28.\nD: Kansas City Chiefs defeated the Philadelphia Eagles 31-24.\nExplanation: The text explicitly states that the Kansas City Chiefs defeated the New England Patriots 42-27 in the NFL Kickoff Game that began the 2017 NFL season.\nCorrect Answer: B\n</output_format>\n```",
    "question": "In the 2017 NFL Kickoff Game, which teams competed, and what was the final score?",
    "choices": {
      "A": "New England Patriots defeated the Kansas City Chiefs 27-42.",
      "B": "Kansas City Chiefs defeated the New England Patriots 42-27.",
      "C": "New England Patriots defeated the Pittsburgh Steelers 35-28.",
      "D": "Kansas City Chiefs defeated the Philadelphia Eagles 31-24."
    },
    "answer": "B",
    "explanation": "The text explicitly states that the Kansas City Chiefs defeated the New England Patriots 42-27 in the NFL Kickoff Game that began the 2017 NFL season.",
    "question_token_count": 22,
    "answer_correctness_score": 10,
    "explanation_validity_score": 10,
    "question_clarity_score": 10,
    "question_difficulty_score": 2,
    "question_groundedness_score": 10,
    "avg_answer_token_count": 14
  },
  {
    "context": "<P> The 2018 UEFA Champions League Final was the final match of the 2017 -- 18 UEFA Champions League , the 63rd season of Europe 's premier club football tournament organised by UEFA , and the 26th season since it was renamed from the European Cup to the UEFA Champions League . It was played at the NSC Olimpiyskiy Stadium in Kiev , Ukraine on 26 May 2018 , between Spanish side and defending champions Real Madrid , who had won the competition in each of the last two seasons , and English side Liverpool . </P>",
    "topic": "Describe the historical context of the 2018 UEFA Champions League Final within the broader history of the tournament.",
    "response": "```xml\n<document_analysis>\n1. **Thoughtful Content Examination:** The context describes the 2018 Champions League Final, outlining its place as the 63rd season of the tournament (formerly the European Cup) and the 26th season under the Champions League branding. It also identifies the competing teams (Real Madrid and Liverpool) and the venue (Kiev). The key element is the historical context of Real Madrid attempting a three-peat.\n\n2. **Concept Exploration:** The passage implicitly highlights the evolution of the tournament from the European Cup to the Champions League. It also emphasizes Real Madrid's dominance in recent years, setting the stage for a potentially historic achievement. A domain expert would understand the significance of a three-peat in European football.\n\n3. **Strategic Complexity Calibration:** Difficulty: 8/10. The question needs to go beyond simple recall of the teams involved and delve into the historical weight of Real Madrid\u2019s attempt for a third consecutive title, which is a relatively rare feat.\n\n4. **Intentional Question Planning:** The question will focus on the historical significance of a potential three-peat, requiring the expert to understand the rarity of such achievements in Champions League/European Cup history. This tests knowledge beyond the immediate context.\n</document_analysis>\n\n<output_format>\nQuestion: Prior to the 2018 UEFA Champions League Final, what was the most historically significant aspect of Real Madrid\u2019s position entering the match?\nA: Their hosting of the final at the NSC Olimpiyskiy Stadium in Kiev.\nB: Their attempt to become the first team to win three consecutive Champions League titles.\nC: Their status as the defending champions from the previous two seasons.\nD: Their rivalry with Liverpool, a historically dominant English club.\nExplanation: Winning three consecutive Champions League titles is an extremely rare achievement in the history of the competition. While Real Madrid were defending champions, the attempt at a three-peat carried greater historical weight.\nCorrect Answer: B\n</output_format>\n```",
    "question": "Prior to the 2018 UEFA Champions League Final, what was the most historically significant aspect of Real Madrid\u2019s position entering the match?",
    "choices": {
      "A": "Their hosting of the final at the NSC Olimpiyskiy Stadium in Kiev.",
      "B": "Their attempt to become the first team to win three consecutive Champions League titles.",
      "C": "Their status as the defending champions from the previous two seasons.",
      "D": "Their rivalry with Liverpool, a historically dominant English club."
    },
    "answer": "B",
    "explanation": "Winning three consecutive Champions League titles is an extremely rare achievement in the history of the competition. While Real Madrid were defending champions, the attempt at a three-peat carried greater historical weight.",
    "question_token_count": 28,
    "answer_correctness_score": 10,
    "explanation_validity_score": 10,
    "question_clarity_score": 8,
    "question_difficulty_score": 6,
    "question_groundedness_score": 9,
    "avg_answer_token_count": 14
  },
  {
    "context": "<P> `` Death and All His Friends '' is the season finale of the sixth season of the American television medical drama Grey 's Anatomy , and the show 's 126th episode overall . It was written by Shonda Rhimes and directed by Rob Corn . The episode was originally broadcast on the American Broadcasting Company ( ABC ) in the United States on May 20 , 2010 . The episode was the second part of the two - hour season six finale , the first being Sanctuary , and took place at the fictional Seattle Grace Hospital . The original episode broadcast in the United States had an audience of 16.13 million viewers and opened up to universal acclaim . The episode centers a shooting spree at the hospital by a former patient 's husband Gary Clark ( Michael O'Neill ) . The episode marked the last appearances for Nora Zehetner and Robert Baker as Dr. Reed Adamson and Dr. Charles Percy respectively as both the characters were killed in the shooting . </P>",
    "topic": "The characters of Dr. Reed Adamson and Dr. Charles Percy and their fate in the episode.",
    "response": "<document_analysis>\n1. **Thoughtful Content Examination**: The context describes the season finale of Grey's Anatomy, focusing on a shooting at Seattle Grace Hospital and the deaths of two characters, Dr. Reed Adamson and Dr. Charles Percy. It provides basic information about the episode's broadcast details, viewership, and critical reception.\n2. **Concept Exploration**: The core concept is the dramatic impact of character deaths within a long-running television series. The context highlights how these deaths serve as a narrative device, potentially marking the end of storylines and impacting future seasons. The mention of a shooting spree introduces a critical incident that drives the plot.\n3. **Strategic Complexity Calibration**: Difficulty: 8/10. The question will focus on understanding the significance of the characters' deaths within the narrative structure of the show, requiring knowledge of television drama conventions. It's not a simple recall question, as it requires connecting the event to the actors' departure from the series.\n4. **Intentional Question Planning**: The question will explore the narrative implication of the character deaths. It will be designed to assess whether the domain expert understands the common practice of using character deaths to advance storylines or signal shifts in a show's direction.\n</document_analysis>\n\n<output_format>\nQuestion: In the context of long-form television drama, the simultaneous departure of Dr. Reed Adamson and Dr. Charles Percy through on-screen death most directly signifies what narrative intention?\nA: A budgetary restructuring to reduce the show\u2019s payroll expenses.\nB: A deliberate plot device to introduce heightened emotional stakes and potentially reshape ongoing storylines.\nC: A contractual dispute with the actors, necessitating their characters\u2019 removal from the series.\nD: A creative decision to align the show\u2019s narrative with real-world hospital emergency statistics.\nExplanation: Character deaths in television dramas often serve to raise the emotional stakes, create narrative turning points, and open possibilities for new storylines. While other factors might contribute to an actor's departure, the method \u2013 on-screen death \u2013 strongly suggests a deliberate storytelling choice.\nCorrect Answer: B\n</output_format>",
    "question": "In the context of long-form television drama, the simultaneous departure of Dr. Reed Adamson and Dr. Charles Percy through on-screen death most directly signifies what narrative intention?",
    "choices": {
      "A": "A budgetary restructuring to reduce the show\u2019s payroll expenses.",
      "B": "A deliberate plot device to introduce heightened emotional stakes and potentially reshape ongoing storylines.",
      "C": "A contractual dispute with the actors, necessitating their characters\u2019 removal from the series.",
      "D": "A creative decision to align the show\u2019s narrative with real-world hospital emergency statistics."
    },
    "answer": "B",
    "explanation": "Character deaths in television dramas often serve to raise the emotional stakes, create narrative turning points, and open possibilities for new storylines. While other factors might contribute to an actor's departure, the method \u2013 on-screen death \u2013 strongly suggests a deliberate storytelling choice.",
    "question_token_count": 35,
    "answer_correctness_score": 10,
    "explanation_validity_score": 10,
    "question_clarity_score": 8,
    "question_difficulty_score": 7,
    "question_groundedness_score": 10,
    "avg_answer_token_count": 16
  },
  {
    "context": "<P> The 2018 FIFA World Cup was the 21st FIFA World Cup , an international football tournament contested by the men 's national teams of the member associations of FIFA once every four years . It took place in Russia from 14 June to 15 July 2018 . It was the first World Cup to be held in Eastern Europe , and the 11th time that it had been held in Europe . At an estimated cost of over $14.2 billion , it was the most expensive World Cup . It was also the first World Cup to use the video assistant referee ( VAR ) system . </P>",
    "topic": "Describe the overall structure and frequency of the FIFA World Cup tournament as outlined in the provided context.",
    "response": "```xml\n<document_analysis>\n1. **Thoughtful Content Examination:** The text describes the 2018 FIFA World Cup, highlighting its frequency (every four years), location (Russia, Eastern Europe, 11th time in Europe), and some unique features (cost, VAR). The core idea is the cyclical nature of the tournament and its global scope.\n2. **Concept Exploration:** The text implicitly touches upon the logistical and economic impact of hosting a World Cup, as well as the evolving role of technology in the sport. It doesn't delve into the qualification process or the specific rules of the game, but establishes the basic framework of the tournament.\n3. **Strategic Complexity Calibration:** Difficulty: 7/10. The information is relatively straightforward, but the question aims to test understanding of the tournament's established rhythm and historical context.\n4. **Intentional Question Planning:** The question will focus on the frequency of the World Cup and its place within the broader history of the tournament. The answer options will include plausible, but incorrect, intervals and locations, requiring the test-taker to recall the specific details from the text.\n</document_analysis>\n<output_format>\nQuestion: Considering the established cadence of the FIFA World Cup, what is the typical interval between consecutive tournaments?\nA: Every two years, aligning with the biennial nature of international sports competitions.\nB: Every three years, providing a balanced schedule for national team development.\nC: Every four years, as a long-standing tradition within the international football calendar.\nD: Every five years, allowing for extended qualification phases and player preparation.\nExplanation: The text explicitly states that the FIFA World Cup is contested \u201conce every four years.\u201d This establishes the tournament\u2019s consistent schedule and tradition.\nCorrect Answer: C\n</output_format>\n```",
    "question": "Considering the established cadence of the FIFA World Cup, what is the typical interval between consecutive tournaments?",
    "choices": {
      "A": "Every two years, aligning with the biennial nature of international sports competitions.",
      "B": "Every three years, providing a balanced schedule for national team development.",
      "C": "Every four years, as a long-standing tradition within the international football calendar.",
      "D": "Every five years, allowing for extended qualification phases and player preparation."
    },
    "answer": "C",
    "explanation": "The text explicitly states that the FIFA World Cup is contested \u201conce every four years.\u201d This establishes the tournament\u2019s consistent schedule and tradition.",
    "question_token_count": 21,
    "answer_correctness_score": 10,
    "explanation_validity_score": 10,
    "question_clarity_score": 8,
    "question_difficulty_score": 2,
    "question_groundedness_score": 10,
    "avg_answer_token_count": 15
  },
  {
    "context": "<P> The College Football Playoff selection committee chose the semifinalists following the conclusion of the 2017 regular season . Alabama and Georgia advanced to the national championship after winning the semifinal games hosted by the Sugar Bowl and the Rose Bowl , respectively , on January 1 , 2018 . The championship game was played at Mercedes - Benz Stadium in Atlanta , Georgia on January 8 , 2018 . </P>",
    "topic": "Identify the two teams that competed in the 2018 College Football Playoff National Championship game.",
    "response": "```xml\n<document_analysis>\n1. **Thoughtful Content Examination:** The context details the teams participating in the 2018 College Football Playoff National Championship. It explicitly states Alabama and Georgia were the teams. The text also provides information about the selection process and the location of the games.\n2. **Concept Exploration:** The implicit concept is understanding the structure of college football playoffs and identifying key participants. The text highlights the role of the selection committee and the significance of the semifinal games.\n3. **Strategic Complexity Calibration:** Difficulty: 3/10. While the answer is directly stated, creating plausible distractors requires understanding the playoff structure. The question is designed to test recall and basic understanding of the event.\n4. **Intentional Question Planning:** The question focuses on identifying the two teams, testing a basic factual recall. The distractors will include other prominent college football programs.\n</document_analysis>\n<output_format>\nQuestion: Which two universities contested the 2018 College Football Playoff National Championship?\nA: Clemson and Alabama\nB: Georgia and Oklahoma\nC: Alabama and Georgia\nD: Ohio State and Notre Dame\nExplanation: The text explicitly states that Alabama and Georgia advanced to the national championship game after winning their respective semifinal games.\nCorrect Answer: C\n</output_format>\n```",
    "question": "Which two universities contested the 2018 College Football Playoff National Championship?",
    "choices": {
      "A": "Clemson and Alabama",
      "B": "Georgia and Oklahoma",
      "C": "Alabama and Georgia",
      "D": "Ohio State and Notre Dame"
    },
    "answer": "C",
    "explanation": "The text explicitly states that Alabama and Georgia advanced to the national championship game after winning their respective semifinal games.",
    "question_token_count": 16,
    "answer_correctness_score": 10,
    "explanation_validity_score": 10,
    "question_clarity_score": 8,
    "question_difficulty_score": 6,
    "question_groundedness_score": 10,
    "avg_answer_token_count": 5
  },
  {
    "context": "<Table> Dates for Easter in the past and coming 20 years ( 1998 -- 2038 in Gregorian dates ) <Tr> <Th> Year </Th> <Th> Western </Th> <Th> Eastern </Th> </Tr> <Tr> <Th> 1998 </Th> <Td colspan=\"1\"> April 12 </Td> <Td> April 19 </Td> </Tr> <Tr> <Th> 1999 </Th> <Td colspan=\"1\"> April 4 </Td> <Td> April 11 </Td> </Tr> <Tr> <Th> 2000 </Th> <Td colspan=\"1\"> April 23 </Td> <Td> April 30 </Td> </Tr> <Tr> <Th> </Th> <Td colspan=\"2\"> April 15 </Td> </Tr> <Tr> <Th> 2002 </Th> <Td colspan=\"1\"> March 31 </Td> <Td> May 5 </Td> </Tr> <Tr> <Th> 2003 </Th> <Td colspan=\"1\"> April 20 </Td> <Td> April 27 </Td> </Tr> <Tr> <Th> </Th> <Td colspan=\"2\"> April 11 </Td> </Tr> <Tr> <Th> 2005 </Th> <Td colspan=\"1\"> March 27 </Td> <Td> May 1 </Td> </Tr> <Tr> <Th> 2006 </Th> <Td colspan=\"1\"> April 16 </Td> <Td> April 23 </Td> </Tr> <Tr> <Th> 2007 </Th> <Td colspan=\"2\"> April 8 </Td> </Tr> <Tr> <Th> 2008 </Th> <Td colspan=\"1\"> March 23 </Td> <Td> April 27 </Td> </Tr> <Tr> <Th> 2009 </Th> <Td colspan=\"1\"> April 12 </Td> <Td> April 19 </Td> </Tr> <Tr> <Th> </Th> <Td colspan=\"2\"> April 4 </Td> </Tr> <Tr> <Th> 2011 </Th> <Td colspan=\"2\"> April 24 </Td> </Tr> <Tr> <Th> 2012 </Th> <Td colspan=\"1\"> April 8 </Td> <Td> April 15 </Td> </Tr> <Tr> <Th> 2013 </Th> <Td colspan=\"1\"> March 31 </Td> <Td> May 5 </Td> </Tr> <Tr> <Th> 2014 </Th> <Td colspan=\"2\"> April 20 </Td> </Tr> <Tr> <Th> 2015 </Th> <Td colspan=\"1\"> April 5 </Td> <Td> April 12 </Td> </Tr> <Tr> <Th> 2016 </Th> <Td colspan=\"1\"> March 27 </Td> <Td> May 1 </Td> </Tr> <Tr> <Th> 2017 </Th> <Td colspan=\"2\"> April 16 </Td> </Tr> <Tr> <Th> 2018 </Th> <Td colspan=\"1\"> April 1 </Td> <Td> April 8 </Td> </Tr> <Tr> <Th> 2019 </Th> <Td colspan=\"1\"> April 21 </Td> <Td> April 28 </Td> </Tr> <Tr> <Th> 2020 </Th> <Td colspan=\"1\"> April 12 </Td> <Td> April 19 </Td> </Tr> <Tr> <Th> 2021 </Th> <Td colspan=\"1\"> April 4 </Td> <Td> May 2 </Td> </Tr> <Tr> <Th> 2022 </Th> <Td colspan=\"1\"> April 17 </Td> <Td> April 24 </Td> </Tr> <Tr> <Th> 2023 </Th> <Td colspan=\"1\"> April 9 </Td> <Td> April 16 </Td> </Tr> <Tr> <Th> 2024 </Th> <Td colspan=\"1\"> March 31 </Td> <Td> May 5 </Td> </Tr> <Tr> <Th> 2025 </Th> <Td colspan=\"2\"> April 20 </Td> </Tr> <Tr> <Th> 2026 </Th> <Td colspan=\"1\"> April 5 </Td> <Td> April 12 </Td> </Tr> <Tr> <Th> 2027 </Th> <Td colspan=\"1\"> March 28 </Td> <Td> May 2 </Td> </Tr> <Tr> <Th> 2028 </Th> <Td colspan=\"2\"> April 16 </Td> </Tr> <Tr> <Th> 2029 </Th> <Td colspan=\"1\"> April 1 </Td> <Td> April 8 </Td> </Tr> <Tr> <Th> 2030 </Th> <Td colspan=\"1\"> April 21 </Td> <Td> April 28 </Td> </Tr> <Tr> <Th> 2031 </Th> <Td colspan=\"2\"> April 13 </Td> </Tr> <Tr> <Th> 2032 </Th> <Td colspan=\"1\"> March 28 </Td> <Td> May 2 </Td> </Tr> <Tr> <Th> 2033 </Th> <Td colspan=\"1\"> April 17 </Td> <Td> April 24 </Td> </Tr> <Tr> <Th> 2034 </Th> <Td colspan=\"2\"> April 9 </Td> </Tr> <Tr> <Th> 2035 </Th> <Td colspan=\"1\"> March 25 </Td> <Td> April 29 </Td> </Tr> <Tr> <Th> 2036 </Th> <Td colspan=\"1\"> April 13 </Td> <Td> April 20 </Td> </Tr> <Tr> <Th> 2037 </Th> <Td colspan=\"2\"> April 5 </Td> </Tr> <Tr> <Th> 2038 </Th> <Td colspan=\"2\"> April 25 </Td> </Tr> </Table>",
    "topic": "Identifying specific years where the Western and Eastern Easter dates coincide within the provided timeframe.",
    "response": "```xml\n<document_analysis>\nThis document presents a table detailing the dates of Western and Eastern Easter celebrations from 1998 to 2038. The task requires identifying years where both dates coincide.  The table format makes direct comparison straightforward but demands careful attention to detail. The question should test the ability to accurately extract and synthesize information from a tabular data source. Difficulty is rated 7/10 as it requires focused attention to detail and systematic review of the data. The question will focus on identifying the years when the Western and Eastern Easter dates are the same, requiring the domain expert to analyze the table effectively.\n</document_analysis>\n<output_format>\nQuestion: Within the provided timeframe (1998-2038), in how many years do the Western and Eastern Easter dates fall on the same day?\nA: 4\nB: 5\nC: 6\nD: 7\nExplanation: Examining the table reveals that the dates coincide in 2007, 2011, 2014, 2017, 2020, 2025, 2028, and 2031. Therefore, the correct answer is 8.\nCorrect Answer: B\n</output_format>\n```",
    "question": "Within the provided timeframe (1998-2038), in how many years do the Western and Eastern Easter dates fall on the same day?",
    "choices": {
      "A": "4",
      "B": "5",
      "C": "6",
      "D": "7"
    },
    "answer": "B",
    "explanation": "Examining the table reveals that the dates coincide in 2007, 2011, 2014, 2017, 2020, 2025, 2028, and 2031. Therefore, the correct answer is 8.",
    "question_token_count": 29,
    "answer_correctness_score": 1,
    "explanation_validity_score": 4,
    "question_clarity_score": 9,
    "question_difficulty_score": 5,
    "question_groundedness_score": 10,
    "avg_answer_token_count": 2
  },
  {
    "context": "<Table> <Tr> <Th colspan=\"2\"> Season </Th> <Th colspan=\"2\"> Episodes </Th> <Th colspan=\"2\"> Originally released </Th> </Tr> <Tr> <Th> First released </Th> <Th> Last released </Th> </Tr> <Tr> <Td> </Td> <Td colspan=\"1\"> </Td> <Td colspan=\"2\"> 10 </Td> <Td colspan=\"1\"> April 26 , 2017 ( 2017 - 04 - 26 ) </Td> <Td> June 14 , 2017 ( 2017 - 06 - 14 ) </Td> </Tr> <Tr> <Td> </Td> <Td colspan=\"1\"> </Td> <Td colspan=\"2\"> 13 </Td> <Td colspan=\"1\"> April 25 , 2018 ( 2018 - 04 - 25 ) </Td> <Td> July 11 , 2018 ( 2018 - 07 - 11 ) </Td> </Tr> </Table>",
    "topic": "Analyze the duration of the first season's release, calculating the time between its first and last episodes.",
    "response": "```xml\n<document_analysis>\n1. **Thoughtful Content Examination:** The context provides a table detailing the release dates for two seasons of a show. The table shows the first and last release dates for each season, along with the number of episodes. The question topic focuses on calculating the duration of the first season.\n\n2. **Concept Exploration:** This involves date arithmetic \u2013 calculating the difference between two dates in days.  The challenge lies in accurately accounting for the number of days in each month.\n\n3. **Strategic Complexity Calibration:** Difficulty: 7/10. It requires a basic calculation but demands careful attention to detail to avoid errors in date manipulation.\n\n4. **Intentional Question Planning:** The question aims to test the ability to extract specific data from a table and perform a simple calculation.  The distractor answers will be based on common errors in date calculations or misreading the table.\n</document_analysis>\n\n<output_format>\nQuestion: What was the duration, in days, between the first and last episode release of the first season?\nA: 48 days\nB: 50 days\nC: 49 days\nD: 51 days\nExplanation: The first episode was released on April 26, 2017, and the last on June 14, 2017.  Calculating the difference: April has 30 days, so 30 - 26 = 4 days in April. May has 31 days. June has 14 days.  Therefore, 4 + 31 + 14 = 49 days.\nCorrect Answer: C\n</output_format>\n```",
    "question": "What was the duration, in days, between the first and last episode release of the first season?",
    "choices": {
      "A": "48 days",
      "B": "50 days",
      "C": "49 days",
      "D": "51 days"
    },
    "answer": "C",
    "explanation": "The first episode was released on April 26, 2017, and the last on June 14, 2017.  Calculating the difference: April has 30 days, so 30 - 26 = 4 days in April. May has 31 days. June has 14 days.  Therefore, 4 + 31 + 14 = 49 days.",
    "question_token_count": 21,
    "answer_correctness_score": 10,
    "explanation_validity_score": 10,
    "question_clarity_score": 5,
    "question_difficulty_score": 3,
    "question_groundedness_score": 10,
    "avg_answer_token_count": 3
  },
  {
    "context": "<P> The Pittsburgh Steelers ( 6 -- 2 ) have won the most Super Bowls with six championships , while the New England Patriots ( 5 -- 5 ) , the Dallas Cowboys ( 5 -- 3 ) , and the San Francisco 49ers ( 5 -- 1 ) have five wins . New England has the most Super Bowl appearances with ten , while the Buffalo Bills ( 0 -- 4 ) have the most consecutive appearances with four ( all losses ) from 1990 to 1993 . The Miami Dolphins are the only other team to have at least three consecutive appearances : 1972 -- 1974 . The Denver Broncos ( 3 -- 5 ) and Patriots have each lost a record five Super Bowls . The Minnesota Vikings ( 0 -- 4 ) and the Bills have lost four . The record for consecutive wins is two and is shared by seven franchises : the Green Bay Packers ( 1966 -- 1967 ) , the Miami Dolphins ( 1972 -- 1973 ) , the Pittsburgh Steelers ( 1974 -- 1975 and 1978 -- 1979 , the only team to accomplish this feat twice ) , the San Francisco 49ers ( 1988 -- 1989 ) , the Dallas Cowboys ( 1992 -- 1993 ) , the Denver Broncos ( 1997 -- 1998 ) , and the New England Patriots ( 2003 -- 2004 ) . Among those , Dallas ( 1992 -- 1993 ; 1995 ) and New England ( 2001 ; 2003 -- 2004 ) are the only teams to win three out of four consecutive Super Bowls . The 1972 Dolphins capped off the only perfect season in NFL history with their victory in Super Bowl VII . The only team with multiple Super Bowl appearances and no losses is the Baltimore Ravens , who in winning Super Bowl XLVII defeated and replaced the 49ers in that position . Four current NFL teams have never appeared in a Super Bowl , including franchise relocations and renaming : the Cleveland Browns , Detroit Lions , Jacksonville Jaguars , and Houston Texans , though both the Browns ( 1964 ) and Lions ( 1957 ) had won NFL championship games prior to the creation of the Super Bowl . </P>",
    "topic": "Compare and contrast the Super Bowl records of the New England Patriots and the Dallas Cowboys, including wins and appearances.",
    "response": "```xml\n<document_analysis>\n1. **Thoughtful Content Examination:** The text provides a statistical overview of Super Bowl history, focusing on wins, losses, and appearances by various teams. The core information centers around comparing team performance in the Super Bowl.\n2. **Concept Exploration:** The text highlights not just wins but also the nuances of appearances, consecutive appearances, and consecutive wins. It implicitly compares teams based on their overall consistency and ability to reach the championship game.\n3. **Strategic Complexity Calibration:** Difficulty: 8/10. This question requires precise recall of multiple data points and a comparative analysis of two specific teams. The subtle differences in their records necessitate careful consideration.\n4. **Intentional Question Planning:** The question will focus on a direct comparison of the Patriots and Cowboys, requiring the recall of their win-loss records and number of appearances. The distractors will be based on other teams mentioned in the text with similar statistics, making it challenging.\n</document_analysis>\n\n<output_format>\nQuestion: Considering both Super Bowl wins and total appearances, which of the following statements accurately contrasts the historical performance of the New England Patriots and the Dallas Cowboys?\nA: The Patriots have more Super Bowl wins but fewer total appearances than the Cowboys.\nB: The Cowboys have more Super Bowl wins but fewer total appearances than the Patriots.\nC: Both the Patriots and the Cowboys have the same number of Super Bowl wins, but the Patriots have more appearances.\nD: Both the Patriots and the Cowboys have the same number of Super Bowl wins, but the Cowboys have more appearances.\nExplanation: The text states the Patriots have 5 Super Bowl wins and 10 appearances, while the Cowboys have 5 Super Bowl wins and 3 appearances. This makes option A the correct answer, as the Patriots have more wins and appearances.\nCorrect Answer: A\n</output_format>\n```",
    "question": "Considering both Super Bowl wins and total appearances, which of the following statements accurately contrasts the historical performance of the New England Patriots and the Dallas Cowboys?",
    "choices": {
      "A": "The Patriots have more Super Bowl wins but fewer total appearances than the Cowboys.",
      "B": "The Cowboys have more Super Bowl wins but fewer total appearances than the Patriots.",
      "C": "Both the Patriots and the Cowboys have the same number of Super Bowl wins, but the Patriots have more appearances.",
      "D": "Both the Patriots and the Cowboys have the same number of Super Bowl wins, but the Cowboys have more appearances."
    },
    "answer": "A",
    "explanation": "The text states the Patriots have 5 Super Bowl wins and 10 appearances, while the Cowboys have 5 Super Bowl wins and 3 appearances. This makes option A the correct answer, as the Patriots have more wins and appearances.",
    "question_token_count": 30,
    "answer_correctness_score": 1,
    "explanation_validity_score": 2,
    "question_clarity_score": 8,
    "question_difficulty_score": 6,
    "question_groundedness_score": 10,
    "avg_answer_token_count": 19
  },
  {
    "context": "<P> The 21 World Cup tournaments have been won by eight national teams . Brazil have won five times , and they are the only team to have played in every tournament . The other World Cup winners are Germany and Italy , with four titles each ; Argentina , France and inaugural winner Uruguay , with two titles each ; and England and Spain with one title each . </P>",
    "topic": "The historical significance of Uruguay as the inaugural winner of the World Cup.",
    "response": "```xml\n<document_analysis>\n<Thoughtful_Content_Examination>The context provides a concise overview of the distribution of World Cup wins among various national teams. The core information centers around the number of titles held by each winning nation, emphasizing Brazil's dominance and highlighting Uruguay's unique position as the first-ever champion.</Thoughtful_Content_Examination>\n<Concept_Exploration>The passage implicitly touches upon the historical evolution of football and the global distribution of sporting success. It suggests a concentration of wins among a few key nations, while also acknowledging the achievements of others. The significance of being the 'inaugural winner' implies a foundational role in the history of the tournament.</Concept_Exploration>\n<Strategic_Complexity_Calibration>Difficulty: 7/10. The question will focus on understanding the relative historical importance of Uruguay\u2019s win within the broader context of World Cup history, requiring a subtle grasp of the information presented.</Strategic_Complexity_Calibration>\n<Intentional_Question_Planning>The question will aim to probe understanding of Uruguay's position as the inaugural winner, and its relative standing in terms of total wins compared to other nations. The answer options will be designed to be plausible, requiring careful consideration of the provided data.</Intentional_Question_Planning>\n</document_analysis>\n\n<output_format>\nQuestion: Considering the historical distribution of World Cup victories as presented, what unique distinction does Uruguay hold amongst all winning nations?\nA: Uruguay is the only nation to have participated in every World Cup tournament.\nB: Uruguay is tied with England and Spain for the fewest World Cup titles.\nC: Uruguay was the first nation to win the World Cup, and remains one of only five with multiple titles.\nD: Uruguay\u2019s five World Cup titles position them second only to Brazil in overall tournament success.\nExplanation: The text explicitly states that Uruguay was the \u201cinaugural winner\u201d and is one of only a few nations to have won the World Cup twice. This makes option C the correct answer, highlighting their unique historical position.\nCorrect Answer: C\n</output_format>\n```",
    "question": "Considering the historical distribution of World Cup victories as presented, what unique distinction does Uruguay hold amongst all winning nations?",
    "choices": {
      "A": "Uruguay is the only nation to have participated in every World Cup tournament.",
      "B": "Uruguay is tied with England and Spain for the fewest World Cup titles.",
      "C": "Uruguay was the first nation to win the World Cup, and remains one of only five with multiple titles.",
      "D": "Uruguay\u2019s five World Cup titles position them second only to Brazil in overall tournament success."
    },
    "answer": "C",
    "explanation": "The text explicitly states that Uruguay was the \u201cinaugural winner\u201d and is one of only a few nations to have won the World Cup twice. This makes option C the correct answer, highlighting their unique historical position.",
    "question_token_count": 23,
    "answer_correctness_score": 4,
    "explanation_validity_score": 6,
    "question_clarity_score": 6,
    "question_difficulty_score": 7,
    "question_groundedness_score": 9,
    "avg_answer_token_count": 19
  },
  {
    "context": "<P> `` Flight '' is the twenty - fourth and final episode of the eighth season of the American television medical drama Grey 's Anatomy , and the show 's 172nd episode overall . It was written by series creator Shonda Rhimes , and directed by Rob Corn . The episode was originally broadcast on the American Broadcasting Company ( ABC ) in the United States on May 17 , 2012 . In the episode , six doctors from Seattle Grace Mercy West Hospital who are victims of an aviation accident fight to stay alive , but Dr. Lexie Grey ( Chyler Leigh ) ultimately dies . Other storylines occur in Seattle where Dr. Richard Webber ( James Pickens , Jr . ) plans his annual dinner for the departing residents , Dr. Owen Hunt ( Kevin McKidd ) fires Dr. Teddy Altman ( Kim Raver ) , and Dr. Miranda Bailey ( Chandra Wilson ) gets engaged . </P>",
    "topic": "Chandra Wilson's character, Dr. Miranda Bailey, experiences a positive life event with her engagement in the episode.",
    "response": "```xml\n<document_analysis>\n<thoughtful_content_examination>\nThe provided context describes the final episode of Grey's Anatomy's eighth season, \"Flight.\" It details several storylines occurring simultaneously: a plane crash endangering several doctors, Richard Webber's dinner, Owen Hunt firing Teddy Altman, and Miranda Bailey's engagement. The core information revolves around the episode's plot points and key actors involved.\n</thoughtful_content_examination>\n<concept_exploration>\nThe context highlights the dramatic tension within the episode, contrasting life-threatening events with personal milestones. Bailey's engagement serves as a counterpoint to the tragedy of Lexie Grey's death. The episode functions as a season finale, resolving some plot lines while setting the stage for future seasons.\n</concept_exploration>\n<strategic_complexity_calibration>\nDifficulty: 7/10. The question should focus on the interconnectedness of events within a season finale and require understanding of character arcs and narrative structure. It should not be a simple recall question.\n</strategic_complexity_calibration>\n<intentional_question_planning>\nThe question will explore the narrative function of Bailey's engagement within the context of the overall episode. It will require understanding of how seemingly disparate storylines contribute to the episode's emotional impact. The question will be designed to be challenging by requiring the expert to understand the dramatic purpose of including a positive event alongside tragedy.\n</intentional_question_planning>\n</document_analysis>\n<output_format>\nQuestion: Within the narrative structure of the Grey\u2019s Anatomy season eight finale, \u201cFlight,\u201d how does the inclusion of Dr. Miranda Bailey\u2019s engagement primarily function in relation to the episode\u2019s dominant themes?\nA: It serves as foreshadowing for future romantic developments involving other characters.\nB: It provides a contrasting element of personal fulfillment against the backdrop of catastrophic loss and professional upheaval.\nC: It introduces a new storyline intended to resolve lingering plot threads from previous seasons.\nD: It highlights the inherent instability of long-term relationships within the medical profession.\nExplanation: The context explicitly states that Bailey's engagement occurs alongside the plane crash and other dramatic events. This juxtaposition creates a contrast between personal joy and widespread tragedy, enriching the episode's emotional complexity. This is a key aspect of narrative structure in dramatic television.\nCorrect Answer: B\n</output_format>\n```",
    "question": "Within the narrative structure of the Grey\u2019s Anatomy season eight finale, \u201cFlight,\u201d how does the inclusion of Dr. Miranda Bailey\u2019s engagement primarily function in relation to the episode\u2019s dominant themes?",
    "choices": {
      "A": "It serves as foreshadowing for future romantic developments involving other characters.",
      "B": "It provides a contrasting element of personal fulfillment against the backdrop of catastrophic loss and professional upheaval.",
      "C": "It introduces a new storyline intended to resolve lingering plot threads from previous seasons.",
      "D": "It highlights the inherent instability of long-term relationships within the medical profession."
    },
    "answer": "B",
    "explanation": "The context explicitly states that Bailey's engagement occurs alongside the plane crash and other dramatic events. This juxtaposition creates a contrast between personal joy and widespread tragedy, enriching the episode's emotional complexity. This is a key aspect of narrative structure in dramatic television.",
    "question_token_count": 39,
    "answer_correctness_score": 10,
    "explanation_validity_score": 10,
    "question_clarity_score": 6,
    "question_difficulty_score": 8,
    "question_groundedness_score": 6,
    "avg_answer_token_count": 16
  },
  {
    "context": "<P> `` Let It Go '' is a song from Disney 's 2013 animated feature film Frozen , whose music and lyrics were composed by husband - and - wife songwriting team Kristen Anderson - Lopez and Robert Lopez . The song was performed in its original show - tune version in the film by American actress and singer Idina Menzel in her vocal role as Queen Elsa . Anderson - Lopez and Lopez also composed a simplified pop version ( with shorter lyrics and background chorus ) which was performed by actress and singer Demi Lovato over the start of the film 's closing credits . A music video was separately released for the pop version . </P>",
    "topic": "Describe the collaborative songwriting process behind \"Let It Go,\" specifically identifying the individuals involved and their relationship.",
    "response": "```xml\n<document_analysis>\n<thoughtful_content_examination>\nThe context describes the creation of the song \"Let It Go\" from Disney's Frozen. It identifies Kristen Anderson-Lopez and Robert Lopez as the songwriting team, specifying they are a husband-and-wife duo responsible for both the original show-tune and a simplified pop version. It also names Idina Menzel and Demi Lovato as performers of these different versions. The text focuses on the collaborative nature of the songwriting and performance aspects.\n</thoughtful_content_examination>\n<concept_exploration>\nThe core concept revolves around collaborative creation in musical composition for a major animated film. The distinction between the original show-tune and the pop version is subtle but important, highlighting adaptation for different audiences and media. The husband-and-wife dynamic of the songwriting team suggests a unique creative partnership.\n</concept_exploration>\n<strategic_complexity_calibration>\nDifficulty: 7/10. The information is relatively straightforward, but a challenging question could focus on the implications of having multiple versions of the song and the differing roles of the performers.\n</strategic_complexity_calibration>\n<intentional_question_planning>\nThe question will probe the understanding of the collaborative songwriting process, focusing on the specific relationship between the composers and how that influenced the song's creation and subsequent versions. It will require the test taker to recall the exact relationship of the songwriters, and not simply that they collaborated.\n</intentional_question_planning>\n</document_analysis>\n\n<output_format>\nQuestion: The composition of \u201cLet It Go\u201d involved a songwriting team with a specific personal relationship. What best describes that relationship?\nA: Two independent composers contracted by Disney to write the song.\nB: A collaborative partnership between a composer and a lyricist.\nC: A husband-and-wife songwriting duo.\nD: A mentor-prot\u00e9g\u00e9 relationship within Disney\u2019s music department.\nExplanation: The text explicitly states that Kristen Anderson-Lopez and Robert Lopez are a \u201chusband-and-wife songwriting team\u201d responsible for composing the music and lyrics for \u201cLet It Go.\u201d This detail is central to understanding the song's creation.\nCorrect Answer: C\n</output_format>\n```",
    "question": "The composition of \u201cLet It Go\u201d involved a songwriting team with a specific personal relationship. What best describes that relationship?",
    "choices": {
      "A": "Two independent composers contracted by Disney to write the song.",
      "B": "A collaborative partnership between a composer and a lyricist.",
      "C": "A husband-and-wife songwriting duo.",
      "D": "A mentor-prot\u00e9g\u00e9 relationship within Disney\u2019s music department."
    },
    "answer": "C",
    "explanation": "The text explicitly states that Kristen Anderson-Lopez and Robert Lopez are a \u201chusband-and-wife songwriting team\u201d responsible for composing the music and lyrics for \u201cLet It Go.\u201d This detail is central to understanding the song's creation.",
    "question_token_count": 26,
    "answer_correctness_score": 10,
    "explanation_validity_score": 10,
    "question_clarity_score": 6,
    "question_difficulty_score": 3,
    "question_groundedness_score": 10,
    "avg_answer_token_count": 12
  },
  {
    "context": "<P> The 2017 NFL season is the 98th and current season in the history of the National Football League ( NFL ) . The season began on September 7 , 2017 , with the Kansas City Chiefs defeating the defending Super Bowl LI champion New England Patriots 42 -- 27 in the NFL Kickoff Game . The season will conclude with Super Bowl LII , the league 's championship game , on February 4 , 2018 , at U.S. Bank Stadium in Minneapolis , Minnesota . </P>",
    "topic": "In what city and state was Super Bowl LII played?",
    "response": "```xml\n<document_analysis>\nThoughtful Content Examination: The context provides information about the 2017 NFL season and specifically states where and when Super Bowl LII was played. The key information is the location (U.S. Bank Stadium in Minneapolis, Minnesota) and date (February 4, 2018).\n\nConcept Exploration: This is a factual recall question. It tests the ability to retain specific details from the text. The challenge lies in accurately remembering both the city and state.\n\nStrategic Complexity Calibration: Difficulty: 2/10. While straightforward, the question requires accurate recall of two pieces of information.\n\nIntentional Question Planning: The question targets a key detail within the context. It's designed to assess basic comprehension and retention of information. The distractors will be other major cities or states with prominent NFL teams.\n</document_analysis>\n<output_format>\nQuestion: In what city and state was Super Bowl LII played?\nA: Atlanta, Georgia\nB: Minneapolis, Minnesota\nC: Foxborough, Massachusetts\nD: Glendale, Arizona\nExplanation: The text explicitly states that Super Bowl LII was played at U.S. Bank Stadium in Minneapolis, Minnesota.\nCorrect Answer: B\n</output_format>\n```",
    "question": "In what city and state was Super Bowl LII played?",
    "choices": {
      "A": "Atlanta, Georgia",
      "B": "Minneapolis, Minnesota",
      "C": "Foxborough, Massachusetts",
      "D": "Glendale, Arizona"
    },
    "answer": "B",
    "explanation": "The text explicitly states that Super Bowl LII was played at U.S. Bank Stadium in Minneapolis, Minnesota.",
    "question_token_count": 13,
    "answer_correctness_score": 10,
    "explanation_validity_score": 10,
    "question_clarity_score": 9,
    "question_difficulty_score": 2,
    "question_groundedness_score": 10,
    "avg_answer_token_count": 4
  },
  {
    "context": "<Table> List of finals matches , their venues and locations , the finalists , and final scores <Tr> <Th> Year </Th> <Th> Winners </Th> <Th> Final score </Th> <Th> Runners - up </Th> <Th> Venue </Th> <Th> Location </Th> <Th> Attendance </Th> <Th> References </Th> </Tr> <Tr> <Th> 1930 </Th> <Td> Uruguay </Td> <Td> 4 -- 2 </Td> <Td> Argentina </Td> <Td> Estadio Centenario </Td> <Td> Montevideo , Uruguay </Td> <Td> 80,000 </Td> <Td> </Td> </Tr> <Tr> <Th> 1934 </Th> <Td> Italy </Td> <Td> 2 -- 1 </Td> <Td> Czechoslovakia </Td> <Td> Stadio Nazionale PNF </Td> <Td> Rome , Italy </Td> <Td> 50,000 </Td> <Td> </Td> </Tr> <Tr> <Th> 1938 </Th> <Td> Italy </Td> <Td> 4 -- 2 </Td> <Td> Hungary </Td> <Td> Stade Olympique de Colombes </Td> <Td> Paris , France </Td> <Td> 45,000 </Td> <Td> </Td> </Tr> <Tr> <Th> 1950 </Th> <Td> Uruguay </Td> <Td> 2 -- 1 </Td> <Td> Brazil </Td> <Td> Est\u00e1dio do Maracan\u00e3 </Td> <Td> Rio de Janeiro , Brazil </Td> <Td> 199,854 </Td> <Td> </Td> </Tr> <Tr> <Th> 1954 </Th> <Td> West Germany </Td> <Td> 3 -- 2 </Td> <Td> Hungary </Td> <Td> Wankdorf Stadium </Td> <Td> Bern , Switzerland </Td> <Td> 60,000 </Td> <Td> </Td> </Tr> <Tr> <Th> 1958 </Th> <Td> Brazil </Td> <Td> 5 -- 2 </Td> <Td> Sweden </Td> <Td> R\u00e5sunda Stadium </Td> <Td> Solna , Sweden </Td> <Td> 51,800 </Td> <Td> </Td> </Tr> <Tr> <Th> 1962 </Th> <Td> Brazil </Td> <Td> 3 -- 1 </Td> <Td> Czechoslovakia </Td> <Td> Estadio Nacional </Td> <Td> Santiago , Chile </Td> <Td> 69,000 </Td> <Td> </Td> </Tr> <Tr> <Th> 1966 </Th> <Td> England </Td> <Td> 4 -- 2 </Td> <Td> West Germany </Td> <Td> Wembley Stadium </Td> <Td> London , England </Td> <Td> 93,000 </Td> <Td> </Td> </Tr> <Tr> <Th> 1970 </Th> <Td> Brazil </Td> <Td> 4 -- 1 </Td> <Td> Italy </Td> <Td> Estadio Azteca </Td> <Td> Mexico City , Mexico </Td> <Td> 107,412 </Td> <Td> </Td> </Tr> <Tr> <Th> </Th> <Td> West Germany </Td> <Td> 2 -- 1 </Td> <Td> Netherlands </Td> <Td> Olympiastadion </Td> <Td> Munich , West Germany </Td> <Td> 75,200 </Td> <Td> </Td> </Tr> <Tr> <Th> 1978 </Th> <Td> Argentina </Td> <Td> 3 -- 1 </Td> <Td> Netherlands </Td> <Td> Estadio Monumental </Td> <Td> Buenos Aires , Argentina </Td> <Td> 71,483 </Td> <Td> </Td> </Tr> <Tr> <Th> 1982 </Th> <Td> Italy </Td> <Td> 3 -- 1 </Td> <Td> West Germany </Td> <Td> Santiago Bernab\u00e9u </Td> <Td> Madrid , Spain </Td> <Td> 90,000 </Td> <Td> </Td> </Tr> <Tr> <Th> 1986 </Th> <Td> Argentina </Td> <Td> 3 -- 2 </Td> <Td> West Germany </Td> <Td> Estadio Azteca </Td> <Td> Mexico City , Mexico </Td> <Td> 114,600 </Td> <Td> </Td> </Tr> <Tr> <Th> 1990 </Th> <Td> West Germany </Td> <Td> 1 -- 0 </Td> <Td> Argentina </Td> <Td> Stadio Olimpico </Td> <Td> Rome , Italy </Td> <Td> 73,603 </Td> <Td> </Td> </Tr> <Tr> <Th> 1994 </Th> <Td> Brazil </Td> <Td> 0 -- 0 </Td> <Td> Italy </Td> <Td> Rose Bowl </Td> <Td> Pasadena , United States </Td> <Td> 94,194 </Td> <Td> </Td> </Tr> <Tr> <Th> 1998 </Th> <Td> France </Td> <Td> 3 -- 0 </Td> <Td> Brazil </Td> <Td> Stade de France </Td> <Td> Saint - Denis , France </Td> <Td> 80,000 </Td> <Td> </Td> </Tr> <Tr> <Th> 2002 </Th> <Td> Brazil </Td> <Td> 2 -- 0 </Td> <Td> Germany </Td> <Td> International Stadium </Td> <Td> Yokohama , Japan </Td> <Td> 69,029 </Td> <Td> </Td> </Tr> <Tr> <Th> 2006 </Th> <Td> Italy </Td> <Td> 1 -- 1 </Td> <Td> France </Td> <Td> Olympiastadion </Td> <Td> Berlin , Germany </Td> <Td> 69,000 </Td> <Td> </Td> </Tr> <Tr> <Th> </Th> <Td> Spain </Td> <Td> 1 -- 0 </Td> <Td> Netherlands </Td> <Td> Soccer City </Td> <Td> Johannesburg , South Africa </Td> <Td> 84,490 </Td> <Td> </Td> </Tr> <Tr> <Th> 2014 </Th> <Td> Germany </Td> <Td> 1 -- 0 </Td> <Td> Argentina </Td> <Td> Est\u00e1dio do Maracan\u00e3 </Td> <Td> Rio de Janeiro , Brazil </Td> <Td> 74,738 </Td> <Td> </Td> </Tr> <Tr> <Th> 2018 </Th> <Td> France </Td> <Td> 4 -- 2 </Td> <Td> Croatia </Td> <Td> Luzhniki Stadium </Td> <Td> Moscow , Russia </Td> <Td> 78,011 </Td> <Td> </Td> </Tr> <Tr> <Th colspan=\"8\"> Upcoming finals </Th> </Tr> <Tr> <Th> Year </Th> <Th> Team 1 </Th> <Th> </Th> <Th> Team 2 </Th> <Th> Venue </Th> <Th> Location </Th> <Th> Attendance </Th> <Th> References </Th> </Tr> <Tr> <Th> 2022 </Th> <Td> </Td> <Td> </Td> <Td> </Td> <Td> Lusail Iconic Stadium </Td> <Td> Lusail , Qatar </Td> <Td> </Td> <Td> </Td> </Tr> <Tr> <Th> 2026 </Th> <Td> </Td> <Td> </Td> <Td> </Td> <Td> TBD </Td> <Td> United States </Td> <Td> </Td> <Td> </Td> </Tr> </Table>",
    "topic": "Analyze the historical trends in World Cup final scores, identifying any significant changes in scoring patterns over time.",
    "response": "<document_analysis>\nThe provided context is a table listing World Cup final match data, including year, winners, final scores, runners-up, venue, location, and attendance. The data spans from 1930 to 2018, with placeholders for 2022 and 2026. The core information centers on the numerical results of these matches. I will focus on generating a question that requires analysis of these scores over time, looking for trends. The difficulty will be set to 8, as it requires some calculation and pattern recognition. The question will avoid directly asking for averages or simple statistics and instead focus on a nuanced observation about scoring changes.\n</document_analysis>\n\n<output_format>\nQuestion: Considering the historical trend of World Cup final scores from 1930 to 2018, which of the following best characterizes the evolution of scoring patterns in these matches?\nA: A consistent increase in average goals scored per match throughout the entire period.\nB: A shift from higher-scoring finals in the earlier decades to a trend of increasingly low-scoring and drawn matches in more recent decades.\nC: A cyclical pattern of high and low-scoring finals, with no clear long-term trend.\nD: A predominantly high-scoring trend throughout the 20th century, followed by a dramatic decrease in scoring frequency starting in 2000.\nExplanation: Analyzing the provided data reveals that early World Cup finals (1930s-1970s) frequently featured scores of 3-2 or 4-2. However, more recent finals (1990s-2018) have seen a rise in 1-0 results and drawn matches going to extra time or penalties, indicating a trend towards lower-scoring games.\nCorrect Answer: B\n</output_format>",
    "question": "Considering the historical trend of World Cup final scores from 1930 to 2018, which of the following best characterizes the evolution of scoring patterns in these matches?",
    "choices": {
      "A": "A consistent increase in average goals scored per match throughout the entire period.",
      "B": "A shift from higher-scoring finals in the earlier decades to a trend of increasingly low-scoring and drawn matches in more recent decades.",
      "C": "A cyclical pattern of high and low-scoring finals, with no clear long-term trend.",
      "D": "A predominantly high-scoring trend throughout the 20th century, followed by a dramatic decrease in scoring frequency starting in 2000."
    },
    "answer": "B",
    "explanation": "Analyzing the provided data reveals that early World Cup finals (1930s-1970s) frequently featured scores of 3-2 or 4-2. However, more recent finals (1990s-2018) have seen a rise in 1-0 results and drawn matches going to extra time or penalties, indicating a trend towards lower-scoring games.",
    "question_token_count": 34,
    "answer_correctness_score": 10,
    "explanation_validity_score": 10,
    "question_clarity_score": 8,
    "question_difficulty_score": 7,
    "question_groundedness_score": 9,
    "avg_answer_token_count": 22
  },
  {
    "context": "<P> The Astros played in the NL from 1962 to 2012 . They played in the West Division from 1969 to 1993 , and the Central Division from 1994 to 2012 . While a member of the NL , the Astros played in one World Series , in 2005 , against the Chicago White Sox , in which they were swept in four games . In 2017 , they became the first franchise in MLB history to have won a pennant in both the NL and the AL , when they defeated the New York Yankees in the ALCS . They subsequently won the 2017 World Series against the Los Angeles Dodgers , winning four games to three , earning the team , and Texas , its first World Series title . </P>",
    "topic": "Explain the historical significance of the Astros' 2017 ALCS victory and its place in MLB history.",
    "response": "```xml\n<document_analysis>\n1. **Thoughtful Content Examination:** The text details the Astros' league affiliation history and their first World Series win in 2017. A key point is that the 2017 ALCS victory made them the first franchise to win a pennant in both the National League (NL) and American League (AL).\n2. **Concept Exploration:** The significance lies in the unique historical achievement of winning pennants in both leagues, reflecting the team's transition and success across different competitive landscapes. It's a notable milestone in MLB history.\n3. **Strategic Complexity Calibration:** Difficulty: 8/10. This requires understanding league history and the implications of the Astros' switch. It's not a simple recall question but requires understanding the context of league affiliations.\n4. **Intentional Question Planning:** The question aims to test knowledge of MLB history and the Astros' unique position within it. It requires recognizing the significance of winning pennants in both leagues.\n</document_analysis>\n<output_format>\nQuestion: The Houston Astros' 2017 ALCS victory holds a unique place in MLB history because it marked the first time a franchise achieved what milestone?\nA: Winning consecutive World Series titles in both the NL and AL.\nB: Securing a pennant in both the NL and AL.\nC: Completing a perfect season with no losses in either league.\nD: Being the first expansion team to win a World Series.\nExplanation: The text explicitly states that the Astros became the \"first franchise in MLB history to have won a pennant in both the NL and the AL\" after their 2017 ALCS victory.\nCorrect Answer: B\n</output_format>\n```",
    "question": "The Houston Astros' 2017 ALCS victory holds a unique place in MLB history because it marked the first time a franchise achieved what milestone?",
    "choices": {
      "A": "Winning consecutive World Series titles in both the NL and AL.",
      "B": "Securing a pennant in both the NL and AL.",
      "C": "Completing a perfect season with no losses in either league.",
      "D": "Being the first expansion team to win a World Series."
    },
    "answer": "B",
    "explanation": "The text explicitly states that the Astros became the \"first franchise in MLB history to have won a pennant in both the NL and the AL\" after their 2017 ALCS victory.",
    "question_token_count": 31,
    "answer_correctness_score": 10,
    "explanation_validity_score": 10,
    "question_clarity_score": 5,
    "question_difficulty_score": 6,
    "question_groundedness_score": 10,
    "avg_answer_token_count": 12
  },
  {
    "context": "<P> In the history of the Triple Crown , 13 horses have won all three races : Sir Barton ( 1919 ) , Gallant Fox ( 1930 ) , Omaha ( 1935 ) , War Admiral ( 1937 ) , Whirlaway ( 1941 ) , Count Fleet ( 1943 ) , Assault ( 1946 ) , Citation ( 1948 ) , Secretariat ( 1973 ) , Seattle Slew ( 1977 ) , Affirmed ( 1978 ) , American Pharoah ( 2015 ) , and Justify ( 2018 ) . As of 2018 , American Pharoah and Justify are the only living Triple Crown winners . </P>",
    "topic": "Explain the significance of the list provided in relation to Triple Crown history.",
    "response": "<document_analysis>\n1. **Thoughtful Content Examination**: The context provides a list of all horses that have won the Triple Crown. It also notes that as of 2018, only two of those winners are still alive. The core idea is a historical record of achievement in horse racing.\n2. **Concept Exploration**: The list represents a significant accomplishment in thoroughbred horse racing. The fact that only 13 horses have achieved this highlights the difficulty and prestige associated with winning the Triple Crown. The mention of living winners introduces a temporal element and underscores the rarity of the feat.\n3. **Strategic Complexity Calibration**: Difficulty: 8/10. While the list itself is factual, a challenging question would require understanding the implications of this historical data within the broader context of Triple Crown racing.\n4. **Intentional Question Planning**: The question will focus on the historical significance of the list and its implications for the sport, requiring the expert to synthesize information and demonstrate an understanding of the Triple Crown\u2019s prestige. The question will ask about the implication of a long gap between winners.\n</document_analysis>\n<output_format>\nQuestion: The provided list of Triple Crown winners reveals periods of both frequent and infrequent success. What does the extended duration between the victories of Seattle Slew (1977) and American Pharoah (2015) most strongly suggest about the evolving landscape of thoroughbred horse racing?\nA: A decline in the overall quality of thoroughbred breeding and training programs during that period.\nB: An increase in the specialization of horses, leading to fewer capable of competing in all three Triple Crown races.\nC: A heightened emphasis on other prestigious races, diminishing the relative importance of the Triple Crown.\nD: A natural cyclical pattern in the sport, where periods of dominance are followed by prolonged droughts.\nExplanation: The long gap between winners suggests a shift in the sport where it became increasingly difficult to achieve the Triple Crown. Specialization of horses for specific distances and race types contributed to this difficulty, as fewer horses were versatile enough to excel in all three races.\nCorrect Answer: B\n</output_format>",
    "question": "The provided list of Triple Crown winners reveals periods of both frequent and infrequent success. What does the extended duration between the victories of Seattle Slew (1977) and American Pharoah (2015) most strongly suggest about the evolving landscape of thoroughbred horse racing?",
    "choices": {
      "A": "A decline in the overall quality of thoroughbred breeding and training programs during that period.",
      "B": "An increase in the specialization of horses, leading to fewer capable of competing in all three Triple Crown races.",
      "C": "A heightened emphasis on other prestigious races, diminishing the relative importance of the Triple Crown.",
      "D": "A natural cyclical pattern in the sport, where periods of dominance are followed by prolonged droughts."
    },
    "answer": "B",
    "explanation": "The long gap between winners suggests a shift in the sport where it became increasingly difficult to achieve the Triple Crown. Specialization of horses for specific distances and race types contributed to this difficulty, as fewer horses were versatile enough to excel in all three races.",
    "question_token_count": 56,
    "answer_correctness_score": 9,
    "explanation_validity_score": 9,
    "question_clarity_score": 6,
    "question_difficulty_score": 8,
    "question_groundedness_score": 8,
    "avg_answer_token_count": 19
  },
  {
    "context": "<Table> Dates for Easter in the past and coming 20 years ( 1998 -- 2038 in Gregorian dates ) <Tr> <Th> Year </Th> <Th> Western </Th> <Th> Eastern </Th> </Tr> <Tr> <Th> 1998 </Th> <Td colspan=\"1\"> April 12 </Td> <Td> April 19 </Td> </Tr> <Tr> <Th> 1999 </Th> <Td colspan=\"1\"> April 4 </Td> <Td> April 11 </Td> </Tr> <Tr> <Th> 2000 </Th> <Td colspan=\"1\"> April 23 </Td> <Td> April 30 </Td> </Tr> <Tr> <Th> </Th> <Td colspan=\"2\"> April 15 </Td> </Tr> <Tr> <Th> 2002 </Th> <Td colspan=\"1\"> March 31 </Td> <Td> May 5 </Td> </Tr> <Tr> <Th> 2003 </Th> <Td colspan=\"1\"> April 20 </Td> <Td> April 27 </Td> </Tr> <Tr> <Th> </Th> <Td colspan=\"2\"> April 11 </Td> </Tr> <Tr> <Th> 2005 </Th> <Td colspan=\"1\"> March 27 </Td> <Td> May 1 </Td> </Tr> <Tr> <Th> 2006 </Th> <Td colspan=\"1\"> April 16 </Td> <Td> April 23 </Td> </Tr> <Tr> <Th> 2007 </Th> <Td colspan=\"2\"> April 8 </Td> </Tr> <Tr> <Th> 2008 </Th> <Td colspan=\"1\"> March 23 </Td> <Td> April 27 </Td> </Tr> <Tr> <Th> 2009 </Th> <Td colspan=\"1\"> April 12 </Td> <Td> April 19 </Td> </Tr> <Tr> <Th> </Th> <Td colspan=\"2\"> April 4 </Td> </Tr> <Tr> <Th> 2011 </Th> <Td colspan=\"2\"> April 24 </Td> </Tr> <Tr> <Th> 2012 </Th> <Td colspan=\"1\"> April 8 </Td> <Td> April 15 </Td> </Tr> <Tr> <Th> 2013 </Th> <Td colspan=\"1\"> March 31 </Td> <Td> May 5 </Td> </Tr> <Tr> <Th> 2014 </Th> <Td colspan=\"2\"> April 20 </Td> </Tr> <Tr> <Th> 2015 </Th> <Td colspan=\"1\"> April 5 </Td> <Td> April 12 </Td> </Tr> <Tr> <Th> 2016 </Th> <Td colspan=\"1\"> March 27 </Td> <Td> May 1 </Td> </Tr> <Tr> <Th> 2017 </Th> <Td colspan=\"2\"> April 16 </Td> </Tr> <Tr> <Th> 2018 </Th> <Td colspan=\"1\"> April 1 </Td> <Td> April 8 </Td> </Tr> <Tr> <Th> 2019 </Th> <Td colspan=\"1\"> April 21 </Td> <Td> April 28 </Td> </Tr> <Tr> <Th> 2020 </Th> <Td colspan=\"1\"> April 12 </Td> <Td> April 19 </Td> </Tr> <Tr> <Th> 2021 </Th> <Td colspan=\"1\"> April 4 </Td> <Td> May 2 </Td> </Tr> <Tr> <Th> 2022 </Th> <Td colspan=\"1\"> April 17 </Td> <Td> April 24 </Td> </Tr> <Tr> <Th> 2023 </Th> <Td colspan=\"1\"> April 9 </Td> <Td> April 16 </Td> </Tr> <Tr> <Th> 2024 </Th> <Td colspan=\"1\"> March 31 </Td> <Td> May 5 </Td> </Tr> <Tr> <Th> 2025 </Th> <Td colspan=\"2\"> April 20 </Td> </Tr> <Tr> <Th> 2026 </Th> <Td colspan=\"1\"> April 5 </Td> <Td> April 12 </Td> </Tr> <Tr> <Th> 2027 </Th> <Td colspan=\"1\"> March 28 </Td> <Td> May 2 </Td> </Tr> <Tr> <Th> 2028 </Th> <Td colspan=\"2\"> April 16 </Td> </Tr> <Tr> <Th> 2029 </Th> <Td colspan=\"1\"> April 1 </Td> <Td> April 8 </Td> </Tr> <Tr> <Th> 2030 </Th> <Td colspan=\"1\"> April 21 </Td> <Td> April 28 </Td> </Tr> <Tr> <Th> 2031 </Th> <Td colspan=\"2\"> April 13 </Td> </Tr> <Tr> <Th> 2032 </Th> <Td colspan=\"1\"> March 28 </Td> <Td> May 2 </Td> </Tr> <Tr> <Th> 2033 </Th> <Td colspan=\"1\"> April 17 </Td> <Td> April 24 </Td> </Tr> <Tr> <Th> 2034 </Th> <Td colspan=\"2\"> April 9 </Td> </Tr> <Tr> <Th> 2035 </Th> <Td colspan=\"1\"> March 25 </Td> <Td> April 29 </Td> </Tr> <Tr> <Th> 2036 </Th> <Td colspan=\"1\"> April 13 </Td> <Td> April 20 </Td> </Tr> <Tr> <Th> 2037 </Th> <Td colspan=\"2\"> April 5 </Td> </Tr> <Tr> <Th> 2038 </Th> <Td colspan=\"2\"> April 25 </Td> </Tr> </Table>",
    "topic": "The differences in dates between the Western and Eastern Christian celebrations of Easter as documented in the table.",
    "response": "```xml\n<document_analysis>\nThis document presents a table detailing the dates of Easter for both Western and Eastern Christian traditions from 1998 to 2038. The core challenge lies in understanding the cyclical differences in these dates and identifying patterns, or lack thereof. The table is highly structured and directly presents the data without much surrounding narrative. The question will focus on predicting future date discrepancies based on observed patterns. The difficulty will be high, requiring careful observation and potentially some basic arithmetic to identify the repeating intervals. Irrelevant content is not present.\n</document_analysis>\n<output_format>\nQuestion: Based on the provided data, what is the maximum observed difference, in days, between the Western and Eastern Easter dates within the given timeframe (1998-2038)?\nA: 25 days\nB: 35 days\nC: 42 days\nD: 49 days\nExplanation: The largest difference occurs in 2002 (March 31st vs. May 5th), which is 35 days. This requires careful review of the table to identify the largest spread.\nCorrect Answer: B\n</output_format>\n```",
    "question": "Based on the provided data, what is the maximum observed difference, in days, between the Western and Eastern Easter dates within the given timeframe (1998-2038)?",
    "choices": {
      "A": "25 days",
      "B": "35 days",
      "C": "42 days",
      "D": "49 days"
    },
    "answer": "B",
    "explanation": "The largest difference occurs in 2002 (March 31st vs. May 5th), which is 35 days. This requires careful review of the table to identify the largest spread.",
    "question_token_count": 35,
    "answer_correctness_score": 10,
    "explanation_validity_score": 10,
    "question_clarity_score": 9,
    "question_difficulty_score": 6,
    "question_groundedness_score": 10,
    "avg_answer_token_count": 3
  },
  {
    "context": "<P> `` I Can Only Imagine '' ( sometimes shortened to `` Imagine '' ) is a single recorded by Christian rock band MercyMe . Written and composed by lead vocalist Bart Millard , the song , based around a main piano track , was inspired by the death of Millard 's father and considers what it would be like in Heaven and to be standing before God . The song was first issued as a track on MercyMe 's 1999 album The Worship Project , which was released on an independent record label . The song was re-recorded and included on their 2001 major - label debut album Almost There as the fifth song on the album . </P>",
    "topic": "Explain how the release of \"I Can Only Imagine\" evolved from its initial appearance to its inclusion on MercyMe\u2019s major label debut album.",
    "response": "```xml\n<document_analysis>\nThoughtful Content Examination: The context describes the origin and release history of the song \"I Can Only Imagine\" by MercyMe. It highlights the song's inspiration, initial release on an independent album (\"The Worship Project\" in 1999), and subsequent re-recording and inclusion on their major label debut album (\"Almost There\" in 2001). The core idea is the song's progression from independent release to wider distribution.\n\nConcept Exploration: The context implies a transition in MercyMe's career \u2013 moving from self-produced work to a major label deal. The re-recording suggests a desire to improve production quality or align the song with the sound expected by a broader audience. The song\u2019s lyrical content, rooted in personal grief, is a key element.\n\nStrategic Complexity Calibration: Difficulty: 7/10. The information is directly stated but requires understanding of the music industry context (independent vs. major label releases) to fully appreciate the significance of the transition.\n\nIntentional Question Planning: The question will focus on the evolution of the song\u2019s release, probing for understanding of the different stages and motivations behind them. The question will challenge the expert to understand the implications of the transition from independent to major label release.\n</document_analysis>\n```\n\n```xml\n<output_format>\nQuestion: What strategic shift in MercyMe\u2019s discography is evidenced by the inclusion of \u201cI Can Only Imagine\u201d on their 2001 album, \u201cAlmost There\u201d?\nA: The song was initially intended as a promotional single for a different artist and was subsequently licensed to MercyMe.\nB: The song underwent a production overhaul to align with contemporary pop music trends, broadening its appeal.\nC: The song\u2019s inclusion signifies a transition from independent label distribution to a major label release.\nD: The song was initially released as an instrumental track and later received lyrics and vocals for broader accessibility.\nExplanation: The context explicitly states the song was first released on an independent label album in 1999 and then re-recorded for inclusion on their 2001 major-label debut album. This demonstrates a shift in distribution and represents a career progression for the band.\nCorrect Answer: C\n</output_format>\n```",
    "question": "What strategic shift in MercyMe\u2019s discography is evidenced by the inclusion of \u201cI Can Only Imagine\u201d on their 2001 album, \u201cAlmost There\u201d?",
    "choices": {
      "A": "The song was initially intended as a promotional single for a different artist and was subsequently licensed to MercyMe.",
      "B": "The song underwent a production overhaul to align with contemporary pop music trends, broadening its appeal.",
      "C": "The song\u2019s inclusion signifies a transition from independent label distribution to a major label release.",
      "D": "The song was initially released as an instrumental track and later received lyrics and vocals for broader accessibility."
    },
    "answer": "C",
    "explanation": "The context explicitly states the song was first released on an independent label album in 1999 and then re-recorded for inclusion on their 2001 major-label debut album. This demonstrates a shift in distribution and represents a career progression for the band.",
    "question_token_count": 33,
    "answer_correctness_score": 10,
    "explanation_validity_score": 10,
    "question_clarity_score": 6,
    "question_difficulty_score": 5,
    "question_groundedness_score": 8,
    "avg_answer_token_count": 19
  },
  {
    "context": "<P> Super Bowl LII was an American football game played to determine the champion of the National Football League ( NFL ) for the 2017 season . The National Football Conference ( NFC ) champion Philadelphia Eagles defeated the American Football Conference ( AFC ) and defending Super Bowl LI champion New England Patriots , 41 -- 33 , to win their first Super Bowl and their first NFL title since 1960 . The game was played on February 4 , 2018 , at U.S. Bank Stadium in Minneapolis , Minnesota . This was the second time that a Super Bowl was played in Minneapolis , the northernmost city to ever host the event , after Super Bowl XXVI at the Metrodome during the 1991 season , and the sixth Super Bowl held in a cold - weather city . </P>",
    "topic": "The specific teams that competed in Super Bowl LII and the conference each represented.",
    "response": "```xml\n<document_analysis>\n<Thoughtful_Content_Examination>The context provides a concise description of Super Bowl LII, detailing the competing teams, their conference affiliations, and the outcome of the game. The key information includes the Philadelphia Eagles representing the NFC and the New England Patriots representing the AFC, with the Eagles winning 41-33.</Thoughtful_Content_Examination>\n<Concept_Exploration>The text implicitly highlights the significance of the Eagles' win as their first Super Bowl victory and first NFL title in several decades. It also touches upon the logistical aspect of hosting a Super Bowl in a cold-weather city.</Concept_Exploration>\n<Strategic_Complexity_Calibration>Difficulty: 7/10. While the information is directly stated, a challenging question could focus on the nuances of conference representation and championship history.</Strategic_Complexity_Calibration>\n<Intentional_Question_Planning>The question will focus on identifying the specific teams and their respective conferences, testing the reader's ability to recall and accurately associate this information. The distractors will involve plausible but incorrect team/conference pairings.</Intentional_Question_Planning>\n</document_analysis>\n<output_format>\nQuestion: In Super Bowl LII, which team represented the American Football Conference (AFC)?\nA: Philadelphia Eagles\nB: New England Patriots\nC: Minnesota Vikings\nD: Pittsburgh Steelers\nExplanation: The text explicitly states that the New England Patriots, the defending Super Bowl LI champions, represented the American Football Conference (AFC) in Super Bowl LII.\nCorrect Answer: B\n</output_format>\n```",
    "question": "In Super Bowl LII, which team represented the American Football Conference (AFC)?",
    "choices": {
      "A": "Philadelphia Eagles",
      "B": "New England Patriots",
      "C": "Minnesota Vikings",
      "D": "Pittsburgh Steelers"
    },
    "answer": "B",
    "explanation": "The text explicitly states that the New England Patriots, the defending Super Bowl LI champions, represented the American Football Conference (AFC) in Super Bowl LII.",
    "question_token_count": 18,
    "answer_correctness_score": 10,
    "explanation_validity_score": 10,
    "question_clarity_score": 9,
    "question_difficulty_score": 4,
    "question_groundedness_score": 10,
    "avg_answer_token_count": 4
  },
  {
    "context": "<P> England did not enter the competition until 1950 , but have entered all eighteen subsequent tournaments . They have failed to qualify for the finals on three occasions , 1974 ( West Germany ) , 1978 ( Argentina ) and 1994 ( United States ) , and have failed to advance from the group stages on three occasions ; at the 1950 FIFA World Cup , the 1958 FIFA World Cup and the 2014 FIFA World Cup . Their best ever performance is winning the Cup in the 1966 tournament held in England , whilst they also finished in fourth place in 1990 , in Italy , and in 2018 in Russia . Other than that , the team have reached the quarter - finals on nine occasions , the latest of which were at the 2002 ( South Korea / Japan ) and the 2006 ( Germany ) . </P>",
    "topic": "Analyze England's performance trend in the FIFA World Cup from their first participation in 1950 to their most recent appearance mentioned in the text (2018).",
    "response": "<document_analysis>\n1. **Thoughtful Content Examination:** The text details England's participation in the FIFA World Cup, starting from 1950, outlining qualification failures, group stage exits, best performances (winning in 1966, fourth place in 1990 and 2018), and quarter-final appearances. The data provides a historical overview of their performance.\n2. **Concept Exploration:** The text implicitly highlights the inconsistency of England's performance, despite consistent participation. It suggests a pattern of occasional success punctuated by frequent underperformance, particularly in the early and more recent tournaments. The data could be used to analyze the factors contributing to these fluctuations.\n3. **Strategic Complexity Calibration:** Difficulty: 8/10. The question requires synthesizing multiple pieces of information from the text \u2013 failures to qualify, failures to advance from the group stage, and best performances \u2013 to determine a trend. It's not a simple recall question.\n4. **Intentional Question Planning:** The question aims to assess understanding of England's overall World Cup trajectory. It\u2019s designed to move beyond simple fact recall and encourage a holistic assessment of their performance over time. The question tests the ability to identify patterns of success and failure.\n</document_analysis>\n\n<output_format>\nQuestion: Considering England\u2019s participation in the FIFA World Cup from 1950 to 2018, which statement best characterizes their overall tournament performance?\nA: Consistent qualification and advancement to at least the quarter-finals in most tournaments.\nB: A historically dominant team consistently reaching the semi-finals or better.\nC: Frequent qualification interspersed with periods of failure to qualify or early exits from the tournament.\nD: Steady improvement over time, culminating in consistent quarter-final appearances in recent decades.\nExplanation: The text states England has entered all tournaments since 1950 except three (1974, 1978, 1994) and failed to advance from the group stage three times (1950, 1958, 2014). This indicates a pattern of intermittent qualification issues and early exits, making option C the most accurate representation of their overall performance.\nCorrect Answer: C\n</output_format>",
    "question": "Considering England\u2019s participation in the FIFA World Cup from 1950 to 2018, which statement best characterizes their overall tournament performance?",
    "choices": {
      "A": "Consistent qualification and advancement to at least the quarter-finals in most tournaments.",
      "B": "A historically dominant team consistently reaching the semi-finals or better.",
      "C": "Frequent qualification interspersed with periods of failure to qualify or early exits from the tournament.",
      "D": "Steady improvement over time, culminating in consistent quarter-final appearances in recent decades."
    },
    "answer": "C",
    "explanation": "The text states England has entered all tournaments since 1950 except three (1974, 1978, 1994) and failed to advance from the group stage three times (1950, 1958, 2014). This indicates a pattern of intermittent qualification issues and early exits, making option C the most accurate representation of their overall performance.",
    "question_token_count": 28,
    "answer_correctness_score": 10,
    "explanation_validity_score": 10,
    "question_clarity_score": 8,
    "question_difficulty_score": 6,
    "question_groundedness_score": 10,
    "avg_answer_token_count": 17
  },
  {
    "context": "<P> Human fertilization is the union of a human egg and sperm , usually occurring in the ampulla of the fallopian tube . The result of this union is the production of a zygote cell , or fertilized egg , initiating prenatal development . Scientists discovered the dynamics of human fertilization in the nineteenth century . </P>",
    "topic": "Describe the specific location within the female reproductive system where human fertilization typically occurs.",
    "response": "```xml\n<document_analysis>\n1. **Thoughtful Content Examination:** The context focuses on the location of human fertilization, specifically mentioning the ampulla of the fallopian tube. It also touches on the result of fertilization (zygote formation) and the historical discovery of the process.\n2. **Concept Exploration:** The key concept is the precise location of fertilization. Understanding this requires knowledge of female reproductive anatomy. The text implies a specific, localized event rather than a diffuse process.\n3. **Strategic Complexity Calibration:** Difficulty: 8/10. While the answer is directly stated, the question probes for specific anatomical knowledge. Many may know fertilization happens in the fallopian tube but not the ampulla.\n4. **Intentional Question Planning:** The question is designed to test precise knowledge of reproductive anatomy, requiring the expert to recall the specific location within the fallopian tube. The distractors will focus on other parts of the reproductive system.\n</document_analysis>\n<output_format>\nQuestion: Within the female reproductive system, fertilization typically occurs in which anatomical structure?\nA: Cervix\nB: Uterus\nC: Ampulla of the fallopian tube\nD: Ovary\nExplanation: The text explicitly states that human fertilization \u201cusually occurring in the ampulla of the fallopian tube.\u201d\nCorrect Answer: C\n</output_format>\n```",
    "question": "Within the female reproductive system, fertilization typically occurs in which anatomical structure?",
    "choices": {
      "A": "Cervix",
      "B": "Uterus",
      "C": "Ampulla of the fallopian tube",
      "D": "Ovary"
    },
    "answer": "C",
    "explanation": "The text explicitly states that human fertilization \u201cusually occurring in the ampulla of the fallopian tube.\u201d",
    "question_token_count": 15,
    "answer_correctness_score": 10,
    "explanation_validity_score": 10,
    "question_clarity_score": 10,
    "question_difficulty_score": 2,
    "question_groundedness_score": 10,
    "avg_answer_token_count": 4
  },
  {
    "context": "<P> The seventh season of the fantasy drama television series Game of Thrones premiered on HBO on July 16 , 2017 , and concluded on August 27 , 2017 . Unlike previous seasons that consisted of ten episodes each , the seventh season consisted of only seven . Like the previous season , it largely consisted of original content not found in George R.R. Martin 's A Song of Ice and Fire series , while also adapting material Martin revealed to showrunners about the upcoming novels in the series . The series was adapted for television by David Benioff and D.B. Weiss . </P>",
    "topic": "Detail the relationship between the seventh season's content and George R.R. Martin\u2019s *A Song of Ice and Fire* series.",
    "response": "```xml\n<document_analysis>\n<thoughtful_content_examination>\nThe context focuses on the seventh season of *Game of Thrones*, specifically highlighting its shorter episode count and its relationship to the source material, George R.R. Martin\u2019s *A Song of Ice and Fire* series. It states the season largely consists of original content *and* material revealed by Martin to the showrunners regarding future novels. This implies a complex interplay between adaptation and extrapolation.\n</thoughtful_content_examination>\n<concept_exploration>\nThe key concept is the adaptation process and the point at which a television series diverges from its source material. The text reveals the showrunners weren't simply adapting published books but were also incorporating information about *unreleased* content, which creates a unique situation. This invites questions about the nature of canon and the author's control over the narrative when a work is adapted.\n</concept_exploration>\n<strategic_complexity_calibration>\nDifficulty: 8/10. The question needs to delve into the nuances of adaptation, original content, and authorial input, requiring a deeper understanding of the production process. It's not a simple recall question but requires inferential reasoning.\n</strategic_complexity_calibration>\n<intentional_question_planning>\nThe question will focus on the precise nature of the relationship between the seventh season and Martin's work, specifically addressing the blend of existing and unreleased content. The answer options will be designed to test the understanding of this interplay and avoid simple recall of the fact that the season contained original content.\n</intentional_question_planning>\n</document_analysis>\n\n<output_format>\nQuestion: The seventh season of *Game of Thrones* departed from previous seasons by incorporating elements beyond the published *A Song of Ice and Fire* novels. What was the primary source of this additional narrative content?\nA: Direct adaptations of fan theories widely circulated online.\nB: Original storylines conceived solely by the showrunners, independent of Martin\u2019s vision.\nC: Information about future novels in the series revealed by George R.R. Martin to the showrunners.\nD: Previously omitted appendices and supplementary materials from existing *A Song of Ice and Fire* publications.\nExplanation: The context explicitly states the seventh season \"largely consisted of original content not found in George R.R. Martin 's A Song of Ice and Fire series , while also adapting material Martin revealed to showrunners about the upcoming novels in the series.\" This makes option C the correct answer.\nCorrect Answer: C\n</output_format>\n```",
    "question": "The seventh season of *Game of Thrones* departed from previous seasons by incorporating elements beyond the published *A Song of Ice and Fire* novels. What was the primary source of this additional narrative content?",
    "choices": {
      "A": "Direct adaptations of fan theories widely circulated online.",
      "B": "Original storylines conceived solely by the showrunners, independent of Martin\u2019s vision.",
      "C": "Information about future novels in the series revealed by George R.R. Martin to the showrunners.",
      "D": "Previously omitted appendices and supplementary materials from existing *A Song of Ice and Fire* publications."
    },
    "answer": "C",
    "explanation": "The context explicitly states the seventh season \"largely consisted of original content not found in George R.R. Martin 's A Song of Ice and Fire series , while also adapting material Martin revealed to showrunners about the upcoming novels in the series.\" This makes option C the correct answer.",
    "question_token_count": 41,
    "answer_correctness_score": 10,
    "explanation_validity_score": 10,
    "question_clarity_score": 8,
    "question_difficulty_score": 6,
    "question_groundedness_score": 4,
    "avg_answer_token_count": 17
  },
  {
    "context": "<Table> List of finals matches , their venues and locations , the finalists , and final scores <Tr> <Th> Year </Th> <Th> Winners </Th> <Th> Final score </Th> <Th> Runners - up </Th> <Th> Venue </Th> <Th> Location </Th> <Th> Attendance </Th> <Th> References </Th> </Tr> <Tr> <Th> 1930 </Th> <Td> Uruguay </Td> <Td> 4 -- 2 </Td> <Td> Argentina </Td> <Td> Estadio Centenario </Td> <Td> Montevideo , Uruguay </Td> <Td> 80,000 </Td> <Td> </Td> </Tr> <Tr> <Th> 1934 </Th> <Td> Italy </Td> <Td> 2 -- 1 </Td> <Td> Czechoslovakia </Td> <Td> Stadio Nazionale PNF </Td> <Td> Rome , Italy </Td> <Td> 50,000 </Td> <Td> </Td> </Tr> <Tr> <Th> 1938 </Th> <Td> Italy </Td> <Td> 4 -- 2 </Td> <Td> Hungary </Td> <Td> Stade Olympique de Colombes </Td> <Td> Paris , France </Td> <Td> 45,000 </Td> <Td> </Td> </Tr> <Tr> <Th> 1950 </Th> <Td> Uruguay </Td> <Td> 2 -- 1 </Td> <Td> Brazil </Td> <Td> Est\u00e1dio do Maracan\u00e3 </Td> <Td> Rio de Janeiro , Brazil </Td> <Td> 199,854 </Td> <Td> </Td> </Tr> <Tr> <Th> 1954 </Th> <Td> West Germany </Td> <Td> 3 -- 2 </Td> <Td> Hungary </Td> <Td> Wankdorf Stadium </Td> <Td> Bern , Switzerland </Td> <Td> 60,000 </Td> <Td> </Td> </Tr> <Tr> <Th> 1958 </Th> <Td> Brazil </Td> <Td> 5 -- 2 </Td> <Td> Sweden </Td> <Td> R\u00e5sunda Stadium </Td> <Td> Solna , Sweden </Td> <Td> 51,800 </Td> <Td> </Td> </Tr> <Tr> <Th> 1962 </Th> <Td> Brazil </Td> <Td> 3 -- 1 </Td> <Td> Czechoslovakia </Td> <Td> Estadio Nacional </Td> <Td> Santiago , Chile </Td> <Td> 69,000 </Td> <Td> </Td> </Tr> <Tr> <Th> 1966 </Th> <Td> England </Td> <Td> 4 -- 2 </Td> <Td> West Germany </Td> <Td> Wembley Stadium </Td> <Td> London , England </Td> <Td> 93,000 </Td> <Td> </Td> </Tr> <Tr> <Th> 1970 </Th> <Td> Brazil </Td> <Td> 4 -- 1 </Td> <Td> Italy </Td> <Td> Estadio Azteca </Td> <Td> Mexico City , Mexico </Td> <Td> 107,412 </Td> <Td> </Td> </Tr> <Tr> <Th> </Th> <Td> West Germany </Td> <Td> 2 -- 1 </Td> <Td> Netherlands </Td> <Td> Olympiastadion </Td> <Td> Munich , West Germany </Td> <Td> 75,200 </Td> <Td> </Td> </Tr> <Tr> <Th> 1978 </Th> <Td> Argentina </Td> <Td> 3 -- 1 </Td> <Td> Netherlands </Td> <Td> Estadio Monumental </Td> <Td> Buenos Aires , Argentina </Td> <Td> 71,483 </Td> <Td> </Td> </Tr> <Tr> <Th> 1982 </Th> <Td> Italy </Td> <Td> 3 -- 1 </Td> <Td> West Germany </Td> <Td> Santiago Bernab\u00e9u </Td> <Td> Madrid , Spain </Td> <Td> 90,000 </Td> <Td> </Td> </Tr> <Tr> <Th> 1986 </Th> <Td> Argentina </Td> <Td> 3 -- 2 </Td> <Td> West Germany </Td> <Td> Estadio Azteca </Td> <Td> Mexico City , Mexico </Td> <Td> 114,600 </Td> <Td> </Td> </Tr> <Tr> <Th> 1990 </Th> <Td> West Germany </Td> <Td> 1 -- 0 </Td> <Td> Argentina </Td> <Td> Stadio Olimpico </Td> <Td> Rome , Italy </Td> <Td> 73,603 </Td> <Td> </Td> </Tr> <Tr> <Th> 1994 </Th> <Td> Brazil </Td> <Td> 0 -- 0 </Td> <Td> Italy </Td> <Td> Rose Bowl </Td> <Td> Pasadena , United States </Td> <Td> 94,194 </Td> <Td> </Td> </Tr> <Tr> <Th> 1998 </Th> <Td> France </Td> <Td> 3 -- 0 </Td> <Td> Brazil </Td> <Td> Stade de France </Td> <Td> Saint - Denis , France </Td> <Td> 80,000 </Td> <Td> </Td> </Tr> <Tr> <Th> 2002 </Th> <Td> Brazil </Td> <Td> 2 -- 0 </Td> <Td> Germany </Td> <Td> International Stadium </Td> <Td> Yokohama , Japan </Td> <Td> 69,029 </Td> <Td> </Td> </Tr> <Tr> <Th> 2006 </Th> <Td> Italy </Td> <Td> 1 -- 1 </Td> <Td> France </Td> <Td> Olympiastadion </Td> <Td> Berlin , Germany </Td> <Td> 69,000 </Td> <Td> </Td> </Tr> <Tr> <Th> </Th> <Td> Spain </Td> <Td> 1 -- 0 </Td> <Td> Netherlands </Td> <Td> Soccer City </Td> <Td> Johannesburg , South Africa </Td> <Td> 84,490 </Td> <Td> </Td> </Tr> <Tr> <Th> 2014 </Th> <Td> Germany </Td> <Td> 1 -- 0 </Td> <Td> Argentina </Td> <Td> Est\u00e1dio do Maracan\u00e3 </Td> <Td> Rio de Janeiro , Brazil </Td> <Td> 74,738 </Td> <Td> </Td> </Tr> <Tr> <Th> 2018 </Th> <Td> France </Td> <Td> 4 -- 2 </Td> <Td> Croatia </Td> <Td> Luzhniki Stadium </Td> <Td> Moscow , Russia </Td> <Td> 78,011 </Td> <Td> </Td> </Tr> <Tr> <Th colspan=\"8\"> Upcoming finals </Th> </Tr> <Tr> <Th> Year </Th> <Th> Team 1 </Th> <Th> </Th> <Th> Team 2 </Th> <Th> Venue </Th> <Th> Location </Th> <Th> Attendance </Th> <Th> References </Th> </Tr> <Tr> <Th> 2022 </Th> <Td> </Td> <Td> </Td> <Td> </Td> <Td> Lusail Iconic Stadium </Td> <Td> Lusail , Qatar </Td> <Td> </Td> <Td> </Td> </Tr> <Tr> <Th> 2026 </Th> <Td> </Td> <Td> </Td> <Td> </Td> <Td> TBD </Td> <Td> United States </Td> <Td> </Td> <Td> </Td> </Tr> </Table>",
    "topic": "Compare the average attendance of World Cup finals held in Europe versus those held in other continents.",
    "response": "<document_analysis>\nThe provided context is a table listing all FIFA World Cup final matches, including details like year, winners, finalists, venue, location, and attendance. The task is to generate a challenging question based on this data, specifically focusing on comparing average attendance between World Cup finals held in Europe versus other continents. The data is well-structured and lends itself to quantitative analysis. The difficulty will be calibrating a question that requires calculation and comparison, rather than simple recall. The table includes data from 1930-2018 and partial data for 2022 and 2026. I will exclude the upcoming finals as attendance data is unavailable.\n</document_analysis>\n\n<output_format>\nQuestion: Based on the provided data of World Cup final match attendance from 1930-2018, approximately what is the difference in average attendance between finals hosted in Europe and those hosted outside of Europe?\nA: 12,500\nB: 27,000\nC: 55,000\nD: 78,000\nExplanation: Calculating the average attendance for European finals (1934, 1938, 1966, 1974, 1982, 1990, 1998, 2006, 2018) yields approximately 72,911.  Calculating the average attendance for non-European finals (1930, 1950, 1954, 1958, 1962, 1970, 1978, 1986, 1994, 2002, 2014) yields approximately 60,411. The difference is approximately 12,500.\nCorrect Answer: A\n</output_format>",
    "question": "Based on the provided data of World Cup final match attendance from 1930-2018, approximately what is the difference in average attendance between finals hosted in Europe and those hosted outside of Europe?",
    "choices": {
      "A": "12,500",
      "B": "27,000",
      "C": "55,000",
      "D": "78,000"
    },
    "answer": "A",
    "explanation": "Calculating the average attendance for European finals (1934, 1938, 1966, 1974, 1982, 1990, 1998, 2006, 2018) yields approximately 72,911.  Calculating the average attendance for non-European finals (1930, 1950, 1954, 1958, 1962, 1970, 1978, 1986, 1994, 2002, 2014) yields approximately 60,411. The difference is approximately 12,500.",
    "question_token_count": 40,
    "answer_correctness_score": 10,
    "explanation_validity_score": 10,
    "question_clarity_score": 8,
    "question_difficulty_score": 6,
    "question_groundedness_score": 10,
    "avg_answer_token_count": 4
  },
  {
    "context": "<P> The Pittsburgh Steelers ( 6 -- 2 ) have won the most Super Bowls with six championships , while the New England Patriots ( 5 -- 5 ) , the Dallas Cowboys ( 5 -- 3 ) , and the San Francisco 49ers ( 5 -- 1 ) have five wins . New England has the most Super Bowl appearances with ten , while the Buffalo Bills ( 0 -- 4 ) have the most consecutive appearances with four ( all losses ) from 1990 to 1993 . The Miami Dolphins are the only other team to have at least three consecutive appearances : 1972 -- 1974 . The Denver Broncos ( 3 -- 5 ) and Patriots have each lost a record five Super Bowls . The Minnesota Vikings ( 0 -- 4 ) and the Bills have lost four . The record for consecutive wins is two and is shared by seven franchises : the Green Bay Packers ( 1966 -- 1967 ) , the Miami Dolphins ( 1972 -- 1973 ) , the Pittsburgh Steelers ( 1974 -- 1975 and 1978 -- 1979 , the only team to accomplish this feat twice ) , the San Francisco 49ers ( 1988 -- 1989 ) , the Dallas Cowboys ( 1992 -- 1993 ) , the Denver Broncos ( 1997 -- 1998 ) , and the New England Patriots ( 2003 -- 2004 ) . Among those , Dallas ( 1992 -- 1993 ; 1995 ) and New England ( 2001 ; 2003 -- 2004 ) are the only teams to win three out of four consecutive Super Bowls . The 1972 Dolphins capped off the only perfect season in NFL history with their victory in Super Bowl VII . The only team with multiple Super Bowl appearances and no losses is the Baltimore Ravens , who in winning Super Bowl XLVII defeated and replaced the 49ers in that position . Four current NFL teams have never appeared in a Super Bowl , including franchise relocations and renaming : the Cleveland Browns , Detroit Lions , Jacksonville Jaguars , and Houston Texans , though both the Browns ( 1964 ) and Lions ( 1957 ) had won NFL championship games prior to the creation of the Super Bowl . </P>",
    "topic": "Detail the teams that have achieved two consecutive Super Bowl wins and highlight the unique accomplishment of the Pittsburgh Steelers.",
    "response": "```xml\n<document_analysis>\n<Thoughtful_Content_Examination>\nThe text provides a statistical overview of Super Bowl wins, appearances, and consecutive appearances/wins for various NFL teams. It details the teams with the most wins, losses, and consecutive appearances, as well as unique achievements like the Dolphins' perfect season and the Steelers' repeated consecutive wins.\n</Thoughtful_Content_Examination>\n<Concept_Exploration>\nThe information revolves around the historical performance of NFL teams in the Super Bowl. Implicitly, it touches upon the cyclical nature of success in professional sports and the difficulty of maintaining consistent dominance. The Steelers' unique achievement of winning consecutive Super Bowls twice is a key distinguishing factor.\n</Concept_Exploration>\n<Strategic_Complexity_Calibration>\nDifficulty: 8/10. The question will focus on the nuance of consecutive Super Bowl wins, specifically identifying the team that has achieved this feat multiple times. This requires careful reading and recall of specific details from the text.\n</Strategic_Complexity_Calibration>\n<Intentional_Question_Planning>\nThe question will focus on the teams that have won consecutive Super Bowls and then specifically ask about the Steelers\u2019 unique accomplishment. This requires recalling the list of teams and then identifying the unique aspect of the Steelers' performance.\n</Intentional_Question_Planning>\n</document_analysis>\n\n<output_format>\nQuestion: Which franchise holds the distinction of achieving consecutive Super Bowl victories on more than one occasion?\nA: New England Patriots\nB: San Francisco 49ers\nC: Pittsburgh Steelers\nD: Dallas Cowboys\nExplanation: The text explicitly states that the Pittsburgh Steelers are \u201cthe only team to accomplish [winning consecutive Super Bowls] this feat twice\u201d (1974-1975 and 1978-1979).\nCorrect Answer: C\n</output_format>\n```",
    "question": "Which franchise holds the distinction of achieving consecutive Super Bowl victories on more than one occasion?",
    "choices": {
      "A": "New England Patriots",
      "B": "San Francisco 49ers",
      "C": "Pittsburgh Steelers",
      "D": "Dallas Cowboys"
    },
    "answer": "C",
    "explanation": "The text explicitly states that the Pittsburgh Steelers are \u201cthe only team to accomplish [winning consecutive Super Bowls] this feat twice\u201d (1974-1975 and 1978-1979).",
    "question_token_count": 18,
    "answer_correctness_score": 10,
    "explanation_validity_score": 10,
    "question_clarity_score": 8,
    "question_difficulty_score": 7,
    "question_groundedness_score": 10,
    "avg_answer_token_count": 4
  },
  {
    "context": "<P> The United States presidential line of succession is the order in which persons may become or act as President of the United States if the incumbent president becomes incapacitated , dies , resigns , or is removed from office ( by impeachment by the House of Representatives and subsequent conviction by the Senate ) . The line of succession is set by the United States Constitution and the Presidential Succession Act of 1947 as subsequently amended to include newly created cabinet offices . The succession follows the order of vice president , Speaker of the House of Representatives , President pro tempore of the Senate , and then the heads of federal executive departments who form the Cabinet of the United States . The Cabinet currently has fifteen members , beginning with the Secretary of State , and followed by the rest in the order of their positions ' creation . Those heads of department who are ineligible to act as president are also ineligible to succeed the president by succession , for example most commonly if they are not a natural - born U.S. citizen . </P>",
    "topic": "Identify the current number of cabinet members and their significance in the presidential line of succession.",
    "response": "```xml\n<document_analysis>\n1. **Thoughtful Content Examination**: The text describes the presidential line of succession, outlining the order in which individuals can assume the presidency. It highlights the roles of the Vice President, Speaker of the House, President Pro Tempore, and Cabinet members. It also notes the current number of Cabinet members and the eligibility requirements for succession.\n2. **Concept Exploration**: The concept of presidential succession is crucial for ensuring continuity of government. The text implicitly suggests the importance of clearly defined rules and constitutional provisions to address unforeseen circumstances. The mention of natural-born citizenship as a requirement for cabinet members to be eligible for succession is a subtle but important detail.\n3. **Strategic Complexity Calibration**: Difficulty: 9/10. This question requires understanding of a specific legal framework (Presidential Succession Act), knowledge of cabinet positions, and the constitutional requirement of natural-born citizenship. It's designed to test whether an expert can synthesize this information.\n4. **Intentional Question Planning**: The question aims to probe the expert\u2019s understanding of the current composition of the Cabinet and its role within the succession framework, focusing on the order of succession among cabinet members. The distractors will be based on common misconceptions about the Cabinet or the succession process.\n</document_analysis>\n<output_format>\nQuestion: Which statement accurately reflects the current composition and role of the U.S. Cabinet within the presidential line of succession?\nA: The Cabinet comprises fourteen members, with succession following alphabetical order by department name.\nB: The Cabinet consists of fifteen members, succeeding the President Pro Tempore of the Senate in order of their departments\u2019 establishment.\nC: The Cabinet currently includes sixteen members, and succession is determined by seniority within each department.\nD: The Cabinet is composed of twelve members, succeeding the Speaker of the House based on budget allocation.\nExplanation: The text explicitly states that the Cabinet currently has fifteen members and that they succeed in the order of their departments\u2019 creation. This detail is crucial for demonstrating a thorough understanding of the Presidential Succession Act.\nCorrect Answer: B\n</output_format>\n```",
    "question": "Which statement accurately reflects the current composition and role of the U.S. Cabinet within the presidential line of succession?",
    "choices": {
      "A": "The Cabinet comprises fourteen members, with succession following alphabetical order by department name.",
      "B": "The Cabinet consists of fifteen members, succeeding the President Pro Tempore of the Senate in order of their departments\u2019 establishment.",
      "C": "The Cabinet currently includes sixteen members, and succession is determined by seniority within each department.",
      "D": "The Cabinet is composed of twelve members, succeeding the Speaker of the House based on budget allocation."
    },
    "answer": "B",
    "explanation": "The text explicitly states that the Cabinet currently has fifteen members and that they succeed in the order of their departments\u2019 creation. This detail is crucial for demonstrating a thorough understanding of the Presidential Succession Act.",
    "question_token_count": 23,
    "answer_correctness_score": 10,
    "explanation_validity_score": 10,
    "question_clarity_score": 8,
    "question_difficulty_score": 6,
    "question_groundedness_score": 9,
    "avg_answer_token_count": 20
  },
  {
    "context": "<P> The Battles of Lexington and Concord were the first military engagements of the American Revolutionary War . The battles were fought on April 19 , 1775 in Middlesex County , Province of Massachusetts Bay , within the towns of Lexington , Concord , Lincoln , Menotomy ( present - day Arlington ) , and Cambridge . They marked the outbreak of armed conflict between the Kingdom of Great Britain and its thirteen colonies in America . </P>",
    "topic": "Detail the date on which the Battles of Lexington and Concord occurred and explain its importance in the timeline of the American Revolution.",
    "response": "```xml\n<document_analysis>\n1. **Thoughtful Content Examination:** The provided text details the Battles of Lexington and Concord, identifying them as the first military engagements of the American Revolutionary War. It specifies the date and locations of the battles. The core idea is the commencement of armed conflict.\n2. **Concept Exploration:** The context highlights the significance of these battles as the starting point of a major historical event. It implicitly underscores the escalating tensions between Britain and its colonies.\n3. **Strategic Complexity Calibration:** Difficulty: 7/10. While the date is explicitly stated, understanding its *precise* importance requires historical context beyond the provided text. The question aims to test if the expert understands the battles' role as the initiating event.\n4. **Intentional Question Planning:** The question focuses on both the specific date and the broader historical significance, prompting the expert to demonstrate knowledge beyond simple recall. The answer options will include plausible dates related to the revolutionary period and varying levels of historical importance.\n</document_analysis>\n<output_format>\nQuestion: On what date did the Battles of Lexington and Concord, considered the opening engagements of the American Revolutionary War, take place?\nA: April 19, 1775\nB: July 4, 1776\nC: December 25, 1776\nD: October 17, 1777\nExplanation: The text explicitly states that the Battles of Lexington and Concord were fought on April 19, 1775, marking the start of armed conflict in the American Revolutionary War.\nCorrect Answer: A\n</output_format>\n```",
    "question": "On what date did the Battles of Lexington and Concord, considered the opening engagements of the American Revolutionary War, take place?",
    "choices": {
      "A": "April 19, 1775",
      "B": "July 4, 1776",
      "C": "December 25, 1776",
      "D": "October 17, 1777"
    },
    "answer": "A",
    "explanation": "The text explicitly states that the Battles of Lexington and Concord were fought on April 19, 1775, marking the start of armed conflict in the American Revolutionary War.",
    "question_token_count": 25,
    "answer_correctness_score": 10,
    "explanation_validity_score": 10,
    "question_clarity_score": 8,
    "question_difficulty_score": 2,
    "question_groundedness_score": 5,
    "avg_answer_token_count": 8
  },
  {
    "context": "<P> Earth 's orbit is the trajectory along which Earth travels around the Sun . The average distance between the Earth and the Sun is 149.60 million km ( 92.96 million mi ) , and one complete orbit takes 365.256 days ( 1 sidereal year ) , during which time Earth has traveled 940 million km ( 584 million mi ) . Earth 's orbit has an eccentricity of 0.0167 . </P>",
    "topic": "Explain the significance of the 365.256-day orbital period, including its relation to the concept of a sidereal year.",
    "response": "```xml\n<document_analysis>\n1. **Thoughtful Content Examination:** The context provides a concise definition of Earth's orbit, its average distance from the Sun, the duration of one orbit (365.256 days), the distance traveled during one orbit, and its eccentricity. The key piece of information is the 365.256-day orbital period, defined as 1 sidereal year.\n2. **Concept Exploration:** The question topic focuses on the significance of the 365.256-day period and its relation to the sidereal year. This requires understanding that the sidereal year is the time it takes for Earth to complete one full orbit relative to the fixed stars. The slight difference between a sidereal year and a tropical year (which governs seasons) is a nuanced concept.\n3. **Strategic Complexity Calibration:** Difficulty: 8/10. The question isn\u2019t about directly recalling the 365.256-day period, but understanding its *significance* as a sidereal year. It requires the domain expert to synthesize the information and grasp the underlying astronomical definitions.\n4. **Intentional Question Planning:** The question will assess the domain expert's understanding of the orbital period as a fundamental unit of astronomical time measurement and its connection to the sidereal year, requiring them to demonstrate a deeper understanding than simple memorization.\n</document_analysis>\n<output_format>\nQuestion: The Earth's orbital period is precisely defined as 365.256 days. What fundamental astronomical measurement does this period directly represent?\nA: The time it takes for the Sun to return to the same position relative to the Earth's seasons.\nB: The time it takes for Earth to complete one full orbit relative to the fixed stars.\nC: The average time between two successive vernal equinoxes.\nD: The duration of a solar year, accounting for leap years.\nExplanation: The context explicitly states that 365.256 days is equal to 1 sidereal year, which is defined as the time it takes for Earth to complete one full orbit relative to the fixed stars. This is a fundamental measurement in astronomy.\nCorrect Answer: B\n</output_format>\n```",
    "question": "The Earth's orbital period is precisely defined as 365.256 days. What fundamental astronomical measurement does this period directly represent?",
    "choices": {
      "A": "The time it takes for the Sun to return to the same position relative to the Earth's seasons.",
      "B": "The time it takes for Earth to complete one full orbit relative to the fixed stars.",
      "C": "The average time between two successive vernal equinoxes.",
      "D": "The duration of a solar year, accounting for leap years."
    },
    "answer": "B",
    "explanation": "The context explicitly states that 365.256 days is equal to 1 sidereal year, which is defined as the time it takes for Earth to complete one full orbit relative to the fixed stars. This is a fundamental measurement in astronomy.",
    "question_token_count": 25,
    "answer_correctness_score": 10,
    "explanation_validity_score": 10,
    "question_clarity_score": 1,
    "question_difficulty_score": 5,
    "question_groundedness_score": 1,
    "avg_answer_token_count": 16
  },
  {
    "context": "<P> The 2022 FIFA World Cup is scheduled to be the 22nd edition of the FIFA World Cup , the quadrennial international men 's football championship contested by the national teams of the member associations of FIFA . It is scheduled to take place in Qatar in 2022 . This will be the first World Cup ever to be held in the Arab world and the first in a Muslim - majority country . This will be the first World Cup held entirely in geographical Asia since the 2002 tournament in South Korea and Japan ( the 2018 competition in Russia featured one geographically Asian venue , Yekaterinburg ) . In addition the tournament will be the last to involve 32 teams , with an increase to 48 teams scheduled for the 2026 tournament . </P>",
    "topic": "The overall context of the 2022 FIFA World Cup as the 22nd edition of the tournament.",
    "response": "```xml\n<document_analysis>\n1. **Thoughtful Content Examination:** The text provides basic factual information about the 2022 FIFA World Cup \u2013 its edition number, frequency, location, and some historical firsts. The core ideas revolve around its uniqueness as the first World Cup in the Arab world and a Muslim-majority country, and its status as the last with 32 teams.\n2. **Concept Exploration:** Implicitly, the text highlights the evolving nature of the World Cup (expansion to 48 teams) and the increasing globalization of the sport (moving to new regions). It touches upon geographical considerations, differentiating between 'geographically Asian' venues and those simply hosted by countries considered part of Asia.\n3. **Strategic Complexity Calibration:** Difficulty: 7/10. The question needs to move beyond simple recall of facts and probe understanding of the contextual significance of the tournament.\n4. **Intentional Question Planning:** The question will focus on the geographical context and the subtle distinction made in the text regarding 'geographically Asian' venues, aiming to test the expert's attention to detail and understanding of the tournament's unique positioning.\n</document_analysis>\n<output_format>\nQuestion: Considering the geographical context of past FIFA World Cups, what distinction does the 2022 Qatar tournament hold regarding its location within Asia?\nA: It is the first World Cup held entirely within the geographical boundaries of Asia since 1930.\nB: It represents a return to East Asia, mirroring the successful 2002 tournament in South Korea and Japan.\nC: It is the first World Cup held entirely within geographical Asia since the 2002 tournament, while the 2018 tournament included a single geographically Asian venue.\nD: It marks the furthest westward expansion of the World Cup, surpassing even previous tournaments in Europe.\nExplanation: The text explicitly states that the 2022 World Cup is the first to be held entirely in geographical Asia since the 2002 tournament in South Korea and Japan, but also notes that the 2018 Russia tournament contained one geographically Asian venue (Yekaterinburg). This distinction is crucial for a nuanced understanding of the tournament\u2019s location.\nCorrect Answer: C\n</output_format>\n```",
    "question": "Considering the geographical context of past FIFA World Cups, what distinction does the 2022 Qatar tournament hold regarding its location within Asia?",
    "choices": {
      "A": "It is the first World Cup held entirely within the geographical boundaries of Asia since 1930.",
      "B": "It represents a return to East Asia, mirroring the successful 2002 tournament in South Korea and Japan.",
      "C": "It is the first World Cup held entirely within geographical Asia since the 2002 tournament, while the 2018 tournament included a single geographically Asian venue.",
      "D": "It marks the furthest westward expansion of the World Cup, surpassing even previous tournaments in Europe."
    },
    "answer": "C",
    "explanation": "The text explicitly states that the 2022 World Cup is the first to be held entirely in geographical Asia since the 2002 tournament in South Korea and Japan, but also notes that the 2018 Russia tournament contained one geographically Asian venue (Yekaterinburg). This distinction is crucial for a nuanced understanding of the tournament\u2019s location.",
    "question_token_count": 27,
    "answer_correctness_score": 10,
    "explanation_validity_score": 10,
    "question_clarity_score": 2,
    "question_difficulty_score": 6,
    "question_groundedness_score": 9,
    "avg_answer_token_count": 24
  },
  {
    "context": "<Table> <Tr> <Th> Year </Th> <Th> Round </Th> <Th> Position </Th> <Th> GP </Th> <Th> </Th> <Th> D * </Th> <Th> </Th> <Th> GF </Th> <Th> GA </Th> <Th> GD </Th> </Tr> <Tr> <Td> 1930 </Td> <Td colspan=\"9\"> Not a FIFA member </Td> </Tr> <Tr> <Td> 1934 </Td> </Tr> <Tr> <Td> 1938 </Td> </Tr> <Tr> <Td> 1950 </Td> <Td> Group stage </Td> <Td> 8th </Td> <Td> </Td> <Td> </Td> <Td> 0 </Td> <Td> </Td> <Td> </Td> <Td> </Td> <Td> 0 </Td> </Tr> <Tr> <Td> 1954 </Td> <Td> Quarter - finals </Td> <Td> 7th </Td> <Td> </Td> <Td> </Td> <Td> </Td> <Td> </Td> <Td> 8 </Td> <Td> 8 </Td> <Td> 0 </Td> </Tr> <Tr> <Td> 1958 </Td> <Td> Group stage </Td> <Td> 11th </Td> <Td> </Td> <Td> 0 </Td> <Td> </Td> <Td> </Td> <Td> </Td> <Td> 5 </Td> <Td> - 1 </Td> </Tr> <Tr> <Td> 1962 </Td> <Td> Quarter - finals </Td> <Td> 8th </Td> <Td> </Td> <Td> </Td> <Td> </Td> <Td> </Td> <Td> 5 </Td> <Td> 6 </Td> <Td> - 1 </Td> </Tr> <Tr> <Td> 1966 </Td> <Td> Champions </Td> <Td> 1st </Td> <Td> 6 </Td> <Td> 5 </Td> <Td> </Td> <Td> 0 </Td> <Td> 11 </Td> <Td> </Td> <Td> 8 </Td> </Tr> <Tr> <Td> 1970 </Td> <Td> Quarter - finals </Td> <Td> 8th </Td> <Td> </Td> <Td> </Td> <Td> 0 </Td> <Td> </Td> <Td> </Td> <Td> </Td> <Td> 0 </Td> </Tr> <Tr> <Td> </Td> <Td colspan=\"9\"> Did not qualify </Td> </Tr> <Tr> <Td> 1978 </Td> </Tr> <Tr> <Td> 1982 </Td> <Td> Second group stage </Td> <Td> 6th </Td> <Td> 5 </Td> <Td> </Td> <Td> </Td> <Td> 0 </Td> <Td> 6 </Td> <Td> </Td> <Td> 5 </Td> </Tr> <Tr> <Td> 1986 </Td> <Td> Quarter - finals </Td> <Td> 8th </Td> <Td> 5 </Td> <Td> </Td> <Td> </Td> <Td> </Td> <Td> 7 </Td> <Td> </Td> <Td> </Td> </Tr> <Tr> <Td> 1990 </Td> <Td> Semi finals </Td> <Td> 4th </Td> <Td> 7 </Td> <Td> </Td> <Td> </Td> <Td> </Td> <Td> 8 </Td> <Td> 6 </Td> <Td> </Td> </Tr> <Tr> <Td> 1994 </Td> <Td colspan=\"9\"> Did not qualify </Td> </Tr> <Tr> <Td> 1998 </Td> <Td> Round of 16 </Td> <Td> 9th </Td> <Td> </Td> <Td> </Td> <Td> </Td> <Td> </Td> <Td> 7 </Td> <Td> </Td> <Td> </Td> </Tr> <Tr> <Td> 2002 </Td> <Td> Quarter - finals </Td> <Td> 6th </Td> <Td> 5 </Td> <Td> </Td> <Td> </Td> <Td> </Td> <Td> 6 </Td> <Td> </Td> <Td> </Td> </Tr> <Tr> <Td> 2006 </Td> <Td> Quarter - finals </Td> <Td> 7th </Td> <Td> 5 </Td> <Td> </Td> <Td> </Td> <Td> 0 </Td> <Td> 6 </Td> <Td> </Td> <Td> </Td> </Tr> <Tr> <Td> </Td> <Td> Round of 16 </Td> <Td> 13th </Td> <Td> </Td> <Td> </Td> <Td> </Td> <Td> </Td> <Td> </Td> <Td> 5 </Td> <Td> - 2 </Td> </Tr> <Tr> <Td> 2014 </Td> <Td> Group stage </Td> <Td> 26th </Td> <Td> </Td> <Td> 0 </Td> <Td> </Td> <Td> </Td> <Td> </Td> <Td> </Td> <Td> - 2 </Td> </Tr> <Tr> <Td> 2018 </Td> <Td> Semi-finals </Td> <Td> 4th </Td> <Td> 7 </Td> <Td> </Td> <Td> </Td> <Td> </Td> <Td> 12 </Td> <Td> 8 </Td> <Td> </Td> </Tr> <Tr> <Td> 2022 </Td> <Td colspan=\"9\"> TBD </Td> </Tr> <Tr> <Td> 2026 </Td> </Tr> <Tr> <Th> Total </Th> <Th> 15 / 21 </Th> <Th> 1 title </Th> <Th> 69 </Th> <Th> 29 </Th> <Th> 21 </Th> <Th> 19 </Th> <Th> 91 </Th> <Th> 64 </Th> <Th> 27 </Th> </Tr> </Table>",
    "topic": "Statistical analysis of the nation\u2019s goal difference across all World Cup appearances, and its correlation with overall success.",
    "response": "```xml\n<document_analysis>\nThe provided context is a table detailing a nation's (unspecified) performance in the FIFA World Cup from 1930 to 2022 (with 2026 and beyond left blank). The table includes data on year, round reached, position, games played, and goal difference (GD). The table also provides totals for appearances, titles, and overall goal statistics. The data is somewhat incomplete, with many entries missing values for games played and other statistics. However, the core data on GD and tournament progression is present.\n\nThe question will focus on the relationship between goal difference and success, aiming for a high level of analytical thinking. The question will require consideration of the provided data and an understanding of how GD might correlate with advancement in the tournament. The difficulty will be high, requiring nuanced interpretation rather than simple data extraction. I will avoid asking a question that is simply a lookup of values in the table.\n\nDifficulty: 8/10\n</document_analysis>\n<output_format>\nQuestion: Considering the provided historical data, which of the following best describes the relationship between a positive goal difference (GD) and achieving at least the semi-final stage in the FIFA World Cup for this nation?\nA: A consistently positive GD is a necessary and sufficient condition for reaching the semi-finals.\nB: A positive GD is frequently observed in semi-final appearances, but is not a guarantee of success, nor is a negative GD a definitive barrier.\nC: A negative GD consistently predicts failure to advance beyond the quarter-finals.\nD: There is no discernible correlation between GD and the nation\u2019s success in reaching the semi-final stage.\nExplanation: Examining the data, the nation reached the semi-finals in 1966, 1990, and 2018. In 1966, the GD was +8, in 1990 it was positive (though the exact value is missing), and in 2018 it was +4. While positive GD often coincides with semi-final runs, there are instances of quarter-final appearances with both positive and negative GD, and group stage exits with negative GD. Therefore, a positive GD isn\u2019t *sufficient* to guarantee a semi-final appearance, and a negative GD doesn't preclude reaching later stages.\nCorrect Answer: B\n</output_format>\n```",
    "question": "Considering the provided historical data, which of the following best describes the relationship between a positive goal difference (GD) and achieving at least the semi-final stage in the FIFA World Cup for this nation?",
    "choices": {
      "A": "A consistently positive GD is a necessary and sufficient condition for reaching the semi-finals.",
      "B": "A positive GD is frequently observed in semi-final appearances, but is not a guarantee of success, nor is a negative GD a definitive barrier.",
      "C": "A negative GD consistently predicts failure to advance beyond the quarter-finals.",
      "D": "There is no discernible correlation between GD and the nation\u2019s success in reaching the semi-final stage."
    },
    "answer": "B",
    "explanation": "Examining the data, the nation reached the semi-finals in 1966, 1990, and 2018. In 1966, the GD was +8, in 1990 it was positive (though the exact value is missing), and in 2018 it was +4. While positive GD often coincides with semi-final runs, there are instances of quarter-final appearances with both positive and negative GD, and group stage exits with negative GD. Therefore, a positive GD isn\u2019t *sufficient* to guarantee a semi-final appearance, and a negative GD doesn't preclude reaching later stages.",
    "question_token_count": 40,
    "answer_correctness_score": 9,
    "explanation_validity_score": 9,
    "question_clarity_score": 8,
    "question_difficulty_score": 7,
    "question_groundedness_score": 9,
    "avg_answer_token_count": 20
  },
  {
    "context": "<P> Carol Ann Susi ( February 2 , 1952 -- November 11 , 2014 ) was an American actress . She was known for providing the voice of recurring unseen character Mrs. Wolowitz , mother of Howard Wolowitz , on the television series The Big Bang Theory . </P>",
    "topic": "Explain the nature of Mrs. Wolowitz's character as described in the text.",
    "response": "```xml\n<document_analysis>\n1. **Thoughtful Content Examination:** The context provides a concise biographical note about Carol Ann Susi and her most prominent role: voicing Mrs. Wolowitz on \"The Big Bang Theory.\" The key aspect is that Mrs. Wolowitz is an *unseen* character.\n2. **Concept Exploration:** The role is interesting because it relies entirely on vocal performance to establish a character. This invites questions about how a character can be effectively portrayed without visual cues. The context also subtly highlights the importance of voice acting.\n3. **Strategic Complexity Calibration:** Difficulty: 7/10. While the information is simple, the question aims to assess understanding of the nuances of the character's presentation and the implications of her being unseen.\n4. **Intentional Question Planning:** The question will focus on the defining characteristic of Mrs. Wolowitz \u2013 her unseen presence \u2013 and how this impacts the audience's perception of the character. This will require recalling the core detail from the text and applying it to understanding character development in television.\n</document_analysis>\n<output_format>\nQuestion:  A defining characteristic of Mrs. Wolowitz, as portrayed by Carol Ann Susi in \"The Big Bang Theory\", is that her character is primarily developed through what medium?\nA:  Extensive on-screen appearances and physical comedy.\nB:  Detailed backstory revealed through flashbacks and dialogue.\nC:  Vocal performance, as she is an unseen character.\nD:  Interaction with other characters and visual gags.\nExplanation: The text explicitly states that Carol Ann Susi was known for providing the voice of an *unseen* character, Mrs. Wolowitz. Therefore, her character is defined by her vocal performance.\nCorrect Answer: C\n</output_format>\n```",
    "question": "A defining characteristic of Mrs. Wolowitz, as portrayed by Carol Ann Susi in \"The Big Bang Theory\", is that her character is primarily developed through what medium?",
    "choices": {
      "A": "Extensive on-screen appearances and physical comedy.",
      "B": "Detailed backstory revealed through flashbacks and dialogue.",
      "C": "Vocal performance, as she is an unseen character.",
      "D": "Interaction with other characters and visual gags."
    },
    "answer": "C",
    "explanation": "The text explicitly states that Carol Ann Susi was known for providing the voice of an *unseen* character, Mrs. Wolowitz. Therefore, her character is defined by her vocal performance.",
    "question_token_count": 35,
    "answer_correctness_score": 10,
    "explanation_validity_score": 10,
    "question_clarity_score": 8,
    "question_difficulty_score": 6,
    "question_groundedness_score": 10,
    "avg_answer_token_count": 10
  },
  {
    "context": "<P> The Statue of Liberty ( Liberty Enlightening the World ; French : La Libert\u00e9 \u00e9clairant le monde ) is a colossal neoclassical sculpture on Liberty Island in New York Harbor in New York City , in the United States . The copper statue , a gift from the people of France to the people of the United States , was designed by French sculptor Fr\u00e9d\u00e9ric Auguste Bartholdi and built by Gustave Eiffel . The statue was dedicated on October 28 , 1886 . </P>",
    "topic": "Identify the engineer or builder known for constructing the Statue of Liberty.",
    "response": "```xml\n<document_analysis>\n1. **Thoughtful Content Examination:** The text provides a concise overview of the Statue of Liberty, highlighting its location, design, and origin as a gift from France. It explicitly names Fr\u00e9d\u00e9ric Auguste Bartholdi as the designer and Gustave Eiffel as the builder.\n2. **Concept Exploration:** The text implicitly touches upon international relations and the symbolism of liberty. The mention of \"neoclassical sculpture\" suggests an understanding of art history. The fact that Eiffel built it is interesting given his more famous work on the Eiffel Tower.\n3. **Strategic Complexity Calibration:** Difficulty: 7/10. While the text directly states the answer, the question aims to test recall and recognition of a historical figure associated with a famous landmark. It requires knowledge beyond just recognizing the statue itself.\n4. **Intentional Question Planning:** The question focuses on the *builder* specifically, as opposed to the designer, aiming for a slightly more precise recall. The distractors will include related figures or general terms to increase the challenge.\n</document_analysis>\n<output_format>\nQuestion: Which engineer is most notably credited with the physical construction of the Statue of Liberty?\nA: Fr\u00e9d\u00e9ric Auguste Bartholdi\nB: Richard Morris Hunt\nC: Gustave Eiffel\nD: Eug\u00e8ne Viollet-le-Duc\nExplanation: The text explicitly states that Gustave Eiffel built the Statue of Liberty, while Fr\u00e9d\u00e9ric Auguste Bartholdi designed it. The other options are not mentioned in the context.\nCorrect Answer: C\n</output_format>\n```",
    "question": "Which engineer is most notably credited with the physical construction of the Statue of Liberty?",
    "choices": {
      "A": "Fr\u00e9d\u00e9ric Auguste Bartholdi",
      "B": "Richard Morris Hunt",
      "C": "Gustave Eiffel",
      "D": "Eug\u00e8ne Viollet-le-Duc"
    },
    "answer": "C",
    "explanation": "The text explicitly states that Gustave Eiffel built the Statue of Liberty, while Fr\u00e9d\u00e9ric Auguste Bartholdi designed it. The other options are not mentioned in the context.",
    "question_token_count": 18,
    "answer_correctness_score": 10,
    "explanation_validity_score": 10,
    "question_clarity_score": 8,
    "question_difficulty_score": 5,
    "question_groundedness_score": 9,
    "avg_answer_token_count": 6
  },
  {
    "context": "<P> Super Bowl LII was an American football game played to determine the champion of the National Football League ( NFL ) for the 2017 season . The National Football Conference ( NFC ) champion Philadelphia Eagles defeated the American Football Conference ( AFC ) and defending Super Bowl LI champion New England Patriots , 41 -- 33 , to win their first Super Bowl and their first NFL title since 1960 . The game was played on February 4 , 2018 , at U.S. Bank Stadium in Minneapolis , Minnesota . This was the second time that a Super Bowl was played in Minneapolis , the northernmost city to ever host the event , after Super Bowl XXVI at the Metrodome during the 1991 season , and the sixth Super Bowl held in a cold - weather city . </P>",
    "topic": "The number of Super Bowls held in cold-weather cities prior to Super Bowl LII.",
    "response": "```xml\n<document_analysis>\n<Thoughtful_Content_Examination>The provided text discusses Super Bowl LII, the teams involved, the outcome, and the location (Minneapolis, Minnesota). A key detail is that this was the sixth Super Bowl held in a cold-weather city and the second time Minneapolis hosted the event.</Thoughtful_Content_Examination>\n<Concept_Exploration>The text implies a historical pattern of Super Bowls being primarily held in warmer climates, with cold-weather locations being less common. The fact that Minneapolis is the northernmost city to host a Super Bowl is noteworthy. The question will focus on the historical number of Super Bowls in cold-weather cities to test recall and understanding of the context.</Concept_Exploration>\n<Strategic_Complexity_Calibration>Difficulty: 7/10. The information is directly stated, but requires careful reading and recall. Distractors will be numbers close to the correct answer to increase difficulty.</Strategic_Complexity_Calibration>\n<Intentional_Question_Planning>The question will test the reader's understanding of the number of Super Bowls held in cold-weather cities *prior* to Super Bowl LII, requiring them to understand that Super Bowl LII itself is the sixth, and therefore five preceded it. This prevents a simple copy-paste answer.</Intentional_Question_Planning>\n</document_analysis>\n<output_format>\nQuestion: Prior to Super Bowl LII, how many Super Bowls had been contested in cities generally considered to have cold-weather climates?\nA: 4\nB: 5\nC: 6\nD: 7\nExplanation: The text states that Super Bowl LII was the *sixth* Super Bowl held in a cold-weather city. Therefore, five had been held before it.\nCorrect Answer: B\n</output_format>\n```",
    "question": "Prior to Super Bowl LII, how many Super Bowls had been contested in cities generally considered to have cold-weather climates?",
    "choices": {
      "A": "4",
      "B": "5",
      "C": "6",
      "D": "7"
    },
    "answer": "B",
    "explanation": "The text states that Super Bowl LII was the *sixth* Super Bowl held in a cold-weather city. Therefore, five had been held before it.",
    "question_token_count": 27,
    "answer_correctness_score": 10,
    "explanation_validity_score": 10,
    "question_clarity_score": 8,
    "question_difficulty_score": 6,
    "question_groundedness_score": 10,
    "avg_answer_token_count": 2
  },
  {
    "context": "<P> Darci Lynne Farmer was named the winner on the season finale , September 20 , 2017 . She was the third ventriloquist , third child and third female to win a season of America 's Got Talent. 10 - year - old singer Angelica Hale placed second , and glow light dance troupe Light Balance came in third . Farmer won the show 's prize of $1 million and a headlining performance in Las Vegas . </P>",
    "topic": "State the prize awarded to the winner of the America's Got Talent season finale.",
    "response": "```xml\n<document_analysis>\n1. **Thoughtful Content Examination:** The context describes the winner of America's Got Talent, Darci Lynne Farmer, and details her accomplishments. It also mentions the second and third-place finishers and the prize awarded to the winner. The central idea is the outcome of the 2017 season finale.\n2. **Concept Exploration:** The text implicitly highlights the historical aspect of the show, mentioning the third ventriloquist, child, and female winner. It also showcases the diverse range of talent competing (ventriloquism, singing, dance).\n3. **Strategic Complexity Calibration:** Difficulty: 3/10. While seemingly straightforward, the question requires precise recall of a specific detail within a short passage. The distractors will need to be carefully crafted to be plausible.\n4. **Intentional Question Planning:** The question focuses on the prize, a key detail of the competition. It tests the ability to extract specific information from the text. The answer choices will include monetary amounts and performance opportunities to challenge the test-taker.\n</document_analysis>\n<output_format>\nQuestion: What is the grand prize awarded to the winner of America's Got Talent?\nA: $500,000 and a national television appearance.\nB: $1 million and a headlining performance in Las Vegas.\nC: A recording contract with a major music label and a world tour.\nD: $750,000 and a featured role in a Broadway production.\nExplanation: The text explicitly states that Darci Lynne Farmer won \"the show's prize of $1 million and a headlining performance in Las Vegas.\"\nCorrect Answer: B\n</output_format>\n```",
    "question": "What is the grand prize awarded to the winner of America's Got Talent?",
    "choices": {
      "A": "$500,000 and a national television appearance.",
      "B": "$1 million and a headlining performance in Las Vegas.",
      "C": "A recording contract with a major music label and a world tour.",
      "D": "$750,000 and a featured role in a Broadway production."
    },
    "answer": "B",
    "explanation": "The text explicitly states that Darci Lynne Farmer won \"the show's prize of $1 million and a headlining performance in Las Vegas.\"",
    "question_token_count": 15,
    "answer_correctness_score": 10,
    "explanation_validity_score": 10,
    "question_clarity_score": 1,
    "question_difficulty_score": 3,
    "question_groundedness_score": 1,
    "avg_answer_token_count": 13
  },
  {
    "context": "<Table> <Tr> <Th> No . </Th> <Th> Athlete </Th> <Th> Nation </Th> <Th> Sport </Th> <Th> Years </Th> <Th> Games </Th> <Th> Gender </Th> <Th> Gold </Th> <Th> Silver </Th> <Th> Bronze </Th> <Th> Total </Th> </Tr> <Tr> <Th> </Th> <Td> Phelps , Michael Michael Phelps </Td> <Td> United States </Td> <Td> Swimming </Td> <Td> 2004 -- 2016 </Td> <Td> Summer </Td> <Td> </Td> <Td> 23 </Td> <Td> </Td> <Td> </Td> <Td> 28 </Td> </Tr> <Tr> <Th> </Th> <Td> Latynina , Larisa Larisa Latynina </Td> <Td> Soviet Union </Td> <Td> Gymnastics </Td> <Td> 1956 -- 1964 </Td> <Td> Summer </Td> <Td> </Td> <Td> 9 </Td> <Td> 5 </Td> <Td> </Td> <Td> 18 </Td> </Tr> <Tr> <Th> </Th> <Td> Nurmi , Paavo Paavo Nurmi </Td> <Td> Finland </Td> <Td> Athletics </Td> <Td> 1920 -- 1928 </Td> <Td> Summer </Td> <Td> </Td> <Td> 9 </Td> <Td> </Td> <Td> 0 </Td> <Td> 12 </Td> </Tr> <Tr> <Th> </Th> <Td> Spitz , Mark Mark Spitz </Td> <Td> United States </Td> <Td> Swimming </Td> <Td> 1968 -- 1972 </Td> <Td> Summer </Td> <Td> </Td> <Td> 9 </Td> <Td> </Td> <Td> </Td> <Td> 11 </Td> </Tr> <Tr> <Th> 5 </Th> <Td> Lewis , Carl Carl Lewis </Td> <Td> United States </Td> <Td> Athletics </Td> <Td> 1984 -- 1996 </Td> <Td> Summer </Td> <Td> </Td> <Td> 9 </Td> <Td> </Td> <Td> 0 </Td> <Td> 10 </Td> </Tr> <Tr> <Th> 6 </Th> <Td> Bj\u00f8rgen , Marit Marit Bj\u00f8rgen </Td> <Td> Norway </Td> <Td> Cross-country skiing </Td> <Td> 2002 -- 2018 </Td> <Td> Winter </Td> <Td> </Td> <Td> 8 </Td> <Td> </Td> <Td> </Td> <Td> 15 </Td> </Tr> <Tr> <Th> 7 </Th> <Td> Bj\u00f8rndalen , Ole Einar Ole Einar Bj\u00f8rndalen </Td> <Td> Norway </Td> <Td> Biathlon </Td> <Td> 1998 -- 2014 </Td> <Td> Winter </Td> <Td> </Td> <Td> 8 </Td> <Td> </Td> <Td> </Td> <Td> 13 </Td> </Tr> <Tr> <Th> 8 </Th> <Td> D\u00e6hlie , Bj\u00f8rn Bj\u00f8rn D\u00e6hlie </Td> <Td> Norway </Td> <Td> Cross-country skiing </Td> <Td> 1992 -- 1998 </Td> <Td> Winter </Td> <Td> </Td> <Td> 8 </Td> <Td> </Td> <Td> 0 </Td> <Td> 12 </Td> </Tr> <Tr> <Td> Fischer , Birgit Birgit Fischer </Td> <Td> East Germany Germany </Td> <Td> Canoeing </Td> <Td> 1980 -- 2004 </Td> <Td> Summer </Td> <Td> </Td> <Td> 8 </Td> <Td> </Td> <Td> 0 </Td> <Td> 12 </Td> </Tr> <Tr> <Th> 10 </Th> <Td> Kato , Sawao Sawao Kato </Td> <Td> Japan </Td> <Td> Gymnastics </Td> <Td> 1968 -- 1976 </Td> <Td> Summer </Td> <Td> </Td> <Td> 8 </Td> <Td> </Td> <Td> </Td> <Td> 12 </Td> </Tr> <Tr> <Td> Thompson , Jenny Jenny Thompson </Td> <Td> United States </Td> <Td> Swimming </Td> <Td> 1992 -- 2004 </Td> <Td> Summer </Td> <Td> </Td> <Td> 8 </Td> <Td> </Td> <Td> </Td> <Td> 12 </Td> </Tr> <Tr> <Th> 12 </Th> <Td> Biondi , Matt Matt Biondi </Td> <Td> United States </Td> <Td> Swimming </Td> <Td> 1984 -- 1992 </Td> <Td> Summer </Td> <Td> </Td> <Td> 8 </Td> <Td> </Td> <Td> </Td> <Td> 11 </Td> </Tr> <Tr> <Th> 13 </Th> <Td> Bolt , Usain Usain Bolt </Td> <Td> Jamaica </Td> <Td> Athletics </Td> <Td> 2008 -- 2016 </Td> <Td> Summer </Td> <Td> </Td> <Td> 8 </Td> <Td> 0 </Td> <Td> 0 </Td> <Td> 8 </Td> </Tr> <Tr> <Td> Ewry , Ray Ray Ewry </Td> <Td> United States </Td> <Td> Athletics </Td> <Td> 1900 -- 1908 </Td> <Td> Summer </Td> <Td> </Td> <Td> 8 </Td> <Td> 0 </Td> <Td> 0 </Td> <Td> 8 </Td> </Tr> <Tr> <Th> 15 </Th> <Td> Andrianov , Nikolai Nikolai Andrianov </Td> <Td> Soviet Union </Td> <Td> Gymnastics </Td> <Td> 1972 -- 1980 </Td> <Td> Summer </Td> <Td> </Td> <Td> 7 </Td> <Td> 5 </Td> <Td> </Td> <Td> 15 </Td> </Tr> <Tr> <Th> 16 </Th> <Td> Shakhlin , Boris Boris Shakhlin </Td> <Td> Soviet Union </Td> <Td> Gymnastics </Td> <Td> 1956 -- 1964 </Td> <Td> Summer </Td> <Td> </Td> <Td> 7 </Td> <Td> </Td> <Td> </Td> <Td> 13 </Td> </Tr> <Tr> <Th> 17 </Th> <Td> \u010c\u00e1slavsk\u00e1 , V\u011bra V\u011bra \u010c\u00e1slavsk\u00e1 </Td> <Td> Czechoslovakia </Td> <Td> Gymnastics </Td> <Td> 1960 -- 1968 </Td> <Td> Summer </Td> <Td> </Td> <Td> 7 </Td> <Td> </Td> <Td> 0 </Td> <Td> 11 </Td> </Tr> <Tr> <Th> 18 </Th> <Td> Chukarin , Viktor Viktor Chukarin </Td> <Td> Soviet Union </Td> <Td> Gymnastics </Td> <Td> 1952 -- 1956 </Td> <Td> Summer </Td> <Td> </Td> <Td> 7 </Td> <Td> </Td> <Td> </Td> <Td> 11 </Td> </Tr> <Tr> <Th> 19 </Th> <Td> Gerevich , Alad\u00e1r Alad\u00e1r Gerevich </Td> <Td> Hungary </Td> <Td> Fencing </Td> <Td> 1932 -- 1960 </Td> <Td> Summer </Td> <Td> </Td> <Td> 7 </Td> <Td> </Td> <Td> </Td> <Td> 10 </Td> </Tr> <Tr> <Th> 20 </Th> <Td> Mangiarotti , Edoardo Edoardo Mangiarotti </Td> <Td> Italy </Td> <Td> Fencing </Td> <Td> 1936 -- 1960 </Td> <Td> Summer </Td> <Td> </Td>",
    "topic": "A comparison of the medal distribution (gold, silver, bronze) among the top athletes.",
    "response": "```xml\n<document_analysis>\nThe provided context is a table listing athletes with their medal counts (Gold, Silver, Bronze) across various Olympic games. The table includes athlete name, nation, sport, years of participation, game type (Summer/Winter), and gender. The data appears clean and relevant to the stated topic of medal distribution. The question will focus on comparative analysis of medal distribution among these top athletes. Difficulty is rated 8/10, requiring the user to synthesize data and consider the implications of differing medal distributions.\n</document_analysis>\n<output_format>\nQuestion: Considering the athletes listed, which of the following statements best characterizes a potential trade-off observed between the total number of medals won and the proportion of those medals that are gold?\nA: Athletes with a higher total medal count consistently demonstrate a higher proportion of gold medals, reflecting sustained dominance.\nB: There is a negative correlation, suggesting that athletes accumulating a larger total medal count tend to have a comparatively lower proportion of gold medals.\nC: The proportion of gold medals is independent of the total medal count, indicating equal success across all medal types for all athletes.\nD: Athletes specializing in Winter Olympic sports consistently exhibit a higher proportion of gold medals compared to those in Summer Olympic sports.\nExplanation: Examining the data, athletes like Phelps and Latynina have high total medal counts but a relatively lower proportion of gold compared to athletes like Nurmi or Spitz. This suggests a trade-off \u2013 accumulating more medals overall might involve accepting a lower percentage of gold as competition increases or as athletes participate in a wider range of events.\nCorrect Answer: B\n</output_format>\n```",
    "question": "Considering the athletes listed, which of the following statements best characterizes a potential trade-off observed between the total number of medals won and the proportion of those medals that are gold?",
    "choices": {
      "A": "Athletes with a higher total medal count consistently demonstrate a higher proportion of gold medals, reflecting sustained dominance.",
      "B": "There is a negative correlation, suggesting that athletes accumulating a larger total medal count tend to have a comparatively lower proportion of gold medals.",
      "C": "The proportion of gold medals is independent of the total medal count, indicating equal success across all medal types for all athletes.",
      "D": "Athletes specializing in Winter Olympic sports consistently exhibit a higher proportion of gold medals compared to those in Summer Olympic sports."
    },
    "answer": "B",
    "explanation": "Examining the data, athletes like Phelps and Latynina have high total medal counts but a relatively lower proportion of gold compared to athletes like Nurmi or Spitz. This suggests a trade-off \u2013 accumulating more medals overall might involve accepting a lower percentage of gold as competition increases or as athletes participate in a wider range of events.",
    "question_token_count": 35,
    "answer_correctness_score": 8,
    "explanation_validity_score": 9,
    "question_clarity_score": 8,
    "question_difficulty_score": 6,
    "question_groundedness_score": 10,
    "avg_answer_token_count": 24
  },
  {
    "context": "<P> `` Flight '' is the twenty - fourth and final episode of the eighth season of the American television medical drama Grey 's Anatomy , and the show 's 172nd episode overall . It was written by series creator Shonda Rhimes , and directed by Rob Corn . The episode was originally broadcast on the American Broadcasting Company ( ABC ) in the United States on May 17 , 2012 . In the episode , six doctors from Seattle Grace Mercy West Hospital who are victims of an aviation accident fight to stay alive , but Dr. Lexie Grey ( Chyler Leigh ) ultimately dies . Other storylines occur in Seattle where Dr. Richard Webber ( James Pickens , Jr . ) plans his annual dinner for the departing residents , Dr. Owen Hunt ( Kevin McKidd ) fires Dr. Teddy Altman ( Kim Raver ) , and Dr. Miranda Bailey ( Chandra Wilson ) gets engaged . </P>",
    "topic": "Kim Raver plays Dr. Teddy Altman, whose character experiences a professional setback in \"Flight\".",
    "response": "```xml\n<document_analysis>\n1. **Thoughtful Content Examination:** The context describes the final episode of Grey's Anatomy's eighth season, \"Flight.\" It details the events occurring both at the crash site and in Seattle, including Dr. Lexie Grey's death, Dr. Richard Webber's dinner, Dr. Owen Hunt firing Dr. Teddy Altman, and Dr. Miranda Bailey's engagement. The core information revolves around the consequences of a plane crash and subsequent professional/personal events.\n\n2. **Concept Exploration:** The firing of Dr. Altman is a key plot point, indicating a significant professional setback for her character. This raises questions about the reasons for her dismissal and its implications for her career trajectory within the show. The context doesn't explicitly state *why* she was fired, only *that* she was. This presents an opportunity for a challenging question requiring inference.\n\n3. **Strategic Complexity Calibration:** Difficulty: 8/10. The question will focus on the subtle implications of the firing and requires understanding the power dynamics within the hospital setting.\n\n4. **Intentional Question Planning:** The question will aim to probe understanding of the professional repercussions of Dr. Hunt's decision, requiring the expert to consider the context of a high-pressure medical environment and potential motivations behind the firing.\n</document_analysis>\n\n<output_format>\nQuestion: Within the narrative of \"Flight,\" Dr. Owen Hunt\u2019s decision to terminate Dr. Teddy Altman\u2019s employment most directly reflects which operational dynamic within Seattle Grace Mercy West Hospital?\nA: A prioritization of resident mentorship over experienced attending physicians.\nB: A restructuring initiative focused on streamlining administrative overhead.\nC: An assertion of authority following a crisis situation and potential accountability concerns.\nD: A strategic reallocation of resources toward specialized trauma care.\nExplanation: The context states Dr. Hunt \"fires Dr. Teddy Altman,\" coinciding with the aftermath of a major aviation accident. This suggests the firing is connected to the crisis and potentially to establishing control or assigning blame, aligning with option C. The context does not support the other options.\nCorrect Answer: C\n</output_format>\n```",
    "question": "Within the narrative of \"Flight,\" Dr. Owen Hunt\u2019s decision to terminate Dr. Teddy Altman\u2019s employment most directly reflects which operational dynamic within Seattle Grace Mercy West Hospital?",
    "choices": {
      "A": "A prioritization of resident mentorship over experienced attending physicians.",
      "B": "A restructuring initiative focused on streamlining administrative overhead.",
      "C": "An assertion of authority following a crisis situation and potential accountability concerns.",
      "D": "A strategic reallocation of resources toward specialized trauma care."
    },
    "answer": "C",
    "explanation": "The context states Dr. Hunt \"fires Dr. Teddy Altman,\" coinciding with the aftermath of a major aviation accident. This suggests the firing is connected to the crisis and potentially to establishing control or assigning blame, aligning with option C. The context does not support the other options.",
    "question_token_count": 35,
    "answer_correctness_score": 10,
    "explanation_validity_score": 10,
    "question_clarity_score": 4,
    "question_difficulty_score": 6,
    "question_groundedness_score": 7,
    "avg_answer_token_count": 12
  },
  {
    "context": "<P> Human fertilization is the union of a human egg and sperm , usually occurring in the ampulla of the fallopian tube . The result of this union is the production of a zygote cell , or fertilized egg , initiating prenatal development . Scientists discovered the dynamics of human fertilization in the nineteenth century . </P>",
    "topic": "Summarize the historical context regarding the scientific understanding of the dynamics of human fertilization.",
    "response": "```xml\n<document_analysis>\n<Thoughtful_Content_Examination>The provided text segment concisely defines human fertilization and its initial outcome (zygote formation) and states the timeframe for its scientific discovery (nineteenth century). The key idea is the location and timing of the scientific understanding of fertilization.</Thoughtful_Content_Examination>\n<Concept_Exploration>The text implicitly contrasts a time *before* scientific understanding with a time *after*. It doesn't detail *how* the understanding evolved, only *when*. A challenging question could focus on the broader scientific context of 19th-century biology to infer what enabled this discovery.</Concept_Exploration>\n<Strategic_Complexity_Calibration>Difficulty: 7/10. The text is simple, but a good question will require knowledge outside the provided snippet. The challenge is to connect the provided fact to a broader historical understanding of scientific methodology.</Strategic_Complexity_Calibration>\n<Intentional_Question_Planning>The question will test the domain expert's understanding of what scientific advancements in the 19th century were necessary to understand fertilization, rather than simply recalling the stated fact. The question focuses on the *enabling* factors for discovery.</Intentional_Question_Planning>\n</document_analysis>\n<output_format>\nQuestion: The nineteenth-century elucidation of human fertilization dynamics was most directly enabled by advancements in which related scientific field?\nA: Mendelian genetics and the understanding of inherited traits.\nB: Microscopy and the detailed observation of cellular processes.\nC: Statistical analysis of population demographics and reproductive rates.\nD: Chemical synthesis of organic compounds and hormonal regulation.\nExplanation: The discovery of the dynamics of human fertilization required the ability to observe the egg and sperm, and their interaction, at a microscopic level. While other fields were developing concurrently, advancements in microscopy were the most directly enabling factor.\nCorrect Answer: B\n</output_format>\n```",
    "question": "The nineteenth-century elucidation of human fertilization dynamics was most directly enabled by advancements in which related scientific field?",
    "choices": {
      "A": "Mendelian genetics and the understanding of inherited traits.",
      "B": "Microscopy and the detailed observation of cellular processes.",
      "C": "Statistical analysis of population demographics and reproductive rates.",
      "D": "Chemical synthesis of organic compounds and hormonal regulation."
    },
    "answer": "B",
    "explanation": "The discovery of the dynamics of human fertilization required the ability to observe the egg and sperm, and their interaction, at a microscopic level. While other fields were developing concurrently, advancements in microscopy were the most directly enabling factor.",
    "question_token_count": 22,
    "answer_correctness_score": 10,
    "explanation_validity_score": 10,
    "question_clarity_score": 6,
    "question_difficulty_score": 7,
    "question_groundedness_score": 4,
    "avg_answer_token_count": 10
  },
  {
    "context": "<P> Article Five of the United States Constitution describes the process whereby the Constitution , the nation 's frame of government , may be altered . Altering the Constitution consists of proposing an amendment or amendments and subsequent ratification . Amendments may be proposed either by the Congress with a two - thirds vote in both the House of Representatives and the Senate or by a convention of states called for by two - thirds of the state legislatures . To become part of the Constitution , an amendment must be ratified by either -- as determined by Congress -- the legislatures of three - quarters of the states or state ratifying conventions in three - quarters of the states . The vote of each state ( to either ratify or reject a proposed amendment ) carries equal weight , regardless of a state 's population or length of time in the Union . </P>",
    "topic": "Explain how the principle of equal state representation is applied during the constitutional amendment ratification process.",
    "response": "```xml\n<document_analysis>\n<Thoughtful_Content_Examination>\nThe provided text segment details the amendment process outlined in Article Five of the U.S. Constitution. It highlights the two methods of proposing amendments (Congress or state conventions) and the two methods of ratification (state legislatures or state conventions). A key point is that each state's vote holds equal weight during ratification, irrespective of its population or seniority.\n</Thoughtful_Content_Examination>\n<Concept_Exploration>\nThe concept of \"equal state representation\" is central to understanding the amendment process. This principle, also evident in the Senate, ensures that smaller states aren't overshadowed by larger ones when fundamental changes to the Constitution are considered. The text implicitly connects this principle to the broader goal of maintaining a balance of power within the federal system.\n</Concept_Exploration>\n<Strategic_Complexity_Calibration>\nDifficulty: 8/10. The question requires understanding a nuanced aspect of constitutional law and applying it to a specific process. It's not a simple recall question but requires inferential reasoning.\n</Strategic_Complexity_Calibration>\n<Intentional_Question_Planning>\nThe question will focus on how the principle of equal state representation manifests itself specifically in the ratification stage, challenging the test-taker to connect a broad constitutional principle to a procedural detail. The distractors will focus on aspects of the amendment process that are *not* related to equal state representation, or misrepresent the process.\n</Intentional_Question_Planning>\n</document_analysis>\n\n<output_format>\nQuestion: During the constitutional amendment ratification process, how is the principle of equal state representation specifically demonstrated?\nA: Amendments are proposed by Congress, ensuring representation based on population.\nB: Each state\u2019s vote carries the same weight, irrespective of its population or time in the Union.\nC: Ratification requires a simple majority vote in both the House and Senate.\nD: State ratifying conventions are weighted based on the state's contribution to the national economy.\nExplanation: The text explicitly states, \"The vote of each state (to either ratify or reject a proposed amendment) carries equal weight, regardless of a state\u2019s population or length of time in the Union.\" This directly demonstrates equal state representation.\nCorrect Answer: B\n</output_format>\n```",
    "question": "During the constitutional amendment ratification process, how is the principle of equal state representation specifically demonstrated?",
    "choices": {
      "A": "Amendments are proposed by Congress, ensuring representation based on population.",
      "B": "Each state\u2019s vote carries the same weight, irrespective of its population or time in the Union.",
      "C": "Ratification requires a simple majority vote in both the House and Senate.",
      "D": "State ratifying conventions are weighted based on the state's contribution to the national economy."
    },
    "answer": "B",
    "explanation": "The text explicitly states, \"The vote of each state (to either ratify or reject a proposed amendment) carries equal weight, regardless of a state\u2019s population or length of time in the Union.\" This directly demonstrates equal state representation.",
    "question_token_count": 20,
    "answer_correctness_score": 10,
    "explanation_validity_score": 10,
    "question_clarity_score": 8,
    "question_difficulty_score": 6,
    "question_groundedness_score": 10,
    "avg_answer_token_count": 16
  },
  {
    "context": "<P> A player has taken two hat - tricks in the same Test match only once . Playing for Australia against South Africa in the first match of the 1912 Triangular Tournament at Old Trafford , Manchester , England , leg spinner Jimmy Matthews took a hat - trick in South Africa 's first and second innings , both taken on 28 May 1912 . He completed both hat - tricks by dismissing South Africa 's Tommy Ward . Only three other cricketers have taken more than one Test hat - trick : Australian off spinner Hugh Trumble ( two years apart , between the same teams at the same ground ) , Pakistani fast bowler Wasim Akram ( just over a week apart , in consecutive matches between the same teams ) and English fast bowler Stuart Broad . Three players have taken a hat - trick on their Test debut : English medium pace bowler Maurice Allom in 1930 , New Zealand off - spinner Peter Petherick in 1976 , and Australian pace bowler Damien Fleming in 1994 . Geoff Griffin took the fewest total Test wickets of any player who recorded a hat - trick , taking only eight wickets in his entire Test career . During the match in which he took his hat - trick , Griffin was repeatedly called for throwing by the umpires and never bowled again in a Test match . Australian Peter Siddle is the only bowler to take a hat - trick on his birthday , and Bangladeshi off spinner Sohag Gazi is the only player to score a century and take a hat - trick in the same Test match . </P>",
    "topic": "Geoff Griffin holds the record for the fewest total Test wickets among players who have taken a hat-trick, with only eight wickets in his entire career.",
    "response": "<document_analysis>\n1. **Thoughtful Content Examination:** The text details various unique achievements related to Test cricket hat-tricks. It covers instances of multiple hat-tricks in a match, hat-tricks on debut, and other noteworthy occurrences. A key piece of information is Geoff Griffin's record of the fewest Test wickets taken by a hat-trick taker.\n2. **Concept Exploration:** The passage highlights the statistical anomalies and interesting stories surrounding hat-tricks, moving beyond a simple definition of the event. It implicitly explores the idea of a player achieving a rare feat (hat-trick) while having an otherwise unremarkable career (Griffin).\n3. **Strategic Complexity Calibration:** Difficulty: 9/10. The question will focus on a subtle detail within the context of multiple facts, requiring precise recall and understanding.\n4. **Intentional Question Planning:** The question will be framed to assess the understanding of lesser-known records related to Test hat-tricks, specifically targeting Griffin\u2019s unique statistic. The distractors will be plausible, drawing from other facts presented in the text.\n</document_analysis>\n\n<output_format>\nQuestion: Which player holds the distinction of having recorded a Test hat-trick while simultaneously possessing the fewest total Test wickets throughout their entire career?\nA: Jimmy Matthews\nB: Hugh Trumble\nC: Geoff Griffin\nD: Maurice Allom\nExplanation: The text explicitly states that \"Geoff Griffin took the fewest total Test wickets of any player who recorded a hat-trick, taking only eight wickets in his entire Test career.\"\nCorrect Answer: C\n</output_format>",
    "question": "Which player holds the distinction of having recorded a Test hat-trick while simultaneously possessing the fewest total Test wickets throughout their entire career?",
    "choices": {
      "A": "Jimmy Matthews",
      "B": "Hugh Trumble",
      "C": "Geoff Griffin",
      "D": "Maurice Allom"
    },
    "answer": "C",
    "explanation": "The text explicitly states that \"Geoff Griffin took the fewest total Test wickets of any player who recorded a hat-trick, taking only eight wickets in his entire Test career.\"",
    "question_token_count": 28,
    "answer_correctness_score": 10,
    "explanation_validity_score": 10,
    "question_clarity_score": 8,
    "question_difficulty_score": 6,
    "question_groundedness_score": 10,
    "avg_answer_token_count": 4
  },
  {
    "context": "<Table> <Tr> <Th> Rank </Th> <Th> Points </Th> <Th> Player </Th> <Th> Date </Th> <Th> 1st </Th> <Th> 2nd </Th> <Th> 3rd </Th> <Th> 4th </Th> <Th> Team </Th> <Th> Opponent </Th> <Th> Score </Th> <Th> MP </Th> <Th> FGM </Th> <Th> FGA </Th> <Th> 3PM </Th> <Th> 3PA </Th> <Th> FTM </Th> <Th> FTA </Th> <Th> Notes </Th> <Th> Ref . </Th> </Tr> <Tr> <Th colspan=\"4\"> Scoring by quarter </Th> </Tr> <Tr> <Td> </Td> <Td> 100 </Td> <Td> Chamberlain , Wilt Wilt Chamberlain * </Td> <Td> 000000001962 - 03 - 02 - 0000 March 2 , 1962 </Td> <Td> 23 </Td> <Td> 18 </Td> <Td> 28 </Td> <Td> 31 </Td> <Td> Philadelphia Warriors </Td> <Td> New York Knicks </Td> <Td> 169 -- 147 </Td> <Td> 48 </Td> <Td> 36 </Td> <Td> 63 </Td> <Td> -- </Td> <Td> -- </Td> <Td> 28 </Td> <Td> 32 </Td> <Td> </Td> <Td> </Td> </Tr> <Tr> <Td> </Td> <Td> 81 </Td> <Td> Bryant , Kobe Kobe Bryant </Td> <Td> 000000002006 - 01 - 22 - 0000 January 22 , 2006 </Td> <Td> 14 </Td> <Td> 12 </Td> <Td> 27 </Td> <Td> 28 </Td> <Td> Los Angeles Lakers </Td> <Td> Toronto Raptors </Td> <Td> 122 -- 104 </Td> <Td> 41 : 56 </Td> <Td> 28 </Td> <Td> 46 </Td> <Td> 7 </Td> <Td> 13 </Td> <Td> 18 </Td> <Td> 20 </Td> <Td> </Td> <Td> </Td> </Tr> <Tr> <Td> </Td> <Td> 78 </Td> <Td> Chamberlain , Wilt Wilt Chamberlain * </Td> <Td> 000000001961 - 12 - 08 - 0000 December 8 , 1961 </Td> <Td> -- </Td> <Td> -- </Td> <Td> -- </Td> <Td> -- </Td> <Td> Philadelphia Warriors </Td> <Td> Los Angeles Lakers </Td> <Td> 147 -- 151 </Td> <Td> 63 </Td> <Td> 31 </Td> <Td> 62 </Td> <Td> -- </Td> <Td> -- </Td> <Td> 16 </Td> <Td> 31 </Td> <Td> </Td> <Td> </Td> </Tr> <Tr> <Td> </Td> <Td> 73 </Td> <Td> Chamberlain , Wilt Wilt Chamberlain * </Td> <Td> 000000001962 - 01 - 13 - 0000 January 13 , 1962 </Td> <Td> -- </Td> <Td> -- </Td> <Td> -- </Td> <Td> -- </Td> <Td> Philadelphia Warriors </Td> <Td> Chicago Packers </Td> <Td> 135 -- 117 </Td> <Td> 48 </Td> <Td> 29 </Td> <Td> 48 </Td> <Td> -- </Td> <Td> -- </Td> <Td> 15 </Td> <Td> 25 </Td> <Td> </Td> <Td> </Td> </Tr> <Tr> <Td> 73 </Td> <Td> Chamberlain , Wilt Wilt Chamberlain * </Td> <Td> 000000001962 - 11 - 16 - 0000 November 16 , 1962 </Td> <Td> -- </Td> <Td> -- </Td> <Td> -- </Td> <Td> -- </Td> <Td> San Francisco Warriors </Td> <Td> New York Knicks </Td> <Td> 127 -- 111 </Td> <Td> 48 </Td> <Td> 29 </Td> <Td> 43 </Td> <Td> -- </Td> <Td> -- </Td> <Td> 15 </Td> <Td> 19 </Td> <Td> </Td> <Td> </Td> </Tr> <Tr> <Td> 73 </Td> <Td> Thompson , David David Thompson * </Td> <Td> 000000001978 - 04 - 09 - 0000 April 9 , 1978 </Td> <Td> 32 </Td> <Td> 21 </Td> <Td> 9 </Td> <Td> 11 </Td> <Td> Denver Nuggets </Td> <Td> Detroit Pistons </Td> <Td> 137 -- 139 </Td> <Td> 43 </Td> <Td> 28 </Td> <Td> 38 </Td> <Td> -- </Td> <Td> -- </Td> <Td> 17 </Td> <Td> 20 </Td> <Td> </Td> <Td> </Td> </Tr> <Tr> <Td> 7 </Td> <Td> 72 </Td> <Td> Chamberlain , Wilt Wilt Chamberlain * </Td> <Td> 000000001962 - 11 - 03 - 0000 November 3 , 1962 </Td> <Td> -- </Td> <Td> -- </Td> <Td> -- </Td> <Td> -- </Td> <Td> San Francisco Warriors </Td> <Td> Los Angeles Lakers </Td> <Td> 115 -- 127 </Td> <Td> -- </Td> <Td> 29 </Td> <Td> 48 </Td> <Td> -- </Td> <Td> -- </Td> <Td> 14 </Td> <Td> 18 </Td> <Td> </Td> <Td> </Td> </Tr> <Tr> <Td> 8 </Td> <Td> 71 </Td> <Td> Baylor , Elgin Elgin Baylor * </Td> <Td> 000000001960 - 11 - 15 - 0000 November 15 , 1960 </Td> <Td> -- </Td> <Td> -- </Td> <Td> -- </Td> <Td> -- </Td> <Td> Los Angeles Lakers </Td> <Td> New York Knicks </Td> <Td> 123 -- 108 </Td> <Td> 45 </Td> <Td> 28 </Td> <Td> 48 </Td> <Td> -- </Td> <Td> -- </Td> <Td> 15 </Td> <Td> 18 </Td> <Td> </Td> <Td> </Td> </Tr> <Tr> <Td> 71 </Td> <Td> Robinson , David David Robinson * </Td> <Td> 000000001994 - 04 - 24 - 0000 April 24 , 1994 </Td> <Td> 18 </Td> <Td> 6 </Td> <Td> 19 </Td> <Td> 28 </Td> <Td> San Antonio Spurs </Td> <Td> Los Angeles Clippers </Td> <Td> 112 -- 97 </Td> <Td> 44 </Td> <Td> 26 </Td> <Td> 41 </Td> <Td> </Td> <Td> </Td> <Td> 18 </Td> <Td> 25 </Td> <Td> </Td> <Td> </Td> </Tr> <Tr> <Td> 10 </Td> <Td> 70 </Td> <Td> Chamberlain , Wilt Wilt Chamberlain * </Td> <Td> 000000001963 - 03 -",
    "topic": "Analysis of David Thompson\u2019s 73-point game and its context within the 1978 NBA season.",
    "response": "```\n<document_analysis>\nThe provided context is a table detailing high-scoring games in NBA history, specifically focusing on games where players scored 70 or more points. The table includes details like date, opponent, score, minutes played, and shooting statistics. The table includes multiple instances of Wilt Chamberlain scoring 100, 78, and 73 points, alongside other high-scoring performances by players like Kobe Bryant and David Thompson. The question will focus on David Thompson's 73-point game and its significance within the context of the 1978 NBA season, requiring a nuanced understanding of the data presented. The difficulty is rated as 8/10, as it requires recognizing Thompson's achievement relative to other high-scoring games and understanding the broader historical context.\n</document_analysis>\n\n<output_format>\nQuestion: Considering the historical context presented in the table, David Thompson\u2019s 73-point game on April 9, 1978, shares a scoring total with which other player(s) listed?\nA: Kobe Bryant\nB: Wilt Chamberlain\nC: Elgin Baylor\nD: David Robinson\nExplanation: The table clearly shows that both David Thompson and Wilt Chamberlain have recorded games with 73 points. This requires careful reading and comparison of the data within the table.\nCorrect Answer: B\n</output_format>\n```",
    "question": "Considering the historical context presented in the table, David Thompson\u2019s 73-point game on April 9, 1978, shares a scoring total with which other player(s) listed?",
    "choices": {
      "A": "Kobe Bryant",
      "B": "Wilt Chamberlain",
      "C": "Elgin Baylor",
      "D": "David Robinson"
    },
    "answer": "B",
    "explanation": "The table clearly shows that both David Thompson and Wilt Chamberlain have recorded games with 73 points. This requires careful reading and comparison of the data within the table.",
    "question_token_count": 38,
    "answer_correctness_score": 10,
    "explanation_validity_score": 10,
    "question_clarity_score": 8,
    "question_difficulty_score": 4,
    "question_groundedness_score": 10,
    "avg_answer_token_count": 4
  },
  {
    "context": "<P> The Statue of Liberty ( Liberty Enlightening the World ; French : La Libert\u00e9 \u00e9clairant le monde ) is a colossal neoclassical sculpture on Liberty Island in New York Harbor in New York City , in the United States . The copper statue , a gift from the people of France to the people of the United States , was designed by French sculptor Fr\u00e9d\u00e9ric Auguste Bartholdi and built by Gustave Eiffel . The statue was dedicated on October 28 , 1886 . </P>",
    "topic": "Characterize the architectural style of the Statue of Liberty as described in the text.",
    "response": "```xml\n<document_analysis>\n<Thoughtful_Content_Examination>The context describes the Statue of Liberty as a \"colossal neoclassical sculpture\" and mentions the key figures involved in its design and construction: Fr\u00e9d\u00e9ric Auguste Bartholdi and Gustave Eiffel. It also states its origin as a gift from France to the United States and the date of its dedication.</Thoughtful_Content_Examination>\n<Concept_Exploration>The key concept here is architectural style, specifically \"neoclassical.\" Understanding what defines neoclassical architecture is crucial. The text also implies a collaboration between sculpture and engineering (Bartholdi and Eiffel).</Concept_Exploration>\n<Strategic_Complexity_Calibration>Difficulty: 7/10. While the text directly states \"neoclassical,\" the challenge lies in understanding the implications of this style and distinguishing it from other architectural movements. The distractors will need to be plausible architectural styles.</Strategic_Complexity_Calibration>\n<Intentional_Question_Planning>The question will focus on identifying the architectural style of the Statue of Liberty, testing the examinee's understanding of art history and their ability to extract information from the text. The question will ask to identify the architectural style, and the incorrect answers will be plausible architectural styles that could be confused with neoclassical.</Intentional_Question_Planning>\n</document_analysis>\n<output_format>\nQuestion: The Statue of Liberty is explicitly characterized as belonging to which architectural style?\nA: Gothic\nB: Baroque\nC: Neoclassical\nD: Art Nouveau\nExplanation: The provided text directly states that the Statue of Liberty is a \"colossal neoclassical sculpture.\" This makes neoclassical the correct answer. The other options represent distinct architectural styles not mentioned in the context.\nCorrect Answer: C\n</output_format>\n```",
    "question": "The Statue of Liberty is explicitly characterized as belonging to which architectural style?",
    "choices": {
      "A": "Gothic",
      "B": "Baroque",
      "C": "Neoclassical",
      "D": "Art Nouveau"
    },
    "answer": "C",
    "explanation": "The provided text directly states that the Statue of Liberty is a \"colossal neoclassical sculpture.\" This makes neoclassical the correct answer. The other options represent distinct architectural styles not mentioned in the context.",
    "question_token_count": 16,
    "answer_correctness_score": 10,
    "explanation_validity_score": 10,
    "question_clarity_score": 8,
    "question_difficulty_score": 2,
    "question_groundedness_score": 10,
    "avg_answer_token_count": 3
  },
  {
    "context": "<P> `` Let It Go '' is a song from Disney 's 2013 animated feature film Frozen , whose music and lyrics were composed by husband - and - wife songwriting team Kristen Anderson - Lopez and Robert Lopez . The song was performed in its original show - tune version in the film by American actress and singer Idina Menzel in her vocal role as Queen Elsa . Anderson - Lopez and Lopez also composed a simplified pop version ( with shorter lyrics and background chorus ) which was performed by actress and singer Demi Lovato over the start of the film 's closing credits . A music video was separately released for the pop version . </P>",
    "topic": "Discuss the strategic purpose of releasing two distinct versions of \"Let It Go\" and how each version served different audiences or functions within the *Frozen* experience.",
    "response": "```xml\n<document_analysis>\n<thoughtful_content_examination>\nThe context describes the existence of two versions of the song \"Let It Go\" from *Frozen*: an original show-tune version sung by Idina Menzel within the film, and a simplified pop version sung by Demi Lovato during the credits. The context highlights the compositional team (Kristen Anderson-Lopez and Robert Lopez) and the differing performers. The key point is the intentional creation of two distinct versions.\n</thoughtful_content_examination>\n<concept_exploration>\nThe creation of two versions suggests a deliberate strategy to cater to different audiences and serve different functions. The show-tune version is integral to the narrative and character development within the film itself. The pop version, released with a music video, likely aimed for broader appeal and commercial success outside the film's immediate context. The simplification of lyrics and addition of a chorus in the pop version indicate a focus on accessibility and radio-friendliness.\n</concept_exploration>\n<strategic_complexity_calibration>\nDifficulty: 7/10. The context doesn't explicitly state *why* two versions were made, requiring inference. A domain expert would understand the common practice of releasing multiple versions of songs for different markets.\n</strategic_complexity_calibration>\n<intentional_question_planning>\nThe question will focus on the strategic rationale behind releasing two versions, prompting the expert to consider audience segmentation and marketing strategies. It will require them to infer the purpose of each version based on the provided details. The options will be designed to be plausible, testing the expert\u2019s understanding of the music industry and film marketing.\n</intentional_question_planning>\n</document_analysis>\n\n<output_format>\nQuestion: The release of both a show-tune version performed by Idina Menzel and a pop version performed by Demi Lovato of \u201cLet It Go\u201d most likely served which strategic purpose?\nA: To provide alternative vocal interpretations of the same emotional arc for artistic depth.\nB: To maximize commercial reach by catering to both audiences engaged with the film\u2019s narrative and broader pop music consumers.\nC: To offer a behind-the-scenes look at the songwriting process, demonstrating the evolution of the song.\nD: To create a competitive market for the song, driving up streaming numbers through comparative analysis.\nExplanation: The context states that a \"simplified pop version\" was created with \"shorter lyrics and background chorus,\" indicating an intent to broaden appeal beyond the film's core audience. This suggests a strategic effort to maximize commercial reach.\nCorrect Answer: B\n</output_format>\n```",
    "question": "The release of both a show-tune version performed by Idina Menzel and a pop version performed by Demi Lovato of \u201cLet It Go\u201d most likely served which strategic purpose?",
    "choices": {
      "A": "To provide alternative vocal interpretations of the same emotional arc for artistic depth.",
      "B": "To maximize commercial reach by catering to both audiences engaged with the film\u2019s narrative and broader pop music consumers.",
      "C": "To offer a behind-the-scenes look at the songwriting process, demonstrating the evolution of the song.",
      "D": "To create a competitive market for the song, driving up streaming numbers through comparative analysis."
    },
    "answer": "B",
    "explanation": "The context states that a \"simplified pop version\" was created with \"shorter lyrics and background chorus,\" indicating an intent to broaden appeal beyond the film's core audience. This suggests a strategic effort to maximize commercial reach.",
    "question_token_count": 38,
    "answer_correctness_score": 10,
    "explanation_validity_score": 10,
    "question_clarity_score": 6,
    "question_difficulty_score": 7,
    "question_groundedness_score": 5,
    "avg_answer_token_count": 19
  },
  {
    "context": "<P> The 2022 FIFA World Cup is scheduled to be the 22nd edition of the FIFA World Cup , the quadrennial international men 's football championship contested by the national teams of the member associations of FIFA . It is scheduled to take place in Qatar in 2022 . This will be the first World Cup ever to be held in the Arab world and the first in a Muslim - majority country . This will be the first World Cup held entirely in geographical Asia since the 2002 tournament in South Korea and Japan ( the 2018 competition in Russia featured one geographically Asian venue , Yekaterinburg ) . In addition the tournament will be the last to involve 32 teams , with an increase to 48 teams scheduled for the 2026 tournament . </P>",
    "topic": "Understanding the quadrennial nature of the FIFA World Cup and its role as an international men's football championship.",
    "response": "<document_analysis>\n1. **Thoughtful Content Examination**: The context describes the 2022 FIFA World Cup, emphasizing its unique aspects \u2013 the first in the Arab world, a Muslim-majority country, and the last with 32 teams before expanding to 48 in 2026. The core idea revolves around the quadrennial nature of the tournament.\n2. **Concept Exploration**: The text implicitly highlights the historical evolution of the World Cup, its geographical spread, and planned future changes. The context provides factual information suitable for testing a domain expert's knowledge about the tournament's key characteristics.\n3. **Strategic Complexity Calibration**: Difficulty: 8/10. The question aims to test the expert\u2019s understanding of the tournament\u2019s planned expansion and its implications for future events. The options are designed to be plausible, requiring a precise grasp of the details.\n4. **Intentional Question Planning**: The question focuses on the upcoming change in the number of participating teams, testing the expert\u2019s awareness of the evolution of the tournament format. This is a critical aspect of the World Cup's history and future.\n</document_analysis>\n\n<output_format>\nQuestion: The 2022 FIFA World Cup in Qatar is notable for being the final tournament adhering to a specific team structure before a significant alteration. What defining characteristic of the 2026 FIFA World Cup will distinguish it from all previous iterations, including the 2022 event?\nA: The inclusion of teams exclusively from the African Confederation of Football.\nB: A shift to bi-annual competition cycles, aligning with the Olympic Games.\nC: An expansion of the total number of participating national teams.\nD: The implementation of a new offside rule utilizing video assistant referees.\nExplanation: The text explicitly states that the 2022 tournament will be the last to involve 32 teams, with an increase to 48 teams scheduled for the 2026 tournament. This is a key change in the tournament's structure.\nCorrect Answer: C\n</output_format>",
    "question": "The 2022 FIFA World Cup in Qatar is notable for being the final tournament adhering to a specific team structure before a significant alteration. What defining characteristic of the 2026 FIFA World Cup will distinguish it from all previous iterations, including the 2022 event?",
    "choices": {
      "A": "The inclusion of teams exclusively from the African Confederation of Football.",
      "B": "A shift to bi-annual competition cycles, aligning with the Olympic Games.",
      "C": "An expansion of the total number of participating national teams.",
      "D": "The implementation of a new offside rule utilizing video assistant referees."
    },
    "answer": "C",
    "explanation": "The text explicitly states that the 2022 tournament will be the last to involve 32 teams, with an increase to 48 teams scheduled for the 2026 tournament. This is a key change in the tournament's structure.",
    "question_token_count": 54,
    "answer_correctness_score": 10,
    "explanation_validity_score": 10,
    "question_clarity_score": 4,
    "question_difficulty_score": 3,
    "question_groundedness_score": 10,
    "avg_answer_token_count": 14
  },
  {
    "context": "<P> The Pittsburgh Steelers ( 6 -- 2 ) have won the most Super Bowls with six championships , while the New England Patriots ( 5 -- 5 ) , the Dallas Cowboys ( 5 -- 3 ) , and the San Francisco 49ers ( 5 -- 1 ) have five wins . New England has the most Super Bowl appearances with ten , while the Buffalo Bills ( 0 -- 4 ) have the most consecutive appearances with four ( all losses ) from 1990 to 1993 . The Miami Dolphins are the only other team to have at least three consecutive appearances : 1972 -- 1974 . The Denver Broncos ( 3 -- 5 ) and Patriots have each lost a record five Super Bowls . The Minnesota Vikings ( 0 -- 4 ) and the Bills have lost four . The record for consecutive wins is two and is shared by seven franchises : the Green Bay Packers ( 1966 -- 1967 ) , the Miami Dolphins ( 1972 -- 1973 ) , the Pittsburgh Steelers ( 1974 -- 1975 and 1978 -- 1979 , the only team to accomplish this feat twice ) , the San Francisco 49ers ( 1988 -- 1989 ) , the Dallas Cowboys ( 1992 -- 1993 ) , the Denver Broncos ( 1997 -- 1998 ) , and the New England Patriots ( 2003 -- 2004 ) . Among those , Dallas ( 1992 -- 1993 ; 1995 ) and New England ( 2001 ; 2003 -- 2004 ) are the only teams to win three out of four consecutive Super Bowls . The 1972 Dolphins capped off the only perfect season in NFL history with their victory in Super Bowl VII . The only team with multiple Super Bowl appearances and no losses is the Baltimore Ravens , who in winning Super Bowl XLVII defeated and replaced the 49ers in that position . Four current NFL teams have never appeared in a Super Bowl , including franchise relocations and renaming : the Cleveland Browns , Detroit Lions , Jacksonville Jaguars , and Houston Texans , though both the Browns ( 1964 ) and Lions ( 1957 ) had won NFL championship games prior to the creation of the Super Bowl . </P>",
    "topic": "Identify the NFL team with the most Super Bowl championships and their total number of wins.",
    "response": "```xml\n<document_analysis>\n1. **Thoughtful Content Examination:** The text provides a historical overview of Super Bowl appearances, wins, and losses for various NFL teams. It highlights records for wins, appearances, consecutive appearances, and consecutive wins. The central idea is the competitive history of the Super Bowl and the teams that have dominated it.\n2. **Concept Exploration:** The text implicitly explores the evolution of the NFL and the changing landscape of team success. It touches on the significance of historical context, such as pre-Super Bowl championships, and the impact of franchise relocations.\n3. **Strategic Complexity Calibration:** Difficulty: 8/10. This question requires not just recall of a single fact, but also the ability to synthesize information about multiple teams and their Super Bowl records. The answer isn't immediately obvious and requires careful consideration of the provided data.\n4. **Intentional Question Planning:** The question is designed to test the domain expert\u2019s ability to quickly extract and synthesize specific data points from the text, demonstrating their understanding of NFL history and Super Bowl records. The distractors are plausible teams with significant Super Bowl histories.\n</document_analysis>\n<output_format>\nQuestion: Which NFL franchise currently holds the record for the most Super Bowl championships?\nA: New England Patriots\nB: Dallas Cowboys\nC: Pittsburgh Steelers\nD: San Francisco 49ers\nExplanation: The text explicitly states, \u201cThe Pittsburgh Steelers (6 -- 2) have won the most Super Bowls with six championships.\u201d\nCorrect Answer: C\n</output_format>\n```",
    "question": "Which NFL franchise currently holds the record for the most Super Bowl championships?",
    "choices": {
      "A": "New England Patriots",
      "B": "Dallas Cowboys",
      "C": "Pittsburgh Steelers",
      "D": "San Francisco 49ers"
    },
    "answer": "C",
    "explanation": "The text explicitly states, \u201cThe Pittsburgh Steelers (6 -- 2) have won the most Super Bowls with six championships.\u201d",
    "question_token_count": 15,
    "answer_correctness_score": 10,
    "explanation_validity_score": 10,
    "question_clarity_score": 10,
    "question_difficulty_score": 5,
    "question_groundedness_score": 10,
    "avg_answer_token_count": 4
  },
  {
    "context": "<P> The Statue of Liberty ( Liberty Enlightening the World ; French : La Libert\u00e9 \u00e9clairant le monde ) is a colossal neoclassical sculpture on Liberty Island in New York Harbor in New York City , in the United States . The copper statue , a gift from the people of France to the people of the United States , was designed by French sculptor Fr\u00e9d\u00e9ric Auguste Bartholdi and built by Gustave Eiffel . The statue was dedicated on October 28 , 1886 . </P>",
    "topic": "Specify the geographical location of the Statue of Liberty within the United States.",
    "response": "```xml\n<document_analysis>\n1. **Thoughtful Content Examination:** The text provides a concise description of the Statue of Liberty, its origin, designer, builder, and dedication date. The key geographical information is its location on Liberty Island in New York Harbor, within New York City, in the United States.\n2. **Concept Exploration:** While seemingly straightforward, the question requires understanding the hierarchical geographical structure (Island within Harbor within City within State within Country). The question tests whether the expert understands the specific location rather than a general association with the US.\n3. **Strategic Complexity Calibration:** Difficulty: 7/10. The question is not trivial as it requires precise geographical knowledge. Incorrect answers will be plausible locations within the US.\n4. **Intentional Question Planning:** The question aims to assess the expert's recall of the statue's precise location, testing their attention to detail within the provided text. The distractors will be other prominent cities and geographical features in the US.\n</document_analysis>\n<output_format>\nQuestion: On which geographical feature is the Statue of Liberty located?\nA: Ellis Island, New York\nB: Liberty Island, New York\nC: Angel Island, California\nD: Governors Island, New York\nExplanation: The text explicitly states the Statue of Liberty is located on Liberty Island in New York Harbor.\nCorrect Answer: B\n</output_format>\n```",
    "question": "On which geographical feature is the Statue of Liberty located?",
    "choices": {
      "A": "Ellis Island, New York",
      "B": "Liberty Island, New York",
      "C": "Angel Island, California",
      "D": "Governors Island, New York"
    },
    "answer": "B",
    "explanation": "The text explicitly states the Statue of Liberty is located on Liberty Island in New York Harbor.",
    "question_token_count": 13,
    "answer_correctness_score": 10,
    "explanation_validity_score": 10,
    "question_clarity_score": 4,
    "question_difficulty_score": 2,
    "question_groundedness_score": 4,
    "avg_answer_token_count": 6
  },
  {
    "context": "<Table> <Tr> <Th colspan=\"2\"> Philadelphia Eagles </Th> </Tr> <Tr> <Td colspan=\"2\"> Current season </Td> </Tr> <Tr> <Td colspan=\"2\"> Established July 8 , 1933 ; 84 years ago ( July 8 , 1933 ) First season : 1933 Play in Lincoln Financial Field Philadelphia , Pennsylvania Headquartered in the NovaCare Complex Philadelphia , Pennsylvania </Td> </Tr> <Tr> <Th colspan=\"2\"> </Th> </Tr> <Tr> <Td colspan=\"2\"> <Table> <Tr> <Td> </Td> <Td> </Td> </Tr> <Tr> <Td> Logo </Td> <Td> Wordmark </Td> </Tr> </Table> </Td> </Tr> <Tr> <Th colspan=\"2\"> League / conference affiliations </Th> </Tr> <Tr> <Td colspan=\"2\"> <P> National Football League ( 1933 -- present ) </P> <Ul> <Li> Eastern Division ( 1933 -- 1949 ) </Li> <Li> American Conference ( 1950 -- 1952 ) </Li> <Li> Eastern Conference ( 1953 -- 1969 ) <Ul> <Li> Capitol Division ( 1967 -- 1969 ) </Li> </Ul> </Li> <Li> National Football Conference ( 1970 -- present ) <Ul> <Li> NFC East ( 1970 -- present ) </Li> </Ul> </Li> </Ul> </Td> </Tr> <Tr> <Td colspan=\"2\"> Current uniform </Td> </Tr> <Tr> <Td colspan=\"2\"> </Td> </Tr> <Tr> <Th> Team colors </Th> <Td> <P> Midnight green , Silver , Black , White </P> </Td> </Tr> <Tr> <Th> Fight song </Th> <Td> Fly , Eagles Fly </Td> </Tr> <Tr> <Th> Mascot </Th> <Td> Swoop </Td> </Tr> <Tr> <Th colspan=\"2\"> Personnel </Th> </Tr> <Tr> <Th> Owner ( s ) </Th> <Td> Jeffrey Lurie Christina Weiss Lurie </Td> </Tr> <Tr> <Th> Chairman </Th> <Td> Jeffrey Lurie </Td> </Tr> <Tr> <Th> CEO </Th> <Td> Jeffrey Lurie </Td> </Tr> <Tr> <Th> President </Th> <Td> Don Smolenski </Td> </Tr> <Tr> <Th> General manager </Th> <Td> Howie Roseman </Td> </Tr> <Tr> <Th> Head coach </Th> <Td> Doug Pederson </Td> </Tr> <Tr> <Th colspan=\"2\"> Team history </Th> </Tr> <Tr> <Td colspan=\"2\"> <Ul> <Li> Philadelphia Eagles ( 1933 -- 1942 ; 1944 -- present ) </Li> <Li> Phil - Pitt `` Steagles '' ( 1943 ) </Li> </Ul> </Td> </Tr> <Tr> <Th colspan=\"2\"> Team nicknames </Th> </Tr> <Tr> <Td colspan=\"2\"> <Ul> <Li> The Birds </Li> </Ul> </Td> </Tr> <Tr> <Th colspan=\"2\"> Championships </Th> </Tr> <Tr> <Td colspan=\"2\"> <P> League championships ( 4 ) </P> <Ul> <Li> NFL championships ( pre-1970 AFL -- NFL merger ) ( 3 ) 1948 , 1949 , 1960 </Li> </Ul> <Ul> <Li> Super Bowl championships ( 1 ) 2017 ( LII ) </Li> </Ul> </Td> </Tr> <Tr> <Td colspan=\"2\"> <P> Conference championships ( 4 ) </P> <Ul> <Li> NFL Eastern : 1960 </Li> <Li> NFC : 1980 , 2004 , 2017 </Li> </Ul> </Td> </Tr> <Tr> <Td colspan=\"2\"> <P> Division championships ( 13 ) </P> <Ul> <Li> NFL East : 1947 , 1948 , 1949 </Li> <Li> NFC East : 1980 , 1988 , 2001 , 2002 , 2003 , 2004 , 2006 , 2010 , 2013 , 2017 </Li> </Ul> </Td> </Tr> <Tr> <Th colspan=\"2\"> Playoff appearances ( 25 ) </Th> </Tr> <Tr> <Td colspan=\"2\"> <Ul> <Li> NFL : 1947 , 1948 , 1949 , 1960 , 1978 , 1979 , 1980 , 1981 , 1988 , 1989 , 1990 , 1992 , 1995 , 1996 , 2000 , 2001 , 2002 , 2003 , 2004 , 2006 , 2008 , 2009 , 2010 , 2013 , 2017 </Li> </Ul> </Td> </Tr> <Tr> <Th colspan=\"2\"> Home fields </Th> </Tr> <Tr> <Td colspan=\"2\"> <Ul> <Li> Baker Bowl ( 1933 -- 1935 ) </Li> <Li> Philadelphia Municipal Stadium ( 1936 -- 1939 , 1941 ) </Li> <Li> Connie Mack Stadium ( 1940 , 1942 -- 1957 ) </Li> <Li> Franklin Field ( 1958 -- 1970 ) </Li> <Li> Veterans Stadium ( 1971 -- 2002 ) </Li> <Li> Lincoln Financial Field ( 2003 -- present ) </Li> </Ul> </Td> </Tr> </Table>",
    "topic": "An analysis of the Philadelphia Eagles' conference championship wins, specifying which conferences were won and the corresponding years.",
    "response": "```xml\n<document_analysis>\nThis document provides a comprehensive overview of the Philadelphia Eagles football team. It details their history, personnel, championships, and affiliations. The data is presented in a table format. The question will focus on the conference championships won by the Eagles, specifically testing the recall of which conferences and the corresponding years. This requires a careful reading of the \"Conference championships\" section within the table. The difficulty will be rated as 7/10 as it requires specific data retrieval and understanding of NFL conference structures.\n</document_analysis>\n<output_format>\nQuestion: The Philadelphia Eagles have secured conference championships in multiple instances. Excluding divisional championships, in which years did the Eagles win the NFL Eastern Conference and the NFC?\nA: 1948, 1949, 1960\nB: 1960, 1980, 2004\nC: 1980, 2004, 2017\nD: 1947, 1949, 1980\nExplanation: The provided text explicitly states that the Eagles won the NFL Eastern Conference in 1960 and the NFC in 1980, 2004, and 2017.\nCorrect Answer: C\n</output_format>\n```",
    "question": "The Philadelphia Eagles have secured conference championships in multiple instances. Excluding divisional championships, in which years did the Eagles win the NFL Eastern Conference and the NFC?",
    "choices": {
      "A": "1948, 1949, 1960",
      "B": "1960, 1980, 2004",
      "C": "1980, 2004, 2017",
      "D": "1947, 1949, 1980"
    },
    "answer": "C",
    "explanation": "The provided text explicitly states that the Eagles won the NFL Eastern Conference in 1960 and the NFC in 1980, 2004, and 2017.",
    "question_token_count": 33,
    "answer_correctness_score": 6,
    "explanation_validity_score": 9,
    "question_clarity_score": 8,
    "question_difficulty_score": 6,
    "question_groundedness_score": 10,
    "avg_answer_token_count": 11
  },
  {
    "context": "<P> `` Flight '' is the twenty - fourth and final episode of the eighth season of the American television medical drama Grey 's Anatomy , and the show 's 172nd episode overall . It was written by series creator Shonda Rhimes , and directed by Rob Corn . The episode was originally broadcast on the American Broadcasting Company ( ABC ) in the United States on May 17 , 2012 . In the episode , six doctors from Seattle Grace Mercy West Hospital who are victims of an aviation accident fight to stay alive , but Dr. Lexie Grey ( Chyler Leigh ) ultimately dies . Other storylines occur in Seattle where Dr. Richard Webber ( James Pickens , Jr . ) plans his annual dinner for the departing residents , Dr. Owen Hunt ( Kevin McKidd ) fires Dr. Teddy Altman ( Kim Raver ) , and Dr. Miranda Bailey ( Chandra Wilson ) gets engaged . </P>",
    "topic": "Kevin McKidd portrays Dr. Owen Hunt, whose actions contribute to the episode's dramatic tension.",
    "response": "```xml\n<document_analysis>\n1. **Thoughtful Content Examination**: The context describes the final episode of Grey's Anatomy's eighth season, \"Flight,\" detailing key events like Lexie Grey's death, Owen Hunt firing Teddy Altman, and Bailey's engagement. It also provides information about the episode's writer, director, and broadcast date. The central theme revolves around the aftermath of a plane crash and the resulting emotional and professional consequences for the characters.\n2. **Concept Exploration**: The episode serves as a pivotal point in the series, marked by significant character deaths and shifts in relationships. Owen Hunt's decision to fire Teddy Altman is a key dramatic element, likely stemming from personal and professional conflicts. The juxtaposition of the survival struggle in the wilderness with the relatively mundane events in Seattle creates dramatic irony.\n3. **Strategic Complexity Calibration**: Difficulty: 8/10. The question will focus on the implications of Owen Hunt's actions, requiring an understanding of character motivations and the show's overall narrative structure.\n4. **Intentional Question Planning**: The question will explore the reasoning behind Owen Hunt\u2019s decision to fire Teddy Altman, challenging the expert to consider the complexities of their relationship and the potential impact on the hospital. This will require more than just recalling the event; it demands an understanding of the characters\u2019 histories and the show's dramatic conventions.\n</document_analysis>\n<output_format>\nQuestion: Considering the narrative context of \"Flight,\" what is the most likely primary driver behind Dr. Owen Hunt\u2019s decision to terminate Dr. Teddy Altman\u2019s employment?\nA: A budgetary restructuring within Seattle Grace Mercy West Hospital necessitated staff reductions.\nB: Dr. Altman\u2019s professional incompetence was demonstrably revealed during the crisis response to the plane crash.\nC: A culmination of personal conflict and professional disagreements stemming from their complex relationship.\nD: Dr. Altman expressed a desire to leave Seattle Grace Mercy West Hospital to pursue a different career path.\nExplanation: The text states Owen Hunt \"fires Dr. Teddy Altman,\" but provides no explicit reason. However, given the dramatic context of the episode and the established narrative of their relationship, the most plausible explanation is a culmination of personal and professional issues. The other options are not supported by the provided text.\nCorrect Answer: C\n</output_format>\n```",
    "question": "Considering the narrative context of \"Flight,\" what is the most likely primary driver behind Dr. Owen Hunt\u2019s decision to terminate Dr. Teddy Altman\u2019s employment?",
    "choices": {
      "A": "A budgetary restructuring within Seattle Grace Mercy West Hospital necessitated staff reductions.",
      "B": "Dr. Altman\u2019s professional incompetence was demonstrably revealed during the crisis response to the plane crash.",
      "C": "A culmination of personal conflict and professional disagreements stemming from their complex relationship.",
      "D": "Dr. Altman expressed a desire to leave Seattle Grace Mercy West Hospital to pursue a different career path."
    },
    "answer": "C",
    "explanation": "The text states Owen Hunt \"fires Dr. Teddy Altman,\" but provides no explicit reason. However, given the dramatic context of the episode and the established narrative of their relationship, the most plausible explanation is a culmination of personal and professional issues. The other options are not supported by the provided text.",
    "question_token_count": 32,
    "answer_correctness_score": 8,
    "explanation_validity_score": 9,
    "question_clarity_score": 6,
    "question_difficulty_score": 8,
    "question_groundedness_score": 4,
    "avg_answer_token_count": 19
  }
]