[
  {
    "orig_question": "Margaret Ann \"Peggy\" Lipton, is an American actress and former model, Lipton was married to the musician/producer Quincy Jones and is mother to their two daughters, Rashida Jones and Kidada Jones, an American actress, model and fashion designer, best known for her work as a designer, for which organization?",
    "orig_answer": "The Walt Disney Company",
    "context": "[PAR] [TLE] Kidada Jones [SEP] Kidada Ann Jones (born March 22, 1974) is an American actress, model and fashion designer.  Jones is best known for her work as a designer for The Walt Disney Company, where she has a line known as Kidada for Disney Couture.  Jones is the daughter of composer Quincy Jones and actress Peggy Lipton. [PAR] [TLE] Peggy Lipton [SEP] Margaret Ann \"Peggy\" Lipton (born August 30, 1946) is an American actress and former model.  Lipton became an overnight success through her best-known role as flower child Julie Barnes in the ABC counterculture television series \"The Mod Squad\" (1968\u20131973) for which she won the Golden Globe Award for Best Actress \u2013 Television Series Drama in 1970.  Her fifty-year career in television, film, and on stage included many roles, most notably that of Norma Jennings in David Lynch's surreal \"Twin Peaks\".  Lipton was married to the musician/producer Quincy Jones and is mother to their two daughters, Rashida Jones and Kidada Jones, who also became actresses.",
    "response": "```xml\n<document_analysis>\nThoughtful Content Examination: The context provides information about Kidada Jones and her mother, Peggy Lipton, detailing their careers and family relationships. The question focuses on Kidada Jones's work as a designer and asks for the organization she designs for.\n\nConcept Exploration: The text establishes a clear lineage and professional connection between the individuals. The question tests recall of specific details regarding Kidada Jones's career.\n\nStrategic Complexity Calibration: Difficulty: 4/10. The information is directly stated in the text, making it a relatively straightforward recall question. However, it requires connecting information about Kidada Jones to her professional role.\n\nIntentional Question Planning: The question is designed to assess comprehension of the provided text and the ability to recall specific details about a person's career. The question is reworded for clarity and to improve the flow of information.\n</document_analysis>\n<output_format>\nQuestion: Margaret Ann \"Peggy\" Lipton, an American actress and former model, was married to musician/producer Quincy Jones and is the mother of two daughters, Rashida Jones and Kidada Jones. Kidada Jones is also an actress, model, and fashion designer. For which prominent entertainment organization is Kidada Jones best known for her design work, specifically through a line named \"Kidada for [Organization Name] Couture?\"\nA: National Broadcasting Company (NBC)\nB: The Walt Disney Company\nC: Amazon Studios\nD: Paramount Pictures\nExplanation: The text states, \"Jones is best known for her work as a designer for The Walt Disney Company, where she has a line known as Kidada for Disney Couture.\" This directly answers the question.\nCorrect Answer: B\n</output_format>\n```",
    "question": "Margaret Ann \"Peggy\" Lipton, an American actress and former model, was married to musician/producer Quincy Jones and is the mother of two daughters, Rashida Jones and Kidada Jones. Kidada Jones is also an actress, model, and fashion designer. For which prominent entertainment organization is Kidada Jones best known for her design work, specifically through a line named \"Kidada for [Organization Name] Couture?\"",
    "choices": {
      "A": "National Broadcasting Company (NBC)",
      "B": "The Walt Disney Company",
      "C": "Amazon Studios",
      "D": "Paramount Pictures"
    },
    "answer": "B",
    "explanation": "The text states, \"Jones is best known for her work as a designer for The Walt Disney Company, where she has a line known as Kidada for Disney Couture.\" This directly answers the question.",
    "answer_correctness_score": 10,
    "explanation_validity_score": 10,
    "question_clarity_score": 8,
    "question_difficulty_score": 2,
    "question_groundedness_score": 10,
    "question_token_count": 89,
    "reformat_question_cosine_similarity_to_orig": 0.8276335000991821,
    "reformat_answer_cosine_similarity_to_orig": 0.9999999403953552,
    "reformat_question_similarity_score": 9,
    "reformat_answer_similarity_score": 10,
    "avg_answer_token_count": 5
  },
  {
    "orig_question": "Which venue leased by Sarah Crocker Conway was the site of a theatre fire in 1876?",
    "orig_answer": "Brooklyn Theatre",
    "context": "[PAR] [TLE] Brooklyn Theatre fire [SEP] The Brooklyn Theatre Fire was a catastrophic theatre fire that broke out on the evening of December 5, 1876, in the then-city of Brooklyn (now a borough of New York City).  The conflagration killed at least 278 individuals, with some accounts reporting more than 300 dead.  One hundred and three unidentified victims were interred in a common grave at Green-Wood Cemetery.  An obelisk near the main entrance at Fifth Avenue and 25th Street marks the burial site.  More than two dozen identified victims were interred individually in separate sections at the Cemetery of the Evergreens in Brooklyn. [PAR] [TLE] Sarah Crocker Conway [SEP] Sarah Crocker Conway (b. Ridgefield, Connecticut, 1834; d. Brooklyn, New York, April 28, 1875) was an actress.  She was a sister of Elizabeth Crocker Bowers, also an actress.  She made her debut in Baltimore, Maryland in 1849, playing Parthenia and other leading parts.  In May 1852, she married the actor Frederick B. Conway, and the two thenceforward acted together.  In 1859, they opened Pike's Opera House in Cincinnati, Ohio with a first-class company, but the engagement was not profitable, and they returned to the east.  In 1861, they visited England, and filled a short engagement at Sadler's Wells Theatre, London.  After their return, they became star actors, and made an extensive and profitable tour.  In 1864 Sarah leased the Park Theatre in Brooklyn, and subsequently the new Brooklyn Theatre, in which for nine years her husband played leading parts.  Sarah Conway possessed a tall and graceful figure and an expressive countenance, and was a versatile actress and a popular theatre manager.",
    "response": "```xml\n<document_analysis>\nThoughtful Content Examination: The context provides information about the Brooklyn Theatre fire and Sarah Crocker Conway, an actress who leased the Brooklyn Theatre. The question asks which venue leased by Conway was the site of the fire.\n\nConcept Exploration: The connection between Conway's leasing of the theatre and the subsequent fire is a key element. The context explicitly states that Conway leased the Brooklyn Theatre and that the Brooklyn Theatre was the site of a fire.\n\nStrategic Complexity Calibration: Difficulty: 6/10. This question requires a direct recall of information presented in the text, but it involves connecting two separate pieces of information (Conway's lease and the fire).\n\nIntentional Question Planning: The question aims to assess comprehension of the relationship between the individuals and locations mentioned in the text. It requires the test-taker to synthesize information from different parts of the context.\n</document_analysis>\n<output_format>\nQuestion: Sarah Crocker Conway, a 19th-century actress and theatre manager, was known for her work at several venues, including leasing performance spaces in both Brooklyn and Cincinnati. Given the provided text, which specific theatre, leased by Conway for nine years where her husband played leading parts, tragically became the site of a devastating fire on December 5, 1876, resulting in at least 278 fatalities?\nA: Pike's Opera House in Cincinnati, Ohio\nB: Sadler's Wells Theatre in London, England\nC: Park Theatre in Brooklyn, New York\nD: Brooklyn Theatre in Brooklyn, New York\nExplanation: The text states that Sarah Conway leased the new Brooklyn Theatre, where her husband played leading parts for nine years, and that the Brooklyn Theatre was the site of a fire in 1876.\nCorrect Answer: D\n</output_format>\n```",
    "question": "Sarah Crocker Conway, a 19th-century actress and theatre manager, was known for her work at several venues, including leasing performance spaces in both Brooklyn and Cincinnati. Given the provided text, which specific theatre, leased by Conway for nine years where her husband played leading parts, tragically became the site of a devastating fire on December 5, 1876, resulting in at least 278 fatalities?",
    "choices": {
      "A": "Pike's Opera House in Cincinnati, Ohio",
      "B": "Sadler's Wells Theatre in London, England",
      "C": "Park Theatre in Brooklyn, New York",
      "D": "Brooklyn Theatre in Brooklyn, New York"
    },
    "answer": "D",
    "explanation": "The text states that Sarah Conway leased the new Brooklyn Theatre, where her husband played leading parts for nine years, and that the Brooklyn Theatre was the site of a fire in 1876.",
    "answer_correctness_score": 10,
    "explanation_validity_score": 10,
    "question_clarity_score": 8,
    "question_difficulty_score": 6,
    "question_groundedness_score": 10,
    "question_token_count": 83,
    "reformat_question_cosine_similarity_to_orig": 0.8304561376571655,
    "reformat_answer_cosine_similarity_to_orig": 0.9539151191711426,
    "reformat_question_similarity_score": 9,
    "reformat_answer_similarity_score": 9,
    "avg_answer_token_count": 9
  },
  {
    "orig_question": "When was the astronaut who took Breathing Your Love in space first launched into space?",
    "orig_answer": "December 10, 2006",
    "context": "[PAR] [TLE] Christer Fuglesang [SEP] Arne Christer Fuglesang (] ) (born March 18, 1957 in Stockholm) is a Swedish physicist and an ESA astronaut.  He was first launched aboard the STS-116 Space Shuttle mission on December 10, 2006, at 01:47 GMT, making him the first Swedish citizen in space. [PAR] [TLE] Breathing Your Love [SEP] \"Breathing Your Love\" is a song by the Swedish singer Darin featuring vocals by singer Kat DeLuna and the first single from \"Flashback\".  The song co-written by Darin with RedOne, Bilal Hajji and Novel was released to radio stations and as a digital download in Sweden on 8 October 2008.  The single was released in Finland and is also the first single from Darin to be released in the United Kingdom in January 2010.  In October 2009 Swedish astronaut Christer Fuglesang took 2 copies of the single into space with him, as his daughter is a Darin fan, a photo of the disc can be seen with earth in the distance can be found on the official Darin website.",
    "response": "```xml\n<document_analysis>\nThoughtful Content Examination: The context provides information about Christer Fuglesang, a Swedish astronaut, and the song \"Breathing Your Love\" by Darin. It mentions that Fuglesang took copies of the song into space because his daughter is a fan. The question asks about the date of Fuglesang's first launch into space.\n\nConcept Exploration: The connection between a Swedish astronaut and a Swedish pop song is an interesting detail. The question tests factual recall regarding the astronaut's career milestones.\n\nStrategic Complexity Calibration: Difficulty: 3/10. This is a straightforward factual question. It's important to increase the difficulty to target domain experts.\n\nIntentional Question Planning: The question can be made more challenging by framing it to require the test-taker to recall the event surrounding the song being taken into space and then connecting it to the astronaut's first launch date.\n</document_analysis>\n<output_format>\nQuestion: Swedish astronaut Christer Fuglesang notably took copies of Darin's single \"Breathing Your Love\" into space in October 2009 at the request of his daughter. Considering this event, and his overall career, on what date did Christer Fuglesang first travel into space?\nA: January 15, 2010\nB: December 10, 2006\nC: October 8, 2008\nD: March 18, 1957\nExplanation: The text explicitly states that Christer Fuglesang was first launched into space aboard the STS-116 Space Shuttle mission on December 10, 2006. The information regarding the song is a distractor intended to test the test-taker's ability to isolate the relevant information.\nCorrect Answer: B\n</output_format>\n```",
    "question": "Swedish astronaut Christer Fuglesang notably took copies of Darin's single \"Breathing Your Love\" into space in October 2009 at the request of his daughter. Considering this event, and his overall career, on what date did Christer Fuglesang first travel into space?",
    "choices": {
      "A": "January 15, 2010",
      "B": "December 10, 2006",
      "C": "October 8, 2008",
      "D": "March 18, 1957"
    },
    "answer": "B",
    "explanation": "The text explicitly states that Christer Fuglesang was first launched into space aboard the STS-116 Space Shuttle mission on December 10, 2006. The information regarding the song is a distractor intended to test the test-taker's ability to isolate the relevant information.",
    "answer_correctness_score": 10,
    "explanation_validity_score": 10,
    "question_clarity_score": 4,
    "question_difficulty_score": 6,
    "question_groundedness_score": 8,
    "question_token_count": 59,
    "reformat_question_cosine_similarity_to_orig": 0.7181054353713989,
    "reformat_answer_cosine_similarity_to_orig": 1.0,
    "reformat_question_similarity_score": 9,
    "reformat_answer_similarity_score": 10,
    "avg_answer_token_count": 8
  },
  {
    "orig_question": "What bill president Clinton sign at the school mentioned in his wife\u2019s book about childhood influences?",
    "orig_answer": "Goals 2000",
    "context": "[PAR] [TLE] It Takes a Village [SEP] It Takes a Village: And Other Lessons Children Teach Us is a book published in 1996 by First Lady of the United States Hillary Rodham Clinton.  In it, Clinton presents her vision for the children of America.  She focuses on the impact individuals and groups outside the family have, for better or worse, on a child's well-being, and advocates a society which meets all of a child's needs. [PAR] [TLE] O'Farrell Community School [SEP] O'Farrell Community School or The O'Farrell Charter School (CDE official name) commonly referred to as O'Farrell is a charter school in the Southeast San Diego neighborhood of Encanto serving grades K-12 in the K-12 American education system.  The school opened its doors in the San Diego Unified School District in 1959 with its name chosen in 1957 as Mabel E. O'Farrell Jr.  High.  It was voted to become a charter school in 1994.  President Bill Clinton made a visit to San Diego in 1995 to sign the \"Goals 2000\" education bill and to visit O'Farrell because it was charter.  It was also mentioned in Hillary Clinton's book It Takes a Village.  It has a code of conduct of how to become a good citizen called \"The Falcon Way\", of Focus, Attitude, Leadership Citizenship, Organization, and Non-Violience, that is indoctrinated per student.  Instead of being called principal, faculty and students refer to the educational leader as the \"Chief Educational Officer\" (CEO).  The large conspicuous mural in front of the school on the side of the Theatre was a tribute to a faculty member by the nickname \"Animal\" who died.  The mural was painted by students.",
    "response": "```xml\n<document_analysis>\nThoughtful Content Examination: The context provides information about Hillary Clinton's book \"It Takes a Village\" and O'Farrell Community School. It details President Clinton's visit to O'Farrell to sign an education bill. The question asks about the bill signed during this visit.\n\nConcept Exploration: The question tests the recall of a specific detail related to a historical event (President Clinton's visit) and its connection to a published work (Hillary Clinton's book). It requires understanding the relationship between the school, the book, and the political event.\n\nStrategic Complexity Calibration: Difficulty: 6/10. This is a factual recall question but requires connecting two pieces of information from the text.\n\nIntentional Question Planning: The question aims to assess the test-taker's ability to synthesize information from different parts of the context and recall a specific detail.\n</document_analysis>\n<output_format>\nQuestion: In 1995, President Bill Clinton visited O'Farrell Community School, a charter school also mentioned in his wife Hillary Rodham Clinton\u2019s 1996 book, \u201cIt Takes a Village: And Other Lessons Children Teach Us,\u201d to commemorate a significant legislative action related to education. What was the name of the education bill signed by President Clinton during this visit to O'Farrell Community School?\nA: No Child Left Behind Act\nB: Elementary and Secondary Education Act\nC: Goals 2000\nD: Higher Education Act of 1965\nExplanation: The text states, \u201cPresident Bill Clinton made a visit to San Diego in 1995 to sign the \"Goals 2000\" education bill and to visit O'Farrell because it was charter.\u201d This directly answers the question.\nCorrect Answer: C\n</output_format>\n```",
    "question": "In 1995, President Bill Clinton visited O'Farrell Community School, a charter school also mentioned in his wife Hillary Rodham Clinton\u2019s 1996 book, \u201cIt Takes a Village: And Other Lessons Children Teach Us,\u201d to commemorate a significant legislative action related to education. What was the name of the education bill signed by President Clinton during this visit to O'Farrell Community School?",
    "choices": {
      "A": "No Child Left Behind Act",
      "B": "Elementary and Secondary Education Act",
      "C": "Goals 2000",
      "D": "Higher Education Act of 1965"
    },
    "answer": "C",
    "explanation": "The text states, \u201cPresident Bill Clinton made a visit to San Diego in 1995 to sign the \"Goals 2000\" education bill and to visit O'Farrell because it was charter.\u201d This directly answers the question.",
    "answer_correctness_score": 10,
    "explanation_validity_score": 10,
    "question_clarity_score": 6,
    "question_difficulty_score": 6,
    "question_groundedness_score": 10,
    "question_token_count": 82,
    "reformat_question_cosine_similarity_to_orig": 0.7087459564208984,
    "reformat_answer_cosine_similarity_to_orig": 1.0,
    "reformat_question_similarity_score": 9,
    "reformat_answer_similarity_score": 10,
    "avg_answer_token_count": 6
  },
  {
    "orig_question": "What is special about Vic & Anthony's fourth location?",
    "orig_answer": "242-acre waterfront casino resort",
    "context": "[PAR] [TLE] Vic &amp; Anthony's Steakhouse [SEP] Vic & Anthony\u2019s is an American steakhouse restaurant chain with locations in Downtown Houston, ]and inside the Golden Nugget Casinos in Las Vegas and Atlantic City.  A fourth location is scheduled to open inside the new Golden Nugget Lake Charles in late 2014.  Vic & Anthony\u2019s is owned and operated by Landry\u2019s, Inc. [PAR] [TLE] Golden Nugget Lake Charles [SEP] Golden Nugget Lake Charles is a 242-acre waterfront casino resort in Lake Charles, Louisiana, U.S.A., owned and operated by Houston-based Landry's, Inc. The resort features 740 guest rooms and suites housed in a 25-story tower, an 18-hole golf course, 30,000-square-feet of meeting space, more than a dozen dining and bar options, a private beach, marina, spa & salon, retail corridor and expansive 24-hour casino floor.",
    "response": "```xml\n<document_analysis>\n<thought_process>The provided context describes Vic &amp; Anthony's Steakhouse and Golden Nugget Lake Charles, both owned by Landry's, Inc. The question asks about a special characteristic of Vic &amp; Anthony's fourth location. The original answer, \"242-acre waterfront casino resort,\" is incorrect, as this describes Golden Nugget Lake Charles, not Vic &amp; Anthony\u2019s. The fourth location is *inside* Golden Nugget Lake Charles. A better question will focus on the relationship between the two establishments and the location of the fourth Vic &amp; Anthony's. The difficulty level is moderate, requiring an understanding of the context. I will rephrase the question to accurately reflect the information in the text and provide plausible distractors.</thought_process>\n</document_analysis>\n<output_format>\nQuestion: Vic &amp; Anthony\u2019s Steakhouse is planning a fourth location. Based on the provided information, where will this new restaurant be situated?\nA: Within the Downtown Houston location, undergoing an expansion to accommodate increased demand.\nB: As a standalone establishment on a 242-acre waterfront property in Lake Charles, Louisiana.\nC: Inside the Golden Nugget Lake Charles casino resort, currently under development.\nD: As part of a new Landry\u2019s, Inc. flagship restaurant in Atlantic City, New Jersey.\nExplanation: The text states that a fourth Vic & Anthony\u2019s location is \u201cscheduled to open inside the new Golden Nugget Lake Charles.\u201d This directly answers the question.\nCorrect Answer: C\n</output_format>\n```",
    "question": "Vic &amp; Anthony\u2019s Steakhouse is planning a fourth location. Based on the provided information, where will this new restaurant be situated?",
    "choices": {
      "A": "Within the Downtown Houston location, undergoing an expansion to accommodate increased demand.",
      "B": "As a standalone establishment on a 242-acre waterfront property in Lake Charles, Louisiana.",
      "C": "Inside the Golden Nugget Lake Charles casino resort, currently under development.",
      "D": "As part of a new Landry\u2019s, Inc. flagship restaurant in Atlantic City, New Jersey."
    },
    "answer": "C",
    "explanation": "The text states that a fourth Vic & Anthony\u2019s location is \u201cscheduled to open inside the new Golden Nugget Lake Charles.\u201d This directly answers the question.",
    "answer_correctness_score": 10,
    "explanation_validity_score": 10,
    "question_clarity_score": 1,
    "question_difficulty_score": 2,
    "question_groundedness_score": 10,
    "question_token_count": 30,
    "reformat_question_cosine_similarity_to_orig": 0.7119055986404419,
    "reformat_answer_cosine_similarity_to_orig": 0.5198454856872559,
    "reformat_question_similarity_score": 7,
    "reformat_answer_similarity_score": 9,
    "avg_answer_token_count": 17
  },
  {
    "orig_question": "The special division's constitutionality was upheld by which 1988 United States Federal Court Case?",
    "orig_answer": "Morrison v. Olson, 487 U.S. 654 (1988)",
    "context": "[PAR] [TLE] Special Division [SEP] The Special Division is a division of the United States Court of Appeals for the District of Columbia Circuit.  28 U.S.C. \u00a7 49 (1982 ed., Supp.  V) (Title VI of the Ethics in Government Act).  It consists of three circuit court judges or justices appointed by the Chief Justice of the United States.  One of the judges must be a judge of the DC Circuit, and no two of the judges may be named to the Special Division from a particular court.  The judges are appointed for 2-year terms, with any vacancy being filled only for the remainder of the 2-year period.  Its constitutionality was upheld in Morrison v. Olson. [PAR] [TLE] Morrison v. Olson [SEP] Morrison v. Olson, 487 U.S. 654 (1988) , is a United States federal court case in which the Supreme Court of the United States decided that the Independent Counsel Act was constitutional.",
    "response": "```xml\n<document_analysis>\nThoughtful Content Examination: The context describes the Special Division of the United States Court of Appeals for the District of Columbia Circuit, its composition, appointment process, and term lengths. It also mentions that its constitutionality was upheld in the case of Morrison v. Olson. The question directly asks about the case that upheld the Special Division's constitutionality.\n\nConcept Exploration: This is a factual recall question. It tests knowledge of a specific legal case related to the structure of the US court system. The concepts involved are judicial review, the constitutionality of acts of Congress, and the structure of the federal court system.\n\nStrategic Complexity Calibration: Difficulty: 3/10. This is a relatively straightforward factual recall question. However, it requires knowing the specific case name and year.\n\nIntentional Question Planning: The question is designed to test whether the reader accurately remembers the case name associated with upholding the constitutionality of the Special Division.\n</document_analysis>\n<output_format>\nQuestion: The United States Court of Appeals for the District of Columbia Circuit includes a Special Division, established under Title VI of the Ethics in Government Act. This division is comprised of three circuit court judges or justices appointed by the Chief Justice of the United States, with specific requirements regarding representation from the DC Circuit and preventing multiple judges from the same court. In 1988, a legal challenge to the constitutionality of this division was resolved. Which United States federal court case, decided that year, affirmed the constitutionality of the Special Division?\nA: Buckley v. Valeo, 424 U.S. 1 (1976)\nB: Roe v. Wade, 410 U.S. 113 (1973)\nC: Morrison v. Olson, 487 U.S. 654 (1988)\nD: Miranda v. Arizona, 384 U.S. 436 (1966)\nExplanation: The text explicitly states, \"Its constitutionality was upheld in Morrison v. Olson.\" Therefore, Morrison v. Olson, 487 U.S. 654 (1988) is the correct answer.\nCorrect Answer: C\n</output_format>\n```",
    "question": "The United States Court of Appeals for the District of Columbia Circuit includes a Special Division, established under Title VI of the Ethics in Government Act. This division is comprised of three circuit court judges or justices appointed by the Chief Justice of the United States, with specific requirements regarding representation from the DC Circuit and preventing multiple judges from the same court. In 1988, a legal challenge to the constitutionality of this division was resolved. Which United States federal court case, decided that year, affirmed the constitutionality of the Special Division?",
    "choices": {
      "A": "Buckley v. Valeo, 424 U.S. 1 (1976)",
      "B": "Roe v. Wade, 410 U.S. 113 (1973)",
      "C": "Morrison v. Olson, 487 U.S. 654 (1988)",
      "D": "Miranda v. Arizona, 384 U.S. 436 (1966)"
    },
    "answer": "C",
    "explanation": "The text explicitly states, \"Its constitutionality was upheld in Morrison v. Olson.\" Therefore, Morrison v. Olson, 487 U.S. 654 (1988) is the correct answer.",
    "answer_correctness_score": 10,
    "explanation_validity_score": 10,
    "question_clarity_score": 6,
    "question_difficulty_score": 8,
    "question_groundedness_score": 8,
    "question_token_count": 107,
    "reformat_question_cosine_similarity_to_orig": 0.7468355894088745,
    "reformat_answer_cosine_similarity_to_orig": 1.0,
    "reformat_question_similarity_score": 9,
    "reformat_answer_similarity_score": 10,
    "avg_answer_token_count": 18
  },
  {
    "orig_question": "Who designed the resort that Allard Roen managed prior to La Costa Resort and Spa?",
    "orig_answer": "Hugh Taylor",
    "context": "[PAR] [TLE] Allard Roen [SEP] Allard Roen (May 8, 1921\u2013August 28, 2008) was an American businessman in the hospitality industry.  He was the Managing Director of the Desert Inn and the Stardust Resort and Casino in Paradise, Nevada.  He was a co-founder of the Sunrise Hospital, The Boulevard Mall and the Las Vegas Country Club.  Later, he was a co-founder and the on-site Manager of the La Costa Resort and Spa in Carlsbad, California. [PAR] [TLE] Desert Inn [SEP] The Desert Inn, also known as the D.I., was a casino hotel on the Las Vegas Strip in Paradise, Nevada, which operated from April 24, 1950, to August 28, 2000.  Designed by architect Hugh Taylor and interior design by Jac Lessman, it was the fifth resort to open on the Strip.  It was situated between Desert Inn Road and Sands Avenue.",
    "response": "```xml\n<document_analysis>\nThoughtful Content Examination: The context provides information about Allard Roen and the Desert Inn. The question asks about the designer of a resort Roen managed. The answer is directly stated in the text.\n\nConcept Exploration: This question tests recall of factual information about a historical figure and a landmark resort. It requires understanding Roen's career trajectory and the details of the Desert Inn.\n\nStrategic Complexity Calibration: Difficulty: 3/10. This is a fairly straightforward factual recall question. However, it requires connecting information about Roen and the Desert Inn.\n\nIntentional Question Planning: The question is designed to assess knowledge of Las Vegas history and the individuals who shaped its development. It encourages the test-taker to recall specific details about the Desert Inn and its architect.\n</document_analysis>\n<output_format>\nQuestion: Allard Roen served as the Managing Director of both the Desert Inn and the Stardust Resort and Casino before becoming a co-founder and on-site Manager of the La Costa Resort and Spa. The Desert Inn, opening on April 24, 1950, was the fifth resort established on the Las Vegas Strip, positioned between Desert Inn Road and Sands Avenue. Who was responsible for the architectural design of the Desert Inn, the resort Allard Roen managed in Paradise, Nevada?\nA: Jac Lessman\nB: Steve Wynn\nC: Hugh Taylor\nD: Frank Lloyd Wright\nExplanation: The text explicitly states, \"Designed by architect Hugh Taylor and interior design by Jac Lessman...\" indicating that Hugh Taylor was the architect of the Desert Inn.\nCorrect Answer: C\n</output_format>\n```",
    "question": "Allard Roen served as the Managing Director of both the Desert Inn and the Stardust Resort and Casino before becoming a co-founder and on-site Manager of the La Costa Resort and Spa. The Desert Inn, opening on April 24, 1950, was the fifth resort established on the Las Vegas Strip, positioned between Desert Inn Road and Sands Avenue. Who was responsible for the architectural design of the Desert Inn, the resort Allard Roen managed in Paradise, Nevada?",
    "choices": {
      "A": "Jac Lessman",
      "B": "Steve Wynn",
      "C": "Hugh Taylor",
      "D": "Frank Lloyd Wright"
    },
    "answer": "C",
    "explanation": "The text explicitly states, \"Designed by architect Hugh Taylor and interior design by Jac Lessman...\" indicating that Hugh Taylor was the architect of the Desert Inn.",
    "answer_correctness_score": 10,
    "explanation_validity_score": 10,
    "question_clarity_score": 1,
    "question_difficulty_score": 4,
    "question_groundedness_score": 10,
    "question_token_count": 98,
    "reformat_question_cosine_similarity_to_orig": 0.6675770878791809,
    "reformat_answer_cosine_similarity_to_orig": 1.000000238418579,
    "reformat_question_similarity_score": 9,
    "reformat_answer_similarity_score": 10,
    "avg_answer_token_count": 3
  },
  {
    "orig_question": "Who was the director of the 2012 American romantic comedy film in which Noah Lomax played the wole of Lewis?",
    "orig_answer": "Gabriele Muccino",
    "context": "[PAR] [TLE] Noah Lomax [SEP] Noah Lomax (born November 7, 2001) is an American child actor.  Among his prominent roles are: Lewis in the film \"Playing for Keeps\", Josh in the film \"Safe Haven\", and Louis Morales in the TV series \"The Walking Dead\". [PAR] [TLE] Playing for Keeps (2012 film) [SEP] Playing for Keeps is a 2012 American romantic comedy film directed by Gabriele Muccino, starring Gerard Butler with Jessica Biel, Catherine Zeta-Jones, Dennis Quaid, Uma Thurman and Judy Greer in supporting roles.  The film was released on December 7, 2012, in the United States and Canada by FilmDistrict.",
    "response": "```xml\n<document_analysis>\nThoughtful Content Examination: The context provides information about Noah Lomax and the film \"Playing for Keeps\". The question asks about the director of \"Playing for Keeps\" and specifically links it to Noah Lomax's involvement.\nConcept Exploration: The question tests recall of a specific fact (director's name) related to a film and an actor. It requires understanding the connection between the two.\nStrategic Complexity Calibration: Difficulty: 3/10. This is a relatively straightforward factual recall question. However, it is important to ensure that the answer options are plausible and require the test taker to know the correct director.\nIntentional Question Planning: The question is designed to test a specific detail within the provided context. I will rephrase to make it more comprehensive and less direct, and to make sure it is answerable without the context paragraph.\n</document_analysis>\n<output_format>\nQuestion: In the 2012 American romantic comedy film featuring Gerard Butler, Jessica Biel, Catherine Zeta-Jones, Dennis Quaid, Uma Thurman, Judy Greer, and child actor Noah Lomax in the role of Lewis, who directed the film?\nA: Dennis Quaid\nB: Gabriele Muccino\nC: Gerard Butler\nD: Jessica Biel\nExplanation: The text states that Gabriele Muccino directed \"Playing for Keeps,\" a 2012 American romantic comedy film starring Gerard Butler and featuring Noah Lomax as Lewis.\nCorrect Answer: B\n</output_format>\n```",
    "question": "In the 2012 American romantic comedy film featuring Gerard Butler, Jessica Biel, Catherine Zeta-Jones, Dennis Quaid, Uma Thurman, Judy Greer, and child actor Noah Lomax in the role of Lewis, who directed the film?",
    "choices": {
      "A": "Dennis Quaid",
      "B": "Gabriele Muccino",
      "C": "Gerard Butler",
      "D": "Jessica Biel"
    },
    "answer": "B",
    "explanation": "The text states that Gabriele Muccino directed \"Playing for Keeps,\" a 2012 American romantic comedy film starring Gerard Butler and featuring Noah Lomax as Lewis.",
    "answer_correctness_score": 10,
    "explanation_validity_score": 10,
    "question_clarity_score": 6,
    "question_difficulty_score": 5,
    "question_groundedness_score": 8,
    "question_token_count": 51,
    "reformat_question_cosine_similarity_to_orig": 0.7604947090148926,
    "reformat_answer_cosine_similarity_to_orig": 1.0000001192092896,
    "reformat_question_similarity_score": 9,
    "reformat_answer_similarity_score": 10,
    "avg_answer_token_count": 4
  },
  {
    "orig_question": "Breathing Your Love was taken into space by the Swedish astronaut who had what other job?",
    "orig_answer": "physicist",
    "context": "[PAR] [TLE] Christer Fuglesang [SEP] Arne Christer Fuglesang (] ) (born March 18, 1957 in Stockholm) is a Swedish physicist and an ESA astronaut.  He was first launched aboard the STS-116 Space Shuttle mission on December 10, 2006, at 01:47 GMT, making him the first Swedish citizen in space. [PAR] [TLE] Breathing Your Love [SEP] \"Breathing Your Love\" is a song by the Swedish singer Darin featuring vocals by singer Kat DeLuna and the first single from \"Flashback\".  The song co-written by Darin with RedOne, Bilal Hajji and Novel was released to radio stations and as a digital download in Sweden on 8 October 2008.  The single was released in Finland and is also the first single from Darin to be released in the United Kingdom in January 2010.  In October 2009 Swedish astronaut Christer Fuglesang took 2 copies of the single into space with him, as his daughter is a Darin fan, a photo of the disc can be seen with earth in the distance can be found on the official Darin website.",
    "response": "```xml\n<document_analysis>\nThoughtful Content Examination: The context provides information about Christer Fuglesang, a Swedish astronaut and physicist, and the song \"Breathing Your Love\" by Darin. It notes that Fuglesang took copies of the song into space because his daughter is a fan. The question asks for Fuglesang's other profession.\n\nConcept Exploration: The connection between an astronaut and a musician\u2019s song creates an interesting detail. The question tests recall of Fuglesang's dual identity.\n\nStrategic Complexity Calibration: Difficulty: 4/10. The answer is directly stated in the text, but requires reading and integrating information from different parts of the provided context.\n\nIntentional Question Planning: The question is designed to test comprehension of the provided text by requiring the test taker to connect two seemingly disparate pieces of information.\n</document_analysis>\n<output_format>\nQuestion: Swedish astronaut Christer Fuglesang notably brought copies of the song \u201cBreathing Your Love\u201d into space for a personal reason. Beyond his role as an astronaut, what is Christer Fuglesang\u2019s other profession, as detailed in the provided information?\nA: Musician\nB: Engineer\nC: Physicist\nD: Doctor\nExplanation: The text states, \u201cChrister Fuglesang is a Swedish physicist and an ESA astronaut.\u201d Therefore, his other profession is physics.\nCorrect Answer: C\n</output_format>\n```",
    "question": "Swedish astronaut Christer Fuglesang notably brought copies of the song \u201cBreathing Your Love\u201d into space for a personal reason. Beyond his role as an astronaut, what is Christer Fuglesang\u2019s other profession, as detailed in the provided information?",
    "choices": {
      "A": "Musician",
      "B": "Engineer",
      "C": "Physicist",
      "D": "Doctor"
    },
    "answer": "C",
    "explanation": "The text states, \u201cChrister Fuglesang is a Swedish physicist and an ESA astronaut.\u201d Therefore, his other profession is physics.",
    "answer_correctness_score": 10,
    "explanation_validity_score": 10,
    "question_clarity_score": 6,
    "question_difficulty_score": 2,
    "question_groundedness_score": 10,
    "question_token_count": 53,
    "reformat_question_cosine_similarity_to_orig": 0.7435847520828247,
    "reformat_answer_cosine_similarity_to_orig": 0.9999999403953552,
    "reformat_question_similarity_score": 9,
    "reformat_answer_similarity_score": 10,
    "avg_answer_token_count": 3
  },
  {
    "orig_question": "Dane DeHaan played the title character in which 2017 3D film written by Luc Besson?",
    "orig_answer": "Valerian and the City of a Thousand Planets",
    "context": "[PAR] [TLE] Valerian and the City of a Thousand Planets [SEP] Valerian and the City of a Thousand Planets (French: \"Val\u00e9rian et la Cit\u00e9 des mille plan\u00e8tes\" ) is a 2017 English-language French 3D science fiction adventure film written and directed by Luc Besson, and co-produced by Besson and his wife, Virginie Besson-Silla.  The film is based on the French science fiction comics series \"Val\u00e9rian and Laureline\", written by Pierre Christin and illustrated by Jean-Claude M\u00e9zi\u00e8res.  It stars Dane DeHaan as Valerian and Cara Delevingne as Laureline, with Clive Owen, Rihanna, Ethan Hawke, Herbie Hancock, Kris Wu and Rutger Hauer in supporting roles.  Besson independently crowd-sourced and personally funded \"Valerian\" and, with a production budget of around $180 million, it is both the most expensive European and independent film ever made. [PAR] [TLE] Dane DeHaan [SEP] Dane William DeHaan ( ; born February 6, 1986) is an American actor.  His roles include Jesse on the HBO series \"In Treatment\", Andrew Detmer in \"Chronicle\" (2012), Jason Kancam in Derek Cianfrance's \"The Place Beyond the Pines\" (2012), Lucien Carr in \"Kill Your Darlings\" (2013), Harry Osborn in \"The Amazing Spider-Man 2\" (2014), James Dean in Anton Corbijn's \"Life\" (2015), Lockhart in Gore Verbinski's \"A Cure for Wellness\" (2016) and the title character in Luc Besson's \"Valerian and the City of a Thousand Planets\" (2017).  He has also appeared in several advertisements for Prada.",
    "response": "```xml\n<document_analysis>\nThoughtful Content Examination: The context provides information about the film \"Valerian and the City of a Thousand Planets\" and Dane DeHaan's role in it. The question directly asks about DeHaan's role in a 2017 film written by Luc Besson, which is explicitly stated in the text.\n\nConcept Exploration: The question tests recall of specific details regarding a film adaptation and an actor's involvement. It relies on understanding the relationship between the film, its writer/director, and the actor's role.\n\nStrategic Complexity Calibration: Difficulty: 3/10. While straightforward, the question requires precise recall of details. It's a good baseline for assessing comprehension of the provided text.\n\nIntentional Question Planning: The question is designed to test whether the reader has absorbed the key information about DeHaan's role in \"Valerian.\"\n</document_analysis>\n<output_format>\nQuestion: Dane William DeHaan, recognized for his roles in films such as \"Chronicle,\" \"The Amazing Spider-Man 2,\" and \"Life,\" portrayed the lead character in a 2017 English-language French science fiction adventure film co-produced by Luc Besson and his wife, Virginie Besson-Silla. This film, based on a French comic series, is notably the most expensive European and independent film ever created with a production budget of approximately $180 million. What is the title of this Luc Besson-directed film in which DeHaan stars?\nA: A Cure for Wellness\nB: Kill Your Darlings\nC: Valerian and the City of a Thousand Planets\nD: The Place Beyond the Pines\nExplanation: The text explicitly states that Dane DeHaan played the title character in Luc Besson's \"Valerian and the City of a Thousand Planets\" (2017).\nCorrect Answer: C\n</output_format>\n```",
    "question": "Dane William DeHaan, recognized for his roles in films such as \"Chronicle,\" \"The Amazing Spider-Man 2,\" and \"Life,\" portrayed the lead character in a 2017 English-language French science fiction adventure film co-produced by Luc Besson and his wife, Virginie Besson-Silla. This film, based on a French comic series, is notably the most expensive European and independent film ever created with a production budget of approximately $180 million. What is the title of this Luc Besson-directed film in which DeHaan stars?",
    "choices": {
      "A": "A Cure for Wellness",
      "B": "Kill Your Darlings",
      "C": "Valerian and the City of a Thousand Planets",
      "D": "The Place Beyond the Pines"
    },
    "answer": "C",
    "explanation": "The text explicitly states that Dane DeHaan played the title character in Luc Besson's \"Valerian and the City of a Thousand Planets\" (2017).",
    "answer_correctness_score": 10,
    "explanation_validity_score": 10,
    "question_clarity_score": 8,
    "question_difficulty_score": 6,
    "question_groundedness_score": 10,
    "question_token_count": 114,
    "reformat_question_cosine_similarity_to_orig": 0.7434688806533813,
    "reformat_answer_cosine_similarity_to_orig": 1.0000001192092896,
    "reformat_question_similarity_score": 10,
    "reformat_answer_similarity_score": 10,
    "avg_answer_token_count": 7
  },
  {
    "orig_question": "when was a narrative poem most known from an American poet born July 18, 1850 written?",
    "orig_answer": "1867",
    "context": "[PAR] [TLE] Rose Hartwick Thorpe [SEP] Rose Hartwick Thorpe (July 18, 1850 \u2013 July 19, 1939) was an American poet and writer, remembered largely for the narrative poem, \"Curfew Must Not Ring Tonight\" (1867), which gained national popularity.  Other poems followed, among them being \"The Station Agent's Story,\" \"Red Cross,\" and \"In a Mining Town.\"  Although a busy and prolific author, she was ill for some years.  In 1888, she and her family removed to San Diego, California, living in Rosemere, Pacific Beach. [PAR] [TLE] Curfew Must Not Ring Tonight [SEP] Curfew Must Not Ring Tonight is a narrative poem by Rose Hartwick Thorpe, written in 1867 and set in the 17th century.  It was written when she was 16 years old and first published in \"Detroit Commercial Advertiser\".",
    "response": "```xml\n<document_analysis>\n<thought_process>The provided context discusses Rose Hartwick Thorpe, an American poet, and her most famous work, \"Curfew Must Not Ring Tonight.\" The question asks about the year the poem was written. The context explicitly states the poem was written in 1867. I will rephrase the question to be more detailed and challenging, ensuring it requires a precise understanding of the text. I will also craft distractors that are plausible but incorrect, testing the examinee's knowledge of the poet and her work. The difficulty level is estimated to be 4/10.</thought_process>\n</document_analysis>\n<output_format>\nQuestion: Rose Hartwick Thorpe, born July 18, 1850, achieved national recognition for a specific narrative poem. Considering her biographical details and the provided information, in what year was the poem \"Curfew Must Not Ring Tonight,\" which propelled her to prominence, initially penned and published in the \"Detroit Commercial Advertiser?\"\nA: 1850\nB: 1867\nC: 1888\nD: 1939\nExplanation: The text explicitly states that \"Curfew Must Not Ring Tonight\" was written in 1867 and first published in the \"Detroit Commercial Advertiser.\" This poem is identified as the work that brought Rose Hartwick Thorpe national popularity.\nCorrect Answer: B\n</output_format>\n```",
    "question": "Rose Hartwick Thorpe, born July 18, 1850, achieved national recognition for a specific narrative poem. Considering her biographical details and the provided information, in what year was the poem \"Curfew Must Not Ring Tonight,\" which propelled her to prominence, initially penned and published in the \"Detroit Commercial Advertiser?\"",
    "choices": {
      "A": "1850",
      "B": "1867",
      "C": "1888",
      "D": "1939"
    },
    "answer": "B",
    "explanation": "The text explicitly states that \"Curfew Must Not Ring Tonight\" was written in 1867 and first published in the \"Detroit Commercial Advertiser.\" This poem is identified as the work that brought Rose Hartwick Thorpe national popularity.",
    "answer_correctness_score": 10,
    "explanation_validity_score": 10,
    "question_clarity_score": 6,
    "question_difficulty_score": 2,
    "question_groundedness_score": 10,
    "question_token_count": 70,
    "reformat_question_cosine_similarity_to_orig": 0.5049871206283569,
    "reformat_answer_cosine_similarity_to_orig": 1.0000001192092896,
    "reformat_question_similarity_score": 9,
    "reformat_answer_similarity_score": 10,
    "avg_answer_token_count": 3
  },
  {
    "orig_question": "The USS \"Elrod\" was named after a captain born in what state?",
    "orig_answer": "Georgia",
    "context": "[PAR] [TLE] Henry T. Elrod [SEP] Elrod was born on September 27, 1905, in Turner County, Georgia.  He enlisted in the Marine Corps in December 1927, and was appointed a Marine second lieutenant in February 1931.  He attended the University of Georgia and Yale University prior to his entry into the Marine Corps. [PAR] [TLE] USS Elrod (FFG-55) [SEP] USS \"Elrod\" (FFG-55), an \"Oliver Hazard Perry\"-class frigate, is a ship of the United States Navy named after Captain Henry T. Elrod (1905\u20131941), a Marine aviator who was posthumously awarded the Medal of Honor for his heroism in the defense of Wake Island in World War II.",
    "response": "```xml\n<document_analysis>\nThoughtful Content Examination: The provided context details the life of Captain Henry T. Elrod and the naming of the USS Elrod. The key information is Elrod's birth location (Turner County, Georgia) and his connection to the USS Elrod (FFG-55).\nConcept Exploration: This is a straightforward factual recall question. It tests the ability to associate a name with a place of birth.\nStrategic Complexity Calibration: Difficulty: 3/10. While factual, it requires reading comprehension. It is not overly challenging but is appropriate for a domain expert assessment.\nIntentional Question Planning: The question directly asks for Elrod\u2019s birth state, assessing the ability to extract specific information from the text.\n</document_analysis>\n<output_format>\nQuestion: Captain Henry T. Elrod, a Marine aviator posthumously awarded the Medal of Honor for his defense of Wake Island during World War II, is the namesake of the USS \"Elrod\" (FFG-55), an \"Oliver Hazard Perry\"-class frigate. Considering his biographical details, in what U.S. state was Captain Elrod born?\nA: California\nB: Georgia\nC: North Carolina\nD: Texas\nExplanation: The text explicitly states that Henry T. Elrod was born on September 27, 1905, in Turner County, Georgia.\nCorrect Answer: B\n</output_format>\n```",
    "question": "Captain Henry T. Elrod, a Marine aviator posthumously awarded the Medal of Honor for his defense of Wake Island during World War II, is the namesake of the USS \"Elrod\" (FFG-55), an \"Oliver Hazard Perry\"-class frigate. Considering his biographical details, in what U.S. state was Captain Elrod born?",
    "choices": {
      "A": "California",
      "B": "Georgia",
      "C": "North Carolina",
      "D": "Texas"
    },
    "answer": "B",
    "explanation": "The text explicitly states that Henry T. Elrod was born on September 27, 1905, in Turner County, Georgia.",
    "answer_correctness_score": 10,
    "explanation_validity_score": 10,
    "question_clarity_score": 5,
    "question_difficulty_score": 2,
    "question_groundedness_score": 10,
    "question_token_count": 77,
    "reformat_question_cosine_similarity_to_orig": 0.7267944812774658,
    "reformat_answer_cosine_similarity_to_orig": 1.0,
    "reformat_question_similarity_score": 9,
    "reformat_answer_similarity_score": 10,
    "avg_answer_token_count": 2
  },
  {
    "orig_question": "What year was John Haase's associate Curtis Warren born in?",
    "orig_answer": "1963",
    "context": "[PAR] [TLE] Curtis Warren [SEP] Curtis Francis Warren (born 31 May 1963) is an English gangster, who as Britain's most notorious drugs trafficker was formerly Interpol's Target One, and once listed on the Sunday Times Rich List. [PAR] [TLE] John Haase (criminal) [SEP] John Haase (born 1948) is an English gangster, drug dealer and associate of Curtis Warren.",
    "response": "```xml\n<document_analysis>\nThoughtful Content Examination: The context provides biographical information about Curtis Warren and John Haase, establishing a relationship between them. The question asks for Curtis Warren's birth year, which is directly stated in the text.\n\nConcept Exploration: This is a straightforward factual recall question. It tests the ability to extract specific information from a short text.\n\nStrategic Complexity Calibration: Difficulty is rated a 2/10. While factually simple, the question requires identifying the correct individual (Curtis Warren) within the context before retrieving the birth year.\n\nIntentional Question Planning: The question tests basic comprehension and information retrieval. It's a good starting point for assessing understanding of the provided context. I will rephrase to make it more challenging by adding potential distractors within the question itself.\n</document_analysis>\n<output_format>\nQuestion: Curtis Warren, a notorious figure in British organized crime and previously designated as Interpol's Target One, had associations with several other criminals, including John Haase. Considering this information and the provided context, in what year was Curtis Warren born?\nA: 1948\nB: 1953\nC: 1963\nD: 1978\nExplanation: The text explicitly states, \u201cCurtis Francis Warren (born 31 May 1963) is an English gangster\u2026\u201d. Therefore, the correct answer is 1963.\nCorrect Answer: C\n</output_format>\n```",
    "question": "Curtis Warren, a notorious figure in British organized crime and previously designated as Interpol's Target One, had associations with several other criminals, including John Haase. Considering this information and the provided context, in what year was Curtis Warren born?",
    "choices": {
      "A": "1948",
      "B": "1953",
      "C": "1963",
      "D": "1978"
    },
    "answer": "C",
    "explanation": "The text explicitly states, \u201cCurtis Francis Warren (born 31 May 1963) is an English gangster\u2026\u201d. Therefore, the correct answer is 1963.",
    "answer_correctness_score": 10,
    "explanation_validity_score": 10,
    "question_clarity_score": 2,
    "question_difficulty_score": 2,
    "question_groundedness_score": 10,
    "question_token_count": 50,
    "reformat_question_cosine_similarity_to_orig": 0.8236215114593506,
    "reformat_answer_cosine_similarity_to_orig": 0.9999998807907104,
    "reformat_question_similarity_score": 9,
    "reformat_answer_similarity_score": 10,
    "avg_answer_token_count": 3
  },
  {
    "orig_question": "The World's Funniest! is a reality show hosted by the sportscaster known for what CBS Sports program?",
    "orig_answer": "The NFL Today",
    "context": "[PAR] [TLE] The World's Funniest! [SEP] The World's Funniest!  is an American reality show that aired on Fox in 1997.  It was hosted by James Brown and announced by Mark Thompson.  The show was similar in format to ABC's \"America's Funniest Home Videos\", but also featuring funny clips from TV shows, bloopers, and funny TV commercials.  Unlike \"AFHV\", there was no contest element and viewer-submitted videos were not rewarded with prizes.  It was also hosted without a studio audience, with laughter backing during clips coming via laugh track. [PAR] [TLE] James Brown (sportscaster) [SEP] James Brown (born February 25, 1951), commonly called \"J.B.\", is an American sportscaster known for being the host of \"The NFL Today\" on CBS Sports and \"Thursday Night Football\" on CBS Sports and NFL Network.  He is also the Special Correspondent for CBS' news division.  Also, he is best known as the former host of the FOX network's NFL pregame show, \"Fox NFL Sunday\" for 11 years.",
    "response": "```xml\n<document_analysis>\nThoughtful Content Examination: The context provides information about the reality show \"The World's Funniest!\" and James Brown, the sportscaster who hosted it. It also details his current role at CBS Sports. The question asks to link James Brown's hosting role on \"The World's Funniest!\" with his current position at CBS.\n\nConcept Exploration: The question tests the ability to recall and connect information about a person across different contexts (a past hosting role and a current sportscasting role). It requires understanding James Brown's multifaceted career.\n\nStrategic Complexity Calibration: Difficulty: 6/10. The information is present in the text, but requires connecting two distinct pieces of information about the same person.\n\nIntentional Question Planning: The question is designed to test recall and the ability to synthesize information. It's not a simple direct quote retrieval.\n</document_analysis>\n<output_format>\nQuestion: In 1997, James Brown hosted the American reality show, \"The World's Funniest!\" Prior to his current role as Special Correspondent for CBS News, and host of \"Thursday Night Football\" on CBS Sports and NFL Network, what long-running CBS Sports program was James Brown known for hosting?\nA: Fox NFL Sunday\nB: The NFL Today\nC: America's Funniest Home Videos\nD: CBS Evening News\nExplanation: The provided text states that James Brown is \"known for being the host of 'The NFL Today' on CBS Sports.\" This directly answers the question, linking his past hosting role to his current prominent position at CBS Sports.\nCorrect Answer: B\n</output_format>\n```",
    "question": "In 1997, James Brown hosted the American reality show, \"The World's Funniest!\" Prior to his current role as Special Correspondent for CBS News, and host of \"Thursday Night Football\" on CBS Sports and NFL Network, what long-running CBS Sports program was James Brown known for hosting?",
    "choices": {
      "A": "Fox NFL Sunday",
      "B": "The NFL Today",
      "C": "America's Funniest Home Videos",
      "D": "CBS Evening News"
    },
    "answer": "B",
    "explanation": "The provided text states that James Brown is \"known for being the host of 'The NFL Today' on CBS Sports.\" This directly answers the question, linking his past hosting role to his current prominent position at CBS Sports.",
    "answer_correctness_score": 10,
    "explanation_validity_score": 10,
    "question_clarity_score": 1,
    "question_difficulty_score": 6,
    "question_groundedness_score": 10,
    "question_token_count": 62,
    "reformat_question_cosine_similarity_to_orig": 0.685184121131897,
    "reformat_answer_cosine_similarity_to_orig": 1.0000001192092896,
    "reformat_question_similarity_score": 8,
    "reformat_answer_similarity_score": 10,
    "avg_answer_token_count": 5
  },
  {
    "orig_question": "A former University of Oklahoma gymnastics coach recruited a retired olympic gymnast from the 1984 summer games, who is married to what Olympic gold medalist?",
    "orig_answer": "Nadia Com\u0103neci",
    "context": "[PAR] [TLE] Bart Conner [SEP] Bart Conner (born March 28, 1958) is a retired American Olympic gymnast.  As a member of the men's gymnastics team at the 1984 Summer Olympic Games, Conner won two gold medals.  He currently owns and operates the Bart Conner Gymnastics Academy in Norman, Oklahoma, along with his wife, Romanian Olympic gold medalist Nadia Com\u0103neci.  In addition, both Com\u0103neci and Conner are highly involved with the Special Olympics. [PAR] [TLE] Paul Ziert [SEP] Paul Ziert is a former University of Oklahoma gymnastics coach.  Ziert recruited Bart Conner to the school.  In 1977 and 1978, Ziert's teams won the NCAA Men's Gymnastics championship.",
    "response": "```xml\n<document_analysis>\nThoughtful Content Examination: The context provides information about Bart Conner, a retired Olympic gymnast, and Paul Ziert, his former coach at the University of Oklahoma. It also mentions Conner's marriage to Nadia Com\u0103neci, another Olympic gold medalist. The question accurately reflects the relationships described in the text.\n\nConcept Exploration: The question tests the ability to recall and connect multiple pieces of information from the provided text \u2013 Conner's athletic background, his coaching connection, and his personal life. It requires understanding the relationships between individuals and events.\n\nStrategic Complexity Calibration: Difficulty: 6/10. The question requires recalling multiple facts and connecting them, making it moderately challenging. It isn't overly complex but demands more than simple fact retrieval.\n\nIntentional Question Planning: The question is designed to assess comprehension of the relationships between the individuals mentioned in the text. It encourages the test taker to integrate information from different parts of the context.\n</document_analysis>\n<output_format>\nQuestion: Bart Conner, a gold medalist in men\u2019s gymnastics at the 1984 Summer Olympic Games and a former student of the University of Oklahoma, was recruited to the school by Paul Ziert. Conner now operates a gymnastics academy with his spouse. What Olympic gold medalist is married to Bart Conner?\nA: Olga Korbut\nB: Nadia Com\u0103neci\nC: Mary Lou Retton\nD: Simone Biles\nExplanation: The text explicitly states that Bart Conner owns and operates the Bart Conner Gymnastics Academy in Norman, Oklahoma, along with his wife, Romanian Olympic gold medalist Nadia Com\u0103neci.\nCorrect Answer: B\n</output_format>\n```",
    "question": "Bart Conner, a gold medalist in men\u2019s gymnastics at the 1984 Summer Olympic Games and a former student of the University of Oklahoma, was recruited to the school by Paul Ziert. Conner now operates a gymnastics academy with his spouse. What Olympic gold medalist is married to Bart Conner?",
    "choices": {
      "A": "Olga Korbut",
      "B": "Nadia Com\u0103neci",
      "C": "Mary Lou Retton",
      "D": "Simone Biles"
    },
    "answer": "B",
    "explanation": "The text explicitly states that Bart Conner owns and operates the Bart Conner Gymnastics Academy in Norman, Oklahoma, along with his wife, Romanian Olympic gold medalist Nadia Com\u0103neci.",
    "answer_correctness_score": 10,
    "explanation_validity_score": 10,
    "question_clarity_score": 8,
    "question_difficulty_score": 4,
    "question_groundedness_score": 10,
    "question_token_count": 66,
    "reformat_question_cosine_similarity_to_orig": 0.6858609914779663,
    "reformat_answer_cosine_similarity_to_orig": 0.9999998211860657,
    "reformat_question_similarity_score": 9,
    "reformat_answer_similarity_score": 10,
    "avg_answer_token_count": 5
  },
  {
    "orig_question": "What Mexican drug lord know as \"El M\u00e1s Loco\" (English: \"The Craziest One\") preached his organization's divine right to eliminate their enemies?",
    "orig_answer": "Nazario Moreno Gonz\u00e1lez",
    "context": "[PAR] [TLE] La Familia Michoacana [SEP] La Familia Michoacana, (English: \"The Michoac\u00e1n Family\") La Familia (English: \"The Family\"), or LFM was a Mexican drug cartel and a organized crime syndicate based in the Mexican state of Michoac\u00e1n.  Formerly allied to the Gulf Cartel\u2014as part of Los Zetas\u2014it split off in 2006.  The cartel was founded by Carlos Rosales Mendoza a close associate of Osiel C\u00e1rdenas.  The second leader, Nazario Moreno Gonz\u00e1lez, known as \"El M\u00e1s Loco\" (English: \"The Craziest One\"), preached his organization's divine right to eliminate enemies.  He carried a \"bible\" of his own sayings and insisted that his army of traffickers and hitmen avoid using the narcotics they sell.  Nazario Moreno's partners were Jos\u00e9 de Jes\u00fas M\u00e9ndez Vargas, Servando G\u00f3mez Mart\u00ednez and Enrique Plancarte Sol\u00eds, each of whom has a bounty of $2 million for his capture, and were contesting the control of the organization. [PAR] [TLE] Nazario Moreno Gonz\u00e1lez [SEP] Nazario Moreno Gonz\u00e1lez (8 March 1970 \u2013 9 March 2014), commonly referred to by his alias El Chayo (\"Nazario\" or \"The Rosary\") and/or El M\u00e1s Loco (\"The Craziest One\"), was a Mexican drug lord who headed La Familia Michoacana before heading the Knights Templar Cartel, a drug cartel headquartered in the state of Michoac\u00e1n.  He was one of Mexico's most-wanted drug lords.",
    "response": "```xml\n<document_analysis>\nThoughtful Content Examination: The context describes La Familia Michoacana and its leaders, specifically Nazario Moreno Gonz\u00e1lez, known as \"El M\u00e1s Loco.\" The question directly asks about this leader and his unique approach to justifying the cartel's actions. The information is straightforward and readily available within the provided text.\n\nConcept Exploration: The concept of a drug lord claiming a \"divine right\" is a noteworthy element, highlighting the complex interplay of ideology, violence, and organized crime. The detail about avoiding drug use despite trafficking is also a curious aspect.\n\nStrategic Complexity Calibration: Difficulty: 6/10. The answer is explicitly stated in the text, but the question requires recall of a specific detail and nickname.\n\nIntentional Question Planning: The question aims to test the test taker's ability to recall key details about significant figures within the context of Mexican drug cartels. The question is designed to assess understanding of the unique characteristics of La Familia Michoacana and its leadership.\n</document_analysis>\n<output_format>\nQuestion: Nazario Moreno Gonz\u00e1lez, a prominent figure in the Mexican drug trade initially leading La Familia Michoacana and later the Knights Templar Cartel, gained notoriety for a distinctive leadership style. What characteristic defined his approach to eliminating rivals within the criminal organization?\nA: He advocated for the widespread consumption of the narcotics his cartel distributed to foster loyalty among its members.\nB: He emphasized a strict code of silence and discouraged any public discussion of the cartel's activities.\nC: He preached his organization's divine right to eliminate enemies, even carrying a personal compilation of his own philosophical tenets.\nD: He prioritized forming alliances with rival cartels to minimize violence and expand the cartel\u2019s territorial control.\nExplanation: The text states that Nazario Moreno Gonz\u00e1lez, known as \"El M\u00e1s Loco,\" preached his organization's divine right to eliminate enemies and carried a \"bible\" of his own sayings.\nCorrect Answer: C\n</output_format>\n```",
    "question": "Nazario Moreno Gonz\u00e1lez, a prominent figure in the Mexican drug trade initially leading La Familia Michoacana and later the Knights Templar Cartel, gained notoriety for a distinctive leadership style. What characteristic defined his approach to eliminating rivals within the criminal organization?",
    "choices": {
      "A": "He advocated for the widespread consumption of the narcotics his cartel distributed to foster loyalty among its members.",
      "B": "He emphasized a strict code of silence and discouraged any public discussion of the cartel's activities.",
      "C": "He preached his organization's divine right to eliminate enemies, even carrying a personal compilation of his own philosophical tenets.",
      "D": "He prioritized forming alliances with rival cartels to minimize violence and expand the cartel\u2019s territorial control."
    },
    "answer": "C",
    "explanation": "The text states that Nazario Moreno Gonz\u00e1lez, known as \"El M\u00e1s Loco,\" preached his organization's divine right to eliminate enemies and carried a \"bible\" of his own sayings.",
    "answer_correctness_score": 10,
    "explanation_validity_score": 10,
    "question_clarity_score": 5,
    "question_difficulty_score": 6,
    "question_groundedness_score": 10,
    "question_token_count": 52,
    "reformat_question_cosine_similarity_to_orig": 0.571193277835846,
    "reformat_answer_cosine_similarity_to_orig": 0.10482634603977203,
    "reformat_question_similarity_score": 6,
    "reformat_answer_similarity_score": 8,
    "avg_answer_token_count": 21
  },
  {
    "orig_question": "Which astronaut depicted in the movie \"Apollo 13\" retired from NASA in 1979?",
    "orig_answer": "Fred Haise",
    "context": "[PAR] [TLE] Fred Haise [SEP] Fred Wallace Haise Jr. ( ; born November 14, 1933) is an American former NASA astronaut, fighter pilot with the U.S. Marine Corps and the U.S. Air Force and test pilot.  He is one of only 24 people to have flown to the Moon, having flown as Lunar Module Pilot on Apollo 13.  He was to have been the sixth person to land and walk on the Moon, but the Apollo 13 mission was aborted before lunar landing.  He went on to fly Space Shuttle Approach and Landing Tests in 1977, and retired from NASA in 1979. [PAR] [TLE] Apollo 13 (film) [SEP] Apollo 13 is a 1995 American space adventure docudrama film directed by Ron Howard and starring Tom Hanks, Kevin Bacon, Bill Paxton, Gary Sinise, and Ed Harris.  The screenplay by William Broyles, Jr. and Al Reinert, that dramatizes the aborted 1970 Apollo 13 lunar mission, is an adaptation of the book \"Lost Moon: The Perilous Voyage of Apollo 13\" by astronaut Jim Lovell and Jeffrey Kluger.  The film depicts astronauts Lovell, Jack Swigert, and Fred Haise aboard Apollo 13 for America's third Moon landing mission.  En route, an on-board explosion deprives their spacecraft of most of its oxygen supply and electric power, forcing NASA's flight controllers to abort the Moon landing, and turning the mission into a struggle to get the three men home safely.",
    "response": "```xml\n<document_analysis>\nThoughtful Content Examination: The context provides information about Fred Haise, a NASA astronaut who flew on Apollo 13 and later retired from NASA in 1979. It also mentions the movie \"Apollo 13,\" which dramatizes the aborted Apollo 13 mission and features Haise as one of the astronauts. The question asks which astronaut from the movie retired in 1979.\n\nConcept Exploration: The question tests knowledge of the connection between the historical event (Apollo 13), the movie adaptation, and the astronaut's career timeline. It requires understanding that the movie portrays real individuals and events.\n\nStrategic Complexity Calibration: Difficulty: 4/10. The answer is explicitly stated in the text, but requires connecting information across sentences.\n\nIntentional Question Planning: The question aims to assess the user's ability to recall specific details about the astronauts featured in the movie and their post-mission careers. It encourages a direct retrieval of information from the text.\n</document_analysis>\n<output_format>\nQuestion: Fred Wallace Haise Jr., a former NASA astronaut and fighter pilot, participated in the Apollo 13 mission, which was dramatized in the 1995 film \"Apollo 13\" starring Tom Hanks and Kevin Bacon. According to the provided information, in what year did Haise conclude his career with NASA?\nA: 1970, coinciding with the original Apollo 13 mission.\nB: 1995, following the release of the film \"Apollo 13.\"\nC: 1977, after completing Space Shuttle Approach and Landing Tests.\nD: 1979, after a distinguished career including service as Lunar Module Pilot on Apollo 13.\nExplanation: The text explicitly states that Fred Haise \"retired from NASA in 1979.\"\nCorrect Answer: D\n</output_format>\n```",
    "question": "Fred Wallace Haise Jr., a former NASA astronaut and fighter pilot, participated in the Apollo 13 mission, which was dramatized in the 1995 film \"Apollo 13\" starring Tom Hanks and Kevin Bacon. According to the provided information, in what year did Haise conclude his career with NASA?",
    "choices": {
      "A": "1970, coinciding with the original Apollo 13 mission.",
      "B": "1995, following the release of the film \"Apollo 13.\"",
      "C": "1977, after completing Space Shuttle Approach and Landing Tests.",
      "D": "1979, after a distinguished career including service as Lunar Module Pilot on Apollo 13."
    },
    "answer": "D",
    "explanation": "The text explicitly states that Fred Haise \"retired from NASA in 1979.\"",
    "answer_correctness_score": 10,
    "explanation_validity_score": 10,
    "question_clarity_score": 6,
    "question_difficulty_score": 3,
    "question_groundedness_score": 10,
    "question_token_count": 64,
    "reformat_question_cosine_similarity_to_orig": 0.7022281289100647,
    "reformat_answer_cosine_similarity_to_orig": 0.11283976584672928,
    "reformat_question_similarity_score": 9,
    "reformat_answer_similarity_score": 9,
    "avg_answer_token_count": 15
  },
  {
    "orig_question": "Gold Mountain Casino is 34 miles north of another casino with how many table poker rooms?",
    "orig_answer": "46",
    "context": "[PAR] [TLE] Gold Mountain Casino [SEP] Gold Mountain Casino is a Native American casino in Ardmore, Oklahoma, owned and operated by the Chickasaw Nation.  Originally opened in 2002 as Ardmore Gaming, the facility has grown steadily and today features more than 300 gaming machines.  The casino is open 24 hours a day, seven days a week.  The 8620 sqft casino is located on the corner of P Street N.E. and Sam Noble Parkway, and can be accessed via Interstate 35, exit 33.  It is a short distance from the Ardmore Convention Center and the Hardy Murphy Coliseum.  Gold Mountain is about 34 miles north of WinStar World Casino in Thackerville, Oklahoma, and 77 miles south of Riverwind Casino in Norman, Oklahoma, which are also Chickasaw-owned gaming facilities. [PAR] [TLE] WinStar World Casino [SEP] WinStar World Casino and Resort is a hotel and casino located near the Oklahoma\u2013Texas state line, 1 mi north of the Red River, at Exit 1 off Interstate 35 and Winstar Boulevard in Thackerville, Oklahoma.  The casino opened as the WinStar Casino in 2004, and was expanded (with a 395-room hotel tower) and renamed the WinStar World Casino in 2009, with its 519000 sqft of casino floor making it the largest casino in the state of Oklahoma.  In August 2013, WinStar Resorts completed a major expansion project, which added a new 1000-room second hotel tower that was divided into two phases; this also added a new casino that is attached to the tower.  As a result of the completion of this expansion, the casino overtook Foxwoods Resort Casino to become the largest casino in the United States based on gaming floor space.  WinStar has over 7,400 electronic games, 46 table poker rooms, 99 total table games, Racer's off-track betting, High Limit Room, keno, and bingo.",
    "response": "```xml\n<document_analysis>\n<thought_process>The question asks about the number of table poker rooms at a casino located near Gold Mountain Casino. The context states that Gold Mountain Casino is 34 miles north of WinStar World Casino, and WinStar has 46 table poker rooms. This is a straightforward factual recall question. The difficulty level is relatively low (around 3-4) as it directly states the answer in the text. I will rephrase the question to be more detailed and less direct, increasing the complexity slightly. I will also ensure the answer options are distinct and plausible, requiring careful reading of the context.</thought_process>\n</document_analysis>\n<output_format>\nQuestion: Gold Mountain Casino, operated by the Chickasaw Nation in Ardmore, Oklahoma, is geographically positioned in relation to WinStar World Casino and Resort, another Chickasaw-owned gaming facility. Considering this proximity, and the amenities available at WinStar World Casino, how many dedicated table poker rooms are present at the larger WinStar facility?\nA: 395\nB: 99\nC: 46\nD: 7,400\nExplanation: The provided text explicitly states that WinStar World Casino has 46 table poker rooms. This information is presented in the context describing WinStar's gaming options.\nCorrect Answer: C\n</output_format>\n```",
    "question": "Gold Mountain Casino, operated by the Chickasaw Nation in Ardmore, Oklahoma, is geographically positioned in relation to WinStar World Casino and Resort, another Chickasaw-owned gaming facility. Considering this proximity, and the amenities available at WinStar World Casino, how many dedicated table poker rooms are present at the larger WinStar facility?",
    "choices": {
      "A": "395",
      "B": "99",
      "C": "46",
      "D": "7,400"
    },
    "answer": "C",
    "explanation": "The provided text explicitly states that WinStar World Casino has 46 table poker rooms. This information is presented in the context describing WinStar's gaming options.",
    "answer_correctness_score": 10,
    "explanation_validity_score": 10,
    "question_clarity_score": 4,
    "question_difficulty_score": 2,
    "question_groundedness_score": 10,
    "question_token_count": 69,
    "reformat_question_cosine_similarity_to_orig": 0.6872320175170898,
    "reformat_answer_cosine_similarity_to_orig": 1.000000238418579,
    "reformat_question_similarity_score": 9,
    "reformat_answer_similarity_score": 10,
    "avg_answer_token_count": 2
  },
  {
    "orig_question": "Which song written by Max Martin and Shellback has been compared to the song \"Yodel It!\"?",
    "orig_answer": "\"Shake It Off\"",
    "context": "[PAR] [TLE] Yodel It! [SEP] \"Yodel It!\"  is a song recorded by Romanian singers Ilinca and Alex Florea, released on 30 January 2017 by Cat Music.  The track was written by Alexandra Niculae and produced by Mihai Alexandru for the Swiss band Timebelle who rejected it.  It was then given to Ilinca to record.  Florea was chosen as a featured artist as both Alexandru and Ilinca felt her version was incomplete.  \"Yodel It!\"  is a mixture of rock, pop and hip hop music, including Ilinca yodeling during the chorus and Florea's rap vocals.  The track's optimistic lyrical message was compared to that of Taylor Swift's \"Shake It Off\" (2014). [PAR] [TLE] Shake It Off [SEP] \"Shake It Off\" is a song recorded by American singer-songwriter Taylor Swift from her fifth album, \"1989\" (2014).  Written by Swift, Max Martin and Shellback, it is an uptempo dance-pop track considered to be a departure from Swift's earlier country pop music style.  \"Shake It Off\" is the sixth track on the album and serves as the lead single.  The song premiered during a Yahoo! live stream session on August 18, 2014 (also streaming internationally online); its music video was also released the same day.  Several hours later, the song was made available for digital download.",
    "response": "```xml\n<document_analysis>\nThoughtful Content Examination: The context provides information about two songs, \"Yodel It!\" and \"Shake It Off.\" The question asks about a comparison between the two songs, specifically which song written by Max Martin and Shellback was compared to \"Yodel It!\".\n\nConcept Exploration: The comparison is based on the optimistic lyrical message of both songs. The text explicitly states that the lyrical message of \"Yodel It!\" was compared to that of Taylor Swift's \"Shake It Off.\"\n\nStrategic Complexity Calibration: Difficulty: 3/10. The answer is directly stated in the text. However, it requires reading and comprehension of both song descriptions to identify the connection.\n\nIntentional Question Planning: The question targets a factual recall of information, requiring the test-taker to identify the song written by specific songwriters that was linked to \"Yodel It!\" based on lyrical similarity.\n</document_analysis>\n<output_format>\nQuestion: \"Yodel It!\", a song recorded by Ilinca and Alex Florea, shares a similarity in lyrical message with a song released in 2014. Which uptempo dance-pop song, written by Taylor Swift alongside Max Martin and Shellback, was identified as having this comparable optimistic lyrical theme?\nA: \"1989\"\nB: \"Shake It Off\"\nC: \"Timebelle\"\nD: \"Cat Music\"\nExplanation: The text explicitly states that the track's optimistic lyrical message was compared to that of Taylor Swift's \"Shake It Off\" (2014).\nCorrect Answer: B\n</output_format>\n```",
    "question": "\"Yodel It!\", a song recorded by Ilinca and Alex Florea, shares a similarity in lyrical message with a song released in 2014. Which uptempo dance-pop song, written by Taylor Swift alongside Max Martin and Shellback, was identified as having this comparable optimistic lyrical theme?",
    "choices": {
      "A": "\"1989\"",
      "B": "\"Shake It Off\"",
      "C": "\"Timebelle\"",
      "D": "\"Cat Music\""
    },
    "answer": "B",
    "explanation": "The text explicitly states that the track's optimistic lyrical message was compared to that of Taylor Swift's \"Shake It Off\" (2014).",
    "answer_correctness_score": 10,
    "explanation_validity_score": 10,
    "question_clarity_score": 6,
    "question_difficulty_score": 7,
    "question_groundedness_score": 8,
    "question_token_count": 63,
    "reformat_question_cosine_similarity_to_orig": 0.6315803527832031,
    "reformat_answer_cosine_similarity_to_orig": 1.000000238418579,
    "reformat_question_similarity_score": 9,
    "reformat_answer_similarity_score": 10,
    "avg_answer_token_count": 5
  },
  {
    "orig_question": "What South Korean disaster film did Park Min-ha appear in?",
    "orig_answer": "Flu",
    "context": "[PAR] [TLE] Flu (film) [SEP] Flu () is a 2013 South Korean disaster film written and directed by Kim Sung-su, about an outbreak of a deadly strain of H5N1 that kills its victims within 36 hours, throwing the district of Budang in Seongnam, with a population of nearly half a million people into chaos.  It stars Jang Hyuk and Soo Ae. [PAR] [TLE] Park Min-ha (actress) [SEP] Park Min-ha (born July 2, 2007) is a South Korean actress.  Park began her career as a child actress in 2011, and has appeared in such productions as the South Korean disaster film \"Flu\" (2013), the Korean drama television series \"King of Ambition\" (2013), and the music video for K.Will's song \"Love Blossom\" (2013).  Her father is SBS anchorman Park Chan-min.",
    "response": "```xml\n<document_analysis>\nThoughtful Content Examination: The context provides information about the film \"Flu\" and the actress Park Min-ha, stating she appeared in the film \"Flu\" in 2013. The question directly asks which South Korean disaster film Park Min-ha appeared in.\n\nConcept Exploration: This is a factual recall question. It tests the ability to associate an actress with a specific film mentioned in the text.\n\nStrategic Complexity Calibration: Difficulty: 3/10. It's a straightforward recall question, but the context is relatively short, making it accessible. We'll increase the difficulty by adding plausible distractors.\n\nIntentional Question Planning: The question is clear and concise. We will expand it to include more detail from the context to make it more challenging and less easily answered by guessing.\n</document_analysis>\n<output_format>\nQuestion: In 2013, actress Park Min-ha, who began her career as a child actress in 2011 and also appeared in the Korean drama television series \"King of Ambition,\" starred in a South Korean disaster film depicting an outbreak of a deadly H5N1 strain. What was the title of this film, which threw the district of Budang into chaos with its rapid 36-hour fatality rate?\nA: Train to Busan\nB: The Host\nC: Flu\nD: Tunnel\nExplanation: The text explicitly states that Park Min-ha appeared in the South Korean disaster film \"Flu\" (2013), which is about an outbreak of a deadly strain of H5N1.\nCorrect Answer: C\n</output_format>\n```",
    "question": "In 2013, actress Park Min-ha, who began her career as a child actress in 2011 and also appeared in the Korean drama television series \"King of Ambition,\" starred in a South Korean disaster film depicting an outbreak of a deadly H5N1 strain. What was the title of this film, which threw the district of Budang into chaos with its rapid 36-hour fatality rate?",
    "choices": {
      "A": "Train to Busan",
      "B": "The Host",
      "C": "Flu",
      "D": "Tunnel"
    },
    "answer": "C",
    "explanation": "The text explicitly states that Park Min-ha appeared in the South Korean disaster film \"Flu\" (2013), which is about an outbreak of a deadly strain of H5N1.",
    "answer_correctness_score": 10,
    "explanation_validity_score": 10,
    "question_clarity_score": 6,
    "question_difficulty_score": 4,
    "question_groundedness_score": 1,
    "question_token_count": 84,
    "reformat_question_cosine_similarity_to_orig": 0.6956671476364136,
    "reformat_answer_cosine_similarity_to_orig": 1.0,
    "reformat_question_similarity_score": 9,
    "reformat_answer_similarity_score": 10,
    "avg_answer_token_count": 3
  },
  {
    "orig_question": "How many times did the murder victim of an heir to the Du Pont family fortune win Olympic Medals?",
    "orig_answer": "seven-time",
    "context": "[PAR] [TLE] John du Pont [SEP] John Eleuth\u00e8re du Pont (November 22, 1938 \u2013 December 9, 2010) was an American philanthropist and heir to the Du Pont family fortune, he had been a published ornithologist, philatelist, philanthropist, conchologist, sports enthusiast, self-styled wrestling coach.  He died in prison while serving a sentence of 30 years in prison for the murder of Dave Schultz. [PAR] [TLE] Dave Schultz (wrestling) [SEP] David Leslie \"Dave\" Schultz (June 6, 1959 \u2013 January 26, 1996) was an American Olympic and world champion freestyle wrestler, a seven-time World and Olympic medalist.  He coached individuals and teams at the college level and also privately.  He was shot and killed by John Eleuth\u00e8re du Pont, a millionaire philanthropist who sponsored the private Foxcatcher wrestling team at an amateur sports center, known as Foxcatcher Farm, he set up on his estate in Pennsylvania.",
    "response": "```xml\n<document_analysis>\nThoughtful Content Examination: The context provides information about John du Pont, a wealthy philanthropist who murdered Dave Schultz, an Olympic wrestler. The question asks about the number of Olympic medals won by the victim, Dave Schultz. \nConcept Exploration: The information is factual and straightforward. The key is to accurately recall the number of Olympic medals Schultz won.\nStrategic Complexity Calibration: Difficulty: 3/10. This is a relatively simple factual recall question, but necessary to verify comprehension of the text.\nIntentional Question Planning: The question directly tests the ability to extract a specific detail from the provided text. It is important to include relevant information from the context within the question itself to make it self-contained.\n</document_analysis>\n<output_format>\nQuestion: John Eleuth\u00e8re du Pont, an heir to the Du Pont family fortune, murdered Olympic and world champion freestyle wrestler David Leslie \"Dave\" Schultz. Considering Schultz\u2019s accomplishments as detailed in the provided text, how many times did he earn a medal at either the World Championships or the Olympic Games?\nA: Three\nB: Five\nC: Seven\nD: Nine\nExplanation: The text states that David Leslie \"Dave\" Schultz was a \u201cseven-time World and Olympic medalist.\u201d\nCorrect Answer: C\n</output_format>\n```",
    "question": "John Eleuth\u00e8re du Pont, an heir to the Du Pont family fortune, murdered Olympic and world champion freestyle wrestler David Leslie \"Dave\" Schultz. Considering Schultz\u2019s accomplishments as detailed in the provided text, how many times did he earn a medal at either the World Championships or the Olympic Games?",
    "choices": {
      "A": "Three",
      "B": "Five",
      "C": "Seven",
      "D": "Nine"
    },
    "answer": "C",
    "explanation": "The text states that David Leslie \"Dave\" Schultz was a \u201cseven-time World and Olympic medalist.\u201d",
    "answer_correctness_score": 10,
    "explanation_validity_score": 10,
    "question_clarity_score": 8,
    "question_difficulty_score": 2,
    "question_groundedness_score": 10,
    "question_token_count": 62,
    "reformat_question_cosine_similarity_to_orig": 0.6111915111541748,
    "reformat_answer_cosine_similarity_to_orig": 0.7287890911102295,
    "reformat_question_similarity_score": 8,
    "reformat_answer_similarity_score": 10,
    "avg_answer_token_count": 2
  },
  {
    "orig_question": "Kopparvallen is a multi-use stadium in \u00c5tvidaberg, Sweden, famous football players who have played in the arena includes which former footballer from Sweden, and he participated at the World Cups 1974 FIFA World Cup and 1978 FIFA World Cup?",
    "orig_answer": "Conny Torstensson",
    "context": "[PAR] [TLE] Kopparvallen [SEP] Kopparvallen is a multi-use stadium in \u00c5tvidaberg, Sweden.  It is used mostly for football matches and is the home stadium of \u00c5tvidabergs FF.  The stadium holds 8,000 people and was built in 1907.  Famous football players who have played in the arena is Ralf Edstr\u00f6m, Roland Sandberg, Conny Torstensson, Zlatan Ibrahimovi\u0107 and Pel\u00e9. [PAR] [TLE] Conny Torstensson [SEP] Conny Torstensson (born 28 August 1949) is a former footballer from Sweden.  With Sweden he participated at the World Cups 1974 FIFA World Cup and 1978 FIFA World Cup.  With \u00c5tvidabergs FF he won national titles.  Later he belonged to the side of Bayern Munich which dominated international club football in the mid-1970s.",
    "response": "```xml\n<document_analysis>\nThoughtful Content Examination: The context provides information about Kopparvallen stadium and several football players who have played there, including Conny Torstensson. It also details Torstensson's career, mentioning his participation in the 1974 and 1978 World Cups and his success with \u00c5tvidabergs FF and Bayern Munich.\n\nConcept Exploration: The question asks about a specific player (Conny Torstensson) who is linked to both the stadium and his international career. The information is directly stated in the provided context.\n\nStrategic Complexity Calibration: Difficulty: 5/10. The question requires recalling a specific fact from the text and connecting it to the stadium. It's a moderate level of complexity, testing recall and association.\n\nIntentional Question Planning: The question is designed to test the ability to integrate information from different parts of the text. It combines details about the stadium with information about a player's career.\n</document_analysis>\n<output_format>\nQuestion: Kopparvallen, a multi-use stadium located in \u00c5tvidaberg, Sweden, has hosted numerous renowned football players throughout its history. Considering the provided information, which former Swedish footballer, who notably participated in both the 1974 and 1978 FIFA World Cups and achieved national titles with \u00c5tvidabergs FF, has played at Kopparvallen?\nA: Ralf Edstr\u00f6m\nB: Roland Sandberg\nC: Conny Torstensson\nD: Zlatan Ibrahimovi\u0107\nExplanation: The text explicitly states that Conny Torstensson played at Kopparvallen and participated in the 1974 and 1978 FIFA World Cups, as well as winning national titles with \u00c5tvidabergs FF.\nCorrect Answer: C\n</output_format>\n```",
    "question": "Kopparvallen, a multi-use stadium located in \u00c5tvidaberg, Sweden, has hosted numerous renowned football players throughout its history. Considering the provided information, which former Swedish footballer, who notably participated in both the 1974 and 1978 FIFA World Cups and achieved national titles with \u00c5tvidabergs FF, has played at Kopparvallen?",
    "choices": {
      "A": "Ralf Edstr\u00f6m",
      "B": "Roland Sandberg",
      "C": "Conny Torstensson",
      "D": "Zlatan Ibrahimovi\u0107"
    },
    "answer": "C",
    "explanation": "The text explicitly states that Conny Torstensson played at Kopparvallen and participated in the 1974 and 1978 FIFA World Cups, as well as winning national titles with \u00c5tvidabergs FF.",
    "answer_correctness_score": 10,
    "explanation_validity_score": 10,
    "question_clarity_score": 6,
    "question_difficulty_score": 7,
    "question_groundedness_score": 10,
    "question_token_count": 77,
    "reformat_question_cosine_similarity_to_orig": 0.9525324702262878,
    "reformat_answer_cosine_similarity_to_orig": 1.000000238418579,
    "reformat_question_similarity_score": 9,
    "reformat_answer_similarity_score": 10,
    "avg_answer_token_count": 5
  },
  {
    "orig_question": "Who was a candidate for the Libertarian Party's 2012 nomination for President of the United States, that unsuccessfully challenged during his tenure, the fourth-ranking Republican leader in the House?",
    "orig_answer": "Richard Jason Satawk \"R. J.\" Harris",
    "context": "[PAR] [TLE] R. J. Harris [SEP] Richard Jason Satawk \"R. J.\" Harris (born November 16, 1972) is a United States Army National Guard warrant officer, politician, law student and former Air Traffic Controller.  He was a candidate for the Libertarian Party's 2012 nomination for President of the United States.  In 2010, he unsuccessfully challenged incumbent Tom Cole for the Republican Party nomination in the primary election for Oklahoma's 4th congressional district.  He ran as an independent candidate for the same congressional seat in 2012. [PAR] [TLE] Tom Cole [SEP] Thomas Jeffery Cole (born April 28, 1949) is the U.S. Representative for Oklahoma 's 4 congressional district , serving since 2003.  He is a member of the Republican Party.  He is a Deputy Majority Whip.  The chairman of the National Republican Congressional Committee (NRCC) from 2006 to 2008, he was, during his tenure, the fourth-ranking Republican leader in the House.  As of 2015, Cole \u2013 a member of the Chickasaw Nation \u2013 is one of only two registered Native Americans in Congress (the other being fellow Oklahoman Markwayne Mullin).",
    "response": "```xml\n<document_analysis>\nThoughtful Content Examination: The context provides information about R.J. Harris and Tom Cole, detailing their political careers and affiliations. The original question attempts to combine information about both individuals into a single question, which is somewhat awkward and could be improved for clarity. The question asks about a candidate for the Libertarian Party's presidential nomination who also unsuccessfully challenged a Republican leader.\n\nConcept Exploration: The question tests the ability to recall specific details about both R.J. Harris and Tom Cole and to connect them based on their political activities. It requires understanding of their roles and the timelines of their campaigns.\n\nStrategic Complexity Calibration: Difficulty: 7/10. The question requires recalling two separate pieces of information and linking them together. It's not overly complex, but it's more challenging than a simple factual recall question.\n\nIntentional Question Planning: The question will be rephrased to be more direct and avoid combining unrelated attributes. The answer options will be crafted to be plausible but distinct, requiring a careful reading of the provided text.\n</document_analysis>\n<output_format>\nQuestion: Richard Jason Satawk \"R. J.\" Harris, born November 16, 1972, is a United States Army National Guard warrant officer, politician, law student, and former Air Traffic Controller. In 2010, Harris unsuccessfully sought the Republican Party nomination for Oklahoma's 4th congressional district, challenging the incumbent. He also ran as an independent candidate for the same seat in 2012. What additional political pursuit did R.J. Harris undertake in 2012?\nA: He served as the chairman of the National Republican Congressional Committee (NRCC).\nB: He was elected as a Deputy Majority Whip in the U.S. House of Representatives.\nC: He was a candidate for the Libertarian Party's nomination for President of the United States.\nD: He successfully unseated Tom Cole as the U.S. Representative for Oklahoma's 4th congressional district.\nExplanation: The text explicitly states that R.J. Harris was a candidate for the Libertarian Party's 2012 nomination for President of the United States.\nCorrect Answer: C\n</output_format>\n```",
    "question": "Richard Jason Satawk \"R. J.\" Harris, born November 16, 1972, is a United States Army National Guard warrant officer, politician, law student, and former Air Traffic Controller. In 2010, Harris unsuccessfully sought the Republican Party nomination for Oklahoma's 4th congressional district, challenging the incumbent. He also ran as an independent candidate for the same seat in 2012. What additional political pursuit did R.J. Harris undertake in 2012?",
    "choices": {
      "A": "He served as the chairman of the National Republican Congressional Committee (NRCC).",
      "B": "He was elected as a Deputy Majority Whip in the U.S. House of Representatives.",
      "C": "He was a candidate for the Libertarian Party's nomination for President of the United States.",
      "D": "He successfully unseated Tom Cole as the U.S. Representative for Oklahoma's 4th congressional district."
    },
    "answer": "C",
    "explanation": "The text explicitly states that R.J. Harris was a candidate for the Libertarian Party's 2012 nomination for President of the United States.",
    "answer_correctness_score": 10,
    "explanation_validity_score": 10,
    "question_clarity_score": 6,
    "question_difficulty_score": 4,
    "question_groundedness_score": 10,
    "question_token_count": 100,
    "reformat_question_cosine_similarity_to_orig": 0.4306444525718689,
    "reformat_answer_cosine_similarity_to_orig": 0.21133728325366974,
    "reformat_question_similarity_score": 7,
    "reformat_answer_similarity_score": 9,
    "avg_answer_token_count": 19
  },
  {
    "orig_question": "Kopparvallen is a stadium in Atvidaberg, Sweden, and has been used by a former footballer born in 1949, from what country?",
    "orig_answer": "Sweden",
    "context": "[PAR] [TLE] Kopparvallen [SEP] Kopparvallen is a multi-use stadium in \u00c5tvidaberg, Sweden.  It is used mostly for football matches and is the home stadium of \u00c5tvidabergs FF.  The stadium holds 8,000 people and was built in 1907.  Famous football players who have played in the arena is Ralf Edstr\u00f6m, Roland Sandberg, Conny Torstensson, Zlatan Ibrahimovi\u0107 and Pel\u00e9. [PAR] [TLE] Conny Torstensson [SEP] Conny Torstensson (born 28 August 1949) is a former footballer from Sweden.  With Sweden he participated at the World Cups 1974 FIFA World Cup and 1978 FIFA World Cup.  With \u00c5tvidabergs FF he won national titles.  Later he belonged to the side of Bayern Munich which dominated international club football in the mid-1970s.",
    "response": "```xml\n<document_analysis>\nThoughtful Content Examination: The context provides information about Kopparvallen stadium and Conny Torstensson, a Swedish footballer who played there. The question asks about the country of origin of the footballer who played at Kopparvallen.\nConcept Exploration: The question tests the ability to connect information about a location (Kopparvallen) with a person (Conny Torstensson) and extract a specific detail (country of origin).\nStrategic Complexity Calibration: Difficulty: 3/10. This is a relatively straightforward question requiring a direct lookup of information within the provided text. It's appropriate as a baseline comprehension check.\nIntentional Question Planning: The question is designed to assess if the reader can synthesize information from two parts of the provided text and draw a simple conclusion.\n</document_analysis>\n<output_format>\nQuestion: Kopparvallen, a multi-use stadium established in 1907 in \u00c5tvidaberg, Sweden, has hosted numerous prominent footballers, including Conny Torstensson, who was born on August 28, 1949, and participated in the 1974 and 1978 FIFA World Cups. To which country did Conny Torstensson represent during his international football career?\nA: Brazil\nB: Germany\nC: Sweden\nD: Italy\nExplanation: The text states, \"Conny Torstensson (born 28 August 1949) is a former footballer from Sweden.\" This directly answers the question of his country of origin.\nCorrect Answer: C\n</output_format>\n```",
    "question": "Kopparvallen, a multi-use stadium established in 1907 in \u00c5tvidaberg, Sweden, has hosted numerous prominent footballers, including Conny Torstensson, who was born on August 28, 1949, and participated in the 1974 and 1978 FIFA World Cups. To which country did Conny Torstensson represent during his international football career?",
    "choices": {
      "A": "Brazil",
      "B": "Germany",
      "C": "Sweden",
      "D": "Italy"
    },
    "answer": "C",
    "explanation": "The text states, \"Conny Torstensson (born 28 August 1949) is a former footballer from Sweden.\" This directly answers the question of his country of origin.",
    "answer_correctness_score": 10,
    "explanation_validity_score": 10,
    "question_clarity_score": 9,
    "question_difficulty_score": 4,
    "question_groundedness_score": 10,
    "question_token_count": 81,
    "reformat_question_cosine_similarity_to_orig": 0.8404314517974854,
    "reformat_answer_cosine_similarity_to_orig": 1.0000001192092896,
    "reformat_question_similarity_score": 9,
    "reformat_answer_similarity_score": 10,
    "avg_answer_token_count": 2
  },
  {
    "orig_question": "The horse-collar tackle technique is most closely associated with a football player who played college football for what school?",
    "orig_answer": "University of Oklahoma",
    "context": "[PAR] [TLE] Roy Williams (safety) [SEP] Roy Lee Williams (born August 14, 1980), is a former American college and professional football player who was a safety in the National Football League (NFL) for nine seasons.  He played college football for the University of Oklahoma, and was recognized as a unanimous All-American.  He was drafted by the Dallas Cowboys eighth overall in the 2002 NFL Draft, and played professionally for the Cowboys and Cincinnati Bengals.  He earned five straight Pro Bowl selections from 2003 to 2007.  Williams is currently a sideline reporter for Oklahoma football games. [PAR] [TLE] Horse-collar tackle [SEP] The horse-collar tackle is an American football maneuver in which a defender tackles another player by grabbing the back collar or the back-inside of an opponent's shoulder pads and pulling the ball carrier directly downward in order to pull his feet from underneath him.  The technique is most closely associated with Pro Bowl safety Roy Williams.  This kind of tackle was banned from the NFL during the 2005 off-season.  The rule forbidding it is often referred to in the press as \"The Roy Williams Rule\".  The rule, with modifications, was adopted in college football in 2008 and high school football in 2009.",
    "response": "```xml\n<document_analysis>\nThoughtful Content Examination: The context provides information about Roy Williams, a former NFL safety, and the horse-collar tackle, a technique he is strongly associated with. It details his college football career at the University of Oklahoma and his NFL draft. The key connection is the association of Williams with the horse-collar tackle and the subsequent NFL rule change.\n\nConcept Exploration: The question tests the recall of a specific detail\u2014where Roy Williams played college football\u2014within the larger context of a football technique and rule change. The association of the technique with Williams is crucial.\n\nStrategic Complexity Calibration: Difficulty: 4/10. The information is directly stated in the text, making it a relatively straightforward recall question. However, it requires connecting Williams to both the tackle and his college.\n\nIntentional Question Planning: The question is designed to check if the test-taker understands the connection between Roy Williams and the horse-collar tackle. It aims to assess comprehension of the context and the ability to recall specific details.\n</document_analysis>\n<output_format>\nQuestion: Roy Williams, a professional football player known for his nine seasons as a safety in the NFL and five consecutive Pro Bowl selections from 2003-2007, is most notably linked to the banning of the horse-collar tackle, a maneuver involving grabbing the back collar or inside of an opponent\u2019s shoulder pads to pull them downward. Prior to his professional career, Williams achieved unanimous All-American recognition while playing for a university. Which of the following universities did Roy Williams attend during his college football career?\nA: University of Texas\nB: University of California, Los Angeles\nC: University of Oklahoma\nD: Ohio State University\nExplanation: The text explicitly states that Roy Williams played college football for the University of Oklahoma and was a unanimous All-American.\nCorrect Answer: C\n</output_format>\n```",
    "question": "Roy Williams, a professional football player known for his nine seasons as a safety in the NFL and five consecutive Pro Bowl selections from 2003-2007, is most notably linked to the banning of the horse-collar tackle, a maneuver involving grabbing the back collar or inside of an opponent\u2019s shoulder pads to pull them downward. Prior to his professional career, Williams achieved unanimous All-American recognition while playing for a university. Which of the following universities did Roy Williams attend during his college football career?",
    "choices": {
      "A": "University of Texas",
      "B": "University of California, Los Angeles",
      "C": "University of Oklahoma",
      "D": "Ohio State University"
    },
    "answer": "C",
    "explanation": "The text explicitly states that Roy Williams played college football for the University of Oklahoma and was a unanimous All-American.",
    "answer_correctness_score": 10,
    "explanation_validity_score": 10,
    "question_clarity_score": 8,
    "question_difficulty_score": 2,
    "question_groundedness_score": 10,
    "question_token_count": 102,
    "reformat_question_cosine_similarity_to_orig": 0.6333088874816895,
    "reformat_answer_cosine_similarity_to_orig": 1.0,
    "reformat_question_similarity_score": 9,
    "reformat_answer_similarity_score": 10,
    "avg_answer_token_count": 4
  },
  {
    "orig_question": "What was the name of the tour launched in support of Taylor Swift's album focused on the color of her emotions and beginning on March 13, 2013?",
    "orig_answer": "The Red Tour",
    "context": "[PAR] [TLE] The Red Tour [SEP] The Red Tour was the third concert tour by American singer-songwriter Taylor Swift.  Launched in support of Swift's fourth studio album, \"Red\" (2012), the tour began on March 13, 2013 in Omaha, Nebraska and concluded on June 12, 2014 in Singapore. [PAR] [TLE] Red (Taylor Swift album) [SEP] Red is the fourth studio album by American singer-songwriter Taylor Swift.  It was released on October 22, 2012, by Big Machine Records, as the follow-up to her third studio album, \"Speak Now\".  The album title was inspired by the \"semi-toxic relationships\" that Swift experienced during the process of conceiving this album, which Swift described the emotions she felt as \"red emotions\" due to their intense and tumultuous nature.  \"Red\" touches on Swift's signature themes of love and heartbreak, however, from a more mature perspective while exploring other themes such as fame and the pressure of being in the limelight.  The album features collaborations with producers and guest artists such as Gary Lightbody of Snow Patrol and Ed Sheeran and is noted for Swift's experimentation with new musical genres.  Swift completed The Red Tour in support of the album on June 12, 2014, which became the highest-grossing tour of all time by a country artist, grossing over $150 million.",
    "response": "```xml\n<document_analysis>\nThoughtful Content Examination: The provided context discusses Taylor Swift's \"Red\" album and the subsequent \"Red Tour.\" The question accurately reflects information present in the text, asking for the tour name linked to the album and its start date.\n\nConcept Exploration: The context highlights the emotional inspiration behind the album title (\"red emotions\") and the tour's purpose as a promotional endeavor. The question tests recall of this connection.\n\nStrategic Complexity Calibration: Difficulty: 4/10. The information is directly stated in the text, making it a relatively straightforward recall question. However, the question is phrased to require integrating multiple pieces of information (album focus, tour support, start date).\n\nIntentional Question Planning: The question is designed to assess understanding of the relationship between Swift's albums and her concert tours, and her artistic choices.\n</document_analysis>\n<output_format>\nQuestion: Taylor Swift's fourth studio album, \"Red,\" released in October 2012, drew its title from the artist's description of intense and tumultuous emotions experienced during its creation. Following the album's release, a concert tour was launched on March 13, 2013, to promote the record. What was the name of this tour?\nA: The Speak Now Tour\nB: The Fearless Tour\nC: The Red Tour\nD: The 1989 World Tour\nExplanation: The text explicitly states, \"The Red Tour was the third concert tour by American singer-songwriter Taylor Swift. Launched in support of Swift's fourth studio album, 'Red' (2012), the tour began on March 13, 2013...\"\nCorrect Answer: C\n</output_format>\n```",
    "question": "Taylor Swift's fourth studio album, \"Red,\" released in October 2012, drew its title from the artist's description of intense and tumultuous emotions experienced during its creation. Following the album's release, a concert tour was launched on March 13, 2013, to promote the record. What was the name of this tour?",
    "choices": {
      "A": "The Speak Now Tour",
      "B": "The Fearless Tour",
      "C": "The Red Tour",
      "D": "The 1989 World Tour"
    },
    "answer": "C",
    "explanation": "The text explicitly states, \"The Red Tour was the third concert tour by American singer-songwriter Taylor Swift. Launched in support of Swift's fourth studio album, 'Red' (2012), the tour began on March 13, 2013...\"",
    "answer_correctness_score": 10,
    "explanation_validity_score": 10,
    "question_clarity_score": 9,
    "question_difficulty_score": 2,
    "question_groundedness_score": 10,
    "question_token_count": 70,
    "reformat_question_cosine_similarity_to_orig": 0.8588820695877075,
    "reformat_answer_cosine_similarity_to_orig": 1.0000001192092896,
    "reformat_question_similarity_score": 9,
    "reformat_answer_similarity_score": 10,
    "avg_answer_token_count": 5
  },
  {
    "orig_question": "What type creative work do Yodel It! and Shake It Off have in common?",
    "orig_answer": "song",
    "context": "[PAR] [TLE] Yodel It! [SEP] \"Yodel It!\"  is a song recorded by Romanian singers Ilinca and Alex Florea, released on 30 January 2017 by Cat Music.  The track was written by Alexandra Niculae and produced by Mihai Alexandru for the Swiss band Timebelle who rejected it.  It was then given to Ilinca to record.  Florea was chosen as a featured artist as both Alexandru and Ilinca felt her version was incomplete.  \"Yodel It!\"  is a mixture of rock, pop and hip hop music, including Ilinca yodeling during the chorus and Florea's rap vocals.  The track's optimistic lyrical message was compared to that of Taylor Swift's \"Shake It Off\" (2014). [PAR] [TLE] Shake It Off [SEP] \"Shake It Off\" is a song recorded by American singer-songwriter Taylor Swift from her fifth album, \"1989\" (2014).  Written by Swift, Max Martin and Shellback, it is an uptempo dance-pop track considered to be a departure from Swift's earlier country pop music style.  \"Shake It Off\" is the sixth track on the album and serves as the lead single.  The song premiered during a Yahoo! live stream session on August 18, 2014 (also streaming internationally online); its music video was also released the same day.  Several hours later, the song was made available for digital download.",
    "response": "```xml\n<document_analysis>\nThoughtful Content Examination: The context provides information about two songs, \"Yodel It!\" and \"Shake It Off,\" detailing their release dates, artists, writers, and musical styles. The core connection between the two pieces of information is that they are both songs.\n\nConcept Exploration: The passage highlights the contrasting musical styles of the two songs while establishing their shared identity as musical works. The comparison to Taylor Swift's song also underscores a similarity in lyrical message (optimism).\n\nStrategic Complexity Calibration: Difficulty: 3/10. While straightforward, the question requires understanding the context to identify the commonality.\n\nIntentional Question Planning: The question aims to test the ability to identify a basic, yet fundamental, characteristic shared by both entries.\n</document_analysis>\n<output_format>\nQuestion: Ilinca and Alex Florea released \"Yodel It!\" in 2017, while Taylor Swift released \"Shake It Off\" in 2014. Both tracks were written by multiple individuals and received significant attention upon their release. What fundamental type of creative work are both \"Yodel It!\" and \"Shake It Off\"?\nA: Musical albums\nB: Live performances\nC: Songs\nD: Dance routines\nExplanation: The provided text explicitly states that both \"Yodel It!\" and \"Shake It Off\" are songs, establishing this as a shared characteristic.\nCorrect Answer: C\n</output_format>\n```",
    "question": "Ilinca and Alex Florea released \"Yodel It!\" in 2017, while Taylor Swift released \"Shake It Off\" in 2014. Both tracks were written by multiple individuals and received significant attention upon their release. What fundamental type of creative work are both \"Yodel It!\" and \"Shake It Off\"?",
    "choices": {
      "A": "Musical albums",
      "B": "Live performances",
      "C": "Songs",
      "D": "Dance routines"
    },
    "answer": "C",
    "explanation": "The provided text explicitly states that both \"Yodel It!\" and \"Shake It Off\" are songs, establishing this as a shared characteristic.",
    "answer_correctness_score": 10,
    "explanation_validity_score": 10,
    "question_clarity_score": 6,
    "question_difficulty_score": 4,
    "question_groundedness_score": 10,
    "question_token_count": 67,
    "reformat_question_cosine_similarity_to_orig": 0.7387605905532837,
    "reformat_answer_cosine_similarity_to_orig": 0.7906684279441833,
    "reformat_question_similarity_score": 9,
    "reformat_answer_similarity_score": 10,
    "avg_answer_token_count": 3
  },
  {
    "orig_question": "What song was co-written by Verse Simmonds and can be found in an album know as \"Loud\" (2010)?",
    "orig_answer": "Man Down",
    "context": "[PAR] [TLE] Verse Simmonds [SEP] Maurice \"Verse\" Simmonds is a Puerto Rican American singer, songwriter, and record producer.  Based in Los Angeles California bit raised in the Virgin Islands, he moved to the United States after high school and he formed the production duo the Jugganauts in the 1990s.  The duo has since co-written and produced tracks such as \"Man Down\" by Rihanna and \"Who Gon Stop Me\" by Kanye West and Jay-Z, both of which charted prominently on \"Billboard\". [PAR] [TLE] Man Down (song) [SEP] \"Man Down\" is a song by Barbadian singer Rihanna from her fifth studio album, \"Loud\" (2010).  Singer Shontelle and production duo Rock City wrote the song with its main producer, Sham.  They wrote it during a writing camp, in Los Angeles of March 2010, held by Rihanna's record label to gather compositions for possible inclusion on the then-untitled album.  Rock City were inspired by Bob Marley's 1973 song \"I Shot the Sheriff\" and set out to create a song which embodied the same feel, but from a female perspective.  \"Man Down\" is a reggae murder ballad which incorporates elements of ragga and electronic music.  Lyrically, Rihanna is a fugitive after she shoots a man, an action she later regrets.  Several critics singled out \"Man Down\" as \"Loud\"' s highlight, while others commented on her prominent West Indian accent and vocal agility.",
    "response": "```xml\n<document_analysis>\nThoughtful Content Examination: The context provides information about Verse Simmonds, a singer, songwriter, and producer, and the song \"Man Down\" by Rihanna. It details Verse Simmonds' involvement in co-writing and producing \"Man Down,\" which appears on Rihanna\u2019s album \"Loud\" (2010).\n\nConcept Exploration: The text highlights the collaborative nature of music production and songwriting, showcasing how different artists contribute to a final product. It also touches upon the inspiration behind \"Man Down,\" drawing a connection to Bob Marley's \"I Shot the Sheriff.\"\n\nStrategic Complexity Calibration: Difficulty: 6/10. The question requires recalling a specific detail about Verse Simmonds' work and linking it to Rihanna's album. It's not overly complex but demands attention to detail.\n\nIntentional Question Planning: The question aims to test the understanding of the relationships between artists and their contributions to specific songs and albums. The question is designed to assess whether the test taker can recall the co-writing credit of Verse Simmonds for a song featured on Rihanna\u2019s \u201cLoud\u201d album.\n</document_analysis>\n<output_format>\nQuestion: Maurice \"Verse\" Simmonds, a Puerto Rican American singer, songwriter, and record producer originally from the Virgin Islands, co-wrote a song that appears on Rihanna's 2010 album titled \"Loud.\" This song was inspired by Bob Marley\u2019s 1973 hit, \u201cI Shot the Sheriff,\u201d and reimagined the narrative from a female perspective. What is the title of this song co-written by Verse Simmonds?\nA: \"Who Gon Stop Me\"\nB: \"I Shot the Sheriff\"\nC: \"Man Down\"\nD: \"Work\"\nExplanation: The text explicitly states that Verse Simmonds co-wrote \"Man Down\" by Rihanna, which is featured on her album \"Loud\" (2010). The song was inspired by Bob Marley's \"I Shot the Sheriff\" and created from a female perspective.\nCorrect Answer: C\n</output_format>\n```",
    "question": "Maurice \"Verse\" Simmonds, a Puerto Rican American singer, songwriter, and record producer originally from the Virgin Islands, co-wrote a song that appears on Rihanna's 2010 album titled \"Loud.\" This song was inspired by Bob Marley\u2019s 1973 hit, \u201cI Shot the Sheriff,\u201d and reimagined the narrative from a female perspective. What is the title of this song co-written by Verse Simmonds?",
    "choices": {
      "A": "\"Who Gon Stop Me\"",
      "B": "\"I Shot the Sheriff\"",
      "C": "\"Man Down\"",
      "D": "\"Work\""
    },
    "answer": "C",
    "explanation": "The text explicitly states that Verse Simmonds co-wrote \"Man Down\" by Rihanna, which is featured on her album \"Loud\" (2010). The song was inspired by Bob Marley's \"I Shot the Sheriff\" and created from a female perspective.",
    "answer_correctness_score": 10,
    "explanation_validity_score": 10,
    "question_clarity_score": 6,
    "question_difficulty_score": 5,
    "question_groundedness_score": 4,
    "question_token_count": 94,
    "reformat_question_cosine_similarity_to_orig": 0.689235508441925,
    "reformat_answer_cosine_similarity_to_orig": 0.8676929473876953,
    "reformat_question_similarity_score": 9,
    "reformat_answer_similarity_score": 10,
    "avg_answer_token_count": 5
  },
  {
    "orig_question": "Charlie Bryan was the head of the International Association of Machinists union during the mid to late 1980s who led a strike against the American businessman and philanthropist, Frank Lorenzo in what year?",
    "orig_answer": "1989",
    "context": "[PAR] [TLE] Charlie Bryan [SEP] Charlie Bryan (11 December 1933 - 2 November 2013) was the head of the International Association of Machinists union in the southeast United States, during the mid to late 1980s.  He led machinists to strike against Eastern Air Lines and Frank Lorenzo in 1989. [PAR] [TLE] Frank Lorenzo [SEP] Francisco Anthony \"Frank\" Lorenzo (born May 19, 1940) is an American businessman and philanthropist.  He is most famous for his leadership of Texas International Airlines and its successor holding company Texas Air Corporation between 1972 and 1990, through which he formed or acquired a number of major U.S. airlines including Continental Airlines, Eastern Air Lines, Frontier Airlines, New York Air and People Express Airlines.",
    "response": "```xml\n<document_analysis>\n<thought_process>The provided context is straightforward, presenting biographical information about Charlie Bryan and Frank Lorenzo, and noting Bryan's leadership of a strike against Eastern Air Lines and Lorenzo in 1989. The original question is a direct factual recall question. To increase complexity, I will rephrase it to require integrating information about both individuals and the union they were involved with. I'll aim for a question that tests understanding of their roles in the 1989 strike. The difficulty level is currently low (around 2/10), and I'll increase it to around 6/10 with the rephrasing and multiple-choice options.</thought_process>\n</document_analysis>\n<output_format>\nQuestion: In the late 1980s, a significant labor dispute arose involving the International Association of Machinists, led by Charlie Bryan, and a prominent figure in the American airline industry. This dispute culminated in a strike against Eastern Air Lines. Which individual, known for his leadership of Texas Air Corporation and multiple U.S. airlines, was the target of this strike action?\nA: Francisco Anthony \"Frank\" Lorenzo, who oversaw a holding company that included Continental and People Express Airlines.\nB: Charlie Bryan, the head of the International Association of Machinists, who initiated the strike.\nC: An unnamed executive at Eastern Air Lines, responsible for negotiating with the machinists union.\nD: A representative from the Federal Aviation Administration, mediating the labor dispute.\nExplanation: The context explicitly states that Charlie Bryan led machinists to strike against Frank Lorenzo in 1989. Frank Lorenzo was known for his leadership of Texas Air Corporation and its acquired airlines.\nCorrect Answer: A\n</output_format>\n```",
    "question": "In the late 1980s, a significant labor dispute arose involving the International Association of Machinists, led by Charlie Bryan, and a prominent figure in the American airline industry. This dispute culminated in a strike against Eastern Air Lines. Which individual, known for his leadership of Texas Air Corporation and multiple U.S. airlines, was the target of this strike action?",
    "choices": {
      "A": "Francisco Anthony \"Frank\" Lorenzo, who oversaw a holding company that included Continental and People Express Airlines.",
      "B": "Charlie Bryan, the head of the International Association of Machinists, who initiated the strike.",
      "C": "An unnamed executive at Eastern Air Lines, responsible for negotiating with the machinists union.",
      "D": "A representative from the Federal Aviation Administration, mediating the labor dispute."
    },
    "answer": "A",
    "explanation": "The context explicitly states that Charlie Bryan led machinists to strike against Frank Lorenzo in 1989. Frank Lorenzo was known for his leadership of Texas Air Corporation and its acquired airlines.",
    "answer_correctness_score": 10,
    "explanation_validity_score": 10,
    "question_clarity_score": 7,
    "question_difficulty_score": 6,
    "question_groundedness_score": 10,
    "question_token_count": 76,
    "reformat_question_cosine_similarity_to_orig": 0.7427927851676941,
    "reformat_answer_cosine_similarity_to_orig": 0.1309240162372589,
    "reformat_question_similarity_score": 8,
    "reformat_answer_similarity_score": 7,
    "avg_answer_token_count": 19
  },
  {
    "orig_question": "What actor played Lewis in a 2012 American romantic comedy film directed by Gabriele Muccino?",
    "orig_answer": "Noah Lomax",
    "context": "[PAR] [TLE] Noah Lomax [SEP] Noah Lomax (born November 7, 2001) is an American child actor.  Among his prominent roles are: Lewis in the film \"Playing for Keeps\", Josh in the film \"Safe Haven\", and Louis Morales in the TV series \"The Walking Dead\". [PAR] [TLE] Playing for Keeps (2012 film) [SEP] Playing for Keeps is a 2012 American romantic comedy film directed by Gabriele Muccino, starring Gerard Butler with Jessica Biel, Catherine Zeta-Jones, Dennis Quaid, Uma Thurman and Judy Greer in supporting roles.  The film was released on December 7, 2012, in the United States and Canada by FilmDistrict.",
    "response": "```xml\n<document_analysis>\n<thought_process>The provided context details Noah Lomax's roles, specifically mentioning his role as Lewis in the film \"Playing for Keeps,\" which is described as a 2012 American romantic comedy directed by Gabriele Muccino. The question directly asks about the actor who played Lewis in that film. The complexity is relatively low, but can be increased by making the options more similar and requiring the test-taker to recall specific details. I will rephrase the question to be more detailed, incorporating more information from the context to increase the challenge and ensure the question is self-contained. The answer is straightforward, so I will create distractors that are other actors or film details to test precise knowledge. </thought_process>\n</document_analysis>\n<output_format>\nQuestion: In Gabriele Muccino's 2012 American romantic comedy film, \"Playing for Keeps,\" which also stars Gerard Butler, Jessica Biel, and Catherine Zeta-Jones, who portrayed the character of Lewis?\nA: Gerard Butler\nB: Noah Lomax\nC: Dennis Quaid\nD: Josh Hutcherson\nExplanation: The text explicitly states that Noah Lomax played Lewis in the 2012 film \"Playing for Keeps\", directed by Gabriele Muccino and starring Gerard Butler, Jessica Biel, and Catherine Zeta-Jones.\nCorrect Answer: B\n</output_format>\n```",
    "question": "In Gabriele Muccino's 2012 American romantic comedy film, \"Playing for Keeps,\" which also stars Gerard Butler, Jessica Biel, and Catherine Zeta-Jones, who portrayed the character of Lewis?",
    "choices": {
      "A": "Gerard Butler",
      "B": "Noah Lomax",
      "C": "Dennis Quaid",
      "D": "Josh Hutcherson"
    },
    "answer": "B",
    "explanation": "The text explicitly states that Noah Lomax played Lewis in the 2012 film \"Playing for Keeps\", directed by Gabriele Muccino and starring Gerard Butler, Jessica Biel, and Catherine Zeta-Jones.",
    "answer_correctness_score": 10,
    "explanation_validity_score": 10,
    "question_clarity_score": 8,
    "question_difficulty_score": 4,
    "question_groundedness_score": 1,
    "question_token_count": 44,
    "reformat_question_cosine_similarity_to_orig": 0.6911051273345947,
    "reformat_answer_cosine_similarity_to_orig": 1.000000238418579,
    "reformat_question_similarity_score": 9,
    "reformat_answer_similarity_score": 10,
    "avg_answer_token_count": 4
  },
  {
    "orig_question": "What companies were acquired by the man that Charlie Bryan lead strike against in 1989?",
    "orig_answer": "Continental Airlines, Eastern Air Lines, Frontier Airlines, New York Air and People Express Airlines",
    "context": "[PAR] [TLE] Charlie Bryan [SEP] Charlie Bryan (11 December 1933 - 2 November 2013) was the head of the International Association of Machinists union in the southeast United States, during the mid to late 1980s.  He led machinists to strike against Eastern Air Lines and Frank Lorenzo in 1989. [PAR] [TLE] Frank Lorenzo [SEP] Francisco Anthony \"Frank\" Lorenzo (born May 19, 1940) is an American businessman and philanthropist.  He is most famous for his leadership of Texas International Airlines and its successor holding company Texas Air Corporation between 1972 and 1990, through which he formed or acquired a number of major U.S. airlines including Continental Airlines, Eastern Air Lines, Frontier Airlines, New York Air and People Express Airlines.",
    "response": "```xml\n<document_analysis>\nThoughtful Content Examination: The context provides information about Charlie Bryan, a union leader who led a strike against Frank Lorenzo and Eastern Air Lines in 1989. It also details Frank Lorenzo's career, specifically mentioning the airlines he acquired through Texas Air Corporation. \n\nConcept Exploration: The question asks about the companies acquired by Frank Lorenzo, the target of the machinists' strike led by Charlie Bryan. This requires connecting information about both individuals and understanding Lorenzo's business activities.\n\nStrategic Complexity Calibration: Difficulty: 6/10. This requires connecting two pieces of information within the text. It's not a simple recall question, but also doesn't require deep inference.\n\nIntentional Question Planning: The question is designed to assess understanding of the relationship between the two figures and Lorenzo's business dealings. It tests the ability to synthesize information from different parts of the provided text.\n</document_analysis>\n<output_format>\nQuestion: In 1989, Charlie Bryan led a strike against Frank Lorenzo, the leader of Texas Air Corporation. Considering Lorenzo's business activities between 1972 and 1990, which of the following airlines were either formed or acquired under his leadership through Texas Air Corporation?\nA: Delta Airlines, Northwest Airlines, and Pan American World Airways.\nB: Continental Airlines, Eastern Air Lines, Frontier Airlines, New York Air and People Express Airlines.\nC: United Airlines, American Airlines, and Southwest Airlines.\nD: Alaska Airlines, Hawaiian Airlines, and JetBlue Airways.\nExplanation: The text explicitly states that Frank Lorenzo, through Texas Air Corporation, formed or acquired Continental Airlines, Eastern Air Lines, Frontier Airlines, New York Air, and People Express Airlines between 1972 and 1990. This is the direct answer to the question.\nCorrect Answer: B\n</output_format>\n```",
    "question": "In 1989, Charlie Bryan led a strike against Frank Lorenzo, the leader of Texas Air Corporation. Considering Lorenzo's business activities between 1972 and 1990, which of the following airlines were either formed or acquired under his leadership through Texas Air Corporation?",
    "choices": {
      "A": "Delta Airlines, Northwest Airlines, and Pan American World Airways.",
      "B": "Continental Airlines, Eastern Air Lines, Frontier Airlines, New York Air and People Express Airlines.",
      "C": "United Airlines, American Airlines, and Southwest Airlines.",
      "D": "Alaska Airlines, Hawaiian Airlines, and JetBlue Airways."
    },
    "answer": "B",
    "explanation": "The text explicitly states that Frank Lorenzo, through Texas Air Corporation, formed or acquired Continental Airlines, Eastern Air Lines, Frontier Airlines, New York Air, and People Express Airlines between 1972 and 1990. This is the direct answer to the question.",
    "answer_correctness_score": 10,
    "explanation_validity_score": 10,
    "question_clarity_score": 1,
    "question_difficulty_score": 6,
    "question_groundedness_score": 10,
    "question_token_count": 54,
    "reformat_question_cosine_similarity_to_orig": 0.670376181602478,
    "reformat_answer_cosine_similarity_to_orig": 0.9740335941314697,
    "reformat_question_similarity_score": 9,
    "reformat_answer_similarity_score": 10,
    "avg_answer_token_count": 14
  },
  {
    "orig_question": "Who wrote and directed the sequel to the 2003 film in which Olivia Olson played Joanna?",
    "orig_answer": "Richard Curtis",
    "context": "[PAR] [TLE] Red Nose Day Actually [SEP] Red Nose Day Actually is a 2017 British romantic comedy television short film, acting as both a sequel to the 2003 feature film \"Love Actually\", and a part of the fund-raising event Red Nose Day 2017.  \"Love Actually\" writer and director Richard Curtis returns alongside cast members Hugh Grant, Liam Neeson, Colin Firth, Andrew Lincoln, Chiwetel Ejiofor, Keira Knightley, Martine McCutcheon, Bill Nighy, Thomas Sangster, L\u00facia Moniz, Olivia Olson, Marcus Brigstocke, and Rowan Atkinson. [PAR] [TLE] Olivia Olson [SEP] Olivia Rose Olson (born May 21, 1992) is an American actress and singer-songwriter, mostly known for her voice roles as Vanessa Doofenshmirtz in \"Phineas and Ferb\" and Marceline the Vampire Queen in \"Adventure Time\".  She also played the character of Joanna in the 2003 film \"Love Actually\" and its 2017 short sequel \"Red Nose Day Actually\".",
    "response": "```xml\n<document_analysis>\nThoughtful Content Examination: The context provides information about \"Red Nose Day Actually,\" a sequel to \"Love Actually,\" and Olivia Olson's involvement in both films. It explicitly states Richard Curtis wrote and directed both films.\nConcept Exploration: The question tests the understanding of the relationships between the films, the director, and the actress. It requires recall of information presented across two segments of the provided text.\nStrategic Complexity Calibration: Difficulty: 6/10. It's not a trivial question, as it requires connecting two pieces of information.\nIntentional Question Planning: The question aims to assess the user's ability to synthesize information about the films and their creators. It's a factual question, but requires a bit of recall and connection-making.\n</document_analysis>\n<output_format>\nQuestion: Olivia Olson appeared as Joanna in the 2003 film \"Love Actually\" and reprised a role in the 2017 short film \"Red Nose Day Actually.\"  Considering the creative team behind both productions, who was responsible for both writing and directing these films?\nA: Hugh Grant\nB: Liam Neeson\nC: Richard Curtis\nD: Rowan Atkinson\nExplanation: The text explicitly states that \"Love Actually\" writer and director Richard Curtis returned for \"Red Nose Day Actually,\" indicating he held both roles for both films.\nCorrect Answer: C\n</output_format>\n```",
    "question": "Olivia Olson appeared as Joanna in the 2003 film \"Love Actually\" and reprised a role in the 2017 short film \"Red Nose Day Actually.\"  Considering the creative team behind both productions, who was responsible for both writing and directing these films?",
    "choices": {
      "A": "Hugh Grant",
      "B": "Liam Neeson",
      "C": "Richard Curtis",
      "D": "Rowan Atkinson"
    },
    "answer": "C",
    "explanation": "The text explicitly states that \"Love Actually\" writer and director Richard Curtis returned for \"Red Nose Day Actually,\" indicating he held both roles for both films.",
    "answer_correctness_score": 10,
    "explanation_validity_score": 10,
    "question_clarity_score": 5,
    "question_difficulty_score": 2,
    "question_groundedness_score": 5,
    "question_token_count": 56,
    "reformat_question_cosine_similarity_to_orig": 0.697130560874939,
    "reformat_answer_cosine_similarity_to_orig": 0.9999998807907104,
    "reformat_question_similarity_score": 9,
    "reformat_answer_similarity_score": 10,
    "avg_answer_token_count": 3
  },
  {
    "orig_question": "Where is the striker who scored 19 goals during the 2007\u201308 Blackburn Rovers F.C. season from?",
    "orig_answer": "Paraguaya",
    "context": "[PAR] [TLE] Roque Santa Cruz [SEP] Roque Luis Santa Cruz Cantero (] ; born 16 August 1981) is a Paraguayan footballer who plays as a striker for Primera Divisi\u00f3n Paraguaya club Olimpia Asunci\u00f3n.  Santa Cruz represented Paraguay from 1999 to 2016.  He is currently the leading scorer of the Albirroja with 32 goals and is also the sixth Paraguay national team player to reach 100 appearances. [PAR] [TLE] 2007\u201308 Blackburn Rovers F.C. season [SEP] Blackburn Rovers F.C. finished in the top half of the Premier League for the third successive season, this time ending up in 7th place, ultimately not enough for European qualification.  Manager Mark Hughes departed for Manchester City at the end of the season, while successful winger David Bentley was sold to Tottenham Hotspur for a club record fee.  Striker Roque Santa Cruz, a summer signing from Bayern Munich, had the season of his life, scoring 19 league goals, making up for Benni McCarthy's loss of form.  Despite interest for richer clubs, Santa Cruz stayed on for another season.",
    "response": "```xml\n<document_analysis>\n<thought_process>The context provides information about Roque Santa Cruz, a Paraguayan footballer who played for Blackburn Rovers in the 2007-08 season, where he scored 19 league goals. The question asks about his origin. This is a factual recall question. I will rephrase it to be more detailed and challenging, requiring the test taker to synthesize information from both paragraphs. The question should include information about his performance to make it less straightforward. I will ensure the distractors are plausible, based on football knowledge.</thought_process>\n<complexity_assessment>Difficulty: 5/10. This is a relatively straightforward factual recall question, but adding details increases the complexity.</complexity_assessment>\n<relevance_assessment>The context is directly relevant to the question. No irrelevant information is present.</relevance_assessment>\n</document_analysis>\n<output_format>\nQuestion: During the 2007\u201308 Premier League season, Roque Santa Cruz experienced a career year with Blackburn Rovers, scoring 19 league goals and compensating for Benni McCarthy\u2019s decline in performance. Prior to joining Blackburn Rovers from Bayern Munich, from which nation did this prolific striker originate?\nA: Brazil\nB: Argentina\nC: Paraguay\nD: Uruguay\nExplanation: The text explicitly states that Roque Santa Cruz is a Paraguayan footballer.\nCorrect Answer: C\n</output_format>\n```",
    "question": "During the 2007\u201308 Premier League season, Roque Santa Cruz experienced a career year with Blackburn Rovers, scoring 19 league goals and compensating for Benni McCarthy\u2019s decline in performance. Prior to joining Blackburn Rovers from Bayern Munich, from which nation did this prolific striker originate?",
    "choices": {
      "A": "Brazil",
      "B": "Argentina",
      "C": "Paraguay",
      "D": "Uruguay"
    },
    "answer": "C",
    "explanation": "The text explicitly states that Roque Santa Cruz is a Paraguayan footballer.",
    "answer_correctness_score": 10,
    "explanation_validity_score": 10,
    "question_clarity_score": 4,
    "question_difficulty_score": 2,
    "question_groundedness_score": 10,
    "question_token_count": 59,
    "reformat_question_cosine_similarity_to_orig": 0.6478070616722107,
    "reformat_answer_cosine_similarity_to_orig": 0.9468401670455933,
    "reformat_question_similarity_score": 9,
    "reformat_answer_similarity_score": 9,
    "avg_answer_token_count": 3
  },
  {
    "orig_question": "Baker Reagan Mayfield, is a college American football quarterback for the Oklahoma Sooners, after sitting out the 2014 season due to NCAA transfer rules, Mayfield won the starting quarterback job in 2015 over which incumbent starter, an American football quarterback for the Atlanta Falcons of the National Football League (NFL)?",
    "orig_answer": "Trevor Knight",
    "context": "[PAR] [TLE] Baker Mayfield [SEP] Baker Reagan Mayfield (born April 14, 1995) is a college American football quarterback for the Oklahoma Sooners.  Mayfield began his college football career as a walk-on player for the Texas Tech Red Raiders.  He is notable for being the first walk-on true freshman quarterback to start a season opener at a BCS school.  Mayfield transferred from Texas Tech to Oklahoma following alleged scholarship issues and a lack of communication with coaches.  After sitting out the 2014 season due to NCAA transfer rules, Mayfield won the starting quarterback job in 2015 over Cody Thomas and incumbent starter Trevor Knight. [PAR] [TLE] Trevor Knight [SEP] Trevor Knight (born October 3, 1993) is an American football quarterback for the Atlanta Falcons of the National Football League (NFL).  He played college football for the Oklahoma Sooners and Texas A&M Aggies.  After leading Oklahoma to an 8\u20135 record in the 2014 season, he lost the starting job in an open quarterback competition to Texas Tech transfer Baker Mayfield prior to the 2015 season.  On January 4, 2016, it was announced that Knight would transfer to Texas A&M University.",
    "response": "```xml\n<document_analysis>\nThoughtful Content Examination: The context provides information about Baker Mayfield and Trevor Knight, both college football quarterbacks. It details Mayfield's transfer from Texas Tech to Oklahoma and his subsequent winning of the starting quarterback position. It also states Knight lost his starting position to Mayfield and then transferred to Texas A&M.\n\nConcept Exploration: The question centers on the quarterback competition at Oklahoma and the transfer of Trevor Knight. It tests knowledge of player movements and team dynamics within college football.\n\nStrategic Complexity Calibration: Difficulty: 6/10. This question requires recalling specific details about the players and their circumstances. It's not overly complex but isn't trivial either.\n\nIntentional Question Planning: The question is designed to assess understanding of the sequence of events regarding the quarterback competition at Oklahoma and the subsequent transfer of Trevor Knight. It requires the test taker to connect information about both players.\n</document_analysis>\n<output_format>\nQuestion: Baker Reagan Mayfield, a college American football quarterback for the Oklahoma Sooners, transferred from Texas Tech following alleged scholarship issues and a lack of communication with coaches. After fulfilling NCAA transfer requirements and sitting out the 2014 season, Mayfield secured the starting quarterback role in 2015. Prior to this, which player had held the starting quarterback position for the Oklahoma Sooners and later transferred to Texas A&M University, currently playing as an American football quarterback for the Atlanta Falcons of the National Football League (NFL)?\nA: Cody Thomas\nB: Trevor Knight\nC: Kyler Murray\nD: Samaje Perine\nExplanation: The text explicitly states that Trevor Knight lost the starting job to Baker Mayfield and subsequently transferred to Texas A&M University. It also notes he plays for the Atlanta Falcons.\nCorrect Answer: B\n</output_format>\n```",
    "question": "Baker Reagan Mayfield, a college American football quarterback for the Oklahoma Sooners, transferred from Texas Tech following alleged scholarship issues and a lack of communication with coaches. After fulfilling NCAA transfer requirements and sitting out the 2014 season, Mayfield secured the starting quarterback role in 2015. Prior to this, which player had held the starting quarterback position for the Oklahoma Sooners and later transferred to Texas A&M University, currently playing as an American football quarterback for the Atlanta Falcons of the National Football League (NFL)?",
    "choices": {
      "A": "Cody Thomas",
      "B": "Trevor Knight",
      "C": "Kyler Murray",
      "D": "Samaje Perine"
    },
    "answer": "B",
    "explanation": "The text explicitly states that Trevor Knight lost the starting job to Baker Mayfield and subsequently transferred to Texas A&M University. It also notes he plays for the Atlanta Falcons.",
    "answer_correctness_score": 10,
    "explanation_validity_score": 10,
    "question_clarity_score": 6,
    "question_difficulty_score": 7,
    "question_groundedness_score": 10,
    "question_token_count": 105,
    "reformat_question_cosine_similarity_to_orig": 0.9419071674346924,
    "reformat_answer_cosine_similarity_to_orig": 0.9999998807907104,
    "reformat_question_similarity_score": 9,
    "reformat_answer_similarity_score": 10,
    "avg_answer_token_count": 4
  },
  {
    "orig_question": "Two Lanes of Freedom includes the single that features which other singer-songwriter on vocals?",
    "orig_answer": "Taylor Swift",
    "context": "[PAR] [TLE] Highway Don't Care [SEP] \"Highway Don't Care\" is a song performed by American country music artist Tim McGraw and features American singer-songwriter Taylor Swift on vocals, as well as Keith Urban on guitar.  It was released in March 2013 as the third single from McGraw's first album for Big Machine Records, \"Two Lanes of Freedom\" (2013).  The song was written by Mark Irwin, Josh Kear and Brad and Brett Warren.  McGraw and Swift recorded their parts separately. [PAR] [TLE] Two Lanes of Freedom [SEP] Two Lanes of Freedom is the twelfth studio album by American country music artist Tim McGraw.  It was released February 5, 2013, as his first album for Big Machine Records following a 20-year tenure with Curb Records.  He co-produced the album with Byron Gallimore, producer of his previously released albums.  The album includes the singles \"Truck Yeah\", \"One of Those Nights\", \"Highway Don't Care\" featuring new labelmate Taylor Swift, and \"Southern Girl\".",
    "response": "```xml\n<document_analysis>\nThoughtful Content Examination: The context discusses Tim McGraw's album \"Two Lanes of Freedom\" and the song \"Highway Don't Care,\" which features Taylor Swift. The question directly asks about the singer featured on a single from the album.\nConcept Exploration: The question tests recall of specific details regarding Tim McGraw's discography and collaborations. It assesses understanding of album content and featured artists.\nStrategic Complexity Calibration: Difficulty: 3/10. This is a fairly straightforward factual recall question. I will increase the difficulty by making the answer options more similar and requiring more precise knowledge.\nIntentional Question Planning: The question is suitable as is, but can be improved by adding distractors that are also artists associated with country music.\n</document_analysis>\n<output_format>\nQuestion: Tim McGraw's album, \"Two Lanes of Freedom,\" released in 2013, included a single that gained significant attention for its collaboration with another prominent artist. This single, titled \"Highway Don't Care,\" notably featured vocals from which singer-songwriter?\nA: Shania Twain\nB: Faith Hill\nC: Taylor Swift\nD: Carrie Underwood\nExplanation: The text explicitly states that \"Highway Don't Care\" features American singer-songwriter Taylor Swift on vocals, making C the correct answer.\nCorrect Answer: C\n</output_format>\n```",
    "question": "Tim McGraw's album, \"Two Lanes of Freedom,\" released in 2013, included a single that gained significant attention for its collaboration with another prominent artist. This single, titled \"Highway Don't Care,\" notably featured vocals from which singer-songwriter?",
    "choices": {
      "A": "Shania Twain",
      "B": "Faith Hill",
      "C": "Taylor Swift",
      "D": "Carrie Underwood"
    },
    "answer": "C",
    "explanation": "The text explicitly states that \"Highway Don't Care\" features American singer-songwriter Taylor Swift on vocals, making C the correct answer.",
    "answer_correctness_score": 10,
    "explanation_validity_score": 10,
    "question_clarity_score": 9,
    "question_difficulty_score": 4,
    "question_groundedness_score": 10,
    "question_token_count": 54,
    "reformat_question_cosine_similarity_to_orig": 0.691591739654541,
    "reformat_answer_cosine_similarity_to_orig": 1.0000001192092896,
    "reformat_question_similarity_score": 9,
    "reformat_answer_similarity_score": 10,
    "avg_answer_token_count": 4
  },
  {
    "orig_question": "Who is the mother of Britney and Jamie Lynn Spears?",
    "orig_answer": "Lynne Spears",
    "context": "[PAR] [TLE] A Mother's Gift [SEP] A Mother's Gift is a 2001 novel by pop music singer Britney Spears and her mother, Lynne Spears.  It is their second book together, following 2000's \"Heart-to-Heart\".  The novel is loosely based on Britney's life.  Popular reactions to the novel in spaces like Amazon were mixed.  In 2012, rumors of a third novel sequel surfaced. [PAR] [TLE] Lynne Spears [SEP] Lynne Irene Spears (born Lynne Irene Bridges; May 4, 1955) is an American author and mother of film and television producer Bryan Spears, pop singer Britney Spears, and country singer Jamie Lynn Spears.",
    "response": "```xml\n<document_analysis>\nThoughtful Content Examination: The context provides information about Britney Spears, her mother Lynne Spears, and their collaborative novel \"A Mother's Gift.\" It also briefly mentions Britney's brother, Bryan Spears, and sister, Jamie Lynn Spears. The core information relevant to a question is Lynne Spears' identity and her relationship to Britney and Jamie Lynn.\n\nConcept Exploration: The context establishes a familial connection and highlights Lynne Spears as an author. This could be used to formulate questions about her authorship or her role in her children's lives.\n\nStrategic Complexity Calibration: Difficulty: 3/10. The information is very direct and easily accessible. I will aim to increase the complexity by rephrasing the question to require more than a simple recall of a name.\n\nIntentional Question Planning: I will rephrase the question to focus on Lynne Spears' identity and her role as a mother, incorporating details about her birthdate and the names of all her children to test a more comprehensive understanding of the provided context.\n</document_analysis>\n<output_format>\nQuestion: Lynne Irene Bridges, born May 4, 1955, is known professionally by another name and is the mother of three children involved in the entertainment industry: Bryan, a film and television producer; Britney, a pop singer; and Jamie Lynn, a country singer. What is Lynne Irene Bridges\u2019 more commonly known name?\nA: Britney Spears\nB: Lynne Spears\nC: Jamie Lynn Spears\nD: Bryan Spears\nExplanation: The text explicitly states, \u201cLynne Irene Spears (born Lynne Irene Bridges; May 4, 1955) is an American author and mother of film and television producer Bryan Spears, pop singer Britney Spears, and country singer Jamie Lynn Spears.\u201d This confirms Lynne Spears as her commonly known name.\nCorrect Answer: B\n</output_format>\n```",
    "question": "Lynne Irene Bridges, born May 4, 1955, is known professionally by another name and is the mother of three children involved in the entertainment industry: Bryan, a film and television producer; Britney, a pop singer; and Jamie Lynn, a country singer. What is Lynne Irene Bridges\u2019 more commonly known name?",
    "choices": {
      "A": "Britney Spears",
      "B": "Lynne Spears",
      "C": "Jamie Lynn Spears",
      "D": "Bryan Spears"
    },
    "answer": "B",
    "explanation": "The text explicitly states, \u201cLynne Irene Spears (born Lynne Irene Bridges; May 4, 1955) is an American author and mother of film and television producer Bryan Spears, pop singer Britney Spears, and country singer Jamie Lynn Spears.\u201d This confirms Lynne Spears as her commonly known name.",
    "answer_correctness_score": 10,
    "explanation_validity_score": 10,
    "question_clarity_score": 4,
    "question_difficulty_score": 2,
    "question_groundedness_score": 1,
    "question_token_count": 70,
    "reformat_question_cosine_similarity_to_orig": 0.49734067916870117,
    "reformat_answer_cosine_similarity_to_orig": 0.9999997615814209,
    "reformat_question_similarity_score": 9,
    "reformat_answer_similarity_score": 10,
    "avg_answer_token_count": 5
  },
  {
    "orig_question": "Which Sacramento Kings player who won four player of the year awards also played at the seventh annual Diamond Head Classic?",
    "orig_answer": "Buddy Hield",
    "context": "[PAR] [TLE] 2015 Diamond Head Classic [SEP] The 2015 Diamond Head Classic was a mid-season eight-team college basketball tournament that was played on December 22, 23, and 25 at the Stan Sheriff Center in Honolulu, Hawaii.  It was the seventh annual Diamond Head Classic tournament and was part of the 2015\u201316 NCAA Division I men's basketball season.  No. 3-ranked Oklahoma defeated Harvard to win the tournament championship.  Buddy Hield was named the tournament's MVP. [PAR] [TLE] Buddy Hield [SEP] Chavano Rainier \"Buddy\" Hield (born December 17, 1993) is a Bahamian professional basketball player for the Sacramento Kings of the National Basketball Association (NBA).  He was named the Big 12 Conference Men's Basketball Player of the Year in 2015 and 2016, and in 2016, he received four major national player of the year awards\u2014the John R. Wooden Award, the Naismith Award, \"Sporting News\" Player of the Year, and the Oscar Robertson Trophy.  Hield was selected with the sixth overall pick in the 2016 NBA draft by the New Orleans Pelicans.",
    "response": "```xml\n<document_analysis>\nThoughtful Content Examination: The provided context discusses the 2015 Diamond Head Classic and Buddy Hield, a basketball player currently with the Sacramento Kings. The question asks about a player who played in the tournament and won multiple awards, directly linking these two pieces of information.\n\nConcept Exploration: The connection between collegiate achievements (Diamond Head Classic, Player of the Year awards) and professional career (Sacramento Kings, NBA draft) is a key aspect of the text. The question tests the ability to synthesize information across different parts of the context.\n\nStrategic Complexity Calibration: Difficulty: 6/10. The information is directly stated, but requires linking two distinct pieces of information.\n\nIntentional Question Planning: The question is designed to test the ability to recall specific details and make connections between them. It avoids simply asking for a definition or a direct quote, instead requiring the user to combine information.\n</document_analysis>\n<output_format>\nQuestion: Chavano Rainier \"Buddy\" Hield, a Bahamian professional basketball player currently with the Sacramento Kings of the National Basketball Association, achieved significant collegiate recognition by being named the Big 12 Conference Men's Basketball Player of the Year in both 2015 and 2016. Furthermore, in 2016, Hield was honored with four prestigious national player of the year awards \u2013 the John R. Wooden Award, the Naismith Award, \"Sporting News\" Player of the Year, and the Oscar Robertson Trophy. Considering this information, and knowing the 2015 Diamond Head Classic was a mid-season eight-team college basketball tournament held in Honolulu, Hawaii, which player competed in the seventh annual Diamond Head Classic?\nA: Jayson Tatum\nB: Buddy Hield\nC: Zion Williamson\nD: Ja Morant\nExplanation: The context states that Buddy Hield was named the tournament's MVP at the 2015 Diamond Head Classic, directly answering the question.\nCorrect Answer: B\n</output_format>\n```",
    "question": "Chavano Rainier \"Buddy\" Hield, a Bahamian professional basketball player currently with the Sacramento Kings of the National Basketball Association, achieved significant collegiate recognition by being named the Big 12 Conference Men's Basketball Player of the Year in both 2015 and 2016. Furthermore, in 2016, Hield was honored with four prestigious national player of the year awards \u2013 the John R. Wooden Award, the Naismith Award, \"Sporting News\" Player of the Year, and the Oscar Robertson Trophy. Considering this information, and knowing the 2015 Diamond Head Classic was a mid-season eight-team college basketball tournament held in Honolulu, Hawaii, which player competed in the seventh annual Diamond Head Classic?",
    "choices": {
      "A": "Jayson Tatum",
      "B": "Buddy Hield",
      "C": "Zion Williamson",
      "D": "Ja Morant"
    },
    "answer": "B",
    "explanation": "The context states that Buddy Hield was named the tournament's MVP at the 2015 Diamond Head Classic, directly answering the question.",
    "answer_correctness_score": 10,
    "explanation_validity_score": 10,
    "question_clarity_score": 1,
    "question_difficulty_score": 8,
    "question_groundedness_score": 1,
    "question_token_count": 148,
    "reformat_question_cosine_similarity_to_orig": 0.6179158687591553,
    "reformat_answer_cosine_similarity_to_orig": 1.0,
    "reformat_question_similarity_score": 9,
    "reformat_answer_similarity_score": 10,
    "avg_answer_token_count": 4
  },
  {
    "orig_question": "What naval destroyed is named after the first naval recipient of the Medal of Honor in World War II?",
    "orig_answer": "USS \"O'Hare\"",
    "context": "[PAR] [TLE] Edward O'Hare [SEP] Lieutenant Commander Edward Henry \u201cButch\u201d O\u2019Hare (March 13, 1914 \u2013 November 26, 1943) was an American naval aviator of the United States Navy, who on February 20, 1942, became the Navy's first flying ace when he single-handedly attacked a formation of nine heavy bombers approaching his aircraft carrier.  Even though he had a limited amount of ammunition, he managed to shoot down or damage several enemy bombers.  On April 21, 1942, he became the first naval recipient of the Medal of Honor in World War II. [PAR] [TLE] USS O'Hare (DD-889) [SEP] USS \"O'Hare\" (DD/DDR-889) was a \"Gearing\"-class destroyer of the United States Navy, named for Lieutenant Commander Edward \"Butch\" O'Hare, Medal of Honor recipient, who was shot down at Tarawa on 27 November 1943.",
    "response": "```xml\n<document_analysis>\nThoughtful Content Examination: The context provides information about Edward O'Hare, a naval aviator and the first naval recipient of the Medal of Honor in WWII, and the USS O'Hare, a destroyer named after him. The question asks about the naval destroyer named after the Medal of Honor recipient.\n\nConcept Exploration: This is a factual recall question. It tests the understanding of the relationship between Edward O'Hare and the ship named after him.\n\nStrategic Complexity Calibration: Difficulty: 3/10. It's a straightforward factual question but important for understanding the historical connection.\n\nIntentional Question Planning: The question can be enhanced by adding more detail about O'Hare and the class of destroyer to test a more thorough understanding. I will rephrase the question to include the class of ship and a specific detail about O'Hare's actions.\n</document_analysis>\n<output_format>\nQuestion: Lieutenant Commander Edward Henry \u201cButch\u201d O\u2019Hare, the first naval aviator to earn the Medal of Honor in World War II for single-handedly engaging a formation of nine enemy bombers, is honored by the naming of which United States Navy destroyer?\nA: USS Johnston (DD-872)\nB: USS O'Hare (DD-889)\nC: USS Cassin Young (DD-793)\nD: USS Fletcher (DD-445)\nExplanation: The text states that USS \"O'Hare\" (DD-889) was a \"Gearing\"-class destroyer named for Lieutenant Commander Edward \"Butch\" O'Hare, Medal of Honor recipient.\nCorrect Answer: B\n</output_format>\n```",
    "question": "Lieutenant Commander Edward Henry \u201cButch\u201d O\u2019Hare, the first naval aviator to earn the Medal of Honor in World War II for single-handedly engaging a formation of nine enemy bombers, is honored by the naming of which United States Navy destroyer?",
    "choices": {
      "A": "USS Johnston (DD-872)",
      "B": "USS O'Hare (DD-889)",
      "C": "USS Cassin Young (DD-793)",
      "D": "USS Fletcher (DD-445)"
    },
    "answer": "B",
    "explanation": "The text states that USS \"O'Hare\" (DD-889) was a \"Gearing\"-class destroyer named for Lieutenant Commander Edward \"Butch\" O'Hare, Medal of Honor recipient.",
    "answer_correctness_score": 10,
    "explanation_validity_score": 10,
    "question_clarity_score": 1,
    "question_difficulty_score": 2,
    "question_groundedness_score": 1,
    "question_token_count": 55,
    "reformat_question_cosine_similarity_to_orig": 0.6371573805809021,
    "reformat_answer_cosine_similarity_to_orig": 0.9028388261795044,
    "reformat_question_similarity_score": 9,
    "reformat_answer_similarity_score": 9,
    "avg_answer_token_count": 9
  },
  {
    "orig_question": "Evolution: A Theory in Crisis is a 1985 book by a biochemist and Senior fellow at Discovery Institute's Center for what?",
    "orig_answer": "Science and Culture",
    "context": "[PAR] [TLE] Michael Denton [SEP] Michael John Denton (born 25 August 1943) is a British-Australian author and biochemist.  He is a Senior Fellow at the Discovery Institute's Center for Science and Culture.  Denton\u2019s most prominent book, \"\", inspired intelligent design proponents Phillip Johnson and Michael Behe. [PAR] [TLE] Evolution: A Theory in Crisis [SEP] Evolution: A Theory in Crisis is a 1985 book by Michael Denton arguing that the scientific theory of evolution by natural selection is a \"theory in crisis\".  Reviews by scientists say that the book distorts and misrepresents evolutionary theory and contains numerous errors.",
    "response": "```xml\n<document_analysis>\n<thought_process>The provided context is concise and factual, detailing Michael Denton's background and his book \"Evolution: A Theory in Crisis.\" The original question is very simple and doesn't challenge a domain expert. The goal is to create a more complex, nuanced question that tests understanding of the context. The context provides information about Denton's affiliations and the core argument of his book. I will rephrase the question to be more challenging, incorporating details about his role and the book's central claim, and create plausible distractors.</thought_process>\n<complexity_assessment>Original question difficulty: 2/10. Rewritten question difficulty: 6/10</complexity_assessment>\n</document_analysis>\n<output_format>\nQuestion: Michael Denton, a biochemist recognized for his 1985 publication \"Evolution: A Theory in Crisis,\" which contends that the scientific theory of evolution by natural selection is facing significant challenges, currently holds the position of Senior Fellow at which institution's Center?\nA: The National Academy of Sciences' Center for Evolutionary Research\nB: The Discovery Institute's Center for Science and Culture\nC: The Smithsonian Institution's Center for Human Origins\nD: The Max Planck Institute for Evolutionary Anthropology\nExplanation: The text explicitly states that Michael Denton is a Senior Fellow at the Discovery Institute's Center for Science and Culture.\nCorrect Answer: B\n</output_format>\n```",
    "question": "Michael Denton, a biochemist recognized for his 1985 publication \"Evolution: A Theory in Crisis,\" which contends that the scientific theory of evolution by natural selection is facing significant challenges, currently holds the position of Senior Fellow at which institution's Center?",
    "choices": {
      "A": "The National Academy of Sciences' Center for Evolutionary Research",
      "B": "The Discovery Institute's Center for Science and Culture",
      "C": "The Smithsonian Institution's Center for Human Origins",
      "D": "The Max Planck Institute for Evolutionary Anthropology"
    },
    "answer": "B",
    "explanation": "The text explicitly states that Michael Denton is a Senior Fellow at the Discovery Institute's Center for Science and Culture.",
    "answer_correctness_score": 10,
    "explanation_validity_score": 10,
    "question_clarity_score": 6,
    "question_difficulty_score": 4,
    "question_groundedness_score": 10,
    "question_token_count": 53,
    "reformat_question_cosine_similarity_to_orig": 0.7568444013595581,
    "reformat_answer_cosine_similarity_to_orig": 0.6280219554901123,
    "reformat_question_similarity_score": 9,
    "reformat_answer_similarity_score": 9,
    "avg_answer_token_count": 10
  },
  {
    "orig_question": "Where was the first naval recipient of the Medal of Honor in World War II shot down?",
    "orig_answer": "Tarawa",
    "context": "[PAR] [TLE] Edward O'Hare [SEP] Lieutenant Commander Edward Henry \u201cButch\u201d O\u2019Hare (March 13, 1914 \u2013 November 26, 1943) was an American naval aviator of the United States Navy, who on February 20, 1942, became the Navy's first flying ace when he single-handedly attacked a formation of nine heavy bombers approaching his aircraft carrier.  Even though he had a limited amount of ammunition, he managed to shoot down or damage several enemy bombers.  On April 21, 1942, he became the first naval recipient of the Medal of Honor in World War II. [PAR] [TLE] USS O'Hare (DD-889) [SEP] USS \"O'Hare\" (DD/DDR-889) was a \"Gearing\"-class destroyer of the United States Navy, named for Lieutenant Commander Edward \"Butch\" O'Hare, Medal of Honor recipient, who was shot down at Tarawa on 27 November 1943.",
    "response": "```xml\n<document_analysis>\nThoughtful Content Examination: The context provides information about Edward O'Hare, a naval aviator, and the USS O'Hare, a destroyer named after him. It states O'Hare was the first naval recipient of the Medal of Honor in WWII and was shot down at Tarawa. The question directly asks where he was shot down.\n\nConcept Exploration: The text establishes a connection between the person and the ship named after him, highlighting O'Hare's bravery and contribution. The question focuses on a specific event in his life \u2013 his death in action.\n\nStrategic Complexity Calibration: Difficulty: 3/10. This is a fairly straightforward factual recall question. To increase complexity, we can rephrase the question to require synthesis of information.\n\nIntentional Question Planning: The question can be made more challenging by embedding it within a scenario or asking about the implications of his death. However, the goal is to maintain semantic equivalence.\n</document_analysis>\n<output_format>\nQuestion: Lieutenant Commander Edward Henry \u201cButch\u201d O\u2019Hare earned the distinction of being the first naval recipient of the Medal of Honor during World War II for his exceptional bravery in combat. Considering the information provided, at which location did this decorated naval aviator ultimately meet his fate, being shot down in action?\nA: Pearl Harbor\nB: Midway Island\nC: Tarawa\nD: Guadalcanal\nExplanation: The text explicitly states that Lieutenant Commander Edward \u201cButch\u201d O\u2019Hare was shot down at Tarawa on November 27, 1943.\nCorrect Answer: C\n</output_format>\n```",
    "question": "Lieutenant Commander Edward Henry \u201cButch\u201d O\u2019Hare earned the distinction of being the first naval recipient of the Medal of Honor during World War II for his exceptional bravery in combat. Considering the information provided, at which location did this decorated naval aviator ultimately meet his fate, being shot down in action?",
    "choices": {
      "A": "Pearl Harbor",
      "B": "Midway Island",
      "C": "Tarawa",
      "D": "Guadalcanal"
    },
    "answer": "C",
    "explanation": "The text explicitly states that Lieutenant Commander Edward \u201cButch\u201d O\u2019Hare was shot down at Tarawa on November 27, 1943.",
    "answer_correctness_score": 10,
    "explanation_validity_score": 10,
    "question_clarity_score": 1,
    "question_difficulty_score": 3,
    "question_groundedness_score": 10,
    "question_token_count": 64,
    "reformat_question_cosine_similarity_to_orig": 0.7081433534622192,
    "reformat_answer_cosine_similarity_to_orig": 0.9999998807907104,
    "reformat_question_similarity_score": 9,
    "reformat_answer_similarity_score": 10,
    "avg_answer_token_count": 4
  },
  {
    "orig_question": "John P. Buchanan had a term as governor marred by the labor uprising that mainly took place in what Tennessee locale?",
    "orig_answer": "Anderson County",
    "context": "[PAR] [TLE] John P. Buchanan [SEP] John Price Buchanan (October 24, 1847May 14, 1930) was an American politician and farmers' advocate.  He served as Governor of Tennessee from 1891 to 1893, and was president of the Tennessee Farmers' Alliance and Laborers' Union in the late 1880s.  Buchanan's lone term as governor was largely marred by the Coal Creek War, an armed uprising by coal miners aimed at ending the state's convict lease system. [PAR] [TLE] Coal Creek War [SEP] The Coal Creek War was an early 1890s armed labor uprising in the southeastern United States that took place primarily in Anderson County, Tennessee.  This labor conflict ignited during 1891 when coal mine owners in the Coal Creek watershed began to remove and replace their company-employed, private coal miners then on the payroll with convict laborers leased out by the Tennessee state prison system.",
    "response": "```xml\n<document_analysis>\nThoughtful Content Examination: The context provides information about John P. Buchanan, his role as governor of Tennessee, and the Coal Creek War. The question asks about the location of the Coal Creek War, which is explicitly stated in the context.\n\nConcept Exploration: The Coal Creek War represents a significant labor conflict and highlights issues related to convict leasing. Buchanan's governorship was directly impacted by this event.\n\nStrategic Complexity Calibration: Difficulty: 4/10. The answer is directly stated in the text, making it a relatively straightforward factual recall question. However, it requires understanding the connection between Buchanan's governorship and the Coal Creek War.\n\nIntentional Question Planning: The question tests the ability to recall specific details about a historical event and its connection to a political figure.\n</document_analysis>\n<output_format>\nQuestion: John P. Buchanan served as Governor of Tennessee from 1891 to 1893, a period significantly impacted by an armed labor uprising protesting the state's practice of leasing convict laborers to private companies. This conflict, known as the Coal Creek War, primarily unfolded within which Tennessee county?\nA: Shelby County\nB: Davidson County\nC: Anderson County\nD: Knox County\nExplanation: The text states that the Coal Creek War \"took place primarily in Anderson County, Tennessee.\" Therefore, Anderson County is the correct answer.\nCorrect Answer: C\n</output_format>\n```",
    "question": "John P. Buchanan served as Governor of Tennessee from 1891 to 1893, a period significantly impacted by an armed labor uprising protesting the state's practice of leasing convict laborers to private companies. This conflict, known as the Coal Creek War, primarily unfolded within which Tennessee county?",
    "choices": {
      "A": "Shelby County",
      "B": "Davidson County",
      "C": "Anderson County",
      "D": "Knox County"
    },
    "answer": "C",
    "explanation": "The text states that the Coal Creek War \"took place primarily in Anderson County, Tennessee.\" Therefore, Anderson County is the correct answer.",
    "answer_correctness_score": 10,
    "explanation_validity_score": 10,
    "question_clarity_score": 8,
    "question_difficulty_score": 2,
    "question_groundedness_score": 10,
    "question_token_count": 61,
    "reformat_question_cosine_similarity_to_orig": 0.7938553094863892,
    "reformat_answer_cosine_similarity_to_orig": 1.0,
    "reformat_question_similarity_score": 9,
    "reformat_answer_similarity_score": 10,
    "avg_answer_token_count": 3
  },
  {
    "orig_question": "Mariana Kovacevic is a Serbian traditional healer who has specialized in the use of horse placenta treatment to heal athletes, during the duration of the 2012 African Cup of Nations in Gabon and Equatorial Guinea she used the horse placenta treatment to heal Asamoah Gyan, a Ghanaian professional footballer who plays as a striker for which team, and captains the Ghanaian national team?",
    "orig_answer": "Kayserispor",
    "context": "[PAR] [TLE] Mariana Kovacevic [SEP] Mariana Kovacevic is a Serbian traditional healer who has specialized in the use of horse placenta treatment to heal athletes.  During the duration of the 2012 African Cup of Nations in Gabon and Equatorial Guinea she used the horse placenta treatment to heal Ghana's Asamoah Gyan, who had been injured and was supposed to be off football for four weeks.  She is reported to have nursed him back to health in four hours.  She was also reportedly enlisted by the Serbia during the world of 2010 in south Africa.  Other footballers who are reported to have been treated by Mariana include Pablo Zabaleta, Vincent Kompany, Nigel de Jong and Robin Van Persie of Manchester United.  There has been some doubt as to whether Mariana's therapies work.  But more footballers are turning to her for help. [PAR] [TLE] Asamoah Gyan [SEP] Asamoah Gyan ( , , born 22 November 1985 in Accra) is a Ghanaian professional footballer who plays as a striker for Kayserispor and captains the Ghanaian national team.",
    "response": "```xml\n<document_analysis>\nThoughtful Content Examination: The context provides information about Mariana Kovacevic, a traditional healer, and her use of horse placenta treatment on athletes, specifically mentioning Asamoah Gyan. It also states Gyan plays for Kayserispor and captains the Ghanaian national team. The question combines information about Kovacevic, her treatment, and Gyan's team affiliation.\n\nConcept Exploration: The question tests the recall of specific details from the text \u2013 the team Asamoah Gyan plays for. It requires understanding the context of both individuals and their connection.\n\nStrategic Complexity Calibration: Difficulty: 3/10. This is a factual recall question, but it combines information from two parts of the provided text, making it slightly more complex than a simple direct recall.\n\nIntentional Question Planning: The question aims to assess if the reader can integrate information about multiple entities (Kovacevic and Gyan) presented within the context. It tests attention to detail and the ability to connect related facts.\n</document_analysis>\n<output_format>\nQuestion: Mariana Kovacevic, a Serbian traditional healer specializing in horse placenta treatment for athletes, notably aided Asamoah Gyan during the 2012 African Cup of Nations. Asamoah Gyan, a Ghanaian professional footballer who serves as the captain of the Ghanaian national team, currently plays as a striker for which club?\nA: Manchester United\nB: Kayserispor\nC: Serbia National Team\nD: Equatorial Guinea National Team\nExplanation: The text explicitly states that Asamoah Gyan plays as a striker for Kayserispor.\nCorrect Answer: B\n</output_format>\n```",
    "question": "Mariana Kovacevic, a Serbian traditional healer specializing in horse placenta treatment for athletes, notably aided Asamoah Gyan during the 2012 African Cup of Nations. Asamoah Gyan, a Ghanaian professional footballer who serves as the captain of the Ghanaian national team, currently plays as a striker for which club?",
    "choices": {
      "A": "Manchester United",
      "B": "Kayserispor",
      "C": "Serbia National Team",
      "D": "Equatorial Guinea National Team"
    },
    "answer": "B",
    "explanation": "The text explicitly states that Asamoah Gyan plays as a striker for Kayserispor.",
    "answer_correctness_score": 10,
    "explanation_validity_score": 10,
    "question_clarity_score": 1,
    "question_difficulty_score": 5,
    "question_groundedness_score": 1,
    "question_token_count": 70,
    "reformat_question_cosine_similarity_to_orig": 0.9162333011627197,
    "reformat_answer_cosine_similarity_to_orig": 1.000000238418579,
    "reformat_question_similarity_score": 10,
    "reformat_answer_similarity_score": 10,
    "avg_answer_token_count": 4
  },
  {
    "orig_question": "O'Sheas Casino is a casino located within The Linq, a 2,640-room hotel, casino and shopping promenade on the Las Vegas Strip in Paradise, in which state?",
    "orig_answer": "Nevada",
    "context": "[PAR] [TLE] The Linq [SEP] The Linq (formerly Flamingo Capri, Imperial Palace and The Quad) is a 2,640-room hotel, casino and shopping promenade on the Las Vegas Strip in Paradise, Nevada.  It is owned and operated by Caesars Entertainment Corporation.  As of 2012, the casino is 32890 sqft with 830 slot machines, 55 table games, and a race and sports book. [PAR] [TLE] O'Sheas Casino [SEP] O'Sheas Casino is a casino located within The Linq on the Las Vegas Strip in Paradise, Nevada.  As part of The Linq, it is owned and operated by Caesars Entertainment Corporation and is connected on the exterior to a shopping/dining promenade, also owned by Caesars.  The revitalized O'Sheas has three bars - the main Dublin Up Bar, the Lucky Bar and the exterior-facing Blarney Bar.  The casino includes beer pong tables, a stage, a dance floor and a pit with games including blackjack, roulette, and craps.",
    "response": "```xml\n<document_analysis>\nThoughtful Content Examination: The context provides information about The Linq and O'Sheas Casino, both located in Paradise, Nevada. The question asks for the state in which these establishments are located.\n\nConcept Exploration: This is a straightforward factual recall question. It tests the ability to identify a specific detail within the provided text.\n\nStrategic Complexity Calibration: Difficulty: 2/10. While simple, it's a necessary baseline question to ensure basic comprehension.\n\nIntentional Question Planning: The question directly asks for the state, requiring the test-taker to locate the relevant information within the text.\n</document_analysis>\n<output_format>\nQuestion: The Linq is a 2,640-room hotel, casino, and shopping promenade situated on the Las Vegas Strip in Paradise. Within The Linq is O'Sheas Casino, which features three bars \u2013 Dublin Up Bar, Lucky Bar, and Blarney Bar \u2013 alongside beer pong tables, a stage, a dance floor, and traditional casino games. In what U.S. state are both The Linq and O'Sheas Casino located?\nA: California\nB: Arizona\nC: Nevada\nD: Utah\nExplanation: The text explicitly states that The Linq and O'Sheas Casino are located in Paradise, Nevada.\nCorrect Answer: C\n</output_format>\n```",
    "question": "The Linq is a 2,640-room hotel, casino, and shopping promenade situated on the Las Vegas Strip in Paradise. Within The Linq is O'Sheas Casino, which features three bars \u2013 Dublin Up Bar, Lucky Bar, and Blarney Bar \u2013 alongside beer pong tables, a stage, a dance floor, and traditional casino games. In what U.S. state are both The Linq and O'Sheas Casino located?",
    "choices": {
      "A": "California",
      "B": "Arizona",
      "C": "Nevada",
      "D": "Utah"
    },
    "answer": "C",
    "explanation": "The text explicitly states that The Linq and O'Sheas Casino are located in Paradise, Nevada.",
    "answer_correctness_score": 10,
    "explanation_validity_score": 10,
    "question_clarity_score": 8,
    "question_difficulty_score": 2,
    "question_groundedness_score": 10,
    "question_token_count": 93,
    "reformat_question_cosine_similarity_to_orig": 0.8798528909683228,
    "reformat_answer_cosine_similarity_to_orig": 1.000000238418579,
    "reformat_question_similarity_score": 9,
    "reformat_answer_similarity_score": 10,
    "avg_answer_token_count": 2
  },
  {
    "orig_question": "Zuffa was founded in 2001 by Lorenzo Ferlitta and another American entrepreneur who is the current CEO of what?",
    "orig_answer": "Station Casinos",
    "context": "[PAR] [TLE] Frank Fertitta III [SEP] Frank Joseph Fertitta III (born February 24, 1962) is an American entrepreneur.  He is the current CEO of Station Casinos.  He is also an owner of Zuffa LLC, which is the entity that formerly ran the Ultimate Fighting Championship (UFC). [PAR] [TLE] Zuffa [SEP] Zuffa, LLC ( ) is an American sports promotion company specializing in mixed martial arts.  It was founded in January 2001 in Las Vegas, Nevada, by Station Casinos executives Frank Fertitta III and Lorenzo Fertitta to be the parent entity of the Ultimate Fighting Championship (UFC) after they purchased it from the Semaphore Entertainment Group.  The word \"Zuffa\" is an Italian word (] ), meaning \"fight\".  On July 11, 2016, Zuffa announced that it would be purchased by WME-IMG for the price of $4 billion.",
    "response": "```xml\n<document_analysis>\nThoughtful Content Examination: The context discusses Frank Fertitta III and Zuffa, LLC, highlighting their connection to the UFC and Station Casinos. The question asks about the co-founder of Zuffa and the current position of the other founder.\nConcept Exploration: The text establishes a clear relationship between the Fertitta brothers, Zuffa, and Station Casinos. The question tests recall of this relationship.\nStrategic Complexity Calibration: Difficulty: 4/10. This is a factual recall question but requires connecting two pieces of information.\nIntentional Question Planning: The question tests the test taker\u2019s ability to recall details about the founders of Zuffa and their subsequent roles.\n</document_analysis>\n<output_format>\nQuestion: In January 2001, Lorenzo Fertitta and a fellow entrepreneur established Zuffa, LLC, in Las Vegas, Nevada, to acquire the Ultimate Fighting Championship (UFC). This entrepreneur currently holds a leadership position at which organization?\nA: Endeavor Entertainment\nB: Semaphore Entertainment Group\nC: Station Casinos\nD: WME-IMG\nExplanation: The text explicitly states that Frank Fertitta III, alongside Lorenzo Fertitta, founded Zuffa LLC and that Frank Fertitta III is currently the CEO of Station Casinos.\nCorrect Answer: C\n</output_format>\n```",
    "question": "In January 2001, Lorenzo Fertitta and a fellow entrepreneur established Zuffa, LLC, in Las Vegas, Nevada, to acquire the Ultimate Fighting Championship (UFC). This entrepreneur currently holds a leadership position at which organization?",
    "choices": {
      "A": "Endeavor Entertainment",
      "B": "Semaphore Entertainment Group",
      "C": "Station Casinos",
      "D": "WME-IMG"
    },
    "answer": "C",
    "explanation": "The text explicitly states that Frank Fertitta III, alongside Lorenzo Fertitta, founded Zuffa LLC and that Frank Fertitta III is currently the CEO of Station Casinos.",
    "answer_correctness_score": 10,
    "explanation_validity_score": 10,
    "question_clarity_score": 4,
    "question_difficulty_score": 6,
    "question_groundedness_score": 10,
    "question_token_count": 48,
    "reformat_question_cosine_similarity_to_orig": 0.7245783805847168,
    "reformat_answer_cosine_similarity_to_orig": 1.0,
    "reformat_question_similarity_score": 9,
    "reformat_answer_similarity_score": 9,
    "avg_answer_token_count": 4
  },
  {
    "orig_question": "Who was the manager for the midfielder and second most capped player in the history of the Bosnia and Herzegovina national team, who won a Bundesliga title with an attacking lineup, which included strikers Edin D\u017eeko and Grafite?",
    "orig_answer": "Felix Magath",
    "context": "[PAR] [TLE] 2008\u201309 VfL Wolfsburg season [SEP] VfL Wolfsburg won their first ever Bundesliga title during this season.  Manager Felix Magath formed an attacking lineup, which included strikers Edin D\u017eeko and Grafite, the pair scoring 54 goals between them, much due to the help of attacking midfielder Zvjezdan Misimovi\u0107's 20 assists. [PAR] [TLE] Zvjezdan Misimovi\u0107 [SEP] Zvjezdan Misimovi\u0107 (, ] ; born 5 June 1982) is a Bosnian former footballer who most notably played for Bayern Munich, VfL Wolfsburg, Galatasaray, Dynamo Moscow and Beijing Renhe as an attacking midfielder, during his active playing career.  Misimovi\u0107 is the second most capped player in the history of the Bosnia and Herzegovina national team, capped 84 times.  His 25 international goals also makes him his country's third top-goalscorer.  He represented Bosnia and Herzegovina at 2014 FIFA World Cup.",
    "response": "```xml\n<document_analysis>\nThoughtful Content Examination: The context provides information about Zvjezdan Misimovi\u0107, a Bosnian footballer, and the 2008-09 VfL Wolfsburg season, where the team won the Bundesliga title. It highlights Misimovi\u0107's role as an attacking midfielder and his contribution to the team's success, alongside strikers Edin D\u017eeko and Grafite, under the management of Felix Magath.\n\nConcept Exploration: The text touches upon team dynamics, player roles, and the importance of key players in achieving team success. It also provides biographical information about Misimovi\u0107, including his international career.\n\nStrategic Complexity Calibration: Difficulty: 7. The question requires integrating information from multiple sentences and understanding the relationships between players and the manager.\n\nIntentional Question Planning: The question is designed to test the understanding of the context by requiring the recall of the manager's name based on a description of the team and its achievements.\n</document_analysis>\n<output_format>\nQuestion: During the 2008\u201309 season, VfL Wolfsburg secured their inaugural Bundesliga title, largely attributed to an offensive formation featuring strikers Edin D\u017eeko and Grafite, supported by the playmaking of Zvjezdan Misimovi\u0107, who delivered 20 assists. Misimovi\u0107, a Bosnian footballer and the second most capped player in the history of the Bosnia and Herzegovina national team, played as an attacking midfielder. Who served as the manager during this championship-winning season for VfL Wolfsburg?\nA: J\u00fcrgen Klopp\nB: Thomas Tuchel\nC: Felix Magath\nD: Ottmar Hitzfeld\nExplanation: The text explicitly states that Felix Magath was the manager of VfL Wolfsburg during the 2008\u201309 season, when the team won their first Bundesliga title with an attacking lineup including D\u017eeko, Grafite, and Misimovi\u0107.\nCorrect Answer: C\n</output_format>\n```",
    "question": "During the 2008\u201309 season, VfL Wolfsburg secured their inaugural Bundesliga title, largely attributed to an offensive formation featuring strikers Edin D\u017eeko and Grafite, supported by the playmaking of Zvjezdan Misimovi\u0107, who delivered 20 assists. Misimovi\u0107, a Bosnian footballer and the second most capped player in the history of the Bosnia and Herzegovina national team, played as an attacking midfielder. Who served as the manager during this championship-winning season for VfL Wolfsburg?",
    "choices": {
      "A": "J\u00fcrgen Klopp",
      "B": "Thomas Tuchel",
      "C": "Felix Magath",
      "D": "Ottmar Hitzfeld"
    },
    "answer": "C",
    "explanation": "The text explicitly states that Felix Magath was the manager of VfL Wolfsburg during the 2008\u201309 season, when the team won their first Bundesliga title with an attacking lineup including D\u017eeko, Grafite, and Misimovi\u0107.",
    "answer_correctness_score": 10,
    "explanation_validity_score": 10,
    "question_clarity_score": 9,
    "question_difficulty_score": 5,
    "question_groundedness_score": 10,
    "question_token_count": 103,
    "reformat_question_cosine_similarity_to_orig": 0.6935696601867676,
    "reformat_answer_cosine_similarity_to_orig": 1.0,
    "reformat_question_similarity_score": 9,
    "reformat_answer_similarity_score": 10,
    "avg_answer_token_count": 4
  },
  {
    "orig_question": "The song \"Yodel It\" is similar to which 2014 Taylor Swift song?",
    "orig_answer": "Shake It Off",
    "context": "[PAR] [TLE] Yodel It! [SEP] \"Yodel It!\"  is a song recorded by Romanian singers Ilinca and Alex Florea, released on 30 January 2017 by Cat Music.  The track was written by Alexandra Niculae and produced by Mihai Alexandru for the Swiss band Timebelle who rejected it.  It was then given to Ilinca to record.  Florea was chosen as a featured artist as both Alexandru and Ilinca felt her version was incomplete.  \"Yodel It!\"  is a mixture of rock, pop and hip hop music, including Ilinca yodeling during the chorus and Florea's rap vocals.  The track's optimistic lyrical message was compared to that of Taylor Swift's \"Shake It Off\" (2014). [PAR] [TLE] Shake It Off [SEP] \"Shake It Off\" is a song recorded by American singer-songwriter Taylor Swift from her fifth album, \"1989\" (2014).  Written by Swift, Max Martin and Shellback, it is an uptempo dance-pop track considered to be a departure from Swift's earlier country pop music style.  \"Shake It Off\" is the sixth track on the album and serves as the lead single.  The song premiered during a Yahoo! live stream session on August 18, 2014 (also streaming internationally online); its music video was also released the same day.  Several hours later, the song was made available for digital download.",
    "response": "```xml\n<document_analysis>\nThoughtful Content Examination: The context provides information about two songs: \"Yodel It!\" by Ilinca and Alex Florea, and \"Shake It Off\" by Taylor Swift. The key connection is that the lyrical message of \"Yodel It!\" was compared to that of \"Shake It Off\".\n\nConcept Exploration: This question tests recall of a comparative statement made within the text. It requires understanding the content of both song descriptions to identify the similarity.\n\nStrategic Complexity Calibration: Difficulty: 4/10. The information is explicitly stated, but requires attention to detail.\n\nIntentional Question Planning: The question focuses on the comparative aspect of the songs, ensuring the answer isn't simply a recall of facts about each song individually.\n</document_analysis>\n<output_format>\nQuestion: \"Yodel It!\", recorded by Ilinca and Alex Florea and released in 2017, shares a characteristic with a song released three years prior. The optimistic lyrical message of \"Yodel It!\" was noted to be comparable to which Taylor Swift song from 2014, a track described as an uptempo dance-pop song and a departure from Swift\u2019s earlier country pop style?\nA: \"Blank Space\"\nB: \"Bad Blood\"\nC: \"Shake It Off\"\nD: \"Style\"\nExplanation: The text explicitly states that the track\u2019s optimistic lyrical message was compared to that of Taylor Swift's \"Shake It Off\" (2014).\nCorrect Answer: C\n</output_format>\n```",
    "question": "\"Yodel It!\", recorded by Ilinca and Alex Florea and released in 2017, shares a characteristic with a song released three years prior. The optimistic lyrical message of \"Yodel It!\" was noted to be comparable to which Taylor Swift song from 2014, a track described as an uptempo dance-pop song and a departure from Swift\u2019s earlier country pop style?",
    "choices": {
      "A": "\"Blank Space\"",
      "B": "\"Bad Blood\"",
      "C": "\"Shake It Off\"",
      "D": "\"Style\""
    },
    "answer": "C",
    "explanation": "The text explicitly states that the track\u2019s optimistic lyrical message was compared to that of Taylor Swift's \"Shake It Off\" (2014).",
    "answer_correctness_score": 10,
    "explanation_validity_score": 10,
    "question_clarity_score": 6,
    "question_difficulty_score": 7,
    "question_groundedness_score": 10,
    "question_token_count": 80,
    "reformat_question_cosine_similarity_to_orig": 0.8491654992103577,
    "reformat_answer_cosine_similarity_to_orig": 0.8393587470054626,
    "reformat_question_similarity_score": 9,
    "reformat_answer_similarity_score": 10,
    "avg_answer_token_count": 5
  },
  {
    "orig_question": "What is the name of the rivalry game that is played in the same stadium as the State Fair Classic, thats name is derived from the river that forms part of the boundary between Texas and Oklahoma?",
    "orig_answer": "Red River Showdown",
    "context": "[PAR] [TLE] State Fair Classic [SEP] The State Fair Classic (known as the Southwest Airlines State Fair Classic for sponsorship purposes) is an annual college football game between the Grambling State University Tigers and the Prairie View A&M University Panthers of the Southwestern Athletic Conference.  The game is played on a neutral site at the Cotton Bowl in Fair Park, Dallas, Texas during the State Fair of Texas.  The game often occurs the weekend before the Oklahoma\u2013Texas Red River Showdown game; the new Texas State Fair Football Showdown is also scheduled to take place on the third weekends of the 2018 and 2019 fairs and will feature Southern and Texas Southern. [PAR] [TLE] Red River Showdown [SEP] The Red River Showdown, commonly called the Red River Rivalry, the Red River Classic, or the Red River Shootout, is an American college football rivalry game played annually at the Cotton Bowl stadium in Dallas, Texas, during the second weekend of the State Fair of Texas in October.  The participants are the Oklahoma Sooners football team of the University of Oklahoma and the Texas Longhorns football team of the University of Texas at Austin.  The game is played the week following the State Fair Classic featuring Prairie View A&M University and Grambling State University.  The series is one of the major rivalries in NCAA football and in all of American sports.  The name is derived from the Red River that forms part of the boundary between Texas and Oklahoma that has in the past caused conflict between the two states, most notably the 1931 Red River Bridge War.",
    "response": "```xml\n<document_analysis>\nThe provided context describes two college football games played at the Cotton Bowl in Dallas, Texas during the State Fair of Texas: the State Fair Classic (Grambling State vs. Prairie View A&M) and the Red River Showdown (Oklahoma vs. Texas). The question asks for the name of the rivalry game played in the same stadium as the State Fair Classic and whose name originates from the river bordering Texas and Oklahoma. The answer, \"Red River Showdown,\" is directly stated in the text. The difficulty is rated a 6, as it requires understanding the relationship between the two events and recalling specific details. The question will be rephrased to be more detailed and avoid direct language from the context.\n</document_analysis>\n<output_format>\nQuestion: The annual State Fair Classic, featuring Grambling State University and Prairie View A&M University, is held at the Cotton Bowl in Dallas, Texas. Another significant college football game is also played at this same venue, and its title reflects a geographical feature defining the border between the states of Texas and Oklahoma. What is the name of this rivalry game?\nA: The Southwest Airlines State Fair Classic\nB: The Red River Showdown\nC: The Texas State Fair Football Showdown\nD: The Oklahoma\u2013Texas Red River Classic\nExplanation: The text explicitly states that the Red River Showdown is played at the Cotton Bowl and that its name is derived from the Red River, which forms part of the boundary between Texas and Oklahoma.\nCorrect Answer: B\n</output_format>\n```",
    "question": "The annual State Fair Classic, featuring Grambling State University and Prairie View A&M University, is held at the Cotton Bowl in Dallas, Texas. Another significant college football game is also played at this same venue, and its title reflects a geographical feature defining the border between the states of Texas and Oklahoma. What is the name of this rivalry game?",
    "choices": {
      "A": "The Southwest Airlines State Fair Classic",
      "B": "The Red River Showdown",
      "C": "The Texas State Fair Football Showdown",
      "D": "The Oklahoma\u2013Texas Red River Classic"
    },
    "answer": "B",
    "explanation": "The text explicitly states that the Red River Showdown is played at the Cotton Bowl and that its name is derived from the Red River, which forms part of the boundary between Texas and Oklahoma.",
    "answer_correctness_score": 10,
    "explanation_validity_score": 10,
    "question_clarity_score": 6,
    "question_difficulty_score": 7,
    "question_groundedness_score": 10,
    "question_token_count": 70,
    "reformat_question_cosine_similarity_to_orig": 0.8084098100662231,
    "reformat_answer_cosine_similarity_to_orig": 0.9792248010635376,
    "reformat_question_similarity_score": 9,
    "reformat_answer_similarity_score": 10,
    "avg_answer_token_count": 7
  },
  {
    "orig_question": "On what mission did the astrounaut after whom the Onizuka Prop Wash Award is named after successfully fly into space?",
    "orig_answer": "STS-51-C",
    "context": "[PAR] [TLE] Ellison Onizuka [SEP] Ellison Shoji Onizuka (June 24, 1946 \u2013 January 28, 1986 ) was an American astronaut from Kealakekua, Hawaii, who successfully flew into space with the Space Shuttle \"Discovery\" on STS-51-C.  He died in the destruction of the Space Shuttle \"Challenger\", on which he was serving as Mission Specialist for mission STS-51-L.  He was the first Asian American and the first person of Japanese ancestry to reach space. [PAR] [TLE] Onizuka Prop Wash Award [SEP] The Onizuka Prop Wash Award recognizes the student at the United States Air Force Test Pilot School (USAF TPS) who contributed most to class spirit and morale.  The honoree from each class is selected by his or her fellow students rather than by school faculty.  The award is named in memory of TPS graduate Ellison Onizuka who perished in the explosion of the Space Shuttle \"Challenger\" in 1986.",
    "response": "```xml\n<document_analysis>\nThoughtful Content Examination: The context provides information about Ellison Onizuka, an astronaut who flew on STS-51-C and tragically died on the Challenger mission (STS-51-L). It also details the Onizuka Prop Wash Award, named in his memory. The question asks about the mission Onizuka successfully flew before his death.\n\nConcept Exploration: The key connection is identifying the successful mission before the Challenger disaster. This requires recalling the specific mission name (STS-51-C) from the text.\n\nStrategic Complexity Calibration: Difficulty: 4/10. This is a factual recall question, but requires reading comprehension to identify the correct mission. It's not overly complex but tests understanding of the provided text.\n\nIntentional Question Planning: The question directly asks for the mission name. The answer is explicitly stated in the text. The goal is to assess if the reader can accurately extract specific information.\n</document_analysis>\n<output_format>\nQuestion: Ellison Onizuka, a graduate of the United States Air Force Test Pilot School and the first Asian American in space, was posthumously honored with an award recognizing contributions to morale and spirit within his class. Prior to his tragic death aboard the Space Shuttle Challenger during mission STS-51-L, Onizuka achieved a significant milestone in space exploration. On which Space Shuttle mission did Ellison Onizuka successfully travel into space?\nA: STS-51-L\nB: STS-35\nC: STS-51-C\nD: STS-61-A\nExplanation: The text explicitly states that Ellison Onizuka successfully flew into space with the Space Shuttle \"Discovery\" on STS-51-C.\nCorrect Answer: C\n</output_format>\n```",
    "question": "Ellison Onizuka, a graduate of the United States Air Force Test Pilot School and the first Asian American in space, was posthumously honored with an award recognizing contributions to morale and spirit within his class. Prior to his tragic death aboard the Space Shuttle Challenger during mission STS-51-L, Onizuka achieved a significant milestone in space exploration. On which Space Shuttle mission did Ellison Onizuka successfully travel into space?",
    "choices": {
      "A": "STS-51-L",
      "B": "STS-35",
      "C": "STS-51-C",
      "D": "STS-61-A"
    },
    "answer": "C",
    "explanation": "The text explicitly states that Ellison Onizuka successfully flew into space with the Space Shuttle \"Discovery\" on STS-51-C.",
    "answer_correctness_score": 10,
    "explanation_validity_score": 10,
    "question_clarity_score": 8,
    "question_difficulty_score": 5,
    "question_groundedness_score": 10,
    "question_token_count": 88,
    "reformat_question_cosine_similarity_to_orig": 0.5107507109642029,
    "reformat_answer_cosine_similarity_to_orig": 1.0,
    "reformat_question_similarity_score": 9,
    "reformat_answer_similarity_score": 10,
    "avg_answer_token_count": 4
  },
  {
    "orig_question": "The twelfth studio album from singer Tim McGraw features a guest appearance on guitar by which other famous musician?",
    "orig_answer": "Keith Urban",
    "context": "[PAR] [TLE] Highway Don't Care [SEP] \"Highway Don't Care\" is a song performed by American country music artist Tim McGraw and features American singer-songwriter Taylor Swift on vocals, as well as Keith Urban on guitar.  It was released in March 2013 as the third single from McGraw's first album for Big Machine Records, \"Two Lanes of Freedom\" (2013).  The song was written by Mark Irwin, Josh Kear and Brad and Brett Warren.  McGraw and Swift recorded their parts separately. [PAR] [TLE] Two Lanes of Freedom [SEP] Two Lanes of Freedom is the twelfth studio album by American country music artist Tim McGraw.  It was released February 5, 2013, as his first album for Big Machine Records following a 20-year tenure with Curb Records.  He co-produced the album with Byron Gallimore, producer of his previously released albums.  The album includes the singles \"Truck Yeah\", \"One of Those Nights\", \"Highway Don't Care\" featuring new labelmate Taylor Swift, and \"Southern Girl\".",
    "response": "```xml\n<document_analysis>\nThoughtful Content Examination: The context provides information about Tim McGraw's album \"Two Lanes of Freedom\" and the single \"Highway Don't Care\". It specifies that Keith Urban contributed guitar work to the song \"Highway Don't Care.\" The question directly asks about a guitarist featured on one of Tim McGraw\u2019s albums. \n\nConcept Exploration: The question tests recall of specific details regarding collaborations on Tim McGraw\u2019s albums. It requires knowledge of both the album title and the featured artist.\n\nStrategic Complexity Calibration: Difficulty: 4/10. This is a relatively straightforward factual recall question, but requires knowing the details of the song and album.\n\nIntentional Question Planning: The question is designed to test a domain expert's knowledge of Tim McGraw's collaborations and album details. It focuses on a specific aspect of the album's production.\n</document_analysis>\n<output_format>\nQuestion: Tim McGraw\u2019s twelfth studio album, \u201cTwo Lanes of Freedom,\u201d released in 2013, marked a significant change in his recording career as his first album with Big Machine Records after two decades with Curb Records. This album included the hit single \u201cHighway Don\u2019t Care,\u201d a collaboration featuring Taylor Swift on vocals. Beyond Swift\u2019s vocal contribution, which prominent country music artist provided guitar work on this particular track?\nA: Brad Paisley\nB: Keith Urban\nC: Blake Shelton\nD: Kenny Chesney\nExplanation: The provided text explicitly states that Keith Urban played guitar on \u201cHighway Don\u2019t Care\u201d featuring Tim McGraw and Taylor Swift.\nCorrect Answer: B\n</output_format>\n```",
    "question": "Tim McGraw\u2019s twelfth studio album, \u201cTwo Lanes of Freedom,\u201d released in 2013, marked a significant change in his recording career as his first album with Big Machine Records after two decades with Curb Records. This album included the hit single \u201cHighway Don\u2019t Care,\u201d a collaboration featuring Taylor Swift on vocals. Beyond Swift\u2019s vocal contribution, which prominent country music artist provided guitar work on this particular track?",
    "choices": {
      "A": "Brad Paisley",
      "B": "Keith Urban",
      "C": "Blake Shelton",
      "D": "Kenny Chesney"
    },
    "answer": "B",
    "explanation": "The provided text explicitly states that Keith Urban played guitar on \u201cHighway Don\u2019t Care\u201d featuring Tim McGraw and Taylor Swift.",
    "answer_correctness_score": 10,
    "explanation_validity_score": 10,
    "question_clarity_score": 8,
    "question_difficulty_score": 6,
    "question_groundedness_score": 10,
    "question_token_count": 87,
    "reformat_question_cosine_similarity_to_orig": 0.5710818767547607,
    "reformat_answer_cosine_similarity_to_orig": 0.9999999403953552,
    "reformat_question_similarity_score": 9,
    "reformat_answer_similarity_score": 10,
    "avg_answer_token_count": 4
  },
  {
    "orig_question": "During what Olympic Games did coach Paul Ziert's men's gymnastic team win two gold medals?",
    "orig_answer": "1984 Summer Olympic Games",
    "context": "[PAR] [TLE] Bart Conner [SEP] Bart Conner (born March 28, 1958) is a retired American Olympic gymnast.  As a member of the men's gymnastics team at the 1984 Summer Olympic Games, Conner won two gold medals.  He currently owns and operates the Bart Conner Gymnastics Academy in Norman, Oklahoma, along with his wife, Romanian Olympic gold medalist Nadia Com\u0103neci.  In addition, both Com\u0103neci and Conner are highly involved with the Special Olympics. [PAR] [TLE] Paul Ziert [SEP] Paul Ziert is a former University of Oklahoma gymnastics coach.  Ziert recruited Bart Conner to the school.  In 1977 and 1978, Ziert's teams won the NCAA Men's Gymnastics championship.",
    "response": "```xml\n<document_analysis>\nThoughtful Content Examination: The provided context details Bart Conner's achievements as an Olympic gymnast and his post-athletic career, along with information about his coach, Paul Ziert. The original question incorrectly attributes the gold medals to Paul Ziert's team instead of Bart Conner himself. \n\nConcept Exploration: The core concepts involve Olympic gymnastics, coaching, and the relationship between athletes and their coaches. The context highlights the success of both Conner and Ziert, but in different capacities.\n\nStrategic Complexity Calibration: Difficulty: 6/10. The question requires understanding who won the medals (Conner, not the team) and recalling the year of the Olympics. The original question is flawed and easy, so a more nuanced question is needed.\n\nIntentional Question Planning: The revised question will focus on Bart Conner's Olympic achievements and test the ability to recall specific details about his gold medals.\n</document_analysis>\n<output_format>\nQuestion: Bart Conner, a renowned American Olympic gymnast, achieved significant success at the Summer Olympic Games. Considering his athletic career, in which Olympic Games did Bart Conner win two gold medals as a member of the men\u2019s gymnastics team, and what is his current professional role alongside his wife, Nadia Com\u0103neci?\nA: 1976 Summer Olympic Games, co-owning a sports management firm.\nB: 1980 Summer Olympic Games, serving as a commentator for gymnastics events.\nC: 1984 Summer Olympic Games, owning and operating the Bart Conner Gymnastics Academy.\nD: 1988 Summer Olympic Games, working as a fitness trainer for elite athletes.\nExplanation: The text states, \u201cAs a member of the men's gymnastics team at the 1984 Summer Olympic Games, Conner won two gold medals.\u201d Additionally, the text indicates that Conner \u201ccurrently owns and operates the Bart Conner Gymnastics Academy in Norman, Oklahoma, along with his wife, Romanian Olympic gold medalist Nadia Com\u0103neci.\u201d\nCorrect Answer: C\n</output_format>\n```",
    "question": "Bart Conner, a renowned American Olympic gymnast, achieved significant success at the Summer Olympic Games. Considering his athletic career, in which Olympic Games did Bart Conner win two gold medals as a member of the men\u2019s gymnastics team, and what is his current professional role alongside his wife, Nadia Com\u0103neci?",
    "choices": {
      "A": "1976 Summer Olympic Games, co-owning a sports management firm.",
      "B": "1980 Summer Olympic Games, serving as a commentator for gymnastics events.",
      "C": "1984 Summer Olympic Games, owning and operating the Bart Conner Gymnastics Academy.",
      "D": "1988 Summer Olympic Games, working as a fitness trainer for elite athletes."
    },
    "answer": "C",
    "explanation": "The text states, \u201cAs a member of the men's gymnastics team at the 1984 Summer Olympic Games, Conner won two gold medals.\u201d Additionally, the text indicates that Conner \u201ccurrently owns and operates the Bart Conner Gymnastics Academy in Norman, Oklahoma, along with his wife, Romanian Olympic gold medalist Nadia Com\u0103neci.\u201d",
    "answer_correctness_score": 10,
    "explanation_validity_score": 10,
    "question_clarity_score": 6,
    "question_difficulty_score": 5,
    "question_groundedness_score": 10,
    "question_token_count": 65,
    "reformat_question_cosine_similarity_to_orig": 0.5851934552192688,
    "reformat_answer_cosine_similarity_to_orig": 0.7330907583236694,
    "reformat_question_similarity_score": 2,
    "reformat_answer_similarity_score": 7,
    "avg_answer_token_count": 17
  },
  {
    "orig_question": "In regards to the album released on October 22, 2012, where did the Tour that was launched in support of it end?",
    "orig_answer": "Singapore",
    "context": "[PAR] [TLE] The Red Tour [SEP] The Red Tour was the third concert tour by American singer-songwriter Taylor Swift.  Launched in support of Swift's fourth studio album, \"Red\" (2012), the tour began on March 13, 2013 in Omaha, Nebraska and concluded on June 12, 2014 in Singapore. [PAR] [TLE] Red (Taylor Swift album) [SEP] Red is the fourth studio album by American singer-songwriter Taylor Swift.  It was released on October 22, 2012, by Big Machine Records, as the follow-up to her third studio album, \"Speak Now\".  The album title was inspired by the \"semi-toxic relationships\" that Swift experienced during the process of conceiving this album, which Swift described the emotions she felt as \"red emotions\" due to their intense and tumultuous nature.  \"Red\" touches on Swift's signature themes of love and heartbreak, however, from a more mature perspective while exploring other themes such as fame and the pressure of being in the limelight.  The album features collaborations with producers and guest artists such as Gary Lightbody of Snow Patrol and Ed Sheeran and is noted for Swift's experimentation with new musical genres.  Swift completed The Red Tour in support of the album on June 12, 2014, which became the highest-grossing tour of all time by a country artist, grossing over $150 million.",
    "response": "```xml\n<document_analysis>\nThoughtful Content Examination: The context provides information about Taylor Swift's \"Red\" album and the subsequent \"Red Tour\". The question asks about the ending location of the tour supporting the album released on October 22, 2012.\n\nConcept Exploration: The information is factual and straightforward, relating an album release to a concert tour. The key connection is that the tour was *in support of* the album.\n\nStrategic Complexity Calibration: Difficulty: 3/10. While factual recall, the question requires connecting two pieces of information (album release and tour end date/location). It's a relatively simple connection. I will increase the difficulty by making the question more detailed and adding plausible distractors.\n\nIntentional Question Planning: I will rephrase the question to include more details from the text, making it less directly answerable by simply locating a single sentence. This will test for a more thorough understanding of the relationship between the album and the tour.\n</document_analysis>\n<output_format>\nQuestion: Taylor Swift's fourth studio album, \"Red\", released on October 22, 2012, explored themes of intense and tumultuous relationships which she described as \"red emotions.\" Following the album's release, Swift embarked on The Red Tour. Considering the album's themes and the tour's purpose, in what city and country did The Red Tour conclude, marking the end of its run in support of the \"Red\" album?\nA: Omaha, Nebraska\nB: Nashville, Tennessee\nC: Singapore\nD: London, England\nExplanation: The text states that The Red Tour concluded on June 12, 2014 in Singapore. The tour was launched in support of the album \u201cRed\u201d (2012).\nCorrect Answer: C\n</output_format>\n```",
    "question": "Taylor Swift's fourth studio album, \"Red\", released on October 22, 2012, explored themes of intense and tumultuous relationships which she described as \"red emotions.\" Following the album's release, Swift embarked on The Red Tour. Considering the album's themes and the tour's purpose, in what city and country did The Red Tour conclude, marking the end of its run in support of the \"Red\" album?",
    "choices": {
      "A": "Omaha, Nebraska",
      "B": "Nashville, Tennessee",
      "C": "Singapore",
      "D": "London, England"
    },
    "answer": "C",
    "explanation": "The text states that The Red Tour concluded on June 12, 2014 in Singapore. The tour was launched in support of the album \u201cRed\u201d (2012).",
    "answer_correctness_score": 10,
    "explanation_validity_score": 10,
    "question_clarity_score": 6,
    "question_difficulty_score": 4,
    "question_groundedness_score": 10,
    "question_token_count": 88,
    "reformat_question_cosine_similarity_to_orig": 0.4984509348869324,
    "reformat_answer_cosine_similarity_to_orig": 0.9999998807907104,
    "reformat_question_similarity_score": 9,
    "reformat_answer_similarity_score": 10,
    "avg_answer_token_count": 4
  },
  {
    "orig_question": "In what year was the man who named the First Battle of Kharkov born?",
    "orig_answer": "1882",
    "context": "[PAR] [TLE] Wilhelm Keitel [SEP] Wilhelm Keitel (22 September 1882 \u2013 16 October 1946) was a German field marshal who served as Chief of the Armed Forces High Command (\"Oberkommando der Wehrmacht\" or OKW) in Nazi Germany during World War II.  According to David Stahel, Keitel was \"well known and [...] reviled as Hitler's dependable mouthpiece and habitual yes-man\" among his military colleagues. [PAR] [TLE] First Battle of Kharkov [SEP] The 1st Battle of Kharkov, so named by Wilhelm Keitel, was the 1941 tactical battle for the city of Kharkov (now \"Kharkiv\") (Ukrainian SSR) during the final phase of Operation \"Barbarossa\" between the German 6th Army of Army Group South and the Soviet Southwestern Front.  The Soviet 38th Army was ordered to defend the city while its factories were dismantled for relocation farther east.",
    "response": "```xml\n<document_analysis>\n<thought_process>The context provides information about Wilhelm Keitel and the First Battle of Kharkov, establishing that Keitel named the battle. The question asks for the year of Keitel's birth. This is a straightforward factual recall question, but can be made more challenging by framing it to test understanding of the relationship between Keitel and the battle's naming. The difficulty level is currently low (around 3/10), so I will rephrase to increase complexity and ensure it tests understanding of the context rather than just recall.</thought_process>\n</document_analysis>\n<output_format>\nQuestion: Wilhelm Keitel, recognized for his role as Chief of the Armed Forces High Command in Nazi Germany and notably for designating a significant 1941 military engagement, is associated with which year of birth?\nA: 1918\nB: 1882\nC: 1939\nD: 1905\nExplanation: The text explicitly states that Wilhelm Keitel was born on September 22, 1882. He also named the First Battle of Kharkov in 1941.\nCorrect Answer: B\n</output_format>\n```",
    "question": "Wilhelm Keitel, recognized for his role as Chief of the Armed Forces High Command in Nazi Germany and notably for designating a significant 1941 military engagement, is associated with which year of birth?",
    "choices": {
      "A": "1918",
      "B": "1882",
      "C": "1939",
      "D": "1905"
    },
    "answer": "B",
    "explanation": "The text explicitly states that Wilhelm Keitel was born on September 22, 1882. He also named the First Battle of Kharkov in 1941.",
    "answer_correctness_score": 10,
    "explanation_validity_score": 10,
    "question_clarity_score": 2,
    "question_difficulty_score": 2,
    "question_groundedness_score": 10,
    "question_token_count": 42,
    "reformat_question_cosine_similarity_to_orig": 0.3617391586303711,
    "reformat_answer_cosine_similarity_to_orig": 1.0000001192092896,
    "reformat_question_similarity_score": 9,
    "reformat_answer_similarity_score": 10,
    "avg_answer_token_count": 3
  },
  {
    "orig_question": "Ahmad Khormali, who plays goalkeeper, wears pyjama-like tracksuit bottoms to honor another goalkeeper who plays for what team?",
    "orig_answer": "Szombathelyi Halad\u00e1s",
    "context": "[PAR] [TLE] G\u00e1bor Kir\u00e1ly [SEP] G\u00e1bor Ferenc Kir\u00e1ly (] ; born 1 April 1976) is a Hungarian professional footballer who plays for Szombathelyi Halad\u00e1s as a goalkeeper. [PAR] [TLE] Ahmad Khormali [SEP] Ahmad Khormali (Persian: \u0627\u062d\u0645\u062f \u062e\u0631\u0645\u0627\u0644\u06cc\u200e \u200e ) is an Iranian football goalkeeper.  He wears pyjama-like tracksuit bottoms while playing after Hungarian goalkeeper G\u00e1bor Kir\u00e1ly.  He holds a B.Sc.  in Social Sciences from Ferdowsi University of Mashhad.",
    "response": "```xml\n<document_analysis>\n<thought_process>The context provides a direct link between Ahmad Khormali's attire and G\u00e1bor Kir\u00e1ly, specifying that Khormali emulates Kir\u00e1ly's style. It also states Kir\u00e1ly currently plays for Szombathelyi Halad\u00e1s. The question tests the ability to connect these two pieces of information. The original question is straightforward, so I will increase the complexity by making the answer options more similar and requiring a precise recall of the team name. I will also rephrase the question to be more descriptive and less direct.</thought_process>\n<difficulty>4</difficulty>\n<question_type>Factual</question_type>\n</document_analysis>\n<output_format>\nQuestion: Iranian football goalkeeper Ahmad Khormali has gained attention for his unusual on-field attire, specifically wearing pyjama-like tracksuit bottoms during matches. This stylistic choice is a tribute to a Hungarian goalkeeper whose influence extends beyond the pitch.  Which of the following clubs is currently home to the Hungarian goalkeeper who inspired this unique fashion statement?\nA: Ferencv\u00e1ros\nB: Szombathelyi Halad\u00e1s\nC: Videoton\nD: Debrecen\nExplanation: The text explicitly states that Ahmad Khormali wears pyjama-like tracksuit bottoms after Hungarian goalkeeper G\u00e1bor Kir\u00e1ly, and that G\u00e1bor Kir\u00e1ly plays for Szombathelyi Halad\u00e1s.\nCorrect Answer: B\n</output_format>\n```",
    "question": "Iranian football goalkeeper Ahmad Khormali has gained attention for his unusual on-field attire, specifically wearing pyjama-like tracksuit bottoms during matches. This stylistic choice is a tribute to a Hungarian goalkeeper whose influence extends beyond the pitch.  Which of the following clubs is currently home to the Hungarian goalkeeper who inspired this unique fashion statement?",
    "choices": {
      "A": "Ferencv\u00e1ros",
      "B": "Szombathelyi Halad\u00e1s",
      "C": "Videoton",
      "D": "Debrecen"
    },
    "answer": "B",
    "explanation": "The text explicitly states that Ahmad Khormali wears pyjama-like tracksuit bottoms after Hungarian goalkeeper G\u00e1bor Kir\u00e1ly, and that G\u00e1bor Kir\u00e1ly plays for Szombathelyi Halad\u00e1s.",
    "answer_correctness_score": 10,
    "explanation_validity_score": 10,
    "question_clarity_score": 6,
    "question_difficulty_score": 7,
    "question_groundedness_score": 8,
    "question_token_count": 73,
    "reformat_question_cosine_similarity_to_orig": 0.8496161103248596,
    "reformat_answer_cosine_similarity_to_orig": 1.0,
    "reformat_question_similarity_score": 9,
    "reformat_answer_similarity_score": 10,
    "avg_answer_token_count": 4
  },
  {
    "orig_question": "What U.S. senator held office from 2001 to 2009 and won by a two-to-one margin in their reelection?",
    "orig_answer": "Hillary Rodham Clinton",
    "context": "[PAR] [TLE] United States Senate career of Hillary Clinton [SEP] Hillary Rodham Clinton served as a United States Senator from New York from January 3, 2001 to January 21, 2009.  She won the United States Senate election in New York, 2000 and the United States Senate election in New York, 2006.  Clinton resigned from the Senate on January 21, 2009 to become United States Secretary of State for the Obama Administration. [PAR] [TLE] United States Senate election in New York, 2006 [SEP] The 2006 United States Senate election in New York was held November 7, 2006.  Incumbent Democratic U.S. Senator Hillary Rodham Clinton won, by a more than two-to-one margin, a second term representing New York in the United States Senate.  Clinton was challenged by Republican John Spencer, a former Mayor of Yonkers, New York.  Spencer won his party nomination by defeating former national security staffer K. T. McFarland in a primary.",
    "response": "```xml\n<document_analysis>\nThoughtful Content Examination: The context provides information about Hillary Clinton's tenure as a U.S. Senator from New York, including her election years and eventual resignation to become Secretary of State. It also details her 2006 reelection, mentioning her opponent and the margin of her victory.\n\nConcept Exploration: The core concept revolves around understanding the timeline of Clinton's Senate career and recognizing key details of her 2006 reelection. The information is factual and requires recall of specific details.\n\nStrategic Complexity Calibration: Difficulty is rated a 5/10. While the information is directly stated, it requires connecting details from different parts of the context.\n\nIntentional Question Planning: The question aims to test the recall of specific details regarding Clinton's Senate career and reelection, specifically focusing on the timeframe and margin of victory.\n</document_analysis>\n<output_format>\nQuestion: Between January 3, 2001, and January 21, 2009, which U.S. Senator representing New York secured a second term in office on November 7, 2006, achieving a victory margin exceeding a two-to-one ratio against former Yonkers Mayor John Spencer?\nA: Chuck Schumer\nB: Kirsten Gillibrand\nC: Hillary Rodham Clinton\nD: Al D'Amato\nExplanation: The text explicitly states that Hillary Rodham Clinton served as a U.S. Senator from New York from January 3, 2001, to January 21, 2009, and won reelection in 2006 by a more than two-to-one margin against John Spencer.\nCorrect Answer: C\n</output_format>\n```",
    "question": "Between January 3, 2001, and January 21, 2009, which U.S. Senator representing New York secured a second term in office on November 7, 2006, achieving a victory margin exceeding a two-to-one ratio against former Yonkers Mayor John Spencer?",
    "choices": {
      "A": "Chuck Schumer",
      "B": "Kirsten Gillibrand",
      "C": "Hillary Rodham Clinton",
      "D": "Al D'Amato"
    },
    "answer": "C",
    "explanation": "The text explicitly states that Hillary Rodham Clinton served as a U.S. Senator from New York from January 3, 2001, to January 21, 2009, and won reelection in 2006 by a more than two-to-one margin against John Spencer.",
    "answer_correctness_score": 10,
    "explanation_validity_score": 10,
    "question_clarity_score": 8,
    "question_difficulty_score": 7,
    "question_groundedness_score": 10,
    "question_token_count": 61,
    "reformat_question_cosine_similarity_to_orig": 0.6797064542770386,
    "reformat_answer_cosine_similarity_to_orig": 1.0000001192092896,
    "reformat_question_similarity_score": 10,
    "reformat_answer_similarity_score": 10,
    "avg_answer_token_count": 5
  },
  {
    "orig_question": "The artist who released \"State of Grace\" and \"Begin Again\" is known for singing about what topic?",
    "orig_answer": "failed relationship",
    "context": "[PAR] [TLE] Begin Again (Taylor Swift song) [SEP] \"Begin Again\" is a song written and recorded by American singer-songwriter Taylor Swift for her fourth studio album, \"Red\" (2012).  Swift co-produced the song with Nathan Chapman and Dann Huff.  Initially released as a promotional single on September 25, 2012 by Big Machine Records, the song served as the second single from \"Red\" on October 1, 2012.  \"Begin Again\" is a country song, with the lyrical content finds Swift falling in love again after a failed relationship. [PAR] [TLE] State of Grace (Taylor Swift song) [SEP] \"State of Grace\" is a song by American singer-songwriter Taylor Swift from her fourth studio album \"Red\" (2012).  It was released to the iTunes Store on October 16, 2012, in the United States by Big Machine Records as the fourth and final promotional single from the album.  It was the only promotional single from the album that was not re-issued as an official single, as \"Begin Again\", \"Red\", and \"I Knew You Were Trouble\", were all later re-issued as official singles.  The song was written by Swift and produced by Nathan Chapman and Swift.  Musically, the song is a departure from Swift's typical country pop, using influences of alternative rock while being compared to bands such as U2, Muse and The Cranberries.  The song has received immense praise from music critics, who have complimented its broader sound in comparison with Swift's previous material.",
    "response": "```xml\n<document_analysis>\nThoughtful Content Examination: The context discusses two songs by Taylor Swift, \"State of Grace\" and \"Begin Again,\" both from her album \"Red\" (2012). \"Begin Again\" specifically focuses on falling in love after a failed relationship. \"State of Grace\" is described in terms of its musical style and critical reception, but does not directly mention lyrical themes.\n\nConcept Exploration: The question asks about the lyrical themes prevalent in the artist's work, leveraging the provided information about \"Begin Again.\" While \"State of Grace\" is mentioned, the core answer lies within the description of \"Begin Again.\"\n\nStrategic Complexity Calibration: Difficulty: 6/10. It requires connecting information about two songs and identifying the primary lyrical theme present in one of them.\n\nIntentional Question Planning: The question aims to assess the ability to synthesize information from multiple parts of the context and identify a common thread in the artist's lyrical content.\n</document_analysis>\n<output_format>\nQuestion: Taylor Swift's album \"Red\" (2012) features both the country song \"Begin Again,\" co-produced with Nathan Chapman and Dann Huff, and the alternative rock-influenced \"State of Grace,\" produced by Swift and Chapman. Given that \"Begin Again\" explores the experience of finding love after a previous relationship ends, which of the following best describes a central theme often explored in Swift's songwriting, as suggested by the lyrical content of this song?\nA: The complexities of navigating the music industry and achieving commercial success.\nB: The emotional journey of overcoming heartbreak and finding new love.\nC: The challenges of artistic experimentation and breaking away from genre conventions.\nD: The importance of maintaining long-term friendships and familial bonds.\nExplanation: The context explicitly states that \"Begin Again\" is about falling in love again after a failed relationship. This directly supports answer option B as the central theme.\nCorrect Answer: B\n</output_format>\n```",
    "question": "Taylor Swift's album \"Red\" (2012) features both the country song \"Begin Again,\" co-produced with Nathan Chapman and Dann Huff, and the alternative rock-influenced \"State of Grace,\" produced by Swift and Chapman. Given that \"Begin Again\" explores the experience of finding love after a previous relationship ends, which of the following best describes a central theme often explored in Swift's songwriting, as suggested by the lyrical content of this song?",
    "choices": {
      "A": "The complexities of navigating the music industry and achieving commercial success.",
      "B": "The emotional journey of overcoming heartbreak and finding new love.",
      "C": "The challenges of artistic experimentation and breaking away from genre conventions.",
      "D": "The importance of maintaining long-term friendships and familial bonds."
    },
    "answer": "B",
    "explanation": "The context explicitly states that \"Begin Again\" is about falling in love again after a failed relationship. This directly supports answer option B as the central theme.",
    "answer_correctness_score": 10,
    "explanation_validity_score": 10,
    "question_clarity_score": 7,
    "question_difficulty_score": 5,
    "question_groundedness_score": 9,
    "question_token_count": 94,
    "reformat_question_cosine_similarity_to_orig": 0.606507420539856,
    "reformat_answer_cosine_similarity_to_orig": 0.40014100074768066,
    "reformat_question_similarity_score": 8,
    "reformat_answer_similarity_score": 9,
    "avg_answer_token_count": 12
  },
  {
    "orig_question": "Takura Tendayi is a Zimbabwean singer/songwriter and member of the band Door Policy alongside producer Bibby Jones, he co-wrote Rihanna's 2009 single, Wait Your Turn, for her fourth studio album, \"Rated R\", released in what year?",
    "orig_answer": "2009",
    "context": "[PAR] [TLE] Takura [SEP] Takura Tendayi is a Zimbabwean singer/songwriter and member of the band Door Policy alongside producer Bibby Jones.  He is well known for his frequent collaborations with Chase & Status and Sub Focus, as well as many other dubstep and drum and bass artists.  His guest appearances have accumulated over seventeen million YouTube views, and \"Flashing Lights\" has charted in the United Kingdom at number 98 in the UK Singles Chart and number 15 in the UK Dance Chart.  shared stage with Ray Cee and also co-wrote Rihanna's 2009 single \"Wait Your Turn\" which alone has over seventeen million YouTube views and charted at number 45 in the UK Singles Chart.  On 10 September, Door Policy released the three-track EP \"No Cover Charge\" for free download.  It features a guest appearance from \"Traktor\" singer L Marshall. [PAR] [TLE] Wait Your Turn [SEP] \"Wait Your Turn\" is a song recorded by Barbadian singer Rihanna for her fourth studio album, \"Rated R\" (2009).  It was written by Mikkel S. Eriksen, Tor Erik Hermansen, Saul Milton, Will Kennard, James Fauntleroy II, Takura Tendayi, and Rihanna herself.  Stargate (Eriksen and Hermansen) and Chase & Status (Milton and Kennard) produced the song.  \"Wait Your Turn\" was released on November 13, 2009 as the second international and third overall single from \"Rated R\".",
    "response": "```xml\n<document_analysis>\nThoughtful Content Examination: The context provides information about Takura Tendayi, his collaborations, and his co-writing credit on Rihanna's \"Wait Your Turn.\" The question focuses on the release year of Rihanna\u2019s album \"Rated R\", which contains the song co-written by Takura.\n\nConcept Exploration: The question tests factual recall of a specific detail within the provided text. It requires understanding the relationship between Takura, Rihanna's song, and the album's release date.\n\nStrategic Complexity Calibration: Difficulty: 3/10. This is a relatively straightforward factual question. I will increase the complexity by adding distractors related to other dates mentioned in the text.\n\nIntentional Question Planning: The question aims to assess the test taker's ability to accurately extract and recall specific details from the provided context.\n</document_analysis>\n<output_format>\nQuestion: Takura Tendayi, a Zimbabwean singer-songwriter and member of Door Policy, collaborated on the writing of Rihanna\u2019s 2009 single \"Wait Your Turn,\" which appeared on the album \"Rated R\". Considering this information, and the provided text, in what year was Rihanna\u2019s album \u201cRated R\u201d released?\nA: 2010\nB: 2008\nC: 2009\nD: 2011\nExplanation: The text explicitly states that \u201cWait Your Turn\u201d was released as part of Rihanna\u2019s fourth studio album, \"Rated R\" (2009).\nCorrect Answer: C\n</output_format>\n```",
    "question": "Takura Tendayi, a Zimbabwean singer-songwriter and member of Door Policy, collaborated on the writing of Rihanna\u2019s 2009 single \"Wait Your Turn,\" which appeared on the album \"Rated R\". Considering this information, and the provided text, in what year was Rihanna\u2019s album \u201cRated R\u201d released?",
    "choices": {
      "A": "2010",
      "B": "2008",
      "C": "2009",
      "D": "2011"
    },
    "answer": "C",
    "explanation": "The text explicitly states that \u201cWait Your Turn\u201d was released as part of Rihanna\u2019s fourth studio album, \"Rated R\" (2009).",
    "answer_correctness_score": 10,
    "explanation_validity_score": 10,
    "question_clarity_score": 6,
    "question_difficulty_score": 2,
    "question_groundedness_score": 10,
    "question_token_count": 69,
    "reformat_question_cosine_similarity_to_orig": 0.9398096799850464,
    "reformat_answer_cosine_similarity_to_orig": 1.0,
    "reformat_question_similarity_score": 9,
    "reformat_answer_similarity_score": 10,
    "avg_answer_token_count": 3
  },
  {
    "orig_question": "Which University did the gymnastics coach, who recruited a two time gold medal winner in the 1984 Summer Olympics, attend?",
    "orig_answer": "University of Oklahoma",
    "context": "[PAR] [TLE] Bart Conner [SEP] Bart Conner (born March 28, 1958) is a retired American Olympic gymnast.  As a member of the men's gymnastics team at the 1984 Summer Olympic Games, Conner won two gold medals.  He currently owns and operates the Bart Conner Gymnastics Academy in Norman, Oklahoma, along with his wife, Romanian Olympic gold medalist Nadia Com\u0103neci.  In addition, both Com\u0103neci and Conner are highly involved with the Special Olympics. [PAR] [TLE] Paul Ziert [SEP] Paul Ziert is a former University of Oklahoma gymnastics coach.  Ziert recruited Bart Conner to the school.  In 1977 and 1978, Ziert's teams won the NCAA Men's Gymnastics championship.",
    "response": "```xml\n<document_analysis>\nThoughtful Content Examination: The context provides information about Bart Conner, an Olympic gymnast, and Paul Ziert, his former coach at the University of Oklahoma. The question asks about the university attended by the coach who recruited Conner.\nConcept Exploration: The question tests the ability to connect two pieces of information: Ziert recruited Conner, and Ziert coached at a specific university.\nStrategic Complexity Calibration: Difficulty: 6/10. This requires a simple recall of information but requires connecting two facts.\nIntentional Question Planning: The question is designed to assess comprehension of the relationship between Conner and Ziert and Ziert\u2019s affiliation with a university.\n</document_analysis>\n<output_format>\nQuestion: Bart Conner, a two-time gold medalist at the 1984 Summer Olympic Games, was recruited to a university by Paul Ziert, a former gymnastics coach. Which university did Paul Ziert coach at during the time he recruited Bart Conner?\nA: University of California, Los Angeles\nB: University of Oklahoma\nC: University of Michigan\nD: University of Texas\nExplanation: The text states, \u201cPaul Ziert is a former University of Oklahoma gymnastics coach\u2026 Ziert recruited Bart Conner to the school.\u201d Therefore, Paul Ziert coached at the University of Oklahoma.\nCorrect Answer: B\n</output_format>\n```",
    "question": "Bart Conner, a two-time gold medalist at the 1984 Summer Olympic Games, was recruited to a university by Paul Ziert, a former gymnastics coach. Which university did Paul Ziert coach at during the time he recruited Bart Conner?",
    "choices": {
      "A": "University of California, Los Angeles",
      "B": "University of Oklahoma",
      "C": "University of Michigan",
      "D": "University of Texas"
    },
    "answer": "B",
    "explanation": "The text states, \u201cPaul Ziert is a former University of Oklahoma gymnastics coach\u2026 Ziert recruited Bart Conner to the school.\u201d Therefore, Paul Ziert coached at the University of Oklahoma.",
    "answer_correctness_score": 10,
    "explanation_validity_score": 10,
    "question_clarity_score": 1,
    "question_difficulty_score": 5,
    "question_groundedness_score": 10,
    "question_token_count": 53,
    "reformat_question_cosine_similarity_to_orig": 0.6837601661682129,
    "reformat_answer_cosine_similarity_to_orig": 1.0,
    "reformat_question_similarity_score": 9,
    "reformat_answer_similarity_score": 10,
    "avg_answer_token_count": 4
  },
  {
    "orig_question": "What sport is represented by Zuffa founded in 2001 by Frank Fertitta III and Lorenzo Fertitta?",
    "orig_answer": "mixed martial arts",
    "context": "[PAR] [TLE] Frank Fertitta III [SEP] Frank Joseph Fertitta III (born February 24, 1962) is an American entrepreneur.  He is the current CEO of Station Casinos.  He is also an owner of Zuffa LLC, which is the entity that formerly ran the Ultimate Fighting Championship (UFC). [PAR] [TLE] Zuffa [SEP] Zuffa, LLC ( ) is an American sports promotion company specializing in mixed martial arts.  It was founded in January 2001 in Las Vegas, Nevada, by Station Casinos executives Frank Fertitta III and Lorenzo Fertitta to be the parent entity of the Ultimate Fighting Championship (UFC) after they purchased it from the Semaphore Entertainment Group.  The word \"Zuffa\" is an Italian word (] ), meaning \"fight\".  On July 11, 2016, Zuffa announced that it would be purchased by WME-IMG for the price of $4 billion.",
    "response": "```xml\n<document_analysis>\nThoughtful Content Examination: The context describes Frank Fertitta III and his involvement with Station Casinos and Zuffa LLC. Zuffa was founded to be the parent entity of the Ultimate Fighting Championship (UFC). The text explicitly states Zuffa specializes in mixed martial arts.\nConcept Exploration: The passage introduces key figures in the world of mixed martial arts promotion and the evolution of the UFC's ownership. It highlights the business side of the sport.\nStrategic Complexity Calibration: Difficulty: 4/10. This is a fairly straightforward factual recall question, but it requires understanding the relationship between Zuffa and the UFC.\nIntentional Question Planning: The question aims to assess understanding of Zuffa's primary business focus. The question can be rephrased to be more challenging by including distractors related to the Fertitta brothers' other business ventures.\n</document_analysis>\n<output_format>\nQuestion: In 2001, Frank Fertitta III and Lorenzo Fertitta co-founded Zuffa, LLC in Las Vegas, Nevada, with the intention of acquiring and managing a specific sports organization. What discipline does Zuffa, LLC primarily promote and oversee?\nA: Boxing\nB: Professional Wrestling\nC: Mixed Martial Arts\nD: Basketball\nExplanation: The text explicitly states that Zuffa, LLC specializes in mixed martial arts and was founded to be the parent entity of the Ultimate Fighting Championship (UFC).\nCorrect Answer: C\n</output_format>\n```",
    "question": "In 2001, Frank Fertitta III and Lorenzo Fertitta co-founded Zuffa, LLC in Las Vegas, Nevada, with the intention of acquiring and managing a specific sports organization. What discipline does Zuffa, LLC primarily promote and oversee?",
    "choices": {
      "A": "Boxing",
      "B": "Professional Wrestling",
      "C": "Mixed Martial Arts",
      "D": "Basketball"
    },
    "answer": "C",
    "explanation": "The text explicitly states that Zuffa, LLC specializes in mixed martial arts and was founded to be the parent entity of the Ultimate Fighting Championship (UFC).",
    "answer_correctness_score": 10,
    "explanation_validity_score": 10,
    "question_clarity_score": 6,
    "question_difficulty_score": 5,
    "question_groundedness_score": 10,
    "question_token_count": 53,
    "reformat_question_cosine_similarity_to_orig": 0.7766323089599609,
    "reformat_answer_cosine_similarity_to_orig": 1.0000001192092896,
    "reformat_question_similarity_score": 9,
    "reformat_answer_similarity_score": 10,
    "avg_answer_token_count": 3
  },
  {
    "orig_question": "When was the first naval recipient of the Medal of Honor in World War II shot down?",
    "orig_answer": "27 November 1943",
    "context": "[PAR] [TLE] Edward O'Hare [SEP] Lieutenant Commander Edward Henry \u201cButch\u201d O\u2019Hare (March 13, 1914 \u2013 November 26, 1943) was an American naval aviator of the United States Navy, who on February 20, 1942, became the Navy's first flying ace when he single-handedly attacked a formation of nine heavy bombers approaching his aircraft carrier.  Even though he had a limited amount of ammunition, he managed to shoot down or damage several enemy bombers.  On April 21, 1942, he became the first naval recipient of the Medal of Honor in World War II. [PAR] [TLE] USS O'Hare (DD-889) [SEP] USS \"O'Hare\" (DD/DDR-889) was a \"Gearing\"-class destroyer of the United States Navy, named for Lieutenant Commander Edward \"Butch\" O'Hare, Medal of Honor recipient, who was shot down at Tarawa on 27 November 1943.",
    "response": "```xml\n<document_analysis>\nThoughtful Content Examination: The context provides information about Edward O'Hare, a naval aviator, and the USS O'Hare, a destroyer named after him. The question asks when the first naval recipient of the Medal of Honor in WWII was shot down. The answer is directly stated in the text.\n\nConcept Exploration: The text highlights the legacy of Edward O'Hare through both his personal achievements and the naming of a naval vessel in his honor. This demonstrates a common practice of commemorating military heroes.\n\nStrategic Complexity Calibration: Difficulty: 6/10. While the answer is explicitly stated, locating it requires understanding the connection between O'Hare receiving the Medal of Honor and the subsequent mention of his death.\n\nIntentional Question Planning: The question tests recall and comprehension of the timeline of events related to Edward O'Hare's life and military service. The question is crafted to require the test taker to synthesize information from different parts of the text.\n</document_analysis>\n<output_format>\nQuestion: Lieutenant Commander Edward Henry \u201cButch\u201d O\u2019Hare was the Navy's first flying ace and the first naval recipient of the Medal of Honor in World War II. Considering his distinguished service record, on what date was Lieutenant Commander O\u2019Hare shot down during combat operations?\nA: February 20, 1942\nB: April 21, 1942\nC: November 26, 1943\nD: November 27, 1943\nExplanation: The text states that USS \"O'Hare\" (DD/DDR-889) was named for Lieutenant Commander Edward \"Butch\" O'Hare, Medal of Honor recipient, who was shot down at Tarawa on November 27, 1943.\nCorrect Answer: D\n</output_format>\n```",
    "question": "Lieutenant Commander Edward Henry \u201cButch\u201d O\u2019Hare was the Navy's first flying ace and the first naval recipient of the Medal of Honor in World War II. Considering his distinguished service record, on what date was Lieutenant Commander O\u2019Hare shot down during combat operations?",
    "choices": {
      "A": "February 20, 1942",
      "B": "April 21, 1942",
      "C": "November 26, 1943",
      "D": "November 27, 1943"
    },
    "answer": "D",
    "explanation": "The text states that USS \"O'Hare\" (DD/DDR-889) was named for Lieutenant Commander Edward \"Butch\" O'Hare, Medal of Honor recipient, who was shot down at Tarawa on November 27, 1943.",
    "answer_correctness_score": 10,
    "explanation_validity_score": 10,
    "question_clarity_score": 8,
    "question_difficulty_score": 6,
    "question_groundedness_score": 10,
    "question_token_count": 56,
    "reformat_question_cosine_similarity_to_orig": 0.6640588045120239,
    "reformat_answer_cosine_similarity_to_orig": 0.9754891395568848,
    "reformat_question_similarity_score": 8,
    "reformat_answer_similarity_score": 10,
    "avg_answer_token_count": 8
  },
  {
    "orig_question": "In what Florida city did the 2015 Clemson Tigers beat the Oklahoma Sooners 37-17?",
    "orig_answer": "Miami Gardens",
    "context": "[PAR] [TLE] 2015 Clemson Tigers football team [SEP] The 2015 Clemson Tigers football team represented Clemson University in the 2015 NCAA Division I FBS football season.  The Tigers were led by head coach Dabo Swinney in his seventh full year and eighth overall since taking over midway through 2008 season.  They played their home games at Memorial Stadium, also known as \"Death Valley.\"  Clemson competed in the Atlantic Division of the Atlantic Coast Conference.  On December 5, 2015, the Tigers won the 2015 ACC Championship Game by defeating the North Carolina Tar Heels, 45\u201337, capping their first undefeated regular season since winning the national title in 1981.  Ranked No. 1 throughout the College Football Playoff (CFP) rankings, Clemson defeated the No. 4 Oklahoma Sooners, 37\u201317, in the 2015 Orange Bowl to advance to the College Football Playoff National Championship.  On January 11, 2016, the No. 2 Alabama Crimson Tide (13\u20131) defeated the No. 1 Clemson Tigers (14\u20130) in the 2016 national championship, 45\u201340.  Both Clemson and Alabama finished the season 14\u20131. [PAR] [TLE] 2015 Orange Bowl [SEP] The 2015 Capital One Orange Bowl was a college football bowl game that was played on December 31, 2015 at Sun Life Stadium in Miami Gardens, Florida.  The 82nd Orange Bowl was a College Football Playoff semifinal with the winner of the game competing against the winner of the 2015 Cotton Bowl: Alabama Crimson Tide football in the 2016 College Football Playoff National Championship, which took place at University of Phoenix Stadium in Glendale, Arizona.  It was one of the 2015\u201316 bowl games that concluded the 2015 FBS football season.",
    "response": "```xml\n<document_analysis>\nThoughtful Content Examination: The context provides information about the 2015 Clemson Tigers football team, including their season results, and specifically mentions their 37-17 victory over the Oklahoma Sooners in the 2015 Orange Bowl. It also states the game was played in Miami Gardens, Florida.\n\nConcept Exploration: The question tests factual recall regarding a specific event within the context of college football. It requires knowing both the outcome of a game and its location.\n\nStrategic Complexity Calibration: Difficulty: 4/10. This is a straightforward factual recall question, but requires reading comprehension to locate the information within the provided text.\n\nIntentional Question Planning: The question directly assesses the ability to extract specific details from the text. It\u2019s important to phrase the question clearly and provide plausible distractors in the answer options.\n</document_analysis>\n<output_format>\nQuestion: During the 2015 College Football Playoff, the Clemson Tigers achieved a decisive 37-17 victory over the Oklahoma Sooners in a semifinal game. This contest, known as the 2015 Capital One Orange Bowl and serving as a playoff semifinal, determined one participant in the championship game against the Alabama Crimson Tide. In what Florida city was this pivotal game played, ultimately propelling Clemson towards the national championship stage?\nA: Orlando\nB: Tampa\nC: Miami Gardens\nD: Jacksonville\nExplanation: The text explicitly states that the 2015 Capital One Orange Bowl was played on December 31, 2015, at Sun Life Stadium in Miami Gardens, Florida.\nCorrect Answer: C\n</output_format>\n```",
    "question": "During the 2015 College Football Playoff, the Clemson Tigers achieved a decisive 37-17 victory over the Oklahoma Sooners in a semifinal game. This contest, known as the 2015 Capital One Orange Bowl and serving as a playoff semifinal, determined one participant in the championship game against the Alabama Crimson Tide. In what Florida city was this pivotal game played, ultimately propelling Clemson towards the national championship stage?",
    "choices": {
      "A": "Orlando",
      "B": "Tampa",
      "C": "Miami Gardens",
      "D": "Jacksonville"
    },
    "answer": "C",
    "explanation": "The text explicitly states that the 2015 Capital One Orange Bowl was played on December 31, 2015, at Sun Life Stadium in Miami Gardens, Florida.",
    "answer_correctness_score": 10,
    "explanation_validity_score": 10,
    "question_clarity_score": 8,
    "question_difficulty_score": 5,
    "question_groundedness_score": 10,
    "question_token_count": 87,
    "reformat_question_cosine_similarity_to_orig": 0.758920431137085,
    "reformat_answer_cosine_similarity_to_orig": 1.0000001192092896,
    "reformat_question_similarity_score": 9,
    "reformat_answer_similarity_score": 10,
    "avg_answer_token_count": 3
  },
  {
    "orig_question": "Where was the captain that the USS Elrod is named after born?",
    "orig_answer": "Turner County, Georgia",
    "context": "[PAR] [TLE] Henry T. Elrod [SEP] Elrod was born on September 27, 1905, in Turner County, Georgia.  He enlisted in the Marine Corps in December 1927, and was appointed a Marine second lieutenant in February 1931.  He attended the University of Georgia and Yale University prior to his entry into the Marine Corps. [PAR] [TLE] USS Elrod (FFG-55) [SEP] USS \"Elrod\" (FFG-55), an \"Oliver Hazard Perry\"-class frigate, is a ship of the United States Navy named after Captain Henry T. Elrod (1905\u20131941), a Marine aviator who was posthumously awarded the Medal of Honor for his heroism in the defense of Wake Island in World War II.",
    "response": "```xml\n<document_analysis>\nThoughtful Content Examination: The context provides biographical information about Captain Henry T. Elrod and the ship named after him, USS Elrod. The key information for question generation is Elrod's birthplace and his military service, particularly his posthumous Medal of Honor for heroism at Wake Island.\n\nConcept Exploration: The text establishes a clear connection between a historical figure (Elrod) and a naval vessel (USS Elrod). It highlights the honor bestowed upon Elrod through the ship's naming. The information is factual and straightforward.\n\nStrategic Complexity Calibration: Difficulty: 3/10. The question is relatively straightforward as the answer is directly stated in the text. However, it serves as a good baseline for assessing basic comprehension.\n\nIntentional Question Planning: The question aims to assess the recall of a specific detail about Elrod's background. It\u2019s a foundational piece of information for understanding the context. I will rephrase it to be more challenging and include more context in the question itself.\n</document_analysis>\n<output_format>\nQuestion: Captain Henry T. Elrod, a Marine aviator honored with the Medal of Honor for his defense of Wake Island during World War II, lent his name to the USS Elrod (FFG-55), an \"Oliver Hazard Perry\"-class frigate. Considering Captain Elrod's early life and military career as outlined in the provided information, in which Georgia county did he first see the light of day?\nA: Chatham County, Georgia\nB: Fulton County, Georgia\nC: Turner County, Georgia\nD: Cobb County, Georgia\nExplanation: The text explicitly states that Henry T. Elrod was born on September 27, 1905, in Turner County, Georgia.\nCorrect Answer: C\n</output_format>\n```",
    "question": "Captain Henry T. Elrod, a Marine aviator honored with the Medal of Honor for his defense of Wake Island during World War II, lent his name to the USS Elrod (FFG-55), an \"Oliver Hazard Perry\"-class frigate. Considering Captain Elrod's early life and military career as outlined in the provided information, in which Georgia county did he first see the light of day?",
    "choices": {
      "A": "Chatham County, Georgia",
      "B": "Fulton County, Georgia",
      "C": "Turner County, Georgia",
      "D": "Cobb County, Georgia"
    },
    "answer": "C",
    "explanation": "The text explicitly states that Henry T. Elrod was born on September 27, 1905, in Turner County, Georgia.",
    "answer_correctness_score": 10,
    "explanation_validity_score": 10,
    "question_clarity_score": 8,
    "question_difficulty_score": 2,
    "question_groundedness_score": 10,
    "question_token_count": 84,
    "reformat_question_cosine_similarity_to_orig": 0.6697217226028442,
    "reformat_answer_cosine_similarity_to_orig": 1.0000001192092896,
    "reformat_question_similarity_score": 10,
    "reformat_answer_similarity_score": 10,
    "avg_answer_token_count": 6
  },
  {
    "orig_question": "What secret organization is Snape a part of?",
    "orig_answer": "Order of the Phoenix",
    "context": "[PAR] [TLE] Order of the Phoenix (fictional organisation) [SEP] The Order of the Phoenix is a secret organisation in the \"Harry Potter\" series of fiction books written by J. K. Rowling.  Founded by Albus Dumbledore to fight Lord Voldemort and his followers, the Death Eaters, the Order lends its name to the fifth book of the series, \"Harry Potter and the Order of the Phoenix\". [PAR] [TLE] Severus Snape [SEP] Severus Snape is a fictional character in J. K. Rowling's \"Harry Potter\" series.  An exceptionally skilful wizard, his coldly sarcastic and controlled exterior conceals deep emotions and anguish.  A Professor at Hogwarts School of Witchcraft and Wizardry, Snape is hostile to the series' protagonist, Harry, the moment he sets foot in Snape's classroom; this hostility is rooted in Harry's resemblance to Harry's father James, who bullied and harassed Snape during their time at Hogwarts.  Though philosophically attracted to the Dark Arts and Lord Voldemort's ideology of wizard supremacy, Snape's love for Muggle-born Lily Evans, Harry's mother, eventually compels him to defect from the Death Eaters.  Snape becomes a double-agent on behalf of Albus Dumbledore and the Order of the Phoenix, and protects Harry throughout the series.",
    "response": "```xml\n<document_analysis>\nThoughtful Content Examination: The context provides information about the Order of the Phoenix and Severus Snape. It states that Snape becomes a double-agent for Albus Dumbledore and the Order of the Phoenix. The question asks about the secret organization Snape is a part of.\n\nConcept Exploration: The passage highlights the dual nature of Snape\u2019s allegiance, initially leaning towards the Dark Arts but ultimately serving as a crucial protector of Harry Potter through his work with the Order.\n\nStrategic Complexity Calibration: Difficulty: 6/10. The answer is directly stated in the text, but requires understanding Snape's complex role.\n\nIntentional Question Planning: The question will be rephrased to focus on Snape's affiliation and the motivations behind it, requiring a slightly deeper understanding of his character arc.\n</document_analysis>\n<output_format>\nQuestion: Severus Snape, a wizard with a complex history and a concealed emotional depth, ultimately dedicates himself to opposing Lord Voldemort and safeguarding Harry Potter. This commitment leads him to operate as a double-agent for a specific clandestine group. Which of the following organizations does Severus Snape secretly serve, acting on behalf of Albus Dumbledore?\nA: The Death Eaters, initially aligned with Snape\u2019s philosophical leanings towards the Dark Arts and wizard supremacy.\nB: Hogwarts School of Witchcraft and Wizardry, where Snape maintains a position as a Professor despite his covert activities.\nC: The Order of the Phoenix, a secret society founded by Albus Dumbledore to resist Lord Voldemort and his followers.\nD: A self-formed network of independent wizards, operating outside of established organizations to counter Voldemort\u2019s influence.\nExplanation: The text explicitly states that \u201cSnape becomes a double-agent on behalf of Albus Dumbledore and the Order of the Phoenix.\u201d This indicates his secret service to the Order, working to protect Harry and oppose Voldemort.\nCorrect Answer: C\n</output_format>\n```",
    "question": "Severus Snape, a wizard with a complex history and a concealed emotional depth, ultimately dedicates himself to opposing Lord Voldemort and safeguarding Harry Potter. This commitment leads him to operate as a double-agent for a specific clandestine group. Which of the following organizations does Severus Snape secretly serve, acting on behalf of Albus Dumbledore?",
    "choices": {
      "A": "The Death Eaters, initially aligned with Snape\u2019s philosophical leanings towards the Dark Arts and wizard supremacy.",
      "B": "Hogwarts School of Witchcraft and Wizardry, where Snape maintains a position as a Professor despite his covert activities.",
      "C": "The Order of the Phoenix, a secret society founded by Albus Dumbledore to resist Lord Voldemort and his followers.",
      "D": "A self-formed network of independent wizards, operating outside of established organizations to counter Voldemort\u2019s influence."
    },
    "answer": "C",
    "explanation": "The text explicitly states that \u201cSnape becomes a double-agent on behalf of Albus Dumbledore and the Order of the Phoenix.\u201d This indicates his secret service to the Order, working to protect Harry and oppose Voldemort.",
    "answer_correctness_score": 10,
    "explanation_validity_score": 10,
    "question_clarity_score": 8,
    "question_difficulty_score": 6,
    "question_groundedness_score": 10,
    "question_token_count": 77,
    "reformat_question_cosine_similarity_to_orig": 0.657098650932312,
    "reformat_answer_cosine_similarity_to_orig": 0.5471212863922119,
    "reformat_question_similarity_score": 9,
    "reformat_answer_similarity_score": 9,
    "avg_answer_token_count": 26
  },
  {
    "orig_question": "Who conducts the draft in which Marc-Andre Fleury was drafted to the Vegas Golden Knights for the 2017-18 season?",
    "orig_answer": "National Hockey League",
    "context": "[PAR] [TLE] 2017\u201318 Pittsburgh Penguins season [SEP] The 2017\u201318 Pittsburgh Penguins season will be the 51st season for the National Hockey League ice hockey team that was established on June 5, 1967.  They will enter the season as two-time defending Stanley Cup champions.  It will be the first season since the 2002\u201303 season in which the team will play without goaltender Marc-Andre Fleury, who was drafted to the Vegas Golden Knights in the expansion draft. [PAR] [TLE] 2017 NHL Expansion Draft [SEP] The 2017 NHL Expansion Draft was an expansion draft conducted by the National Hockey League on June 18\u201320, 2017 to fill the roster of the league's expansion team for the 2017\u201318 season, the Vegas Golden Knights.  The team's selections were announced on June 21 during the NHL Awards ceremony at T-Mobile Arena.",
    "response": "```xml\n<document_analysis>\nThoughtful Content Examination: The context discusses the 2017-18 Pittsburgh Penguins season and the 2017 NHL Expansion Draft, specifically mentioning Marc-Andre Fleury being drafted to the Vegas Golden Knights. The question asks about who conducted the draft.\n\nConcept Exploration: The passage establishes a direct link between the NHL Expansion Draft and Fleury's move to the Golden Knights. It's a factual recall question, but can be made more complex by framing the answer choices carefully.\n\nStrategic Complexity Calibration: Difficulty: 6/10. While the answer is explicitly stated, the question requires understanding the connection between the events described.\n\nIntentional Question Planning: The question will be rephrased to include more detail from the context, creating a more challenging scenario. The answer options will be designed to test understanding of the specific draft mentioned.\n</document_analysis>\n<output_format>\nQuestion: During the 2017-18 offseason, the Pittsburgh Penguins experienced a significant roster change with goaltender Marc-Andre Fleury being selected in an expansion draft. Considering this event and the context surrounding the formation of the Vegas Golden Knights, which organization was responsible for conducting the draft that resulted in Fleury joining the Golden Knights?\nA: The Pittsburgh Penguins' management team.\nB: The National Hockey League.\nC: The Vegas Golden Knights' ownership group.\nD: The NHL Players' Association.\nExplanation: The text explicitly states that the 2017 NHL Expansion Draft was conducted by the National Hockey League to populate the roster of the Vegas Golden Knights. This draft resulted in Marc-Andre Fleury being drafted to the Golden Knights.\nCorrect Answer: B\n</output_format>\n```",
    "question": "During the 2017-18 offseason, the Pittsburgh Penguins experienced a significant roster change with goaltender Marc-Andre Fleury being selected in an expansion draft. Considering this event and the context surrounding the formation of the Vegas Golden Knights, which organization was responsible for conducting the draft that resulted in Fleury joining the Golden Knights?",
    "choices": {
      "A": "The Pittsburgh Penguins' management team.",
      "B": "The National Hockey League.",
      "C": "The Vegas Golden Knights' ownership group.",
      "D": "The NHL Players' Association."
    },
    "answer": "B",
    "explanation": "The text explicitly states that the 2017 NHL Expansion Draft was conducted by the National Hockey League to populate the roster of the Vegas Golden Knights. This draft resulted in Marc-Andre Fleury being drafted to the Golden Knights.",
    "answer_correctness_score": 10,
    "explanation_validity_score": 10,
    "question_clarity_score": 6,
    "question_difficulty_score": 2,
    "question_groundedness_score": 10,
    "question_token_count": 68,
    "reformat_question_cosine_similarity_to_orig": 0.8127292394638062,
    "reformat_answer_cosine_similarity_to_orig": 0.94842928647995,
    "reformat_question_similarity_score": 9,
    "reformat_answer_similarity_score": 10,
    "avg_answer_token_count": 7
  },
  {
    "orig_question": "what does Frank Fertitta III and Zuffa have in common?",
    "orig_answer": "American",
    "context": "[PAR] [TLE] Frank Fertitta III [SEP] Frank Joseph Fertitta III (born February 24, 1962) is an American entrepreneur.  He is the current CEO of Station Casinos.  He is also an owner of Zuffa LLC, which is the entity that formerly ran the Ultimate Fighting Championship (UFC). [PAR] [TLE] Zuffa [SEP] Zuffa, LLC ( ) is an American sports promotion company specializing in mixed martial arts.  It was founded in January 2001 in Las Vegas, Nevada, by Station Casinos executives Frank Fertitta III and Lorenzo Fertitta to be the parent entity of the Ultimate Fighting Championship (UFC) after they purchased it from the Semaphore Entertainment Group.  The word \"Zuffa\" is an Italian word (] ), meaning \"fight\".  On July 11, 2016, Zuffa announced that it would be purchased by WME-IMG for the price of $4 billion.",
    "response": "```xml\n<document_analysis>\n<thought_process>The provided context details Frank Fertitta III's role as CEO of Station Casinos and an owner of Zuffa LLC, the former parent company of the UFC. The question asks for a commonality between Frank Fertitta III and Zuffa. The original answer, \"American,\" is too broad and doesn't demonstrate a deep understanding of the context. A more challenging question would focus on their shared business relationship and founding of Zuffa. The complexity level is currently low (2/10) and needs to be increased. I will create a multiple-choice question that requires the test taker to understand the specific connection between Fertitta and Zuffa.</thought_process>\n</document_analysis>\n<output_format>\nQuestion: Frank Fertitta III and Lorenzo Fertitta co-founded Zuffa, LLC in 2001 with a specific purpose. Which of the following best describes the primary reason for establishing Zuffa, LLC?\nA: To diversify Station Casinos' holdings into the entertainment industry, specifically focusing on Italian language learning centers, leveraging the meaning of the name \"Zuffa.\"\nB: To acquire and manage the Ultimate Fighting Championship (UFC), transforming it into a major sports promotion company.\nC: To create a new casino resort in Las Vegas, capitalizing on the rising popularity of mixed martial arts as a form of entertainment.\nD: To establish a venture capital firm specializing in investments within the sports and entertainment sectors, with the UFC as its initial portfolio company.\nExplanation: The text explicitly states that Zuffa, LLC was founded by Frank and Lorenzo Fertitta \"to be the parent entity of the Ultimate Fighting Championship (UFC) after they purchased it from the Semaphore Entertainment Group.\" This demonstrates their primary intention was to acquire and manage the UFC.\nCorrect Answer: B\n</output_format>\n```",
    "question": "Frank Fertitta III and Lorenzo Fertitta co-founded Zuffa, LLC in 2001 with a specific purpose. Which of the following best describes the primary reason for establishing Zuffa, LLC?",
    "choices": {
      "A": "To diversify Station Casinos' holdings into the entertainment industry, specifically focusing on Italian language learning centers, leveraging the meaning of the name \"Zuffa.\"",
      "B": "To acquire and manage the Ultimate Fighting Championship (UFC), transforming it into a major sports promotion company.",
      "C": "To create a new casino resort in Las Vegas, capitalizing on the rising popularity of mixed martial arts as a form of entertainment.",
      "D": "To establish a venture capital firm specializing in investments within the sports and entertainment sectors, with the UFC as its initial portfolio company."
    },
    "answer": "B",
    "explanation": "The text explicitly states that Zuffa, LLC was founded by Frank and Lorenzo Fertitta \"to be the parent entity of the Ultimate Fighting Championship (UFC) after they purchased it from the Semaphore Entertainment Group.\" This demonstrates their primary intention was to acquire and manage the UFC.",
    "answer_correctness_score": 10,
    "explanation_validity_score": 10,
    "question_clarity_score": 6,
    "question_difficulty_score": 4,
    "question_groundedness_score": 9,
    "question_token_count": 43,
    "reformat_question_cosine_similarity_to_orig": 0.6571065187454224,
    "reformat_answer_cosine_similarity_to_orig": 0.06694740056991577,
    "reformat_question_similarity_score": 2,
    "reformat_answer_similarity_score": 1,
    "avg_answer_token_count": 26
  },
  {
    "orig_question": "Shinee, is a South Korean boy group formed by S.M. Entertainment in 2008, the group is composed of five members, one being which South Korean singer and actor, born in Gwangmyeong, Gyeonggi-do?",
    "orig_answer": "Onew",
    "context": "[PAR] [TLE] Shinee [SEP] Shinee ( ; Korean: \uc0e4\uc774\ub2c8; Japanese: \u30b7\u30e3\u30a4\u30cb\u30fc; stylized as SHINee) is a South Korean boy group formed by S.M. Entertainment in 2008.  The group is composed of five members: Onew, Jonghyun, Key, Minho and Taemin. [PAR] [TLE] Onew [SEP] Lee Jin-ki (born (1989--) 14, 1989 ), better known by his stage name Onew, is a South Korean singer and actor.  Born in Gwangmyeong, Gyeonggi-do, Onew was discovered at the 2006 S.M. Academy Casting and signed the contract with S.M Entertainment the day after his audition.  He debuted as one of the lead vocalists of boy group Shinee in May 2008, who went on to become one of the best-selling artists in South Korea.",
    "response": "```xml\n<document_analysis>\nThoughtful Content Examination: The context provides information about the South Korean boy group Shinee and its member Onew. The question asks for the name of a Shinee member who is also a South Korean singer and actor born in Gwangmyeong, Gyeonggi-do. The answer is directly stated in the text.\n\nConcept Exploration: The information is straightforward factual recall. It tests the ability to extract specific details from a short text.\n\nStrategic Complexity Calibration: Difficulty: 3/10. While factual, the question requires parsing a relatively complex sentence structure to identify the key information.\n\nIntentional Question Planning: The question can be improved by rephrasing it into a multiple-choice format to increase the challenge and test deeper understanding. The distractors should be other members of Shinee or similar figures.\n</document_analysis>\n<output_format>\nQuestion: In 2008, S.M. Entertainment formed the South Korean boy group Shinee, which consists of five members. One of these members is a singer and actor born in Gwangmyeong, Gyeonggi-do, discovered at the 2006 S.M. Academy Casting. Which member is being described?\nA: Key\nB: Minho\nC: Onew\nD: Taemin\nExplanation: The text explicitly states that Lee Jin-ki, known as Onew, was born in Gwangmyeong, Gyeonggi-do, discovered at the 2006 S.M. Academy Casting, and debuted as a member of Shinee in 2008.\nCorrect Answer: C\n</output_format>\n```",
    "question": "In 2008, S.M. Entertainment formed the South Korean boy group Shinee, which consists of five members. One of these members is a singer and actor born in Gwangmyeong, Gyeonggi-do, discovered at the 2006 S.M. Academy Casting. Which member is being described?",
    "choices": {
      "A": "Key",
      "B": "Minho",
      "C": "Onew",
      "D": "Taemin"
    },
    "answer": "C",
    "explanation": "The text explicitly states that Lee Jin-ki, known as Onew, was born in Gwangmyeong, Gyeonggi-do, discovered at the 2006 S.M. Academy Casting, and debuted as a member of Shinee in 2008.",
    "answer_correctness_score": 10,
    "explanation_validity_score": 10,
    "question_clarity_score": 8,
    "question_difficulty_score": 6,
    "question_groundedness_score": 10,
    "question_token_count": 65,
    "reformat_question_cosine_similarity_to_orig": 0.9177683591842651,
    "reformat_answer_cosine_similarity_to_orig": 1.000000238418579,
    "reformat_question_similarity_score": 9,
    "reformat_answer_similarity_score": 10,
    "avg_answer_token_count": 2
  },
  {
    "orig_question": "Bob Scucci was the former Assistant Race and Sports Book Manager at what casino resort located on 63 acres along the Las Vegas Strip?",
    "orig_answer": "Stardust Resort and Casino",
    "context": "[PAR] [TLE] Bob Scucci [SEP] Robert \"Bob\" Scucci is the Director of Race and Sports for Boyd Gaming Corp.  and was formerly the Assistant Race and Sports Book Manager at the Stardust Resort and Casino. [PAR] [TLE] Stardust Resort and Casino [SEP] The Stardust Resort and Casino was a casino resort located on 63 acres (25 ha) along the Las Vegas Strip in Winchester, Nevada.",
    "response": "```xml\n<document_analysis>\nThoughtful Content Examination: The context provides information about Bob Scucci's career and the Stardust Resort and Casino. The core relationship is Scucci's former role at the Stardust.\nConcept Exploration: This is a factual recall question. It tests the ability to remember a specific detail about a person's employment history and a location's characteristics.\nStrategic Complexity Calibration: Difficulty: 3/10. It's a straightforward recall question. However, it can be made more challenging by introducing plausible distractors.\nIntentional Question Planning: The question will be rephrased to include more details about the Stardust to make the question more challenging, and the answer options will be constructed to test precise recall of the casino's name.\n</document_analysis>\n<output_format>\nQuestion: Robert \"Bob\" Scucci held the position of Assistant Race and Sports Book Manager at a casino resort known for its 63-acre footprint situated along the Las Vegas Strip. Which of the following establishments represents this casino resort?\nA: Caesars Palace\nB: The Bellagio\nC: Stardust Resort and Casino\nD: The Mirage\nExplanation: The text explicitly states that Bob Scucci was formerly the Assistant Race and Sports Book Manager at the Stardust Resort and Casino, which was located on 63 acres along the Las Vegas Strip.\nCorrect Answer: C\n</output_format>\n```",
    "question": "Robert \"Bob\" Scucci held the position of Assistant Race and Sports Book Manager at a casino resort known for its 63-acre footprint situated along the Las Vegas Strip. Which of the following establishments represents this casino resort?",
    "choices": {
      "A": "Caesars Palace",
      "B": "The Bellagio",
      "C": "Stardust Resort and Casino",
      "D": "The Mirage"
    },
    "answer": "C",
    "explanation": "The text explicitly states that Bob Scucci was formerly the Assistant Race and Sports Book Manager at the Stardust Resort and Casino, which was located on 63 acres along the Las Vegas Strip.",
    "answer_correctness_score": 10,
    "explanation_validity_score": 10,
    "question_clarity_score": 6,
    "question_difficulty_score": 2,
    "question_groundedness_score": 10,
    "question_token_count": 45,
    "reformat_question_cosine_similarity_to_orig": 0.9095757007598877,
    "reformat_answer_cosine_similarity_to_orig": 1.0000001192092896,
    "reformat_question_similarity_score": 9,
    "reformat_answer_similarity_score": 10,
    "avg_answer_token_count": 5
  },
  {
    "orig_question": "What is the nationality of this retired professional footballer who was named as man of the match at 2001 Intercontinental Cup?",
    "orig_answer": "Ghanaian",
    "context": "[PAR] [TLE] 2001 Intercontinental Cup [SEP] The 2001 Intercontinental Cup was a football match played on 27 November 2001 between Bayern Munich, winners of the 2000\u201301 UEFA Champions League, and defending champions Boca Juniors, winners of the 2001 Copa Libertadores.  The match was played at the neutral venue of the National Stadium in Tokyo in front of 51,360 fans.  Samuel Kuffour was named as man of the match. [PAR] [TLE] Samuel Kuffour [SEP] Samuel Osei Kuffour (born 3 September 1976) is a Ghanaian retired professional footballer who played as a defender.",
    "response": "```xml\n<document_analysis>\n<thought_process>The context provides information about the 2001 Intercontinental Cup and Samuel Kuffour, a footballer who played in the match and was named man of the match. The question asks for Kuffour's nationality. The answer is directly stated in the text. The question can be made more challenging by framing it as a multiple-choice question with plausible distractors.</thought_process>\n<complexity_assessment>Difficulty: 3/10. The information is directly available in the text, making it a relatively straightforward question. However, the context involves multiple pieces of information, requiring the test-taker to connect them.</complexity_assessment>\n<question_planning>I will rephrase the question to include more context and make it a multiple-choice question. The distractors will be other nationalities commonly associated with football players.</question_planning>\n</document_analysis>\n<output_format>\nQuestion: In the 2001 Intercontinental Cup, played between Bayern Munich and Boca Juniors at the National Stadium in Tokyo, Samuel Kuffour received the man of the match award.  Considering his career as a retired professional footballer and his recognition in this international competition, what is Samuel Kuffour\u2019s nationality?\nA: Brazilian\nB: Argentinian\nC: Ghanaian\nD: Italian\nExplanation: The text explicitly states that Samuel Osei Kuffour is a Ghanaian retired professional footballer. This is the correct answer.\nCorrect Answer: C\n</output_format>\n```",
    "question": "In the 2001 Intercontinental Cup, played between Bayern Munich and Boca Juniors at the National Stadium in Tokyo, Samuel Kuffour received the man of the match award.  Considering his career as a retired professional footballer and his recognition in this international competition, what is Samuel Kuffour\u2019s nationality?",
    "choices": {
      "A": "Brazilian",
      "B": "Argentinian",
      "C": "Ghanaian",
      "D": "Italian"
    },
    "answer": "C",
    "explanation": "The text explicitly states that Samuel Osei Kuffour is a Ghanaian retired professional footballer. This is the correct answer.",
    "answer_correctness_score": 10,
    "explanation_validity_score": 10,
    "question_clarity_score": 1,
    "question_difficulty_score": 2,
    "question_groundedness_score": 10,
    "question_token_count": 63,
    "reformat_question_cosine_similarity_to_orig": 0.6996621489524841,
    "reformat_answer_cosine_similarity_to_orig": 0.9999999403953552,
    "reformat_question_similarity_score": 9,
    "reformat_answer_similarity_score": 10,
    "avg_answer_token_count": 3
  },
  {
    "orig_question": "Tinker Owens was the younger brother of what running back from the 1970s?",
    "orig_answer": "Loren Everett \"Steve\" Owens",
    "context": "[PAR] [TLE] Tinker Owens [SEP] Charles Wayne \"Tinker\" Owens is a former professional American football player who played wide receiver for four seasons for the New Orleans Saints (1976, 1978\u20131980) in the National Football League.  The younger brother of Heisman Trophy winner Steve Owens, Tinker was a two-time All-American (1974, 1975) during his college career at Oklahoma. [PAR] [TLE] Steve Owens (American football) [SEP] Loren Everett \"Steve\" Owens (born December 9, 1947) is a former football player, a running back in the National Football League (NFL) for five seasons in the early 1970s.",
    "response": "```xml\n<document_analysis>\nThoughtful Content Examination: The context provides biographical information on two football players, Tinker Owens and Steve Owens, establishing a familial relationship between them. The question focuses on identifying Steve Owens' profession and timeframe.\n\nConcept Exploration: The text highlights the achievements of both players \u2013 Tinker as a wide receiver and Steve as a running back \u2013 and their respective careers in the NFL. It also notes Steve Owens being a Heisman Trophy winner.\n\nStrategic Complexity Calibration: Difficulty: 4/10. The question directly tests recall of a stated relationship, but requires understanding the context to identify Steve Owens' role.\n\nIntentional Question Planning: The question aims to assess understanding of the familial connection between the two athletes and Steve Owens' position. It is a straightforward factual question but requires careful reading of the context.\n</document_analysis>\n<output_format>\nQuestion: Charles Wayne \"Tinker\" Owens, a former wide receiver for the New Orleans Saints and a two-time All-American during his college career at Oklahoma, is the younger brother of which Heisman Trophy winner and running back who played in the National Football League during the early 1970s?\nA: Jim Brown\nB: Loren Everett \"Steve\" Owens\nC: Walter Payton\nD: O.J. Simpson\nExplanation: The provided text explicitly states that Tinker Owens is the younger brother of Loren Everett \"Steve\" Owens, who was a running back in the NFL during the early 1970s and a Heisman Trophy winner.\nCorrect Answer: B\n</output_format>\n```",
    "question": "Charles Wayne \"Tinker\" Owens, a former wide receiver for the New Orleans Saints and a two-time All-American during his college career at Oklahoma, is the younger brother of which Heisman Trophy winner and running back who played in the National Football League during the early 1970s?",
    "choices": {
      "A": "Jim Brown",
      "B": "Loren Everett \"Steve\" Owens",
      "C": "Walter Payton",
      "D": "O.J. Simpson"
    },
    "answer": "B",
    "explanation": "The provided text explicitly states that Tinker Owens is the younger brother of Loren Everett \"Steve\" Owens, who was a running back in the NFL during the early 1970s and a Heisman Trophy winner.",
    "answer_correctness_score": 10,
    "explanation_validity_score": 10,
    "question_clarity_score": 8,
    "question_difficulty_score": 6,
    "question_groundedness_score": 10,
    "question_token_count": 59,
    "reformat_question_cosine_similarity_to_orig": 0.7702516913414001,
    "reformat_answer_cosine_similarity_to_orig": 1.000000238418579,
    "reformat_question_similarity_score": 9,
    "reformat_answer_similarity_score": 10,
    "avg_answer_token_count": 5
  },
  {
    "orig_question": "The plaintiff of Paul v. Clinton was convicted for business dealing with whom?",
    "orig_answer": "Stan Lee",
    "context": "[PAR] [TLE] Paul v. Clinton [SEP] Paul v. Clinton was a civil suit filed in 2004 held in Los Angeles County Superior Court.  The plaintiff, Peter F. Paul, alleged that President Bill Clinton and his wife, First Lady Hillary Clinton, deceived him into paying for the Gala Hollywood Farewell Salute to President Clinton, during Hillary Clinton's first Senate race in 2000, by making a promise that the President would work for Paul's company, Stan Lee Media, after his presidential term was over.  Paul alleged that the President broke his promise and stole his business partner, causing his business to crumble and, further, that his contributions to Hillary Clinton's campaign were falsely reported to the Federal Election Commission.  Besides the Clintons, three other individuals who were involved in fundraising for the gala, were named as defendants in the suit. [PAR] [TLE] Peter F. Paul [SEP] Peter Franklin Paul (born September 2, 1948) is a former lawyer and entrepreneur who was convicted for conspiracy and drug dealing, and later for securities fraud in connection with his business dealings with \"Spider-Man\" co-creator Stan Lee.  He has repeatedly brought suit against Hillary Clinton, accusing her of lying about donations he solicited on behalf of her 2000 senatorial campaign.",
    "response": "```xml\n<document_analysis>\n<thought_process>The context provides information about the lawsuit *Paul v. Clinton* and the plaintiff, Peter F. Paul. It states Paul was convicted of securities fraud in connection with his business dealings with Stan Lee. This forms the basis for a factual recall question. The question should be phrased to require specific knowledge of the context, not general knowledge about Stan Lee or Peter Paul. The question and answers must be self-contained. The question should be rephrased to be more detailed and less direct.</thought_process>\n<complexity_rating>4</complexity_rating>\n<question_type>Factual</question_type>\n</document_analysis>\n<output_format>\nQuestion: In the civil suit *Paul v. Clinton*, the plaintiff, Peter F. Paul, brought allegations against President Bill Clinton and First Lady Hillary Clinton. Prior to this legal action, Paul had a prior criminal record related to business activities. Specifically, what individual, renowned for co-creating the comic book character \"Spider-Man,\" was involved in the business dealings that led to Paul\u2019s conviction for securities fraud?\nA: Bill Clinton\nB: Stan Lee\nC: Hillary Clinton\nD: Peter Franklin Paul\nExplanation: The text states, \"He [Peter F. Paul] has repeatedly brought suit against Hillary Clinton, accusing her of lying about donations he solicited on behalf of her 2000 senatorial campaign\" and \"Peter Franklin Paul (born September 2, 1948) is a former lawyer and entrepreneur who was convicted for conspiracy and drug dealing, and later for securities fraud in connection with his business dealings with 'Spider-Man' co-creator Stan Lee.\"\nCorrect Answer: B\n</output_format>\n```",
    "question": "In the civil suit *Paul v. Clinton*, the plaintiff, Peter F. Paul, brought allegations against President Bill Clinton and First Lady Hillary Clinton. Prior to this legal action, Paul had a prior criminal record related to business activities. Specifically, what individual, renowned for co-creating the comic book character \"Spider-Man,\" was involved in the business dealings that led to Paul\u2019s conviction for securities fraud?",
    "choices": {
      "A": "Bill Clinton",
      "B": "Stan Lee",
      "C": "Hillary Clinton",
      "D": "Peter Franklin Paul"
    },
    "answer": "B",
    "explanation": "The text states, \"He [Peter F. Paul] has repeatedly brought suit against Hillary Clinton, accusing her of lying about donations he solicited on behalf of her 2000 senatorial campaign\" and \"Peter Franklin Paul (born September 2, 1948) is a former lawyer and entrepreneur who was convicted for conspiracy and drug dealing, and later for securities fraud in connection with his business dealings with 'Spider-Man' co-creator Stan Lee.\"",
    "answer_correctness_score": 10,
    "explanation_validity_score": 10,
    "question_clarity_score": 8,
    "question_difficulty_score": 6,
    "question_groundedness_score": 10,
    "question_token_count": 83,
    "reformat_question_cosine_similarity_to_orig": 0.7479832172393799,
    "reformat_answer_cosine_similarity_to_orig": 0.9999998807907104,
    "reformat_question_similarity_score": 9,
    "reformat_answer_similarity_score": 10,
    "avg_answer_token_count": 3
  },
  {
    "orig_question": "In addition to Eric Hilton, who else founded the record label ESL Music?",
    "orig_answer": "Rob Garza",
    "context": "[PAR] [TLE] Eric Hilton [SEP] Eric Michael Hilton (July 1, 1933 \u2013 December 10, 2016) was an American heir, hotelier, and philanthropist. [PAR] [TLE] ESL Music [SEP] Eighteenth Street Lounge Music (ESL Music) is an independent record label based in Washington, D.C. founded by Rob Garza and Eric Hilton in 1996.  The duo, as Thievery Corporation, heads the label's roster of artists.",
    "response": "```xml\n<document_analysis>\n<thought_process>The context provides a concise overview of Eric Hilton and the record label ESL Music. The question directly asks about the co-founder of ESL Music, and the context clearly states that Rob Garza and Eric Hilton founded the label in 1996. This is a straightforward factual recall question, but it can be made more challenging by providing plausible distractors. Difficulty: 3/10. I will rephrase the question to be more detailed and include the year the label was founded.</thought_process>\n</document_analysis>\n<output_format>\nQuestion: In 1996, Eric Hilton co-founded the independent record label Eighteenth Street Lounge Music (ESL Music) based in Washington, D.C. Alongside Eric Hilton, which individual also established this label?\nA: Jack Johnson\nB: Rob Garza\nC: Dave Grohl\nD: Trent Reznor\nExplanation: The text explicitly states that ESL Music was founded by Rob Garza and Eric Hilton in 1996.\nCorrect Answer: B\n</output_format>\n```",
    "question": "In 1996, Eric Hilton co-founded the independent record label Eighteenth Street Lounge Music (ESL Music) based in Washington, D.C. Alongside Eric Hilton, which individual also established this label?",
    "choices": {
      "A": "Jack Johnson",
      "B": "Rob Garza",
      "C": "Dave Grohl",
      "D": "Trent Reznor"
    },
    "answer": "B",
    "explanation": "The text explicitly states that ESL Music was founded by Rob Garza and Eric Hilton in 1996.",
    "answer_correctness_score": 10,
    "explanation_validity_score": 10,
    "question_clarity_score": 9,
    "question_difficulty_score": 6,
    "question_groundedness_score": 10,
    "question_token_count": 44,
    "reformat_question_cosine_similarity_to_orig": 0.6883260011672974,
    "reformat_answer_cosine_similarity_to_orig": 1.0000003576278687,
    "reformat_question_similarity_score": 9,
    "reformat_answer_similarity_score": 10,
    "avg_answer_token_count": 4
  },
  {
    "orig_question": "Barry Keoghan appeared in a 2017 psychological horror-thriller film selected for competition at what festival?",
    "orig_answer": "Cannes Film Festival",
    "context": "[PAR] [TLE] The Killing of a Sacred Deer [SEP] The Killing of a Sacred Deer is a 2017 psychological horror-thriller film directed by Yorgos Lanthimos, from a screenplay by Lanthimos and Efthymis Filippou.  It stars Colin Farrell and Nicole Kidman.  It was selected to compete for the Palme d'Or in the main competition section at the 2017 Cannes Film Festival.  At Cannes, Lanthimos and Filippou won the Best Screenplay award.  The film is scheduled to be released in the United States on October 20, 2017, by A24, before being released in the United Kingdom on November 17, 2017, by Curzon Artificial Eye. [PAR] [TLE] Barry Keoghan [SEP] Barry Keoghan (born 18 October 1992) is an Irish actor.  He has appeared in the films \"Dunkirk\" along with Mark Rylance, Tom Hardy, Cillian Murphy, Kenneth Branagh, Tom Glynn-Carney; \"The Killing of a Sacred Deer\" with Nicole Kidman, Colin Farrell and Alicia Silverstone; and \"Trespass Against Us\" with Michael Fassbender and Brendan Gleeson.  He has also played the \"heartless cat killer\" Wayne in the RT\u00c9 drama \"Love/Hate\".",
    "response": "```xml\n<document_analysis>\nThoughtful Content Examination: The context provides information about the film \"The Killing of a Sacred Deer\" and the actor Barry Keoghan. It states that the film was selected to compete for the Palme d'Or at the 2017 Cannes Film Festival, and that Keoghan appeared in the film. \nConcept Exploration: The question tests the ability to connect information about a film and an actor. It requires recall of details about the film's festival selection.\nStrategic Complexity Calibration: Difficulty: 6/10. The information is directly stated in the text, but requires linking two pieces of information.\nIntentional Question Planning: The question focuses on a specific detail about the film's recognition and Keoghan's involvement, requiring the test taker to demonstrate understanding of both the film and the actor's work.\n</document_analysis>\n<output_format>\nQuestion: In 2017, Barry Keoghan starred in Yorgos Lanthimos\u2019s psychological horror-thriller, \"The Killing of a Sacred Deer,\" which received critical acclaim and was chosen to compete for a prestigious award. Which international film festival served as the venue for this competition?\nA: Venice Film Festival\nB: Berlin International Film Festival\nC: Cannes Film Festival\nD: Toronto International Film Festival\nExplanation: The text explicitly states that \u201cThe Killing of a Sacred Deer\u201d was selected to compete for the Palme d'Or in the main competition section at the 2017 Cannes Film Festival.\nCorrect Answer: C\n</output_format>\n```",
    "question": "In 2017, Barry Keoghan starred in Yorgos Lanthimos\u2019s psychological horror-thriller, \"The Killing of a Sacred Deer,\" which received critical acclaim and was chosen to compete for a prestigious award. Which international film festival served as the venue for this competition?",
    "choices": {
      "A": "Venice Film Festival",
      "B": "Berlin International Film Festival",
      "C": "Cannes Film Festival",
      "D": "Toronto International Film Festival"
    },
    "answer": "C",
    "explanation": "The text explicitly states that \u201cThe Killing of a Sacred Deer\u201d was selected to compete for the Palme d'Or in the main competition section at the 2017 Cannes Film Festival.",
    "answer_correctness_score": 10,
    "explanation_validity_score": 10,
    "question_clarity_score": 6,
    "question_difficulty_score": 6,
    "question_groundedness_score": 9,
    "question_token_count": 60,
    "reformat_question_cosine_similarity_to_orig": 0.6647798418998718,
    "reformat_answer_cosine_similarity_to_orig": 1.0000001192092896,
    "reformat_question_similarity_score": 9,
    "reformat_answer_similarity_score": 10,
    "avg_answer_token_count": 5
  },
  {
    "orig_question": "What top prospect born in 1992 was introduced the same day as the official team mascot of Major League Baseball's Chicago Cubs?",
    "orig_answer": "Kristopher Lee Bryant",
    "context": "[PAR] [TLE] Kris Bryant [SEP] Kristopher Lee Bryant (born January 4, 1992) is an American professional baseball third baseman for the Chicago Cubs of Major League Baseball (MLB).  Bryant attended the University of San Diego, where he played college baseball for the Toreros, and won the Dick Howser Trophy and Golden Spikes Award his junior year in 2013.  The Cubs selected him number-two overall in the 2013 MLB draft and he quickly became one of the top prospects in baseball.  Bryant made his major league debut in 2015 and won the National League Rookie of the Year Award.  He won a World Series championship with the Cubs in , and was named the National League Most Valuable Player. [PAR] [TLE] Clark (mascot) [SEP] Clark is the official team mascot of Major League Baseball's Chicago Cubs.  He was announced on January 13, 2014 as the first official mascot in the modern history of the Cubs franchise.  He was introduced that day at the Advocate Illinois Masonic Medical Center's pediatric developmental center along with some of the Cubs' top prospects such as number one draft pick Kris Bryant and Albert Almora, Jorge Soler, Mike Olt and Eric Jokisch.  Over a dozen Cubs prospects were attending the Cubs' Rookie Development Program that week.  The Cubs become the 27th team in Major League Baseball to have a mascot, leaving the Los Angeles Angels, Los Angeles Dodgers and New York Yankees as the remaining franchises without mascots.  According to the Cubs' press release, Clark is a response to fan demands (expressed via surveys and interviews) for more kid-friendly elements at Wrigley Field Cubs games to keep pace with games in other cities that have more to offer youth fans.",
    "response": "```xml\n<document_analysis>\nThoughtful Content Examination: The context provides information about Kris Bryant and the Cubs' mascot, Clark. The question asks about a prospect introduced with the mascot. The answer is directly stated in the context.\n\nConcept Exploration: The question tests recall of details regarding the introduction of the Cubs' mascot and a prominent player. It requires understanding the connection between the two events.\n\nStrategic Complexity Calibration: Difficulty: 4/10. This is a factual recall question, but requires reading comprehension to connect the two pieces of information.\n\nIntentional Question Planning: The question is designed to assess if the reader can extract specific details from the text and understand the context of events.\n</document_analysis>\n<output_format>\nQuestion: On January 13, 2014, the Chicago Cubs announced their first official mascot in modern franchise history, named Clark, and introduced him alongside several of the team\u2019s top prospects at the Advocate Illinois Masonic Medical Center\u2019s pediatric developmental center. Considering this event, which American professional baseball third baseman, born on January 4, 1992, was among those prospects presented with the new mascot?\nA: Albert Almora\nB: Jorge Soler\nC: Kristopher Lee Bryant\nD: Mike Olt\nExplanation: The text states that Clark was introduced with several Cubs prospects, including Kris Bryant.\nCorrect Answer: C\n</output_format>\n```",
    "question": "On January 13, 2014, the Chicago Cubs announced their first official mascot in modern franchise history, named Clark, and introduced him alongside several of the team\u2019s top prospects at the Advocate Illinois Masonic Medical Center\u2019s pediatric developmental center. Considering this event, which American professional baseball third baseman, born on January 4, 1992, was among those prospects presented with the new mascot?",
    "choices": {
      "A": "Albert Almora",
      "B": "Jorge Soler",
      "C": "Kristopher Lee Bryant",
      "D": "Mike Olt"
    },
    "answer": "C",
    "explanation": "The text states that Clark was introduced with several Cubs prospects, including Kris Bryant.",
    "answer_correctness_score": 10,
    "explanation_validity_score": 10,
    "question_clarity_score": 6,
    "question_difficulty_score": 7,
    "question_groundedness_score": 10,
    "question_token_count": 84,
    "reformat_question_cosine_similarity_to_orig": 0.7625095844268799,
    "reformat_answer_cosine_similarity_to_orig": 0.9999997615814209,
    "reformat_question_similarity_score": 9,
    "reformat_answer_similarity_score": 10,
    "avg_answer_token_count": 4
  },
  {
    "orig_question": "ECI was established by Ben Affleck and another who if the daughter of who?",
    "orig_answer": "former Congressman Pat Williams and former Montana Senate Majority Leader Carol Williams",
    "context": "[PAR] [TLE] Eastern Congo Initiative [SEP] The Eastern Congo Initiative (ECI) is an American nonprofit organization established by Ben Affleck and Whitney Williams in 2010 as \"the first U.S. based advocacy and grant-making initiative wholly focused on working with and for the people of eastern Congo\".  ECI provides development grants and international advocacy for community-building initiatives in the Democratic Republic of Congo. [PAR] [TLE] Whitney Williams [SEP] Whitney Williams is an American businesswoman and philanthropist, currently serving as Vice-Chair of the board for Eastern Congo Initiative and Founder + CEO of the Seattle-based consultancy williamsworks.  She is the daughter of former Congressman Pat Williams and former Montana Senate Majority Leader Carol Williams. \" The Washington Post\" has referred to the Williams family as the \u201cfirst family of Montana politics.\u201d  Her brother is artist Griff Williams.",
    "response": "```xml\n<document_analysis>\nThoughtful Content Examination: The context provides information about the Eastern Congo Initiative (ECI) and Whitney Williams. It states ECI was founded by Ben Affleck and Whitney Williams and details Whitney Williams' background, including her parents' political careers.\nConcept Exploration: The question asks for the founders of ECI and then seeks to identify the parentage of one of the founders, Whitney Williams. This tests recall of specific details within the provided text.\nStrategic Complexity Calibration: Difficulty: 6/10. The question requires recalling two pieces of information: the co-founder's name and their parents' identities. It's not overly complex but requires careful reading.\nIntentional Question Planning: The question combines two related facts to assess comprehension and memory. It encourages the test-taker to integrate information from different parts of the text.\n</document_analysis>\n<output_format>\nQuestion: The Eastern Congo Initiative (ECI), an American nonprofit focused on community-building initiatives in the Democratic Republic of Congo, was co-founded by actor Ben Affleck and Whitney Williams. Whitney Williams currently serves as Vice-Chair of the ECI board and is the founder of williamsworks, a Seattle-based consultancy. Considering her family's prominent role in Montana politics, who are the parents of Whitney Williams?\nA: Former Governor of Montana, Mark Racicot, and former State Representative, Nancy Balaban.\nB: Former Congressman Pat Williams and former Montana Senate Majority Leader Carol Williams.\nC: Former Senator Max Baucus and former Governor Judith Ann Baucus.\nD: Former Mayor of Seattle, Greg Nickels, and former City Councilmember, Margaret Nickels.\nExplanation: The text explicitly states that Whitney Williams is the daughter of former Congressman Pat Williams and former Montana Senate Majority Leader Carol Williams.\nCorrect Answer: B\n</output_format>\n```",
    "question": "The Eastern Congo Initiative (ECI), an American nonprofit focused on community-building initiatives in the Democratic Republic of Congo, was co-founded by actor Ben Affleck and Whitney Williams. Whitney Williams currently serves as Vice-Chair of the ECI board and is the founder of williamsworks, a Seattle-based consultancy. Considering her family's prominent role in Montana politics, who are the parents of Whitney Williams?",
    "choices": {
      "A": "Former Governor of Montana, Mark Racicot, and former State Representative, Nancy Balaban.",
      "B": "Former Congressman Pat Williams and former Montana Senate Majority Leader Carol Williams.",
      "C": "Former Senator Max Baucus and former Governor Judith Ann Baucus.",
      "D": "Former Mayor of Seattle, Greg Nickels, and former City Councilmember, Margaret Nickels."
    },
    "answer": "B",
    "explanation": "The text explicitly states that Whitney Williams is the daughter of former Congressman Pat Williams and former Montana Senate Majority Leader Carol Williams.",
    "answer_correctness_score": 10,
    "explanation_validity_score": 10,
    "question_clarity_score": 6,
    "question_difficulty_score": 2,
    "question_groundedness_score": 10,
    "question_token_count": 82,
    "reformat_question_cosine_similarity_to_orig": 0.5782812833786011,
    "reformat_answer_cosine_similarity_to_orig": 0.9611501097679138,
    "reformat_question_similarity_score": 9,
    "reformat_answer_similarity_score": 10,
    "avg_answer_token_count": 17
  },
  {
    "orig_question": "The captain of the Netherlands national footballer team helped win against what team  at the 2010 DFB-Pokal Final?",
    "orig_answer": "Werder Bremen",
    "context": "[PAR] [TLE] 2010 DFB-Pokal Final [SEP] The 2009\u201310 DFB-Pokal season came to a close on 15 May 2010 when Bayern Munich played defending champions Werder Bremen at the Olympiastadion in Berlin.  Bayern thrashed Bremen 4-0 with goals from Robben, Oli\u0107, Rib\u00e9ry, and Schweinsteiger.  The title capped off a successful season, with Bayern winning the domestic double of the Fu\u00dfball-Bundesliga and the DFB-Pokal.  These successes were Bayern's 22nd league and 15th cup titles.  Bayern were also in line for \"The Treble\" but lost to Internazionale of Milan, 2-0 in the Champions League Final at Madrid's Santiago Bernab\u00e9u Stadium on 22 May. [PAR] [TLE] Arjen Robben [SEP] Arjen Robben (] ; born 23 January 1984) is a Dutch professional footballer who plays for German club Bayern Munich and is the captain of the Netherlands national team.  He is a forward who usually plays as a left or right sided winger, known for his dribbling skills, speed, crossing ability and his accurate left foot long-range shots from the right wing.",
    "response": "```xml\n<document_analysis>\nThoughtful Content Examination: The context provides information about the 2010 DFB-Pokal Final, where Bayern Munich defeated Werder Bremen 4-0. It also introduces Arjen Robben, a player for Bayern Munich and the captain of the Netherlands national team. The question asks which team Robben helped defeat in the 2010 DFB-Pokal Final.\n\nConcept Exploration: The question requires connecting Robben's role as a player for Bayern Munich with the outcome of the DFB-Pokal Final. It tests recall of specific details from the text.\n\nStrategic Complexity Calibration: Difficulty: 6/10. The question is relatively straightforward, as the answer is explicitly stated in the text. However, it requires integrating information from two parts of the provided context.\n\nIntentional Question Planning: The question is designed to assess understanding of the event and the player's involvement. It's a factual recall question with a slight inferential component (connecting Robben to Bayern Munich's victory).\n</document_analysis>\n<output_format>\nQuestion: Arjen Robben, the captain of the Netherlands national team and a forward known for his dribbling skills, speed, and accurate long-range shots, was a key player for Bayern Munich in the 2010 DFB-Pokal Final held at the Olympiastadion in Berlin. Bayern Munich secured a decisive victory in this match. Against which team did Bayern Munich triumph, with Robben contributing to a 4-0 scoreline?\nA: Internazionale of Milan\nB: Werder Bremen\nC: Real Madrid\nD: Borussia Dortmund\nExplanation: The text states that Bayern Munich played and defeated Werder Bremen 4-0 in the 2010 DFB-Pokal Final. Arjen Robben was a player for Bayern Munich during this match.\nCorrect Answer: B\n</output_format>\n```",
    "question": "Arjen Robben, the captain of the Netherlands national team and a forward known for his dribbling skills, speed, and accurate long-range shots, was a key player for Bayern Munich in the 2010 DFB-Pokal Final held at the Olympiastadion in Berlin. Bayern Munich secured a decisive victory in this match. Against which team did Bayern Munich triumph, with Robben contributing to a 4-0 scoreline?",
    "choices": {
      "A": "Internazionale of Milan",
      "B": "Werder Bremen",
      "C": "Real Madrid",
      "D": "Borussia Dortmund"
    },
    "answer": "B",
    "explanation": "The text states that Bayern Munich played and defeated Werder Bremen 4-0 in the 2010 DFB-Pokal Final. Arjen Robben was a player for Bayern Munich during this match.",
    "answer_correctness_score": 10,
    "explanation_validity_score": 10,
    "question_clarity_score": 8,
    "question_difficulty_score": 2,
    "question_groundedness_score": 10,
    "question_token_count": 90,
    "reformat_question_cosine_similarity_to_orig": 0.7367022037506104,
    "reformat_answer_cosine_similarity_to_orig": 1.000000238418579,
    "reformat_question_similarity_score": 9,
    "reformat_answer_similarity_score": 10,
    "avg_answer_token_count": 4
  },
  {
    "orig_question": "What person does O'Farrell Community School and It Takes a Village have in common?",
    "orig_answer": "Hillary Clinton",
    "context": "[PAR] [TLE] It Takes a Village [SEP] It Takes a Village: And Other Lessons Children Teach Us is a book published in 1996 by First Lady of the United States Hillary Rodham Clinton.  In it, Clinton presents her vision for the children of America.  She focuses on the impact individuals and groups outside the family have, for better or worse, on a child's well-being, and advocates a society which meets all of a child's needs. [PAR] [TLE] O'Farrell Community School [SEP] O'Farrell Community School or The O'Farrell Charter School (CDE official name) commonly referred to as O'Farrell is a charter school in the Southeast San Diego neighborhood of Encanto serving grades K-12 in the K-12 American education system.  The school opened its doors in the San Diego Unified School District in 1959 with its name chosen in 1957 as Mabel E. O'Farrell Jr.  High.  It was voted to become a charter school in 1994.  President Bill Clinton made a visit to San Diego in 1995 to sign the \"Goals 2000\" education bill and to visit O'Farrell because it was charter.  It was also mentioned in Hillary Clinton's book It Takes a Village.  It has a code of conduct of how to become a good citizen called \"The Falcon Way\", of Focus, Attitude, Leadership Citizenship, Organization, and Non-Violience, that is indoctrinated per student.  Instead of being called principal, faculty and students refer to the educational leader as the \"Chief Educational Officer\" (CEO).  The large conspicuous mural in front of the school on the side of the Theatre was a tribute to a faculty member by the nickname \"Animal\" who died.  The mural was painted by students.",
    "response": "```xml\n<document_analysis>\nThoughtful Content Examination: The context provides information about Hillary Clinton's book \"It Takes a Village\" and O'Farrell Community School. It highlights that O'Farrell was mentioned in Clinton's book and that President Bill Clinton visited the school to sign an education bill. The core connection is Hillary Clinton.\n\nConcept Exploration: The question tests the ability to synthesize information from different parts of the provided text and identify a common element. It requires understanding the relationship between the book and the school.\n\nStrategic Complexity Calibration: Difficulty: 4/10. The question is relatively straightforward, but requires careful reading to identify the connection.\n\nIntentional Question Planning: The question is designed to assess comprehension of the provided text and the ability to make connections between different pieces of information.\n</document_analysis>\n<output_format>\nQuestion: In 1995, President Bill Clinton visited O'Farrell Community School in San Diego to sign the \"Goals 2000\" education bill and acknowledge its charter status. Considering this event and the content of Hillary Rodham Clinton\u2019s 1996 book, \u201cIt Takes a Village: And Other Lessons Children Teach Us\u201d, what individual serves as a common link between these two distinct entities?\nA: Bill Clinton\nB: Mabel E. O'Farrell Jr.\nC: Hillary Rodham Clinton\nD: The Chief Educational Officer of O'Farrell Community School\nExplanation: The text explicitly states that O'Farrell Community School was mentioned in Hillary Clinton's book, \"It Takes a Village,\" and President Bill Clinton visited the school. Therefore, Hillary Clinton is the common link.\nCorrect Answer: C\n</output_format>\n```",
    "question": "In 1995, President Bill Clinton visited O'Farrell Community School in San Diego to sign the \"Goals 2000\" education bill and acknowledge its charter status. Considering this event and the content of Hillary Rodham Clinton\u2019s 1996 book, \u201cIt Takes a Village: And Other Lessons Children Teach Us\u201d, what individual serves as a common link between these two distinct entities?",
    "choices": {
      "A": "Bill Clinton",
      "B": "Mabel E. O'Farrell Jr.",
      "C": "Hillary Rodham Clinton",
      "D": "The Chief Educational Officer of O'Farrell Community School"
    },
    "answer": "C",
    "explanation": "The text explicitly states that O'Farrell Community School was mentioned in Hillary Clinton's book, \"It Takes a Village,\" and President Bill Clinton visited the school. Therefore, Hillary Clinton is the common link.",
    "answer_correctness_score": 10,
    "explanation_validity_score": 10,
    "question_clarity_score": 6,
    "question_difficulty_score": 7,
    "question_groundedness_score": 5,
    "question_token_count": 79,
    "reformat_question_cosine_similarity_to_orig": 0.5502888560295105,
    "reformat_answer_cosine_similarity_to_orig": 0.8174120783805847,
    "reformat_question_similarity_score": 9,
    "reformat_answer_similarity_score": 10,
    "avg_answer_token_count": 8
  },
  {
    "orig_question": "The 2011 Major League Soccer All-Star Game, held on July 27, 2011, was the 16th annual Major League Soccer All-Star Game, Manchester United won the game 4\u20130 with goals from players, including Daniel Nii Tackie Mensah Welbeck, an English professional footballer who plays for which organization, club Arsenal and the England national team?",
    "orig_answer": "Premier League",
    "context": "[PAR] [TLE] Danny Welbeck [SEP] Daniel Nii Tackie Mensah Welbeck (born 26 November 1990) is an English professional footballer who plays for Premier League club Arsenal and the England national team.  He primarily plays as a forward but can also play as a winger. [PAR] [TLE] 2011 MLS All-Star Game [SEP] The 2011 Major League Soccer All-Star Game, held on July 27, 2011, was the 16th annual Major League Soccer All-Star Game, a soccer match involving all-stars from Major League Soccer.  The MLS All-Stars faced Manchester United of the English Premier League for the second year running in the eighth MLS All-Star Game to feature international opposition.  Manchester United won the game 4\u20130 with goals from Anderson, Park Ji-Sung, Dimitar Berbatov and Danny Welbeck.",
    "response": "```xml\n<document_analysis>\nThoughtful Content Examination: The context provides information about Danny Welbeck, an English professional footballer, and his participation in the 2011 MLS All-Star Game where he scored for Manchester United. The question accurately reflects this information but is somewhat awkwardly phrased. It combines details from both parts of the context.\n\nConcept Exploration: The question tests recall of Welbeck's professional affiliation. It requires understanding that Welbeck plays for both a club (Arsenal) and a national team (England) and that he was playing for Manchester United during the 2011 MLS All-Star Game.\n\nStrategic Complexity Calibration: Difficulty: 6/10. The question isn't overly difficult, but it requires combining information from different sentences.\n\nIntentional Question Planning: The question will be rephrased to focus specifically on Welbeck's involvement in the 2011 MLS All-Star Game and his team affiliation at that time, making it more concise and directly testable. The answer options will be designed to be plausible but distinct, requiring careful consideration.\n</document_analysis>\n<output_format>\nQuestion: In the 2011 Major League Soccer All-Star Game, Danny Welbeck scored a goal for which English Premier League team in their 4-0 victory over the MLS All-Stars?\nA: Arsenal\nB: Manchester United\nC: Liverpool\nD: Chelsea\nExplanation: The text states that \"Manchester United won the game 4\u20130 with goals from Anderson, Park Ji-Sung, Dimitar Berbatov and Danny Welbeck.\"\nCorrect Answer: B\n</output_format>\n```",
    "question": "In the 2011 Major League Soccer All-Star Game, Danny Welbeck scored a goal for which English Premier League team in their 4-0 victory over the MLS All-Stars?",
    "choices": {
      "A": "Arsenal",
      "B": "Manchester United",
      "C": "Liverpool",
      "D": "Chelsea"
    },
    "answer": "B",
    "explanation": "The text states that \"Manchester United won the game 4\u20130 with goals from Anderson, Park Ji-Sung, Dimitar Berbatov and Danny Welbeck.\"",
    "answer_correctness_score": 10,
    "explanation_validity_score": 10,
    "question_clarity_score": 8,
    "question_difficulty_score": 4,
    "question_groundedness_score": 10,
    "question_token_count": 39,
    "reformat_question_cosine_similarity_to_orig": 0.7321668863296509,
    "reformat_answer_cosine_similarity_to_orig": 0.658019483089447,
    "reformat_question_similarity_score": 8,
    "reformat_answer_similarity_score": 6,
    "avg_answer_token_count": 2
  },
  {
    "orig_question": "In 2015, Matt Stone listed this episode of South Park as his third favorite that used a screen-capturing program for what operating system?",
    "orig_answer": "macOS",
    "context": "[PAR] [TLE] Snapz Pro X [SEP] Snapz Pro X is a utility program for macOS developed by Ambrosia Software.  It is designed to record movie-like screenshots of a computer monitor doing various actions, such as a user moving their mouse across the screen, clicking on desktop icons, typing text, et cetera.  It has been used commercially in the production of books, such as O'Reilly Media's series, \"The Missing Manual,\" and others.  The program was also used by South Park to create the Make Love, Not Warcraft episode. [PAR] [TLE] Make Love, Not Warcraft [SEP] \"Make Love, Not Warcraft\" is the eighth episode in the tenth season of the American animated television series \"South Park\".  The 147th episode overall, it first aired on Comedy Central in the United States on October 4, 2006.  In the episode, Cartman, Kyle, Stan, and Kenny enjoy playing the popular massively multiplayer online role-playing game \"World of Warcraft\".  When a high level player goes around killing other players in the game, they start playing the game every day to try to stop him.  The episode was written and directed by series co-creator Trey Parker.  In 2015, he and co-creator Matt Stone listed it as their third favorite episode of the series.",
    "response": "```xml\n<document_analysis>\nThoughtful Content Examination: The context provides information about Snapz Pro X, a screen-capturing utility for macOS, and the South Park episode \"Make Love, Not Warcraft,\" which utilized this software. The question focuses on a specific detail \u2013 Matt Stone's favorite episode and the operating system associated with the screen-capturing program used in its creation.\n\nConcept Exploration: The connection between the software, the television episode, and the creators' preferences highlights the practical applications of screen-capturing technology in media production. It also demonstrates how specific tools can become integral to creative processes.\n\nStrategic Complexity Calibration: Difficulty: 7/10. This question requires recalling details from both sections of the context and making a connection between them. It\u2019s not a simple fact retrieval but demands understanding of how the tools were used.\n\nIntentional Question Planning: The question aims to test the candidate's ability to synthesize information from different parts of the provided text and recall a specific detail regarding the software's association with the South Park episode and the creators\u2019 preferences.\n</document_analysis>\n<output_format>\nQuestion: The South Park episode \u201cMake Love, Not Warcraft\u201d was created using screenshots captured with Snapz Pro X, a utility program designed to record movie-like screenshots of actions on a computer monitor. In 2015, South Park co-creator Matt Stone identified this episode as one of his favorites. What operating system is Snapz Pro X designed for?\nA: Windows\nB: Linux\nC: macOS\nD: Android\nExplanation: The text explicitly states that Snapz Pro X is a utility program for macOS. This is a direct recall of information provided in the context.\nCorrect Answer: C\n</output_format>\n```",
    "question": "The South Park episode \u201cMake Love, Not Warcraft\u201d was created using screenshots captured with Snapz Pro X, a utility program designed to record movie-like screenshots of actions on a computer monitor. In 2015, South Park co-creator Matt Stone identified this episode as one of his favorites. What operating system is Snapz Pro X designed for?",
    "choices": {
      "A": "Windows",
      "B": "Linux",
      "C": "macOS",
      "D": "Android"
    },
    "answer": "C",
    "explanation": "The text explicitly states that Snapz Pro X is a utility program for macOS. This is a direct recall of information provided in the context.",
    "answer_correctness_score": 10,
    "explanation_validity_score": 10,
    "question_clarity_score": 6,
    "question_difficulty_score": 4,
    "question_groundedness_score": 10,
    "question_token_count": 71,
    "reformat_question_cosine_similarity_to_orig": 0.7237638235092163,
    "reformat_answer_cosine_similarity_to_orig": 0.9999999403953552,
    "reformat_question_similarity_score": 9,
    "reformat_answer_similarity_score": 10,
    "avg_answer_token_count": 2
  },
  {
    "orig_question": "Which daughter of King Lear does Edmund flirt with to play her off against Regan?",
    "orig_answer": "Goneril",
    "context": "[PAR] [TLE] Edmund (King Lear) [SEP] Edmund or Edmond is a fictional character and the main antagonist in William Shakespeare's \"King Lear\".  He is the illegitimate son of the Earl of Gloucester, and the younger brother of Edgar, the Earl's legitimate son.  Early on in the play, Edmund resolves to get rid of his brother, then his father, and become Earl in his own right.  He later flirts with both Goneril and Regan and attempts to play them off against each other. [PAR] [TLE] Goneril [SEP] Goneril is a character in Shakespeare's tragic play \"King Lear\" (1605).  She is the eldest of King Lear's three daughters.  Along with her sister Regan, Goneril is considered a villain, obsessed with power and overthrowing her elderly father as ruler of the kingdom of Britain.  Her aggressiveness is a rare trait for a female character in Elizabethan literature.",
    "response": "```xml\n<document_analysis>\nThoughtful Content Examination: The context describes Edmund's character in \"King Lear\" and his manipulative actions, specifically mentioning his attempts to play Goneril and Regan against each other. The question directly tests understanding of this key plot point.\n\nConcept Exploration: This question explores the themes of ambition, betrayal, and manipulation present in the play. It requires understanding of character relationships and motivations.\n\nStrategic Complexity Calibration: Difficulty: 6/10. The answer is explicitly stated in the text, but understanding the context of Edmund's motivations adds complexity.\n\nIntentional Question Planning: The question is designed to assess the test-taker's comprehension of Edmund's scheming and the dynamics between the characters. It's a factual recall question with a slightly nuanced understanding requirement.\n</document_analysis>\n<output_format>\nQuestion: In Shakespeare's \"King Lear,\" Edmund, the illegitimate son of the Earl of Gloucester, actively attempts to advance his own ambitions through manipulation. Recognizing the power held by King Lear\u2019s daughters, Goneril and Regan, he engages in a calculated strategy to exploit their desires. Which of King Lear\u2019s daughters does Edmund attempt to manipulate and incite rivalry with her sister, Regan, in pursuit of his own goals?\nA: Cordelia, the youngest and most honest of King Lear's daughters, who refused to participate in the initial flattery contest.\nB: Goneril, the eldest daughter, characterized by her ambition and willingness to seize power.\nC: Regan, the second daughter, known for her ruthlessness and alignment with Goneril's schemes.\nD: Katherine, a minor character who appears briefly in the play with no significant influence on the main plot.\nExplanation: The text explicitly states that Edmund \"later flirts with both Goneril and Regan and attempts to play them off against each other,\" indicating his deliberate manipulation of both sisters to further his own agenda.\nCorrect Answer: B\n</output_format>\n```",
    "question": "In Shakespeare's \"King Lear,\" Edmund, the illegitimate son of the Earl of Gloucester, actively attempts to advance his own ambitions through manipulation. Recognizing the power held by King Lear\u2019s daughters, Goneril and Regan, he engages in a calculated strategy to exploit their desires. Which of King Lear\u2019s daughters does Edmund attempt to manipulate and incite rivalry with her sister, Regan, in pursuit of his own goals?",
    "choices": {
      "A": "Cordelia, the youngest and most honest of King Lear's daughters, who refused to participate in the initial flattery contest.",
      "B": "Goneril, the eldest daughter, characterized by her ambition and willingness to seize power.",
      "C": "Regan, the second daughter, known for her ruthlessness and alignment with Goneril's schemes.",
      "D": "Katherine, a minor character who appears briefly in the play with no significant influence on the main plot."
    },
    "answer": "B",
    "explanation": "The text explicitly states that Edmund \"later flirts with both Goneril and Regan and attempts to play them off against each other,\" indicating his deliberate manipulation of both sisters to further his own agenda.",
    "answer_correctness_score": 10,
    "explanation_validity_score": 10,
    "question_clarity_score": 6,
    "question_difficulty_score": 7,
    "question_groundedness_score": 10,
    "question_token_count": 90,
    "reformat_question_cosine_similarity_to_orig": 0.84577476978302,
    "reformat_answer_cosine_similarity_to_orig": 0.5861799716949463,
    "reformat_question_similarity_score": 9,
    "reformat_answer_similarity_score": 9,
    "avg_answer_token_count": 22
  },
  {
    "orig_question": "The heir to the Du Pont family fortune sponsored what wrestling team?",
    "orig_answer": "Foxcatcher",
    "context": "[PAR] [TLE] John du Pont [SEP] John Eleuth\u00e8re du Pont (November 22, 1938 \u2013 December 9, 2010) was an American philanthropist and heir to the Du Pont family fortune, he had been a published ornithologist, philatelist, philanthropist, conchologist, sports enthusiast, self-styled wrestling coach.  He died in prison while serving a sentence of 30 years in prison for the murder of Dave Schultz. [PAR] [TLE] Dave Schultz (wrestling) [SEP] David Leslie \"Dave\" Schultz (June 6, 1959 \u2013 January 26, 1996) was an American Olympic and world champion freestyle wrestler, a seven-time World and Olympic medalist.  He coached individuals and teams at the college level and also privately.  He was shot and killed by John Eleuth\u00e8re du Pont, a millionaire philanthropist who sponsored the private Foxcatcher wrestling team at an amateur sports center, known as Foxcatcher Farm, he set up on his estate in Pennsylvania.",
    "response": "```xml\n<document_analysis>\nThoughtful Content Examination: The context details the relationship between John du Pont and Dave Schultz, focusing on du Pont's wealth, diverse interests, and eventual conviction for Schultz's murder. It also establishes Schultz's wrestling career and his connection to a wrestling team sponsored by du Pont.\n\nConcept Exploration: The core concept revolves around the intersection of wealth, sports, and a tragic outcome. The text implicitly explores themes of power dynamics and potential consequences of unchecked privilege.\n\nStrategic Complexity Calibration: Difficulty: 6/10. The information is directly stated, but requires understanding the context to accurately answer.\n\nIntentional Question Planning: The question will focus on extracting the name of the wrestling team sponsored by du Pont, testing recall and comprehension of the provided information. It will be rephrased to be more comprehensive and require more precise recall.\n</document_analysis>\n<output_format>\nQuestion: John Eleuth\u00e8re du Pont, an heir to the Du Pont family fortune and convicted murderer of Olympic wrestler Dave Schultz, financially supported a wrestling team at his estate in Pennsylvania. What was the name of this wrestling team established at Foxcatcher Farm?\nA: Team DuPont\nB: Pennsylvania Wrestling Club\nC: Foxcatcher\nD: Schultz Wrestling Alliance\nExplanation: The text explicitly states that John du Pont sponsored the private wrestling team known as Foxcatcher at his amateur sports center, Foxcatcher Farm.\nCorrect Answer: C\n</output_format>\n```",
    "question": "John Eleuth\u00e8re du Pont, an heir to the Du Pont family fortune and convicted murderer of Olympic wrestler Dave Schultz, financially supported a wrestling team at his estate in Pennsylvania. What was the name of this wrestling team established at Foxcatcher Farm?",
    "choices": {
      "A": "Team DuPont",
      "B": "Pennsylvania Wrestling Club",
      "C": "Foxcatcher",
      "D": "Schultz Wrestling Alliance"
    },
    "answer": "C",
    "explanation": "The text explicitly states that John du Pont sponsored the private wrestling team known as Foxcatcher at his amateur sports center, Foxcatcher Farm.",
    "answer_correctness_score": 10,
    "explanation_validity_score": 10,
    "question_clarity_score": 1,
    "question_difficulty_score": 2,
    "question_groundedness_score": 1,
    "question_token_count": 53,
    "reformat_question_cosine_similarity_to_orig": 0.6885870099067688,
    "reformat_answer_cosine_similarity_to_orig": 1.0,
    "reformat_question_similarity_score": 8,
    "reformat_answer_similarity_score": 10,
    "avg_answer_token_count": 4
  },
  {
    "orig_question": "An SC Bastia player earned what nickname for his  powerful and tough tackling playing style?",
    "orig_answer": "\"The Bison\"",
    "context": "[PAR] [TLE] SC Bastia Reserves and Academy [SEP] The SC Bastia Reserves and Academy are the reserve team and academy of French football club Bastia.  The Plaine de l\u2019Igesa serves as the home facility for the club's Reserves and Academy sides, which play their home matches at the Stade Erbajolo and Stade Armand Cesari.  It is located in the commune of Haute-Corse, located in the western suburbs of Bastia.  Notable graduates of the academy include Alex Song, Michael Essien, Nicolas Penneteau, Yannick Cahuzac, Wahbi Khazri, Claude Papi and Charles Orlanducci.  Ghislain Printant was the first director of the training centre.  Beno\u00eet Tavenot and former Bastia and French international player Fr\u00e9d\u00e9ric N\u00e9e is the current director. [PAR] [TLE] Michael Essien [SEP] Michael Kojo Essien (born 3 December 1982) is a Ghanaian footballer who currently plays for Indonesian club Persib Bandung.  He has also played for the Ghana national team more than 50 times.  He is a physically strong midfielder who has often been touted as a box-to-box midfielder for his ability to exert energy in supporting offensive and defensive play and for his powerful and tough tackling playing style which has earned him the nickname \"The Bison\".  Essien can also play as a defender, both on the right of defence and in the centre.",
    "response": "```xml\n<document_analysis>\nThoughtful Content Examination: The context provides information about the SC Bastia Reserves and Academy, including notable graduates. One graduate, Michael Essien, is specifically described as having earned a nickname due to his playing style.\n\nConcept Exploration: The question focuses on a specific detail about a player's reputation\u2014his nickname\u2014which reveals something about his playing style and how he's perceived within the football community. This taps into understanding player archetypes and stylistic labels.\n\nStrategic Complexity Calibration: Difficulty: 4/10. This is a factual recall question but requires reading comprehension to locate the relevant information within the context.\n\nIntentional Question Planning: The question is designed to test if the reader can accurately extract specific details about a player from the provided text. It's a straightforward question but requires careful attention to detail.\n</document_analysis>\n<output_format>\nQuestion: Michael Kojo Essien, a graduate of the SC Bastia Academy who currently plays for Indonesian club Persib Bandung, gained recognition for his robust and assertive playing style. What nickname did Essien acquire because of his powerful tackling and energetic contributions to both offensive and defensive maneuvers?\nA: \"The Magician\"\nB: \"The Bison\"\nC: \"The Maestro\"\nD: \"The Rock\"\nExplanation: The text explicitly states that Michael Essien earned the nickname \"The Bison\" due to his powerful and tough tackling playing style, as well as his ability to exert energy in both offensive and defensive play.\nCorrect Answer: B\n</output_format>\n```",
    "question": "Michael Kojo Essien, a graduate of the SC Bastia Academy who currently plays for Indonesian club Persib Bandung, gained recognition for his robust and assertive playing style. What nickname did Essien acquire because of his powerful tackling and energetic contributions to both offensive and defensive maneuvers?",
    "choices": {
      "A": "\"The Magician\"",
      "B": "\"The Bison\"",
      "C": "\"The Maestro\"",
      "D": "\"The Rock\""
    },
    "answer": "B",
    "explanation": "The text explicitly states that Michael Essien earned the nickname \"The Bison\" due to his powerful and tough tackling playing style, as well as his ability to exert energy in both offensive and defensive play.",
    "answer_correctness_score": 10,
    "explanation_validity_score": 10,
    "question_clarity_score": 9,
    "question_difficulty_score": 6,
    "question_groundedness_score": 8,
    "question_token_count": 57,
    "reformat_question_cosine_similarity_to_orig": 0.5811643600463867,
    "reformat_answer_cosine_similarity_to_orig": 1.0000001192092896,
    "reformat_question_similarity_score": 8,
    "reformat_answer_similarity_score": 10,
    "avg_answer_token_count": 4
  },
  {
    "orig_question": "What is the name of the second studio album by the American singer-songwriter who has released four video albums and has appeared in 38 music videos including her song 'Love Story' which is the lead single of the album?",
    "orig_answer": "Fearless",
    "context": "[PAR] [TLE] Taylor Swift videography [SEP] American singer-songwriter Taylor Swift has released four video albums and has appeared in thirty-eight music videos, five films and three television shows.  From her eponymous debut album (2006), she released music videos for the singles \"Tim McGraw\", \"Teardrops on My Guitar\", \"Our Song\", and \"Picture to Burn\", all directed by Trey Fanjoy and released from 2006\u201308.  For the second of these, she earned an MTV Video Music Award for Best New Artist nomination.  She followed with three other music videos in 2008\u2014\"Beautiful Eyes\" from her extended play of the same name, \"Change\" from the \"AT&T Team USA Soundtrack\" and \"Love Story\" from her second album \"Fearless\" (2008).  The latter was nominated for two awards at the 2009 CMT Music Awards\u2014Video of the Year and Female Video of the Year.  For the video of \"You Belong with Me\" she won Best Female Video at the 2009 MTV Video Music Awards.  During her acceptance speech, she was interrupted by rapper Kanye West, which sparked controversy and received much media attention. [PAR] [TLE] Love Story (Taylor Swift song) [SEP] \"Love Story\" is a song performed by American singer-songwriter Taylor Swift.  The song was written by Swift and produced by Nathan Chapman, alongside Swift.  It was released on September 12, 2008 by Big Machine Records, as the lead single from Swift's second studio album \"Fearless\" (2008).  The song was written about a love interest of Swift's who was not popular among Swift's family and friends.  Because of the scenario, Swift related to the plot of William Shakespeare's \"Romeo and Juliet\" (1597) and used it as a source of inspiration to compose the song.  However, she replaced \"Romeo and Juliet\"' s original tragic conclusion with a happy ending.  It is a midtempo song with a dreamy soprano voice, while the melody continually builds.  The lyrics are from the perspective of Juliet.",
    "response": "```xml\n<document_analysis>\nThoughtful Content Examination: The provided context discusses Taylor Swift's videography and specifically details her song \"Love Story.\" The question asks for the name of her second studio album, which is directly stated in the text.\n\nConcept Exploration: The context establishes Taylor Swift as a prominent figure in music and video production, and highlights \"Love Story\" as a key single from her \"Fearless\" album. The question tests recall of this specific detail.\n\nStrategic Complexity Calibration: Difficulty is rated as 4/10. It's a fairly straightforward factual recall question but requires understanding the relationship between the artist, the song, and the album.\n\nIntentional Question Planning: The question is designed to assess understanding of Taylor Swift's discography and the context surrounding her popular song \"Love Story.\" The phrasing is slightly more complex to avoid a simple keyword search.\n</document_analysis>\n<output_format>\nQuestion: American singer-songwriter Taylor Swift, renowned for her extensive videography including 38 music videos, released the lead single \"Love Story\" from her second studio album. Inspired by Shakespeare\u2019s \"Romeo and Juliet\" but concluding with a happier outcome, this midtempo song with a dreamy soprano voice was produced by Nathan Chapman and Swift herself. What is the title of this second studio album?\nA: Red\nB: Speak Now\nC: Fearless\nD: 1989\nExplanation: The text explicitly states that \"Love Story\" was released as the lead single from Swift's second studio album, \"Fearless.\"\nCorrect Answer: C\n</output_format>\n```",
    "question": "American singer-songwriter Taylor Swift, renowned for her extensive videography including 38 music videos, released the lead single \"Love Story\" from her second studio album. Inspired by Shakespeare\u2019s \"Romeo and Juliet\" but concluding with a happier outcome, this midtempo song with a dreamy soprano voice was produced by Nathan Chapman and Swift herself. What is the title of this second studio album?",
    "choices": {
      "A": "Red",
      "B": "Speak Now",
      "C": "Fearless",
      "D": "1989"
    },
    "answer": "C",
    "explanation": "The text explicitly states that \"Love Story\" was released as the lead single from Swift's second studio album, \"Fearless.\"",
    "answer_correctness_score": 10,
    "explanation_validity_score": 10,
    "question_clarity_score": 8,
    "question_difficulty_score": 5,
    "question_groundedness_score": 10,
    "question_token_count": 81,
    "reformat_question_cosine_similarity_to_orig": 0.6861222982406616,
    "reformat_answer_cosine_similarity_to_orig": 1.0,
    "reformat_question_similarity_score": 9,
    "reformat_answer_similarity_score": 10,
    "avg_answer_token_count": 3
  },
  {
    "orig_question": "What is the birthdate of this American entrepreneur, who is an ownder of this company that is an Italian word meaning fight?",
    "orig_answer": "February 24, 1962",
    "context": "[PAR] [TLE] Frank Fertitta III [SEP] Frank Joseph Fertitta III (born February 24, 1962) is an American entrepreneur.  He is the current CEO of Station Casinos.  He is also an owner of Zuffa LLC, which is the entity that formerly ran the Ultimate Fighting Championship (UFC). [PAR] [TLE] Zuffa [SEP] Zuffa, LLC ( ) is an American sports promotion company specializing in mixed martial arts.  It was founded in January 2001 in Las Vegas, Nevada, by Station Casinos executives Frank Fertitta III and Lorenzo Fertitta to be the parent entity of the Ultimate Fighting Championship (UFC) after they purchased it from the Semaphore Entertainment Group.  The word \"Zuffa\" is an Italian word (] ), meaning \"fight\".  On July 11, 2016, Zuffa announced that it would be purchased by WME-IMG for the price of $4 billion.",
    "response": "```xml\n<document_analysis>\nThoughtful Content Examination: The context provides information about Frank Fertitta III, his role as CEO of Station Casinos, his ownership of Zuffa LLC (parent company of UFC), and details about Zuffa itself, including its origin, name meaning, and eventual sale. The question asks for Fertitta's birthdate, linking it to his ownership of a company whose name means \"fight\" (Zuffa).\n\nConcept Exploration: The question combines factual recall (birthdate) with a contextual link (Zuffa's meaning). It tests whether the test-taker can connect Fertitta to Zuffa and recall the specific detail about his birthdate.\n\nStrategic Complexity Calibration: Difficulty: 6/10. It's not overly complex but requires recalling a specific date and linking it to a company's name origin.\n\nIntentional Question Planning: The question is designed to assess the test-taker\u2019s ability to integrate information from different parts of the text and recall a specific detail. The phrasing is intentionally a bit convoluted to increase the challenge.\n</document_analysis>\n<output_format>\nQuestion: Frank Fertitta III, the current CEO of Station Casinos and an owner of Zuffa LLC \u2013 a sports promotion company specializing in mixed martial arts and whose name is an Italian word meaning \"fight\" \u2013 was born on what date?\nA: March 15, 1965\nB: February 24, 1962\nC: January 1, 2001\nD: July 11, 2016\nExplanation: The text explicitly states that Frank Joseph Fertitta III was born on February 24, 1962. This information is directly stated in the first paragraph of the provided context.\nCorrect Answer: B\n</output_format>\n```",
    "question": "Frank Fertitta III, the current CEO of Station Casinos and an owner of Zuffa LLC \u2013 a sports promotion company specializing in mixed martial arts and whose name is an Italian word meaning \"fight\" \u2013 was born on what date?",
    "choices": {
      "A": "March 15, 1965",
      "B": "February 24, 1962",
      "C": "January 1, 2001",
      "D": "July 11, 2016"
    },
    "answer": "B",
    "explanation": "The text explicitly states that Frank Joseph Fertitta III was born on February 24, 1962. This information is directly stated in the first paragraph of the provided context.",
    "answer_correctness_score": 10,
    "explanation_validity_score": 10,
    "question_clarity_score": 8,
    "question_difficulty_score": 2,
    "question_groundedness_score": 1,
    "question_token_count": 48,
    "reformat_question_cosine_similarity_to_orig": 0.47433626651763916,
    "reformat_answer_cosine_similarity_to_orig": 1.0000001192092896,
    "reformat_question_similarity_score": 10,
    "reformat_answer_similarity_score": 10,
    "avg_answer_token_count": 8
  },
  {
    "orig_question": "What is the Onizuka Prop Wash Award?",
    "orig_answer": "who contributed most to class spirit and morale",
    "context": "[PAR] [TLE] Ellison Onizuka [SEP] Ellison Shoji Onizuka (June 24, 1946 \u2013 January 28, 1986 ) was an American astronaut from Kealakekua, Hawaii, who successfully flew into space with the Space Shuttle \"Discovery\" on STS-51-C.  He died in the destruction of the Space Shuttle \"Challenger\", on which he was serving as Mission Specialist for mission STS-51-L.  He was the first Asian American and the first person of Japanese ancestry to reach space. [PAR] [TLE] Onizuka Prop Wash Award [SEP] The Onizuka Prop Wash Award recognizes the student at the United States Air Force Test Pilot School (USAF TPS) who contributed most to class spirit and morale.  The honoree from each class is selected by his or her fellow students rather than by school faculty.  The award is named in memory of TPS graduate Ellison Onizuka who perished in the explosion of the Space Shuttle \"Challenger\" in 1986.",
    "response": "```xml\n<document_analysis>\nThoughtful Content Examination: The context provides information about Ellison Onizuka, an astronaut, and the Onizuka Prop Wash Award, an award given at the United States Air Force Test Pilot School. The award is named in his memory and recognizes a student who contributes most to class spirit and morale.\n\nConcept Exploration: The award highlights the importance of morale and camaraderie within a high-pressure training environment like the USAF TPS. The fact that the award is chosen by fellow students emphasizes peer recognition.\n\nStrategic Complexity Calibration: Difficulty: 6. This is a factual recall question, but requires understanding the context to differentiate the award from Onizuka\u2019s primary achievement as an astronaut.\n\nIntentional Question Planning: The question will focus on the specifics of the award, requiring the test-taker to recall details about its purpose and selection process.\n</document_analysis>\n<output_format>\nQuestion: Ellison Onizuka's legacy is honored through an award presented at the United States Air Force Test Pilot School. Which of the following best describes the primary criterion for receiving the Onizuka Prop Wash Award?\nA: Demonstrating exceptional technical skill in flight testing and aircraft evaluation.\nB: Achieving the highest academic performance within the graduating class.\nC: Contributing significantly to the overall morale and spirit of the class, as determined by fellow students.\nD: Exhibiting leadership qualities and initiative during group projects and simulations.\nExplanation: The text explicitly states that the Onizuka Prop Wash Award \"recognizes the student...who contributed most to class spirit and morale,\" and that the selection is made by fellow students.\nCorrect Answer: C\n</output_format>\n```",
    "question": "Ellison Onizuka's legacy is honored through an award presented at the United States Air Force Test Pilot School. Which of the following best describes the primary criterion for receiving the Onizuka Prop Wash Award?",
    "choices": {
      "A": "Demonstrating exceptional technical skill in flight testing and aircraft evaluation.",
      "B": "Achieving the highest academic performance within the graduating class.",
      "C": "Contributing significantly to the overall morale and spirit of the class, as determined by fellow students.",
      "D": "Exhibiting leadership qualities and initiative during group projects and simulations."
    },
    "answer": "C",
    "explanation": "The text explicitly states that the Onizuka Prop Wash Award \"recognizes the student...who contributed most to class spirit and morale,\" and that the selection is made by fellow students.",
    "answer_correctness_score": 10,
    "explanation_validity_score": 10,
    "question_clarity_score": 8,
    "question_difficulty_score": 5,
    "question_groundedness_score": 10,
    "question_token_count": 43,
    "reformat_question_cosine_similarity_to_orig": 0.7510161399841309,
    "reformat_answer_cosine_similarity_to_orig": 0.750120997428894,
    "reformat_question_similarity_score": 8,
    "reformat_answer_similarity_score": 9,
    "avg_answer_token_count": 14
  },
  {
    "orig_question": "How many acres was the resort where Bob Scucci was the Assistant Race and Sports Book Manager?",
    "orig_answer": "63",
    "context": "[PAR] [TLE] Bob Scucci [SEP] Robert \"Bob\" Scucci is the Director of Race and Sports for Boyd Gaming Corp.  and was formerly the Assistant Race and Sports Book Manager at the Stardust Resort and Casino. [PAR] [TLE] Stardust Resort and Casino [SEP] The Stardust Resort and Casino was a casino resort located on 63 acres (25 ha) along the Las Vegas Strip in Winchester, Nevada.",
    "response": "```xml\n<document_analysis>\n<thought_process>The context provides information about Bob Scucci's career and the Stardust Resort and Casino. The question asks for the acreage of the Stardust Resort and Casino, which is directly stated in the context. This is a factual recall question, but can be made more challenging by providing distractors related to Bob Scucci's career or other details. The difficulty level is currently low, so I will increase it by including plausible but incorrect acreage values. The question is straightforward and requires minimal rephrasing. </thought_process>\n<complexity_assessment>Difficulty: 3/10.  The information is directly stated, making it a low-complexity question. I aim to increase this to 6/10 with the answer options.</complexity_assessment>\n</document_analysis>\n<output_format>\nQuestion: Robert \"Bob\" Scucci previously held the position of Assistant Race and Sports Book Manager at a casino resort located on the Las Vegas Strip. What was the total acreage of this resort?\nA: 20 acres\nB: 45 acres\nC: 63 acres\nD: 80 acres\nExplanation: The Stardust Resort and Casino, where Bob Scucci was formerly the Assistant Race and Sports Book Manager, was located on 63 acres of land.\nCorrect Answer: C\n</output_format>\n```",
    "question": "Robert \"Bob\" Scucci previously held the position of Assistant Race and Sports Book Manager at a casino resort located on the Las Vegas Strip. What was the total acreage of this resort?",
    "choices": {
      "A": "20 acres",
      "B": "45 acres",
      "C": "63 acres",
      "D": "80 acres"
    },
    "answer": "C",
    "explanation": "The Stardust Resort and Casino, where Bob Scucci was formerly the Assistant Race and Sports Book Manager, was located on 63 acres of land.",
    "answer_correctness_score": 10,
    "explanation_validity_score": 10,
    "question_clarity_score": 8,
    "question_difficulty_score": 2,
    "question_groundedness_score": 10,
    "question_token_count": 39,
    "reformat_question_cosine_similarity_to_orig": 0.8325656056404114,
    "reformat_answer_cosine_similarity_to_orig": 0.5532203316688538,
    "reformat_question_similarity_score": 10,
    "reformat_answer_similarity_score": 10,
    "avg_answer_token_count": 3
  },
  {
    "orig_question": "Who was the British Former professional Cyclist who was part of Team Halfords Bikehut?",
    "orig_answer": "Sharon Laws",
    "context": "[PAR] [TLE] Sharon Laws [SEP] Sharon Laws (born 7 July 1974) is a British former professional cyclist, who currently works as an environmental consultant. [PAR] [TLE] Team Halfords Bikehut [SEP] Team Halfords Bikehut was a 2008 UCI elite women's cycling team based in the United Kingdom.  The team was formed in January 2008 with Dave Brailsford, performance director of British Cycling, the general manager.  It had been a pro/national team mooted as the first full British professional women's team but there were two men in the team (Rob Hayles and Tom Southam).  The team was in 2009 not an UCI Women's Teams anymore and consisted of a mix of mountain bikers and road racers (mainly men): Rob Hayles, Ed Clancy, Ian Wilkinson, Andy Tennant, Mark McNally, Rob Partridge, Seb Batchelor, David Fletcher, Annie Last, Sharon Laws, Ian Bibby.  The team disbanded ahead of the 2010 season, with a number of riders moving to the Scottish-based Endura Racing team.",
    "response": "```xml\n<document_analysis>\nThoughtful Content Examination: The context provides information about Sharon Laws, a British former professional cyclist, and Team Halfords Bikehut, a UCI elite women's cycling team. It details the team's formation, management, and eventual disbandment, listing several riders including Sharon Laws.\n\nConcept Exploration: The core concept revolves around identifying individuals associated with a specific cycling team. The passage highlights the transition of Team Halfords Bikehut from a primarily women's team to a mixed team, and ultimately its dissolution.\n\nStrategic Complexity Calibration: Difficulty: 3/10. The question is relatively straightforward, directly stated in the text. However, increasing the complexity involves requiring the user to recall the team's composition and Sharon Laws' association with it.\n\nIntentional Question Planning: The question will be rephrased to require a deeper understanding of the team's evolution and Sharon Laws' role within it. The answer options will include other riders mentioned in the text to increase the challenge.\n</document_analysis>\n<output_format>\nQuestion: In 2009, Team Halfords Bikehut transitioned from a UCI elite women's cycling team to a mixed team consisting of both mountain bikers and road racers. Considering this shift in team composition, which of the following athletes was a member of Team Halfords Bikehut during this period of transition?\nA: Dave Brailsford\nB: Annie Last\nC: Tom Southam\nD: Mark McNally\nExplanation: The text explicitly states that Sharon Laws was a member of Team Halfords Bikehut in 2009, when the team consisted of a mix of mountain bikers and road racers. Annie Last was also listed as a team member during this period. However, Sharon Laws is the correct answer as it directly answers the question. Dave Brailsford was the general manager of the team, and Tom Southam was one of the two men on the initial team, but the question refers to the 2009 roster. Mark McNally was also on the 2009 roster.\nCorrect Answer: B\n</output_format>\n```",
    "question": "In 2009, Team Halfords Bikehut transitioned from a UCI elite women's cycling team to a mixed team consisting of both mountain bikers and road racers. Considering this shift in team composition, which of the following athletes was a member of Team Halfords Bikehut during this period of transition?",
    "choices": {
      "A": "Dave Brailsford",
      "B": "Annie Last",
      "C": "Tom Southam",
      "D": "Mark McNally"
    },
    "answer": "B",
    "explanation": "The text explicitly states that Sharon Laws was a member of Team Halfords Bikehut in 2009, when the team consisted of a mix of mountain bikers and road racers. Annie Last was also listed as a team member during this period. However, Sharon Laws is the correct answer as it directly answers the question. Dave Brailsford was the general manager of the team, and Tom Southam was one of the two men on the initial team, but the question refers to the 2009 roster. Mark McNally was also on the 2009 roster.",
    "answer_correctness_score": 10,
    "explanation_validity_score": 8,
    "question_clarity_score": 1,
    "question_difficulty_score": 5,
    "question_groundedness_score": 10,
    "question_token_count": 64,
    "reformat_question_cosine_similarity_to_orig": 0.7248308658599854,
    "reformat_answer_cosine_similarity_to_orig": 0.2747579514980316,
    "reformat_question_similarity_score": 6,
    "reformat_answer_similarity_score": 1,
    "avg_answer_token_count": 4
  },
  {
    "orig_question": "Dharmatama is a 1975 Hindi thriller movie, and the first Bollywood film to be shot in Afghanistan,the title character was based on matka, king Ratan Khatri, Matka\" gambling or satta\" is a form of lottery which originally involved betting on the opening and closing rates of cotton transmitted from where?",
    "orig_answer": "New York Cotton Exchange",
    "context": "[PAR] [TLE] Dharmatma [SEP] Dharmatama is a 1975 Hindi thriller movie and the first Bollywood film to be shot in Afghanistan.  It was produced and directed by Feroz Khan.  The movie is the first attempt in India to localise \"The Godfather\".  The title character was based on matka (form of Indian gambling) king Ratan Khatri.  It is said that Khan sat down with Khatri to learn more about him and understand the nuances of matka.  The cast includes Feroz Khan, Hema Malini, Rekha, Premnath, Imtiaz Khan, Danny Denzongpa, Farida Jalal, Ranjeet, Helen, Madan Puri, Jeevan, Iftekhar and Dara Singh, satyen kappu and sudhir.  The music is by Kalyanji Anandji.  This film took Feroz Khan to new heights in his career as this was a blockbuster movie.  The same year, \"Sholay\" and \"Deewar\" were released.  The film is also its scenes featuring Buzkashi a Central Asian sport on horses, including aerial shots, which in turn won film's cinematographer, Kamal Bose, Filmfare Award for Best Cinematographer. [PAR] [TLE] Matka gambling [SEP] Matka\" gambling or satta\" is a form of lottery which originally involved betting on the opening and closing rates of cotton transmitted from the New York Cotton Exchange.  It originates from before the era of Indian independence when it was known as \"Ankada Jugar\" (\"figures gambling\").  In the 1960s, the system was replaced with other ways of generating random numbers, including pulling slips from a large earthenware pot known as a \"matka\", or dealing playing cards.",
    "response": "```xml\n<document_analysis>\nThoughtful Content Examination: The context discusses the movie Dharmatama and the origins of Matka gambling. The question combines information from both sections, asking about the origin of the betting rates in Matka gambling.\n\nConcept Exploration: The question tests the ability to connect details across different parts of the provided text. It assesses understanding of the historical roots of Matka gambling.\n\nStrategic Complexity Calibration: Difficulty: 6/10. This is a factual recall question but requires connecting two distinct pieces of information.\n\nIntentional Question Planning: The question aims to test whether the reader can synthesize information from different sections of the text to answer a specific question. It's not a direct quote but requires understanding the context of Matka gambling as described in the passage.\n</document_analysis>\n<output_format>\nQuestion: Dharmatama, a 1975 Hindi thriller and the first Bollywood film shot in Afghanistan, drew inspiration for its title character from Ratan Khatri, a prominent figure in the world of \u201cMatka\u201d gambling. Considering the historical origins of \u201cMatka\u201d gambling, as described in the provided text, on what exchange were the initial betting rates based?\nA: The London Stock Exchange\nB: The Bombay Stock Exchange\nC: The New York Cotton Exchange\nD: The Amsterdam Stock Exchange\nExplanation: The text explicitly states that Matka gambling originally involved betting on the opening and closing rates of cotton transmitted from the New York Cotton Exchange.\nCorrect Answer: C\n</output_format>\n```",
    "question": "Dharmatama, a 1975 Hindi thriller and the first Bollywood film shot in Afghanistan, drew inspiration for its title character from Ratan Khatri, a prominent figure in the world of \u201cMatka\u201d gambling. Considering the historical origins of \u201cMatka\u201d gambling, as described in the provided text, on what exchange were the initial betting rates based?",
    "choices": {
      "A": "The London Stock Exchange",
      "B": "The Bombay Stock Exchange",
      "C": "The New York Cotton Exchange",
      "D": "The Amsterdam Stock Exchange"
    },
    "answer": "C",
    "explanation": "The text explicitly states that Matka gambling originally involved betting on the opening and closing rates of cotton transmitted from the New York Cotton Exchange.",
    "answer_correctness_score": 10,
    "explanation_validity_score": 10,
    "question_clarity_score": 4,
    "question_difficulty_score": 6,
    "question_groundedness_score": 10,
    "question_token_count": 74,
    "reformat_question_cosine_similarity_to_orig": 0.9076923131942749,
    "reformat_answer_cosine_similarity_to_orig": 0.9746254682540894,
    "reformat_question_similarity_score": 9,
    "reformat_answer_similarity_score": 10,
    "avg_answer_token_count": 5
  },
  {
    "orig_question": "The Crystal Palace Football Club Player of the Year is awarded at the end of each season, nine of these players have won the award for a second time, the most recent being which professional footballer, who plays as a winger for Premier League club Crystal Palace, and the Ivory Coast national team?",
    "orig_answer": "Wilfried Zaha",
    "context": "[PAR] [TLE] Wilfried Zaha [SEP] Dazet Wilfried Armel Zaha (born 10 November 1992) is a professional footballer who plays as a winger for Premier League club Crystal Palace and the Ivory Coast national team. [PAR] [TLE] Crystal Palace F.C. Player of the Year [SEP] The Crystal Palace Football Club Player of the Year is awarded at the end of each season.  Since the inaugural award was made to John McCormick in 1972, 34 different players have won the award.  Nine of these players have won the award for a second time, the most recent being Wilfried Zaha.  Two players have received the award on more than two occasions, Jim Cannon won it three times and Juli\u00e1n Speroni won it four times.  Paul Hinshelwood was the first to win the trophy in consecutive seasons, a feat since emulated by Andrew Johnson, Juli\u00e1n Speroni and Wilfried Zaha.  Speroni is the only one to win it in three consecutive seasons.  The current incumbent of the award is Wilfried Zaha, who was the 2016\u201317 recipient.",
    "response": "```xml\n<document_analysis>\nThoughtful Content Examination: The provided text segment details information about Wilfried Zaha and the Crystal Palace Football Club Player of the Year award. The question accurately reflects information contained within the context. \n\nConcept Exploration: The context presents factual information about a footballer and an award. The question tests recall of a specific detail \u2013 the most recent player to win the award a second time.\n\nStrategic Complexity Calibration: Difficulty: 3/10. The question is relatively straightforward, requiring direct recall from the text. However, the length and phrasing make it slightly more challenging than a simple factual question.\n\nIntentional Question Planning: The question aims to assess the test-taker's ability to identify and recall specific details from the text, while also integrating information about Zaha's profession and team affiliation.\n</document_analysis>\n<output_format>\nQuestion: Wilfried Zaha, a professional footballer who plays as a winger for a Premier League club and represents the Ivory Coast national team, was recently recognized as the most recent player to win the Crystal Palace Football Club Player of the Year award for a second time. Considering this information and the history of the award\u2014which began in 1972 with John McCormick as its first recipient, and has seen players like Jim Cannon win it three times and Juli\u00e1n Speroni win it four times\u2014who is this footballer?\nA: Juli\u00e1n Speroni\nB: Jim Cannon\nC: Andrew Johnson\nD: Wilfried Zaha\nExplanation: The text explicitly states that Wilfried Zaha is the most recent player to win the Crystal Palace Football Club Player of the Year award for a second time.\nCorrect Answer: D\n</output_format>\n```",
    "question": "Wilfried Zaha, a professional footballer who plays as a winger for a Premier League club and represents the Ivory Coast national team, was recently recognized as the most recent player to win the Crystal Palace Football Club Player of the Year award for a second time. Considering this information and the history of the award\u2014which began in 1972 with John McCormick as its first recipient, and has seen players like Jim Cannon win it three times and Juli\u00e1n Speroni win it four times\u2014who is this footballer?",
    "choices": {
      "A": "Juli\u00e1n Speroni",
      "B": "Jim Cannon",
      "C": "Andrew Johnson",
      "D": "Wilfried Zaha"
    },
    "answer": "D",
    "explanation": "The text explicitly states that Wilfried Zaha is the most recent player to win the Crystal Palace Football Club Player of the Year award for a second time.",
    "answer_correctness_score": 10,
    "explanation_validity_score": 10,
    "question_clarity_score": 8,
    "question_difficulty_score": 7,
    "question_groundedness_score": 10,
    "question_token_count": 107,
    "reformat_question_cosine_similarity_to_orig": 0.7004220485687256,
    "reformat_answer_cosine_similarity_to_orig": 1.0,
    "reformat_question_similarity_score": 8,
    "reformat_answer_similarity_score": 10,
    "avg_answer_token_count": 4
  },
  {
    "orig_question": "Shin Hye-sun (born August 31, 1989) is a South Korean actress, she acted her first protagonist role in which 2017 South Korean television series, starring Park Si-hoo, Shin Hye-sun, Lee Tae-hwan, and Seo Eun-soo?",
    "orig_answer": "My Golden Life",
    "context": "[PAR] [TLE] My Golden Life [SEP] My Golden Life () is a 2017 South Korean television series starring Park Si-hoo, Shin Hye-sun, Lee Tae-hwan, and Seo Eun-soo.  The series airs on KBS2 every Saturday and Sunday from 7:55 p.m. to 9:15 p.m. (KST). [PAR] [TLE] Shin Hye-sun [SEP] Shin Hye-sun (born August 31, 1989) is a South Korean actress.  She made her debut in the television series \"School 2013\" and acted her first protagonist role in \"My Golden Life\" (2017).",
    "response": "```xml\n<document_analysis>\nThoughtful Content Examination: The context provides information about the South Korean television series \"My Golden Life\" and the actress Shin Hye-sun. It specifies her birthdate, debut series (\"School 2013\"), and her first protagonist role being in \"My Golden Life.\"\n\nConcept Exploration: The question directly tests recall of a factual detail \u2013 the series where Shin Hye-sun played her first protagonist role. It\u2019s a straightforward but important piece of information within the provided context.\n\nStrategic Complexity Calibration: Difficulty: 3/10. While factually simple, the length of the question and the inclusion of multiple actors' names could slightly increase cognitive load.\n\nIntentional Question Planning: The question tests direct recall and comprehension of the provided text. It\u2019s a good starting point for assessing understanding.\n</document_analysis>\n<output_format>\nQuestion: Shin Hye-sun, a South Korean actress born on August 31, 1989, is recognized for her debut in the television series \"School 2013.\" In 2017, she took on her first leading role in a KBS2 series that also starred Park Si-hoo, Lee Tae-hwan, and Seo Eun-soo. What was the title of this pivotal series where Shin Hye-sun first portrayed a protagonist?\nA: School 2013\nB: My Golden Life\nC: The Princess's Man\nD: Descendants of the Sun\nExplanation: The provided text explicitly states, \"She made her debut in the television series \"School 2013\" and acted her first protagonist role in \"My Golden Life\" (2017).\" Therefore, \"My Golden Life\" is the correct answer.\nCorrect Answer: B\n</output_format>\n```",
    "question": "Shin Hye-sun, a South Korean actress born on August 31, 1989, is recognized for her debut in the television series \"School 2013.\" In 2017, she took on her first leading role in a KBS2 series that also starred Park Si-hoo, Lee Tae-hwan, and Seo Eun-soo. What was the title of this pivotal series where Shin Hye-sun first portrayed a protagonist?",
    "choices": {
      "A": "School 2013",
      "B": "My Golden Life",
      "C": "The Princess's Man",
      "D": "Descendants of the Sun"
    },
    "answer": "B",
    "explanation": "The provided text explicitly states, \"She made her debut in the television series \"School 2013\" and acted her first protagonist role in \"My Golden Life\" (2017).\" Therefore, \"My Golden Life\" is the correct answer.",
    "answer_correctness_score": 10,
    "explanation_validity_score": 10,
    "question_clarity_score": 6,
    "question_difficulty_score": 3,
    "question_groundedness_score": 10,
    "question_token_count": 92,
    "reformat_question_cosine_similarity_to_orig": 0.8686559796333313,
    "reformat_answer_cosine_similarity_to_orig": 0.9999999403953552,
    "reformat_question_similarity_score": 9,
    "reformat_answer_similarity_score": 10,
    "avg_answer_token_count": 5
  },
  {
    "orig_question": "which Szombathelyi Haladas footballer wears pyjama-like tracksuit bottoms while playing?",
    "orig_answer": "G\u00e1bor Ferenc Kir\u00e1ly",
    "context": "[PAR] [TLE] G\u00e1bor Kir\u00e1ly [SEP] G\u00e1bor Ferenc Kir\u00e1ly (] ; born 1 April 1976) is a Hungarian professional footballer who plays for Szombathelyi Halad\u00e1s as a goalkeeper. [PAR] [TLE] Ahmad Khormali [SEP] Ahmad Khormali (Persian: \u0627\u062d\u0645\u062f \u062e\u0631\u0645\u0627\u0644\u06cc\u200e \u200e ) is an Iranian football goalkeeper.  He wears pyjama-like tracksuit bottoms while playing after Hungarian goalkeeper G\u00e1bor Kir\u00e1ly.  He holds a B.Sc.  in Social Sciences from Ferdowsi University of Mashhad.",
    "response": "```xml\n<document_analysis>\n<thought_process>The context provides information about two footballers: G\u00e1bor Kir\u00e1ly and Ahmad Khormali. The question asks about a footballer from Szombathelyi Halad\u00e1s who wears pyjama-like tracksuit bottoms. The context states that G\u00e1bor Kir\u00e1ly plays for Szombathelyi Halad\u00e1s and that Ahmad Khormali wears pyjama-like tracksuit bottoms *after* G\u00e1bor Kir\u00e1ly. Therefore, the correct answer is G\u00e1bor Kir\u00e1ly. The question is relatively straightforward but can be made more challenging by introducing plausible distractors. The complexity level is moderate, around a 6/10.</thought_process>\n</document_analysis>\n<output_format>\nQuestion: G\u00e1bor Ferenc Kir\u00e1ly, a Hungarian professional footballer currently playing as a goalkeeper for Szombathelyi Halad\u00e1s, is noted for a particular stylistic choice during matches. What is this distinctive element of his on-field presentation that has inspired other players, such as Ahmad Khormali?\nA: He consistently scores goals from free kicks.\nB: He wears pyjama-like tracksuit bottoms while playing.\nC: He is known for his elaborate pre-game rituals.\nD: He always captains his team, regardless of seniority.\nExplanation: The text explicitly states that G\u00e1bor Kir\u00e1ly plays for Szombathelyi Halad\u00e1s and that Ahmad Khormali wears pyjama-like tracksuit bottoms after him, indicating Kir\u00e1ly's use of this attire during games.\nCorrect Answer: B\n</output_format>\n```",
    "question": "G\u00e1bor Ferenc Kir\u00e1ly, a Hungarian professional footballer currently playing as a goalkeeper for Szombathelyi Halad\u00e1s, is noted for a particular stylistic choice during matches. What is this distinctive element of his on-field presentation that has inspired other players, such as Ahmad Khormali?",
    "choices": {
      "A": "He consistently scores goals from free kicks.",
      "B": "He wears pyjama-like tracksuit bottoms while playing.",
      "C": "He is known for his elaborate pre-game rituals.",
      "D": "He always captains his team, regardless of seniority."
    },
    "answer": "B",
    "explanation": "The text explicitly states that G\u00e1bor Kir\u00e1ly plays for Szombathelyi Halad\u00e1s and that Ahmad Khormali wears pyjama-like tracksuit bottoms after him, indicating Kir\u00e1ly's use of this attire during games.",
    "answer_correctness_score": 10,
    "explanation_validity_score": 9,
    "question_clarity_score": 2,
    "question_difficulty_score": 5,
    "question_groundedness_score": 6,
    "question_token_count": 62,
    "reformat_question_cosine_similarity_to_orig": 0.546286940574646,
    "reformat_answer_cosine_similarity_to_orig": 0.1967800259590149,
    "reformat_question_similarity_score": 9,
    "reformat_answer_similarity_score": 9,
    "avg_answer_token_count": 11
  },
  {
    "orig_question": "How many rooms are in the hotel where O'Sheas Casino is located?",
    "orig_answer": "2,640-room",
    "context": "[PAR] [TLE] The Linq [SEP] The Linq (formerly Flamingo Capri, Imperial Palace and The Quad) is a 2,640-room hotel, casino and shopping promenade on the Las Vegas Strip in Paradise, Nevada.  It is owned and operated by Caesars Entertainment Corporation.  As of 2012, the casino is 32890 sqft with 830 slot machines, 55 table games, and a race and sports book. [PAR] [TLE] O'Sheas Casino [SEP] O'Sheas Casino is a casino located within The Linq on the Las Vegas Strip in Paradise, Nevada.  As part of The Linq, it is owned and operated by Caesars Entertainment Corporation and is connected on the exterior to a shopping/dining promenade, also owned by Caesars.  The revitalized O'Sheas has three bars - the main Dublin Up Bar, the Lucky Bar and the exterior-facing Blarney Bar.  The casino includes beer pong tables, a stage, a dance floor and a pit with games including blackjack, roulette, and craps.",
    "response": "```xml\n<document_analysis>\nThoughtful Content Examination: The context provides information about The Linq hotel and casino, including its room count and ownership, as well as details about O'Sheas Casino located within The Linq. The question asks for the number of rooms in the hotel where O'Sheas is located.\n\nConcept Exploration: This is a straightforward factual recall question. It tests the ability to identify the relevant hotel (The Linq) from the provided text and recall the stated number of rooms.\n\nStrategic Complexity Calibration: Difficulty: 3/10. While factually simple, the question requires identifying the correct hotel within the context.\n\nIntentional Question Planning: The question is designed to test basic reading comprehension and information retrieval skills. It can be improved by making it more challenging by adding distractors or requiring a more nuanced understanding of the relationship between O'Sheas and The Linq.\n</document_analysis>\n<output_format>\nQuestion: O'Sheas Casino is located within a larger hotel and casino complex on the Las Vegas Strip. This complex, owned and operated by Caesars Entertainment Corporation, features a variety of amenities including a shopping promenade and a substantial number of guest accommodations. How many rooms are available within this hotel and casino complex that houses O'Sheas Casino?\nA: 1,850 rooms\nB: 2,640 rooms\nC: 3,289 rooms\nD: 5,500 rooms\nExplanation: The text states, \"The Linq\u2026is a 2,640-room hotel, casino and shopping promenade\u2026\" and that \"O'Sheas Casino is a casino located within The Linq\u2026\" Therefore, the hotel housing O'Sheas Casino has 2,640 rooms.\nCorrect Answer: B\n</output_format>\n```",
    "question": "O'Sheas Casino is located within a larger hotel and casino complex on the Las Vegas Strip. This complex, owned and operated by Caesars Entertainment Corporation, features a variety of amenities including a shopping promenade and a substantial number of guest accommodations. How many rooms are available within this hotel and casino complex that houses O'Sheas Casino?",
    "choices": {
      "A": "1,850 rooms",
      "B": "2,640 rooms",
      "C": "3,289 rooms",
      "D": "5,500 rooms"
    },
    "answer": "B",
    "explanation": "The text states, \"The Linq\u2026is a 2,640-room hotel, casino and shopping promenade\u2026\" and that \"O'Sheas Casino is a casino located within The Linq\u2026\" Therefore, the hotel housing O'Sheas Casino has 2,640 rooms.",
    "answer_correctness_score": 10,
    "explanation_validity_score": 10,
    "question_clarity_score": 7,
    "question_difficulty_score": 3,
    "question_groundedness_score": 10,
    "question_token_count": 70,
    "reformat_question_cosine_similarity_to_orig": 0.7580490112304688,
    "reformat_answer_cosine_similarity_to_orig": 0.8630887269973755,
    "reformat_question_similarity_score": 9,
    "reformat_answer_similarity_score": 10,
    "avg_answer_token_count": 5
  },
  {
    "orig_question": "The uprising that happened when John P. Buchanan was governor primarily took place in what county?",
    "orig_answer": "Anderson County",
    "context": "[PAR] [TLE] John P. Buchanan [SEP] John Price Buchanan (October 24, 1847May 14, 1930) was an American politician and farmers' advocate.  He served as Governor of Tennessee from 1891 to 1893, and was president of the Tennessee Farmers' Alliance and Laborers' Union in the late 1880s.  Buchanan's lone term as governor was largely marred by the Coal Creek War, an armed uprising by coal miners aimed at ending the state's convict lease system. [PAR] [TLE] Coal Creek War [SEP] The Coal Creek War was an early 1890s armed labor uprising in the southeastern United States that took place primarily in Anderson County, Tennessee.  This labor conflict ignited during 1891 when coal mine owners in the Coal Creek watershed began to remove and replace their company-employed, private coal miners then on the payroll with convict laborers leased out by the Tennessee state prison system.",
    "response": "```xml\n<document_analysis>\nThoughtful Content Examination: The context provides information about John P. Buchanan, his role as governor of Tennessee, and the Coal Creek War. The Coal Creek War is described as an armed uprising by coal miners against the convict lease system, and it's specifically stated to have taken place primarily in Anderson County, Tennessee.\n\nConcept Exploration: The question focuses on a specific detail within the broader context of Buchanan's governorship and the Coal Creek War\u2014the location of the uprising. This tests recall of factual information and the ability to connect events to their geographical setting.\n\nStrategic Complexity Calibration: Difficulty: 4/10. The answer is explicitly stated in the text, making it a relatively straightforward factual recall question. However, it requires reading and understanding the context to locate the specific information.\n\nIntentional Question Planning: The question directly asks for the county where the Coal Creek War primarily occurred, testing the candidate's ability to extract precise details from the provided text. The question is designed to be clear and concise, focusing on a key element of the historical event.\n</document_analysis>\n<output_format>\nQuestion: During John P. Buchanan\u2019s governorship of Tennessee, an armed uprising by coal miners against the state\u2019s convict lease system occurred; this conflict, known as the Coal Creek War, was centered in which county?\nA: Knox County\nB: Davidson County\nC: Anderson County\nD: Hamilton County\nExplanation: The text explicitly states that the Coal Creek War, an armed uprising by coal miners, took place primarily in Anderson County, Tennessee.\nCorrect Answer: C\n</output_format>\n```",
    "question": "During John P. Buchanan\u2019s governorship of Tennessee, an armed uprising by coal miners against the state\u2019s convict lease system occurred; this conflict, known as the Coal Creek War, was centered in which county?",
    "choices": {
      "A": "Knox County",
      "B": "Davidson County",
      "C": "Anderson County",
      "D": "Hamilton County"
    },
    "answer": "C",
    "explanation": "The text explicitly states that the Coal Creek War, an armed uprising by coal miners, took place primarily in Anderson County, Tennessee.",
    "answer_correctness_score": 10,
    "explanation_validity_score": 10,
    "question_clarity_score": 8,
    "question_difficulty_score": 6,
    "question_groundedness_score": 10,
    "question_token_count": 45,
    "reformat_question_cosine_similarity_to_orig": 0.6891710162162781,
    "reformat_answer_cosine_similarity_to_orig": 1.0,
    "reformat_question_similarity_score": 9,
    "reformat_answer_similarity_score": 10,
    "avg_answer_token_count": 3
  },
  {
    "orig_question": "Which year did the quarterback, known by the nickname Kaep, get drafted?",
    "orig_answer": "2011",
    "context": "[PAR] [TLE] Kaep (disambiguation) [SEP] Kaep is a nickname for athlete Colin Kaepernick (although he prefers \"Kap\").  It may also refer to: [PAR] [TLE] Colin Kaepernick [SEP] Colin Rand Kaepernick ( ; born November 3, 1987) is an American football quarterback who is currently a free agent.  Kaepernick played college football at the University of Nevada, where he was named the Western Athletic Conference (WAC) Offensive Player of the Year twice and became the only player in NCAA Division I FBS history to amass 10,000 passing yards and 4,000 rushing yards in a career.  After graduating, he was selected by the San Francisco 49ers in the second round of the 2011 NFL Draft.",
    "response": "```xml\n<document_analysis>\nThoughtful Content Examination: The provided context details Colin Kaepernick's nickname \"Kaep\" and his football career, specifically mentioning his drafting year. The information is concise and directly answers the question.\n\nConcept Exploration: The text establishes the connection between \"Kaep\" and Colin Kaepernick, which is crucial for understanding the question. It also highlights his achievements in college football, providing additional background.\n\nStrategic Complexity Calibration: Difficulty: 3/10. While straightforward, the question requires identifying the correct nickname and then locating the corresponding draft year within the text.\n\nIntentional Question Planning: The question is designed to assess the ability to connect a nickname to a person and retrieve specific factual information from the text. I will rephrase to include more context from the provided paragraph, increasing the complexity slightly and ensuring the question is self-contained.\n</document_analysis>\n<output_format>\nQuestion: Colin Kaepernick, a former American football quarterback who achieved notable success at the University of Nevada\u2014becoming the only player in NCAA Division I FBS history to amass 10,000 passing yards and 4,000 rushing yards\u2014is also known by the nickname \"Kaep.\" In what year was this athlete drafted into the NFL, and by which team was he selected?\nA: 2010, drafted by the Seattle Seahawks\nB: 2011, drafted by the San Francisco 49ers\nC: 2012, drafted by the New England Patriots\nD: 2009, drafted by the Green Bay Packers\nExplanation: The text explicitly states that Colin Kaepernick was drafted by the San Francisco 49ers in the second round of the 2011 NFL Draft.\nCorrect Answer: B\n</output_format>\n```",
    "question": "Colin Kaepernick, a former American football quarterback who achieved notable success at the University of Nevada\u2014becoming the only player in NCAA Division I FBS history to amass 10,000 passing yards and 4,000 rushing yards\u2014is also known by the nickname \"Kaep.\" In what year was this athlete drafted into the NFL, and by which team was he selected?",
    "choices": {
      "A": "2010, drafted by the Seattle Seahawks",
      "B": "2011, drafted by the San Francisco 49ers",
      "C": "2012, drafted by the New England Patriots",
      "D": "2009, drafted by the Green Bay Packers"
    },
    "answer": "B",
    "explanation": "The text explicitly states that Colin Kaepernick was drafted by the San Francisco 49ers in the second round of the 2011 NFL Draft.",
    "answer_correctness_score": 10,
    "explanation_validity_score": 10,
    "question_clarity_score": 8,
    "question_difficulty_score": 2,
    "question_groundedness_score": 10,
    "question_token_count": 80,
    "reformat_question_cosine_similarity_to_orig": 0.7352876663208008,
    "reformat_answer_cosine_similarity_to_orig": 0.4674035906791687,
    "reformat_question_similarity_score": 8,
    "reformat_answer_similarity_score": 8,
    "avg_answer_token_count": 10
  },
  {
    "orig_question": "What band is the creator of the website with the slogan \"media for the 65.8 million\" part of?",
    "orig_answer": "The Daou",
    "context": "[PAR] [TLE] Verrit [SEP] The website's slogan says it is \"media for the 65.8 million,\" referring to the number of votes Hillary Clinton won in the 2016 presidential election.  Daou, an adviser to Clinton's 2008 presidential campaign, and prior chief executive of Shareblue told \"Business Insider\" that he intended the website to \"reflect the worldview\" of those who voted for Clinton and described the site as an \"online hub for Clinton backers so that they can find easy-to-share facts, stats and other information you can take out to social media when you\u2019re having debates on key issues people are discussing\".  Daou also said the website had no financial ties to Clinton. [PAR] [TLE] Peter Daou [SEP] Peter Daou is the creator of Verrit, the prior chief executive of Shareblue, and a member of the band The Daou.",
    "response": "```xml\n<document_analysis>\nThoughtful Content Examination: The context provides information about Verrit, a website created by Peter Daou, and its connection to Hillary Clinton's 2016 presidential campaign. It also states Peter Daou is a member of a band.\nConcept Exploration: The question focuses on a specific detail about the creator of the website \u2013 his involvement in a musical group. This requires recall of a relatively minor piece of information presented within the text.\nStrategic Complexity Calibration: Difficulty: 3/10. This is a fairly straightforward factual recall question.\nIntentional Question Planning: The question tests the ability to retain and recall specific details from the provided text. It's a simple fact-checking exercise.\n</document_analysis>\n<output_format>\nQuestion: Peter Daou, the creator of Verrit \u2013 a website whose slogan references the 65.8 million votes received by Hillary Clinton in the 2016 presidential election \u2013 also holds a position within a musical ensemble. What is the name of this band?\nA: Shareblue\nB: The 65.8 Million\nC: The Daou\nD: Hillary's Helpers\nExplanation: The text explicitly states, \u201cPeter Daou is the creator of Verrit...and a member of the band The Daou.\u201d\nCorrect Answer: C\n</output_format>\n```",
    "question": "Peter Daou, the creator of Verrit \u2013 a website whose slogan references the 65.8 million votes received by Hillary Clinton in the 2016 presidential election \u2013 also holds a position within a musical ensemble. What is the name of this band?",
    "choices": {
      "A": "Shareblue",
      "B": "The 65.8 Million",
      "C": "The Daou",
      "D": "Hillary's Helpers"
    },
    "answer": "C",
    "explanation": "The text explicitly states, \u201cPeter Daou is the creator of Verrit...and a member of the band The Daou.\u201d",
    "answer_correctness_score": 10,
    "explanation_validity_score": 10,
    "question_clarity_score": 8,
    "question_difficulty_score": 4,
    "question_groundedness_score": 10,
    "question_token_count": 52,
    "reformat_question_cosine_similarity_to_orig": 0.45928382873535156,
    "reformat_answer_cosine_similarity_to_orig": 1.000000238418579,
    "reformat_question_similarity_score": 9,
    "reformat_answer_similarity_score": 10,
    "avg_answer_token_count": 4
  },
  {
    "orig_question": "Red is the fourth studio album by American singer-songwriter Taylor Swift, Swift completed The Red Tour in support of the album on June 12, 2014, in which country?",
    "orig_answer": "Singapore",
    "context": "[PAR] [TLE] The Red Tour [SEP] The Red Tour was the third concert tour by American singer-songwriter Taylor Swift.  Launched in support of Swift's fourth studio album, \"Red\" (2012), the tour began on March 13, 2013 in Omaha, Nebraska and concluded on June 12, 2014 in Singapore. [PAR] [TLE] Red (Taylor Swift album) [SEP] Red is the fourth studio album by American singer-songwriter Taylor Swift.  It was released on October 22, 2012, by Big Machine Records, as the follow-up to her third studio album, \"Speak Now\".  The album title was inspired by the \"semi-toxic relationships\" that Swift experienced during the process of conceiving this album, which Swift described the emotions she felt as \"red emotions\" due to their intense and tumultuous nature.  \"Red\" touches on Swift's signature themes of love and heartbreak, however, from a more mature perspective while exploring other themes such as fame and the pressure of being in the limelight.  The album features collaborations with producers and guest artists such as Gary Lightbody of Snow Patrol and Ed Sheeran and is noted for Swift's experimentation with new musical genres.  Swift completed The Red Tour in support of the album on June 12, 2014, which became the highest-grossing tour of all time by a country artist, grossing over $150 million.",
    "response": "```xml\n<document_analysis>\nThoughtful Content Examination: The context provides information about Taylor Swift's \"Red\" album and the subsequent \"Red Tour.\" The question asks about the location where the tour concluded.\nConcept Exploration: The question tests factual recall related to the timeline and geography of Taylor Swift's career. It's a straightforward question but requires knowing a specific detail.\nStrategic Complexity Calibration: Difficulty is rated a 3/10. It's a fact directly stated in the text. However, it's suitable as a baseline question within a larger set.\nIntentional Question Planning: The question is designed to assess basic comprehension of the provided text and recall of specific details.\n</document_analysis>\n<output_format>\nQuestion: Taylor Swift's \"Red\" album, released in 2012 by Big Machine Records, was supported by The Red Tour, which spanned from March 13, 2013, to June 12, 2014. The album\u2019s title reflects the intense emotions Swift experienced during tumultuous relationships. In what country did The Red Tour conclude on June 12, 2014?\nA: United States\nB: England\nC: Singapore\nD: Ireland\nExplanation: The provided text states that The Red Tour concluded on June 12, 2014, in Singapore.\nCorrect Answer: C\n</output_format>\n```",
    "question": "Taylor Swift's \"Red\" album, released in 2012 by Big Machine Records, was supported by The Red Tour, which spanned from March 13, 2013, to June 12, 2014. The album\u2019s title reflects the intense emotions Swift experienced during tumultuous relationships. In what country did The Red Tour conclude on June 12, 2014?",
    "choices": {
      "A": "United States",
      "B": "England",
      "C": "Singapore",
      "D": "Ireland"
    },
    "answer": "C",
    "explanation": "The provided text states that The Red Tour concluded on June 12, 2014, in Singapore.",
    "answer_correctness_score": 10,
    "explanation_validity_score": 10,
    "question_clarity_score": 4,
    "question_difficulty_score": 3,
    "question_groundedness_score": 10,
    "question_token_count": 78,
    "reformat_question_cosine_similarity_to_orig": 0.8771494030952454,
    "reformat_answer_cosine_similarity_to_orig": 0.9999998807907104,
    "reformat_question_similarity_score": 10,
    "reformat_answer_similarity_score": 10,
    "avg_answer_token_count": 2
  },
  {
    "orig_question": "The man of the watch of the 2001 Intercontinental Cup was a footballer of what nationality?",
    "orig_answer": "Ghanaian",
    "context": "[PAR] [TLE] 2001 Intercontinental Cup [SEP] The 2001 Intercontinental Cup was a football match played on 27 November 2001 between Bayern Munich, winners of the 2000\u201301 UEFA Champions League, and defending champions Boca Juniors, winners of the 2001 Copa Libertadores.  The match was played at the neutral venue of the National Stadium in Tokyo in front of 51,360 fans.  Samuel Kuffour was named as man of the match. [PAR] [TLE] Samuel Kuffour [SEP] Samuel Osei Kuffour (born 3 September 1976) is a Ghanaian retired professional footballer who played as a defender.",
    "response": "```xml\n<document_analysis>\nThoughtful Content Examination: The context provides information about the 2001 Intercontinental Cup and Samuel Kuffour, who was named man of the match. The question asks for Kuffour's nationality.\nConcept Exploration: The question tests recall of a specific detail related to the event and the individual recognized for their performance.\nStrategic Complexity Calibration: Difficulty: 3/10. It's a fairly straightforward factual recall question. I will increase the difficulty by adding distractors that are plausible but incorrect.\nIntentional Question Planning: The question directly assesses the ability to recall a specific detail from the provided text. It\u2019s a factual question.\n</document_analysis>\n<output_format>\nQuestion: During the 2001 Intercontinental Cup, contested between Bayern Munich and Boca Juniors at the National Stadium in Tokyo, Samuel Kuffour received the distinction of being named man of the match. Considering his professional football career as a defender, what is Samuel Kuffour\u2019s nationality?\nA: Brazilian\nB: Argentinian\nC: Ghanaian\nD: German\nExplanation: The text explicitly states that Samuel Kuffour is a Ghanaian retired professional footballer.\nCorrect Answer: C\n</output_format>\n```",
    "question": "During the 2001 Intercontinental Cup, contested between Bayern Munich and Boca Juniors at the National Stadium in Tokyo, Samuel Kuffour received the distinction of being named man of the match. Considering his professional football career as a defender, what is Samuel Kuffour\u2019s nationality?",
    "choices": {
      "A": "Brazilian",
      "B": "Argentinian",
      "C": "Ghanaian",
      "D": "German"
    },
    "answer": "C",
    "explanation": "The text explicitly states that Samuel Kuffour is a Ghanaian retired professional footballer.",
    "answer_correctness_score": 10,
    "explanation_validity_score": 10,
    "question_clarity_score": 8,
    "question_difficulty_score": 2,
    "question_groundedness_score": 10,
    "question_token_count": 57,
    "reformat_question_cosine_similarity_to_orig": 0.6320102214813232,
    "reformat_answer_cosine_similarity_to_orig": 0.9999999403953552,
    "reformat_question_similarity_score": 10,
    "reformat_answer_similarity_score": 10,
    "avg_answer_token_count": 3
  },
  {
    "orig_question": "\"Breathing Your Love\" is a song by the Swedish singer Darin featuring vocals by singer Kat DeLuna, in October 2009 which Swedish ESA astronaut, and physicist, took 2 copies of the single into space with him?",
    "orig_answer": "Christer Fuglesang",
    "context": "[PAR] [TLE] Christer Fuglesang [SEP] Arne Christer Fuglesang (] ) (born March 18, 1957 in Stockholm) is a Swedish physicist and an ESA astronaut.  He was first launched aboard the STS-116 Space Shuttle mission on December 10, 2006, at 01:47 GMT, making him the first Swedish citizen in space. [PAR] [TLE] Breathing Your Love [SEP] \"Breathing Your Love\" is a song by the Swedish singer Darin featuring vocals by singer Kat DeLuna and the first single from \"Flashback\".  The song co-written by Darin with RedOne, Bilal Hajji and Novel was released to radio stations and as a digital download in Sweden on 8 October 2008.  The single was released in Finland and is also the first single from Darin to be released in the United Kingdom in January 2010.  In October 2009 Swedish astronaut Christer Fuglesang took 2 copies of the single into space with him, as his daughter is a Darin fan, a photo of the disc can be seen with earth in the distance can be found on the official Darin website.",
    "response": "```xml\n<document_analysis>\nThoughtful Content Examination: The context provides information about Christer Fuglesang, a Swedish astronaut, and the song \"Breathing Your Love\" by Darin. It specifically states that Fuglesang took copies of the song into space because his daughter is a fan.\n\nConcept Exploration: The question directly tests recall of a specific detail linking the astronaut and the song. It's a factual question, but requires connecting two pieces of information from the provided text.\n\nStrategic Complexity Calibration: Difficulty: 3/10. It's a straightforward recall question, but requires reading both paragraphs to answer correctly.\n\nIntentional Question Planning: The question is designed to assess if the reader can identify the connection between the astronaut and the song and recall the astronaut's name.\n</document_analysis>\n<output_format>\nQuestion: In October 2009, Swedish astronaut and physicist, Arne Christer Fuglesang, born in Stockholm on March 18, 1957, took two copies of the song \u201cBreathing Your Love\u201d featuring vocals by Kat DeLuna into space with him; what is the name of the Swedish ESA astronaut?\nA: Bjorn Borg\nB: Christer Fuglesang\nC: Avicii\nD: Zlatan Ibrahimovi\u0107\nExplanation: The text explicitly states that \u201cSwedish astronaut Christer Fuglesang took 2 copies of the single into space with him.\u201d\nCorrect Answer: B\n</output_format>\n```",
    "question": "In October 2009, Swedish astronaut and physicist, Arne Christer Fuglesang, born in Stockholm on March 18, 1957, took two copies of the song \u201cBreathing Your Love\u201d featuring vocals by Kat DeLuna into space with him; what is the name of the Swedish ESA astronaut?",
    "choices": {
      "A": "Bjorn Borg",
      "B": "Christer Fuglesang",
      "C": "Avicii",
      "D": "Zlatan Ibrahimovi\u0107"
    },
    "answer": "B",
    "explanation": "The text explicitly states that \u201cSwedish astronaut Christer Fuglesang took 2 copies of the single into space with him.\u201d",
    "answer_correctness_score": 10,
    "explanation_validity_score": 10,
    "question_clarity_score": 4,
    "question_difficulty_score": 2,
    "question_groundedness_score": 1,
    "question_token_count": 66,
    "reformat_question_cosine_similarity_to_orig": 0.7683054208755493,
    "reformat_answer_cosine_similarity_to_orig": 1.0000001192092896,
    "reformat_question_similarity_score": 9,
    "reformat_answer_similarity_score": 10,
    "avg_answer_token_count": 4
  },
  {
    "orig_question": "What position did the person who named the 1st Battle of Kharkov hold during World War II?",
    "orig_answer": "Chief of the Armed Forces High Command",
    "context": "[PAR] [TLE] Wilhelm Keitel [SEP] Wilhelm Keitel (22 September 1882 \u2013 16 October 1946) was a German field marshal who served as Chief of the Armed Forces High Command (\"Oberkommando der Wehrmacht\" or OKW) in Nazi Germany during World War II.  According to David Stahel, Keitel was \"well known and [...] reviled as Hitler's dependable mouthpiece and habitual yes-man\" among his military colleagues. [PAR] [TLE] First Battle of Kharkov [SEP] The 1st Battle of Kharkov, so named by Wilhelm Keitel, was the 1941 tactical battle for the city of Kharkov (now \"Kharkiv\") (Ukrainian SSR) during the final phase of Operation \"Barbarossa\" between the German 6th Army of Army Group South and the Soviet Southwestern Front.  The Soviet 38th Army was ordered to defend the city while its factories were dismantled for relocation farther east.",
    "response": "```xml\n<document_analysis>\nThoughtful Content Examination: The context provides information about Wilhelm Keitel and the naming of the 1st Battle of Kharkov. It establishes that Keitel named the battle and held a specific position during WWII. The question directly asks about the position Keitel held.\n\nConcept Exploration: This question tests the recall of a specific detail related to a historical figure and event. It requires understanding the connection between Keitel and the 1st Battle of Kharkov as presented in the text.\n\nStrategic Complexity Calibration: Difficulty: 4/10. This is a relatively straightforward factual recall question but requires reading comprehension to connect the two pieces of information.\n\nIntentional Question Planning: The question aims to assess the test-taker\u2019s ability to identify and recall specific details from the provided context. It encourages a direct connection between Keitel\u2019s role and the naming of the battle.\n</document_analysis>\n<output_format>\nQuestion: Wilhelm Keitel is noted as the individual who named the 1941 tactical battle for the city of Kharkov during the final phase of Operation \"Barbarossa.\" During World War II, what was Wilhelm Keitel's official position within Nazi Germany?\nA: Commander of the 6th Army of Army Group South\nB: Chief of the Armed Forces High Command (\"Oberkommando der Wehrmacht\" or OKW)\nC: Head of Soviet Southwestern Front\nD: Overseer of factory dismantling and relocation in the Ukrainian SSR\nExplanation: The provided text explicitly states that Wilhelm Keitel served as Chief of the Armed Forces High Command (\"Oberkommando der Wehrmacht\" or OKW) in Nazi Germany during World War II.\nCorrect Answer: B\n</output_format>\n```",
    "question": "Wilhelm Keitel is noted as the individual who named the 1941 tactical battle for the city of Kharkov during the final phase of Operation \"Barbarossa.\" During World War II, what was Wilhelm Keitel's official position within Nazi Germany?",
    "choices": {
      "A": "Commander of the 6th Army of Army Group South",
      "B": "Chief of the Armed Forces High Command (\"Oberkommando der Wehrmacht\" or OKW)",
      "C": "Head of Soviet Southwestern Front",
      "D": "Overseer of factory dismantling and relocation in the Ukrainian SSR"
    },
    "answer": "B",
    "explanation": "The provided text explicitly states that Wilhelm Keitel served as Chief of the Armed Forces High Command (\"Oberkommando der Wehrmacht\" or OKW) in Nazi Germany during World War II.",
    "answer_correctness_score": 10,
    "explanation_validity_score": 10,
    "question_clarity_score": 9,
    "question_difficulty_score": 4,
    "question_groundedness_score": 1,
    "question_token_count": 52,
    "reformat_question_cosine_similarity_to_orig": 0.6537339687347412,
    "reformat_answer_cosine_similarity_to_orig": 0.7185615301132202,
    "reformat_question_similarity_score": 9,
    "reformat_answer_similarity_score": 9,
    "avg_answer_token_count": 13
  },
  {
    "orig_question": "The Knicks\u2013Nuggets was the most penalized on-court fight in the NBA since an altercation that occured in what city?",
    "orig_answer": "Auburn Hills",
    "context": "[PAR] [TLE] Pacers\u2013Pistons brawl [SEP] The Pacers\u2013Pistons brawl (colloquially known as the Malice at the Palace or Basketbrawl) was an altercation that occurred in a National Basketball Association (NBA) game between the Indiana Pacers and the Detroit Pistons on November 19, 2004, at The Palace of Auburn Hills in Auburn Hills, Michigan.  The Associated Press (AP) called it \"the most infamous brawl in NBA history\". [PAR] [TLE] Knicks\u2013Nuggets brawl [SEP] The Knicks\u2013Nuggets brawl was an on-court altercation at a National Basketball Association (NBA) game between the New York Knicks and Denver Nuggets at Madison Square Garden in New York City on December 16, 2006.  This altercation was the most penalized on-court fight in the NBA since the Pacers\u2013Pistons brawl two years before.",
    "response": "```xml\n<document_analysis>\nThoughtful Content Examination: The context discusses two NBA brawls: the Pacers\u2013Pistons brawl (\"Malice at the Palace\") and the Knicks\u2013Nuggets brawl. The key information is that the Knicks\u2013Nuggets brawl was the most penalized since the Pacers\u2013Pistons brawl. The location of the Pacers\u2013Pistons brawl is specified as Auburn Hills, Michigan.\nConcept Exploration: The question tests recall of the location associated with a prior event mentioned in relation to another. It relies on understanding the temporal relationship (\"since\") and identifying the relevant event.\nStrategic Complexity Calibration: Difficulty: 6/10. This requires recalling a specific detail (city) from one event to answer a question about another. It's not overly complex, but not trivial either.\nIntentional Question Planning: The question aims to assess the ability to connect information across different parts of the text and recall a specific detail.\n</document_analysis>\n<output_format>\nQuestion: In December 2006, an altercation between the New York Knicks and Denver Nuggets at Madison Square Garden resulted in the most penalized on-court fight in the NBA in two years; this fight was most penalized since a similar incident involving the Indiana Pacers and Detroit Pistons. The Pacers\u2013Pistons altercation took place at The Palace in what city?\nA: New York City\nB: Denver\nC: Auburn Hills\nD: Indianapolis\nExplanation: The text states the Pacers\u2013Pistons brawl occurred at The Palace of Auburn Hills in Auburn Hills, Michigan.\nCorrect Answer: C\n</output_format>\n```",
    "question": "In December 2006, an altercation between the New York Knicks and Denver Nuggets at Madison Square Garden resulted in the most penalized on-court fight in the NBA in two years; this fight was most penalized since a similar incident involving the Indiana Pacers and Detroit Pistons. The Pacers\u2013Pistons altercation took place at The Palace in what city?",
    "choices": {
      "A": "New York City",
      "B": "Denver",
      "C": "Auburn Hills",
      "D": "Indianapolis"
    },
    "answer": "C",
    "explanation": "The text states the Pacers\u2013Pistons brawl occurred at The Palace of Auburn Hills in Auburn Hills, Michigan.",
    "answer_correctness_score": 10,
    "explanation_validity_score": 10,
    "question_clarity_score": 8,
    "question_difficulty_score": 3,
    "question_groundedness_score": 10,
    "question_token_count": 78,
    "reformat_question_cosine_similarity_to_orig": 0.8675484657287598,
    "reformat_answer_cosine_similarity_to_orig": 0.9999998807907104,
    "reformat_question_similarity_score": 8,
    "reformat_answer_similarity_score": 10,
    "avg_answer_token_count": 3
  },
  {
    "orig_question": "The man featured in the documentary The Man Who Predicted 9/11 led hundreds out of which tower before its collapse?",
    "orig_answer": "the South Tower",
    "context": "[PAR] [TLE] Rick Rescorla [SEP] Cyril Richard Rescorla (May 27, 1939 \u2013 September 11, 2001) was a United States Army officer and private security officer of British origin who served in Northern Rhodesia as a member of the Northern Rhodesia Police (NRP) and as a commissioned officer in the Vietnam War, where he was a second lieutenant in the United States Army. [PAR] [TLE] The Man Who Predicted 9/11 [SEP] The Man Who Predicted 9/11 is a documentary television film that premiered in 2002 on The History Channel.  The programme is centered on the director of security of Morgan Stanley, Rick Rescorla, who predicted an attack on the World Trade Center and led hundreds out of the South Tower before dying in its collapse.  The film was shown on Channel 4 in the United Kingdom and The History Channel in the United States.",
    "response": "```xml\n<document_analysis>\nThoughtful Content Examination:\nThe context provides information about Rick Rescorla, his background, and his role in predicting and responding to the 9/11 attacks. It specifically highlights that he directed security for Morgan Stanley and led hundreds of people out of a specific tower before it collapsed. The documentary \"The Man Who Predicted 9/11\" focuses on his actions.\n\nConcept Exploration:\nThe core concept revolves around preparedness, leadership under pressure, and the tragic events of 9/11. The context subtly emphasizes Rescorla's foresight and bravery.\n\nStrategic Complexity Calibration:\nDifficulty: 6/10. This question tests recall of a specific detail from the provided text. While not overly complex, it requires careful reading and attention to detail.\n\nIntentional Question Planning:\nThe question is designed to assess whether the domain expert can recall the specific detail of which tower Rescorla evacuated people from. It tests comprehension of the documentary's central theme and Rescorla's actions.\n</document_analysis>\n<output_format>\nQuestion: Cyril Richard Rescorla, a British-born security expert, gained prominence for his proactive security measures at Morgan Stanley and his courageous actions during the September 11th attacks. Featured in the 2002 documentary \u201cThe Man Who Predicted 9/11,\u201d Rescorla successfully guided hundreds of individuals to safety. Which World Trade Center tower did Rescorla lead these individuals out of prior to its tragic collapse?\nA: The North Tower\nB: The East Tower\nC: The South Tower\nD: The West Tower\nExplanation: The documentary centers on Rick Rescorla, who led hundreds out of the South Tower before it collapsed, as stated in the provided text.\nCorrect Answer: C\n</output_format>\n```",
    "question": "Cyril Richard Rescorla, a British-born security expert, gained prominence for his proactive security measures at Morgan Stanley and his courageous actions during the September 11th attacks. Featured in the 2002 documentary \u201cThe Man Who Predicted 9/11,\u201d Rescorla successfully guided hundreds of individuals to safety. Which World Trade Center tower did Rescorla lead these individuals out of prior to its tragic collapse?",
    "choices": {
      "A": "The North Tower",
      "B": "The East Tower",
      "C": "The South Tower",
      "D": "The West Tower"
    },
    "answer": "C",
    "explanation": "The documentary centers on Rick Rescorla, who led hundreds out of the South Tower before it collapsed, as stated in the provided text.",
    "answer_correctness_score": 10,
    "explanation_validity_score": 10,
    "question_clarity_score": 6,
    "question_difficulty_score": 6,
    "question_groundedness_score": 10,
    "question_token_count": 85,
    "reformat_question_cosine_similarity_to_orig": 0.6758415699005127,
    "reformat_answer_cosine_similarity_to_orig": 1.0,
    "reformat_question_similarity_score": 10,
    "reformat_answer_similarity_score": 10,
    "avg_answer_token_count": 4
  },
  {
    "orig_question": "Two Lanes of Freedom included a cameo by which other male country singer on guitar?",
    "orig_answer": "Keith Urban",
    "context": "[PAR] [TLE] Highway Don't Care [SEP] \"Highway Don't Care\" is a song performed by American country music artist Tim McGraw and features American singer-songwriter Taylor Swift on vocals, as well as Keith Urban on guitar.  It was released in March 2013 as the third single from McGraw's first album for Big Machine Records, \"Two Lanes of Freedom\" (2013).  The song was written by Mark Irwin, Josh Kear and Brad and Brett Warren.  McGraw and Swift recorded their parts separately. [PAR] [TLE] Two Lanes of Freedom [SEP] Two Lanes of Freedom is the twelfth studio album by American country music artist Tim McGraw.  It was released February 5, 2013, as his first album for Big Machine Records following a 20-year tenure with Curb Records.  He co-produced the album with Byron Gallimore, producer of his previously released albums.  The album includes the singles \"Truck Yeah\", \"One of Those Nights\", \"Highway Don't Care\" featuring new labelmate Taylor Swift, and \"Southern Girl\".",
    "response": "```xml\n<document_analysis>\nThoughtful Content Examination: The provided context details the song \"Highway Don't Care\" and the album \"Two Lanes of Freedom.\" It specifies that Taylor Swift provided vocals, and Keith Urban played guitar on the song. The question asks about a male country singer featured on guitar.\n\nConcept Exploration: The information is straightforward and factual. There's no hidden complexity or implicit assumption. It's a direct recall question.\n\nStrategic Complexity Calibration: Difficulty: 3/10. While factual, the question tests recall of a specific detail within the provided text.\n\nIntentional Question Planning: The question tests the ability to identify supporting details. It requires recognizing that the guitar performance is a feature of the song.\n</document_analysis>\n<output_format>\nQuestion: Tim McGraw\u2019s album, \u201cTwo Lanes of Freedom,\u201d released in February 2013, featured the single \u201cHighway Don\u2019t Care,\u201d which included vocals from Taylor Swift and instrumental contributions from other artists. Considering the details provided, which male country music artist contributed a guitar performance to the song \u201cHighway Don\u2019t Care?\u201d\nA: Brad Warren\nB: Byron Gallimore\nC: Keith Urban\nD: Josh Kear\nExplanation: The provided text states, \u201c'Highway Don't Care' \u2026 features American singer-songwriter Taylor Swift on vocals, as well as Keith Urban on guitar.\u201d This directly answers the question.\nCorrect Answer: C\n</output_format>\n```",
    "question": "Tim McGraw\u2019s album, \u201cTwo Lanes of Freedom,\u201d released in February 2013, featured the single \u201cHighway Don\u2019t Care,\u201d which included vocals from Taylor Swift and instrumental contributions from other artists. Considering the details provided, which male country music artist contributed a guitar performance to the song \u201cHighway Don\u2019t Care?\u201d",
    "choices": {
      "A": "Brad Warren",
      "B": "Byron Gallimore",
      "C": "Keith Urban",
      "D": "Josh Kear"
    },
    "answer": "C",
    "explanation": "The provided text states, \u201c'Highway Don't Care' \u2026 features American singer-songwriter Taylor Swift on vocals, as well as Keith Urban on guitar.\u201d This directly answers the question.",
    "answer_correctness_score": 10,
    "explanation_validity_score": 10,
    "question_clarity_score": 8,
    "question_difficulty_score": 2,
    "question_groundedness_score": 10,
    "question_token_count": 68,
    "reformat_question_cosine_similarity_to_orig": 0.6467100381851196,
    "reformat_answer_cosine_similarity_to_orig": 1.0,
    "reformat_question_similarity_score": 9,
    "reformat_answer_similarity_score": 10,
    "avg_answer_token_count": 3
  }
]