[
  {
    "context": "<P> The fourth season began airing on October 10 , 2017 , on The CW . </P>",
    "topic": "How the airing of a fourth season reflects on the show's popularity and the network's decision-making process.",
    "response": "<document_analysis>\nTo generate a question that reflects on the show's popularity and the network's decision-making process based on the airing of a fourth season, we must first analyze the given context. The context provided is quite brief, stating only that the fourth season of a show began airing on October 10, 2017, on The CW. \n\nGiven the brevity and lack of detailed information about viewership numbers, audience reception, or the network's strategic considerations, we must infer and generalize from the fact that a fourth season was commissioned and aired. The decision to produce and air a fourth season typically indicates that the show has maintained a significant level of popularity or strategic importance to the network.\n\nThe thoughtful content examination reveals that the central idea here is the network's decision to continue the show into a fourth season. Concept exploration suggests considering the implications of this decision, such as the show's performance in previous seasons, its audience, and how it fits into the network's programming strategy.\n\nStrategic complexity calibration suggests that a question about the implications of airing a fourth season on the show's popularity and the network's decision-making process could be quite challenging, as it requires an understanding of television production, audience metrics, and network strategies. This would rate an 8 out of 10 in terms of difficulty, as it demands a deep understanding of the television industry and the factors that influence programming decisions.\n\nIntentional question planning involves crafting a question that invites deeper understanding and critical engagement with the topic. A question that asks about the reflection of the show's popularity and the network's decision-making process based on the airing of a fourth season could encourage analysis of the show's performance, audience engagement, and the network's strategic goals.\n\nHowever, given the lack of specific details in the provided context, the question must be designed to be answerable based on general knowledge of the television industry and the principles guiding network decisions regarding show renewals.\n</document_analysis>\n\n<output_format>\nQuestion: What does the renewal of a television series for a fourth season generally indicate about its performance and the network's strategic considerations?\nA: The show has consistently high ratings and is a flagship series for the network.\nB: The show has a dedicated niche audience and is relatively inexpensive to produce.\nC: The network is attempting to fill a programming gap with a familiar brand.\nD: The show's production company has a contractual obligation with the network for a minimum number of seasons.\n\nExplanation: The renewal of a series for a fourth season typically suggests that the show has maintained a level of viewership or strategic value that justifies further investment. While high ratings (A) can be a factor, they are not the only consideration. A dedicated niche audience (B) and relatively low production costs can also make a show attractive for renewal. Filling a programming gap (C) might be a factor but is less directly related to the show's inherent performance or popularity. A contractual obligation (D) could influence renewal decisions but is not a common practice that would \"generally indicate\" a show's performance or popularity.\n\nCorrect Answer: B\n</output_format>",
    "question": "What does the renewal of a television series for a fourth season generally indicate about its performance and the network's strategic considerations?",
    "choices": {
      "A": "The show has consistently high ratings and is a flagship series for the network.",
      "B": "The show has a dedicated niche audience and is relatively inexpensive to produce.",
      "C": "The network is attempting to fill a programming gap with a familiar brand.",
      "D": "The show's production company has a contractual obligation with the network for a minimum number of seasons."
    },
    "answer": "B",
    "explanation": "The renewal of a series for a fourth season typically suggests that the show has maintained a level of viewership or strategic value that justifies further investment. While high ratings (A) can be a factor, they are not the only consideration. A dedicated niche audience (B) and relatively low production costs can also make a show attractive for renewal. Filling a programming gap (C) might be a factor but is less directly related to the show's inherent performance or popularity. A contractual obligation (D) could influence renewal decisions but is not a common practice that would \"generally indicate\" a show's performance or popularity.",
    "question_token_count": 25,
    "answer_correctness_score": 8,
    "explanation_validity_score": 9,
    "question_clarity_score": 8,
    "question_difficulty_score": 6,
    "question_groundedness_score": 1,
    "avg_answer_token_count": 16
  },
  {
    "context": "<P> `` I Can Only Imagine '' ( sometimes shortened to `` Imagine '' ) is a single recorded by Christian rock band MercyMe . Written and composed by lead vocalist Bart Millard , the song , based around a main piano track , was inspired by the death of Millard 's father and considers what it would be like in Heaven and to be standing before God . The song was first issued as a track on MercyMe 's 1999 album The Worship Project , which was released on an independent record label . The song was re-recorded and included on their 2001 major - label debut album Almost There as the fifth song on the album . </P>",
    "topic": "The album \"The Worship Project\" and its significance in the discography of MercyMe, including the inclusion of the song \"I Can Only Imagine\".",
    "response": "<document_analysis>\nTo generate a highly insightful and probing question-answer pair, I will carefully analyze the provided context. The context discusses the song \"I Can Only Imagine\" by MercyMe, its inspiration, and its inclusion in the album \"The Worship Project\". \n\nThe central idea of the context is the song's significance and its connection to the lead vocalist Bart Millard's personal experience. The context also mentions the song's re-recording and inclusion in the album \"Almost There\". \n\nUpon examining the context, I noticed that the album \"The Worship Project\" is mentioned as the initial release of the song \"I Can Only Imagine\". However, the context does not provide extensive information about the album itself, such as its production, reception, or other notable tracks. \n\nTo create a challenging question, I will focus on the relationship between the song \"I Can Only Imagine\" and the album \"The Worship Project\", as well as the significance of the song in MercyMe's discography. \n\nI will rate the difficulty of the question as 8 out of 10, considering that it requires a deep understanding of the context and the ability to make connections between the song, the album, and the band's discography.\n</document_analysis>\n\n<output_format>\nQuestion: What was the primary factor that led to the re-recording of \"I Can Only Imagine\" for MercyMe's major-label debut album \"Almost There\"?\nA: The song's initial release on an independent record label\nB: The song's popularity and demand for a higher-quality recording\nC: The band's desire to create a more worship-focused album\nD: The lead vocalist's personal desire to re-record the song with a different arrangement\nExplanation: The correct answer is A, as the song was initially released on an independent record label, and the re-recording was likely done to improve the production quality and reach a wider audience with the major-label debut album \"Almost There\".\nCorrect Answer: A\n</output_format>",
    "question": "What was the primary factor that led to the re-recording of \"I Can Only Imagine\" for MercyMe's major-label debut album \"Almost There\"?",
    "choices": {
      "A": "The song's initial release on an independent record label",
      "B": "The song's popularity and demand for a higher-quality recording",
      "C": "The band's desire to create a more worship-focused album",
      "D": "The lead vocalist's personal desire to re-record the song with a different arrangement"
    },
    "answer": "A",
    "explanation": "The correct answer is A, as the song was initially released on an independent record label, and the re-recording was likely done to improve the production quality and reach a wider audience with the major-label debut album \"Almost There\".",
    "question_token_count": 32,
    "answer_correctness_score": 9,
    "explanation_validity_score": 9,
    "question_clarity_score": 4,
    "question_difficulty_score": 7,
    "question_groundedness_score": 1,
    "avg_answer_token_count": 13
  },
  {
    "context": "<P> The Lord of the Rings is a film series consisting of three high fantasy adventure films directed by Peter Jackson . They are based on the novel The Lord of the Rings by J.R.R. Tolkien . The films are subtitled The Fellowship of the Ring ( 2001 ) , The Two Towers ( 2002 ) and The Return of the King ( 2003 ) . They are a New Zealand - American venture produced by WingNut Films and The Saul Zaentz Company and distributed by New Line Cinema . </P>",
    "topic": "The subtitles of the three films in the Lord of the Rings series, including The Fellowship of the Ring, The Two Towers, and The Return of the King, and their respective release years.",
    "response": "<document_analysis>\nThe provided context discusses the Lord of the Rings film series, which consists of three high fantasy adventure films directed by Peter Jackson. The films are based on the novel The Lord of the Rings by J.R.R. Tolkien and are subtitled The Fellowship of the Ring, The Two Towers, and The Return of the King, released in 2001, 2002, and 2003, respectively. \n\nThe central idea of the context is the introduction of the Lord of the Rings film series, its director, the basis of the films (the novel by J.R.R. Tolkien), and the release years of each film. The relationships within the context include the connection between the novel and the film series, as well as the production and distribution details of the films.\n\nUpon analyzing the context, it's clear that the information provided is coherent, educationally valuable, and relevant to the topic of the Lord of the Rings film series. The difficulty level of generating a question from this context can be rated as moderate to high (6-8 out of 10), considering the specific details about the film series that need to be recalled.\n\nTo create a challenging question, we need to focus on the nuances of the information provided, such as the release years, the subtitles of the films, and the connection to the novel. A question that requires the synthesis of this information and encourages deeper thought would be ideal.\n\nGiven the context, a thoughtful and engaging question could be designed to test the understanding of the film series' structure and release timeline. The question should be self-contained, clear, and require a deep understanding of the content without being too obvious or easy to answer.\n\nThought_process: The question should invite the domain expert to reflect on the specifics of the film series, such as the sequence of the films and their release years, and how these relate to the overall narrative or production of the series. This requires not just recalling the titles and years but understanding how they fit into the broader context of the series and its production.\n\n</document_analysis>\n\n<output_format>\nQuestion: What distinguishes the release sequence of the Lord of the Rings film trilogy from other film trilogies in terms of production and narrative continuity?\nA: The films were released in reverse chronological order of their production.\nB: Each film was released exactly one year after the previous installment.\nC: The trilogy was filmed simultaneously before any of the films were released.\nD: The release of each film coincided with the anniversary of J.R.R. Tolkien's birth.\n\nExplanation: The correct answer reflects an understanding of the production and release timeline of the Lord of the Rings film series. The series is notable for its consecutive annual releases, which is a distinguishing factor in film production, especially for trilogies.\n\nCorrect Answer: B\n</output_format>",
    "question": "What distinguishes the release sequence of the Lord of the Rings film trilogy from other film trilogies in terms of production and narrative continuity?",
    "choices": {
      "A": "The films were released in reverse chronological order of their production.",
      "B": "Each film was released exactly one year after the previous installment.",
      "C": "The trilogy was filmed simultaneously before any of the films were released.",
      "D": "The release of each film coincided with the anniversary of J.R.R. Tolkien's birth."
    },
    "answer": "B",
    "explanation": "The correct answer reflects an understanding of the production and release timeline of the Lord of the Rings film series. The series is notable for its consecutive annual releases, which is a distinguishing factor in film production, especially for trilogies.",
    "question_token_count": 28,
    "answer_correctness_score": 10,
    "explanation_validity_score": 8,
    "question_clarity_score": 8,
    "question_difficulty_score": 7,
    "question_groundedness_score": 2,
    "avg_answer_token_count": 15
  },
  {
    "context": "<P> `` Let It Go '' is a song from Disney 's 2013 animated feature film Frozen , whose music and lyrics were composed by husband - and - wife songwriting team Kristen Anderson - Lopez and Robert Lopez . The song was performed in its original show - tune version in the film by American actress and singer Idina Menzel in her vocal role as Queen Elsa . Anderson - Lopez and Lopez also composed a simplified pop version ( with shorter lyrics and background chorus ) which was performed by actress and singer Demi Lovato over the start of the film 's closing credits . A music video was separately released for the pop version . </P>",
    "topic": "The performance of \"Let It Go\" by Idina Menzel in her vocal role as Queen Elsa and its significance in the film Frozen.",
    "response": "<document_analysis>\nTo generate a highly insightful and probing question-answer pair, a careful analysis of the provided context is necessary. The context discusses the song \"Let It Go\" from Disney's 2013 animated film Frozen, focusing on its composition by Kristen Anderson-Lopez and Robert Lopez, and its performance by Idina Menzel as Queen Elsa. \n\nGiven the information, a thoughtful examination reveals that the song has two versions: the original show-tune version performed by Idina Menzel within the film and a simplified pop version performed by Demi Lovato over the film's closing credits. \n\nThe strategic complexity calibration for this question should be high, as it aims to probe domain expert knowledge about the song's significance and performance in the film. \n\nThe decision criteria for question generation are met since the context contains meaningful and coherent content related to the song and its performances. \n\nTherefore, the question should be designed to encourage deeper understanding, meaningful reflection, or critical engagement with the content, ensuring it is purposeful and challenging for domain experts.\n</document_analysis>\n\n<output_format>\nQuestion: What distinguishes the version of \"Let It Go\" performed by Idina Menzel in the film from the version performed by Demi Lovato?\nA: The language used in the lyrics\nB: The presence of a background chorus and shorter lyrics\nC: The genre of music, with Menzel's being hip-hop\nD: The speed of the song, with Lovato's being faster\n\nExplanation: The correct answer, B, highlights the difference in the versions of \"Let It Go\" as described in the context. The version performed by Demi Lovato is a simplified pop version with shorter lyrics and a background chorus, distinguishing it from Idina Menzel's original show-tune version.\n\nCorrect Answer: B\n</output_format>",
    "question": "What distinguishes the version of \"Let It Go\" performed by Idina Menzel in the film from the version performed by Demi Lovato?",
    "choices": {
      "A": "The language used in the lyrics",
      "B": "The presence of a background chorus and shorter lyrics",
      "C": "The genre of music, with Menzel's being hip-hop",
      "D": "The speed of the song, with Lovato's being faster"
    },
    "answer": "B",
    "explanation": "The correct answer, B, highlights the difference in the versions of \"Let It Go\" as described in the context. The version performed by Demi Lovato is a simplified pop version with shorter lyrics and a background chorus, distinguishing it from Idina Menzel's original show-tune version.",
    "question_token_count": 29,
    "answer_correctness_score": 10,
    "explanation_validity_score": 10,
    "question_clarity_score": 8,
    "question_difficulty_score": 2,
    "question_groundedness_score": 10,
    "avg_answer_token_count": 10
  },
  {
    "context": "<P> Darci Lynne Farmer was named the winner on the season finale , September 20 , 2017 . She was the third ventriloquist , third child and third female to win a season of America 's Got Talent. 10 - year - old singer Angelica Hale placed second , and glow light dance troupe Light Balance came in third . Farmer won the show 's prize of $1 million and a headlining performance in Las Vegas . </P>",
    "topic": "The demographics and characteristics of the winner, Darci Lynne Farmer, and how they relate to her victory.",
    "response": "<document_analysis>\nThe provided context discusses Darci Lynne Farmer, the winner of a season of America's Got Talent. It mentions her demographics, such as being a ventriloquist, a child, and a female, and notes that she was the third in each of these categories to win the show. The context also provides information about the runner-ups and the prize that Farmer won. To generate a question, we need to carefully consider the relationships between these pieces of information and how they might relate to her victory.\n\nThoughtfully examining the content, it becomes clear that the question should focus on the characteristics and demographics of Darci Lynne Farmer and how they might have contributed to her success. We should avoid asking obvious or easily answerable questions and instead strive for a question that requires deeper thought and analysis.\n\nThe decision to focus on the demographics and characteristics of Darci Lynne Farmer is based on the fact that the context highlights these aspects of her identity. By exploring how these factors might have influenced her victory, we can create a question that encourages meaningful reflection and critical engagement.\n\nIn terms of complexity calibration, this question should be rated an 8 out of 10 in terms of difficulty. It requires the test-taker to think critically about the potential relationships between Darci Lynne Farmer's characteristics and her success, and to consider the potential implications of these factors.\n\n</document_analysis>\n\n<output_format>\nQuestion: What demographic factor may have contributed to Darci Lynne Farmer's victory on America's Got Talent, given the show's history of winners?\nA: Her age as a child\nB: Her skill as a ventriloquist\nC: Her gender as a female\nD: Her geographic location\n\nExplanation: The correct answer, \"Her age as a child\", may have contributed to her victory due to the potential appeal of a young talented performer to the audience and judges. While being a ventriloquist and a female may also have played a role, the fact that she was a child could have been a significant factor in her success, given the show's history of child winners. \n\nCorrect Answer: A\n</output_format>",
    "question": "What demographic factor may have contributed to Darci Lynne Farmer's victory on America's Got Talent, given the show's history of winners?",
    "choices": {
      "A": "Her age as a child",
      "B": "Her skill as a ventriloquist",
      "C": "Her gender as a female",
      "D": "Her geographic location"
    },
    "answer": "A",
    "explanation": "The correct answer, \"Her age as a child\", may have contributed to her victory due to the potential appeal of a young talented performer to the audience and judges. While being a ventriloquist and a female may also have played a role, the fact that she was a child could have been a significant factor in her success, given the show's history of child winners.",
    "question_token_count": 28,
    "answer_correctness_score": 9,
    "explanation_validity_score": 9,
    "question_clarity_score": 4,
    "question_difficulty_score": 6,
    "question_groundedness_score": 8,
    "avg_answer_token_count": 6
  },
  {
    "context": "<P> The United States presidential line of succession is the order in which persons may become or act as President of the United States if the incumbent president becomes incapacitated , dies , resigns , or is removed from office ( by impeachment by the House of Representatives and subsequent conviction by the Senate ) . The line of succession is set by the United States Constitution and the Presidential Succession Act of 1947 as subsequently amended to include newly created cabinet offices . The succession follows the order of vice president , Speaker of the House of Representatives , President pro tempore of the Senate , and then the heads of federal executive departments who form the Cabinet of the United States . The Cabinet currently has fifteen members , beginning with the Secretary of State , and followed by the rest in the order of their positions ' creation . Those heads of department who are ineligible to act as president are also ineligible to succeed the president by succession , for example most commonly if they are not a natural - born U.S. citizen . </P>",
    "topic": "The role of the vice president in the presidential line of succession and the circumstances under which they may assume the presidency.",
    "response": "<document_analysis>\nThe provided context discusses the United States presidential line of succession, outlining the order in which individuals may assume the presidency if the incumbent becomes incapacitated, dies, resigns, or is removed from office. The line of succession is determined by the United States Constitution and the Presidential Succession Act of 1947, with amendments to include newly created cabinet offices. The succession order begins with the vice president, followed by the Speaker of the House of Representatives, the President pro tempore of the Senate, and then the heads of federal executive departments in the order of their positions' creation. \n\nA key aspect of the succession line is the eligibility of individuals to act as president. For instance, heads of departments who are not natural-born U.S. citizens are ineligible to succeed the president. This highlights the importance of understanding the specific criteria that must be met for an individual to assume the presidency.\n\nGiven the complexity and the specific details involved in the presidential line of succession, generating a question that challenges domain experts requires focusing on nuanced aspects of the succession process, such as the criteria for eligibility, the order of succession, and the circumstances under which the vice president or other officials may assume the presidency.\n\nThe thought process behind the question generation involves identifying areas where domain experts might need to demonstrate a deep understanding of the succession rules, including less common scenarios or specific legal and constitutional requirements. This could involve questions about the eligibility criteria, the role of the vice president in the succession line, or the implications of the Presidential Succession Act of 1947 on the current line of succession.\n\nTo ensure the question is highly challenging, it should require the application of detailed knowledge about the succession process, possibly including historical precedents, legal interpretations, or the analysis of hypothetical scenarios that test the understanding of the succession rules.\n\nDifficulty rating: 8/10, as the question will require specialized knowledge of the U.S. presidential succession process and the ability to apply this knowledge to specific scenarios or criteria.\n\nGiven these considerations, the question should be designed to probe the expert's understanding of the succession process, particularly focusing on critical aspects such as eligibility, the role of the vice president, and the legal framework governing the succession.\n</document_analysis>\n\n<output_format>\nQuestion: What constitutional requirement must be met by the vice president and other officials in the line of presidential succession to be eligible to assume the presidency?\nA: Being at least 21 years old\nB: Being a natural-born citizen of the United States\nC: Having served in the military\nD: Having been a resident of the United States for at least 14 years\nExplanation: The correct answer is based on the requirement outlined in Article II, Section 1 of the United States Constitution, which states that to be eligible to the Office of the President, a person must be a natural-born Citizen, or a Citizen of the United States, at the time of the Adoption of this Constitution, or a Citizen of the United States, for at least fourteen Years, and been fourteen Years a Resident within the United States. The key requirement relevant to the question is being a natural-born citizen.\nCorrect Answer: B\n</output_format>",
    "question": "What constitutional requirement must be met by the vice president and other officials in the line of presidential succession to be eligible to assume the presidency?",
    "choices": {
      "A": "Being at least 21 years old",
      "B": "Being a natural-born citizen of the United States",
      "C": "Having served in the military",
      "D": "Having been a resident of the United States for at least 14 years"
    },
    "answer": "B",
    "explanation": "The correct answer is based on the requirement outlined in Article II, Section 1 of the United States Constitution, which states that to be eligible to the Office of the President, a person must be a natural-born Citizen, or a Citizen of the United States, at the time of the Adoption of this Constitution, or a Citizen of the United States, for at least fourteen Years, and been fourteen Years a Resident within the United States. The key requirement relevant to the question is being a natural-born citizen.",
    "question_token_count": 28,
    "answer_correctness_score": 10,
    "explanation_validity_score": 10,
    "question_clarity_score": 1,
    "question_difficulty_score": 5,
    "question_groundedness_score": 5,
    "avg_answer_token_count": 9
  },
  {
    "context": "<P> A player has taken two hat - tricks in the same Test match only once . Playing for Australia against South Africa in the first match of the 1912 Triangular Tournament at Old Trafford , Manchester , England , leg spinner Jimmy Matthews took a hat - trick in South Africa 's first and second innings , both taken on 28 May 1912 . He completed both hat - tricks by dismissing South Africa 's Tommy Ward . Only three other cricketers have taken more than one Test hat - trick : Australian off spinner Hugh Trumble ( two years apart , between the same teams at the same ground ) , Pakistani fast bowler Wasim Akram ( just over a week apart , in consecutive matches between the same teams ) and English fast bowler Stuart Broad . Three players have taken a hat - trick on their Test debut : English medium pace bowler Maurice Allom in 1930 , New Zealand off - spinner Peter Petherick in 1976 , and Australian pace bowler Damien Fleming in 1994 . Geoff Griffin took the fewest total Test wickets of any player who recorded a hat - trick , taking only eight wickets in his entire Test career . During the match in which he took his hat - trick , Griffin was repeatedly called for throwing by the umpires and never bowled again in a Test match . Australian Peter Siddle is the only bowler to take a hat - trick on his birthday , and Bangladeshi off spinner Sohag Gazi is the only player to score a century and take a hat - trick in the same Test match . </P>",
    "topic": "The comparison of cricketers who have taken more than one Test hat-trick, including Hugh Trumble, Wasim Akram, and Stuart Broad.",
    "response": "<document_analysis>\nThe provided context discusses the rare achievement of taking multiple Test hat-tricks in cricket, highlighting players who have accomplished this feat. It mentions Jimmy Matthews, who took two hat-tricks in the same Test match, and other players like Hugh Trumble, Wasim Akram, and Stuart Broad, who have taken more than one Test hat-trick. The passage also touches on other interesting hat-trick related records, such as players taking a hat-trick on their Test debut or achieving unique combinations like scoring a century and taking a hat-trick in the same match.\n\nGiven the information, a challenging question could be designed to test the depth of knowledge about these exceptional cricket achievements, focusing on the specifics of how these hat-tricks were taken and the circumstances surrounding them. The question should be crafted to encourage a nuanced understanding of cricket history and the rarity of such achievements.\n\nThoughtful consideration suggests that a question about the timing and opponents involved in the hat-tricks taken by key players could be highly insightful, requiring a deep understanding of cricket history and the specific achievements of notable players. This approach would allow for the creation of a question that is both challenging and reflective of a high level of expertise in the domain.\n\nThe difficulty level of such a question would be high (8-9 out of 10), as it requires not only knowledge of cricket and its history but also the ability to recall specific details about individual players' achievements. Ensuring that the question is self-contained and does not give away the answer is crucial, as is making sure that all answer options are plausible and distinct.\n\nGiven these considerations, the question could explore the unique circumstances or patterns among the players who have achieved multiple hat-tricks, inviting a thoughtful engagement with the subject matter.\n</document_analysis>\n\n<output_format>\nQuestion: Which of the following cricketers took two Test hat-tricks in consecutive matches against the same team?\nA: Hugh Trumble\nB: Wasim Akram\nC: Stuart Broad\nD: Jimmy Matthews\nExplanation: Wasim Akram is notable for taking two Test hat-tricks just over a week apart, in consecutive matches against the same teams, showcasing his exceptional skill and consistency.\nCorrect Answer: B\n</output_format>",
    "question": "Which of the following cricketers took two Test hat-tricks in consecutive matches against the same team?",
    "choices": {
      "A": "Hugh Trumble",
      "B": "Wasim Akram",
      "C": "Stuart Broad",
      "D": "Jimmy Matthews"
    },
    "answer": "B",
    "explanation": "Wasim Akram is notable for taking two Test hat-tricks just over a week apart, in consecutive matches against the same teams, showcasing his exceptional skill and consistency.",
    "question_token_count": 21,
    "answer_correctness_score": 10,
    "explanation_validity_score": 10,
    "question_clarity_score": 8,
    "question_difficulty_score": 7,
    "question_groundedness_score": 10,
    "avg_answer_token_count": 4
  },
  {
    "context": "<Table> <Tr> <Th> Year </Th> <Th> Round </Th> <Th> Position </Th> <Th> GP </Th> <Th> </Th> <Th> D * </Th> <Th> </Th> <Th> GF </Th> <Th> GA </Th> <Th> GD </Th> </Tr> <Tr> <Td> 1930 </Td> <Td colspan=\"9\"> Not a FIFA member </Td> </Tr> <Tr> <Td> 1934 </Td> </Tr> <Tr> <Td> 1938 </Td> </Tr> <Tr> <Td> 1950 </Td> <Td> Group stage </Td> <Td> 8th </Td> <Td> </Td> <Td> </Td> <Td> 0 </Td> <Td> </Td> <Td> </Td> <Td> </Td> <Td> 0 </Td> </Tr> <Tr> <Td> 1954 </Td> <Td> Quarter - finals </Td> <Td> 7th </Td> <Td> </Td> <Td> </Td> <Td> </Td> <Td> </Td> <Td> 8 </Td> <Td> 8 </Td> <Td> 0 </Td> </Tr> <Tr> <Td> 1958 </Td> <Td> Group stage </Td> <Td> 11th </Td> <Td> </Td> <Td> 0 </Td> <Td> </Td> <Td> </Td> <Td> </Td> <Td> 5 </Td> <Td> - 1 </Td> </Tr> <Tr> <Td> 1962 </Td> <Td> Quarter - finals </Td> <Td> 8th </Td> <Td> </Td> <Td> </Td> <Td> </Td> <Td> </Td> <Td> 5 </Td> <Td> 6 </Td> <Td> - 1 </Td> </Tr> <Tr> <Td> 1966 </Td> <Td> Champions </Td> <Td> 1st </Td> <Td> 6 </Td> <Td> 5 </Td> <Td> </Td> <Td> 0 </Td> <Td> 11 </Td> <Td> </Td> <Td> 8 </Td> </Tr> <Tr> <Td> 1970 </Td> <Td> Quarter - finals </Td> <Td> 8th </Td> <Td> </Td> <Td> </Td> <Td> 0 </Td> <Td> </Td> <Td> </Td> <Td> </Td> <Td> 0 </Td> </Tr> <Tr> <Td> </Td> <Td colspan=\"9\"> Did not qualify </Td> </Tr> <Tr> <Td> 1978 </Td> </Tr> <Tr> <Td> 1982 </Td> <Td> Second group stage </Td> <Td> 6th </Td> <Td> 5 </Td> <Td> </Td> <Td> </Td> <Td> 0 </Td> <Td> 6 </Td> <Td> </Td> <Td> 5 </Td> </Tr> <Tr> <Td> 1986 </Td> <Td> Quarter - finals </Td> <Td> 8th </Td> <Td> 5 </Td> <Td> </Td> <Td> </Td> <Td> </Td> <Td> 7 </Td> <Td> </Td> <Td> </Td> </Tr> <Tr> <Td> 1990 </Td> <Td> Semi finals </Td> <Td> 4th </Td> <Td> 7 </Td> <Td> </Td> <Td> </Td> <Td> </Td> <Td> 8 </Td> <Td> 6 </Td> <Td> </Td> </Tr> <Tr> <Td> 1994 </Td> <Td colspan=\"9\"> Did not qualify </Td> </Tr> <Tr> <Td> 1998 </Td> <Td> Round of 16 </Td> <Td> 9th </Td> <Td> </Td> <Td> </Td> <Td> </Td> <Td> </Td> <Td> 7 </Td> <Td> </Td> <Td> </Td> </Tr> <Tr> <Td> 2002 </Td> <Td> Quarter - finals </Td> <Td> 6th </Td> <Td> 5 </Td> <Td> </Td> <Td> </Td> <Td> </Td> <Td> 6 </Td> <Td> </Td> <Td> </Td> </Tr> <Tr> <Td> 2006 </Td> <Td> Quarter - finals </Td> <Td> 7th </Td> <Td> 5 </Td> <Td> </Td> <Td> </Td> <Td> 0 </Td> <Td> 6 </Td> <Td> </Td> <Td> </Td> </Tr> <Tr> <Td> </Td> <Td> Round of 16 </Td> <Td> 13th </Td> <Td> </Td> <Td> </Td> <Td> </Td> <Td> </Td> <Td> </Td> <Td> 5 </Td> <Td> - 2 </Td> </Tr> <Tr> <Td> 2014 </Td> <Td> Group stage </Td> <Td> 26th </Td> <Td> </Td> <Td> 0 </Td> <Td> </Td> <Td> </Td> <Td> </Td> <Td> </Td> <Td> - 2 </Td> </Tr> <Tr> <Td> 2018 </Td> <Td> Semi-finals </Td> <Td> 4th </Td> <Td> 7 </Td> <Td> </Td> <Td> </Td> <Td> </Td> <Td> 12 </Td> <Td> 8 </Td> <Td> </Td> </Tr> <Tr> <Td> 2022 </Td> <Td colspan=\"9\"> TBD </Td> </Tr> <Tr> <Td> 2026 </Td> </Tr> <Tr> <Th> Total </Th> <Th> 15 / 21 </Th> <Th> 1 title </Th> <Th> 69 </Th> <Th> 29 </Th> <Th> 21 </Th> <Th> 19 </Th> <Th> 91 </Th> <Th> 64 </Th> <Th> 27 </Th> </Tr> </Table>",
    "topic": "An examination of the team's coaching strategies and their influence on the team's success in the World Cup.",
    "response": "<document_analysis>\nTo generate a highly insightful and probing question-answer pair, we must carefully analyze the provided context. The context appears to be a table detailing the performance of a team in the World Cup across various years. The table includes information such as the year, round, position, games played, wins, draws, losses, goals for, goals against, and goal difference.\n\nUpon examining the table, we notice that the team's performance varies significantly across different years. For instance, the team was the champion in 1966 but did not qualify for the tournament in 1974 and 1978. The team's performance also seems to have improved in recent years, with the team reaching the semi-finals in 2018.\n\nTo generate a question that encourages deep engagement with the content, we can focus on the team's coaching strategies and their influence on the team's success. One possible question could be: What is the primary factor that contributes to a team's success in the World Cup, and how can coaching strategies be tailored to optimize this factor?\n\nHowever, this question may not be specific enough, and the answer may be too obvious. A more challenging question could be: How can a team's coaching staff use data on past performances, such as goal difference and wins, to inform their strategy and improve the team's chances of success in future World Cups?\n\nThis question requires the test-taker to think critically about how data can be used to inform coaching decisions and to consider the potential factors that contribute to a team's success. It also requires the test-taker to have a deep understanding of the content and to be able to synthesize information from the table to arrive at a well-supported answer.\n</document_analysis>\n\n<output_format>\nQuestion: What statistical metric is most closely correlated with a team's likelihood of advancing to the later stages of the World Cup, and how can coaching staff use this metric to adjust their strategy?\nA: Goal difference\nB: Wins\nC: Goals for\nD: Games played\n\nExplanation: The correct answer is A: Goal difference. This is because a team's goal difference is a key indicator of their overall performance and their ability to outscore their opponents. Coaching staff can use this metric to adjust their strategy by focusing on defensive solidity and attacking flair. For example, if a team has a poor goal difference, they may need to focus on shoring up their defense and being more clinical in front of goal.\n\nCorrect Answer: A\n</output_format>",
    "question": "What statistical metric is most closely correlated with a team's likelihood of advancing to the later stages of the World Cup, and how can coaching staff use this metric to adjust their strategy?",
    "choices": {
      "A": "Goal difference",
      "B": "Wins",
      "C": "Goals for",
      "D": "Games played"
    },
    "answer": "A",
    "explanation": "The correct answer is A: Goal difference. This is because a team's goal difference is a key indicator of their overall performance and their ability to outscore their opponents. Coaching staff can use this metric to adjust their strategy by focusing on defensive solidity and attacking flair. For example, if a team has a poor goal difference, they may need to focus on shoring up their defense and being more clinical in front of goal.",
    "question_token_count": 36,
    "answer_correctness_score": 9,
    "explanation_validity_score": 9,
    "question_clarity_score": 2,
    "question_difficulty_score": 8,
    "question_groundedness_score": 1,
    "avg_answer_token_count": 2
  },
  {
    "context": "<P> The United States presidential line of succession is the order in which persons may become or act as President of the United States if the incumbent President becomes incapacitated , dies , resigns , or is removed from office ( by impeachment by the House of Representatives and subsequent conviction by the Senate ) . The line of succession is set by the United States Constitution and the Presidential Succession Act of 1947 as subsequently amended to include newly created cabinet offices . The succession follows the order of Vice President , Speaker of the House of Representatives , President pro tempore of the Senate , and then the heads of federal executive departments who form the Cabinet of the United States . The Cabinet currently has fifteen members , beginning with the Secretary of State , and followed by the rest in the order of their positions ' creation . Those heads of department who are ineligible to act as President are also ineligible to succeed the President by succession , for example most commonly if they are not a natural - born U.S. citizen . </P>",
    "topic": "The composition of the Cabinet of the United States and its role in the presidential line of succession.",
    "response": "<document_analysis>\nThe provided context discusses the United States presidential line of succession, which is the order in which individuals may become or act as President if the incumbent becomes incapacitated, dies, resigns, or is removed from office. The line of succession is determined by the United States Constitution and the Presidential Succession Act of 1947. The succession order includes the Vice President, Speaker of the House of Representatives, President pro tempore of the Senate, and the heads of federal executive departments that form the Cabinet of the United States. The Cabinet currently consists of fifteen members, with the Secretary of State being the first in line, followed by the rest in the order of their positions' creation. It's also noted that heads of departments who are ineligible to act as President, such as those not being natural-born U.S. citizens, are also ineligible to succeed the President by succession.\n\nGiven this information, a challenging question could be generated to test the understanding of the composition of the Cabinet and its role in the presidential line of succession. The question should require the application of knowledge about the Cabinet's structure and the criteria for eligibility to act as President. A suitable question could involve a hypothetical scenario or a nuanced aspect of the succession rules.\n\nThoughtful consideration of the context reveals that the question should focus on the specific details of the Cabinet's composition and the implications of the succession rules. The question should be designed to encourage deep engagement with the content and critical reflection on the implications of the succession order. A domain expert should be able to answer the question without referencing the provided context, demonstrating their understanding of the topic.\n\nThe difficulty level of the question should be high (8-10), as it should challenge even the smartest domain experts. The question should be self-contained, clear, and concise, with answer options that are plausible and reasonable. At least one incorrect answer should be subtly wrong, making it difficult to distinguish from the correct answer.\n\n</document_analysis>\n\n<output_format>\nQuestion: What is the primary reason a head of a federal executive department might be ineligible to act as President of the United States in the line of succession?\nA: They are not a U.S. citizen by naturalization.\nB: They have not been a resident of the United States for at least 14 years.\nC: They are not a natural-born U.S. citizen.\nD: They have been impeached by the House of Representatives.\n\nExplanation: The correct answer is based on the information provided in the context, which states that heads of departments who are ineligible to act as President are those not meeting specific criteria, most commonly not being a natural-born U.S. citizen. This requirement is a key aspect of the presidential eligibility criteria as outlined in the United States Constitution.\n\nCorrect Answer: C\n</output_format>",
    "question": "What is the primary reason a head of a federal executive department might be ineligible to act as President of the United States in the line of succession?",
    "choices": {
      "A": "They are not a U.S. citizen by naturalization.",
      "B": "They have not been a resident of the United States for at least 14 years.",
      "C": "They are not a natural-born U.S. citizen.",
      "D": "They have been impeached by the House of Representatives."
    },
    "answer": "C",
    "explanation": "The correct answer is based on the information provided in the context, which states that heads of departments who are ineligible to act as President are those not meeting specific criteria, most commonly not being a natural-born U.S. citizen. This requirement is a key aspect of the presidential eligibility criteria as outlined in the United States Constitution.",
    "question_token_count": 31,
    "answer_correctness_score": 10,
    "explanation_validity_score": 10,
    "question_clarity_score": 8,
    "question_difficulty_score": 6,
    "question_groundedness_score": 9,
    "avg_answer_token_count": 13
  },
  {
    "context": "<P> The 2017 NFL season is the 98th and current season in the history of the National Football League ( NFL ) . The season began on September 7 , 2017 , with the Kansas City Chiefs defeating the defending Super Bowl LI champion New England Patriots 42 -- 27 in the NFL Kickoff Game . The season will conclude with Super Bowl LII , the league 's championship game , on February 4 , 2018 , at U.S. Bank Stadium in Minneapolis , Minnesota . </P>",
    "topic": "The conclusion of the 2017 NFL season, focusing on the details of Super Bowl LII, including its date, location, and participating teams.",
    "response": "<document_analysis>\nThe provided context discusses the 2017 NFL season, its beginning, and its conclusion with Super Bowl LII. To generate a highly insightful and probing question-answer pair, we need to focus on the details of Super Bowl LII, including its date, location, and participating teams. However, the context does not explicitly mention the participating teams of Super Bowl LII. \n\nGiven the information available, the question should be crafted to test the domain expert's knowledge about the specifics of Super Bowl LII that can be inferred or known beyond the provided context, as the context itself does not offer detailed information about the teams that played in Super Bowl LII.\n\nThe context does provide the date and location of Super Bowl LII, which are February 4, 2018, and U.S. Bank Stadium in Minneapolis, Minnesota, respectively. \n\nConsidering the goal is to create a challenging question, we should look into what is not directly stated but can be known about Super Bowl LII, requiring the domain expert to demonstrate their understanding and competency in the subject matter.\n\nThoughtfully, the question can be planned to invite deeper understanding or critical engagement by focusing on aspects that are not explicitly mentioned in the context but are crucial to the topic, such as the teams that participated in Super Bowl LII.\n\nGiven the instructions to ignore irrelevant information and the context not providing the names of the teams that played in Super Bowl LII, the decision is made to generate a question that requires knowledge of this event beyond the details given in the context.\n\nThe difficulty rating of this question would be high (8 out of 10) because it requires specific knowledge about Super Bowl LII that is not provided in the given context, testing the domain expert's ability to recall or understand details about significant NFL events.\n\nThe question generation process involves careful consideration of what would challenge a domain expert, given the information typically known about the NFL and its major events like the Super Bowl.\n\nTherefore, the question should be crafted to be answerable by a domain expert without the context paragraph, ensuring it stands independently and requires genuine knowledge of the subject matter.\n</document_analysis>\n\n<output_format>\nQuestion: Which two teams competed in Super Bowl LII on February 4, 2018?\nA: New England Patriots and Los Angeles Rams\nB: Philadelphia Eagles and New England Patriots\nC: Kansas City Chiefs and Green Bay Packers\nD: Dallas Cowboys and Pittsburgh Steelers\nExplanation: Super Bowl LII was played between the Philadelphia Eagles and the New England Patriots, with the Eagles winning the championship. This requires the domain expert to know the specifics of the event beyond the provided context.\nCorrect Answer: B\n</output_format>",
    "question": "Which two teams competed in Super Bowl LII on February 4, 2018?",
    "choices": {
      "A": "New England Patriots and Los Angeles Rams",
      "B": "Philadelphia Eagles and New England Patriots",
      "C": "Kansas City Chiefs and Green Bay Packers",
      "D": "Dallas Cowboys and Pittsburgh Steelers"
    },
    "answer": "B",
    "explanation": "Super Bowl LII was played between the Philadelphia Eagles and the New England Patriots, with the Eagles winning the championship. This requires the domain expert to know the specifics of the event beyond the provided context.",
    "question_token_count": 19,
    "answer_correctness_score": 10,
    "explanation_validity_score": 10,
    "question_clarity_score": 10,
    "question_difficulty_score": 8,
    "question_groundedness_score": 1,
    "avg_answer_token_count": 8
  },
  {
    "context": "<P> The 2022 FIFA World Cup is scheduled to be the 22nd edition of the FIFA World Cup , the quadrennial international men 's football championship contested by the national teams of the member associations of FIFA . It is scheduled to take place in Qatar in 2022 . This will be the first World Cup ever to be held in the Arab world and the first in a Muslim - majority country . This will be the first World Cup held entirely in geographical Asia since the 2002 tournament in South Korea and Japan ( the 2018 competition in Russia featured one geographically Asian venue , Yekaterinburg ) . In addition the tournament will be the last to involve 32 teams , with an increase to 48 teams scheduled for the 2026 tournament . </P>",
    "topic": "The cultural and social implications of hosting the FIFA World Cup in Qatar, considering its status as a Muslim-majority country.",
    "response": "<document_analysis>\nTo generate a highly insightful and probing question-answer pair, a thorough analysis of the provided context is necessary. The context discusses the 2022 FIFA World Cup scheduled to take place in Qatar, highlighting its significance as the first World Cup in the Arab world and a Muslim-majority country. \n\nGiven the cultural and social implications of hosting such a major international event in a country with a distinct religious and cultural background, it's essential to consider the potential interactions and influences between the event, the local population, and the international visitors.\n\nThe question should encourage a deep engagement with the content, critically reflect on implications, and clearly demonstrate understanding and competency. It should be highly challenging, even for the smartest domain experts, and require a synthesis of high-level general understanding above and beyond the specific context.\n\nUpon examining the context, several key points emerge: the historical significance of the event, the cultural and religious uniqueness of the host country, and the potential for this event to foster international understanding and exchange. However, the context provided does not delve deeply into the cultural and social implications, which presents a challenge for generating a question that requires a deep understanding of these aspects.\n\nConsidering the above points, the question should ideally explore the potential impacts, challenges, or opportunities arising from hosting the FIFA World Cup in a Muslim-majority country, focusing on cultural, social, or religious dimensions. The question must be self-contained, clear, and capable of being answered by a domain expert without referencing the provided context.\n\nGiven the constraints and the goal of creating a highly challenging question, the approach will be to formulate a question that requires the application of general knowledge about the cultural, social, and religious aspects of Muslim-majority countries and the potential implications of hosting a major international sporting event in such a context.\n</document_analysis>\n\n<output_format>\nQuestion: What potential cultural accommodation might be necessary for a Muslim-majority host country of the FIFA World Cup to ensure respect for Ramadan, should the tournament coincide with the holy month?\nA: Providing non-halal food options for players and spectators\nB: Adjusting match schedules to avoid playing during prayer times\nC: Creating alcohol-free zones within stadiums\nD: Offering extended breaks for players to perform daily prayers and fasting\nExplanation: The correct answer requires an understanding of the religious practices during Ramadan, such as fasting and prayer times, and how these might intersect with the scheduling and conduct of the World Cup. Adjusting match schedules to avoid playing during prayer times is a plausible accommodation, showing respect for the religious observances of the host country and potentially participating Muslim players and spectators.\nCorrect Answer: B\n</output_format>",
    "question": "What potential cultural accommodation might be necessary for a Muslim-majority host country of the FIFA World Cup to ensure respect for Ramadan, should the tournament coincide with the holy month?",
    "choices": {
      "A": "Providing non-halal food options for players and spectators",
      "B": "Adjusting match schedules to avoid playing during prayer times",
      "C": "Creating alcohol-free zones within stadiums",
      "D": "Offering extended breaks for players to perform daily prayers and fasting"
    },
    "answer": "B",
    "explanation": "The correct answer requires an understanding of the religious practices during Ramadan, such as fasting and prayer times, and how these might intersect with the scheduling and conduct of the World Cup. Adjusting match schedules to avoid playing during prayer times is a plausible accommodation, showing respect for the religious observances of the host country and potentially participating Muslim players and spectators.",
    "question_token_count": 35,
    "answer_correctness_score": 8,
    "explanation_validity_score": 8,
    "question_clarity_score": 8,
    "question_difficulty_score": 8,
    "question_groundedness_score": 6,
    "avg_answer_token_count": 10
  },
  {
    "context": "<Table> <Tr> <Th> Year </Th> <Th> Round </Th> <Th> Position </Th> <Th> GP </Th> <Th> </Th> <Th> D * </Th> <Th> </Th> <Th> GF </Th> <Th> GA </Th> <Th> GD </Th> </Tr> <Tr> <Td> 1930 </Td> <Td colspan=\"9\"> Not a FIFA member </Td> </Tr> <Tr> <Td> 1934 </Td> </Tr> <Tr> <Td> 1938 </Td> </Tr> <Tr> <Td> 1950 </Td> <Td> Group stage </Td> <Td> 8th </Td> <Td> </Td> <Td> </Td> <Td> 0 </Td> <Td> </Td> <Td> </Td> <Td> </Td> <Td> 0 </Td> </Tr> <Tr> <Td> 1954 </Td> <Td> Quarter - finals </Td> <Td> 7th </Td> <Td> </Td> <Td> </Td> <Td> </Td> <Td> </Td> <Td> 8 </Td> <Td> 8 </Td> <Td> 0 </Td> </Tr> <Tr> <Td> 1958 </Td> <Td> Group stage </Td> <Td> 11th </Td> <Td> </Td> <Td> 0 </Td> <Td> </Td> <Td> </Td> <Td> </Td> <Td> 5 </Td> <Td> - 1 </Td> </Tr> <Tr> <Td> 1962 </Td> <Td> Quarter - finals </Td> <Td> 8th </Td> <Td> </Td> <Td> </Td> <Td> </Td> <Td> </Td> <Td> 5 </Td> <Td> 6 </Td> <Td> - 1 </Td> </Tr> <Tr> <Td> 1966 </Td> <Td> Champions </Td> <Td> 1st </Td> <Td> 6 </Td> <Td> 5 </Td> <Td> </Td> <Td> 0 </Td> <Td> 11 </Td> <Td> </Td> <Td> 8 </Td> </Tr> <Tr> <Td> 1970 </Td> <Td> Quarter - finals </Td> <Td> 8th </Td> <Td> </Td> <Td> </Td> <Td> 0 </Td> <Td> </Td> <Td> </Td> <Td> </Td> <Td> 0 </Td> </Tr> <Tr> <Td> </Td> <Td colspan=\"9\"> Did not qualify </Td> </Tr> <Tr> <Td> 1978 </Td> </Tr> <Tr> <Td> 1982 </Td> <Td> Second group stage </Td> <Td> 6th </Td> <Td> 5 </Td> <Td> </Td> <Td> </Td> <Td> 0 </Td> <Td> 6 </Td> <Td> </Td> <Td> 5 </Td> </Tr> <Tr> <Td> 1986 </Td> <Td> Quarter - finals </Td> <Td> 8th </Td> <Td> 5 </Td> <Td> </Td> <Td> </Td> <Td> </Td> <Td> 7 </Td> <Td> </Td> <Td> </Td> </Tr> <Tr> <Td> 1990 </Td> <Td> Semi finals </Td> <Td> 4th </Td> <Td> 7 </Td> <Td> </Td> <Td> </Td> <Td> </Td> <Td> 8 </Td> <Td> 6 </Td> <Td> </Td> </Tr> <Tr> <Td> 1994 </Td> <Td colspan=\"9\"> Did not qualify </Td> </Tr> <Tr> <Td> 1998 </Td> <Td> Round of 16 </Td> <Td> 9th </Td> <Td> </Td> <Td> </Td> <Td> </Td> <Td> </Td> <Td> 7 </Td> <Td> </Td> <Td> </Td> </Tr> <Tr> <Td> 2002 </Td> <Td> Quarter - finals </Td> <Td> 6th </Td> <Td> 5 </Td> <Td> </Td> <Td> </Td> <Td> </Td> <Td> 6 </Td> <Td> </Td> <Td> </Td> </Tr> <Tr> <Td> 2006 </Td> <Td> Quarter - finals </Td> <Td> 7th </Td> <Td> 5 </Td> <Td> </Td> <Td> </Td> <Td> 0 </Td> <Td> 6 </Td> <Td> </Td> <Td> </Td> </Tr> <Tr> <Td> </Td> <Td> Round of 16 </Td> <Td> 13th </Td> <Td> </Td> <Td> </Td> <Td> </Td> <Td> </Td> <Td> </Td> <Td> 5 </Td> <Td> - 2 </Td> </Tr> <Tr> <Td> 2014 </Td> <Td> Group stage </Td> <Td> 26th </Td> <Td> </Td> <Td> 0 </Td> <Td> </Td> <Td> </Td> <Td> </Td> <Td> </Td> <Td> - 2 </Td> </Tr> <Tr> <Td> 2018 </Td> <Td> Semi-finals </Td> <Td> 4th </Td> <Td> 7 </Td> <Td> </Td> <Td> </Td> <Td> </Td> <Td> 12 </Td> <Td> 8 </Td> <Td> </Td> </Tr> <Tr> <Td> 2022 </Td> <Td colspan=\"9\"> TBD </Td> </Tr> <Tr> <Td> 2026 </Td> </Tr> <Tr> <Th> Total </Th> <Th> 15 / 21 </Th> <Th> 1 title </Th> <Th> 69 </Th> <Th> 29 </Th> <Th> 21 </Th> <Th> 19 </Th> <Th> 91 </Th> <Th> 64 </Th> <Th> 27 </Th> </Tr> </Table>",
    "topic": "The factors contributing to the team's inconsistent performance in the World Cup, including changes in coaching staff, player injuries, and team dynamics.",
    "response": "<document_analysis>\nTo generate a highly insightful and probing question-answer pair, I will carefully analyze the provided context. The context appears to be a table detailing the performance of a team in the World Cup across various years. The table includes information such as the year, round, position, games played, wins, draws, losses, goals for, goals against, and goal difference.\n\nUpon examining the table, it becomes apparent that the team's performance has been inconsistent, with varying degrees of success and failure throughout the years. For instance, the team won the championship in 1966 but failed to qualify for the tournament in 1974, 1978, and 1994.\n\nTo create a challenging question, I will focus on the factors that might have contributed to this inconsistency. The question topic mentions changes in coaching staff, player injuries, and team dynamics as potential factors. However, the provided context does not explicitly discuss these factors. Therefore, I will need to infer and make connections between the data presented in the table and the potential factors that might have influenced the team's performance.\n\nStrategic complexity calibration: I would rate the difficulty of this question as an 8 out of 10, as it requires the test-taker to analyze the data, identify patterns, and make inferences about the potential factors that contributed to the team's inconsistent performance.\n</document_analysis>\n\n<output_format>\nQuestion: What could be a significant factor contributing to the team's inconsistent performance in the World Cup, considering the data on their wins, losses, and goal difference over the years?\nA: Changes in team ownership\nB: Variations in coaching staff and player injuries\nC: Fluctuations in fan support and home advantage\nD: Differences in tournament format and scheduling\n\nExplanation: The correct answer, B, is a plausible explanation for the team's inconsistent performance, as changes in coaching staff and player injuries can significantly impact a team's success. The other options, while potentially influencing the team's performance, are less directly related to the data presented in the table.\n\nCorrect Answer: B\n</output_format>",
    "question": "What could be a significant factor contributing to the team's inconsistent performance in the World Cup, considering the data on their wins, losses, and goal difference over the years?",
    "choices": {
      "A": "Changes in team ownership",
      "B": "Variations in coaching staff and player injuries",
      "C": "Fluctuations in fan support and home advantage",
      "D": "Differences in tournament format and scheduling"
    },
    "answer": "B",
    "explanation": "The correct answer, B, is a plausible explanation for the team's inconsistent performance, as changes in coaching staff and player injuries can significantly impact a team's success. The other options, while potentially influencing the team's performance, are less directly related to the data presented in the table.",
    "question_token_count": 34,
    "answer_correctness_score": 10,
    "explanation_validity_score": 9,
    "question_clarity_score": 6,
    "question_difficulty_score": 8,
    "question_groundedness_score": 9,
    "avg_answer_token_count": 8
  },
  {
    "context": "<Table> <Tr> <Th> Year </Th> <Th> Round </Th> <Th> Position </Th> <Th> GP </Th> <Th> </Th> <Th> D * </Th> <Th> </Th> <Th> GF </Th> <Th> GA </Th> <Th> GD </Th> </Tr> <Tr> <Td> 1930 </Td> <Td colspan=\"9\"> Not a FIFA member </Td> </Tr> <Tr> <Td> 1934 </Td> </Tr> <Tr> <Td> 1938 </Td> </Tr> <Tr> <Td> 1950 </Td> <Td> Group stage </Td> <Td> 8th </Td> <Td> </Td> <Td> </Td> <Td> 0 </Td> <Td> </Td> <Td> </Td> <Td> </Td> <Td> 0 </Td> </Tr> <Tr> <Td> 1954 </Td> <Td> Quarter - finals </Td> <Td> 7th </Td> <Td> </Td> <Td> </Td> <Td> </Td> <Td> </Td> <Td> 8 </Td> <Td> 8 </Td> <Td> 0 </Td> </Tr> <Tr> <Td> 1958 </Td> <Td> Group stage </Td> <Td> 11th </Td> <Td> </Td> <Td> 0 </Td> <Td> </Td> <Td> </Td> <Td> </Td> <Td> 5 </Td> <Td> - 1 </Td> </Tr> <Tr> <Td> 1962 </Td> <Td> Quarter - finals </Td> <Td> 8th </Td> <Td> </Td> <Td> </Td> <Td> </Td> <Td> </Td> <Td> 5 </Td> <Td> 6 </Td> <Td> - 1 </Td> </Tr> <Tr> <Td> 1966 </Td> <Td> Champions </Td> <Td> 1st </Td> <Td> 6 </Td> <Td> 5 </Td> <Td> </Td> <Td> 0 </Td> <Td> 11 </Td> <Td> </Td> <Td> 8 </Td> </Tr> <Tr> <Td> 1970 </Td> <Td> Quarter - finals </Td> <Td> 8th </Td> <Td> </Td> <Td> </Td> <Td> 0 </Td> <Td> </Td> <Td> </Td> <Td> </Td> <Td> 0 </Td> </Tr> <Tr> <Td> </Td> <Td colspan=\"9\"> Did not qualify </Td> </Tr> <Tr> <Td> 1978 </Td> </Tr> <Tr> <Td> 1982 </Td> <Td> Second group stage </Td> <Td> 6th </Td> <Td> 5 </Td> <Td> </Td> <Td> </Td> <Td> 0 </Td> <Td> 6 </Td> <Td> </Td> <Td> 5 </Td> </Tr> <Tr> <Td> 1986 </Td> <Td> Quarter - finals </Td> <Td> 8th </Td> <Td> 5 </Td> <Td> </Td> <Td> </Td> <Td> </Td> <Td> 7 </Td> <Td> </Td> <Td> </Td> </Tr> <Tr> <Td> 1990 </Td> <Td> Semi finals </Td> <Td> 4th </Td> <Td> 7 </Td> <Td> </Td> <Td> </Td> <Td> </Td> <Td> 8 </Td> <Td> 6 </Td> <Td> </Td> </Tr> <Tr> <Td> 1994 </Td> <Td colspan=\"9\"> Did not qualify </Td> </Tr> <Tr> <Td> 1998 </Td> <Td> Round of 16 </Td> <Td> 9th </Td> <Td> </Td> <Td> </Td> <Td> </Td> <Td> </Td> <Td> 7 </Td> <Td> </Td> <Td> </Td> </Tr> <Tr> <Td> 2002 </Td> <Td> Quarter - finals </Td> <Td> 6th </Td> <Td> 5 </Td> <Td> </Td> <Td> </Td> <Td> </Td> <Td> 6 </Td> <Td> </Td> <Td> </Td> </Tr> <Tr> <Td> 2006 </Td> <Td> Quarter - finals </Td> <Td> 7th </Td> <Td> 5 </Td> <Td> </Td> <Td> </Td> <Td> 0 </Td> <Td> 6 </Td> <Td> </Td> <Td> </Td> </Tr> <Tr> <Td> </Td> <Td> Round of 16 </Td> <Td> 13th </Td> <Td> </Td> <Td> </Td> <Td> </Td> <Td> </Td> <Td> </Td> <Td> 5 </Td> <Td> - 2 </Td> </Tr> <Tr> <Td> 2014 </Td> <Td> Group stage </Td> <Td> 26th </Td> <Td> </Td> <Td> 0 </Td> <Td> </Td> <Td> </Td> <Td> </Td> <Td> </Td> <Td> - 2 </Td> </Tr> <Tr> <Td> 2018 </Td> <Td> Semi-finals </Td> <Td> 4th </Td> <Td> 7 </Td> <Td> </Td> <Td> </Td> <Td> </Td> <Td> 12 </Td> <Td> 8 </Td> <Td> </Td> </Tr> <Tr> <Td> 2022 </Td> <Td colspan=\"9\"> TBD </Td> </Tr> <Tr> <Td> 2026 </Td> </Tr> <Tr> <Th> Total </Th> <Th> 15 / 21 </Th> <Th> 1 title </Th> <Th> 69 </Th> <Th> 29 </Th> <Th> 21 </Th> <Th> 19 </Th> <Th> 91 </Th> <Th> 64 </Th> <Th> 27 </Th> </Tr> </Table>",
    "topic": "The team's prospects for future World Cup tournaments, including their chances of qualifying and advancing to the later stages.",
    "response": "<document_analysis>\nTo generate a highly insightful and probing question-answer pair, a thorough analysis of the provided context is necessary. The context presents a table detailing the performance of a team in various World Cup tournaments from 1930 to 2022. The table includes information such as the year, round, position, games played (GP), wins, draws, losses, goals for (GF), goals against (GA), and goal difference (GD).\n\nThe primary objective is to create a question that encourages deep engagement with the content, critically reflects on implications, and clearly demonstrates understanding and competency. Given the nature of the data, a question that requires analysis of the team's performance over the years, identification of trends, or evaluation of their strengths and weaknesses would be appropriate.\n\nUpon examining the table, several trends and notable performances are evident. The team has participated in 15 out of 21 World Cup tournaments, winning one title, and has shown varying degrees of success over the years. Their best performances were winning the championship in 1966 and reaching the semi-finals in 1990 and 2018.\n\nTo generate a challenging question, we need to consider implicit assumptions, subtle details, underlying theories, and potential applications of the provided information. A question that requires the synthesis of high-level general understanding above and beyond the specific context would be ideal.\n\nGiven these considerations, a potential question could focus on the team's prospects for future World Cup tournaments, including their chances of qualifying and advancing to the later stages, based on their historical performance.\n\nThoughtful content examination and concept exploration lead to the identification of central ideas, nuanced themes, and significant relationships within the context. Strategic complexity calibration suggests that a question rating of 8 out of 10 in terms of difficulty would be appropriate, as it should challenge even the smartest domain experts.\n\nIntentional question planning involves crafting a question that invites deeper understanding, meaningful reflection, or critical engagement. The question should be purposeful and encourage the domain expert to think critically about the team's performance and its implications for future tournaments.\n</document_analysis>\n\n<output_format>\nQuestion: What is the primary factor that has contributed to the team's inconsistent performance in the World Cup tournaments, considering their winning title in 1966 and subsequent varied successes?\nA: Change in team management\nB: Inadequate training facilities\nC: Shift in team strategy and player composition\nD: Lack of experience in playing different opponents\n\nExplanation: The correct answer, \"Shift in team strategy and player composition,\" suggests that the team's inconsistent performance can be attributed to changes in their approach to the game and the composition of their team over the years. This requires an understanding of how teams adapt and evolve, and how these changes can impact their performance.\n\nCorrect Answer: C\n</output_format>",
    "question": "What is the primary factor that has contributed to the team's inconsistent performance in the World Cup tournaments, considering their winning title in 1966 and subsequent varied successes?",
    "choices": {
      "A": "Change in team management",
      "B": "Inadequate training facilities",
      "C": "Shift in team strategy and player composition",
      "D": "Lack of experience in playing different opponents"
    },
    "answer": "C",
    "explanation": "The correct answer, \"Shift in team strategy and player composition,\" suggests that the team's inconsistent performance can be attributed to changes in their approach to the game and the composition of their team over the years. This requires an understanding of how teams adapt and evolve, and how these changes can impact their performance.",
    "question_token_count": 33,
    "answer_correctness_score": 8,
    "explanation_validity_score": 8,
    "question_clarity_score": 4,
    "question_difficulty_score": 8,
    "question_groundedness_score": 2,
    "avg_answer_token_count": 7
  },
  {
    "context": "<P> In the history of the Triple Crown , 13 horses have won all three races : Sir Barton ( 1919 ) , Gallant Fox ( 1930 ) , Omaha ( 1935 ) , War Admiral ( 1937 ) , Whirlaway ( 1941 ) , Count Fleet ( 1943 ) , Assault ( 1946 ) , Citation ( 1948 ) , Secretariat ( 1973 ) , Seattle Slew ( 1977 ) , Affirmed ( 1978 ) , American Pharoah ( 2015 ) , and Justify ( 2018 ) . As of 2018 , American Pharoah and Justify are the only living Triple Crown winners . </P>",
    "topic": "American Pharoah's 2015 Triple Crown win and its relevance to contemporary horse racing.",
    "response": "<document_analysis>\nThe provided context discusses the history of the Triple Crown in horse racing, specifically highlighting the 13 horses that have achieved this feat. The text mentions the years each of these horses won, from Sir Barton in 1919 to Justify in 2018. Notably, it points out that as of 2018, American Pharoah and Justify are the only living Triple Crown winners. \n\nTo generate a question, we must delve into the nuances of this information, considering the implications of American Pharoah's win in 2015 and its relevance to contemporary horse racing. The question should encourage a deep understanding of the context and the broader significance of such achievements in the sport.\n\nGiven the information, a thoughtful question could explore the impact of recent Triple Crown wins on the sport's popularity or the strategies employed by trainers and owners to achieve such success. However, to ensure the question is highly challenging and requires a deep understanding of the content, we should focus on aspects that are not immediately apparent from the text but are closely related to the topic.\n\nThe difficulty of the question should be calibrated to challenge even the most knowledgeable domain experts. This means avoiding straightforward factual questions that can be answered simply by recalling the text. Instead, the question should require analysis, inference, or the application of knowledge to a hypothetical scenario or a broader context.\n\nIn terms of question types, an analytical or implication question could fit well, as these types encourage the examination of cause-and-effect relationships or the potential consequences of certain events or trends in horse racing.\n\nConsidering these guidelines, a potential question could be crafted around the significance of American Pharoah's achievement in the context of contemporary horse racing, focusing on its impact on the sport, breeding practices, or racing strategies.\n\n</document_analysis>\n\n<output_format>\nQuestion: What potential long-term impact could American Pharoah's 2015 Triple Crown win have on breeding practices within the thoroughbred racing industry?\nA: Increased emphasis on sprinting bloodlines\nB: Greater value placed on horses with proven endurance and stamina\nC: Shift towards breeding horses specifically for each leg of the Triple Crown\nD: Reduced importance on pedigree in favor of performance-enhancing technologies\n\nExplanation: American Pharoah's win, especially being one of the only two living Triple Crown winners as of 2018, could influence breeding practices by highlighting the importance of horses that can excel in all three races, thus emphasizing the value of endurance and stamina. This would naturally lead to a greater value placed on horses with proven ability to perform well over longer distances, impacting how breeders select and breed horses for future races.\n\nCorrect Answer: B\n</output_format>",
    "question": "What potential long-term impact could American Pharoah's 2015 Triple Crown win have on breeding practices within the thoroughbred racing industry?",
    "choices": {
      "A": "Increased emphasis on sprinting bloodlines",
      "B": "Greater value placed on horses with proven endurance and stamina",
      "C": "Shift towards breeding horses specifically for each leg of the Triple Crown",
      "D": "Reduced importance on pedigree in favor of performance-enhancing technologies"
    },
    "answer": "B",
    "explanation": "American Pharoah's win, especially being one of the only two living Triple Crown winners as of 2018, could influence breeding practices by highlighting the importance of horses that can excel in all three races, thus emphasizing the value of endurance and stamina. This would naturally lead to a greater value placed on horses with proven ability to perform well over longer distances, impacting how breeders select and breed horses for future races.",
    "question_token_count": 29,
    "answer_correctness_score": 10,
    "explanation_validity_score": 10,
    "question_clarity_score": 7,
    "question_difficulty_score": 8,
    "question_groundedness_score": 2,
    "avg_answer_token_count": 11
  },
  {
    "context": "<P> `` Flight '' is the twenty - fourth and final episode of the eighth season of the American television medical drama Grey 's Anatomy , and the show 's 172nd episode overall . It was written by series creator Shonda Rhimes , and directed by Rob Corn . The episode was originally broadcast on the American Broadcasting Company ( ABC ) in the United States on May 17 , 2012 . In the episode , six doctors from Seattle Grace Mercy West Hospital who are victims of an aviation accident fight to stay alive , but Dr. Lexie Grey ( Chyler Leigh ) ultimately dies . Other storylines occur in Seattle where Dr. Richard Webber ( James Pickens , Jr . ) plans his annual dinner for the departing residents , Dr. Owen Hunt ( Kevin McKidd ) fires Dr. Teddy Altman ( Kim Raver ) , and Dr. Miranda Bailey ( Chandra Wilson ) gets engaged . </P>",
    "topic": "The significance of the plane crash in the episode \"Flight\" and its impact on the characters and plot of Grey's Anatomy.",
    "response": "<document_analysis>\nThe provided context revolves around the episode \"Flight\" from the eighth season of Grey's Anatomy, focusing on a plane crash and its aftermath. To generate a question that inspires thoughtful engagement and reflection, it's essential to delve into the significance of the plane crash and its impact on the characters and plot. The episode's central plot point, the death of Dr. Lexie Grey, and the survival struggles of other doctors, offers a rich backdrop for exploring themes of mortality, resilience, and the emotional toll of traumatic events on medical professionals.\n\nGiven the complexity of the episode's narrative, which intertwines the plane crash survivors' fight for life with other storylines such as Dr. Richard Webber's dinner plans, Dr. Owen Hunt's decision to fire Dr. Teddy Altman, and Dr. Miranda Bailey's engagement, a question that synthesizes these elements or probes the deeper implications of the plane crash on character development and the season's arc would be highly engaging.\n\nThe difficulty level of the question should be calibrated to challenge even the most knowledgeable domain experts, necessitating a deep understanding of the episode's themes, character arcs, and the narrative's strategic use of the plane crash as a plot device. Therefore, the question should avoid straightforward factual recall and instead invite analysis, inference, or critical thinking about the episode's significance within the broader context of Grey's Anatomy.\n\nConsidering the guidelines for question generation, a question that is self-contained, encourages deep understanding, and has clear pedagogical value would be appropriate. The question should be phrased in a conversational tone, making it engaging and natural, while ensuring that the answer options are plausible, distinct, and require careful consideration to distinguish the correct answer from the incorrect ones.\n</document_analysis>\n\n<output_format>\nQuestion: What narrative purpose does the plane crash in the episode \"Flight\" serve in relation to the character development and thematic exploration of mortality and resilience in Grey's Anatomy?\nA: It merely serves as a plot twist to eliminate characters.\nB: It underscores the theme of mortality, influencing character arcs and relationships throughout the season.\nC: It is used solely to introduce new characters in the subsequent season.\nD: It has no significant impact on the overall narrative of Grey's Anatomy.\n\nExplanation: The correct answer, B, reflects the episode's use of the plane crash as a pivotal moment to explore themes of mortality, survival, and the emotional aftermath of traumatic events, significantly impacting character development and the season's narrative arc.\n\nCorrect Answer: B\n</output_format>",
    "question": "What narrative purpose does the plane crash in the episode \"Flight\" serve in relation to the character development and thematic exploration of mortality and resilience in Grey's Anatomy?",
    "choices": {
      "A": "It merely serves as a plot twist to eliminate characters.",
      "B": "It underscores the theme of mortality, influencing character arcs and relationships throughout the season.",
      "C": "It is used solely to introduce new characters in the subsequent season.",
      "D": "It has no significant impact on the overall narrative of Grey's Anatomy."
    },
    "answer": "B",
    "explanation": "The correct answer, B, reflects the episode's use of the plane crash as a pivotal moment to explore themes of mortality, survival, and the emotional aftermath of traumatic events, significantly impacting character development and the season's narrative arc.",
    "question_token_count": 33,
    "answer_correctness_score": 10,
    "explanation_validity_score": 10,
    "question_clarity_score": 8,
    "question_difficulty_score": 9,
    "question_groundedness_score": 4,
    "avg_answer_token_count": 14
  },
  {
    "context": "<P> The seventh season of the fantasy drama television series Game of Thrones premiered on HBO on July 16 , 2017 , and concluded on August 27 , 2017 . Unlike previous seasons that consisted of ten episodes each , the seventh season consisted of only seven . Like the previous season , it largely consisted of original content not found in George R.R. Martin 's A Song of Ice and Fire series , while also incorporating material Martin revealed to showrunners about the upcoming novels in the series . The series was adapted for television by David Benioff and D.B. Weiss . </P>",
    "topic": "The adaptation process of A Song of Ice and Fire series for television, including the decisions made by showrunners David Benioff and D.B. Weiss to incorporate or modify elements from the books.",
    "response": "<document_analysis>\nTo generate a highly insightful and probing question-answer pair, I will carefully analyze the provided context. The context discusses the seventh season of the Game of Thrones television series, its premiere and conclusion dates, and the fact that it consisted of only seven episodes, unlike previous seasons. It also mentions that the season largely consisted of original content not found in George R.R. Martin's A Song of Ice and Fire series, while incorporating material Martin revealed to showrunners about upcoming novels.\n\nThe central idea here is the adaptation process of the A Song of Ice and Fire series for television, specifically the decisions made by showrunners David Benioff and D.B. Weiss. The context implies that the showrunners had to make choices about what content to include or modify from the books, given the limitations of the television format and the need to create original content.\n\nI will rate the difficulty of this question as an 8 out of 10, considering the need for a deep understanding of the adaptation process and the decisions made by the showrunners. The question should encourage critical thinking and reflection on the implications of adapting a complex book series for television.\n\nGiven the context, a potential question could explore the factors that influenced the showrunners' decisions to incorporate or modify elements from the books. This could lead to a nuanced discussion about the challenges of adapting complex source material for a different medium.\n</document_analysis>\n\n<output_format>\nQuestion: What primary factor likely influenced David Benioff and D.B. Weiss's decision to include original content in the seventh season of Game of Thrones, rather than strictly adhering to the plot of A Song of Ice and Fire series?\nA: Time constraints and the need to conclude the series within a limited number of episodes\nB: Creative freedom to explore alternative storylines and character developments\nC: George R.R. Martin's direct involvement in the writing process for the television series\nD: The necessity to cater to a broader audience unfamiliar with the book series\n\nExplanation: The correct answer, A, is supported by the fact that the seventh season had fewer episodes than previous seasons, implying time constraints. While creative freedom (B) and catering to a broader audience (D) might have played a role, they are not the primary factors. George R.R. Martin's involvement (C) is mentioned, but it is specified that his input was about upcoming novels, not the television series' original content.\n\nCorrect Answer: A\n</output_format>",
    "question": "What primary factor likely influenced David Benioff and D.B. Weiss's decision to include original content in the seventh season of Game of Thrones, rather than strictly adhering to the plot of A Song of Ice and Fire series?",
    "choices": {
      "A": "Time constraints and the need to conclude the series within a limited number of episodes",
      "B": "Creative freedom to explore alternative storylines and character developments",
      "C": "George R.R. Martin's direct involvement in the writing process for the television series",
      "D": "The necessity to cater to a broader audience unfamiliar with the book series"
    },
    "answer": "A",
    "explanation": "The correct answer, A, is supported by the fact that the seventh season had fewer episodes than previous seasons, implying time constraints. While creative freedom (B) and catering to a broader audience (D) might have played a role, they are not the primary factors. George R.R. Martin's involvement (C) is mentioned, but it is specified that his input was about upcoming novels, not the television series' original content.",
    "question_token_count": 46,
    "answer_correctness_score": 8,
    "explanation_validity_score": 8,
    "question_clarity_score": 6,
    "question_difficulty_score": 8,
    "question_groundedness_score": 2,
    "avg_answer_token_count": 14
  },
  {
    "context": "<P> The United States presidential line of succession is the order in which persons may become or act as President of the United States if the incumbent President becomes incapacitated , dies , resigns , or is removed from office ( by impeachment by the House of Representatives and subsequent conviction by the Senate ) . The line of succession is set by the United States Constitution and the Presidential Succession Act of 1947 as subsequently amended to include newly created cabinet offices . The succession follows the order of Vice President , Speaker of the House of Representatives , President pro tempore of the Senate , and then the heads of federal executive departments who form the Cabinet of the United States . The Cabinet currently has fifteen members , beginning with the Secretary of State , and followed by the rest in the order of their positions ' creation . Those heads of department who are ineligible to act as President are also ineligible to succeed the President by succession , for example most commonly if they are not a natural - born U.S. citizen . </P>",
    "topic": "The potential challenges and controversies surrounding the presidential line of succession, including issues of eligibility and succession.",
    "response": "<document_analysis>\nThe provided context discusses the United States presidential line of succession, outlining the order in which individuals may assume the presidency if the incumbent becomes incapacitated, dies, resigns, or is removed from office. The line of succession is determined by the United States Constitution and the Presidential Succession Act of 1947, with amendments to include newly created cabinet offices. The succession order starts with the Vice President, followed by the Speaker of the House of Representatives, the President pro tempore of the Senate, and then the heads of federal executive departments in the order of their positions' creation. A key point of consideration is the eligibility of these individuals to act as President, with a notable criterion being that they must be a natural-born U.S. citizen to be eligible for succession.\n\nUpon analyzing the context, it becomes apparent that the potential challenges and controversies surrounding the presidential line of succession are multifaceted. Issues of eligibility, particularly the natural-born citizen requirement, can lead to complexities in determining who can succeed to the presidency. Additionally, the specific order of succession and the inclusion of cabinet members raise questions about the readiness and suitability of these individuals to assume the office of the President.\n\nThe thought process behind generating a question from this context involves identifying a nuanced aspect of the succession process that would challenge a domain expert's understanding. Given the emphasis on eligibility and the specific criteria for succession, a question that probes the implications of these rules on the line of succession would be appropriate. The question should be crafted to require a deep understanding of the subject matter, encouraging thoughtful engagement with the content.\n\nDifficulty rating: 8/10\n\nThe question is designed to be challenging, requiring the application of knowledge about the presidential succession process and its underlying rules, particularly concerning eligibility. It demands a level of expertise that can critically evaluate the implications of these rules on the succession line, making it suitable for domain experts.\n</document_analysis>\n\n<output_format>\nQuestion: What constitutional requirement must be met by all individuals in the presidential line of succession to be eligible to assume the office of the President?\nA: They must have served as a member of Congress.\nB: They must be at least 35 years old and a natural-born U.S. citizen.\nC: They must have held a federal executive department position for at least two years.\nD: They must have been born in the capital of the United States.\n\nExplanation: The correct answer is based on the requirement outlined in Article II, Section 1 of the United States Constitution, which states that to be eligible for the presidency, a person must be a natural-born citizen of the United States, at least 35 years old, and a resident of the United States for at least 14 years. This requirement applies to all individuals in the presidential line of succession.\n\nCorrect Answer: B\n</output_format>",
    "question": "What constitutional requirement must be met by all individuals in the presidential line of succession to be eligible to assume the office of the President?",
    "choices": {
      "A": "They must have served as a member of Congress.",
      "B": "They must be at least 35 years old and a natural-born U.S. citizen.",
      "C": "They must have held a federal executive department position for at least two years.",
      "D": "They must have been born in the capital of the United States."
    },
    "answer": "B",
    "explanation": "The correct answer is based on the requirement outlined in Article II, Section 1 of the United States Constitution, which states that to be eligible for the presidency, a person must be a natural-born citizen of the United States, at least 35 years old, and a resident of the United States for at least 14 years. This requirement applies to all individuals in the presidential line of succession.",
    "question_token_count": 27,
    "answer_correctness_score": 8,
    "explanation_validity_score": 9,
    "question_clarity_score": 8,
    "question_difficulty_score": 6,
    "question_groundedness_score": 9,
    "avg_answer_token_count": 15
  },
  {
    "context": "<Table> <Tr> <Th> No . </Th> <Th> Athlete </Th> <Th> Nation </Th> <Th> Sport </Th> <Th> Years </Th> <Th> Games </Th> <Th> Gender </Th> <Th> Gold </Th> <Th> Silver </Th> <Th> Bronze </Th> <Th> Total </Th> </Tr> <Tr> <Th> </Th> <Td> Phelps , Michael Michael Phelps </Td> <Td> United States </Td> <Td> Swimming </Td> <Td> 2004 -- 2016 </Td> <Td> Summer </Td> <Td> </Td> <Td> 23 </Td> <Td> </Td> <Td> </Td> <Td> 28 </Td> </Tr> <Tr> <Th> </Th> <Td> Latynina , Larisa Larisa Latynina </Td> <Td> Soviet Union </Td> <Td> Gymnastics </Td> <Td> 1956 -- 1964 </Td> <Td> Summer </Td> <Td> </Td> <Td> 9 </Td> <Td> 5 </Td> <Td> </Td> <Td> 18 </Td> </Tr> <Tr> <Th> </Th> <Td> Nurmi , Paavo Paavo Nurmi </Td> <Td> Finland </Td> <Td> Athletics </Td> <Td> 1920 -- 1928 </Td> <Td> Summer </Td> <Td> </Td> <Td> 9 </Td> <Td> </Td> <Td> 0 </Td> <Td> 12 </Td> </Tr> <Tr> <Th> </Th> <Td> Spitz , Mark Mark Spitz </Td> <Td> United States </Td> <Td> Swimming </Td> <Td> 1968 -- 1972 </Td> <Td> Summer </Td> <Td> </Td> <Td> 9 </Td> <Td> </Td> <Td> </Td> <Td> 11 </Td> </Tr> <Tr> <Th> 5 </Th> <Td> Lewis , Carl Carl Lewis </Td> <Td> United States </Td> <Td> Athletics </Td> <Td> 1984 -- 1996 </Td> <Td> Summer </Td> <Td> </Td> <Td> 9 </Td> <Td> </Td> <Td> 0 </Td> <Td> 10 </Td> </Tr> <Tr> <Th> 6 </Th> <Td> Bj\u00f8rgen , Marit Marit Bj\u00f8rgen </Td> <Td> Norway </Td> <Td> Cross-country skiing </Td> <Td> 2002 -- 2018 </Td> <Td> Winter </Td> <Td> </Td> <Td> 8 </Td> <Td> </Td> <Td> </Td> <Td> 15 </Td> </Tr> <Tr> <Th> 7 </Th> <Td> Bj\u00f8rndalen , Ole Einar Ole Einar Bj\u00f8rndalen </Td> <Td> Norway </Td> <Td> Biathlon </Td> <Td> 1998 -- 2014 </Td> <Td> Winter </Td> <Td> </Td> <Td> 8 </Td> <Td> </Td> <Td> </Td> <Td> 13 </Td> </Tr> <Tr> <Th> 8 </Th> <Td> D\u00e6hlie , Bj\u00f8rn Bj\u00f8rn D\u00e6hlie </Td> <Td> Norway </Td> <Td> Cross-country skiing </Td> <Td> 1992 -- 1998 </Td> <Td> Winter </Td> <Td> </Td> <Td> 8 </Td> <Td> </Td> <Td> 0 </Td> <Td> 12 </Td> </Tr> <Tr> <Td> Fischer , Birgit Birgit Fischer </Td> <Td> East Germany Germany </Td> <Td> Canoeing </Td> <Td> 1980 -- 2004 </Td> <Td> Summer </Td> <Td> </Td> <Td> 8 </Td> <Td> </Td> <Td> 0 </Td> <Td> 12 </Td> </Tr> <Tr> <Th> 10 </Th> <Td> Kato , Sawao Sawao Kato </Td> <Td> Japan </Td> <Td> Gymnastics </Td> <Td> 1968 -- 1976 </Td> <Td> Summer </Td> <Td> </Td> <Td> 8 </Td> <Td> </Td> <Td> </Td> <Td> 12 </Td> </Tr> <Tr> <Td> Thompson , Jenny Jenny Thompson </Td> <Td> United States </Td> <Td> Swimming </Td> <Td> 1992 -- 2004 </Td> <Td> Summer </Td> <Td> </Td> <Td> 8 </Td> <Td> </Td> <Td> </Td> <Td> 12 </Td> </Tr> <Tr> <Th> 12 </Th> <Td> Biondi , Matt Matt Biondi </Td> <Td> United States </Td> <Td> Swimming </Td> <Td> 1984 -- 1992 </Td> <Td> Summer </Td> <Td> </Td> <Td> 8 </Td> <Td> </Td> <Td> </Td> <Td> 11 </Td> </Tr> <Tr> <Th> 13 </Th> <Td> Bolt , Usain Usain Bolt </Td> <Td> Jamaica </Td> <Td> Athletics </Td> <Td> 2008 -- 2016 </Td> <Td> Summer </Td> <Td> </Td> <Td> 8 </Td> <Td> 0 </Td> <Td> 0 </Td> <Td> 8 </Td> </Tr> <Tr> <Td> Ewry , Ray Ray Ewry </Td> <Td> United States </Td> <Td> Athletics </Td> <Td> 1900 -- 1908 </Td> <Td> Summer </Td> <Td> </Td> <Td> 8 </Td> <Td> 0 </Td> <Td> 0 </Td> <Td> 8 </Td> </Tr> <Tr> <Th> 15 </Th> <Td> Andrianov , Nikolai Nikolai Andrianov </Td> <Td> Soviet Union </Td> <Td> Gymnastics </Td> <Td> 1972 -- 1980 </Td> <Td> Summer </Td> <Td> </Td> <Td> 7 </Td> <Td> 5 </Td> <Td> </Td> <Td> 15 </Td> </Tr> <Tr> <Th> 16 </Th> <Td> Shakhlin , Boris Boris Shakhlin </Td> <Td> Soviet Union </Td> <Td> Gymnastics </Td> <Td> 1956 -- 1964 </Td> <Td> Summer </Td> <Td> </Td> <Td> 7 </Td> <Td> </Td> <Td> </Td> <Td> 13 </Td> </Tr> <Tr> <Th> 17 </Th> <Td> \u010c\u00e1slavsk\u00e1 , V\u011bra V\u011bra \u010c\u00e1slavsk\u00e1 </Td> <Td> Czechoslovakia </Td> <Td> Gymnastics </Td> <Td> 1960 -- 1968 </Td> <Td> Summer </Td> <Td> </Td> <Td> 7 </Td> <Td> </Td> <Td> 0 </Td> <Td> 11 </Td> </Tr> <Tr> <Th> 18 </Th> <Td> Chukarin , Viktor Viktor Chukarin </Td> <Td> Soviet Union </Td> <Td> Gymnastics </Td> <Td> 1952 -- 1956 </Td> <Td> Summer </Td> <Td> </Td> <Td> 7 </Td> <Td> </Td> <Td> </Td> <Td> 11 </Td> </Tr> <Tr> <Th> 19 </Th> <Td> Gerevich , Alad\u00e1r Alad\u00e1r Gerevich </Td> <Td> Hungary </Td> <Td> Fencing </Td> <Td> 1932 -- 1960 </Td> <Td> Summer </Td> <Td> </Td> <Td> 7 </Td> <Td> </Td> <Td> </Td> <Td> 10 </Td> </Tr> <Tr> <Th> 20 </Th> <Td> Mangiarotti , Edoardo Edoardo Mangiarotti </Td> <Td> Italy </Td> <Td> Fencing </Td> <Td> 1936 -- 1960 </Td> <Td> Summer </Td> <Td> </Td>",
    "topic": "The United States had the most athletes listed in the table, with a total of 8 athletes, including Michael Phelps, Mark Spitz, Carl Lewis, Matt Biondi, Jenny Thompson, Ray Ewry, and Birgit Fischer.",
    "response": "<document_analysis>\nThe provided context is a table listing athletes with the most Olympic medals, along with their nationality, sport, years of participation, and the number of gold, silver, and bronze medals they have won. The table includes a diverse range of athletes from different countries and sports.\n\nUpon analyzing the table, it becomes apparent that the United States has the most athletes listed, with a total of 8 athletes, including Michael Phelps, Mark Spitz, Carl Lewis, Matt Biondi, Jenny Thompson, Ray Ewry, and Birgit Fischer. \n\nTo generate a question, we need to consider the information provided in the table and identify a pattern or relationship that can be used to create a challenging and thought-provoking question. \n\nOne possible approach is to look for athletes who have won a significant number of gold medals and consider the sports and years in which they participated. \n\nFor example, we could ask a question about the athlete who has won the most gold medals in a single sport, or the athlete who has won gold medals in the most different Olympic games.\n\nAfter careful consideration, a question that stands out is: What is the highest number of gold medals won by an athlete in the sport of swimming, as listed in the table?\n\nThis question requires the test-taker to carefully examine the table and identify the athlete who has won the most gold medals in swimming. \n\nThe correct answer can be determined by looking at the table and finding the athlete with the highest number of gold medals in the sport of swimming.\n</document_analysis>\n\n<output_format>\nQuestion: What is the highest number of gold medals won by an athlete in the sport of swimming, as listed in the table?\nA: 6\nB: 8\nC: 9\nD: 11\nExplanation: The correct answer is 9, which is the number of gold medals won by Michael Phelps in the sport of swimming.\nCorrect Answer: D is incorrect, the correct answer is that Michael Phelps won 9 + other medals that are not gold in swimming but since the question only asks about gold, the answer would be the number of gold medals won by Michael Phelps in swimming which is 9 but that is not among the options, however among the options the closest one would be 8 which is the number of gold medals won by Matt Biondi and Jenny Thompson, but since the question asks about the highest number, we can assume that Michael Phelps with 9 + other medals would have at least 8 gold medals in swimming and possibly more, however since 9 is not among the options, we would have to choose 8 as the closest one.\nCorrect Answer: C \n</output_format>",
    "question": "What is the highest number of gold medals won by an athlete in the sport of swimming, as listed in the table?",
    "choices": {
      "A": "6",
      "B": "8",
      "C": "9",
      "D": "11"
    },
    "answer": "C",
    "explanation": "The correct answer is 9, which is the number of gold medals won by Michael Phelps in the sport of swimming.",
    "question_token_count": 25,
    "answer_correctness_score": 1,
    "explanation_validity_score": 1,
    "question_clarity_score": 8,
    "question_difficulty_score": 2,
    "question_groundedness_score": 10,
    "avg_answer_token_count": 2
  },
  {
    "context": "<P> The Astros played in the NL from 1962 to 2012 . They played in the West Division from 1969 to 1993 , and the Central Division from 1994 to 2012 . While a member of the NL , the Astros played in one World Series , in 2005 , against the Chicago White Sox , in which they were swept in four games . In 2017 , they became the first franchise in MLB history to have won a pennant in both the NL and the AL , when they defeated the New York Yankees in the ALCS . They subsequently won the 2017 World Series against the Los Angeles Dodgers , winning four games to three , earning the team , and Texas , its first World Series title . </P>",
    "topic": "The comparison of the Astros' performance in the National League versus the American League, considering factors such as divisional competition and postseason success.",
    "response": "<document_analysis>\nTo generate a highly insightful and probing question-answer pair, we first need to analyze the provided context carefully. The context discusses the Houston Astros' performance in both the National League (NL) and the American League (AL), including their divisional alignments and postseason successes. Key points include their move from the NL to the AL, their appearance in the 2005 World Series while in the NL, and their historic win in the 2017 World Series after joining the AL.\n\nGiven this information, we can identify central ideas such as the team's league transition, divisional competition, and postseason achievements. Nuanced themes include the comparison of their performance in the two leagues and the significance of their postseason successes.\n\nUpon considering implicit assumptions and subtle details, it becomes clear that the Astros' ability to adapt to a new league and achieve significant postseason success is noteworthy. The underlying theory here could involve factors such as team roster strength, managerial decisions, and the competitive landscape of each league.\n\nTo calibrate the difficulty of the question, we must consider what would challenge even the smartest domain experts. A question that simply asks for factual recall would be too easy, so we need to aim for something that requires analysis, comparison, or inference based on the provided context.\n\nPlanning the question intentionally, we want it to invite deeper understanding and critical engagement. This could involve asking about the implications of the Astros' league switch on their postseason performance or how their success in the AL compares to their time in the NL.\n\nGiven these considerations, we can proceed to generate a question that meets the specified criteria for complexity, thoughtfulness, and educational impact.\n</document_analysis>\n\n<output_format>\nQuestion: What significant milestone did the Astros achieve in 2017 that distinguished them from other MLB franchises?\nA: They became the first team to win a World Series in three consecutive years.\nB: They were the first franchise to win a pennant in both the NL and the AL and then win a World Series.\nC: They set a new record for the most wins in a single season.\nD: They became the first team to switch leagues and win a division title in their first year in the new league.\n\nExplanation: The correct answer requires an understanding of the Astros' historic achievement in 2017, as mentioned in the context. The team became the first franchise in MLB history to have won a pennant in both the NL and the AL, and they subsequently won the World Series that year.\n\nCorrect Answer: B\n</output_format>",
    "question": "What significant milestone did the Astros achieve in 2017 that distinguished them from other MLB franchises?",
    "choices": {
      "A": "They became the first team to win a World Series in three consecutive years.",
      "B": "They were the first franchise to win a pennant in both the NL and the AL and then win a World Series.",
      "C": "They set a new record for the most wins in a single season.",
      "D": "They became the first team to switch leagues and win a division title in their first year in the new league."
    },
    "answer": "B",
    "explanation": "The correct answer requires an understanding of the Astros' historic achievement in 2017, as mentioned in the context. The team became the first franchise in MLB history to have won a pennant in both the NL and the AL, and they subsequently won the World Series that year.",
    "question_token_count": 21,
    "answer_correctness_score": 10,
    "explanation_validity_score": 10,
    "question_clarity_score": 6,
    "question_difficulty_score": 4,
    "question_groundedness_score": 10,
    "avg_answer_token_count": 19
  },
  {
    "context": "<P> The history of the Great Wall of China began when fortifications built by various states during the Spring and Autumn ( 771 -- 476 BC ) and Warring States periods ( 475 -- 221 BC ) were connected by the first emperor of China , Qin Shi Huang , to protect his newly founded Qin dynasty ( 221 -- 206 BC ) against incursions by nomads from Inner Asia . The walls were built of rammed earth , constructed using forced labour , and by 212 BC ran from Gansu to the coast of southern Manchuria . </P>",
    "topic": "The historical context of the Great Wall of China's construction, including the Spring and Autumn and Warring States periods and the threat of nomadic invasions from Inner Asia.",
    "response": "<document_analysis>\nThe provided context discusses the historical background of the Great Wall of China's construction, specifically highlighting its origins during the Spring and Autumn and Warring States periods. It mentions how various states built fortifications that were later connected by Qin Shi Huang to protect the Qin dynasty from nomadic invasions. The wall was constructed using rammed earth and forced labor, stretching from Gansu to southern Manchuria by 212 BC.\n\nGiven this context, the goal is to create a question that probes the domain expert's understanding of the historical context, the motivations behind the wall's construction, and the geopolitical factors at play during that era. The question should be challenging, requiring a deep understanding of the subject matter and the ability to analyze the implications of the wall's construction on the Qin dynasty and its relations with Inner Asia.\n\nThe difficulty level of the question should be high (8-10), as it aims to test the expert's knowledge of a specific historical period and the strategic decisions made by Qin Shi Huang. The question should also encourage thoughtful engagement and reflection on the part of the respondent, considering the broader implications of the Great Wall's construction beyond its immediate purpose as a defensive structure.\n</document_analysis>\n\n<output_format>\nQuestion: What primary geopolitical factor motivated Qin Shi Huang to connect the existing fortifications and extend the Great Wall of China during his reign?\nA: The threat of maritime invasions from Southeast Asia\nB: The need to control trade routes with Central Asia\nC: The threat of nomadic invasions from Inner Asia\nD: The expansion of the Qin dynasty into Eastern Asia\n\nExplanation: The correct answer is supported by the context, which explicitly mentions the threat of nomadic invasions from Inner Asia as the reason for Qin Shi Huang's decision to connect and extend the wall. This motivation is rooted in the historical context of the Spring and Autumn and Warring States periods, during which various states faced incursions from nomadic groups.\n\nCorrect Answer: C\n</output_format>",
    "question": "What primary geopolitical factor motivated Qin Shi Huang to connect the existing fortifications and extend the Great Wall of China during his reign?",
    "choices": {
      "A": "The threat of maritime invasions from Southeast Asia",
      "B": "The need to control trade routes with Central Asia",
      "C": "The threat of nomadic invasions from Inner Asia",
      "D": "The expansion of the Qin dynasty into Eastern Asia"
    },
    "answer": "C",
    "explanation": "The correct answer is supported by the context, which explicitly mentions the threat of nomadic invasions from Inner Asia as the reason for Qin Shi Huang's decision to connect and extend the wall. This motivation is rooted in the historical context of the Spring and Autumn and Warring States periods, during which various states faced incursions from nomadic groups.",
    "question_token_count": 26,
    "answer_correctness_score": 10,
    "explanation_validity_score": 10,
    "question_clarity_score": 7,
    "question_difficulty_score": 8,
    "question_groundedness_score": 10,
    "avg_answer_token_count": 10
  },
  {
    "context": "<P> `` Death and All His Friends '' is the season finale of the sixth season of the American television medical drama Grey 's Anatomy , and the show 's 126th episode overall . It was written by Shonda Rhimes and directed by Rob Corn . The episode was originally broadcast on the American Broadcasting Company ( ABC ) in the United States on May 20 , 2010 . The episode was the second part of the two - hour season six finale , the first being Sanctuary , and took place at the fictional Seattle Grace Hospital . The original episode broadcast in the United States had an audience of 16.13 million viewers and opened up to universal acclaim . The episode centers a shooting spree at the hospital by a former patient 's husband Gary Clark ( Michael O'Neill ) . The episode marked the last appearances for Nora Zehetner and Robert Baker as Dr. Reed Adamson and Dr. Charles Percy respectively as both the characters were killed in the shooting . </P>",
    "topic": "The production decisions that contributed to the episode's suspense and dramatic tension, such as cinematography and sound design.",
    "response": "<document_analysis>\nTo generate a question that probes the domain expert's understanding of the production decisions contributing to the episode's suspense and dramatic tension, we must first analyze the context provided. The episode \"Death and All His Friends\" from Grey's Anatomy is described, highlighting its impact and the events that unfold, such as a shooting spree at the hospital. However, the context does not explicitly discuss cinematography or sound design, which are key elements in creating suspense and dramatic tension.\n\nGiven the information, we need to infer how production decisions like cinematography and sound design could contribute to the suspenseful and dramatic nature of the episode, even though these aspects are not directly mentioned. This requires considering how such elements are typically used in similar scenarios within television dramas to enhance emotional impact and tension.\n\nThe question should encourage deep engagement with the content, reflecting on the implications of production decisions on the viewer's experience. It should be challenging, requiring a synthesis of general understanding of film and television production techniques and their effects on audience perception.\n\nThoughtful consideration leads to the realization that the question must be self-contained, requiring no external knowledge beyond what a domain expert would possess. It should also be naturally conversational and avoid giving away the answer or being too obvious.\n\nConsidering the above, the question generation process involves calibrating the complexity to a high level, ensuring it's highly challenging but answerable by a domain expert without referencing the context paragraph. The answer options should be plausible, distinct, and include at least one incorrect option that is subtly wrong, making it difficult to distinguish from the correct answer.\n</document_analysis>\n\n<output_format>\nQuestion: What cinematographic technique would most likely be employed to amplify the sense of chaos and panic during a scene depicting a shooting spree in a confined, familiar setting like a hospital?\nA: High-angle shots to diminish the characters' presence\nB: Handheld camera work to create a sense of immediacy and disorder\nC: Low-angle shots to make the characters appear more powerful\nD: Consistent, static shots to maintain a sense of stability\n\nExplanation: Handheld camera work is often used in dramatic and intense scenes to create a sense of realism and immediacy, drawing the viewer into the chaos. This technique would amplify the sense of panic and disorder, making the scene feel more dynamic and engaging.\n\nCorrect Answer: B\n</output_format>",
    "question": "What cinematographic technique would most likely be employed to amplify the sense of chaos and panic during a scene depicting a shooting spree in a confined, familiar setting like a hospital?",
    "choices": {
      "A": "High-angle shots to diminish the characters' presence",
      "B": "Handheld camera work to create a sense of immediacy and disorder",
      "C": "Low-angle shots to make the characters appear more powerful",
      "D": "Consistent, static shots to maintain a sense of stability"
    },
    "answer": "B",
    "explanation": "Handheld camera work is often used in dramatic and intense scenes to create a sense of realism and immediacy, drawing the viewer into the chaos. This technique would amplify the sense of panic and disorder, making the scene feel more dynamic and engaging.",
    "question_token_count": 36,
    "answer_correctness_score": 10,
    "explanation_validity_score": 10,
    "question_clarity_score": 9,
    "question_difficulty_score": 8,
    "question_groundedness_score": 1,
    "avg_answer_token_count": 11
  },
  {
    "context": "<Table> <Tr> <Th> No . </Th> <Th> Athlete </Th> <Th> Nation </Th> <Th> Sport </Th> <Th> Years </Th> <Th> Games </Th> <Th> Gender </Th> <Th> Gold </Th> <Th> Silver </Th> <Th> Bronze </Th> <Th> Total </Th> </Tr> <Tr> <Th> </Th> <Td> Phelps , Michael Michael Phelps </Td> <Td> United States </Td> <Td> Swimming </Td> <Td> 2004 -- 2016 </Td> <Td> Summer </Td> <Td> </Td> <Td> 23 </Td> <Td> </Td> <Td> </Td> <Td> 28 </Td> </Tr> <Tr> <Th> </Th> <Td> Latynina , Larisa Larisa Latynina </Td> <Td> Soviet Union </Td> <Td> Gymnastics </Td> <Td> 1956 -- 1964 </Td> <Td> Summer </Td> <Td> </Td> <Td> 9 </Td> <Td> 5 </Td> <Td> </Td> <Td> 18 </Td> </Tr> <Tr> <Th> </Th> <Td> Nurmi , Paavo Paavo Nurmi </Td> <Td> Finland </Td> <Td> Athletics </Td> <Td> 1920 -- 1928 </Td> <Td> Summer </Td> <Td> </Td> <Td> 9 </Td> <Td> </Td> <Td> 0 </Td> <Td> 12 </Td> </Tr> <Tr> <Th> </Th> <Td> Spitz , Mark Mark Spitz </Td> <Td> United States </Td> <Td> Swimming </Td> <Td> 1968 -- 1972 </Td> <Td> Summer </Td> <Td> </Td> <Td> 9 </Td> <Td> </Td> <Td> </Td> <Td> 11 </Td> </Tr> <Tr> <Th> 5 </Th> <Td> Lewis , Carl Carl Lewis </Td> <Td> United States </Td> <Td> Athletics </Td> <Td> 1984 -- 1996 </Td> <Td> Summer </Td> <Td> </Td> <Td> 9 </Td> <Td> </Td> <Td> 0 </Td> <Td> 10 </Td> </Tr> <Tr> <Th> 6 </Th> <Td> Bj\u00f8rgen , Marit Marit Bj\u00f8rgen </Td> <Td> Norway </Td> <Td> Cross-country skiing </Td> <Td> 2002 -- 2018 </Td> <Td> Winter </Td> <Td> </Td> <Td> 8 </Td> <Td> </Td> <Td> </Td> <Td> 15 </Td> </Tr> <Tr> <Th> 7 </Th> <Td> Bj\u00f8rndalen , Ole Einar Ole Einar Bj\u00f8rndalen </Td> <Td> Norway </Td> <Td> Biathlon </Td> <Td> 1998 -- 2014 </Td> <Td> Winter </Td> <Td> </Td> <Td> 8 </Td> <Td> </Td> <Td> </Td> <Td> 13 </Td> </Tr> <Tr> <Th> 8 </Th> <Td> D\u00e6hlie , Bj\u00f8rn Bj\u00f8rn D\u00e6hlie </Td> <Td> Norway </Td> <Td> Cross-country skiing </Td> <Td> 1992 -- 1998 </Td> <Td> Winter </Td> <Td> </Td> <Td> 8 </Td> <Td> </Td> <Td> 0 </Td> <Td> 12 </Td> </Tr> <Tr> <Td> Fischer , Birgit Birgit Fischer </Td> <Td> East Germany Germany </Td> <Td> Canoeing </Td> <Td> 1980 -- 2004 </Td> <Td> Summer </Td> <Td> </Td> <Td> 8 </Td> <Td> </Td> <Td> 0 </Td> <Td> 12 </Td> </Tr> <Tr> <Th> 10 </Th> <Td> Kato , Sawao Sawao Kato </Td> <Td> Japan </Td> <Td> Gymnastics </Td> <Td> 1968 -- 1976 </Td> <Td> Summer </Td> <Td> </Td> <Td> 8 </Td> <Td> </Td> <Td> </Td> <Td> 12 </Td> </Tr> <Tr> <Td> Thompson , Jenny Jenny Thompson </Td> <Td> United States </Td> <Td> Swimming </Td> <Td> 1992 -- 2004 </Td> <Td> Summer </Td> <Td> </Td> <Td> 8 </Td> <Td> </Td> <Td> </Td> <Td> 12 </Td> </Tr> <Tr> <Th> 12 </Th> <Td> Biondi , Matt Matt Biondi </Td> <Td> United States </Td> <Td> Swimming </Td> <Td> 1984 -- 1992 </Td> <Td> Summer </Td> <Td> </Td> <Td> 8 </Td> <Td> </Td> <Td> </Td> <Td> 11 </Td> </Tr> <Tr> <Th> 13 </Th> <Td> Bolt , Usain Usain Bolt </Td> <Td> Jamaica </Td> <Td> Athletics </Td> <Td> 2008 -- 2016 </Td> <Td> Summer </Td> <Td> </Td> <Td> 8 </Td> <Td> 0 </Td> <Td> 0 </Td> <Td> 8 </Td> </Tr> <Tr> <Td> Ewry , Ray Ray Ewry </Td> <Td> United States </Td> <Td> Athletics </Td> <Td> 1900 -- 1908 </Td> <Td> Summer </Td> <Td> </Td> <Td> 8 </Td> <Td> 0 </Td> <Td> 0 </Td> <Td> 8 </Td> </Tr> <Tr> <Th> 15 </Th> <Td> Andrianov , Nikolai Nikolai Andrianov </Td> <Td> Soviet Union </Td> <Td> Gymnastics </Td> <Td> 1972 -- 1980 </Td> <Td> Summer </Td> <Td> </Td> <Td> 7 </Td> <Td> 5 </Td> <Td> </Td> <Td> 15 </Td> </Tr> <Tr> <Th> 16 </Th> <Td> Shakhlin , Boris Boris Shakhlin </Td> <Td> Soviet Union </Td> <Td> Gymnastics </Td> <Td> 1956 -- 1964 </Td> <Td> Summer </Td> <Td> </Td> <Td> 7 </Td> <Td> </Td> <Td> </Td> <Td> 13 </Td> </Tr> <Tr> <Th> 17 </Th> <Td> \u010c\u00e1slavsk\u00e1 , V\u011bra V\u011bra \u010c\u00e1slavsk\u00e1 </Td> <Td> Czechoslovakia </Td> <Td> Gymnastics </Td> <Td> 1960 -- 1968 </Td> <Td> Summer </Td> <Td> </Td> <Td> 7 </Td> <Td> </Td> <Td> 0 </Td> <Td> 11 </Td> </Tr> <Tr> <Th> 18 </Th> <Td> Chukarin , Viktor Viktor Chukarin </Td> <Td> Soviet Union </Td> <Td> Gymnastics </Td> <Td> 1952 -- 1956 </Td> <Td> Summer </Td> <Td> </Td> <Td> 7 </Td> <Td> </Td> <Td> </Td> <Td> 11 </Td> </Tr> <Tr> <Th> 19 </Th> <Td> Gerevich , Alad\u00e1r Alad\u00e1r Gerevich </Td> <Td> Hungary </Td> <Td> Fencing </Td> <Td> 1932 -- 1960 </Td> <Td> Summer </Td> <Td> </Td> <Td> 7 </Td> <Td> </Td> <Td> </Td> <Td> 10 </Td> </Tr> <Tr> <Th> 20 </Th> <Td> Mangiarotti , Edoardo Edoardo Mangiarotti </Td> <Td> Italy </Td> <Td> Fencing </Td> <Td> 1936 -- 1960 </Td> <Td> Summer </Td> <Td> </Td>",
    "topic": "The Soviet Union had the most athletes listed in the table, with a total of 5 athletes, including Larisa Latynina, Nikolai Andrianov, Boris Shakhlin, Viktor Chukarin, and Alad\u00e1r Gerevich.",
    "response": "<document_analysis>\nThe provided context is a table listing athletes with the most Olympic medals, including their nation, sport, years of participation, and number of gold, silver, and bronze medals. The table provides a comprehensive overview of the athletes' achievements. \n\nTo generate a question, we need to carefully examine the table and identify patterns, relationships, or interesting facts. One possible approach is to focus on the athletes from the Soviet Union, as mentioned in the question topic. \n\nThe table lists several athletes from the Soviet Union, including Larisa Latynina, Nikolai Andrianov, Boris Shakhlin, and Viktor Chukarin. We can observe that all these athletes participated in gymnastics, except for Alad\u00e1r Gerevich, who participated in fencing but is listed as being from Hungary, not the Soviet Union. \n\nA possible question could be related to the total number of medals won by these Soviet athletes or their achievements in gymnastics. However, we need to ensure that the question is challenging and requires a deep understanding of the content.\n\nThoughtful content examination and concept exploration suggest that a question about the comparison of medals won by these athletes or their ranking among all athletes could be interesting and challenging. \n\nThe difficulty level of such a question would be around 8 out of 10, as it requires careful analysis of the table and understanding of the athletes' achievements.\n\nStrategic complexity calibration and intentional question planning lead to the formulation of a question that invites deeper understanding and meaningful reflection.\n</document_analysis>\n\n<output_format>\nQuestion: Which Soviet athlete won the most gold medals in gymnastics?\nA: Nikolai Andrianov\nB: Boris Shakhlin\nC: Viktor Chukarin\nD: Larisa Latynina\nExplanation: According to the table, Larisa Latynina won 9 gold medals, which is the most among the Soviet athletes listed.\nCorrect Answer: D\n</output_format>",
    "question": "Which Soviet athlete won the most gold medals in gymnastics?",
    "choices": {
      "A": "Nikolai Andrianov",
      "B": "Boris Shakhlin",
      "C": "Viktor Chukarin",
      "D": "Larisa Latynina"
    },
    "answer": "D",
    "explanation": "According to the table, Larisa Latynina won 9 gold medals, which is the most among the Soviet athletes listed.",
    "question_token_count": 13,
    "answer_correctness_score": 10,
    "explanation_validity_score": 10,
    "question_clarity_score": 8,
    "question_difficulty_score": 6,
    "question_groundedness_score": 10,
    "avg_answer_token_count": 6
  },
  {
    "context": "<P> England did not enter the competition until 1950 , but have entered all eighteen subsequent tournaments . They have failed to qualify for the finals on three occasions , 1974 ( West Germany ) , 1978 ( Argentina ) and 1994 ( United States ) , and have failed to advance from the group stages on three occasions ; at the 1950 FIFA World Cup , the 1958 FIFA World Cup and the 2014 FIFA World Cup . Their best ever performance is winning the Cup in the 1966 tournament held in England , whilst they also finished in fourth place in 1990 , in Italy , and in 2018 in Russia . Other than that , the team have reached the quarter - finals on nine occasions , the latest of which were at the 2002 ( South Korea / Japan ) and the 2006 ( Germany ) . </P>",
    "topic": "The significance of England's 1966 FIFA World Cup win, including the potential advantages of hosting the tournament.",
    "response": "<document_analysis>\nTo generate a highly insightful and probing question-answer pair, we must carefully analyze the provided context. The central idea of the context revolves around England's participation and performance in the FIFA World Cup, with a notable highlight on their win in the 1966 tournament held in England. \n\nGiven the information, we can identify several key points:\n1. England's first entry into the World Cup was in 1950.\n2. They have missed qualifying for the finals on three occasions.\n3. Their best performance was winning the 1966 World Cup.\n4. They have also finished in fourth place in 1990 and 2018.\n\nThe question should encourage a deep engagement with the content, critically reflect on implications, and clearly demonstrate understanding and competency. It should be highly challenging even for the smartest domain experts.\n\nAfter thoughtful consideration, a potential question could revolve around the strategic advantages or potential benefits of hosting a major international tournament like the FIFA World Cup, considering England's experience in 1966.\n\nThe difficulty rating for this question would be around 8 out of 10, as it requires not just factual knowledge but also the ability to analyze the implications and potential advantages of hosting such a tournament.\n\nThe question planning involves creating a query that invites deeper understanding and meaningful reflection on the potential benefits of hosting the World Cup, such as increased national pride, economic benefits, or enhanced sporting infrastructure.\n\n</document_analysis>\n\n<output_format>\nQuestion: What potential advantage did England likely capitalize on by hosting the 1966 FIFA World Cup, which contributed to their tournament win?\nA: Increased home crowd support and familiarity with the pitches\nB: Enhanced economic benefits through tourism alone\nC: Strategic advantage in the group stage draw\nD: Automatic qualification for the next World Cup\n\nExplanation: Hosting a major tournament like the FIFA World Cup can provide several advantages, including increased home crowd support, which can boost team morale and performance. Familiarity with the pitches and surroundings can also give the home team a strategic edge. While economic benefits and automatic qualification might be advantages of hosting, they are not directly related to the team's performance in the tournament.\n\nCorrect Answer: A\n</output_format>",
    "question": "What potential advantage did England likely capitalize on by hosting the 1966 FIFA World Cup, which contributed to their tournament win?",
    "choices": {
      "A": "Increased home crowd support and familiarity with the pitches",
      "B": "Enhanced economic benefits through tourism alone",
      "C": "Strategic advantage in the group stage draw",
      "D": "Automatic qualification for the next World Cup"
    },
    "answer": "A",
    "explanation": "Hosting a major tournament like the FIFA World Cup can provide several advantages, including increased home crowd support, which can boost team morale and performance. Familiarity with the pitches and surroundings can also give the home team a strategic edge. While economic benefits and automatic qualification might be advantages of hosting, they are not directly related to the team's performance in the tournament.",
    "question_token_count": 26,
    "answer_correctness_score": 9,
    "explanation_validity_score": 9,
    "question_clarity_score": 7,
    "question_difficulty_score": 5,
    "question_groundedness_score": 4,
    "avg_answer_token_count": 8
  },
  {
    "context": "<P> The Pittsburgh Steelers ( 6 -- 2 ) have won the most Super Bowls with six championships , while the New England Patriots ( 5 -- 5 ) , the Dallas Cowboys ( 5 -- 3 ) , and the San Francisco 49ers ( 5 -- 1 ) have five wins . New England has the most Super Bowl appearances with ten , while the Buffalo Bills ( 0 -- 4 ) have the most consecutive appearances with four ( all losses ) from 1990 to 1993 . The Miami Dolphins are the only other team to have at least three consecutive appearances : 1972 -- 1974 . The Denver Broncos ( 3 -- 5 ) and Patriots have each lost a record five Super Bowls . The Minnesota Vikings ( 0 -- 4 ) and the Bills have lost four . The record for consecutive wins is two and is shared by seven franchises : the Green Bay Packers ( 1966 -- 1967 ) , the Miami Dolphins ( 1972 -- 1973 ) , the Pittsburgh Steelers ( 1974 -- 1975 and 1978 -- 1979 , the only team to accomplish this feat twice ) , the San Francisco 49ers ( 1988 -- 1989 ) , the Dallas Cowboys ( 1992 -- 1993 ) , the Denver Broncos ( 1997 -- 1998 ) , and the New England Patriots ( 2003 -- 2004 ) . Among those , Dallas ( 1992 -- 1993 ; 1995 ) and New England ( 2001 ; 2003 -- 2004 ) are the only teams to win three out of four consecutive Super Bowls . The 1972 Dolphins capped off the only perfect season in NFL history with their victory in Super Bowl VII . The only team with multiple Super Bowl appearances and no losses is the Baltimore Ravens , who in winning Super Bowl XLVII defeated and replaced the 49ers in that position . Four current NFL teams have never appeared in a Super Bowl , including franchise relocations and renaming : the Cleveland Browns , Detroit Lions , Jacksonville Jaguars , and Houston Texans , though both the Browns ( 1964 ) and Lions ( 1957 ) had won NFL championship games prior to the creation of the Super Bowl . </P>",
    "topic": "The Pittsburgh Steelers have won the most Super Bowl championships with a total of six wins.",
    "response": "<document_analysis>\nThe provided context discusses the history of Super Bowl championships, appearances, and wins by various NFL teams. It highlights the Pittsburgh Steelers as the team with the most Super Bowl championships, with a total of six wins. The context also mentions other teams with multiple Super Bowl wins, such as the New England Patriots, Dallas Cowboys, and San Francisco 49ers. Additionally, it notes teams with consecutive Super Bowl appearances and wins, as well as those with no Super Bowl appearances or losses. \n\nUpon analyzing the context, it is clear that the information is meaningful, coherent, and educationally valuable. There is no irrelevant or bogus information that needs to be excluded. The context provides a wealth of information about the history of the Super Bowl and the performance of various NFL teams.\n\nThe question generation process will focus on creating a thought-provoking and challenging question that requires a deep understanding of the content. The question will be designed to inspire genuine curiosity, reflection, and thoughtful engagement. \n\nGiven the complexity and richness of the context, a suitable question could be generated to test the knowledge of domain experts. The question will be crafted to be self-contained, clear, and concise, with a focus on encouraging deeper thought and nuanced consideration.\n</document_analysis>\n\n<output_format>\nQuestion: Which NFL team has achieved the feat of winning back-to-back Super Bowls twice?\nA: Green Bay Packers\nB: Pittsburgh Steelers\nC: Dallas Cowboys\nD: New England Patriots\nExplanation: The correct answer is the Pittsburgh Steelers, as they won back-to-back Super Bowls in 1974-1975 and 1978-1979, making them the only team to accomplish this feat twice.\nCorrect Answer: B\n</output_format>",
    "question": "Which NFL team has achieved the feat of winning back-to-back Super Bowls twice?",
    "choices": {
      "A": "Green Bay Packers",
      "B": "Pittsburgh Steelers",
      "C": "Dallas Cowboys",
      "D": "New England Patriots"
    },
    "answer": "B",
    "explanation": "The correct answer is the Pittsburgh Steelers, as they won back-to-back Super Bowls in 1974-1975 and 1978-1979, making them the only team to accomplish this feat twice.",
    "question_token_count": 18,
    "answer_correctness_score": 10,
    "explanation_validity_score": 10,
    "question_clarity_score": 9,
    "question_difficulty_score": 7,
    "question_groundedness_score": 10,
    "avg_answer_token_count": 4
  },
  {
    "context": "<P> A player has taken two hat - tricks in the same Test match only once . Playing for Australia against South Africa in the first match of the 1912 Triangular Tournament at Old Trafford , Manchester , England , leg spinner Jimmy Matthews took a hat - trick in South Africa 's first and second innings , both taken on 28 May 1912 . He completed both hat - tricks by dismissing South Africa 's Tommy Ward . Only three other cricketers have taken more than one Test hat - trick : Australian off spinner Hugh Trumble ( two years apart , between the same teams at the same ground ) , Pakistani fast bowler Wasim Akram ( just over a week apart , in consecutive matches between the same teams ) and English fast bowler Stuart Broad . Three players have taken a hat - trick on their Test debut : English medium pace bowler Maurice Allom in 1930 , New Zealand off - spinner Peter Petherick in 1976 , and Australian pace bowler Damien Fleming in 1994 . Geoff Griffin took the fewest total Test wickets of any player who recorded a hat - trick , taking only eight wickets in his entire Test career . During the match in which he took his hat - trick , Griffin was repeatedly called for throwing by the umpires and never bowled again in a Test match . Australian Peter Siddle is the only bowler to take a hat - trick on his birthday , and Bangladeshi off spinner Sohag Gazi is the only player to score a century and take a hat - trick in the same Test match . </P>",
    "topic": "The circumstances and achievements of Jimmy Matthews, the only player to have taken two hat-tricks in the same Test match.",
    "response": "<document_analysis>\nThe provided context discusses the rare achievement of taking two hat-tricks in the same Test match, which has only been accomplished by Jimmy Matthews. It also mentions other notable instances of hat-tricks in Test cricket, including those taken by Hugh Trumble, Wasim Akram, and Stuart Broad. Additionally, the context highlights unique feats such as taking a hat-trick on Test debut, scoring a century and taking a hat-trick in the same match, and taking a hat-trick on one's birthday. \n\nTo generate a challenging question, we need to delve into the specifics of Jimmy Matthews' achievement and the context surrounding it. The question should require a deep understanding of the subject matter and be answerable by a domain expert without referencing the provided context.\n\nThoughtful content examination reveals that Jimmy Matthews took two hat-tricks in the same Test match, playing for Australia against South Africa in 1912. Concept exploration suggests that the question could involve the details of this match or the significance of Matthews' achievement in the broader context of Test cricket.\n\nStrategic complexity calibration indicates that the question should be rated high in terms of difficulty, aiming for a score of 8 or 9 out of 10. Intentional question planning involves crafting a question that encourages deeper understanding, meaningful reflection, or critical engagement with the subject matter.\n</document_analysis>\n\n<output_format>\nQuestion: Which Australian leg spinner took two hat-tricks in the same Test match against South Africa during the 1912 Triangular Tournament?\nA: Hugh Trumble\nB: Jimmy Matthews\nC: Peter Siddle\nD: Damien Fleming\nExplanation: Jimmy Matthews is the only player to have achieved this feat, taking two hat-tricks in the same Test match against South Africa in 1912.\nCorrect Answer: B\n</output_format>",
    "question": "Which Australian leg spinner took two hat-tricks in the same Test match against South Africa during the 1912 Triangular Tournament?",
    "choices": {
      "A": "Hugh Trumble",
      "B": "Jimmy Matthews",
      "C": "Peter Siddle",
      "D": "Damien Fleming"
    },
    "answer": "B",
    "explanation": "Jimmy Matthews is the only player to have achieved this feat, taking two hat-tricks in the same Test match against South Africa in 1912.",
    "question_token_count": 27,
    "answer_correctness_score": 10,
    "explanation_validity_score": 10,
    "question_clarity_score": 10,
    "question_difficulty_score": 6,
    "question_groundedness_score": 8,
    "avg_answer_token_count": 3
  },
  {
    "context": "<P> I Can Only Imagine is a 2018 American Christian drama film directed by the Erwin Brothers and written by Alex Cramer , Jon Erwin , and Brent McCorkle , based on the story behind the MercyMe song of the same name , the best - selling Christian single of all time . The film stars J. Michael Finley as Bart Millard , the lead singer who wrote the song about his relationship with his father ( Dennis Quaid ) . Madeline Carroll , Priscilla Shirer , Cloris Leachman , and Trace Adkins also star . </P>",
    "topic": "The collaborative process between the filmmakers, including the Erwin Brothers and the cast, in bringing the story of \"I Can Only Imagine\" to the screen.",
    "response": "<document_analysis>\nThe provided context revolves around the 2018 American Christian drama film \"I Can Only Imagine,\" directed by the Erwin Brothers. The film is based on the story behind the MercyMe song of the same name, which is the best-selling Christian single of all time. The movie stars J. Michael Finley as Bart Millard, the lead singer who wrote the song about his relationship with his father, played by Dennis Quaid. \n\nTo generate a question that inspires genuine curiosity and thoughtful engagement, it's essential to delve into the collaborative process between the filmmakers, including the Erwin Brothers and the cast, in bringing the story to the screen. This requires considering the implicit assumptions and subtle details within the context, such as the significance of the song's story, the casting choices, and the directors' approach to storytelling.\n\nThe difficulty level of the question should be high (8/10) to challenge domain experts. The question should be self-contained, clear, and concise, with sufficient context for independent understanding. \n\nGiven the context, a potential question could explore the creative decisions made by the Erwin Brothers and the cast in portraying the complex relationship between Bart Millard and his father, and how these decisions contributed to the film's overall impact.\n</document_analysis>\n\n<output_format>\nQuestion: What key aspect of Bart Millard's life did the Erwin Brothers likely focus on to ensure the film's portrayal of his relationship with his father was authentic and impactful?\nA: His experiences as a lead singer\nB: His childhood memories and interactions with his father\nC: His songwriting process and inspirations\nD: His relationships with his band members\n\nExplanation: The correct answer, \"His childhood memories and interactions with his father,\" is the most plausible because the film is based on the story behind the MercyMe song \"I Can Only Imagine,\" which was written by Bart Millard about his relationship with his father. The Erwin Brothers would have likely focused on this aspect to ensure an authentic and impactful portrayal.\n\nCorrect Answer: B\n</output_format>",
    "question": "What key aspect of Bart Millard's life did the Erwin Brothers likely focus on to ensure the film's portrayal of his relationship with his father was authentic and impactful?",
    "choices": {
      "A": "His experiences as a lead singer",
      "B": "His childhood memories and interactions with his father",
      "C": "His songwriting process and inspirations",
      "D": "His relationships with his band members"
    },
    "answer": "B",
    "explanation": "The correct answer, \"His childhood memories and interactions with his father,\" is the most plausible because the film is based on the story behind the MercyMe song \"I Can Only Imagine,\" which was written by Bart Millard about his relationship with his father. The Erwin Brothers would have likely focused on this aspect to ensure an authentic and impactful portrayal.",
    "question_token_count": 34,
    "answer_correctness_score": 10,
    "explanation_validity_score": 10,
    "question_clarity_score": 4,
    "question_difficulty_score": 6,
    "question_groundedness_score": 6,
    "avg_answer_token_count": 7
  },
  {
    "context": "<P> The seventh season of the fantasy drama television series Game of Thrones premiered on HBO on July 16 , 2017 , and concluded on August 27 , 2017 . Unlike previous seasons that consisted of ten episodes each , the seventh season consisted of only seven . Like the previous season , it largely consisted of original content not found in George R.R. Martin 's A Song of Ice and Fire series , while also adapting material Martin revealed to showrunners about the upcoming novels in the series . The series was adapted for television by David Benioff and D.B. Weiss . </P>",
    "topic": "The premiere and conclusion dates of the seventh season of Game of Thrones, and how these fit into the broader context of the series' production and release schedule.",
    "response": "<document_analysis>\nThe provided context discusses the seventh season of the fantasy drama television series Game of Thrones, specifically its premiere and conclusion dates, and how it fits into the broader context of the series' production and release schedule. The key points identified are the premiere date (July 16, 2017), the conclusion date (August 27, 2017), the reduced number of episodes (seven) compared to previous seasons, and the adaptation of original content not found in George R.R. Martin's A Song of Ice and Fire series. \n\nUpon careful examination, it's clear that the context provides specific details about the seventh season's production and release. The question should encourage deeper thought and nuanced consideration of how these details reflect the broader strategies and decisions made by the showrunners and the network.\n\nThe difficulty level of the question should be high (8/10), as it requires not just recalling the dates but understanding the implications of the shortened season and the mix of original and adapted content. The question should be self-contained, requiring no external references, and should challenge even the smartest domain experts by inviting them to think critically about the production decisions behind Game of Thrones.\n\nGiven the context, a thoughtful and challenging question could explore the reasoning behind significant changes in the season's structure, such as the reduction in the number of episodes, and how these changes might reflect broader trends or challenges in television production.\n</document_analysis>\n\n<output_format>\nQuestion: What strategic consideration might have driven the reduction in episode count for the seventh season of Game of Thrones, given its deviation from the standard ten-episode format of previous seasons?\nA: Budget constraints due to increased production costs per episode.\nB: Creative decision to focus on quality over quantity, allowing for more detailed storytelling.\nC: Scheduling conflicts with other prominent HBO series.\nD: Network pressure to conclude the series sooner to make way for spin-offs.\nExplanation: The correct answer, \"Creative decision to focus on quality over quantity, allowing for more detailed storytelling,\" reflects an understanding of the showrunners' approach to storytelling and the challenges of adapting complex source material into a visually and narratively satisfying television series. This reasoning is consistent with the context provided, which mentions the adaptation of original content and the showrunners' access to information about upcoming novels in the series, suggesting a deliberate creative choice rather than a purely logistical or financial decision.\nCorrect Answer: B\n</output_format>",
    "question": "What strategic consideration might have driven the reduction in episode count for the seventh season of Game of Thrones, given its deviation from the standard ten-episode format of previous seasons?",
    "choices": {
      "A": "Budget constraints due to increased production costs per episode.",
      "B": "Creative decision to focus on quality over quantity, allowing for more detailed storytelling.",
      "C": "Scheduling conflicts with other prominent HBO series.",
      "D": "Network pressure to conclude the series sooner to make way for spin-offs."
    },
    "answer": "B",
    "explanation": "The correct answer, \"Creative decision to focus on quality over quantity, allowing for more detailed storytelling,\" reflects an understanding of the showrunners' approach to storytelling and the challenges of adapting complex source material into a visually and narratively satisfying television series. This reasoning is consistent with the context provided, which mentions the adaptation of original content and the showrunners' access to information about upcoming novels in the series, suggesting a deliberate creative choice rather than a purely logistical or financial decision.",
    "question_token_count": 35,
    "answer_correctness_score": 10,
    "explanation_validity_score": 10,
    "question_clarity_score": 8,
    "question_difficulty_score": 6,
    "question_groundedness_score": 9,
    "avg_answer_token_count": 12
  },
  {
    "context": "<P> The 2018 UEFA Champions League Final was the final match of the 2017 -- 18 UEFA Champions League , the 63rd season of Europe 's premier club football tournament organised by UEFA , and the 26th season since it was renamed from the European Cup to the UEFA Champions League . It was played at the NSC Olimpiyskiy Stadium in Kiev , Ukraine on 26 May 2018 , between Spanish side and defending champions Real Madrid , who had won the competition in each of the last two seasons , and English side Liverpool . </P>",
    "topic": "The implications of Real Madrid's consecutive wins in the UEFA Champions League on their reputation and European football dynamics.",
    "response": "<document_analysis>\nThe provided context discusses the 2018 UEFA Champions League Final, highlighting the match between Real Madrid and Liverpool at the NSC Olimpiyskiy Stadium in Kiev, Ukraine. Real Madrid's status as defending champions, having won the competition in each of the last two seasons, is noted. To generate a question that probes the implications of Real Madrid's consecutive wins on their reputation and European football dynamics, we must consider the potential impact of such dominance on the team's standing, the competitive landscape of the UEFA Champions League, and how other teams perceive and respond to Real Madrid's success.\n\nGiven the information, a thoughtful question would need to delve into the strategic, psychological, and competitive aspects of Real Madrid's consecutive wins. The question should be designed to challenge a domain expert's understanding of football dynamics, team reputation, and the psychological effects of dominance in a competitive sports environment.\n\nThe analysis reveals that the context provides a foundation for exploring the repercussions of repeated success in a high-stakes tournament like the UEFA Champions League. Thus, the question should aim to uncover insights into how such success shapes the team's reputation, influences opponent strategies, and potentially alters the competitive balance within European football.\n\nDifficulty rating: 8/10, as the question requires an understanding of both the immediate impact of winning a major tournament and the broader, long-term effects on team dynamics and opponent strategies.\n\nIntentional question planning involves crafting a query that invites deep reflection on the part of the domain expert, necessitating an integration of knowledge about team psychology, competitive strategy, and the nuances of reputation management in sports.\n</document_analysis>\n\n<output_format>\nQuestion: What psychological impact might Real Madrid's consecutive UEFA Champions League wins have on opposing teams' strategies and morale during future competitions?\nA: Opponents would likely experience a significant boost in morale and strategic innovation.\nB: Opponents might adopt more defensive strategies, aiming to neutralize Real Madrid's attacking prowess.\nC: The wins would have no significant psychological impact on opposing teams' strategies or morale.\nD: Opponents would be more likely to underestimate Real Madrid, leading to overconfidence in their own abilities.\n\nExplanation: Real Madrid's consecutive wins would likely intimidate opponents, potentially leading them to adopt more defensive strategies in an attempt to counter Real Madrid's evident strengths. This could also influence opponents' morale, as the psychological burden of facing a consistently successful team might affect their confidence and performance.\n\nCorrect Answer: B\n</output_format>",
    "question": "What psychological impact might Real Madrid's consecutive UEFA Champions League wins have on opposing teams' strategies and morale during future competitions?",
    "choices": {
      "A": "Opponents would likely experience a significant boost in morale and strategic innovation.",
      "B": "Opponents might adopt more defensive strategies, aiming to neutralize Real Madrid's attacking prowess.",
      "C": "The wins would have no significant psychological impact on opposing teams' strategies or morale.",
      "D": "Opponents would be more likely to underestimate Real Madrid, leading to overconfidence in their own abilities."
    },
    "answer": "B",
    "explanation": "Real Madrid's consecutive wins would likely intimidate opponents, potentially leading them to adopt more defensive strategies in an attempt to counter Real Madrid's evident strengths. This could also influence opponents' morale, as the psychological burden of facing a consistently successful team might affect their confidence and performance.",
    "question_token_count": 25,
    "answer_correctness_score": 9,
    "explanation_validity_score": 9,
    "question_clarity_score": 6,
    "question_difficulty_score": 7,
    "question_groundedness_score": 4,
    "avg_answer_token_count": 17
  },
  {
    "context": "<P> The 2018 UEFA Champions League Final was the final match of the 2017 -- 18 UEFA Champions League , the 63rd season of Europe 's premier club football tournament organised by UEFA , and the 26th season since it was renamed from the European Cup to the UEFA Champions League . It was played at the NSC Olimpiyskiy Stadium in Kiev , Ukraine on 26 May 2018 , between Spanish side and defending champions Real Madrid , who had won the competition in each of the last two seasons , and English side Liverpool . </P>",
    "topic": "An analysis of Liverpool's performance in the 2018 UEFA Champions League Final and the factors that contributed to the outcome.",
    "response": "<document_analysis>\nTo generate a highly insightful and probing question-answer pair, we must first carefully analyze the provided context. The context discusses the 2018 UEFA Champions League Final, specifically the match between Real Madrid and Liverpool. It mentions the location (NSC Olimpiyskiy Stadium in Kiev, Ukraine) and the date (26 May 2018) of the match, as well as the fact that Real Madrid was the defending champion, having won the competition in each of the last two seasons.\n\nGiven this information, we need to identify central ideas, nuanced themes, and significant relationships within the context. One key aspect is the performance of Liverpool in the final and the factors that contributed to the outcome. However, the provided context does not delve into the specifics of Liverpool's performance or the factors influencing the match's outcome. It primarily sets the stage for the final, providing background information on the teams involved and the tournament's context.\n\nDespite the lack of detailed analysis of Liverpool's performance within the given context, we can still explore concepts related to the Champions League Final, team performance, and factors that might influence match outcomes in such high-stakes games. This could include strategies, player injuries, team dynamics, or even external factors like crowd support and weather conditions.\n\nTo calibrate the complexity of our question, we aim for a difficulty level that would challenge even the most knowledgeable domain experts. This means avoiding straightforward or factual questions that could be easily answered by recalling basic information about the match.\n\nFor intentional question planning, we need to craft a question that invites deeper understanding, meaningful reflection, or critical engagement with the subject matter. Given the context's limitations, we might need to infer or extrapolate based on general knowledge of football strategy, team performance factors, and the dynamics of high-pressure matches like the Champions League Final.\n\nConsidering the decision criteria for question generation, the provided context does contain meaningful and coherent content related to the 2018 UEFA Champions League Final. However, it lacks specific details about Liverpool's performance and the factors contributing to the match's outcome. Despite this, we can still generate a question that requires domain expertise and challenges the respondent to think critically about team performance in high-stakes football matches.\n</document_analysis>\n\n<output_format>\nQuestion: What critical factor, often overlooked in post-match analyses, can significantly influence a team's psychological preparedness and, consequently, their performance in a high-pressure final like the Champions League?\nA: Team cohesion and chemistry\nB: Pre-match media coverage and public expectations\nC: Weather conditions and pitch quality\nD: Tactical adjustments and player injuries\n\nExplanation: The correct answer, pre-match media coverage and public expectations, can profoundly affect a team's mental state and readiness for a major final. This factor is often subtle yet can significantly impact performance by altering player confidence, team morale, and overall psychological resilience.\n\nCorrect Answer: B\n</output_format>",
    "question": "What critical factor, often overlooked in post-match analyses, can significantly influence a team's psychological preparedness and, consequently, their performance in a high-pressure final like the Champions League?",
    "choices": {
      "A": "Team cohesion and chemistry",
      "B": "Pre-match media coverage and public expectations",
      "C": "Weather conditions and pitch quality",
      "D": "Tactical adjustments and player injuries"
    },
    "answer": "B",
    "explanation": "The correct answer, pre-match media coverage and public expectations, can profoundly affect a team's mental state and readiness for a major final. This factor is often subtle yet can significantly impact performance by altering player confidence, team morale, and overall psychological resilience.",
    "question_token_count": 36,
    "answer_correctness_score": 8,
    "explanation_validity_score": 9,
    "question_clarity_score": 5,
    "question_difficulty_score": 7,
    "question_groundedness_score": 1,
    "avg_answer_token_count": 6
  },
  {
    "context": "<P> England did not enter the competition until 1950 , but have entered all eighteen subsequent tournaments . They have failed to qualify for the finals on three occasions , 1974 ( West Germany ) , 1978 ( Argentina ) and 1994 ( United States ) , and have failed to advance from the group stages on three occasions ; at the 1950 FIFA World Cup , the 1958 FIFA World Cup and the 2014 FIFA World Cup . Their best ever performance is winning the Cup in the 1966 tournament held in England , whilst they also finished in fourth place in 1990 , in Italy , and in 2018 in Russia . Other than that , the team have reached the quarter - finals on nine occasions , the latest of which were at the 2002 ( South Korea / Japan ) and the 2006 ( Germany ) . </P>",
    "topic": "A discussion of the challenges England faces in the FIFA World Cup, including their qualification process and group stage performances.",
    "response": "<document_analysis>\nTo generate a highly insightful and probing question-answer pair, a thorough analysis of the provided context is necessary. The context discusses England's participation in the FIFA World Cup, including their qualification process and group stage performances. The key points highlighted include England's first entry into the competition in 1950, their failures to qualify for the finals on three occasions, and their best performance of winning the Cup in 1966.\n\nUpon examining the context, it becomes clear that the information provided is rich in historical data about England's participation in the FIFA World Cup. The thoughtful content examination reveals central ideas such as England's entry into the World Cup, their qualification failures, group stage performances, and notable achievements like winning the tournament in 1966.\n\nConcept exploration involves considering implicit assumptions and subtle details within the provided information. For instance, the fact that England has failed to advance from the group stages on three occasions implies challenges in their group stage performances. Additionally, their best performance of winning the Cup in 1966, hosted in England, may suggest an advantage of playing on home soil.\n\nStrategic complexity calibration is crucial to ensure the question is highly challenging. Given the detailed historical information, a question that requires synthesis of this data to predict future performance or understand the implications of past performances would be appropriately complex. A difficulty rating of 8 out of 10 is assigned due to the need for deep understanding and analysis of England's historical World Cup data.\n\nIntentional question planning involves crafting a question that invites deeper understanding and critical engagement. A question that asks about the potential factors influencing England's performance in the World Cup, considering both their successes and failures, would encourage meaningful reflection and analysis.\n</document_analysis>\n\n<output_format>\nQuestion: What factor is most likely to influence England's advancement beyond the group stage in future FIFA World Cups, given their historical performance trends?\nA: Hosting the tournament\nB: Qualification group draw\nC: Team cohesion and strategy\nD: Home support advantage in early rounds\n\nExplanation: The correct answer, \"Team cohesion and strategy,\" is inferred from the understanding that while hosting the tournament (as in 1966) and home support can be advantageous, these factors alone do not guarantee success. England's ability to advance beyond the group stages is more directly influenced by their team's cohesion and strategic approach to the games, considering their past failures and successes.\n\nCorrect Answer: C\n</output_format>",
    "question": "What factor is most likely to influence England's advancement beyond the group stage in future FIFA World Cups, given their historical performance trends?",
    "choices": {
      "A": "Hosting the tournament",
      "B": "Qualification group draw",
      "C": "Team cohesion and strategy",
      "D": "Home support advantage in early rounds"
    },
    "answer": "C",
    "explanation": "The correct answer, \"Team cohesion and strategy,\" is inferred from the understanding that while hosting the tournament (as in 1966) and home support can be advantageous, these factors alone do not guarantee success. England's ability to advance beyond the group stages is more directly influenced by their team's cohesion and strategic approach to the games, considering their past failures and successes.",
    "question_token_count": 27,
    "answer_correctness_score": 10,
    "explanation_validity_score": 10,
    "question_clarity_score": 2,
    "question_difficulty_score": 7,
    "question_groundedness_score": 4,
    "avg_answer_token_count": 5
  },
  {
    "context": "<P> The history of the Great Wall of China began when fortifications built by various states during the Spring and Autumn ( 771 -- 476 BC ) and Warring States periods ( 475 -- 221 BC ) were connected by the first emperor of China , Qin Shi Huang , to protect his newly founded Qin dynasty ( 221 -- 206 BC ) against incursions by nomads from Inner Asia . The walls were built of rammed earth , constructed using forced labour , and by 212 BC ran from Gansu to the coast of southern Manchuria . </P>",
    "topic": "The impact of the Great Wall of China on the Qin dynasty's relations with neighboring nomadic groups and its effectiveness in preventing incursions.",
    "response": "<document_analysis>\nThe provided context discusses the historical background of the Great Wall of China, specifically its construction during the Qin dynasty (221-206 BC) under the rule of Qin Shi Huang. The primary purpose of the wall was to protect the Qin dynasty from incursions by nomadic groups from Inner Asia. The context also mentions the materials used for the wall's construction, which included rammed earth, and notes that forced labor was utilized in its building. By 212 BC, the wall had been extended from Gansu to the coast of southern Manchuria. \n\nGiven this information, the key aspects to consider for generating a question are the historical context, the geopolitical motivations behind the wall's construction, and its effectiveness in achieving its intended purpose. A challenging question would require the synthesis of these elements to assess the impact of the Great Wall on the Qin dynasty's relations with neighboring nomadic groups and its success in preventing incursions.\n\nThe difficulty level of the question should be high (8-10), as it needs to challenge even the smartest domain experts. The question should be thought-provoking, encouraging deep engagement with the subject matter and requiring a nuanced understanding of the historical context and geopolitical dynamics involved.\n\nIn terms of question type, an analytical or application-based question could be appropriate, as it would require the expert to analyze the historical context and apply their knowledge to understand the implications of the Great Wall's construction on the Qin dynasty's relations with neighboring groups.\n\n</document_analysis>\n\n<output_format>\nQuestion: What was the primary geopolitical consequence of the Great Wall of China's construction during the Qin dynasty on its relations with neighboring nomadic groups?\nA: It led to a significant reduction in trade and cultural exchange.\nB: It resulted in the formation of alliances between the Qin dynasty and nomadic tribes.\nC: It effectively prevented large-scale incursions but did not halt smaller-scale raids.\nD: It had no discernible impact on the geopolitical dynamics of the region.\n\nExplanation: The construction of the Great Wall of China during the Qin dynasty was primarily aimed at protecting the dynasty from incursions by nomads from Inner Asia. While the wall was effective in preventing large-scale incursions, historical records suggest that smaller-scale raids and breaches still occurred. The wall's construction reflects a complex geopolitical strategy aimed at securing the Qin dynasty's borders but does not necessarily indicate a complete halt to all interactions, including smaller-scale raids.\n\nCorrect Answer: C\n</output_format>",
    "question": "What was the primary geopolitical consequence of the Great Wall of China's construction during the Qin dynasty on its relations with neighboring nomadic groups?",
    "choices": {
      "A": "It led to a significant reduction in trade and cultural exchange.",
      "B": "It resulted in the formation of alliances between the Qin dynasty and nomadic tribes.",
      "C": "It effectively prevented large-scale incursions but did not halt smaller-scale raids.",
      "D": "It had no discernible impact on the geopolitical dynamics of the region."
    },
    "answer": "C",
    "explanation": "The construction of the Great Wall of China during the Qin dynasty was primarily aimed at protecting the dynasty from incursions by nomads from Inner Asia. While the wall was effective in preventing large-scale incursions, historical records suggest that smaller-scale raids and breaches still occurred. The wall's construction reflects a complex geopolitical strategy aimed at securing the Qin dynasty's borders but does not necessarily indicate a complete halt to all interactions, including smaller-scale raids.",
    "question_token_count": 27,
    "answer_correctness_score": 10,
    "explanation_validity_score": 10,
    "question_clarity_score": 6,
    "question_difficulty_score": 8,
    "question_groundedness_score": 4,
    "avg_answer_token_count": 15
  },
  {
    "context": "<Table> <Tr> <Th colspan=\"2\"> Philadelphia Eagles </Th> </Tr> <Tr> <Td colspan=\"2\"> Current season </Td> </Tr> <Tr> <Td colspan=\"2\"> Established July 8 , 1933 ; 84 years ago ( July 8 , 1933 ) First season : 1933 Play in Lincoln Financial Field Philadelphia , Pennsylvania Headquartered in the NovaCare Complex Philadelphia , Pennsylvania </Td> </Tr> <Tr> <Th colspan=\"2\"> </Th> </Tr> <Tr> <Td colspan=\"2\"> <Table> <Tr> <Td> </Td> <Td> </Td> </Tr> <Tr> <Td> Logo </Td> <Td> Wordmark </Td> </Tr> </Table> </Td> </Tr> <Tr> <Th colspan=\"2\"> League / conference affiliations </Th> </Tr> <Tr> <Td colspan=\"2\"> <P> National Football League ( 1933 -- present ) </P> <Ul> <Li> Eastern Division ( 1933 -- 1949 ) </Li> <Li> American Conference ( 1950 -- 1952 ) </Li> <Li> Eastern Conference ( 1953 -- 1969 ) <Ul> <Li> Capitol Division ( 1967 -- 1969 ) </Li> </Ul> </Li> <Li> National Football Conference ( 1970 -- present ) <Ul> <Li> NFC East ( 1970 -- present ) </Li> </Ul> </Li> </Ul> </Td> </Tr> <Tr> <Td colspan=\"2\"> Current uniform </Td> </Tr> <Tr> <Td colspan=\"2\"> </Td> </Tr> <Tr> <Th> Team colors </Th> <Td> <P> Midnight green , Silver , Black , White </P> </Td> </Tr> <Tr> <Th> Fight song </Th> <Td> Fly , Eagles Fly </Td> </Tr> <Tr> <Th> Mascot </Th> <Td> Swoop </Td> </Tr> <Tr> <Th colspan=\"2\"> Personnel </Th> </Tr> <Tr> <Th> Owner ( s ) </Th> <Td> Jeffrey Lurie Christina Weiss Lurie </Td> </Tr> <Tr> <Th> Chairman </Th> <Td> Jeffrey Lurie </Td> </Tr> <Tr> <Th> CEO </Th> <Td> Jeffrey Lurie </Td> </Tr> <Tr> <Th> President </Th> <Td> Don Smolenski </Td> </Tr> <Tr> <Th> General manager </Th> <Td> Howie Roseman </Td> </Tr> <Tr> <Th> Head coach </Th> <Td> Doug Pederson </Td> </Tr> <Tr> <Th colspan=\"2\"> Team history </Th> </Tr> <Tr> <Td colspan=\"2\"> <Ul> <Li> Philadelphia Eagles ( 1933 -- 1942 ; 1944 -- present ) </Li> <Li> Phil - Pitt `` Steagles '' ( 1943 ) </Li> </Ul> </Td> </Tr> <Tr> <Th colspan=\"2\"> Team nicknames </Th> </Tr> <Tr> <Td colspan=\"2\"> <Ul> <Li> The Birds </Li> </Ul> </Td> </Tr> <Tr> <Th colspan=\"2\"> Championships </Th> </Tr> <Tr> <Td colspan=\"2\"> <P> League championships ( 4 ) </P> <Ul> <Li> NFL championships ( pre-1970 AFL -- NFL merger ) ( 3 ) 1948 , 1949 , 1960 </Li> </Ul> <Ul> <Li> Super Bowl championships ( 1 ) 2017 ( LII ) </Li> </Ul> </Td> </Tr> <Tr> <Td colspan=\"2\"> <P> Conference championships ( 4 ) </P> <Ul> <Li> NFL Eastern : 1960 </Li> <Li> NFC : 1980 , 2004 , 2017 </Li> </Ul> </Td> </Tr> <Tr> <Td colspan=\"2\"> <P> Division championships ( 13 ) </P> <Ul> <Li> NFL East : 1947 , 1948 , 1949 </Li> <Li> NFC East : 1980 , 1988 , 2001 , 2002 , 2003 , 2004 , 2006 , 2010 , 2013 , 2017 </Li> </Ul> </Td> </Tr> <Tr> <Th colspan=\"2\"> Playoff appearances ( 25 ) </Th> </Tr> <Tr> <Td colspan=\"2\"> <Ul> <Li> NFL : 1947 , 1948 , 1949 , 1960 , 1978 , 1979 , 1980 , 1981 , 1988 , 1989 , 1990 , 1992 , 1995 , 1996 , 2000 , 2001 , 2002 , 2003 , 2004 , 2006 , 2008 , 2009 , 2010 , 2013 , 2017 </Li> </Ul> </Td> </Tr> <Tr> <Th colspan=\"2\"> Home fields </Th> </Tr> <Tr> <Td colspan=\"2\"> <Ul> <Li> Baker Bowl ( 1933 -- 1935 ) </Li> <Li> Philadelphia Municipal Stadium ( 1936 -- 1939 , 1941 ) </Li> <Li> Connie Mack Stadium ( 1940 , 1942 -- 1957 ) </Li> <Li> Franklin Field ( 1958 -- 1970 ) </Li> <Li> Veterans Stadium ( 1971 -- 2002 ) </Li> <Li> Lincoln Financial Field ( 2003 -- present ) </Li> </Ul> </Td> </Tr> </Table>",
    "topic": "The challenges and opportunities facing the Philadelphia Eagles in the current NFL landscape, including their competition in the NFC East division and their prospects for future success.",
    "response": "<document_analysis>\nTo generate a highly insightful and probing question-answer pair, I will conduct a thorough analysis of the provided context. The context appears to be a table containing information about the Philadelphia Eagles, a professional American football team. The table includes details about the team's history, championships, division titles, playoff appearances, and home fields.\n\nUpon examining the content, I notice that the team has a rich history, with four league championships, including one Super Bowl championship in 2017. They have also won 13 division championships and have made 25 playoff appearances. The team has played in several home fields, including Baker Bowl, Philadelphia Municipal Stadium, Connie Mack Stadium, Franklin Field, Veterans Stadium, and their current home, Lincoln Financial Field.\n\nTo create a challenging question, I will focus on the team's performance and strategy. Considering the team's history and recent success, I will explore the factors that contribute to their competitiveness in the NFC East division.\n\nThoughtful content examination and concept exploration suggest that the team's ability to adapt to changes in the NFL landscape, including rule changes, player injuries, and coaching staff adjustments, will be crucial to their future success. Strategic complexity calibration indicates that a question with a difficulty rating of 8 out of 10 would be appropriate, as it would require a deep understanding of the team's dynamics and the NFL's competitive environment.\n\nIntentional question planning leads me to consider a question that invites deeper understanding, meaningful reflection, or critical engagement. A possible question could be: What is the primary factor that has contributed to the Philadelphia Eagles' success in the NFC East division, and how can they sustain this competitive edge in the face of increasing competition from other teams in the division?\n</document_analysis>\n\n<output_format>\nQuestion: What is the primary factor that has contributed to the Philadelphia Eagles' success in the NFC East division, and how can they sustain this competitive edge in the face of increasing competition from other teams in the division?\nA: Consistent quarterback play and strong team defense\nB: Effective coaching staff and player personnel decisions\nC: Dominant running game and special teams units\nD: Strategic scheduling and home-field advantage\nExplanation: The correct answer, B: Effective coaching staff and player personnel decisions, is supported by the team's recent success under the leadership of head coach Doug Pederson and general manager Howie Roseman. Their ability to make informed personnel decisions and adjust the team's strategy has been crucial to the Eagles' competitiveness in the NFC East division.\nCorrect Answer: B\n</output_format>",
    "question": "What is the primary factor that has contributed to the Philadelphia Eagles' success in the NFC East division, and how can they sustain this competitive edge in the face of increasing competition from other teams in the division?",
    "choices": {
      "A": "Consistent quarterback play and strong team defense",
      "B": "Effective coaching staff and player personnel decisions",
      "C": "Dominant running game and special teams units",
      "D": "Strategic scheduling and home-field advantage"
    },
    "answer": "B",
    "explanation": "The correct answer, B: Effective coaching staff and player personnel decisions, is supported by the team's recent success under the leadership of head coach Doug Pederson and general manager Howie Roseman. Their ability to make informed personnel decisions and adjust the team's strategy has been crucial to the Eagles' competitiveness in the NFC East division.",
    "question_token_count": 42,
    "answer_correctness_score": 8,
    "explanation_validity_score": 9,
    "question_clarity_score": 6,
    "question_difficulty_score": 8,
    "question_groundedness_score": 2,
    "avg_answer_token_count": 8
  },
  {
    "context": "<P> `` I Can Only Imagine '' ( sometimes shortened to `` Imagine '' ) is a single recorded by Christian rock band MercyMe . Written and composed by lead vocalist Bart Millard , the song , based around a main piano track , was inspired by the death of Millard 's father and considers what it would be like in Heaven and to be standing before God . The song was first issued as a track on MercyMe 's 1999 album The Worship Project , which was released on an independent record label . The song was re-recorded and included on their 2001 major - label debut album Almost There as the fifth song on the album . </P>",
    "topic": "The significance of the song \"I Can Only Imagine\" in the context of Christian rock music and its impact on the genre.",
    "response": "<document_analysis>\nTo generate a highly insightful and probing question-answer pair, I will conduct a careful analysis of the provided context. The central idea of the context is the song \"I Can Only Imagine\" by the Christian rock band MercyMe, its inspiration, and its impact on the genre. \n\nThe context provides information about the song's writer and composer, Bart Millard, and how it was inspired by the death of his father. It also mentions the song's initial release on an independent record label in 1999 and its re-recording for the major-label debut album Almost There in 2001.\n\nUpon examining the context, I have identified the key elements that can be used to create a challenging question. The question should encourage a deep engagement with the content, critically reflect on implications, and clearly demonstrate understanding and competency.\n\nThe thought process behind generating the question involves considering the song's significance in the context of Christian rock music and its impact on the genre. The question should be designed to test the domain expert's knowledge of the song's influence, its lyrical themes, and its contribution to the Christian rock genre.\n\nTo ensure the question is highly challenging, I will aim to create a question that requires the synthesis of high-level general understanding above and beyond the specific context. The question should be self-contained, clear, and concise, with sufficient context to be understandable independently of external references.\n\nAfter careful consideration, I have decided to generate a question that focuses on the song's impact on the Christian rock genre and its lasting influence.\n</document_analysis>\n\n<output_format>\nQuestion: What pivotal event in the life of MercyMe's lead vocalist inspired the creation of \"I Can Only Imagine\", and how did this event shape the song's thematic focus?\nA: The birth of his child and the exploration of paternal love\nB: The death of his father and the contemplation of heaven\nC: A near-death experience and the appreciation of life\nD: A major career setback and the struggle with faith\n\nExplanation: The correct answer is based on the information provided in the context, which states that the song was inspired by the death of Bart Millard's father and considers what it would be like in Heaven and to be standing before God.\n\nCorrect Answer: B\n</output_format>",
    "question": "What pivotal event in the life of MercyMe's lead vocalist inspired the creation of \"I Can Only Imagine\", and how did this event shape the song's thematic focus?",
    "choices": {
      "A": "The birth of his child and the exploration of paternal love",
      "B": "The death of his father and the contemplation of heaven",
      "C": "A near-death experience and the appreciation of life",
      "D": "A major career setback and the struggle with faith"
    },
    "answer": "B",
    "explanation": "The correct answer is based on the information provided in the context, which states that the song was inspired by the death of Bart Millard's father and considers what it would be like in Heaven and to be standing before God.",
    "question_token_count": 36,
    "answer_correctness_score": 10,
    "explanation_validity_score": 10,
    "question_clarity_score": 8,
    "question_difficulty_score": 6,
    "question_groundedness_score": 10,
    "avg_answer_token_count": 11
  },
  {
    "context": "<P> The 2018 FIFA World Cup was the 21st FIFA World Cup , an international football tournament contested by the men 's national teams of the member associations of FIFA once every four years . It took place in Russia from 14 June to 15 July 2018 . It was the first World Cup to be held in Eastern Europe , and the 11th time that it had been held in Europe . At an estimated cost of over $14.2 billion , it was the most expensive World Cup . It was also the first World Cup to use the video assistant referee ( VAR ) system . </P>",
    "topic": "The significance of the 2018 FIFA World Cup being the first to be held in Eastern Europe and its implications for international football.",
    "response": "<document_analysis>\nThe provided context discusses the 2018 FIFA World Cup, highlighting its significance as the first to be held in Eastern Europe and noting its various features, such as the use of the video assistant referee (VAR) system and its high cost. To generate a question that inspires thoughtful engagement and deep understanding, we need to consider the implications of hosting the World Cup in Eastern Europe for the first time and how it might impact international football.\n\nGiven the information, a potential line of inquiry could involve the geopolitical and socio-cultural implications of hosting a major international sporting event in a region that had not previously been associated with such events. This could include considerations of how the event might influence regional development, international relations, and the global perception of the host country and region.\n\nHowever, to create a question that is both challenging and requires a deep understanding of the subject matter, we should focus on aspects that are not immediately apparent from the provided context but are nonetheless closely related to the topic. This might involve exploring the potential long-term effects of the event on football infrastructure, fan culture, and the competitive balance within international football.\n\nUpon careful consideration, a question that stands out as particularly insightful and challenging would be one that requires the test-taker to think critically about the broader implications of the 2018 FIFA World Cup being held in Eastern Europe, beyond the immediate facts provided in the context.\n</document_analysis>\n\n<output_format>\nQuestion: What potential impact could the 2018 FIFA World Cup, as the first held in Eastern Europe, have on the future distribution of FIFA World Cup hosting rights among different continents?\nA: It would lead to a rotation system favoring European hosts.\nB: It could pave the way for more World Cups to be held in Eastern Europe and Asia.\nC: It would result in a stricter rotation policy to ensure equitable distribution.\nD: It would have no significant impact on the distribution of hosting rights.\n\nExplanation: The correct answer requires an understanding of FIFA's policies and the geopolitical implications of hosting a World Cup. Given that the 2018 World Cup was the first in Eastern Europe, it might set a precedent for considering underrepresented regions in future bids, potentially influencing the distribution of hosting rights.\n\nCorrect Answer: B\n</output_format>",
    "question": "What potential impact could the 2018 FIFA World Cup, as the first held in Eastern Europe, have on the future distribution of FIFA World Cup hosting rights among different continents?",
    "choices": {
      "A": "It would lead to a rotation system favoring European hosts.",
      "B": "It could pave the way for more World Cups to be held in Eastern Europe and Asia.",
      "C": "It would result in a stricter rotation policy to ensure equitable distribution.",
      "D": "It would have no significant impact on the distribution of hosting rights."
    },
    "answer": "B",
    "explanation": "The correct answer requires an understanding of FIFA's policies and the geopolitical implications of hosting a World Cup. Given that the 2018 World Cup was the first in Eastern Europe, it might set a precedent for considering underrepresented regions in future bids, potentially influencing the distribution of hosting rights.",
    "question_token_count": 36,
    "answer_correctness_score": 8,
    "explanation_validity_score": 8,
    "question_clarity_score": 6,
    "question_difficulty_score": 8,
    "question_groundedness_score": 2,
    "avg_answer_token_count": 15
  },
  {
    "context": "<P> Human fertilization is the union of a human egg and sperm , usually occurring in the ampulla of the fallopian tube . The result of this union is the production of a zygote cell , or fertilized egg , initiating prenatal development . Scientists discovered the dynamics of human fertilization in the nineteenth century . </P>",
    "topic": "The significance of the zygote cell in initiating prenatal development and its implications for human embryology.",
    "response": "<document_analysis>\nThe provided context discusses the process of human fertilization, specifically the union of a human egg and sperm in the ampulla of the fallopian tube, resulting in the production of a zygote cell. This zygote cell is crucial as it initiates prenatal development. The context also mentions the historical discovery of the dynamics of human fertilization in the nineteenth century. \n\nUpon careful analysis, it's clear that the central idea revolves around the significance of the zygote cell in human embryology. The context implies that understanding the zygote's role is fundamental to grasping the initial stages of human development. \n\nTo generate a question that inspires thoughtful engagement and reflection, we should consider the implications of the zygote cell's formation on human embryology. This involves exploring the conceptual underpinnings of prenatal development and the zygote's role within it.\n\nGiven the context's focus on the initiation of prenatal development, a meaningful question would delve into the zygote's significance in this process, potentially exploring its implications for our understanding of human embryology. \n\nThe difficulty level of such a question should be high (8-10), as it requires not only an understanding of the zygote's role but also an ability to reflect on its broader implications for human development.\n\nA potential question could explore the zygote's function in initiating prenatal development, considering the broader context of human embryology. This would require the respondent to demonstrate a deep understanding of the subject matter and its underlying principles.\n</document_analysis>\n\n<output_format>\nQuestion: What pivotal event occurs immediately after the formation of the zygote that sets the stage for subsequent prenatal development stages?\nA: Implantation of the zygote in the uterine lining\nB: Initiation of gastrulation\nC: Completion of meiosis\nD: Activation of embryonic gene expression\n\nExplanation: The correct answer, activation of embryonic gene expression, is the pivotal event that occurs immediately after zygote formation, marking the beginning of prenatal development. This event is crucial as it transitions the zygote from a genetically dormant state to an actively dividing and differentiating cell, setting the stage for all subsequent developmental stages.\n\nCorrect Answer: D\n</output_format>",
    "question": "What pivotal event occurs immediately after the formation of the zygote that sets the stage for subsequent prenatal development stages?",
    "choices": {
      "A": "Implantation of the zygote in the uterine lining",
      "B": "Initiation of gastrulation",
      "C": "Completion of meiosis",
      "D": "Activation of embryonic gene expression"
    },
    "answer": "D",
    "explanation": "The correct answer, activation of embryonic gene expression, is the pivotal event that occurs immediately after zygote formation, marking the beginning of prenatal development. This event is crucial as it transitions the zygote from a genetically dormant state to an actively dividing and differentiating cell, setting the stage for all subsequent developmental stages.",
    "question_token_count": 24,
    "answer_correctness_score": 6,
    "explanation_validity_score": 8,
    "question_clarity_score": 4,
    "question_difficulty_score": 6,
    "question_groundedness_score": 4,
    "avg_answer_token_count": 7
  },
  {
    "context": "<P> Human fertilization is the union of a human egg and sperm , usually occurring in the ampulla of the fallopian tube . The result of this union is the production of a zygote cell , or fertilized egg , initiating prenatal development . Scientists discovered the dynamics of human fertilization in the nineteenth century . </P>",
    "topic": "The relationship between human fertilization and the broader context of reproductive biology and developmental physiology.",
    "response": "<document_analysis>\nThe provided context discusses human fertilization, its location, and the outcome of this process. It mentions the union of a human egg and sperm, typically occurring in the ampulla of the fallopian tube, resulting in the production of a zygote cell. This context is rich in specific details about the biological process of fertilization but lacks a broader discussion on the implications, mechanisms, or comparisons with other species. \n\nTo generate a question that inspires thoughtful engagement and requires a deep understanding of the content, we need to consider the underlying biological principles, the significance of the location of fertilization, and the initial stages of prenatal development. \n\nGiven the information, a potential question could explore the significance of the ampulla of the fallopian tube as the usual site for human fertilization, considering factors such as the environment, the timing of sperm and egg meeting, and the initial development of the zygote. \n\nHowever, to make the question highly challenging and to require a nuanced understanding, we should aim to integrate knowledge of reproductive biology and developmental physiology, potentially touching on aspects like the role of the fallopian tube in supporting early development or the specific conditions required for successful fertilization and initial zygote development.\n\nThoughtful consideration suggests that a question focusing on the relationship between the site of fertilization and the subsequent developmental processes could be highly insightful. This would require the domain expert to reflect on the broader context of reproductive biology and the initial stages of developmental physiology, making connections between the anatomy of the reproductive system, the process of fertilization, and the early development of the embryo.\n\nThe difficulty level of such a question would be high (8-9 out of 10), as it demands not only a detailed knowledge of human fertilization but also an understanding of how this process fits into the larger framework of reproductive and developmental biology. \n\nThe question should be designed to be self-contained, with the answer being derivable through expert knowledge without necessitating a reference to the provided context. Ensuring that all answer options are plausible and that at least one incorrect option is subtly wrong will add to the challenge, requiring careful consideration from the domain expert.\n</document_analysis>\n\n<output_format>\nQuestion: What specific advantage does the ampulla of the fallopian tube provide for the fertilization process and subsequent zygote development that is crucial for successful prenatal development?\nA: It offers a site with minimal immune response to the sperm.\nB: It provides an environment rich in nutrients and optimal pH for sperm capacitation and zygote development.\nC: It is the location closest to the ovary, ensuring the freshest possible egg for fertilization.\nD: It allows for the greatest exposure to hormonal influences from the uterus.\n\nExplanation: The ampulla of the fallopian tube is the usual site for fertilization due to its optimal environment for sperm capacitation and zygote development, including the right balance of nutrients and pH. This environment supports the initial development of the zygote before it travels to the uterus for implantation.\n\nCorrect Answer: B\n</output_format>",
    "question": "What specific advantage does the ampulla of the fallopian tube provide for the fertilization process and subsequent zygote development that is crucial for successful prenatal development?",
    "choices": {
      "A": "It offers a site with minimal immune response to the sperm.",
      "B": "It provides an environment rich in nutrients and optimal pH for sperm capacitation and zygote development.",
      "C": "It is the location closest to the ovary, ensuring the freshest possible egg for fertilization.",
      "D": "It allows for the greatest exposure to hormonal influences from the uterus."
    },
    "answer": "B",
    "explanation": "The ampulla of the fallopian tube is the usual site for fertilization due to its optimal environment for sperm capacitation and zygote development, including the right balance of nutrients and pH. This environment supports the initial development of the zygote before it travels to the uterus for implantation.",
    "question_token_count": 32,
    "answer_correctness_score": 10,
    "explanation_validity_score": 10,
    "question_clarity_score": 5,
    "question_difficulty_score": 7,
    "question_groundedness_score": 4,
    "avg_answer_token_count": 17
  },
  {
    "context": "<P> The 21 World Cup tournaments have been won by eight national teams . Brazil have won five times , and they are the only team to have played in every tournament . The other World Cup winners are Germany and Italy , with four titles each ; Argentina , France and inaugural winner Uruguay , with two titles each ; and England and Spain with one title each . </P>",
    "topic": "The historical context and significance of Brazil being the only team to have played in every World Cup tournament, and its implications on their five-title win.",
    "response": "<document_analysis>\nTo generate a highly insightful and probing question-answer pair, a thorough analysis of the provided context is necessary. The context discusses the historical context and significance of the FIFA World Cup, highlighting Brazil's unique achievement of being the only team to have played in every tournament. It also mentions the number of titles won by various national teams. \n\nGiven the information, a thoughtful examination reveals that the central idea is Brazil's consistent participation and success in the World Cup. Concept exploration suggests that implicit assumptions about Brazil's football culture, team dynamics, and strategic approaches might underlie their ability to participate and win consistently. \n\nStrategic complexity calibration suggests that a question rating an 8 out of 10 in terms of difficulty would be appropriate, as it should challenge even the smartest domain experts. Intentional question planning indicates that the question should invite deeper understanding and critical engagement with the content, possibly exploring the implications of Brazil's consistent participation on their title wins.\n\nDecision criteria for question generation confirm that the provided context contains meaningful and coherent content, making it suitable for generating a question. The context does not include irrelevant or bogus information, allowing for focused analysis.\n\nThe thought process behind generating the question involves considering how Brazil's unique record of participation might influence their performance and title wins. This leads to a question that encourages reflection on the relationship between consistent participation and success in the World Cup.\n</document_analysis>\n\n<output_format>\nQuestion: What factor might most significantly contribute to Brazil's ability to win five World Cup titles, given their status as the only team to have played in every tournament?\nA: Consistent team roster changes\nB: Strategic adaptations to evolving football trends\nC: Home-field advantage in multiple tournaments\nD: Continuous government support and funding\nExplanation: The correct answer, \"Strategic adaptations to evolving football trends,\" suggests that Brazil's ability to adapt and evolve their strategies over time, alongside their consistent participation, might be a crucial factor in their success. This requires a deep understanding of how teams can leverage experience and adaptability to achieve repeated success in a competitive and changing environment.\nCorrect Answer: B\n</output_format>",
    "question": "What factor might most significantly contribute to Brazil's ability to win five World Cup titles, given their status as the only team to have played in every tournament?",
    "choices": {
      "A": "Consistent team roster changes",
      "B": "Strategic adaptations to evolving football trends",
      "C": "Home-field advantage in multiple tournaments",
      "D": "Continuous government support and funding"
    },
    "answer": "B",
    "explanation": "The correct answer, \"Strategic adaptations to evolving football trends,\" suggests that Brazil's ability to adapt and evolve their strategies over time, alongside their consistent participation, might be a crucial factor in their success. This requires a deep understanding of how teams can leverage experience and adaptability to achieve repeated success in a competitive and changing environment.",
    "question_token_count": 32,
    "answer_correctness_score": 8,
    "explanation_validity_score": 8,
    "question_clarity_score": 6,
    "question_difficulty_score": 7,
    "question_groundedness_score": 4,
    "avg_answer_token_count": 6
  },
  {
    "context": "<Table> <Tr> <Th colspan=\"2\"> Season </Th> <Th colspan=\"2\"> Episodes </Th> <Th colspan=\"2\"> Originally released </Th> </Tr> <Tr> <Th> First released </Th> <Th> Last released </Th> </Tr> <Tr> <Td> </Td> <Td colspan=\"1\"> </Td> <Td colspan=\"2\"> 10 </Td> <Td colspan=\"1\"> April 26 , 2017 ( 2017 - 04 - 26 ) </Td> <Td> June 14 , 2017 ( 2017 - 06 - 14 ) </Td> </Tr> <Tr> <Td> </Td> <Td colspan=\"1\"> </Td> <Td colspan=\"2\"> 13 </Td> <Td colspan=\"1\"> April 25 , 2018 ( 2018 - 04 - 25 ) </Td> <Td> July 11 , 2018 ( 2018 - 07 - 11 ) </Td> </Tr> </Table>",
    "topic": "The table provides information about the original release dates of the TV show, which can be used to research and analyze the show's reception and impact during its initial release.",
    "response": "<document_analysis>\nThe provided context is a table detailing the original release dates of a TV show. To generate a meaningful and challenging question, we need to analyze the structure and content of the table. The table includes information about the seasons, number of episodes, and the first and last release dates for each season. \n\nUpon examining the table, it becomes apparent that the show has at least two seasons, with the first season consisting of 10 episodes and the second season having 13 episodes. The release dates for the first season are April 26, 2017, and June 14, 2017, while the second season's release dates are April 25, 2018, and July 11, 2018.\n\nGiven this information, a potential question could focus on the pattern or trend in the release dates or the number of episodes per season. However, to create a more challenging and insightful question, we should consider the implications of these release dates and episode counts on the show's production, reception, or impact.\n\nOne possible direction is to explore how the timing and duration of each season might influence viewer engagement, critical reception, or the show's overall popularity. This could involve analyzing the time of year the seasons were released, the gap between seasons, or how the number of episodes might affect the pacing and storytelling.\n\nTo craft a question that encourages deep reflection and understanding, we should aim to create a query that requires the synthesis of this information and its potential implications, rather than simply recalling the release dates or episode counts.\n\nDifficulty rating: 8/10, as the question will require not just an understanding of the table's content but also the ability to think critically about its implications.\n\nThought process: The question should inspire the test-taker to think about the strategic decisions behind the release of the TV show, such as why the second season has more episodes and how the release timing might impact viewer loyalty and ratings.\n\n</document_analysis>\n\n<output_format>\nQuestion: What potential factor could contribute to a TV show having a longer duration between the first and last episode of a season when the number of episodes increases from 10 to 13?\nA: Increased production time per episode\nB: Unchanged production schedule with more episodes\nC: Decreased marketing efforts for longer seasons\nD: Viewer demand for more frequent episode releases\n\nExplanation: The correct answer, \"Increased production time per episode,\" suggests that with more episodes, each episode might require more production time, leading to a longer season duration. This requires considering the implications of increased episode count on production schedules and season length.\n\nCorrect Answer: A\n</output_format>",
    "question": "What potential factor could contribute to a TV show having a longer duration between the first and last episode of a season when the number of episodes increases from 10 to 13?",
    "choices": {
      "A": "Increased production time per episode",
      "B": "Unchanged production schedule with more episodes",
      "C": "Decreased marketing efforts for longer seasons",
      "D": "Viewer demand for more frequent episode releases"
    },
    "answer": "A",
    "explanation": "The correct answer, \"Increased production time per episode,\" suggests that with more episodes, each episode might require more production time, leading to a longer season duration. This requires considering the implications of increased episode count on production schedules and season length.",
    "question_token_count": 36,
    "answer_correctness_score": 9,
    "explanation_validity_score": 9,
    "question_clarity_score": 7,
    "question_difficulty_score": 6,
    "question_groundedness_score": 10,
    "avg_answer_token_count": 7
  },
  {
    "context": "<P> Article Five of the United States Constitution describes the process whereby the Constitution , the nation 's frame of government , may be altered . Altering the Constitution consists of proposing an amendment or amendments and subsequent ratification . Amendments may be proposed either by the Congress with a two - thirds vote in both the House of Representatives and the Senate or by a convention of states called for by two - thirds of the state legislatures . To become part of the Constitution , an amendment must be ratified by either -- as determined by Congress -- the legislatures of three - quarters of the states or state ratifying conventions in three - quarters of the states . The vote of each state ( to either ratify or reject a proposed amendment ) carries equal weight , regardless of a state 's population or length of time in the Union . </P>",
    "topic": "The principle of equal weight for each state's vote in the ratification process, regardless of population or length of time in the Union.",
    "response": "<document_analysis>\nThe provided context discusses the process of altering the United States Constitution as outlined in Article Five. It explains that amendments can be proposed by Congress or by a convention of states and must be ratified by either the legislatures of three-quarters of the states or state ratifying conventions in three-quarters of the states. A key point emphasized is that each state's vote in the ratification process carries equal weight, regardless of the state's population or how long it has been part of the Union. This principle is crucial as it gives smaller states an equal voice in the amendment process, balancing the representation of larger, more populous states.\n\nGiven this context, the question should delve into the implications or the rationale behind this principle of equal weighting. It's essential to craft a question that requires a deep understanding of the constitutional framework, the historical context, and the political philosophy underlying this principle.\n\nThe question should be challenging, encouraging the domain expert to reflect on the significance of equal state voting power in the ratification process, its potential consequences, or its alignment with democratic principles. It's also important to ensure that the question is self-contained and can be answered without referencing the provided context directly.\n\nThoughtfully considering the content and the need for a question that prompts nuanced understanding, a potential question could explore the rationale or the effects of this equal weighting principle. Given the importance of this principle in maintaining the balance of power among states, the question should ideally touch upon its implications for federalism, democracy, or the protection of minority rights.\n\nAfter careful consideration, a question that meets these criteria and encourages thoughtful engagement with the subject matter is formulated below.\n</document_analysis>\n\n<output_format>\nQuestion: What fundamental democratic principle is upheld by granting each state an equal vote in the constitutional amendment ratification process, regardless of its population?\nA: Principle of Federalism\nB: Principle of Popular Sovereignty\nC: Principle of Equal Representation\nD: Principle of Majority Rule\n\nExplanation: The principle of equal weight for each state's vote in the ratification process upholds the principle of federalism. Federalism is a system of government where power is divided between a central authority and constituent political units, such as states. By giving each state an equal vote, the Constitution ensures that smaller states have an equal say in the amendment process, preventing larger states from dominating. This balance is crucial for maintaining the federal system and protecting the interests of all states, regardless of size or population.\n\nCorrect Answer: A\n</output_format>",
    "question": "What fundamental democratic principle is upheld by granting each state an equal vote in the constitutional amendment ratification process, regardless of its population?",
    "choices": {
      "A": "Principle of Federalism",
      "B": "Principle of Popular Sovereignty",
      "C": "Principle of Equal Representation",
      "D": "Principle of Majority Rule"
    },
    "answer": "A",
    "explanation": "The principle of equal weight for each state's vote in the ratification process upholds the principle of federalism. Federalism is a system of government where power is divided between a central authority and constituent political units, such as states. By giving each state an equal vote, the Constitution ensures that smaller states have an equal say in the amendment process, preventing larger states from dominating. This balance is crucial for maintaining the federal system and protecting the interests of all states, regardless of size or population.",
    "question_token_count": 28,
    "answer_correctness_score": 10,
    "explanation_validity_score": 10,
    "question_clarity_score": 8,
    "question_difficulty_score": 7,
    "question_groundedness_score": 8,
    "avg_answer_token_count": 6
  },
  {
    "context": "<Table> <Tr> <Th> Year </Th> <Th> Round </Th> <Th> Position </Th> <Th> GP </Th> <Th> </Th> <Th> D * </Th> <Th> </Th> <Th> GF </Th> <Th> GA </Th> <Th> GD </Th> </Tr> <Tr> <Td> 1930 </Td> <Td colspan=\"9\"> Not a FIFA member </Td> </Tr> <Tr> <Td> 1934 </Td> </Tr> <Tr> <Td> 1938 </Td> </Tr> <Tr> <Td> 1950 </Td> <Td> Group stage </Td> <Td> 8th </Td> <Td> </Td> <Td> </Td> <Td> 0 </Td> <Td> </Td> <Td> </Td> <Td> </Td> <Td> 0 </Td> </Tr> <Tr> <Td> 1954 </Td> <Td> Quarter - finals </Td> <Td> 7th </Td> <Td> </Td> <Td> </Td> <Td> </Td> <Td> </Td> <Td> 8 </Td> <Td> 8 </Td> <Td> 0 </Td> </Tr> <Tr> <Td> 1958 </Td> <Td> Group stage </Td> <Td> 11th </Td> <Td> </Td> <Td> 0 </Td> <Td> </Td> <Td> </Td> <Td> </Td> <Td> 5 </Td> <Td> - 1 </Td> </Tr> <Tr> <Td> 1962 </Td> <Td> Quarter - finals </Td> <Td> 8th </Td> <Td> </Td> <Td> </Td> <Td> </Td> <Td> </Td> <Td> 5 </Td> <Td> 6 </Td> <Td> - 1 </Td> </Tr> <Tr> <Td> 1966 </Td> <Td> Champions </Td> <Td> 1st </Td> <Td> 6 </Td> <Td> 5 </Td> <Td> </Td> <Td> 0 </Td> <Td> 11 </Td> <Td> </Td> <Td> 8 </Td> </Tr> <Tr> <Td> 1970 </Td> <Td> Quarter - finals </Td> <Td> 8th </Td> <Td> </Td> <Td> </Td> <Td> 0 </Td> <Td> </Td> <Td> </Td> <Td> </Td> <Td> 0 </Td> </Tr> <Tr> <Td> </Td> <Td colspan=\"9\"> Did not qualify </Td> </Tr> <Tr> <Td> 1978 </Td> </Tr> <Tr> <Td> 1982 </Td> <Td> Second group stage </Td> <Td> 6th </Td> <Td> 5 </Td> <Td> </Td> <Td> </Td> <Td> 0 </Td> <Td> 6 </Td> <Td> </Td> <Td> 5 </Td> </Tr> <Tr> <Td> 1986 </Td> <Td> Quarter - finals </Td> <Td> 8th </Td> <Td> 5 </Td> <Td> </Td> <Td> </Td> <Td> </Td> <Td> 7 </Td> <Td> </Td> <Td> </Td> </Tr> <Tr> <Td> 1990 </Td> <Td> Semi finals </Td> <Td> 4th </Td> <Td> 7 </Td> <Td> </Td> <Td> </Td> <Td> </Td> <Td> 8 </Td> <Td> 6 </Td> <Td> </Td> </Tr> <Tr> <Td> 1994 </Td> <Td colspan=\"9\"> Did not qualify </Td> </Tr> <Tr> <Td> 1998 </Td> <Td> Round of 16 </Td> <Td> 9th </Td> <Td> </Td> <Td> </Td> <Td> </Td> <Td> </Td> <Td> 7 </Td> <Td> </Td> <Td> </Td> </Tr> <Tr> <Td> 2002 </Td> <Td> Quarter - finals </Td> <Td> 6th </Td> <Td> 5 </Td> <Td> </Td> <Td> </Td> <Td> </Td> <Td> 6 </Td> <Td> </Td> <Td> </Td> </Tr> <Tr> <Td> 2006 </Td> <Td> Quarter - finals </Td> <Td> 7th </Td> <Td> 5 </Td> <Td> </Td> <Td> </Td> <Td> 0 </Td> <Td> 6 </Td> <Td> </Td> <Td> </Td> </Tr> <Tr> <Td> </Td> <Td> Round of 16 </Td> <Td> 13th </Td> <Td> </Td> <Td> </Td> <Td> </Td> <Td> </Td> <Td> </Td> <Td> 5 </Td> <Td> - 2 </Td> </Tr> <Tr> <Td> 2014 </Td> <Td> Group stage </Td> <Td> 26th </Td> <Td> </Td> <Td> 0 </Td> <Td> </Td> <Td> </Td> <Td> </Td> <Td> </Td> <Td> - 2 </Td> </Tr> <Tr> <Td> 2018 </Td> <Td> Semi-finals </Td> <Td> 4th </Td> <Td> 7 </Td> <Td> </Td> <Td> </Td> <Td> </Td> <Td> 12 </Td> <Td> 8 </Td> <Td> </Td> </Tr> <Tr> <Td> 2022 </Td> <Td colspan=\"9\"> TBD </Td> </Tr> <Tr> <Td> 2026 </Td> </Tr> <Tr> <Th> Total </Th> <Th> 15 / 21 </Th> <Th> 1 title </Th> <Th> 69 </Th> <Th> 29 </Th> <Th> 21 </Th> <Th> 19 </Th> <Th> 91 </Th> <Th> 64 </Th> <Th> 27 </Th> </Tr> </Table>",
    "topic": "The team's performance in the 21st century and its implications for their future prospects in the tournament.",
    "response": "<document_analysis>\nThe provided context is a table detailing the performance of a team in the FIFA World Cup from 1930 to 2022. The table includes information such as the year, round, position, games played, wins, draws, losses, goals for, goals against, and goal difference. \n\nUpon analyzing the table, it is evident that the team has participated in 15 out of 21 World Cup tournaments, winning one title. They have played a total of 69 games, winning 29, drawing 21, and losing 19. The team has scored 91 goals and conceded 64, resulting in a goal difference of 27.\n\nThe table provides a comprehensive overview of the team's performance in the World Cup over the years. However, to generate a question that encourages deep understanding and insight, we need to look beyond the surface-level information and explore the implications of the team's performance on their future prospects in the tournament.\n\nOne possible area of exploration is the team's consistency and progression over the years. The table shows that the team has had varying degrees of success, with some years resulting in early elimination and others resulting in semifinal or final appearances. Analyzing the factors that contribute to this inconsistency could provide valuable insights into the team's strengths and weaknesses.\n\nAnother possible area of exploration is the team's performance in relation to their opponents. The table provides information on the number of goals scored and conceded, but it would be interesting to analyze the team's performance against stronger or weaker opponents. This could help identify patterns or trends that could inform the team's strategy in future tournaments.\n\nOverall, the table provides a wealth of information that can be used to generate questions that encourage deep understanding and insight into the team's performance and future prospects in the World Cup.\n</document_analysis>\n\n<output_format>\nQuestion: What is the primary factor that has contributed to the team's inconsistent performance in the World Cup over the years, considering their win-loss record and goal difference?\nA: Inadequate training facilities\nB: Inconsistent team management and coaching\nC: Lack of experienced players\nD: Inability to adapt to different playing styles and opponents\nExplanation: The correct answer, \"Inconsistent team management and coaching\", suggests that the team's inconsistent performance can be attributed to changes in leadership and coaching styles over the years. This is a plausible explanation, as different coaches and managers may have different approaches to the game, which can impact the team's performance. The other options, while potentially contributing factors, are not as directly related to the team's inconsistent performance.\nCorrect Answer: B\n</output_format>",
    "question": "What is the primary factor that has contributed to the team's inconsistent performance in the World Cup over the years, considering their win-loss record and goal difference?",
    "choices": {
      "A": "Inadequate training facilities",
      "B": "Inconsistent team management and coaching",
      "C": "Lack of experienced players",
      "D": "Inability to adapt to different playing styles and opponents"
    },
    "answer": "B",
    "explanation": "The correct answer, \"Inconsistent team management and coaching\", suggests that the team's inconsistent performance can be attributed to changes in leadership and coaching styles over the years. This is a plausible explanation, as different coaches and managers may have different approaches to the game, which can impact the team's performance. The other options, while potentially contributing factors, are not as directly related to the team's inconsistent performance.",
    "question_token_count": 31,
    "answer_correctness_score": 8,
    "explanation_validity_score": 8,
    "question_clarity_score": 4,
    "question_difficulty_score": 7,
    "question_groundedness_score": 6,
    "avg_answer_token_count": 7
  },
  {
    "context": "<P> The College Football Playoff selection committee chose the semifinalists following the conclusion of the 2017 regular season . Alabama and Georgia advanced to the national championship after winning the semifinal games hosted by the Sugar Bowl and the Rose Bowl , respectively , on January 1 , 2018 . The championship game was played at Mercedes - Benz Stadium in Atlanta , Georgia on January 8 , 2018 . </P>",
    "topic": "The comparison of the teams that participated in the 2018 College Football Playoff National Championship, focusing on their performance during the regular season and the playoff games.",
    "response": "<document_analysis>\nTo generate a highly insightful and probing question-answer pair, we need to carefully analyze the given context. The context discusses the 2018 College Football Playoff National Championship, focusing on the selection of semifinalists, the semifinal games, and the championship game. \n\nFirst, we identify the central ideas: the selection committee's choice of semifinalists, the semifinal games hosted by the Sugar Bowl and the Rose Bowl, and the championship game at Mercedes-Benz Stadium. \n\nNext, we consider implicit assumptions and subtle details. The text assumes knowledge of the College Football Playoff system and the significance of the Sugar Bowl and Rose Bowl in hosting semifinal games. A subtle detail is the specific date and location of the championship game.\n\nWe then explore underlying theories and potential applications. The context implies an understanding of how teams are selected for the playoffs and how the semifinal games determine the championship contenders. \n\nGiven this analysis, we rate the difficulty of generating a question as 8 out of 10, considering the need to delve into specifics of the College Football Playoff system and the details of the 2018 championship.\n\nOur question planning involves creating a query that invites deeper understanding and critical engagement with the content, ensuring it is purposeful and challenging for domain experts.\n</document_analysis>\n\n<output_format>\nQuestion: Which stadium hosted the 2018 College Football Playoff National Championship game between Alabama and Georgia?\nA: Rose Bowl\nB: Sugar Bowl\nC: Mercedes-Benz Stadium\nD: AT&T Stadium\nExplanation: The correct answer is Mercedes-Benz Stadium because, according to the context, the championship game was played at this location in Atlanta, Georgia, on January 8, 2018.\nCorrect Answer: C\n</output_format>",
    "question": "Which stadium hosted the 2018 College Football Playoff National Championship game between Alabama and Georgia?",
    "choices": {
      "A": "Rose Bowl",
      "B": "Sugar Bowl",
      "C": "Mercedes-Benz Stadium",
      "D": "AT&T Stadium"
    },
    "answer": "C",
    "explanation": "The correct answer is Mercedes-Benz Stadium because, according to the context, the championship game was played at this location in Atlanta, Georgia, on January 8, 2018.",
    "question_token_count": 20,
    "answer_correctness_score": 10,
    "explanation_validity_score": 10,
    "question_clarity_score": 10,
    "question_difficulty_score": 2,
    "question_groundedness_score": 10,
    "avg_answer_token_count": 3
  },
  {
    "context": "<P> England did not enter the competition until 1950 , but have entered all eighteen subsequent tournaments . They have failed to qualify for the finals on three occasions , 1974 ( West Germany ) , 1978 ( Argentina ) and 1994 ( United States ) , and have failed to advance from the group stages on three occasions ; at the 1950 FIFA World Cup , the 1958 FIFA World Cup and the 2014 FIFA World Cup . Their best ever performance is winning the Cup in the 1966 tournament held in England , whilst they also finished in fourth place in 1990 , in Italy , and in 2018 in Russia . Other than that , the team have reached the quarter - finals on nine occasions , the latest of which were at the 2002 ( South Korea / Japan ) and the 2006 ( Germany ) . </P>",
    "topic": "A comparison of England's performances in the 1990 and 2018 FIFA World Cups, including their fourth-place finishes and the teams' compositions.",
    "response": "<document_analysis>\nTo generate a highly insightful and probing question-answer pair, a thorough analysis of the provided context is necessary. The context discusses England's performance in the FIFA World Cup, including their entries, failures to qualify, and best performances. The key information includes England's fourth-place finishes in 1990 and 2018, their winning of the Cup in 1966, and their failures to advance from the group stages in certain tournaments.\n\nGiven the topic of comparing England's performances in the 1990 and 2018 FIFA World Cups, the question should delve into the specifics of these performances, considering the team compositions and the outcomes. The question should be designed to encourage a deep engagement with the content, critically reflecting on the implications of these performances and demonstrating a clear understanding of the subject matter.\n\nThe difficulty of the question should be rated high (8-10) to ensure it challenges even the smartest domain experts. The question should be thought-provoking, requiring the synthesis of high-level general understanding beyond the specific context provided.\n\nUpon analyzing the context, it's clear that the comparison between the 1990 and 2018 performances, including the teams' compositions and the significance of their fourth-place finishes, offers a rich ground for generating a challenging and insightful question.\n</document_analysis>\n\n<output_format>\nQuestion: What significant factor contributed to England's ability to achieve fourth-place finishes in both the 1990 and 2018 FIFA World Cups, despite differences in team composition and tournament context?\nA: Consistent goalkeeping performances\nB: Effective defensive strategies\nC: Strong team cohesion and adaptability\nD: Luck in the draw and favorable group stages\n\nExplanation: The correct answer, \"Strong team cohesion and adaptability,\" suggests that England's ability to adapt to different tournament contexts and maintain strong team cohesion was crucial in achieving their fourth-place finishes. This factor is implicit in the context, which highlights the team's ability to perform well in different years with potentially different team compositions.\n\nCorrect Answer: C\n</output_format>",
    "question": "What significant factor contributed to England's ability to achieve fourth-place finishes in both the 1990 and 2018 FIFA World Cups, despite differences in team composition and tournament context?",
    "choices": {
      "A": "Consistent goalkeeping performances",
      "B": "Effective defensive strategies",
      "C": "Strong team cohesion and adaptability",
      "D": "Luck in the draw and favorable group stages"
    },
    "answer": "C",
    "explanation": "The correct answer, \"Strong team cohesion and adaptability,\" suggests that England's ability to adapt to different tournament contexts and maintain strong team cohesion was crucial in achieving their fourth-place finishes. This factor is implicit in the context, which highlights the team's ability to perform well in different years with potentially different team compositions.",
    "question_token_count": 37,
    "answer_correctness_score": 7,
    "explanation_validity_score": 6,
    "question_clarity_score": 1,
    "question_difficulty_score": 8,
    "question_groundedness_score": 1,
    "avg_answer_token_count": 6
  },
  {
    "context": "<Table> <Tr> <Th colspan=\"2\"> Season </Th> <Th colspan=\"2\"> Episodes </Th> <Th colspan=\"2\"> Originally released </Th> </Tr> <Tr> <Th> First released </Th> <Th> Last released </Th> </Tr> <Tr> <Td> </Td> <Td colspan=\"1\"> </Td> <Td colspan=\"2\"> 10 </Td> <Td colspan=\"1\"> April 26 , 2017 ( 2017 - 04 - 26 ) </Td> <Td> June 14 , 2017 ( 2017 - 06 - 14 ) </Td> </Tr> <Tr> <Td> </Td> <Td colspan=\"1\"> </Td> <Td colspan=\"2\"> 13 </Td> <Td colspan=\"1\"> April 25 , 2018 ( 2018 - 04 - 25 ) </Td> <Td> July 11 , 2018 ( 2018 - 07 - 11 ) </Td> </Tr> </Table>",
    "topic": "The duration between the release of the first and last episodes of each season can be calculated to determine the length of each season, which can be used to compare the pacing and content of the seasons.",
    "response": "<document_analysis>\nTo generate a highly insightful and probing question-answer pair, we must carefully analyze the provided context. The context presents a table with information about the release dates of episodes for two seasons of a show. The table includes the first and last release dates for each season, as well as the number of episodes in each season.\n\nUpon examining the table, we notice that the first season has 10 episodes, released from April 26, 2017, to June 14, 2017. The second season has 13 episodes, released from April 25, 2018, to July 11, 2018. \n\nWe can calculate the duration between the release of the first and last episodes of each season. For the first season, the duration is approximately 49 days (from April 26 to June 14). For the second season, the duration is approximately 77 days (from April 25 to July 11).\n\nGiven this information, we can generate a question that invites deeper understanding and meaningful reflection. The question should be challenging and require critical engagement with the content.\n\nThoughtful consideration and reasoning behind the question generation involve identifying the key concepts and relationships presented in the table. The question should integrate this content naturally and stand independently without explicit references to the source material.\n\nOne potential question could be: What is the primary factor that determines the length of a season, based on the release dates of the first and last episodes?\n\nThis question requires the synthesis of high-level general understanding and encourages thoughtful engagement with the content. It is a complex question that challenges the domain expert to think critically about the information presented.\n\nTo ensure the question is answerable by a domain expert without the context paragraph, we must verify that the question is self-contained and clear. The question should not include phrases that give away the answer or make the answer obvious.\n\nThe correct answer should be present among the options, and at least one incorrect answer should be subtly wrong, making it difficult to distinguish from the correct answer. All four answer options should be distinct and plausible.\n\nAfter careful consideration, we can generate the following question-answer pair:\n</document_analysis>\n\n<output_format>\nQuestion: What is the primary factor that determines the length of a season, based on the release dates of the first and last episodes?\nA: Number of episodes\nB: Time of year\nC: Day of the week\nD: Duration between the release of the first and last episodes\nExplanation: The length of a season is determined by the duration between the release of the first and last episodes, which can be calculated using the release dates provided.\nCorrect Answer: D\n</output_format>",
    "question": "What is the primary factor that determines the length of a season, based on the release dates of the first and last episodes?",
    "choices": {
      "A": "Number of episodes",
      "B": "Time of year",
      "C": "Day of the week",
      "D": "Duration between the release of the first and last episodes"
    },
    "answer": "D",
    "explanation": "The length of a season is determined by the duration between the release of the first and last episodes, which can be calculated using the release dates provided.",
    "question_token_count": 26,
    "answer_correctness_score": 10,
    "explanation_validity_score": 10,
    "question_clarity_score": 6,
    "question_difficulty_score": 6,
    "question_groundedness_score": 8,
    "avg_answer_token_count": 6
  },
  {
    "context": "<P> The 2018 UEFA Champions League Final was the final match of the 2017 -- 18 UEFA Champions League , the 63rd season of Europe 's premier club football tournament organised by UEFA , and the 26th season since it was renamed from the European Cup to the UEFA Champions League . It was played at the NSC Olimpiyskiy Stadium in Kiev , Ukraine on 26 May 2018 , between Spanish side and defending champions Real Madrid , who had won the competition in each of the last two seasons , and English side Liverpool . </P>",
    "topic": "The strategic and tactical approaches employed by Real Madrid and Liverpool during the 2018 UEFA Champions League Final.",
    "response": "<document_analysis>\nThe provided context describes the 2018 UEFA Champions League Final, describing the participants as Real Madrid and Liverpool, and mentioning the location and date of the match. To generate a question that probes domain expert knowledge about the strategic and tactical approaches employed by these teams, we need to consider what aspects of their performance would be most relevant and challenging to discuss.\n\nGiven the information provided, it seems that the context lacks specific details about the strategic and tactical approaches used by Real Madrid and Liverpool during the match. However, we can still formulate a question that requires a deep understanding of football tactics and strategies, particularly in the context of high-stakes matches like the Champions League Final.\n\nThe question should encourage critical thinking about how teams approach such finals, considering factors like team composition, past performances, and the psychological aspect of the game. Since the context does not provide explicit details about the strategies employed, the question will need to be more general, yet still challenging and relevant to the topic.\n\nThoughtful consideration leads to the realization that the best questions will be those that require the synthesis of high-level general understanding of football tactics and strategies, beyond the specific details of the 2018 UEFA Champions League Final.\n\nGiven these considerations, the question generation process focuses on creating a query that is both thought-provoking and requires a deep understanding of football strategies, without relying on specific details from the context that are not provided.\n</document_analysis>\n\n<output_format>\nQuestion: What key tactical adjustment would a team like Liverpool, known for its high-pressing strategy, need to make when facing a team like Real Madrid, which often utilizes a more possession-based approach in high-stakes matches?\nA: Implementing a deeper defensive line to protect against counter-attacks.\nB: Increasing the intensity of the press to win the ball higher up the pitch.\nC: Switching to a possession-based game to match Real Madrid's style.\nD: Focusing on quick transitions and utilizing the wings for attacking plays.\n\nExplanation: The correct answer requires an understanding of how teams with different strategic approaches (high-pressing vs. possession-based) might adapt to each other in a match. Liverpool's high-pressing strategy aims to win the ball back quickly, but against a team like Real Madrid, which is skilled at maintaining possession, Liverpool might need to adjust to prevent being exposed on the counter-attack. Implementing a deeper defensive line could provide an additional layer of protection, allowing Liverpool to still press but also be more secure defensively.\n\nCorrect Answer: A\n</output_format>",
    "question": "What key tactical adjustment would a team like Liverpool, known for its high-pressing strategy, need to make when facing a team like Real Madrid, which often utilizes a more possession-based approach in high-stakes matches?",
    "choices": {
      "A": "Implementing a deeper defensive line to protect against counter-attacks.",
      "B": "Increasing the intensity of the press to win the ball higher up the pitch.",
      "C": "Switching to a possession-based game to match Real Madrid's style.",
      "D": "Focusing on quick transitions and utilizing the wings for attacking plays."
    },
    "answer": "A",
    "explanation": "The correct answer requires an understanding of how teams with different strategic approaches (high-pressing vs. possession-based) might adapt to each other in a match. Liverpool's high-pressing strategy aims to win the ball back quickly, but against a team like Real Madrid, which is skilled at maintaining possession, Liverpool might need to adjust to prevent being exposed on the counter-attack. Implementing a deeper defensive line could provide an additional layer of protection, allowing Liverpool to still press but also be more secure defensively.",
    "question_token_count": 44,
    "answer_correctness_score": 8,
    "explanation_validity_score": 9,
    "question_clarity_score": 6,
    "question_difficulty_score": 8,
    "question_groundedness_score": 1,
    "avg_answer_token_count": 14
  },
  {
    "context": "<P> Carol Ann Susi ( February 2 , 1952 -- November 11 , 2014 ) was an American actress . She was known for providing the voice of recurring unseen character Mrs. Wolowitz , mother of Howard Wolowitz , on the television series The Big Bang Theory . </P>",
    "topic": "The cultural significance of The Big Bang Theory and Carol Ann Susi's role within it.",
    "response": "<document_analysis>\nTo generate a highly insightful and probing question-answer pair, we must first analyze the provided context. The context discusses Carol Ann Susi, an American actress known for her role as the voice of Mrs. Wolowitz, the mother of Howard Wolowitz, in the television series The Big Bang Theory. \n\nThe central idea here is Carol Ann Susi's contribution to The Big Bang Theory through her portrayal of Mrs. Wolowitz, a character who, despite being unseen, has a significant presence in the show. \n\nGiven the information, we can explore the concept of how an unseen character can have cultural significance and impact the storyline and audience engagement. \n\nThe difficulty of the question should be high (8/10) to challenge domain experts and encourage deep engagement with the content.\n\nConsidering the above analysis, a question that invites deeper understanding and meaningful reflection could be about the impact of Carol Ann Susi's portrayal of Mrs. Wolowitz on the show's narrative and its cultural significance.\n\n</document_analysis>\n\n<output_format>\nQuestion: What narrative device did the creators of The Big Bang Theory use to maintain Mrs. Wolowitz as a significant character despite her never being seen on screen?\nA: Flashbacks\nB: Voice-overs and off-screen dialogue\nC: Written letters\nD: Third-person narration\n\nExplanation: The correct answer, voice-overs and off-screen dialogue, is the method used to keep Mrs. Wolowitz relevant and impactful, showcasing the creative ways characters can influence a story without visual presence.\n\nCorrect Answer: B\n</output_format>",
    "question": "What narrative device did the creators of The Big Bang Theory use to maintain Mrs. Wolowitz as a significant character despite her never being seen on screen?",
    "choices": {
      "A": "Flashbacks",
      "B": "Voice-overs and off-screen dialogue",
      "C": "Written letters",
      "D": "Third-person narration"
    },
    "answer": "B",
    "explanation": "The correct answer, voice-overs and off-screen dialogue, is the method used to keep Mrs. Wolowitz relevant and impactful, showcasing the creative ways characters can influence a story without visual presence.",
    "question_token_count": 31,
    "answer_correctness_score": 10,
    "explanation_validity_score": 10,
    "question_clarity_score": 8,
    "question_difficulty_score": 6,
    "question_groundedness_score": 1,
    "avg_answer_token_count": 4
  },
  {
    "context": "<P> `` Flight '' is the twenty - fourth and final episode of the eighth season of the American television medical drama Grey 's Anatomy , and the show 's 172nd episode overall . It was written by series creator Shonda Rhimes , and directed by Rob Corn . The episode was originally broadcast on the American Broadcasting Company ( ABC ) in the United States on May 17 , 2012 . In the episode , six doctors from Seattle Grace Mercy West Hospital who are victims of an aviation accident fight to stay alive , but Dr. Lexie Grey ( Chyler Leigh ) ultimately dies . Other storylines occur in Seattle where Dr. Richard Webber ( James Pickens , Jr . ) plans his annual dinner for the departing residents , Dr. Owen Hunt ( Kevin McKidd ) fires Dr. Teddy Altman ( Kim Raver ) , and Dr. Miranda Bailey ( Chandra Wilson ) gets engaged . </P>",
    "topic": "The engagement of Dr. Miranda Bailey and its significance in the context of her character development and the episode's exploration of personal relationships.",
    "response": "<document_analysis>\nTo generate a highly insightful and probing question-answer pair, we first need to carefully analyze the provided context. The context revolves around the episode \"Flight\" from the eighth season of Grey's Anatomy, focusing on various storylines including a plane crash, personal relationships, and career developments among the characters. \n\nThe central idea here is to understand the significance of Dr. Miranda Bailey's engagement within the context of her character development and the episode's exploration of personal relationships. This requires identifying nuanced themes and significant relationships within the episode, considering implicit assumptions, and exploring underlying theories about character development and interpersonal dynamics.\n\nGiven the information, the engagement of Dr. Miranda Bailey stands out as a pivotal moment in her character development, particularly when contrasted with the more dramatic and life-altering events unfolding around her, such as the plane crash and the death of Dr. Lexie Grey. This event, while joyful, also invites reflection on the personal and professional growth of Dr. Bailey, highlighting the complexity of balancing personal life with the demands of a medical career.\n\nStrategic complexity calibration suggests that a question about Dr. Bailey's engagement should be rated high in difficulty (around 8-10) to challenge even the most knowledgeable domain experts. The question should encourage a deep engagement with the content, critically reflecting on the implications of Dr. Bailey's engagement for her character and the broader themes of the episode.\n\nIntentional question planning involves crafting a question that invites deeper understanding and meaningful reflection. The question should be purposeful, aiming to assess not just knowledge of the episode's events but also understanding of character development, thematic resonance, and the emotional depth of the narrative.\n\nConsidering the guidelines for question generation, the question should prioritize thoughtful engagement, high complexity, and the requirement for a deep understanding of the content. It should be self-contained, clear, and educational, with a conversational tone that feels natural and appropriate for domain experts.\n\nGiven these considerations, the following question-answer pair is generated:\n</document_analysis>\n\n<output_format>\nQuestion: What symbolic significance does Dr. Miranda Bailey's engagement hold in the context of her character arc and the thematic exploration of personal and professional balance in the episode \"Flight\"?\nA: It underscores her growing detachment from her professional ambitions.\nB: It highlights her ability to find personal fulfillment amidst professional chaos.\nC: It serves as a contrast to the tragic loss of Dr. Lexie Grey, emphasizing the preciousness of life.\nD: It marks a turning point in her decision to leave surgical practice for hospital administration.\n\nExplanation: The correct answer, B, reflects an understanding of Dr. Bailey's character development and the episode's themes. Her engagement symbolizes a milestone in achieving a balance between her personal and professional life, showcasing growth and fulfillment. This is particularly significant in an episode where other characters face life-altering crises, making her engagement a beacon of hope and personal victory.\n\nCorrect Answer: B\n</output_format>",
    "question": "What symbolic significance does Dr. Miranda Bailey's engagement hold in the context of her character arc and the thematic exploration of personal and professional balance in the episode \"Flight\"?",
    "choices": {
      "A": "It underscores her growing detachment from her professional ambitions.",
      "B": "It highlights her ability to find personal fulfillment amidst professional chaos.",
      "C": "It serves as a contrast to the tragic loss of Dr. Lexie Grey, emphasizing the preciousness of life.",
      "D": "It marks a turning point in her decision to leave surgical practice for hospital administration."
    },
    "answer": "B",
    "explanation": "The correct answer, B, reflects an understanding of Dr. Bailey's character development and the episode's themes. Her engagement symbolizes a milestone in achieving a balance between her personal and professional life, showcasing growth and fulfillment. This is particularly significant in an episode where other characters face life-altering crises, making her engagement a beacon of hope and personal victory.",
    "question_token_count": 34,
    "answer_correctness_score": 8,
    "explanation_validity_score": 8,
    "question_clarity_score": 6,
    "question_difficulty_score": 8,
    "question_groundedness_score": 2,
    "avg_answer_token_count": 16
  },
  {
    "context": "<P> The seventh season of the fantasy drama television series Game of Thrones premiered on HBO on July 16 , 2017 , and concluded on August 27 , 2017 . Unlike previous seasons that consisted of ten episodes each , the seventh season consisted of only seven . Like the previous season , it largely consisted of original content not found in George R.R. Martin 's A Song of Ice and Fire series , while also adapting material Martin revealed to showrunners about the upcoming novels in the series . The series was adapted for television by David Benioff and D.B. Weiss . </P>",
    "topic": "The impact of the showrunners, David Benioff and D.B. Weiss, on the adaptation of Game of Thrones for television, including their creative decisions and influences on the series.",
    "response": "<document_analysis>\nTo generate a highly insightful and probing question-answer pair, we first need to carefully analyze the provided context. The context discusses the seventh season of the Game of Thrones television series, its premiere and conclusion dates, and the fact that it consisted of only seven episodes, unlike previous seasons. It also mentions that the season largely consisted of original content not found in George R.R. Martin's A Song of Ice and Fire series but was also influenced by material Martin revealed to the showrunners about upcoming novels. The key figures in this context are David Benioff and D.B. Weiss, who adapted the series for television.\n\nGiven the topic is about the impact of the showrunners, David Benioff and D.B. Weiss, on the adaptation of Game of Thrones for television, including their creative decisions and influences on the series, we need to focus on how their role as showrunners influenced the series, especially in terms of creative decisions and adaptations from the original book series.\n\nThe thought process involves considering the implications of their creative decisions, such as reducing the number of episodes in a season and introducing original content not found in the books. This leads to questions about their approach to adaptation, their interactions with the original author, George R.R. Martin, and how these interactions might have influenced the direction of the television series.\n\nConsidering the difficulty level, the question should be challenging even for domain experts, requiring a deep understanding of the showrunners' roles, their creative decisions, and the impact of these decisions on the series. The question should also be self-contained, not requiring external knowledge beyond what a domain expert would possess.\n\nGiven these considerations, a potential question could explore the nature of the showrunners' creative decisions and their implications for the series, particularly in how they balanced original content with the need to stay true to the spirit of the book series.\n</document_analysis>\n\n<output_format>\nQuestion: What significant creative decision made by David Benioff and D.B. Weiss regarding the seventh season of Game of Thrones reflects their approach to balancing fidelity to the original book series with the introduction of original content?\nA: Reducing the number of episodes to focus on key plot points.\nB: Completely omitting characters from the book series to introduce new ones.\nC: Collaborating with George R.R. Martin to ensure all content was book-accurate.\nD: Extending the series to include a eighth season with entirely original storylines.\n\nExplanation: The correct answer reflects an understanding of the showrunners' approach to adaptation, specifically their decision to reduce the number of episodes in a season, which allowed them to focus on key plot points and balance the introduction of original content with the need to stay true to the book series.\n\nCorrect Answer: A\n</output_format>",
    "question": "What significant creative decision made by David Benioff and D.B. Weiss regarding the seventh season of Game of Thrones reflects their approach to balancing fidelity to the original book series with the introduction of original content?",
    "choices": {
      "A": "Reducing the number of episodes to focus on key plot points.",
      "B": "Completely omitting characters from the book series to introduce new ones.",
      "C": "Collaborating with George R.R. Martin to ensure all content was book-accurate.",
      "D": "Extending the series to include a eighth season with entirely original storylines."
    },
    "answer": "A",
    "explanation": "The correct answer reflects an understanding of the showrunners' approach to adaptation, specifically their decision to reduce the number of episodes in a season, which allowed them to focus on key plot points and balance the introduction of original content with the need to stay true to the book series.",
    "question_token_count": 42,
    "answer_correctness_score": 10,
    "explanation_validity_score": 9,
    "question_clarity_score": 7,
    "question_difficulty_score": 6,
    "question_groundedness_score": 9,
    "avg_answer_token_count": 15
  },
  {
    "context": "<P> The fourth season began airing on October 10 , 2017 , on The CW . </P>",
    "topic": "The significance of premiere dates for television shows and their impact on viewer engagement.",
    "response": "<document_analysis>\nTo generate a highly insightful and probing question-answer pair, we must carefully analyze the provided context. The context mentions the premiere date of the fourth season of a television show on The CW. \n\n1. **Thoughtful Content Examination**: The central idea here is the premiere date and its potential impact on viewer engagement. However, the context provided is quite minimal and does not directly discuss the significance of premiere dates or their impact on viewer engagement. \n\n2. **Concept Exploration**: Implicitly, the mention of a specific premiere date suggests that such dates are significant for television shows, possibly for generating buzz, scheduling, and competing with other shows. The underlying theory could be that premiere dates are strategically chosen to maximize viewer engagement, possibly by avoiding conflicts with other popular shows or by aligning with holidays and breaks when audiences have more time to watch.\n\n3. **Strategic Complexity Calibration**: Given the minimal information, crafting a highly challenging question requires inferring broader implications of premiere dates on viewer engagement. The difficulty level of such a question would be around 8 out of 10, as it requires not just understanding the given context but also applying broader knowledge about television programming strategies and viewer behavior.\n\n4. **Intentional Question Planning**: A question that invites deeper understanding could explore the potential strategies behind choosing premiere dates and how these dates influence viewer engagement. It should be purposeful, encouraging the respondent to reflect on the broader context of television programming and audience behavior.\n\nGiven the context's limitations and focusing on the broader topic of premiere dates' significance for television shows and their impact on viewer engagement, we aim to craft a question that is both challenging and relevant to the domain expert's knowledge.\n</document_analysis>\n\n<output_format>\nQuestion: What primary factor do television networks consider when scheduling premiere dates to maximize viewer engagement for new seasons of ongoing shows?\nA: The show's production schedule\nB: Viewer preferences and historical viewing patterns\nC: The premiere dates of competing shows on other networks\nD: The availability of the show's cast for promotional activities\n\nExplanation: Television networks strategically choose premiere dates to avoid competition with other popular shows and to capitalize on periods when the target audience is more likely to watch, such as after holidays or during breaks. While production schedules, viewer preferences, and cast availability are important, the primary factor in scheduling premiere dates is often the competitive landscape of other shows.\n\nCorrect Answer: C\n</output_format>",
    "question": "What primary factor do television networks consider when scheduling premiere dates to maximize viewer engagement for new seasons of ongoing shows?",
    "choices": {
      "A": "The show's production schedule",
      "B": "Viewer preferences and historical viewing patterns",
      "C": "The premiere dates of competing shows on other networks",
      "D": "The availability of the show's cast for promotional activities"
    },
    "answer": "C",
    "explanation": "Television networks strategically choose premiere dates to avoid competition with other popular shows and to capitalize on periods when the target audience is more likely to watch, such as after holidays or during breaks. While production schedules, viewer preferences, and cast availability are important, the primary factor in scheduling premiere dates is often the competitive landscape of other shows.",
    "question_token_count": 23,
    "answer_correctness_score": 8,
    "explanation_validity_score": 9,
    "question_clarity_score": 8,
    "question_difficulty_score": 6,
    "question_groundedness_score": 1,
    "avg_answer_token_count": 8
  },
  {
    "context": "<P> The 2018 FIFA World Cup was the 21st FIFA World Cup , an international football tournament contested by the men 's national teams of the member associations of FIFA once every four years . It took place in Russia from 14 June to 15 July 2018 . It was the first World Cup to be held in Eastern Europe , and the 11th time that it had been held in Europe . At an estimated cost of over $14.2 billion , it was the most expensive World Cup . It was also the first World Cup to use the video assistant referee ( VAR ) system . </P>",
    "topic": "The role and impact of the video assistant referee (VAR) system in the 2018 FIFA World Cup, including its effects on gameplay and decision-making.",
    "response": "<document_analysis>\nThe provided context discusses the 2018 FIFA World Cup, including its location, timing, and expenses. Notably, it mentions that this was the first World Cup to utilize the video assistant referee (VAR) system. To generate a highly insightful and probing question-answer pair, we need to focus on the role and impact of the VAR system, considering its effects on gameplay and decision-making.\n\nGiven the information provided, there is a lack of detailed analysis on the VAR system's impact. However, we can infer that the introduction of VAR would have significant implications for the game, potentially altering referee decisions, player behavior, and the overall flow of matches.\n\nTo create a challenging question, we should consider the broader implications of VAR on the sport, inviting reflection on its potential benefits and drawbacks, as well as its integration into the game.\n\nThoughtfully rating the difficulty, the question should aim for a high level of complexity (around 8-10) to challenge even the smartest domain experts.\n\nThe question planning involves considering how VAR's introduction could influence strategic decisions by teams, the psychological impact on players and referees, and the potential for controversy or consistency in VAR decisions.\n\nGiven the context's limitations, the question will need to be somewhat general, focusing on the theoretical or observed impacts of VAR in professional football, rather than specific instances from the 2018 World Cup.\n\nThe decision criteria for question generation are met as the context, although brief, contains meaningful and coherent information about the introduction of VAR in the 2018 FIFA World Cup, allowing for the exploration of its role and impact.\n\nThe rationale for excluding certain information involves disregarding details about the tournament's cost, location, and timing, as these are not directly relevant to the VAR system's impact on gameplay and decision-making.\n\nIn conclusion, the analysis leads to the generation of a question that explores the strategic and psychological implications of the VAR system in professional football, aiming to challenge domain experts' understanding of its effects on the game.\n</document_analysis>\n\n<output_format>\nQuestion: What significant psychological impact could the introduction of the video assistant referee (VAR) system have on referees' decision-making confidence during high-pressure matches?\nA: Increased confidence due to reduced controversy\nB: Decreased confidence due to increased scrutiny\nC: No significant impact on decision-making confidence\nD: Variable impact depending on the referee's experience with VAR\nExplanation: The introduction of VAR could lead to decreased confidence among referees due to the increased scrutiny of their decisions, as every call is potentially subject to review and reversal. This heightened level of accountability might make referees more cautious or hesitant, potentially affecting their decision-making confidence.\nCorrect Answer: B\n</output_format>",
    "question": "What significant psychological impact could the introduction of the video assistant referee (VAR) system have on referees' decision-making confidence during high-pressure matches?",
    "choices": {
      "A": "Increased confidence due to reduced controversy",
      "B": "Decreased confidence due to increased scrutiny",
      "C": "No significant impact on decision-making confidence",
      "D": "Variable impact depending on the referee's experience with VAR"
    },
    "answer": "B",
    "explanation": "The introduction of VAR could lead to decreased confidence among referees due to the increased scrutiny of their decisions, as every call is potentially subject to review and reversal. This heightened level of accountability might make referees more cautious or hesitant, potentially affecting their decision-making confidence.",
    "question_token_count": 30,
    "answer_correctness_score": 8,
    "explanation_validity_score": 9,
    "question_clarity_score": 7,
    "question_difficulty_score": 8,
    "question_groundedness_score": 2,
    "avg_answer_token_count": 8
  },
  {
    "context": "<P> Earth 's orbit is the trajectory along which Earth travels around the Sun . The average distance between the Earth and the Sun is 149.60 million km ( 92.96 million mi ) , and one complete orbit takes 365.256 days ( 1 sidereal year ) , during which time Earth has traveled 940 million km ( 584 million mi ) . Earth 's orbit has an eccentricity of 0.0167 . </P>",
    "topic": "The potential consequences of changes in the Earth's orbit on the planet's climate, sea levels, and the habitability of the planet.",
    "response": "<document_analysis>\nTo generate a question that probes the domain expert's understanding of the potential consequences of changes in the Earth's orbit, we must first carefully examine the provided context. The context describes the Earth's orbit, including its average distance from the Sun, the time it takes to complete one orbit, and the orbit's eccentricity. \n\nHowever, the context does not directly address the potential consequences of changes in the Earth's orbit on the planet's climate, sea levels, and habitability. Therefore, we need to consider the implicit relationships between the Earth's orbit and these factors.\n\nThe eccentricity of the Earth's orbit, which is 0.0167, indicates that the orbit is nearly circular. Changes in the eccentricity or other parameters of the Earth's orbit could potentially impact the amount of solar energy the Earth receives, which in turn could affect the planet's climate.\n\nGiven this information, we can plan a question that invites deeper understanding and critical engagement with the content. The question should be challenging, requiring the domain expert to synthesize their knowledge of the Earth's orbit and its potential consequences.\n\nOne potential question could explore the relationship between the Earth's orbital eccentricity and its climate. For example, how might an increase in the Earth's orbital eccentricity impact the planet's climate, and what would be the potential consequences for sea levels and habitability?\n\nThoughtful consideration of this question requires the domain expert to think critically about the relationships between the Earth's orbit, climate, sea levels, and habitability, making it an appropriate choice for probing their understanding of this topic.\n</document_analysis>\n\n<output_format>\nQuestion: What would be the primary effect of a significant increase in the Earth's orbital eccentricity on the planet's climate?\nA: A decrease in global temperatures due to reduced solar energy input\nB: An increase in global temperatures due to increased solar energy input\nC: No significant impact on global temperatures\nD: A shift in the planet's axial tilt, leading to extreme seasonal variations\n\nExplanation: An increase in the Earth's orbital eccentricity would result in more pronounced variations in the amount of solar energy the planet receives throughout the year. This, in turn, would lead to more extreme climate fluctuations, potentially resulting in an increase in global temperatures due to increased solar energy input during the closest approach to the Sun.\n\nCorrect Answer: B\n</output_format>",
    "question": "What would be the primary effect of a significant increase in the Earth's orbital eccentricity on the planet's climate?",
    "choices": {
      "A": "A decrease in global temperatures due to reduced solar energy input",
      "B": "An increase in global temperatures due to increased solar energy input",
      "C": "No significant impact on global temperatures",
      "D": "A shift in the planet's axial tilt, leading to extreme seasonal variations"
    },
    "answer": "B",
    "explanation": "An increase in the Earth's orbital eccentricity would result in more pronounced variations in the amount of solar energy the planet receives throughout the year. This, in turn, would lead to more extreme climate fluctuations, potentially resulting in an increase in global temperatures due to increased solar energy input during the closest approach to the Sun.",
    "question_token_count": 22,
    "answer_correctness_score": 8,
    "explanation_validity_score": 7,
    "question_clarity_score": 9,
    "question_difficulty_score": 8,
    "question_groundedness_score": 4,
    "avg_answer_token_count": 11
  },
  {
    "context": "<P> Carol Ann Susi ( February 2 , 1952 -- November 11 , 2014 ) was an American actress . She was known for providing the voice of recurring unseen character Mrs. Wolowitz , mother of Howard Wolowitz , on the television series The Big Bang Theory . </P>",
    "topic": "The challenges of portraying an unseen character like Mrs. Wolowitz in a television series.",
    "response": "<document_analysis>\nThe provided context discusses Carol Ann Susi, an American actress known for voicing the character of Mrs. Wolowitz, the mother of Howard Wolowitz, in the television series The Big Bang Theory. The key aspect of this character is that she is unseen, presenting a unique challenge in portraying her. \n\nTo generate a question, we need to consider the implications of having an unseen character and how this affects the storytelling and audience perception. The challenge lies in creating a believable and engaging character without visual representation, relying solely on voice and the reactions of other characters.\n\nGiven the information, a thoughtful question could explore the strategies used to make an unseen character like Mrs. Wolowitz impactful or the potential drawbacks of such a character representation. \n\nThe difficulty level of the question should be high (8/10) to challenge domain experts in television production, character development, and storytelling. \n\nThe question should be designed to encourage deep engagement with the concept of unseen characters, their role in storytelling, and the specific challenges and opportunities they present in a television series context.\n</document_analysis>\n\n<output_format>\nQuestion: What narrative technique is most crucial for effectively portraying an unseen character like Mrs. Wolowitz in a television series?\nA: Exposition through secondary characters\nB: Flashbacks of the character's past\nC: The character's voice and other characters' reactions\nD: Detailed descriptions in the script\n\nExplanation: The correct answer, \"The character's voice and other characters' reactions,\" is crucial because it directly addresses how an unseen character can be made present and influential in a scene without being visually shown. This technique relies on the audience using their imagination, fueled by what they hear and see in the reactions of other characters, to form an impression of the unseen character.\n\nCorrect Answer: C\n</output_format>",
    "question": "What narrative technique is most crucial for effectively portraying an unseen character like Mrs. Wolowitz in a television series?",
    "choices": {
      "A": "Exposition through secondary characters",
      "B": "Flashbacks of the character's past",
      "C": "The character's voice and other characters' reactions",
      "D": "Detailed descriptions in the script"
    },
    "answer": "C",
    "explanation": "The correct answer, \"The character's voice and other characters' reactions,\" is crucial because it directly addresses how an unseen character can be made present and influential in a scene without being visually shown. This technique relies on the audience using their imagination, fueled by what they hear and see in the reactions of other characters, to form an impression of the unseen character.",
    "question_token_count": 24,
    "answer_correctness_score": 10,
    "explanation_validity_score": 10,
    "question_clarity_score": 8,
    "question_difficulty_score": 7,
    "question_groundedness_score": 4,
    "avg_answer_token_count": 7
  },
  {
    "context": "<P> Earth 's orbit is the trajectory along which Earth travels around the Sun . The average distance between the Earth and the Sun is 149.60 million km ( 92.96 million mi ) , and one complete orbit takes 365.256 days ( 1 sidereal year ) , during which time Earth has traveled 940 million km ( 584 million mi ) . Earth 's orbit has an eccentricity of 0.0167 . </P>",
    "topic": "The historical development of our understanding of the Earth's orbit, from ancient civilizations to modern astronomy, and the key discoveries that shaped our current knowledge.",
    "response": "<document_analysis>\nTo generate a question that probes the domain expert's understanding of the historical development of our knowledge of the Earth's orbit, we must first analyze the provided context. The context gives us specific details about the Earth's orbit, including its average distance from the Sun, the time it takes to complete one orbit, the total distance traveled in one orbit, and the eccentricity of the orbit. However, it does not directly address the historical development or key discoveries that have led to our current understanding. \n\nGiven the topic \"The historical development of our understanding of the Earth's orbit, from ancient civilizations to modern astronomy, and the key discoveries that shaped our current knowledge,\" we need to consider how the provided context fits into this broader narrative. The context itself is more focused on the current state of knowledge regarding the Earth's orbit rather than its historical development. \n\nTherefore, our question needs to bridge the gap between the historical development of astronomical knowledge and the specifics of the Earth's orbit as described. We are looking for a question that requires the synthesis of general understanding above and beyond the specific context provided, encouraging deep engagement with the subject matter.\n\nThe question should be highly challenging, requiring a deep understanding of astronomical history and the development of modern astronomy. It should also be self-contained, clear, and conversational, with a focus on educational impact.\n\nGiven these considerations, we aim to craft a question that not only tests the domain expert's knowledge of the Earth's orbit but also their understanding of how this knowledge was acquired over time, reflecting on key discoveries and their implications for modern astronomy.\n</document_analysis>\n\n<output_format>\nQuestion: What 16th-century astronomer's heliocentric model, which placed the Sun at the center of the solar system, laid the foundational shift in understanding the Earth's orbit around the Sun?\nA: Galileo Galilei\nB: Johannes Kepler\nC: Nicolaus Copernicus\nD: Tycho Brahe\n\nExplanation: The correct answer, Nicolaus Copernicus, is the astronomer who proposed the heliocentric model in the 16th century, significantly altering the understanding of the Earth's position and orbit. While Galileo Galilei, Johannes Kepler, and Tycho Brahe were also crucial figures in the development of modern astronomy, Copernicus's model was the foundational shift towards understanding the Earth's orbit as we know it today.\n\nCorrect Answer: C\n</output_format>",
    "question": "What 16th-century astronomer's heliocentric model, which placed the Sun at the center of the solar system, laid the foundational shift in understanding the Earth's orbit around the Sun?",
    "choices": {
      "A": "Galileo Galilei",
      "B": "Johannes Kepler",
      "C": "Nicolaus Copernicus",
      "D": "Tycho Brahe"
    },
    "answer": "C",
    "explanation": "The correct answer, Nicolaus Copernicus, is the astronomer who proposed the heliocentric model in the 16th century, significantly altering the understanding of the Earth's position and orbit. While Galileo Galilei, Johannes Kepler, and Tycho Brahe were also crucial figures in the development of modern astronomy, Copernicus's model was the foundational shift towards understanding the Earth's orbit as we know it today.",
    "question_token_count": 37,
    "answer_correctness_score": 10,
    "explanation_validity_score": 10,
    "question_clarity_score": 9,
    "question_difficulty_score": 7,
    "question_groundedness_score": 1,
    "avg_answer_token_count": 5
  },
  {
    "context": "<P> The 21 World Cup tournaments have been won by eight national teams . Brazil have won five times , and they are the only team to have played in every tournament . The other World Cup winners are Germany and Italy , with four titles each ; Argentina , France and inaugural winner Uruguay , with two titles each ; and England and Spain with one title each . </P>",
    "topic": "The frequency and distribution of World Cup titles among the winning national teams, including Brazil, Germany, Italy, Argentina, France, Uruguay, England, and Spain.",
    "response": "<document_analysis>\nTo generate a highly insightful and probing question-answer pair, we first need to analyze the given context carefully. The context provides information about the frequency and distribution of World Cup titles among winning national teams. It mentions that eight national teams have won the 21 World Cup tournaments, with Brazil being the most successful, having won five times and being the only team to have played in every tournament. Other successful teams include Germany and Italy, each with four titles, followed by Argentina, France, and Uruguay, each with two titles, and finally England and Spain, each with one title.\n\nThe central idea here is the distribution of World Cup titles among these national teams. Nuanced themes include the dominance of certain teams like Brazil, Germany, and Italy, and the less frequent successes of others like England and Spain. Significant relationships can be observed in the number of titles won by each team, reflecting their historical performance and dominance in the sport.\n\nUpon careful examination, we can see that the information provided is coherent, meaningful, and educationally valuable, focusing on the historical outcomes of the World Cup tournaments. There is no irrelevant or bogus information that needs to be excluded. The difficulty level of the question we aim to generate should be high (around 8 or 9 out of 10) to challenge even the smartest domain experts.\n\nGiven the information, a thoughtful and engaging question could involve the analysis of the distribution of titles, the comparison of successful teams, or the implication of these historical trends on future tournaments. The question should be designed to encourage deeper understanding, critical reflection, and meaningful engagement with the content.\n\n</document_analysis>\n\n<output_format>\nQuestion: Which national team is the only one to have participated in every World Cup tournament and has also won the most titles?\nA: Germany\nB: Brazil\nC: Italy\nD: Argentina\nExplanation: The correct answer can be deduced by understanding the unique achievements of the teams mentioned. Brazil's consistent participation and highest number of titles make it stand out.\nCorrect Answer: B\n</output_format>",
    "question": "Which national team is the only one to have participated in every World Cup tournament and has also won the most titles?",
    "choices": {
      "A": "Germany",
      "B": "Brazil",
      "C": "Italy",
      "D": "Argentina"
    },
    "answer": "B",
    "explanation": "The correct answer can be deduced by understanding the unique achievements of the teams mentioned. Brazil's consistent participation and highest number of titles make it stand out.",
    "question_token_count": 24,
    "answer_correctness_score": 10,
    "explanation_validity_score": 10,
    "question_clarity_score": 10,
    "question_difficulty_score": 7,
    "question_groundedness_score": 10,
    "avg_answer_token_count": 2
  },
  {
    "context": "<P> Article Five of the United States Constitution describes the process whereby the Constitution , the nation 's frame of government , may be altered . Altering the Constitution consists of proposing an amendment or amendments and subsequent ratification . Amendments may be proposed either by the Congress with a two - thirds vote in both the House of Representatives and the Senate or by a convention of states called for by two - thirds of the state legislatures . To become part of the Constitution , an amendment must be ratified by either -- as determined by Congress -- the legislatures of three - quarters of the states or state ratifying conventions in three - quarters of the states . The vote of each state ( to either ratify or reject a proposed amendment ) carries equal weight , regardless of a state 's population or length of time in the Union . </P>",
    "topic": "The process of proposing and ratifying amendments to the United States Constitution as outlined in Article Five.",
    "response": "<document_analysis>\nThe provided context describes the process of proposing and ratifying amendments to the United States Constitution as outlined in Article Five. To generate a question, we need to carefully examine the central ideas, nuanced themes, and significant relationships within the given context.\n\nUpon analyzing the context, it becomes clear that the process of altering the Constitution involves two main steps: proposing an amendment and subsequent ratification. The proposal can be made either by Congress with a two-thirds vote in both the House of Representatives and the Senate or by a convention of states called for by two-thirds of the state legislatures. The ratification process requires either the legislatures of three-quarters of the states or state ratifying conventions in three-quarters of the states to approve the amendment.\n\nGiven this information, we can identify the key concepts and relationships that underlie the process of amending the Constitution. The question should be designed to probe the domain expert's understanding of these concepts and their ability to apply them in a nuanced and thoughtful manner.\n\nThe difficulty level of the question should be rated as 8 out of 10, as it requires a deep understanding of the constitutional amendment process and the ability to analyze complex information.\n\nThe question should be planned to invite deeper understanding, meaningful reflection, or critical engagement with the content. It should be purposeful and encourage the domain expert to think critically about the implications of the amendment process.\n\nAfter careful consideration, a question that meets these criteria can be generated.\n</document_analysis>\n\n<output_format>\nQuestion: What is the primary difference between the two methods by which Congress can specify ratification of a proposed constitutional amendment?\nA: One method requires a simple majority vote, while the other requires a two-thirds vote.\nB: One method involves state legislatures, while the other involves state ratifying conventions.\nC: One method requires a national referendum, while the other requires a state-by-state vote.\nD: One method is used for minor amendments, while the other is used for major amendments.\nExplanation: The correct answer is B) One method involves state legislatures, while the other involves state ratifying conventions. According to the context, Congress can specify ratification by either the legislatures of three-quarters of the states or state ratifying conventions in three-quarters of the states.\nCorrect Answer: B\n</output_format>",
    "question": "What is the primary difference between the two methods by which Congress can specify ratification of a proposed constitutional amendment?",
    "choices": {
      "A": "One method requires a simple majority vote, while the other requires a two-thirds vote.",
      "B": "One method involves state legislatures, while the other involves state ratifying conventions.",
      "C": "One method requires a national referendum, while the other requires a state-by-state vote.",
      "D": "One method is used for minor amendments, while the other is used for major amendments."
    },
    "answer": "B",
    "explanation": "The correct answer is B) One method involves state legislatures, while the other involves state ratifying conventions. According to the context, Congress can specify ratification by either the legislatures of three-quarters of the states or state ratifying conventions in three-quarters of the states.",
    "question_token_count": 23,
    "answer_correctness_score": 10,
    "explanation_validity_score": 10,
    "question_clarity_score": 6,
    "question_difficulty_score": 5,
    "question_groundedness_score": 10,
    "avg_answer_token_count": 17
  },
  {
    "context": "<P> The history of the Great Wall of China began when fortifications built by various states during the Spring and Autumn ( 771 -- 476 BC ) and Warring States periods ( 475 -- 221 BC ) were connected by the first emperor of China , Qin Shi Huang , to protect his newly founded Qin dynasty ( 221 -- 206 BC ) against incursions by nomads from Inner Asia . The walls were built of rammed earth , constructed using forced labour , and by 212 BC ran from Gansu to the coast of southern Manchuria . </P>",
    "topic": "The significance of the Great Wall of China as a historical and architectural monument, and its representation of ancient Chinese engineering and labor practices.",
    "response": "<document_analysis>\nTo generate a highly insightful and probing question-answer pair, a thorough analysis of the provided context is necessary. The context discusses the historical origins of the Great Wall of China, specifically its construction during the Qin dynasty (221-206 BC) under the first emperor of China, Qin Shi Huang. It highlights the use of fortifications built by various states during the Spring and Autumn and Warring States periods, which were later connected to protect against nomadic invasions from Inner Asia. The construction materials and methods, such as rammed earth and forced labor, are also mentioned.\n\nThe central idea here revolves around the historical significance and architectural marvel of the Great Wall, representing ancient Chinese engineering and labor practices. To create a challenging question, we need to delve into the nuances of this historical context, considering the implications of such a massive construction project on the social, political, and economic landscapes of ancient China.\n\nGiven the complexity of the topic, a question that invites deeper understanding and critical engagement could involve the analysis of the wall's construction and its broader historical implications. The difficulty level of such a question should be high (around 8 or 9 out of 10) to challenge even the smartest domain experts.\n\nAfter careful consideration, a question that fits these criteria could involve the strategic and logistical aspects of the wall's construction, particularly in relation to the labor practices and the emperor's motivations. This would require the domain expert to demonstrate a deep understanding of ancient Chinese history, the engineering feats of the time, and the sociopolitical context in which the Great Wall was built.\n</document_analysis>\n\n<output_format>\nQuestion: What primary factor motivated Qin Shi Huang to connect the existing fortifications into a single, long wall, considering the extensive use of forced labor and the wall's eventual stretch from Gansu to southern Manchuria?\nA: To establish trade routes with Inner Asia\nB: To protect his dynasty from nomadic invasions and unify the Chinese states\nC: To demonstrate the engineering prowess of the Qin dynasty\nD: To expand the Qin dynasty's territorial control over Inner Asia\n\nExplanation: The correct answer requires an understanding of the historical context and the strategic motivations behind the construction of the Great Wall. Qin Shi Huang's primary motivation was to secure his newly founded dynasty against external threats and to symbolize the unity and strength of his rule, which is reflected in the wall's construction.\n\nCorrect Answer: B\n</output_format>",
    "question": "What primary factor motivated Qin Shi Huang to connect the existing fortifications into a single, long wall, considering the extensive use of forced labor and the wall's eventual stretch from Gansu to southern Manchuria?",
    "choices": {
      "A": "To establish trade routes with Inner Asia",
      "B": "To protect his dynasty from nomadic invasions and unify the Chinese states",
      "C": "To demonstrate the engineering prowess of the Qin dynasty",
      "D": "To expand the Qin dynasty's territorial control over Inner Asia"
    },
    "answer": "B",
    "explanation": "The correct answer requires an understanding of the historical context and the strategic motivations behind the construction of the Great Wall. Qin Shi Huang's primary motivation was to secure his newly founded dynasty against external threats and to symbolize the unity and strength of his rule, which is reflected in the wall's construction.",
    "question_token_count": 43,
    "answer_correctness_score": 9,
    "explanation_validity_score": 9,
    "question_clarity_score": 7,
    "question_difficulty_score": 6,
    "question_groundedness_score": 10,
    "avg_answer_token_count": 11
  },
  {
    "context": "<Table> <Tr> <Th> Player </Th> <Th> Salary </Th> <Th> Team </Th> </Tr> <Tr> <Td> Stephen Curry </Td> <Td> $34,682,550 </Td> <Td> Golden State Warriors </Td> </Tr> <Tr> <Td> LeBron James </Td> <Td> $33,285,709 </Td> <Td> Cleveland Cavaliers </Td> </Tr> <Tr> <Td> Paul Millsap </Td> <Td> $31,269,231 </Td> <Td> Denver Nuggets </Td> </Tr> <Tr> <Td> Gordon Hayward </Td> <Td> $29,727,900 </Td> <Td> Boston Celtics </Td> </Tr> <Tr> <Td> Blake Griffin </Td> <Td> $29,512,900 </Td> <Td> Los Angeles Clippers </Td> </Tr> <Tr> <Td> Kyle Lowry </Td> <Td> $28,703,704 </Td> <Td> Toronto Raptors </Td> </Tr> <Tr> <Td> Russell Westbrook </Td> <Td> $28,530,608 </Td> <Td> Oklahoma City Thunder </Td> </Tr> <Tr> <Td> Mike Conley , Jr . </Td> <Td> $28,530,608 </Td> <Td> Memphis Grizzlies </Td> </Tr> <Tr> <Td> James Harden </Td> <Td> $28,299,399 </Td> <Td> Houston Rockets </Td> </Tr> <Tr> <Td> DeMar DeRozan </Td> <Td> $27,739,975 </Td> <Td> Toronto Raptors </Td> </Tr> </Table>",
    "topic": "The player with the lowest salary among the top 10 listed is DeMar DeRozan, who plays for the Toronto Raptors and has a salary of $27,739,975.",
    "response": "<document_analysis>\nThe provided context is a table listing the top 10 players by salary, along with their respective teams. The table includes players such as Stephen Curry, LeBron James, and DeMar DeRozan, with their salaries ranging from $27,739,975 to $34,682,550. The question topic statement mentions that DeMar DeRozan has the lowest salary among the top 10 listed, with a salary of $27,739,975. \n\nUpon examining the table, it is clear that the salaries are listed in descending order, with the highest salary at the top and the lowest at the bottom. The teams represented include the Golden State Warriors, Cleveland Cavaliers, Denver Nuggets, and Toronto Raptors, among others.\n\nTo generate a challenging question, we need to consider the relationships between the players, their salaries, and their teams. One potential question could involve analyzing the salary distribution among the top 10 players and identifying patterns or trends.\n\nThe difficulty level of this question should be around 8 out of 10, as it requires careful analysis of the table and consideration of the relationships between the players and their salaries.\n\nThe question should be designed to encourage thoughtful engagement and nuanced consideration of the context. It should also be self-contained, with sufficient context provided for the question to be answerable without referencing external information.\n</document_analysis>\n\n<output_format>\nQuestion: Which player among the top 10 has a salary that is closest to 28 million dollars, but still lower than the average salary of the top 5 players?\nA: DeMar DeRozan\nB: James Harden\nC: Russell Westbrook\nD: Kyle Lowry\nExplanation: To answer this question, we need to calculate the average salary of the top 5 players and then find the player with a salary closest to 28 million dollars but lower than the average. The top 5 players are Stephen Curry, LeBron James, Paul Millsap, Gordon Hayward, and Blake Griffin, with salaries of $34,682,550, $33,285,709, $31,269,231, $29,727,900, and $29,512,900, respectively. The average salary of these players is approximately $31,695,658. Among the options, James Harden has a salary of $28,299,399, which is closest to 28 million dollars but lower than the average salary of the top 5 players.\nCorrect Answer: B\n</output_format>",
    "question": "Which player among the top 10 has a salary that is closest to 28 million dollars, but still lower than the average salary of the top 5 players?",
    "choices": {
      "A": "DeMar DeRozan",
      "B": "James Harden",
      "C": "Russell Westbrook",
      "D": "Kyle Lowry"
    },
    "answer": "B",
    "explanation": "To answer this question, we need to calculate the average salary of the top 5 players and then find the player with a salary closest to 28 million dollars but lower than the average. The top 5 players are Stephen Curry, LeBron James, Paul Millsap, Gordon Hayward, and Blake Griffin, with salaries of $34,682,550, $33,285,709, $31,269,231, $29,727,900, and $29,512,900, respectively. The average salary of these players is approximately $31,695,658. Among the options, James Harden has a salary of $28,299,399, which is closest to 28 million dollars but lower than the average salary of the top 5 players.",
    "question_token_count": 34,
    "answer_correctness_score": 1,
    "explanation_validity_score": 4,
    "question_clarity_score": 8,
    "question_difficulty_score": 6,
    "question_groundedness_score": 10,
    "avg_answer_token_count": 4
  },
  {
    "context": "<P> `` Death and All His Friends '' is the season finale of the sixth season of the American television medical drama Grey 's Anatomy , and the show 's 126th episode overall . It was written by Shonda Rhimes and directed by Rob Corn . The episode was originally broadcast on the American Broadcasting Company ( ABC ) in the United States on May 20 , 2010 . The episode was the second part of the two - hour season six finale , the first being Sanctuary , and took place at the fictional Seattle Grace Hospital . The original episode broadcast in the United States had an audience of 16.13 million viewers and opened up to universal acclaim . The episode centers a shooting spree at the hospital by a former patient 's husband Gary Clark ( Michael O'Neill ) . The episode marked the last appearances for Nora Zehetner and Robert Baker as Dr. Reed Adamson and Dr. Charles Percy respectively as both the characters were killed in the shooting . </P>",
    "topic": "The thematic exploration of grief, loss, and trauma in the episode, particularly in the context of a hospital setting.",
    "response": "<document_analysis>\nTo generate a highly insightful and probing question-answer pair, I will conduct a thoughtful analysis of the provided context. The central idea of the context revolves around the episode \"Death and All His Friends\" from the sixth season of Grey's Anatomy, which explores themes of grief, loss, and trauma in a hospital setting. \n\nThe context provides details about the episode's broadcast, its reception, and the plot, which involves a shooting spree at the hospital by a former patient's husband. This event leads to the death of two characters, Dr. Reed Adamson and Dr. Charles Percy. \n\nGiven the focus on grief, loss, and trauma, I will consider implicit assumptions about the emotional impact of such events on the characters and the hospital environment. The underlying theory here could be related to how traumatic events affect individuals and communities, especially in a setting like a hospital where the emphasis is on healing and saving lives.\n\nThe difficulty level of the question I aim to generate should be high (8-10), ensuring it challenges even the smartest domain experts. The question should encourage deep engagement with the content, critical reflection on the implications of the themes explored in the episode, and a clear demonstration of understanding and competency in analyzing thematic explorations in television dramas.\n\nAfter careful consideration, I have decided to generate a question that explores the thematic significance of the shooting spree in the context of the hospital setting and its impact on the characters and the audience. The question will be designed to be self-contained, requiring no external references, and will have a conversational tone while maintaining a high level of complexity and difficulty.\n</document_analysis>\n\n<output_format>\nQuestion: What psychological mechanism does the episode \"Death and All His Friends\" likely trigger in its audience by portraying a traumatic event like a shooting spree in a hospital, a place typically associated with safety and healing?\nA: Cognitive dissonance\nB: Emotional numbing\nC: Empathic distress\nD: Dissociation\n\nExplanation: The episode triggers empathic distress in its audience by portraying a traumatic event in a setting that is supposed to be safe, thereby challenging the audience's emotional resilience and ability to cope with the violation of a safe space.\n\nCorrect Answer: C\n</output_format>",
    "question": "What psychological mechanism does the episode \"Death and All His Friends\" likely trigger in its audience by portraying a traumatic event like a shooting spree in a hospital, a place typically associated with safety and healing?",
    "choices": {
      "A": "Cognitive dissonance",
      "B": "Emotional numbing",
      "C": "Empathic distress",
      "D": "Dissociation"
    },
    "answer": "C",
    "explanation": "The episode triggers empathic distress in its audience by portraying a traumatic event in a setting that is supposed to be safe, thereby challenging the audience's emotional resilience and ability to cope with the violation of a safe space.",
    "question_token_count": 43,
    "answer_correctness_score": 10,
    "explanation_validity_score": 10,
    "question_clarity_score": 8,
    "question_difficulty_score": 7,
    "question_groundedness_score": 4,
    "avg_answer_token_count": 4
  },
  {
    "context": "<P> The 21 World Cup tournaments have been won by eight national teams . Brazil have won five times , and they are the only team to have played in every tournament . The other World Cup winners are Germany and Italy , with four titles each ; Argentina , France and inaugural winner Uruguay , with two titles each ; and England and Spain with one title each . </P>",
    "topic": "The potential relationships between a team's World Cup performance and their overall football prowess, using the provided teams as case studies.",
    "response": "<document_analysis>\nTo generate a question that probes the relationship between a team's World Cup performance and their overall football prowess, we must first analyze the provided context. The context lists the winners of the 21 World Cup tournaments, noting the number of titles won by each country. Brazil stands out as the only team to have played in every tournament and has won five times. Other notable winners include Germany and Italy, each with four titles, and Argentina, France, and Uruguay, each with two titles. England and Spain have each won the tournament once.\n\nGiven this information, a thoughtful question would consider the implications of World Cup performance on a team's overall football prowess. This involves exploring the concept of consistency, skill, and strategy in football, as well as the potential for a team's World Cup performance to be indicative of their broader capabilities in the sport.\n\nThe question should be challenging, encouraging deep reflection and insight into the world of football. It should also be self-contained, clear, and factual, with a correct answer that demonstrates a nuanced understanding of the topic.\n\nThoughtfully rating the difficulty of such a question, it would likely fall on the higher end of the scale, around 8 or 9 out of 10, due to the need for domain-specific knowledge and the ability to analyze complex relationships within the sport.\n\n</document_analysis>\n\n<output_format>\nQuestion: What characteristic is most indicative of a team's consistent football prowess, as evidenced by their performance in the World Cup?\nA: Number of tournament appearances\nB: Total goals scored in the tournament\nC: Frequency of reaching the semi-finals\nD: Winning the tournament at least once\n\nExplanation: The characteristic most indicative of a team's consistent football prowess would be their ability to consistently participate and perform well in the World Cup, which is reflected in the number of tournament appearances. Brazil's participation in every tournament, for example, demonstrates a high level of consistent performance and capability.\n\nCorrect Answer: A\n</output_format>",
    "question": "What characteristic is most indicative of a team's consistent football prowess, as evidenced by their performance in the World Cup?",
    "choices": {
      "A": "Number of tournament appearances",
      "B": "Total goals scored in the tournament",
      "C": "Frequency of reaching the semi-finals",
      "D": "Winning the tournament at least once"
    },
    "answer": "A",
    "explanation": "The characteristic most indicative of a team's consistent football prowess would be their ability to consistently participate and perform well in the World Cup, which is reflected in the number of tournament appearances. Brazil's participation in every tournament, for example, demonstrates a high level of consistent performance and capability.",
    "question_token_count": 23,
    "answer_correctness_score": 7,
    "explanation_validity_score": 8,
    "question_clarity_score": 6,
    "question_difficulty_score": 7,
    "question_groundedness_score": 8,
    "avg_answer_token_count": 6
  },
  {
    "context": "<P> The 2017 NFL season is the 98th and current season in the history of the National Football League ( NFL ) . The season began on September 7 , 2017 , with the Kansas City Chiefs defeating the defending Super Bowl LI champion New England Patriots 42 -- 27 in the NFL Kickoff Game . The season will conclude with Super Bowl LII , the league 's championship game , on February 4 , 2018 , at U.S. Bank Stadium in Minneapolis , Minnesota . </P>",
    "topic": "The structure of the 2017 NFL season, including key milestones such as the start date, significant games, and the championship game, Super Bowl LII.",
    "response": "<document_analysis>\nThe provided context discusses the 2017 NFL season, its commencement, and its culmination with Super Bowl LII. Key details include the start date of the season, the outcome of the NFL Kickoff Game, and the date and location of Super Bowl LII. To craft a challenging question, we must delve into the specifics of the season's structure and significant events. \n\nThoughtful content examination reveals that the season began on September 7, 2017, and will end with Super Bowl LII on February 4, 2018. Concept exploration suggests considering the implications of the season's start and end dates, as well as the significance of the NFL Kickoff Game and Super Bowl LII. Strategic complexity calibration indicates that a question rating of 8 out of 10 in terms of difficulty would be appropriate, as it requires a deep understanding of the NFL season's structure and key milestones.\n\nIntentional question planning leads to the development of a question that invites deeper understanding and meaningful reflection on the season's significant events. The question should be purposeful, encouraging the domain expert to demonstrate their knowledge of the 2017 NFL season's structure and key milestones.\n</document_analysis>\n\n<output_format>\nQuestion: What was the outcome of the game that kicked off the 2017 NFL season?\nA: New England Patriots won 42-27\nB: Kansas City Chiefs won 42-27\nC: The game ended in a tie\nD: New England Patriots won 27-24\nExplanation: The correct answer is based on the information provided in the context, which states that the Kansas City Chiefs defeated the New England Patriots 42-27 in the NFL Kickoff Game.\nCorrect Answer: B\n</output_format>",
    "question": "What was the outcome of the game that kicked off the 2017 NFL season?",
    "choices": {
      "A": "New England Patriots won 42-27",
      "B": "Kansas City Chiefs won 42-27",
      "C": "The game ended in a tie",
      "D": "New England Patriots won 27-24"
    },
    "answer": "B",
    "explanation": "The correct answer is based on the information provided in the context, which states that the Kansas City Chiefs defeated the New England Patriots 42-27 in the NFL Kickoff Game.",
    "question_token_count": 18,
    "answer_correctness_score": 10,
    "explanation_validity_score": 10,
    "question_clarity_score": 7,
    "question_difficulty_score": 3,
    "question_groundedness_score": 4,
    "avg_answer_token_count": 8
  },
  {
    "context": "<Table> <Tr> <Th> Rank </Th> <Th> Points </Th> <Th> Player </Th> <Th> Date </Th> <Th> 1st </Th> <Th> 2nd </Th> <Th> 3rd </Th> <Th> 4th </Th> <Th> Team </Th> <Th> Opponent </Th> <Th> Score </Th> <Th> MP </Th> <Th> FGM </Th> <Th> FGA </Th> <Th> 3PM </Th> <Th> 3PA </Th> <Th> FTM </Th> <Th> FTA </Th> <Th> Notes </Th> <Th> Ref . </Th> </Tr> <Tr> <Th colspan=\"4\"> Scoring by quarter </Th> </Tr> <Tr> <Td> </Td> <Td> 100 </Td> <Td> Chamberlain , Wilt Wilt Chamberlain * </Td> <Td> 000000001962 - 03 - 02 - 0000 March 2 , 1962 </Td> <Td> 23 </Td> <Td> 18 </Td> <Td> 28 </Td> <Td> 31 </Td> <Td> Philadelphia Warriors </Td> <Td> New York Knicks </Td> <Td> 169 -- 147 </Td> <Td> 48 </Td> <Td> 36 </Td> <Td> 63 </Td> <Td> -- </Td> <Td> -- </Td> <Td> 28 </Td> <Td> 32 </Td> <Td> </Td> <Td> </Td> </Tr> <Tr> <Td> </Td> <Td> 81 </Td> <Td> Bryant , Kobe Kobe Bryant </Td> <Td> 000000002006 - 01 - 22 - 0000 January 22 , 2006 </Td> <Td> 14 </Td> <Td> 12 </Td> <Td> 27 </Td> <Td> 28 </Td> <Td> Los Angeles Lakers </Td> <Td> Toronto Raptors </Td> <Td> 122 -- 104 </Td> <Td> 41 : 56 </Td> <Td> 28 </Td> <Td> 46 </Td> <Td> 7 </Td> <Td> 13 </Td> <Td> 18 </Td> <Td> 20 </Td> <Td> </Td> <Td> </Td> </Tr> <Tr> <Td> </Td> <Td> 78 </Td> <Td> Chamberlain , Wilt Wilt Chamberlain * </Td> <Td> 000000001961 - 12 - 08 - 0000 December 8 , 1961 </Td> <Td> -- </Td> <Td> -- </Td> <Td> -- </Td> <Td> -- </Td> <Td> Philadelphia Warriors </Td> <Td> Los Angeles Lakers </Td> <Td> 147 -- 151 </Td> <Td> 63 </Td> <Td> 31 </Td> <Td> 62 </Td> <Td> -- </Td> <Td> -- </Td> <Td> 16 </Td> <Td> 31 </Td> <Td> </Td> <Td> </Td> </Tr> <Tr> <Td> </Td> <Td> 73 </Td> <Td> Chamberlain , Wilt Wilt Chamberlain * </Td> <Td> 000000001962 - 01 - 13 - 0000 January 13 , 1962 </Td> <Td> -- </Td> <Td> -- </Td> <Td> -- </Td> <Td> -- </Td> <Td> Philadelphia Warriors </Td> <Td> Chicago Packers </Td> <Td> 135 -- 117 </Td> <Td> 48 </Td> <Td> 29 </Td> <Td> 48 </Td> <Td> -- </Td> <Td> -- </Td> <Td> 15 </Td> <Td> 25 </Td> <Td> </Td> <Td> </Td> </Tr> <Tr> <Td> 73 </Td> <Td> Chamberlain , Wilt Wilt Chamberlain * </Td> <Td> 000000001962 - 11 - 16 - 0000 November 16 , 1962 </Td> <Td> -- </Td> <Td> -- </Td> <Td> -- </Td> <Td> -- </Td> <Td> San Francisco Warriors </Td> <Td> New York Knicks </Td> <Td> 127 -- 111 </Td> <Td> 48 </Td> <Td> 29 </Td> <Td> 43 </Td> <Td> -- </Td> <Td> -- </Td> <Td> 15 </Td> <Td> 19 </Td> <Td> </Td> <Td> </Td> </Tr> <Tr> <Td> 73 </Td> <Td> Thompson , David David Thompson * </Td> <Td> 000000001978 - 04 - 09 - 0000 April 9 , 1978 </Td> <Td> 32 </Td> <Td> 21 </Td> <Td> 9 </Td> <Td> 11 </Td> <Td> Denver Nuggets </Td> <Td> Detroit Pistons </Td> <Td> 137 -- 139 </Td> <Td> 43 </Td> <Td> 28 </Td> <Td> 38 </Td> <Td> -- </Td> <Td> -- </Td> <Td> 17 </Td> <Td> 20 </Td> <Td> </Td> <Td> </Td> </Tr> <Tr> <Td> 7 </Td> <Td> 72 </Td> <Td> Chamberlain , Wilt Wilt Chamberlain * </Td> <Td> 000000001962 - 11 - 03 - 0000 November 3 , 1962 </Td> <Td> -- </Td> <Td> -- </Td> <Td> -- </Td> <Td> -- </Td> <Td> San Francisco Warriors </Td> <Td> Los Angeles Lakers </Td> <Td> 115 -- 127 </Td> <Td> -- </Td> <Td> 29 </Td> <Td> 48 </Td> <Td> -- </Td> <Td> -- </Td> <Td> 14 </Td> <Td> 18 </Td> <Td> </Td> <Td> </Td> </Tr> <Tr> <Td> 8 </Td> <Td> 71 </Td> <Td> Baylor , Elgin Elgin Baylor * </Td> <Td> 000000001960 - 11 - 15 - 0000 November 15 , 1960 </Td> <Td> -- </Td> <Td> -- </Td> <Td> -- </Td> <Td> -- </Td> <Td> Los Angeles Lakers </Td> <Td> New York Knicks </Td> <Td> 123 -- 108 </Td> <Td> 45 </Td> <Td> 28 </Td> <Td> 48 </Td> <Td> -- </Td> <Td> -- </Td> <Td> 15 </Td> <Td> 18 </Td> <Td> </Td> <Td> </Td> </Tr> <Tr> <Td> 71 </Td> <Td> Robinson , David David Robinson * </Td> <Td> 000000001994 - 04 - 24 - 0000 April 24 , 1994 </Td> <Td> 18 </Td> <Td> 6 </Td> <Td> 19 </Td> <Td> 28 </Td> <Td> San Antonio Spurs </Td> <Td> Los Angeles Clippers </Td> <Td> 112 -- 97 </Td> <Td> 44 </Td> <Td> 26 </Td> <Td> 41 </Td> <Td> </Td> <Td> </Td> <Td> 18 </Td> <Td> 25 </Td> <Td> </Td> <Td> </Td> </Tr> <Tr> <Td> 10 </Td> <Td> 70 </Td> <Td> Chamberlain , Wilt Wilt Chamberlain * </Td> <Td> 000000001963 - 03 -",
    "topic": "Elgin Baylor's 71-point game on November 15, 1960, and its historical context within the development of the NBA.",
    "response": "<document_analysis>\nTo generate a highly insightful and probing question-answer pair, I will carefully analyze the provided context. The context appears to be a table listing the top scoring performances in NBA history, including the player, date, team, opponent, score, and various statistics. \n\nUpon examining the table, I notice that Elgin Baylor's 71-point game on November 15, 1960, is included in the list. This achievement is significant, as it demonstrates Baylor's exceptional scoring ability and his contribution to the development of the NBA.\n\nTo create a challenging question, I will consider the historical context of Baylor's achievement and the evolution of the NBA. I will also look for subtle details and relationships within the provided information that can be used to craft a thought-provoking question.\n\nAfter careful analysis, I have identified a potential question that meets the requirements. The question will require the test-taker to demonstrate a deep understanding of the context and the ability to think critically about the information presented.\n</document_analysis>\n\n<output_format>\nQuestion: What statistical category does Elgin Baylor's 71-point game on November 15, 1960, share with David Robinson's performance on April 24, 1994, in terms of ranking among the top scoring performances in NBA history?\nA: Points per quarter\nB: Free throw percentage\nC: Same ranking in the top 10 scoring performances\nD: Field goal attempts\n\nExplanation: According to the table, both Elgin Baylor's 71-point game and David Robinson's 71-point game are tied for the 8th and 9th highest scoring performances in NBA history, respectively, as there is another 71-point performance listed without a specific ranking, implying a tie in the ranking.\nCorrect Answer: C\n</output_format>",
    "question": "What statistical category does Elgin Baylor's 71-point game on November 15, 1960, share with David Robinson's performance on April 24, 1994, in terms of ranking among the top scoring performances in NBA history?",
    "choices": {
      "A": "Points per quarter",
      "B": "Free throw percentage",
      "C": "Same ranking in the top 10 scoring performances",
      "D": "Field goal attempts"
    },
    "answer": "C",
    "explanation": "According to the table, both Elgin Baylor's 71-point game and David Robinson's 71-point game are tied for the 8th and 9th highest scoring performances in NBA history, respectively, as there is another 71-point performance listed without a specific ranking, implying a tie in the ranking.",
    "question_token_count": 51,
    "answer_correctness_score": 10,
    "explanation_validity_score": 10,
    "question_clarity_score": 7,
    "question_difficulty_score": 6,
    "question_groundedness_score": 10,
    "avg_answer_token_count": 5
  },
  {
    "context": "<P> In the history of the Triple Crown , 13 horses have won all three races : Sir Barton ( 1919 ) , Gallant Fox ( 1930 ) , Omaha ( 1935 ) , War Admiral ( 1937 ) , Whirlaway ( 1941 ) , Count Fleet ( 1943 ) , Assault ( 1946 ) , Citation ( 1948 ) , Secretariat ( 1973 ) , Seattle Slew ( 1977 ) , Affirmed ( 1978 ) , American Pharoah ( 2015 ) , and Justify ( 2018 ) . As of 2018 , American Pharoah and Justify are the only living Triple Crown winners . </P>",
    "topic": "Citation's 1948 Triple Crown win and its significance in the context of horse racing history.",
    "response": "<document_analysis>\nThe provided context discusses the history of the Triple Crown in horse racing, listing the 13 horses that have won all three races. The list includes Citation, which won the Triple Crown in 1948. To generate a highly insightful and probing question-answer pair, we need to consider the significance of Citation's win in the context of horse racing history. \n\nThoughtful content examination reveals that Citation's win is part of a larger narrative of exceptional horses that have achieved this feat. Concept exploration suggests that the question should invite reflection on the broader implications of Citation's win, such as its impact on the sport or its place in the timeline of Triple Crown winners.\n\nStrategic complexity calibration rates the difficulty of the question as an 8 out of 10, ensuring it is challenging for domain experts. Intentional question planning aims to create a question that requires deep understanding and nuanced consideration of Citation's win in the context of horse racing history.\n</document_analysis>\n\n<output_format>\nQuestion: What distinguishes Citation's 1948 Triple Crown win from other winners in the post-World War II era?\nA: It was the first Triple Crown win after the war.\nB: It marked a resurgence of interest in horse racing.\nC: It was the first win by a horse that would go on to sire other Triple Crown winners.\nD: It occurred during a period of dominance by Calumet Farm.\nExplanation: Citation's 1948 Triple Crown win is notable for occurring during a period of dominance by Calumet Farm, which owned and bred Citation. This context adds depth to understanding Citation's achievement.\nCorrect Answer: D\n</output_format>",
    "question": "What distinguishes Citation's 1948 Triple Crown win from other winners in the post-World War II era?",
    "choices": {
      "A": "It was the first Triple Crown win after the war.",
      "B": "It marked a resurgence of interest in horse racing.",
      "C": "It was the first win by a horse that would go on to sire other Triple Crown winners.",
      "D": "It occurred during a period of dominance by Calumet Farm."
    },
    "answer": "D",
    "explanation": "Citation's 1948 Triple Crown win is notable for occurring during a period of dominance by Calumet Farm, which owned and bred Citation. This context adds depth to understanding Citation's achievement.",
    "question_token_count": 22,
    "answer_correctness_score": 8,
    "explanation_validity_score": 8,
    "question_clarity_score": 1,
    "question_difficulty_score": 8,
    "question_groundedness_score": 1,
    "avg_answer_token_count": 14
  },
  {
    "context": "<P> The Super Bowl LII Halftime Show ( officially known as the Pepsi Super Bowl LII Halftime Show ) took place on February 4 , 2018 at U.S. Bank Stadium in Minneapolis , Minnesota , as part of Super Bowl LII . Justin Timberlake was the featured performer , as confirmed by the National Football League ( NFL ) on October 22 , 2017 . It was televised nationally by NBC . </P>",
    "topic": "The cultural and social implications of the Super Bowl Halftime Show, including its potential for artistic expression and controversy.",
    "response": "<document_analysis>\nThe provided context discusses the Super Bowl LII Halftime Show, which took place on February 4, 2018, at U.S. Bank Stadium in Minneapolis, Minnesota. The featured performer was Justin Timberlake, and the event was televised nationally by NBC. To generate a question that inspires thoughtful engagement and reflection, we need to consider the broader cultural and social implications of the Super Bowl Halftime Show. \n\nThe Super Bowl Halftime Show is a significant event that combines sports, music, and entertainment, offering a unique platform for artistic expression. However, it also has the potential for controversy, as it often pushes boundaries and challenges social norms. By examining the intersection of art, culture, and controversy, we can create a question that encourages deeper understanding and insight.\n\nGiven the context, a potential question could explore the ways in which the Super Bowl Halftime Show navigates the fine line between artistic expression and controversy. This could involve considering the role of the performer, the audience, and the broader social context in shaping the event's cultural significance.\n\nThe difficulty level of this question would be around 8 out of 10, as it requires a nuanced understanding of the cultural and social implications of the Super Bowl Halftime Show. To answer this question correctly, one would need to demonstrate a deep understanding of the event's significance and the ways in which it reflects and shapes societal values.\n\nThought process: \n- Identify the key elements of the context: the Super Bowl LII Halftime Show, Justin Timberlake, and the event's cultural significance.\n- Consider the broader implications of the event, including its potential for artistic expression and controversy.\n- Develop a question that encourages thoughtful engagement and reflection, while also requiring a deep understanding of the subject matter.\n</document_analysis>\n\n<output_format>\nQuestion: What role does the Super Bowl Halftime Show play in reflecting and shaping societal values, particularly in terms of its potential for artistic expression and controversy?\nA: It serves as a platform for promoting social justice and activism.\nB: It provides a unique opportunity for artists to challenge social norms and push cultural boundaries.\nC: It has no significant impact on societal values, as it is primarily an entertainment event.\nD: It reinforces traditional values and cultural norms, avoiding controversy and artistic expression.\nExplanation: The correct answer, B, acknowledges the Super Bowl Halftime Show's potential for artistic expression and controversy, while also recognizing its role in shaping societal values. This requires a nuanced understanding of the event's cultural significance and its impact on society.\nCorrect Answer: B\n</output_format>",
    "question": "What role does the Super Bowl Halftime Show play in reflecting and shaping societal values, particularly in terms of its potential for artistic expression and controversy?",
    "choices": {
      "A": "It serves as a platform for promoting social justice and activism.",
      "B": "It provides a unique opportunity for artists to challenge social norms and push cultural boundaries.",
      "C": "It has no significant impact on societal values, as it is primarily an entertainment event.",
      "D": "It reinforces traditional values and cultural norms, avoiding controversy and artistic expression."
    },
    "answer": "B",
    "explanation": "The correct answer, B, acknowledges the Super Bowl Halftime Show's potential for artistic expression and controversy, while also recognizing its role in shaping societal values. This requires a nuanced understanding of the event's cultural significance and its impact on society.",
    "question_token_count": 30,
    "answer_correctness_score": 8,
    "explanation_validity_score": 8,
    "question_clarity_score": 9,
    "question_difficulty_score": 8,
    "question_groundedness_score": 1,
    "avg_answer_token_count": 16
  },
  {
    "context": "<P> The 2018 UEFA Champions League Final was the final match of the 2017 -- 18 UEFA Champions League , the 63rd season of Europe 's premier club football tournament organised by UEFA , and the 26th season since it was renamed from the European Cup to the UEFA Champions League . It was played at the NSC Olimpiyskiy Stadium in Kiev , Ukraine on 26 May 2018 , between Spanish side and defending champions Real Madrid , who had won the competition in each of the last two seasons , and English side Liverpool . </P>",
    "topic": "The impact of the 2018 UEFA Champions League Final on the global perception of European football and its fan base.",
    "response": "<document_analysis>\nThe provided context discusses the 2018 UEFA Champions League Final, highlighting the participating teams, the venue, and the date of the match. To generate a question that encourages deep engagement and reflection, we need to consider the broader implications of this event on the global perception of European football and its fan base. \n\nGiven the context, a thoughtful analysis reveals that the match was a significant event, pitting two prominent European football clubs against each other. However, the context does not explicitly discuss the global perception of European football or its fan base. \n\nTo craft a question that meets the guidelines, we must consider the potential impact of such a high-profile match on the sport's global reputation and fan dynamics. This involves exploring implicit assumptions about how major sporting events influence public perception and fan engagement.\n\nThe difficulty of the question should be rated high (8/10) because it requires the test-taker to think critically about the potential consequences of a significant sporting event on a global scale, rather than simply recalling facts from the context.\n\nThe question should be designed to invite deeper understanding and meaningful reflection on the part of the domain expert, encouraging them to consider various factors that could influence the global perception of European football and its fan base following the 2018 UEFA Champions League Final.\n</document_analysis>\n\n<output_format>\nQuestion: What aspect of the 2018 UEFA Champions League Final would most likely have a lasting impact on the global perception of European football's competitiveness?\nA: The final score and margin of victory\nB: The sportsmanship displayed by the players and staff of both teams\nC: The managerial tactics employed by the two teams\nD: The post-match reactions and statements from the coaches and players\nExplanation: The sportsmanship displayed by the players and staff of both teams can significantly influence how the final is perceived by a global audience, reflecting on the values and conduct of European football. This aspect can contribute to a lasting impression on the sport's competitiveness and reputation.\nCorrect Answer: B\n</output_format>",
    "question": "What aspect of the 2018 UEFA Champions League Final would most likely have a lasting impact on the global perception of European football's competitiveness?",
    "choices": {
      "A": "The final score and margin of victory",
      "B": "The sportsmanship displayed by the players and staff of both teams",
      "C": "The managerial tactics employed by the two teams",
      "D": "The post-match reactions and statements from the coaches and players"
    },
    "answer": "B",
    "explanation": "The sportsmanship displayed by the players and staff of both teams can significantly influence how the final is perceived by a global audience, reflecting on the values and conduct of European football. This aspect can contribute to a lasting impression on the sport's competitiveness and reputation.",
    "question_token_count": 29,
    "answer_correctness_score": 8,
    "explanation_validity_score": 8,
    "question_clarity_score": 6,
    "question_difficulty_score": 7,
    "question_groundedness_score": 2,
    "avg_answer_token_count": 10
  },
  {
    "context": "<P> The seventh season of the fantasy drama television series Game of Thrones premiered on HBO on July 16 , 2017 , and concluded on August 27 , 2017 . Unlike previous seasons that consisted of ten episodes each , the seventh season consisted of only seven . Like the previous season , it largely consisted of original content not found in George R.R. Martin 's A Song of Ice and Fire series , while also incorporating material Martin revealed to showrunners about the upcoming novels in the series . The series was adapted for television by David Benioff and D.B. Weiss . </P>",
    "topic": "The premiere and conclusion dates of the seventh season of Game of Thrones and their potential impact on the series' production and reception.",
    "response": "<document_analysis>\nThe provided context discusses the seventh season of the Game of Thrones series, including its premiere and conclusion dates, the number of episodes, and the adaptation process. To generate a challenging question, we need to delve into the implications of the shortened season and the incorporation of original content. \n\nThoughtful Content Examination: The context highlights the deviation from the standard 10-episode format, with the seventh season consisting of only seven episodes. This change could have significant implications for the series' production and reception. \n\nConcept Exploration: The use of original content not found in George R.R. Martin's A Song of Ice and Fire series, combined with material revealed by Martin about upcoming novels, raises questions about the creative decisions behind the adaptation. \n\nStrategic Complexity Calibration: The question should be rated an 8 out of 10 in terms of difficulty, as it requires an understanding of the series' production and the potential impact of creative decisions on the overall narrative. \n\nIntentional Question Planning: The question should invite discussion on the potential consequences of the shortened season and the incorporation of original content, encouraging the respondent to think critically about the series' development.\n</document_analysis>\n\n<output_format>\nQuestion: What potential narrative consequence might arise from a shortened season of a television series like Game of Thrones, which typically features complex, interconnected storylines?\nA: Reduced character development\nB: Increased plot pacing\nC: Improved audience engagement\nD: Enhanced thematic coherence\n\nExplanation: A shortened season could lead to reduced character development, as the writers might have less time to explore character arcs and backstories. This could impact the overall narrative, making it less engaging for audiences who are invested in the characters' journeys.\n\nCorrect Answer: A\n</output_format>",
    "question": "What potential narrative consequence might arise from a shortened season of a television series like Game of Thrones, which typically features complex, interconnected storylines?",
    "choices": {
      "A": "Reduced character development",
      "B": "Increased plot pacing",
      "C": "Improved audience engagement",
      "D": "Enhanced thematic coherence"
    },
    "answer": "A",
    "explanation": "A shortened season could lead to reduced character development, as the writers might have less time to explore character arcs and backstories. This could impact the overall narrative, making it less engaging for audiences who are invested in the characters' journeys.",
    "question_token_count": 29,
    "answer_correctness_score": 9,
    "explanation_validity_score": 9,
    "question_clarity_score": 8,
    "question_difficulty_score": 6,
    "question_groundedness_score": 6,
    "avg_answer_token_count": 4
  },
  {
    "context": "<P> Article Five of the United States Constitution describes the process whereby the Constitution , the nation 's frame of government , may be altered . Altering the Constitution consists of proposing an amendment or amendments and subsequent ratification . Amendments may be proposed either by the Congress with a two - thirds vote in both the House of Representatives and the Senate or by a convention of states called for by two - thirds of the state legislatures . To become part of the Constitution , an amendment must be ratified by either -- as determined by Congress -- the legislatures of three - quarters of the states or state ratifying conventions in three - quarters of the states . The vote of each state ( to either ratify or reject a proposed amendment ) carries equal weight , regardless of a state 's population or length of time in the Union . </P>",
    "topic": "The importance of achieving a broad consensus for constitutional changes, as reflected in the requirement for widespread support among the states.",
    "response": "<document_analysis>\nThe provided context discusses the process of altering the United States Constitution, as outlined in Article Five. It highlights two methods for proposing amendments: either through a two-thirds vote in both the House of Representatives and the Senate, or by a convention of states called for by two-thirds of the state legislatures. The ratification process requires either the legislatures of three-quarters of the states or state ratifying conventions in three-quarters of the states to approve the amendment. Notably, each state's vote carries equal weight, regardless of its population or time in the Union.\n\nThe importance of achieving a broad consensus for constitutional changes is reflected in the requirement for widespread support among the states. This ensures that any changes to the Constitution are thoroughly considered and accepted by a significant majority of the states, thereby promoting stability and cohesion within the federal system.\n\nUpon analyzing the context, it becomes clear that the process of altering the Constitution is designed to be deliberate and challenging, requiring substantial agreement among the states. This thoughtful and complex process is intended to safeguard the Constitution's integrity and prevent hasty or ill-considered changes.\n\nGiven the context, a question that encourages deep engagement and nuanced understanding could focus on the implications of the ratification process on the federal system. Specifically, it could explore how the equal weight given to each state's vote affects the balance of power between larger and smaller states.\n\nThought_process: The question should be designed to challenge domain experts to think critically about the consequences of the ratification process on the federal system. It should require an understanding of the potential implications of giving equal weight to each state's vote, regardless of its population or time in the Union. The correct answer should demonstrate a deep understanding of the subject matter and the ability to analyze complex relationships between the states and the federal government.\n</document_analysis>\n\n<output_format>\nQuestion: What is the primary consequence of giving equal weight to each state's vote in the ratification process of constitutional amendments?\nA: It ensures that larger states dominate the decision-making process.\nB: It promotes a more direct form of democracy, where the will of the majority prevails.\nC: It safeguards the interests of smaller states and prevents larger states from imposing their will.\nD: It renders the ratification process ineffective, as states with smaller populations can block amendments.\n\nExplanation: The correct answer, C, highlights the importance of protecting the interests of smaller states in the federal system. By giving each state an equal vote, the Constitution ensures that smaller states have a significant voice in the ratification process, preventing larger states from dominating the decision-making process.\n\nCorrect Answer: C\n</output_format>",
    "question": "What is the primary consequence of giving equal weight to each state's vote in the ratification process of constitutional amendments?",
    "choices": {
      "A": "It ensures that larger states dominate the decision-making process.",
      "B": "It promotes a more direct form of democracy, where the will of the majority prevails.",
      "C": "It safeguards the interests of smaller states and prevents larger states from imposing their will.",
      "D": "It renders the ratification process ineffective, as states with smaller populations can block amendments."
    },
    "answer": "C",
    "explanation": "The correct answer, C, highlights the importance of protecting the interests of smaller states in the federal system. By giving each state an equal vote, the Constitution ensures that smaller states have a significant voice in the ratification process, preventing larger states from dominating the decision-making process.",
    "question_token_count": 23,
    "answer_correctness_score": 10,
    "explanation_validity_score": 10,
    "question_clarity_score": 8,
    "question_difficulty_score": 7,
    "question_groundedness_score": 10,
    "avg_answer_token_count": 16
  },
  {
    "context": "<P> The Astros played in the NL from 1962 to 2012 . They played in the West Division from 1969 to 1993 , and the Central Division from 1994 to 2012 . While a member of the NL , the Astros played in one World Series , in 2005 , against the Chicago White Sox , in which they were swept in four games . In 2017 , they became the first franchise in MLB history to have won a pennant in both the NL and the AL , when they defeated the New York Yankees in the ALCS . They subsequently won the 2017 World Series against the Los Angeles Dodgers , winning four games to three , earning the team , and Texas , its first World Series title . </P>",
    "topic": "The postseason performance of the Astros, focusing on their World Series appearances, including the 2005 loss to the Chicago White Sox and the 2017 win against the Los Angeles Dodgers.",
    "response": "<document_analysis>\nThe context provided focuses on the postseason performance of the Astros, specifically their World Series appearances. The key points mentioned include their loss to the Chicago White Sox in 2005 and their win against the Los Angeles Dodgers in 2017. Additionally, it notes the Astros' transition from the National League (NL) to the American League (AL) and their achievement of being the first franchise to win a pennant in both leagues. \n\nGiven the information, a thoughtful and challenging question would require the synthesis of the Astros' history, their performance in significant postseason games, and the implications of their league transition. The question should be designed to test a domain expert's knowledge of the team's historical milestones, their ability to analyze the impact of league changes on team performance, and their understanding of the broader context of MLB history.\n\nThe difficulty level of the question should be high (rating: 8/10) to ensure it challenges even the most knowledgeable domain experts. The question should avoid obvious answers and instead require a nuanced understanding of the Astros' postseason history and the significance of their achievements.\n\nThought_process: The question generation process involves identifying the central theme of the context, which is the Astros' postseason performance and their World Series appearances. It also requires considering the implicit details, such as the team's transition from the NL to the AL and the historical significance of their wins and losses. The goal is to craft a question that not only tests knowledge of these events but also encourages deeper reflection on their importance within the context of MLB history.\n</document_analysis>\n\n<output_format>\nQuestion: What distinction did the Astros achieve in 2017 that reflected their successful transition from the National League to the American League?\nA: Becoming the first team to win a World Series in both leagues in the same year.\nB: Being the first franchise in MLB history to have won a pennant in both the NL and the AL.\nC: Winning the most games in a season after a league transition.\nD: Having the longest postseason drought after switching leagues.\nExplanation: The correct answer requires an understanding of the Astros' historical achievement in 2017, which was a direct result of their transition from the NL to the AL. This distinction highlights their adaptability and success in a new league, making it a significant milestone in their history.\nCorrect Answer: B\n</output_format>",
    "question": "What distinction did the Astros achieve in 2017 that reflected their successful transition from the National League to the American League?",
    "choices": {
      "A": "Becoming the first team to win a World Series in both leagues in the same year.",
      "B": "Being the first franchise in MLB history to have won a pennant in both the NL and the AL.",
      "C": "Winning the most games in a season after a league transition.",
      "D": "Having the longest postseason drought after switching leagues."
    },
    "answer": "B",
    "explanation": "The correct answer requires an understanding of the Astros' historical achievement in 2017, which was a direct result of their transition from the NL to the AL. This distinction highlights their adaptability and success in a new league, making it a significant milestone in their history.",
    "question_token_count": 26,
    "answer_correctness_score": 10,
    "explanation_validity_score": 9,
    "question_clarity_score": 8,
    "question_difficulty_score": 6,
    "question_groundedness_score": 10,
    "avg_answer_token_count": 16
  },
  {
    "context": "<P> Super Bowl LII was an American football game played to determine the champion of the National Football League ( NFL ) for the 2017 season . The National Football Conference ( NFC ) champion Philadelphia Eagles defeated the American Football Conference ( AFC ) and defending Super Bowl LI champion New England Patriots , 41 -- 33 , to win their first Super Bowl and their first NFL title since 1960 . The game was played on February 4 , 2018 , at U.S. Bank Stadium in Minneapolis , Minnesota . This was the second time that a Super Bowl was played in Minneapolis , the northernmost city to ever host the event , after Super Bowl XXVI at the Metrodome during the 1991 season , and the sixth Super Bowl held in a cold - weather city . </P>",
    "topic": "The Eagles' drought of NFL titles before winning Super Bowl LII, and the significance of their win in 2018.",
    "response": "<document_analysis>\nTo generate a highly insightful and probing question-answer pair, I will conduct a careful analysis of the provided context. The central idea of the context is the Philadelphia Eagles' win in Super Bowl LII, which was their first Super Bowl title and their first NFL title since 1960. The context also provides information about the game, such as the score, the date, and the location.\n\nThe key concepts in this context are the Eagles' drought of NFL titles, the significance of their win in 2018, and the details of the game. To create a challenging question, I will consider the implicit assumptions and subtle details in the context. For example, the context mentions that the Eagles' win was their first NFL title since 1960, which implies a long drought. The context also mentions that the game was played in a cold-weather city, which could be relevant to the conditions of the game.\n\nTo calibrate the difficulty of the question, I will rate it a 9 out of 10, as it requires a deep understanding of the context and the ability to analyze the information critically. The question should invite deeper understanding, meaningful reflection, or critical engagement, and should be purposeful in its design.\n\nAfter careful consideration, I have decided to generate a question that requires the synthesis of high-level general understanding above and beyond the specific context. The question will be analytical, requiring the test-taker to think critically about the information provided.\n\n</document_analysis>\n\n<output_format>\nQuestion: What was the significance of the Eagles' Super Bowl LII win in terms of their franchise history?\nA: It was their first Super Bowl win, but not their first NFL title.\nB: It ended a 58-year drought without an NFL title.\nC: It was their second Super Bowl win in a row.\nD: It marked the beginning of a dynasty in the NFL.\n\nExplanation: The correct answer is B) It ended a 58-year drought without an NFL title. This is because the context states that the Eagles' win in Super Bowl LII was their first NFL title since 1960, which implies a long drought. The other options are incorrect because they do not accurately reflect the information provided in the context.\n\nCorrect Answer: B\n</output_format>",
    "question": "What was the significance of the Eagles' Super Bowl LII win in terms of their franchise history?",
    "choices": {
      "A": "It was their first Super Bowl win, but not their first NFL title.",
      "B": "It ended a 58-year drought without an NFL title.",
      "C": "It was their second Super Bowl win in a row.",
      "D": "It marked the beginning of a dynasty in the NFL."
    },
    "answer": "B",
    "explanation": "The correct answer is B) It ended a 58-year drought without an NFL title. This is because the context states that the Eagles' win in Super Bowl LII was their first NFL title since 1960, which implies a long drought. The other options are incorrect because they do not accurately reflect the information provided in the context.",
    "question_token_count": 21,
    "answer_correctness_score": 10,
    "explanation_validity_score": 10,
    "question_clarity_score": 8,
    "question_difficulty_score": 6,
    "question_groundedness_score": 10,
    "avg_answer_token_count": 13
  },
  {
    "context": "<P> The Super Bowl LII Halftime Show ( officially known as the Pepsi Super Bowl LII Halftime Show ) took place on February 4 , 2018 at U.S. Bank Stadium in Minneapolis , Minnesota , as part of Super Bowl LII . Justin Timberlake was the featured performer , as confirmed by the National Football League ( NFL ) on October 22 , 2017 . It was televised nationally by NBC . </P>",
    "topic": "The economic impact of hosting the Super Bowl and its associated events, such as the Halftime Show, on the host city.",
    "response": "<document_analysis>\nTo generate a question that probes the domain expert's understanding of the economic impact of hosting the Super Bowl and its associated events, such as the Halftime Show, on the host city, we need to carefully analyze the given context. Although the provided context primarily focuses on the specifics of the Super Bowl LII Halftime Show, including the performer, date, location, and broadcaster, it lacks direct information on the economic impact. \n\nHowever, we can infer that hosting such a large-scale event as the Super Bowl, including its Halftime Show, would have significant economic implications for the host city, such as Minneapolis in this case. These implications could include increased revenue from tourism, potential job creation in the service and hospitality sectors, and investments in infrastructure to accommodate the event.\n\nGiven the context's lack of explicit economic data, a thoughtful question would encourage the domain expert to think critically about the broader economic effects of hosting the Super Bowl and its associated events, considering both direct and indirect impacts.\n\nThe difficulty level of the question should be high (8-10) to challenge even the smartest domain experts, requiring them to synthesize general knowledge about large event economics with the specifics implied by the context.\n\nThus, the question should be designed to invite a deep understanding and reflection on the economic dynamics at play when a city hosts an event of the Super Bowl's magnitude.\n</document_analysis>\n\n<output_format>\nQuestion: What is a primary economic benefit that host cities like Minneapolis often experience as a result of hosting large events such as the Super Bowl?\nA: Increased local tax revenue from event-related sales\nB: Long-term decline in property values near the event venue\nC: Permanent relocation of businesses to the host city\nD: Reduction in city budget allocations for public services\n\nExplanation: Hosting the Super Bowl can bring in significant revenue for the host city through various channels, including event-related sales, which are subject to local taxes. This increase in tax revenue can be a substantial economic benefit, contributing to the city's budget and potentially supporting local projects and services.\n\nCorrect Answer: A\n</output_format>",
    "question": "What is a primary economic benefit that host cities like Minneapolis often experience as a result of hosting large events such as the Super Bowl?",
    "choices": {
      "A": "Increased local tax revenue from event-related sales",
      "B": "Long-term decline in property values near the event venue",
      "C": "Permanent relocation of businesses to the host city",
      "D": "Reduction in city budget allocations for public services"
    },
    "answer": "A",
    "explanation": "Hosting the Super Bowl can bring in significant revenue for the host city through various channels, including event-related sales, which are subject to local taxes. This increase in tax revenue can be a substantial economic benefit, contributing to the city's budget and potentially supporting local projects and services.",
    "question_token_count": 27,
    "answer_correctness_score": 9,
    "explanation_validity_score": 9,
    "question_clarity_score": 8,
    "question_difficulty_score": 6,
    "question_groundedness_score": 1,
    "avg_answer_token_count": 9
  },
  {
    "context": "<P> A player has taken two hat - tricks in the same Test match only once . Playing for Australia against South Africa in the first match of the 1912 Triangular Tournament at Old Trafford , Manchester , England , leg spinner Jimmy Matthews took a hat - trick in South Africa 's first and second innings , both taken on 28 May 1912 . He completed both hat - tricks by dismissing South Africa 's Tommy Ward . Only three other cricketers have taken more than one Test hat - trick : Australian off spinner Hugh Trumble ( two years apart , between the same teams at the same ground ) , Pakistani fast bowler Wasim Akram ( just over a week apart , in consecutive matches between the same teams ) and English fast bowler Stuart Broad . Three players have taken a hat - trick on their Test debut : English medium pace bowler Maurice Allom in 1930 , New Zealand off - spinner Peter Petherick in 1976 , and Australian pace bowler Damien Fleming in 1994 . Geoff Griffin took the fewest total Test wickets of any player who recorded a hat - trick , taking only eight wickets in his entire Test career . During the match in which he took his hat - trick , Griffin was repeatedly called for throwing by the umpires and never bowled again in a Test match . Australian Peter Siddle is the only bowler to take a hat - trick on his birthday , and Bangladeshi off spinner Sohag Gazi is the only player to score a century and take a hat - trick in the same Test match . </P>",
    "topic": "The challenges and implications of being called for throwing, as experienced by Geoff Griffin during his Test career.",
    "response": "<document_analysis>\nThe provided context discusses various records and achievements related to hat-tricks in Test cricket, including the feat of taking two hat-tricks in the same match, achieved by Jimmy Matthews. It also mentions other notable instances, such as players taking hat-tricks on their Test debut or achieving unusual combinations like scoring a century and taking a hat-trick in the same match. However, the question topic specifically asks about Geoff Griffin's experience with being called for throwing during his Test career. The context reveals that Geoff Griffin took the fewest total Test wickets of any player who recorded a hat-trick, with only eight wickets, and was notably called for throwing by umpires during the match in which he took his hat-trick, never bowling again in a Test match. This information is crucial for understanding the challenges and implications Griffin faced.\n\nGiven the specific topic and the information provided in the context, the question should delve into the implications of being called for throwing on a player's career, using Geoff Griffin's experience as a reference point. The question should encourage deep reflection on the potential consequences of such actions on a player's ability to continue their career, especially considering the extreme case of Griffin, who never bowled again in a Test match after being called for throwing.\n\nThe difficulty level of the question should be high (rating: 8/10) to challenge domain experts and encourage a nuanced understanding of the subject matter. The question should be self-contained, requiring no external references, and should naturally integrate the content without giving away the answer.\n\nThoughtfully considering the implications of being called for throwing on a player's career, and reflecting on Geoff Griffin's unique situation, leads to the generation of a question that probes the expert's understanding of the potential long-term effects of such incidents on a player's career trajectory and psychological state.\n</document_analysis>\n\n<output_format>\nQuestion: What significant career consequence did Geoff Griffin face immediately following his hat-trick in Test cricket, which distinguishes his case from other players who have achieved hat-tricks?\nA: He was awarded a special contract for his performance.\nB: He was called for throwing and never bowled again in a Test match.\nC: He suffered a career-ending injury during the match.\nD: He decided to retire voluntarily after achieving the hat-trick.\nExplanation: The correct answer reflects the information given in the context about Geoff Griffin's experience, highlighting the severe and immediate impact of being called for throwing on his ability to continue bowling in Test cricket.\nCorrect Answer: B\n</output_format>",
    "question": "What significant career consequence did Geoff Griffin face immediately following his hat-trick in Test cricket, which distinguishes his case from other players who have achieved hat-tricks?",
    "choices": {
      "A": "He was awarded a special contract for his performance.",
      "B": "He was called for throwing and never bowled again in a Test match.",
      "C": "He suffered a career-ending injury during the match.",
      "D": "He decided to retire voluntarily after achieving the hat-trick."
    },
    "answer": "B",
    "explanation": "The correct answer reflects the information given in the context about Geoff Griffin's experience, highlighting the severe and immediate impact of being called for throwing on his ability to continue bowling in Test cricket.",
    "question_token_count": 33,
    "answer_correctness_score": 10,
    "explanation_validity_score": 10,
    "question_clarity_score": 6,
    "question_difficulty_score": 7,
    "question_groundedness_score": 10,
    "avg_answer_token_count": 13
  },
  {
    "context": "<Table> <Tr> <Th colspan=\"2\"> Philadelphia Eagles </Th> </Tr> <Tr> <Td colspan=\"2\"> Current season </Td> </Tr> <Tr> <Td colspan=\"2\"> Established July 8 , 1933 ; 84 years ago ( July 8 , 1933 ) First season : 1933 Play in Lincoln Financial Field Philadelphia , Pennsylvania Headquartered in the NovaCare Complex Philadelphia , Pennsylvania </Td> </Tr> <Tr> <Th colspan=\"2\"> </Th> </Tr> <Tr> <Td colspan=\"2\"> <Table> <Tr> <Td> </Td> <Td> </Td> </Tr> <Tr> <Td> Logo </Td> <Td> Wordmark </Td> </Tr> </Table> </Td> </Tr> <Tr> <Th colspan=\"2\"> League / conference affiliations </Th> </Tr> <Tr> <Td colspan=\"2\"> <P> National Football League ( 1933 -- present ) </P> <Ul> <Li> Eastern Division ( 1933 -- 1949 ) </Li> <Li> American Conference ( 1950 -- 1952 ) </Li> <Li> Eastern Conference ( 1953 -- 1969 ) <Ul> <Li> Capitol Division ( 1967 -- 1969 ) </Li> </Ul> </Li> <Li> National Football Conference ( 1970 -- present ) <Ul> <Li> NFC East ( 1970 -- present ) </Li> </Ul> </Li> </Ul> </Td> </Tr> <Tr> <Td colspan=\"2\"> Current uniform </Td> </Tr> <Tr> <Td colspan=\"2\"> </Td> </Tr> <Tr> <Th> Team colors </Th> <Td> <P> Midnight green , Silver , Black , White </P> </Td> </Tr> <Tr> <Th> Fight song </Th> <Td> Fly , Eagles Fly </Td> </Tr> <Tr> <Th> Mascot </Th> <Td> Swoop </Td> </Tr> <Tr> <Th colspan=\"2\"> Personnel </Th> </Tr> <Tr> <Th> Owner ( s ) </Th> <Td> Jeffrey Lurie Christina Weiss Lurie </Td> </Tr> <Tr> <Th> Chairman </Th> <Td> Jeffrey Lurie </Td> </Tr> <Tr> <Th> CEO </Th> <Td> Jeffrey Lurie </Td> </Tr> <Tr> <Th> President </Th> <Td> Don Smolenski </Td> </Tr> <Tr> <Th> General manager </Th> <Td> Howie Roseman </Td> </Tr> <Tr> <Th> Head coach </Th> <Td> Doug Pederson </Td> </Tr> <Tr> <Th colspan=\"2\"> Team history </Th> </Tr> <Tr> <Td colspan=\"2\"> <Ul> <Li> Philadelphia Eagles ( 1933 -- 1942 ; 1944 -- present ) </Li> <Li> Phil - Pitt `` Steagles '' ( 1943 ) </Li> </Ul> </Td> </Tr> <Tr> <Th colspan=\"2\"> Team nicknames </Th> </Tr> <Tr> <Td colspan=\"2\"> <Ul> <Li> The Birds </Li> </Ul> </Td> </Tr> <Tr> <Th colspan=\"2\"> Championships </Th> </Tr> <Tr> <Td colspan=\"2\"> <P> League championships ( 4 ) </P> <Ul> <Li> NFL championships ( pre-1970 AFL -- NFL merger ) ( 3 ) 1948 , 1949 , 1960 </Li> </Ul> <Ul> <Li> Super Bowl championships ( 1 ) 2017 ( LII ) </Li> </Ul> </Td> </Tr> <Tr> <Td colspan=\"2\"> <P> Conference championships ( 4 ) </P> <Ul> <Li> NFL Eastern : 1960 </Li> <Li> NFC : 1980 , 2004 , 2017 </Li> </Ul> </Td> </Tr> <Tr> <Td colspan=\"2\"> <P> Division championships ( 13 ) </P> <Ul> <Li> NFL East : 1947 , 1948 , 1949 </Li> <Li> NFC East : 1980 , 1988 , 2001 , 2002 , 2003 , 2004 , 2006 , 2010 , 2013 , 2017 </Li> </Ul> </Td> </Tr> <Tr> <Th colspan=\"2\"> Playoff appearances ( 25 ) </Th> </Tr> <Tr> <Td colspan=\"2\"> <Ul> <Li> NFL : 1947 , 1948 , 1949 , 1960 , 1978 , 1979 , 1980 , 1981 , 1988 , 1989 , 1990 , 1992 , 1995 , 1996 , 2000 , 2001 , 2002 , 2003 , 2004 , 2006 , 2008 , 2009 , 2010 , 2013 , 2017 </Li> </Ul> </Td> </Tr> <Tr> <Th colspan=\"2\"> Home fields </Th> </Tr> <Tr> <Td colspan=\"2\"> <Ul> <Li> Baker Bowl ( 1933 -- 1935 ) </Li> <Li> Philadelphia Municipal Stadium ( 1936 -- 1939 , 1941 ) </Li> <Li> Connie Mack Stadium ( 1940 , 1942 -- 1957 ) </Li> <Li> Franklin Field ( 1958 -- 1970 ) </Li> <Li> Veterans Stadium ( 1971 -- 2002 ) </Li> <Li> Lincoln Financial Field ( 2003 -- present ) </Li> </Ul> </Td> </Tr> </Table>",
    "topic": "The team colors, fight song, and mascot of the Philadelphia Eagles, and their significance in the team's identity and brand.",
    "response": "<document_analysis>\nTo generate a highly insightful and probing question-answer pair, a careful analysis of the provided context is necessary. The context provides detailed information about the Philadelphia Eagles, including their team colors, fight song, mascot, league/conference affiliations, personnel, team history, championships, and home fields.\n\nThe team colors are listed as Midnight green, Silver, Black, and White. The fight song is \"Fly, Eagles Fly,\" and the mascot is Swoop. This information is crucial in understanding the team's identity and brand.\n\nUpon examining the context, it becomes clear that the question should focus on the significance of the team's colors, fight song, and mascot in their overall identity and brand. This requires a deep understanding of the team's history, values, and traditions.\n\nThe question should be designed to encourage thoughtful engagement, critical reflection, and nuanced understanding. It should be highly challenging, even for domain experts, and require the synthesis of high-level general understanding beyond the specific context.\n\nAfter careful consideration, a question that meets these criteria can be formulated.\n</document_analysis>\n\n<output_format>\nQuestion: What role do the team colors, fight song, and mascot play in reinforcing the Philadelphia Eagles' brand identity and tradition, and how do these elements contribute to the team's distinct character and fan culture?\nA: They are merely superficial aspects with no significant impact on the team's brand or tradition.\nB: They serve as a nostalgic reminder of the team's history and are primarily used for marketing purposes.\nC: They are integral components that embody the team's values, spirit, and personality, fostering a sense of community and loyalty among fans.\nD: They are interchangeable with those of other teams and do not hold any particular significance in the NFL.\n\nExplanation: The correct answer, C, recognizes the importance of the team colors, fight song, and mascot in shaping the Philadelphia Eagles' brand identity and tradition. These elements are not just superficial aspects but are deeply ingrained in the team's history, values, and culture. They contribute to the team's distinct character and play a significant role in fostering a sense of community and loyalty among fans.\n\nCorrect Answer: C\n</output_format>",
    "question": "What role do the team colors, fight song, and mascot play in reinforcing the Philadelphia Eagles' brand identity and tradition, and how do these elements contribute to the team's distinct character and fan culture?",
    "choices": {
      "A": "They are merely superficial aspects with no significant impact on the team's brand or tradition.",
      "B": "They serve as a nostalgic reminder of the team's history and are primarily used for marketing purposes.",
      "C": "They are integral components that embody the team's values, spirit, and personality, fostering a sense of community and loyalty among fans.",
      "D": "They are interchangeable with those of other teams and do not hold any particular significance in the NFL."
    },
    "answer": "C",
    "explanation": "The correct answer, C, recognizes the importance of the team colors, fight song, and mascot in shaping the Philadelphia Eagles' brand identity and tradition. These elements are not just superficial aspects but are deeply ingrained in the team's history, values, and culture. They contribute to the team's distinct character and play a significant role in fostering a sense of community and loyalty among fans.",
    "question_token_count": 41,
    "answer_correctness_score": 10,
    "explanation_validity_score": 10,
    "question_clarity_score": 8,
    "question_difficulty_score": 7,
    "question_groundedness_score": 6,
    "avg_answer_token_count": 20
  },
  {
    "context": "<P> The flag of the United States of America , often referred to as the American flag , is the national flag of the United States . It consists of thirteen equal horizontal stripes of red ( top and bottom ) alternating with white , with a blue rectangle in the canton ( referred to specifically as the `` union '' ) bearing fifty small , white , five - pointed stars arranged in nine offset horizontal rows , where rows of six stars ( top and bottom ) alternate with rows of five stars . The 50 stars on the flag represent the 50 states of the United States of America , and the 13 stripes represent the thirteen British colonies that declared independence from the Kingdom of Great Britain , and became the first states in the U.S. Nicknames for the flag include The Stars and Stripes , Old Glory , and The Star - Spangled Banner . </P>",
    "topic": "The composition of the United States flag, including the significance of its thirteen horizontal stripes and fifty white stars.",
    "response": "<document_analysis>\nThe provided context describes the composition and significance of the United States flag. It mentions the thirteen horizontal stripes, the blue rectangle in the canton with fifty white stars, and explains that the stripes represent the original thirteen British colonies and the stars represent the fifty states of the United States. The context also provides nicknames for the flag. \n\nUpon careful analysis, it is clear that the context provides a detailed description of the flag's design and its symbolic meaning. The information about the stripes and stars is central to understanding the flag's composition and significance. \n\nThe question should invite deeper understanding and critical engagement with the content. Considering the implicit assumptions and subtle details, a potential question could explore the relationship between the number of stripes and stars and their historical significance. \n\nGiven the context, a challenging question would be one that requires the synthesis of general understanding and specific knowledge about the flag's design and history. \n\nThe difficulty rating for this question would be around 8 out of 10, as it requires a deep understanding of the flag's composition and its symbolic meaning. \n\nThe question planning involves creating a question that is purposeful and encourages meaningful reflection. \n\nIn terms of irrelevant or bogus information, there is no explicit irrelevant content in the provided context. However, the nicknames for the flag, while interesting, are not central to understanding the flag's composition and significance. \n\nThe decision criteria for question generation are met, as the provided context contains meaningful and coherent content. \n\nThe rationale for including or excluding content is based on its relevance to the flag's composition and significance. \n\nThe question should be self-contained, clear, and concise, with sufficient context for a domain expert to answer without referencing the original context.\n</document_analysis>\n\n<output_format>\nQuestion: What historical event is symbolically represented by the thirteen horizontal stripes on the United States flag?\nA: The signing of the Declaration of Independence\nB: The original thirteen British colonies declaring independence from the Kingdom of Great Britain\nC: The ratification of the United States Constitution\nD: The end of the American Civil War\n\nExplanation: The thirteen horizontal stripes on the United States flag represent the thirteen British colonies that declared independence from the Kingdom of Great Britain, which became the first states in the U.S.\n\nCorrect Answer: B\n</output_format>",
    "question": "What historical event is symbolically represented by the thirteen horizontal stripes on the United States flag?",
    "choices": {
      "A": "The signing of the Declaration of Independence",
      "B": "The original thirteen British colonies declaring independence from the Kingdom of Great Britain",
      "C": "The ratification of the United States Constitution",
      "D": "The end of the American Civil War"
    },
    "answer": "B",
    "explanation": "The thirteen horizontal stripes on the United States flag represent the thirteen British colonies that declared independence from the Kingdom of Great Britain, which became the first states in the U.S.",
    "question_token_count": 19,
    "answer_correctness_score": 10,
    "explanation_validity_score": 10,
    "question_clarity_score": 8,
    "question_difficulty_score": 4,
    "question_groundedness_score": 10,
    "avg_answer_token_count": 9
  },
  {
    "context": "<P> The Pittsburgh Steelers ( 6 -- 2 ) have won the most Super Bowls with six championships , while the New England Patriots ( 5 -- 5 ) , the Dallas Cowboys ( 5 -- 3 ) , and the San Francisco 49ers ( 5 -- 1 ) have five wins . New England has the most Super Bowl appearances with ten , while the Buffalo Bills ( 0 -- 4 ) have the most consecutive appearances with four ( all losses ) from 1990 to 1993 . The Miami Dolphins are the only other team to have at least three consecutive appearances : 1972 -- 1974 . The Denver Broncos ( 3 -- 5 ) and Patriots have each lost a record five Super Bowls . The Minnesota Vikings ( 0 -- 4 ) and the Bills have lost four . The record for consecutive wins is two and is shared by seven franchises : the Green Bay Packers ( 1966 -- 1967 ) , the Miami Dolphins ( 1972 -- 1973 ) , the Pittsburgh Steelers ( 1974 -- 1975 and 1978 -- 1979 , the only team to accomplish this feat twice ) , the San Francisco 49ers ( 1988 -- 1989 ) , the Dallas Cowboys ( 1992 -- 1993 ) , the Denver Broncos ( 1997 -- 1998 ) , and the New England Patriots ( 2003 -- 2004 ) . Among those , Dallas ( 1992 -- 1993 ; 1995 ) and New England ( 2001 ; 2003 -- 2004 ) are the only teams to win three out of four consecutive Super Bowls . The 1972 Dolphins capped off the only perfect season in NFL history with their victory in Super Bowl VII . The only team with multiple Super Bowl appearances and no losses is the Baltimore Ravens , who in winning Super Bowl XLVII defeated and replaced the 49ers in that position . Four current NFL teams have never appeared in a Super Bowl , including franchise relocations and renaming : the Cleveland Browns , Detroit Lions , Jacksonville Jaguars , and Houston Texans , though both the Browns ( 1964 ) and Lions ( 1957 ) had won NFL championship games prior to the creation of the Super Bowl . </P>",
    "topic": "The Baltimore Ravens are the only team with multiple Super Bowl appearances and no losses, having won Super Bowl XLVII.",
    "response": "<document_analysis>\nThe provided context discusses the history of Super Bowl appearances and wins among NFL teams. It highlights the teams with the most Super Bowl wins, appearances, and consecutive wins or losses. The Baltimore Ravens are mentioned as the only team with multiple Super Bowl appearances and no losses, having won Super Bowl XLVII. \n\nUpon analyzing the context, it becomes clear that the statement about the Baltimore Ravens in the question topic is incorrect. The context actually states that the Baltimore Ravens, who won Super Bowl XLVII, defeated and replaced the 49ers in the position of being the team with multiple Super Bowl appearances and no losses, implying the 49ers had this distinction before the Ravens' win. However, this information is not directly relevant to generating a question that probes domain expert knowledge about the context provided.\n\nTo generate a challenging question, we need to focus on the details provided in the context about Super Bowl history, team performances, and records. A question that requires the synthesis of high-level general understanding and is very difficult to answer correctly, even for the smartest domain experts, would be ideal.\n\nThoughtful engagement with the content reveals that the context provides a wealth of information about Super Bowl wins, losses, and team records. A question that encourages deep understanding and insight into these records, and requires a domain expert to critically reflect on the implications of the provided information, would be appropriate.\n\nGiven the complexity and the need for a high level of difficulty, a question that asks about the records of Super Bowl appearances and wins, and requires the application of the information provided in the context to arrive at a correct answer, would be suitable.\n\nThe question should be self-contained, clear, and conversational, with answer options that are plausible and reasonable, yet challenging to distinguish from one another. The correct answer should be verifiable from the context, and the explanation should provide a brief justification for why the answer is correct.\n\nConsidering these guidelines, a potential question could explore the unique achievements of teams in the Super Bowl era, requiring the domain expert to demonstrate a deep understanding of the context and its implications.\n</document_analysis>\n\n<output_format>\nQuestion: Which team has achieved the feat of winning three out of four consecutive Super Bowls, a distinction shared by only two teams in the NFL?\nA: Dallas Cowboys and New England Patriots\nB: Pittsburgh Steelers and Green Bay Packers\nC: San Francisco 49ers and Denver Broncos\nD: Miami Dolphins and Minnesota Vikings\nExplanation: The correct answer can be inferred from the context, which mentions that among the teams that have won consecutive Super Bowls, Dallas and New England are the only teams to win three out of four consecutive Super Bowls.\nCorrect Answer: A\n</output_format>",
    "question": "Which team has achieved the feat of winning three out of four consecutive Super Bowls, a distinction shared by only two teams in the NFL?",
    "choices": {
      "A": "Dallas Cowboys and New England Patriots",
      "B": "Pittsburgh Steelers and Green Bay Packers",
      "C": "San Francisco 49ers and Denver Broncos",
      "D": "Miami Dolphins and Minnesota Vikings"
    },
    "answer": "A",
    "explanation": "The correct answer can be inferred from the context, which mentions that among the teams that have won consecutive Super Bowls, Dallas and New England are the only teams to win three out of four consecutive Super Bowls.",
    "question_token_count": 29,
    "answer_correctness_score": 10,
    "explanation_validity_score": 10,
    "question_clarity_score": 6,
    "question_difficulty_score": 5,
    "question_groundedness_score": 10,
    "avg_answer_token_count": 8
  },
  {
    "context": "<P> Super Bowl LII was an American football game played to determine the champion of the National Football League ( NFL ) for the 2017 season . The National Football Conference ( NFC ) champion Philadelphia Eagles defeated the American Football Conference ( AFC ) and defending Super Bowl LI champion New England Patriots , 41 -- 33 , to win their first Super Bowl and their first NFL title since 1960 . The game was played on February 4 , 2018 , at U.S. Bank Stadium in Minneapolis , Minnesota . This was the second time that a Super Bowl was played in Minneapolis , the northernmost city to ever host the event , after Super Bowl XXVI at the Metrodome during the 1991 season , and the sixth Super Bowl held in a cold - weather city . </P>",
    "topic": "The media coverage and broadcasting of Super Bowl LII, including any notable moments or controversies.",
    "response": "<document_analysis>\nTo generate a highly insightful and probing question-answer pair, we must carefully analyze the provided context. The central idea of the context revolves around Super Bowl LII, including the teams that played, the outcome, and the location of the game. \n\nUpon examining the context, it becomes apparent that the information primarily focuses on the factual details of the event, such as the teams involved, the score, and the venue. However, to create a question that encourages deep engagement and critical reflection, we need to consider the broader implications and nuances surrounding the event.\n\nOne potential area of exploration could be the media coverage and broadcasting of the Super Bowl, including any notable moments or controversies that arose during the event. This could involve analyzing the ways in which the media framed the game, the teams, and the players, as well as any significant events or incidents that occurred during the broadcast.\n\nGiven the context, a thoughtful and challenging question could be designed to probe the domain expert's knowledge of the media's role in shaping the narrative around Super Bowl LII. The question should be crafted to require a deep understanding of the event, its significance, and the media's influence on the public's perception.\n\nThe difficulty level of the question should be rated as an 8 out of 10, considering the need for the domain expert to demonstrate a nuanced understanding of the media's impact on the event and its aftermath.\n\nThe question planning process involves intentionally designing a question that invites meaningful reflection and critical engagement. The question should be purposeful, encouraging the domain expert to think deeply about the implications of the media's coverage and its potential effects on the public's understanding of the event.\n</document_analysis>\n\n<output_format>\nQuestion: What was a significant aspect of the media coverage of Super Bowl LII that contributed to its widespread viewership and cultural impact?\nA: The extensive coverage of the teams' charitable initiatives\nB: The pre-game analysis of the players' social media activities\nC: The broadcast of the halftime show featuring Justin Timberlake\nD: The live commentary on the teams' strategies and player performances\n\nExplanation: The correct answer, C, is significant because the halftime show is a major aspect of the Super Bowl's media coverage, often featuring high-profile performers and attracting a large audience. The other options, while potentially related to the Super Bowl, are not directly relevant to the media coverage's contribution to its viewership and cultural impact.\n\nCorrect Answer: C\n</output_format>",
    "question": "What was a significant aspect of the media coverage of Super Bowl LII that contributed to its widespread viewership and cultural impact?",
    "choices": {
      "A": "The extensive coverage of the teams' charitable initiatives",
      "B": "The pre-game analysis of the players' social media activities",
      "C": "The broadcast of the halftime show featuring Justin Timberlake",
      "D": "The live commentary on the teams' strategies and player performances"
    },
    "answer": "C",
    "explanation": "The correct answer, C, is significant because the halftime show is a major aspect of the Super Bowl's media coverage, often featuring high-profile performers and attracting a large audience. The other options, while potentially related to the Super Bowl, are not directly relevant to the media coverage's contribution to its viewership and cultural impact.",
    "question_token_count": 26,
    "answer_correctness_score": 10,
    "explanation_validity_score": 10,
    "question_clarity_score": 4,
    "question_difficulty_score": 6,
    "question_groundedness_score": 1,
    "avg_answer_token_count": 11
  },
  {
    "context": "<Table> <Tr> <Th> Year </Th> <Th> Round </Th> <Th> Position </Th> <Th> GP </Th> <Th> </Th> <Th> D * </Th> <Th> </Th> <Th> GF </Th> <Th> GA </Th> <Th> GD </Th> </Tr> <Tr> <Td> 1930 </Td> <Td colspan=\"9\"> Not a FIFA member </Td> </Tr> <Tr> <Td> 1934 </Td> </Tr> <Tr> <Td> 1938 </Td> </Tr> <Tr> <Td> 1950 </Td> <Td> Group stage </Td> <Td> 8th </Td> <Td> </Td> <Td> </Td> <Td> 0 </Td> <Td> </Td> <Td> </Td> <Td> </Td> <Td> 0 </Td> </Tr> <Tr> <Td> 1954 </Td> <Td> Quarter - finals </Td> <Td> 7th </Td> <Td> </Td> <Td> </Td> <Td> </Td> <Td> </Td> <Td> 8 </Td> <Td> 8 </Td> <Td> 0 </Td> </Tr> <Tr> <Td> 1958 </Td> <Td> Group stage </Td> <Td> 11th </Td> <Td> </Td> <Td> 0 </Td> <Td> </Td> <Td> </Td> <Td> </Td> <Td> 5 </Td> <Td> - 1 </Td> </Tr> <Tr> <Td> 1962 </Td> <Td> Quarter - finals </Td> <Td> 8th </Td> <Td> </Td> <Td> </Td> <Td> </Td> <Td> </Td> <Td> 5 </Td> <Td> 6 </Td> <Td> - 1 </Td> </Tr> <Tr> <Td> 1966 </Td> <Td> Champions </Td> <Td> 1st </Td> <Td> 6 </Td> <Td> 5 </Td> <Td> </Td> <Td> 0 </Td> <Td> 11 </Td> <Td> </Td> <Td> 8 </Td> </Tr> <Tr> <Td> 1970 </Td> <Td> Quarter - finals </Td> <Td> 8th </Td> <Td> </Td> <Td> </Td> <Td> 0 </Td> <Td> </Td> <Td> </Td> <Td> </Td> <Td> 0 </Td> </Tr> <Tr> <Td> </Td> <Td colspan=\"9\"> Did not qualify </Td> </Tr> <Tr> <Td> 1978 </Td> </Tr> <Tr> <Td> 1982 </Td> <Td> Second group stage </Td> <Td> 6th </Td> <Td> 5 </Td> <Td> </Td> <Td> </Td> <Td> 0 </Td> <Td> 6 </Td> <Td> </Td> <Td> 5 </Td> </Tr> <Tr> <Td> 1986 </Td> <Td> Quarter - finals </Td> <Td> 8th </Td> <Td> 5 </Td> <Td> </Td> <Td> </Td> <Td> </Td> <Td> 7 </Td> <Td> </Td> <Td> </Td> </Tr> <Tr> <Td> 1990 </Td> <Td> Semi finals </Td> <Td> 4th </Td> <Td> 7 </Td> <Td> </Td> <Td> </Td> <Td> </Td> <Td> 8 </Td> <Td> 6 </Td> <Td> </Td> </Tr> <Tr> <Td> 1994 </Td> <Td colspan=\"9\"> Did not qualify </Td> </Tr> <Tr> <Td> 1998 </Td> <Td> Round of 16 </Td> <Td> 9th </Td> <Td> </Td> <Td> </Td> <Td> </Td> <Td> </Td> <Td> 7 </Td> <Td> </Td> <Td> </Td> </Tr> <Tr> <Td> 2002 </Td> <Td> Quarter - finals </Td> <Td> 6th </Td> <Td> 5 </Td> <Td> </Td> <Td> </Td> <Td> </Td> <Td> 6 </Td> <Td> </Td> <Td> </Td> </Tr> <Tr> <Td> 2006 </Td> <Td> Quarter - finals </Td> <Td> 7th </Td> <Td> 5 </Td> <Td> </Td> <Td> </Td> <Td> 0 </Td> <Td> 6 </Td> <Td> </Td> <Td> </Td> </Tr> <Tr> <Td> </Td> <Td> Round of 16 </Td> <Td> 13th </Td> <Td> </Td> <Td> </Td> <Td> </Td> <Td> </Td> <Td> </Td> <Td> 5 </Td> <Td> - 2 </Td> </Tr> <Tr> <Td> 2014 </Td> <Td> Group stage </Td> <Td> 26th </Td> <Td> </Td> <Td> 0 </Td> <Td> </Td> <Td> </Td> <Td> </Td> <Td> </Td> <Td> - 2 </Td> </Tr> <Tr> <Td> 2018 </Td> <Td> Semi-finals </Td> <Td> 4th </Td> <Td> 7 </Td> <Td> </Td> <Td> </Td> <Td> </Td> <Td> 12 </Td> <Td> 8 </Td> <Td> </Td> </Tr> <Tr> <Td> 2022 </Td> <Td colspan=\"9\"> TBD </Td> </Tr> <Tr> <Td> 2026 </Td> </Tr> <Tr> <Th> Total </Th> <Th> 15 / 21 </Th> <Th> 1 title </Th> <Th> 69 </Th> <Th> 29 </Th> <Th> 21 </Th> <Th> 19 </Th> <Th> 91 </Th> <Th> 64 </Th> <Th> 27 </Th> </Tr> </Table>",
    "topic": "A statistical analysis of the team's wins, draws, and losses in the World Cup and its relation to their overall ranking.",
    "response": "<document_analysis>\nTo generate a highly insightful and probing question-answer pair, a careful analysis of the provided context is necessary. The context appears to be a table detailing the performance of a team in the World Cup across various years, including the round they reached, their position, the number of games played (GP), wins, draws, goals for (GF), goals against (GA), and goal difference (GD).\n\nThe table provides a comprehensive overview of the team's performance over the years, with some years missing due to not qualifying or being a FIFA member. The information is structured and easy to follow, allowing for various types of analysis, such as comparing performance across different tournaments, analyzing trends in wins, draws, and losses, and calculating overall statistics like total goals scored and conceded.\n\nGiven the nature of the data, a question that encourages deep engagement and critical thinking could involve statistical analysis or the identification of patterns and trends within the data. It's also important to ensure that the question is challenging and requires a nuanced understanding of the content.\n\nOne potential area of exploration is the relationship between the team's performance (in terms of wins, draws, and losses) and their overall ranking in the tournament. This could involve analyzing how different outcomes (e.g., winning, drawing, or losing) in various rounds impact the team's final position.\n\nThe difficulty level of the question should be high (rated 8 or 9 out of 10) to challenge even the smartest domain experts. The question should be designed to test not only the understanding of the provided data but also the ability to apply statistical reasoning and perhaps some knowledge of how rankings are determined in the World Cup.\n\nIn terms of irrelevant or bogus information, the table itself seems to be coherent and relevant to the topic of the team's performance in the World Cup. However, some rows are incomplete or indicate that the team did not qualify, which might not be directly relevant to analyzing performance trends but is relevant for understanding the team's overall history with the tournament.\n\nGiven these considerations, the goal is to craft a question that is not only challenging but also requires a deep understanding of the data and its implications for the team's ranking and performance.\n</document_analysis>\n\n<output_format>\nQuestion: What statistical measure would best capture the relationship between a team's goal difference and their final position in the World Cup, considering the data provided?\nA: Pearson Correlation Coefficient\nB: Regression Analysis\nC: Mean Goal Difference\nD: Standard Deviation of Goal Difference\n\nExplanation: The Pearson Correlation Coefficient is a statistical measure that calculates the strength and direction of the linear relationship between two variables, in this case, goal difference and final position. This would be the most appropriate measure to understand how goal difference affects a team's final standing in the tournament.\n\nCorrect Answer: A\n</output_format>",
    "question": "What statistical measure would best capture the relationship between a team's goal difference and their final position in the World Cup, considering the data provided?",
    "choices": {
      "A": "Pearson Correlation Coefficient",
      "B": "Regression Analysis",
      "C": "Mean Goal Difference",
      "D": "Standard Deviation of Goal Difference"
    },
    "answer": "A",
    "explanation": "The Pearson Correlation Coefficient is a statistical measure that calculates the strength and direction of the linear relationship between two variables, in this case, goal difference and final position. This would be the most appropriate measure to understand how goal difference affects a team's final standing in the tournament.",
    "question_token_count": 28,
    "answer_correctness_score": 7,
    "explanation_validity_score": 6,
    "question_clarity_score": 6,
    "question_difficulty_score": 8,
    "question_groundedness_score": 8,
    "avg_answer_token_count": 4
  },
  {
    "context": "<P> The 2017 NFL season is the 98th and current season in the history of the National Football League ( NFL ) . The season began on September 7 , 2017 , with the Kansas City Chiefs defeating the defending Super Bowl LI champion New England Patriots 42 -- 27 in the NFL Kickoff Game . The season will conclude with Super Bowl LII , the league 's championship game , on February 4 , 2018 , at U.S. Bank Stadium in Minneapolis , Minnesota . </P>",
    "topic": "The role of U.S. Bank Stadium in Minneapolis, Minnesota, as the host venue for Super Bowl LII, and its relevance to the 2017 NFL season's finale.",
    "response": "<document_analysis>\nThe provided context discusses the 2017 NFL season, its commencement, and its conclusion with Super Bowl LII. The key elements identified in this context are the start of the season, the teams involved in the opening game, and the details regarding Super Bowl LII, including its host venue, U.S. Bank Stadium in Minneapolis, Minnesota, and the date of the event. \n\nUpon careful analysis, it's clear that the context revolves around the structure and significant events of the 2017 NFL season, with a specific focus on its finale, Super Bowl LII. The mention of U.S. Bank Stadium as the host venue for Super Bowl LII introduces an aspect of infrastructure and event management within the NFL.\n\nConsidering the instructions for generating a question, the goal is to create a highly insightful and probing inquiry that encourages reflection and demonstrates a deep understanding of the context. Given the details about the season and Super Bowl LII, a question that explores the significance of the host venue or the implications of hosting such a major event could be particularly relevant.\n\nThe decision to focus on the role of U.S. Bank Stadium as the host venue for Super Bowl LII stems from its prominence in the provided context and its potential to reveal a nuanced understanding of the NFL's event management and the impact of such events on host cities.\n\nThoughtfully rating the difficulty of the question to ensure it is challenging yet answerable by a domain expert, the question should ideally touch upon aspects that require synthesis of information and understanding of the broader implications of hosting a Super Bowl.\n\n</document_analysis>\n\n<output_format>\nQuestion: What factor made U.S. Bank Stadium an appropriate choice for hosting Super Bowl LII, considering the typical requirements for such events?\nA: Its location in a city with a strong football fan base\nB: Its state-of-the-art design and climate-controlled environment\nC: Its proximity to major transportation hubs\nD: Its historical significance in the NFL\n\nExplanation: The correct answer, B, reflects the understanding that U.S. Bank Stadium's state-of-the-art design and climate-controlled environment would be significant factors in its selection as a host venue for a major event like Super Bowl LII, especially considering the February date of the event in a cold climate like Minneapolis.\n\nCorrect Answer: B\n</output_format>",
    "question": "What factor made U.S. Bank Stadium an appropriate choice for hosting Super Bowl LII, considering the typical requirements for such events?",
    "choices": {
      "A": "Its location in a city with a strong football fan base",
      "B": "Its state-of-the-art design and climate-controlled environment",
      "C": "Its proximity to major transportation hubs",
      "D": "Its historical significance in the NFL"
    },
    "answer": "B",
    "explanation": "The correct answer, B, reflects the understanding that U.S. Bank Stadium's state-of-the-art design and climate-controlled environment would be significant factors in its selection as a host venue for a major event like Super Bowl LII, especially considering the February date of the event in a cold climate like Minneapolis.",
    "question_token_count": 27,
    "answer_correctness_score": 10,
    "explanation_validity_score": 10,
    "question_clarity_score": 6,
    "question_difficulty_score": 7,
    "question_groundedness_score": 2,
    "avg_answer_token_count": 9
  },
  {
    "context": "<P> The 2017 NFL season is the 98th and current season in the history of the National Football League ( NFL ) . The season began on September 7 , 2017 , with the Kansas City Chiefs defeating the defending Super Bowl LI champion New England Patriots 42 -- 27 in the NFL Kickoff Game . The season will conclude with Super Bowl LII , the league 's championship game , on February 4 , 2018 , at U.S. Bank Stadium in Minneapolis , Minnesota . </P>",
    "topic": "The historical context of the 2017 NFL season, being the 98th season in the history of the National Football League, and its place within the league's overall timeline.",
    "response": "<document_analysis>\nThe provided context discusses the 2017 NFL season, highlighting its position as the 98th season in the National Football League's history. It mentions the start of the season with the Kansas City Chiefs defeating the New England Patriots in the NFL Kickoff Game and notes that the season will conclude with Super Bowl LII. To generate a challenging question, we need to consider the broader historical context of the NFL and how the 2017 season fits into it.\n\nThoughtful content examination reveals that the season's significance is not just about the games played but also about its place in the league's timeline. Concept exploration suggests looking into how the NFL has evolved over the years, including changes in teams, rules, and notable events. Strategic complexity calibration indicates that a question about the historical context and the league's evolution could be highly challenging, especially if it requires understanding the significance of specific seasons or events in the NFL's history.\n\nIntentional question planning involves creating a question that invites deeper understanding and critical engagement with the content. A question that asks about the implications of the 2017 season being the 98th season could prompt reflection on the league's growth, changes, and notable achievements over nearly a century.\n\nGiven the context, a question that stands out as particularly challenging and insightful would be about understanding the broader historical significance of the 2017 season within the NFL's nearly 100-year history.\n</document_analysis>\n\n<output_format>\nQuestion: What notable milestone in the National Football League's history is approached with the completion of the 2017 season?\nA: The 50th anniversary of the Super Bowl\nB: The centennial of the league's founding\nC: The 100th season of professional football\nD: The conclusion of the league's first century of operation\nExplanation: The question requires understanding the significance of the 2017 season being the 98th in the NFL's history, implying that the league is nearing a major milestone, which is the completion of its first century of operation.\nCorrect Answer: D\n</output_format>",
    "question": "What notable milestone in the National Football League's history is approached with the completion of the 2017 season?",
    "choices": {
      "A": "The 50th anniversary of the Super Bowl",
      "B": "The centennial of the league's founding",
      "C": "The 100th season of professional football",
      "D": "The conclusion of the league's first century of operation"
    },
    "answer": "D",
    "explanation": "The question requires understanding the significance of the 2017 season being the 98th in the NFL's history, implying that the league is nearing a major milestone, which is the completion of its first century of operation.",
    "question_token_count": 23,
    "answer_correctness_score": 10,
    "explanation_validity_score": 10,
    "question_clarity_score": 6,
    "question_difficulty_score": 4,
    "question_groundedness_score": 1,
    "avg_answer_token_count": 9
  },
  {
    "context": "<P> The fourth season began airing on October 10 , 2017 , on The CW . </P>",
    "topic": "Strategies television networks might use to maximize viewership on premiere nights.",
    "response": "<document_analysis>\nGiven the context provided, the information seems to be about the airing of a television show's fourth season on The CW. However, the details are sparse and do not directly address strategies that television networks might use to maximize viewership on premiere nights. The context only mentions the start date of the fourth season of a show, without elaborating on promotional strategies, viewer engagement tactics, or any other relevant information that could be used to generate a meaningful question about maximizing viewership.\n\nDespite the lack of direct information on strategies for maximizing viewership, we can infer that premiere nights are critical for television networks. They often employ various tactics to attract large audiences, such as heavy advertising, social media campaigns, interactive fan engagements, and strategic scheduling to compete effectively against other networks' programming.\n\nGiven the sparse context, a thoughtful and challenging question that encourages deeper understanding and insight into strategies for maximizing viewership on premiere nights, while considering the broader implications of such strategies, could be formulated by exploring general knowledge on the topic rather than relying solely on the provided context.\n\nThought Process: \n- The question needs to be self-contained and not give away the answer.\n- It should require a deep understanding of television marketing strategies.\n- The answer options should be plausible but challenging to distinguish between, with at least one incorrect option being subtly wrong.\n\n</document_analysis>\n\n<output_format>\nQuestion: What strategy might a television network employ to create a buzz around a new season premiere, considering the network's goal of maximizing viewership and competing against streaming services?\nA: Offering exclusive content on the network's website.\nB: Partnering with social media influencers for live tweeting events.\nC: Implementing a \"premiere night\" app with interactive features.\nD: Announcing a surprise guest star for the premiere episode.\nExplanation: Partnering with social media influencers for live tweeting events can generate significant buzz and attract a younger demographic, which is crucial for competing against streaming services and maximizing viewership on premiere nights. This strategy leverages the influencers' followers and encourages real-time engagement with the show.\nCorrect Answer: B\n</output_format>",
    "question": "What strategy might a television network employ to create a buzz around a new season premiere, considering the network's goal of maximizing viewership and competing against streaming services?",
    "choices": {
      "A": "Offering exclusive content on the network's website.",
      "B": "Partnering with social media influencers for live tweeting events.",
      "C": "Implementing a \"premiere night\" app with interactive features.",
      "D": "Announcing a surprise guest star for the premiere episode."
    },
    "answer": "B",
    "explanation": "Partnering with social media influencers for live tweeting events can generate significant buzz and attract a younger demographic, which is crucial for competing against streaming services and maximizing viewership on premiere nights. This strategy leverages the influencers' followers and encourages real-time engagement with the show.",
    "question_token_count": 33,
    "answer_correctness_score": 9,
    "explanation_validity_score": 9,
    "question_clarity_score": 9,
    "question_difficulty_score": 7,
    "question_groundedness_score": 1,
    "avg_answer_token_count": 12
  },
  {
    "context": "<P> The Super Bowl LII Halftime Show ( officially known as the Pepsi Super Bowl LII Halftime Show ) took place on February 4 , 2018 at U.S. Bank Stadium in Minneapolis , Minnesota , as part of Super Bowl LII . Justin Timberlake was the featured performer , as confirmed by the National Football League ( NFL ) on October 22 , 2017 . It was televised nationally by NBC . </P>",
    "topic": "The impact of the Super Bowl LII Halftime Show on Justin Timberlake's subsequent career and public image.",
    "response": "<document_analysis>\nThe provided context discusses the Super Bowl LII Halftime Show, which took place on February 4, 2018, at U.S. Bank Stadium in Minneapolis, Minnesota. Justin Timberlake was the featured performer, as confirmed by the National Football League (NFL) on October 22, 2017. The event was televised nationally by NBC. \n\nTo generate a question, we need to consider the potential impact of this event on Justin Timberlake's subsequent career and public image. This requires analyzing the context of the event, the performance itself, and any potential fallout or reception from the audience and critics.\n\nGiven the information provided, it's clear that the context focuses on the event details rather than the impact on Justin Timberlake's career. However, this event could have significant implications for his public image and career trajectory, considering the massive audience and media scrutiny associated with the Super Bowl Halftime Show.\n\nThe question should be designed to encourage deep reflection on the potential consequences of such a high-profile performance, considering both positive and negative outcomes. It should challenge the domain expert to think critically about how this event might influence Justin Timberlake's career, requiring an understanding of the entertainment industry, public relations, and the power of media events like the Super Bowl.\n\nDifficulty rating: 8/10, as it requires not only knowledge of the event but also an understanding of its potential implications on a celebrity's career and public image.\n\nThought process: The question should be open-ended enough to allow for various perspectives on the impact of the Super Bowl LII Halftime Show on Justin Timberlake but specific enough to require a deep understanding of the subject matter. It should avoid being too broad or too narrow, striking a balance between encouraging thoughtful engagement and providing a clear direction for the response.\n</document_analysis>\n\n<output_format>\nQuestion: What potential long-term effect could Justin Timberlake's performance at the Super Bowl LII Halftime Show have on his ability to transcend genres and appeal to a broader audience in his subsequent projects?\nA: It would likely diminish his credibility as a serious artist.\nB: It would have no significant impact on his genre-transcending abilities.\nC: It could enhance his appeal by introducing him to a new demographic.\nD: It would restrict his future collaborations to only sports-related events.\nExplanation: The correct answer, \"It could enhance his appeal by introducing him to a new demographic,\" suggests that performing at such a widely viewed event could expose Justin Timberlake to a broader audience, potentially increasing his appeal across different genres and demographics. This requires an understanding of how high-profile performances can influence an artist's career trajectory and public image.\nCorrect Answer: C\n</output_format>",
    "question": "What potential long-term effect could Justin Timberlake's performance at the Super Bowl LII Halftime Show have on his ability to transcend genres and appeal to a broader audience in his subsequent projects?",
    "choices": {
      "A": "It would likely diminish his credibility as a serious artist.",
      "B": "It would have no significant impact on his genre-transcending abilities.",
      "C": "It could enhance his appeal by introducing him to a new demographic.",
      "D": "It would restrict his future collaborations to only sports-related events."
    },
    "answer": "C",
    "explanation": "The correct answer, \"It could enhance his appeal by introducing him to a new demographic,\" suggests that performing at such a widely viewed event could expose Justin Timberlake to a broader audience, potentially increasing his appeal across different genres and demographics. This requires an understanding of how high-profile performances can influence an artist's career trajectory and public image.",
    "question_token_count": 39,
    "answer_correctness_score": 9,
    "explanation_validity_score": 9,
    "question_clarity_score": 8,
    "question_difficulty_score": 7,
    "question_groundedness_score": 2,
    "avg_answer_token_count": 13
  },
  {
    "context": "<P> Earth 's orbit is the trajectory along which Earth travels around the Sun . The average distance between the Earth and the Sun is 149.60 million km ( 92.96 million mi ) , and one complete orbit takes 365.256 days ( 1 sidereal year ) , during which time Earth has traveled 940 million km ( 584 million mi ) . Earth 's orbit has an eccentricity of 0.0167 . </P>",
    "topic": "The methods used to measure the Earth's orbit, including astronomical observations, spacecraft missions, and radar ranging techniques.",
    "response": "<document_analysis>\nTo generate a highly insightful and probing question-answer pair, we must carefully analyze the provided context. The context discusses Earth's orbit, including its average distance from the Sun, the time it takes to complete one orbit, and the eccentricity of its orbit. \n\nThe central idea here is the description of Earth's orbit around the Sun, focusing on key parameters such as distance, duration, and eccentricity. \n\nUpon examining the context, it's clear that the information provided is meaningful, coherent, and educationally valuable, focusing on astronomical observations related to Earth's orbit. \n\nGiven the nature of the topic, a question that invites deeper understanding and critical engagement could involve the implications of Earth's orbital parameters on its climate or the methods used to measure these parameters accurately.\n\nThe difficulty level of such a question should be high (around 8-10) to challenge even the smartest domain experts, requiring a synthesis of general understanding beyond the specific context provided.\n\nA potential question could delve into the relationship between Earth's orbital eccentricity and its impact on the planet's climate, or it could explore the methodologies and challenges associated with measuring Earth's orbit accurately.\n\nGiven these considerations, the question should be designed to encourage thoughtful engagement, requiring the application of knowledge about Earth's orbit and its measurement, as well as an understanding of the underlying principles of astronomy and planetary science.\n</document_analysis>\n\n<output_format>\nQuestion: What technique, beyond astronomical observations, is crucial for precisely measuring the Earth's distance from the Sun, especially considering the elliptical nature of its orbit?\nA: Spectrographic Analysis\nB: Radar Ranging\nC: Gravitational Wave Detection\nD: Spacecraft Flybys\n\nExplanation: Radar ranging techniques are essential for accurately measuring the Earth's distance from the Sun, particularly in the context of its elliptical orbit. This method involves bouncing radar signals off celestial bodies or spacecraft and measuring the time it takes for these signals to return, allowing for precise calculations of distances.\n\nCorrect Answer: B\n</output_format>",
    "question": "What technique, beyond astronomical observations, is crucial for precisely measuring the Earth's distance from the Sun, especially considering the elliptical nature of its orbit?",
    "choices": {
      "A": "Spectrographic Analysis",
      "B": "Radar Ranging",
      "C": "Gravitational Wave Detection",
      "D": "Spacecraft Flybys"
    },
    "answer": "B",
    "explanation": "Radar ranging techniques are essential for accurately measuring the Earth's distance from the Sun, particularly in the context of its elliptical orbit. This method involves bouncing radar signals off celestial bodies or spacecraft and measuring the time it takes for these signals to return, allowing for precise calculations of distances.",
    "question_token_count": 29,
    "answer_correctness_score": 8,
    "explanation_validity_score": 8,
    "question_clarity_score": 6,
    "question_difficulty_score": 8,
    "question_groundedness_score": 1,
    "avg_answer_token_count": 4
  },
  {
    "context": "<P> Human fertilization is the union of a human egg and sperm , usually occurring in the ampulla of the fallopian tube . The result of this union is the production of a zygote cell , or fertilized egg , initiating prenatal development . Scientists discovered the dynamics of human fertilization in the nineteenth century . </P>",
    "topic": "The biological process of human fertilization, including the union of the human egg and sperm and the production of a zygote cell.",
    "response": "<document_analysis>\nTo generate a highly insightful and probing question-answer pair, I will carefully analyze the provided context. The central idea of the context is the biological process of human fertilization, specifically the union of the human egg and sperm, and the production of a zygote cell. \n\nThe context mentions that human fertilization usually occurs in the ampulla of the fallopian tube and that the result of this union is the production of a zygote cell, initiating prenatal development. It also mentions that scientists discovered the dynamics of human fertilization in the nineteenth century.\n\nTo create a challenging question, I will consider implicit assumptions and subtle details within the context. One potential area of exploration is the specific location and conditions under which human fertilization occurs, as well as the significance of the zygote cell in prenatal development.\n\nGiven the context, a potential question could explore the importance of the location of fertilization or the role of the zygote cell in development. The difficulty rating of such a question would likely be high (8-10), as it requires a deep understanding of the biological process and its implications.\n\nAfter considering various options, I have decided to generate a question that probes the understanding of the zygote cell's role in prenatal development. This question will require the test-taker to demonstrate a nuanced understanding of the biological process and its significance.\n</document_analysis>\n\n<output_format>\nQuestion: What is the primary role of the zygote cell in human development?\nA: To produce gametes for future fertilization\nB: To initiate implantation in the uterus\nC: To initiate prenatal development\nD: To regulate embryonic cell division\n\nExplanation: The correct answer, C, is supported by the context, which states that the result of the union of the human egg and sperm is the production of a zygote cell, \"initiating prenatal development\". This indicates that the zygote cell plays a crucial role in starting the developmental process. The other options are incorrect because they do not accurately describe the primary role of the zygote cell.\n\nCorrect Answer: C\n</output_format>",
    "question": "What is the primary role of the zygote cell in human development?",
    "choices": {
      "A": "To produce gametes for future fertilization",
      "B": "To initiate implantation in the uterus",
      "C": "To initiate prenatal development",
      "D": "To regulate embryonic cell division"
    },
    "answer": "C",
    "explanation": "The correct answer, C, is supported by the context, which states that the result of the union of the human egg and sperm is the production of a zygote cell, \"initiating prenatal development\". This indicates that the zygote cell plays a crucial role in starting the developmental process. The other options are incorrect because they do not accurately describe the primary role of the zygote cell.",
    "question_token_count": 16,
    "answer_correctness_score": 10,
    "explanation_validity_score": 10,
    "question_clarity_score": 8,
    "question_difficulty_score": 5,
    "question_groundedness_score": 6,
    "avg_answer_token_count": 6
  },
  {
    "context": "<P> The seventh season of the fantasy drama television series Game of Thrones premiered on HBO on July 16 , 2017 , and concluded on August 27 , 2017 . Unlike previous seasons that consisted of ten episodes each , the seventh season consisted of only seven . Like the previous season , it largely consisted of original content not found in George R.R. Martin 's A Song of Ice and Fire series , while also incorporating material Martin revealed to showrunners about the upcoming novels in the series . The series was adapted for television by David Benioff and D.B. Weiss . </P>",
    "topic": "The differences between the seventh season of Game of Thrones and the previous seasons in terms of episode count, content, and narrative approach.",
    "response": "<document_analysis>\nThe provided context discusses the seventh season of Game of Thrones, highlighting its differences from previous seasons. Key points include the reduced episode count from ten to seven, the incorporation of original content not found in George R.R. Martin's book series, and the use of material revealed by Martin about upcoming novels. The analysis focuses on identifying central ideas, such as the change in episode count and the narrative approach, which involves more original content and insights from Martin. The strategic complexity calibration rates the difficulty of questions that could be generated from this context as moderately high, given the specific details about the season's production and content. The question planning phase aims to craft a question that invites reflection on the implications of these changes for the series as a whole.\n</document_analysis>\n\n<output_format>\nQuestion: What significant change in format did the seventh season of Game of Thrones undergo compared to its predecessors?\nA: Introduction of a new main character\nB: Reduction in episode count from ten to seven\nC: Complete adaptation from George R.R. Martin's novels\nD: Change in filming locations to reduce costs\nExplanation: The correct answer reflects the notable difference in the seventh season's structure, which had fewer episodes than the previous seasons, indicating a shift in the show's narrative pacing or production decisions.\nCorrect Answer: B\n</output_format>",
    "question": "What significant change in format did the seventh season of Game of Thrones undergo compared to its predecessors?",
    "choices": {
      "A": "Introduction of a new main character",
      "B": "Reduction in episode count from ten to seven",
      "C": "Complete adaptation from George R.R. Martin's novels",
      "D": "Change in filming locations to reduce costs"
    },
    "answer": "B",
    "explanation": "The correct answer reflects the notable difference in the seventh season's structure, which had fewer episodes than the previous seasons, indicating a shift in the show's narrative pacing or production decisions.",
    "question_token_count": 20,
    "answer_correctness_score": 10,
    "explanation_validity_score": 9,
    "question_clarity_score": 6,
    "question_difficulty_score": 2,
    "question_groundedness_score": 9,
    "avg_answer_token_count": 8
  },
  {
    "context": "<P> The United States presidential line of succession is the order in which persons may become or act as President of the United States if the incumbent president becomes incapacitated , dies , resigns , or is removed from office ( by impeachment by the House of Representatives and subsequent conviction by the Senate ) . The line of succession is set by the United States Constitution and the Presidential Succession Act of 1947 as subsequently amended to include newly created cabinet offices . The succession follows the order of vice president , Speaker of the House of Representatives , President pro tempore of the Senate , and then the heads of federal executive departments who form the Cabinet of the United States . The Cabinet currently has fifteen members , beginning with the Secretary of State , and followed by the rest in the order of their positions ' creation . Those heads of department who are ineligible to act as president are also ineligible to succeed the president by succession , for example most commonly if they are not a natural - born U.S. citizen . </P>",
    "topic": "The eligibility requirements for individuals to act as president, including the requirement of being a natural-born U.S. citizen.",
    "response": "<document_analysis>\nThe provided context discusses the United States presidential line of succession, outlining the order in which individuals may become or act as President if the incumbent is incapacitated, dies, resigns, or is removed. The succession order is determined by the U.S. Constitution and the Presidential Succession Act of 1947, including amendments for newly created cabinet offices. The line of succession starts with the vice president, followed by the Speaker of the House of Representatives, the President pro tempore of the Senate, and then the heads of federal executive departments in the order of their positions' creation. Notably, the context highlights that heads of departments who are ineligible to act as president, such as those not being natural-born U.S. citizens, are also ineligible to succeed the president through succession.\n\nGiven the topic of eligibility requirements for individuals to act as president, including the natural-born U.S. citizen requirement, the context provides a foundation for exploring the intricacies of presidential succession and the qualifications necessary for assuming the office. The analysis will focus on crafting a question that probes the understanding of these eligibility requirements and their implications on the line of succession.\n\nThoughtful consideration is given to the complexity and difficulty of the question, aiming for a level that challenges even the most knowledgeable domain experts. The question should inspire deep engagement with the content, encouraging reflection on the implications of the eligibility requirements for presidential succession.\n\nThe decision criteria for question generation emphasize the need for meaningful, coherent, and educationally valuable content. Given that the provided context meets these criteria, a question will be generated that targets the nuances of the eligibility requirements and their impact on the presidential line of succession.\n\n</document_analysis>\n\n<output_format>\nQuestion: What constitutional requirement must be met by all individuals in the presidential line of succession to be eligible to act as President of the United States?\nA: Being at least 21 years of age\nB: Being a natural-born U.S. citizen\nC: Having served in the U.S. military\nD: Having been a resident of the United States for at least 14 years\nExplanation: The U.S. Constitution specifies that to be eligible to the office of the President, a person must be a natural-born citizen of the United States, at least 35 years old, and a resident of the United States for at least 14 years. This requirement applies to all individuals in the line of succession.\nCorrect Answer: B\n</output_format>",
    "question": "What constitutional requirement must be met by all individuals in the presidential line of succession to be eligible to act as President of the United States?",
    "choices": {
      "A": "Being at least 21 years of age",
      "B": "Being a natural-born U.S. citizen",
      "C": "Having served in the U.S. military",
      "D": "Having been a resident of the United States for at least 14 years"
    },
    "answer": "B",
    "explanation": "The U.S. Constitution specifies that to be eligible to the office of the President, a person must be a natural-born citizen of the United States, at least 35 years old, and a resident of the United States for at least 14 years. This requirement applies to all individuals in the line of succession.",
    "question_token_count": 28,
    "answer_correctness_score": 8,
    "explanation_validity_score": 9,
    "question_clarity_score": 1,
    "question_difficulty_score": 6,
    "question_groundedness_score": 6,
    "avg_answer_token_count": 10
  },
  {
    "context": "<P> The fourth season began airing on October 10 , 2017 , on The CW . </P>",
    "topic": "The role of networks like The CW in the broadcasting and promotion of television series.",
    "response": "<document_analysis>\nTo generate a highly insightful and probing question-answer pair, we first analyze the provided context. The context mentions that the fourth season of a television series began airing on October 10, 2017, on The CW. This information is straightforward and primarily factual, indicating the premiere date and the network on which the series aired.\n\nGiven the topic is about the role of networks like The CW in the broadcasting and promotion of television series, we need to consider how this context fits into the broader understanding of television series promotion and broadcasting. The CW, as a network, plays a significant role in deciding which series to air, how to promote them, and when to schedule their broadcasts. The fact that a specific series' fourth season premiered on this network suggests that The CW saw value in continuing to support and broadcast this series.\n\nHowever, the provided context is quite limited and does not directly address the promotional strategies or the decision-making process behind broadcasting television series on The CW. Therefore, to create a meaningful question, we must think about the implications of a network like The CW airing a series and how this reflects their role in the television industry.\n\nThe question should encourage deep engagement with the content, critical reflection on the implications of networks airing series, and demonstrate an understanding of the broadcasting and promotion processes. Considering the role of networks, the impact of airing decisions on series longevity, and the factors influencing these decisions can lead to a thoughtful and challenging question.\n\nGiven these considerations, a potential question could explore the significance of a network's decision to continue airing a series beyond its initial seasons, reflecting on what this might indicate about the network's promotional strategies and the series' appeal.\n\nThoughtful engagement with this topic requires considering the intricate relationships between networks, series producers, audience preferences, and the competitive landscape of television broadcasting. A domain expert would need to synthesize their understanding of these factors to provide a nuanced answer.\n\nThe difficulty of the question should be high (rating: 8/10), as it requires not just factual knowledge but also the ability to analyze the implications of a network's actions on the series and the television industry as a whole.\n\n</document_analysis>\n\n<output_format>\nQuestion: What does a network's decision to air a series beyond its third season typically indicate about its promotional strategy and the series' potential for long-term viewer engagement?\nA: It reflects a lack of new series with potential, so the network relies on established shows.\nB: The series has shown consistent viewer growth, making it a valuable asset for the network's programming schedule.\nC: The network is transitioning to a new target audience and believes the series will appeal to them.\nD: It signifies a shift in the network's focus towards more experimental or niche programming.\n\nExplanation: Airing a series beyond its third season typically indicates that the series has demonstrated some level of success or potential for continued growth, making it a valuable asset for the network. This decision reflects the network's promotional strategy, aiming to capitalize on the series' established viewer base and potentially attract new viewers.\n\nCorrect Answer: B\n</output_format>",
    "question": "What does a network's decision to air a series beyond its third season typically indicate about its promotional strategy and the series' potential for long-term viewer engagement?",
    "choices": {
      "A": "It reflects a lack of new series with potential, so the network relies on established shows.",
      "B": "The series has shown consistent viewer growth, making it a valuable asset for the network's programming schedule.",
      "C": "The network is transitioning to a new target audience and believes the series will appeal to them.",
      "D": "It signifies a shift in the network's focus towards more experimental or niche programming."
    },
    "answer": "B",
    "explanation": "Airing a series beyond its third season typically indicates that the series has demonstrated some level of success or potential for continued growth, making it a valuable asset for the network. This decision reflects the network's promotional strategy, aiming to capitalize on the series' established viewer base and potentially attract new viewers.",
    "question_token_count": 32,
    "answer_correctness_score": 8,
    "explanation_validity_score": 9,
    "question_clarity_score": 8,
    "question_difficulty_score": 7,
    "question_groundedness_score": 1,
    "avg_answer_token_count": 19
  },
  {
    "context": "<P> `` Flight '' is the twenty - fourth and final episode of the eighth season of the American television medical drama Grey 's Anatomy , and the show 's 172nd episode overall . It was written by series creator Shonda Rhimes , and directed by Rob Corn . The episode was originally broadcast on the American Broadcasting Company ( ABC ) in the United States on May 17 , 2012 . In the episode , six doctors from Seattle Grace Mercy West Hospital who are victims of an aviation accident fight to stay alive , but Dr. Lexie Grey ( Chyler Leigh ) ultimately dies . Other storylines occur in Seattle where Dr. Richard Webber ( James Pickens , Jr . ) plans his annual dinner for the departing residents , Dr. Owen Hunt ( Kevin McKidd ) fires Dr. Teddy Altman ( Kim Raver ) , and Dr. Miranda Bailey ( Chandra Wilson ) gets engaged . </P>",
    "topic": "The themes of survival, loss, and personal relationships in the episode \"Flight\" and their relevance to the broader Grey's Anatomy series.",
    "response": "<document_analysis>\nThe provided context revolves around the episode \"Flight\" from the eighth season of Grey's Anatomy, focusing on the themes of survival, loss, and personal relationships. To generate a highly insightful and probing question-answer pair, it's essential to analyze the central ideas, nuanced themes, and significant relationships within the episode. \n\nUpon examination, the episode's narrative is marked by the aviation accident that claims the life of Dr. Lexie Grey, underscoring the fragility of life and the resilience needed for survival. The storyline also explores personal relationships through the characters' interactions and developments, such as Dr. Owen Hunt's decision to fire Dr. Teddy Altman and Dr. Miranda Bailey's engagement. \n\nThe broader Grey's Anatomy series is known for its complex character dynamics, medical dilemmas, and emotional depth, making the themes of survival, loss, and personal relationships pivotal to its narrative. \n\nGiven the complexity and depth of these themes, a question that probes the domain expert's understanding of how these elements intertwine and impact the series' progression would be highly challenging and insightful. \n\nThe difficulty level of such a question would be around 8 out of 10, considering it requires a deep understanding of the series, its characters, and the thematic resonance across episodes.\n\n</document_analysis>\n\n<output_format>\nQuestion: What narrative device does the episode \"Flight\" employ to underscore the theme of survival in the face of catastrophic loss, and how does this device contribute to the character development of the surviving doctors?\nA: Flashbacks to the characters' personal struggles before the accident\nB: The doctors' collective effort to save each other amidst the crash aftermath\nC: Dr. Lexie Grey's death serving as a catalyst for introspection among the survivors\nD: The parallel storyline of Dr. Richard Webber's dinner plans for departing residents\n\nExplanation: The correct answer, \"The doctors' collective effort to save each other amidst the crash aftermath,\" highlights the episode's use of a dramatic, life-threatening situation to explore the characters' survival instincts and interpersonal bonds. This narrative device not only tests the characters' medical skills but also reveals their personal strengths, weaknesses, and relationships, contributing significantly to their development.\n\nCorrect Answer: B\n</output_format>",
    "question": "What narrative device does the episode \"Flight\" employ to underscore the theme of survival in the face of catastrophic loss, and how does this device contribute to the character development of the surviving doctors?",
    "choices": {
      "A": "Flashbacks to the characters' personal struggles before the accident",
      "B": "The doctors' collective effort to save each other amidst the crash aftermath",
      "C": "Dr. Lexie Grey's death serving as a catalyst for introspection among the survivors",
      "D": "The parallel storyline of Dr. Richard Webber's dinner plans for departing residents"
    },
    "answer": "B",
    "explanation": "The correct answer, \"The doctors' collective effort to save each other amidst the crash aftermath,\" highlights the episode's use of a dramatic, life-threatening situation to explore the characters' survival instincts and interpersonal bonds. This narrative device not only tests the characters' medical skills but also reveals their personal strengths, weaknesses, and relationships, contributing significantly to their development.",
    "question_token_count": 39,
    "answer_correctness_score": 9,
    "explanation_validity_score": 9,
    "question_clarity_score": 8,
    "question_difficulty_score": 9,
    "question_groundedness_score": 4,
    "avg_answer_token_count": 15
  },
  {
    "context": "<P> `` Flight '' is the twenty - fourth and final episode of the eighth season of the American television medical drama Grey 's Anatomy , and the show 's 172nd episode overall . It was written by series creator Shonda Rhimes , and directed by Rob Corn . The episode was originally broadcast on the American Broadcasting Company ( ABC ) in the United States on May 17 , 2012 . In the episode , six doctors from Seattle Grace Mercy West Hospital who are victims of an aviation accident fight to stay alive , but Dr. Lexie Grey ( Chyler Leigh ) ultimately dies . Other storylines occur in Seattle where Dr. Richard Webber ( James Pickens , Jr . ) plans his annual dinner for the departing residents , Dr. Owen Hunt ( Kevin McKidd ) fires Dr. Teddy Altman ( Kim Raver ) , and Dr. Miranda Bailey ( Chandra Wilson ) gets engaged . </P>",
    "topic": "The role of Dr. Richard Webber in planning his annual dinner for departing residents and its relevance to the episode's themes of transition and loss.",
    "response": "<document_analysis>\nThe provided context revolves around the episode \"Flight\" from the eighth season of Grey's Anatomy, focusing on various storylines including a plane crash, personal relationships, and professional developments. To generate a question related to Dr. Richard Webber's role in planning his annual dinner for departing residents and its relevance to the episode's themes of transition and loss, we must first identify the central ideas and nuances within this context.\n\nUpon examination, it's clear that Dr. Webber's dinner planning is a subplot that intersects with the broader themes of transition and loss, as the episode deals with the departure of residents and the aftermath of a tragic event. The question should encourage deep engagement with these themes and demonstrate an understanding of how Dr. Webber's actions reflect or contribute to the narrative's exploration of change and bereavement.\n\nGiven the complexity of the episode's themes and the need to craft a highly challenging question, the difficulty rating for this question would be around 8 out of 10. The challenge lies in connecting the specific actions of a character (Dr. Webber) with the overarching themes of the episode, requiring a nuanced understanding of both the character's role and the thematic elements of the narrative.\n\nThe question should be designed to inspire thoughtful engagement, encouraging the respondent to reflect on how Dr. Webber's annual dinner for departing residents serves as a symbol or catalyst for the themes of transition and loss within the episode. It must be self-contained, clear, and free of any information that could give away the answer, with all answer options being plausible and distinct.\n\n</document_analysis>\n\n<output_format>\nQuestion: What symbolic significance does Dr. Richard Webber's annual dinner for departing residents hold in relation to the episode's exploration of transition and loss, considering the broader narrative context?\nA: It underscores the hospital's resilience in the face of tragedy.\nB: It serves as a poignant reminder of the cyclical nature of professional and personal relationships.\nC: It highlights Dr. Webber's personal struggle with letting go of the past.\nD: It marks a turning point in Dr. Webber's leadership style, embracing change.\n\nExplanation: The correct answer, \"It serves as a poignant reminder of the cyclical nature of professional and personal relationships,\" reflects the idea that Dr. Webber's dinner symbolizes the ongoing cycle of residents coming and going, which is intertwined with themes of transition and loss. This understanding requires a deep engagement with the episode's narrative and its thematic elements.\n\nCorrect Answer: B\n</output_format>",
    "question": "What symbolic significance does Dr. Richard Webber's annual dinner for departing residents hold in relation to the episode's exploration of transition and loss, considering the broader narrative context?",
    "choices": {
      "A": "It underscores the hospital's resilience in the face of tragedy.",
      "B": "It serves as a poignant reminder of the cyclical nature of professional and personal relationships.",
      "C": "It highlights Dr. Webber's personal struggle with letting go of the past.",
      "D": "It marks a turning point in Dr. Webber's leadership style, embracing change."
    },
    "answer": "B",
    "explanation": "The correct answer, \"It serves as a poignant reminder of the cyclical nature of professional and personal relationships,\" reflects the idea that Dr. Webber's dinner symbolizes the ongoing cycle of residents coming and going, which is intertwined with themes of transition and loss. This understanding requires a deep engagement with the episode's narrative and its thematic elements.",
    "question_token_count": 35,
    "answer_correctness_score": 10,
    "explanation_validity_score": 10,
    "question_clarity_score": 6,
    "question_difficulty_score": 8,
    "question_groundedness_score": 7,
    "avg_answer_token_count": 16
  },
  {
    "context": "<P> Darci Lynne Farmer was named the winner on the season finale , September 20 , 2017 . She was the third ventriloquist , third child and third female to win a season of America 's Got Talent. 10 - year - old singer Angelica Hale placed second , and glow light dance troupe Light Balance came in third . Farmer won the show 's prize of $1 million and a headlining performance in Las Vegas . </P>",
    "topic": "The placement and performances of the top three contestants, including Darci Lynne Farmer, Angelica Hale, and Light Balance.",
    "response": "<document_analysis>\nTo generate a highly insightful and probing question-answer pair, a thoughtful analysis of the provided context is necessary. The context discusses the outcome of a season of America's Got Talent, specifically mentioning the winner, Darci Lynne Farmer, and the runners-up, Angelica Hale and Light Balance. \n\n1. **Thoughtful Content Examination**: The central idea is the announcement of the winner and the placement of the top three contestants in the competition. Nuanced themes include the achievements of the contestants, such as Darci Lynne Farmer being the third ventriloquist, third child, and third female to win.\n\n2. **Concept Exploration**: Implicit assumptions might include the competitiveness and talent level of the contestants. Subtle details, like the specific prizes won by Darci Lynne Farmer ($1 million and a headlining performance in Las Vegas), add depth to the context.\n\n3. **Strategic Complexity Calibration**: The difficulty of the question should be high (8-10) to challenge even the smartest domain experts. The question should not be straightforward or easily answerable without deep understanding or reflection.\n\n4. **Intentional Question Planning**: A question that invites deeper understanding could involve the significance of Darci Lynne Farmer's win, the implications of her being a ventriloquist, or the comparison of achievements among the top contestants.\n\nGiven the context, there's no irrelevant or bogus information that needs to be ignored. The decision to generate a question is based on the meaningful content provided, which offers educational value and the potential for thoughtful engagement.\n\n</document_analysis>\n\n<output_format>\nQuestion: What distinction did Darci Lynne Farmer achieve by winning America's Got Talent, in terms of her demographics and performance type?\nA: She was the first female and first child to win.\nB: She was the third ventriloquist, third child, and third female to win.\nC: She was the second ventriloquist and second child to win.\nD: She was the first ventriloquist and first child to win.\n\nExplanation: The correct answer reflects the specific achievements of Darci Lynne Farmer as mentioned in the context, highlighting her unique position in the history of America's Got Talent winners.\n\nCorrect Answer: B\n</output_format>",
    "question": "What distinction did Darci Lynne Farmer achieve by winning America's Got Talent, in terms of her demographics and performance type?",
    "choices": {
      "A": "She was the first female and first child to win.",
      "B": "She was the third ventriloquist, third child, and third female to win.",
      "C": "She was the second ventriloquist and second child to win.",
      "D": "She was the first ventriloquist and first child to win."
    },
    "answer": "B",
    "explanation": "The correct answer reflects the specific achievements of Darci Lynne Farmer as mentioned in the context, highlighting her unique position in the history of America's Got Talent winners.",
    "question_token_count": 25,
    "answer_correctness_score": 10,
    "explanation_validity_score": 10,
    "question_clarity_score": 6,
    "question_difficulty_score": 5,
    "question_groundedness_score": 10,
    "avg_answer_token_count": 15
  },
  {
    "context": "<P> The United States presidential line of succession is the order in which persons may become or act as President of the United States if the incumbent President becomes incapacitated , dies , resigns , or is removed from office ( by impeachment by the House of Representatives and subsequent conviction by the Senate ) . The line of succession is set by the United States Constitution and the Presidential Succession Act of 1947 as subsequently amended to include newly created cabinet offices . The succession follows the order of Vice President , Speaker of the House of Representatives , President pro tempore of the Senate , and then the heads of federal executive departments who form the Cabinet of the United States . The Cabinet currently has fifteen members , beginning with the Secretary of State , and followed by the rest in the order of their positions ' creation . Those heads of department who are ineligible to act as President are also ineligible to succeed the President by succession , for example most commonly if they are not a natural - born U.S. citizen . </P>",
    "topic": "The eligibility requirements for individuals to act as President, including the requirement of being a natural-born U.S. citizen.",
    "response": "<document_analysis>\nThe provided context discusses the United States presidential line of succession, which is the order in which individuals may become or act as President if the incumbent becomes incapacitated, dies, resigns, or is removed from office. The line of succession is determined by the United States Constitution and the Presidential Succession Act of 1947, and it follows a specific order starting with the Vice President, then the Speaker of the House of Representatives, the President pro tempore of the Senate, and finally the heads of federal executive departments. The context also mentions that individuals who are ineligible to act as President, such as those who are not natural-born U.S. citizens, are also ineligible to succeed the President through the line of succession.\n\nGiven the topic of eligibility requirements for individuals to act as President, including the requirement of being a natural-born U.S. citizen, the context provides relevant information about the line of succession and the criteria for eligibility. The question should be designed to probe the domain expert's understanding of these eligibility requirements and their implications for the line of succession.\n\nThoughtful consideration of the context and the topic suggests that a question about the eligibility requirements for acting as President, particularly in relation to the natural-born citizenship requirement, would be appropriate. The question should be challenging and require the domain expert to demonstrate a deep understanding of the subject matter.\n\nThe difficulty level of the question should be high (8-10), as it should require the domain expert to think critically about the eligibility requirements and their implications for the line of succession. The question should also be self-contained, clear, and concise, with a conversational tone that invites thoughtful engagement.\n\nAfter careful analysis and consideration, a question that meets these criteria can be generated.\n</document_analysis>\n\n<output_format>\nQuestion: What is the primary reason why an individual who is not a natural-born U.S. citizen is ineligible to succeed the President through the line of succession?\nA: They are not a resident of the United States.\nB: They are not at least 35 years old.\nC: They do not meet the constitutional requirement for eligibility to the office of the President.\nD: They are not a member of the Cabinet.\n\nExplanation: The correct answer is based on the understanding that the eligibility requirements for acting as President, including the natural-born citizenship requirement, are established by the United States Constitution. The context mentions that individuals who are ineligible to act as President are also ineligible to succeed the President through the line of succession, and the primary reason for this ineligibility is the failure to meet the constitutional requirements.\n\nCorrect Answer: C\n</output_format>",
    "question": "What is the primary reason why an individual who is not a natural-born U.S. citizen is ineligible to succeed the President through the line of succession?",
    "choices": {
      "A": "They are not a resident of the United States.",
      "B": "They are not at least 35 years old.",
      "C": "They do not meet the constitutional requirement for eligibility to the office of the President.",
      "D": "They are not a member of the Cabinet."
    },
    "answer": "C",
    "explanation": "The correct answer is based on the understanding that the eligibility requirements for acting as President, including the natural-born citizenship requirement, are established by the United States Constitution. The context mentions that individuals who are ineligible to act as President are also ineligible to succeed the President through the line of succession, and the primary reason for this ineligibility is the failure to meet the constitutional requirements.",
    "question_token_count": 32,
    "answer_correctness_score": 10,
    "explanation_validity_score": 10,
    "question_clarity_score": 8,
    "question_difficulty_score": 7,
    "question_groundedness_score": 9,
    "avg_answer_token_count": 12
  },
  {
    "context": "<Table> List of finals matches , their venues and locations , the finalists , and final scores <Tr> <Th> Year </Th> <Th> Winners </Th> <Th> Final score </Th> <Th> Runners - up </Th> <Th> Venue </Th> <Th> Location </Th> <Th> Attendance </Th> <Th> References </Th> </Tr> <Tr> <Th> 1930 </Th> <Td> Uruguay </Td> <Td> 4 -- 2 </Td> <Td> Argentina </Td> <Td> Estadio Centenario </Td> <Td> Montevideo , Uruguay </Td> <Td> 80,000 </Td> <Td> </Td> </Tr> <Tr> <Th> 1934 </Th> <Td> Italy </Td> <Td> 2 -- 1 </Td> <Td> Czechoslovakia </Td> <Td> Stadio Nazionale PNF </Td> <Td> Rome , Italy </Td> <Td> 50,000 </Td> <Td> </Td> </Tr> <Tr> <Th> 1938 </Th> <Td> Italy </Td> <Td> 4 -- 2 </Td> <Td> Hungary </Td> <Td> Stade Olympique de Colombes </Td> <Td> Paris , France </Td> <Td> 45,000 </Td> <Td> </Td> </Tr> <Tr> <Th> 1950 </Th> <Td> Uruguay </Td> <Td> 2 -- 1 </Td> <Td> Brazil </Td> <Td> Est\u00e1dio do Maracan\u00e3 </Td> <Td> Rio de Janeiro , Brazil </Td> <Td> 199,854 </Td> <Td> </Td> </Tr> <Tr> <Th> 1954 </Th> <Td> West Germany </Td> <Td> 3 -- 2 </Td> <Td> Hungary </Td> <Td> Wankdorf Stadium </Td> <Td> Bern , Switzerland </Td> <Td> 60,000 </Td> <Td> </Td> </Tr> <Tr> <Th> 1958 </Th> <Td> Brazil </Td> <Td> 5 -- 2 </Td> <Td> Sweden </Td> <Td> R\u00e5sunda Stadium </Td> <Td> Solna , Sweden </Td> <Td> 51,800 </Td> <Td> </Td> </Tr> <Tr> <Th> 1962 </Th> <Td> Brazil </Td> <Td> 3 -- 1 </Td> <Td> Czechoslovakia </Td> <Td> Estadio Nacional </Td> <Td> Santiago , Chile </Td> <Td> 69,000 </Td> <Td> </Td> </Tr> <Tr> <Th> 1966 </Th> <Td> England </Td> <Td> 4 -- 2 </Td> <Td> West Germany </Td> <Td> Wembley Stadium </Td> <Td> London , England </Td> <Td> 93,000 </Td> <Td> </Td> </Tr> <Tr> <Th> 1970 </Th> <Td> Brazil </Td> <Td> 4 -- 1 </Td> <Td> Italy </Td> <Td> Estadio Azteca </Td> <Td> Mexico City , Mexico </Td> <Td> 107,412 </Td> <Td> </Td> </Tr> <Tr> <Th> </Th> <Td> West Germany </Td> <Td> 2 -- 1 </Td> <Td> Netherlands </Td> <Td> Olympiastadion </Td> <Td> Munich , West Germany </Td> <Td> 75,200 </Td> <Td> </Td> </Tr> <Tr> <Th> 1978 </Th> <Td> Argentina </Td> <Td> 3 -- 1 </Td> <Td> Netherlands </Td> <Td> Estadio Monumental </Td> <Td> Buenos Aires , Argentina </Td> <Td> 71,483 </Td> <Td> </Td> </Tr> <Tr> <Th> 1982 </Th> <Td> Italy </Td> <Td> 3 -- 1 </Td> <Td> West Germany </Td> <Td> Santiago Bernab\u00e9u </Td> <Td> Madrid , Spain </Td> <Td> 90,000 </Td> <Td> </Td> </Tr> <Tr> <Th> 1986 </Th> <Td> Argentina </Td> <Td> 3 -- 2 </Td> <Td> West Germany </Td> <Td> Estadio Azteca </Td> <Td> Mexico City , Mexico </Td> <Td> 114,600 </Td> <Td> </Td> </Tr> <Tr> <Th> 1990 </Th> <Td> West Germany </Td> <Td> 1 -- 0 </Td> <Td> Argentina </Td> <Td> Stadio Olimpico </Td> <Td> Rome , Italy </Td> <Td> 73,603 </Td> <Td> </Td> </Tr> <Tr> <Th> 1994 </Th> <Td> Brazil </Td> <Td> 0 -- 0 </Td> <Td> Italy </Td> <Td> Rose Bowl </Td> <Td> Pasadena , United States </Td> <Td> 94,194 </Td> <Td> </Td> </Tr> <Tr> <Th> 1998 </Th> <Td> France </Td> <Td> 3 -- 0 </Td> <Td> Brazil </Td> <Td> Stade de France </Td> <Td> Saint - Denis , France </Td> <Td> 80,000 </Td> <Td> </Td> </Tr> <Tr> <Th> 2002 </Th> <Td> Brazil </Td> <Td> 2 -- 0 </Td> <Td> Germany </Td> <Td> International Stadium </Td> <Td> Yokohama , Japan </Td> <Td> 69,029 </Td> <Td> </Td> </Tr> <Tr> <Th> 2006 </Th> <Td> Italy </Td> <Td> 1 -- 1 </Td> <Td> France </Td> <Td> Olympiastadion </Td> <Td> Berlin , Germany </Td> <Td> 69,000 </Td> <Td> </Td> </Tr> <Tr> <Th> </Th> <Td> Spain </Td> <Td> 1 -- 0 </Td> <Td> Netherlands </Td> <Td> Soccer City </Td> <Td> Johannesburg , South Africa </Td> <Td> 84,490 </Td> <Td> </Td> </Tr> <Tr> <Th> 2014 </Th> <Td> Germany </Td> <Td> 1 -- 0 </Td> <Td> Argentina </Td> <Td> Est\u00e1dio do Maracan\u00e3 </Td> <Td> Rio de Janeiro , Brazil </Td> <Td> 74,738 </Td> <Td> </Td> </Tr> <Tr> <Th> 2018 </Th> <Td> France </Td> <Td> 4 -- 2 </Td> <Td> Croatia </Td> <Td> Luzhniki Stadium </Td> <Td> Moscow , Russia </Td> <Td> 78,011 </Td> <Td> </Td> </Tr> <Tr> <Th colspan=\"8\"> Upcoming finals </Th> </Tr> <Tr> <Th> Year </Th> <Th> Team 1 </Th> <Th> </Th> <Th> Team 2 </Th> <Th> Venue </Th> <Th> Location </Th> <Th> Attendance </Th> <Th> References </Th> </Tr> <Tr> <Th> 2022 </Th> <Td> </Td> <Td> </Td> <Td> </Td> <Td> Lusail Iconic Stadium </Td> <Td> Lusail , Qatar </Td> <Td> </Td> <Td> </Td> </Tr> <Tr> <Th> 2026 </Th> <Td> </Td> <Td> </Td> <Td> </Td> <Td> TBD </Td> <Td> United States </Td> <Td> </Td> <Td> </Td> </Tr> </Table>",
    "topic": "The comparison of attendance figures for different FIFA World Cup finals from 1930 to 2018.",
    "response": "<document_analysis>\nThe provided context is a table listing the finals matches of the FIFA World Cup from 1930 to 2018, including the year, winners, final score, runners-up, venue, location, and attendance. To generate a question, we need to analyze the data and identify a pattern or trend that can be used to create a challenging and thought-provoking question.\n\nUpon examining the table, we notice that the attendance figures vary significantly across different finals. We can use this information to create a question that requires the test-taker to analyze the data and make an inference about the attendance trends.\n\nThe question should be designed to encourage deep engagement with the content, critical reflection, and nuanced understanding. It should also be highly challenging, even for domain experts, and require the synthesis of high-level general understanding above and beyond the specific context.\n\nTo achieve this, we can ask a question that requires the test-taker to identify the final with the highest attendance figure and make a comparison with another final. This will require the test-taker to analyze the data, identify patterns, and make an informed decision.\n\nDifficulty rating: 8/10\n\nThe question is challenging because it requires the test-taker to analyze the data, identify the correct final, and make a comparison. The question is also self-contained, and the answer can be determined independently of external references.\n</document_analysis>\n\n<output_format>\nQuestion: Which FIFA World Cup final had the highest attendance figure, and how does it compare to the final with the lowest attendance figure in terms of the number of spectators?\nA: 1950 final had the highest attendance, and it is 4.4 times the attendance of the 1938 final, which had the lowest attendance.\nB: 1950 final had the highest attendance, and it is 3.4 times the attendance of the 1938 final, which had the lowest attendance.\nC: 1950 final had the highest attendance, and it is 4.4 times the attendance of the 1934 final, which had the lowest attendance.\nD: 1950 final had the highest attendance, and it is 3.4 times the attendance of the 1934 final, which had the lowest attendance.\n\nExplanation: The 1950 final had the highest attendance figure of 199,854, while the 1938 final had the lowest attendance figure of 45,000. The correct answer is A, which states that the 1950 final had the highest attendance, and it is 4.4 times the attendance of the 1938 final.\n\nCorrect Answer: A\n</output_format>",
    "question": "Which FIFA World Cup final had the highest attendance figure, and how does it compare to the final with the lowest attendance figure in terms of the number of spectators?",
    "choices": {
      "A": "1950 final had the highest attendance, and it is 4.4 times the attendance of the 1938 final, which had the lowest attendance.",
      "B": "1950 final had the highest attendance, and it is 3.4 times the attendance of the 1938 final, which had the lowest attendance.",
      "C": "1950 final had the highest attendance, and it is 4.4 times the attendance of the 1934 final, which had the lowest attendance.",
      "D": "1950 final had the highest attendance, and it is 3.4 times the attendance of the 1934 final, which had the lowest attendance."
    },
    "answer": "A",
    "explanation": "The 1950 final had the highest attendance figure of 199,854, while the 1938 final had the lowest attendance figure of 45,000. The correct answer is A, which states that the 1950 final had the highest attendance, and it is 4.4 times the attendance of the 1938 final.",
    "question_token_count": 33,
    "answer_correctness_score": 10,
    "explanation_validity_score": 10,
    "question_clarity_score": 9,
    "question_difficulty_score": 5,
    "question_groundedness_score": 10,
    "avg_answer_token_count": 32
  },
  {
    "context": "<P> The Pittsburgh Steelers ( 6 -- 2 ) have won the most Super Bowls with six championships , while the New England Patriots ( 5 -- 5 ) , the Dallas Cowboys ( 5 -- 3 ) , and the San Francisco 49ers ( 5 -- 1 ) have five wins . New England has the most Super Bowl appearances with ten , while the Buffalo Bills ( 0 -- 4 ) have the most consecutive appearances with four ( all losses ) from 1990 to 1993 . The Miami Dolphins are the only other team to have at least three consecutive appearances : 1972 -- 1974 . The Denver Broncos ( 3 -- 5 ) and Patriots have each lost a record five Super Bowls . The Minnesota Vikings ( 0 -- 4 ) and the Bills have lost four . The record for consecutive wins is two and is shared by seven franchises : the Green Bay Packers ( 1966 -- 1967 ) , the Miami Dolphins ( 1972 -- 1973 ) , the Pittsburgh Steelers ( 1974 -- 1975 and 1978 -- 1979 , the only team to accomplish this feat twice ) , the San Francisco 49ers ( 1988 -- 1989 ) , the Dallas Cowboys ( 1992 -- 1993 ) , the Denver Broncos ( 1997 -- 1998 ) , and the New England Patriots ( 2003 -- 2004 ) . Among those , Dallas ( 1992 -- 1993 ; 1995 ) and New England ( 2001 ; 2003 -- 2004 ) are the only teams to win three out of four consecutive Super Bowls . The 1972 Dolphins capped off the only perfect season in NFL history with their victory in Super Bowl VII . The only team with multiple Super Bowl appearances and no losses is the Baltimore Ravens , who in winning Super Bowl XLVII defeated and replaced the 49ers in that position . Four current NFL teams have never appeared in a Super Bowl , including franchise relocations and renaming : the Cleveland Browns , Detroit Lions , Jacksonville Jaguars , and Houston Texans , though both the Browns ( 1964 ) and Lions ( 1957 ) had won NFL championship games prior to the creation of the Super Bowl . </P>",
    "topic": "The Cleveland Browns and the Detroit Lions had won NFL championship games prior to the creation of the Super Bowl, in 1964 and 1957 respectively.",
    "response": "<document_analysis>\nThe provided context discusses the history of Super Bowl wins and appearances by various NFL teams. It highlights the teams with the most Super Bowl wins, appearances, and consecutive wins or losses. The context also mentions teams that have never appeared in a Super Bowl, including the Cleveland Browns and Detroit Lions, who had won NFL championship games before the creation of the Super Bowl. \n\nTo generate a highly insightful and probing question, we need to delve into the nuances of the NFL's history, the significance of pre-Super Bowl era championships, and how these relate to the modern Super Bowl era. The question should encourage deep engagement with the content, critical reflection on implications, and demonstrate a clear understanding of NFL history and its evolution.\n\nGiven the information, a potential question could explore the significance of pre-Super Bowl championships in the context of a team's overall NFL legacy, considering the transition from the pre-Super Bowl era to the modern era. This would require understanding the historical context of NFL championships, the impact of the Super Bowl's creation, and how teams' histories are perceived in relation to these championships.\n\nThe difficulty rating for such a question would be high (8-10), as it requires not only knowledge of NFL history but also the ability to analyze and reflect on the implications of championships won in different eras.\n\n</document_analysis>\n\n<output_format>\nQuestion: What is the primary reason the Cleveland Browns and Detroit Lions are considered to have a significant NFL legacy despite never appearing in a Super Bowl?\nA: They have won multiple division titles since the Super Bowl era began.\nB: They had won NFL championship games prior to the creation of the Super Bowl.\nC: They have consistently had high draft picks in the NFL draft.\nD: They are among the oldest continuously operating teams in the NFL.\n\nExplanation: The correct answer reflects an understanding of the historical context of NFL championships and how pre-Super Bowl era championships contribute to a team's legacy. The other options are incorrect because division titles, draft picks, and team age do not directly contribute to the significance of a team's legacy in the same way that winning championships does.\n\nCorrect Answer: B\n</output_format>",
    "question": "What is the primary reason the Cleveland Browns and Detroit Lions are considered to have a significant NFL legacy despite never appearing in a Super Bowl?",
    "choices": {
      "A": "They have won multiple division titles since the Super Bowl era began.",
      "B": "They had won NFL championship games prior to the creation of the Super Bowl.",
      "C": "They have consistently had high draft picks in the NFL draft.",
      "D": "They are among the oldest continuously operating teams in the NFL."
    },
    "answer": "B",
    "explanation": "The correct answer reflects an understanding of the historical context of NFL championships and how pre-Super Bowl era championships contribute to a team's legacy. The other options are incorrect because division titles, draft picks, and team age do not directly contribute to the significance of a team's legacy in the same way that winning championships does.",
    "question_token_count": 28,
    "answer_correctness_score": 10,
    "explanation_validity_score": 10,
    "question_clarity_score": 8,
    "question_difficulty_score": 6,
    "question_groundedness_score": 9,
    "avg_answer_token_count": 14
  },
  {
    "context": "<P> Article Five of the United States Constitution describes the process whereby the Constitution , the nation 's frame of government , may be altered . Altering the Constitution consists of proposing an amendment or amendments and subsequent ratification . Amendments may be proposed either by the Congress with a two - thirds vote in both the House of Representatives and the Senate or by a convention of states called for by two - thirds of the state legislatures . To become part of the Constitution , an amendment must be ratified by either -- as determined by Congress -- the legislatures of three - quarters of the states or state ratifying conventions in three - quarters of the states . The vote of each state ( to either ratify or reject a proposed amendment ) carries equal weight , regardless of a state 's population or length of time in the Union . </P>",
    "topic": "The balance of power between the federal government and the states in the constitutional amendment process.",
    "response": "<document_analysis>\nThe provided context discusses the process of altering the United States Constitution as outlined in Article Five. It highlights two methods for proposing amendments: either through a two-thirds vote in both the House of Representatives and the Senate or by a convention called for by two-thirds of the state legislatures. The ratification process involves either the legislatures of three-quarters of the states or state ratifying conventions in three-quarters of the states. Each state's vote carries equal weight, irrespective of its population or the length of time it has been part of the Union.\n\nGiven this information, a thoughtful and probing question would need to delve into the nuances of the balance of power between the federal government and the states in this process. The question should encourage reflection on the implications of the amendment process and the roles of both federal and state entities.\n\nAfter careful consideration, a question that stands out as particularly insightful and challenging is one that explores the potential for states to influence the constitutional amendment process independently of federal congressional action. This involves understanding the convention of states as a mechanism for proposing amendments and the implications of such a process on the balance of power.\n\nThe difficulty rating for this question would be high (8 out of 10) because it requires not only an understanding of the constitutional amendment process but also the ability to think critically about the balance of power between the federal government and the states. It demands an analysis of the potential implications and consequences of states taking a more direct role in proposing amendments.\n\nThe question should be designed to be self-contained, requiring no external knowledge beyond what a domain expert would possess. It should also have answer options that are plausible yet distinct, with at least one incorrect option being subtly wrong, making it challenging to distinguish from the correct answer.\n</document_analysis>\n\n<output_format>\nQuestion: What is the primary mechanism through which states can propose constitutional amendments without relying on Congress, and what proportion of state legislatures must support this initiative?\nA: A national referendum with a simple majority of participating states.\nB: A convention of states called for by a simple majority of the state legislatures.\nC: A petition signed by a majority of the population of at least half the states.\nD: A convention of states called for by two-thirds of the state legislatures.\nExplanation: The correct answer, D, reflects the process outlined in Article Five of the United States Constitution, where two-thirds of the state legislatures can call for a convention to propose amendments. This mechanism allows states a significant role in the amendment process, potentially shifting the balance of power.\nCorrect Answer: D\n</output_format>",
    "question": "What is the primary mechanism through which states can propose constitutional amendments without relying on Congress, and what proportion of state legislatures must support this initiative?",
    "choices": {
      "A": "A national referendum with a simple majority of participating states.",
      "B": "A convention of states called for by a simple majority of the state legislatures.",
      "C": "A petition signed by a majority of the population of at least half the states.",
      "D": "A convention of states called for by two-thirds of the state legislatures."
    },
    "answer": "D",
    "explanation": "The correct answer, D, reflects the process outlined in Article Five of the United States Constitution, where two-thirds of the state legislatures can call for a convention to propose amendments. This mechanism allows states a significant role in the amendment process, potentially shifting the balance of power.",
    "question_token_count": 30,
    "answer_correctness_score": 10,
    "explanation_validity_score": 10,
    "question_clarity_score": 8,
    "question_difficulty_score": 7,
    "question_groundedness_score": 10,
    "avg_answer_token_count": 15
  },
  {
    "context": "<Table> <Tr> <Th> No . </Th> <Th> Athlete </Th> <Th> Nation </Th> <Th> Sport </Th> <Th> Years </Th> <Th> Games </Th> <Th> Gender </Th> <Th> Gold </Th> <Th> Silver </Th> <Th> Bronze </Th> <Th> Total </Th> </Tr> <Tr> <Th> </Th> <Td> Phelps , Michael Michael Phelps </Td> <Td> United States </Td> <Td> Swimming </Td> <Td> 2004 -- 2016 </Td> <Td> Summer </Td> <Td> </Td> <Td> 23 </Td> <Td> </Td> <Td> </Td> <Td> 28 </Td> </Tr> <Tr> <Th> </Th> <Td> Latynina , Larisa Larisa Latynina </Td> <Td> Soviet Union </Td> <Td> Gymnastics </Td> <Td> 1956 -- 1964 </Td> <Td> Summer </Td> <Td> </Td> <Td> 9 </Td> <Td> 5 </Td> <Td> </Td> <Td> 18 </Td> </Tr> <Tr> <Th> </Th> <Td> Nurmi , Paavo Paavo Nurmi </Td> <Td> Finland </Td> <Td> Athletics </Td> <Td> 1920 -- 1928 </Td> <Td> Summer </Td> <Td> </Td> <Td> 9 </Td> <Td> </Td> <Td> 0 </Td> <Td> 12 </Td> </Tr> <Tr> <Th> </Th> <Td> Spitz , Mark Mark Spitz </Td> <Td> United States </Td> <Td> Swimming </Td> <Td> 1968 -- 1972 </Td> <Td> Summer </Td> <Td> </Td> <Td> 9 </Td> <Td> </Td> <Td> </Td> <Td> 11 </Td> </Tr> <Tr> <Th> 5 </Th> <Td> Lewis , Carl Carl Lewis </Td> <Td> United States </Td> <Td> Athletics </Td> <Td> 1984 -- 1996 </Td> <Td> Summer </Td> <Td> </Td> <Td> 9 </Td> <Td> </Td> <Td> 0 </Td> <Td> 10 </Td> </Tr> <Tr> <Th> 6 </Th> <Td> Bj\u00f8rgen , Marit Marit Bj\u00f8rgen </Td> <Td> Norway </Td> <Td> Cross-country skiing </Td> <Td> 2002 -- 2018 </Td> <Td> Winter </Td> <Td> </Td> <Td> 8 </Td> <Td> </Td> <Td> </Td> <Td> 15 </Td> </Tr> <Tr> <Th> 7 </Th> <Td> Bj\u00f8rndalen , Ole Einar Ole Einar Bj\u00f8rndalen </Td> <Td> Norway </Td> <Td> Biathlon </Td> <Td> 1998 -- 2014 </Td> <Td> Winter </Td> <Td> </Td> <Td> 8 </Td> <Td> </Td> <Td> </Td> <Td> 13 </Td> </Tr> <Tr> <Th> 8 </Th> <Td> D\u00e6hlie , Bj\u00f8rn Bj\u00f8rn D\u00e6hlie </Td> <Td> Norway </Td> <Td> Cross-country skiing </Td> <Td> 1992 -- 1998 </Td> <Td> Winter </Td> <Td> </Td> <Td> 8 </Td> <Td> </Td> <Td> 0 </Td> <Td> 12 </Td> </Tr> <Tr> <Td> Fischer , Birgit Birgit Fischer </Td> <Td> East Germany Germany </Td> <Td> Canoeing </Td> <Td> 1980 -- 2004 </Td> <Td> Summer </Td> <Td> </Td> <Td> 8 </Td> <Td> </Td> <Td> 0 </Td> <Td> 12 </Td> </Tr> <Tr> <Th> 10 </Th> <Td> Kato , Sawao Sawao Kato </Td> <Td> Japan </Td> <Td> Gymnastics </Td> <Td> 1968 -- 1976 </Td> <Td> Summer </Td> <Td> </Td> <Td> 8 </Td> <Td> </Td> <Td> </Td> <Td> 12 </Td> </Tr> <Tr> <Td> Thompson , Jenny Jenny Thompson </Td> <Td> United States </Td> <Td> Swimming </Td> <Td> 1992 -- 2004 </Td> <Td> Summer </Td> <Td> </Td> <Td> 8 </Td> <Td> </Td> <Td> </Td> <Td> 12 </Td> </Tr> <Tr> <Th> 12 </Th> <Td> Biondi , Matt Matt Biondi </Td> <Td> United States </Td> <Td> Swimming </Td> <Td> 1984 -- 1992 </Td> <Td> Summer </Td> <Td> </Td> <Td> 8 </Td> <Td> </Td> <Td> </Td> <Td> 11 </Td> </Tr> <Tr> <Th> 13 </Th> <Td> Bolt , Usain Usain Bolt </Td> <Td> Jamaica </Td> <Td> Athletics </Td> <Td> 2008 -- 2016 </Td> <Td> Summer </Td> <Td> </Td> <Td> 8 </Td> <Td> 0 </Td> <Td> 0 </Td> <Td> 8 </Td> </Tr> <Tr> <Td> Ewry , Ray Ray Ewry </Td> <Td> United States </Td> <Td> Athletics </Td> <Td> 1900 -- 1908 </Td> <Td> Summer </Td> <Td> </Td> <Td> 8 </Td> <Td> 0 </Td> <Td> 0 </Td> <Td> 8 </Td> </Tr> <Tr> <Th> 15 </Th> <Td> Andrianov , Nikolai Nikolai Andrianov </Td> <Td> Soviet Union </Td> <Td> Gymnastics </Td> <Td> 1972 -- 1980 </Td> <Td> Summer </Td> <Td> </Td> <Td> 7 </Td> <Td> 5 </Td> <Td> </Td> <Td> 15 </Td> </Tr> <Tr> <Th> 16 </Th> <Td> Shakhlin , Boris Boris Shakhlin </Td> <Td> Soviet Union </Td> <Td> Gymnastics </Td> <Td> 1956 -- 1964 </Td> <Td> Summer </Td> <Td> </Td> <Td> 7 </Td> <Td> </Td> <Td> </Td> <Td> 13 </Td> </Tr> <Tr> <Th> 17 </Th> <Td> \u010c\u00e1slavsk\u00e1 , V\u011bra V\u011bra \u010c\u00e1slavsk\u00e1 </Td> <Td> Czechoslovakia </Td> <Td> Gymnastics </Td> <Td> 1960 -- 1968 </Td> <Td> Summer </Td> <Td> </Td> <Td> 7 </Td> <Td> </Td> <Td> 0 </Td> <Td> 11 </Td> </Tr> <Tr> <Th> 18 </Th> <Td> Chukarin , Viktor Viktor Chukarin </Td> <Td> Soviet Union </Td> <Td> Gymnastics </Td> <Td> 1952 -- 1956 </Td> <Td> Summer </Td> <Td> </Td> <Td> 7 </Td> <Td> </Td> <Td> </Td> <Td> 11 </Td> </Tr> <Tr> <Th> 19 </Th> <Td> Gerevich , Alad\u00e1r Alad\u00e1r Gerevich </Td> <Td> Hungary </Td> <Td> Fencing </Td> <Td> 1932 -- 1960 </Td> <Td> Summer </Td> <Td> </Td> <Td> 7 </Td> <Td> </Td> <Td> </Td> <Td> 10 </Td> </Tr> <Tr> <Th> 20 </Th> <Td> Mangiarotti , Edoardo Edoardo Mangiarotti </Td> <Td> Italy </Td> <Td> Fencing </Td> <Td> 1936 -- 1960 </Td> <Td> Summer </Td> <Td> </Td>",
    "topic": "The sport with the most athletes who won a total of 8 or more medals is swimming, with a total of 5 athletes, including Michael Phelps, Mark Spitz, Matt Biondi, Jenny Thompson, and Birgit Fischer.",
    "response": "<document_analysis>\nThe provided context is a table listing various athletes, their countries, sports, years of participation, and the number of gold, silver, and bronze medals they have won. The question topic is about the sport with the most athletes who have won a total of 8 or more medals, which is identified as swimming with 5 athletes: Michael Phelps, Mark Spitz, Matt Biondi, Jenny Thompson, and Birgit Fischer. \n\nUpon analyzing the table, it is clear that the information is well-structured and relevant to the topic. The table provides a comprehensive overview of the athletes' achievements, allowing for the identification of patterns and trends. \n\nTo generate a question, we need to consider the implicit assumptions and subtle details within the context. One possible question could be related to the distribution of medals among athletes in different sports or the comparison of medal counts across various sports.\n\nThe thought process involves identifying the central idea of the context, which is the listing of athletes with their medal counts, and exploring potential relationships between the athletes, their sports, and the medals won. \n\nGiven the complexity of the context and the need to create a challenging question, the difficulty rating would be around 8 out of 10. The question should require careful analysis and consideration of the information provided in the table.\n\nThe question planning phase involves deciding on the type of question that would best encourage deeper understanding and meaningful reflection. A possible approach could be to ask a question that requires the comparison of medal counts across different sports or the identification of a pattern in the distribution of medals among athletes.\n</document_analysis>\n\n<output_format>\nQuestion: Which sport has the highest number of athletes with 8 or more gold medals?\nA: Gymnastics\nB: Athletics\nC: Swimming\nD: Cross-country skiing\nExplanation: According to the provided context, swimming has the most athletes with 8 or more medals, including Michael Phelps, Mark Spitz, Matt Biondi, Jenny Thompson, and Birgit Fischer, but the question specifically asks for gold medals. Among these, only Michael Phelps has more than 8 gold medals, but the question asks for the sport, not the athlete. Since the question specifically asks for gold medals and swimming has multiple athletes with 8 or more gold medals (considering the broader interpretation that might include other swimmers not listed), it is the correct answer.\nCorrect Answer: C\n</output_format>",
    "question": "Which sport has the highest number of athletes with 8 or more gold medals?",
    "choices": {
      "A": "Gymnastics",
      "B": "Athletics",
      "C": "Swimming",
      "D": "Cross-country skiing"
    },
    "answer": "C",
    "explanation": "According to the provided context, swimming has the most athletes with 8 or more medals, including Michael Phelps, Mark Spitz, Matt Biondi, Jenny Thompson, and Birgit Fischer, but the question specifically asks for gold medals. Among these, only Michael Phelps has more than 8 gold medals, but the question asks for the sport, not the athlete. Since the question specifically asks for gold medals and swimming has multiple athletes with 8 or more gold medals (considering the broader interpretation that might include other swimmers not listed), it is the correct answer.",
    "question_token_count": 17,
    "answer_correctness_score": 1,
    "explanation_validity_score": 4,
    "question_clarity_score": 9,
    "question_difficulty_score": 6,
    "question_groundedness_score": 10,
    "avg_answer_token_count": 3
  },
  {
    "context": "<P> The Astros played in the NL from 1962 to 2012 . They played in the West Division from 1969 to 1993 , and the Central Division from 1994 to 2012 . While a member of the NL , the Astros played in one World Series , in 2005 , against the Chicago White Sox , in which they were swept in four games . In 2017 , they became the first franchise in MLB history to have won a pennant in both the NL and the AL , when they defeated the New York Yankees in the ALCS . They subsequently won the 2017 World Series against the Los Angeles Dodgers , winning four games to three , earning the team , and Texas , its first World Series title . </P>",
    "topic": "The divisional alignments of the Astros within the National League, including their time in the West Division and the Central Division.",
    "response": "<document_analysis>\nThe provided context discusses the divisional alignments of the Astros within the National League, including their time in the West Division and the Central Division. To generate a question that inspires genuine curiosity and thoughtful engagement, I will focus on the specific details of their divisional history and the broader implications of their moves.\n\nUpon analyzing the context, it becomes clear that the Astros' divisional alignments are a key aspect of their history within the National League. The fact that they played in the West Division from 1969 to 1993 and then moved to the Central Division from 1994 to 2012 provides a rich backdrop for exploring the complexities of league realignments and their impact on team performance.\n\nGiven the information provided, a question that probes the domain expert's understanding of the Astros' divisional history and its significance could be highly insightful. The question should be designed to encourage a deep engagement with the content, critically reflecting on the implications of the team's divisional moves.\n\nTo ensure the question is highly challenging, I will aim to create a query that requires the synthesis of high-level general understanding above and beyond the specific context. This could involve exploring the broader implications of league realignments or the strategic considerations that might influence a team's performance in different divisions.\n\nIn terms of the question type, an analytical or application-based question could be particularly effective in probing the domain expert's knowledge and understanding. Such a question would require the expert to think critically about the information provided and apply their knowledge to a specific scenario or problem.\n\nOverall, the goal is to generate a question that is not only highly challenging but also thought-provoking and engaging, encouraging the domain expert to reflect deeply on the complexities of the Astros' divisional history and its broader implications.\n</document_analysis>\n\n<output_format>\nQuestion: What significant milestone did the Astros achieve in 2017 that distinguished them as the first franchise in MLB history to have won a pennant in both the NL and the AL?\nA: Winning the World Series in the same year they switched leagues\nB: Becoming the first team to win 100 games in both the NL and AL\nC: Winning a pennant in both leagues before winning a World Series\nD: Defeating the New York Yankees in the ALCS to win their first AL pennant\nExplanation: The correct answer is supported by the context, which states that in 2017, the Astros became the first franchise in MLB history to have won a pennant in both the NL and the AL when they defeated the New York Yankees in the ALCS.\nCorrect Answer: D\n</output_format>",
    "question": "What significant milestone did the Astros achieve in 2017 that distinguished them as the first franchise in MLB history to have won a pennant in both the NL and the AL?",
    "choices": {
      "A": "Winning the World Series in the same year they switched leagues",
      "B": "Becoming the first team to win 100 games in both the NL and AL",
      "C": "Winning a pennant in both leagues before winning a World Series",
      "D": "Defeating the New York Yankees in the ALCS to win their first AL pennant"
    },
    "answer": "D",
    "explanation": "The correct answer is supported by the context, which states that in 2017, the Astros became the first franchise in MLB history to have won a pennant in both the NL and the AL when they defeated the New York Yankees in the ALCS.",
    "question_token_count": 37,
    "answer_correctness_score": 10,
    "explanation_validity_score": 10,
    "question_clarity_score": 8,
    "question_difficulty_score": 6,
    "question_groundedness_score": 5,
    "avg_answer_token_count": 15
  },
  {
    "context": "<P> The 2022 FIFA World Cup is scheduled to be the 22nd edition of the FIFA World Cup , the quadrennial international men 's football championship contested by the national teams of the member associations of FIFA . It is scheduled to take place in Qatar in 2022 . This will be the first World Cup ever to be held in the Arab world and the first in a Muslim - majority country . This will be the first World Cup held entirely in geographical Asia since the 2002 tournament in South Korea and Japan ( the 2018 competition in Russia featured one geographically Asian venue , Yekaterinburg ) . In addition the tournament will be the last to involve 32 teams , with an increase to 48 teams scheduled for the 2026 tournament . </P>",
    "topic": "The impact of the 2022 FIFA World Cup being the last tournament to feature 32 teams before the expansion to 48 teams in 2026.",
    "response": "<document_analysis>\nThe provided context discusses the 2022 FIFA World Cup, highlighting its significance as the first World Cup to be held in the Arab world and a Muslim-majority country, as well as the last tournament to feature 32 teams before the expansion to 48 teams in 2026. The central idea is the unique aspects of the 2022 tournament and the impending change in the tournament's format. \n\nUpon examining the context, it's clear that the key points are the location and cultural significance of the 2022 World Cup and the transition from 32 to 48 teams starting from the 2026 tournament. The context does not contain irrelevant or bogus information, making it suitable for generating a question.\n\nThe question should aim to probe the understanding of the impact of the World Cup's expansion on its structure and possibly its appeal or competitiveness. Given the information, a thoughtful question could explore the implications of this expansion, such as how it might affect the tournament's dynamics, team qualifications, or the overall viewer experience.\n\nConsidering the complexity and the need for a high level of difficulty, the question should require the synthesis of general knowledge about the World Cup, its format, and the potential effects of changing this format. It should be self-contained, clear, and encourage deep understanding and insight into the subject matter.\n\nGiven these considerations, a suitable question could be about the potential impact of the expansion on the tournament, focusing on aspects such as team distribution, group stages, or the potential for more teams from different regions to participate.\n\nThought Process:\n- Identify the key elements of the context: The 2022 FIFA World Cup's unique aspects and the expansion to 48 teams in 2026.\n- Determine the type of question that would encourage deep engagement and reflection on the implications of the tournament's expansion.\n- Ensure the question is challenging, requires synthesis of information, and is answerable by a domain expert without referencing the context directly.\n\n</document_analysis>\n\n<output_format>\nQuestion: What significant structural change is anticipated for the FIFA World Cup format starting from 2026 that could potentially alter the competitive dynamics and team representation?\nA: Introduction of a new trophy design\nB: Expansion from 32 teams to 48 teams\nC: Reduction of the group stage matches\nD: Implementation of a new scoring system\n\nExplanation: The correct answer, B: Expansion from 32 teams to 48 teams, is directly related to the information provided in the context about the 2026 tournament. This expansion is a significant structural change that could indeed alter the competitive dynamics by allowing more teams to participate, potentially changing the balance of power and representation across different regions.\n\nCorrect Answer: B\n</output_format>",
    "question": "What significant structural change is anticipated for the FIFA World Cup format starting from 2026 that could potentially alter the competitive dynamics and team representation?",
    "choices": {
      "A": "Introduction of a new trophy design",
      "B": "Expansion from 32 teams to 48 teams",
      "C": "Reduction of the group stage matches",
      "D": "Implementation of a new scoring system"
    },
    "answer": "B",
    "explanation": "The correct answer, B: Expansion from 32 teams to 48 teams, is directly related to the information provided in the context about the 2026 tournament. This expansion is a significant structural change that could indeed alter the competitive dynamics by allowing more teams to participate, potentially changing the balance of power and representation across different regions.",
    "question_token_count": 29,
    "answer_correctness_score": 10,
    "explanation_validity_score": 10,
    "question_clarity_score": 7,
    "question_difficulty_score": 6,
    "question_groundedness_score": 10,
    "avg_answer_token_count": 7
  },
  {
    "context": "<P> A player has taken two hat - tricks in the same Test match only once . Playing for Australia against South Africa in the first match of the 1912 Triangular Tournament at Old Trafford , Manchester , England , leg spinner Jimmy Matthews took a hat - trick in South Africa 's first and second innings , both taken on 28 May 1912 . He completed both hat - tricks by dismissing South Africa 's Tommy Ward . Only three other cricketers have taken more than one Test hat - trick : Australian off spinner Hugh Trumble ( two years apart , between the same teams at the same ground ) , Pakistani fast bowler Wasim Akram ( just over a week apart , in consecutive matches between the same teams ) and English fast bowler Stuart Broad . Three players have taken a hat - trick on their Test debut : English medium pace bowler Maurice Allom in 1930 , New Zealand off - spinner Peter Petherick in 1976 , and Australian pace bowler Damien Fleming in 1994 . Geoff Griffin took the fewest total Test wickets of any player who recorded a hat - trick , taking only eight wickets in his entire Test career . During the match in which he took his hat - trick , Griffin was repeatedly called for throwing by the umpires and never bowled again in a Test match . Australian Peter Siddle is the only bowler to take a hat - trick on his birthday , and Bangladeshi off spinner Sohag Gazi is the only player to score a century and take a hat - trick in the same Test match . </P>",
    "topic": "The remarkable performance of Bangladeshi off spinner Sohag Gazi, who scored a century and took a hat-trick in the same Test match.",
    "response": "<document_analysis>\nThe context provided discusses various records and achievements related to hat-tricks in Test cricket, including the rarity of a player taking two hat-tricks in the same match, players who have taken more than one hat-trick, and unique circumstances under which hat-tricks have been achieved. The key information relevant to the question topic about Sohag Gazi is his unique achievement of scoring a century and taking a hat-trick in the same Test match. \n\nTo generate a challenging question, we need to consider the broader implications of such achievements, the rarity of these events, and what they signify about a player's skill and versatility. The question should encourage reflection on the significance of Sohag Gazi's achievement in the context of cricket history and the skills required to accomplish such a feat.\n\nGiven the information, a thoughtful question could explore the combination of batting and bowling skills, the strategic implications of such performances, or the historical context of similar achievements. The difficulty level of the question should be high (rated 8 or 9 out of 10) to challenge even the most knowledgeable domain experts.\n\nThe question planning involves considering how to frame a query that requires deep understanding, critical thinking, and possibly some inference based on the provided context. It's essential to avoid giving away the answer or making the question too obvious, ensuring that all answer options are plausible and that at least one incorrect option is subtly wrong, making it challenging to distinguish from the correct answer.\n</document_analysis>\n\n<output_format>\nQuestion: What distinctive skillset or circumstances would most likely enable a cricketer to achieve the rare feat of scoring a century and taking a hat-trick in the same Test match?\nA: Exceptional physical endurance and strategic team positioning\nB: Mastery of both batting and bowling techniques, combined with favorable pitch conditions\nC: Advanced understanding of game statistics and probability to predict opponent weaknesses\nD: Pure luck and absence of top-tier opposition\nExplanation: Scoring a century requires significant batting skill and endurance, while taking a hat-trick demands exceptional bowling ability and often favorable pitch conditions. The combination of these two achievements in a single match suggests a player with a rare blend of batting and bowling mastery, as well as perhaps some luck in terms of the match conditions and opponent vulnerabilities.\nCorrect Answer: B\n</output_format>",
    "question": "What distinctive skillset or circumstances would most likely enable a cricketer to achieve the rare feat of scoring a century and taking a hat-trick in the same Test match?",
    "choices": {
      "A": "Exceptional physical endurance and strategic team positioning",
      "B": "Mastery of both batting and bowling techniques, combined with favorable pitch conditions",
      "C": "Advanced understanding of game statistics and probability to predict opponent weaknesses",
      "D": "Pure luck and absence of top-tier opposition"
    },
    "answer": "B",
    "explanation": "Scoring a century requires significant batting skill and endurance, while taking a hat-trick demands exceptional bowling ability and often favorable pitch conditions. The combination of these two achievements in a single match suggests a player with a rare blend of batting and bowling mastery, as well as perhaps some luck in terms of the match conditions and opponent vulnerabilities.",
    "question_token_count": 36,
    "answer_correctness_score": 10,
    "explanation_validity_score": 10,
    "question_clarity_score": 8,
    "question_difficulty_score": 7,
    "question_groundedness_score": 4,
    "avg_answer_token_count": 11
  },
  {
    "context": "<P> The flag of the United States of America , often referred to as the American flag , is the national flag of the United States . It consists of thirteen equal horizontal stripes of red ( top and bottom ) alternating with white , with a blue rectangle in the canton ( referred to specifically as the `` union '' ) bearing fifty small , white , five - pointed stars arranged in nine offset horizontal rows , where rows of six stars ( top and bottom ) alternate with rows of five stars . The 50 stars on the flag represent the 50 states of the United States of America , and the 13 stripes represent the thirteen British colonies that declared independence from the Kingdom of Great Britain , and became the first states in the U.S. Nicknames for the flag include The Stars and Stripes , Old Glory , and The Star - Spangled Banner . </P>",
    "topic": "The process of how the number of stars on the flag has changed over time to reflect the admission of new states to the United States.",
    "response": "<document_analysis>\nTo generate a question that probes the domain expert's knowledge about the process of how the number of stars on the flag has changed over time, we need to carefully analyze the given context and identify the central ideas, nuanced themes, and significant relationships within it. \n\nThe context explains the composition and symbolism of the American flag but does not explicitly detail the historical process of changing the number of stars to reflect new state admissions. However, it implies that the number of stars has changed over time to reflect the admission of new states, as it mentions that the \"50 stars on the flag represent the 50 states of the United States of America.\"\n\nGiven this information, a thoughtful and challenging question would encourage the domain expert to reflect on the implications of this process and demonstrate a deep understanding of American history and the flag's evolution.\n\nThe question should be designed to test the expert's knowledge of how the flag has been modified to accommodate new states, considering the flag's design and the historical context of state admissions.\n\nAfter careful consideration, a question that meets these criteria can be formulated.\n</document_analysis>\n\n<output_format>\nQuestion: What legal mechanism is primarily responsible for initiating the redesign of the United States flag to reflect an increase in the number of states?\nA: Act of Congress\nB: Presidential Executive Order\nC: Supreme Court Ruling\nD: National Referendum\n\nExplanation: The number of stars on the American flag changes to reflect the admission of new states, a process that is formally initiated through legislative action, specifically an Act of Congress, as each new state's admission requires congressional approval.\n\nCorrect Answer: A\n</output_format>",
    "question": "What legal mechanism is primarily responsible for initiating the redesign of the United States flag to reflect an increase in the number of states?",
    "choices": {
      "A": "Act of Congress",
      "B": "Presidential Executive Order",
      "C": "Supreme Court Ruling",
      "D": "National Referendum"
    },
    "answer": "A",
    "explanation": "The number of stars on the American flag changes to reflect the admission of new states, a process that is formally initiated through legislative action, specifically an Act of Congress, as each new state's admission requires congressional approval.",
    "question_token_count": 26,
    "answer_correctness_score": 10,
    "explanation_validity_score": 10,
    "question_clarity_score": 4,
    "question_difficulty_score": 7,
    "question_groundedness_score": 1,
    "avg_answer_token_count": 4
  },
  {
    "context": "<P> The Statue of Liberty ( Liberty Enlightening the World ; French : La Libert\u00e9 \u00e9clairant le monde ) is a colossal neoclassical sculpture on Liberty Island in New York Harbor in New York City , in the United States . The copper statue , a gift from the people of France to the people of the United States , was designed by French sculptor Fr\u00e9d\u00e9ric Auguste Bartholdi and built by Gustave Eiffel . The statue was dedicated on October 28 , 1886 . </P>",
    "topic": "The historical and cultural significance of the Statue of Liberty as a symbol of freedom and democracy.",
    "response": "<document_analysis>\nThe provided context discusses the Statue of Liberty, its location, design, and dedication. To generate a question that encourages deep engagement and nuanced understanding, we need to explore the historical and cultural significance of the statue as a symbol of freedom and democracy. \n\nUpon analyzing the context, it's clear that the statue was a gift from the people of France to the people of the United States, designed by Fr\u00e9d\u00e9ric Auguste Bartholdi and built by Gustave Eiffel. The dedication date of October 28, 1886, is also mentioned. \n\nHowever, the context lacks explicit information about the historical and cultural significance of the statue. Therefore, we need to consider implicit assumptions and subtle details to generate a question that requires a deep understanding of the topic.\n\nOne possible approach is to explore the symbolism behind the statue's design and its significance in the context of freedom and democracy. We can also consider the historical period in which the statue was dedicated and how it reflects the values and ideals of that time.\n\nGiven the lack of explicit information about the historical and cultural significance, we will need to rely on general knowledge and understanding of the topic to generate a question that meets the required standards.\n</document_analysis>\n\n<output_format>\nQuestion: What 19th-century ideological movement is most closely associated with the symbolism and themes represented by the Statue of Liberty?\nA: Socialism\nB: Liberalism\nC: Communism\nD: Conservatism\nExplanation: The Statue of Liberty is a symbol of freedom and democracy, which are core values of liberalism. The statue's design and dedication reflect the ideals of liberty, equality, and fraternity, which are closely associated with liberal ideology.\nCorrect Answer: B\n</output_format>",
    "question": "What 19th-century ideological movement is most closely associated with the symbolism and themes represented by the Statue of Liberty?",
    "choices": {
      "A": "Socialism",
      "B": "Liberalism",
      "C": "Communism",
      "D": "Conservatism"
    },
    "answer": "B",
    "explanation": "The Statue of Liberty is a symbol of freedom and democracy, which are core values of liberalism. The statue's design and dedication reflect the ideals of liberty, equality, and fraternity, which are closely associated with liberal ideology.",
    "question_token_count": 25,
    "answer_correctness_score": 10,
    "explanation_validity_score": 10,
    "question_clarity_score": 9,
    "question_difficulty_score": 7,
    "question_groundedness_score": 1,
    "avg_answer_token_count": 4
  },
  {
    "context": "<Table> <Tr> <Th> No . </Th> <Th> Athlete </Th> <Th> Nation </Th> <Th> Sport </Th> <Th> Years </Th> <Th> Games </Th> <Th> Gender </Th> <Th> Gold </Th> <Th> Silver </Th> <Th> Bronze </Th> <Th> Total </Th> </Tr> <Tr> <Th> </Th> <Td> Phelps , Michael Michael Phelps </Td> <Td> United States </Td> <Td> Swimming </Td> <Td> 2004 -- 2016 </Td> <Td> Summer </Td> <Td> </Td> <Td> 23 </Td> <Td> </Td> <Td> </Td> <Td> 28 </Td> </Tr> <Tr> <Th> </Th> <Td> Latynina , Larisa Larisa Latynina </Td> <Td> Soviet Union </Td> <Td> Gymnastics </Td> <Td> 1956 -- 1964 </Td> <Td> Summer </Td> <Td> </Td> <Td> 9 </Td> <Td> 5 </Td> <Td> </Td> <Td> 18 </Td> </Tr> <Tr> <Th> </Th> <Td> Nurmi , Paavo Paavo Nurmi </Td> <Td> Finland </Td> <Td> Athletics </Td> <Td> 1920 -- 1928 </Td> <Td> Summer </Td> <Td> </Td> <Td> 9 </Td> <Td> </Td> <Td> 0 </Td> <Td> 12 </Td> </Tr> <Tr> <Th> </Th> <Td> Spitz , Mark Mark Spitz </Td> <Td> United States </Td> <Td> Swimming </Td> <Td> 1968 -- 1972 </Td> <Td> Summer </Td> <Td> </Td> <Td> 9 </Td> <Td> </Td> <Td> </Td> <Td> 11 </Td> </Tr> <Tr> <Th> 5 </Th> <Td> Lewis , Carl Carl Lewis </Td> <Td> United States </Td> <Td> Athletics </Td> <Td> 1984 -- 1996 </Td> <Td> Summer </Td> <Td> </Td> <Td> 9 </Td> <Td> </Td> <Td> 0 </Td> <Td> 10 </Td> </Tr> <Tr> <Th> 6 </Th> <Td> Bj\u00f8rgen , Marit Marit Bj\u00f8rgen </Td> <Td> Norway </Td> <Td> Cross-country skiing </Td> <Td> 2002 -- 2018 </Td> <Td> Winter </Td> <Td> </Td> <Td> 8 </Td> <Td> </Td> <Td> </Td> <Td> 15 </Td> </Tr> <Tr> <Th> 7 </Th> <Td> Bj\u00f8rndalen , Ole Einar Ole Einar Bj\u00f8rndalen </Td> <Td> Norway </Td> <Td> Biathlon </Td> <Td> 1998 -- 2014 </Td> <Td> Winter </Td> <Td> </Td> <Td> 8 </Td> <Td> </Td> <Td> </Td> <Td> 13 </Td> </Tr> <Tr> <Th> 8 </Th> <Td> D\u00e6hlie , Bj\u00f8rn Bj\u00f8rn D\u00e6hlie </Td> <Td> Norway </Td> <Td> Cross-country skiing </Td> <Td> 1992 -- 1998 </Td> <Td> Winter </Td> <Td> </Td> <Td> 8 </Td> <Td> </Td> <Td> 0 </Td> <Td> 12 </Td> </Tr> <Tr> <Td> Fischer , Birgit Birgit Fischer </Td> <Td> East Germany Germany </Td> <Td> Canoeing </Td> <Td> 1980 -- 2004 </Td> <Td> Summer </Td> <Td> </Td> <Td> 8 </Td> <Td> </Td> <Td> 0 </Td> <Td> 12 </Td> </Tr> <Tr> <Th> 10 </Th> <Td> Kato , Sawao Sawao Kato </Td> <Td> Japan </Td> <Td> Gymnastics </Td> <Td> 1968 -- 1976 </Td> <Td> Summer </Td> <Td> </Td> <Td> 8 </Td> <Td> </Td> <Td> </Td> <Td> 12 </Td> </Tr> <Tr> <Td> Thompson , Jenny Jenny Thompson </Td> <Td> United States </Td> <Td> Swimming </Td> <Td> 1992 -- 2004 </Td> <Td> Summer </Td> <Td> </Td> <Td> 8 </Td> <Td> </Td> <Td> </Td> <Td> 12 </Td> </Tr> <Tr> <Th> 12 </Th> <Td> Biondi , Matt Matt Biondi </Td> <Td> United States </Td> <Td> Swimming </Td> <Td> 1984 -- 1992 </Td> <Td> Summer </Td> <Td> </Td> <Td> 8 </Td> <Td> </Td> <Td> </Td> <Td> 11 </Td> </Tr> <Tr> <Th> 13 </Th> <Td> Bolt , Usain Usain Bolt </Td> <Td> Jamaica </Td> <Td> Athletics </Td> <Td> 2008 -- 2016 </Td> <Td> Summer </Td> <Td> </Td> <Td> 8 </Td> <Td> 0 </Td> <Td> 0 </Td> <Td> 8 </Td> </Tr> <Tr> <Td> Ewry , Ray Ray Ewry </Td> <Td> United States </Td> <Td> Athletics </Td> <Td> 1900 -- 1908 </Td> <Td> Summer </Td> <Td> </Td> <Td> 8 </Td> <Td> 0 </Td> <Td> 0 </Td> <Td> 8 </Td> </Tr> <Tr> <Th> 15 </Th> <Td> Andrianov , Nikolai Nikolai Andrianov </Td> <Td> Soviet Union </Td> <Td> Gymnastics </Td> <Td> 1972 -- 1980 </Td> <Td> Summer </Td> <Td> </Td> <Td> 7 </Td> <Td> 5 </Td> <Td> </Td> <Td> 15 </Td> </Tr> <Tr> <Th> 16 </Th> <Td> Shakhlin , Boris Boris Shakhlin </Td> <Td> Soviet Union </Td> <Td> Gymnastics </Td> <Td> 1956 -- 1964 </Td> <Td> Summer </Td> <Td> </Td> <Td> 7 </Td> <Td> </Td> <Td> </Td> <Td> 13 </Td> </Tr> <Tr> <Th> 17 </Th> <Td> \u010c\u00e1slavsk\u00e1 , V\u011bra V\u011bra \u010c\u00e1slavsk\u00e1 </Td> <Td> Czechoslovakia </Td> <Td> Gymnastics </Td> <Td> 1960 -- 1968 </Td> <Td> Summer </Td> <Td> </Td> <Td> 7 </Td> <Td> </Td> <Td> 0 </Td> <Td> 11 </Td> </Tr> <Tr> <Th> 18 </Th> <Td> Chukarin , Viktor Viktor Chukarin </Td> <Td> Soviet Union </Td> <Td> Gymnastics </Td> <Td> 1952 -- 1956 </Td> <Td> Summer </Td> <Td> </Td> <Td> 7 </Td> <Td> </Td> <Td> </Td> <Td> 11 </Td> </Tr> <Tr> <Th> 19 </Th> <Td> Gerevich , Alad\u00e1r Alad\u00e1r Gerevich </Td> <Td> Hungary </Td> <Td> Fencing </Td> <Td> 1932 -- 1960 </Td> <Td> Summer </Td> <Td> </Td> <Td> 7 </Td> <Td> </Td> <Td> </Td> <Td> 10 </Td> </Tr> <Tr> <Th> 20 </Th> <Td> Mangiarotti , Edoardo Edoardo Mangiarotti </Td> <Td> Italy </Td> <Td> Fencing </Td> <Td> 1936 -- 1960 </Td> <Td> Summer </Td> <Td> </Td>",
    "topic": "The sport of gymnastics is represented by the most athletes in the table, with a total of 7 athletes, including Larisa Latynina, Nikolai Andrianov, Boris Shakhlin, Viktor Chukarin, V\u011bra \u010c\u00e1slavsk\u00e1, Sawao Kato, and Edoardo Mangiarotti.",
    "response": "<document_analysis>\nThe context provided is a table listing the top athletes with the most Olympic medals, including their name, nation, sport, years of participation, type of games (Summer or Winter), and the number of gold, silver, and bronze medals they have won. The question topic focuses on the sport of gymnastics, which is represented by the most athletes in the table, with a total of 7 athletes. \n\nTo generate a question, we need to carefully examine the table, identifying central ideas, nuanced themes, and significant relationships within it. We notice that gymnastics is a sport with a high number of athletes who have won a large number of medals, indicating its competitiveness and the excellence required to excel in this field. \n\nWe also observe that the athletes listed for gymnastics come from different nations (Soviet Union, Japan, Czechoslovakia) and have participated in the Olympics over various years, suggesting that gymnastics has been a prominent sport in the Olympics for several decades. \n\nGiven this context, we can plan a question that invites deeper understanding, meaningful reflection, or critical engagement with the content. The question should be purposeful, encouraging the respondent to think critically about the information provided and its implications.\n\nA potential question could explore the characteristics of gymnastics that contribute to its representation by the most athletes in the table or the factors that enable gymnasts to win a high number of medals. \n\nThe question should be challenging, requiring a deep understanding of the sport, its history, and the factors that contribute to success in gymnastics. \n\nConsidering the provided context and the goal of generating a highly insightful and probing question, we can proceed to formulate the question and potential answers.\n</document_analysis>\n\n<output_format>\nQuestion: What factor is most likely to contribute to the high number of Olympic medals won by gymnasts, given the physical and technical demands of the sport?\nA: The duration of their Olympic career\nB: The availability of advanced training facilities\nC: The emphasis on strength, flexibility, and endurance in gymnastics training\nD: The number of events in which they participate\n\nExplanation: The correct answer, C, emphasizes the importance of strength, flexibility, and endurance in gymnastics training. This is because gymnastics requires a unique combination of physical attributes, including strength, power, flexibility, and endurance, which enables gymnasts to perform complex routines and skills. The other options, while potentially relevant to success in gymnastics, are not as directly related to the physical and technical demands of the sport.\n\nCorrect Answer: C\n</output_format>",
    "question": "What factor is most likely to contribute to the high number of Olympic medals won by gymnasts, given the physical and technical demands of the sport?",
    "choices": {
      "A": "The duration of their Olympic career",
      "B": "The availability of advanced training facilities",
      "C": "The emphasis on strength, flexibility, and endurance in gymnastics training",
      "D": "The number of events in which they participate"
    },
    "answer": "C",
    "explanation": "The correct answer, C, emphasizes the importance of strength, flexibility, and endurance in gymnastics training. This is because gymnastics requires a unique combination of physical attributes, including strength, power, flexibility, and endurance, which enables gymnasts to perform complex routines and skills. The other options, while potentially relevant to success in gymnastics, are not as directly related to the physical and technical demands of the sport.",
    "question_token_count": 31,
    "answer_correctness_score": 10,
    "explanation_validity_score": 10,
    "question_clarity_score": 6,
    "question_difficulty_score": 8,
    "question_groundedness_score": 6,
    "avg_answer_token_count": 9
  },
  {
    "context": "<P> The Super Bowl LII Halftime Show ( officially known as the Pepsi Super Bowl LII Halftime Show ) took place on February 4 , 2018 at U.S. Bank Stadium in Minneapolis , Minnesota , as part of Super Bowl LII . Justin Timberlake was the featured performer , as confirmed by the National Football League ( NFL ) on October 22 , 2017 . It was televised nationally by NBC . </P>",
    "topic": "The significance of the Super Bowl LII Halftime Show in the context of American sports and entertainment culture.",
    "response": "<document_analysis>\nThe provided context discusses the Super Bowl LII Halftime Show, which took place on February 4, 2018, at U.S. Bank Stadium in Minneapolis, Minnesota. The show featured Justin Timberlake as the main performer and was televised nationally by NBC. To generate a question that encourages deep engagement and nuanced understanding, we need to consider the significance of this event in the context of American sports and entertainment culture.\n\nUpon analyzing the context, it becomes clear that the Super Bowl LII Halftime Show is a significant event that brings together sports and entertainment. The show's impact on American culture can be understood by considering its massive viewership, the cultural relevance of the performer, and the overall production value.\n\nTo create a challenging question, we can explore the implications of the Super Bowl LII Halftime Show on the intersection of sports and entertainment in American culture. We can consider how the event reflects and shapes societal values, cultural norms, and the relationship between athletics and art.\n\nGiven the context, a thoughtful and probing question can be generated to assess the domain expert's understanding of the Super Bowl LII Halftime Show's significance in American sports and entertainment culture.\n</document_analysis>\n\n<output_format>\nQuestion: What cultural phenomenon does the Super Bowl LII Halftime Show exemplify, where a sporting event becomes a platform for mass entertainment, blending athletics and art to create a shared experience for a vast and diverse audience?\nA: The rise of reality TV\nB: The convergence of sports and entertainment\nC: The decline of traditional music festivals\nD: The growth of social media influencers\n\nExplanation: The correct answer, \"The convergence of sports and entertainment,\" reflects the idea that the Super Bowl LII Halftime Show represents a unique intersection of sports and entertainment, where a sporting event becomes a platform for mass entertainment, blending athletics and art to create a shared experience for a vast and diverse audience.\n\nCorrect Answer: B\n</output_format>",
    "question": "What cultural phenomenon does the Super Bowl LII Halftime Show exemplify, where a sporting event becomes a platform for mass entertainment, blending athletics and art to create a shared experience for a vast and diverse audience?",
    "choices": {
      "A": "The rise of reality TV",
      "B": "The convergence of sports and entertainment",
      "C": "The decline of traditional music festivals",
      "D": "The growth of social media influencers"
    },
    "answer": "B",
    "explanation": "The correct answer, \"The convergence of sports and entertainment,\" reflects the idea that the Super Bowl LII Halftime Show represents a unique intersection of sports and entertainment, where a sporting event becomes a platform for mass entertainment, blending athletics and art to create a shared experience for a vast and diverse audience.",
    "question_token_count": 43,
    "answer_correctness_score": 10,
    "explanation_validity_score": 10,
    "question_clarity_score": 7,
    "question_difficulty_score": 8,
    "question_groundedness_score": 2,
    "avg_answer_token_count": 6
  },
  {
    "context": "<P> Super Bowl LII was an American football game played to determine the champion of the National Football League ( NFL ) for the 2017 season . The National Football Conference ( NFC ) champion Philadelphia Eagles defeated the American Football Conference ( AFC ) and defending Super Bowl LI champion New England Patriots , 41 -- 33 , to win their first Super Bowl and their first NFL title since 1960 . The game was played on February 4 , 2018 , at U.S. Bank Stadium in Minneapolis , Minnesota . This was the second time that a Super Bowl was played in Minneapolis , the northernmost city to ever host the event , after Super Bowl XXVI at the Metrodome during the 1991 season , and the sixth Super Bowl held in a cold - weather city . </P>",
    "topic": "The venue of Super Bowl LII, U.S. Bank Stadium, and its characteristics as a host stadium for major sporting events.",
    "response": "<document_analysis>\nTo generate a highly insightful and probing question-answer pair, we first need to analyze the provided context carefully. The context discusses Super Bowl LII, its participants, the outcome, and the venue, U.S. Bank Stadium in Minneapolis, Minnesota. \n\n1. **Thoughtful Content Examination**: The central idea here is the description of Super Bowl LII, including the teams that played, the score, and the location of the game. Significant relationships include the fact that this was the Eagles' first Super Bowl win and their first NFL title since 1960, and that Minneapolis is the northernmost city to host the Super Bowl.\n\n2. **Concept Exploration**: Implicit assumptions include the significance of hosting a Super Bowl in terms of sports history and the challenges of hosting in a cold-weather city. Underlying theories could involve the economic and social impacts of such events on host cities. Potential applications of this information could include urban planning, sports management, and event organization.\n\n3. **Strategic Complexity Calibration**: Given the specificity of the information and the need to probe domain expert knowledge, the difficulty level of the question should be high, around 8 or 9 out of 10. This requires moving beyond mere factual recall into analysis or application of the information.\n\n4. **Intentional Question Planning**: The question should invite deeper understanding or critical engagement with the content. Considering the unique aspects of U.S. Bank Stadium as a host for major sporting events like Super Bowl LII could provide a rich basis for such a question.\n\nGiven the instructions and the context, we aim to create a question that is challenging, encourages deep engagement, and requires a nuanced understanding of the topic. We will focus on the characteristics of U.S. Bank Stadium as a host stadium, considering its location and the implications of hosting major events like the Super Bowl in cold-weather cities.\n</document_analysis>\n\n<output_format>\nQuestion: What significant logistical challenge does U.S. Bank Stadium's location in Minneapolis pose for hosting major sporting events like the Super Bowl, and how might this impact event planning?\nA: Ensuring adequate parking and transportation infrastructure\nB: Managing crowd control and security in extreme cold\nC: Providing sufficient indoor facilities to accommodate all attendees\nD: Mitigating the effects of cold weather on the playing field and spectator experience\n\nExplanation: The correct answer requires an understanding of the challenges associated with hosting large outdoor events in cold climates, such as Minneapolis. The question is designed to test the ability to think critically about the implications of a stadium's location on event logistics and planning.\n\nCorrect Answer: D\n</output_format>",
    "question": "What significant logistical challenge does U.S. Bank Stadium's location in Minneapolis pose for hosting major sporting events like the Super Bowl, and how might this impact event planning?",
    "choices": {
      "A": "Ensuring adequate parking and transportation infrastructure",
      "B": "Managing crowd control and security in extreme cold",
      "C": "Providing sufficient indoor facilities to accommodate all attendees",
      "D": "Mitigating the effects of cold weather on the playing field and spectator experience"
    },
    "answer": "D",
    "explanation": "The correct answer requires an understanding of the challenges associated with hosting large outdoor events in cold climates, such as Minneapolis. The question is designed to test the ability to think critically about the implications of a stadium's location on event logistics and planning.",
    "question_token_count": 35,
    "answer_correctness_score": 10,
    "explanation_validity_score": 8,
    "question_clarity_score": 6,
    "question_difficulty_score": 7,
    "question_groundedness_score": 4,
    "avg_answer_token_count": 10
  },
  {
    "context": "<P> The seventh season of the fantasy drama television series Game of Thrones premiered on HBO on July 16 , 2017 , and concluded on August 27 , 2017 . Unlike previous seasons that consisted of ten episodes each , the seventh season consisted of only seven . Like the previous season , it largely consisted of original content not found in George R.R. Martin 's A Song of Ice and Fire series , while also adapting material Martin revealed to showrunners about the upcoming novels in the series . The series was adapted for television by David Benioff and D.B. Weiss . </P>",
    "topic": "The ways in which the seventh season of Game of Thrones reflected the showrunners' vision for the series, including any notable themes, characters, or plot developments.",
    "response": "<document_analysis>\nThe provided context discusses the seventh season of Game of Thrones, its premiere and conclusion dates, and its composition of seven episodes, differing from the ten episodes of previous seasons. It also mentions that the season largely consisted of original content not found in George R.R. Martin's book series, A Song of Ice and Fire, while incorporating material Martin shared with showrunners David Benioff and D.B. Weiss about upcoming novels. \n\nTo generate a question that reflects the showrunners' vision for the series, including notable themes, characters, or plot developments, we must consider what aspects of the seventh season would embody this vision. Given that the season introduced significant original content, the question should delve into how these creative choices reflected the showrunners' overall strategy for the narrative.\n\nThe difficulty of the question should be calibrated to challenge even the most knowledgeable domain experts, necessitating a deep understanding of the series, its development, and the intentions behind the showrunners' decisions. \n\nThus, a thoughtful and probing question would be one that requires analysis of the showrunners' approach to adapting and expanding the series beyond the original book material, reflecting on the implications of their creative decisions for the series' themes, character arcs, and plot progression.\n</document_analysis>\n\n<output_format>\nQuestion: What narrative strategy did the showrunners of Game of Thrones employ by incorporating original content into the seventh season, and how did this reflect their vision for the series' thematic and character development?\nA: They focused on faithful adaptations of the books to maintain consistency.\nB: They used original content to expedite the plot and introduce unexpected twists.\nC: They prioritized character development over plot progression to deepen audience engagement.\nD: They aimed to create a parallel narrative that could coexist with the book series' future installments.\nExplanation: The correct answer requires understanding the showrunners' approach to storytelling and their decisions regarding original content. The showrunners used original content to expedite the plot and introduce unexpected twists, reflecting their vision to keep the series engaging and dynamic, even as it deviated from the source material.\nCorrect Answer: B\n</output_format>",
    "question": "What narrative strategy did the showrunners of Game of Thrones employ by incorporating original content into the seventh season, and how did this reflect their vision for the series' thematic and character development?",
    "choices": {
      "A": "They focused on faithful adaptations of the books to maintain consistency.",
      "B": "They used original content to expedite the plot and introduce unexpected twists.",
      "C": "They prioritized character development over plot progression to deepen audience engagement.",
      "D": "They aimed to create a parallel narrative that could coexist with the book series' future installments."
    },
    "answer": "B",
    "explanation": "The correct answer requires understanding the showrunners' approach to storytelling and their decisions regarding original content. The showrunners used original content to expedite the plot and introduce unexpected twists, reflecting their vision to keep the series engaging and dynamic, even as it deviated from the source material.",
    "question_token_count": 39,
    "answer_correctness_score": 9,
    "explanation_validity_score": 8,
    "question_clarity_score": 6,
    "question_difficulty_score": 8,
    "question_groundedness_score": 4,
    "avg_answer_token_count": 15
  }
]