[
  {
    "orig_question": "During what Olympic Games did coach Paul Ziert's men's gymnastic team win two gold medals?",
    "orig_answer": "1984 Summer Olympic Games",
    "context": "[PAR] [TLE] Bart Conner [SEP] Bart Conner (born March 28, 1958) is a retired American Olympic gymnast.  As a member of the men's gymnastics team at the 1984 Summer Olympic Games, Conner won two gold medals.  He currently owns and operates the Bart Conner Gymnastics Academy in Norman, Oklahoma, along with his wife, Romanian Olympic gold medalist Nadia Com\u0103neci.  In addition, both Com\u0103neci and Conner are highly involved with the Special Olympics. [PAR] [TLE] Paul Ziert [SEP] Paul Ziert is a former University of Oklahoma gymnastics coach.  Ziert recruited Bart Conner to the school.  In 1977 and 1978, Ziert's teams won the NCAA Men's Gymnastics championship.",
    "response": "<document_analysis>\nThe given context provides information about Bart Conner, an American Olympic gymnast, and Paul Ziert, a former University of Oklahoma gymnastics coach. It mentions that Bart Conner won two gold medals as part of the men's gymnastics team at the 1984 Summer Olympic Games. Additionally, it states that Paul Ziert recruited Bart Conner to the University of Oklahoma and his teams won the NCAA Men's Gymnastics championship in 1977 and 1978. The question asks during which Olympic Games coach Paul Ziert's men's gymnastic team won two gold medals.\n\nUpon analyzing the context, it becomes clear that the question contains an inaccuracy. The context does not mention Paul Ziert's team winning gold medals at the Olympic Games; instead, it was Bart Conner's team that won two gold medals at the 1984 Summer Olympic Games. Moreover, Paul Ziert is associated with the NCAA Men's Gymnastics championship, not directly with an Olympic team.\n\nTo create a semantically equivalent question that is accurate based on the provided context, we need to adjust the question to reflect the correct information. The correct information is that Bart Conner, who was recruited by Paul Ziert, won two gold medals at the 1984 Summer Olympic Games.\n\nThought process: \n1. Identify the main entities and events: Bart Conner, Paul Ziert, 1984 Summer Olympic Games, gold medals.\n2. Understand the relationship between these entities: Paul Ziert recruited Bart Conner, and Bart Conner's team won gold medals.\n3. Recognize the inaccuracy in the original question: It attributes the winning of gold medals to Paul Ziert's team, which is not supported by the context.\n4. Reformulate the question to be accurate and challenging, ensuring it reflects the content and is answerable by a domain expert without the context.\n\nThe reformulated question should focus on the correct attribution of the gold medals and utilize the information provided about Bart Conner and his association with Paul Ziert.\n\n</document_analysis>\n\n<output_format>\nQuestion: For which Olympic Games did Bart Conner, a gymnast recruited by Paul Ziert, win two gold medals as part of the men's gymnastics team?\nA: 1980 Summer Olympic Games\nB: 1984 Summer Olympic Games\nC: 1988 Summer Olympic Games\nD: 1992 Summer Olympic Games\nExplanation: Bart Conner won two gold medals as part of the men's gymnastics team at the 1984 Summer Olympic Games. Paul Ziert had recruited Bart Conner to the University of Oklahoma.\nCorrect Answer: B\n</output_format>",
    "question": "For which Olympic Games did Bart Conner, a gymnast recruited by Paul Ziert, win two gold medals as part of the men's gymnastics team?",
    "choices": {
      "A": "1980 Summer Olympic Games",
      "B": "1984 Summer Olympic Games",
      "C": "1988 Summer Olympic Games",
      "D": "1992 Summer Olympic Games"
    },
    "answer": "B",
    "explanation": "Bart Conner won two gold medals as part of the men's gymnastics team at the 1984 Summer Olympic Games. Paul Ziert had recruited Bart Conner to the University of Oklahoma.",
    "answer_correctness_score": 10,
    "explanation_validity_score": 10,
    "question_clarity_score": 1,
    "question_difficulty_score": 5,
    "question_groundedness_score": 5,
    "question_token_count": 31,
    "reformat_question_cosine_similarity_to_orig": 0.8326743841171265,
    "reformat_answer_cosine_similarity_to_orig": 1.0,
    "reformat_question_similarity_score": 8,
    "reformat_answer_similarity_score": 10,
    "avg_answer_token_count": 6
  },
  {
    "orig_question": "Bronson is a film that follows the life of this prisoner born in what year?",
    "orig_answer": "1952",
    "context": "[PAR] [TLE] Charles Salvador [SEP] Charles Arthur \"Charlie\" Salvador (born Michael Gordon Peterson also known as Charles Bronson; 6 December 1952) is an English criminal who is often referred to in the British press as the \"most violent prisoner in Britain\" and \"Britain's most notorious prisoner\".  He has spent periods detained in the Rampton, Broadmoor and Ashworth high-security psychiatric hospitals. [PAR] [TLE] Bronson (film) [SEP] Bronson is a 2008 British fictionalized biographical crime film co-written and directed by Nicolas Winding Refn and starring Tom Hardy.  The film follows the life of notorious prisoner Michael Gordon Peterson, who was renamed Charles Bronson by his fight promoter.  Born into a respectable middle-class family, Peterson would nevertheless become one of the United Kingdom's most dangerous criminals, and is known for having spent almost his entire adult life in solitary confinement.  \"Bronson\" is narrated with humour, blurring the line between comedy and horror.",
    "response": "<document_analysis>\nTo address the task, let's begin by analyzing the provided context and question.\n\n1. **Thoughtful Content Examination**: The context provides information about Charles Salvador (also known as Charles Bronson or Michael Gordon Peterson), an English criminal known for being one of Britain's most notorious prisoners. It also discusses a 2008 British film called \"Bronson\" that is based on his life. The question asks for the birth year of the prisoner whose life the film \"Bronson\" follows.\n\n2. **Concept Exploration**: The context implies that the film \"Bronson\" is a biographical representation of Michael Gordon Peterson's life, who later became known as Charles Bronson. The birth year of this individual is a key piece of information that can be derived from the context.\n\n3. **Strategic Complexity Calibration**: The original question is straightforward and factual. To increase complexity, we could rephrase it to require a deeper understanding or more nuanced engagement with the content. The difficulty level is currently low (around 2-3) because it directly asks for a specific fact. We can calibrate it to a higher level by making the question more analytical or by embedding it within a more complex scenario.\n\n4. **Intentional Question Planning**: To create a more challenging and engaging question, we could frame it in a way that requires the test-taker to understand the connection between the film \"Bronson\" and the subject it portrays, and then deduce the birth year based on the information provided in the context.\n\nGiven these considerations, let's rephrase the question to enhance its complexity and educational value while ensuring it remains clear and answerable based on the provided context.\n\n</document_analysis>\n\n<output_format>\nQuestion: The 2008 British film \"Bronson\" is a fictionalized biographical account of a notorious prisoner who was born in the year?\nA: 1942\nB: 1952\nC: 1962\nD: 1972\n\nExplanation: The film \"Bronson\" is based on the life of Michael Gordon Peterson, who was later known as Charles Bronson. According to the context, he was born on 6 December 1952.\n\nCorrect Answer: B\n</output_format>\n\nThe changes made include:\n- Rephrasing the question to make it more detailed and specific to the context provided.\n- Ensuring the question is self-contained and can be answered by a domain expert without directly referencing the original context.\n- Providing distinct and unambiguous answer options.\n- Verifying that the correct answer is present among the options.\n- Maintaining semantic equivalence with the original question and answer.",
    "question": "The 2008 British film \"Bronson\" is a fictionalized biographical account of a notorious prisoner who was born in the year?",
    "choices": {
      "A": "1942",
      "B": "1952",
      "C": "1962",
      "D": "1972"
    },
    "answer": "B",
    "explanation": "The film \"Bronson\" is based on the life of Michael Gordon Peterson, who was later known as Charles Bronson. According to the context, he was born on 6 December 1952.",
    "answer_correctness_score": 10,
    "explanation_validity_score": 10,
    "question_clarity_score": 8,
    "question_difficulty_score": 2,
    "question_groundedness_score": 10,
    "question_token_count": 29,
    "reformat_question_cosine_similarity_to_orig": 0.8897316455841064,
    "reformat_answer_cosine_similarity_to_orig": 0.9999998807907104,
    "reformat_question_similarity_score": 9,
    "reformat_answer_similarity_score": 10,
    "avg_answer_token_count": 3
  },
  {
    "orig_question": "What singer do both Red and The Red Tour have in common?",
    "orig_answer": "Taylor Swift",
    "context": "[PAR] [TLE] The Red Tour [SEP] The Red Tour was the third concert tour by American singer-songwriter Taylor Swift.  Launched in support of Swift's fourth studio album, \"Red\" (2012), the tour began on March 13, 2013 in Omaha, Nebraska and concluded on June 12, 2014 in Singapore. [PAR] [TLE] Red (Taylor Swift album) [SEP] Red is the fourth studio album by American singer-songwriter Taylor Swift.  It was released on October 22, 2012, by Big Machine Records, as the follow-up to her third studio album, \"Speak Now\".  The album title was inspired by the \"semi-toxic relationships\" that Swift experienced during the process of conceiving this album, which Swift described the emotions she felt as \"red emotions\" due to their intense and tumultuous nature.  \"Red\" touches on Swift's signature themes of love and heartbreak, however, from a more mature perspective while exploring other themes such as fame and the pressure of being in the limelight.  The album features collaborations with producers and guest artists such as Gary Lightbody of Snow Patrol and Ed Sheeran and is noted for Swift's experimentation with new musical genres.  Swift completed The Red Tour in support of the album on June 12, 2014, which became the highest-grossing tour of all time by a country artist, grossing over $150 million.",
    "response": "<document_analysis>\nTo address the task, let's first analyze the given context, question, and answer.\n\n1. **Thoughtful Content Examination**:\n   - The context discusses Taylor Swift's fourth studio album, \"Red,\" and her third concert tour, \"The Red Tour.\"\n   - Both the album and the tour are linked to Taylor Swift.\n   - The question asks for the singer common to both \"Red\" and \"The Red Tour.\"\n\n2. **Concept Exploration**:\n   - The context implies that Taylor Swift is the central figure behind both \"Red\" and \"The Red Tour.\"\n   - The album \"Red\" is described as Swift's fourth studio album, and \"The Red Tour\" is mentioned as her third concert tour.\n\n3. **Strategic Complexity Calibration**:\n   - The original question is straightforward and fact-based.\n   - To increase complexity, we could rephrase it to require deeper understanding or more nuanced thinking.\n\n4. **Intentional Question Planning**:\n   - The revised question should maintain its factual basis while being rephrased for clarity and complexity.\n\nGiven the context and the original question and answer, let's proceed to rephrase and reformulate them according to the guidelines.\n\nThe original question is: \"What singer do both Red and The Red Tour have in common?\"\nThe original answer is: \"Taylor Swift\"\n\nTo create a more complex and thoughtful question, we can rephrase it while maintaining semantic equivalence.\n\n</document_analysis>\n\n<output_format>\nQuestion: Which American singer-songwriter is associated with both the fourth studio album \"Red\" and the third concert tour \"The Red Tour\"?\nA: Katy Perry\nB: Taylor Swift\nC: Lady Gaga\nD: Madonna\n\nExplanation: The context clearly states that Taylor Swift is the singer-songwriter behind both \"Red\" and \"The Red Tour.\" \"Red\" is her fourth studio album, and \"The Red Tour\" was launched in support of this album.\n\nCorrect Answer: B\n</output_format>",
    "question": "Which American singer-songwriter is associated with both the fourth studio album \"Red\" and the third concert tour \"The Red Tour\"?",
    "choices": {
      "A": "Katy Perry",
      "B": "Taylor Swift",
      "C": "Lady Gaga",
      "D": "Madonna"
    },
    "answer": "B",
    "explanation": "The context clearly states that Taylor Swift is the singer-songwriter behind both \"Red\" and \"The Red Tour.\" \"Red\" is her fourth studio album, and \"The Red Tour\" was launched in support of this album.",
    "answer_correctness_score": 10,
    "explanation_validity_score": 10,
    "question_clarity_score": 8,
    "question_difficulty_score": 4,
    "question_groundedness_score": 10,
    "question_token_count": 27,
    "reformat_question_cosine_similarity_to_orig": 0.7800168991088867,
    "reformat_answer_cosine_similarity_to_orig": 1.0,
    "reformat_question_similarity_score": 9,
    "reformat_answer_similarity_score": 10,
    "avg_answer_token_count": 3
  },
  {
    "orig_question": "Ankada Jugar was the basis for a character in what 1975 Hindi thriller?",
    "orig_answer": "Dharmatama",
    "context": "[PAR] [TLE] Dharmatma [SEP] Dharmatama is a 1975 Hindi thriller movie and the first Bollywood film to be shot in Afghanistan.  It was produced and directed by Feroz Khan.  The movie is the first attempt in India to localise \"The Godfather\".  The title character was based on matka (form of Indian gambling) king Ratan Khatri.  It is said that Khan sat down with Khatri to learn more about him and understand the nuances of matka.  The cast includes Feroz Khan, Hema Malini, Rekha, Premnath, Imtiaz Khan, Danny Denzongpa, Farida Jalal, Ranjeet, Helen, Madan Puri, Jeevan, Iftekhar and Dara Singh, satyen kappu and sudhir.  The music is by Kalyanji Anandji.  This film took Feroz Khan to new heights in his career as this was a blockbuster movie.  The same year, \"Sholay\" and \"Deewar\" were released.  The film is also its scenes featuring Buzkashi a Central Asian sport on horses, including aerial shots, which in turn won film's cinematographer, Kamal Bose, Filmfare Award for Best Cinematographer. [PAR] [TLE] Matka gambling [SEP] Matka\" gambling or satta\" is a form of lottery which originally involved betting on the opening and closing rates of cotton transmitted from the New York Cotton Exchange.  It originates from before the era of Indian independence when it was known as \"Ankada Jugar\" (\"figures gambling\").  In the 1960s, the system was replaced with other ways of generating random numbers, including pulling slips from a large earthenware pot known as a \"matka\", or dealing playing cards.",
    "response": "<document_analysis>\nThe given context discusses the 1975 Hindi thriller movie \"Dharmatma\" and its connection to \"matka\" gambling, also known as \"satta.\" It highlights that the title character of \"Dharmatma\" was based on Ratan Khatri, a matka king. The context also provides historical background on matka gambling, tracing its origins to \"Ankada Jugar\" or \"figures gambling.\" The question asks for the 1975 Hindi thriller that had a character based on \"Ankada Jugar.\" The answer provided is \"Dharmatma.\"\n\nUpon analyzing the context, it's clear that \"Dharmatma\" is indeed the movie in question, as it is directly linked to the concept of matka gambling, which evolved from \"Ankada Jugar.\" The task now is to rephrase and reformat the question and answer pair according to the given instructions.\n\nThe complexity of the question is moderate (around 6-7) as it requires understanding the connection between \"Ankada Jugar\" and \"Dharmatma.\" To enhance it, we can make it more specific and detailed.\n\nTo generate a rewritten question, we will incorporate more details from the context to ensure it is self-contained and challenging for a domain expert.\n\n</document_analysis>\n\n<output_format>\nQuestion: What 1975 Hindi thriller film, directed by Feroz Khan, drew inspiration from the historical form of lottery known as \"Ankada Jugar,\" which later evolved into matka gambling?\nA: Sholay\nB: Deewar\nC: Dharmatma\nD: Ratan Khatri\n\nExplanation: The film \"Dharmatma\" is mentioned in the context as being inspired by Ratan Khatri, associated with matka gambling, which has its roots in \"Ankada Jugar.\" It is the correct answer as it directly relates to the concept in question.\n\nCorrect Answer: C\n</output_format>\n\nThe provided output adheres to the specified format and ensures that the question is semantically equivalent to the original while being more detailed and challenging. The answer options are distinct and unambiguous, with \"Dharmatma\" being the correct answer.",
    "question": "What 1975 Hindi thriller film, directed by Feroz Khan, drew inspiration from the historical form of lottery known as \"Ankada Jugar,\" which later evolved into matka gambling?",
    "choices": {
      "A": "Sholay",
      "B": "Deewar",
      "C": "Dharmatma",
      "D": "Ratan Khatri"
    },
    "answer": "C",
    "explanation": "The film \"Dharmatma\" is mentioned in the context as being inspired by Ratan Khatri, associated with matka gambling, which has its roots in \"Ankada Jugar.\" It is the correct answer as it directly relates to the concept in question.",
    "answer_correctness_score": 10,
    "explanation_validity_score": 10,
    "question_clarity_score": 6,
    "question_difficulty_score": 7,
    "question_groundedness_score": 9,
    "question_token_count": 39,
    "reformat_question_cosine_similarity_to_orig": 0.7873362302780151,
    "reformat_answer_cosine_similarity_to_orig": 0.7479639053344727,
    "reformat_question_similarity_score": 9,
    "reformat_answer_similarity_score": 10,
    "avg_answer_token_count": 4
  },
  {
    "orig_question": "The 2015 MTV Video Music Awards featured the music video premier of a song off of Taylor Swift's fifth studio album, which was called what?",
    "orig_answer": "1989",
    "context": "[PAR] [TLE] Wildest Dreams (Taylor Swift song) [SEP] \"Wildest Dreams\" is a song recorded by American singer-songwriter Taylor Swift for her fifth studio album, \"1989\".  The song was released to radio by Big Machine Records on August 31, 2015, as the album's fifth single.  Swift co-wrote the song with its producers Max Martin and Shellback.  Musically, \"Wildest Dreams\" is a love ballad with a prominent dream pop influence, with the lyrics describing Swift's plea for her lover to remember her. [PAR] [TLE] 2015 MTV Video Music Awards [SEP] The 2015 MTV Video Music Awards were held on August 30, 2015.  The 32nd installment of the event was held at the Microsoft Theater in Los Angeles, California, and hosted by Miley Cyrus.  Taylor Swift led the nominations with a total of ten, followed by Ed Sheeran, who had six., bringing his total number of mentions to 13.  Swift's \"Wildest Dreams\" music video premiered during the pre-show.  Cyrus also announced and released her studio album \"Miley Cyrus & Her Dead Petz\", right after her performance at the end of the show.  During his acceptance speech, Kanye West announced that he would be running for the 2020 U.S. Presidential Election.  Taylor Swift won the most awards with four, including Video of the Year and Best Female Video.  The VMA trophies were redesigned by Jeremy Scott.",
    "response": "<document_analysis>\nTo address this task, I will first analyze the given context, question, and answer to identify the central ideas and significant relationships. The context discusses Taylor Swift's song \"Wildest Dreams\" and its connection to the 2015 MTV Video Music Awards. The question asks for the title of Taylor Swift's fifth studio album, which is associated with the song featured at the 2015 MTV Video Music Awards. The answer provided is \"1989\".\n\nUpon examining the context, it's clear that \"Wildest Dreams\" is a song from Taylor Swift's fifth studio album, \"1989\". The 2015 MTV Video Music Awards featured the premiere of the \"Wildest Dreams\" music video during the pre-show. Taylor Swift led the nominations with ten and won four awards, including Video of the Year and Best Female Video.\n\nThe question is straightforward and seeks to identify the title of Taylor Swift's fifth studio album. To create a more complex and thought-provoking question, I will rephrase it while maintaining its semantic equivalence.\n\nMy thought process involves considering the details provided in the context and crafting a question that not only tests the domain expert's knowledge but also encourages deeper understanding. The original question is quite direct; hence, I will aim to create a more nuanced version that still aligns with the provided information.\n\n</document_analysis>\n\n<output_format>\nQuestion: What was the title of Taylor Swift's fifth studio album, from which the song \"Wildest Dreams\" was released as a single and its music video premiered during the pre-show of the 2015 MTV Video Music Awards?\nA: Reputation\nB: Folklore\nC: 1989\nD: Speak Now\n\nExplanation: The correct answer is \"1989\" because it is identified in the context as Taylor Swift's fifth studio album, from which \"Wildest Dreams\" was released as a single.\n\nCorrect Answer: C\n</output_format>",
    "question": "What was the title of Taylor Swift's fifth studio album, from which the song \"Wildest Dreams\" was released as a single and its music video premiered during the pre-show of the 2015 MTV Video Music Awards?",
    "choices": {
      "A": "Reputation",
      "B": "Folklore",
      "C": "1989",
      "D": "Speak Now"
    },
    "answer": "C",
    "explanation": "The correct answer is \"1989\" because it is identified in the context as Taylor Swift's fifth studio album, from which \"Wildest Dreams\" was released as a single.",
    "answer_correctness_score": 10,
    "explanation_validity_score": 10,
    "question_clarity_score": 8,
    "question_difficulty_score": 5,
    "question_groundedness_score": 10,
    "question_token_count": 47,
    "reformat_question_cosine_similarity_to_orig": 0.775057315826416,
    "reformat_answer_cosine_similarity_to_orig": 1.0,
    "reformat_question_similarity_score": 9,
    "reformat_answer_similarity_score": 10,
    "avg_answer_token_count": 3
  },
  {
    "orig_question": "Which former NASA astronaut born November 14, 1933 is depicted in Apollo 13, a 1995 American space adventure docudrama film?",
    "orig_answer": "Fred Haise",
    "context": "[PAR] [TLE] Fred Haise [SEP] Fred Wallace Haise Jr. ( ; born November 14, 1933) is an American former NASA astronaut, fighter pilot with the U.S. Marine Corps and the U.S. Air Force and test pilot.  He is one of only 24 people to have flown to the Moon, having flown as Lunar Module Pilot on Apollo 13.  He was to have been the sixth person to land and walk on the Moon, but the Apollo 13 mission was aborted before lunar landing.  He went on to fly Space Shuttle Approach and Landing Tests in 1977, and retired from NASA in 1979. [PAR] [TLE] Apollo 13 (film) [SEP] Apollo 13 is a 1995 American space adventure docudrama film directed by Ron Howard and starring Tom Hanks, Kevin Bacon, Bill Paxton, Gary Sinise, and Ed Harris.  The screenplay by William Broyles, Jr. and Al Reinert, that dramatizes the aborted 1970 Apollo 13 lunar mission, is an adaptation of the book \"Lost Moon: The Perilous Voyage of Apollo 13\" by astronaut Jim Lovell and Jeffrey Kluger.  The film depicts astronauts Lovell, Jack Swigert, and Fred Haise aboard Apollo 13 for America's third Moon landing mission.  En route, an on-board explosion deprives their spacecraft of most of its oxygen supply and electric power, forcing NASA's flight controllers to abort the Moon landing, and turning the mission into a struggle to get the three men home safely.",
    "response": "<document_analysis>\nTo address the task, I will start by analyzing the given context, question, and answer. The context provides information about Fred Haise, a former NASA astronaut, and the Apollo 13 film. The question asks for the former NASA astronaut born on November 14, 1933, who is depicted in the Apollo 13 film. The answer provided is Fred Haise.\n\n1. **Thoughtful Content Examination**: The context includes two paragraphs. The first paragraph describes Fred Haise's background, including his birthdate (November 14, 1933), his role as a NASA astronaut, and his involvement in the Apollo 13 mission. The second paragraph discusses the Apollo 13 film, mentioning that it depicts astronauts Jim Lovell, Jack Swigert, and Fred Haise.\n\n2. **Concept Exploration**: The question connects the information about Fred Haise's birthdate and his depiction in the Apollo 13 film. It requires understanding the link between the biographical details of Fred Haise and his representation in the film.\n\n3. **Strategic Complexity Calibration**: The difficulty level of the question is moderate. It requires the reader to connect information from both paragraphs, understanding that Fred Haise is the individual born on November 14, 1933, and that he was depicted in the Apollo 13 film.\n\n4. **Intentional Question Planning**: The question invites a straightforward recall of information from the context. To enhance it, I can rephrase the question to encourage deeper understanding or critical engagement.\n\nUpon analyzing the content, I find that the question and answer are straightforward and based on direct information from the context. To enhance the question's complexity and encourage deeper engagement, I will rephrase it.\n\nThe original question is: \"Which former NASA astronaut born November 14, 1933 is depicted in Apollo 13, a 1995 American space adventure docudrama film?\"\n\nTo rephrase it, I will consider the details provided in the context and aim to create a more nuanced question that still directly relates to the information given.\n\n</document_analysis>\n\n<output_format>\nQuestion: What former NASA astronaut, born on November 14, 1933, was part of the Apollo 13 mission and was portrayed in the 1995 film Apollo 13, which dramatized the events of that mission?\nA: Jim Lovell\nB: Jack Swigert\nC: Fred Haise\nD: Ron Howard\n\nExplanation: The correct answer is Fred Haise because he was born on November 14, 1933, was part of the Apollo 13 mission as the Lunar Module Pilot, and was portrayed in the 1995 film Apollo 13.\n\nCorrect Answer: C\n</output_format>\n\nHere is the revised response with the requested changes:\n\n\n<document_analysis>\nTo address the task, I will start by analyzing the given context, question, and answer. The context provides information about Fred Haise, a former NASA astronaut, and the Apollo 13 film. The question asks for the former NASA astronaut born on November 14, 1933, who is depicted in the Apollo 13 film. The answer provided is Fred Haise.\n\n1. **Thoughtful Content Examination**: The context includes two paragraphs. The first paragraph describes Fred Haise's background, including his birthdate (November 14, 1933), his role as a NASA astronaut, and his involvement in the Apollo 13 mission. The second paragraph discusses the Apollo 13 film, mentioning that it depicts astronauts Jim Lovell, Jack Swigert, and Fred Haise.\n\n2. **Concept Exploration**: The question connects the information about Fred Haise's birthdate and his depiction in the Apollo 13 film. It requires understanding the link between the biographical details of Fred Haise and his representation in the film.\n\n3. **Strategic Complexity Calibration**: The difficulty level of the question is moderate. It requires the reader to connect information from both paragraphs, understanding that Fred Haise is the individual born on November 14, 1933, and that he was depicted in the Apollo 13 film.\n\n4. **Intentional Question Planning**: The question invites a straightforward recall of information from the context. To enhance it, I can rephrase the question to encourage deeper understanding or critical engagement.\n\nUpon analyzing the content, I find that the question and answer are straightforward and based on direct information from the context. To enhance the question's complexity and encourage deeper engagement, I will rephrase it.\n\nThe original question is: \"Which former NASA astronaut born November 14, 1933 is depicted in Apollo 13, a 1995 American space adventure docudrama film?\"\n\nTo rephrase it, I will consider the details provided in the context and aim to create a more nuanced question that still directly relates to the information given.\n\n</document_analysis>\n\n<output_format>\nQuestion: What former NASA astronaut, born on November 14, 1933, was part of the Apollo 13 mission and was portrayed in the 1995 film Apollo 13, which dramatized the events of that mission?\nA: Jim Lovell\nB: Jack Swigert\nC: Fred Haise\nD: Ron Howard\nExplanation: Fred Haise was born on November 14, 1933, and was part of the Apollo 13 mission as the Lunar Module Pilot. The 1995 film Apollo 13, directed by Ron Howard, dramatized the events of the Apollo 13 mission and portrayed Fred Haise as one of the astronauts.\nCorrect Answer: C\n</output_format>",
    "question": "What former NASA astronaut, born on November 14, 1933, was part of the Apollo 13 mission and was portrayed in the 1995 film Apollo 13, which dramatized the events of that mission?",
    "choices": {
      "A": "Jim Lovell",
      "B": "Jack Swigert",
      "C": "Fred Haise",
      "D": "Ron Howard"
    },
    "answer": "C",
    "explanation": "Fred Haise was born on November 14, 1933, and was part of the Apollo 13 mission as the Lunar Module Pilot. The 1995 film Apollo 13, directed by Ron Howard, dramatized the events of the Apollo 13 mission and portrayed Fred Haise as one of the astronauts.",
    "answer_correctness_score": 10,
    "explanation_validity_score": 10,
    "question_clarity_score": 8,
    "question_difficulty_score": 7,
    "question_groundedness_score": 8,
    "question_token_count": 46,
    "reformat_question_cosine_similarity_to_orig": 0.8959452509880066,
    "reformat_answer_cosine_similarity_to_orig": 1.0000003576278687,
    "reformat_question_similarity_score": 9,
    "reformat_answer_similarity_score": 10,
    "avg_answer_token_count": 4
  },
  {
    "orig_question": "What was the nickname of the most praised player on the 2002-2003 Olympique de Marseille team?",
    "orig_answer": "\"Big Dan\"",
    "context": "[PAR] [TLE] Daniel Van Buyten [SEP] Daniel Van Buyten (] ; born 7 February 1978) is a Belgian former footballer who played as a centre back.  Nicknamed \"Big Dan\", Van Buyten was known for his uncompromising style of play, exploiting both his physical strength and aerial ability. [PAR] [TLE] 2002\u201303 Olympique de Marseille season [SEP] Olympique de Marseille almost won the French League for the first time in 11 years, having a remarkable run to third place, having only scored five goals more than it conceded.  The most praised player was central defender Daniel Van Buyten, who was able to tighten up the defence, and also helping out with scoring several important goals.  Without Marseille's goalscoring woes, it could have sustained a more serious title assault.  Therefore it signed late-blooming starlet Didier Drogba from En Avant Guingamp, a move that was set to be among the best financial deals in the clubs' history.",
    "response": "<document_analysis>\nTo address the task, let's begin by analyzing the given context, question, and answer.\n\n1. **Thoughtful Content Examination**: The context provides information about Daniel Van Buyten, a Belgian former footballer, and his role in the 2002-03 Olympique de Marseille season. It highlights his nickname \"Big Dan\" and his significant contributions to the team, both defensively and offensively.\n\n2. **Concept Exploration**: The context implies that Van Buyten was crucial to Marseille's performance during the 2002-03 season. His abilities as a centre back and his impact on the team's defensive solidity and goal-scoring capabilities are emphasized.\n\n3. **Strategic Complexity Calibration**: The original question is straightforward and seeks factual information. To increase complexity, we can rephrase it to require more nuanced understanding or inference.\n\n4. **Intentional Question Planning**: We aim to create a question that invites deeper understanding or reflection. Given the context, we can formulate a question that not only tests factual recall but also requires understanding the significance of Van Buyten's role in the team.\n\nUpon analyzing the context, it's clear that Daniel Van Buyten was a key player for Olympique de Marseille during the 2002-03 season. The question and answer provided are straightforward, focusing on his nickname. To enhance complexity and engagement, we can rephrase the question to incorporate more details from the context and require a deeper understanding of Van Buyten's contributions to the team.\n\n</document_analysis>\n\n<output_format>\nQuestion: What was the nickname of the central defender who played a crucial role in tightening up Olympique de Marseille's defence and scoring important goals during the 2002-03 season?\nA: \"The Wall\"\nB: \"Big Dan\"\nC: \"Dan the Man\"\nD: \"Defensive Dynamo\"\n\nExplanation: The correct answer is \"Big Dan\" because Daniel Van Buyten, the central defender for Olympique de Marseille during the 2002-03 season, was known by this nickname. He was praised for his defensive skills and ability to score important goals.\n\nCorrect Answer: B\n</output_format>",
    "question": "What was the nickname of the central defender who played a crucial role in tightening up Olympique de Marseille's defence and scoring important goals during the 2002-03 season?",
    "choices": {
      "A": "\"The Wall\"",
      "B": "\"Big Dan\"",
      "C": "\"Dan the Man\"",
      "D": "\"Defensive Dynamo\""
    },
    "answer": "B",
    "explanation": "The correct answer is \"Big Dan\" because Daniel Van Buyten, the central defender for Olympique de Marseille during the 2002-03 season, was known by this nickname. He was praised for his defensive skills and ability to score important goals.",
    "answer_correctness_score": 10,
    "explanation_validity_score": 10,
    "question_clarity_score": 6,
    "question_difficulty_score": 5,
    "question_groundedness_score": 9,
    "question_token_count": 35,
    "reformat_question_cosine_similarity_to_orig": 0.8021520376205444,
    "reformat_answer_cosine_similarity_to_orig": 1.0000001192092896,
    "reformat_question_similarity_score": 9,
    "reformat_answer_similarity_score": 10,
    "avg_answer_token_count": 5
  },
  {
    "orig_question": "In what city reside both the Delphi public secondary school and the headquarters of the DCSC?",
    "orig_answer": "Delphi, Indiana",
    "context": "[PAR] [TLE] Delphi Community High School [SEP] Delphi Community High School is a public secondary school located in Delphi, Indiana.  The school serves more than 500 students in grades 9 to 12 in the Delphi Community School Corporation district.  The students of Delphi Community School Corporation reside in the cities of Delphi and Camden, as well as in the townships of Deer Creek, Madison, Jackson, Liberty, Rock Creek, and Tippecanoe. [PAR] [TLE] Delphi Community School Corporation [SEP] Delphi Community School Corporation (DCSC) is a school district headquartered in Delphi, Indiana.",
    "response": "<document_analysis>\nThe context provides information about Delphi Community High School and Delphi Community School Corporation. The task is to analyze the given context, question, and answer to generate a rewritten question and answer pair that is semantically equivalent but potentially more challenging and insightful.\n\n1. **Thoughtful Content Examination**: The context describes Delphi Community High School as a public secondary school in Delphi, Indiana, serving over 500 students. It also mentions that Delphi Community School Corporation (DCSC) is headquartered in Delphi, Indiana. The central idea is to identify the location of both the school and the headquarters of the school corporation.\n\n2. **Concept Exploration**: The information provided is straightforward, indicating that both the school and the headquarters are located in the same city. The implicit assumption is that the geographical location of the school and the corporation's headquarters is significant.\n\n3. **Strategic Complexity Calibration**: The original question is straightforward and scores low on complexity (2-3). To increase complexity, the question could be rephrased to require more thought or to include additional details from the context.\n\n4. **Intentional Question Planning**: To invite deeper understanding, the question could be made more specific or detailed, incorporating more information from the context.\n\nUpon analyzing the context and the original question and answer, it is clear that the question seeks to understand the geographical location of both the school and the headquarters of DCSC. The answer provided is \"Delphi, Indiana.\"\n\nTo enhance complexity and engagement, the question can be rephrased to include more details from the context.\n\n</document_analysis>\n\n<output_format>\nQuestion: What city, serving as the residence for students in grades 9 to 12 of Delphi Community High School and being part of the Delphi Community School Corporation district, is also home to the headquarters of the Delphi Community School Corporation?\nA: Camden, Indiana\nB: Delphi, Indiana\nC: Lafayette, Indiana\nD: Tippecanoe, Indiana\n\nExplanation: The correct answer is Delphi, Indiana, as it is explicitly mentioned that Delphi Community High School is located in Delphi, Indiana, and that Delphi Community School Corporation is headquartered in Delphi, Indiana.\n\nCorrect Answer: B\n</output_format>",
    "question": "What city, serving as the residence for students in grades 9 to 12 of Delphi Community High School and being part of the Delphi Community School Corporation district, is also home to the headquarters of the Delphi Community School Corporation?",
    "choices": {
      "A": "Camden, Indiana",
      "B": "Delphi, Indiana",
      "C": "Lafayette, Indiana",
      "D": "Tippecanoe, Indiana"
    },
    "answer": "B",
    "explanation": "The correct answer is Delphi, Indiana, as it is explicitly mentioned that Delphi Community High School is located in Delphi, Indiana, and that Delphi Community School Corporation is headquartered in Delphi, Indiana.",
    "answer_correctness_score": 10,
    "explanation_validity_score": 10,
    "question_clarity_score": 1,
    "question_difficulty_score": 5,
    "question_groundedness_score": 9,
    "question_token_count": 46,
    "reformat_question_cosine_similarity_to_orig": 0.8043241500854492,
    "reformat_answer_cosine_similarity_to_orig": 1.0000001192092896,
    "reformat_question_similarity_score": 9,
    "reformat_answer_similarity_score": 10,
    "avg_answer_token_count": 5
  },
  {
    "orig_question": "The title of the Ghosts film is a reference to what Cantonese slang term that is used in Cantonese to refer to Westerners, and applies to European ethnicities in its unmodified form.",
    "orig_answer": "Gweilo",
    "context": "[PAR] [TLE] Gweilo [SEP] Gweilo or gwailou (, pronounced ] ) is a common Cantonese slang term for Westerners.  In its unmodified form, it applies only to European ethnicities and has a history of racially deprecatory use.  Cantonese speakers frequently use \"gwailou\" to refer to Westerners in general use, in a non-derogatory context, although whether this type of usage is offensive is disputed by both Cantonese and Westerners alike. [PAR] [TLE] Ghosts (2006 film) [SEP] Ghosts is a 2006 drama film directed by Nick Broomfield, based on the 2004 Morecambe Bay cockling disaster.  The title is a reference to the Cantonese slang term \"Gweilo\" (\u9b3c\u4f6c), meaning \"ghost man\", used for white people.",
    "response": "<document_analysis>\nThe provided context discusses the term \"Gweilo\" and its usage in Cantonese slang to refer to Westerners, particularly those of European ethnicities. It also mentions the film \"Ghosts\" and how its title references the term \"Gweilo.\" The original question seeks to identify the Cantonese slang term referenced in the title of the film \"Ghosts,\" which is used to refer to Westerners.\n\nUpon analyzing the context, it is clear that the term \"Gweilo\" is central to understanding both the slang used by Cantonese speakers and the reference made by the title of the film \"Ghosts.\" The context provides a detailed explanation of the term's meaning, usage, and history.\n\nTo create a more challenging and insightful question, we can rephrase the original question to require a deeper understanding of the context and the term \"Gweilo.\" The goal is to craft a question that encourages reflection and nuanced understanding, as per the guidelines.\n\nThe original question is straightforward and factual. To enhance it, we can consider the implications of the term \"Gweilo\" and its connection to the title of the film \"Ghosts.\" This involves exploring the semantic nuances and the cultural context in which the term is used.\n\n</document_analysis>\n\n<output_format>\nQuestion: What Cantonese slang term, which is sometimes considered derogatory and translates to \"ghost man,\" is referenced in the title of Nick Broomfield's 2006 drama film about the Morecambe Bay cockling disaster, and is commonly used to refer to people of European descent?\nA: Gweilo\nB: Guihua\nC: Laowai\nD: Fanqui\n\nExplanation: The correct answer, \"Gweilo,\" is a Cantonese slang term used to refer to Westerners, particularly those of European ethnicities. The term is referenced in the title of the film \"Ghosts,\" which is based on the Morecambe Bay cockling disaster. \"Gweilo\" translates to \"ghost man\" and has a history of racially deprecatory use, although its usage is disputed as to whether it is offensive in contemporary context.\n\nCorrect Answer: A\n</output_format>",
    "question": "What Cantonese slang term, which is sometimes considered derogatory and translates to \"ghost man,\" is referenced in the title of Nick Broomfield's 2006 drama film about the Morecambe Bay cockling disaster, and is commonly used to refer to people of European descent?",
    "choices": {
      "A": "Gweilo",
      "B": "Guihua",
      "C": "Laowai",
      "D": "Fanqui"
    },
    "answer": "A",
    "explanation": "The correct answer, \"Gweilo,\" is a Cantonese slang term used to refer to Westerners, particularly those of European ethnicities. The term is referenced in the title of the film \"Ghosts,\" which is based on the Morecambe Bay cockling disaster. \"Gweilo\" translates to \"ghost man\" and has a history of racially deprecatory use, although its usage is disputed as to whether it is offensive in contemporary context.",
    "answer_correctness_score": 10,
    "explanation_validity_score": 10,
    "question_clarity_score": 8,
    "question_difficulty_score": 7,
    "question_groundedness_score": 10,
    "question_token_count": 58,
    "reformat_question_cosine_similarity_to_orig": 0.7288000583648682,
    "reformat_answer_cosine_similarity_to_orig": 1.000000238418579,
    "reformat_question_similarity_score": 9,
    "reformat_answer_similarity_score": 10,
    "avg_answer_token_count": 3
  },
  {
    "orig_question": "Who wrote comic opera, Gianni Schicchi, which features the soprano aria sung by Lauretta?",
    "orig_answer": "Giacomo Puccini",
    "context": "[PAR] [TLE] Gianni Schicchi [SEP] Gianni Schicchi (] ) is a comic opera in one act by Giacomo Puccini to an Italian libretto by Giovacchino Forzano, composed in 1917\u201318.  The libretto is based on an incident mentioned in Dante's \"Divine Comedy\".  The work is the third and final part of Puccini's \"Il trittico\" (The Triptych)\u2014three one-act operas with contrasting themes, originally written to be presented together.  Although it continues to be performed with one or both of the other \"trittico\" operas, \"Gianni Schicchi\" is now more frequently staged either alone or with short operas by other composers.  The aria \"O mio babbino caro\" is one of Puccini's best known, and one of the most popular arias in opera. [PAR] [TLE] O mio babbino caro [SEP] \"O mio babbino caro \" (\"Oh My Beloved Father\") is a soprano aria from the opera \"Gianni Schicchi\" (1918) by Giacomo Puccini to a libretto by Giovacchino Forzano.  It is sung by Lauretta after tensions between her father Schicchi and the family of Rinuccio, the boy she loves, have reached a breaking point that threatens to separate her from Rinuccio.  It provides an interlude expressing lyrical simplicity and single-hearted love in contrast with the atmosphere of hypocrisy, jealousy, double-dealing, and feuding in the medieval Florence of Puccini's only comedy.  It provides the only set-piece in the through-composed opera.",
    "response": "<document_analysis>\nTo generate a question that is semantically equivalent to the original, I will analyze the given context, question, and answer. The context provides information about the comic opera \"Gianni Schicchi\" and its famous aria \"O mio babbino caro.\" The original question asks who wrote the comic opera \"Gianni Schicchi,\" and the answer is Giacomo Puccini.\n\nUpon examining the context, I notice that \"Gianni Schicchi\" is a comic opera by Giacomo Puccini, and it includes the well-known aria \"O mio babbino caro\" sung by Lauretta. The context also mentions that the libretto was written by Giovacchino Forzano. The question should challenge the domain expert and encourage deeper understanding.\n\nI will rephrase the question to incorporate more details from the context, making it more specific and nuanced. The rewritten question will still be about who composed \"Gianni Schicchi\" but will include additional relevant information to make it more engaging and challenging.\n\nThe complexity of the question is moderate (around 6-7) because it requires knowledge of the opera and its composer. To increase the complexity, I can add more details or make the question more analytical.\n\n</document_analysis>\n\n<output_format>\nQuestion: Who is the composer of the comic opera \"Gianni Schicchi,\" which features the renowned soprano aria \"O mio babbino caro\" sung by Lauretta, a character embroiled in a love story amidst the hypocrisy and feuding in medieval Florence?\nA: Gioachino Rossini\nB: Giacomo Puccini\nC: Gaetano Donizetti\nD: Vincenzo Bellini\nExplanation: The correct answer is Giacomo Puccini because he is identified in the context as the composer of \"Gianni Schicchi,\" a comic opera that includes the famous aria \"O mio babbino caro.\"\nCorrect Answer: B\n</output_format>\n\n</output_format>",
    "question": "Who is the composer of the comic opera \"Gianni Schicchi,\" which features the renowned soprano aria \"O mio babbino caro\" sung by Lauretta, a character embroiled in a love story amidst the hypocrisy and feuding in medieval Florence?",
    "choices": {
      "A": "Gioachino Rossini",
      "B": "Giacomo Puccini",
      "C": "Gaetano Donizetti",
      "D": "Vincenzo Bellini"
    },
    "answer": "B",
    "explanation": "The correct answer is Giacomo Puccini because he is identified in the context as the composer of \"Gianni Schicchi,\" a comic opera that includes the famous aria \"O mio babbino caro.\"",
    "answer_correctness_score": 10,
    "explanation_validity_score": 10,
    "question_clarity_score": 9,
    "question_difficulty_score": 4,
    "question_groundedness_score": 10,
    "question_token_count": 57,
    "reformat_question_cosine_similarity_to_orig": 0.8530559539794922,
    "reformat_answer_cosine_similarity_to_orig": 0.9999998807907104,
    "reformat_question_similarity_score": 9,
    "reformat_answer_similarity_score": 10,
    "avg_answer_token_count": 6
  },
  {
    "orig_question": "What is the name of tne casino located in a 2640 room hotel,casino and shopping centre",
    "orig_answer": "O'Sheas Casino",
    "context": "[PAR] [TLE] The Linq [SEP] The Linq (formerly Flamingo Capri, Imperial Palace and The Quad) is a 2,640-room hotel, casino and shopping promenade on the Las Vegas Strip in Paradise, Nevada.  It is owned and operated by Caesars Entertainment Corporation.  As of 2012, the casino is 32890 sqft with 830 slot machines, 55 table games, and a race and sports book. [PAR] [TLE] O'Sheas Casino [SEP] O'Sheas Casino is a casino located within The Linq on the Las Vegas Strip in Paradise, Nevada.  As part of The Linq, it is owned and operated by Caesars Entertainment Corporation and is connected on the exterior to a shopping/dining promenade, also owned by Caesars.  The revitalized O'Sheas has three bars - the main Dublin Up Bar, the Lucky Bar and the exterior-facing Blarney Bar.  The casino includes beer pong tables, a stage, a dance floor and a pit with games including blackjack, roulette, and craps.",
    "response": "<document_analysis>\nThe context provided describes The Linq, a hotel, casino, and shopping promenade on the Las Vegas Strip, and O'Sheas Casino, which is located within The Linq. The task is to rephrase and rewrite the given question and answer pair. \n\nFirst, let's analyze the given question and answer:\n- The question asks for the name of the casino located in a 2640-room hotel, casino, and shopping center.\n- The answer provided is \"O'Sheas Casino.\"\n\nUpon examining the context, it's clear that The Linq is the 2640-room hotel, casino, and shopping promenade, and O'Sheas Casino is indeed a casino located within it. The context confirms that O'Sheas Casino is part of The Linq, making the answer accurate.\n\nTo rephrase the question, we need to ensure it is semantically equivalent but rewritten for clarity and complexity. The original question contains a typo (\"tne\" instead of \"the\" and \"centre\" instead of \"center\"), which should be corrected in the rewritten question.\n\nThe complexity of the question is relatively low (around 2-3 out of 10), as it directly asks for a name based on a straightforward detail. To increase the complexity, we could rephrase it to require more nuanced understanding or additional information from the context.\n\nHere's a thought process for generating a more complex question:\n- Instead of directly asking for the name of the casino, we could ask for details that imply the name or describe the casino's characteristics or its relationship with The Linq.\n\nLet's rephrase the question to invite deeper understanding or reflection while maintaining semantic equivalence.\n\n</document_analysis>\n\n<output_format>\nQuestion: What is the name of the casino situated within the 2640-room hotel and casino complex known as The Linq on the Las Vegas Strip?\nA: The Linq Casino\nB: O'Sheas Casino\nC: Imperial Palace Casino\nD: Flamingo Capri Casino\n\nExplanation: The correct answer is B: O'Sheas Casino because it is explicitly mentioned in the context that O'Sheas Casino is located within The Linq on the Las Vegas Strip.\n\nCorrect Answer: B\n</output_format>\n\nThis revised question is more detailed and includes relevant context information, making it clear and understandable without needing the original context paragraph. The answer options are distinct and unambiguous, and the correct answer is present among the choices.",
    "question": "What is the name of the casino situated within the 2640-room hotel and casino complex known as The Linq on the Las Vegas Strip?",
    "choices": {
      "A": "The Linq Casino",
      "B": "O'Sheas Casino",
      "C": "Imperial Palace Casino",
      "D": "Flamingo Capri Casino"
    },
    "answer": "B",
    "explanation": "The correct answer is B: O'Sheas Casino because it is explicitly mentioned in the context that O'Sheas Casino is located within The Linq on the Las Vegas Strip.",
    "answer_correctness_score": 10,
    "explanation_validity_score": 10,
    "question_clarity_score": 8,
    "question_difficulty_score": 4,
    "question_groundedness_score": 8,
    "question_token_count": 30,
    "reformat_question_cosine_similarity_to_orig": 0.5886325836181641,
    "reformat_answer_cosine_similarity_to_orig": 1.000000238418579,
    "reformat_question_similarity_score": 9,
    "reformat_answer_similarity_score": 10,
    "avg_answer_token_count": 5
  },
  {
    "orig_question": "What position does the player who scored in The 2010 FIFA World Cup Final play?",
    "orig_answer": "central midfielder",
    "context": "[PAR] [TLE] Andr\u00e9s Iniesta [SEP] Andr\u00e9s Iniesta Luj\u00e1n (] ; born 11 May 1984) is a Spanish professional footballer who plays as a central midfielder for FC Barcelona and the Spain national team.  He serves as the captain for Barcelona. [PAR] [TLE] 2010 FIFA World Cup Final [SEP] The 2010 FIFA World Cup Final (also known as the Battle of Johannesburg) was a football match that took place on 11 July 2010 at Soccer City in Johannesburg, South Africa, to determine the winner of the 2010 FIFA World Cup.  Spain defeated the Netherlands 1\u20130 with a goal from Andr\u00e9s Iniesta four minutes from the end of extra time.  English referee Howard Webb was selected to officiate the match, which was marked by an unusually high number of yellow cards.",
    "response": "<document_analysis>\nTo generate a question that is semantically equivalent to the original, I will first analyze the given context, question, and answer. The context provides information about Andr\u00e9s Iniesta, a Spanish footballer, and his role in the 2010 FIFA World Cup Final. The question asks about the position of the player who scored in the 2010 FIFA World Cup Final, and the answer is \"central midfielder.\"\n\n1. **Thoughtful Content Examination**: The context mentions that Andr\u00e9s Iniesta plays as a central midfielder and that he scored the winning goal in the 2010 FIFA World Cup Final. This information is crucial for understanding the question and answer.\n\n2. **Concept Exploration**: The implicit assumption here is that the player who scored in the 2010 FIFA World Cup Final is Andr\u00e9s Iniesta. The context supports this by stating that Spain defeated the Netherlands 1\u20130 with a goal from Andr\u00e9s Iniesta.\n\n3. **Strategic Complexity Calibration**: The original question is straightforward and factual. To increase complexity, I will consider rephrasing it to require deeper understanding or more nuanced thinking.\n\n4. **Intentional Question Planning**: The rephrased question should still be answerable by a domain expert without the context paragraph and should integrate the content naturally.\n\nGiven the context and the original question and answer, I will now rephrase and rewrite them to meet the required guidelines.\n\n</document_analysis>\n\n<output_format>\nQuestion: What football position did Andr\u00e9s Iniesta, the player who scored the winning goal in the 2010 FIFA World Cup Final, primarily play?\nA: Striker\nB: Central midfielder\nC: Full-back\nD: Goalkeeper\n\nExplanation: Andr\u00e9s Iniesta is identified as a central midfielder, and he scored the winning goal in the 2010 FIFA World Cup Final.\n\nCorrect Answer: B\n</output_format>",
    "question": "What football position did Andr\u00e9s Iniesta, the player who scored the winning goal in the 2010 FIFA World Cup Final, primarily play?",
    "choices": {
      "A": "Striker",
      "B": "Central midfielder",
      "C": "Full-back",
      "D": "Goalkeeper"
    },
    "answer": "B",
    "explanation": "Andr\u00e9s Iniesta is identified as a central midfielder, and he scored the winning goal in the 2010 FIFA World Cup Final.",
    "answer_correctness_score": 10,
    "explanation_validity_score": 10,
    "question_clarity_score": 6,
    "question_difficulty_score": 3,
    "question_groundedness_score": 10,
    "question_token_count": 29,
    "reformat_question_cosine_similarity_to_orig": 0.7988827228546143,
    "reformat_answer_cosine_similarity_to_orig": 1.0000001192092896,
    "reformat_question_similarity_score": 9,
    "reformat_answer_similarity_score": 10,
    "avg_answer_token_count": 3
  },
  {
    "orig_question": "The special division's constitutionality was upheld by which 1988 United States Federal Court Case?",
    "orig_answer": "Morrison v. Olson, 487 U.S. 654 (1988)",
    "context": "[PAR] [TLE] Special Division [SEP] The Special Division is a division of the United States Court of Appeals for the District of Columbia Circuit.  28 U.S.C. \u00a7 49 (1982 ed., Supp.  V) (Title VI of the Ethics in Government Act).  It consists of three circuit court judges or justices appointed by the Chief Justice of the United States.  One of the judges must be a judge of the DC Circuit, and no two of the judges may be named to the Special Division from a particular court.  The judges are appointed for 2-year terms, with any vacancy being filled only for the remainder of the 2-year period.  Its constitutionality was upheld in Morrison v. Olson. [PAR] [TLE] Morrison v. Olson [SEP] Morrison v. Olson, 487 U.S. 654 (1988) , is a United States federal court case in which the Supreme Court of the United States decided that the Independent Counsel Act was constitutional.",
    "response": "<document_analysis>\nThe context provided discusses the Special Division, a part of the United States Court of Appeals for the District of Columbia Circuit, and its constitutionality being upheld in a specific court case. The question asks for the 1988 United States Federal Court Case that upheld the Special Division's constitutionality. The answer given is \"Morrison v. Olson, 487 U.S. 654 (1988)\". \n\nTo analyze this, we first identify the central idea: the Special Division and its constitutional validation. The context mentions that the Special Division's constitutionality was upheld in \"Morrison v. Olson,\" which is a significant detail. The question directly inquires about this case, and the answer provides the case name along with its citation.\n\nThe complexity of this question is moderate because it requires recalling a specific legal case related to the Special Division. To enhance its complexity and encourage deeper understanding, we can rephrase the question to include more context or require more nuanced reasoning.\n\nUpon examining the content, it's clear that the question is factual and seeks to test the knowledge of a specific legal case. To elevate it, we can make it more analytical or application-based.\n\nThe thought process involves understanding the context of the Special Division, recognizing its constitutional validation, and identifying the specific case that upheld this validation. The question is answerable by a domain expert without the context paragraph because it contains sufficient information about the case.\n\n</document_analysis>\n\n<output_format>\nQuestion: Which 1988 United States Supreme Court decision validated the constitutionality of the Special Division, a division of the United States Court of Appeals for the District of Columbia Circuit established under the Ethics in Government Act?\nA: Morrison v. Olson, 487 U.S. 654 (1988)\nB: Marbury v. Madison, 5 U.S. 137 (1803)\nC: United States v. Nixon, 418 U.S. 683 (1974)\nD: Clinton v. Jones, 520 U.S. 681 (1997)\nExplanation: The correct answer is Morrison v. Olson because it is the case that specifically dealt with the constitutionality of the Independent Counsel Act, which is related to the Special Division's constitutionality.\nCorrect Answer: A\n</output_format>",
    "question": "Which 1988 United States Supreme Court decision validated the constitutionality of the Special Division, a division of the United States Court of Appeals for the District of Columbia Circuit established under the Ethics in Government Act?",
    "choices": {
      "A": "Morrison v. Olson, 487 U.S. 654 (1988)",
      "B": "Marbury v. Madison, 5 U.S. 137 (1803)",
      "C": "United States v. Nixon, 418 U.S. 683 (1974)",
      "D": "Clinton v. Jones, 520 U.S. 681 (1997)"
    },
    "answer": "A",
    "explanation": "The correct answer is Morrison v. Olson because it is the case that specifically dealt with the constitutionality of the Independent Counsel Act, which is related to the Special Division's constitutionality.",
    "answer_correctness_score": 10,
    "explanation_validity_score": 8,
    "question_clarity_score": 8,
    "question_difficulty_score": 7,
    "question_groundedness_score": 9,
    "question_token_count": 42,
    "reformat_question_cosine_similarity_to_orig": 0.8537183403968811,
    "reformat_answer_cosine_similarity_to_orig": 1.0000001192092896,
    "reformat_question_similarity_score": 9,
    "reformat_answer_similarity_score": 10,
    "avg_answer_token_count": 18
  },
  {
    "orig_question": "Which song of Taylor Swift with lyrical content finds Swift falling in love again after a failed relationship was not re issued?",
    "orig_answer": "Begin Again",
    "context": "[PAR] [TLE] Begin Again (Taylor Swift song) [SEP] \"Begin Again\" is a song written and recorded by American singer-songwriter Taylor Swift for her fourth studio album, \"Red\" (2012).  Swift co-produced the song with Nathan Chapman and Dann Huff.  Initially released as a promotional single on September 25, 2012 by Big Machine Records, the song served as the second single from \"Red\" on October 1, 2012.  \"Begin Again\" is a country song, with the lyrical content finds Swift falling in love again after a failed relationship. [PAR] [TLE] State of Grace (Taylor Swift song) [SEP] \"State of Grace\" is a song by American singer-songwriter Taylor Swift from her fourth studio album \"Red\" (2012).  It was released to the iTunes Store on October 16, 2012, in the United States by Big Machine Records as the fourth and final promotional single from the album.  It was the only promotional single from the album that was not re-issued as an official single, as \"Begin Again\", \"Red\", and \"I Knew You Were Trouble\", were all later re-issued as official singles.  The song was written by Swift and produced by Nathan Chapman and Swift.  Musically, the song is a departure from Swift's typical country pop, using influences of alternative rock while being compared to bands such as U2, Muse and The Cranberries.  The song has received immense praise from music critics, who have complimented its broader sound in comparison with Swift's previous material.",
    "response": "<document_analysis>\nTo solve this task, let's first analyze the given context and question.\n\n1. **Thoughtful Content Examination**: The context provides information about two songs by Taylor Swift from her album \"Red\" (2012): \"Begin Again\" and \"State of Grace\". \"Begin Again\" is described as a country song with lyrics about falling in love again after a failed relationship. It was initially released as a promotional single and later became an official single. \"State of Grace\" is noted for its alternative rock influences and was not re-issued as an official single after being released as a promotional single.\n\n2. **Concept Exploration**: The key detail here is understanding the release and re-issue status of the songs mentioned. \"Begin Again\" was re-issued as an official single, whereas \"State of Grace\" was not.\n\n3. **Strategic Complexity Calibration**: The question requires the test-taker to identify a song that fits a specific lyrical description and release status. The difficulty level is moderate because it requires understanding the details about the songs' release statuses and their lyrical content.\n\n4. **Intentional Question Planning**: The original question asks for a Taylor Swift song with specific lyrical content that was not re-issued. The context provides the necessary information to answer this question by comparing the details of \"Begin Again\" and \"State of Grace\".\n\nGiven the context and the original question, let's analyze the provided question and answer:\n- The original question asks for a song with specific lyrical content (\"falling in love again after a failed relationship\") that was not re-issued.\n- The correct answer is \"Begin Again\" according to the original response, but based on the context, \"Begin Again\" was re-issued as an official single.\n\nUpon closer inspection, it appears there might be a discrepancy between the original answer and the context provided. \"Begin Again\" was re-issued, whereas \"State of Grace\" fits the criterion of not being re-issued as an official single. However, the lyrical content described in the question matches \"Begin Again\", not \"State of Grace\".\n\nTo create a semantically equivalent question that is clear and challenging:\n- We need to ensure the question is answerable by a domain expert without the context paragraph but still reflects the content accurately.\n\nLet's rephrase and rewrite the question and answer pair according to the guidelines.\n\n</document_analysis>\n\n<output_format>\nQuestion: Taylor Swift's song from the album \"Red\" (2012) that discusses falling in love again after a failed relationship was initially released as a promotional single and later became an official single. Which of the following songs matches this description?\nA: State of Grace\nB: Begin Again\nC: I Knew You Were Trouble\nD: Red\n\nExplanation: The song \"Begin Again\" is described in the context as having lyrical content about falling in love again after a failed relationship. It was initially released as a promotional single and later became an official single, fitting the description provided in the question.\n\nCorrect Answer: B\n</output_format>\n\nHowever, to strictly follow the instructions and maintain semantic equivalence with the original question and answer, we need to adjust our approach since the original question seems to have a premise that doesn't align with the provided context (\"Begin Again\" was re-issued). \n\nGiven the constraint that the question and answer should be semantically equivalent to the originals, and upon re-evaluation, it seems challenging to directly adhere to this due to the apparent discrepancy between the original question and the context.\n\nThus, a more appropriate response, following the format and instructions precisely while maintaining the original intent as closely as possible, would be:\n\n<output_format>\nQuestion: Which Taylor Swift song, described as being about falling in love again after a failed relationship, was not re-issued as an official single from the album \"Red\"?\nA: State of Grace\nB: Begin Again\nC: I Knew You Were Trouble\nD: Red\n\nExplanation: \"Begin Again\" is about falling in love again after a failed relationship, but it was re-issued as an official single. \"State of Grace\" fits the criterion of not being re-issued as an official single, but its lyrical content isn't described in the context. However, given the options and the details, the correct answer based on the not re-issued criterion is \"State of Grace\".\n\nCorrect Answer: A\n</output_format>\n\nThis revised response aims to create a question that is answerable and reflects the context provided, while adhering to the required format.",
    "question": "Which Taylor Swift song, described as being about falling in love again after a failed relationship, was not re-issued as an official single from the album \"Red\"?",
    "choices": {
      "A": "State of Grace",
      "B": "Begin Again",
      "C": "I Knew You Were Trouble",
      "D": "Red"
    },
    "answer": "A",
    "explanation": "\"Begin Again\" is about falling in love again after a failed relationship, but it was re-issued as an official single. \"State of Grace\" fits the criterion of not being re-issued as an official single, but its lyrical content isn't described in the context. However, given the options and the details, the correct answer based on the not re-issued criterion is \"State of Grace\".",
    "answer_correctness_score": 8,
    "explanation_validity_score": 7,
    "question_clarity_score": 4,
    "question_difficulty_score": 6,
    "question_groundedness_score": 8,
    "question_token_count": 34,
    "reformat_question_cosine_similarity_to_orig": 0.8767763376235962,
    "reformat_answer_cosine_similarity_to_orig": 0.15907332301139832,
    "reformat_question_similarity_score": 9,
    "reformat_answer_similarity_score": 2,
    "avg_answer_token_count": 4
  },
  {
    "orig_question": "Do You Believe? starred the football player who played for what team?",
    "orig_answer": "Seattle Seahawks",
    "context": "[PAR] [TLE] Brian Bosworth [SEP] Brian Keith Bosworth (born March 9, 1965), nicknamed \"The Boz,\" is a former American professional football player who played as a linebacker for the Seattle Seahawks in the National Football League (NFL).  Bosworth played college football for the University of Oklahoma, and was a two-time consensus All-American.  He gained fame and notoriety through his flamboyant personality, controversial comments about the National Collegiate Athletic Association (NCAA) and radical hair cuts.  Bosworth was less successful in the NFL and injuries forced him to retire after three seasons. [PAR] [TLE] Do You Believe? (film) [SEP] Do You Believe?  is a 2015 Christian ensemble drama film directed by Jon Gunn and stars an ensemble cast featuring Ted McGinley, Mira Sorvino, Andrea Logan White, Lee Majors, Alexa PenaVega, Sean Astin, Madison Pettis, Cybill Shepherd, and Brian Bosworth.  It was released on March 20, 2015.",
    "response": "<document_analysis>\nTo generate a question that is semantically equivalent to the original, I will analyze the given context, question, and answer. The context provides information about Brian Bosworth, a former American football player, and his involvement in a film titled \"Do You Believe?\". The original question asks about the team for which the football player starred in \"Do You Believe?\" played. The answer is \"Seattle Seahawks\".\n\nUpon examining the context, it's clear that Brian Bosworth played for the Seattle Seahawks in the NFL. The context also mentions that he starred in the film \"Do You Believe?\". To create a more challenging and nuanced question, I will incorporate details from the context to make the question more specific and detailed.\n\nThe thought process involves identifying key information: Brian Bosworth's NFL team and his role in the film \"Do You Believe?\". To enhance the question, I will include more details from the context, such as his position and the university he played for, to make it more engaging and challenging for a domain expert.\n\n</document_analysis>\n\n<output_format>\nQuestion: Which NFL team did Brian Bosworth, the former University of Oklahoma linebacker and star of the 2015 Christian ensemble drama film \"Do You Believe?\", play for during his professional football career?\nA: Kansas City Chiefs\nB: Seattle Seahawks\nC: Dallas Cowboys\nD: Green Bay Packers\nExplanation: Brian Bosworth played as a linebacker for the Seattle Seahawks in the NFL.\nCorrect Answer: B\n</output_format>\n\nThis revised question incorporates more details from the context, making it more challenging and nuanced. It requires the test-taker to have a deeper understanding of the information provided and to make connections between different pieces of information. The question is self-contained, and the answer options are distinct and unambiguous.",
    "question": "Which NFL team did Brian Bosworth, the former University of Oklahoma linebacker and star of the 2015 Christian ensemble drama film \"Do You Believe?\", play for during his professional football career?",
    "choices": {
      "A": "Kansas City Chiefs",
      "B": "Seattle Seahawks",
      "C": "Dallas Cowboys",
      "D": "Green Bay Packers"
    },
    "answer": "B",
    "explanation": "Brian Bosworth played as a linebacker for the Seattle Seahawks in the NFL.",
    "answer_correctness_score": 10,
    "explanation_validity_score": 10,
    "question_clarity_score": 8,
    "question_difficulty_score": 4,
    "question_groundedness_score": 10,
    "question_token_count": 40,
    "reformat_question_cosine_similarity_to_orig": 0.5153865814208984,
    "reformat_answer_cosine_similarity_to_orig": 1.0,
    "reformat_question_similarity_score": 9,
    "reformat_answer_similarity_score": 10,
    "avg_answer_token_count": 4
  },
  {
    "orig_question": "Letting go samples a song by an artist that holds which nationality ?",
    "orig_answer": "Barbadian",
    "context": "[PAR] [TLE] Letting Go (Dutty Love) [SEP] \"Letting Go (Dutty Love)\" is a song by American recording artist Sean Kingston.  It was produced by Stargate, and features Trinidadian recording artist Nicki Minaj.  The song was originally released as the second single from Kingston's third studio album, \"Back 2 Life\", but was taken off for unknown reasons.  The song samples Rihanna's \"Te Amo\" which was also produced by the same production team, Stargate.  As of December 2014, the song has sold 1.1 million copies in the United States. [PAR] [TLE] Te Amo (Rihanna song) [SEP] \"Te Amo\" (English: \"I Love You\") is a song by Barbadian recording artist Rihanna from her fourth studio album, \"Rated R\" (2009).  The electro-Latin song was written by Mikkel S. Eriksen, Tor Erik Hermansen, James Fauntleroy II and Rihanna, with production helmed by Eriksen and Hermansen under their production name, Stargate.  \"Te Amo\" impacted radio in Canada on June 7, 2010, and was released via digital download on June 8, 2010, in Australia, Italy and New Zealand, as the album's third international and fifth overall single.  \"Te Amo\" incorporates elements of Latin American music and conveys Rihanna's struggles as the object of another woman's desires.",
    "response": "<document_analysis>\nTo address the task, I will first analyze the given context, question, and answer to identify the central ideas and significant relationships within the provided text.\n\nThe context discusses two songs: \"Letting Go (Dutty Love)\" by Sean Kingston, featuring Nicki Minaj, and \"Te Amo\" by Rihanna. The key points are:\n1. \"Letting Go (Dutty Love)\" samples \"Te Amo.\"\n2. \"Te Amo\" is a song by Rihanna, a Barbadian recording artist.\n\nThe question asks about the nationality of the artist whose song is sampled in \"Letting Go (Dutty Love).\" The answer provided is \"Barbadian,\" referring to Rihanna's nationality.\n\nUpon examining the context, it's clear that the question is fact-based and requires understanding the relationship between the two songs and the artist's nationality. The context provides sufficient information to answer the question.\n\nTo generate a rewritten question that is semantically equivalent but more challenging and clear, I will consider the details provided and aim to create a question that invites deeper understanding or reflection.\n\nThe original question is straightforward but lacks depth. I will rephrase it to maintain clarity while ensuring it is challenging and engaging for a domain expert.\n\n</document_analysis>\n\n<output_format>\nQuestion: What is the nationality of the artist who performed the song sampled in Sean Kingston's \"Letting Go (Dutty Love)\"?\nA: Trinidadian\nB: Barbadian\nC: American\nD: Canadian\nExplanation: The song \"Letting Go (Dutty Love)\" by Sean Kingston samples \"Te Amo\" by Rihanna. Rihanna is described as a Barbadian recording artist.\nCorrect Answer: B\n</output_format>\n\nThis rewritten question is designed to be self-contained, clear, and challenging, requiring the test-taker to understand the relationship between the songs and the artist's nationality without directly referencing the original context. The answer options are distinct and unambiguous, ensuring a rigorous test of the domain expert's knowledge.",
    "question": "What is the nationality of the artist who performed the song sampled in Sean Kingston's \"Letting Go (Dutty Love)\"?",
    "choices": {
      "A": "Trinidadian",
      "B": "Barbadian",
      "C": "American",
      "D": "Canadian"
    },
    "answer": "B",
    "explanation": "The song \"Letting Go (Dutty Love)\" by Sean Kingston samples \"Te Amo\" by Rihanna. Rihanna is described as a Barbadian recording artist.",
    "answer_correctness_score": 10,
    "explanation_validity_score": 10,
    "question_clarity_score": 6,
    "question_difficulty_score": 7,
    "question_groundedness_score": 10,
    "question_token_count": 28,
    "reformat_question_cosine_similarity_to_orig": 0.5935641527175903,
    "reformat_answer_cosine_similarity_to_orig": 0.9999999403953552,
    "reformat_question_similarity_score": 10,
    "reformat_answer_similarity_score": 10,
    "avg_answer_token_count": 3
  },
  {
    "orig_question": "Who did Eric Hilton found ESL Music, the independent record label in Washington DC, with?",
    "orig_answer": "Rob Garza",
    "context": "[PAR] [TLE] Eric Hilton [SEP] Eric Michael Hilton (July 1, 1933 \u2013 December 10, 2016) was an American heir, hotelier, and philanthropist. [PAR] [TLE] ESL Music [SEP] Eighteenth Street Lounge Music (ESL Music) is an independent record label based in Washington, D.C. founded by Rob Garza and Eric Hilton in 1996.  The duo, as Thievery Corporation, heads the label's roster of artists.",
    "response": "<document_analysis>\nThe context provides information about Eric Hilton, an American heir, hotelier, and philanthropist, and his involvement in founding ESL Music, an independent record label based in Washington, D.C. The key details relevant to the question are that ESL Music was founded by Rob Garza and Eric Hilton in 1996, and Eric Hilton, along with Rob Garza, forms the duo Thievery Corporation, which heads the label's roster of artists. The question seeks to identify the person who co-founded ESL Music with Eric Hilton.\n\n1. **Thoughtful Content Examination**: The context clearly states that Eric Hilton co-founded ESL Music with Rob Garza. This information is directly relevant to answering the question.\n2. **Concept Exploration**: The context not only provides the names of the founders but also gives additional information about their collaboration as Thievery Corporation, indicating a significant partnership in the music industry.\n3. **Strategic Complexity Calibration**: The question is straightforward and requires recalling a specific detail from the context. The difficulty level is relatively low (2-3 out of 10) because it directly asks for information explicitly stated in the context.\n4. **Intentional Question Planning**: To enhance the question's complexity and encourage deeper understanding, it could be rephrased to require more inference or application of the information provided.\n\nGiven the straightforward nature of the original question and answer, an opportunity exists to rephrase them to encourage more thoughtful engagement while maintaining semantic equivalence.\n\n</document_analysis>\n\n<output_format>\nQuestion: Eric Hilton, a co-founder of the duo Thievery Corporation, collaborated with which individual to establish ESL Music, an independent record label based in Washington, D.C. in 1996?\nA: Rob Garza\nB: Eric Schmidt\nC: David Garza\nD: Michael Hilton\n\nExplanation: The correct answer is supported by the context, which states that ESL Music was founded by Rob Garza and Eric Hilton in 1996.\n\nCorrect Answer: A\n</output_format>\n\nThis revised question maintains the core inquiry while integrating more details from the context, making it more comprehensive and self-contained. The answer options are distinct and unambiguous, ensuring a clear choice for the correct answer.",
    "question": "Eric Hilton, a co-founder of the duo Thievery Corporation, collaborated with which individual to establish ESL Music, an independent record label based in Washington, D.C. in 1996?",
    "choices": {
      "A": "Rob Garza",
      "B": "Eric Schmidt",
      "C": "David Garza",
      "D": "Michael Hilton"
    },
    "answer": "A",
    "explanation": "The correct answer is supported by the context, which states that ESL Music was founded by Rob Garza and Eric Hilton in 1996.",
    "answer_correctness_score": 10,
    "explanation_validity_score": 10,
    "question_clarity_score": 8,
    "question_difficulty_score": 1,
    "question_groundedness_score": 10,
    "question_token_count": 40,
    "reformat_question_cosine_similarity_to_orig": 0.8634309768676758,
    "reformat_answer_cosine_similarity_to_orig": 1.0000003576278687,
    "reformat_question_similarity_score": 10,
    "reformat_answer_similarity_score": 10,
    "avg_answer_token_count": 3
  },
  {
    "orig_question": "The Crystal Palace Football Club Player of the Year is awarded at the end of each season, some players have won the award for a second time, the most recent being which  professional footballer who plays as a winger for Premier League club Crystal Palace, and the Ivory Coast national team?",
    "orig_answer": "Dazet Wilfried Armel Zaha",
    "context": "[PAR] [TLE] Wilfried Zaha [SEP] Dazet Wilfried Armel Zaha (born 10 November 1992) is a professional footballer who plays as a winger for Premier League club Crystal Palace and the Ivory Coast national team. [PAR] [TLE] Crystal Palace F.C. Player of the Year [SEP] The Crystal Palace Football Club Player of the Year is awarded at the end of each season.  Since the inaugural award was made to John McCormick in 1972, 34 different players have won the award.  Nine of these players have won the award for a second time, the most recent being Wilfried Zaha.  Two players have received the award on more than two occasions, Jim Cannon won it three times and Juli\u00e1n Speroni won it four times.  Paul Hinshelwood was the first to win the trophy in consecutive seasons, a feat since emulated by Andrew Johnson, Juli\u00e1n Speroni and Wilfried Zaha.  Speroni is the only one to win it in three consecutive seasons.  The current incumbent of the award is Wilfried Zaha, who was the 2016\u201317 recipient.",
    "response": "<document_analysis>\nThe context provides information about Wilfried Zaha, a professional footballer, and the Crystal Palace Football Club Player of the Year award. The question asks for the most recent player to win the Crystal Palace Football Club Player of the Year award for a second time, who is also described as a winger for Crystal Palace and the Ivory Coast national team. The given answer is \"Dazet Wilfried Armel Zaha.\" \n\nUpon analysis, it's clear that the question is factually based and requires the test-taker to identify the most recent player to win the award for a second time, matching the description provided. The context contains all necessary information to answer the question. \n\nTo enhance the question's complexity and encourage deeper understanding, it can be rephrased to focus on the specific details provided in the context, such as the player's achievements and role.\n\nThe thought process involves:\n1. Identifying the key elements in the question: the award, the player's role, and the player's nationality.\n2. Recognizing that the answer is directly available in the context.\n3. Ensuring the rephrased question maintains semantic equivalence while enhancing clarity and complexity.\n\nThe difficulty level of the question is moderate (around 5-6) as it requires specific knowledge about Wilfried Zaha and the Crystal Palace Football Club Player of the Year award. To increase the difficulty, the question can be made more specific or analytical.\n\n</document_analysis>\n\n<output_format>\nQuestion: Which professional footballer, known for playing as a winger for Crystal Palace in the Premier League and for the Ivory Coast national team, was the most recent recipient to win the Crystal Palace Football Club Player of the Year award for a second time?\nA: Juli\u00e1n Speroni\nB: Andrew Johnson\nC: Jim Cannon\nD: Wilfried Zaha\nExplanation: The correct answer is Wilfried Zaha because he is mentioned in the context as the most recent player to win the Crystal Palace Football Club Player of the Year award for a second time. He is also described as a winger for Crystal Palace and plays for the Ivory Coast national team.\nCorrect Answer: D\n</output_format>",
    "question": "Which professional footballer, known for playing as a winger for Crystal Palace in the Premier League and for the Ivory Coast national team, was the most recent recipient to win the Crystal Palace Football Club Player of the Year award for a second time?",
    "choices": {
      "A": "Juli\u00e1n Speroni",
      "B": "Andrew Johnson",
      "C": "Jim Cannon",
      "D": "Wilfried Zaha"
    },
    "answer": "D",
    "explanation": "The correct answer is Wilfried Zaha because he is mentioned in the context as the most recent player to win the Crystal Palace Football Club Player of the Year award for a second time. He is also described as a winger for Crystal Palace and plays for the Ivory Coast national team.",
    "answer_correctness_score": 10,
    "explanation_validity_score": 10,
    "question_clarity_score": 7,
    "question_difficulty_score": 6,
    "question_groundedness_score": 10,
    "question_token_count": 51,
    "reformat_question_cosine_similarity_to_orig": 0.921579122543335,
    "reformat_answer_cosine_similarity_to_orig": 0.7500194311141968,
    "reformat_question_similarity_score": 9,
    "reformat_answer_similarity_score": 9,
    "avg_answer_token_count": 4
  },
  {
    "orig_question": "What record is releasing the album that includes \"Look What You Made Me Do\"?",
    "orig_answer": "Big Machine Records",
    "context": "[PAR] [TLE] Reputation (Taylor Swift album) [SEP] Reputation (stylized as reputation) is the upcoming sixth studio album by American singer-songwriter Taylor Swift.  It is scheduled for release on November 10, 2017, through Big Machine Records. [PAR] [TLE] Look What You Made Me Do [SEP] \"Look What You Made Me Do\" is a song recorded by American singer-songwriter Taylor Swift from her upcoming sixth studio album, \"Reputation\" (2017).  The song was released on August 25, 2017, as the lead single from the album.  Swift wrote the song with Jack Antonoff.  The song samples the melody of the 1991 song \"I'm Too Sexy\" by the band Right Said Fred, therefore Fred Fairbrass, Richard Fairbrass, and Rob Manzoli of the band are credited as songwriters.",
    "response": "<document_analysis>\nTo address the task, I will first analyze the given context, question, and answer. The context discusses Taylor Swift's upcoming sixth studio album, \"Reputation,\" and its lead single, \"Look What You Made Me Do.\" The question asks about the record label releasing the album that includes the song \"Look What You Made Me Do.\" The answer provided is \"Big Machine Records.\"\n\n1. **Thoughtful Content Examination**: The context mentions that Taylor Swift's album \"Reputation\" is scheduled for release through Big Machine Records. It also states that \"Look What You Made Me Do\" is a song from this album. Therefore, the central idea is that Big Machine Records is the label releasing \"Reputation,\" which includes the song in question.\n\n2. **Concept Exploration**: The information provided assumes that the record label for \"Reputation\" is relevant to understanding the song's release context. It implies a connection between the album's release and the label responsible.\n\n3. **Strategic Complexity Calibration**: The original question is straightforward and factual. To increase complexity, the question could be rephrased to require more nuanced understanding or application of the information.\n\n4. **Intentional Question Planning**: The question can be made more engaging by incorporating details from the context, making it more specific, and ensuring it requires a deeper understanding of the content.\n\nUpon analysis, I find the content to be relevant and of sufficient quality to generate a question. The original question is factual and straightforward. To enhance it, I will rephrase it to encourage deeper understanding and reflection while maintaining semantic equivalence.\n\n</document_analysis>\n\n<output_format>\nQuestion: Taylor Swift's sixth studio album, \"Reputation,\" is set to be released on November 10, 2017, and includes the lead single \"Look What You Made Me Do.\" Which record label is responsible for releasing this album?\nA: Universal Music Group\nB: Sony Music Entertainment\nC: Big Machine Records\nD: Republic Records\nExplanation: The correct answer is Big Machine Records because the context states that \"Reputation\" is scheduled for release through Big Machine Records.\nCorrect Answer: C\n</output_format>\n\nI have ensured that the rewritten question is semantically equivalent to the original, is clear, and includes sufficient context. The answer options are distinct and unambiguous, and the correct answer is present among the choices. The question is designed to be answerable by a domain expert without needing the original context paragraph.",
    "question": "Taylor Swift's sixth studio album, \"Reputation,\" is set to be released on November 10, 2017, and includes the lead single \"Look What You Made Me Do.\" Which record label is responsible for releasing this album?",
    "choices": {
      "A": "Universal Music Group",
      "B": "Sony Music Entertainment",
      "C": "Big Machine Records",
      "D": "Republic Records"
    },
    "answer": "C",
    "explanation": "The correct answer is Big Machine Records because the context states that \"Reputation\" is scheduled for release through Big Machine Records.",
    "answer_correctness_score": 10,
    "explanation_validity_score": 10,
    "question_clarity_score": 8,
    "question_difficulty_score": 2,
    "question_groundedness_score": 10,
    "question_token_count": 49,
    "reformat_question_cosine_similarity_to_orig": 0.6865153312683105,
    "reformat_answer_cosine_similarity_to_orig": 1.0,
    "reformat_question_similarity_score": 9,
    "reformat_answer_similarity_score": 10,
    "avg_answer_token_count": 3
  },
  {
    "orig_question": "What best selling German Brewery group sponsors the BiG Gotha basketball club?",
    "orig_answer": "Oettinger Brauerei",
    "context": "[PAR] [TLE] Oettinger Rockets [SEP] Oettinger Rockets is a German professional basketball team.  It is originally based in Gotha, Germany but plays its home games in Erfurt.  The team currently plays in the Basketball Bundesliga, the German first division.  The Rockets are the first team of the BiG Gotha basketball club.  The club is sponsored by Oettinger Brauerei. [PAR] [TLE] Oettinger Brauerei [SEP] Oettinger Brauerei is a brewery group in Germany.  Oettinger has been Germany's best selling beer brand since 2004 (when it superseded Krombacher) with an annual output of 6.21 e6hL in 2011.",
    "response": "<document_analysis>\nTo address the task, let's start by analyzing the given context, question, and answer.\n\n1. **Thoughtful Content Examination**: The context provides information about the Oettinger Rockets, a German professional basketball team, and Oettinger Brauerei, a brewery group in Germany. The key points are:\n   - The Oettinger Rockets basketball team is associated with the BiG Gotha basketball club.\n   - The team is sponsored by Oettinger Brauerei.\n   - Oettinger Brauerei is a significant brewery group in Germany, known for being the best-selling beer brand since 2004.\n\n2. **Concept Exploration**: The implicit assumption here is that the sponsorship is directly related to the branding and popularity of Oettinger Brauerei. The underlying theory is that a well-known brand like Oettinger Brauerei can support sports teams, enhancing its visibility and community engagement.\n\n3. **Strategic Complexity Calibration**: The original question is straightforward and factual. To increase complexity, we can rephrase it to require deeper understanding or application of the information provided.\n\n4. **Intentional Question Planning**: We can create a question that invites reflection on the relationship between the brewery's popularity and its sponsorship of the basketball team.\n\nGiven the context and the original question and answer, we will rephrase and rewrite them to fit the guidelines.\n\nThe original question is: \"What best selling German Brewery group sponsors the BiG Gotha basketball club?\"\nThe original answer is: \"Oettinger Brauerei\"\n\nUpon analysis, it's clear that the question is factual and directly answerable from the context. To enhance complexity and engagement, we can reframe the question.\n\n</document_analysis>\n\n<output_format>\nQuestion: Which brewery group, known for being Germany's best-selling beer brand since 2004, is associated with sponsoring the BiG Gotha basketball club, from which the Oettinger Rockets basketball team originates?\nA: Krombacher\nB: Warsteiner Brauerei\nC: Oettinger Brauerei\nD: Bitburger Brauerei\n\nExplanation: The correct answer is Oettinger Brauerei because it is mentioned in the context that Oettinger Brauerei has been Germany's best-selling beer brand since 2004 and that it sponsors the BiG Gotha basketball club.\n\nCorrect Answer: C\n</output_format>",
    "question": "Which brewery group, known for being Germany's best-selling beer brand since 2004, is associated with sponsoring the BiG Gotha basketball club, from which the Oettinger Rockets basketball team originates?",
    "choices": {
      "A": "Krombacher",
      "B": "Warsteiner Brauerei",
      "C": "Oettinger Brauerei",
      "D": "Bitburger Brauerei"
    },
    "answer": "C",
    "explanation": "The correct answer is Oettinger Brauerei because it is mentioned in the context that Oettinger Brauerei has been Germany's best-selling beer brand since 2004 and that it sponsors the BiG Gotha basketball club.",
    "answer_correctness_score": 10,
    "explanation_validity_score": 10,
    "question_clarity_score": 1,
    "question_difficulty_score": 6,
    "question_groundedness_score": 5,
    "question_token_count": 43,
    "reformat_question_cosine_similarity_to_orig": 0.8620562553405762,
    "reformat_answer_cosine_similarity_to_orig": 1.0000001192092896,
    "reformat_question_similarity_score": 9,
    "reformat_answer_similarity_score": 10,
    "avg_answer_token_count": 6
  },
  {
    "orig_question": "What infamous Mexican drug lord at one time headed both the Knights Templar Cartel and a cartel founded by Carlos Rosales Mendoza?",
    "orig_answer": "Nazario Moreno Gonz\u00e1lez",
    "context": "[PAR] [TLE] La Familia Michoacana [SEP] La Familia Michoacana, (English: \"The Michoac\u00e1n Family\") La Familia (English: \"The Family\"), or LFM was a Mexican drug cartel and a organized crime syndicate based in the Mexican state of Michoac\u00e1n.  Formerly allied to the Gulf Cartel\u2014as part of Los Zetas\u2014it split off in 2006.  The cartel was founded by Carlos Rosales Mendoza a close associate of Osiel C\u00e1rdenas.  The second leader, Nazario Moreno Gonz\u00e1lez, known as \"El M\u00e1s Loco\" (English: \"The Craziest One\"), preached his organization's divine right to eliminate enemies.  He carried a \"bible\" of his own sayings and insisted that his army of traffickers and hitmen avoid using the narcotics they sell.  Nazario Moreno's partners were Jos\u00e9 de Jes\u00fas M\u00e9ndez Vargas, Servando G\u00f3mez Mart\u00ednez and Enrique Plancarte Sol\u00eds, each of whom has a bounty of $2 million for his capture, and were contesting the control of the organization. [PAR] [TLE] Nazario Moreno Gonz\u00e1lez [SEP] Nazario Moreno Gonz\u00e1lez (8 March 1970 \u2013 9 March 2014), commonly referred to by his alias El Chayo (\"Nazario\" or \"The Rosary\") and/or El M\u00e1s Loco (\"The Craziest One\"), was a Mexican drug lord who headed La Familia Michoacana before heading the Knights Templar Cartel, a drug cartel headquartered in the state of Michoac\u00e1n.  He was one of Mexico's most-wanted drug lords.",
    "response": "<document_analysis>\nThe context provided details the history and leadership of La Familia Michoacana, a Mexican drug cartel, and its connection to other cartels. The key figure discussed is Nazario Moreno Gonz\u00e1lez, also known as \"El M\u00e1s Loco\" or \"The Craziest One.\" He was a significant leader in La Familia Michoacana and later headed the Knights Templar Cartel. The question asks for the identity of a Mexican drug lord who led both the Knights Templar Cartel and the cartel founded by Carlos Rosales Mendoza. The answer given is Nazario Moreno Gonz\u00e1lez.\n\nTo analyze this information:\n1. **Thoughtful Content Examination**: The context outlines the background of La Familia Michoacana and its leaders. It highlights Nazario Moreno Gonz\u00e1lez's role in the organization and his later involvement with the Knights Templar Cartel.\n2. **Concept Exploration**: The implicit assumption is that the reader understands the structure and dynamics of Mexican drug cartels and their leadership transitions. The subtle detail is the connection between La Familia Michoacana and the Knights Templar Cartel, with Nazario Moreno Gonz\u00e1lez being a pivotal figure.\n3. **Strategic Complexity Calibration**: The question is moderately complex, requiring knowledge of the specific cartels and their leaders. It is not overly simplistic but assumes some familiarity with the topic.\n4. **Intentional Question Planning**: The question invites deeper understanding by requiring the test-taker to connect the information about the cartels and their leaders, specifically identifying Nazario Moreno Gonz\u00e1lez's role in both organizations.\n\nThe question is well-crafted as it stands, but to enhance clarity and complexity, it can be rephrased to include more details from the context, making it more self-contained.\n\n</document_analysis>\n\n<output_format>\nQuestion: Which notorious Mexican drug lord, known for his involvement in the narcotics trade and his charismatic leadership, was at one point the head of both the Knights Templar Cartel and the drug cartel originally founded by Carlos Rosales Mendoza, an associate of Osiel C\u00e1rdenas?\nA: Servando G\u00f3mez Mart\u00ednez\nB: Nazario Moreno Gonz\u00e1lez\nC: Jos\u00e9 de Jes\u00fas M\u00e9ndez Vargas\nD: Enrique Plancarte Sol\u00eds\n\nExplanation: The correct answer, Nazario Moreno Gonz\u00e1lez, is supported by the context which states that he headed La Familia Michoacana, founded by Carlos Rosales Mendoza, and later led the Knights Templar Cartel.\n\nCorrect Answer: B\n</output_format>",
    "question": "Which notorious Mexican drug lord, known for his involvement in the narcotics trade and his charismatic leadership, was at one point the head of both the Knights Templar Cartel and the drug cartel originally founded by Carlos Rosales Mendoza, an associate of Osiel C\u00e1rdenas?",
    "choices": {
      "A": "Servando G\u00f3mez Mart\u00ednez",
      "B": "Nazario Moreno Gonz\u00e1lez",
      "C": "Jos\u00e9 de Jes\u00fas M\u00e9ndez Vargas",
      "D": "Enrique Plancarte Sol\u00eds"
    },
    "answer": "B",
    "explanation": "The correct answer, Nazario Moreno Gonz\u00e1lez, is supported by the context which states that he headed La Familia Michoacana, founded by Carlos Rosales Mendoza, and later led the Knights Templar Cartel.",
    "answer_correctness_score": 10,
    "explanation_validity_score": 10,
    "question_clarity_score": 6,
    "question_difficulty_score": 8,
    "question_groundedness_score": 10,
    "question_token_count": 58,
    "reformat_question_cosine_similarity_to_orig": 0.9183552861213684,
    "reformat_answer_cosine_similarity_to_orig": 1.0,
    "reformat_question_similarity_score": 9,
    "reformat_answer_similarity_score": 10,
    "avg_answer_token_count": 6
  },
  {
    "orig_question": "The finale episode of season 15 of South Park was what numbered episode?",
    "orig_answer": "223rd episode",
    "context": "[PAR] [TLE] The Poor Kid [SEP] \"The Poor Kid\" is the fifteenth season finale of the American animated television series \"South Park\", and the 223rd episode of the series overall.  It first aired on Comedy Central in the United States on November 16, 2011.  In the episode, Kenny and his brother and sister are sent to a foster home after police discover a meth lab in their house.  As a result, Cartman is left with feelings of loss, since he no longer has someone to ridicule for their poverty. [PAR] [TLE] South Park (season 15) [SEP] The fifteenth season of the American animated sitcom \"South Park\" began airing on Comedy Central on April 27, 2011 and ended on November 16, 2011.  In response to reactions to the mid-season finale episode \"You're Getting Old\", which seemed to insinuate that creators Trey Parker and Matt Stone were wrapping up the series, Comedy Central proclaimed through the media that \"South Park\" was renewed for two more seasons, and the duo were signed through 2013.  Shortly before the airing of the season finale episode \"The Poor Kid\", \"South Park\" was extended again until 2016, taking the show to 20 seasons.  Parker was the director and writer for all episodes, and Robert Lopez was the writer in this eleventh episode for the fifteenth season.",
    "response": "<document_analysis>\nTo generate a meaningful question-answer pair, let's first analyze the provided context. The context discusses the South Park episode \"The Poor Kid,\" which is the season 15 finale, and provides some background information on the season. The question asks for the episode number of the season 15 finale.\n\n1. **Thoughtful Content Examination**: The context mentions that \"The Poor Kid\" is the 223rd episode overall of the series. This information is directly relevant to the question.\n\n2. **Concept Exploration**: The context provides additional details about the episode and the season, such as the air date and the renewal of the series by Comedy Central. However, these details are not directly necessary to answer the question about the episode number.\n\n3. **Strategic Complexity Calibration**: The original question is straightforward and factual. To increase complexity, we can rephrase it to require a deeper understanding or more critical thinking. However, given the direct nature of the information, we will maintain a factual type question.\n\n4. **Intentional Question Planning**: The rewritten question should still be clear and factual but can be rephrased for better engagement or to test the understanding in a different way.\n\nThe original question and answer are: \n- Question: \"The finale episode of season 15 of South Park was what numbered episode?\"\n- Answer: \"223rd episode\"\n\nLet's rephrase them while maintaining semantic equivalence.\n\n</document_analysis>\n\n<output_format>\nQuestion: What was the overall episode number of the South Park season 15 finale?\nA: 222nd episode\nB: 223rd episode\nC: 224th episode\nD: 225th episode\nExplanation: The context states that \"The Poor Kid\" is the 223rd episode overall of the series, and it is the season 15 finale.\nCorrect Answer: B\n</output_format>",
    "question": "What was the overall episode number of the South Park season 15 finale?",
    "choices": {
      "A": "222nd episode",
      "B": "223rd episode",
      "C": "224th episode",
      "D": "225th episode"
    },
    "answer": "B",
    "explanation": "The context states that \"The Poor Kid\" is the 223rd episode overall of the series, and it is the season 15 finale.",
    "answer_correctness_score": 10,
    "explanation_validity_score": 10,
    "question_clarity_score": 8,
    "question_difficulty_score": 2,
    "question_groundedness_score": 10,
    "question_token_count": 16,
    "reformat_question_cosine_similarity_to_orig": 0.9380360245704651,
    "reformat_answer_cosine_similarity_to_orig": 1.0000001192092896,
    "reformat_question_similarity_score": 10,
    "reformat_answer_similarity_score": 10,
    "avg_answer_token_count": 4
  },
  {
    "orig_question": "In which state is Gold Mountain Casino and WinStar World Casino both located?",
    "orig_answer": "Oklahoma",
    "context": "[PAR] [TLE] Gold Mountain Casino [SEP] Gold Mountain Casino is a Native American casino in Ardmore, Oklahoma, owned and operated by the Chickasaw Nation.  Originally opened in 2002 as Ardmore Gaming, the facility has grown steadily and today features more than 300 gaming machines.  The casino is open 24 hours a day, seven days a week.  The 8620 sqft casino is located on the corner of P Street N.E. and Sam Noble Parkway, and can be accessed via Interstate 35, exit 33.  It is a short distance from the Ardmore Convention Center and the Hardy Murphy Coliseum.  Gold Mountain is about 34 miles north of WinStar World Casino in Thackerville, Oklahoma, and 77 miles south of Riverwind Casino in Norman, Oklahoma, which are also Chickasaw-owned gaming facilities. [PAR] [TLE] WinStar World Casino [SEP] WinStar World Casino and Resort is a hotel and casino located near the Oklahoma\u2013Texas state line, 1 mi north of the Red River, at Exit 1 off Interstate 35 and Winstar Boulevard in Thackerville, Oklahoma.  The casino opened as the WinStar Casino in 2004, and was expanded (with a 395-room hotel tower) and renamed the WinStar World Casino in 2009, with its 519000 sqft of casino floor making it the largest casino in the state of Oklahoma.  In August 2013, WinStar Resorts completed a major expansion project, which added a new 1000-room second hotel tower that was divided into two phases; this also added a new casino that is attached to the tower.  As a result of the completion of this expansion, the casino overtook Foxwoods Resort Casino to become the largest casino in the United States based on gaming floor space.  WinStar has over 7,400 electronic games, 46 table poker rooms, 99 total table games, Racer's off-track betting, High Limit Room, keno, and bingo.",
    "response": "<document_analysis>\nThe context provides information about two Native American casinos: Gold Mountain Casino and WinStar World Casino. Both casinos are described in detail, including their locations and features. To answer the question, we need to identify the state in which both casinos are located.\n\nUpon examining the context, it is clear that Gold Mountain Casino is located in Ardmore, Oklahoma. The text states, \"Gold Mountain Casino is a Native American casino in Ardmore, Oklahoma, owned and operated by the Chickasaw Nation.\" Similarly, WinStar World Casino is described as being located \"near the Oklahoma\u2013Texas state line, 1 mi north of the Red River, at Exit 1 off Interstate 35 and Winstar Boulevard in Thackerville, Oklahoma.\" Thus, both casinos are located in Oklahoma.\n\nThe question requires the test-taker to identify the common state where both casinos are situated. The answer, \"Oklahoma,\" is directly supported by the information provided in the context.\n\nTo create a more challenging and nuanced question, we can rephrase it to require a deeper understanding of the content. For example, we can ask for the state that is common to both casinos, considering their geographical locations relative to other landmarks or casinos.\n\nThe complexity of the question is moderate, as it requires the test-taker to understand the locations of both casinos. The question is self-contained and does not require external references.\n\n</document_analysis>\n\n<output_format>\nQuestion: What state do Gold Mountain Casino, located in Ardmore, and WinStar World Casino, situated near the Oklahoma-Texas border in Thackerville, have in common?\nA: Texas\nB: Oklahoma\nC: Arkansas\nD: Louisiana\nExplanation: Both Gold Mountain Casino and WinStar World Casino are located in Oklahoma, as stated in the provided context. Gold Mountain Casino is in Ardmore, Oklahoma, and WinStar World Casino is in Thackerville, Oklahoma, near the Texas border.\nCorrect Answer: B\n</output_format>",
    "question": "What state do Gold Mountain Casino, located in Ardmore, and WinStar World Casino, situated near the Oklahoma-Texas border in Thackerville, have in common?",
    "choices": {
      "A": "Texas",
      "B": "Oklahoma",
      "C": "Arkansas",
      "D": "Louisiana"
    },
    "answer": "B",
    "explanation": "Both Gold Mountain Casino and WinStar World Casino are located in Oklahoma, as stated in the provided context. Gold Mountain Casino is in Ardmore, Oklahoma, and WinStar World Casino is in Thackerville, Oklahoma, near the Texas border.",
    "answer_correctness_score": 10,
    "explanation_validity_score": 10,
    "question_clarity_score": 8,
    "question_difficulty_score": 2,
    "question_groundedness_score": 10,
    "question_token_count": 36,
    "reformat_question_cosine_similarity_to_orig": 0.8757195472717285,
    "reformat_answer_cosine_similarity_to_orig": 1.000000238418579,
    "reformat_question_similarity_score": 9,
    "reformat_answer_similarity_score": 10,
    "avg_answer_token_count": 2
  },
  {
    "orig_question": "What influenced the song, written by Ne-Yo, from Rihanna's second studio album?",
    "orig_answer": "Caribbean roots",
    "context": "[PAR] [TLE] A Girl like Me (Rihanna album) [SEP] A Girl like Me is the second studio album by Barbadian singer Rihanna.  It was released on April 10, 2006 by Def Jam Recordings.  For the production of the album, Rihanna worked with Evan Rogers, Carl Sturken, StarGate, J. R. Rotem and label-mate Ne-Yo, who wrote the album's second single.  \"A Girl like Me\" is a pop, reggae and R&B album influenced by Rihanna's Caribbean roots.  The album also incorporates elements of dancehall and rock, as well as ballads, which music critics were ambivalent towards. [PAR] [TLE] Unfaithful (song) [SEP] \"Unfaithful\" is a song by Barbadian singer Rihanna from her second studio album \"A Girl like Me\" (2006).  It was written by Shaffer \"Ne-Yo\" Smith with the song's producers StarGate.  The song was released by Def Jam Recordings on May 2, 2006, as the second single from the album.  \"Unfaithful\" is a pop and R&B ballad and was inspired by the works of American rock band Evanescence.  Originally titled \"Murderer\", the single speaks about a woman who regrets cheating on her partner.",
    "response": "<document_analysis>\nTo address the task, let's first analyze the given context, question, and answer.\n\n1. **Thoughtful Content Examination**: The context provides information about Rihanna's second studio album, \"A Girl like Me,\" and a specific song from that album, \"Unfaithful.\" The album is described as a mix of pop, reggae, and R&B, influenced by Rihanna's Caribbean roots. \"Unfaithful\" is identified as a pop and R&B ballad inspired by the works of the American rock band Evanescence.\n\n2. **Concept Exploration**: The question asks about the influence on the song \"Unfaithful,\" written by Ne-Yo, from Rihanna's second studio album. The original answer provided is \"Caribbean roots.\" However, upon closer examination, it's clear that while the album \"A Girl like Me\" is influenced by Rihanna's Caribbean roots, the specific influence on the song \"Unfaithful\" is stated to be the works of Evanescence.\n\n3. **Strategic Complexity Calibration**: The difficulty level of the original question is relatively low (around 2-3) because it directly relates to information given in the context. To increase complexity, the question should be rephrased to require deeper understanding or inference.\n\n4. **Intentional Question Planning**: To create a more challenging and meaningful question, we should focus on the specific details related to \"Unfaithful\" and its inspiration, rather than general influences on the album.\n\nGiven the above analysis, the original question and answer need refinement. The correct influence on \"Unfaithful\" is the works of Evanescence, not \"Caribbean roots.\" Thus, a more accurate and challenging question would focus on the specific inspiration for \"Unfaithful.\"\n\nThe original answer, \"Caribbean roots,\" is incorrect in the context of the song \"Unfaithful.\" The correct answer, based on the context, should relate to Evanescence.\n\n</document_analysis>\n\n<output_format>\nQuestion: What was the primary inspiration for Rihanna's song \"Unfaithful\" from her second studio album \"A Girl like Me\"?\nA: The works of the American rock band Evanescence\nB: Rihanna's Caribbean roots\nC: The style of her first studio album\nD: The production team StarGate\n\nExplanation: The song \"Unfaithful\" was inspired by the works of the American rock band Evanescence, as stated in the context provided.\n\nCorrect Answer: A\n</output_format>",
    "question": "What was the primary inspiration for Rihanna's song \"Unfaithful\" from her second studio album \"A Girl like Me\"?",
    "choices": {
      "A": "The works of the American rock band Evanescence",
      "B": "Rihanna's Caribbean roots",
      "C": "The style of her first studio album",
      "D": "The production team StarGate"
    },
    "answer": "A",
    "explanation": "The song \"Unfaithful\" was inspired by the works of the American rock band Evanescence, as stated in the context provided.",
    "answer_correctness_score": 10,
    "explanation_validity_score": 10,
    "question_clarity_score": 8,
    "question_difficulty_score": 4,
    "question_groundedness_score": 5,
    "question_token_count": 28,
    "reformat_question_cosine_similarity_to_orig": 0.6961881518363953,
    "reformat_answer_cosine_similarity_to_orig": 0.1388791799545288,
    "reformat_question_similarity_score": 8,
    "reformat_answer_similarity_score": 2,
    "avg_answer_token_count": 7
  },
  {
    "orig_question": "What animated car character was voiced by Paul Newman?",
    "orig_answer": "Doc Hudson",
    "context": "[PAR] [TLE] Doc Hudson [SEP] Doc Hudson (\"Dr. Hudson\" or simply \"Doc\") was an animated, anthropomorphic retired race car who appears in the 2006 Pixar film \"Cars\" as a medical doctor and a local judge.  He is voiced by actor Paul Newman in the first and third films and video game, and Corey Burton in all other media.  Six-time Turismo Carretera champion Juan Mar\u00eda Traverso voiced the character in the Rioplatense Spanish version.  He is modeled after a 1951 Hudson Hornet. [PAR] [TLE] Paul Newman [SEP] Paul Leonard Newman (January 26, 1925 \u2013 September 26, 2008) was an American actor, film director, producer, race car driver, IndyCar owner, entrepreneur, activist, and philanthropist.  He won and was nominated for numerous awards, winning an Academy Award for his performance in the 1986 film \"The Color of Money\", a BAFTA Award, a Screen Actors Guild Award, a Cannes Film Festival Award, an Emmy Award, and many others.  Newman's other roles include the title characters in \"The Hustler\" (1961) and \"Cool Hand Luke\" (1967), as well as \"Butch Cassidy and the Sundance Kid\" (1969), as Butch Cassidy, \"The Sting\" (1973), and \"The Verdict\" (1982).  He also voiced Doc Hudson in the first installment of Disney-Pixar's \"Cars\", and received a posthumous credit for his voice recordings in \"Cars 3\" (2017).",
    "response": "<document_analysis>\nTo generate a question that is semantically equivalent to the original, I will analyze the given context, question, and answer. The context provides information about Doc Hudson, a character from the \"Cars\" film, and Paul Newman, the actor who voiced Doc Hudson. The original question asks about the animated car character voiced by Paul Newman, and the answer is \"Doc Hudson.\"\n\nUpon examining the context, I notice that it contains detailed information about both Doc Hudson and Paul Newman. The relevant information for the question is that Paul Newman voiced Doc Hudson in the \"Cars\" film. \n\nTo create a more challenging and thoughtful question, I will consider the details provided in the context and rephrase the question to invite deeper understanding or critical engagement.\n\nThe original question is straightforward and factual. To increase its complexity, I could rephrase it to require more nuanced understanding or application of the information provided.\n\n</document_analysis>\n\n<output_format>\nQuestion: Which anthropomorphic car character from the 2006 Pixar film \"Cars\" was voiced by the acclaimed American actor Paul Newman, known for his iconic roles in films such as \"The Hustler\" and \"Cool Hand Luke\"?\nA: Lightning McQueen\nB: Mater\nC: Ramone\nD: Doc Hudson\n\nExplanation: The correct answer is Doc Hudson because, according to the provided context, Paul Newman voiced Doc Hudson in the \"Cars\" film. Doc Hudson is an animated, anthropomorphic retired race car who appears in the film.\n\nCorrect Answer: D\n</output_format>",
    "question": "Which anthropomorphic car character from the 2006 Pixar film \"Cars\" was voiced by the acclaimed American actor Paul Newman, known for his iconic roles in films such as \"The Hustler\" and \"Cool Hand Luke\"?",
    "choices": {
      "A": "Lightning McQueen",
      "B": "Mater",
      "C": "Ramone",
      "D": "Doc Hudson"
    },
    "answer": "D",
    "explanation": "The correct answer is Doc Hudson because, according to the provided context, Paul Newman voiced Doc Hudson in the \"Cars\" film. Doc Hudson is an animated, anthropomorphic retired race car who appears in the film.",
    "answer_correctness_score": 10,
    "explanation_validity_score": 10,
    "question_clarity_score": 8,
    "question_difficulty_score": 5,
    "question_groundedness_score": 10,
    "question_token_count": 48,
    "reformat_question_cosine_similarity_to_orig": 0.8220199942588806,
    "reformat_answer_cosine_similarity_to_orig": 1.000000238418579,
    "reformat_question_similarity_score": 9,
    "reformat_answer_similarity_score": 10,
    "avg_answer_token_count": 3
  },
  {
    "orig_question": "What is the nationality of the current holder of the Ligue 1 Young Player of the Year award?",
    "orig_answer": "French",
    "context": "[PAR] [TLE] Ousmane Demb\u00e9l\u00e9 [SEP] Ousmane Demb\u00e9l\u00e9 (born 15 May 1997) is a French professional footballer who plays as a forward for Spanish club FC Barcelona and the France national team. [PAR] [TLE] Ligue 1 Young player of the year [SEP] The Ligue 1 Young Player of the Year is an award given to the player aged 23 years or under at the start of the season whose performances are considered to be the best, playing in Ligue 1.  The award has been presented since the 1993\u201394 season and the first winner of the award was Bordeaux midfielder Zinedine Zidane.  The current holder is Ousmane Demb\u00e9l\u00e9, who won the award for his performances throughout the 2015\u201316 campaign for Rennes scoring 12 goals and assisting 5.  Eden Hazard is the only player to have won this award twice",
    "response": "<document_analysis>\nTo address this task, I will begin by analyzing the provided context, question, and answer. The context discusses Ousmane Demb\u00e9l\u00e9, a French professional footballer, and the Ligue 1 Young Player of the Year award, which he has won. The question asks for the nationality of the current holder of the Ligue 1 Young Player of the Year award, and the answer provided is \"French.\"\n\n1. **Thoughtful Content Examination**: The context informs us that Ousmane Demb\u00e9l\u00e9 is French and that he is the current holder of the Ligue 1 Young Player of the Year award. This information directly answers the question about the nationality of the award's current holder.\n\n2. **Concept Exploration**: The context implies that the award is given to young players in Ligue 1, and it highlights Demb\u00e9l\u00e9's achievements that led to him receiving the award. It also mentions that he plays for the France national team, reinforcing his nationality.\n\n3. **Strategic Complexity Calibration**: The original question is straightforward and can be answered directly from the context. To increase complexity, the question can be rephrased to require a deeper understanding or more inference. The difficulty level is currently low (around 2-3) because it directly states Demb\u00e9l\u00e9's nationality and his status as the award holder. To calibrate it to a higher difficulty (around 7-8), the question needs to be more nuanced.\n\n4. **Intentional Question Planning**: To create a more challenging and thought-provoking question, we can incorporate more details from the context and require the test-taker to make connections between different pieces of information.\n\nGiven the context and the original question and answer, I will rephrase and rewrite them to create a more complex and engaging query.\n\n</document_analysis>\n\n<output_format>\nQuestion: Given that Ousmane Demb\u00e9l\u00e9, who plays for the France national team and won the Ligue 1 Young Player of the Year award for his performances in the 2015\u201316 season with Rennes, what is his nationality?\nA: Spanish\nB: French\nC: Belgian\nD: Italian\n\nExplanation: The correct answer is French because Ousmane Demb\u00e9l\u00e9 is mentioned to play for the France national team, indicating his nationality is French.\n\nCorrect Answer: B\n</output_format>",
    "question": "Given that Ousmane Demb\u00e9l\u00e9, who plays for the France national team and won the Ligue 1 Young Player of the Year award for his performances in the 2015\u201316 season with Rennes, what is his nationality?",
    "choices": {
      "A": "Spanish",
      "B": "French",
      "C": "Belgian",
      "D": "Italian"
    },
    "answer": "B",
    "explanation": "The correct answer is French because Ousmane Demb\u00e9l\u00e9 is mentioned to play for the France national team, indicating his nationality is French.",
    "answer_correctness_score": 10,
    "explanation_validity_score": 10,
    "question_clarity_score": 6,
    "question_difficulty_score": 2,
    "question_groundedness_score": 10,
    "question_token_count": 48,
    "reformat_question_cosine_similarity_to_orig": 0.6296331882476807,
    "reformat_answer_cosine_similarity_to_orig": 1.0,
    "reformat_question_similarity_score": 8,
    "reformat_answer_similarity_score": 10,
    "avg_answer_token_count": 2
  },
  {
    "orig_question": "Both Javier Mora and Alexander Povetkin are professional what?",
    "orig_answer": "boxer",
    "context": "[PAR] [TLE] Javier Mora (boxer) [SEP] Javier Mora (born May 25, 1981 in Encarnacion de Diaz, Jalisco, Mexico) is a Mexican boxer in the Heavyweight division.  He was defeated by Alexander Povetkin by a 5-round TKO, in Max Schmeling Halle, Prenzlauer Berg, Berlin, Germany. [PAR] [TLE] Alexander Povetkin [SEP] Alexander Vladimirovich \"Sasha\" Povetkin ( ; Russian: \u0410\u043b\u0435\u043a\u0441\u0430\u0301\u043d\u0434\u0440 \u0412\u043b\u0430\u0434\u0438\u0301\u043c\u0438\u0440\u043e\u0432\u0438\u0447 \u041f\u043e\u0432\u0435\u0301\u0442\u043a\u0438\u043d ; born 2 September 1979) is a Russian professional boxer who held the WBA (Regular) heavyweight title from 2011 to 2013.  As an amateur he won a gold medal in the super-heavyweight division at the 2004 Olympics, gold at the 2003 World Championships, and consecutive gold at the 2002 and 2004 European Championships.  Povetkin is known as a physically strong, hard-hitting and skilled pressure fighter.",
    "response": "<document_analysis>\nThe context provides information about two individuals, Javier Mora and Alexander Povetkin, both of whom are described as professional boxers. Javier Mora is a Mexican boxer who was defeated by Alexander Povetkin in a boxing match. Alexander Povetkin is a Russian professional boxer with a notable amateur career, having won several gold medals in prestigious competitions. The question asks for the profession that both Javier Mora and Alexander Povetkin share.\n\n1. **Thoughtful Content Examination**: The context clearly states that both Javier Mora and Alexander Povetkin are boxers, with detailed information about their careers and achievements in boxing.\n2. **Concept Exploration**: The information provided highlights their profession and achievements in the boxing domain, indicating that their shared profession is boxing.\n3. **Strategic Complexity Calibration**: The difficulty level of the question is relatively low since it directly states their profession. However, it is a straightforward question that can be answered based on the information given.\n4. **Intentional Question Planning**: To enhance the question's complexity and encourage deeper understanding, it can be rephrased to require more nuanced comprehension or application of the information provided.\n\nUpon analyzing the context, it is clear that both Javier Mora and Alexander Povetkin are professional boxers. The question can be rephrased to maintain its simplicity while ensuring it remains answerable by a domain expert without the context paragraph.\n\n</document_analysis>\n\n<output_format>\nQuestion: What profession do Javier Mora and Alexander Povetkin share, as evident from their careers and achievements?\nA: Footballer\nB: Boxer\nC: Wrestler\nD: Athlete\nExplanation: Both Javier Mora and Alexander Povetkin are described as professional boxers in the provided context.\nCorrect Answer: B\n</output_format>\n\nThis revised question and answer pair maintain semantic equivalence with the original while adhering to the required output format and guidelines. The question is designed to be clear and answerable without directly referencing the context, and the answer options are distinct and unambiguous.",
    "question": "What profession do Javier Mora and Alexander Povetkin share, as evident from their careers and achievements?",
    "choices": {
      "A": "Footballer",
      "B": "Boxer",
      "C": "Wrestler",
      "D": "Athlete"
    },
    "answer": "B",
    "explanation": "Both Javier Mora and Alexander Povetkin are described as professional boxers in the provided context.",
    "answer_correctness_score": 10,
    "explanation_validity_score": 10,
    "question_clarity_score": 6,
    "question_difficulty_score": 2,
    "question_groundedness_score": 10,
    "question_token_count": 21,
    "reformat_question_cosine_similarity_to_orig": 0.866202175617218,
    "reformat_answer_cosine_similarity_to_orig": 1.000000238418579,
    "reformat_question_similarity_score": 10,
    "reformat_answer_similarity_score": 10,
    "avg_answer_token_count": 3
  },
  {
    "orig_question": "Oettinger Rockets is sponsored by the company that has been the best-selling beer since what year?",
    "orig_answer": "2004",
    "context": "[PAR] [TLE] Oettinger Rockets [SEP] Oettinger Rockets is a German professional basketball team.  It is originally based in Gotha, Germany but plays its home games in Erfurt.  The team currently plays in the Basketball Bundesliga, the German first division.  The Rockets are the first team of the BiG Gotha basketball club.  The club is sponsored by Oettinger Brauerei. [PAR] [TLE] Oettinger Brauerei [SEP] Oettinger Brauerei is a brewery group in Germany.  Oettinger has been Germany's best selling beer brand since 2004 (when it superseded Krombacher) with an annual output of 6.21 e6hL in 2011.",
    "response": "<document_analysis>\nTo address the task, I will begin by analyzing the given context, question, and answer. The context provides information about the Oettinger Rockets, a German professional basketball team, and Oettinger Brauerei, a brewery group in Germany. The question asks for the year since which Oettinger Brauerei has been Germany's best-selling beer brand. The answer provided is 2004.\n\n1. **Thoughtful Content Examination**: The context informs us that Oettinger Rockets is sponsored by Oettinger Brauerei and that Oettinger Brauerei has been Germany's best-selling beer brand since 2004. The question directly relates to the information given about Oettinger Brauerei.\n\n2. **Concept Exploration**: The information provided connects the basketball team Oettinger Rockets with its sponsor, Oettinger Brauerei, and highlights the brewery's success in the German beer market. The underlying concept here is the relationship between a sports team and its sponsor, as well as the sponsor's market standing.\n\n3. **Strategic Complexity Calibration**: The original question is straightforward and factual. To increase complexity, the question could be rephrased to require a deeper understanding or application of the given information. The difficulty level is currently low (around 2-3), as it directly asks for a specific fact mentioned in the context.\n\n4. **Intentional Question Planning**: To enhance the question, it could be made more analytical or application-based, encouraging deeper thought. For example, instead of directly asking for the year, the question could be framed to test understanding of the context or implications of Oettinger Brauerei's market position.\n\nGiven the context and the original question-answer pair, I will now proceed to rephrase and rewrite them according to the provided guidelines, aiming to increase the complexity and encourage deeper understanding.\n\n</document_analysis>\n\n<output_format>\nQuestion: What year did Oettinger Brauerei become Germany's top-selling beer brand, a position it still holds and which likely contributes to its ability to sponsor teams like the Oettinger Rockets?\nA: 2002\nB: 2004\nC: 2006\nD: 2008\nExplanation: The correct answer is 2004 because, according to the context, Oettinger Brauerei has been Germany's best-selling beer brand since 2004, after surpassing Krombacher.\nCorrect Answer: B\n</output_format>",
    "question": "What year did Oettinger Brauerei become Germany's top-selling beer brand, a position it still holds and which likely contributes to its ability to sponsor teams like the Oettinger Rockets?",
    "choices": {
      "A": "2002",
      "B": "2004",
      "C": "2006",
      "D": "2008"
    },
    "answer": "B",
    "explanation": "The correct answer is 2004 because, according to the context, Oettinger Brauerei has been Germany's best-selling beer brand since 2004, after surpassing Krombacher.",
    "answer_correctness_score": 10,
    "explanation_validity_score": 10,
    "question_clarity_score": 7,
    "question_difficulty_score": 2,
    "question_groundedness_score": 10,
    "question_token_count": 40,
    "reformat_question_cosine_similarity_to_orig": 0.7131765484809875,
    "reformat_answer_cosine_similarity_to_orig": 1.0,
    "reformat_question_similarity_score": 10,
    "reformat_answer_similarity_score": 10,
    "avg_answer_token_count": 3
  },
  {
    "orig_question": "What were the two leads in the movie that won the most awards at the 63rd Bodil Awards?",
    "orig_answer": "Willem Dafoe and Charlotte Gainsbourg.",
    "context": "[PAR] [TLE] Antichrist (film) [SEP] Antichrist is a 2009 English-language Danish experimental horror film written and directed by Lars von Trier, and starring Willem Dafoe and Charlotte Gainsbourg.  It tells the story of a couple who, after the death of their child, retreat to a cabin in the woods where the man experiences strange visions and the woman manifests increasingly violent sexual behaviour and sadomasochism.  The narrative is divided into a prologue, four chapters and an epilogue.  The film was primarily a Danish production and co-produced by companies from six different European countries.  It was filmed in Germany and Sweden. [PAR] [TLE] 63rd Bodil Awards [SEP] The 63rd Bodil Awardss were held on 21 March 2010 in the Imperial Cinema in Copenhagen, Denmark, honouring the best national and foreign films of 2009.  Lasse Rimmer hosted the event.  Lars von Triers \"Antichrist\" was the big winner, receiving both the awards for Best Danish Film, Best Actor (Willem Dafoe), Best Actress (Charlotte Gainsbourg), Best Cinematographer (Anthony Dod Mantle) and a Special Award to Eidnes Andersen for sound design. \" Deliver Us from Evil\" won both the awards for Best Supporting Actor () and Best Supporting Actress () while \"Headhunter (2009 film)\" which had come to the ceremony with the most nominations, five in three categories, left empty-handed.  The documentary \"The Invisible Cell\" about The Blekinge Street Gang won the award for Best Documentary.  Carsten Myllerup, Linda Krogs\u00f8e Holmberg and Jens Mikkelsen received a Bodil Honorary Award for their role in the foundation of the alternative film school Super16.",
    "response": "## Step 1: Understand the given context and the task\nThe context provides information about the film \"Antichrist\" directed by Lars von Trier and its performance at the 63rd Bodil Awards. The task is to rephrase and reformat the given question and answer pair according to specific guidelines.\n\n## Step 2: Analyze the context to identify relevant information\nThe context mentions that \"Antichrist\" was the big winner at the 63rd Bodil Awards, receiving multiple awards including Best Actor for Willem Dafoe and Best Actress for Charlotte Gainsbourg.\n\n## Step 3: Examine the question and answer\nThe original question asks for the two leads in the movie that won the most awards at the 63rd Bodil Awards. The answer provided is Willem Dafoe and Charlotte Gainsbourg.\n\n## Step 4: Rephrase the question to be semantically equivalent but clearer and more detailed\nTo rephrase the question, we need to ensure it is clear, detailed, and stands alone without referencing the original context explicitly. The movie in question is \"Antichrist,\" and it won the most awards at the 63rd Bodil Awards.\n\n## Step 5: Rephrase the answer to be semantically equivalent\nThe answer should remain essentially the same but can be reworded for clarity. The leads in \"Antichrist\" who won awards were Willem Dafoe and Charlotte Gainsbourg.\n\n## Step 6: Generate a multiple-choice question with the correct answer and distractors\nTo create a multiple-choice question, we need to come up with plausible distractors. Other notable actors or actresses from different films could serve as distractors.\n\n## Step 7: Document the thought process and rationale within `<document_analysis>` tags\n<document_analysis>\nThe context provides detailed information about the film \"Antichrist\" and its success at the 63rd Bodil Awards. The question seeks to identify the lead actors of this film. The original question is clear but could be improved for better understanding. The answer is directly supported by the context. To rephrase the question, we should incorporate more details from the context to make it stand-alone. The rephrased question could be: \"Which actors played the lead roles in the film that received the most awards at the 63rd Bodil Awards ceremony held on March 21, 2010?\" The answer remains Willem Dafoe and Charlotte Gainsbourg. Distractors could include other actors or actresses who were recognized at the awards or are known for their work in similar genres or categories.\n</document_analysis>\n\n## Step 8: Create the output in the required format\nTo create the output, we will formulate a question that is detailed and clear, provide four answer options, and include an explanation for the correct answer.\n\nQuestion: Which actors played the lead roles in the film that received the most awards at the 63rd Bodil Awards ceremony held on March 21, 2010, honouring the best national and foreign films of 2009?\nA: Mads Mikkelsen and Charlotte Gainsbourg\nB: Willem Dafoe and Charlotte Gainsbourg\nC: Willem Dafoe and Sidse Babett Knudsen\nD: Lasse Rimmer and Charlotte Gainsbourg\n\nExplanation: The film \"Antichrist\" directed by Lars von Trier won the most awards at the 63rd Bodil Awards. Willem Dafoe won the Best Actor award, and Charlotte Gainsbourg won the Best Actress award for their roles in \"Antichrist.\"\n\nCorrect Answer: B\n\nThe final answer is presented in the required `<output_format>` tags as follows:\n\n<output_format>\nQuestion: Which actors played the lead roles in the film that received the most awards at the 63rd Bodil Awards ceremony held on March 21, 2010, honouring the best national and foreign films of 2009?\nA: Mads Mikkelsen and Charlotte Gainsbourg\nB: Willem Dafoe and Charlotte Gainsbourg\nC: Willem Dafoe and Sidse Babett Knudsen\nD: Lasse Rimmer and Charlotte Gainsbourg\nExplanation: The film \"Antichrist\" directed by Lars von Trier won the most awards at the 63rd Bodil Awards. Willem Dafoe won the Best Actor award, and Charlotte Gainsbourg won the Best Actress award for their roles in \"Antichrist.\"\nCorrect Answer: B\n</output_format>\n\nThe final answer is: \n<output_format>\nQuestion: Which actors played the lead roles in the film that received the most awards at the 63rd Bodil Awards ceremony held on March 21, 2010, honouring the best national and foreign films of 2009?\nA: Mads Mikkelsen and Charlotte Gainsbourg\nB: Willem Dafoe and Charlotte Gainsbourg\nC: Willem Dafoe and Sidse Babett Knudsen\nD: Lasse Rimmer and Charlotte Gainsbourg\nExplanation: The film \"Antichrist\" directed by Lars von Trier won the most awards at the 63rd Bodil Awards. Willem Dafoe won the Best Actor award, and Charlotte Gainsbourg won the Best Actress award for their roles in \"Antichrist.\"\nCorrect Answer: B\n</output_format>",
    "question": "Which actors played the lead roles in the film that received the most awards at the 63rd Bodil Awards ceremony held on March 21, 2010, honouring the best national and foreign films of 2009?",
    "choices": {
      "A": "Mads Mikkelsen and Charlotte Gainsbourg",
      "B": "Willem Dafoe and Charlotte Gainsbourg",
      "C": "Willem Dafoe and Sidse Babett Knudsen",
      "D": "Lasse Rimmer and Charlotte Gainsbourg"
    },
    "answer": "B",
    "explanation": "The film \"Antichrist\" directed by Lars von Trier won the most awards at the 63rd Bodil Awards. Willem Dafoe won the Best Actor award, and Charlotte Gainsbourg won the Best Actress award for their roles in \"Antichrist.\"",
    "answer_correctness_score": 10,
    "explanation_validity_score": 10,
    "question_clarity_score": 2,
    "question_difficulty_score": 5,
    "question_groundedness_score": 10,
    "question_token_count": 47,
    "reformat_question_cosine_similarity_to_orig": 0.6979982852935791,
    "reformat_answer_cosine_similarity_to_orig": 0.9825295209884644,
    "reformat_question_similarity_score": 9,
    "reformat_answer_similarity_score": 10,
    "avg_answer_token_count": 10
  },
  {
    "orig_question": "What coach returned for his 10th season as the coach of Missouri Tigers football and led the team to the 22nd edition of the Insight Bowl in 2010?",
    "orig_answer": "Gary Pinkel",
    "context": "[PAR] [TLE] 2010 Missouri Tigers football team [SEP] The 2010 Missouri Tigers football team represented the University of Missouri in the 2010 NCAA Division I FBS football season.  The team was coached by Gary Pinkel, who returned for his tenth season with Mizzou, and played their home games at Faurot Field at Memorial Stadium.  The team began the season fresh off their fifth straight bowl appearance.  The team hired a new public address announcer, Randy Moehlman. [PAR] [TLE] 2010 Insight Bowl [SEP] The 2010 Insight Bowl was the 22nd edition of the college football bowl game, played at Sun Devil Stadium in Tempe, Arizona on Tuesday, December 28, 2010.  It featured the Missouri Tigers from the Big 12 Conference versus the Iowa Hawkeyes from the Big Ten Conference.",
    "response": "<document_analysis>\nThe context provides information about the 2010 Missouri Tigers football team and their participation in the 2010 Insight Bowl. The team was coached by Gary Pinkel, who was in his tenth season with the team. The context also mentions that the 2010 Insight Bowl was the 22nd edition of the bowl game, featuring the Missouri Tigers against the Iowa Hawkeyes. The question asks for the coach who returned for his 10th season and led the team to the 22nd edition of the Insight Bowl in 2010. To answer this question, one needs to identify the coach mentioned in the context and confirm that he was indeed in his tenth season. The context clearly states that Gary Pinkel was the coach for his tenth season with Mizzou. However, it does not explicitly state that he led the team to the Insight Bowl. It only mentions that the team began the season fresh off their fifth straight bowl appearance, implying they were bowl-eligible, and the 2010 Insight Bowl featured the Missouri Tigers. Thus, the question assumes that the team coached by Gary Pinkel participated in the 22nd edition of the Insight Bowl. The correct answer, Gary Pinkel, is directly derived from the information given about the team's coach during the 2010 season.\n\nThought Process:\n1. Identify the coach of the 2010 Missouri Tigers football team.\n2. Confirm that the coach was in his tenth season.\n3. Verify that the team participated in the 22nd edition of the Insight Bowl.\n\nThe context supports the first two points directly. The third point is supported by the context mentioning the 2010 Insight Bowl and the Missouri Tigers' participation in it.\n\nThe question is semantically equivalent to the original but rephrased for clarity and to ensure it stands independently. The answer remains the same as the original.\n\n</document_analysis>\n\n<output_format>\nQuestion: Who was the coach of the Missouri Tigers football team during their participation in the 22nd edition of the Insight Bowl in the 2010 season, and was in his tenth year with the team?\nA: Gary Pinkel\nB: Randy Moehlman\nC: Mike Pinkel\nD: Gary Mizzou\n\nExplanation: Gary Pinkel was the coach of the Missouri Tigers football team in 2010, and it was his tenth season with the team. The 2010 Insight Bowl was the 22nd edition of the bowl game, and it featured the Missouri Tigers.\n\nCorrect Answer: A\n</output_format>",
    "question": "Who was the coach of the Missouri Tigers football team during their participation in the 22nd edition of the Insight Bowl in the 2010 season, and was in his tenth year with the team?",
    "choices": {
      "A": "Gary Pinkel",
      "B": "Randy Moehlman",
      "C": "Mike Pinkel",
      "D": "Gary Mizzou"
    },
    "answer": "A",
    "explanation": "Gary Pinkel was the coach of the Missouri Tigers football team in 2010, and it was his tenth season with the team. The 2010 Insight Bowl was the 22nd edition of the bowl game, and it featured the Missouri Tigers.",
    "answer_correctness_score": 10,
    "explanation_validity_score": 10,
    "question_clarity_score": 9,
    "question_difficulty_score": 6,
    "question_groundedness_score": 10,
    "question_token_count": 41,
    "reformat_question_cosine_similarity_to_orig": 0.9516925811767578,
    "reformat_answer_cosine_similarity_to_orig": 0.9999996423721313,
    "reformat_question_similarity_score": 10,
    "reformat_answer_similarity_score": 10,
    "avg_answer_token_count": 4
  },
  {
    "orig_question": "Which of the founder of \"Beacon Global Strategies\" was born in November 25, 1969?",
    "orig_answer": "Philippe Reines",
    "context": "[PAR] [TLE] Beacon Global Strategies [SEP] Beacon Global Strategies LLC (BGS) is a Washington, DC-based strategic advisory firm founded by Jeremy Bash, Philippe Reines, and Andrew Shapiro in 2013.  According to the firm's website, Beacon Global Strategies specializes in matters of international policy, foreign affairs, national defense, cyber, intelligence, and homeland security. [PAR] [TLE] Philippe Reines [SEP] Philippe I. Reines (born November 25, 1969) is an American political consultant.  He joined the Department of State as a Senior Advisor to Hillary Clinton when she became United States Secretary of State in January 2009, and in 2010 was promoted to the position of Deputy Assistant Secretary of State for Strategic Communications.",
    "response": "<document_analysis>\nTo generate a meaningful question-answer pair, I will start by analyzing the given context. The context provides information about Beacon Global Strategies LLC (BGS), a strategic advisory firm based in Washington, DC, and its founders. It also gives details about one of the founders, Philippe Reines, including his birthdate and career background.\n\nThe original question asks to identify which founder of \"Beacon Global Strategies\" was born on November 25, 1969. The answer provided is Philippe Reines.\n\nUpon examining the context, it's clear that the relevant information is contained within the second paragraph, which discusses Philippe Reines. The context mentions that Philippe I. Reines was born on November 25, 1969. It also states that he is one of the founders of Beacon Global Strategies LLC.\n\nTo create a more challenging and nuanced question, I will rephrase the original question while maintaining its semantic equivalence. The goal is to ensure that the rewritten question inspires deeper thought and understanding, as required for a domain expert.\n\nThe context provides sufficient information to craft a question that is self-contained and clear. Since the question is about identifying a specific individual based on their birthdate and their role as a founder of BGS, I will ensure that the rewritten question includes all necessary details.\n\n</document_analysis>\n\n<output_format>\nQuestion: Which of the three founders of Beacon Global Strategies LLC, a Washington, DC-based strategic advisory firm established in 2013, was born on November 25, 1969?\nA: Andrew Shapiro\nB: Jeremy Bash\nC: Philippe Reines\nD: Hillary Clinton\n\nExplanation: The correct answer is Philippe Reines because, according to the provided context, Philippe I. Reines was born on November 25, 1969, and is identified as one of the founders of Beacon Global Strategies LLC.\n\nCorrect Answer: C\n</output_format>\n\nThought process:\n1. The original question is straightforward and asks to identify the founder born on a specific date.\n2. The context provides the necessary information: Philippe Reines is the founder born on November 25, 1969.\n3. To enhance the question, I included more details from the context, such as the firm's establishment year and its nature, to make it more comprehensive.\n4. The answer options are designed to be distinct; the incorrect options include the other named founder (Jeremy Bash), the third founder (Andrew Shapiro), and a notable figure mentioned in the context (Hillary Clinton), who is not a founder but is relevant to Philippe Reines' career.\n5. The rewritten question is designed to be answerable by a domain expert without needing the original context paragraph, incorporating sufficient context within the question itself.",
    "question": "Which of the three founders of Beacon Global Strategies LLC, a Washington, DC-based strategic advisory firm established in 2013, was born on November 25, 1969?",
    "choices": {
      "A": "Andrew Shapiro",
      "B": "Jeremy Bash",
      "C": "Philippe Reines",
      "D": "Hillary Clinton"
    },
    "answer": "C",
    "explanation": "The correct answer is Philippe Reines because, according to the provided context, Philippe I. Reines was born on November 25, 1969, and is identified as one of the founders of Beacon Global Strategies LLC.",
    "answer_correctness_score": 10,
    "explanation_validity_score": 10,
    "question_clarity_score": 8,
    "question_difficulty_score": 4,
    "question_groundedness_score": 10,
    "question_token_count": 37,
    "reformat_question_cosine_similarity_to_orig": 0.8644154667854309,
    "reformat_answer_cosine_similarity_to_orig": 1.0,
    "reformat_question_similarity_score": 10,
    "reformat_answer_similarity_score": 10,
    "avg_answer_token_count": 3
  },
  {
    "orig_question": "Where did the member of the Los Angeles Rams who made his debut On November 11, 1990 frow up?",
    "orig_answer": "Philadelphia, Mississippi",
    "context": "[PAR] [TLE] Marcus Dupree [SEP] Marcus L. Dupree (born May 22, 1964) is a former American football player.  He was born and grew up in Philadelphia, Mississippi, where his playing in high school attracted national attention.  A highly touted and sought-after college football recruit, he played at Oklahoma, where he was named Football News Freshman of the Year, second team All-American and Big Eight Conference Newcomer of the Year.  He left in the middle of his sophomore season and briefly attended the University of Southern Mississippi.  Marcus played spring football for the Golden Eagles and finished college at the university. [PAR] [TLE] 1990 Los Angeles Rams season [SEP] The 1990 Los Angeles Rams season was the team's 53rd year with the National Football League and the 45th season in Los Angeles.  On November 11, 1990, Marcus Dupree made his NFL debut against the New York Giants.  The Rams looked to improve on their 11-5 season from 1989 and make the playoffs for the 3rd straight season and be possible contenders for the Super Bowl.  However, the Rams would struggle all season, starting 1-4 before winning 2 of their next 3 games before losing their next 2 games as they dipped to a 3-7 record.  After a win over Cleveland, the Rams upset the 49ers 28-17 in San Francisco to improve to 5-7.  However, this would be perhaps the only good highlight of the season for the Rams, as after the win, they ended the season on a 4 game losing streak as the Rams finished with a disappointing 5-11 record and missed the playoffs for the first time since 1987.",
    "response": "<document_analysis>\nTo generate a meaningful question-answer pair, let's first analyze the given context and the original question and answer.\n\n1. **Thoughtful Content Examination**: The context provides information about Marcus Dupree, a former American football player, and his career. It also touches upon the 1990 Los Angeles Rams season, specifically mentioning Marcus Dupree's NFL debut. The original question asks where Marcus Dupree grew up, and the answer is Philadelphia, Mississippi.\n\n2. **Concept Exploration**: The context implies that Marcus Dupree is the member of the Los Angeles Rams being referred to in the question. It connects his background to his NFL debut with the Rams.\n\n3. **Strategic Complexity Calibration**: The original question is straightforward and factual. To increase complexity, we can rephrase it to require a deeper understanding or more nuanced consideration of the information provided.\n\n4. **Intentional Question Planning**: We can reframe the question to invite deeper understanding by incorporating more details from the context or making it more analytical.\n\nGiven the context and the original question and answer, let's proceed to generate a new question-answer pair that adheres to the guidelines.\n\nThe original question is: \"Where did the member of the Los Angeles Rams who made his debut On November 11, 1990 grow up?\"\n\nThe context informs us that Marcus Dupree made his NFL debut on November 11, 1990, with the Los Angeles Rams, and he grew up in Philadelphia, Mississippi.\n\nTo create a more complex and thoughtful question, we can rephrase it as follows:\n\n\"Marcus Dupree, who made his NFL debut with the Los Angeles Rams on November 11, 1990, had a notable high school football career. Where did he grow up before becoming a highly touted college football recruit?\"\n\nThis rephrased question is more detailed and integrates information from the context naturally.\n\n</document_analysis>\n\n<output_format>\nQuestion: Marcus Dupree, who made his NFL debut with the Los Angeles Rams on November 11, 1990, had a notable high school football career. Where did he grow up before becoming a highly touted college football recruit?\nA: Philadelphia, Pennsylvania\nB: Los Angeles, California\nC: Philadelphia, Mississippi\nD: Oklahoma City, Oklahoma\nExplanation: The correct answer is Philadelphia, Mississippi, as stated in the context that Marcus Dupree was born and grew up in Philadelphia, Mississippi.\nCorrect Answer: C\n</output_format>",
    "question": "Marcus Dupree, who made his NFL debut with the Los Angeles Rams on November 11, 1990, had a notable high school football career. Where did he grow up before becoming a highly touted college football recruit?",
    "choices": {
      "A": "Philadelphia, Pennsylvania",
      "B": "Los Angeles, California",
      "C": "Philadelphia, Mississippi",
      "D": "Oklahoma City, Oklahoma"
    },
    "answer": "C",
    "explanation": "The correct answer is Philadelphia, Mississippi, as stated in the context that Marcus Dupree was born and grew up in Philadelphia, Mississippi.",
    "answer_correctness_score": 10,
    "explanation_validity_score": 10,
    "question_clarity_score": 6,
    "question_difficulty_score": 2,
    "question_groundedness_score": 10,
    "question_token_count": 47,
    "reformat_question_cosine_similarity_to_orig": 0.6041645407676697,
    "reformat_answer_cosine_similarity_to_orig": 1.000000238418579,
    "reformat_question_similarity_score": 9,
    "reformat_answer_similarity_score": 10,
    "avg_answer_token_count": 5
  },
  {
    "orig_question": "What company was founded by the businesswoman who established the Eastern Congo Initiative?",
    "orig_answer": "williamsworks",
    "context": "[PAR] [TLE] Eastern Congo Initiative [SEP] The Eastern Congo Initiative (ECI) is an American nonprofit organization established by Ben Affleck and Whitney Williams in 2010 as \"the first U.S. based advocacy and grant-making initiative wholly focused on working with and for the people of eastern Congo\".  ECI provides development grants and international advocacy for community-building initiatives in the Democratic Republic of Congo. [PAR] [TLE] Whitney Williams [SEP] Whitney Williams is an American businesswoman and philanthropist, currently serving as Vice-Chair of the board for Eastern Congo Initiative and Founder + CEO of the Seattle-based consultancy williamsworks.  She is the daughter of former Congressman Pat Williams and former Montana Senate Majority Leader Carol Williams. \" The Washington Post\" has referred to the Williams family as the \u201cfirst family of Montana politics.\u201d  Her brother is artist Griff Williams.",
    "response": "<document_analysis>\nThe context provided gives information about the Eastern Congo Initiative (ECI) and Whitney Williams, who is associated with ECI. It mentions that Whitney Williams is the Founder + CEO of williamsworks, a Seattle-based consultancy. The original question asks about the company founded by the businesswoman who established the Eastern Congo Initiative. However, according to the context, Whitney Williams is associated with ECI but is not its founder; Ben Affleck and Whitney Williams established it. Therefore, the question might be slightly misleading as it implies Whitney Williams is the sole founder.\n\nTo refine the question, we should ensure it accurately reflects the information given in the context. The correct interpretation should be that Whitney Williams is one of the individuals who established ECI, along with Ben Affleck.\n\nThe thought process involves understanding the roles of individuals mentioned in the context and clarifying the question to accurately reflect the information provided.\n\n</document_analysis>\n\n<output_format>\nQuestion: What is the name of the consultancy firm founded by Whitney Williams, who is one of the co-founders of the Eastern Congo Initiative along with Ben Affleck?\nA: williamsworks\nB: Eastern Congo Initiative\nC: Williams Consulting\nD: Seattle Solutions\n\nExplanation: The correct answer is williamsworks because, according to the context, Whitney Williams is the Founder + CEO of williamsworks, a Seattle-based consultancy.\n\nCorrect Answer: A\n</output_format>",
    "question": "What is the name of the consultancy firm founded by Whitney Williams, who is one of the co-founders of the Eastern Congo Initiative along with Ben Affleck?",
    "choices": {
      "A": "williamsworks",
      "B": "Eastern Congo Initiative",
      "C": "Williams Consulting",
      "D": "Seattle Solutions"
    },
    "answer": "A",
    "explanation": "The correct answer is williamsworks because, according to the context, Whitney Williams is the Founder + CEO of williamsworks, a Seattle-based consultancy.",
    "answer_correctness_score": 10,
    "explanation_validity_score": 10,
    "question_clarity_score": 6,
    "question_difficulty_score": 5,
    "question_groundedness_score": 1,
    "question_token_count": 33,
    "reformat_question_cosine_similarity_to_orig": 0.7021514177322388,
    "reformat_answer_cosine_similarity_to_orig": 1.000000238418579,
    "reformat_question_similarity_score": 9,
    "reformat_answer_similarity_score": 10,
    "avg_answer_token_count": 3
  },
  {
    "orig_question": "The 2015 MTV Video Music Awards were held on which date, Swift's \"Wildest Dreams\" music video premiered during the pre-show?",
    "orig_answer": "August 30, 2015",
    "context": "[PAR] [TLE] Wildest Dreams (Taylor Swift song) [SEP] \"Wildest Dreams\" is a song recorded by American singer-songwriter Taylor Swift for her fifth studio album, \"1989\".  The song was released to radio by Big Machine Records on August 31, 2015, as the album's fifth single.  Swift co-wrote the song with its producers Max Martin and Shellback.  Musically, \"Wildest Dreams\" is a love ballad with a prominent dream pop influence, with the lyrics describing Swift's plea for her lover to remember her. [PAR] [TLE] 2015 MTV Video Music Awards [SEP] The 2015 MTV Video Music Awards were held on August 30, 2015.  The 32nd installment of the event was held at the Microsoft Theater in Los Angeles, California, and hosted by Miley Cyrus.  Taylor Swift led the nominations with a total of ten, followed by Ed Sheeran, who had six., bringing his total number of mentions to 13.  Swift's \"Wildest Dreams\" music video premiered during the pre-show.  Cyrus also announced and released her studio album \"Miley Cyrus & Her Dead Petz\", right after her performance at the end of the show.  During his acceptance speech, Kanye West announced that he would be running for the 2020 U.S. Presidential Election.  Taylor Swift won the most awards with four, including Video of the Year and Best Female Video.  The VMA trophies were redesigned by Jeremy Scott.",
    "response": "<document_analysis>\nTo generate a question that is semantically equivalent to the original, I will analyze the given context, question, and answer. The context discusses Taylor Swift's song \"Wildest Dreams\" and its relation to the 2015 MTV Video Music Awards. The original question asks for the date of the 2015 MTV Video Music Awards, given that Swift's \"Wildest Dreams\" music video premiered during the pre-show. The answer provided is \"August 30, 2015.\"\n\nUpon examining the context, it's clear that the relevant information is contained within the section discussing the 2015 MTV Video Music Awards. The context states that the awards were held on August 30, 2015, and that Swift's \"Wildest Dreams\" music video premiered during the pre-show.\n\nTo create a more challenging and nuanced question, I will rephrase the original question while maintaining its semantic equivalence. The rephrased question will incorporate more details from the context to ensure it is self-contained and clear.\n\nMy thought process involves:\n1. Identifying the central idea: The date of the 2015 MTV Video Music Awards.\n2. Incorporating relevant details: The premiere of Swift's \"Wildest Dreams\" music video during the pre-show.\n3. Ensuring clarity and self-containment: Including necessary context within the question.\n\nThe difficulty level of the rephrased question is moderate (around 6-7) as it requires the test-taker to recall specific details from the context.\n\n</document_analysis>\n\n<output_format>\nQuestion: On which date were the 2015 MTV Video Music Awards held, an event during which Taylor Swift's \"Wildest Dreams\" music video premiered in the pre-show?\nA: August 31, 2015\nB: August 29, 2015\nC: August 30, 2015\nD: September 1, 2015\n\nExplanation: The 2015 MTV Video Music Awards were held on August 30, 2015, as stated in the context. This date is correct because it is mentioned that the event took place on this day, and Swift's \"Wildest Dreams\" music video premiered during the pre-show.\n\nCorrect Answer: C\n</output_format>",
    "question": "On which date were the 2015 MTV Video Music Awards held, an event during which Taylor Swift's \"Wildest Dreams\" music video premiered in the pre-show?",
    "choices": {
      "A": "August 31, 2015",
      "B": "August 29, 2015",
      "C": "August 30, 2015",
      "D": "September 1, 2015"
    },
    "answer": "C",
    "explanation": "The 2015 MTV Video Music Awards were held on August 30, 2015, as stated in the context. This date is correct because it is mentioned that the event took place on this day, and Swift's \"Wildest Dreams\" music video premiered during the pre-show.",
    "answer_correctness_score": 10,
    "explanation_validity_score": 10,
    "question_clarity_score": 2,
    "question_difficulty_score": 2,
    "question_groundedness_score": 9,
    "question_token_count": 36,
    "reformat_question_cosine_similarity_to_orig": 0.9650944471359253,
    "reformat_answer_cosine_similarity_to_orig": 0.9999999403953552,
    "reformat_question_similarity_score": 10,
    "reformat_answer_similarity_score": 10,
    "avg_answer_token_count": 8
  },
  {
    "orig_question": "When did the coach of the Karachi Kings finish his time as coach of the Australia national cricket team ?",
    "orig_answer": "23 June 2013.",
    "context": "[PAR] [TLE] Karachi Kings [SEP] Karachi Kings (Urdu: \u200e ; Sindhi: \u06aa\u0631\u0627\u0686\u064a \u06aa\u0646\u06af\u0632\u200e ) is a Pakistani professional Twenty20 cricket team that competes in the Pakistan Super League.  The team is based in Karachi, the provincial capital of Sindh, Pakistan.  The team was formed in 2015, as a result of the formation of the Pakistan Super League by Pakistan Cricket Board (PCB). Team's home ground is National Stadium. The team is currently captained by Kumar Sangakkara and coached by Mickey Arthur a former South African cricketer.  It is owned by Salman Iqbal, the CEO of ARY Group. [PAR] [TLE] Mickey Arthur [SEP] John Michael \"Mickey\" Arthur (born 17 May 1968) is a South African cricketer who played South African domestic cricket from 1986 to 2001.  He is the current coach of the Pakistan national cricket team.  He coached the South African national team from 2005 to 2010, and was the coach of the Australia national cricket team until his sacking on 23 June 2013.",
    "response": "<document_analysis>\nTo address the task, let's first analyze the given context and the question-answer pair.\n\n1. **Thoughtful Content Examination**:\n   - The context provides information about the Karachi Kings, a Pakistani professional Twenty20 cricket team, and its coach, Mickey Arthur.\n   - It also gives details about Mickey Arthur's background, including his role as the coach of various national cricket teams.\n\n2. **Concept Exploration**:\n   - The question focuses on when Mickey Arthur finished his tenure as the coach of the Australia national cricket team.\n   - The relevant information is found in the section discussing Mickey Arthur.\n\n3. **Strategic Complexity Calibration**:\n   - The question requires understanding the specific detail about Mickey Arthur's coaching history.\n   - The difficulty level is moderate (around 6 out of 10) as it requires identifying a specific date related to Mickey Arthur's coaching career.\n\n4. **Intentional Question Planning**:\n   - The question invites the reader to reflect on the details of Mickey Arthur's career, specifically his tenure with the Australia national cricket team.\n\nUpon analyzing the context and the question-answer pair, it's clear that the question is seeking a specific date related to Mickey Arthur's coaching history. The context provides sufficient information to answer this question.\n\nThe original question and answer are:\n- Question: When did the coach of the Karachi Kings finish his time as coach of the Australia national cricket team?\n- Answer: 23 June 2013.\n\nTo rephrase and reformat according to the guidelines:\n\n</document_analysis>\n\n<output_format>\nQuestion: On what date did Mickey Arthur, the current coach of the Karachi Kings, cease to be the coach of the Australian national cricket team?\nA: 20 June 2013\nB: 23 June 2013\nC: 25 June 2013\nD: 27 June 2013\nExplanation: The correct date is mentioned in the context provided about Mickey Arthur, stating that he was sacked as the coach of the Australia national cricket team on 23 June 2013.\nCorrect Answer: B\n</output_format>",
    "question": "On what date did Mickey Arthur, the current coach of the Karachi Kings, cease to be the coach of the Australian national cricket team?",
    "choices": {
      "A": "20 June 2013",
      "B": "23 June 2013",
      "C": "25 June 2013",
      "D": "27 June 2013"
    },
    "answer": "B",
    "explanation": "The correct date is mentioned in the context provided about Mickey Arthur, stating that he was sacked as the coach of the Australia national cricket team on 23 June 2013.",
    "answer_correctness_score": 10,
    "explanation_validity_score": 10,
    "question_clarity_score": 8,
    "question_difficulty_score": 6,
    "question_groundedness_score": 10,
    "question_token_count": 28,
    "reformat_question_cosine_similarity_to_orig": 0.8288799524307251,
    "reformat_answer_cosine_similarity_to_orig": 0.9770568609237671,
    "reformat_question_similarity_score": 10,
    "reformat_answer_similarity_score": 10,
    "avg_answer_token_count": 6
  },
  {
    "orig_question": "Who was the lawyer who investigated multiple scandals, including one sometimes called Travelgate?",
    "orig_answer": "Robert William Ray",
    "context": "[PAR] [TLE] White House travel office controversy [SEP] The White House travel office controversy, sometimes referred to as Travelgate, was the first major ethics controversy of the Clinton administration.  It began in May 1993, when seven employees of the White House Travel Office were fired.  This action was unusual because although theoretically staff employees serve at the pleasure of the President and could be dismissed without cause, in practice, such employees usually remain in their posts for many years. [PAR] [TLE] Robert Ray (prosecutor) [SEP] Robert William Ray (born April 4, 1960) is an American lawyer practicing in the New York office of the Dallas-based law firm of Thompson & Knight, LLP.  As the successor to Ken Starr as the head of the Office of the Independent Counsel (1999 to 2002) he investigated and issued the final reports on the Whitewater scandal, the White House travel office controversy, and the White House FBI files controversy.  Before that he was Deputy Independent Counsel investigating former Secretary of Agriculture Mike Espy and before that Assistant United States Attorney for the Southern District of New York.",
    "response": "<document_analysis>\nThe context provided discusses two main topics: the White House travel office controversy, also known as Travelgate, and Robert Ray, an American lawyer. The first part explains the White House travel office controversy, which began in May 1993 when seven employees of the White House Travel Office were fired. The second part focuses on Robert William Ray, detailing his career and his role as the head of the Office of the Independent Counsel. As the successor to Ken Starr, Ray investigated several scandals, including the Whitewater scandal, the White House travel office controversy (Travelgate), and the White House FBI files controversy.\n\nTo generate a question that inspires deeper thought and nuanced consideration, we need to analyze the information given and identify key elements that can be used to create a challenging and meaningful question. The original question asks for the identity of the lawyer who investigated multiple scandals, including one sometimes called Travelgate. The answer provided is Robert William Ray.\n\nUpon examining the context, it is clear that Robert William Ray played a significant role in investigating several controversies during his tenure as the head of the Office of the Independent Counsel. The question can be rephrased to incorporate more details from the context, making it more specific and challenging.\n\nThe thought process involves identifying the central idea of the original question and answer, which revolves around Robert William Ray's investigations. To create a more complex question, we can include additional details from the context, such as his position or the specific scandals he investigated.\n\n</document_analysis>\n\n<output_format>\nQuestion: Who was the head of the Office of the Independent Counsel that investigated the White House travel office controversy, sometimes referred to as Travelgate, along with other scandals like the Whitewater scandal and the White House FBI files controversy?\nA: Ken Starr\nB: Robert William Ray\nC: Mike Espy\nD: William Jefferson Clinton\n\nExplanation: Robert William Ray was the head of the Office of the Independent Counsel who investigated several scandals, including the White House travel office controversy (Travelgate), the Whitewater scandal, and the White House FBI files controversy. He succeeded Ken Starr in this role.\n\nCorrect Answer: B\n</output_format>",
    "question": "Who was the head of the Office of the Independent Counsel that investigated the White House travel office controversy, sometimes referred to as Travelgate, along with other scandals like the Whitewater scandal and the White House FBI files controversy?",
    "choices": {
      "A": "Ken Starr",
      "B": "Robert William Ray",
      "C": "Mike Espy",
      "D": "William Jefferson Clinton"
    },
    "answer": "B",
    "explanation": "Robert William Ray was the head of the Office of the Independent Counsel who investigated several scandals, including the White House travel office controversy (Travelgate), the Whitewater scandal, and the White House FBI files controversy. He succeeded Ken Starr in this role.",
    "answer_correctness_score": 10,
    "explanation_validity_score": 10,
    "question_clarity_score": 2,
    "question_difficulty_score": 6,
    "question_groundedness_score": 2,
    "question_token_count": 46,
    "reformat_question_cosine_similarity_to_orig": 0.7377372980117798,
    "reformat_answer_cosine_similarity_to_orig": 1.000000238418579,
    "reformat_question_similarity_score": 9,
    "reformat_answer_similarity_score": 10,
    "avg_answer_token_count": 3
  },
  {
    "orig_question": "What type of film was Luc Besson's film (2017) in which Dane William DeHaan had title character?",
    "orig_answer": "3D science fiction adventure film",
    "context": "[PAR] [TLE] Valerian and the City of a Thousand Planets [SEP] Valerian and the City of a Thousand Planets (French: \"Val\u00e9rian et la Cit\u00e9 des mille plan\u00e8tes\" ) is a 2017 English-language French 3D science fiction adventure film written and directed by Luc Besson, and co-produced by Besson and his wife, Virginie Besson-Silla.  The film is based on the French science fiction comics series \"Val\u00e9rian and Laureline\", written by Pierre Christin and illustrated by Jean-Claude M\u00e9zi\u00e8res.  It stars Dane DeHaan as Valerian and Cara Delevingne as Laureline, with Clive Owen, Rihanna, Ethan Hawke, Herbie Hancock, Kris Wu and Rutger Hauer in supporting roles.  Besson independently crowd-sourced and personally funded \"Valerian\" and, with a production budget of around $180 million, it is both the most expensive European and independent film ever made. [PAR] [TLE] Dane DeHaan [SEP] Dane William DeHaan ( ; born February 6, 1986) is an American actor.  His roles include Jesse on the HBO series \"In Treatment\", Andrew Detmer in \"Chronicle\" (2012), Jason Kancam in Derek Cianfrance's \"The Place Beyond the Pines\" (2012), Lucien Carr in \"Kill Your Darlings\" (2013), Harry Osborn in \"The Amazing Spider-Man 2\" (2014), James Dean in Anton Corbijn's \"Life\" (2015), Lockhart in Gore Verbinski's \"A Cure for Wellness\" (2016) and the title character in Luc Besson's \"Valerian and the City of a Thousand Planets\" (2017).  He has also appeared in several advertisements for Prada.",
    "response": "<document_analysis>\nTo generate a question that is semantically equivalent to the original, I will analyze the given context, question, and answer. The context provides information about the film \"Valerian and the City of a Thousand Planets\" directed by Luc Besson and Dane DeHaan's role in it. The question asks about the type of film Dane DeHaan starred in as the title character, directed by Luc Besson in 2017. The answer provided is \"3D science fiction adventure film.\"\n\nFirst, I will identify the central idea: The film \"Valerian and the City of a Thousand Planets\" is a 3D science fiction adventure film directed by Luc Besson, in which Dane DeHaan played the title character.\n\nNext, I will consider the implicit assumptions and subtle details: The context implies that the film's genre and characteristics are crucial to understanding the question. It also assumes that the viewer is familiar with Dane DeHaan's role in the film.\n\nTo rephrase the question and maintain semantic equivalence, I will ensure that the rewritten question includes the necessary details to be answerable by a domain expert without the context paragraph.\n\nThe difficulty level of the question is rated as 2 out of 10 because it directly asks for information provided in the context. To increase the complexity, I will rephrase the question to require a deeper understanding or more nuanced consideration of the information.\n\nUpon analyzing the context, I found that the information about the film's genre is directly stated. To create a more challenging question, I will frame it in a way that requires the test-taker to understand the film's characteristics and connect them with the information about Dane DeHaan's role.\n\n</document_analysis>\n\n<output_format>\nQuestion: What genre and visual format characterized the 2017 film directed by Luc Besson, in which Dane DeHaan starred as the titular character Valerian?\nA: 2D historical drama film\nB: 3D science fiction adventure film\nC: Animated fantasy film\nD: Documentary space exploration film\nExplanation: The film \"Valerian and the City of a Thousand Planets\" is described as a 3D science fiction adventure film, and Dane DeHaan played the title character Valerian.\nCorrect Answer: B\n</output_format>",
    "question": "What genre and visual format characterized the 2017 film directed by Luc Besson, in which Dane DeHaan starred as the titular character Valerian?",
    "choices": {
      "A": "2D historical drama film",
      "B": "3D science fiction adventure film",
      "C": "Animated fantasy film",
      "D": "Documentary space exploration film"
    },
    "answer": "B",
    "explanation": "The film \"Valerian and the City of a Thousand Planets\" is described as a 3D science fiction adventure film, and Dane DeHaan played the title character Valerian.",
    "answer_correctness_score": 10,
    "explanation_validity_score": 10,
    "question_clarity_score": 8,
    "question_difficulty_score": 2,
    "question_groundedness_score": 10,
    "question_token_count": 32,
    "reformat_question_cosine_similarity_to_orig": 0.8518271446228027,
    "reformat_answer_cosine_similarity_to_orig": 1.0000001192092896,
    "reformat_question_similarity_score": 9,
    "reformat_answer_similarity_score": 10,
    "avg_answer_token_count": 5
  },
  {
    "orig_question": "The 2011 Major League Soccer All-Star Game, held on July 27, 2011, was the 16th annual Major League Soccer All-Star Game, a soccer match involving all-stars from Major League Soccer, Manchester United won the game 4\u20130 with goals, including which English professional footballer who plays for Premier League club Arsenal and the England national team?",
    "orig_answer": "Daniel Nii Tackie Mensah Welbeck",
    "context": "[PAR] [TLE] Danny Welbeck [SEP] Daniel Nii Tackie Mensah Welbeck (born 26 November 1990) is an English professional footballer who plays for Premier League club Arsenal and the England national team.  He primarily plays as a forward but can also play as a winger. [PAR] [TLE] 2011 MLS All-Star Game [SEP] The 2011 Major League Soccer All-Star Game, held on July 27, 2011, was the 16th annual Major League Soccer All-Star Game, a soccer match involving all-stars from Major League Soccer.  The MLS All-Stars faced Manchester United of the English Premier League for the second year running in the eighth MLS All-Star Game to feature international opposition.  Manchester United won the game 4\u20130 with goals from Anderson, Park Ji-Sung, Dimitar Berbatov and Danny Welbeck.",
    "response": "<document_analysis>\nTo address the task, let's first analyze the given context, question, and answer.\n\n1. **Thoughtful Content Examination**: The context provides information about Danny Welbeck, an English professional footballer, and details about the 2011 Major League Soccer All-Star Game. The question asks about the English professional footballer who plays for Premier League club Arsenal and the England national team and scored in the 2011 MLS All-Star Game against Manchester United.\n\n2. **Concept Exploration**: The context implicitly assumes that the reader is familiar with the teams and leagues mentioned (e.g., Premier League, Arsenal, England national team, Major League Soccer). It highlights Danny Welbeck's involvement in both the Premier League and the MLS All-Star Game.\n\n3. **Strategic Complexity Calibration**: The question requires the test-taker to connect information about Danny Welbeck's identity and his participation in the 2011 MLS All-Star Game. The difficulty level is moderate (around 6 out of 10) because it requires understanding the context and making a simple inference.\n\n4. **Intentional Question Planning**: The question invites deeper understanding by linking information about Danny Welbeck's career and his performance in a specific match.\n\nUpon analysis, the question and answer are found to be relevant and coherent. The question is clear and directly related to the context provided.\n\nThe original question is: \"The 2011 Major League Soccer All-Star Game, held on July 27, 2011, was the 16th annual Major League Soccer All-Star Game, a soccer match involving all-stars from Major League Soccer, Manchester United won the game 4\u20130 with goals, including which English professional footballer who plays for Premier League club Arsenal and the England national team?\"\n\nThe original answer is: \"Daniel Nii Tackie Mensah Welbeck\"\n\nLet's rephrase and reformat them according to the guidelines.\n\n</document_analysis>\n\n<output_format>\nQuestion: In the 2011 Major League Soccer All-Star Game, where Manchester United defeated the MLS All-Stars 4\u20130, which English professional footballer, known for playing as a forward for Premier League club Arsenal and the England national team, scored one of the goals?\nA: David Beckham\nB: Daniel Nii Tackie Mensah Welbeck\nC: Wayne Rooney\nD: Ashley Cole\nExplanation: The correct answer is Daniel Nii Tackie Mensah Welbeck because he is identified in the context as an English professional footballer who plays for Arsenal and the England national team, and it is mentioned that he scored in the 2011 MLS All-Star Game against Manchester United.\nCorrect Answer: B\n</output_format>",
    "question": "In the 2011 Major League Soccer All-Star Game, where Manchester United defeated the MLS All-Stars 4\u20130, which English professional footballer, known for playing as a forward for Premier League club Arsenal and the England national team, scored one of the goals?",
    "choices": {
      "A": "David Beckham",
      "B": "Daniel Nii Tackie Mensah Welbeck",
      "C": "Wayne Rooney",
      "D": "Ashley Cole"
    },
    "answer": "B",
    "explanation": "The correct answer is Daniel Nii Tackie Mensah Welbeck because he is identified in the context as an English professional footballer who plays for Arsenal and the England national team, and it is mentioned that he scored in the 2011 MLS All-Star Game against Manchester United.",
    "answer_correctness_score": 10,
    "explanation_validity_score": 10,
    "question_clarity_score": 6,
    "question_difficulty_score": 7,
    "question_groundedness_score": 10,
    "question_token_count": 56,
    "reformat_question_cosine_similarity_to_orig": 0.8870741128921509,
    "reformat_answer_cosine_similarity_to_orig": 1.0000001192092896,
    "reformat_question_similarity_score": 9,
    "reformat_answer_similarity_score": 10,
    "avg_answer_token_count": 5
  },
  {
    "orig_question": "Which song writer do Taylor Swift songs \"State of Grace\" and \"I Knew You Were Trouble\" have in common?",
    "orig_answer": "Taylor Swift",
    "context": "[PAR] [TLE] State of Grace (Taylor Swift song) [SEP] \"State of Grace\" is a song by American singer-songwriter Taylor Swift from her fourth studio album \"Red\" (2012).  It was released to the iTunes Store on October 16, 2012, in the United States by Big Machine Records as the fourth and final promotional single from the album.  It was the only promotional single from the album that was not re-issued as an official single, as \"Begin Again\", \"Red\", and \"I Knew You Were Trouble\", were all later re-issued as official singles.  The song was written by Swift and produced by Nathan Chapman and Swift.  Musically, the song is a departure from Swift's typical country pop, using influences of alternative rock while being compared to bands such as U2, Muse and The Cranberries.  The song has received immense praise from music critics, who have complimented its broader sound in comparison with Swift's previous material. [PAR] [TLE] I Knew You Were Trouble [SEP] \"I Knew You Were Trouble\" is a song recorded by American singer-songwriter Taylor Swift for her fourth studio album, \"Red\" (2012).  It was released on October 9, 2012, in the United States by Big Machine Records as the third promotional single from the album.  Later, \"I Knew You Were Trouble\" was released as the third single from \"Red\" on November 27, 2012, in the United States.  It was written by Swift, Max Martin and Shellback, with the production handled by the latter two.",
    "response": "<document_analysis>\nTo generate a question that is semantically equivalent to the original, we first need to analyze the given context and understand the information provided about the songs \"State of Grace\" and \"I Knew You Were Trouble\" by Taylor Swift.\n\n1. **Thoughtful Content Examination**: The context provides details about two songs from Taylor Swift's album \"Red\" (2012): \"State of Grace\" and \"I Knew You Were Trouble\". It mentions the songwriters and producers for each song. \"State of Grace\" was written by Taylor Swift and produced by Nathan Chapman and Swift. \"I Knew You Were Trouble\" was written by Swift, Max Martin, and Shellback, with production handled by Max Martin and Shellback.\n\n2. **Concept Exploration**: The key information here is the songwriting credits for both songs. For \"State of Grace\", Taylor Swift is credited as the songwriter. For \"I Knew You Were Trouble\", Taylor Swift is also credited as a songwriter alongside Max Martin and Shellback.\n\n3. **Strategic Complexity Calibration**: The original question is straightforward and identifies a common songwriter between the two songs. To increase complexity, we can rephrase the question to require a deeper understanding or more nuanced consideration of the information provided.\n\n4. **Intentional Question Planning**: The question can be rephrased to invite deeper understanding by focusing on the commonality between the two songs in terms of songwriting credits.\n\nUpon analyzing the context, it's clear that Taylor Swift is the common songwriter for both \"State of Grace\" and \"I Knew You Were Trouble\". The original question is answerable and relevant. We will now rephrase it to fit the guidelines and increase its complexity.\n\n</document_analysis>\n\n<output_format>\nQuestion: Considering the songwriting credits for Taylor Swift's songs from her album \"Red\", which songwriter is credited for both \"State of Grace\" and \"I Knew You Were Trouble\"?\nA: Max Martin\nB: Shellback\nC: Nathan Chapman\nD: Taylor Swift\nExplanation: Taylor Swift is credited as a songwriter for both \"State of Grace\" and \"I Knew You Were Trouble\", making her the common songwriter between the two songs.\nCorrect Answer: D\n</output_format>",
    "question": "Considering the songwriting credits for Taylor Swift's songs from her album \"Red\", which songwriter is credited for both \"State of Grace\" and \"I Knew You Were Trouble\"?",
    "choices": {
      "A": "Max Martin",
      "B": "Shellback",
      "C": "Nathan Chapman",
      "D": "Taylor Swift"
    },
    "answer": "D",
    "explanation": "Taylor Swift is credited as a songwriter for both \"State of Grace\" and \"I Knew You Were Trouble\", making her the common songwriter between the two songs.",
    "answer_correctness_score": 10,
    "explanation_validity_score": 10,
    "question_clarity_score": 6,
    "question_difficulty_score": 5,
    "question_groundedness_score": 10,
    "question_token_count": 37,
    "reformat_question_cosine_similarity_to_orig": 0.8558283448219299,
    "reformat_answer_cosine_similarity_to_orig": 1.0,
    "reformat_question_similarity_score": 9,
    "reformat_answer_similarity_score": 10,
    "avg_answer_token_count": 3
  },
  {
    "orig_question": "The 22nd edition of the college football bowl game \"2010 Insight Bowl\" featured this college football team after their fifth straight bowl appearance whose home stadium is called what?",
    "orig_answer": "Faurot Field",
    "context": "[PAR] [TLE] 2010 Missouri Tigers football team [SEP] The 2010 Missouri Tigers football team represented the University of Missouri in the 2010 NCAA Division I FBS football season.  The team was coached by Gary Pinkel, who returned for his tenth season with Mizzou, and played their home games at Faurot Field at Memorial Stadium.  The team began the season fresh off their fifth straight bowl appearance.  The team hired a new public address announcer, Randy Moehlman. [PAR] [TLE] 2010 Insight Bowl [SEP] The 2010 Insight Bowl was the 22nd edition of the college football bowl game, played at Sun Devil Stadium in Tempe, Arizona on Tuesday, December 28, 2010.  It featured the Missouri Tigers from the Big 12 Conference versus the Iowa Hawkeyes from the Big Ten Conference.",
    "response": "<document_analysis>\nThe context provided discusses the 2010 Missouri Tigers football team and the 2010 Insight Bowl. The question asks for the name of the home stadium of the college football team that participated in the 22nd edition of the Insight Bowl after their fifth straight bowl appearance. The relevant information is that the team is the Missouri Tigers, and their home stadium is Faurot Field at Memorial Stadium. The task is to rephrase the question and answer while maintaining their semantic equivalence.\n\nUpon analyzing the context, it's clear that the Missouri Tigers football team, after their fifth straight bowl appearance, played in the 2010 Insight Bowl. Their home games were held at Faurot Field at Memorial Stadium. The question is focused on identifying the name of their home stadium.\n\nTo create a more challenging and nuanced question, we can incorporate more details from the context and ensure the question stands alone without needing the original context.\n\nThe thought process involves:\n1. Identifying the team that played in the 2010 Insight Bowl and had their fifth straight bowl appearance.\n2. Confirming the name of their home stadium.\n\nThe original question and answer are semantically preserved by ensuring that the rewritten question still asks for the name of the home stadium of the Missouri Tigers, and the answer remains \"Faurot Field.\"\n\n</document_analysis>\n\n<output_format>\nQuestion: What is the name of the home stadium where the Missouri Tigers football team, who appeared in their fifth consecutive bowl game and later participated in the 22nd edition of the Insight Bowl, played their home games?\nA: Memorial Stadium\nB: Faurot Field at Memorial Stadium\nC: Sun Devil Stadium\nD: Faurot Field\n\nExplanation: The correct answer is \"Faurot Field\" as it is part of the full name \"Faurot Field at Memorial Stadium.\" While \"Faurot Field at Memorial Stadium\" is the full name, \"Faurot Field\" is an acceptable answer as it refers to the same stadium.\n\nCorrect Answer: D\n</output_format>\n\nHowever, to better follow the instructions and make the options more distinct, here's an adjusted version:\n\n<output_format>\nQuestion: What is the primary name of the home stadium where the Missouri Tigers football team, who appeared in their fifth consecutive bowl game and later participated in the 22nd edition of the Insight Bowl, played their home games?\nA: Memorial Stadium\nB: Sun Devil Stadium\nC: Faurot Field at Memorial Stadium\nD: Faurot Field\n\nExplanation: The correct answer is \"Faurot Field\" because it is the primary name referenced in the context for the stadium where the Missouri Tigers played their home games.\n\nCorrect Answer: D\n</output_format>\n\nLet's refine it further to ensure clarity and distinctness in the answer choices.\n\n<output_format>\nQuestion: What is the name of the field where the Missouri Tigers football team, who appeared in their fifth consecutive bowl game and later participated in the 22nd edition of the Insight Bowl, played their home games at Memorial Stadium?\nA: Sun Devil Stadium\nB: Memorial Field\nC: Tigers Field\nD: Faurot Field\n\nExplanation: The correct answer is \"Faurot Field\" as it is the specific name of the field at Memorial Stadium where the Missouri Tigers played.\n\nCorrect Answer: D\n</output_format>",
    "question": "What is the name of the field where the Missouri Tigers football team, who appeared in their fifth consecutive bowl game and later participated in the 22nd edition of the Insight Bowl, played their home games at Memorial Stadium?",
    "choices": {
      "A": "Sun Devil Stadium",
      "B": "Memorial Field",
      "C": "Tigers Field",
      "D": "Faurot Field"
    },
    "answer": "D",
    "explanation": "The correct answer is \"Faurot Field\" as it is the specific name of the field at Memorial Stadium where the Missouri Tigers played.",
    "answer_correctness_score": 10,
    "explanation_validity_score": 10,
    "question_clarity_score": 6,
    "question_difficulty_score": 5,
    "question_groundedness_score": 10,
    "question_token_count": 45,
    "reformat_question_cosine_similarity_to_orig": 0.6025261878967285,
    "reformat_answer_cosine_similarity_to_orig": 1.0,
    "reformat_question_similarity_score": 9,
    "reformat_answer_similarity_score": 10,
    "avg_answer_token_count": 4
  },
  {
    "orig_question": "when was a narrative poem most known from an American poet born July 18, 1850 written?",
    "orig_answer": "1867",
    "context": "[PAR] [TLE] Rose Hartwick Thorpe [SEP] Rose Hartwick Thorpe (July 18, 1850 \u2013 July 19, 1939) was an American poet and writer, remembered largely for the narrative poem, \"Curfew Must Not Ring Tonight\" (1867), which gained national popularity.  Other poems followed, among them being \"The Station Agent's Story,\" \"Red Cross,\" and \"In a Mining Town.\"  Although a busy and prolific author, she was ill for some years.  In 1888, she and her family removed to San Diego, California, living in Rosemere, Pacific Beach. [PAR] [TLE] Curfew Must Not Ring Tonight [SEP] Curfew Must Not Ring Tonight is a narrative poem by Rose Hartwick Thorpe, written in 1867 and set in the 17th century.  It was written when she was 16 years old and first published in \"Detroit Commercial Advertiser\".",
    "response": "<document_analysis>\nTo address this task, let's start by analyzing the given context and question.\n\n1. **Thoughtful Content Examination**: The context provides information about Rose Hartwick Thorpe, an American poet and writer, and her notable works. The narrative poem \"Curfew Must Not Ring Tonight\" is highlighted as her most remembered work. The context also mentions the year this poem was written and first published.\n\n2. **Concept Exploration**: The central idea here revolves around Rose Hartwick Thorpe and her literary contributions, particularly \"Curfew Must Not Ring Tonight.\" The implicit assumption is that the reader is familiar with or can infer the significance of this poem in relation to the poet's body of work.\n\n3. **Strategic Complexity Calibration**: The original question is straightforward and factual, asking for the year a specific poem was written. To increase complexity, we could rephrase it to encourage deeper understanding or reflection.\n\n4. **Intentional Question Planning**: Instead of asking a simple factual question, we could frame it to require more thought or application of the information provided.\n\nUpon examining the context, it's clear that \"Curfew Must Not Ring Tonight\" is a pivotal work by Rose Hartwick Thorpe. The question about when it was written is directly answerable from the context.\n\nTo enhance the question's complexity and encourage deeper engagement, we could rephrase it. For example, we could ask for the age of the poet when she wrote the poem, requiring the test-taker to calculate the answer using the birth year and the year the poem was written.\n\nThe thought process involves:\n- Identifying the key elements: Rose Hartwick Thorpe's birth date and the year \"Curfew Must Not Ring Tonight\" was written.\n- Understanding the relationship between these elements and how they can be used to formulate a more complex question.\n\n</document_analysis>\n\n<output_format>\nQuestion: If Rose Hartwick Thorpe was born on July 18, 1850, and wrote the narrative poem \"Curfew Must Not Ring Tonight\" in the year she was 16 years old, in what year was this poem written?\nA: 1865\nB: 1866\nC: 1867\nD: 1868\n\nExplanation: To find the year the poem was written, we need to add 16 to her birth year. Since Rose Hartwick Thorpe was born in 1850, adding 16 years gives us 1866. However, considering her birthdate is in July, she would have turned 16 in July 1866. Thus, by the end of 1866, she was 16, meaning she wrote it in 1866 or later in the context of a full year cycle. But the exact year she was 16 and wrote it would be considered as 1866, yet the poem is known to be written in 1867.\n\nCorrect Answer: C\n</output_format>\n\nHowever, upon careful reconsideration for optimal output:\n\n<output_format>\nQuestion: In what year did Rose Hartwick Thorpe write \"Curfew Must Not Ring Tonight\" when she was just 16 years old?\nA: 1865\nB: 1866\nC: 1867\nD: 1868\n\nExplanation: Rose Hartwick Thorpe was born on July 18, 1850. She wrote \"Curfew Must Not Ring Tonight\" at the age of 16. Thus, the year of writing is 1850 + 16 = 1866. However, she was born in July, so she turned 16 in July 1866, and the poem is known to be written in 1867.\n\nCorrect Answer: C\n</output_format>\n\nLet's refine it further for better accuracy and clarity:\n\n<output_format>\nQuestion: Rose Hartwick Thorpe wrote \"Curfew Must Not Ring Tonight\" at the age of 16. Given that she was born on July 18, 1850, in which year did she compose this narrative poem?\nA: 1865\nB: 1866\nC: 1867\nD: 1868\n\nExplanation: Since Rose Hartwick Thorpe was born on July 18, 1850, she turned 16 years old in July 1866. Therefore, she was 16 years old for the remainder of 1866 and the beginning of 1867. The poem is known to have been written in 1867.\n\nCorrect Answer: C\n</output_format>\n\nThe final answer is adjusted for optimal clarity and correctness.",
    "question": "Rose Hartwick Thorpe wrote \"Curfew Must Not Ring Tonight\" at the age of 16. Given that she was born on July 18, 1850, in which year did she compose this narrative poem?",
    "choices": {
      "A": "1865",
      "B": "1866",
      "C": "1867",
      "D": "1868"
    },
    "answer": "C",
    "explanation": "Since Rose Hartwick Thorpe was born on July 18, 1850, she turned 16 years old in July 1866. Therefore, she was 16 years old for the remainder of 1866 and the beginning of 1867. The poem is known to have been written in 1867.",
    "answer_correctness_score": 10,
    "explanation_validity_score": 10,
    "question_clarity_score": 10,
    "question_difficulty_score": 2,
    "question_groundedness_score": 10,
    "question_token_count": 46,
    "reformat_question_cosine_similarity_to_orig": 0.5395070314407349,
    "reformat_answer_cosine_similarity_to_orig": 1.0,
    "reformat_question_similarity_score": 9,
    "reformat_answer_similarity_score": 10,
    "avg_answer_token_count": 3
  },
  {
    "orig_question": "Which professor emeritus of Mathematics and statistical mechanics at California State University was also a contributor to The Panda's Thumb? Mark Perakh",
    "orig_answer": "Mark Perakh",
    "context": "[PAR] [TLE] The Panda's Thumb (blog) [SEP] The Panda's Thumb is a weblog on the creation-evolution controversy from a mainstream scientific perspective.  In 2006, \"Nature\" listed it as one of the top five science blogs.  It is written by multiple contributors, including Wesley R. Elsberry, Paul R. Gross, Nick Matzke, PZ Myers and Mark Perakh, many of whom also have complementary weblogs at ScienceBlogs.  The blog takes its name from The Panda's Thumb, the pub of the virtual University of Ediacara, which is named after the by Stephen Jay Gould, which in turn takes its title from the essay \"The Panda's Peculiar Thumb\", which discusses the Panda's sesamoid bone, an example of convergent evolution. [PAR] [TLE] Mark Perakh [SEP] Mark Perakh (Russian: \u041c\u0430\u0440\u043a \u041f\u044d\u0440\u0430\u0445 ; \"perach\" (\u05e4\u05b6\u05bc\u05ab\u05e8\u05b7\u05d7) is the Hebrew word for \"flower\"; born \"Mark Yakovlevich Popereka\" in 1924, Kiev, Ukraine, died 7 May 2013 in Escondido, California), was a professor emeritus of Mathematics and statistical mechanics at California State University, Fullerton in Fullerton, California.",
    "response": "<document_analysis>\nThe provided context discusses two main topics: The Panda's Thumb blog and Mark Perakh. The Panda's Thumb is a blog that focuses on the creation-evolution controversy from a scientific perspective and is written by multiple contributors. Mark Perakh is identified as one of these contributors and is described as a professor emeritus of Mathematics and statistical mechanics at California State University, Fullerton.\n\nUpon analyzing the given question and answer, it's clear that the question is asking to identify a contributor to The Panda's Thumb who held a specific academic position. The answer provided is \"Mark Perakh,\" which is directly supported by the context.\n\nTo enhance the question's complexity and encourage deeper understanding, we can rephrase it to include more details from the context and make it more challenging.\n\nThe thought process involves:\n1. Identifying key information about Mark Perakh and his association with The Panda's Thumb.\n2. Understanding the context of The Panda's Thumb as a blog and its contributors.\n3. Recognizing the need to rephrase the question to make it more challenging and self-contained.\n\nThe original question is straightforward but can be made more engaging by incorporating additional details from the context.\n\n</document_analysis>\n\n<output_format>\nQuestion: Who was both a contributor to the science blog known for discussing the creation-evolution controversy and a professor emeritus of Mathematics and statistical mechanics at California State University, Fullerton?\nA: Wesley R. Elsberry\nB: Mark Perakh\nC: Paul R. Gross\nD: Nick Matzke\nExplanation: Mark Perakh is identified as a contributor to The Panda's Thumb, a blog that discusses the creation-evolution controversy, and is also described as a professor emeritus of Mathematics and statistical mechanics at California State University, Fullerton.\nCorrect Answer: B\n</output_format>",
    "question": "Who was both a contributor to the science blog known for discussing the creation-evolution controversy and a professor emeritus of Mathematics and statistical mechanics at California State University, Fullerton?",
    "choices": {
      "A": "Wesley R. Elsberry",
      "B": "Mark Perakh",
      "C": "Paul R. Gross",
      "D": "Nick Matzke"
    },
    "answer": "B",
    "explanation": "Mark Perakh is identified as a contributor to The Panda's Thumb, a blog that discusses the creation-evolution controversy, and is also described as a professor emeritus of Mathematics and statistical mechanics at California State University, Fullerton.",
    "answer_correctness_score": 10,
    "explanation_validity_score": 10,
    "question_clarity_score": 6,
    "question_difficulty_score": 5,
    "question_groundedness_score": 8,
    "question_token_count": 36,
    "reformat_question_cosine_similarity_to_orig": 0.4554198980331421,
    "reformat_answer_cosine_similarity_to_orig": 1.000000238418579,
    "reformat_question_similarity_score": 9,
    "reformat_answer_similarity_score": 10,
    "avg_answer_token_count": 5
  },
  {
    "orig_question": "Mark Perakh who helped write The Panda's Thumb, was a professor at what university?",
    "orig_answer": "California State University",
    "context": "[PAR] [TLE] The Panda's Thumb (blog) [SEP] The Panda's Thumb is a weblog on the creation-evolution controversy from a mainstream scientific perspective.  In 2006, \"Nature\" listed it as one of the top five science blogs.  It is written by multiple contributors, including Wesley R. Elsberry, Paul R. Gross, Nick Matzke, PZ Myers and Mark Perakh, many of whom also have complementary weblogs at ScienceBlogs.  The blog takes its name from The Panda's Thumb, the pub of the virtual University of Ediacara, which is named after the by Stephen Jay Gould, which in turn takes its title from the essay \"The Panda's Peculiar Thumb\", which discusses the Panda's sesamoid bone, an example of convergent evolution. [PAR] [TLE] Mark Perakh [SEP] Mark Perakh (Russian: \u041c\u0430\u0440\u043a \u041f\u044d\u0440\u0430\u0445 ; \"perach\" (\u05e4\u05b6\u05bc\u05ab\u05e8\u05b7\u05d7) is the Hebrew word for \"flower\"; born \"Mark Yakovlevich Popereka\" in 1924, Kiev, Ukraine, died 7 May 2013 in Escondido, California), was a professor emeritus of Mathematics and statistical mechanics at California State University, Fullerton in Fullerton, California.",
    "response": "<document_analysis>\nThe provided context discusses The Panda's Thumb blog and its contributors, including Mark Perakh. It mentions that Mark Perakh was a professor emeritus of Mathematics and statistical mechanics at California State University, Fullerton. The question asks for the university where Mark Perakh was a professor. The answer provided is \"California State University.\" \n\nUpon analyzing the context, it's clear that Mark Perakh's full affiliation is with California State University, Fullerton, which is a part of the California State University system. The question and answer are straightforward, but we can enhance the question's complexity and clarity.\n\nThe original question is clear but lacks detail. We can rephrase it to include more context and make it more challenging while ensuring it remains self-contained and understandable without the original context.\n\n</document_analysis>\n\n<output_format>\nQuestion: What university was Mark Perakh, a contributor to the science blog The Panda's Thumb, affiliated with as a professor emeritus of Mathematics and statistical mechanics?\nA: University of California, Los Angeles\nB: California State University, Fullerton\nC: Stanford University\nD: Harvard University\nExplanation: Mark Perakh was a professor emeritus at California State University, Fullerton, as stated in the provided context.\nCorrect Answer: B\n</output_format>\n\nThought process:\n1. The original question is rephrased to include more context about Mark Perakh's role and affiliation.\n2. The answer options are created to be distinct and unambiguous, with only one correct answer based on the context.\n3. The correct answer, \"California State University, Fullerton,\" is the most specific and accurate based on the context provided.\n4. The other options are plausible but incorrect, representing other well-known universities.\n5. The explanation directly references the context to justify the correct answer.",
    "question": "What university was Mark Perakh, a contributor to the science blog The Panda's Thumb, affiliated with as a professor emeritus of Mathematics and statistical mechanics?",
    "choices": {
      "A": "University of California, Los Angeles",
      "B": "California State University, Fullerton",
      "C": "Stanford University",
      "D": "Harvard University"
    },
    "answer": "B",
    "explanation": "Mark Perakh was a professor emeritus at California State University, Fullerton, as stated in the provided context.",
    "answer_correctness_score": 10,
    "explanation_validity_score": 10,
    "question_clarity_score": 8,
    "question_difficulty_score": 2,
    "question_groundedness_score": 1,
    "question_token_count": 32,
    "reformat_question_cosine_similarity_to_orig": 0.8564316630363464,
    "reformat_answer_cosine_similarity_to_orig": 0.8175830841064453,
    "reformat_question_similarity_score": 9,
    "reformat_answer_similarity_score": 8,
    "avg_answer_token_count": 5
  },
  {
    "orig_question": "What actress starred in \"The Office\" as receptionist Erin Hannon for the final five seasons and played the title character on the Netflix original series \"Unbreakable Kimmy Schmidt\"?",
    "orig_answer": "Elizabeth Claire Kemper",
    "context": "[PAR] [TLE] Kimmy Schmidt [SEP] Kimberly Couger \"Kimmy\" Schmidt is the title character on the Netflix original series \"Unbreakable Kimmy Schmidt\". [PAR] [TLE] Ellie Kemper [SEP] Elizabeth Claire Kemper (born May 2, 1980) is an American actress and comedian.  She gained prominence when she starred in the NBC series \"The Office\" as receptionist Erin Hannon for the final five seasons.  After her role in \"The Office\", she was cast in a leading role as Kimmy Schmidt in the Netflix comedy series \"Unbreakable Kimmy Schmidt\", for which she has received critical acclaim.  Kemper is also known for her supporting roles in the films \"Bridesmaids\" (2011) and \"21 Jump Street\" (2012).",
    "response": "<document_analysis>\nThe provided context gives information about the title character of the Netflix series \"Unbreakable Kimmy Schmidt\" and about Ellie Kemper, an American actress who played this character. The context highlights Ellie Kemper's career, including her role in \"The Office\" and \"Unbreakable Kimmy Schmidt\". The question seeks to identify the actress who played Erin Hannon in \"The Office\" and the title character in \"Unbreakable Kimmy Schmidt\". The answer provided is \"Elizabeth Claire Kemper\", which is Ellie Kemper's full name.\n\nTo rephrase the question and answer, I will first analyze the context to understand the central ideas and significant relationships. The context connects Ellie Kemper to two major roles: Erin Hannon in \"The Office\" and Kimmy Schmidt in \"Unbreakable Kimmy Schmidt\". The question combines these two roles to identify the actress.\n\nUpon examining the context, it's clear that Ellie Kemper is the actress in question. The task now is to rephrase the question to inspire deeper thought while maintaining clarity and ensuring it remains answerable by a domain expert without the original context.\n\nThe complexity of the question is moderate (around 6-7) because it requires knowledge of Ellie Kemper's roles in both \"The Office\" and \"Unbreakable Kimmy Schmidt\". To increase complexity, the question could be rephrased to include more details or to require a deeper understanding of Ellie Kemper's career.\n\nHere's the thought process for rephrasing:\n1. Identify key elements: The actress's roles in \"The Office\" and \"Unbreakable Kimmy Schmidt\".\n2. Consider additional details from the context that could be included to enhance clarity or complexity.\n3. Rephrase the question to maintain semantic equivalence while inviting deeper understanding.\n\nThe rephrased question will include details about Ellie Kemper's career, making it self-contained and clear.\n\n</document_analysis>\n\n<output_format>\nQuestion: Which American actress, known for her supporting roles in films like \"Bridesmaids\" and \"21 Jump Street\", played the role of receptionist Erin Hannon for the final five seasons of \"The Office\" and later starred as the titular character in the Netflix comedy series \"Unbreakable Kimmy Schmidt\"?\nA: Elizabeth Claire Kemper\nB: Kimberly Couger Schmidt\nC: Tina Fey\nD: Ellie Kemper-Jackson\n\nExplanation: The correct answer is Elizabeth Claire Kemper, also known as Ellie Kemper, who is recognized for her roles in \"The Office\" and \"Unbreakable Kimmy Schmidt\" as well as in the mentioned films.\n\nCorrect Answer: A\n</output_format>",
    "question": "Which American actress, known for her supporting roles in films like \"Bridesmaids\" and \"21 Jump Street\", played the role of receptionist Erin Hannon for the final five seasons of \"The Office\" and later starred as the titular character in the Netflix comedy series \"Unbreakable Kimmy Schmidt\"?",
    "choices": {
      "A": "Elizabeth Claire Kemper",
      "B": "Kimberly Couger Schmidt",
      "C": "Tina Fey",
      "D": "Ellie Kemper-Jackson"
    },
    "answer": "A",
    "explanation": "The correct answer is Elizabeth Claire Kemper, also known as Ellie Kemper, who is recognized for her roles in \"The Office\" and \"Unbreakable Kimmy Schmidt\" as well as in the mentioned films.",
    "answer_correctness_score": 10,
    "explanation_validity_score": 10,
    "question_clarity_score": 9,
    "question_difficulty_score": 7,
    "question_groundedness_score": 10,
    "question_token_count": 64,
    "reformat_question_cosine_similarity_to_orig": 0.9135178327560425,
    "reformat_answer_cosine_similarity_to_orig": 1.000000238418579,
    "reformat_question_similarity_score": 9,
    "reformat_answer_similarity_score": 10,
    "avg_answer_token_count": 5
  },
  {
    "orig_question": "The man of the watch of the 2001 Intercontinental Cup was a footballer of what nationality?",
    "orig_answer": "Ghanaian",
    "context": "[PAR] [TLE] 2001 Intercontinental Cup [SEP] The 2001 Intercontinental Cup was a football match played on 27 November 2001 between Bayern Munich, winners of the 2000\u201301 UEFA Champions League, and defending champions Boca Juniors, winners of the 2001 Copa Libertadores.  The match was played at the neutral venue of the National Stadium in Tokyo in front of 51,360 fans.  Samuel Kuffour was named as man of the match. [PAR] [TLE] Samuel Kuffour [SEP] Samuel Osei Kuffour (born 3 September 1976) is a Ghanaian retired professional footballer who played as a defender.",
    "response": "<document_analysis>\nTo address the task, let's start by analyzing the given context and question.\n\n1. **Thoughtful Content Examination**: The context provides information about the 2001 Intercontinental Cup, a football match between Bayern Munich and Boca Juniors, and details about Samuel Kuffour, who was named man of the match. It mentions that Samuel Kuffour is Ghanaian.\n\n2. **Concept Exploration**: The question asks for the nationality of the man of the match of the 2001 Intercontinental Cup. The context clearly states that Samuel Kuffour, the man of the match, is Ghanaian.\n\n3. **Strategic Complexity Calibration**: The difficulty level of the question is relatively low because it directly asks for information given in the context. However, it still requires understanding the context. Let's calibrate it to a level 6, as it involves a simple lookup but is still related to a specific event.\n\n4. **Intentional Question Planning**: The original question is straightforward. To enhance it, we can rephrase it to encourage deeper understanding or critical engagement while maintaining its simplicity.\n\nUpon analyzing the context and the original question, we observe that the question is factual and directly answerable from the provided context. The context clearly states that Samuel Kuffour, the man of the match, is Ghanaian.\n\nTo rephrase the question and maintain semantic equivalence, we can make it more detailed and specific. The goal is to ensure the question is clear, self-contained, and answerable by a domain expert without referencing the original context.\n\n</document_analysis>\n\n<output_format>\nQuestion: What was the nationality of the football player who was awarded man of the match in the 2001 Intercontinental Cup football match held between Bayern Munich and Boca Juniors on 27 November 2001?\nA: Nigerian\nB: Ghanaian\nC: South African\nD: Brazilian\nExplanation: The correct answer is Ghanaian because Samuel Kuffour, who was named man of the match, is Ghanaian.\nCorrect Answer: B\n</output_format>",
    "question": "What was the nationality of the football player who was awarded man of the match in the 2001 Intercontinental Cup football match held between Bayern Munich and Boca Juniors on 27 November 2001?",
    "choices": {
      "A": "Nigerian",
      "B": "Ghanaian",
      "C": "South African",
      "D": "Brazilian"
    },
    "answer": "B",
    "explanation": "The correct answer is Ghanaian because Samuel Kuffour, who was named man of the match, is Ghanaian.",
    "answer_correctness_score": 10,
    "explanation_validity_score": 10,
    "question_clarity_score": 6,
    "question_difficulty_score": 4,
    "question_groundedness_score": 10,
    "question_token_count": 41,
    "reformat_question_cosine_similarity_to_orig": 0.6917346715927124,
    "reformat_answer_cosine_similarity_to_orig": 0.9999999403953552,
    "reformat_question_similarity_score": 10,
    "reformat_answer_similarity_score": 10,
    "avg_answer_token_count": 3
  },
  {
    "orig_question": "Baker Reagan Mayfield, is a college American football quarterback for the Oklahoma Sooners, after sitting out the 2014 season due to NCAA transfer rules, Mayfield won the starting quarterback job in 2015 over which incumbent starter, an American football quarterback for the Atlanta Falcons of the National Football League (NFL)?",
    "orig_answer": "Trevor Knight",
    "context": "[PAR] [TLE] Baker Mayfield [SEP] Baker Reagan Mayfield (born April 14, 1995) is a college American football quarterback for the Oklahoma Sooners.  Mayfield began his college football career as a walk-on player for the Texas Tech Red Raiders.  He is notable for being the first walk-on true freshman quarterback to start a season opener at a BCS school.  Mayfield transferred from Texas Tech to Oklahoma following alleged scholarship issues and a lack of communication with coaches.  After sitting out the 2014 season due to NCAA transfer rules, Mayfield won the starting quarterback job in 2015 over Cody Thomas and incumbent starter Trevor Knight. [PAR] [TLE] Trevor Knight [SEP] Trevor Knight (born October 3, 1993) is an American football quarterback for the Atlanta Falcons of the National Football League (NFL).  He played college football for the Oklahoma Sooners and Texas A&M Aggies.  After leading Oklahoma to an 8\u20135 record in the 2014 season, he lost the starting job in an open quarterback competition to Texas Tech transfer Baker Mayfield prior to the 2015 season.  On January 4, 2016, it was announced that Knight would transfer to Texas A&M University.",
    "response": "<document_analysis>\nTo address the task, let's first analyze the given context, question, and answer.\n\n1. **Thoughtful Content Examination**:\n   - The context provides information about Baker Mayfield and Trevor Knight, both involved in college American football as quarterbacks.\n   - Baker Mayfield is currently with the Oklahoma Sooners, having transferred from Texas Tech. He won the starting quarterback job in 2015 after sitting out the 2014 season.\n   - Trevor Knight is mentioned as having lost the starting job to Baker Mayfield in 2015 and is now with the Atlanta Falcons.\n\n2. **Concept Exploration**:\n   - The context highlights the transfer and competition dynamics in college football, particularly focusing on quarterbacks.\n   - It touches upon NCAA transfer rules and their implications on player eligibility.\n\n3. **Strategic Complexity Calibration**:\n   - The original question requires knowledge of the context to identify who Baker Mayfield won the starting quarterback job from in 2015.\n   - The difficulty level is moderate (around 6) because it involves recalling specific details about the individuals mentioned and their careers.\n\n4. **Intentional Question Planning**:\n   - The question can be made more challenging by ensuring it requires a deeper understanding or more nuanced insight into the provided context.\n\nThe original question and answer are:\n- Question: Baker Reagan Mayfield, is a college American football quarterback for the Oklahoma Sooners, after sitting out the 2014 season due to NCAA transfer rules, Mayfield won the starting quarterback job in 2015 over which incumbent starter, an American football quarterback for the Atlanta Falcons of the National Football League (NFL)?\n- Answer: Trevor Knight\n\nTo enhance the question, we need to ensure it is clear, challenging, and requires deep understanding. The original question is somewhat long and includes specific details that might not be necessary for a domain expert.\n\nLet's refine the question to make it more engaging and challenging while maintaining its semantic equivalence.\n\n</document_analysis>\n\n<output_format>\nQuestion: Who did Baker Mayfield surpass to become the starting quarterback for the Oklahoma Sooners in 2015, after being a transfer student from Texas Tech and sitting out the 2014 season due to NCAA transfer rules, and this individual is now associated with the Atlanta Falcons?\nA: Cody Thomas\nB: Trevor Knight\nC: Blake Jarwin\nD: Kyler Murray\n\nExplanation: Baker Mayfield won the starting quarterback job in 2015 over Trevor Knight, who later transferred to Texas A&M University and is now associated with the Atlanta Falcons.\n\nCorrect Answer: B\n</output_format>",
    "question": "Who did Baker Mayfield surpass to become the starting quarterback for the Oklahoma Sooners in 2015, after being a transfer student from Texas Tech and sitting out the 2014 season due to NCAA transfer rules, and this individual is now associated with the Atlanta Falcons?",
    "choices": {
      "A": "Cody Thomas",
      "B": "Trevor Knight",
      "C": "Blake Jarwin",
      "D": "Kyler Murray"
    },
    "answer": "B",
    "explanation": "Baker Mayfield won the starting quarterback job in 2015 over Trevor Knight, who later transferred to Texas A&M University and is now associated with the Atlanta Falcons.",
    "answer_correctness_score": 10,
    "explanation_validity_score": 10,
    "question_clarity_score": 8,
    "question_difficulty_score": 6,
    "question_groundedness_score": 10,
    "question_token_count": 55,
    "reformat_question_cosine_similarity_to_orig": 0.9037905931472778,
    "reformat_answer_cosine_similarity_to_orig": 0.9999998807907104,
    "reformat_question_similarity_score": 9,
    "reformat_answer_similarity_score": 10,
    "avg_answer_token_count": 4
  },
  {
    "orig_question": "When was the player whom the Los Angeles Rams traded William Frederick Traux for born?",
    "orig_answer": "October 14, 1943",
    "context": "[PAR] [TLE] Billy Truax [SEP] William Frederick Truax (born July 15, 1943) is a former professional American football tight end in the National Football League (NFL) from 1964 to 1973 for the Los Angeles Rams and the Dallas Cowboys.  He played in high school at Holy Cross in New Orleans and college football at Louisiana State University and was drafted in the second round of the 1964 NFL draft.  Following the 1970 NFL season, Truax was traded by the Rams to the Cowboys for wide receiver Lance Rentzel.  He was part of the Cowboys' Super Bowl VI championship team in 1971. [PAR] [TLE] Lance Rentzel [SEP] Thomas Lance Rentzel (born October 14, 1943) is a former American football flanker in the National Football League (NFL) for the Minnesota Vikings, Dallas Cowboys and the Los Angeles Rams.  He played college football at the University of Oklahoma.",
    "response": "<document_analysis>\nTo generate a question that is semantically equivalent to the original, I will analyze the given context, question, and answer. The context provides information about two former NFL players, Billy Truax and Lance Rentzel, including their careers and personal details. The original question asks for the birth date of the player the Los Angeles Rams traded Billy Truax for. According to the context, Billy Truax was traded to the Cowboys for wide receiver Lance Rentzel following the 1970 NFL season. Therefore, the answer to the original question is the birth date of Lance Rentzel, which is October 14, 1943.\n\nThe context indicates that Lance Rentzel played for the Minnesota Vikings, Dallas Cowboys, and Los Angeles Rams, and that he was traded by the Rams to the Cowboys for Billy Truax. This information is crucial for understanding the transaction between the Rams and the Cowboys.\n\nTo rephrase the question, I will maintain the core inquiry about the birth date of the player received by the Rams in the trade involving Billy Truax. The rephrased question should be clear, detailed, and self-contained, allowing a domain expert to answer it without referencing the original context.\n\nMy thought process involves:\n1. Identifying the key elements: The trade involving Billy Truax and the player received by the Rams.\n2. Understanding the context: The transaction between the Rams and Cowboys involving Billy Truax and Lance Rentzel.\n3. Rephrasing the question: To make it clear and detailed, ensuring it stands alone.\n\nThe difficulty level of the rephrased question is moderate to high (around 6-7) because it requires understanding the specific transaction between the teams and identifying the correct individual involved.\n\n</document_analysis>\n\n<output_format>\nQuestion: As part of a trade following the 1970 NFL season, the Los Angeles Rams sent Billy Truax to the Dallas Cowboys in exchange for wide receiver Lance Rentzel; what is the birth date of Rentzel?\nA: July 15, 1943\nB: October 14, 1943\nC: November 20, 1945\nD: December 25, 1942\nExplanation: The correct birth date of Lance Rentzel is October 14, 1943, as stated in the context provided about his biography.\nCorrect Answer: B\n</output_format>",
    "question": "As part of a trade following the 1970 NFL season, the Los Angeles Rams sent Billy Truax to the Dallas Cowboys in exchange for wide receiver Lance Rentzel; what is the birth date of Rentzel?",
    "choices": {
      "A": "July 15, 1943",
      "B": "October 14, 1943",
      "C": "November 20, 1945",
      "D": "December 25, 1942"
    },
    "answer": "B",
    "explanation": "The correct birth date of Lance Rentzel is October 14, 1943, as stated in the context provided about his biography.",
    "answer_correctness_score": 10,
    "explanation_validity_score": 10,
    "question_clarity_score": 6,
    "question_difficulty_score": 2,
    "question_groundedness_score": 8,
    "question_token_count": 44,
    "reformat_question_cosine_similarity_to_orig": 0.6213771104812622,
    "reformat_answer_cosine_similarity_to_orig": 0.9999997615814209,
    "reformat_question_similarity_score": 9,
    "reformat_answer_similarity_score": 10,
    "avg_answer_token_count": 8
  },
  {
    "orig_question": "Which game often occurs the weekend before the Red River Rivalry?",
    "orig_answer": "State Fair Classic",
    "context": "[PAR] [TLE] State Fair Classic [SEP] The State Fair Classic (known as the Southwest Airlines State Fair Classic for sponsorship purposes) is an annual college football game between the Grambling State University Tigers and the Prairie View A&M University Panthers of the Southwestern Athletic Conference.  The game is played on a neutral site at the Cotton Bowl in Fair Park, Dallas, Texas during the State Fair of Texas.  The game often occurs the weekend before the Oklahoma\u2013Texas Red River Showdown game; the new Texas State Fair Football Showdown is also scheduled to take place on the third weekends of the 2018 and 2019 fairs and will feature Southern and Texas Southern. [PAR] [TLE] Red River Showdown [SEP] The Red River Showdown, commonly called the Red River Rivalry, the Red River Classic, or the Red River Shootout, is an American college football rivalry game played annually at the Cotton Bowl stadium in Dallas, Texas, during the second weekend of the State Fair of Texas in October.  The participants are the Oklahoma Sooners football team of the University of Oklahoma and the Texas Longhorns football team of the University of Texas at Austin.  The game is played the week following the State Fair Classic featuring Prairie View A&M University and Grambling State University.  The series is one of the major rivalries in NCAA football and in all of American sports.  The name is derived from the Red River that forms part of the boundary between Texas and Oklahoma that has in the past caused conflict between the two states, most notably the 1931 Red River Bridge War.",
    "response": "<document_analysis>\nThe provided context discusses two major college football events held during the State Fair of Texas in Dallas, Texas: the State Fair Classic and the Red River Showdown. The State Fair Classic is an annual game between Grambling State University and Prairie View A&M University, while the Red River Showdown is a rivalry game between the University of Oklahoma and the University of Texas at Austin. The context clearly states that the State Fair Classic often occurs the weekend before the Oklahoma\u2013Texas Red River Showdown game.\n\n1. **Thoughtful Content Examination**: The central idea is to understand the relationship between the timing of the State Fair Classic and the Red River Showdown. The context provides specific details about both events, including their participants and the venue.\n\n2. **Concept Exploration**: The implicit assumption is that both events are significant in the college football calendar, especially within the region. The subtle detail is the scheduling relationship between the two events.\n\n3. **Strategic Complexity Calibration**: The difficulty level is moderate (around 6) as it requires understanding the specific details about the timing and names of the events.\n\n4. **Intentional Question Planning**: The question invites a deeper understanding of the scheduling of major college football events during the State Fair of Texas.\n\nThe original question and answer are straightforward and based on the information provided in the context. The task now is to rephrase and reformat them according to the guidelines.\n\n</document_analysis>\n\n<output_format>\nQuestion: Which annual college football event typically takes place the weekend before the Red River Showdown, also known as the Red River Rivalry, that features the Oklahoma Sooners and the Texas Longhorns?\nA: Grambling State University vs Prairie View A&M University game\nB: State Fair Classic\nC: Texas State Fair Football Showdown\nD: Oklahoma-Texas Showdown\n\nExplanation: The State Fair Classic is the annual college football game between Grambling State University Tigers and Prairie View A&M University Panthers, and it is stated to often occur the weekend before the Oklahoma\u2013Texas Red River Showdown game.\n\nCorrect Answer: B\n</output_format>\n\nHowever, to improve the question's clarity and ensure it is self-contained, we can rephrase it further.\n\n<output_format>\nQuestion: Which college football game, held at the Cotton Bowl in Dallas, Texas, during the State Fair of Texas, typically occurs the weekend before the Red River Showdown between the Oklahoma Sooners and the Texas Longhorns?\nA: Texas State Fair Football Showdown\nB: Bayou Classic\nC: State Fair Classic\nD: Southwestern Athletic Conference Championship\n\nExplanation: The State Fair Classic is the correct answer as it is the game between Grambling State University and Prairie View A&M University, occurring before the Red River Showdown.\n\nCorrect Answer: C\n</output_format>\n\nLet's refine it to meet the requirements perfectly.\n\n<output_format>\nQuestion: Identify the annual college football event that is held at the Cotton Bowl in Fair Park, Dallas, Texas, during the State Fair of Texas and typically takes place the weekend before the Red River Showdown between the Oklahoma Sooners football team and the Texas Longhorns football team.\nA: Southwestern Athletic Conference Championship\nB: Texas State Fair Football Showdown\nC: Bayou Classic\nD: State Fair Classic\n\nExplanation: The State Fair Classic is an annual college football game between Grambling State University Tigers and Prairie View A&M University Panthers, known to occur the weekend before the Red River Showdown.\n\nCorrect Answer: D\n</output_format>\n\nThe final answer is adjusted to fit the required format and to ensure that the question is clear and self-contained.",
    "question": "Identify the annual college football event that is held at the Cotton Bowl in Fair Park, Dallas, Texas, during the State Fair of Texas and typically takes place the weekend before the Red River Showdown between the Oklahoma Sooners football team and the Texas Longhorns football team.",
    "choices": {
      "A": "Southwestern Athletic Conference Championship",
      "B": "Texas State Fair Football Showdown",
      "C": "Bayou Classic",
      "D": "State Fair Classic"
    },
    "answer": "D",
    "explanation": "The State Fair Classic is an annual college football game between Grambling State University Tigers and Prairie View A&M University Panthers, known to occur the weekend before the Red River Showdown.",
    "answer_correctness_score": 10,
    "explanation_validity_score": 10,
    "question_clarity_score": 8,
    "question_difficulty_score": 6,
    "question_groundedness_score": 10,
    "question_token_count": 56,
    "reformat_question_cosine_similarity_to_orig": 0.45900648832321167,
    "reformat_answer_cosine_similarity_to_orig": 1.0000001192092896,
    "reformat_question_similarity_score": 9,
    "reformat_answer_similarity_score": 10,
    "avg_answer_token_count": 5
  },
  {
    "orig_question": "The daughter of former Congressman Pat Williams started an organization with what other person in 2010?",
    "orig_answer": "Ben Affleck",
    "context": "[PAR] [TLE] Eastern Congo Initiative [SEP] The Eastern Congo Initiative (ECI) is an American nonprofit organization established by Ben Affleck and Whitney Williams in 2010 as \"the first U.S. based advocacy and grant-making initiative wholly focused on working with and for the people of eastern Congo\".  ECI provides development grants and international advocacy for community-building initiatives in the Democratic Republic of Congo. [PAR] [TLE] Whitney Williams [SEP] Whitney Williams is an American businesswoman and philanthropist, currently serving as Vice-Chair of the board for Eastern Congo Initiative and Founder + CEO of the Seattle-based consultancy williamsworks.  She is the daughter of former Congressman Pat Williams and former Montana Senate Majority Leader Carol Williams. \" The Washington Post\" has referred to the Williams family as the \u201cfirst family of Montana politics.\u201d  Her brother is artist Griff Williams.",
    "response": "<document_analysis>\nThe provided context describes the Eastern Congo Initiative (ECI), a nonprofit organization founded by Ben Affleck and Whitney Williams in 2010. It highlights Whitney Williams' background, including her role at ECI and her family connections. To create a challenging question, we need to integrate the relevant information seamlessly into the question. The original question asks about the person who started the organization with the daughter of former Congressman Pat Williams in 2010. The answer is Ben Affleck.\n\nUpon analyzing the context, it's clear that Whitney Williams is the daughter of former Congressman Pat Williams and that she co-founded ECI with Ben Affleck. The question should be crafted to reflect this information in a nuanced and challenging way.\n\nThe complexity of the question is rated as 6 out of 10 because it requires understanding the relationship between Whitney Williams and the founding of ECI. To increase the complexity, the question can be rephrased to include more details from the context.\n\n</document_analysis>\n\n<output_format>\nQuestion: Who co-founded the Eastern Congo Initiative in 2010 alongside Whitney Williams, the daughter of former Congressman Pat Williams?\nA: Griff Williams\nB: Ben Affleck\nC: Carol Williams\nD: Pat Williams\nExplanation: The correct answer is Ben Affleck because he co-founded the Eastern Congo Initiative with Whitney Williams in 2010, as stated in the context provided.\nCorrect Answer: B\n</output_format>",
    "question": "Who co-founded the Eastern Congo Initiative in 2010 alongside Whitney Williams, the daughter of former Congressman Pat Williams?",
    "choices": {
      "A": "Griff Williams",
      "B": "Ben Affleck",
      "C": "Carol Williams",
      "D": "Pat Williams"
    },
    "answer": "B",
    "explanation": "The correct answer is Ben Affleck because he co-founded the Eastern Congo Initiative with Whitney Williams in 2010, as stated in the context provided.",
    "answer_correctness_score": 10,
    "explanation_validity_score": 10,
    "question_clarity_score": 8,
    "question_difficulty_score": 4,
    "question_groundedness_score": 10,
    "question_token_count": 26,
    "reformat_question_cosine_similarity_to_orig": 0.5861872434616089,
    "reformat_answer_cosine_similarity_to_orig": 0.9999998807907104,
    "reformat_question_similarity_score": 10,
    "reformat_answer_similarity_score": 10,
    "avg_answer_token_count": 3
  },
  {
    "orig_question": "Charlie Bryan was the head of the International Association of Machinists union during the mid to late 1980s who led a strike against the American businessman and philanthropist, Frank Lorenzo in what year?",
    "orig_answer": "1989",
    "context": "[PAR] [TLE] Charlie Bryan [SEP] Charlie Bryan (11 December 1933 - 2 November 2013) was the head of the International Association of Machinists union in the southeast United States, during the mid to late 1980s.  He led machinists to strike against Eastern Air Lines and Frank Lorenzo in 1989. [PAR] [TLE] Frank Lorenzo [SEP] Francisco Anthony \"Frank\" Lorenzo (born May 19, 1940) is an American businessman and philanthropist.  He is most famous for his leadership of Texas International Airlines and its successor holding company Texas Air Corporation between 1972 and 1990, through which he formed or acquired a number of major U.S. airlines including Continental Airlines, Eastern Air Lines, Frontier Airlines, New York Air and People Express Airlines.",
    "response": "<document_analysis>\nTo begin, let's carefully analyze the given context, question, and answer. The context provides information about Charlie Bryan and Frank Lorenzo, focusing on their roles in a significant labor dispute involving Eastern Air Lines. Charlie Bryan led the International Association of Machinists union in a strike against Eastern Air Lines and Frank Lorenzo.\n\n1. **Thoughtful Content Examination**: The context highlights Charlie Bryan's leadership role in the International Association of Machinists union during the mid to late 1980s and his involvement in a strike against Eastern Air Lines and Frank Lorenzo. It also provides background on Frank Lorenzo, detailing his airline leadership roles.\n\n2. **Concept Exploration**: The information implicitly assumes that the strike was a significant event related to labor disputes in the airline industry during the late 1980s. It suggests that Charlie Bryan and Frank Lorenzo were key figures in this dispute.\n\n3. **Strategic Complexity Calibration**: The question about the year of the strike is factual and straightforward. To increase complexity, we could rephrase it to encourage deeper understanding or critical engagement. The difficulty level is currently low (around 2-3), as it directly asks for a specific year mentioned in the context.\n\n4. **Intentional Question Planning**: To invite deeper understanding or meaningful reflection, we could reframe the question to focus on the implications of the strike or the roles of the individuals involved, rather than just recalling a date.\n\nGiven the context and the original question, we can see that the question is factual and directly answerable from the provided information. To enhance it, we should aim to create a more complex and thought-provoking query that still aligns with the original content.\n\nThe original question is: \"Charlie Bryan was the head of the International Association of Machinists union during the mid to late 1980s who led a strike against the American businessman and philanthropist, Frank Lorenzo in what year?\"\n\nTo improve it, we can rephrase the question to include more context and encourage deeper understanding.\n\n</document_analysis>\n\n<output_format>\nQuestion: As the leader of the International Association of Machinists union in the southeast United States during the mid to late 1980s, Charlie Bryan orchestrated a significant labor action against Eastern Air Lines and its leadership under Frank Lorenzo; in which year did this strike occur?\nA: 1985\nB: 1989\nC: 1990\nD: 1987\nExplanation: The strike led by Charlie Bryan against Eastern Air Lines and Frank Lorenzo took place in 1989, as mentioned in the context provided.\nCorrect Answer: B\n</output_format>\n\nThe revised question is designed to be more self-contained and clear, providing sufficient context for a domain expert to answer without referencing the original paragraph. The answer options are distinct and unambiguous, and the correct answer is included among the choices. The question and answer remain semantically equivalent to the originals while promoting a deeper understanding of the event.",
    "question": "As the leader of the International Association of Machinists union in the southeast United States during the mid to late 1980s, Charlie Bryan orchestrated a significant labor action against Eastern Air Lines and its leadership under Frank Lorenzo; in which year did this strike occur?",
    "choices": {
      "A": "1985",
      "B": "1989",
      "C": "1990",
      "D": "1987"
    },
    "answer": "B",
    "explanation": "The strike led by Charlie Bryan against Eastern Air Lines and Frank Lorenzo took place in 1989, as mentioned in the context provided.",
    "answer_correctness_score": 10,
    "explanation_validity_score": 10,
    "question_clarity_score": 8,
    "question_difficulty_score": 6,
    "question_groundedness_score": 10,
    "question_token_count": 55,
    "reformat_question_cosine_similarity_to_orig": 0.8579199314117432,
    "reformat_answer_cosine_similarity_to_orig": 1.0,
    "reformat_question_similarity_score": 9,
    "reformat_answer_similarity_score": 10,
    "avg_answer_token_count": 3
  },
  {
    "orig_question": "Who directed the docudrama film about the sixth person to land and walk on the Moon?",
    "orig_answer": "Ron Howard",
    "context": "[PAR] [TLE] Fred Haise [SEP] Fred Wallace Haise Jr. ( ; born November 14, 1933) is an American former NASA astronaut, fighter pilot with the U.S. Marine Corps and the U.S. Air Force and test pilot.  He is one of only 24 people to have flown to the Moon, having flown as Lunar Module Pilot on Apollo 13.  He was to have been the sixth person to land and walk on the Moon, but the Apollo 13 mission was aborted before lunar landing.  He went on to fly Space Shuttle Approach and Landing Tests in 1977, and retired from NASA in 1979. [PAR] [TLE] Apollo 13 (film) [SEP] Apollo 13 is a 1995 American space adventure docudrama film directed by Ron Howard and starring Tom Hanks, Kevin Bacon, Bill Paxton, Gary Sinise, and Ed Harris.  The screenplay by William Broyles, Jr. and Al Reinert, that dramatizes the aborted 1970 Apollo 13 lunar mission, is an adaptation of the book \"Lost Moon: The Perilous Voyage of Apollo 13\" by astronaut Jim Lovell and Jeffrey Kluger.  The film depicts astronauts Lovell, Jack Swigert, and Fred Haise aboard Apollo 13 for America's third Moon landing mission.  En route, an on-board explosion deprives their spacecraft of most of its oxygen supply and electric power, forcing NASA's flight controllers to abort the Moon landing, and turning the mission into a struggle to get the three men home safely.",
    "response": "<document_analysis>\nTo address the task, let's first analyze the given context, question, and answer.\n\n1. **Thoughtful Content Examination**:\n   - The context provides information about Fred Haise, an American astronaut who was to be the sixth person to land and walk on the Moon as part of the Apollo 13 mission. However, the mission was aborted before landing.\n   - It also describes the 1995 film \"Apollo 13,\" a docudrama directed by Ron Howard, which dramatizes the Apollo 13 mission.\n\n2. **Concept Exploration**:\n   - The question asks who directed the docudrama film about the sixth person to land and walk on the Moon. \n   - The context indicates that Fred Haise was to be the sixth person to land on the Moon, and the film \"Apollo 13\" is about the Apollo 13 mission, which included Fred Haise.\n   - The answer provided is \"Ron Howard,\" who directed \"Apollo 13.\"\n\n3. **Strategic Complexity Calibration**:\n   - The difficulty level of the question seems moderate because it requires understanding the connection between Fred Haise and the film \"Apollo 13.\" Let's rate it a 6 out of 10.\n\n4. **Intentional Question Planning**:\n   - The original question is straightforward but could be improved for deeper understanding or critical engagement. We need to rephrase it to ensure it invites reflection or insight.\n\nUpon examination, the original question and answer are:\n- Question: \"Who directed the docudrama film about the sixth person to land and walk on the Moon?\"\n- Answer: \"Ron Howard\"\n\nThe context does not directly state that the film is \"about the sixth person to land and walk on the Moon.\" Instead, it states that Fred Haise was to be the sixth person and that the film \"Apollo 13\" is about the Apollo 13 mission, which included him. Thus, the question makes an inference not directly stated in the context.\n\nTo improve the question, we should make it more specific and detailed to stand alone without referencing the original context explicitly.\n\nHere's a rephrased version that is more detailed and encourages deeper understanding:\n\n\"Fred Haise was slated to be the sixth astronaut to walk on the Moon as part of the Apollo 13 mission. Which director brought the story of this mission to the big screen in a 1995 docudrama film?\"\n\nThis rephrased question includes more context and is self-contained.\n\nThe answer remains \"Ron Howard.\"\n\nLet's now format the output according to the guidelines.\n\n<output_format>\nQuestion: Fred Haise was slated to be the sixth astronaut to walk on the Moon as part of the Apollo 13 mission. Which director brought the story of this mission to the big screen in a 1995 docudrama film?\nA: Ron Howard\nB: Christopher Nolan\nC: James Cameron\nD: Ridley Scott\nExplanation: The film \"Apollo 13\" is a 1995 docudrama that dramatizes the Apollo 13 mission, which included Fred Haise. It was directed by Ron Howard.\nCorrect Answer: A\n</output_format>\n</document_analysis>\n\n<output_format>\nQuestion: Fred Haise was slated to be the sixth astronaut to walk on the Moon as part of the Apollo 13 mission. Which director brought the story of this mission to the big screen in a 1995 docudrama film?\nA: Ron Howard\nB: Christopher Nolan\nC: James Cameron\nD: Ridley Scott\nExplanation: The film \"Apollo 13\" is a 1995 docudrama that dramatizes the Apollo 13 mission, which included Fred Haise. It was directed by Ron Howard.\nCorrect Answer: A\n</output_format>",
    "question": "Fred Haise was slated to be the sixth astronaut to walk on the Moon as part of the Apollo 13 mission. Which director brought the story of this mission to the big screen in a 1995 docudrama film?",
    "choices": {
      "A": "Ron Howard",
      "B": "Christopher Nolan",
      "C": "James Cameron",
      "D": "Ridley Scott"
    },
    "answer": "A",
    "explanation": "The film \"Apollo 13\" is a 1995 docudrama that dramatizes the Apollo 13 mission, which included Fred Haise. It was directed by Ron Howard.",
    "answer_correctness_score": 10,
    "explanation_validity_score": 10,
    "question_clarity_score": 8,
    "question_difficulty_score": 4,
    "question_groundedness_score": 10,
    "question_token_count": 47,
    "reformat_question_cosine_similarity_to_orig": 0.6792253851890564,
    "reformat_answer_cosine_similarity_to_orig": 1.0,
    "reformat_question_similarity_score": 9,
    "reformat_answer_similarity_score": 10,
    "avg_answer_token_count": 3
  },
  {
    "orig_question": "How many times did the murder victim of an heir to the Du Pont family fortune win Olympic Medals?",
    "orig_answer": "seven-time",
    "context": "[PAR] [TLE] John du Pont [SEP] John Eleuth\u00e8re du Pont (November 22, 1938 \u2013 December 9, 2010) was an American philanthropist and heir to the Du Pont family fortune, he had been a published ornithologist, philatelist, philanthropist, conchologist, sports enthusiast, self-styled wrestling coach.  He died in prison while serving a sentence of 30 years in prison for the murder of Dave Schultz. [PAR] [TLE] Dave Schultz (wrestling) [SEP] David Leslie \"Dave\" Schultz (June 6, 1959 \u2013 January 26, 1996) was an American Olympic and world champion freestyle wrestler, a seven-time World and Olympic medalist.  He coached individuals and teams at the college level and also privately.  He was shot and killed by John Eleuth\u00e8re du Pont, a millionaire philanthropist who sponsored the private Foxcatcher wrestling team at an amateur sports center, known as Foxcatcher Farm, he set up on his estate in Pennsylvania.",
    "response": "<document_analysis>\nTo address the task, we first need to analyze the given context and understand the question being asked. The context revolves around John Eleuth\u00e8re du Pont, an American philanthropist and heir to the Du Pont family fortune, and Dave Schultz, an American Olympic and world champion freestyle wrestler. The context mentions that John du Pont murdered Dave Schultz.\n\nThe original question is: \"How many times did the murder victim of an heir to the Du Pont family fortune win Olympic Medals?\" The answer provided is \"seven-time.\"\n\nUpon examining the context, we find that Dave Schultz was indeed the murder victim of John du Pont, and it is mentioned that Dave Schultz was \"a seven-time World and Olympic medalist.\" This information directly answers the original question.\n\nTo rephrase the question and answer while maintaining semantic equivalence, we need to ensure that the rewritten question is clear and challenging, and the answer is accurate and directly related to the question.\n\nThe thought process involves understanding that the question is asking for the number of Olympic medals won by Dave Schultz, who was murdered by John du Pont. The context provides the necessary information to answer this question.\n\nTo create a more nuanced and challenging question, we can rephrase it to include more details from the context, ensuring it remains self-contained and clear.\n\n</document_analysis>\n\n<output_format>\nQuestion: Dave Schultz, the Olympic champion freestyle wrestler murdered by John Eleuth\u00e8re du Pont, an heir to the Du Pont family fortune and a philanthropist, was known for his numerous achievements in wrestling. How many World and Olympic medals did Dave Schultz win throughout his career?\nA: Three-time World and Olympic medalist\nB: Five-time World and Olympic medalist\nC: Seven-time World and Olympic medalist\nD: Ten-time World and Olympic medalist\nExplanation: According to the context, Dave Schultz was \"a seven-time World and Olympic medalist,\" which directly answers the question regarding his achievements.\nCorrect Answer: C\n</output_format>\n\nThe changes made include rephrasing the question to include more context and details about Dave Schultz and John du Pont, ensuring it is clear and challenging. The answer options are distinct and unambiguous, with the correct answer being \"Seven-time World and Olympic medalist,\" corresponding to option C. The explanation directly references the context to justify the correct answer.",
    "question": "Dave Schultz, the Olympic champion freestyle wrestler murdered by John Eleuth\u00e8re du Pont, an heir to the Du Pont family fortune and a philanthropist, was known for his numerous achievements in wrestling. How many World and Olympic medals did Dave Schultz win throughout his career?",
    "choices": {
      "A": "Three-time World and Olympic medalist",
      "B": "Five-time World and Olympic medalist",
      "C": "Seven-time World and Olympic medalist",
      "D": "Ten-time World and Olympic medalist"
    },
    "answer": "C",
    "explanation": "According to the context, Dave Schultz was \"a seven-time World and Olympic medalist,\" which directly answers the question regarding his achievements.",
    "answer_correctness_score": 10,
    "explanation_validity_score": 10,
    "question_clarity_score": 8,
    "question_difficulty_score": 2,
    "question_groundedness_score": 10,
    "question_token_count": 57,
    "reformat_question_cosine_similarity_to_orig": 0.5574657917022705,
    "reformat_answer_cosine_similarity_to_orig": 0.5133723020553589,
    "reformat_question_similarity_score": 8,
    "reformat_answer_similarity_score": 9,
    "avg_answer_token_count": 8
  },
  {
    "orig_question": "The ice hockey team that was established on June 5, 1967, will play without who, that was drafted to the Vegas Golden Knights in an expansion draft conducted by the National Hockey League on June 18\u201320, 2017?",
    "orig_answer": "Marc-Andre Fleury",
    "context": "[PAR] [TLE] 2017\u201318 Pittsburgh Penguins season [SEP] The 2017\u201318 Pittsburgh Penguins season will be the 51st season for the National Hockey League ice hockey team that was established on June 5, 1967.  They will enter the season as two-time defending Stanley Cup champions.  It will be the first season since the 2002\u201303 season in which the team will play without goaltender Marc-Andre Fleury, who was drafted to the Vegas Golden Knights in the expansion draft. [PAR] [TLE] 2017 NHL Expansion Draft [SEP] The 2017 NHL Expansion Draft was an expansion draft conducted by the National Hockey League on June 18\u201320, 2017 to fill the roster of the league's expansion team for the 2017\u201318 season, the Vegas Golden Knights.  The team's selections were announced on June 21 during the NHL Awards ceremony at T-Mobile Arena.",
    "response": "<document_analysis>\nThe provided context discusses the 2017\u201318 Pittsburgh Penguins season and the 2017 NHL Expansion Draft. The central idea revolves around the Penguins' upcoming season as defending Stanley Cup champions and the impact of the expansion draft on their roster, particularly the loss of Marc-Andre Fleury to the Vegas Golden Knights. The context provides specific details about the establishment date of the Penguins, the expansion draft, and the consequent absence of Marc-Andre Fleury in the upcoming season.\n\nUpon analyzing the given question and answer, it's clear that the question seeks to identify the player who was drafted by the Vegas Golden Knights during the expansion draft, thereby affecting the Penguins' roster for the 2017\u201318 season. The correct answer is Marc-Andre Fleury.\n\nTo rephrase and rewrite the question and answer pair according to the provided instructions, I will focus on maintaining semantic equivalence while enhancing clarity and complexity.\n\nThe original question is: \"The ice hockey team that was established on June 5, 1967, will play without who, that was drafted to the Vegas Golden Knights in an expansion draft conducted by the National Hockey League on June 18\u201320, 2017?\"\n\nThis question is factually accurate but somewhat convoluted. To improve clarity and complexity, I will rephrase it to ensure it is self-contained and challenging for a domain expert.\n\nThought process:\n1. Identify the key elements: The Penguins, establishment date (June 5, 1967), Marc-Andre Fleury, Vegas Golden Knights, and the NHL expansion draft dates (June 18\u201320, 2017).\n2. Understand the relationship: The Penguins, established on June 5, 1967, lost Marc-Andre Fleury to the Vegas Golden Knights during the 2017 NHL Expansion Draft.\n3. Rephrase the question to maintain semantic equivalence while enhancing clarity and ensuring it is challenging and self-contained.\n\n</document_analysis>\n\n<output_format>\nQuestion: Which goaltender, drafted by the Vegas Golden Knights during the National Hockey League's expansion draft held from June 18\u201320, 2017, will be absent from the roster of the ice hockey team established on June 5, 1967, for the upcoming season?\nA: Carey Price\nB: Marc-Andre Fleury\nC: Braden Holtby\nD: Tuukka Rask\nExplanation: The correct answer is Marc-Andre Fleury because he was the goaltender drafted by the Vegas Golden Knights during the 2017 NHL Expansion Draft, thus making him absent from the Penguins' roster.\nCorrect Answer: B\n</output_format>",
    "question": "Which goaltender, drafted by the Vegas Golden Knights during the National Hockey League's expansion draft held from June 18\u201320, 2017, will be absent from the roster of the ice hockey team established on June 5, 1967, for the upcoming season?",
    "choices": {
      "A": "Carey Price",
      "B": "Marc-Andre Fleury",
      "C": "Braden Holtby",
      "D": "Tuukka Rask"
    },
    "answer": "B",
    "explanation": "The correct answer is Marc-Andre Fleury because he was the goaltender drafted by the Vegas Golden Knights during the 2017 NHL Expansion Draft, thus making him absent from the Penguins' roster.",
    "answer_correctness_score": 10,
    "explanation_validity_score": 10,
    "question_clarity_score": 4,
    "question_difficulty_score": 7,
    "question_groundedness_score": 9,
    "question_token_count": 58,
    "reformat_question_cosine_similarity_to_orig": 0.8521808385848999,
    "reformat_answer_cosine_similarity_to_orig": 0.9999998807907104,
    "reformat_question_similarity_score": 10,
    "reformat_answer_similarity_score": 10,
    "avg_answer_token_count": 5
  },
  {
    "orig_question": "Ghosts comes from a slang term that applies to what type of ethnicities?",
    "orig_answer": "European",
    "context": "[PAR] [TLE] Gweilo [SEP] Gweilo or gwailou (, pronounced ] ) is a common Cantonese slang term for Westerners.  In its unmodified form, it applies only to European ethnicities and has a history of racially deprecatory use.  Cantonese speakers frequently use \"gwailou\" to refer to Westerners in general use, in a non-derogatory context, although whether this type of usage is offensive is disputed by both Cantonese and Westerners alike. [PAR] [TLE] Ghosts (2006 film) [SEP] Ghosts is a 2006 drama film directed by Nick Broomfield, based on the 2004 Morecambe Bay cockling disaster.  The title is a reference to the Cantonese slang term \"Gweilo\" (\u9b3c\u4f6c), meaning \"ghost man\", used for white people.",
    "response": "<document_analysis>\nThe provided context discusses the term \"Gweilo\" (or \"gwailou\"), a Cantonese slang term used to refer to Westerners, particularly those of European ethnicities. It is noted that the term has a history of being used in a racially deprecatory manner but is also used in non-derogatory contexts by Cantonese speakers to refer to Westerners in general. The film \"Ghosts\" (2006) is mentioned, with its title referencing the term \"Gweilo,\" which translates to \"ghost man\" and is used to refer to white people. The question posed is about the ethnicities to which the slang term referenced by the title \"Ghosts\" applies.\n\n1. **Thoughtful Content Examination**: The context explains the term \"Gweilo\" and its use in Cantonese slang, as well as its connection to the film \"Ghosts.\" The central idea is the meaning and usage of \"Gweilo\" and its relevance to the title of the film.\n\n2. **Concept Exploration**: The implicit assumption is that understanding the term \"Gweilo\" is crucial to grasping the reference made by the title \"Ghosts.\" The underlying theory is that cultural references, like the term \"Gweilo,\" carry significant meaning that can be context-dependent.\n\n3. **Strategic Complexity Calibration**: The difficulty level is rated as 6 out of 10 because understanding the question requires knowledge of the term \"Gweilo\" and its cultural context, but the answer is directly related to the information provided.\n\n4. **Intentional Question Planning**: The question invites deeper understanding by requiring the test-taker to connect the title \"Ghosts\" with the cultural reference \"Gweilo\" and understand its implications.\n\nThe rationale for the analysis is to ensure that the generated question and answer pair is meaningful and challenging, reflecting the nuances of the term \"Gweilo\" and its cultural significance.\n</document_analysis>\n\n<output_format>\nQuestion: What type of ethnicities are referred to by the Cantonese slang term that is the origin of the title of the 2006 drama film \"Ghosts,\" directed by Nick Broomfield?\nA: Asian\nB: African\nC: European\nD: Indigenous American\nExplanation: The term \"Gweilo\" translates to \"ghost man\" and is used to refer to white people, specifically those of European ethnicities.\nCorrect Answer: C\n</output_format>",
    "question": "What type of ethnicities are referred to by the Cantonese slang term that is the origin of the title of the 2006 drama film \"Ghosts,\" directed by Nick Broomfield?",
    "choices": {
      "A": "Asian",
      "B": "African",
      "C": "European",
      "D": "Indigenous American"
    },
    "answer": "C",
    "explanation": "The term \"Gweilo\" translates to \"ghost man\" and is used to refer to white people, specifically those of European ethnicities.",
    "answer_correctness_score": 10,
    "explanation_validity_score": 10,
    "question_clarity_score": 6,
    "question_difficulty_score": 7,
    "question_groundedness_score": 10,
    "question_token_count": 40,
    "reformat_question_cosine_similarity_to_orig": 0.747802734375,
    "reformat_answer_cosine_similarity_to_orig": 0.9999999403953552,
    "reformat_question_similarity_score": 9,
    "reformat_answer_similarity_score": 10,
    "avg_answer_token_count": 2
  },
  {
    "orig_question": "Question: What coach, who was born in 1955 took over for Mike Cavan for the Southern Methodist University football team in 2002?",
    "orig_answer": "Phil Bennett",
    "context": "[PAR] [TLE] Phil Bennett (American football) [SEP] Phil Bennett (born December 3, 1955) is an American football coach and former player.  He is the defensive coordinator at Arizona State Sun Devils.  Prior to this position, he served as the defensive coordinator for the Baylor Bears from 2011-2016, and was interim head coach of the Pittsburgh Panthers during their 2011 BBVA Compass Bowl win over Kentucky after serving as defensive coordinator of the Panthers for three seasons.  Prior to coaching the Panthers, he served as the head football coach at Southern Methodist University (SMU) from 2002 to 2007.  Before his stint at SMU, he served as an assistant coach at seven different colleges. [PAR] [TLE] SMU Mustangs football under Mike Cavan [SEP] Mike Cavan was the coach of the Southern Methodist University's football team from 1997 to 2001.  He compiled a 22\u201334\u20130 record, and was succeeded by Phil Bennett.",
    "response": "<document_analysis>\nTo generate a question that is semantically equivalent to the original, I will first analyze the given context, question, and answer. The context provides information about Phil Bennett's coaching career and his succession of Mike Cavan at Southern Methodist University (SMU). The original question asks for the coach born in 1955 who took over for Mike Cavan at SMU in 2002. The answer is Phil Bennett.\n\nThe context indicates that Phil Bennett succeeded Mike Cavan as the head football coach at SMU, starting in 2002. It also mentions that Phil Bennett was born on December 3, 1955. This information is crucial for answering the question.\n\nTo create a more challenging and nuanced question, I will rephrase it while maintaining its original meaning. The new question will be designed to test the understanding of the context and the ability to apply the information provided.\n\nUpon examining the context, I notice that it provides a chronological account of Phil Bennett's coaching career and mentions his birth year. The question can be rephrased to incorporate more details from the context, making it more comprehensive and challenging.\n\nThought Process:\n1. Identify key details: Phil Bennett's birth year (1955), his role as a coach, and his succession of Mike Cavan at SMU.\n2. Rephrase the question to include more context or make it more specific.\n3. Ensure the question remains answerable without the original context paragraph.\n\nThe rephrased question will be: \"Who succeeded Mike Cavan as the head football coach at Southern Methodist University in 2002, and was born in the same year he finished his tenure with a 22\u201334\u20130 record?\"\n\nThis question integrates more details from the context, such as Mike Cavan's record, to make it more detailed and challenging.\n\nThe correct answer remains \"Phil Bennett.\" To fit the required output format, I will create multiple-choice options.\n\nA: June Jones\nB: Phil Bennett\nC: Mike Cavan\nD: Dan Beebe\n\nExplanation: Phil Bennett succeeded Mike Cavan as the head football coach at SMU in 2002. The context mentions that Phil Bennett was born in 1955, the same year Mike Cavan finished his tenure with a 22\u201334\u20130 record.\n\nCorrect Answer: B\n\n</document_analysis>\n\n<output_format>\nQuestion: Who succeeded Mike Cavan as the head football coach at Southern Methodist University in 2002, and was born in the same year he finished his tenure with a 22\u201334\u20130 record?\nA: June Jones\nB: Phil Bennett\nC: Mike Cavan\nD: Dan Beebe\nExplanation: Phil Bennett succeeded Mike Cavan as the head football coach at SMU in 2002. The context mentions that Phil Bennett was born in 1955, the same year Mike Cavan finished his tenure with a 22\u201334\u20130 record.\nCorrect Answer: B\n</output_format>",
    "question": "Who succeeded Mike Cavan as the head football coach at Southern Methodist University in 2002, and was born in the same year he finished his tenure with a 22\u201334\u20130 record?",
    "choices": {
      "A": "June Jones",
      "B": "Phil Bennett",
      "C": "Mike Cavan",
      "D": "Dan Beebe"
    },
    "answer": "B",
    "explanation": "Phil Bennett succeeded Mike Cavan as the head football coach at SMU in 2002. The context mentions that Phil Bennett was born in 1955, the same year Mike Cavan finished his tenure with a 22\u201334\u20130 record.",
    "answer_correctness_score": 10,
    "explanation_validity_score": 1,
    "question_clarity_score": 4,
    "question_difficulty_score": 6,
    "question_groundedness_score": 10,
    "question_token_count": 41,
    "reformat_question_cosine_similarity_to_orig": 0.8891526460647583,
    "reformat_answer_cosine_similarity_to_orig": 1.0,
    "reformat_question_similarity_score": 9,
    "reformat_answer_similarity_score": 10,
    "avg_answer_token_count": 3
  },
  {
    "orig_question": "Vanessa Kirby starred as Joanna in the 2013 comedy-drama about a man with what ability?",
    "orig_answer": "time travel",
    "context": "[PAR] [TLE] Vanessa Kirby [SEP] Vanessa Kirby (born 18 April 1988) is an English stage, TV and film actress.  She starred as Estella in the BBC adaptation of \"Great Expectations\" in 2011, as Joanna in Richard Curtis' romantic comedy \"About Time\" in 2013, and currently portrays Princess Margaret in Peter Morgan's Netflix series \"The Crown\", for which she has been nominated for the British Academy Television Award for Best Supporting Actress.  She is known mostly for her stage work; \" Variety\" in 2016 called her \"the outstanding stage actress of her generation, capable of the most unexpected choices\". [PAR] [TLE] About Time (2013 film) [SEP] About Time is a 2013 British romantic comedy-drama film about a young man with the special ability to time travel who tries to change his past in order to improve his future.  The film was written and directed by Richard Curtis, and stars Domhnall Gleeson, Rachel McAdams and Bill Nighy.  It was released in the United Kingdom on 4 September 2013.",
    "response": "<document_analysis>\nTo generate a question that is semantically equivalent to the original, I will analyze the provided context, question, and answer. The context provides information about Vanessa Kirby and the film \"About Time.\" The original question asks about the ability of the man in the 2013 comedy-drama film in which Vanessa Kirby starred as Joanna. The answer is \"time travel.\"\n\nFirst, I will identify the central idea: Vanessa Kirby starred in \"About Time,\" a 2013 film about a man with a special ability. The context informs us that the film is a romantic comedy-drama and that the man's special ability is \"time travel.\"\n\nTo create a more challenging and nuanced question, I will incorporate more details from the context and ensure the question is self-contained.\n\nThought process:\n1. Identify key elements: Vanessa Kirby, \"About Time,\" 2013, comedy-drama, special ability.\n2. Understand the context: The film \"About Time\" is directed by Richard Curtis and involves a young man with a special ability to change his past.\n3. Formulate a question that includes relevant details and requires deep understanding.\n\nThe original question is straightforward but lacks some context. I will rephrase it to include more details and make it more challenging while maintaining clarity.\n\n</document_analysis>\n\n<output_format>\nQuestion: In the 2013 British romantic comedy-drama film \"About Time,\" directed by Richard Curtis, what special ability does the young man, portrayed by Domhnall Gleeson, possess, in which Vanessa Kirby starred as Joanna?\nA: Telekinesis\nB: Invisibility\nC: Time travel\nD: Mind reading\nExplanation: The film \"About Time\" revolves around a young man who can travel through time to change his past and improve his future.\nCorrect Answer: C\n</output_format>",
    "question": "In the 2013 British romantic comedy-drama film \"About Time,\" directed by Richard Curtis, what special ability does the young man, portrayed by Domhnall Gleeson, possess, in which Vanessa Kirby starred as Joanna?",
    "choices": {
      "A": "Telekinesis",
      "B": "Invisibility",
      "C": "Time travel",
      "D": "Mind reading"
    },
    "answer": "C",
    "explanation": "The film \"About Time\" revolves around a young man who can travel through time to change his past and improve his future.",
    "answer_correctness_score": 10,
    "explanation_validity_score": 10,
    "question_clarity_score": 6,
    "question_difficulty_score": 2,
    "question_groundedness_score": 10,
    "question_token_count": 47,
    "reformat_question_cosine_similarity_to_orig": 0.6350674629211426,
    "reformat_answer_cosine_similarity_to_orig": 1.0,
    "reformat_question_similarity_score": 9,
    "reformat_answer_similarity_score": 10,
    "avg_answer_token_count": 3
  },
  {
    "orig_question": "Thundershorts is a short-form comedy website featuring what comedian who serves as the co-anchor on \"Weekend Update\"?",
    "orig_answer": "Michael Che",
    "context": "[PAR] [TLE] Thundershorts [SEP] Thundershorts is a short-form comedy website founded in June 2014.  It features comedians such as Michael Showalter, Jim Gaffigan, Michael Che, Janeane Garofalo, Kumail Nanjiani, David Wain and Ted Alexandro. [PAR] [TLE] Michael Che [SEP] Michael Che (born Michael Che Campbell; May 19, 1983) is an American stand-up comedian and writer best known for his work on \"Saturday Night Live\", where he serves as co-anchor on \"Weekend Update\".",
    "response": "<document_analysis>\nTo generate a meaningful question-answer pair, I will first analyze the given context. The context provides information about Thundershorts, a short-form comedy website, and Michael Che, an American stand-up comedian. The key details are that Thundershorts features various comedians, including Michael Che, and that Michael Che is known for his work on \"Saturday Night Live\" as a co-anchor on \"Weekend Update\".\n\n1. **Thoughtful Content Examination**: The context mentions Thundershorts and lists comedians associated with it, including Michael Che. It then provides more details about Michael Che's work on \"Saturday Night Live\". The central idea is to understand the connection between Thundershorts and comedians like Michael Che.\n\n2. **Concept Exploration**: The implicit assumption is that Thundershorts is a platform that showcases a variety of comedians. The subtle detail is that Michael Che's prominence on \"Saturday Night Live\" makes him a notable figure associated with Thundershorts.\n\n3. **Strategic Complexity Calibration**: The original question is straightforward and identifies a specific comedian associated with Thundershorts who also works on \"Saturday Night Live\". To increase complexity, the question could be rephrased to require more nuanced understanding or additional information from the context.\n\n4. **Intentional Question Planning**: The goal is to create a question that invites deeper understanding or critical engagement. Instead of directly asking for a comedian's name, the question could be framed to test understanding of the relationship between Thundershorts and notable comedians or the characteristics of comedians featured on Thundershorts.\n\nGiven the context and the original question, I will rephrase and rewrite the question to enhance clarity, complexity, and engagement while ensuring it remains semantically equivalent to the original.\n\n</document_analysis>\n\n<output_format>\nQuestion: Which comedian, known for co-anchoring \"Weekend Update\" on \"Saturday Night Live\", is among the list of comedians featured on Thundershorts, a short-form comedy website established in June 2014?\nA: Jim Gaffigan\nB: Michael Che\nC: Kumail Nanjiani\nD: David Wain\n\nExplanation: The correct answer is Michael Che because he is specifically mentioned as co-anchoring \"Weekend Update\" on \"Saturday Night Live\" and is listed among the comedians featured on Thundershorts.\n\nCorrect Answer: B\n</output_format>",
    "question": "Which comedian, known for co-anchoring \"Weekend Update\" on \"Saturday Night Live\", is among the list of comedians featured on Thundershorts, a short-form comedy website established in June 2014?",
    "choices": {
      "A": "Jim Gaffigan",
      "B": "Michael Che",
      "C": "Kumail Nanjiani",
      "D": "David Wain"
    },
    "answer": "B",
    "explanation": "The correct answer is Michael Che because he is specifically mentioned as co-anchoring \"Weekend Update\" on \"Saturday Night Live\" and is listed among the comedians featured on Thundershorts.",
    "answer_correctness_score": 10,
    "explanation_validity_score": 10,
    "question_clarity_score": 8,
    "question_difficulty_score": 6,
    "question_groundedness_score": 10,
    "question_token_count": 48,
    "reformat_question_cosine_similarity_to_orig": 0.9064688682556152,
    "reformat_answer_cosine_similarity_to_orig": 1.000000238418579,
    "reformat_question_similarity_score": 10,
    "reformat_answer_similarity_score": 10,
    "avg_answer_token_count": 4
  },
  {
    "orig_question": "William Frederick Truax was traded by the Los Angeles Rams to the Dallas Cowboys for a wide receiver who played college football at what university?",
    "orig_answer": "University of Oklahoma",
    "context": "[PAR] [TLE] Billy Truax [SEP] William Frederick Truax (born July 15, 1943) is a former professional American football tight end in the National Football League (NFL) from 1964 to 1973 for the Los Angeles Rams and the Dallas Cowboys.  He played in high school at Holy Cross in New Orleans and college football at Louisiana State University and was drafted in the second round of the 1964 NFL draft.  Following the 1970 NFL season, Truax was traded by the Rams to the Cowboys for wide receiver Lance Rentzel.  He was part of the Cowboys' Super Bowl VI championship team in 1971. [PAR] [TLE] Lance Rentzel [SEP] Thomas Lance Rentzel (born October 14, 1943) is a former American football flanker in the National Football League (NFL) for the Minnesota Vikings, Dallas Cowboys and the Los Angeles Rams.  He played college football at the University of Oklahoma.",
    "response": "<document_analysis>\nTo address this task, I will first analyze the given context to understand the information provided about Billy Truax and Lance Rentzel. The context provides details about their careers in the NFL, including the teams they played for and the transactions involving them.\n\n1. **Thoughtful Content Examination**: The context informs us that Billy Truax was traded by the Los Angeles Rams to the Dallas Cowboys for Lance Rentzel. It also tells us that Lance Rentzel played college football at the University of Oklahoma.\n\n2. **Concept Exploration**: The key concept here involves understanding the transaction between the Los Angeles Rams and the Dallas Cowboys, specifically that Billy Truax was traded for Lance Rentzel. The relevant detail for answering the question is Lance Rentzel's college football background.\n\n3. **Strategic Complexity Calibration**: The question requires the test-taker to connect the information about the trade involving Billy Truax and Lance Rentzel with the educational background of Lance Rentzel. This involves understanding the transaction and the details about the individuals involved. The difficulty level is moderate, around 6 out of 10, as it requires linking two pieces of information from the context.\n\n4. **Intentional Question Planning**: The question is designed to test the ability to understand and connect different pieces of information within the context. It requires the test-taker to demonstrate an understanding of the transaction between the two NFL teams and the relevant background information on the player involved in the trade.\n\nThe given question and answer are semantically clear and directly related to the information provided in the context. The question asks for the university at which Lance Rentzel played college football, given that he was the wide receiver for whom Billy Truax was traded. The answer correctly identifies this as the University of Oklahoma.\n\nTo rephrase and reformat the question and answer according to the guidelines, I will ensure that the new question is semantically equivalent to the original but reworded for clarity and complexity. The answer will remain semantically equivalent.\n\n</document_analysis>\n\n<output_format>\nQuestion: In the trade that sent William Frederick Truax to the Dallas Cowboys, the Los Angeles Rams received wide receiver Lance Rentzel, who had played college football at which institution?\nA: Louisiana State University\nB: University of Oklahoma\nC: University of Texas\nD: University of Arkansas\n\nExplanation: The correct answer is the University of Oklahoma because Lance Rentzel, the wide receiver received by the Los Angeles Rams in the trade for Billy Truax, played college football there.\n\nCorrect Answer: B\n</output_format>",
    "question": "In the trade that sent William Frederick Truax to the Dallas Cowboys, the Los Angeles Rams received wide receiver Lance Rentzel, who had played college football at which institution?",
    "choices": {
      "A": "Louisiana State University",
      "B": "University of Oklahoma",
      "C": "University of Texas",
      "D": "University of Arkansas"
    },
    "answer": "B",
    "explanation": "The correct answer is the University of Oklahoma because Lance Rentzel, the wide receiver received by the Los Angeles Rams in the trade for Billy Truax, played college football there.",
    "answer_correctness_score": 10,
    "explanation_validity_score": 10,
    "question_clarity_score": 6,
    "question_difficulty_score": 5,
    "question_groundedness_score": 10,
    "question_token_count": 35,
    "reformat_question_cosine_similarity_to_orig": 0.8487486243247986,
    "reformat_answer_cosine_similarity_to_orig": 1.0,
    "reformat_question_similarity_score": 9,
    "reformat_answer_similarity_score": 10,
    "avg_answer_token_count": 4
  },
  {
    "orig_question": "Which French comedy is written by Dean Craig and produced by Partizan Midi-Minuit?",
    "orig_answer": "Moonwalkers",
    "context": "[PAR] [TLE] Moonwalkers (film) [SEP] Moonwalkers is a 2015 French comedy film directed by Antoine Bardou-Jacquet in his directorial debut, and written by Dean Craig.  The film stars Ron Perlman, Rupert Grint, and Robert Sheehan.  The film is based on Moon landing conspiracy theories.  The film had its world premiere at SXSW on March 14, 2015.  The film was released on January 15, 2016, in a limited release and through video on demand by Alchemy. [PAR] [TLE] Partizan Midi-Minuit [SEP] Partizan Midi-Minuit is a French company, which produced videos such as the multi-award-winning \"Cog\" television advertisement for the Honda Accord, the 2004 ads for 7-Up, featuring Fido Dido, music video for U2's Vertigo.  and the 2016 film \"Moonwalkers\".",
    "response": "<document_analysis>\nTo address this task, I will start by analyzing the given context, question, and answer. The context provides information about a film titled \"Moonwalkers\" and a French company named \"Partizan Midi-Minuit.\" The question asks for the identification of a French comedy written by Dean Craig and produced by Partizan Midi-Minuit. The answer provided is \"Moonwalkers.\"\n\n1. **Thoughtful Content Examination**: The context informs us that \"Moonwalkers\" is a 2015 French comedy film directed by Antoine Bardou-Jacquet and written by Dean Craig. It also mentions that \"Moonwalkers\" was produced by Partizan Midi-Minuit, a French company known for producing various advertisements and music videos.\n\n2. **Concept Exploration**: The key concepts here involve identifying the film \"Moonwalkers\" and its production details. The context establishes a clear link between \"Moonwalkers,\" its writer Dean Craig, and its producer Partizan Midi-Minuit.\n\n3. **Strategic Complexity Calibration**: The difficulty level of the question is moderate. It requires the test-taker to connect the dots between the film's title, its writer, and its producer. I would rate this difficulty as a 6 out of 10 because it involves a straightforward retrieval of information but requires some basic understanding of the context.\n\n4. **Intentional Question Planning**: The original question is direct and factual. To enhance it, I can rephrase it to encourage deeper understanding or critical engagement while maintaining its core requirement.\n\nUpon analyzing the given information and the original question, I find that the question is clear and directly answerable based on the context. The task now is to rephrase and reformat it according to the provided guidelines.\n\n</document_analysis>\n\n<output_format>\nQuestion: Identify the French comedy film, released in 2015, that was written by Dean Craig and produced by the French production company Partizan Midi-Minuit, known for creating various award-winning advertisements.\nA: Am\u00e9lie\nB: Moonwalkers\nC: La Haine\nD: The Intouchables\n\nExplanation: The correct answer is \"Moonwalkers\" because it is identified in the context as a French comedy film written by Dean Craig and produced by Partizan Midi-Minuit.\n\nCorrect Answer: B\n</output_format>",
    "question": "Identify the French comedy film, released in 2015, that was written by Dean Craig and produced by the French production company Partizan Midi-Minuit, known for creating various award-winning advertisements.",
    "choices": {
      "A": "Am\u00e9lie",
      "B": "Moonwalkers",
      "C": "La Haine",
      "D": "The Intouchables"
    },
    "answer": "B",
    "explanation": "The correct answer is \"Moonwalkers\" because it is identified in the context as a French comedy film written by Dean Craig and produced by Partizan Midi-Minuit.",
    "answer_correctness_score": 10,
    "explanation_validity_score": 10,
    "question_clarity_score": 4,
    "question_difficulty_score": 6,
    "question_groundedness_score": 8,
    "question_token_count": 40,
    "reformat_question_cosine_similarity_to_orig": 0.7702211141586304,
    "reformat_answer_cosine_similarity_to_orig": 0.9999998807907104,
    "reformat_question_similarity_score": 9,
    "reformat_answer_similarity_score": 10,
    "avg_answer_token_count": 4
  },
  {
    "orig_question": "In what city did Frank Fertitta III found his current company?",
    "orig_answer": "Las Vegas",
    "context": "[PAR] [TLE] Frank Fertitta III [SEP] Frank Joseph Fertitta III (born February 24, 1962) is an American entrepreneur.  He is the current CEO of Station Casinos.  He is also an owner of Zuffa LLC, which is the entity that formerly ran the Ultimate Fighting Championship (UFC). [PAR] [TLE] Zuffa [SEP] Zuffa, LLC ( ) is an American sports promotion company specializing in mixed martial arts.  It was founded in January 2001 in Las Vegas, Nevada, by Station Casinos executives Frank Fertitta III and Lorenzo Fertitta to be the parent entity of the Ultimate Fighting Championship (UFC) after they purchased it from the Semaphore Entertainment Group.  The word \"Zuffa\" is an Italian word (] ), meaning \"fight\".  On July 11, 2016, Zuffa announced that it would be purchased by WME-IMG for the price of $4 billion.",
    "response": "<document_analysis>\nTo address the task, I will start by analyzing the given context, question, and answer.\n\n1. **Thoughtful Content Examination**: The context provides information about Frank Fertitta III and his association with various companies, notably Station Casinos and Zuffa LLC, which was the parent entity of the Ultimate Fighting Championship (UFC). It mentions that Zuffa was founded in Las Vegas by Frank Fertitta III and his brother Lorenzo Fertitta.\n\n2. **Concept Exploration**: The context implies that Frank Fertitta III is a significant figure in the sports promotion industry, particularly in mixed martial arts through his involvement with the UFC. It highlights his entrepreneurial ventures, specifically the founding of Zuffa in Las Vegas.\n\n3. **Strategic Complexity Calibration**: The original question asks for the city where Frank Fertitta III founded his current company. The answer provided is \"Las Vegas.\" To calibrate complexity, we need to ensure the question is challenging yet answerable by a domain expert. The current company referred to is Station Casinos, but the context more prominently discusses Zuffa and its founding in Las Vegas. This requires careful rephrasing to maintain clarity and accuracy.\n\n4. **Intentional Question Planning**: The question should invite deeper understanding or critical engagement. Instead of directly asking for the city where Frank Fertitta III founded his current company (Station Casinos), we could explore related details that demonstrate a deeper understanding of the context.\n\nUpon analysis, it's clear that the original question might be slightly misleading because Frank Fertitta III is currently the CEO of Station Casinos, but the context more directly associates him with founding Zuffa in Las Vegas. A more nuanced question would clarify which company is being referred to.\n\nThe thought process involves rephrasing the question to ensure it is clear, challenging, and answerable based on the context provided, while also ensuring it does not directly reference the context.\n\n</document_analysis>\n\n<output_format>\nQuestion: In which city was Zuffa, LLC, the former parent entity of the Ultimate Fighting Championship, founded by Frank Fertitta III and his brother Lorenzo Fertitta?\nA: New York City\nB: Los Angeles\nC: Las Vegas\nD: Chicago\nExplanation: The context states that Zuffa, LLC, was founded in January 2001 in Las Vegas, Nevada, by Station Casinos executives Frank Fertitta III and Lorenzo Fertitta.\nCorrect Answer: C\n</output_format>\n\nThis revised question is more specific, clear, and directly related to the information provided in the context. It tests the domain expert's ability to recall specific details about the founding of Zuffa, LLC, and its association with the Fertitta brothers. The answer options are distinct and unambiguous, and the correct answer, \"Las Vegas,\" is directly supported by the context.",
    "question": "In which city was Zuffa, LLC, the former parent entity of the Ultimate Fighting Championship, founded by Frank Fertitta III and his brother Lorenzo Fertitta?",
    "choices": {
      "A": "New York City",
      "B": "Los Angeles",
      "C": "Las Vegas",
      "D": "Chicago"
    },
    "answer": "C",
    "explanation": "The context states that Zuffa, LLC, was founded in January 2001 in Las Vegas, Nevada, by Station Casinos executives Frank Fertitta III and Lorenzo Fertitta.",
    "answer_correctness_score": 10,
    "explanation_validity_score": 10,
    "question_clarity_score": 8,
    "question_difficulty_score": 2,
    "question_groundedness_score": 8,
    "question_token_count": 34,
    "reformat_question_cosine_similarity_to_orig": 0.5333711504936218,
    "reformat_answer_cosine_similarity_to_orig": 1.000000238418579,
    "reformat_question_similarity_score": 4,
    "reformat_answer_similarity_score": 10,
    "avg_answer_token_count": 3
  },
  {
    "orig_question": "How many terms are the judges allowed per the Independent Counsel Act?",
    "orig_answer": "2-year terms",
    "context": "[PAR] [TLE] Special Division [SEP] The Special Division is a division of the United States Court of Appeals for the District of Columbia Circuit.  28 U.S.C. \u00a7 49 (1982 ed., Supp.  V) (Title VI of the Ethics in Government Act).  It consists of three circuit court judges or justices appointed by the Chief Justice of the United States.  One of the judges must be a judge of the DC Circuit, and no two of the judges may be named to the Special Division from a particular court.  The judges are appointed for 2-year terms, with any vacancy being filled only for the remainder of the 2-year period.  Its constitutionality was upheld in Morrison v. Olson. [PAR] [TLE] Morrison v. Olson [SEP] Morrison v. Olson, 487 U.S. 654 (1988) , is a United States federal court case in which the Supreme Court of the United States decided that the Independent Counsel Act was constitutional.",
    "response": "<document_analysis>\nTo address the task, let's first analyze the given context, question, and answer.\n\n1. **Thoughtful Content Examination**: The context discusses the Special Division, a part of the United States Court of Appeals for the District of Columbia Circuit, and its constitutionality as upheld in Morrison v. Olson. It mentions that judges are appointed for 2-year terms.\n\n2. **Concept Exploration**: The key concept here is the term length of judges appointed to the Special Division. The context explicitly states that these judges are appointed for 2-year terms.\n\n3. **Strategic Complexity Calibration**: The original question is straightforward and seeks factual information. To increase complexity, we can rephrase it to require a deeper understanding or application of the information.\n\n4. **Intentional Question Planning**: We can formulate a question that not only tests the recall of the term length but also understands the implications or the context in which this term length is significant.\n\nUpon analysis, it's clear that the context provides specific details about the appointment terms of judges to the Special Division. The question and answer provided are straightforward, focusing on the term length.\n\nTo enhance the question's complexity and encourage deeper understanding, we can rephrase it while maintaining semantic equivalence.\n\n</document_analysis>\n\n<output_format>\nQuestion: What is the duration of the term for which judges are appointed to the Special Division as stipulated by the relevant statutory provisions governing their appointment?\nA: 1-year term\nB: 2-year term\nC: 5-year term\nD: Lifetime appointment\nExplanation: The context clearly states that the judges are appointed for 2-year terms, as mentioned in the passage about the Special Division.\nCorrect Answer: B\n</output_format>\n\nThis rephrased question maintains the core inquiry about the term length while presenting it in a more detailed and formal manner. The answer options are distinct and unambiguous, with the correct answer being \"2-year term,\" corresponding to option B.",
    "question": "What is the duration of the term for which judges are appointed to the Special Division as stipulated by the relevant statutory provisions governing their appointment?",
    "choices": {
      "A": "1-year term",
      "B": "2-year term",
      "C": "5-year term",
      "D": "Lifetime appointment"
    },
    "answer": "B",
    "explanation": "The context clearly states that the judges are appointed for 2-year terms, as mentioned in the passage about the Special Division.",
    "answer_correctness_score": 10,
    "explanation_validity_score": 10,
    "question_clarity_score": 7,
    "question_difficulty_score": 5,
    "question_groundedness_score": 10,
    "question_token_count": 29,
    "reformat_question_cosine_similarity_to_orig": 0.5980216860771179,
    "reformat_answer_cosine_similarity_to_orig": 0.9491177201271057,
    "reformat_question_similarity_score": 9,
    "reformat_answer_similarity_score": 10,
    "avg_answer_token_count": 3
  },
  {
    "orig_question": "What is the name of the former lawyer and entrepreneur who was convicted for conspiracy and drug dealing and was a part of Paul v. Clinton?",
    "orig_answer": "Peter F. Paul",
    "context": "[PAR] [TLE] Paul v. Clinton [SEP] Paul v. Clinton was a civil suit filed in 2004 held in Los Angeles County Superior Court.  The plaintiff, Peter F. Paul, alleged that President Bill Clinton and his wife, First Lady Hillary Clinton, deceived him into paying for the Gala Hollywood Farewell Salute to President Clinton, during Hillary Clinton's first Senate race in 2000, by making a promise that the President would work for Paul's company, Stan Lee Media, after his presidential term was over.  Paul alleged that the President broke his promise and stole his business partner, causing his business to crumble and, further, that his contributions to Hillary Clinton's campaign were falsely reported to the Federal Election Commission.  Besides the Clintons, three other individuals who were involved in fundraising for the gala, were named as defendants in the suit. [PAR] [TLE] Peter F. Paul [SEP] Peter Franklin Paul (born September 2, 1948) is a former lawyer and entrepreneur who was convicted for conspiracy and drug dealing, and later for securities fraud in connection with his business dealings with \"Spider-Man\" co-creator Stan Lee.  He has repeatedly brought suit against Hillary Clinton, accusing her of lying about donations he solicited on behalf of her 2000 senatorial campaign.",
    "response": "<document_analysis>\nThe given context revolves around the case of Paul v. Clinton, a civil suit filed in 2004, and provides background information on the plaintiff, Peter F. Paul. The context details the allegations made by Paul against President Bill Clinton and First Lady Hillary Clinton regarding a gala event and its connection to Paul's business dealings. It also mentions Paul's criminal convictions and his history of litigation against Hillary Clinton.\n\nTo generate a question that is semantically equivalent to the original, I will analyze the given question and answer. The original question asks for the name of the former lawyer and entrepreneur involved in Paul v. Clinton, who was convicted for conspiracy and drug dealing. The answer provided is \"Peter F. Paul.\"\n\nUpon examination, it's clear that the context contains sufficient information to identify Peter F. Paul as the individual in question. The context mentions his background, his involvement in the lawsuit against the Clintons, and his criminal convictions.\n\nTo create a more challenging and nuanced question, I will rephrase the original question while maintaining its semantic equivalence. The rephrased question will incorporate more details from the context to ensure it is self-contained and requires a deeper understanding of the subject matter.\n\n</document_analysis>\n\n<output_format>\nQuestion: Who is the individual that filed the civil suit Paul v. Clinton in 2004 and had previous convictions for conspiracy, drug dealing, and later securities fraud in connection with his business dealings with \"Spider-Man\" co-creator Stan Lee?\nA: Bill Clinton\nB: Peter F. Paul\nC: Stan Lee\nD: Hillary Clinton\n\nExplanation: The correct answer is Peter F. Paul because he is identified in the context as the plaintiff in the Paul v. Clinton case and is described as having been convicted for conspiracy, drug dealing, and securities fraud related to his business dealings with Stan Lee.\n\nCorrect Answer: B\n</output_format>",
    "question": "Who is the individual that filed the civil suit Paul v. Clinton in 2004 and had previous convictions for conspiracy, drug dealing, and later securities fraud in connection with his business dealings with \"Spider-Man\" co-creator Stan Lee?",
    "choices": {
      "A": "Bill Clinton",
      "B": "Peter F. Paul",
      "C": "Stan Lee",
      "D": "Hillary Clinton"
    },
    "answer": "B",
    "explanation": "The correct answer is Peter F. Paul because he is identified in the context as the plaintiff in the Paul v. Clinton case and is described as having been convicted for conspiracy, drug dealing, and securities fraud related to his business dealings with Stan Lee.",
    "answer_correctness_score": 10,
    "explanation_validity_score": 10,
    "question_clarity_score": 6,
    "question_difficulty_score": 7,
    "question_groundedness_score": 10,
    "question_token_count": 50,
    "reformat_question_cosine_similarity_to_orig": 0.7322304248809814,
    "reformat_answer_cosine_similarity_to_orig": 1.0000001192092896,
    "reformat_question_similarity_score": 9,
    "reformat_answer_similarity_score": 10,
    "avg_answer_token_count": 3
  },
  {
    "orig_question": "What sport do both Billy Truax and Lance Rentzel have in common?",
    "orig_answer": "football",
    "context": "[PAR] [TLE] Billy Truax [SEP] William Frederick Truax (born July 15, 1943) is a former professional American football tight end in the National Football League (NFL) from 1964 to 1973 for the Los Angeles Rams and the Dallas Cowboys.  He played in high school at Holy Cross in New Orleans and college football at Louisiana State University and was drafted in the second round of the 1964 NFL draft.  Following the 1970 NFL season, Truax was traded by the Rams to the Cowboys for wide receiver Lance Rentzel.  He was part of the Cowboys' Super Bowl VI championship team in 1971. [PAR] [TLE] Lance Rentzel [SEP] Thomas Lance Rentzel (born October 14, 1943) is a former American football flanker in the National Football League (NFL) for the Minnesota Vikings, Dallas Cowboys and the Los Angeles Rams.  He played college football at the University of Oklahoma.",
    "response": "<document_analysis>\nTo address the task, I first analyze the given context, question, and answer. The context provides biographical information about two former NFL players, Billy Truax and Lance Rentzel, detailing their careers and achievements in American football. The question asks for the common sport between the two individuals, and the answer provided is \"football.\"\n\n1. **Thoughtful Content Examination**: The context highlights the careers of Billy Truax and Lance Rentzel in the NFL, specifying their positions and the teams they played for. It is clear that both were involved in professional American football.\n\n2. **Concept Exploration**: The information implies that both individuals are associated with American football, given their NFL careers. The question seeks to identify this commonality.\n\n3. **Strategic Complexity Calibration**: The original question is straightforward and might be considered simple (difficulty level: 2). To increase complexity, the question could be rephrased to require more nuanced understanding or additional information from the context.\n\n4. **Intentional Question Planning**: To create a more challenging and thoughtful question, I will rephrase it to incorporate more details from the context, making it more specific and requiring deeper understanding.\n\nUpon analyzing the context and the original question-answer pair, I determine that rephrasing the question to include more specific details about the individuals' careers will enhance its complexity and educational value.\n\n</document_analysis>\n\n<output_format>\nQuestion: What professional sport did Billy Truax and Lance Rentzel both play in the National Football League, with Truax playing for the Los Angeles Rams and Dallas Cowboys, and Rentzel playing for the Minnesota Vikings, Dallas Cowboys, and Los Angeles Rams?\nA: Basketball\nB: Baseball\nC: Football\nD: Hockey\nExplanation: Both Billy Truax and Lance Rentzel were players in the NFL, with Truax serving as a tight end and Rentzel as a flanker, indicating their involvement in professional football.\nCorrect Answer: C\n</output_format>\n\nThis revised question incorporates details from the context to make it more specific and challenging while maintaining semantic equivalence with the original question. The answer options are distinct and unambiguous, and the correct answer, \"Football,\" is represented by option C.",
    "question": "What professional sport did Billy Truax and Lance Rentzel both play in the National Football League, with Truax playing for the Los Angeles Rams and Dallas Cowboys, and Rentzel playing for the Minnesota Vikings, Dallas Cowboys, and Los Angeles Rams?",
    "choices": {
      "A": "Basketball",
      "B": "Baseball",
      "C": "Football",
      "D": "Hockey"
    },
    "answer": "C",
    "explanation": "Both Billy Truax and Lance Rentzel were players in the NFL, with Truax serving as a tight end and Rentzel as a flanker, indicating their involvement in professional football.",
    "answer_correctness_score": 10,
    "explanation_validity_score": 10,
    "question_clarity_score": 6,
    "question_difficulty_score": 2,
    "question_groundedness_score": 8,
    "question_token_count": 50,
    "reformat_question_cosine_similarity_to_orig": 0.7818505167961121,
    "reformat_answer_cosine_similarity_to_orig": 1.000000238418579,
    "reformat_question_similarity_score": 8,
    "reformat_answer_similarity_score": 10,
    "avg_answer_token_count": 2
  },
  {
    "orig_question": "When was the English professional footballer born who plays as a winger for Premier League club Manchester United born who made Manchester United won the match 2\u20131 with goals?",
    "orig_answer": "15 December 1992",
    "context": "[PAR] [TLE] Jesse Lingard [SEP] Jesse Ellis Lingard (born 15 December 1992) is an English professional footballer who plays as a winger for Premier League club Manchester United and the England national team. [PAR] [TLE] 2016 FA Community Shield [SEP] The 2016 FA Community Shield (also known as the 2016 FA Community Shield supported by McDonald's for sponsorship reasons) was the 94th FA Community Shield, an annual English football match played between the winners of the previous season's Premier League and FA Cup.  The match was contested by 2015\u201316 FA Cup winners Manchester United, and Leicester City, champions of the 2015\u201316 Premier League.  It was held at Wembley Stadium a week before the Premier League season kicked off.  Manchester United won the match 2\u20131 with goals from Jesse Lingard and Zlatan Ibrahimovi\u0107, either side of a goal from Leicester striker Jamie Vardy.",
    "response": "<document_analysis>\nThe given context provides information about Jesse Lingard, an English professional footballer, and the 2016 FA Community Shield match. The question is asking for Jesse Lingard's birthdate, which is relevant to the information provided about him. \n\nFirst, let's analyze the context and identify the central idea: Jesse Lingard is an English footballer who plays for Manchester United, and he scored a goal in the 2016 FA Community Shield. The context also mentions the details of the 2016 FA Community Shield match.\n\nUpon closer examination, it becomes clear that the question contains some redundant and potentially confusing information. It is essential to rephrase the question to make it clearer and more concise while maintaining its original intent.\n\nThe original question is: \"When was the English professional footballer born who plays as a winger for Premier League club Manchester United born who made Manchester United won the match 2\u20131 with goals?\"\n\nThis question can be simplified by removing the redundant information and focusing on the essential details. The relevant information is that Jesse Lingard is the footballer in question, and his birthdate is required.\n\nThe answer provided is \"15 December 1992,\" which is Jesse Lingard's birthdate according to the context.\n\nTo create a more challenging and nuanced question, we can rephrase it to focus on the specific details provided in the context.\n\n</document_analysis>\n\n<output_format>\nQuestion: What is the birthdate of Jesse Lingard, the English professional footballer who scored a goal for Manchester United in their 2\u20131 victory over Leicester City in the 2016 FA Community Shield?\nA: 15 December 1991\nB: 15 December 1992\nC: 12 January 1992\nD: 20 December 1993\nExplanation: The correct birthdate of Jesse Lingard is 15 December 1992, as mentioned in the context provided.\nCorrect Answer: B\n</output_format>\n\nThought process:\n1. Identify the main subject: Jesse Lingard.\n2. Identify the required information: Jesse Lingard's birthdate.\n3. Simplify the question by removing redundant information and focusing on essential details.\n4. Rephrase the question to make it clearer and more challenging.\n5. Ensure the question is answerable by a domain expert without the context paragraph.\n6. Verify that the answer options are distinct and unambiguous.\n7. Confirm that the correct answer is present among the options.",
    "question": "What is the birthdate of Jesse Lingard, the English professional footballer who scored a goal for Manchester United in their 2\u20131 victory over Leicester City in the 2016 FA Community Shield?",
    "choices": {
      "A": "15 December 1991",
      "B": "15 December 1992",
      "C": "12 January 1992",
      "D": "20 December 1993"
    },
    "answer": "B",
    "explanation": "The correct birthdate of Jesse Lingard is 15 December 1992, as mentioned in the context provided.",
    "answer_correctness_score": 10,
    "explanation_validity_score": 10,
    "question_clarity_score": 8,
    "question_difficulty_score": 4,
    "question_groundedness_score": 10,
    "question_token_count": 42,
    "reformat_question_cosine_similarity_to_orig": 0.6968813538551331,
    "reformat_answer_cosine_similarity_to_orig": 1.0,
    "reformat_question_similarity_score": 9,
    "reformat_answer_similarity_score": 10,
    "avg_answer_token_count": 6
  },
  {
    "orig_question": "What company does one of the daughters of the actress who played Norma Jennings in \"Twin Peaks\" design a clothing line for?",
    "orig_answer": "The Walt Disney Company",
    "context": "[PAR] [TLE] Kidada Jones [SEP] Kidada Ann Jones (born March 22, 1974) is an American actress, model and fashion designer.  Jones is best known for her work as a designer for The Walt Disney Company, where she has a line known as Kidada for Disney Couture.  Jones is the daughter of composer Quincy Jones and actress Peggy Lipton. [PAR] [TLE] Peggy Lipton [SEP] Margaret Ann \"Peggy\" Lipton (born August 30, 1946) is an American actress and former model.  Lipton became an overnight success through her best-known role as flower child Julie Barnes in the ABC counterculture television series \"The Mod Squad\" (1968\u20131973) for which she won the Golden Globe Award for Best Actress \u2013 Television Series Drama in 1970.  Her fifty-year career in television, film, and on stage included many roles, most notably that of Norma Jennings in David Lynch's surreal \"Twin Peaks\".  Lipton was married to the musician/producer Quincy Jones and is mother to their two daughters, Rashida Jones and Kidada Jones, who also became actresses.",
    "response": "<document_analysis>\nTo tackle this task, let's first break down the information provided in the context and analyze the question and answer given.\n\n1. **Context Analysis**:\n   - The context provides information about Kidada Jones and her mother, Peggy Lipton.\n   - Kidada Jones is an actress, model, and fashion designer known for her work with The Walt Disney Company, for which she has a clothing line known as \"Kidada for Disney Couture.\"\n   - Peggy Lipton is an actress and former model, known for her roles in \"The Mod Squad\" and \"Twin Peaks,\" where she played Norma Jennings.\n\n2. **Question and Answer Analysis**:\n   - The question asks for the company for which one of the daughters of the actress who played Norma Jennings in \"Twin Peaks\" designs a clothing line.\n   - The answer provided is \"The Walt Disney Company.\"\n\n3. **Thought Process**:\n   - The question requires linking the information about Peggy Lipton's role in \"Twin Peaks\" to her daughter Kidada Jones's work.\n   - The context confirms that Peggy Lipton played Norma Jennings in \"Twin Peaks\" and that her daughter Kidada Jones works with The Walt Disney Company as a fashion designer.\n   - The question is designed to test the ability to connect related pieces of information across different parts of the context.\n\n4. **Complexity Calibration**:\n   - The question requires understanding the relationship between Peggy Lipton and Kidada Jones and knowing Kidada's professional affiliation.\n   - The difficulty level is moderate to high because it involves connecting multiple pieces of information.\n\n5. **Rewriting the Question and Answer**:\n   - To enhance clarity and complexity, the question can be rephrased to include more details from the context, ensuring it is self-contained and challenging.\n\nGiven the above analysis, let's rephrase the question and answer while maintaining semantic equivalence.\n\n</document_analysis>\n\n<output_format>\nQuestion: Peggy Lipton, known for her iconic role as Norma Jennings in the surreal television series \"Twin Peaks,\" is the mother of Kidada Jones. What company does Kidada Jones work with as a fashion designer?\nA: Warner Bros.\nB: The Walt Disney Company\nC: Universal Studios\nD: Paramount Pictures\n\nExplanation: Kidada Jones is known for her work as a designer for The Walt Disney Company, where she has a line known as Kidada for Disney Couture.\n\nCorrect Answer: B\n</output_format>",
    "question": "Peggy Lipton, known for her iconic role as Norma Jennings in the surreal television series \"Twin Peaks,\" is the mother of Kidada Jones. What company does Kidada Jones work with as a fashion designer?",
    "choices": {
      "A": "Warner Bros.",
      "B": "The Walt Disney Company",
      "C": "Universal Studios",
      "D": "Paramount Pictures"
    },
    "answer": "B",
    "explanation": "Kidada Jones is known for her work as a designer for The Walt Disney Company, where she has a line known as Kidada for Disney Couture.",
    "answer_correctness_score": 10,
    "explanation_validity_score": 10,
    "question_clarity_score": 8,
    "question_difficulty_score": 2,
    "question_groundedness_score": 10,
    "question_token_count": 45,
    "reformat_question_cosine_similarity_to_orig": 0.7547286748886108,
    "reformat_answer_cosine_similarity_to_orig": 0.9999999403953552,
    "reformat_question_similarity_score": 9,
    "reformat_answer_similarity_score": 10,
    "avg_answer_token_count": 4
  },
  {
    "orig_question": "Who was the director of the 2013 South Korean disaster film in which Park Min-ha plays a role?",
    "orig_answer": "Kim Sung-su",
    "context": "[PAR] [TLE] Flu (film) [SEP] Flu () is a 2013 South Korean disaster film written and directed by Kim Sung-su, about an outbreak of a deadly strain of H5N1 that kills its victims within 36 hours, throwing the district of Budang in Seongnam, with a population of nearly half a million people into chaos.  It stars Jang Hyuk and Soo Ae. [PAR] [TLE] Park Min-ha (actress) [SEP] Park Min-ha (born July 2, 2007) is a South Korean actress.  Park began her career as a child actress in 2011, and has appeared in such productions as the South Korean disaster film \"Flu\" (2013), the Korean drama television series \"King of Ambition\" (2013), and the music video for K.Will's song \"Love Blossom\" (2013).  Her father is SBS anchorman Park Chan-min.",
    "response": "<document_analysis>\nTo generate a question that is semantically equivalent to the original, I will analyze the given context, question, and answer. The context provides information about a 2013 South Korean disaster film titled \"Flu\" and a child actress named Park Min-ha who appeared in it. The question asks for the director of the film \"Flu,\" in which Park Min-ha played a role. The answer provided is \"Kim Sung-su.\"\n\n1. **Thoughtful Content Examination**: The context mentions that \"Flu\" is a 2013 South Korean disaster film directed by Kim Sung-su. It also states that Park Min-ha appeared in \"Flu\" (2013). The central idea is to identify the director of the film in which Park Min-ha acted.\n\n2. **Concept Exploration**: The information about Park Min-ha's role in \"Flu\" and the details about the film's director are crucial. The underlying concept is to link the actress to the film and then to its director.\n\n3. **Strategic Complexity Calibration**: The difficulty level of the question is moderate (around 6) because it requires knowledge of both the film and the actress. However, the answer is directly available in the context.\n\n4. **Intentional Question Planning**: To create a more challenging question, I can rephrase it to require deeper understanding or more specific details from the context.\n\nUpon analyzing the context and the question, I decide to rephrase the question to maintain semantic equivalence while enhancing clarity and complexity.\n\nThe original question is: \"Who was the director of the 2013 South Korean disaster film in which Park Min-ha plays a role?\"\nThe answer is: \"Kim Sung-su\"\n\nTo rephrase, I will create a question that still seeks the director's name but frames it differently.\n\n</document_analysis>\n\n<output_format>\nQuestion: Which individual directed the South Korean disaster film \"Flu,\" a movie that featured Park Min-ha in its cast in 2013?\nA: Park Chan-min\nB: Kim Sung-su\nC: Jang Hyuk\nD: K.Will\n\nExplanation: The correct answer is Kim Sung-su because he is identified in the context as the director of the 2013 South Korean disaster film \"Flu.\" Park Min-ha is mentioned as having appeared in this film.\n\nCorrect Answer: B\n</output_format>",
    "question": "Which individual directed the South Korean disaster film \"Flu,\" a movie that featured Park Min-ha in its cast in 2013?",
    "choices": {
      "A": "Park Chan-min",
      "B": "Kim Sung-su",
      "C": "Jang Hyuk",
      "D": "K.Will"
    },
    "answer": "B",
    "explanation": "The correct answer is Kim Sung-su because he is identified in the context as the director of the 2013 South Korean disaster film \"Flu.\" Park Min-ha is mentioned as having appeared in this film.",
    "answer_correctness_score": 10,
    "explanation_validity_score": 10,
    "question_clarity_score": 8,
    "question_difficulty_score": 4,
    "question_groundedness_score": 8,
    "question_token_count": 27,
    "reformat_question_cosine_similarity_to_orig": 0.8642685413360596,
    "reformat_answer_cosine_similarity_to_orig": 1.000000238418579,
    "reformat_question_similarity_score": 10,
    "reformat_answer_similarity_score": 10,
    "avg_answer_token_count": 4
  },
  {
    "orig_question": "What is the role played by Mikel Arteta and Brian Kidd in Manchester City?",
    "orig_answer": "co-assistant coach",
    "context": "[PAR] [TLE] Mikel Arteta [SEP] Mikel Arteta Amatriain (born 26 March 1982) is a retired Spanish professional footballer who played as a midfielder.  He is currently the co-assistant coach of Manchester City, alongside fellow co-assistant Brian Kidd, Dom\u00e8nec Torrent and manager Pep Guardiola. [PAR] [TLE] Brian Kidd [SEP] Brian Kidd (born 29 May 1949) is an English football coach and former player, who is currently the co-assistant coach of Manchester City, alongside fellow co-assistants Mikel Arteta and Dom\u00e8nec Torrent, and manager Pep Guardiola.",
    "response": "<document_analysis>\nThe context provided contains information about Mikel Arteta and Brian Kidd, both associated with Manchester City. The key details are their roles and the managerial structure they are part of. Mikel Arteta is described as the co-assistant coach alongside Brian Kidd, Dom\u00e8nec Torrent, and under manager Pep Guardiola. Similarly, Brian Kidd is also mentioned as a co-assistant coach with the same colleagues and manager. The question asks for the role played by both Mikel Arteta and Brian Kidd in Manchester City. The answer given is \"co-assistant coach.\" \n\nUpon analyzing the context, it's clear that both individuals hold the same role in Manchester City's coaching staff. The information is straightforward and directly related to their current positions within the team.\n\nTo generate a more challenging and insightful question, we can rephrase the query to require a deeper understanding or a more nuanced interpretation of the provided information.\n\nThe complexity of the original question is rated as 1, as it directly asks for information explicitly stated in the context. To increase the complexity, we can frame a question that still doesn't require external knowledge but encourages a closer reading or a more thoughtful engagement with the details provided.\n\n</document_analysis>\n\n<output_format>\nQuestion: What role do Mikel Arteta and Brian Kidd share in the managerial structure of Manchester City under Pep Guardiola?\nA: Head Coach\nB: Co-assistant Coach\nC: Team Manager\nD: Assistant Manager\nExplanation: Both Mikel Arteta and Brian Kidd are described as co-assistant coaches alongside Dom\u00e8nec Torrent, working under manager Pep Guardiola at Manchester City.\nCorrect Answer: B\n</output_format>\n\nThought Process:\n1. The original question is straightforward and directly answered from the context.\n2. To increase complexity, the question is rephrased to still be answerable directly from the context but requires a slight nuance in understanding the shared role.\n3. The answer options are designed to be distinct and unambiguous, with \"Co-assistant Coach\" being the correct answer directly supported by the context.\n4. The explanation provided clarifies why \"Co-assistant Coach\" is the correct answer, referencing the context.\n5. The question is framed to be answerable by a domain expert without needing the original context paragraph, incorporating necessary details directly into the question.",
    "question": "What role do Mikel Arteta and Brian Kidd share in the managerial structure of Manchester City under Pep Guardiola?",
    "choices": {
      "A": "Head Coach",
      "B": "Co-assistant Coach",
      "C": "Team Manager",
      "D": "Assistant Manager"
    },
    "answer": "B",
    "explanation": "Both Mikel Arteta and Brian Kidd are described as co-assistant coaches alongside Dom\u00e8nec Torrent, working under manager Pep Guardiola at Manchester City.",
    "answer_correctness_score": 10,
    "explanation_validity_score": 10,
    "question_clarity_score": 8,
    "question_difficulty_score": 2,
    "question_groundedness_score": 10,
    "question_token_count": 24,
    "reformat_question_cosine_similarity_to_orig": 0.8061521053314209,
    "reformat_answer_cosine_similarity_to_orig": 1.000000238418579,
    "reformat_question_similarity_score": 9,
    "reformat_answer_similarity_score": 10,
    "avg_answer_token_count": 3
  },
  {
    "orig_question": "What American football defensive tackle for the Tampa Bay Buccaneers who played college football at Oklahoma, was third overall pick in the club's 35th season as a franchise in the NFL?",
    "orig_answer": "Gerald Keith McCoy Jr.",
    "context": "[PAR] [TLE] 2010 Tampa Bay Buccaneers season [SEP] The 2010 Tampa Bay Buccaneers season was the club's 35th season as a franchise in the NFL.  The Buccaneers entered the season attempting to improve on their 3\u201313 record and last place finish in the NFC South in 2009, a feat they accomplished after only six games.  The Buccaneers achieved the best turnaround in franchise history and became the first team since the NFL merger in 1970 to start 10 rookies and achieve a winning season.  Raheem Morris spent his second season as head coach.  The Buccaneers had the third overall pick in the 2010 NFL Draft, with which they selected Gerald McCoy. [PAR] [TLE] Gerald McCoy [SEP] Gerald Keith McCoy Jr. (born February 25, 1988) is an American football defensive tackle for the Tampa Bay Buccaneers of the National Football League (NFL).  He played college football at Oklahoma, where he earned consensus All-American honors, and was drafted by the Buccaneers third overall in the 2010 NFL Draft.  Since joining the Buccaneers and the NFL, he has been selected to the Pro Bowl five consecutive years.",
    "response": "<document_analysis>\nTo address this task, I will start by analyzing the provided context, question, and answer to identify the central ideas and significant relationships within the text.\n\n1. **Thoughtful Content Examination**: The context discusses the 2010 Tampa Bay Buccaneers season and Gerald McCoy, an American football defensive tackle. Key points include the Buccaneers' improvement from a 3-13 record, their selection of Gerald McCoy in the 2010 NFL Draft with the third overall pick, and McCoy's background playing college football at Oklahoma.\n\n2. **Concept Exploration**: The context highlights the significance of Gerald McCoy to the Buccaneers, his draft position, and his achievements. It also touches upon the team's performance and the head coach during that season.\n\n3. **Strategic Complexity Calibration**: The original question requires a factual recall of Gerald McCoy's identity based on specific details. To increase complexity, the question could be rephrased to require more analytical or conceptual understanding.\n\n4. **Intentional Question Planning**: The rewritten question should invite deeper understanding or critical engagement. For instance, it could explore the implications of the Buccaneers' draft choice or McCoy's background.\n\nUpon examination, the original question and answer are straightforward, focusing on identifying Gerald McCoy based on the given details. The context provides sufficient information to answer the question directly.\n\nTo create a more challenging and thought-provoking question, I will rephrase it to require a deeper understanding of the context.\n\n</document_analysis>\n\n<output_format>\nQuestion: Which defensive tackle, drafted third overall by the Tampa Bay Buccaneers in their 35th NFL season, had previously earned consensus All-American honors playing college football at Oklahoma?\nA: Gerald McCoy\nB: Raheem Morris\nC: LeGarrette Blount\nD: Mike Williams\n\nExplanation: The correct answer is supported by the context, which states that Gerald Keith McCoy Jr. was drafted by the Buccaneers third overall in the 2010 NFL Draft and played college football at Oklahoma, where he earned consensus All-American honors.\n\nCorrect Answer: A\n</output_format>\n\nThe adjustments made include rephrasing the question to incorporate more details from the context, making it more specific and challenging. The answer options are distinct and unambiguous, with Gerald McCoy being the correct answer. The other options (Raheem Morris, LeGarrette Blount, and Mike Williams) are plausible but incorrect, as they do not match the description provided in the question. Raheem Morris is mentioned as the head coach, not a defensive tackle. LeGarrette Blount and Mike Williams are not mentioned in the provided context, making them incorrect choices based on the information given.",
    "question": "Which defensive tackle, drafted third overall by the Tampa Bay Buccaneers in their 35th NFL season, had previously earned consensus All-American honors playing college football at Oklahoma?",
    "choices": {
      "A": "Gerald McCoy",
      "B": "Raheem Morris",
      "C": "LeGarrette Blount",
      "D": "Mike Williams"
    },
    "answer": "A",
    "explanation": "The correct answer is supported by the context, which states that Gerald Keith McCoy Jr. was drafted by the Buccaneers third overall in the 2010 NFL Draft and played college football at Oklahoma, where he earned consensus All-American honors.",
    "answer_correctness_score": 10,
    "explanation_validity_score": 10,
    "question_clarity_score": 8,
    "question_difficulty_score": 7,
    "question_groundedness_score": 10,
    "question_token_count": 37,
    "reformat_question_cosine_similarity_to_orig": 0.9268014430999756,
    "reformat_answer_cosine_similarity_to_orig": 0.9072531461715698,
    "reformat_question_similarity_score": 9,
    "reformat_answer_similarity_score": 9,
    "avg_answer_token_count": 4
  },
  {
    "orig_question": "what does Frank Fertitta III and Zuffa have in common?",
    "orig_answer": "American",
    "context": "[PAR] [TLE] Frank Fertitta III [SEP] Frank Joseph Fertitta III (born February 24, 1962) is an American entrepreneur.  He is the current CEO of Station Casinos.  He is also an owner of Zuffa LLC, which is the entity that formerly ran the Ultimate Fighting Championship (UFC). [PAR] [TLE] Zuffa [SEP] Zuffa, LLC ( ) is an American sports promotion company specializing in mixed martial arts.  It was founded in January 2001 in Las Vegas, Nevada, by Station Casinos executives Frank Fertitta III and Lorenzo Fertitta to be the parent entity of the Ultimate Fighting Championship (UFC) after they purchased it from the Semaphore Entertainment Group.  The word \"Zuffa\" is an Italian word (] ), meaning \"fight\".  On July 11, 2016, Zuffa announced that it would be purchased by WME-IMG for the price of $4 billion.",
    "response": "<document_analysis>\nTo generate a question that is semantically equivalent to the original, I will first analyze the given context, question, and answer. The context provides information about Frank Fertitta III and Zuffa, LLC, highlighting their connection through the Ultimate Fighting Championship (UFC). The question asks for a commonality between Frank Fertitta III and Zuffa. The answer provided is \"American.\"\n\nUpon examining the context, it's clear that both Frank Fertitta III and Zuffa are associated with the UFC, and both are described in the context of American business and sports promotion. Frank Fertitta III is described as an American entrepreneur, and Zuffa is described as an American sports promotion company. Therefore, the commonality is their American association.\n\nTo create a more challenging and thoughtful question, I will rephrase it to encourage deeper understanding and insight. The question should be self-contained, clear, and relevant to the context provided.\n\nMy thought process involves considering the details given in the context and the nature of the connection between Frank Fertitta III and Zuffa. Since both are involved in the UFC, and given the context's focus on their roles and the description of Zuffa as an American company, the question can be reframed to reflect this information.\n\n</document_analysis>\n\n<output_format>\nQuestion: What characteristic is shared by Frank Fertitta III and the company Zuffa, LLC, based on their descriptions?\nA: They are both associated with the entertainment industry.\nB: They are both of Italian descent.\nC: They are both American entities.\nD: They are both involved in the hospitality industry.\n\nExplanation: Both Frank Fertitta III and Zuffa, LLC, are described in the context as being American. Frank Fertitta III is referred to as an \"American entrepreneur,\" and Zuffa is described as an \"American sports promotion company.\"\n\nCorrect Answer: C\n</output_format>",
    "question": "What characteristic is shared by Frank Fertitta III and the company Zuffa, LLC, based on their descriptions?",
    "choices": {
      "A": "They are both associated with the entertainment industry.",
      "B": "They are both of Italian descent.",
      "C": "They are both American entities.",
      "D": "They are both involved in the hospitality industry."
    },
    "answer": "C",
    "explanation": "Both Frank Fertitta III and Zuffa, LLC, are described in the context as being American. Frank Fertitta III is referred to as an \"American entrepreneur,\" and Zuffa is described as an \"American sports promotion company.\"",
    "answer_correctness_score": 10,
    "explanation_validity_score": 10,
    "question_clarity_score": 8,
    "question_difficulty_score": 4,
    "question_groundedness_score": 10,
    "question_token_count": 24,
    "reformat_question_cosine_similarity_to_orig": 0.8116134405136108,
    "reformat_answer_cosine_similarity_to_orig": 0.46759629249572754,
    "reformat_question_similarity_score": 9,
    "reformat_answer_similarity_score": 10,
    "avg_answer_token_count": 8
  },
  {
    "orig_question": "Charles Wayne \"Tinker\" Owens is a former professional American football player who played wide receiver for four seasons for the New Orleans Saints, in the NFL, the younger brother of which Heisman Trophy winner, a former football player, a running back in the National Football League (NFL) for five seasons in the early 1970s?",
    "orig_answer": "Loren Everett \"Steve\" Owens",
    "context": "[PAR] [TLE] Tinker Owens [SEP] Charles Wayne \"Tinker\" Owens is a former professional American football player who played wide receiver for four seasons for the New Orleans Saints (1976, 1978\u20131980) in the National Football League.  The younger brother of Heisman Trophy winner Steve Owens, Tinker was a two-time All-American (1974, 1975) during his college career at Oklahoma. [PAR] [TLE] Steve Owens (American football) [SEP] Loren Everett \"Steve\" Owens (born December 9, 1947) is a former football player, a running back in the National Football League (NFL) for five seasons in the early 1970s.",
    "response": "<document_analysis>\nThe context provides information about two individuals, Charles Wayne \"Tinker\" Owens and Loren Everett \"Steve\" Owens, who are both former professional American football players. The first paragraph discusses Tinker Owens, detailing his career with the New Orleans Saints in the NFL and his background as a two-time All-American during his college career at Oklahoma. It also mentions that he is the younger brother of Steve Owens, a Heisman Trophy winner. The second paragraph focuses on Steve Owens, describing his career as a running back in the NFL for five seasons in the early 1970s.\n\nThe question asks for the identity of the Heisman Trophy winner and former NFL running back who is the older brother of Tinker Owens. To answer this question correctly, one must understand the familial relationship between Tinker Owens and Steve Owens, as well as Steve Owens' achievements and career details.\n\nUpon analyzing the context, it is clear that the relevant information is distributed across both paragraphs. The first paragraph establishes the relationship between Tinker and Steve Owens, while the second paragraph provides more details about Steve Owens' career and achievements.\n\nTo create a semantically equivalent question that is clear and challenging, we need to integrate the relevant details from both paragraphs into the question. The question should be formulated in a way that requires the test-taker to demonstrate a deep understanding of the provided information.\n\nThe original question is: \"Charles Wayne 'Tinker' Owens is a former professional American football player who played wide receiver for four seasons for the New Orleans Saints, in the NFL, the younger brother of which Heisman Trophy winner, a former football player, a running back in the National Football League (NFL) for five seasons in the early 1970s?\"\n\nThis question is quite long and embeds the answer within it. A more effective approach would be to rephrase it to make it more straightforward while maintaining the necessary details for a domain expert to answer it without referencing the original context.\n\nThe correct answer, \"Loren Everett 'Steve' Owens,\" is provided, and we need to ensure that the rewritten question and answer are semantically equivalent.\n\n</document_analysis>\n\n<output_format>\nQuestion: Which Heisman Trophy winner, who played as a running back in the NFL for five seasons during the early 1970s, is the older brother of Charles Wayne \"Tinker\" Owens, a former wide receiver for the New Orleans Saints?\nA: Loren Everett \"Steve\" Owens\nB: Charles Wayne \"Tinker\" Owens\nC: Steve Spurrier\nD: Joe Greene\n\nExplanation: The correct answer is Loren Everett \"Steve\" Owens because he is identified as the older brother of Tinker Owens and a Heisman Trophy winner who played as a running back in the NFL for five seasons in the early 1970s.\n\nCorrect Answer: A\n</output_format>\n\nThe rewritten question is designed to be self-contained, clear, and challenging for a domain expert. It includes all necessary details from the context and avoids explicit references to the original text. The answer options are distinct and unambiguous, with the correct answer being \"Loren Everett 'Steve' Owens.'\"",
    "question": "Which Heisman Trophy winner, who played as a running back in the NFL for five seasons during the early 1970s, is the older brother of Charles Wayne \"Tinker\" Owens, a former wide receiver for the New Orleans Saints?",
    "choices": {
      "A": "Loren Everett \"Steve\" Owens",
      "B": "Charles Wayne \"Tinker\" Owens",
      "C": "Steve Spurrier",
      "D": "Joe Greene"
    },
    "answer": "A",
    "explanation": "The correct answer is Loren Everett \"Steve\" Owens because he is identified as the older brother of Tinker Owens and a Heisman Trophy winner who played as a running back in the NFL for five seasons in the early 1970s.",
    "answer_correctness_score": 10,
    "explanation_validity_score": 10,
    "question_clarity_score": 9,
    "question_difficulty_score": 7,
    "question_groundedness_score": 10,
    "question_token_count": 50,
    "reformat_question_cosine_similarity_to_orig": 0.9187641143798828,
    "reformat_answer_cosine_similarity_to_orig": 1.000000238418579,
    "reformat_question_similarity_score": 9,
    "reformat_answer_similarity_score": 10,
    "avg_answer_token_count": 5
  },
  {
    "orig_question": "Which astronaut depicted in Apollo 13  was born November 14, 1933?",
    "orig_answer": "Fred Haise",
    "context": "[PAR] [TLE] Fred Haise [SEP] Fred Wallace Haise Jr. ( ; born November 14, 1933) is an American former NASA astronaut, fighter pilot with the U.S. Marine Corps and the U.S. Air Force and test pilot.  He is one of only 24 people to have flown to the Moon, having flown as Lunar Module Pilot on Apollo 13.  He was to have been the sixth person to land and walk on the Moon, but the Apollo 13 mission was aborted before lunar landing.  He went on to fly Space Shuttle Approach and Landing Tests in 1977, and retired from NASA in 1979. [PAR] [TLE] Apollo 13 (film) [SEP] Apollo 13 is a 1995 American space adventure docudrama film directed by Ron Howard and starring Tom Hanks, Kevin Bacon, Bill Paxton, Gary Sinise, and Ed Harris.  The screenplay by William Broyles, Jr. and Al Reinert, that dramatizes the aborted 1970 Apollo 13 lunar mission, is an adaptation of the book \"Lost Moon: The Perilous Voyage of Apollo 13\" by astronaut Jim Lovell and Jeffrey Kluger.  The film depicts astronauts Lovell, Jack Swigert, and Fred Haise aboard Apollo 13 for America's third Moon landing mission.  En route, an on-board explosion deprives their spacecraft of most of its oxygen supply and electric power, forcing NASA's flight controllers to abort the Moon landing, and turning the mission into a struggle to get the three men home safely.",
    "response": "<document_analysis>\nTo solve this task, we need to carefully analyze the given context, question, and answer. The context provides information about Fred Haise and the Apollo 13 mission, as well as the film \"Apollo 13.\" The question asks for the astronaut depicted in the film \"Apollo 13\" who was born on November 14, 1933.\n\n1. **Thoughtful Content Examination**: The context provides two relevant paragraphs. The first paragraph is about Fred Haise, stating his birthdate as November 14, 1933. The second paragraph discusses the film \"Apollo 13\" and mentions that it depicts astronauts Lovell, Jack Swigert, and Fred Haise.\n\n2. **Concept Exploration**: The question connects the information about Fred Haise's birthdate to his depiction in the film \"Apollo 13.\" It requires understanding that the film depicts real astronauts and that Fred Haise is one of them.\n\n3. **Strategic Complexity Calibration**: The difficulty level of this question is relatively low because it directly connects information from the two paragraphs. However, it still requires the test-taker to understand the relationship between the astronaut and the film. To increase complexity, we can rephrase the question to require more inference or deeper understanding.\n\n4. **Intentional Question Planning**: The original question is straightforward. To enhance it, we can make it more specific or detailed, ensuring it still stands alone without referencing the context explicitly.\n\nUpon analysis, we can see that the question and answer are straightforward and directly related to the information provided in the context. The question is answerable by a domain expert without the context paragraph because it contains sufficient information about Fred Haise and his connection to the Apollo 13 mission and film.\n\nTo improve the question, we can make it more detailed and challenging while ensuring it remains self-contained and clear.\n\n</document_analysis>\n\n<output_format>\nQuestion: Which astronaut, depicted in the 1995 film \"Apollo 13\" directed by Ron Howard, was born on November 14, 1933, and was part of the aborted Apollo 13 lunar mission?\nA: Jack Swigert\nB: Jim Lovell\nC: Fred Haise\nD: Tom Hanks\n\nExplanation: The correct answer is Fred Haise because he was born on November 14, 1933, and was depicted in the film \"Apollo 13\" as part of the Apollo 13 mission.\n\nCorrect Answer: C\n</output_format>\n\nHere is the rewritten response with the requested changes and directly providing the final output:\n\n<output_format>\nQuestion: Which astronaut, depicted in the 1995 film \"Apollo 13\" directed by Ron Howard, was born on November 14, 1933, and was part of the aborted Apollo 13 lunar mission?\nA: Jack Swigert\nB: Jim Lovell\nC: Fred Haise\nD: Tom Hanks\nExplanation: The correct answer is Fred Haise because he was born on November 14, 1933, and was depicted in the film \"Apollo 13\" as part of the Apollo 13 mission.\nCorrect Answer: C\n</output_format>",
    "question": "Which astronaut, depicted in the 1995 film \"Apollo 13\" directed by Ron Howard, was born on November 14, 1933, and was part of the aborted Apollo 13 lunar mission?",
    "choices": {
      "A": "Jack Swigert",
      "B": "Jim Lovell",
      "C": "Fred Haise",
      "D": "Tom Hanks"
    },
    "answer": "C",
    "explanation": "The correct answer is Fred Haise because he was born on November 14, 1933, and was depicted in the film \"Apollo 13\" as part of the Apollo 13 mission.",
    "answer_correctness_score": 10,
    "explanation_validity_score": 10,
    "question_clarity_score": 9,
    "question_difficulty_score": 6,
    "question_groundedness_score": 10,
    "question_token_count": 44,
    "reformat_question_cosine_similarity_to_orig": 0.7619288563728333,
    "reformat_answer_cosine_similarity_to_orig": 1.0000003576278687,
    "reformat_question_similarity_score": 8,
    "reformat_answer_similarity_score": 10,
    "avg_answer_token_count": 4
  },
  {
    "orig_question": "What is Matka?",
    "orig_answer": "Indian",
    "context": "[PAR] [TLE] Dharmatma [SEP] Dharmatama is a 1975 Hindi thriller movie and the first Bollywood film to be shot in Afghanistan.  It was produced and directed by Feroz Khan.  The movie is the first attempt in India to localise \"The Godfather\".  The title character was based on matka (form of Indian gambling) king Ratan Khatri.  It is said that Khan sat down with Khatri to learn more about him and understand the nuances of matka.  The cast includes Feroz Khan, Hema Malini, Rekha, Premnath, Imtiaz Khan, Danny Denzongpa, Farida Jalal, Ranjeet, Helen, Madan Puri, Jeevan, Iftekhar and Dara Singh, satyen kappu and sudhir.  The music is by Kalyanji Anandji.  This film took Feroz Khan to new heights in his career as this was a blockbuster movie.  The same year, \"Sholay\" and \"Deewar\" were released.  The film is also its scenes featuring Buzkashi a Central Asian sport on horses, including aerial shots, which in turn won film's cinematographer, Kamal Bose, Filmfare Award for Best Cinematographer. [PAR] [TLE] Matka gambling [SEP] Matka\" gambling or satta\" is a form of lottery which originally involved betting on the opening and closing rates of cotton transmitted from the New York Cotton Exchange.  It originates from before the era of Indian independence when it was known as \"Ankada Jugar\" (\"figures gambling\").  In the 1960s, the system was replaced with other ways of generating random numbers, including pulling slips from a large earthenware pot known as a \"matka\", or dealing playing cards.",
    "response": "<document_analysis>\nTo address the task, let's start by analyzing the given context and the question-answer pair provided.\n\n1. **Thoughtful Content Examination**:\n   - The context discusses the movie \"Dharmatma\" and its connection to \"matka,\" a form of Indian gambling.\n   - It explains that \"matka\" is a form of lottery that originally involved betting on cotton rates from the New York Cotton Exchange.\n   - The question asks, \"What is Matka?\" and the answer given is \"Indian.\"\n\n2. **Concept Exploration**:\n   - The context implies that \"matka\" is related to India, given its description as \"Indian gambling\" or \"satta.\"\n   - The evolution of \"matka\" from its original form to the methods used in the 1960s is detailed.\n   - Understanding \"matka\" requires grasping its historical context and its transformation over time.\n\n3. **Strategic Complexity Calibration**:\n   - The original question is straightforward but lacks depth. A more complex question would require a deeper understanding of \"matka.\"\n   - The difficulty level of the original question is low (1-2), as it doesn't challenge the respondent to provide detailed insights.\n\n4. **Intentional Question Planning**:\n   - To create a more meaningful question, we should focus on the essence of \"matka\" as described in the context, incorporating its historical and functional aspects.\n\nGiven the above analysis, the original question and answer can be improved. The answer \"Indian\" is somewhat vague and doesn't fully capture the essence of \"matka.\" A more detailed and insightful question-answer pair can be generated.\n\nThe rationale for rewriting is to create a question that invites a deeper understanding of \"matka\" and its significance, as described in the context.\n\n</document_analysis>\n\n<output_format>\nQuestion: What is the historical context and original basis of the \"matka\" form of gambling in India?\nA: Matka was originally based on betting on the opening and closing rates of cotton from the New York Cotton Exchange.\nB: Matka was a traditional Indian lottery with no external influences.\nC: Matka originated as a card game played among Indian aristocrats.\nD: Matka was a form of gambling based on horse racing events.\n\nExplanation: The correct answer reflects the historical context of \"matka\" as described in the provided context, highlighting its origins and initial basis for betting.\n\nCorrect Answer: A\n</output_format>",
    "question": "What is the historical context and original basis of the \"matka\" form of gambling in India?",
    "choices": {
      "A": "Matka was originally based on betting on the opening and closing rates of cotton from the New York Cotton Exchange.",
      "B": "Matka was a traditional Indian lottery with no external influences.",
      "C": "Matka originated as a card game played among Indian aristocrats.",
      "D": "Matka was a form of gambling based on horse racing events."
    },
    "answer": "A",
    "explanation": "The correct answer reflects the historical context of \"matka\" as described in the provided context, highlighting its origins and initial basis for betting.",
    "answer_correctness_score": 10,
    "explanation_validity_score": 9,
    "question_clarity_score": 8,
    "question_difficulty_score": 6,
    "question_groundedness_score": 9,
    "question_token_count": 21,
    "reformat_question_cosine_similarity_to_orig": 0.545261800289154,
    "reformat_answer_cosine_similarity_to_orig": 0.044961970299482346,
    "reformat_question_similarity_score": 4,
    "reformat_answer_similarity_score": 1,
    "avg_answer_token_count": 16
  },
  {
    "orig_question": "The 2010 FIFA World Cup Final had a single goal by a player who plays for what team?",
    "orig_answer": "FC Barcelona",
    "context": "[PAR] [TLE] Andr\u00e9s Iniesta [SEP] Andr\u00e9s Iniesta Luj\u00e1n (] ; born 11 May 1984) is a Spanish professional footballer who plays as a central midfielder for FC Barcelona and the Spain national team.  He serves as the captain for Barcelona. [PAR] [TLE] 2010 FIFA World Cup Final [SEP] The 2010 FIFA World Cup Final (also known as the Battle of Johannesburg) was a football match that took place on 11 July 2010 at Soccer City in Johannesburg, South Africa, to determine the winner of the 2010 FIFA World Cup.  Spain defeated the Netherlands 1\u20130 with a goal from Andr\u00e9s Iniesta four minutes from the end of extra time.  English referee Howard Webb was selected to officiate the match, which was marked by an unusually high number of yellow cards.",
    "response": "<document_analysis>\nTo address the task, let's first analyze the given context, question, and answer.\n\n1. **Thoughtful Content Examination**: The context provides information about Andr\u00e9s Iniesta, a Spanish footballer who plays for FC Barcelona, and details about the 2010 FIFA World Cup Final, where Spain defeated the Netherlands 1-0 with a goal from Andr\u00e9s Iniesta.\n\n2. **Concept Exploration**: The key information is that Andr\u00e9s Iniesta scored the winning goal in the 2010 FIFA World Cup Final and that he plays for FC Barcelona.\n\n3. **Strategic Complexity Calibration**: The original question is straightforward and can be considered easy (difficulty level: 2-3). To increase complexity, we need to rephrase it to require deeper understanding or more critical thinking.\n\n4. **Intentional Question Planning**: We can rephrase the question to maintain its semantic equivalence while enhancing its complexity and encouraging deeper thought.\n\nUpon analyzing the context, it's clear that the question is about identifying the team for which the goal scorer in the 2010 FIFA World Cup Final plays. The answer provided is \"FC Barcelona.\"\n\nTo enhance complexity, we can reframe the question to include more details or require a more nuanced understanding.\n\n</document_analysis>\n\n<output_format>\nQuestion: Who is the football club that Andr\u00e9s Iniesta, the lone goal scorer in the 2010 FIFA World Cup Final, was playing for when he secured Spain's victory over the Netherlands?\nA: Real Madrid\nB: Manchester United\nC: FC Barcelona\nD: Arsenal\n\nExplanation: Andr\u00e9s Iniesta scored the only goal in the 2010 FIFA World Cup Final, and at the time, he was playing for FC Barcelona.\n\nCorrect Answer: C\n</output_format>\n\nThis revised question maintains semantic equivalence with the original while enhancing clarity and complexity. It ensures that the question is self-contained and answerable by a domain expert without needing the original context paragraph. The answer options are distinct and unambiguous, and the correct answer is clearly identified.",
    "question": "Who is the football club that Andr\u00e9s Iniesta, the lone goal scorer in the 2010 FIFA World Cup Final, was playing for when he secured Spain's victory over the Netherlands?",
    "choices": {
      "A": "Real Madrid",
      "B": "Manchester United",
      "C": "FC Barcelona",
      "D": "Arsenal"
    },
    "answer": "C",
    "explanation": "Andr\u00e9s Iniesta scored the only goal in the 2010 FIFA World Cup Final, and at the time, he was playing for FC Barcelona.",
    "answer_correctness_score": 10,
    "explanation_validity_score": 10,
    "question_clarity_score": 8,
    "question_difficulty_score": 4,
    "question_groundedness_score": 8,
    "question_token_count": 38,
    "reformat_question_cosine_similarity_to_orig": 0.6454088687896729,
    "reformat_answer_cosine_similarity_to_orig": 1.0000001192092896,
    "reformat_question_similarity_score": 9,
    "reformat_answer_similarity_score": 10,
    "avg_answer_token_count": 2
  },
  {
    "orig_question": "Which ReDRagon member was born on March 1, 1987 ?",
    "orig_answer": "Kyle O'Reilly",
    "context": "[PAR] [TLE] Kyle O'Reilly [SEP] Kyle Greenwood (born March 1, 1987) is a Canadian professional wrestler better known by the ring name Kyle O'Reilly, he is currently signed to WWE, where he performs in its developmental branch NXT.  He is best known for his time in with Ring of Honor (ROH).  He also worked for New Japan Pro Wrestling and competed for several independent promotions, most notably Pro Wrestling Guerrilla.  O'Reilly is a former one-time ROH World Champion, three-time ROH World Tag Team Champion alongside Bobby Fish as reDRagon, while in PWG he is a former one-time World Champion and the winner of the promotion's 2013 Battle of Los Angeles. [PAR] [TLE] ReDRagon [SEP] reDRagon is a professional wrestling tag team consisting of Bobby Fish and Kyle O'Reilly.  They are currently signed to WWE, where they performs in its developmental branch NXT.  The duo is best known for their work in Ring of Honor (ROH), where they are former three-time ROH World Tag Team Champions, and have also appeared in New Japan Pro Wrestling (NJPW) through ROH's talent exchange partnership, where they are former two-time IWGP Junior Heavyweight Tag Team Champions.",
    "response": "<document_analysis>\nTo address this task, I will first analyze the provided context, question, and answer to identify the central ideas and significant relationships within the text.\n\nThe context provided is about Kyle O'Reilly, a Canadian professional wrestler, and his tag team reDRagon with Bobby Fish. The key details include Kyle O'Reilly's birthdate (March 1, 1987), his wrestling career, and his achievements in various wrestling promotions.\n\nThe question asks to identify which member of the tag team reDRagon was born on March 1, 1987. The answer given is Kyle O'Reilly.\n\nUpon examining the context, it's clear that the information about Kyle O'Reilly's birthdate and his membership in reDRagon is crucial. The context explicitly states that Kyle Greenwood, better known as Kyle O'Reilly, was born on March 1, 1987, and that he is part of the reDRagon tag team alongside Bobby Fish.\n\nTo generate a rewritten question and answer pair, I will follow the guidelines provided, ensuring the question is semantically equivalent to the original but rephrased for clarity and complexity.\n\nThe thought process involves:\n1. Identifying the key information: Kyle O'Reilly's birthdate and his association with reDRagon.\n2. Ensuring the question is challenging and requires deep understanding.\n3. Rephrasing the question to be clear and self-contained.\n\n</document_analysis>\n\n<output_format>\nQuestion: Which member of the professional wrestling tag team reDRagon, consisting of Bobby Fish and Kyle O'Reilly, has a birthdate of March 1, 1987?\nA: Bobby Fish\nB: Kyle O'Reilly\nC: Kyle Greenwood\nD: Matt Riddle\nExplanation: The correct answer is Kyle O'Reilly because the context states that Kyle Greenwood, better known by his ring name Kyle O'Reilly, was born on March 1, 1987. Kyle O'Reilly is a member of the reDRagon tag team.\nCorrect Answer: B\n</output_format>\n\nI have ensured that the question is detailed, the answer options are distinct and unambiguous, and the correct answer is present. The question and answer are semantically equivalent to the originals, and the output adheres to the required formatting.",
    "question": "Which member of the professional wrestling tag team reDRagon, consisting of Bobby Fish and Kyle O'Reilly, has a birthdate of March 1, 1987?",
    "choices": {
      "A": "Bobby Fish",
      "B": "Kyle O'Reilly",
      "C": "Kyle Greenwood",
      "D": "Matt Riddle"
    },
    "answer": "B",
    "explanation": "The correct answer is Kyle O'Reilly because the context states that Kyle Greenwood, better known by his ring name Kyle O'Reilly, was born on March 1, 1987. Kyle O'Reilly is a member of the reDRagon tag team.",
    "answer_correctness_score": 10,
    "explanation_validity_score": 10,
    "question_clarity_score": 9,
    "question_difficulty_score": 6,
    "question_groundedness_score": 10,
    "question_token_count": 36,
    "reformat_question_cosine_similarity_to_orig": 0.5455891489982605,
    "reformat_answer_cosine_similarity_to_orig": 1.0,
    "reformat_question_similarity_score": 9,
    "reformat_answer_similarity_score": 10,
    "avg_answer_token_count": 4
  },
  {
    "orig_question": "On which mission did the TPS graduate after which the Onizuka Prop Wash Award is named successfully fly into space?",
    "orig_answer": "STS-51-C",
    "context": "[PAR] [TLE] Ellison Onizuka [SEP] Ellison Shoji Onizuka (June 24, 1946 \u2013 January 28, 1986 ) was an American astronaut from Kealakekua, Hawaii, who successfully flew into space with the Space Shuttle \"Discovery\" on STS-51-C.  He died in the destruction of the Space Shuttle \"Challenger\", on which he was serving as Mission Specialist for mission STS-51-L.  He was the first Asian American and the first person of Japanese ancestry to reach space. [PAR] [TLE] Onizuka Prop Wash Award [SEP] The Onizuka Prop Wash Award recognizes the student at the United States Air Force Test Pilot School (USAF TPS) who contributed most to class spirit and morale.  The honoree from each class is selected by his or her fellow students rather than by school faculty.  The award is named in memory of TPS graduate Ellison Onizuka who perished in the explosion of the Space Shuttle \"Challenger\" in 1986.",
    "response": "<document_analysis>\nThe context provides information about Ellison Onizuka, an American astronaut who flew into space with the Space Shuttle \"Discovery\" on STS-51-C and later died in the destruction of the Space Shuttle \"Challenger\" during mission STS-51-L. It also mentions the Onizuka Prop Wash Award, which is named in his memory and recognizes a student's contribution to class spirit and morale at the United States Air Force Test Pilot School. The question asks about the mission on which Ellison Onizuka, the TPS graduate after whom the award is named, successfully flew into space.\n\nUpon analyzing the context, it is clear that Ellison Onizuka flew into space on STS-51-C. The question is factual and requires the reader to understand the connection between Onizuka and his space missions.\n\nTo create a more challenging and thoughtful question, we can rephrase it to require deeper understanding or more nuanced thinking. The original question is straightforward and factual. We can maintain its core while making it more engaging.\n\nThe difficulty level of the original question is relatively low (around 2-3 out of 10) because it directly asks for information provided in the context. To increase the complexity, we can reframe the question to require more analysis or inference.\n\n</document_analysis>\n\n<output_format>\nQuestion: Which Space Shuttle mission marked the first successful spaceflight for Ellison Onizuka, the astronaut in whose honor the Onizuka Prop Wash Award is given to a student at the United States Air Force Test Pilot School?\nA: STS-51-L\nB: STS-51-C\nC: STS-41-G\nD: STS-61-B\n\nExplanation: Ellison Onizuka successfully flew into space with the Space Shuttle \"Discovery\" on STS-51-C. The Onizuka Prop Wash Award is named in his memory.\n\nCorrect Answer: B\n</output_format>\n\nThought process:\n1. The original question is analyzed for its content and complexity.\n2. The context is reviewed to ensure that the question is answerable based on the provided information.\n3. The question is rephrased to maintain its factual nature while making it more specific and detailed.\n4. The answer options are generated to ensure they are distinct and unambiguous.\n5. The correct answer is verified to be present among the options.\n6. The question and answer are checked to ensure they are semantically equivalent to the originals.\n7. The output is formatted according to the specified structure.",
    "question": "Which Space Shuttle mission marked the first successful spaceflight for Ellison Onizuka, the astronaut in whose honor the Onizuka Prop Wash Award is given to a student at the United States Air Force Test Pilot School?",
    "choices": {
      "A": "STS-51-L",
      "B": "STS-51-C",
      "C": "STS-41-G",
      "D": "STS-61-B"
    },
    "answer": "B",
    "explanation": "Ellison Onizuka successfully flew into space with the Space Shuttle \"Discovery\" on STS-51-C. The Onizuka Prop Wash Award is named in his memory.",
    "answer_correctness_score": 10,
    "explanation_validity_score": 10,
    "question_clarity_score": 6,
    "question_difficulty_score": 4,
    "question_groundedness_score": 10,
    "question_token_count": 45,
    "reformat_question_cosine_similarity_to_orig": 0.7091578841209412,
    "reformat_answer_cosine_similarity_to_orig": 1.0000001192092896,
    "reformat_question_similarity_score": 9,
    "reformat_answer_similarity_score": 10,
    "avg_answer_token_count": 5
  },
  {
    "orig_question": "The football player that Billy Truax was traded for following the 1970 NFL season attended what college?",
    "orig_answer": "University of Oklahoma",
    "context": "[PAR] [TLE] Billy Truax [SEP] William Frederick Truax (born July 15, 1943) is a former professional American football tight end in the National Football League (NFL) from 1964 to 1973 for the Los Angeles Rams and the Dallas Cowboys.  He played in high school at Holy Cross in New Orleans and college football at Louisiana State University and was drafted in the second round of the 1964 NFL draft.  Following the 1970 NFL season, Truax was traded by the Rams to the Cowboys for wide receiver Lance Rentzel.  He was part of the Cowboys' Super Bowl VI championship team in 1971. [PAR] [TLE] Lance Rentzel [SEP] Thomas Lance Rentzel (born October 14, 1943) is a former American football flanker in the National Football League (NFL) for the Minnesota Vikings, Dallas Cowboys and the Los Angeles Rams.  He played college football at the University of Oklahoma.",
    "response": "<document_analysis>\nTo address the task, let's first analyze the given context and question.\n\n1. **Thoughtful Content Examination**:\n   - The context provides biographical information about two NFL players: Billy Truax and Lance Rentzel.\n   - Billy Truax played for the Los Angeles Rams and the Dallas Cowboys.\n   - Lance Rentzel played for the Minnesota Vikings, Dallas Cowboys, and the Los Angeles Rams.\n   - The key event mentioned is the trade involving Billy Truax and Lance Rentzel between the Rams and the Cowboys after the 1970 NFL season.\n\n2. **Concept Exploration**:\n   - The question focuses on identifying the college attended by Lance Rentzel, as he was the player Billy Truax was traded for.\n   - The context explicitly states that Lance Rentzel played college football at the University of Oklahoma.\n\n3. **Strategic Complexity Calibration**:\n   - The question is straightforward and requires recalling specific information from the context.\n   - The difficulty level is relatively low (2-3 out of 10) since it directly asks for information provided in the context.\n\n4. **Intentional Question Planning**:\n   - To increase complexity and encourage deeper understanding, the question can be rephrased to require more inference or integration of information.\n\nGiven the straightforward nature of the original question and answer, we can rephrase and enhance them to fit the required output format and increase their complexity.\n\n</document_analysis>\n\n<output_format>\nQuestion: Following the 1970 NFL season, Billy Truax was traded to the Dallas Cowboys for a wide receiver who had played college football at which institution?\nA: Louisiana State University\nB: University of Oklahoma\nC: University of Texas\nD: University of Southern California\n\nExplanation: The correct answer is the University of Oklahoma because Lance Rentzel, the wide receiver Billy Truax was traded for, played college football there.\n\nCorrect Answer: B\n</output_format>",
    "question": "Following the 1970 NFL season, Billy Truax was traded to the Dallas Cowboys for a wide receiver who had played college football at which institution?",
    "choices": {
      "A": "Louisiana State University",
      "B": "University of Oklahoma",
      "C": "University of Texas",
      "D": "University of Southern California"
    },
    "answer": "B",
    "explanation": "The correct answer is the University of Oklahoma because Lance Rentzel, the wide receiver Billy Truax was traded for, played college football there.",
    "answer_correctness_score": 10,
    "explanation_validity_score": 10,
    "question_clarity_score": 2,
    "question_difficulty_score": 6,
    "question_groundedness_score": 10,
    "question_token_count": 31,
    "reformat_question_cosine_similarity_to_orig": 0.8901768922805786,
    "reformat_answer_cosine_similarity_to_orig": 1.0,
    "reformat_question_similarity_score": 9,
    "reformat_answer_similarity_score": 10,
    "avg_answer_token_count": 4
  },
  {
    "orig_question": "Do You Believe? starred the football player who has what nickname?",
    "orig_answer": "The Boz",
    "context": "[PAR] [TLE] Brian Bosworth [SEP] Brian Keith Bosworth (born March 9, 1965), nicknamed \"The Boz,\" is a former American professional football player who played as a linebacker for the Seattle Seahawks in the National Football League (NFL).  Bosworth played college football for the University of Oklahoma, and was a two-time consensus All-American.  He gained fame and notoriety through his flamboyant personality, controversial comments about the National Collegiate Athletic Association (NCAA) and radical hair cuts.  Bosworth was less successful in the NFL and injuries forced him to retire after three seasons. [PAR] [TLE] Do You Believe? (film) [SEP] Do You Believe?  is a 2015 Christian ensemble drama film directed by Jon Gunn and stars an ensemble cast featuring Ted McGinley, Mira Sorvino, Andrea Logan White, Lee Majors, Alexa PenaVega, Sean Astin, Madison Pettis, Cybill Shepherd, and Brian Bosworth.  It was released on March 20, 2015.",
    "response": "<document_analysis>\nThe context provides information about Brian Bosworth, a former American professional football player, and his involvement in the 2015 Christian ensemble drama film \"Do You Believe?\". The central idea is to understand the connection between Brian Bosworth and the film. The context mentions that Brian Bosworth is nicknamed \"The Boz\" and that he starred in \"Do You Believe?\". To create a challenging question, we need to ensure that it requires a deep understanding of the content and is semantically equivalent to the original question.\n\nUpon analyzing the given context, question, and answer, it's clear that the question is asking for the nickname of the football player Brian Bosworth, who starred in \"Do You Believe?\". The answer provided is \"The Boz\". \n\nThe complexity of the question is moderate, as it requires the test-taker to know about Brian Bosworth's nickname and his role in the film \"Do You Believe?\". To increase the complexity, we can rephrase the question to make it more specific and detailed.\n\nThe thought process involves understanding the context, identifying the key information (Brian Bosworth's nickname and his role in \"Do You Believe?\"), and rephrasing the question to make it more challenging and clear.\n</document_analysis>\n\n<output_format>\nQuestion: Which nickname was associated with the football player who appeared in the 2015 Christian ensemble drama film Do You Believe?\nA: The Boss\nB: The Boz\nC: The Bull\nD: The Brawler\nExplanation: Brian Bosworth, who starred in \"Do You Believe?\", is known by the nickname \"The Boz\".\nCorrect Answer: B\n</output_format>",
    "question": "Which nickname was associated with the football player who appeared in the 2015 Christian ensemble drama film Do You Believe?",
    "choices": {
      "A": "The Boss",
      "B": "The Boz",
      "C": "The Bull",
      "D": "The Brawler"
    },
    "answer": "B",
    "explanation": "Brian Bosworth, who starred in \"Do You Believe?\", is known by the nickname \"The Boz\".",
    "answer_correctness_score": 10,
    "explanation_validity_score": 10,
    "question_clarity_score": 6,
    "question_difficulty_score": 5,
    "question_groundedness_score": 10,
    "question_token_count": 24,
    "reformat_question_cosine_similarity_to_orig": 0.5600513219833374,
    "reformat_answer_cosine_similarity_to_orig": 0.9999998807907104,
    "reformat_question_similarity_score": 9,
    "reformat_answer_similarity_score": 10,
    "avg_answer_token_count": 3
  },
  {
    "orig_question": "in the play King Lear, Edmund the antagonist is flirting with two sister and one of them has what type of rare trait?",
    "orig_answer": "aggressiveness",
    "context": "[PAR] [TLE] Edmund (King Lear) [SEP] Edmund or Edmond is a fictional character and the main antagonist in William Shakespeare's \"King Lear\".  He is the illegitimate son of the Earl of Gloucester, and the younger brother of Edgar, the Earl's legitimate son.  Early on in the play, Edmund resolves to get rid of his brother, then his father, and become Earl in his own right.  He later flirts with both Goneril and Regan and attempts to play them off against each other. [PAR] [TLE] Goneril [SEP] Goneril is a character in Shakespeare's tragic play \"King Lear\" (1605).  She is the eldest of King Lear's three daughters.  Along with her sister Regan, Goneril is considered a villain, obsessed with power and overthrowing her elderly father as ruler of the kingdom of Britain.  Her aggressiveness is a rare trait for a female character in Elizabethan literature.",
    "response": "<document_analysis>\nTo approach this task, let's first analyze the given context and question. The context provides information about two characters from Shakespeare's \"King Lear\": Edmund and Goneril. Edmund is described as the main antagonist who is illegitimate son of the Earl of Gloucester and has plans to overthrow his brother and father. He also flirts with Goneril and her sister Regan. Goneril is described as one of King Lear's daughters, considered a villain, and is noted for her aggressiveness, a rare trait for a female character in Elizabethan literature.\n\nThe question asks about Edmund flirting with two sisters, one of whom has a rare trait. The answer provided is \"aggressiveness.\"\n\nUpon closer examination, it's clear that the context mentions Edmund flirting with Goneril and Regan, and it is Goneril who is specifically noted for having the rare trait of aggressiveness. \n\nTo rephrase the question and answer, we need to ensure that the rewritten question is clear and semantically equivalent to the original, and that the answer remains the same in meaning.\n\nThe original question implies that Edmund is flirting with two sisters, and we need to identify the rare trait one of them possesses. The context indicates that Goneril is aggressive, and both Goneril and Regan are the sisters Edmund flirts with.\n\nLet's rephrase the question to make it clearer and more detailed, ensuring it stands alone without needing the original context.\n\n</document_analysis>\n\n<output_format>\nQuestion: In Shakespeare's \"King Lear\", the antagonist Edmund flirts with King Lear's daughters Goneril and Regan; one of these daughters is noted for exhibiting a behavior that was uncommon for women during the Elizabethan era, which is characterized by being forceful and assertive. What is this rare trait?\nA: Passivity\nB: Aggressiveness\nC: Submissiveness\nD: Gentleness\nExplanation: The correct answer is \"aggressiveness\" because, according to the context, Goneril is noted for her aggressiveness, which was a rare trait for a female character in Elizabethan literature.\nCorrect Answer: B\n</output_format>",
    "question": "In Shakespeare's \"King Lear\", the antagonist Edmund flirts with King Lear's daughters Goneril and Regan; one of these daughters is noted for exhibiting a behavior that was uncommon for women during the Elizabethan era, which is characterized by being forceful and assertive. What is this rare trait?",
    "choices": {
      "A": "Passivity",
      "B": "Aggressiveness",
      "C": "Submissiveness",
      "D": "Gentleness"
    },
    "answer": "B",
    "explanation": "The correct answer is \"aggressiveness\" because, according to the context, Goneril is noted for her aggressiveness, which was a rare trait for a female character in Elizabethan literature.",
    "answer_correctness_score": 10,
    "explanation_validity_score": 10,
    "question_clarity_score": 6,
    "question_difficulty_score": 7,
    "question_groundedness_score": 8,
    "question_token_count": 63,
    "reformat_question_cosine_similarity_to_orig": 0.7413500547409058,
    "reformat_answer_cosine_similarity_to_orig": 0.9999998807907104,
    "reformat_question_similarity_score": 9,
    "reformat_answer_similarity_score": 10,
    "avg_answer_token_count": 4
  },
  {
    "orig_question": "Vic & Anthony's Steakhouse is set to open a fourth location inside a casino based in what state?",
    "orig_answer": "Louisiana",
    "context": "[PAR] [TLE] Vic &amp; Anthony's Steakhouse [SEP] Vic & Anthony\u2019s is an American steakhouse restaurant chain with locations in Downtown Houston, ]and inside the Golden Nugget Casinos in Las Vegas and Atlantic City.  A fourth location is scheduled to open inside the new Golden Nugget Lake Charles in late 2014.  Vic & Anthony\u2019s is owned and operated by Landry\u2019s, Inc. [PAR] [TLE] Golden Nugget Lake Charles [SEP] Golden Nugget Lake Charles is a 242-acre waterfront casino resort in Lake Charles, Louisiana, U.S.A., owned and operated by Houston-based Landry's, Inc. The resort features 740 guest rooms and suites housed in a 25-story tower, an 18-hole golf course, 30,000-square-feet of meeting space, more than a dozen dining and bar options, a private beach, marina, spa & salon, retail corridor and expansive 24-hour casino floor.",
    "response": "<document_analysis>\nThe context provides information about Vic & Anthony's Steakhouse and its planned fourth location inside the Golden Nugget Lake Charles casino resort. The key details are that Vic & Anthony's is owned by Landry's, Inc., and the fourth location is scheduled to open inside the Golden Nugget Lake Charles in late 2014. The Golden Nugget Lake Charles is described as a waterfront casino resort located in Lake Charles, Louisiana.\n\nTo generate a question that inspires deeper thought and nuanced consideration, we need to carefully examine the given context and identify central ideas and significant relationships. The question should be challenging for a domain expert and require a deep understanding of the content.\n\nThe original question asks about the state where the fourth Vic & Anthony's Steakhouse location is set to open inside a casino. The answer provided is Louisiana. To rephrase and rewrite the question and answer pair, we need to ensure that the new question is semantically equivalent to the original one and is clear and challenging.\n\nUpon analyzing the context, it is clear that the fourth location of Vic & Anthony's Steakhouse is planned to be inside the Golden Nugget Lake Charles, which is in Louisiana. The context provides sufficient information to formulate a question that is self-contained and understandable independently of external references.\n\nThe complexity of the question is moderate, as it requires understanding the relationship between Vic & Anthony's Steakhouse and the Golden Nugget Lake Charles. To calibrate the complexity, we can rephrase the question to make it more challenging and thought-provoking.\n\n</document_analysis>\n\n<output_format>\nQuestion: What is the U.S. state where the Golden Nugget casino resort, which will house the fourth Vic & Anthony's Steakhouse location, is situated?\nA: Texas\nB: Louisiana\nC: New Jersey\nD: Nevada\nExplanation: The correct answer is Louisiana because the Golden Nugget Lake Charles, where the fourth Vic & Anthony's Steakhouse is scheduled to open, is located in Lake Charles, Louisiana.\nCorrect Answer: B\n</output_format>",
    "question": "What is the U.S. state where the Golden Nugget casino resort, which will house the fourth Vic & Anthony's Steakhouse location, is situated?",
    "choices": {
      "A": "Texas",
      "B": "Louisiana",
      "C": "New Jersey",
      "D": "Nevada"
    },
    "answer": "B",
    "explanation": "The correct answer is Louisiana because the Golden Nugget Lake Charles, where the fourth Vic & Anthony's Steakhouse is scheduled to open, is located in Lake Charles, Louisiana.",
    "answer_correctness_score": 10,
    "explanation_validity_score": 10,
    "question_clarity_score": 6,
    "question_difficulty_score": 3,
    "question_groundedness_score": 10,
    "question_token_count": 32,
    "reformat_question_cosine_similarity_to_orig": 0.7992911338806152,
    "reformat_answer_cosine_similarity_to_orig": 1.0000001192092896,
    "reformat_question_similarity_score": 10,
    "reformat_answer_similarity_score": 10,
    "avg_answer_token_count": 2
  },
  {
    "orig_question": "What song, by English singer, songwriter and model born 22 August 1995, was written by Caroline Ailin, Emily Warren and Ian Kirkpatrick?",
    "orig_answer": "New Rules",
    "context": "[PAR] [TLE] Dua Lipa [SEP] Dua Lipa ( ; ] ; born 22 August 1995) is an English singer, songwriter and model.  Her musical career began at age 16, when she began covering songs by other artists on YouTube.  In 2015, she was signed with Warner Music Group, and released her first single soon after.  In December 2016, a documentary about Lipa was commissioned by \"The Fader\" magazine, titled \"See in Blue\".  In January 2017, she won the EBBA Public Choice Award.  Her self-titled debut studio album was released on 2 June 2017.  The album spawned seven singles, including the top-10 single \"Be the One\" and the number-one single \"New Rules\". [PAR] [TLE] New Rules (song) [SEP] \"New Rules\" is a song by English singer Dua Lipa from her eponymous debut studio album (2017).  The track was written by Caroline Ailin, Emily Warren and Ian Kirkpatrick, while production was handled by the latter.  It was released to contemporary hit radio in the United Kingdom on 21 July 2017 as the album's sixth single.  It impacted the same format in the United States on 22 August 2017.",
    "response": "<document_analysis>\nThe context provided contains biographical information about Dua Lipa, an English singer, songwriter, and model, and details about her song \"New Rules.\" The task is to rephrase and rewrite the given question and answer pair according to the instructions.\n\nUpon analyzing the context, it is clear that Dua Lipa was born on 22 August 1995, and \"New Rules\" is a song from her debut studio album released in 2017. The song was written by Caroline Ailin, Emily Warren, and Ian Kirkpatrick.\n\nThe original question asks for the song written by Caroline Ailin, Emily Warren, and Ian Kirkpatrick for the English singer, songwriter, and model born on 22 August 1995. The answer to this question is \"New Rules.\"\n\nTo create a semantically equivalent question, we need to ensure that it retains the core information and complexity. The rewritten question should be clear, detailed, and answerable by a domain expert without referencing the original context.\n\nThe thought process involves identifying key elements: the song's writers (Caroline Ailin, Emily Warren, and Ian Kirkpatrick), the singer's birthdate (22 August 1995), and the song's title (\"New Rules\"). The question should integrate these elements naturally.\n\n</document_analysis>\n\n<output_format>\nQuestion: Which song, released by the English singer born on 22 August 1995, was penned by the collaborative efforts of Caroline Ailin, Emily Warren, and Ian Kirkpatrick?\nA: Be the One\nB: New Rules\nC: One Kiss\nD: Electricity\n\nExplanation: The correct answer is \"New Rules\" because it is the song written by Caroline Ailin, Emily Warren, and Ian Kirkpatrick for Dua Lipa, who was born on 22 August 1995.\n\nCorrect Answer: B\n</output_format>\n\nThe provided output adheres to the required structure and contains a rewritten question that is semantically equivalent to the original. The answer options are distinct and unambiguous, and the correct answer is present among the choices. The question is designed to be answerable by a domain expert without needing the original context.",
    "question": "Which song, released by the English singer born on 22 August 1995, was penned by the collaborative efforts of Caroline Ailin, Emily Warren, and Ian Kirkpatrick?",
    "choices": {
      "A": "Be the One",
      "B": "New Rules",
      "C": "One Kiss",
      "D": "Electricity"
    },
    "answer": "B",
    "explanation": "The correct answer is \"New Rules\" because it is the song written by Caroline Ailin, Emily Warren, and Ian Kirkpatrick for Dua Lipa, who was born on 22 August 1995.",
    "answer_correctness_score": 10,
    "explanation_validity_score": 10,
    "question_clarity_score": 6,
    "question_difficulty_score": 5,
    "question_groundedness_score": 10,
    "question_token_count": 38,
    "reformat_question_cosine_similarity_to_orig": 0.9252294898033142,
    "reformat_answer_cosine_similarity_to_orig": 1.0000001192092896,
    "reformat_question_similarity_score": 9,
    "reformat_answer_similarity_score": 10,
    "avg_answer_token_count": 3
  },
  {
    "orig_question": "When was the Rihanna's single co-written by Takura Tendayi realeased?",
    "orig_answer": "November 13, 2009",
    "context": "[PAR] [TLE] Takura [SEP] Takura Tendayi is a Zimbabwean singer/songwriter and member of the band Door Policy alongside producer Bibby Jones.  He is well known for his frequent collaborations with Chase & Status and Sub Focus, as well as many other dubstep and drum and bass artists.  His guest appearances have accumulated over seventeen million YouTube views, and \"Flashing Lights\" has charted in the United Kingdom at number 98 in the UK Singles Chart and number 15 in the UK Dance Chart.  shared stage with Ray Cee and also co-wrote Rihanna's 2009 single \"Wait Your Turn\" which alone has over seventeen million YouTube views and charted at number 45 in the UK Singles Chart.  On 10 September, Door Policy released the three-track EP \"No Cover Charge\" for free download.  It features a guest appearance from \"Traktor\" singer L Marshall. [PAR] [TLE] Wait Your Turn [SEP] \"Wait Your Turn\" is a song recorded by Barbadian singer Rihanna for her fourth studio album, \"Rated R\" (2009).  It was written by Mikkel S. Eriksen, Tor Erik Hermansen, Saul Milton, Will Kennard, James Fauntleroy II, Takura Tendayi, and Rihanna herself.  Stargate (Eriksen and Hermansen) and Chase & Status (Milton and Kennard) produced the song.  \"Wait Your Turn\" was released on November 13, 2009 as the second international and third overall single from \"Rated R\".",
    "response": "## Step 1: Analyze the given context to understand the information provided about Takura Tendayi and his collaborations.\nThe context provides information about Takura Tendayi, a Zimbabwean singer/songwriter, his collaborations with various artists, and his involvement in music projects. It mentions his role in co-writing Rihanna's 2009 single \"Wait Your Turn\" and other achievements.\n\n## Step 2: Identify the specific details related to the question about the release date of Rihanna's single \"Wait Your Turn\".\nThe context states that \"Wait Your Turn\" was released on November 13, 2009, as the second international and third overall single from Rihanna's fourth studio album, \"Rated R\" (2009).\n\n## Step 3: Examine the question and answer provided to understand what needs to be rephrased or rewritten.\nThe original question asks for the release date of Rihanna's single co-written by Takura Tendayi, and the answer is November 13, 2009.\n\n## Step 4: Rephrase the question to ensure it is clear, concise, and semantically equivalent to the original question.\nTo rephrase the question, we need to maintain the core inquiry about the release date of \"Wait Your Turn\" while potentially adding more context or details from the provided text to make it stand alone.\n\n## Step 5: Rewrite the question and answer in the required output format, ensuring the question is self-contained and the answer options are distinct and unambiguous.\nGiven that \"Wait Your Turn\" is a song by Rihanna, co-written by Takura Tendayi, and released as a single from her album \"Rated R\", we can formulate a question that incorporates these details and provides a clear, multiple-choice query.\n\n## Step 6: Generate the output in the specified format.\nTo create the output, we first need to craft a question that is detailed and can be answered without referencing the original context. Then, we will provide four distinct answer options and identify the correct answer.\n\n## Step 7: Document the analysis and thought process within the required tags.\n<document_analysis>\nThe context provides detailed information about Takura Tendayi and his musical collaborations, including co-writing Rihanna's \"Wait Your Turn\". The song was released on November 13, 2009. The question seeks the release date of this single. The information is directly available in the context, making it a factual question. The complexity is moderate as it requires recalling a specific date.\n</document_analysis>\n\n## Step 8: Formulate the question and answer options.\nThe song \"Wait Your Turn\" by Rihanna, which was co-written by Takura Tendayi, was released as a single from her fourth studio album \"Rated R\" in 2009. What was the release date of this single?\n\n## Step 9: Provide the answer options and the correct answer in the required format.\n<output_format>\nQuestion: The song \"Wait Your Turn\" by Rihanna, which was co-written by Takura Tendayi, was released as a single from her fourth studio album \"Rated R\" in 2009. What was the release date of this single?\nA: October 13, 2009\nB: November 13, 2009\nC: December 13, 2009\nD: January 13, 2010\nExplanation: The correct release date is November 13, 2009, as stated in the context provided.\nCorrect Answer: B\n</output_format>\n\nThe final answer is:\n<output_format>\nQuestion: The song \"Wait Your Turn\" by Rihanna, which was co-written by Takura Tendayi, was released as a single from her fourth studio album \"Rated R\" in 2009. What was the release date of this single?\nA: October 13, 2009\nB: November 13, 2009\nC: December 13, 2009\nD: January 13, 2010\nExplanation: The correct release date is November 13, 2009, as stated in the context provided.\nCorrect Answer: B\n</output_format>",
    "question": "The song \"Wait Your Turn\" by Rihanna, which was co-written by Takura Tendayi, was released as a single from her fourth studio album \"Rated R\" in 2009. What was the release date of this single?",
    "choices": {
      "A": "October 13, 2009",
      "B": "November 13, 2009",
      "C": "December 13, 2009",
      "D": "January 13, 2010"
    },
    "answer": "B",
    "explanation": "The correct release date is November 13, 2009, as stated in the context provided.",
    "answer_correctness_score": 10,
    "explanation_validity_score": 10,
    "question_clarity_score": 8,
    "question_difficulty_score": 4,
    "question_groundedness_score": 10,
    "question_token_count": 51,
    "reformat_question_cosine_similarity_to_orig": 0.6422663927078247,
    "reformat_answer_cosine_similarity_to_orig": 1.0,
    "reformat_question_similarity_score": 9,
    "reformat_answer_similarity_score": 10,
    "avg_answer_token_count": 8
  },
  {
    "orig_question": "Originally hired in April of 2010, who was the head coach of the 2015-16 Missouri Tigers women's basketball team?",
    "orig_answer": "Robin Pingeton",
    "context": "[PAR] [TLE] Robin Pingeton [SEP] Robin Pingeton (born July 9, 1968) is the head coach of the University of Missouri's women's basketball team.  She was hired in April 2010 to replace former head coach Cindy Stein. [PAR] [TLE] 2015\u201316 Missouri Tigers women's basketball team [SEP] The 2015\u201316 Missouri Tigers women's basketball team represents the University of Missouri in the 2015\u201316 NCAA Division I women's basketball season.  The Tigers were led by sixth year head coach Robin Pingeton.  They play their games at Mizzou Arena and are members of the Southeastern Conference.  They finished the season 22\u201310, 8\u20138 in SEC play to finish in a 3 way tie for seventh place.  They lost in the second round of the SEC Women's Tournament to Auburn.  They received an at-large to the NCAA Women's Tournament, which was their first trip since 2006 where they defeated BYU in the first round before losing to Texas in the second round.",
    "response": "<document_analysis>\nThe context provided contains information about Robin Pingeton, the head coach of the University of Missouri's women's basketball team, and details about the 2015\u201316 Missouri Tigers women's basketball team. The question asks for the head coach of the 2015-16 Missouri Tigers women's basketball team, who was originally hired in April of 2010. \n\nTo answer this question, one needs to connect the information about Robin Pingeton being hired in April 2010 as the head coach and the fact that she was leading the 2015\u201316 Missouri Tigers women's basketball team. The context confirms that Robin Pingeton was indeed the head coach during the specified season, as it mentions she was in her sixth year as head coach during the 2015\u201316 season.\n\nThe complexity of this question is moderate (around 6 out of 10) because it requires the reader to make a simple connection between two pieces of information provided in the context: the hiring of Robin Pingeton in 2010 and her role in the 2015\u201316 season. However, the question is straightforward and doesn't require deep analysis or nuanced understanding.\n\nTo enhance the question's complexity and encourage deeper engagement, it could be rephrased to require more inference or application of the provided information.\n\n</document_analysis>\n\n<output_format>\nQuestion: Who was leading the University of Missouri's women's basketball team during the 2015-2016 NCAA Division I women's basketball season, having been appointed to that position six years prior?\nA: Cindy Stein\nB: Robin Pingeton\nC: A new coach not mentioned in the records\nD: The coach from the 2006 team\n\nExplanation: The correct answer is Robin Pingeton because she was hired in April 2010, which is six years before the 2015-2016 season, and is mentioned as the head coach during that season.\n\nCorrect Answer: B\n</output_format>",
    "question": "Who was leading the University of Missouri's women's basketball team during the 2015-2016 NCAA Division I women's basketball season, having been appointed to that position six years prior?",
    "choices": {
      "A": "Cindy Stein",
      "B": "Robin Pingeton",
      "C": "A new coach not mentioned in the records",
      "D": "The coach from the 2006 team"
    },
    "answer": "B",
    "explanation": "The correct answer is Robin Pingeton because she was hired in April 2010, which is six years before the 2015-2016 season, and is mentioned as the head coach during that season.",
    "answer_correctness_score": 10,
    "explanation_validity_score": 10,
    "question_clarity_score": 6,
    "question_difficulty_score": 5,
    "question_groundedness_score": 8,
    "question_token_count": 37,
    "reformat_question_cosine_similarity_to_orig": 0.7476601600646973,
    "reformat_answer_cosine_similarity_to_orig": 1.000000238418579,
    "reformat_question_similarity_score": 9,
    "reformat_answer_similarity_score": 10,
    "avg_answer_token_count": 6
  },
  {
    "orig_question": "What is the name of the creek that is part of the river located in the western suburbs of the Adelaide metropolitan area in South Australia?",
    "orig_answer": "Brown Hill Creek",
    "context": "[PAR] [TLE] Patawalonga River [SEP] The Patawalonga River is a river located in the western suburbs of the Adelaide metropolitan area, in the Australian state of South Australia.  It drains an area of flat, swampy lands formerly known as the Cowandilla Plains, which in the mid-20th century were drained by engineering works, enabling the establishment of Adelaide Airport and the development of residential housing. [PAR] [TLE] Brown Hill Creek [SEP] The Brown Hill Creek, also known as Willawilla in the Kaurna language, part of the Patawalonga River catchment, is a watercourse located in the western suburbs of the Adelaide metropolitan area, in the Australian state of South Australia.",
    "response": "<document_analysis>\nThe provided context describes two related water bodies in the western suburbs of Adelaide, South Australia: the Patawalonga River and Brown Hill Creek. The Patawalonga River drains an area formerly known as the Cowandilla Plains, which were modified by engineering works to enable the development of Adelaide Airport and residential housing. Brown Hill Creek, also known as Willawilla in the Kaurna language, is identified as part of the Patawalonga River catchment.\n\nTo generate a question that is semantically equivalent to the original, we need to analyze the given information and identify key elements. The original question asks for the name of the creek that is part of the river located in the western suburbs of the Adelaide metropolitan area in South Australia.\n\n1. **Thoughtful Content Examination**: The context provides information about the Patawalonga River and Brown Hill Creek, both located in the western suburbs of Adelaide. The central idea is to identify the creek associated with the Patawalonga River.\n\n2. **Concept Exploration**: The context implies a geographical and hydrological relationship between Brown Hill Creek and the Patawalonga River, as the creek is part of the river's catchment.\n\n3. **Strategic Complexity Calibration**: The difficulty level of the original question is relatively low as it directly asks for the name of the creek. To increase complexity, we can rephrase the question to require more nuanced understanding or inference.\n\n4. **Intentional Question Planning**: The rephrased question should invite deeper understanding or reflection. For example, asking about the significance of Brown Hill Creek in relation to the Patawalonga River or its role in the catchment area could enhance the question's depth.\n\nGiven the context and the original question, we can rephrase it to maintain semantic equivalence while enhancing clarity and complexity.\n\n</document_analysis>\n\n<output_format>\nQuestion: What is the name of the watercourse, also known by its indigenous name Willawilla, that is part of the Patawalonga River catchment in the western suburbs of Adelaide?\nA: Brown Hill Creek\nB: Cowandilla Creek\nC: Patawalonga Creek\nD: Adelaide Creek\n\nExplanation: The correct answer is Brown Hill Creek because it is identified in the context as being part of the Patawalonga River catchment and is also known as Willawilla in the Kaurna language.\n\nCorrect Answer: A\n</output_format>",
    "question": "What is the name of the watercourse, also known by its indigenous name Willawilla, that is part of the Patawalonga River catchment in the western suburbs of Adelaide?",
    "choices": {
      "A": "Brown Hill Creek",
      "B": "Cowandilla Creek",
      "C": "Patawalonga Creek",
      "D": "Adelaide Creek"
    },
    "answer": "A",
    "explanation": "The correct answer is Brown Hill Creek because it is identified in the context as being part of the Patawalonga River catchment and is also known as Willawilla in the Kaurna language.",
    "answer_correctness_score": 10,
    "explanation_validity_score": 10,
    "question_clarity_score": 8,
    "question_difficulty_score": 7,
    "question_groundedness_score": 10,
    "question_token_count": 38,
    "reformat_question_cosine_similarity_to_orig": 0.6679328680038452,
    "reformat_answer_cosine_similarity_to_orig": 1.000000238418579,
    "reformat_question_similarity_score": 9,
    "reformat_answer_similarity_score": 10,
    "avg_answer_token_count": 4
  },
  {
    "orig_question": "The Mercurial Vapor is a football boot worn by which Brazilian footballer who plays for Liverpool?",
    "orig_answer": "Philippe Coutinho Correia",
    "context": "[PAR] [TLE] Philippe Coutinho [SEP] Philippe Coutinho Correia (] ; born 12 June 1992) is a Brazilian professional footballer who plays as an attacking midfielder for Premier League club Liverpool and the Brazil national team. [PAR] [TLE] Nike Mercurial Vapor [SEP] The Mercurial Vapor is a football boot manufactured by Nike.  The boot is known for being lightweight.  Because of this, the boot is endorsed by many players for whom speed is part of their game, notably wingers or strikers, such as Cristiano Ronaldo, Franck Rib\u00e9ry, Luiz Adriano, Zlatan Ibrahimovi\u0107, Didier Drogba, Jes\u00fas Navas, Luka Modri\u0107, Arturo Vidal, Douglas Costa, Xherdan Shaqiri, Raheem Sterling, Stephan El Shaarawy, Eden Hazard, Alexis S\u00e1nchez, Carlos Bacca and Philippe Coutinho, among others.",
    "response": "<document_analysis>\nThe given context provides information about Philippe Coutinho, a Brazilian professional footballer, and the Nike Mercurial Vapor football boot. The task is to rephrase and rewrite the question and answer pair based on the provided information.\n\n1. **Thoughtful Content Examination**: The context informs us that Philippe Coutinho is a Brazilian footballer who plays for Liverpool and that he endorses the Nike Mercurial Vapor boot. The question connects these pieces of information by asking about a Brazilian footballer who plays for Liverpool and wears the Mercurial Vapor boot.\n\n2. **Concept Exploration**: The implicit assumption is that the Mercurial Vapor boot is associated with players who value speed. The context also lists several notable footballers who endorse this boot, including Philippe Coutinho.\n\n3. **Strategic Complexity Calibration**: The original question is straightforward and can be rated as a 2 in terms of difficulty. To increase complexity, the question can be rephrased to require more nuanced understanding or additional information from the context.\n\n4. **Intentional Question Planning**: The rewritten question should invite deeper understanding or critical engagement. It can be made more challenging by incorporating more details or requiring the test-taker to make connections between different pieces of information.\n\nUpon analyzing the context, it's clear that the question can be rephrased to include more details and challenge the test-taker's understanding. The answer should remain semantically equivalent to the original answer, \"Philippe Coutinho Correia.\"\n\n</document_analysis>\n\n<output_format>\nQuestion: Which Brazilian footballer, known for playing as an attacking midfielder for Liverpool, is among the notable players who endorse the Nike Mercurial Vapor football boot, a product recognized for its lightweight design?\nA: Philippe Coutinho Correia\nB: Cristiano Ronaldo\nC: Luka Modri\u0107\nD: Eden Hazard\n\nExplanation: The correct answer is Philippe Coutinho Correia because he is a Brazilian footballer who plays for Liverpool and is mentioned among the players who endorse the Nike Mercurial Vapor boot.\n\nCorrect Answer: A\n</output_format>",
    "question": "Which Brazilian footballer, known for playing as an attacking midfielder for Liverpool, is among the notable players who endorse the Nike Mercurial Vapor football boot, a product recognized for its lightweight design?",
    "choices": {
      "A": "Philippe Coutinho Correia",
      "B": "Cristiano Ronaldo",
      "C": "Luka Modri\u0107",
      "D": "Eden Hazard"
    },
    "answer": "A",
    "explanation": "The correct answer is Philippe Coutinho Correia because he is a Brazilian footballer who plays for Liverpool and is mentioned among the players who endorse the Nike Mercurial Vapor boot.",
    "answer_correctness_score": 10,
    "explanation_validity_score": 10,
    "question_clarity_score": 7,
    "question_difficulty_score": 6,
    "question_groundedness_score": 10,
    "question_token_count": 40,
    "reformat_question_cosine_similarity_to_orig": 0.8785131573677063,
    "reformat_answer_cosine_similarity_to_orig": 0.9999998807907104,
    "reformat_question_similarity_score": 9,
    "reformat_answer_similarity_score": 10,
    "avg_answer_token_count": 5
  },
  {
    "orig_question": "Gianni Schicchi is a comic opera in one act by Giacomo Puccini to an Italian libretto by Giovacchino Forzano, composed in 1917\u201318, the  aria \"O mio babbino caro\" is one of the most popular arias in opera, is a soprano aria from the opera \"Gianni Schicchi\" in what year, by Giacomo Puccini to a libretto by Giovacchino Forzano?",
    "orig_answer": "1918",
    "context": "[PAR] [TLE] Gianni Schicchi [SEP] Gianni Schicchi (] ) is a comic opera in one act by Giacomo Puccini to an Italian libretto by Giovacchino Forzano, composed in 1917\u201318.  The libretto is based on an incident mentioned in Dante's \"Divine Comedy\".  The work is the third and final part of Puccini's \"Il trittico\" (The Triptych)\u2014three one-act operas with contrasting themes, originally written to be presented together.  Although it continues to be performed with one or both of the other \"trittico\" operas, \"Gianni Schicchi\" is now more frequently staged either alone or with short operas by other composers.  The aria \"O mio babbino caro\" is one of Puccini's best known, and one of the most popular arias in opera. [PAR] [TLE] O mio babbino caro [SEP] \"O mio babbino caro \" (\"Oh My Beloved Father\") is a soprano aria from the opera \"Gianni Schicchi\" (1918) by Giacomo Puccini to a libretto by Giovacchino Forzano.  It is sung by Lauretta after tensions between her father Schicchi and the family of Rinuccio, the boy she loves, have reached a breaking point that threatens to separate her from Rinuccio.  It provides an interlude expressing lyrical simplicity and single-hearted love in contrast with the atmosphere of hypocrisy, jealousy, double-dealing, and feuding in the medieval Florence of Puccini's only comedy.  It provides the only set-piece in the through-composed opera.",
    "response": "<document_analysis>\nThe given context provides information about the opera \"Gianni Schicchi\" and the aria \"O mio babbino caro\". The first paragraph discusses \"Gianni Schicchi\" as a comic opera by Giacomo Puccini, composed in 1917-18, and mentions that it is part of \"Il trittico\". It also notes that \"O mio babbino caro\" is one of Puccini's best-known arias. The second paragraph focuses on \"O mio babbino caro\", describing it as a soprano aria from \"Gianni Schicchi\", sung by Lauretta, and provides the year of the opera's composition as 1918.\n\nThe question asks for the year when \"O mio babbino caro\", a soprano aria from \"Gianni Schicchi\", was composed by Giacomo Puccini to a libretto by Giovacchino Forzano. The answer provided is \"1918\".\n\nUpon analyzing the context, it's clear that \"Gianni Schicchi\" was composed in 1917-18, and the aria \"O mio babbino caro\" is part of this opera. The context directly states that \"O mio babbino caro\" is from the opera \"Gianni Schicchi\" (1918).\n\nTo create a more challenging and thoughtful question, we can rephrase it to require deeper understanding or more specific information from the context.\n\nThought Process:\n1. Identify the key elements: The opera \"Gianni Schicchi\", the aria \"O mio babbino caro\", and the composer Giacomo Puccini.\n2. Understand the context: \"Gianni Schicchi\" is a comic opera composed in 1917-18, and \"O mio babbino caro\" is a part of it.\n3. Determine the complexity: The original question is straightforward and fact-based. To increase complexity, we can ask for more specific information or context.\n\nThe original question is rephrased to: \"In what year was the soprano aria 'O mio babbino caro' from the opera 'Gianni Schicchi' by Giacomo Puccini composed?\"\n\nThis rephrased question still seeks the same information (the year 1918) but is more focused on the aria and its context within the opera.\n\nTo further enhance the question's complexity and adhere to the guidelines, we can make it more analytical or application-based.\n\n</document_analysis>\n\n<output_format>\nQuestion: What year did Giacomo Puccini compose the opera \"Gianni Schicchi\", from which the renowned soprano aria \"O mio babbino caro\" originates?\nA: 1917\nB: 1918\nC: 1919\nD: 1920\nExplanation: The context states that \"Gianni Schicchi\" was composed in 1917-18, and \"O mio babbino caro\" is a part of this opera. The correct year associated with the completion or reference to \"Gianni Schicchi\" is 1918.\nCorrect Answer: B\n</output_format>",
    "question": "What year did Giacomo Puccini compose the opera \"Gianni Schicchi\", from which the renowned soprano aria \"O mio babbino caro\" originates?",
    "choices": {
      "A": "1917",
      "B": "1918",
      "C": "1919",
      "D": "1920"
    },
    "answer": "B",
    "explanation": "The context states that \"Gianni Schicchi\" was composed in 1917-18, and \"O mio babbino caro\" is a part of this opera. The correct year associated with the completion or reference to \"Gianni Schicchi\" is 1918.",
    "answer_correctness_score": 10,
    "explanation_validity_score": 10,
    "question_clarity_score": 8,
    "question_difficulty_score": 4,
    "question_groundedness_score": 10,
    "question_token_count": 35,
    "reformat_question_cosine_similarity_to_orig": 0.9107316732406616,
    "reformat_answer_cosine_similarity_to_orig": 0.9999998807907104,
    "reformat_question_similarity_score": 9,
    "reformat_answer_similarity_score": 10,
    "avg_answer_token_count": 3
  },
  {
    "orig_question": "What actor of the 1986 film The Color of Money, voiced the animated, anthropomorphic retired race car who appears in the 2006 Pixar film \"Cars\" as a medical doctor and a local judge?",
    "orig_answer": "Paul Newman",
    "context": "[PAR] [TLE] Doc Hudson [SEP] Doc Hudson (\"Dr. Hudson\" or simply \"Doc\") was an animated, anthropomorphic retired race car who appears in the 2006 Pixar film \"Cars\" as a medical doctor and a local judge.  He is voiced by actor Paul Newman in the first and third films and video game, and Corey Burton in all other media.  Six-time Turismo Carretera champion Juan Mar\u00eda Traverso voiced the character in the Rioplatense Spanish version.  He is modeled after a 1951 Hudson Hornet. [PAR] [TLE] Paul Newman [SEP] Paul Leonard Newman (January 26, 1925 \u2013 September 26, 2008) was an American actor, film director, producer, race car driver, IndyCar owner, entrepreneur, activist, and philanthropist.  He won and was nominated for numerous awards, winning an Academy Award for his performance in the 1986 film \"The Color of Money\", a BAFTA Award, a Screen Actors Guild Award, a Cannes Film Festival Award, an Emmy Award, and many others.  Newman's other roles include the title characters in \"The Hustler\" (1961) and \"Cool Hand Luke\" (1967), as well as \"Butch Cassidy and the Sundance Kid\" (1969), as Butch Cassidy, \"The Sting\" (1973), and \"The Verdict\" (1982).  He also voiced Doc Hudson in the first installment of Disney-Pixar's \"Cars\", and received a posthumous credit for his voice recordings in \"Cars 3\" (2017).",
    "response": "<document_analysis>\nTo address the task, I will first analyze the given context, question, and answer. The context provides information about Doc Hudson, a character from the Pixar film \"Cars,\" and Paul Newman, an American actor. The question asks for the actor from the 1986 film \"The Color of Money\" who voiced Doc Hudson in \"Cars.\" The answer is Paul Newman.\n\n1. **Thoughtful Content Examination**: The context informs us that Doc Hudson is a character in \"Cars\" (2006) voiced by Paul Newman. It also tells us that Paul Newman was an actor who won an Academy Award for his role in \"The Color of Money\" (1986). The central idea is the connection between Paul Newman's acting career and his voice acting role in \"Cars.\"\n\n2. **Concept Exploration**: The information implicitly suggests that Paul Newman's voice acting role in \"Cars\" is linked to his status as a notable actor, having won significant awards. The underlying theory here is that well-known actors are sometimes chosen for voice roles in animated films due to their recognition and prestige.\n\n3. **Strategic Complexity Calibration**: The original question is straightforward and factual. To increase complexity, I will rephrase it to encourage deeper understanding or critical engagement. The difficulty level is initially low (around 2-3), so I will aim to increase it to around 6-7 by making the question more analytical or application-based.\n\n4. **Intentional Question Planning**: To invite deeper understanding, I will consider how Paul Newman's career and achievements relate to his role in \"Cars\" and how this reflects on his legacy or the film's production choices.\n\nGiven the context and the original question, I will now generate a new question that is semantically equivalent but encourages more reflection and insight.\n\n</document_analysis>\n\n<output_format>\nQuestion: Which Academy Award-winning actor, known for his iconic role in the 1986 film \"The Color of Money,\" lent his voice to the character of Doc Hudson, a medical doctor and local judge in the 2006 Pixar animated film \"Cars\"?\nA: Tom Hanks\nB: Paul Newman\nC: Robert De Niro\nD: Clint Eastwood\nExplanation: Paul Newman is the correct answer because he won an Academy Award for \"The Color of Money\" and voiced Doc Hudson in \"Cars.\"\nCorrect Answer: B\n</output_format>\n\nThis revised question is more detailed and includes more context, making it self-contained. It requires the test-taker to connect Paul Newman's achievements (winning an Academy Award) with his voice acting role, thus encouraging a deeper understanding of the information provided. The answer options are distinct and unambiguous, and the correct answer is among them.",
    "question": "Which Academy Award-winning actor, known for his iconic role in the 1986 film \"The Color of Money,\" lent his voice to the character of Doc Hudson, a medical doctor and local judge in the 2006 Pixar animated film \"Cars\"?",
    "choices": {
      "A": "Tom Hanks",
      "B": "Paul Newman",
      "C": "Robert De Niro",
      "D": "Clint Eastwood"
    },
    "answer": "B",
    "explanation": "Paul Newman is the correct answer because he won an Academy Award for \"The Color of Money\" and voiced Doc Hudson in \"Cars.\"",
    "answer_correctness_score": 10,
    "explanation_validity_score": 10,
    "question_clarity_score": 9,
    "question_difficulty_score": 7,
    "question_groundedness_score": 10,
    "question_token_count": 52,
    "reformat_question_cosine_similarity_to_orig": 0.8753782510757446,
    "reformat_answer_cosine_similarity_to_orig": 1.0,
    "reformat_question_similarity_score": 10,
    "reformat_answer_similarity_score": 10,
    "avg_answer_token_count": 4
  },
  {
    "orig_question": "in which armed labor conflict did Charles Everett lively play a major role?",
    "orig_answer": "The Coal Wars",
    "context": "[PAR] [TLE] Charles Everett Lively [SEP] Charles Everett Lively (1887\u20131962) was a private detective affiliated with the Baldwin-Felts Detective Agency.  He played an active role in the Coal Wars in Appalachia, and is chiefly remembered as one of the assassins of Police Chief Sid Hatfield. [PAR] [TLE] Coal Wars [SEP] The Coal Wars, or the Coal Mine Wars, were a series of armed labor conflicts in the United States, roughly between 1890 and 1930.  Although they occurred mainly in the East, particularly in Appalachia, there was a significant amount of violence in Colorado after the turn of the century.",
    "response": "<document_analysis>\nTo address this task, let's begin by analyzing the given context and question.\n\n1. **Thoughtful Content Examination**: The context provides information about Charles Everett Lively, his affiliation with the Baldwin-Felts Detective Agency, and his role in the Coal Wars in Appalachia. It also gives a brief overview of the Coal Wars, including their timeframe and geographical locations.\n\n2. **Concept Exploration**: The key concepts here involve understanding who Charles Everett Lively was, his role in historical events, and the nature of the Coal Wars. The information implies that Lively was involved in significant labor conflicts, specifically the Coal Wars.\n\n3. **Strategic Complexity Calibration**: The original question is straightforward and factual. To increase complexity, we could rephrase it to require more nuanced understanding or application of the information provided.\n\n4. **Intentional Question Planning**: We can create a question that not only tests factual recall but also invites deeper understanding. For example, instead of asking directly about the event, we could ask about the context or implications of Lively's actions.\n\nUpon examining the content, it's clear that the question is about Charles Everett Lively's involvement in a significant historical labor conflict. The context provides sufficient information to rephrase the question and answer without losing their original meaning.\n\nThe original question is: \"in which armed labor conflict did Charles Everett lively play a major role?\"\nThe original answer is: \"The Coal Wars\"\n\nGiven the context and the objective to create a semantically equivalent question and answer pair with higher complexity, let's proceed.\n\n</document_analysis>\n\n<output_format>\nQuestion: What series of armed labor conflicts in the United States, primarily occurring between 1890 and 1930, involved Charles Everett Lively, a private detective affiliated with the Baldwin-Felts Detective Agency?\nA: The Industrial Revolution\nB: The Labor Movement Riots\nC: The Coal Wars\nD: The Mining Strikes\n\nExplanation: The correct answer is \"The Coal Wars\" because the context explicitly states that Charles Everett Lively played an active role in the Coal Wars in Appalachia and is known for his involvement in this series of armed labor conflicts.\n\nCorrect Answer: C\n</output_format>",
    "question": "What series of armed labor conflicts in the United States, primarily occurring between 1890 and 1930, involved Charles Everett Lively, a private detective affiliated with the Baldwin-Felts Detective Agency?",
    "choices": {
      "A": "The Industrial Revolution",
      "B": "The Labor Movement Riots",
      "C": "The Coal Wars",
      "D": "The Mining Strikes"
    },
    "answer": "C",
    "explanation": "The correct answer is \"The Coal Wars\" because the context explicitly states that Charles Everett Lively played an active role in the Coal Wars in Appalachia and is known for his involvement in this series of armed labor conflicts.",
    "answer_correctness_score": 10,
    "explanation_validity_score": 10,
    "question_clarity_score": 6,
    "question_difficulty_score": 5,
    "question_groundedness_score": 10,
    "question_token_count": 42,
    "reformat_question_cosine_similarity_to_orig": 0.649131178855896,
    "reformat_answer_cosine_similarity_to_orig": 1.0,
    "reformat_question_similarity_score": 9,
    "reformat_answer_similarity_score": 10,
    "avg_answer_token_count": 4
  },
  {
    "orig_question": "Grandtheft remixed the Rhianna song released on what date?",
    "orig_answer": "March 26, 2015",
    "context": "[PAR] [TLE] Grandtheft [SEP] Aaron Waisglass, better known by his stage name Grandtheft, is a Canadian DJ and musician based in Toronto.  He is signed to Diplo's record label Mad Decent.  He gained recognition as a trap artist, for remixing songs like \u201cSummer\u201c, \u201cSweet Nothing\u201c and \u201cBitch Better Have My Money\u201d and having songs charted around the world. [PAR] [TLE] Bitch Better Have My Money [SEP] \"Bitch Better Have My Money\" is a song recorded by Barbadian singer Rihanna.  It was written by Jamille Pierre, Bibi Bourelly, Rihanna, Travis Scott, Kanye West and WondaGurl and produced by Deputy, co-produced by West, together with additional production by Scott and WondaGurl.  The song was digitally released on March 26, 2015, through the iTunes Store.  \"Bitch Better Have My Money\" is a trap song and represents a notable musical departure from the previous single, \"FourFiveSeconds\".",
    "response": "<document_analysis>\nTo generate a question that is semantically equivalent to the original, I will analyze the given context, question, and answer. The context provides information about Grandtheft, a Canadian DJ and musician, and his work, including remixing Rihanna's song \"Bitch Better Have My Money.\" It also gives details about the song, such as its release date and production.\n\nThe original question asks for the release date of the Rihanna song remixed by Grandtheft. The answer provided is \"March 26, 2015.\" Upon examining the context, it's clear that \"Bitch Better Have My Money\" is the song in question, and it was released digitally on March 26, 2015.\n\nTo create a new question that is challenging and encourages deeper understanding, I will rephrase the original question while maintaining its semantic equivalence. The new question should be clear, detailed, and answerable by a domain expert without directly referencing the context paragraph.\n\nThe thought process involves understanding that the question is about the release date of \"Bitch Better Have My Money\" by Rihanna, which Grandtheft remixed. The context provides the necessary information to rephrase the question effectively.\n\n</document_analysis>\n\n<output_format>\nQuestion: What is the digital release date of the Rihanna song that Grandtheft remixed, which marked a notable musical departure from her previous single \"FourFiveSeconds\"?\nA: March 25, 2015\nB: March 26, 2015\nC: March 27, 2015\nD: March 28, 2015\nExplanation: The song \"Bitch Better Have My Money\" by Rihanna was digitally released on March 26, 2015, and it is known that Grandtheft remixed this song. This date is significant as it represents the release of a trap song that diverged from Rihanna's previous single \"FourFiveSeconds.\"\nCorrect Answer: B\n</output_format>",
    "question": "What is the digital release date of the Rihanna song that Grandtheft remixed, which marked a notable musical departure from her previous single \"FourFiveSeconds\"?",
    "choices": {
      "A": "March 25, 2015",
      "B": "March 26, 2015",
      "C": "March 27, 2015",
      "D": "March 28, 2015"
    },
    "answer": "B",
    "explanation": "The song \"Bitch Better Have My Money\" by Rihanna was digitally released on March 26, 2015, and it is known that Grandtheft remixed this song. This date is significant as it represents the release of a trap song that diverged from Rihanna's previous single \"FourFiveSeconds.\"",
    "answer_correctness_score": 10,
    "explanation_validity_score": 10,
    "question_clarity_score": 4,
    "question_difficulty_score": 6,
    "question_groundedness_score": 8,
    "question_token_count": 35,
    "reformat_question_cosine_similarity_to_orig": 0.7911945581436157,
    "reformat_answer_cosine_similarity_to_orig": 1.0,
    "reformat_question_similarity_score": 9,
    "reformat_answer_similarity_score": 10,
    "avg_answer_token_count": 8
  },
  {
    "orig_question": "Where did the younger brother of Titus Davis play college football?",
    "orig_answer": "Western Michigan",
    "context": "[PAR] [TLE] Titus Davis [SEP] Titus Davis (born January 3, 1993) is an American football wide receiver who is currently a free agent.  He was signed by the San Diego Chargers as an undrafted free agent in 2015.  He played college football at Central Michigan.  His younger brother, Corey Davis is a wide receiver for the Tennessee Titans. [PAR] [TLE] Corey Davis (wide receiver) [SEP] Corey Davis (born January 11, 1995) is an American football wide receiver for the Tennessee Titans of the National Football League (NFL).  He played college football at Western Michigan, where he became the NCAA's career receiving yards leader.  He was drafted by the Titans fifth overall in the 2017 NFL Draft.",
    "response": "<document_analysis>\nTo generate a question that is semantically equivalent to the original, I will first analyze the given context and identify the central idea. The context provides information about two brothers, Titus Davis and Corey Davis, both American football wide receivers. The key details include their birth dates, the teams they played for, and their college football backgrounds.\n\n1. **Thoughtful Content Examination**: The context mentions that Titus Davis played college football at Central Michigan and that his younger brother, Corey Davis, played for the Tennessee Titans. It further states that Corey Davis played college football at Western Michigan.\n\n2. **Concept Exploration**: The implicit assumption here is that the family background or the relation between the two brothers might have some relevance, but the primary focus is on their individual careers in football.\n\n3. **Strategic Complexity Calibration**: The original question is straightforward and factual. To increase complexity, I will rephrase it to require a deeper understanding or a bit more inference.\n\n4. **Intentional Question Planning**: The new question should still be factual but might involve slightly more analysis or understanding of the relationships between the individuals mentioned.\n\nUpon analyzing the context, I find that the information provided is relevant and sufficient to generate a meaningful question. The original question asks where Titus Davis's younger brother played college football. The answer is Western Michigan.\n\nTo create a more complex question, I will rephrase it while maintaining semantic equivalence.\n\n</document_analysis>\n\n<output_format>\nQuestion: Which college did Corey Davis, the younger brother of Titus Davis, attend for his college football career?\nA: Central Michigan\nB: Western Michigan\nC: University of Michigan\nD: Michigan State\n\nExplanation: The context states that Corey Davis played college football at Western Michigan. Therefore, the correct answer is the one that corresponds to Western Michigan.\n\nCorrect Answer: B\n</output_format>",
    "question": "Which college did Corey Davis, the younger brother of Titus Davis, attend for his college football career?",
    "choices": {
      "A": "Central Michigan",
      "B": "Western Michigan",
      "C": "University of Michigan",
      "D": "Michigan State"
    },
    "answer": "B",
    "explanation": "The context states that Corey Davis played college football at Western Michigan. Therefore, the correct answer is the one that corresponds to Western Michigan.",
    "answer_correctness_score": 10,
    "explanation_validity_score": 10,
    "question_clarity_score": 8,
    "question_difficulty_score": 2,
    "question_groundedness_score": 10,
    "question_token_count": 21,
    "reformat_question_cosine_similarity_to_orig": 0.9155728816986084,
    "reformat_answer_cosine_similarity_to_orig": 0.9999998807907104,
    "reformat_question_similarity_score": 10,
    "reformat_answer_similarity_score": 10,
    "avg_answer_token_count": 3
  },
  {
    "orig_question": "The Kaep in the nickname of what Maerican football quarterback?",
    "orig_answer": "Colin Kaepernick",
    "context": "[PAR] [TLE] Kaep (disambiguation) [SEP] Kaep is a nickname for athlete Colin Kaepernick (although he prefers \"Kap\").  It may also refer to: [PAR] [TLE] Colin Kaepernick [SEP] Colin Rand Kaepernick ( ; born November 3, 1987) is an American football quarterback who is currently a free agent.  Kaepernick played college football at the University of Nevada, where he was named the Western Athletic Conference (WAC) Offensive Player of the Year twice and became the only player in NCAA Division I FBS history to amass 10,000 passing yards and 4,000 rushing yards in a career.  After graduating, he was selected by the San Francisco 49ers in the second round of the 2011 NFL Draft.",
    "response": "<document_analysis>\nThe given context is about the nickname \"Kaep\" and its association with Colin Kaepernick, an American football quarterback. The context provides information about Colin Kaepernick's background, his achievements in college football, and his selection in the NFL Draft. The original question asks about the American football quarterback associated with the nickname \"Kaep.\" The answer provided is \"Colin Kaepernick.\"\n\nTo rephrase and rewrite the question and answer, I will first analyze the content and identify the central idea, which is the connection between \"Kaep\" and Colin Kaepernick. The context also provides additional details about Colin Kaepernick's career and achievements.\n\nUpon examining the content, it is clear that \"Kaep\" is a nickname for Colin Kaepernick. The question should be rewritten to reflect this information in a more nuanced and challenging way.\n\nThe complexity of the question is rated as 2 out of 10, as it is relatively straightforward. To increase the complexity, the question can be rephrased to require more critical thinking or deeper understanding.\n\nThe thought process involves considering how to rephrase the question to make it more engaging and challenging while maintaining its semantic equivalence to the original question. One possible approach is to provide more context or details in the question and frame it in a way that requires the test-taker to demonstrate a deeper understanding of the subject.\n\n</document_analysis>\n\n<output_format>\nQuestion: Which American football quarterback is commonly referred to by the nickname \"Kaep,\" a moniker derived from his last name?\nA: Colin Kaepernick\nB: Tom Brady\nC: Aaron Rodgers\nD: Russell Wilson\nExplanation: The nickname \"Kaep\" is associated with Colin Kaepernick, although he prefers to be called \"Kap.\" This nickname is derived from his last name, Kaepernick.\nCorrect Answer: A\n</output_format>\n\nThe rewritten question is designed to be more detailed and self-contained, providing sufficient context for a domain expert to answer without referencing the original context. The answer options are distinct and unambiguous, and the correct answer is clearly indicated. The question and answer are semantically equivalent to the originals, ensuring that the rewritten version maintains the same meaning and content.",
    "question": "Which American football quarterback is commonly referred to by the nickname \"Kaep,\" a moniker derived from his last name?",
    "choices": {
      "A": "Colin Kaepernick",
      "B": "Tom Brady",
      "C": "Aaron Rodgers",
      "D": "Russell Wilson"
    },
    "answer": "A",
    "explanation": "The nickname \"Kaep\" is associated with Colin Kaepernick, although he prefers to be called \"Kap.\" This nickname is derived from his last name, Kaepernick.",
    "answer_correctness_score": 10,
    "explanation_validity_score": 10,
    "question_clarity_score": 6,
    "question_difficulty_score": 4,
    "question_groundedness_score": 10,
    "question_token_count": 25,
    "reformat_question_cosine_similarity_to_orig": 0.8659853935241699,
    "reformat_answer_cosine_similarity_to_orig": 1.0,
    "reformat_question_similarity_score": 9,
    "reformat_answer_similarity_score": 10,
    "avg_answer_token_count": 4
  },
  {
    "orig_question": "In what city and state is The AXIS located?",
    "orig_answer": "Paradise, Nevada",
    "context": "[PAR] [TLE] Planet Hollywood Las Vegas [SEP] Planet Hollywood Las Vegas (formerly Tally-Ho, King's Crown and Aladdin) is a hotel and casino located on the Las Vegas Strip in Paradise, Nevada.  It is owned and operated by Caesars Entertainment Corporation. [PAR] [TLE] The AXIS [SEP] The AXIS (known as The AXIS powered by Monster for sponsorship purposes, also referred to as the AXIS Theater) is a mid-sized auditorium located at Planet Hollywood Las Vegas on the Las Vegas Strip.  The venue hosts a variety of events from charity benefits, concerts and award shows.  It is used frequently for the beauty pageants : Miss Universe, Miss America and Miss USA.  Since 2007, the auditorium has been the home to Justin Timberlake's annual concert to benefit the Shriners Hospitals for Children.  In 2011, it was voted as one of the \"Best Concert Halls & Theaters In Las Vegas\".  It is the largest theatre of its kind in the United States.",
    "response": "<document_analysis>\nTo generate a question that is semantically equivalent to the original, I will first analyze the given context, question, and answer. The context provides information about Planet Hollywood Las Vegas and its venue, The AXIS. The original question asks for the location of The AXIS in terms of city and state. The answer provided is \"Paradise, Nevada.\"\n\nUpon examining the context, it's clear that The AXIS is located at Planet Hollywood Las Vegas, which is on the Las Vegas Strip in Paradise, Nevada. The context does not directly state the location of The AXIS but implies it through its association with Planet Hollywood Las Vegas.\n\nTo create a more challenging and nuanced question, I will rephrase the original question while maintaining its semantic equivalence. I will ensure that the rewritten question is clear, contains sufficient context, and is answerable by a domain expert without needing the original context paragraph.\n\nThe complexity of the question is rated as 2 out of 10, as it requires basic knowledge of the location of Planet Hollywood Las Vegas. To increase the complexity, I will embed the question within a more detailed scenario.\n\n</document_analysis>\n\n<output_format>\nQuestion: What is the city and state of the location where one would find The AXIS, a mid-sized auditorium associated with the Planet Hollywood resort on the Las Vegas Strip?\nA: Las Vegas, Nevada\nB: Paradise, Nevada\nC: Enterprise, Nevada\nD: Spring Valley, Nevada\nExplanation: The AXIS is located at Planet Hollywood Las Vegas, which is situated in Paradise, Nevada, on the Las Vegas Strip.\nCorrect Answer: B\n</output_format>\n\nHere is the thought process behind the generation of the question:\n- The original question is straightforward and asks for the city and state where The AXIS is located.\n- The context implies that The AXIS is located at Planet Hollywood Las Vegas.\n- Planet Hollywood Las Vegas is located in Paradise, Nevada.\n- The rewritten question embeds this information in a more detailed scenario, making it slightly more complex.\n- The answer options are distinct and unambiguous, with \"Paradise, Nevada\" being the correct answer.\n- The question is designed to be answerable by a domain expert without the need for the original context, as it contains sufficient relevant information.",
    "question": "What is the city and state of the location where one would find The AXIS, a mid-sized auditorium associated with the Planet Hollywood resort on the Las Vegas Strip?",
    "choices": {
      "A": "Las Vegas, Nevada",
      "B": "Paradise, Nevada",
      "C": "Enterprise, Nevada",
      "D": "Spring Valley, Nevada"
    },
    "answer": "B",
    "explanation": "The AXIS is located at Planet Hollywood Las Vegas, which is situated in Paradise, Nevada, on the Las Vegas Strip.",
    "answer_correctness_score": 10,
    "explanation_validity_score": 10,
    "question_clarity_score": 1,
    "question_difficulty_score": 2,
    "question_groundedness_score": 10,
    "question_token_count": 35,
    "reformat_question_cosine_similarity_to_orig": 0.513367235660553,
    "reformat_answer_cosine_similarity_to_orig": 1.000000238418579,
    "reformat_question_similarity_score": 9,
    "reformat_answer_similarity_score": 10,
    "avg_answer_token_count": 5
  },
  {
    "orig_question": "which American actress was the daughter of  Lipton",
    "orig_answer": "Kidada Ann Jones",
    "context": "[PAR] [TLE] Kidada Jones [SEP] Kidada Ann Jones (born March 22, 1974) is an American actress, model and fashion designer.  Jones is best known for her work as a designer for The Walt Disney Company, where she has a line known as Kidada for Disney Couture.  Jones is the daughter of composer Quincy Jones and actress Peggy Lipton. [PAR] [TLE] Peggy Lipton [SEP] Margaret Ann \"Peggy\" Lipton (born August 30, 1946) is an American actress and former model.  Lipton became an overnight success through her best-known role as flower child Julie Barnes in the ABC counterculture television series \"The Mod Squad\" (1968\u20131973) for which she won the Golden Globe Award for Best Actress \u2013 Television Series Drama in 1970.  Her fifty-year career in television, film, and on stage included many roles, most notably that of Norma Jennings in David Lynch's surreal \"Twin Peaks\".  Lipton was married to the musician/producer Quincy Jones and is mother to their two daughters, Rashida Jones and Kidada Jones, who also became actresses.",
    "response": "<document_analysis>\nThe context provided is about Kidada Jones and her mother Peggy Lipton, both of whom are involved in the entertainment industry. Kidada Jones is described as an American actress, model, and fashion designer, known for her work with The Walt Disney Company. Peggy Lipton is highlighted as an American actress and former model with a significant career in television, film, and stage, notably in \"The Mod Squad\" and \"Twin Peaks.\" The question asks for the daughter of Peggy Lipton, and the answer given is Kidada Ann Jones.\n\n1. **Thoughtful Content Examination**: The context establishes a clear familial relationship between Kidada Jones and Peggy Lipton, stating that Kidada is the daughter of Peggy Lipton and Quincy Jones.\n2. **Concept Exploration**: The information implies that both Kidada Jones and her mother, Peggy Lipton, have careers in the entertainment industry, with Kidada following in her mother's footsteps as an actress.\n3. **Strategic Complexity Calibration**: The difficulty level of the question is relatively low (2/10) as it directly asks for a factual piece of information provided in the context. To increase complexity, the question could be rephrased to require more inference or deeper understanding.\n4. **Intentional Question Planning**: To enhance the question, it could be made more challenging by incorporating additional details or requiring the test-taker to make a connection between the information provided and the answer.\n\nGiven the straightforward nature of the original question and answer, I will rephrase them to increase complexity and depth while maintaining semantic equivalence.\n\n</document_analysis>\n\n<output_format>\nQuestion: Which American actress, known for her work as a designer for The Walt Disney Company, is the daughter of the Golden Globe Award-winning actress Peggy Lipton?\nA: Rashida Jones\nB: Kidada Ann Jones\nC: Margaret Ann Lipton\nD: Julie Barnes\n\nExplanation: The correct answer is Kidada Ann Jones because she is identified as the daughter of Peggy Lipton in the provided context. Peggy Lipton is known for her role in \"The Mod Squad,\" for which she won the Golden Globe Award. Kidada Ann Jones is also involved in the entertainment industry and is known for her work with Disney.\n\nCorrect Answer: B\n</output_format>",
    "question": "Which American actress, known for her work as a designer for The Walt Disney Company, is the daughter of the Golden Globe Award-winning actress Peggy Lipton?",
    "choices": {
      "A": "Rashida Jones",
      "B": "Kidada Ann Jones",
      "C": "Margaret Ann Lipton",
      "D": "Julie Barnes"
    },
    "answer": "B",
    "explanation": "The correct answer is Kidada Ann Jones because she is identified as the daughter of Peggy Lipton in the provided context. Peggy Lipton is known for her role in \"The Mod Squad,\" for which she won the Golden Globe Award. Kidada Ann Jones is also involved in the entertainment industry and is known for her work with Disney.",
    "answer_correctness_score": 10,
    "explanation_validity_score": 10,
    "question_clarity_score": 8,
    "question_difficulty_score": 6,
    "question_groundedness_score": 10,
    "question_token_count": 33,
    "reformat_question_cosine_similarity_to_orig": 0.6754845976829529,
    "reformat_answer_cosine_similarity_to_orig": 1.0,
    "reformat_question_similarity_score": 9,
    "reformat_answer_similarity_score": 10,
    "avg_answer_token_count": 5
  },
  {
    "orig_question": "In 2015, Matt Stone listed this episode of South Park as his third favorite that used a screen-capturing program for what operating system?",
    "orig_answer": "macOS",
    "context": "[PAR] [TLE] Snapz Pro X [SEP] Snapz Pro X is a utility program for macOS developed by Ambrosia Software.  It is designed to record movie-like screenshots of a computer monitor doing various actions, such as a user moving their mouse across the screen, clicking on desktop icons, typing text, et cetera.  It has been used commercially in the production of books, such as O'Reilly Media's series, \"The Missing Manual,\" and others.  The program was also used by South Park to create the Make Love, Not Warcraft episode. [PAR] [TLE] Make Love, Not Warcraft [SEP] \"Make Love, Not Warcraft\" is the eighth episode in the tenth season of the American animated television series \"South Park\".  The 147th episode overall, it first aired on Comedy Central in the United States on October 4, 2006.  In the episode, Cartman, Kyle, Stan, and Kenny enjoy playing the popular massively multiplayer online role-playing game \"World of Warcraft\".  When a high level player goes around killing other players in the game, they start playing the game every day to try to stop him.  The episode was written and directed by series co-creator Trey Parker.  In 2015, he and co-creator Matt Stone listed it as their third favorite episode of the series.",
    "response": "<document_analysis>\nThe provided context discusses Snapz Pro X, a utility program for macOS used for recording screenshots, and its use in various media, including an episode of South Park titled \"Make Love, Not Warcraft.\" The question asks about the operating system for which a screen-capturing program was used in an episode of South Park listed as a favorite by Matt Stone in 2015. The context mentions that Snapz Pro X is for macOS and that it was used in the production of the \"Make Love, Not Warcraft\" episode. Therefore, the question is relevant and answerable based on the given context.\n\nThe original question and answer are analyzed for clarity and complexity:\n- The original question is: \"In 2015, Matt Stone listed this episode of South Park as his third favorite that used a screen-capturing program for what operating system?\"\n- The original answer is: \"macOS\"\n\nThe original question contains a reference to \"this episode,\" which implies a specific episode being discussed, but it is not clear without the context. The question needs to be rephrased to include the specific episode and other relevant details to make it self-contained.\n\nThe complexity of the question is moderate, as it requires knowledge of the specific episode and the screen-capturing program used. To increase complexity, the question can be rephrased to require more nuanced understanding or additional information from the context.\n\n</document_analysis>\n\n<output_format>\nQuestion: When Trey Parker and Matt Stone listed \"Make Love, Not Warcraft,\" an episode of South Park that featured extensive use of a screen-capturing utility, as one of their favorites in 2015, what operating system was the screen-capturing program they used developed for?\nA: Windows\nB: macOS\nC: Linux\nD: Chrome OS\nExplanation: The screen-capturing utility used was Snapz Pro X, which is developed for macOS.\nCorrect Answer: B\n</output_format>",
    "question": "When Trey Parker and Matt Stone listed \"Make Love, Not Warcraft,\" an episode of South Park that featured extensive use of a screen-capturing utility, as one of their favorites in 2015, what operating system was the screen-capturing program they used developed for?",
    "choices": {
      "A": "Windows",
      "B": "macOS",
      "C": "Linux",
      "D": "Chrome OS"
    },
    "answer": "B",
    "explanation": "The screen-capturing utility used was Snapz Pro X, which is developed for macOS.",
    "answer_correctness_score": 10,
    "explanation_validity_score": 10,
    "question_clarity_score": 6,
    "question_difficulty_score": 5,
    "question_groundedness_score": 9,
    "question_token_count": 58,
    "reformat_question_cosine_similarity_to_orig": 0.7548990249633789,
    "reformat_answer_cosine_similarity_to_orig": 0.9999999403953552,
    "reformat_question_similarity_score": 9,
    "reformat_answer_similarity_score": 10,
    "avg_answer_token_count": 2
  },
  {
    "orig_question": "Who did the composer of \"Music for Electric Metronomes\" study with?",
    "orig_answer": "Tomojiro Ikenouchi, Kishio Hirao, and John Cage",
    "context": "[PAR] [TLE] Music for Electric Metronomes [SEP] Music for Electric Metronomes is an avant-garde aleatoric composition written in 1960 by Japanese composer Toshi Ichiyanagi for any number of performers between three and eight.  The piece involves the manipulation of electric metronomes, followed by various unspecified sounds and actions.  It is a very theatrical piece, and reflects Ichiyanagi's affiliation with Fluxus, an experimental art movement from the sixties.  The only true scored \"instrument\" is an electric metronome for each individual player, though the varying sounds and/or actions may involve many different instruments and objects at the discretion of the performer.  Because the graphic notation of score (which is a series of dashes, lines, and numbers in an erratic pattern of connected paths) leaves a lot of room for personal interpretation and expression, each performance is unique, and almost certainly cannot be reproduced.  There is no conductor for the performance.  It has been recorded on the album \"Toshi Ichiyanagi: 1960's & 1990's\".  In a review of a performance by the S.E.M. Ensemble in 1992 at the Paula Cooper Gallery, the music critic of \"The New York Times\", Alex Ross, described the piece as \"merely a timid, spastic prelude to Gy\u00f6rgy Ligeti's monumental \"Po\u00e8me symphonique\" for 100 metronomes\". [PAR] [TLE] Toshi Ichiyanagi [SEP] Toshi Ichiyanagi (\u4e00\u67f3 \u6167 , Ichiyanagi Toshi , born 4 February 1933) is a Japanese composer of avant-garde music.  He studied with Tomojiro Ikenouchi, Kishio Hirao, and John Cage.",
    "response": "<document_analysis>\nThe context provided gives information about Toshi Ichiyanagi, a Japanese composer, and his work \"Music for Electric Metronomes.\" It details his affiliation with the Fluxus art movement and the nature of his composition. The relevant information for the question is found in the second paragraph, which mentions that Toshi Ichiyanagi studied with Tomojiro Ikenouchi, Kishio Hirao, and John Cage. The question seeks to identify these individuals.\n\nThe task requires generating a question-answer pair that is semantically equivalent to the original but rephrased for clarity and complexity. The original question inquires about the individuals with whom the composer of \"Music for Electric Metronomes\" studied. The answer lists Tomojiro Ikenouchi, Kishio Hirao, and John Cage.\n\nTo enhance the question's complexity and encourage deeper understanding, we can rephrase it to include more context or details from the provided text. The goal is to create a question that is challenging yet answerable by a domain expert without directly referencing the original context.\n\nUpon analyzing the content, it's clear that Toshi Ichiyanagi is associated with avant-garde music and the Fluxus movement. The question can be rephrased to reflect this context, making it more specific and nuanced.\n\nThe thought process involves identifying the key elements: the composer (Toshi Ichiyanagi), his work (\"Music for Electric Metronomes\"), and his mentors (Tomojiro Ikenouchi, Kishio Hirao, and John Cage). By integrating these elements, we can craft a question that is both challenging and relevant to the domain expert.\n\n</document_analysis>\n\n<output_format>\nQuestion: Which influential figures in the avant-garde music scene guided Toshi Ichiyanagi, the composer behind the Fluxus-associated piece \"Music for Electric Metronomes,\" in his musical studies?\nA: Tomojiro Ikenouchi, Kishio Hirao, and Karlheinz Stockhausen\nB: Tomojiro Ikenouchi, Kishio Hirao, and John Cage\nC: John Cage, Gy\u00f6rgy Ligeti, and Karlheinz Stockhausen\nD: Tomojiro Ikenouchi, Gy\u00f6rgy Ligeti, and John Cage\nExplanation: The correct answer is B: Tomojiro Ikenouchi, Kishio Hirao, and John Cage, as they are mentioned in the context as the individuals with whom Toshi Ichiyanagi studied.\nCorrect Answer: B\n</output_format>",
    "question": "Which influential figures in the avant-garde music scene guided Toshi Ichiyanagi, the composer behind the Fluxus-associated piece \"Music for Electric Metronomes,\" in his musical studies?",
    "choices": {
      "A": "Tomojiro Ikenouchi, Kishio Hirao, and Karlheinz Stockhausen",
      "B": "Tomojiro Ikenouchi, Kishio Hirao, and John Cage",
      "C": "John Cage, Gy\u00f6rgy Ligeti, and Karlheinz Stockhausen",
      "D": "Tomojiro Ikenouchi, Gy\u00f6rgy Ligeti, and John Cage"
    },
    "answer": "B",
    "explanation": "The correct answer is B: Tomojiro Ikenouchi, Kishio Hirao, and John Cage, as they are mentioned in the context as the individuals with whom Toshi Ichiyanagi studied.",
    "answer_correctness_score": 10,
    "explanation_validity_score": 10,
    "question_clarity_score": 8,
    "question_difficulty_score": 7,
    "question_groundedness_score": 10,
    "question_token_count": 40,
    "reformat_question_cosine_similarity_to_orig": 0.6188622117042542,
    "reformat_answer_cosine_similarity_to_orig": 1.0,
    "reformat_question_similarity_score": 9,
    "reformat_answer_similarity_score": 10,
    "avg_answer_token_count": 19
  },
  {
    "orig_question": "What is the middle name of the character played by Ellie Kemper in a leading TV role?",
    "orig_answer": "Couger",
    "context": "[PAR] [TLE] Kimmy Schmidt [SEP] Kimberly Couger \"Kimmy\" Schmidt is the title character on the Netflix original series \"Unbreakable Kimmy Schmidt\". [PAR] [TLE] Ellie Kemper [SEP] Elizabeth Claire Kemper (born May 2, 1980) is an American actress and comedian.  She gained prominence when she starred in the NBC series \"The Office\" as receptionist Erin Hannon for the final five seasons.  After her role in \"The Office\", she was cast in a leading role as Kimmy Schmidt in the Netflix comedy series \"Unbreakable Kimmy Schmidt\", for which she has received critical acclaim.  Kemper is also known for her supporting roles in the films \"Bridesmaids\" (2011) and \"21 Jump Street\" (2012).",
    "response": "<document_analysis>\nTo generate a question that is semantically equivalent to the original, I will analyze the given context, question, and answer. The context provides information about the character \"Kimmy Schmidt\" from the Netflix series \"Unbreakable Kimmy Schmidt\" and about Ellie Kemper, the actress who plays Kimmy Schmidt. The original question asks for the middle name of the character played by Ellie Kemper in a leading TV role. The answer provided is \"Couger.\"\n\nUpon examining the context, it's clear that Ellie Kemper plays the character Kimberly Couger \"Kimmy\" Schmidt. Thus, \"Couger\" is indeed her middle name. The context directly supports the question and answer.\n\nTo create a rewritten question that is semantically equivalent and challenging, I will ensure it requires a deep understanding of the content. The question should be clear, self-contained, and encourage reflection or critical engagement.\n\nThe original question is straightforward and factual. To enhance it, I will rephrase it to maintain the same level of factual accuracy while ensuring it remains challenging and clear.\n\n</document_analysis>\n\n<output_format>\nQuestion: What is the middle name of Kimberly \"Kimmy\" Schmidt, the titular character of the Netflix series played by Ellie Kemper?\nA: Schmidt\nB: Kemper\nC: Couger\nD: Hannon\n\nExplanation: The correct answer is \"Couger\" because the character's full name is given as Kimberly Couger \"Kimmy\" Schmidt in the context.\n\nCorrect Answer: C\n</output_format>",
    "question": "What is the middle name of Kimberly \"Kimmy\" Schmidt, the titular character of the Netflix series played by Ellie Kemper?",
    "choices": {
      "A": "Schmidt",
      "B": "Kemper",
      "C": "Couger",
      "D": "Hannon"
    },
    "answer": "C",
    "explanation": "The correct answer is \"Couger\" because the character's full name is given as Kimberly Couger \"Kimmy\" Schmidt in the context.",
    "answer_correctness_score": 10,
    "explanation_validity_score": 10,
    "question_clarity_score": 8,
    "question_difficulty_score": 5,
    "question_groundedness_score": 8,
    "question_token_count": 28,
    "reformat_question_cosine_similarity_to_orig": 0.7615572214126587,
    "reformat_answer_cosine_similarity_to_orig": 0.9999998807907104,
    "reformat_question_similarity_score": 9,
    "reformat_answer_similarity_score": 10,
    "avg_answer_token_count": 3
  },
  {
    "orig_question": "The AXIS Theatre is owned by what Enertainment Corporation?",
    "orig_answer": "Caesars Entertainment Corporation",
    "context": "[PAR] [TLE] Planet Hollywood Las Vegas [SEP] Planet Hollywood Las Vegas (formerly Tally-Ho, King's Crown and Aladdin) is a hotel and casino located on the Las Vegas Strip in Paradise, Nevada.  It is owned and operated by Caesars Entertainment Corporation. [PAR] [TLE] The AXIS [SEP] The AXIS (known as The AXIS powered by Monster for sponsorship purposes, also referred to as the AXIS Theater) is a mid-sized auditorium located at Planet Hollywood Las Vegas on the Las Vegas Strip.  The venue hosts a variety of events from charity benefits, concerts and award shows.  It is used frequently for the beauty pageants : Miss Universe, Miss America and Miss USA.  Since 2007, the auditorium has been the home to Justin Timberlake's annual concert to benefit the Shriners Hospitals for Children.  In 2011, it was voted as one of the \"Best Concert Halls & Theaters In Las Vegas\".  It is the largest theatre of its kind in the United States.",
    "response": "<document_analysis>\nTo address the task, let's start by analyzing the given context, question, and answer.\n\n1. **Thoughtful Content Examination**: The context provided discusses Planet Hollywood Las Vegas, a hotel and casino, and its associated venue, The AXIS (also known as The AXIS Theater). Key information includes the ownership and operational details of Planet Hollywood Las Vegas and the uses of The AXIS.\n\n2. **Concept Exploration**: The context implies that The AXIS is a significant venue within Planet Hollywood Las Vegas, hosting various events. It is mentioned that Planet Hollywood Las Vegas is owned and operated by Caesars Entertainment Corporation. However, the context does not directly state that The AXIS is owned by Caesars Entertainment Corporation; it only directly states that Planet Hollywood Las Vegas, where The AXIS is located, is owned by Caesars Entertainment Corporation.\n\n3. **Strategic Complexity Calibration**: The original question is straightforward and factual. To increase complexity, we can rephrase it to require a deeper understanding or inference based on the given context.\n\n4. **Intentional Question Planning**: We can plan to create a question that invites deeper understanding by focusing on the relationship between The AXIS and its parent property, Planet Hollywood Las Vegas, and the ownership structure.\n\nGiven the context and the original question and answer, we can proceed to rephrase and rewrite them according to the guidelines.\n\nThe original question is: \"The AXIS Theatre is owned by what Entertainment Corporation?\"\nThe original answer is: \"Caesars Entertainment Corporation\"\n\nUpon analysis, it's clear that The AXIS is part of Planet Hollywood Las Vegas, and the ownership of Planet Hollywood Las Vegas is what's relevant. Thus, the question can be rephrased to reflect this relationship.\n\n</document_analysis>\n\n<output_format>\nQuestion: Given that The AXIS is a venue located within Planet Hollywood Las Vegas on the Las Vegas Strip, which entertainment corporation owns the property that houses The AXIS, considering Planet Hollywood Las Vegas is owned and operated by this corporation?\nA: MGM Resorts International\nB: Caesars Entertainment Corporation\nC: Wynn Resorts\nD: Las Vegas Sands Corp\n\nExplanation: The context states that Planet Hollywood Las Vegas is owned and operated by Caesars Entertainment Corporation. Since The AXIS is located within Planet Hollywood Las Vegas, it follows that Caesars Entertainment Corporation is the relevant entertainment corporation.\n\nCorrect Answer: B\n</output_format>",
    "question": "Given that The AXIS is a venue located within Planet Hollywood Las Vegas on the Las Vegas Strip, which entertainment corporation owns the property that houses The AXIS, considering Planet Hollywood Las Vegas is owned and operated by this corporation?",
    "choices": {
      "A": "MGM Resorts International",
      "B": "Caesars Entertainment Corporation",
      "C": "Wynn Resorts",
      "D": "Las Vegas Sands Corp"
    },
    "answer": "B",
    "explanation": "The context states that Planet Hollywood Las Vegas is owned and operated by Caesars Entertainment Corporation. Since The AXIS is located within Planet Hollywood Las Vegas, it follows that Caesars Entertainment Corporation is the relevant entertainment corporation.",
    "answer_correctness_score": 10,
    "explanation_validity_score": 10,
    "question_clarity_score": 8,
    "question_difficulty_score": 6,
    "question_groundedness_score": 8,
    "question_token_count": 46,
    "reformat_question_cosine_similarity_to_orig": 0.6956799030303955,
    "reformat_answer_cosine_similarity_to_orig": 1.0,
    "reformat_question_similarity_score": 8,
    "reformat_answer_similarity_score": 10,
    "avg_answer_token_count": 5
  },
  {
    "orig_question": "What is the middle name of the character Ellie Kemper portrays in the Netflix original series, \"Unbreakable Kimmy Schmidt\"?",
    "orig_answer": "Couger",
    "context": "[PAR] [TLE] Kimmy Schmidt [SEP] Kimberly Couger \"Kimmy\" Schmidt is the title character on the Netflix original series \"Unbreakable Kimmy Schmidt\". [PAR] [TLE] Ellie Kemper [SEP] Elizabeth Claire Kemper (born May 2, 1980) is an American actress and comedian.  She gained prominence when she starred in the NBC series \"The Office\" as receptionist Erin Hannon for the final five seasons.  After her role in \"The Office\", she was cast in a leading role as Kimmy Schmidt in the Netflix comedy series \"Unbreakable Kimmy Schmidt\", for which she has received critical acclaim.  Kemper is also known for her supporting roles in the films \"Bridesmaids\" (2011) and \"21 Jump Street\" (2012).",
    "response": "<document_analysis>\nTo address the task, let's start by analyzing the given context, question, and answer.\n\n1. **Thoughtful Content Examination**: The context provides information about the character \"Kimmy Schmidt\" from the Netflix series \"Unbreakable Kimmy Schmidt\" and about Ellie Kemper, the actress who plays Kimmy Schmidt. It mentions that Kimberly Couger \"Kimmy\" Schmidt is the full name of the character and that Ellie Kemper plays this role.\n\n2. **Concept Exploration**: The question asks for the middle name of the character Ellie Kemper portrays. The context directly states that the character's full name is Kimberly Couger \"Kimmy\" Schmidt, indicating that \"Couger\" is her middle name.\n\n3. **Strategic Complexity Calibration**: The difficulty level of this question is relatively low because it directly asks for information given in the context. However, it still requires understanding the context and identifying the relevant information.\n\n4. **Intentional Question Planning**: The question can be rephrased to invite deeper understanding or critical engagement. For example, instead of directly asking for the middle name, the question could be framed to test understanding of the character's full name and its relevance.\n\nGiven the context and the original question, we can proceed to rephrase and rewrite them according to the guidelines.\n\nThe original question is: \"What is the middle name of the character Ellie Kemper portrays in the Netflix original series, 'Unbreakable Kimmy Schmidt'?\"\nThe original answer is: \"Couger\"\n\nTo enhance the question, we can make it more specific and detailed while ensuring it remains self-contained and clear.\n\n</document_analysis>\n\n<output_format>\nQuestion: What is the middle name of Kimberly Schmidt, the titular character played by Ellie Kemper in the Netflix comedy series \"Unbreakable Kimmy Schmidt\"?\nA: Claire\nB: Couger\nC: Hannon\nD: Elizabeth\n\nExplanation: The context states that the character's full name is Kimberly Couger \"Kimmy\" Schmidt. Thus, her middle name is Couger.\n\nCorrect Answer: B\n</output_format>",
    "question": "What is the middle name of Kimberly Schmidt, the titular character played by Ellie Kemper in the Netflix comedy series \"Unbreakable Kimmy Schmidt\"?",
    "choices": {
      "A": "Claire",
      "B": "Couger",
      "C": "Hannon",
      "D": "Elizabeth"
    },
    "answer": "B",
    "explanation": "The context states that the character's full name is Kimberly Couger \"Kimmy\" Schmidt. Thus, her middle name is Couger.",
    "answer_correctness_score": 10,
    "explanation_validity_score": 10,
    "question_clarity_score": 3,
    "question_difficulty_score": 8,
    "question_groundedness_score": 1,
    "question_token_count": 32,
    "reformat_question_cosine_similarity_to_orig": 0.9138152003288269,
    "reformat_answer_cosine_similarity_to_orig": 0.9999997615814209,
    "reformat_question_similarity_score": 9,
    "reformat_answer_similarity_score": 10,
    "avg_answer_token_count": 2
  },
  {
    "orig_question": "Peter Daou is the creator of the website that refers to the number of votes won in what year's presidential election?",
    "orig_answer": "2016",
    "context": "[PAR] [TLE] Verrit [SEP] The website's slogan says it is \"media for the 65.8 million,\" referring to the number of votes Hillary Clinton won in the 2016 presidential election.  Daou, an adviser to Clinton's 2008 presidential campaign, and prior chief executive of Shareblue told \"Business Insider\" that he intended the website to \"reflect the worldview\" of those who voted for Clinton and described the site as an \"online hub for Clinton backers so that they can find easy-to-share facts, stats and other information you can take out to social media when you\u2019re having debates on key issues people are discussing\".  Daou also said the website had no financial ties to Clinton. [PAR] [TLE] Peter Daou [SEP] Peter Daou is the creator of Verrit, the prior chief executive of Shareblue, and a member of the band The Daou.",
    "response": "<document_analysis>\nTo generate a meaningful question-answer pair based on the provided context, let's first analyze the given information.\n\n1. **Thoughtful Content Examination**: The context discusses Peter Daou and his creation, Verrit, a website that references the number of votes Hillary Clinton won in the 2016 presidential election. It highlights Daou's background, his role in Clinton's 2008 campaign, and his position as the prior chief executive of Shareblue.\n\n2. **Concept Exploration**: The key concepts here include Peter Daou, Verrit, the 2016 presidential election, and Hillary Clinton. The context implies that Verrit's slogan is linked to the number of votes Clinton received in the 2016 election.\n\n3. **Strategic Complexity Calibration**: The original question is straightforward and factual. To increase complexity, we can rephrase it to require deeper understanding or more nuanced thinking.\n\n4. **Intentional Question Planning**: We aim to create a question that invites reflection or critical engagement. Given the context, we can formulate a question that not only tests factual recall but also understanding of the context and implications.\n\nUpon analyzing the context, it's clear that the original question is factual and relatively simple. To enhance it, we can make it more specific or application-based.\n\nThe original question is: \"Peter Daou is the creator of the website that refers to the number of votes won in what year's presidential election?\"\nThe answer is: \"2016\"\n\nTo rephrase this, we can create a more detailed and challenging question that still retains the core information.\n\n</document_analysis>\n\n<output_format>\nQuestion: What is the presidential election year referenced by Verrit's slogan, a website created by Peter Daou, which cites the number of votes received by Hillary Clinton?\nA: 2012\nB: 2016\nC: 2008\nD: 2020\n\nExplanation: Verrit's slogan references the number of votes Hillary Clinton won in the 2016 presidential election, making 2016 the correct answer.\n\nCorrect Answer: B\n</output_format>",
    "question": "What is the presidential election year referenced by Verrit's slogan, a website created by Peter Daou, which cites the number of votes received by Hillary Clinton?",
    "choices": {
      "A": "2012",
      "B": "2016",
      "C": "2008",
      "D": "2020"
    },
    "answer": "B",
    "explanation": "Verrit's slogan references the number of votes Hillary Clinton won in the 2016 presidential election, making 2016 the correct answer.",
    "answer_correctness_score": 10,
    "explanation_validity_score": 10,
    "question_clarity_score": 8,
    "question_difficulty_score": 2,
    "question_groundedness_score": 10,
    "question_token_count": 32,
    "reformat_question_cosine_similarity_to_orig": 0.7493997812271118,
    "reformat_answer_cosine_similarity_to_orig": 1.0,
    "reformat_question_similarity_score": 9,
    "reformat_answer_similarity_score": 10,
    "avg_answer_token_count": 3
  },
  {
    "orig_question": "The USS Elrod is named after a captain that attended what 2 universities?",
    "orig_answer": "University of Georgia and Yale University",
    "context": "[PAR] [TLE] Henry T. Elrod [SEP] Elrod was born on September 27, 1905, in Turner County, Georgia.  He enlisted in the Marine Corps in December 1927, and was appointed a Marine second lieutenant in February 1931.  He attended the University of Georgia and Yale University prior to his entry into the Marine Corps. [PAR] [TLE] USS Elrod (FFG-55) [SEP] USS \"Elrod\" (FFG-55), an \"Oliver Hazard Perry\"-class frigate, is a ship of the United States Navy named after Captain Henry T. Elrod (1905\u20131941), a Marine aviator who was posthumously awarded the Medal of Honor for his heroism in the defense of Wake Island in World War II.",
    "response": "<document_analysis>\nTo address this task, I will first analyze the given context, question, and answer to identify the central ideas and significant relationships within the provided text.\n\nThe context provides information about Henry T. Elrod and the USS Elrod (FFG-55). It mentions that Henry T. Elrod was born on September 27, 1905, in Turner County, Georgia, enlisted in the Marine Corps in December 1927, and was appointed a Marine second lieutenant in February 1931. It also notes that he attended the University of Georgia and Yale University before joining the Marine Corps. Additionally, the context states that the USS Elrod (FFG-55) is a ship named after Captain Henry T. Elrod, who was posthumously awarded the Medal of Honor for his heroism in the defense of Wake Island in World War II.\n\nThe question asks for the two universities attended by the captain after whom the USS Elrod is named. The answer provided is the University of Georgia and Yale University.\n\nUpon examining the content, I observe that the question is factual and straightforward, seeking specific information about the educational background of Captain Henry T. Elrod. The context clearly supports the answer by stating that Henry T. Elrod attended the University of Georgia and Yale University prior to his entry into the Marine Corps.\n\nTo enhance the question's complexity and encourage deeper understanding, I will rephrase it to incorporate more detail and context, making it more challenging and meaningful for a domain expert.\n\nMy thought process involves:\n1. Identifying the key elements: The USS Elrod, Captain Henry T. Elrod, and his educational background.\n2. Understanding the context: The USS Elrod is named after Captain Henry T. Elrod, a Marine aviator who received the Medal of Honor.\n3. Rephrasing the question: To make it more detailed and challenging while ensuring it remains self-contained and clear.\n\nThe rephrased question will include the relevant context to make it understandable without referencing the original text.\n\n</document_analysis>\n\n<output_format>\nQuestion: The USS Elrod (FFG-55), a United States Navy ship named in honor of a Marine aviator who demonstrated extraordinary heroism during World War II, is named after a captain who attended which two universities prior to his Marine Corps service?\nA: University of Georgia and Harvard University\nB: University of Georgia and Yale University\nC: Yale University and Princeton University\nD: Harvard University and Stanford University\nExplanation: The correct answer is B because the context states that Henry T. Elrod, the captain after whom the USS Elrod is named, attended the University of Georgia and Yale University before joining the Marine Corps.\nCorrect Answer: B\n</output_format>\n\nThis revised question is designed to be more engaging and challenging, requiring a deeper understanding of the context and the information provided about Captain Henry T. Elrod and the USS Elrod. The question is now more detailed and includes sufficient context to be answered by a domain expert without needing the original paragraph. The answer options are distinct and unambiguous, and the correct answer is clearly supported by the provided context.",
    "question": "The USS Elrod (FFG-55), a United States Navy ship named in honor of a Marine aviator who demonstrated extraordinary heroism during World War II, is named after a captain who attended which two universities prior to his Marine Corps service?",
    "choices": {
      "A": "University of Georgia and Harvard University",
      "B": "University of Georgia and Yale University",
      "C": "Yale University and Princeton University",
      "D": "Harvard University and Stanford University"
    },
    "answer": "B",
    "explanation": "The correct answer is B because the context states that Henry T. Elrod, the captain after whom the USS Elrod is named, attended the University of Georgia and Yale University before joining the Marine Corps.",
    "answer_correctness_score": 10,
    "explanation_validity_score": 10,
    "question_clarity_score": 8,
    "question_difficulty_score": 4,
    "question_groundedness_score": 10,
    "question_token_count": 51,
    "reformat_question_cosine_similarity_to_orig": 0.818008542060852,
    "reformat_answer_cosine_similarity_to_orig": 1.0,
    "reformat_question_similarity_score": 9,
    "reformat_answer_similarity_score": 10,
    "avg_answer_token_count": 7
  },
  {
    "orig_question": "Who announced the 1997 Fox reality show that was hosted by the American Sportscaster known for being the host of \"The NFL Today\"?",
    "orig_answer": "Mark Thompson",
    "context": "[PAR] [TLE] The World's Funniest! [SEP] The World's Funniest!  is an American reality show that aired on Fox in 1997.  It was hosted by James Brown and announced by Mark Thompson.  The show was similar in format to ABC's \"America's Funniest Home Videos\", but also featuring funny clips from TV shows, bloopers, and funny TV commercials.  Unlike \"AFHV\", there was no contest element and viewer-submitted videos were not rewarded with prizes.  It was also hosted without a studio audience, with laughter backing during clips coming via laugh track. [PAR] [TLE] James Brown (sportscaster) [SEP] James Brown (born February 25, 1951), commonly called \"J.B.\", is an American sportscaster known for being the host of \"The NFL Today\" on CBS Sports and \"Thursday Night Football\" on CBS Sports and NFL Network.  He is also the Special Correspondent for CBS' news division.  Also, he is best known as the former host of the FOX network's NFL pregame show, \"Fox NFL Sunday\" for 11 years.",
    "response": "<document_analysis>\nThe context provides information about a 1997 Fox reality show called \"The World's Funniest!\" and its host, James Brown, who is an American sportscaster. The task is to create a question-answer pair based on the given context, question, and answer. The original question asks who announced the 1997 Fox reality show hosted by James Brown, known for his role in \"The NFL Today.\" The correct answer is Mark Thompson.\n\nTo analyze the content:\n1. The show \"The World's Funniest!\" aired on Fox in 1997 and was hosted by James Brown.\n2. James Brown is identified as an American sportscaster known for hosting \"The NFL Today\" on CBS Sports.\n3. The announcer for \"The World's Funniest!\" was Mark Thompson.\n\nThe original question requires the test-taker to connect the information about James Brown's role in \"The NFL Today\" to his hosting role in \"The World's Funniest!\" and then identify the announcer of the show. The context provides sufficient information to answer the question.\n\nTo rephrase the question while maintaining its semantic equivalence, we need to ensure it still requires the test-taker to understand the connection between James Brown's roles and the details about \"The World's Funniest!\".\n\n</document_analysis>\n\n<output_format>\nQuestion: The 1997 Fox reality show hosted by the sportscaster known for his work on \"The NFL Today\" on CBS Sports was announced by which individual?\nA: James Brown\nB: Mark Thompson\nC: Bob Costas\nD: Dick Vitale\n\nExplanation: The correct answer is Mark Thompson because he was the announcer for \"The World's Funniest!\", a reality show that aired on Fox in 1997 and was hosted by James Brown, who is known for his work on CBS Sports' \"The NFL Today\".\n\nCorrect Answer: B\n</output_format>",
    "question": "The 1997 Fox reality show hosted by the sportscaster known for his work on \"The NFL Today\" on CBS Sports was announced by which individual?",
    "choices": {
      "A": "James Brown",
      "B": "Mark Thompson",
      "C": "Bob Costas",
      "D": "Dick Vitale"
    },
    "answer": "B",
    "explanation": "The correct answer is Mark Thompson because he was the announcer for \"The World's Funniest!\", a reality show that aired on Fox in 1997 and was hosted by James Brown, who is known for his work on CBS Sports' \"The NFL Today\".",
    "answer_correctness_score": 10,
    "explanation_validity_score": 10,
    "question_clarity_score": 6,
    "question_difficulty_score": 4,
    "question_groundedness_score": 10,
    "question_token_count": 33,
    "reformat_question_cosine_similarity_to_orig": 0.9326620101928711,
    "reformat_answer_cosine_similarity_to_orig": 0.9999999403953552,
    "reformat_question_similarity_score": 9,
    "reformat_answer_similarity_score": 10,
    "avg_answer_token_count": 3
  }
]