[
  {
    "context": "The ultra high risk (UHR) for psychosis criteria have been validated in a number of studies. However, it is not known whether particular UHR criteria (Attenuated Psychotic Symptoms (APS), Brief Limited Intermittent Psychotic Symptoms (BLIPS) or Trait vulnerability criteria), or combination of criteria, is associated with a higher risk of transition to psychosis. The current study investigated this issue over a 6-month follow-up period. We hypothesised that the risk of transition would increase in the following order: Trait alone<APS alone<APS+Trait<BLIPS.\n\nData on UHR intake criteria and transition to psychosis status at 6 months were analysed for UHR patients seen at the PACE clinic, Orygen Youth Health between January 2000 and November 2008.\n\nA total of 928 new referrals were accepted into the PACE clinic over this period of whom 817 (88%) had baseline information available for analysis. The percentage of subjects who presented with APS, Trait and BLIPS were 83%, 27% and 4%, respectively. When the two intermediate groups (APS alone and APS+Trait) were combined, there was evidence that the risk of transition increased in the order of Trait alone<APS<BLIPS (p=0.024, adjusted analysis).\n\n",
    "topic": "Propose how the study\u2019s findings could inform differential preventive interventions or monitoring protocols tailored to each UHR subcategory.",
    "response": "<document_analysis>\nThe context presents a prospective study of individuals at ultra high risk (UHR) for psychosis, stratified by baseline criteria: Trait vulnerability alone, Attenuated Psychotic Symptoms (APS), and Brief Limited Intermittent Psychotic Symptoms (BLIPS). It demonstrates a statistically significant gradient of transition risk over six months, in the order Trait alone < APS < BLIPS (p=0.024). Central themes include risk stratification based on symptomatology and the potential to customize intervention intensity accordingly. Implicit is the assumption that higher-risk subgroups warrant more intensive monitoring and preventive measures, while lower-risk groups may need less resource-heavy protocols.\n\nTo probe deep understanding, a challenging application question can ask how to operationalize these findings into differential intervention or monitoring protocols, requiring the respondent to map risk levels to appropriate clinical strategies. Difficulty is calibrated at 8/10, demanding integration of risk stratification data with evidence-based preventive frameworks. The question avoids obvious answers by including subtly plausible but incorrect alternatives, ensuring that the expert must critically evaluate each protocol\u2019s alignment with risk gradients.\n</document_analysis>\n\n<output_format>\nQuestion: A clinic has limited resources and seeks to allocate preventive interventions and monitoring intensity based on the reported 6\u2011month transition risks (Trait alone < APS < BLIPS). Which of the following tiered protocols best aligns with these findings?\nA: Monthly psychoeducational check\u2011ins for all UHR individuals, regardless of subgroup, supplemented by quarterly clinician review.\nB: Quarterly remote check\u2011ins and basic stress management for Trait alone; biweekly cognitive\u2011behavioral therapy and monthly family involvement for APS; weekly psychiatric evaluations with low\u2011dose antipsychotic consideration and crisis planning for BLIPS.\nC: Immediate initiation of low\u2011dose antipsychotics for Trait alone; monthly group therapy for APS; the same biweekly cognitive\u2011behavioral therapy for BLIPS as for APS.\nD: Weekly in\u2011person psychotherapy for Trait alone; quarterly medication review for APS; annual psychiatric follow\u2011up for BLIPS.\nExplanation: Protocol B proportionally increases intervention intensity in line with the risk gradient\u2014minimal yet regular support for Trait alone, moderate psychotherapy for APS, and intensive monitoring plus pharmacological consideration for BLIPS.\nCorrect Answer: B\n</output_format>",
    "question": "A clinic has limited resources and seeks to allocate preventive interventions and monitoring intensity based on the reported 6\u2011month transition risks (Trait alone < APS < BLIPS). Which of the following tiered protocols best aligns with these findings?",
    "choices": {
      "A": "Monthly psychoeducational check\u2011ins for all UHR individuals, regardless of subgroup, supplemented by quarterly clinician review.",
      "B": "Quarterly remote check\u2011ins and basic stress management for Trait alone; biweekly cognitive\u2011behavioral therapy and monthly family involvement for APS; weekly psychiatric evaluations with low\u2011dose antipsychotic consideration and crisis planning for BLIPS.",
      "C": "Immediate initiation of low\u2011dose antipsychotics for Trait alone; monthly group therapy for APS; the same biweekly cognitive\u2011behavioral therapy for BLIPS as for APS.",
      "D": "Weekly in\u2011person psychotherapy for Trait alone; quarterly medication review for APS; annual psychiatric follow\u2011up for BLIPS."
    },
    "answer": "B",
    "explanation": "Protocol B proportionally increases intervention intensity in line with the risk gradient\u2014minimal yet regular support for Trait alone, moderate psychotherapy for APS, and intensive monitoring plus pharmacological consideration for BLIPS.",
    "question_token_count": 47,
    "answer_correctness_score": 10,
    "explanation_validity_score": 10,
    "question_clarity_score": 6,
    "question_difficulty_score": 8,
    "question_groundedness_score": 10,
    "avg_answer_token_count": 33
  },
  {
    "context": "The purpose of this study is to evaluate right ventricular (RV) volume and function after pulmonary valve replacement (PVR) and to address the issue of optimal surgical timing in these patients.\n\nChronic pulmonary regurgitation (PR) following repair of tetralogy of Fallot (TOF) leads to RV dilation and an increased incidence of sudden cardiac death in adult patients.\n\nWe studied 25 consecutive adult patients who underwent PVR for significant PR late after repair of TOF. Radionuclide angiography was performed in all at a mean of 8.2 months (+/- 8 months) before PVR and repeated at a mean of 28.0 months (+/- 22.8 months) after the operation. Right ventricular (RV) end-systolic volume (RVESV), RV end-diastolic volume (RVEDV) and RV ejection fraction (RVEF) were measured.\n\nMean RVEDV, RVESV and RVEF remained unchanged after PVR (227.1 ml versus 214.9 ml, p = 0.74; 157.4 ml versus 155.4 ml, p = 0.94; 35.6% versus 34.7%, p = 0.78, respectively). Of the 10 patients with RVEF>or = 0.40 before PVR, 5 patients (50%) maintained a RVEF>or = 0.40 following PVR, whereas only 2 out of 15 patients (13%) with pre-operative values<0.40 reached an RVEF>or = 0.40 postoperatively (p<0.001).\n\n",
    "topic": "Technical limitations and potential sources of error when using radionuclide angiography to assess RV mechanics",
    "response": "<document_analysis>\nThe context describes unchanged RVEDV, RVESV, and RVEF measured by planar radionuclide angiography before and after pulmonary valve replacement (PVR), suggesting potential insensitivity of the method to true remodeling. Key themes include quantitative volume assessment, unchanged pre- and post-operative metrics, and the complex geometry of the RV. Radionuclide angiography\u2019s reliance on planar imaging introduces multiple technical limitations\u2014chiefly geometric modeling assumptions, overlap of counts, gating resolution, and background subtraction errors\u2014that can obscure true volumetric changes. To challenge domain experts, the question probes which specific technical limitation most critically undermines accurate RV volume quantification in this technique, encouraging critical evaluation of methodology rather than simple recall.\nDifficulty rating: 8/10\n</document_analysis>\n\n<output_format>\nQuestion: In planar radionuclide angiography assessments of right ventricular volumes post-pulmonary valve replacement, which technical limitation most directly undermines accurate quantification of RV end-diastolic and end-systolic volumes, potentially explaining the apparent lack of change observed?\nA: Overlapping left ventricular activity obscuring RV borders\nB: Simplified geometrical modeling of the complex RV shape during volume calculations\nC: Cardiac motion blurring from low temporal resolution in gated acquisition\nD: Variable pulmonary and hepatic radiotracer uptake affecting background correction\nExplanation: Planar radionuclide angiography requires simplistic geometric assumptions to calculate RV volumes, which poorly represent the right ventricle\u2019s irregular shape and lead to systematic errors that can mask true remodeling.\nCorrect Answer: B\n</output_format>",
    "question": "In planar radionuclide angiography assessments of right ventricular volumes post-pulmonary valve replacement, which technical limitation most directly undermines accurate quantification of RV end-diastolic and end-systolic volumes, potentially explaining the apparent lack of change observed?",
    "choices": {
      "A": "Overlapping left ventricular activity obscuring RV borders",
      "B": "Simplified geometrical modeling of the complex RV shape during volume calculations",
      "C": "Cardiac motion blurring from low temporal resolution in gated acquisition",
      "D": "Variable pulmonary and hepatic radiotracer uptake affecting background correction"
    },
    "answer": "B",
    "explanation": "Planar radionuclide angiography requires simplistic geometric assumptions to calculate RV volumes, which poorly represent the right ventricle\u2019s irregular shape and lead to systematic errors that can mask true remodeling.",
    "question_token_count": 50,
    "answer_correctness_score": 10,
    "explanation_validity_score": 10,
    "question_clarity_score": 6,
    "question_difficulty_score": 8,
    "question_groundedness_score": 4,
    "avg_answer_token_count": 12
  },
  {
    "context": "Patients diagnosed with serious mental illness (SMI) who qualify for nursing home placement tend to require high levels of both psychiatric and nursing care. However, it is unknown whether they are equally likely to be admitted to nursing homes with adequate quality of care compared with other patients.\n\nWe analyzed a national cohort of more than 1.3 million new nursing home admissions in 2007 using the minimum data set. The total and healthcare-related deficiency citations for each facility were obtained from the Online Survey, Certification, and Reporting file. Bivariate and multivariate regression analyses determined the association of schizophrenia or bipolar disorder with admissions to facilities with higher deficiencies.\n\nCompared with other patients, patients with schizophrenia (n=23,767) tended to enter nursing homes with more total (13.3 vs. 11.2, P<0.001) and healthcare-related deficiencies (8.6 vs. 7.2, P<0.001); and patients with bipolar disorder (n=19,741) were more likely to enter facilities with more problematic care too (12.5 vs. 11.2, P<0.001 for total deficiencies; and 8.2 vs. 7.2, P<0.001 for healthcare-related deficiencies). After sequentially controlling for the within-county choice of facilities, patient characteristics, and facility covariates, the association of SMI with admitting to higher-deficiency nursing homes persisted.\n\n",
    "topic": "Interpretation of P-values and mean citation differences in large cohort studies of healthcare outcomes",
    "response": "<document_analysis>\nThe context presents mean differences in deficiency citations between patients with serious mental illness (schizophrenia or bipolar disorder) and other patients, accompanied by highly significant P-values (P<0.001). A domain expert should recognize that such small P-values in large cohorts indicate strong evidence against the null hypothesis of no difference, yet do not directly convey the magnitude or clinical importance of the difference. The analysis focuses on clarifying common misconceptions about P-values, the role of sample size, and the distinction between statistical and clinical significance. Difficulty is calibrated at 8/10, as the question requires nuanced understanding of statistical inference rather than simple factual recall.\n</document_analysis>\n\n<output_format>\nQuestion: What does the P<0.001 finding for the 13.3 versus 11.2 mean total deficiencies imply in this large cohort comparison between schizophrenia patients and others?\nA: It demonstrates a statistically significant mean difference, but clinical importance still requires effect-size evaluation.\nB: It indicates a 99.9% probability that schizophrenia directly leads to higher deficiency counts.\nC: It shows that the large sample size makes the observed difference automatically clinically meaningful.\nD: It quantifies the magnitude of higher deficiencies in schizophrenia patients.\nExplanation: A P-value below 0.001 strongly rejects the null of equal means, yet does not measure effect size or clinical relevance.\nCorrect Answer: A\n</output_format>",
    "question": "What does the P<0.001 finding for the 13.3 versus 11.2 mean total deficiencies imply in this large cohort comparison between schizophrenia patients and others?",
    "choices": {
      "A": "It demonstrates a statistically significant mean difference, but clinical importance still requires effect-size evaluation.",
      "B": "It indicates a 99.9% probability that schizophrenia directly leads to higher deficiency counts.",
      "C": "It shows that the large sample size makes the observed difference automatically clinically meaningful.",
      "D": "It quantifies the magnitude of higher deficiencies in schizophrenia patients."
    },
    "answer": "A",
    "explanation": "A P-value below 0.001 strongly rejects the null of equal means, yet does not measure effect size or clinical relevance.",
    "question_token_count": 36,
    "answer_correctness_score": 10,
    "explanation_validity_score": 10,
    "question_clarity_score": 6,
    "question_difficulty_score": 7,
    "question_groundedness_score": 10,
    "avg_answer_token_count": 16
  },
  {
    "context": "The prevalence of combined humeral and glenoid defects varies between 79 and 84\u00a0% in case of chronic posttraumatic anterior shoulder instability. The main goal of this study was to evaluate the relationship between humeral and glenoid defects based on quantitative radiological criteria.\n\nA retrospective study was performed between 2000 and 2011 including patients who underwent primary surgical shoulder stabilization for chronic posttraumatic anterior shoulder instability, with bone defects in both the glenoid and humerus and a healthy contralateral shoulder. The following measurements were taken: D/R ratio (Hill-Sachs lesion depth/humeral head radius) on an AP X-ray in internal rotation and the D1/D2 ratio [diameter of the involved glenoid articular surfaces (D1)/the healthy one (D2)] on a comparative Bernageau glenoid profile view. Measurements were taken by two observers. Correlations were determined by the Spearman correlation coefficients (r), Bland and Altman diagrams, and intra-class correlation coefficients (ICC). A sample size calculation was done.\n\nThirty patients were included, 25 men/5 women, mean age 29.8\u00a0\u00b1\u00a011.2\u00a0years. The mean D/R was 23\u00a0\u00b1\u00a012\u00a0% for observer 1 and 23\u00a0\u00b1\u00a010\u00a0% for observer 2. The mean D1/D2 was 95\u00a0\u00b1\u00a04\u00a0% for observer 1 and 94\u00a0\u00b1\u00a06\u00a0% for observer 2. No significant correlation was found between humeral and glenoid bone defects by observer 1 (r\u00a0=\u00a00.23, p\u00a0=\u00a00.22) or observer 2 (r\u00a0=\u00a00.05, p\u00a0=\u00a00.78). Agreement of the observers for the D/R ratio was excellent (ICC\u00a0=\u00a00.89\u00a0\u00b1\u00a00.04, p\u00a0<\u00a00.00001) and good for the D1/D2 ratio (ICC\u00a0=\u00a00.54\u00a0\u00b1\u00a00.14, p\u00a0=\u00a00.006).\n\n",
    "topic": "Impact of observer variability on the measurement of humeral versus glenoid bone defects and its influence on clinical decision-making.",
    "response": "<document_analysis>\nThe context details a retrospective study evaluating inter-observer reliability (using ICC) for two radiological measurements: the humeral D/R ratio (ICC\u00a0=\u00a00.89, excellent) and the glenoid D1/D2 ratio (ICC\u00a0=\u00a00.54, good/moderate). It also notes no significant correlation between the two defects. Clinically, quantitative thresholds often guide whether to perform bone augmentation or soft-tissue repair. The lower ICC of the D1/D2 ratio implies greater observer variability around any cutoff, affecting consistency in surgical decision-making. This subtlety in reliability versus decision thresholds can challenge experts to translate statistical agreement into clinical protocol implications.\n</document_analysis>\n\n<output_format>\nQuestion: Suppose a glenoid D1/D2 ratio cutoff of 92% is used to choose between bone augmentation (<92%) and soft-tissue stabilization (\u226592%). Given an inter-observer ICC of 0.54 for the D1/D2 ratio versus 0.89 for the humeral D/R ratio, what is the most likely implication for the consistency of surgical recommendations?\n\nA: The moderate ICC for the D1/D2 ratio means observers measuring values near 92% are more likely to disagree on the surgical plan compared to the D/R ratio.  \nB: Since both ICCs exceed 0.5, both measurements will yield equally consistent surgical recommendations.  \nC: The high ICC of the D/R ratio paradoxically means it will produce more inter-observer disagreement than the D1/D2 ratio.  \nD: ICC values indicate that neither measurement is reliable enough to guide any surgical decision.\n\nExplanation: An ICC of 0.54 indicates only moderate inter-observer agreement, so measurements near the 92% threshold can vary between observers, leading to different treatment choices; the D/R ratio\u2019s higher ICC (0.89) will yield more consistent recommendations.\n\nCorrect Answer: A\n</output_format>",
    "question": "Suppose a glenoid D1/D2 ratio cutoff of 92% is used to choose between bone augmentation (<92%) and soft-tissue stabilization (\u226592%). Given an inter-observer ICC of 0.54 for the D1/D2 ratio versus 0.89 for the humeral D/R ratio, what is the most likely implication for the consistency of surgical recommendations?",
    "choices": {
      "A": "The moderate ICC for the D1/D2 ratio means observers measuring values near 92% are more likely to disagree on the surgical plan compared to the D/R ratio.",
      "B": "Since both ICCs exceed 0.5, both measurements will yield equally consistent surgical recommendations.",
      "C": "The high ICC of the D/R ratio paradoxically means it will produce more inter-observer disagreement than the D1/D2 ratio.",
      "D": "ICC values indicate that neither measurement is reliable enough to guide any surgical decision."
    },
    "answer": "A",
    "explanation": "An ICC of 0.54 indicates only moderate inter-observer agreement, so measurements near the 92% threshold can vary between observers, leading to different treatment choices; the D/R ratio\u2019s higher ICC (0.89) will yield more consistent recommendations.",
    "question_token_count": 79,
    "answer_correctness_score": 10,
    "explanation_validity_score": 10,
    "question_clarity_score": 6,
    "question_difficulty_score": 8,
    "question_groundedness_score": 10,
    "avg_answer_token_count": 24
  },
  {
    "context": "In vivo comparative gap measurements were performed in three different patella positions (reduced, subluxated and everted) using offset-type-force-controlled-spreader-system.\n\nProspectively, 50 knees were operated by total knee arthroplasty using a navigation-assisted gap-balancing technique. The offset-type-force-controlled-spreader-system was used for gap measurements. This commercially available instrument allows controllable tension in patella-reduced position. The mediolateral gaps of knee extension (0\u00b0) and flexion (90\u00b0) angle were recorded in three different patella positions; reduced, subluxated and everted. Any gap differences of more than 3 mm were considered as a meaningful difference. Correlation between the difference with the demographic data, preoperative radiologic alignment and intraoperative data was analysed. For statistical analysis, ANOVA and Pearson's correlation test were used.\n\nThe gaps in patella eversion demonstrated smaller gaps both in knee extension and flexion position compared to the gaps of patella reduction position. The amount of decreased gaps was more definite in knee flexion position. Statistically significant difference was observed for the lateral gap of patella eversion compared to gap of patella reduction in knee flexion position (p<0.05). There were notable cases of variability in knee flexion position. Significant portion of 12 (24 %) knees of patella subluxation and 33 (66 %) knees of patella evertion demonstrated either increased or decreased gaps in knee flexion position compared to the gaps of patella reduction position.\n\n",
    "topic": "Protocol for measuring mediolateral extension and flexion gaps at 0\u00b0 and 90\u00b0 knee flexion using controlled tension.",
    "response": "<document_analysis>\nThe context describes a controlled, instrumented method for measuring mediolateral knee gaps at 0\u00b0 and 90\u00b0 flexion in three patellar positions: reduced, subluxated, and everted. Key findings include that patella eversion produces smaller gaps than reduction, particularly in flexion, and that only the lateral gap in the everted patella at 90\u00b0 showed a statistically significant difference (p<0.05) compared to the reduced patella. This comparison provides a precise, technical detail suitable for a challenging question.  \nDifficulty rating: 8/10  \n</document_analysis>\n\n<output_format>\nQuestion: In a navigated gap-balancing total knee arthroplasty using an offset-type force-controlled spreader, which specific mediolateral gap change at 90\u00b0 knee flexion achieved statistical significance (p<0.05) when compared to the patella-reduced condition?\nA: Medial gap during patella subluxation\nB: Lateral gap during patella eversion\nC: Medial gap during patella eversion\nD: Lateral gap during patella subluxation\nExplanation: Only the lateral gap measured with the patella everted at 90\u00b0 flexion was significantly smaller than the lateral gap with the patella reduced (p<0.05).\nCorrect Answer: B\n</output_format>",
    "question": "In a navigated gap-balancing total knee arthroplasty using an offset-type force-controlled spreader, which specific mediolateral gap change at 90\u00b0 knee flexion achieved statistical significance (p<0.05) when compared to the patella-reduced condition?",
    "choices": {
      "A": "Medial gap during patella subluxation",
      "B": "Lateral gap during patella eversion",
      "C": "Medial gap during patella eversion",
      "D": "Lateral gap during patella subluxation"
    },
    "answer": "B",
    "explanation": "Only the lateral gap measured with the patella everted at 90\u00b0 flexion was significantly smaller than the lateral gap with the patella reduced (p<0.05).",
    "question_token_count": 55,
    "answer_correctness_score": 10,
    "explanation_validity_score": 10,
    "question_clarity_score": 5,
    "question_difficulty_score": 8,
    "question_groundedness_score": 10,
    "avg_answer_token_count": 9
  },
  {
    "context": "The purpose of this study was to delineate early respiratory predictors of mortality in children with hemato-oncology malignancy who developed acute respiratory distress syndrome (ARDS).\n\nWe conducted a retrospective chart review of children with malignant and ARDS who needed mechanical ventilation and were admitted to a pediatric intensive care unit from January 1987 to January 1997.\n\nSeventeen children with ARDS and malignancy aged 10.5 +/- 5.1 years were identified. Six of the 17 children (35.3%) survived. Sepsis syndrome was present in 70.6% of all the children. Peak inspiratory pressure, positive end-expiratory pressure (PEEP), and ventilation index values could distinguish outcome by day 3. A significant relationship between respiratory data and outcome related to efficiency of oxygenation, as determined by PaO(2)/FIO(2) and P(A-a)O(2), was present from day 8 after onset of mechanical ventilation.\n\n",
    "topic": "Interpretation of the impact of peak inspiratory pressure trends within the first 72 hours on mortality prediction in pediatric ARDS patients with malignancy.",
    "response": "<document_analysis>\nThe context reports that in pediatric ARDS patients with malignancy, peak inspiratory pressure (PIP), PEEP, and ventilation index (VI) values distinguished survivors from non-survivors by day 3 of mechanical ventilation, whereas oxygenation efficiency (PaO2/FiO2, P(A-a)O2) only became prognostically significant by day 8. This suggests that early changes in lung mechanics precede measurable gas exchange impairment. Therefore, a high\u2010difficulty question can probe the underlying pathophysiological rationale for why early PIP trends are prognostic before oxygenation indices change.\nDifficulty: 8/10\n</document_analysis>\n\n<output_format>\nQuestion: In pediatric ARDS associated with malignancy, what pathophysiological mechanism explains why peak inspiratory pressure trends within the first 72 hours predict mortality before significant PaO2/FiO2 changes emerge?\nA: Early alterations in lung compliance and airway resistance precede overt gas exchange impairment.\nB: Peak inspiratory pressure directly quantifies alveolar oxygen diffusion capacity.\nC: PIP trends are independent of ventilator adjustments, reflecting only disease severity.\nD: Elevated PIP in early ARDS primarily indicates reduced cardiac output affecting oxygen delivery.\nExplanation: Rising PIP reflects worsening lung compliance and resistance before oxygenation fails, making it an early prognostic marker.\nCorrect Answer: A\n</output_format>",
    "question": "In pediatric ARDS associated with malignancy, what pathophysiological mechanism explains why peak inspiratory pressure trends within the first 72 hours predict mortality before significant PaO2/FiO2 changes emerge?",
    "choices": {
      "A": "Early alterations in lung compliance and airway resistance precede overt gas exchange impairment.",
      "B": "Peak inspiratory pressure directly quantifies alveolar oxygen diffusion capacity.",
      "C": "PIP trends are independent of ventilator adjustments, reflecting only disease severity.",
      "D": "Elevated PIP in early ARDS primarily indicates reduced cardiac output affecting oxygen delivery."
    },
    "answer": "A",
    "explanation": "Rising PIP reflects worsening lung compliance and resistance before oxygenation fails, making it an early prognostic marker.",
    "question_token_count": 41,
    "answer_correctness_score": 10,
    "explanation_validity_score": 10,
    "question_clarity_score": 7,
    "question_difficulty_score": 9,
    "question_groundedness_score": 6,
    "avg_answer_token_count": 15
  },
  {
    "context": "To study the risks of haemodynamic instability, and the possible occurrence of spinal haematoma, meningitis and epidural abscess when epidural analgesia is performed for cytoreductive surgery and hyperthermic intraperitoneal chemotherapy (HIPEC).\n\nWe retrospectively analyzed the data of 35 patients treated by HIPEC with oxaliplatin or cisplatin. An epidural catheter was inserted before induction of general anaesthesia. Postoperatively, a continuous epidural infusion of ropivacain, then a patient-controlled epidural analgesia were started.\n\nThe epidural catheter was used peroperatively before HIPEC in 12 subjects (34%), and after HIPEC in 23 subjects (66%). The median dose of ropivacain given peroperatively in the epidural catheter was 40 mg (30-75). Norepinephrin was used in two subjects (6%) peroperatively (median infusion rate 0.325 \u03bcg/kg per minute [0.32-0.33]), and in four subjects (11%) in the postoperative 24 hours. No spinal haematoma, meningitis or epidural abscess were noted. Five subjects (14%) had a thrombopenia or a prothrombin time less than 60% before catheter removal. Two subjects (6%) had a leukopenia before catheter removal. No thrombopenia or blood coagulation disorders were recorded the day of catheter removal.\n\n",
    "topic": "Surveillance and management of coagulation abnormalities (thrombocytopenia, prothrombin time <60%) before safe epidural catheter removal.",
    "response": "<document_analysis>\nThe context describes postoperative surveillance of coagulation parameters in patients undergoing cytoreductive surgery with HIPEC who had epidural catheters. Key observations include transient thrombocytopenia and reduced prothrombin time (<60%) prior to catheter removal, with no adverse neuraxial events once labs normalized by removal. This implies an underlying mechanism for these transient coagulation abnormalities that domain experts must understand to time safe catheter removal. A challenging question thus probes the pathophysiology of postoperative coagulopathy in HIPEC patients.\nDifficulty rating: 7/10\n</document_analysis>\n\n<output_format>\nQuestion: In the immediate postoperative period following cytoreductive surgery with HIPEC, what is the most plausible mechanism leading to transient thrombocytopenia and reduced prothrombin time observed before safe epidural catheter removal?\nA: Direct bone marrow toxicity from platinum-based chemotherapy impairing platelet and clotting\u2010factor synthesis  \nB: Dilutional coagulopathy from extensive intraoperative fluid resuscitation and blood loss  \nC: Ropivacaine-induced platelet dysfunction and inhibition of vitamin K\u2013dependent factors  \nD: Norepinephrine-mediated hepatic vasoconstriction reducing synthesis of clotting factors  \nExplanation: Massive fluids and blood loss during HIPEC cause dilution of platelets and clotting factors, leading to transient coagulopathy that normalizes once fluid balance is restored.  \nCorrect Answer: B\n</output_format>",
    "question": "In the immediate postoperative period following cytoreductive surgery with HIPEC, what is the most plausible mechanism leading to transient thrombocytopenia and reduced prothrombin time observed before safe epidural catheter removal?",
    "choices": {
      "A": "Direct bone marrow toxicity from platinum-based chemotherapy impairing platelet and clotting\u2010factor synthesis",
      "B": "Dilutional coagulopathy from extensive intraoperative fluid resuscitation and blood loss",
      "C": "Ropivacaine-induced platelet dysfunction and inhibition of vitamin K\u2013dependent factors",
      "D": "Norepinephrine-mediated hepatic vasoconstriction reducing synthesis of clotting factors"
    },
    "answer": "B",
    "explanation": "Massive fluids and blood loss during HIPEC cause dilution of platelets and clotting factors, leading to transient coagulopathy that normalizes once fluid balance is restored.",
    "question_token_count": 42,
    "answer_correctness_score": 10,
    "explanation_validity_score": 10,
    "question_clarity_score": 8,
    "question_difficulty_score": 9,
    "question_groundedness_score": 6,
    "avg_answer_token_count": 17
  },
  {
    "context": "Controlled ovarian stimulation (COS) with intrauterine insemination (IUI) is a common treatment in couples with unexplained non-conception. Induction of multifollicular growth is considered to improve pregnancy outcome, but it contains an increased risk of multiple pregnancies and ovarian hyperstimulation syndrome. In this study the impact of the number of follicles (>14 mm) on the ongoing pregnancy rate (PR) and multiple PR was evaluated in the first four treatment cycles.\n\nA retrospective cohort study was performed in all couples with unexplained non-conception undergoing COS-IUI in the Academic Hospital of Maastricht. The main outcome measure was ongoing PR. Secondary outcomes were ongoing multiple PR, number of follicles of>or=14 mm, and order of treatment cycle.\n\nThree hundred couples were included. No significant difference was found in ongoing PR between women with one, two, three or four follicles respectively (P=0.54), but in women with two or more follicles 12/73 pregnancies were multiples. Ongoing PR was highest in the first treatment cycle and declined significantly with increasing cycle order (P=0.006), while multiple PR did not change.\n\n",
    "topic": "Inclusion and exclusion criteria defining the study population of couples with unexplained non-conception at the Academic Hospital of Maastricht.",
    "response": "<document_analysis>\nThe context describes a retrospective cohort of couples with unexplained non-conception undergoing controlled ovarian stimulation with IUI at Maastricht, evaluating only the first four treatment cycles. Inclusion hinges on absence of identifiable male or female infertility factors; exclusion implies any diagnosed cause (e.g., tubal blockage, endometriosis, PCOS). This key criterion ensures homogeneity. Other details (primary/secondary outcomes, follicle count) are irrelevant to population selection. Thus, a challenging question can present various couple profiles and ask which meets the inclusion criteria.\n</document_analysis>\n\n<output_format>\nQuestion: Which couple would have been eligible for inclusion in the Maastricht retrospective COS-IUI study on unexplained non\u2011conception?\nA: A 29-year-old woman with 2 years of infertility, normal semen analysis for her partner, patent tubes on hysterosalpingography, beginning her first COS-IUI cycle.\nB: A 35-year-old woman with 18 months of infertility and laparoscopically confirmed stage I endometriosis, normal partner tests, starting her second COS-IUI cycle.\nC: A 32-year-old woman with 12 months of infertility, unilateral tubal occlusion, normal semen parameters, on her first COS-IUI cycle.\nD: A 31-year-old woman diagnosed with polycystic ovary syndrome, 18 months of infertility, normal partner evaluation, electing COS-IUI.\nExplanation: The study included only couples with unexplained infertility\u2014no identifiable female or male factors\u2014and evaluated first four COS\u2011IUI cycles.\nCorrect Answer: A\n</output_format>",
    "question": "Which couple would have been eligible for inclusion in the Maastricht retrospective COS-IUI study on unexplained non\u2011conception?",
    "choices": {
      "A": "A 29-year-old woman with 2 years of infertility, normal semen analysis for her partner, patent tubes on hysterosalpingography, beginning her first COS-IUI cycle.",
      "B": "A 35-year-old woman with 18 months of infertility and laparoscopically confirmed stage I endometriosis, normal partner tests, starting her second COS-IUI cycle.",
      "C": "A 32-year-old woman with 12 months of infertility, unilateral tubal occlusion, normal semen parameters, on her first COS-IUI cycle.",
      "D": "A 31-year-old woman diagnosed with polycystic ovary syndrome, 18 months of infertility, normal partner evaluation, electing COS-IUI."
    },
    "answer": "A",
    "explanation": "The study included only couples with unexplained infertility\u2014no identifiable female or male factors\u2014and evaluated first four COS\u2011IUI cycles.",
    "question_token_count": 25,
    "answer_correctness_score": 10,
    "explanation_validity_score": 10,
    "question_clarity_score": 6,
    "question_difficulty_score": 5,
    "question_groundedness_score": 10,
    "avg_answer_token_count": 35
  },
  {
    "context": "To evaluate the degree to which histologic chorioamnionitis, a frequent finding in placentas submitted for histopathologic evaluation, correlates with clinical indicators of infection in the mother.\n\nA retrospective review was performed on 52 cases with a histologic diagnosis of acute chorioamnionitis from 2,051 deliveries at University Hospital, Newark, from January 2003 to July 2003. Third-trimester placentas without histologic chorioamnionitis (n = 52) served as controls. Cases and controls were selected sequentially. Maternal medical records were reviewed for indicators of maternal infection.\n\nHistologic chorioamnionitis was significantly associated with the usage of antibiotics (p = 0.0095) and a higher mean white blood cell count (p = 0.018). The presence of 1 or more clinical indicators was significantly associated with the presence of histologic chorioamnionitis (p = 0.019).\n\n",
    "topic": "Statistical significance testing and interpretation of p-values (p = 0.0095, p = 0.018, p = 0.019) in the context of correlational research.",
    "response": "<document_analysis>\nThe context describes a retrospective correlational study examining associations between histologic chorioamnionitis and clinical indicators, reporting three p-values (0.0095, 0.018, 0.019) for separate hypotheses. Central themes include interpretation of p-values, the risk of type I error across multiple tests, and the need for correction methods (e.g., Bonferroni). A probing question can challenge experts to apply a multiple-comparison correction to these p-values. This requires nuanced understanding of threshold adjustment and its impact on significance conclusions. Difficulty is calibrated high (approximately 7/10) to ensure depth and subtlety.\n</document_analysis>\n\n<output_format>\nQuestion: When applying a Bonferroni correction for the three independent hypotheses tested in this study (\u03b1 = 0.05/3 \u2248 0.0167), which of the reported associations remain statistically significant?\nA: Only the association with antibiotic usage (p = 0.0095)\nB: Both the associations with antibiotic usage (p = 0.0095) and higher mean WBC (p = 0.018)\nC: Both the associations with antibiotic usage (p = 0.0095) and clinical indicators (p = 0.019)\nD: All three associations remain significant\nExplanation: With the Bonferroni\u2010adjusted \u03b1 of ~0.0167, only the p\u2010value below that threshold (0.0095) stays significant.\nCorrect Answer: A\n</output_format>",
    "question": "When applying a Bonferroni correction for the three independent hypotheses tested in this study (\u03b1 = 0.05/3 \u2248 0.0167), which of the reported associations remain statistically significant?",
    "choices": {
      "A": "Only the association with antibiotic usage (p = 0.0095)",
      "B": "Both the associations with antibiotic usage (p = 0.0095) and higher mean WBC (p = 0.018)",
      "C": "Both the associations with antibiotic usage (p = 0.0095) and clinical indicators (p = 0.019)",
      "D": "All three associations remain significant"
    },
    "answer": "A",
    "explanation": "With the Bonferroni\u2010adjusted \u03b1 of ~0.0167, only the p\u2010value below that threshold (0.0095) stays significant.",
    "question_token_count": 42,
    "answer_correctness_score": 10,
    "explanation_validity_score": 10,
    "question_clarity_score": 6,
    "question_difficulty_score": 8,
    "question_groundedness_score": 9,
    "avg_answer_token_count": 19
  },
  {
    "context": "Examine whether patients with prostate cancer choose the more aggressive of two radiotherapeutic options, whether this choice is reasoned, and what the determinants of the choice are.\n\nOne hundred fifty patients with primary prostate cancer (T(1-3)N(0)M(0)) were informed by means of a decision aid of two treatment options: radiotherapy with 70 Gy versus 74 Gy. The latter treatment is associated with more cure and more toxicity. The patients were asked whether they wanted to choose, and if so which treatment they preferred. They also assigned importance weights to the probability of various outcomes, such as survival, cure and adverse effects. Patients who wanted to choose their own treatment (n = 119) are described here.\n\nThe majority of these patients (75%) chose the lower radiation dose. Their choice was highly consistent (P<or = .001), with the importance weights assigned to the probability of survival, cure (odds ratio [OR] = 6.7 and 6.9) and late GI and genitourinary adverse effects (OR = 0.1 and 0.2). The lower dose was chosen more often by the older patients, low-risk patients, patients without hormone treatment, and patients with a low anxiety or depression score.\n\n",
    "topic": "Role of concomitant hormone therapy status in shaping radiotherapy dose decisions",
    "response": "<document_analysis>\nThe context describes a decision\u2010making study in 150 prostate cancer patients comparing two radiotherapy doses (70\u00a0Gy vs 74\u00a0Gy). It quantifies determinants of dose preference, notably that patients without concomitant hormone therapy, older age, low\u2010risk status, and low anxiety/depression scores were significantly more likely to select the lower 70\u00a0Gy dose. The task is to probe domain expertise by requiring integration of all four independent predictors. This yields a question that asks which patient profile is most likely to choose the higher 74\u00a0Gy dose. Difficulty is calibrated high (\u22488/10), as it demands synthesis of multiple multivariate factors rather than recall of a single fact.\n</document_analysis>\n\n<output_format>\nQuestion: Considering that older age, low\u2010risk disease, absence of concomitant hormone therapy, and low anxiety/depression independently predict choosing the lower 70\u00a0Gy dose, which of the following patient profiles is most likely to opt for the higher 74\u00a0Gy regimen?\nA: 68\u2010year\u2010old, low\u2010risk, on hormone therapy, low anxiety\nB: 64\u2010year\u2010old, high\u2010risk, on hormone therapy, high anxiety\nC: 72\u2010year\u2010old, low\u2010risk, no hormone therapy, low anxiety\nD: 59\u2010year\u2010old, high\u2010risk, no hormone therapy, low anxiety\nExplanation: High\u2010risk status, concomitant hormone therapy, higher anxiety, and younger age all favor choosing the more aggressive 74\u00a0Gy dose.\nCorrect Answer: B\n</output_format>",
    "question": "Considering that older age, low\u2010risk disease, absence of concomitant hormone therapy, and low anxiety/depression independently predict choosing the lower 70\u00a0Gy dose, which of the following patient profiles is most likely to opt for the higher 74\u00a0Gy regimen?",
    "choices": {
      "A": "68\u2010year\u2010old, low\u2010risk, on hormone therapy, low anxiety",
      "B": "64\u2010year\u2010old, high\u2010risk, on hormone therapy, high anxiety",
      "C": "72\u2010year\u2010old, low\u2010risk, no hormone therapy, low anxiety",
      "D": "59\u2010year\u2010old, high\u2010risk, no hormone therapy, low anxiety"
    },
    "answer": "B",
    "explanation": "High\u2010risk status, concomitant hormone therapy, higher anxiety, and younger age all favor choosing the more aggressive 74\u00a0Gy dose.",
    "question_token_count": 53,
    "answer_correctness_score": 10,
    "explanation_validity_score": 10,
    "question_clarity_score": 6,
    "question_difficulty_score": 6,
    "question_groundedness_score": 10,
    "avg_answer_token_count": 17
  },
  {
    "context": "To evaluate whether robotically assisted laparoscopic prostatectomy (RALP) is less invasive than radical retropubic prostatectomy (RRP), as experimental studies suggest that the acute phase reaction is proportional to surgery-induced tissue damage.\n\nBetween May and November 2006, all patients undergoing RRP or RALP in our department were prospectively assessed. Blood samples were collected 24 h before (T0), during surgery (T1), at the end of anaesthesia (T2), and 12 (T3) and 24 h after surgery (T4), and assayed for interleukin(IL)-6 and IL-1 alpha, C-reactive protein (CRP), and lactate. The Mann-Whitney U-, Student's t- and Friedman tests were used to compare continuous variables, and the Pearson chi-square and Fisher test for categorical variables, with a two-sided P<0.05 considered to indicate significance.\n\nIn all, 35 and 26 patients were assessed for RALP and RRP, respectively; the median (interquartile range) age was 62 (56-68) and 68.5 (59.2-71.2) years, respectively (P<0.009). Baseline levels (T0) of IL-1, IL-6, CRP and lactate were comparable in both arms. IL-6, CRP and lactates levels increased during both kinds of surgery. The mean IL-6 and CPR values were higher for RRP at T1 (P = 0.01 and 0.001), T2 (P = 0.001 and<0.001), T3 (P = 0.002 and<0.001) and T4 (P<0.001 and 0.02), respectively. Lactate was higher for RRP at T2 (P = 0.001), T3 (P = 0.001) and T4 (P = 0.004), although remaining within the normal ranges. IL-1 alpha did not change at the different sample times.\n\n",
    "topic": "Propose additional biomarkers or outcome measures that could strengthen the assessment of invasiveness in future prostatectomy studies.",
    "response": "<document_analysis>\nThe context describes a comparative study of surgical invasiveness between RALP and RRP using acute\u2010phase reaction markers (IL\u20106, IL\u20101\u03b1, CRP, lactate). It highlights that IL\u20106 and CRP more sensitively reflect tissue damage, whereas IL\u20101\u03b1 remains unchanged. To deepen invasiveness assessment, one could introduce markers tied directly to necrotic cell death or damage\u2010associated molecular patterns (DAMPs), which more specifically quantify cellular injury beyond general inflammation. High\u2010mobility group box 1 protein (HMGB1) is a prime candidate, as it is released from necrotic cells and correlates with the extent of tissue damage.\nDifficulty rating: 8/10 (requires understanding of DAMPs and their relevance to surgical injury)\n</document_analysis>\n\n<output_format>\nQuestion: Which additional biomarker would most directly quantify surgery\u2010induced tissue necrosis to enhance assessment of invasiveness beyond IL\u20106, IL\u20101\u03b1, CRP, and lactate?\nA: Tumor necrosis factor\u2010alpha (TNF\u2010\u03b1)\nB: High\u2010mobility group box\u00a01 protein (HMGB1)\nC: Procalcitonin\nD: Interleukin\u201010 (IL\u201010)\nExplanation: HMGB1 is a damage\u2010associated molecular pattern released by necrotic cells, directly correlating with tissue injury severity and providing a more specific measure of surgical invasiveness.\nCorrect Answer: B\n</output_format>",
    "question": "Which additional biomarker would most directly quantify surgery\u2010induced tissue necrosis to enhance assessment of invasiveness beyond IL\u20106, IL\u20101\u03b1, CRP, and lactate?",
    "choices": {
      "A": "Tumor necrosis factor\u2010alpha (TNF\u2010\u03b1)",
      "B": "High\u2010mobility group box\u00a01 protein (HMGB1)",
      "C": "Procalcitonin",
      "D": "Interleukin\u201010 (IL\u201010)"
    },
    "answer": "B",
    "explanation": "HMGB1 is a damage\u2010associated molecular pattern released by necrotic cells, directly correlating with tissue injury severity and providing a more specific measure of surgical invasiveness.",
    "question_token_count": 34,
    "answer_correctness_score": 10,
    "explanation_validity_score": 10,
    "question_clarity_score": 6,
    "question_difficulty_score": 8,
    "question_groundedness_score": 2,
    "avg_answer_token_count": 11
  },
  {
    "context": "Implementation of the complex treatment strategies that have been shown to improve survival of patients with congestive heart failure (CHF) may require certain expertise. We wanted to examine the association between pattern of outpatient care and survival of patients with CHF.\n\nIn a retrospective cohort study conducted with national Veterans Health Administration (VHA) databases, we examined the association between the pattern of outpatient care and survival in 11,661 patients discharged from VA hospitals between October 1, 1991, and September 30, 1992, with the primary diagnosis of CHF (cohort 1). Patients were divided into 4 groups, on the basis of their pattern of outpatient care over a 12-month period after discharge: 1) general medicine clinic visits only (GM-only); 2) cardiology clinic visits only (CARD-only); 3) general medicine and cardiology (MIXED) clinic visits; and 4) neither general medicine nor cardiology clinic visits (no-GM/CARD). We used the Cox proportional hazards model to evaluate 1-year survival, controlling for clinical and demographic factors. Consistency of our results was examined by performing identical analysis on a cohort of patients discharged from VHA hospitals between October 1, 1994, and September 30, 1995 (cohort 2, n = 10,141).\n\nThe overall 1-year mortality rate was 23% in the primary cohort. The unadjusted mortality rate was highest for patients in the no-GM/CARD follow up (29%) and lowest for patients in the MIXED group (19%). By use of the MIXED group as reference and adjusting for important clinical and demographic factors, the risk of death (risk ratio [95% CI]) was 1.12 (0.94-1.34) in the CARD-only group, 1.26 (1.15-1.38) in the GM-only group, and 1.48 (1.28-1.72) in the no-GM/CARD group. Cohort-2 results were consistent with cohort 1 for most covariates, and significant survival differences were again found between GM-only and the MIXED group (1.25 [1.14-1.37]).\n\n",
    "topic": "Consideration of demographic and clinical confounders in observational studies of healthcare utilization and survival.",
    "response": "<document_analysis>\nThe context describes a retrospective cohort study of CHF patients categorized by outpatient care patterns over 12 months post-discharge, then analyzed for 1-year survival. Critically, classification into visit-based groups uses events that occur during the risk period, introducing a subtle time\u2010related bias. The Cox model adjusts for covariates, but this design feature\u2014grouping by exposures accrued within follow-up\u2014can artificially confer \u201cimmortality\u201d to patients who survive long enough to have visits. This suggests immortal time bias. The question will test deep epidemiological understanding of bias types in observational survival analyses.\nDifficulty rating: 9/10\n</document_analysis>\n\n<output_format>\nQuestion: In a retrospective CHF cohort stratified by outpatient visits occurring during the first 12\u00a0months post-discharge and then assessed for 1-year mortality, which bias arises because patients must survive long enough to register a visit, artificially improving survival in the visit-based groups?\nA: Confounding by indication  \nB: Immortal time bias  \nC: Lead-time bias  \nD: Informative censoring bias  \nExplanation: Classifying exposure based on visits accrued during follow-up creates periods during which death cannot occur before exposure is assigned, thus introducing immortal time bias.  \nCorrect Answer: B\n</output_format>",
    "question": "In a retrospective CHF cohort stratified by outpatient visits occurring during the first 12\u00a0months post-discharge and then assessed for 1-year mortality, which bias arises because patients must survive long enough to register a visit, artificially improving survival in the visit-based groups?",
    "choices": {
      "A": "Confounding by indication",
      "B": "Immortal time bias",
      "C": "Lead-time bias",
      "D": "Informative censoring bias"
    },
    "answer": "B",
    "explanation": "Classifying exposure based on visits accrued during follow-up creates periods during which death cannot occur before exposure is assigned, thus introducing immortal time bias.",
    "question_token_count": 53,
    "answer_correctness_score": 10,
    "explanation_validity_score": 10,
    "question_clarity_score": 6,
    "question_difficulty_score": 8,
    "question_groundedness_score": 6,
    "avg_answer_token_count": 5
  },
  {
    "context": "Tacrolimus is a potent immunosuppressive drug used in organ transplantation. Because of its substantial toxic effects, narrow therapeutic index, and interindividual pharmacokinetic variability, therapeutic drug monitoring of whole-blood tacrolimus concentrations has been recommended. We investigated the comparability of the results of 2 immunoassay systems, affinity column-mediated immunoassay (ACMIA) and microparticle enzyme immunoassay (MEIA), comparing differences in the tacrolimus concentrations measured by the 2 methods in relation to the hematologic and biochemical values of hepatic and renal functions.\n\nA total of 154 samples from kidney or liver transplant recipients were subjected to Dimension RxL HM with a tacrolimus Flex reagent cartilage for the ACMIA method and IMx tacrolimus II for the MEIA method.\n\nTacrolimus concentrations measured by the ACMIA method (n = 154) closely correlated with those measured by the MEIA method (r = 0.84). The Bland-Altman plot using concentration differences between the 2 methods and the average of the 2 methods showed no specific trends. The tacrolimus levels determined by both the MEIA method and the ACMIA method were not influenced by hematocrit levels, but the difference between the 2 methods (ACMIA - MEIA) tended to be larger in low hematocrit samples (P<.001).\n\n",
    "topic": "Comparative study design considerations when evaluating two immunoassay platforms in transplant patient samples.",
    "response": "<document_analysis>\nThe context describes a comparative evaluation of two immunoassay platforms (ACMIA and MEIA) for measuring whole\u2010blood tacrolimus in transplant patients. Key findings include: (1) a high correlation (r = 0.84) between methods, (2) Bland\u2010Altman analysis versus mean concentrations showing no proportional bias across the concentration range, and (3) a significant increase in the difference (ACMIA \u2013 MEIA) in samples with low hematocrit (P < .001). Thus, although overall agreement appears acceptable by standard Bland\u2010Altman, a matrix effect (hematocrit) acts as an effect modifier and produces bias that is not detected when plotting differences against mean concentrations. The most direct way to isolate and quantify this hematocrit\u2010dependent bias is to plot the assay differences against hematocrit values themselves and perform regression analysis. This insight informs design considerations for comparative immunoassay studies: one must assess potential sample\u2010matrix impacts by analyzing differences versus relevant sample attributes, not just versus mean analyte concentration.\nDifficulty rating: 8/10\n</document_analysis>\n\n<output_format>\nQuestion: In a comparative evaluation of two immunoassays for whole\u2010blood tacrolimus, a Bland\u2010Altman plot of differences versus mean concentrations showed no trend, yet larger assay differences were found in low\u2010hematocrit samples. Which analysis most directly quantifies this hematocrit\u2010dependent bias?\nA: Perform Deming regression between the two assay measurements.\nB: Conduct separate Bland\u2010Altman analyses stratified by hematocrit tertiles.\nC: Plot assay differences against hematocrit values and fit a linear regression.\nD: Calculate the intraclass correlation coefficient within the low\u2010hematocrit subgroup.\nExplanation: Directly plotting the difference versus hematocrit and applying regression quantifies how bias varies with hematocrit, isolating the matrix effect.\nCorrect Answer: C\n</output_format>",
    "question": "In a comparative evaluation of two immunoassays for whole\u2010blood tacrolimus, a Bland\u2010Altman plot of differences versus mean concentrations showed no trend, yet larger assay differences were found in low\u2010hematocrit samples. Which analysis most directly quantifies this hematocrit\u2010dependent bias?",
    "choices": {
      "A": "Perform Deming regression between the two assay measurements.",
      "B": "Conduct separate Bland\u2010Altman analyses stratified by hematocrit tertiles.",
      "C": "Plot assay differences against hematocrit values and fit a linear regression.",
      "D": "Calculate the intraclass correlation coefficient within the low\u2010hematocrit subgroup."
    },
    "answer": "C",
    "explanation": "Directly plotting the difference versus hematocrit and applying regression quantifies how bias varies with hematocrit, isolating the matrix effect.",
    "question_token_count": 61,
    "answer_correctness_score": 10,
    "explanation_validity_score": 10,
    "question_clarity_score": 8,
    "question_difficulty_score": 8,
    "question_groundedness_score": 10,
    "avg_answer_token_count": 14
  },
  {
    "context": "Using murine models, we have shown that the lysosomotropic amine, chloroquine, is effective in the prevention of graft-versus-host disease (GVHD) mediated by donor T cells reactive with recipient minor histocompatibility antigens (MiHCs). Because lysosomotropic amines can suppress major histocompatibility complex (MHC) class II antigen presentation, their mechanism of action is potentially different from current immune suppressant drugs used to control GVHD such as cyclosporine.\n\nWe investigated the use of cyclosporine and the lysosomotropic amines chloroquine and hydroxychloroquine in combination for additive or synergistic immunosuppression on T-cell responses in vitro to MiHC and MHC in mice.\n\nWe found that similar concentrations of chloroquine and hydroxychloroquine suppress the T-cell response to MiHC in mice (C57BL/6 anti-BALB.B) and that lysosomotropic amines in combination with cyclosporine result in synergistic suppression of a proliferative response to MiHC. Similar suppression and synergy appear to be present in an alloreactive response (C57BL/6 anti-BALB/c). Direct inhibition by chloroquine of T-cell proliferative responses induced by anti-CD3epsilon in the absence of antigen-presenting cells is present at higher concentrations than that required to suppress responses to MiHC or MHC. Chloroquine appears to induce decreased T-cell viability at high concentrations. This effect does not appear to be due to decreased T-cell production of interleukin-2 or interferon-gamma. At lower concentrations (<25 microg/ml), chloroquine can also decrease the ability of antigen-presenting cells to stimulate an a C57BL/6 anti-BALB/c T-cell response and can inhibit MHC class II expression after activation with lipopolysaccharide.\n\n",
    "topic": "Role of subcytotoxic chloroquine concentrations (<25 \u00b5g/ml) in impairing antigen-presenting cell function and induced MHC class II expression after LPS activation.",
    "response": "<document_analysis>\nThe context describes how subcytotoxic levels of chloroquine (<25\u00a0\u00b5g/ml) impair antigen-presenting cell (APC) function by inhibiting MHC class II expression following LPS activation. The key mechanistic insight is that chloroquine, as a lysosomotropic amine, accumulates in acidic endosomal/lysosomal compartments, raises their pH, and thus disrupts proteolytic processing of the invariant chain and peptide loading onto MHC II. This mechanistic detail allows formulation of a challenging question probing expert understanding of vesicular pH regulation and its impact on antigen presentation.\n</document_analysis>\n\n<output_format>\nQuestion: Subcytotoxic concentrations of chloroquine (<25\u00a0\u00b5g/ml) impair antigen-presenting cell function by inhibiting LPS-induced MHC class II expression. Which lysosomal mechanism most directly explains this effect?\nA: Activation of vacuolar H\u207a-ATPase increasing lysosomal acidity and denaturing MHC II molecules\nB: Chelation of intravesicular calcium that disrupts MHC II\u2013peptide complex transport to the cell surface\nC: Elevation of endosomal pH that prevents proteolytic removal of the invariant chain, blocking peptide loading\nD: Inhibition of autophagosome\u2013lysosome fusion, reducing delivery of peptides for MHC II loading\nExplanation: Chloroquine accumulates in acidic vesicles and raises their pH, inhibiting proteases that remove the invariant chain and thus preventing peptide loading onto MHC II.\nCorrect Answer: C\n</output_format>",
    "question": "Subcytotoxic concentrations of chloroquine (<25\u00a0\u00b5g/ml) impair antigen-presenting cell function by inhibiting LPS-induced MHC class II expression. Which lysosomal mechanism most directly explains this effect?",
    "choices": {
      "A": "Activation of vacuolar H\u207a-ATPase increasing lysosomal acidity and denaturing MHC II molecules",
      "B": "Chelation of intravesicular calcium that disrupts MHC II\u2013peptide complex transport to the cell surface",
      "C": "Elevation of endosomal pH that prevents proteolytic removal of the invariant chain, blocking peptide loading",
      "D": "Inhibition of autophagosome\u2013lysosome fusion, reducing delivery of peptides for MHC II loading"
    },
    "answer": "C",
    "explanation": "Chloroquine accumulates in acidic vesicles and raises their pH, inhibiting proteases that remove the invariant chain and thus preventing peptide loading onto MHC II.",
    "question_token_count": 41,
    "answer_correctness_score": 10,
    "explanation_validity_score": 10,
    "question_clarity_score": 6,
    "question_difficulty_score": 8,
    "question_groundedness_score": 8,
    "avg_answer_token_count": 21
  },
  {
    "context": "The aim of this study was to determine whether bone scans (BS) can be avoided if pelvis was included in CT thorax and abdomen to detect bony metastases from breast cancer.\n\nResults of 77 pairs of CT (thorax, abdomen, and pelvis) and BS in newly diagnosed patients with metastatic breast cancer (MBC) were compared prospectively for 12 months. Both scans were blindly assessed by experienced radiologists and discussed at multidisciplinary team meetings regarding the diagnosis of bone metastases.\n\nCT detected metastatic bone lesions in 43 (98%) of 44 patients with bone metastases. The remaining patient had a solitary, asymptomatic bony metastasis in shaft of femur. BS was positive in all patients with bone metastases. There were 11 cases of false positive findings on BS.\n\n",
    "topic": "Radiation exposure comparison between combined CT thorax\u2013abdomen\u2013pelvis and conventional bone scintigraphy.",
    "response": "<document_analysis>\nThe context reports a prospective comparison of combined CT (thorax, abdomen, pelvis) versus bone scintigraphy (BS) in 77 newly diagnosed metastatic breast cancer patients, with 44 true cases of bone metastases and 33 without:\n- CT detected 43/44 true cases (sensitivity 97.7%), missed one solitary metastasis.\n- BS detected 44/44 true cases (sensitivity 100%) but produced 11 false positives among the 33 non\u2010metastatic patients.\nThis allows calculation of key diagnostic metrics (specificity, PPV, NPV). A suitably challenging question for domain experts can target the positive predictive value of BS, requiring integration of true\u2010positive and false\u2010positive data.\nDifficulty rating: 6/10 (requires quantitative synthesis but uses straightforward formula).\n</document_analysis>\n\n<output_format>\nQuestion: In this cohort of 77 patients, bone scintigraphy identified 44 true\u2010positive and 11 false\u2010positive results for bone metastases. What is the positive predictive value (PPV) of bone scintigraphy in this study?\nA: 67%\nB: 80%\nC: 98%\nD: 100%\nExplanation: PPV = true positives / (true positives + false positives) = 44 / (44 + 11) = 44/55 \u2248 80%.\nCorrect Answer: B\n</output_format>",
    "question": "In this cohort of 77 patients, bone scintigraphy identified 44 true\u2010positive and 11 false\u2010positive results for bone metastases. What is the positive predictive value (PPV) of bone scintigraphy in this study?",
    "choices": {
      "A": "67%",
      "B": "80%",
      "C": "98%",
      "D": "100%"
    },
    "answer": "B",
    "explanation": "PPV = true positives / (true positives + false positives) = 44 / (44 + 11) = 44/55 \u2248 80%.",
    "question_token_count": 48,
    "answer_correctness_score": 10,
    "explanation_validity_score": 10,
    "question_clarity_score": 8,
    "question_difficulty_score": 6,
    "question_groundedness_score": 10,
    "avg_answer_token_count": 3
  },
  {
    "context": "Seventeen patients, aged 7-54\u00a0years (mean of 37.2\u00a0year), were treated by pulpotomy and filling with ProRoot MTA(\u00ae)  in premolar or molar teeth with vital pulps and without clinical evidence of irreversible pulpitis. The patients were then followed up for 12 to 24\u00a0months and the teeth then assessed by clinical and radiographic examination. Statistical analysis was performed with Kaplan-Meier survival probability statistics to estimate the survival of the treated teeth.\n\nAt 24\u00a0months, the survival rate without any complementary treatment was estimated to be 82%. Two of the 17 treated teeth required root canal treatment for pain control and one for prosthetic reasons.\n\n",
    "topic": "Step-by-step clinical protocol for performing pulpotomy and placement of ProRoot MTA",
    "response": "<document_analysis>\nThe context describes a single-arm clinical trial of 17 teeth treated by pulpotomy with ProRoot MTA and followed for up to 24\u00a0months. Failures (two for pain requiring root canal therapy, one for prosthetic reasons) are reported alongside an 82% Kaplan-Meier survival estimate at 24\u00a0months. Key thematic elements include survival analysis methodology, handling of failures versus censored data, and competing risks in time-to-event data. A deeply probing question can target the statistical nuance of Kaplan-Meier estimation in the presence of competing events, challenging experts on survival analysis limitations.\nDifficulty rating: 8/10 \u2013 requires advanced understanding of survival analysis and competing risks.\n</document_analysis>\n\n<output_format>\nQuestion: In a single-arm study of pulpotomy with ProRoot MTA on 17 vital posterior teeth, Kaplan-Meier analysis yielded an 82% survival rate at 24\u00a0months without additional treatment, while failures included two cases needing root canal therapy for pain and one for prosthetic reasons. Which statement best describes a limitation of the Kaplan-Meier method in this context of competing risks?\nA: It overestimates the cumulative incidence of the observed failure event because competing events are treated as censored.\nB: It underestimates the hazard of failure by combining all failure modes into a single curve.\nC: It properly distinguishes between different failure types and yields unbiased incidence measures.\nD: It provides identical results to the cumulative incidence function when competing risks are present.\nExplanation: Kaplan-Meier treats competing events as censored observations, thus yielding an inflated estimate of the event of interest\u2019s incidence.\nCorrect Answer: A\n</output_format>",
    "question": "In a single-arm study of pulpotomy with ProRoot MTA on 17 vital posterior teeth, Kaplan-Meier analysis yielded an 82% survival rate at 24\u00a0months without additional treatment, while failures included two cases needing root canal therapy for pain and one for prosthetic reasons. Which statement best describes a limitation of the Kaplan-Meier method in this context of competing risks?",
    "choices": {
      "A": "It overestimates the cumulative incidence of the observed failure event because competing events are treated as censored.",
      "B": "It underestimates the hazard of failure by combining all failure modes into a single curve.",
      "C": "It properly distinguishes between different failure types and yields unbiased incidence measures.",
      "D": "It provides identical results to the cumulative incidence function when competing risks are present."
    },
    "answer": "A",
    "explanation": "Kaplan-Meier treats competing events as censored observations, thus yielding an inflated estimate of the event of interest\u2019s incidence.",
    "question_token_count": 79,
    "answer_correctness_score": 10,
    "explanation_validity_score": 10,
    "question_clarity_score": 6,
    "question_difficulty_score": 8,
    "question_groundedness_score": 9,
    "avg_answer_token_count": 17
  },
  {
    "context": "Although the retroperitoneal approach has been the preferred choice for open urological procedures, retroperitoneoscopy is not the preferred approach for laparoscopy. This study aims to develop a training model for retroperitoneoscopy and to establish an experimental learning curve.\n\nFifteen piglets were operated on to develop a standard retroperitoneoscopic nephrectomy (RPN) training model. All procedures were performed with three ports. Intraoperative data (side, operative time, blood loss, peritoneal opening) were recorded. Animals were divided into groups A, the first eight, and B, the last seven cases. Data were statistically analyzed.\n\nWe performed fifteen RPNs. The operative time varied from 15 to 50 minutes (median 30 minutes). Blood loss varied from 5 to 100 mL (median 20 mL). We experienced five peritoneal openings; we had two surgical vascular complications managed laparoscopically. There was statistical difference between groups A and B for peritoneal opening (p = 0.025), operative time (p = 0.0037), and blood loss (p = 0.026).\n\nRPN in a porcine model could simulate the whole procedure, from creating the space to nephrectomy completion. Experimental learning curve was eight cases, after statistical data analysis.\n\n",
    "topic": "Standardized three\u2011port placement technique for retroperitoneoscopic nephrectomy and its ergonomic implications",
    "response": "<document_analysis>\nThe context describes the development of a standardized three\u2011port retroperitoneoscopic nephrectomy (RPN) training model in piglets, focusing on ergonomic outcomes: operative time, blood loss, peritoneal openings, and vascular complications. Key findings include significant reductions in peritoneal openings, operative time, and blood loss after eight cases\u2014indicating an experimental learning curve of eight. The implicit ergonomic principle is how port placement influences lever mechanics and instrument triangulation in a confined retroperitoneal space. A deep question will probe the biomechanical rationale linking standardized port configuration and reduced peritoneal injury as expertise develops.\n</document_analysis>\n\n<output_format>\nQuestion: Which biomechanical rationale best explains how the standardized three\u2011port configuration reduces peritoneal tearing as the surgeon gains experience in retroperitoneoscopic nephrectomy?\nA: The optimized fulcrum\u2011to\u2011target distance reduces lever\u2011arm torque on the posterior peritoneum.\nB: Symmetrical port spacing enhances direct line\u2011of\u2011sight to the kidney but does not influence peritoneal tension.\nC: Increased lateral separation of ports lowers insufflation pressure, thereby decreasing peritoneal stress.\nD: Medial positioning of the camera port centralizes the instrument mass, minimizing collisions without affecting peritoneal integrity.\nExplanation: Standardizing port positions optimizes instrument fulcrum mechanics, reducing lever\u2011arm torque and shear forces on the peritoneum, which decreases tearing as ergonomic proficiency is achieved.\nCorrect Answer: A\n</output_format>",
    "question": "Which biomechanical rationale best explains how the standardized three\u2011port configuration reduces peritoneal tearing as the surgeon gains experience in retroperitoneoscopic nephrectomy?",
    "choices": {
      "A": "The optimized fulcrum\u2011to\u2011target distance reduces lever\u2011arm torque on the posterior peritoneum.",
      "B": "Symmetrical port spacing enhances direct line\u2011of\u2011sight to the kidney but does not influence peritoneal tension.",
      "C": "Increased lateral separation of ports lowers insufflation pressure, thereby decreasing peritoneal stress.",
      "D": "Medial positioning of the camera port centralizes the instrument mass, minimizing collisions without affecting peritoneal integrity."
    },
    "answer": "A",
    "explanation": "Standardizing port positions optimizes instrument fulcrum mechanics, reducing lever\u2011arm torque and shear forces on the peritoneum, which decreases tearing as ergonomic proficiency is achieved.",
    "question_token_count": 32,
    "answer_correctness_score": 9,
    "explanation_validity_score": 9,
    "question_clarity_score": 8,
    "question_difficulty_score": 9,
    "question_groundedness_score": 4,
    "avg_answer_token_count": 21
  },
  {
    "context": "Multislice helical computed tomography (CT), which can provide detailed 2-D and 3-D reconstructed images, is useful in imaging diagnosis for dental implant treatment. Therefore, in this study, it was performed to clarify the mandibular depiction of double-oblique reconstructed images when changing their thickness.\n\nA total of 38 sites in the mandibular molar region were examined using multislice helical CT. The thicknesses of the double-oblique images using multislice helical CT scans were reconstructed in 4 conditions: 0.3 mm, 0.9 mm, 1.6 mm, and 4.1 mm. In double-oblique images, mandibular depiction was evaluated by 5 oral radiologists using a subjective rating score.\n\nIn the alveolar crest and the whole of the mandibular canal, the highest value was obtained with 0.9 mm-thick images; however, there was no significant difference between 0.3 mm and 0.9 mm-thick images.\n\n",
    "topic": "Sample selection and site distribution considerations in mandibular CT studies (38 molar sites)",
    "response": "<document_analysis>\nThe context details a study comparing double-oblique CT reconstructions of the mandibular molar region at four slice thicknesses (0.3, 0.9, 1.6, and 4.1\u00a0mm) and finds that 0.9\u00a0mm slices yield the highest subjective depiction scores for the alveolar crest and mandibular canal, yet these scores are not significantly different from those obtained with the thinnest (0.3\u00a0mm) slices. This suggests a trade\u2011off: slightly thicker slices can maintain depiction quality while potentially reducing image noise and data volume. To challenge a domain expert, the question should probe the practical selection of slice thickness balancing resolution, noise, and data considerations.\nDifficulty rating: 7/10\n</document_analysis>\n\n<output_format>\nQuestion: Which reconstructed slice thickness in double-oblique mandibular CT provides the optimal balance of maintaining alveolar crest and mandibular canal depiction equivalent to the thinnest slices while reducing image noise and dataset size?\nA: 0.3\u00a0mm  \nB: 0.9\u00a0mm  \nC: 1.6\u00a0mm  \nD: 4.1\u00a0mm  \nExplanation: Although 0.3\u00a0mm slices offer maximum resolution, 0.9\u00a0mm slices achieve the highest depiction scores (not significantly different from 0.3\u00a0mm) and benefit from lower noise and smaller data volume.  \nCorrect Answer: B\n</output_format>",
    "question": "Which reconstructed slice thickness in double-oblique mandibular CT provides the optimal balance of maintaining alveolar crest and mandibular canal depiction equivalent to the thinnest slices while reducing image noise and dataset size?",
    "choices": {
      "A": "0.3\u00a0mm",
      "B": "0.9\u00a0mm",
      "C": "1.6\u00a0mm",
      "D": "4.1\u00a0mm"
    },
    "answer": "B",
    "explanation": "Although 0.3\u00a0mm slices offer maximum resolution, 0.9\u00a0mm slices achieve the highest depiction scores (not significantly different from 0.3\u00a0mm) and benefit from lower noise and smaller data volume.",
    "question_token_count": 41,
    "answer_correctness_score": 10,
    "explanation_validity_score": 10,
    "question_clarity_score": 8,
    "question_difficulty_score": 9,
    "question_groundedness_score": 10,
    "avg_answer_token_count": 5
  },
  {
    "context": "To explore whether early treatment would shorten the duration of headache from headache onset to its peak and reduce headache severity at peak.\n\nPrior clinical studies almost exclusively focused on headache relief after dosing. No data are available on whether early intervention affects the duration from headache onset to peak and headache severity at peak.\n\nAdult migraineurs were enrolled in this observational study from multi-site headache clinics. Patients recorded their migraine experiences via an electronic diary over 1 month. Patients reported the time and pain severity at onset, dosing, and peak. We used a linear mixed model to evaluate the impact of the timing of treatment and to adjust for covariates and correlation of observations within subjects.\n\nA total of 182 patients reported 970 migraine episodes, 620 of which were treated before headaches progressed to peak. Mean time from headache onset to peak varied from 1.9 hours to 8.9 hours for patients treated within 15 minutes of onset and those who waited for 4 or more hours, respectively. However, early intervention was not associated with reduced headache severity at peak. In multivariate analysis, early treatment, use of triptans, and mild migraine headache in the past 3 months were significantly associated with shorter time from onset to headache peak. A separate model indicated that the timing of medication was not associated with the duration between dosing and headache peak, but use of triptans shortened the time from dosing to headache peak.\n\n",
    "topic": "Methodology for recording and defining the time and pain severity at migraine onset, dosing, and headache peak.",
    "response": "<document_analysis>\nThe context describes an observational study using electronic diaries and linear mixed models to assess how the timing of migraine treatment and use of triptans influence (1) the interval from headache onset to peak and (2) the interval from dosing to peak. Early treatment and triptan use both shorten onset\u2010to\u2010peak, but only triptans shorten dosing\u2010to\u2010peak, while timing of dosing has no effect on the dosing\u2010to\u2010peak interval. This nuanced distinction between two related time intervals and the separate statistical models offers rich ground for a challenging question about differential effects.\nDifficulty: 8/10\n</document_analysis>\n\n<output_format>\nQuestion: Based on the study\u2019s multivariate mixed\u2010model analyses, which statement best captures the distinct impacts of treatment timing versus triptan use on the migraine progression intervals?\nA: Both early treatment and triptan use independently shorten the interval from dosing to headache peak, but only early treatment reduces onset\u2010to\u2010peak.\nB: Early treatment reduces only the onset\u2010to\u2010peak interval, whereas triptan use shortens both the onset\u2010to\u2010peak and dosing\u2010to\u2010peak intervals.\nC: Neither early treatment nor triptan use affects the dosing\u2010to\u2010peak interval, but early treatment still shortens onset\u2010to\u2010peak.\nD: Triptan use shortens the onset\u2010to\u2010peak interval but paradoxically prolongs the dosing\u2010to\u2010peak interval, while early treatment impacts only dosing\u2010to\u2010peak.\nExplanation: Early intervention and triptan use both shorten onset\u2010to\u2010peak, but only triptans, not timing, shorten dosing\u2010to\u2010peak.\nCorrect Answer: B\n</output_format>",
    "question": "Based on the study\u2019s multivariate mixed\u2010model analyses, which statement best captures the distinct impacts of treatment timing versus triptan use on the migraine progression intervals?",
    "choices": {
      "A": "Both early treatment and triptan use independently shorten the interval from dosing to headache peak, but only early treatment reduces onset\u2010to\u2010peak.",
      "B": "Early treatment reduces only the onset\u2010to\u2010peak interval, whereas triptan use shortens both the onset\u2010to\u2010peak and dosing\u2010to\u2010peak intervals.",
      "C": "Neither early treatment nor triptan use affects the dosing\u2010to\u2010peak interval, but early treatment still shortens onset\u2010to\u2010peak.",
      "D": "Triptan use shortens the onset\u2010to\u2010peak interval but paradoxically prolongs the dosing\u2010to\u2010peak interval, while early treatment impacts only dosing\u2010to\u2010peak."
    },
    "answer": "B",
    "explanation": "Early intervention and triptan use both shorten onset\u2010to\u2010peak, but only triptans, not timing, shorten dosing\u2010to\u2010peak.",
    "question_token_count": 33,
    "answer_correctness_score": 10,
    "explanation_validity_score": 10,
    "question_clarity_score": 6,
    "question_difficulty_score": 8,
    "question_groundedness_score": 9,
    "avg_answer_token_count": 33
  },
  {
    "context": "Tethering of the spinal cord is thought to increase the chance of neurological injury when scoliosis correction is undertaken. All patients with myelomeningocele (MM) are radiographically tethered, and untethering procedures carry significant morbidity risks including worsening neurological function and wound complications. No guidelines exist as regards untethering in patients with MM prior to scoliosis correction surgery. The authors' aim in this study was to evaluate their experience in patients with MM who were not untethered before scoliosis correction.\n\nSeventeen patients with MM were retrospectively identified and 1) had no evidence of a clinically symptomatic tethered cord, 2) had undergone spinal fusion for scoliosis correction, and 3) had not been untethered for at least 1 year prior to surgery. The minimum follow-up after fusion was 2 years. Charts and radiographs were reviewed for neurological or shunt complications in the perioperative period.\n\nThe average age of the patients was 12.4 years, and the following neurological levels were affected: T-12 and above, 7 patients; L-1/L-2, 6 patients; L-3, 2 patients; and L-4, 2 patients. All were radiographically tethered as confirmed on MR imaging. Fourteen of the patients (82%) had a ventriculoperitoneal shunt. The mean Cobb angle was corrected from 82 degrees to 35 degrees , for a 57% correction. All patients underwent neuromonitoring of their upper extremities, and some underwent lower extremity monitoring as well. Postoperatively, no patient experienced a new cranial nerve palsy, shunt malfunction, change in urological function, or upper extremity weakness/sensory loss. One patient had transient lower extremity weakness, which returned to baseline within 1 month of surgery.\n\n",
    "topic": "Methodological considerations and limitations inherent in retrospective cohort designs assessing surgical outcomes.",
    "response": "<document_analysis>\nThe context describes a retrospective cohort study of 17 myelomeningocele patients who underwent scoliosis correction without prior untethering. Key methodological aspects include: small sample size, absence of a comparison group (no untethered vs untethered), retrospective design (chart review), and a minimum two-year follow-up. The major limitation impeding causal inference is the lack of a control group undergoing prophylactic untethering, which prevents direct comparison of complication rates and introduces potential confounding. Other biases (selection bias by excluding symptomatic cases, observer bias, limited power) are present but secondary to the missing comparator arm.\n</document_analysis>\n\n<output_format>\nQuestion: In assessing the safety of performing scoliosis correction without prior untethering in this retrospective cohort, which methodological limitation most undermines the ability to draw causal conclusions about comparative complication risks?\nA: Exclusion of clinically symptomatic tethered cord patients, creating selection bias toward lower\u2010risk individuals\nB: Absence of a contemporaneous control group of patients who underwent prophylactic untethering, preventing direct risk comparison\nC: Potential observer bias in detecting postoperative complications due to reliance on retrospective chart review\nD: Follow-up limited to two years, which may miss late-onset neurological sequelae\nExplanation: Without a control arm of untethered patients, one cannot directly compare complication rates, leaving causal inferences about the safety of omitting untethering unsupported.\nCorrect Answer: B\n</output_format>",
    "question": "In assessing the safety of performing scoliosis correction without prior untethering in this retrospective cohort, which methodological limitation most undermines the ability to draw causal conclusions about comparative complication risks?",
    "choices": {
      "A": "Exclusion of clinically symptomatic tethered cord patients, creating selection bias toward lower\u2010risk individuals",
      "B": "Absence of a contemporaneous control group of patients who underwent prophylactic untethering, preventing direct risk comparison",
      "C": "Potential observer bias in detecting postoperative complications due to reliance on retrospective chart review",
      "D": "Follow-up limited to two years, which may miss late-onset neurological sequelae"
    },
    "answer": "B",
    "explanation": "Without a control arm of untethered patients, one cannot directly compare complication rates, leaving causal inferences about the safety of omitting untethering unsupported.",
    "question_token_count": 37,
    "answer_correctness_score": 10,
    "explanation_validity_score": 10,
    "question_clarity_score": 8,
    "question_difficulty_score": 9,
    "question_groundedness_score": 10,
    "avg_answer_token_count": 19
  },
  {
    "context": "The purpose of this study was to investigate the efficacy of ultrasonography to confirm Schanz pin placement in a cadaveric model, and the interobserver repeatability of the ultrasound methodology.\n\nThis investigation is a repeated measures cadaveric study with multiple examiners.\n\nCadaveric preparation and observations were done by an orthopaedic traumatologist and resident, and two general surgery traumatologists.\n\nA total of 16 Schanz pins were equally placed in bilateral femora and tibiae. Four examiners took measurements of pin protrusion beyond the distal cortices using first ultrasonography and then by direct measurement after gross dissection.MAIN OUTCOME MEASURE(S): Distal Schanz pin protrusion length measurements from both ultrasonography and direct measurement post dissection.\n\nSchanz pin protrusion measurements are underestimated by ultrasonography (p<0.01) by an average of 10 percent over the range of 5 to 18 mm, and they display a proportional bias that increases the under reporting as the magnitude of pin protrusion increases. Ultrasound data demonstrate good linear correlation and closely represent actual protrusion values in the 5 to 12 mm range. Interobserver repeatability analysis demonstrated that all examiners were not statistically different in their measurements despite minimal familiarity with the ultrasound methodology (p>0.8).\n\n",
    "topic": "Potential training and familiarity requirements to improve ultrasonography measurement accuracy.",
    "response": "<document_analysis>\nThe context describes a cadaveric study comparing ultrasonography versus direct measurement of Schanz pin protrusion with multiple examiners. Key findings include an average 10% underestimation by ultrasound that worsens with larger protrusion lengths (\u201cproportional bias\u201d), good linear correlation in the 5\u201312\u00a0mm range, and high interobserver repeatability (p\u00a0>\u00a00.8). The most nuanced concept is the nature of the measurement error\u2014specifically a systematic proportional bias rather than fixed or random error. This insight underpins a challenging question about error modeling that requires domain experts to distinguish between types of measurement biases.\nDifficulty rating: 8/10\n</document_analysis>\n\n<output_format>\nQuestion: Which measurement error model best characterizes the ultrasonography\u2011based protrusion length assessments in the study, given their consistent underestimation and increasing bias at larger protrusion magnitudes?\nA: Additive systematic bias with a constant offset  \nB: Proportional systematic bias  \nC: Purely random heteroscedastic error  \nD: Examiner\u2011dependent differential bias  \nExplanation: The underestimation increases as true protrusion length grows, indicating a systematic error proportional to the measurement magnitude.  \nCorrect Answer: B\n</output_format>",
    "question": "Which measurement error model best characterizes the ultrasonography\u2011based protrusion length assessments in the study, given their consistent underestimation and increasing bias at larger protrusion magnitudes?",
    "choices": {
      "A": "Additive systematic bias with a constant offset",
      "B": "Proportional systematic bias",
      "C": "Purely random heteroscedastic error",
      "D": "Examiner\u2011dependent differential bias"
    },
    "answer": "B",
    "explanation": "The underestimation increases as true protrusion length grows, indicating a systematic error proportional to the measurement magnitude.",
    "question_token_count": 34,
    "answer_correctness_score": 10,
    "explanation_validity_score": 10,
    "question_clarity_score": 7,
    "question_difficulty_score": 8,
    "question_groundedness_score": 10,
    "avg_answer_token_count": 7
  },
  {
    "context": "Oncology literature cites that only 2% to 4% of patients participate in research. Up to 85% of patients are unaware that clinical trials research is being conducted at their treatment facility or that they might be eligible to participate.\n\nIt was hypothesized that patients' satisfaction with information regarding clinical trials would improve after targeted educational interventions, and accruals to clinical trials would increase in the year following those interventions.\n\nAll new patients referred to the cancer center over a 4-month period were mailed a baseline survey to assess their knowledge of clinical research. Subsequently, educational interventions were provided, including an orientation session highlighting clinical trials, a pamphlet, and a reference to a clinical trials Web site. A postintervention survey was sent to the responders of the initial survey 3 months after the initial mailing.\n\nPatient satisfaction with information significantly increased after the interventions. There was no increase in subsequent enrollment in clinical trials. Patients who indicated an inclination to participate in clinical trials tended to have greater satisfaction with the information they received.\n\n",
    "topic": "Potential confounding factors, biases (such as response bias or selection bias), and limitations inherent in the study design.",
    "response": "<document_analysis>\nThe context describes a pre-post intervention study evaluating patient satisfaction and clinical trial enrollment, with educational materials sent to all new patients but follow-up surveys only sent to those who responded initially. Key limitations include selection bias (only initial responders are surveyed postintervention), response bias (more engaged patients may overreport satisfaction), and confounding by patient predisposition (those already inclined to participate report higher satisfaction). The most substantive bias affecting the validity of reported satisfaction improvements is the selection bias introduced by non-random follow-up sampling.\n</document_analysis>\n\n<output_format>\nQuestion: In the evaluation of improved patient satisfaction, which methodological flaw most likely led to an overestimation of the educational interventions\u2019 true effect?\nA: Recall bias from patients misremembering their baseline knowledge\nB: Selection bias arising from surveying only those who returned the initial questionnaire\nC: Observer-expectancy bias due to researchers influencing patient responses\nD: Instrumentation bias from using different satisfaction scales before and after the intervention\nExplanation: Only initial responders were eligible for the postintervention survey, causing selection bias by excluding nonresponders who may have had different satisfaction levels.\nCorrect Answer: B\n</output_format>",
    "question": "In the evaluation of improved patient satisfaction, which methodological flaw most likely led to an overestimation of the educational interventions\u2019 true effect?",
    "choices": {
      "A": "Recall bias from patients misremembering their baseline knowledge",
      "B": "Selection bias arising from surveying only those who returned the initial questionnaire",
      "C": "Observer-expectancy bias due to researchers influencing patient responses",
      "D": "Instrumentation bias from using different satisfaction scales before and after the intervention"
    },
    "answer": "B",
    "explanation": "Only initial responders were eligible for the postintervention survey, causing selection bias by excluding nonresponders who may have had different satisfaction levels.",
    "question_token_count": 27,
    "answer_correctness_score": 10,
    "explanation_validity_score": 10,
    "question_clarity_score": 6,
    "question_difficulty_score": 8,
    "question_groundedness_score": 10,
    "avg_answer_token_count": 12
  },
  {
    "context": "Cytokine concentration in pancreatic juice of patients with pancreatic disease is unknown. Secretin stimulation allows endoscopic collection of pancreatic juice secreted into the duodenum. We aimed to evaluate the cytokine concentrations in pancreatic juice of patients with abdominal pain to discriminate presence from absence of pancreatic disease.\n\nFrom January 2003-December 2004, consecutive patients with abdominal pain compatible with pancreatic origin were enrolled. Patients underwent upper endoscopy. Intravenous secretin (0.2 mug/kg) was given immediately before scope intubation. Pancreatic juice collected from the duodenum was immediately snap-frozen in liquid nitrogen until assays were performed. Pancreatic juice levels of interleukin-8, interleukin-6, intercellular adhesion molecule 1, and transforming growth factor-beta 1 were measured by modified enzyme-linked immunosorbent assays. The final diagnosis was made by the primary gastroenterologist on the basis of medical history; laboratory, endoscopic, and imaging studies; and clinical follow-up. Fisher exact test and Kruskal-Wallis rank sum test were used for statistical analysis.\n\nOf 130 patients screened, 118 met the inclusion criteria. Multivariate analysis revealed that only interleukin-8 was able to discriminate between normal pancreas and chronic pancreatitis (P = .011), pancreatic cancer (P = .044), and the presence of pancreatic diseases (P = .007). Individual cytokine concentrations were not significantly different in chronic pancreatitis compared with pancreatic cancer.\n\n",
    "topic": "Rationale for measuring cytokine concentrations in pancreatic juice to discriminate pancreatic disease presence.",
    "response": "<document_analysis>\nThe context describes a study measuring four cytokines (IL-8, IL-6, ICAM-1, TGF-\u03b21) in secretin-stimulated pancreatic juice to distinguish normal pancreas from chronic pancreatitis and pancreatic cancer. Multivariate analysis found only IL-8 to be a significant discriminator. The underlying statistical challenge when biologically relevant but correlated predictors lose significance in multivariate models is multicollinearity. This nuance is not spelled out but is critical for domain experts analyzing cytokine panels.\n</document_analysis>\n\n<output_format>\nQuestion: In a multivariate analysis of cytokine concentrations in secretin-stimulated pancreatic juice, only interleukin-8 remained a significant discriminator of pancreatic disease while interleukin-6, ICAM-1, and TGF-\u03b21 did not; which statistical phenomenon most likely explains the loss of significance for these other cytokines despite their known biological roles?\nA: Multicollinearity among the cytokine predictors leading to unstable coefficient estimates  \nB: Application of a Bonferroni correction making the significance threshold overly stringent  \nC: Simpson\u2019s paradox caused by uneven distribution of disease subtypes  \nD: Violation of normality assumptions in nonparametric data  \nExplanation: When predictors are highly correlated, multicollinearity inflates variance of coefficient estimates, causing loss of individual significance in multivariate models.  \nCorrect Answer: A  \n</output_format>",
    "question": "In a multivariate analysis of cytokine concentrations in secretin-stimulated pancreatic juice, only interleukin-8 remained a significant discriminator of pancreatic disease while interleukin-6, ICAM-1, and TGF-\u03b21 did not; which statistical phenomenon most likely explains the loss of significance for these other cytokines despite their known biological roles?",
    "choices": {
      "A": "Multicollinearity among the cytokine predictors leading to unstable coefficient estimates",
      "B": "Application of a Bonferroni correction making the significance threshold overly stringent",
      "C": "Simpson\u2019s paradox caused by uneven distribution of disease subtypes",
      "D": "Violation of normality assumptions in nonparametric data"
    },
    "answer": "A",
    "explanation": "When predictors are highly correlated, multicollinearity inflates variance of coefficient estimates, causing loss of individual significance in multivariate models.",
    "question_token_count": 67,
    "answer_correctness_score": 10,
    "explanation_validity_score": 10,
    "question_clarity_score": 8,
    "question_difficulty_score": 9,
    "question_groundedness_score": 10,
    "avg_answer_token_count": 12
  },
  {
    "context": "Congenital cytomegalovirus infection is currently the leading cause of congenital infection in 0.2-2.2% of live births worldwide leading to variable serious sequalae. The aim of the study was to determine if low birth weight is an indicator of CMV congenital infection evidenced by detecting CMV-DNA in umbilical cord blood at the time of delivery.\n\nCMV-IgG and IgM antibodies and CMV-DNAemia were assessed in umbilical cord blood of two hundreds newborns, one hundred of whom had birth weight<or = 2700 gram and/or head circumference<or = 32 cm.\n\nCMV-IgM was not detected, while CMV-IgG was positive in 80-90% of the two hundreds tested newborns. CMV-DNA was detected in four out of the 200 newborns. One of them was over the adopted weight limit (>2700 gram).\n\n",
    "topic": "Critique the study design and suggest methodological enhancements for future research on congenital CMV detection.",
    "response": "<document_analysis>\nThe provided context describes a study assessing the utility of low birth weight as an indicator for congenital CMV infection by detecting CMV-DNA in umbilical cord blood. Key limitations include exclusive reliance on cord blood for CMV-DNA detection (where viral loads may be low), absence of gold\u2010standard neonatal specimens (saliva/urine) for PCR, lack of maternal serologic and virologic correlation, and no postnatal follow-up to capture delayed seroconversion. A probing question should focus on the most impactful methodological enhancement to overcome the low detection rate and align with best practices for diagnosing congenital CMV.\n</document_analysis>\n\n<output_format>\nQuestion: Given the low detection rate of CMV-DNA in umbilical cord blood alone, which methodological enhancement would most effectively improve the sensitivity of congenital CMV diagnosis in a similar future study?\nA: Expand the cohort to include a larger number of low birth weight infants for greater statistical power.\nB: Supplement cord blood testing with neonatal saliva or urine PCR within the first three weeks of life to capture higher viral loads.\nC: Incorporate maternal CMV-IgM and CMV-DNA assessments during pregnancy to correlate maternal viremia with neonatal infection.\nD: Switch from qualitative to quantitative PCR on cord blood to detect lower levels of viral DNA.\nExplanation: Testing neonatal saliva or urine via PCR in the first weeks postpartum is the gold standard for congenital CMV detection due to higher viral loads than in cord blood, markedly improving diagnostic sensitivity.\nCorrect Answer: B\n</output_format>",
    "question": "Given the low detection rate of CMV-DNA in umbilical cord blood alone, which methodological enhancement would most effectively improve the sensitivity of congenital CMV diagnosis in a similar future study?",
    "choices": {
      "A": "Expand the cohort to include a larger number of low birth weight infants for greater statistical power.",
      "B": "Supplement cord blood testing with neonatal saliva or urine PCR within the first three weeks of life to capture higher viral loads.",
      "C": "Incorporate maternal CMV-IgM and CMV-DNA assessments during pregnancy to correlate maternal viremia with neonatal infection.",
      "D": "Switch from qualitative to quantitative PCR on cord blood to detect lower levels of viral DNA."
    },
    "answer": "B",
    "explanation": "Testing neonatal saliva or urine via PCR in the first weeks postpartum is the gold standard for congenital CMV detection due to higher viral loads than in cord blood, markedly improving diagnostic sensitivity.",
    "question_token_count": 39,
    "answer_correctness_score": 10,
    "explanation_validity_score": 10,
    "question_clarity_score": 6,
    "question_difficulty_score": 8,
    "question_groundedness_score": 9,
    "avg_answer_token_count": 22
  },
  {
    "context": "The purpose of this study was to determine if registered dietitian (RD) and registered nurse (RN) certified diabetes educators (CDEs) provide similar recommendations regarding carbohydrates and dietary supplements to individuals with diabetes.\n\nA survey was mailed to CDEs in the southern United States. Participants were asked to indicate their recommendations for use of carbohydrates, fiber, artificial sweeteners, and 12 selected dietary and herbal supplements when counseling individuals with diabetes.\n\nThe survey sample consisted of 366 CDEs: 207 were RNs and 159 were RDs. No statistically significant differences were found between RNs and RDs in typical carbohydrate recommendations for treatment of diabetes. However, RDs were more likely than RNs to make recommendations for fiber intake or use of the glycemic index. A significant difference also was found in the treatment of hypoglycemia: RNs were more likely than RDs to recommend consuming a carbohydrate source with protein to treat hypoglycemia.\n\n",
    "topic": "Survey study design and methodology used to compare carbohydrate and supplement recommendations by RD and RN CDEs.",
    "response": "<document_analysis>\nThe context describes a cross-sectional mailed survey comparing registered dietitians (RDs) and registered nurses (RNs) certified diabetes educators (CDEs) on multiple recommendations (carbohydrates, fiber, glycemic index, hypoglycemia treatment, and 12 supplements). Numerous hypothesis tests across distinct outcomes raise the family-wise Type\u00a0I error risk. A probing methodological question would focus on appropriate multiple-comparison adjustments to maintain statistical validity.\n</document_analysis>\n\n<output_format>\nQuestion: In comparing RDs and RNs across multiple dietary recommendation outcomes in this survey, which sequential procedure offers a more powerful alternative to the traditional Bonferroni correction while still controlling the family-wise Type\u00a0I error rate?\nA: Tukey\u2019s honestly significant difference test  \nB: Holm\u2013Bonferroni procedure  \nC: Kaplan\u2013Meier adjustment  \nD: Benjamini\u2013Hochberg false discovery rate  \nExplanation: The Holm\u2013Bonferroni procedure is a stepwise method that controls the family-wise error rate and is uniformly more powerful than the simple Bonferroni correction.  \nCorrect Answer: B\n</output_format>",
    "question": "In comparing RDs and RNs across multiple dietary recommendation outcomes in this survey, which sequential procedure offers a more powerful alternative to the traditional Bonferroni correction while still controlling the family-wise Type\u00a0I error rate?",
    "choices": {
      "A": "Tukey\u2019s honestly significant difference test",
      "B": "Holm\u2013Bonferroni procedure",
      "C": "Kaplan\u2013Meier adjustment",
      "D": "Benjamini\u2013Hochberg false discovery rate"
    },
    "answer": "B",
    "explanation": "The Holm\u2013Bonferroni procedure is a stepwise method that controls the family-wise error rate and is uniformly more powerful than the simple Bonferroni correction.",
    "question_token_count": 43,
    "answer_correctness_score": 10,
    "explanation_validity_score": 10,
    "question_clarity_score": 1,
    "question_difficulty_score": 10,
    "question_groundedness_score": 1,
    "avg_answer_token_count": 8
  },
  {
    "context": "Using murine models, we have shown that the lysosomotropic amine, chloroquine, is effective in the prevention of graft-versus-host disease (GVHD) mediated by donor T cells reactive with recipient minor histocompatibility antigens (MiHCs). Because lysosomotropic amines can suppress major histocompatibility complex (MHC) class II antigen presentation, their mechanism of action is potentially different from current immune suppressant drugs used to control GVHD such as cyclosporine.\n\nWe investigated the use of cyclosporine and the lysosomotropic amines chloroquine and hydroxychloroquine in combination for additive or synergistic immunosuppression on T-cell responses in vitro to MiHC and MHC in mice.\n\nWe found that similar concentrations of chloroquine and hydroxychloroquine suppress the T-cell response to MiHC in mice (C57BL/6 anti-BALB.B) and that lysosomotropic amines in combination with cyclosporine result in synergistic suppression of a proliferative response to MiHC. Similar suppression and synergy appear to be present in an alloreactive response (C57BL/6 anti-BALB/c). Direct inhibition by chloroquine of T-cell proliferative responses induced by anti-CD3epsilon in the absence of antigen-presenting cells is present at higher concentrations than that required to suppress responses to MiHC or MHC. Chloroquine appears to induce decreased T-cell viability at high concentrations. This effect does not appear to be due to decreased T-cell production of interleukin-2 or interferon-gamma. At lower concentrations (<25 microg/ml), chloroquine can also decrease the ability of antigen-presenting cells to stimulate an a C57BL/6 anti-BALB/c T-cell response and can inhibit MHC class II expression after activation with lipopolysaccharide.\n\n",
    "topic": "Evaluation of hydroxychloroquine\u2019s immunosuppressive potency relative to chloroquine in the context of minor histocompatibility\u2013driven T-cell responses.",
    "response": "<document_analysis>\nThe context describes how chloroquine and hydroxychloroquine, lysosomotropic amines, suppress minor histocompatibility antigen\u2013driven T-cell responses by impairing MHC class II antigen presentation in antigen-presenting cells (APCs). It also reports that combining these amines with cyclosporine yields synergistic immunosuppression. Cyclosporine\u2019s known action is calcineurin inhibition in T cells, distinct from the endosomal alkalinization by lysosomotropic amines. This mechanistic complementarity underlies the synergy. The most probing expert-level question asks for the explicit pairing of these divergent mechanisms explaining the synergy.\nDifficulty rating: 8/10 \u2013 requires integration of drug-specific intracellular targets and immunological processes.\n</document_analysis>\n\n<output_format>\nQuestion: The synergistic suppression of minor histocompatibility antigen\u2013driven T-cell proliferation by combining cyclosporine with hydroxychloroquine most likely arises from which complementary mechanisms?\nA: Both drugs elevate endosomal pH to block MHC class II antigen processing.\nB: Cyclosporine inhibits calcineurin-dependent T-cell activation, while hydroxychloroquine impairs endosomal acidification required for peptide loading onto MHC class II in APCs.\nC: Hydroxychloroquine directly antagonizes the IL-2 receptor on T cells, and cyclosporine disrupts MHC class II\u2013mediated antigen presentation.\nD: Cyclosporine prevents NF-\u03baB activation in APCs, enhancing hydroxychloroquine\u2019s induction of T-cell apoptosis.\nExplanation: Cyclosporine blocks the calcineurin\u2013NFAT pathway in T cells, and hydroxychloroquine raises endosomal pH to inhibit antigen processing and MHC class II presentation in APCs, accounting for their synergistic suppression.\nCorrect Answer: B\n</output_format>",
    "question": "The synergistic suppression of minor histocompatibility antigen\u2013driven T-cell proliferation by combining cyclosporine with hydroxychloroquine most likely arises from which complementary mechanisms?",
    "choices": {
      "A": "Both drugs elevate endosomal pH to block MHC class II antigen processing.",
      "B": "Cyclosporine inhibits calcineurin-dependent T-cell activation, while hydroxychloroquine impairs endosomal acidification required for peptide loading onto MHC class II in APCs.",
      "C": "Hydroxychloroquine directly antagonizes the IL-2 receptor on T cells, and cyclosporine disrupts MHC class II\u2013mediated antigen presentation.",
      "D": "Cyclosporine prevents NF-\u03baB activation in APCs, enhancing hydroxychloroquine\u2019s induction of T-cell apoptosis."
    },
    "answer": "B",
    "explanation": "Cyclosporine blocks the calcineurin\u2013NFAT pathway in T cells, and hydroxychloroquine raises endosomal pH to inhibit antigen processing and MHC class II presentation in APCs, accounting for their synergistic suppression.",
    "question_token_count": 38,
    "answer_correctness_score": 10,
    "explanation_validity_score": 10,
    "question_clarity_score": 8,
    "question_difficulty_score": 9,
    "question_groundedness_score": 9,
    "avg_answer_token_count": 30
  },
  {
    "context": "A tonsillectomy audit was carried out and compared with other studies, to emphasize the role of antibiotics.\n\nThis study was carried out at North West Armed Forces Hospital, Tabuk, Kingdom of Saudi Arabia, during the year January 1999 through to December 1999. This is a retrospective study of patients who had tonsillectomy with or with adenoidectomy, the topics audited included indication for surgery, grade of surgeon, method of surgery, length of hospital stay, complications and the use of postoperative antibiotics.\n\nA total of 185 patients underwent tonsillectomy with or without adenoidectomy. The patients age ranged between 2 years to 53 years and the majority were children. In our audit we found no difference with regard to grade of surgeons, method of hemostasis in the outcome of surgery. Moreover, postoperative antibiotics had no role in pain control, postoperative fever, secondary hemorrhage or reduction in hospital stay. The administration of analgesics on the basis of, as required, had poor pain control.\n\n",
    "topic": "Recommendations for future research or practice changes based on the audit\u2019s conclusions",
    "response": "<document_analysis>\nThe context reports a retrospective audit of 185 tonsillectomy patients, showing no impact of postoperative antibiotics on key outcomes and that \u201cas required\u201d analgesic administration yielded poor pain control. Important missing elements include standardized pain assessment, dosing schedules, and prospective randomization. A high-level recommendation would be to conduct a rigorous prospective trial comparing a scheduled multimodal analgesic protocol against PRN dosing, using objective, standardized endpoints. This gap analysis motivates a question about optimal future study design and primary outcomes to validate improved postoperative pain management.\nDifficulty rating: 8/10\n</document_analysis>\n\n<output_format>\nQuestion: Considering the finding that as-needed analgesic administration resulted in suboptimal pain control after tonsillectomy, which study design and primary endpoint would most effectively assess the efficacy of a scheduled multimodal analgesic regimen?\nA: Double-blind randomized trial comparing scheduled multimodal analgesia versus PRN dosing with total opioid consumption over the first 72 hours as the primary endpoint.\nB: Prospective cohort study of scheduled paracetamol only versus PRN NSAID with length of hospital stay as the primary endpoint.\nC: Randomized crossover trial of intraoperative nerve block versus placebo assessing pain scores every 6 hours for 24 hours.\nD: Retrospective case-control study comparing analgesic regimens and measuring incidence of secondary hemorrhage.\nExplanation: Only a double-blind randomized trial directly compares scheduled versus PRN regimens under controlled conditions, using total opioid consumption\u2014an objective, validated measure of analgesic efficacy.\nCorrect Answer: A\n</output_format>",
    "question": "Considering the finding that as-needed analgesic administration resulted in suboptimal pain control after tonsillectomy, which study design and primary endpoint would most effectively assess the efficacy of a scheduled multimodal analgesic regimen?",
    "choices": {
      "A": "Double-blind randomized trial comparing scheduled multimodal analgesia versus PRN dosing with total opioid consumption over the first 72 hours as the primary endpoint.",
      "B": "Prospective cohort study of scheduled paracetamol only versus PRN NSAID with length of hospital stay as the primary endpoint.",
      "C": "Randomized crossover trial of intraoperative nerve block versus placebo assessing pain scores every 6 hours for 24 hours.",
      "D": "Retrospective case-control study comparing analgesic regimens and measuring incidence of secondary hemorrhage."
    },
    "answer": "A",
    "explanation": "Only a double-blind randomized trial directly compares scheduled versus PRN regimens under controlled conditions, using total opioid consumption\u2014an objective, validated measure of analgesic efficacy.",
    "question_token_count": 42,
    "answer_correctness_score": 10,
    "explanation_validity_score": 10,
    "question_clarity_score": 6,
    "question_difficulty_score": 8,
    "question_groundedness_score": 6,
    "avg_answer_token_count": 24
  },
  {
    "context": "Prostate-specific antigen (PSA) levels can show wide fluctuations when repeatedly measured. Here we investigatewd if: (a) biopsy timing influences the prostate cancer (PC) detection rate in patients with fluctuating PSA (flu-PSA) in comparison with patients with steadily increasing PSA (si-PSA); (b) PSA slope estimated in patients with flu-PSA predicts a different risk of cancer detection; (c) flu-PSA and si-PSA patients develop PC in topographically different sites; (d) the behaviour of pre-operative PSA is an expression of a disease with defferent characteristics to the following radical prostatectomy.\n\nThe study involved 211 patients who underwent at least a second biopsy after a first negative prostate biopsy. PSA Slope, PSA velocity (PSAV) and PSA doubling time (PSADT) were estimated. Flu-PSA level was defined as a PSA series with at least one PSA value lower than the one immediately preceding it.\n\n82 patients had flu-PSA levels and 129 si-PSA levels. There were no significant differences between the two groups in terms of cancer detection, clinical or pathological stage, but the si-PSA group with cancer had a higher Gleason score. No difference was found for PSA Slope between flu-PSA patients with cancer and those without.\n\n",
    "topic": "Methodological rationale and statistical considerations for timing repeat prostate biopsies in patients with flu-PSA compared to si-PSA.",
    "response": "<document_analysis>\nThe context compares two PSA trajectories\u2014fluctuating (flu-PSA) versus steadily increasing (si-PSA)\u2014in repeat prostate biopsy patients. It reports similar cancer detection rates and stages but finds that cancers in the si-PSA group have higher Gleason scores. PSA slope does not differ between flu-PSA patients with and without cancer. Key methodological insights include that PSA trajectory (not just absolute levels or slope) correlates with tumor grade, implying that consistent PSA rises may signal more aggressive disease. This observation underpins biopsy timing decisions and risk stratification. Difficulty is calibrated at 8/10 due to inference from clinical-pathological correlations and implications for patient management.\n</document_analysis>\n\n<output_format>\nQuestion: In designing a biopsy strategy, what does the higher Gleason score observed in patients with steadily increasing PSA suggest about PSA trajectory and tumor aggressiveness?\nA: Consistent PSA rises between biopsies are indicative of more aggressive tumor biology.\nB: PSA fluctuations confer a protective effect, leading to lower-grade tumors.\nC: PSA slope independent of trajectory is the primary determinant of tumor grade.\nD: The Gleason score difference is most likely due to sampling bias rather than PSA pattern.\nExplanation: The finding that the si-PSA group had higher Gleason scores indicates that a steady increase in PSA reflects more aggressive prostate cancer characteristics.\nCorrect Answer: A\n</output_format>",
    "question": "In designing a biopsy strategy, what does the higher Gleason score observed in patients with steadily increasing PSA suggest about PSA trajectory and tumor aggressiveness?",
    "choices": {
      "A": "Consistent PSA rises between biopsies are indicative of more aggressive tumor biology.",
      "B": "PSA fluctuations confer a protective effect, leading to lower-grade tumors.",
      "C": "PSA slope independent of trajectory is the primary determinant of tumor grade.",
      "D": "The Gleason score difference is most likely due to sampling bias rather than PSA pattern."
    },
    "answer": "A",
    "explanation": "The finding that the si-PSA group had higher Gleason scores indicates that a steady increase in PSA reflects more aggressive prostate cancer characteristics.",
    "question_token_count": 30,
    "answer_correctness_score": 10,
    "explanation_validity_score": 10,
    "question_clarity_score": 8,
    "question_difficulty_score": 7,
    "question_groundedness_score": 10,
    "avg_answer_token_count": 15
  },
  {
    "context": "To describe the biomechanical and wound healing characteristics of corneas after excimer laser keratorefractive surgery.\n\nHistologic, ultrastructural, and cohesive tensile strength evaluations were performed on 25 normal human corneal specimens, 206 uncomplicated LASIK specimens, 17 uncomplicated sub-Bowman's keratomileusis (SBK) specimens, 4 uncomplicated photorefractive keratectomy (PRK) specimens, 2 uncomplicated advanced surface ablation (ASA) specimens, 5 keratoconus specimens, 12 postoperative LASIK ectasia specimens, and 1 postoperative PRK ectasia specimen and compared to previously published studies.\n\nHistologic and ultrastructural studies of normal corneas showed significant differences in the direction of collagen fibrils and/or the degree of lamellar interweaving in Bowman's layer, the anterior third of the corneal stroma, the posterior two-thirds of the corneal stroma, and Descemet's membrane. Cohesive tensile strength testing directly supported these morphologic findings as the stronger, more rigid regions of the cornea were located anteriorly and peripherally. This suggests that PRK and ASA, and secondarily SBK, should be biomechanically safer than conventional LASIK with regard to risk for causing keratectasia after surgery. Because adult human corneal stromal wounds heal slowly and incompletely, all excimer laser keratorefractive surgical techniques still have some distinct disadvantages due to inadequate reparative wound healing. Despite reducing some of the risk for corneal haze compared to conventional PRK, ASA cases still can develop corneal haze or breakthrough haze from the hypercellular fibrotic stromal scarring. In contrast, similar to conventional LASIK, SBK still has the short- and long-term potential for interface wound complications from the hypocellular primitive stromal scar.\n\n",
    "topic": "Comparative analysis of ectasia risk in PRK, ASA, SBK, and conventional LASIK based on anterior stromal preservation",
    "response": "<document_analysis>\nThe context provides comparative biomechanical and wound healing data for corneal refractive procedures (PRK, ASA, SBK, LASIK), highlighting: \n1) Anterior stromal strength due to collagen lamellar interweaving and orientation. \n2) Preservation of this region in surface ablation (PRK/ASA) yields lower ectasia risk versus flap-based LASIK and SBK. \n3) Incomplete stromal wound healing leaves fibrotic or primitive scar tissue with distinct complications. \nCentral idea: the ultrastructural basis for regional tensile strength in the anterior cornea underlies differential ectasia risk. \nA challenging question will probe the specific ultrastructural feature that confers high tensile strength to the anterior stroma and thus drives the safety of surface ablation techniques.\nDifficulty rating: 8/10\n</document_analysis>\n\n<output_format>\nQuestion: Which ultrastructural feature of the anterior corneal stroma primarily accounts for its superior cohesive tensile strength and explains why surface ablation procedures carry a lower risk of postoperative ectasia compared to flap-based techniques?\nA: The increased diameter of collagen fibrils in the anterior stroma.\nB: The oblique interweaving of collagen lamellae providing enhanced cross\u2011lamellar reinforcement.\nC: The parallel alignment of collagen fibrils oriented along the visual axis.\nD: The higher density of keratocytes promoting rapid stromal regeneration.\nExplanation: The anterior stroma\u2019s superior strength arises from oblique interweaving of collagen lamellae, which is preserved in surface ablation procedures, reducing ectasia risk.\nCorrect Answer: B\n</output_format>",
    "question": "Which ultrastructural feature of the anterior corneal stroma primarily accounts for its superior cohesive tensile strength and explains why surface ablation procedures carry a lower risk of postoperative ectasia compared to flap-based techniques?",
    "choices": {
      "A": "The increased diameter of collagen fibrils in the anterior stroma.",
      "B": "The oblique interweaving of collagen lamellae providing enhanced cross\u2011lamellar reinforcement.",
      "C": "The parallel alignment of collagen fibrils oriented along the visual axis.",
      "D": "The higher density of keratocytes promoting rapid stromal regeneration."
    },
    "answer": "B",
    "explanation": "The anterior stroma\u2019s superior strength arises from oblique interweaving of collagen lamellae, which is preserved in surface ablation procedures, reducing ectasia risk.",
    "question_token_count": 41,
    "answer_correctness_score": 10,
    "explanation_validity_score": 10,
    "question_clarity_score": 8,
    "question_difficulty_score": 9,
    "question_groundedness_score": 6,
    "avg_answer_token_count": 15
  },
  {
    "context": "The incidence of colorectal cancer in young patients is increasing. It remains unclear if the disease has unique features in this age group.\n\nThis was a single-center, retrospective cohort study which included patients diagnosed with colorectal cancer at age \u226440\u00a0years in 1997-2013 matched 1:2 by year of diagnosis with consecutive colorectal cancer patients diagnosed at age>50\u00a0years during the same period. Patients aged 41-50\u00a0years were not included in the study, to accentuate potential age-related differences. Clinicopathological characteristics, treatment, and outcome were compared between groups.\n\nThe cohort included 330 patients, followed for a median time of 65.9\u00a0months (range 4.7-211). Several significant differences were noted. The younger group had a different ethnic composition. They had higher rates of family history of colorectal cancer (p\u00a0=\u00a00.003), hereditary colorectal cancer syndromes (p\u00a0<\u00a00.0001), and inflammatory bowel disease (p\u00a0=\u00a00.007), and a lower rate of polyps (p\u00a0<\u00a00.0001). They were more likely to present with stage III or IV disease (p\u00a0=\u00a00.001), angiolymphatic invasion, signet cell ring adenocarcinoma, and rectal tumors (p\u00a0=\u00a00.02). Younger patients more frequently received treatment. Young patients had a worse estimated 5-year disease-free survival rate (57.6\u00a0 vs. 70\u00a0%, p\u00a0=\u00a00.039), but this did not retain significance when analyzed by stage (p\u00a0=\u00a00.092). Estimated 5-year overall survival rates were 59.1 and 62.1\u00a0% in the younger and the control group, respectively (p\u00a0=\u00a00.565).\n\n",
    "topic": "Future research directions to clarify unique biological behaviors and management strategies for early-onset CRC.",
    "response": "<document_analysis>\nThe context compares clinicopathological features of colorectal cancer in patients \u226440 years vs >50 years, highlighting distinct risk factors (family history, hereditary syndromes, IBD), lower polyp prevalence, advanced stage at presentation, signet ring histology, and similar overall survival after stage adjustment. Meaningful content is present to generate a challenging question focused on future research directions to dissect unique tumorigenesis pathways.\nConcepts to probe: integrating germline predisposition with somatic events, bypassing adenoma-carcinoma sequence, need for multi-omics approaches.\nDifficulty: 7/10 \u2013 requires expert understanding of research methodologies in cancer biology.\n</document_analysis>\n\n<output_format>\nQuestion: Among the distinct features of early-onset colorectal cancer\u2014markedly higher rates of hereditary syndromes and inflammatory bowel disease, coupled with lower adenomatous polyp prevalence and enrichment for signet ring cell histology\u2014which research approach would most powerfully clarify the unique tumorigenesis pathways in this population?\nA: Longitudinal colonoscopic surveillance studies to characterize polyp progression  \nB: Integrative analysis combining germline predisposition variants with tumor somatic mutation profiles  \nC: Epigenomic mapping of microsatellite instability across tumor specimens  \nD: Comparative proteomic profiling of tumor versus adjacent normal tissue  \nExplanation: Integrative germline\u2013somatic mutation mapping directly links inherited risk factors with acquired driver events, illuminating unique oncogenic pathways bypassing the classic adenoma\u2011carcinoma sequence.  \nCorrect Answer: B\n</output_format>",
    "question": "Among the distinct features of early-onset colorectal cancer\u2014markedly higher rates of hereditary syndromes and inflammatory bowel disease, coupled with lower adenomatous polyp prevalence and enrichment for signet ring cell histology\u2014which research approach would most powerfully clarify the unique tumorigenesis pathways in this population?",
    "choices": {
      "A": "Longitudinal colonoscopic surveillance studies to characterize polyp progression",
      "B": "Integrative analysis combining germline predisposition variants with tumor somatic mutation profiles",
      "C": "Epigenomic mapping of microsatellite instability across tumor specimens",
      "D": "Comparative proteomic profiling of tumor versus adjacent normal tissue"
    },
    "answer": "B",
    "explanation": "Integrative germline\u2013somatic mutation mapping directly links inherited risk factors with acquired driver events, illuminating unique oncogenic pathways bypassing the classic adenoma\u2011carcinoma sequence.",
    "question_token_count": 61,
    "answer_correctness_score": 10,
    "explanation_validity_score": 10,
    "question_clarity_score": 8,
    "question_difficulty_score": 9,
    "question_groundedness_score": 10,
    "avg_answer_token_count": 12
  },
  {
    "context": "To examine age-related differences in the relationship between personality and coping strategies in an Australian population of psychiatric inpatients.\n\nConsenting eligible adults (N=238) from 18-100 years of age consecutively admitted to inpatient psychiatry units were assessed using the SCID I and II, the Coping Orientations to Problems Experienced Scale (COPE), the Brief Psychiatric Rating Scale (BPRS), the Global Assessment of Functioning Scale (GAF), the Social and Occupational Functioning Assessment Scale (SOFAS), the 12 Item Short-Form Heath Survey (SF12), the Sarason Social Support Questionnaire, and the NEO Five Factor Inventory (NEO-FFI) (cognitively impaired, and non-English speaking patients were excluded).\n\nOlder adults reported less symptomatology than younger patients and younger patients described more personality dysfunction than older patients. As assessed by the COPE, older adults reported lower levels of dysfunctional coping strategies than younger adults. Personality traits, social supports, gender, and age predicted coping strategies, while Axis I diagnosis, education, personality disorder, and symptom severity were not significant predictors of coping strategies.\n\n",
    "topic": "Critique the role of the Sarason Social Support Questionnaire in predicting coping strategies and explore alternative measures of social support in psychiatric research.",
    "response": "<document_analysis>\nThe context outlines a psychiatric inpatient study where social support, measured solely by the Sarason Social Support Questionnaire (SSQ), predicted coping strategies. The SSQ yields number of supports and satisfaction but does not decompose support into functional subtypes (emotional, tangible, informational). For deeper mechanistic insight into how different support functions drive coping, an instrument like the Interpersonal Support Evaluation List (ISEL) is more suitable. Difficulty is calibrated at 8/10, requiring knowledge of psychometric instruments in social support research.\n</document_analysis>\n\n<output_format>\nQuestion: Considering that social support predicted coping strategies but was assessed only by the Sarason Social Support Questionnaire, which core limitation of the SSQ might hinder understanding the mechanisms linking support to coping, and which alternative instrument best addresses this gap?\nA: The SSQ does not capture structural network size and density; Social Network Index\nB: The SSQ fails to differentiate functional subtypes of support (emotional, informational, tangible); Interpersonal Support Evaluation List\nC: The SSQ ignores negative exchanges and conflict in relationships; Nagging Social Exchange Scale\nD: The SSQ overlooks perceived reciprocity and equity in relationships; Social Support Reciprocity Scale\nExplanation: The Sarason SSQ measures only number and satisfaction, lacking functional subtypes of support, while the ISEL explicitly assesses distinct support functions.\nCorrect Answer: B\n</output_format>",
    "question": "Considering that social support predicted coping strategies but was assessed only by the Sarason Social Support Questionnaire, which core limitation of the SSQ might hinder understanding the mechanisms linking support to coping, and which alternative instrument best addresses this gap?",
    "choices": {
      "A": "The SSQ does not capture structural network size and density; Social Network Index",
      "B": "The SSQ fails to differentiate functional subtypes of support (emotional, informational, tangible); Interpersonal Support Evaluation List",
      "C": "The SSQ ignores negative exchanges and conflict in relationships; Nagging Social Exchange Scale",
      "D": "The SSQ overlooks perceived reciprocity and equity in relationships; Social Support Reciprocity Scale"
    },
    "answer": "B",
    "explanation": "The Sarason SSQ measures only number and satisfaction, lacking functional subtypes of support, while the ISEL explicitly assesses distinct support functions.",
    "question_token_count": 46,
    "answer_correctness_score": 10,
    "explanation_validity_score": 10,
    "question_clarity_score": 6,
    "question_difficulty_score": 8,
    "question_groundedness_score": 4,
    "avg_answer_token_count": 19
  },
  {
    "context": "The intent of this study was to determine if the use of a single or combination of static foot posture measurements can be used to predict rearfoot, midfoot, and forefoot plantar surface area in individuals with pronated or normal foot types.\n\nTwelve foot measurements were collected on 52 individuals (mean age 25.8 years) with the change in midfoot width used to place subjects in a pronated or normal foot mobility group. Dynamic plantar contact area was collected during walking with a pressure sensor platform. The 12 measures were entered into a stepwise regression analysis to determine the optimal set of measures associated with regional plantar surface area.\n\nA two variable model was found to describe the relationship between the foot measurements and forefoot plantar contact area (r(2)=0.79, p<0.0001). A four variable model was found to describe the relationship between the foot measurements and midfoot plantar contact area (r(2)=0.85, p<0.0001) in those individuals with a 1.26cm or greater change in midfoot width.\n\n",
    "topic": "Statistical principles and justification for using stepwise regression analysis in biomechanical research.",
    "response": "<document_analysis>\nThe context describes a study using stepwise regression with 12 predictor variables and only 52 subjects to model plantar surface area. Key statistical issues include overfitting, predictor selection instability, and inflated type\u00a0I error rates inherent to traditional stepwise procedures, especially with a high predictor-to-subject ratio. An expert would consider modern penalized regression alternatives that mitigate these risks. The question will probe knowledge of appropriate regression techniques under these conditions.\n</document_analysis>\n\n<output_format>\nQuestion: In a biomechanical study using stepwise regression with 12 candidate predictors and only 52 participants, which alternative statistical method most directly addresses overfitting and variable\u2010selection instability inherent in traditional stepwise procedures?\nA: Increasing the p\u2011value threshold for variable entry\nB: Ridge regression\nC: LASSO regression\nD: Hierarchical multiple regression\nExplanation: LASSO regression applies an L1 penalty that shrinks some coefficients exactly to zero, performing simultaneous variable selection and regularization to reduce overfitting and improve stability in small\u2011sample, high\u2011dimensional settings.\nCorrect Answer: C\n</output_format>",
    "question": "In a biomechanical study using stepwise regression with 12 candidate predictors and only 52 participants, which alternative statistical method most directly addresses overfitting and variable\u2010selection instability inherent in traditional stepwise procedures?",
    "choices": {
      "A": "Increasing the p\u2011value threshold for variable entry",
      "B": "Ridge regression",
      "C": "LASSO regression",
      "D": "Hierarchical multiple regression"
    },
    "answer": "C",
    "explanation": "LASSO regression applies an L1 penalty that shrinks some coefficients exactly to zero, performing simultaneous variable selection and regularization to reduce overfitting and improve stability in small\u2011sample, high\u2011dimensional settings.",
    "question_token_count": 40,
    "answer_correctness_score": 10,
    "explanation_validity_score": 10,
    "question_clarity_score": 8,
    "question_difficulty_score": 8,
    "question_groundedness_score": 10,
    "avg_answer_token_count": 6
  },
  {
    "context": "Noise exposure in the neonatal intensive care unit is believed to be a risk factor for hearing loss in preterm neonates. Continuous positive airway pressure (CPAP) devices exceed recommended noise levels. High flow nasal cannulae (HFNC) are an increasingly popular alternative to CPAP for treating preterm infants, but there are no in vivo studies assessing noise production by HFNC.\n\nTo study whether HFNC are noisier than bubble CPAP (BCPAP) for preterm infants.\n\nAn observational study of preterm infants receiving HFNC or BCPAP. Noise levels within the external auditory meatus (EAM) were measured using a microphone probe tube connected to a calibrated digital dosimeter. Noise was measured across a range of frequencies and reported as decibels A-weighted (dBA).\n\nA total of 21 HFNC and 13 BCPAP noise measurements were performed in 21 infants. HFNC gas flows were 2-5 L/min, and BCPAP gas flows were 6-10 L/min with set pressures of 5-7 cm of water. There was no evidence of a difference in average noise levels measured at the EAM: mean difference (95% CI) of -1.6 (-4.0 to 0.9) dBA for HFNC compared to BCPAP. At low frequency (500 Hz), HFNC was mean (95% CI) 3.0 (0.3 to 5.7) dBA quieter than BCPAP. Noise increased with increasing BCPAP gas flow (p=0.007), but not with increasing set pressure. There was a trend to noise increasing with increasing HFNC gas flows.\n\n",
    "topic": "Interpretation of mean difference, 95% confidence intervals, and p-values in reporting device noise comparisons.",
    "response": "<document_analysis>\nThe context reports mean differences in dBA between HFNC and BCPAP at the external auditory meatus, with 95% CIs and p-values. Key points:\n- Overall mean difference: -1.6 dBA (95% CI: -4.0 to 0.9) crosses zero \u2192 not statistically significant.\n- Low-frequency (500\u2009Hz) mean difference: 3.0 dBA (95% CI: 0.3 to 5.7) is entirely above zero \u2192 statistically significant reduction in noise by HFNC at that frequency.\n- BCPAP noise increases significantly with gas flow (p=0.007).\n- HFNC shows a non-significant trend of increased noise with flow.\nThe question will test interpretation of confidence intervals and p-values to draw correct inferences about noise differences and flow-related changes.\nDifficulty level: 8/10 \u2013 requires nuanced understanding of inferential statistics in a clinical device comparison.\n</document_analysis>\n\n<output_format>\nQuestion: Which conclusion is most accurately supported by the reported statistics comparing HFNC and BCPAP noise levels?\nA: The overall mean noise reduction of 1.6 dBA for HFNC is statistically significant.\nB: The 3.0 dBA lower noise at 500\u2009Hz for HFNC is statistically significant.\nC: The non-significant trend of HFNC noise rising with flow confirms noise invariance across HFNC settings.\nD: The p=0.007 value indicates no relationship between BCPAP flow rate and noise levels.\nExplanation: Only the low-frequency difference (3.0 dBA; 95% CI: 0.3 to 5.7) excludes zero, indicating a statistically significant reduction by HFNC at 500\u2009Hz.\nCorrect Answer: B\n</output_format>",
    "question": "Which conclusion is most accurately supported by the reported statistics comparing HFNC and BCPAP noise levels?",
    "choices": {
      "A": "The overall mean noise reduction of 1.6 dBA for HFNC is statistically significant.",
      "B": "The 3.0 dBA lower noise at 500\u2009Hz for HFNC is statistically significant.",
      "C": "The non-significant trend of HFNC noise rising with flow confirms noise invariance across HFNC settings.",
      "D": "The p=0.007 value indicates no relationship between BCPAP flow rate and noise levels."
    },
    "answer": "B",
    "explanation": "Only the low-frequency difference (3.0 dBA; 95% CI: 0.3 to 5.7) excludes zero, indicating a statistically significant reduction by HFNC at 500\u2009Hz.",
    "question_token_count": 21,
    "answer_correctness_score": 10,
    "explanation_validity_score": 10,
    "question_clarity_score": 7,
    "question_difficulty_score": 6,
    "question_groundedness_score": 10,
    "avg_answer_token_count": 21
  },
  {
    "context": "To provide equality of cancer care to rural patients, Townsville Cancer Centre administers intensive chemotherapy regimens to rural patients with node-positive breast and metastatic colorectal cancers at the same doses as urban patients. Side-effects were usually managed by rural general practitioners locally.AIM: The aim is to determine the safety of this practice by comparing the profile of serious adverse events and dose intensities between urban and rural patients at the Townsville Cancer Centre.\n\nA retrospective audit was conducted in patients with metastatic colorectal and node-positive breast cancers during a 24-month period. Fisher's exact test was used for analysis. Rurality was determined as per rural, remote and metropolitan classification.\n\nOf the 121 patients included, 70 and 51 patients had breast and colon cancers respectively. The urban versus rural patient split among all patients, breast and colorectal cancer subgroups was 68 versus 53, 43 versus 27 and 25 versus 26 respectively. A total of 421 cycles was given with dose intensity of>95% for breast cancer in both groups (P>0.05). Rate of febrile neutropenia was 9.3% versus 7.4% (P = 0.56). For XELOX, rate of diarrhoea was 20% versus 19% (P = 0.66) and rate of vomiting was 20% versus 11% (P = 0.11). Only two patients were transferred to Townsville for admission. No toxic death occurred in either group.\n\n",
    "topic": "Assessment and comparison of XELOX regimen\u2013related vomiting rates with P\u2011value interpretation",
    "response": "<document_analysis>\nThe context describes a retrospective audit comparing serious adverse event rates, including vomiting with the XELOX regimen, between urban and rural patients. Key data: vomiting rates of 20% vs 11% with P = 0.11. This invites scrutiny of P\u2011value interpretation, statistical significance versus clinical trends, and the risk of type II error given sample size. The most challenging question probes nuanced understanding of what a non\u2011significant P\u2011value implies in context and how to interpret observed trends for future studies.\n</document_analysis>\n\n<output_format>\nQuestion: With XELOX-induced vomiting observed in 20% of urban versus 11% of rural patients yielding a P\u00a0value of 0.11, which inference best reflects both the statistical result and its implications for future research?\nA: The difference is not statistically significant at the 0.05 level, and no further investigation is needed since risk is equivalent.\nB: A P\u00a0value above 0.05 confirms there is definitively no clinically meaningful difference in vomiting risk.\nC: Although not statistically significant, the difference suggests a possible effect that may warrant larger studies to rule out a type\u00a0II error.\nD: The P\u00a0value of 0.11 indicates an 11% chance that the null hypothesis is true.\nExplanation: A P\u00a0value >0.05 does not prove equivalence; it merely fails to reject the null, and a trend may reflect insufficient power, so further study could be needed.\nCorrect Answer: C\n</output_format>",
    "question": "With XELOX-induced vomiting observed in 20% of urban versus 11% of rural patients yielding a P\u00a0value of 0.11, which inference best reflects both the statistical result and its implications for future research?",
    "choices": {
      "A": "The difference is not statistically significant at the 0.05 level, and no further investigation is needed since risk is equivalent.",
      "B": "A P\u00a0value above 0.05 confirms there is definitively no clinically meaningful difference in vomiting risk.",
      "C": "Although not statistically significant, the difference suggests a possible effect that may warrant larger studies to rule out a type\u00a0II error.",
      "D": "The P\u00a0value of 0.11 indicates an 11% chance that the null hypothesis is true."
    },
    "answer": "C",
    "explanation": "A P\u00a0value >0.05 does not prove equivalence; it merely fails to reject the null, and a trend may reflect insufficient power, so further study could be needed.",
    "question_token_count": 46,
    "answer_correctness_score": 10,
    "explanation_validity_score": 10,
    "question_clarity_score": 6,
    "question_difficulty_score": 7,
    "question_groundedness_score": 10,
    "avg_answer_token_count": 23
  },
  {
    "context": "A tonsillectomy audit was carried out and compared with other studies, to emphasize the role of antibiotics.\n\nThis study was carried out at North West Armed Forces Hospital, Tabuk, Kingdom of Saudi Arabia, during the year January 1999 through to December 1999. This is a retrospective study of patients who had tonsillectomy with or with adenoidectomy, the topics audited included indication for surgery, grade of surgeon, method of surgery, length of hospital stay, complications and the use of postoperative antibiotics.\n\nA total of 185 patients underwent tonsillectomy with or without adenoidectomy. The patients age ranged between 2 years to 53 years and the majority were children. In our audit we found no difference with regard to grade of surgeons, method of hemostasis in the outcome of surgery. Moreover, postoperative antibiotics had no role in pain control, postoperative fever, secondary hemorrhage or reduction in hospital stay. The administration of analgesics on the basis of, as required, had poor pain control.\n\n",
    "topic": "The effect of postoperative antibiotics on pain control, fever, secondary hemorrhage, and hospital stay",
    "response": "<document_analysis>\nThe context describes a retrospective audit of 185 tonsillectomy patients comparing those who did and did not receive postoperative antibiotics. Key findings report no benefit of antibiotics on pain, fever, secondary hemorrhage, or length of hospital stay. As a retrospective design without randomization, selection bias is a major threat to validity. To probe deep understanding, the question focuses on advanced epidemiological methods to mitigate bias in non-randomized studies, requiring domain experts to consider analytical techniques beyond standard regression or subgrouping.\nDifficulty: 8/10\n</document_analysis>\n\n<output_format>\nQuestion: In a retrospective audit of 185 tonsillectomy patients showing no apparent benefit from postoperative antibiotics, which analytical method would most directly address selection bias from non-random antibiotic assignment?\nA: Stratified subgroup analysis by surgeon grade\nB: Propensity score matching of antibiotic and non-antibiotic groups\nC: Expansion of sample size to include multiple centers\nD: Adjustment for age and sex in a univariate model\nExplanation: Propensity score matching balances measured covariates between groups, directly mitigating selection bias in observational studies.\nCorrect Answer: B\n</output_format>",
    "question": "In a retrospective audit of 185 tonsillectomy patients showing no apparent benefit from postoperative antibiotics, which analytical method would most directly address selection bias from non-random antibiotic assignment?",
    "choices": {
      "A": "Stratified subgroup analysis by surgeon grade",
      "B": "Propensity score matching of antibiotic and non-antibiotic groups",
      "C": "Expansion of sample size to include multiple centers",
      "D": "Adjustment for age and sex in a univariate model"
    },
    "answer": "B",
    "explanation": "Propensity score matching balances measured covariates between groups, directly mitigating selection bias in observational studies.",
    "question_token_count": 36,
    "answer_correctness_score": 10,
    "explanation_validity_score": 10,
    "question_clarity_score": 8,
    "question_difficulty_score": 9,
    "question_groundedness_score": 4,
    "avg_answer_token_count": 10
  },
  {
    "context": "Polio eradication is now feasible after removal of Nigeria from the list of endemic countries and global reduction of cases of wild polio virus in 2015 by more than 80%. However, all countries must remain focused to achieve eradication. In August 2015, the Catholic bishops in Kenya called for boycott of a polio vaccination campaign citing safety concerns with the polio vaccine. We conducted a survey to establish if the coverage was affected by the boycott.\n\nA cross sectional survey was conducted in all the 32 counties that participated in the campaign. A total of 90,157 children and 37,732 parents/guardians were sampled to determine the vaccination coverage and reasons for missed vaccination.\n\nThe national vaccination coverage was 93% compared to 94% in the November 2014 campaign. The proportion of parents/guardians that belonged to Catholic Church was 31% compared to 7% of the children who were missed. Reasons for missed vaccination included house not being visited (44%), children not being at home at time of visit (38%), refusal by parents (12%), children being as leep (1%), and various other reasons (5%). Compared to the November 2014 campaign, the proportion of children who were not vaccinated due to parent's refusal significantly increased from 6% to 12% in August 2015.\n\n",
    "topic": "Propose strategies to address parental safety concerns and refusal in future polio campaigns, drawing from health communication theory.",
    "response": "<document_analysis>\nThe context provides data on measurably increased parental refusals (from 6% to 12%) in a polio campaign after safety concerns were raised by Catholic bishops. Key issues include safety perceptions, religious authority influence, and identifiable reasons for missed vaccination. Health communication theory (e.g., Health Belief Model) can map constructs\u2014perceived barriers, benefits, cues to action\u2014to design interventions addressing safety concerns. A deep question should require applying these theoretical constructs to craft specific strategies.\n</document_analysis>\n\n<output_format>\nQuestion: Considering the doubled parental refusal rate driven by safety concerns, which intervention rooted in the Health Belief Model would most effectively reduce refusals in future polio campaigns?\nA: Convene small\u2010group forums led by trusted Catholic community leaders that communicate vaccine safety and benefits (lowering perceived barriers, raising perceived benefits), paired with personalized reminder home visits as cues to action.\nB: Air nationwide fear\u2010based advertisements highlighting the severe paralysis caused by polio to increase perceived susceptibility and severity.\nC: Offer nominal cash incentives to parents of vaccinated children to elevate perceived benefits.\nD: Enact legal penalties for non\u2010vaccination to compel compliance.\nExplanation: Option A directly addresses safety worries (barriers), reinforces vaccine advantages (benefits), and provides cues to action; the others rely on fear, extrinsic rewards, or coercion, which poorly tackle safety concerns.\nCorrect Answer: A\n</output_format>",
    "question": "Considering the doubled parental refusal rate driven by safety concerns, which intervention rooted in the Health Belief Model would most effectively reduce refusals in future polio campaigns?",
    "choices": {
      "A": "Convene small\u2010group forums led by trusted Catholic community leaders that communicate vaccine safety and benefits (lowering perceived barriers, raising perceived benefits), paired with personalized reminder home visits as cues to action.",
      "B": "Air nationwide fear\u2010based advertisements highlighting the severe paralysis caused by polio to increase perceived susceptibility and severity.",
      "C": "Offer nominal cash incentives to parents of vaccinated children to elevate perceived benefits.",
      "D": "Enact legal penalties for non\u2010vaccination to compel compliance."
    },
    "answer": "A",
    "explanation": "Option A directly addresses safety worries (barriers), reinforces vaccine advantages (benefits), and provides cues to action; the others rely on fear, extrinsic rewards, or coercion, which poorly tackle safety concerns.",
    "question_token_count": 33,
    "answer_correctness_score": 10,
    "explanation_validity_score": 10,
    "question_clarity_score": 6,
    "question_difficulty_score": 8,
    "question_groundedness_score": 7,
    "avg_answer_token_count": 23
  },
  {
    "context": "Cytokine concentration in pancreatic juice of patients with pancreatic disease is unknown. Secretin stimulation allows endoscopic collection of pancreatic juice secreted into the duodenum. We aimed to evaluate the cytokine concentrations in pancreatic juice of patients with abdominal pain to discriminate presence from absence of pancreatic disease.\n\nFrom January 2003-December 2004, consecutive patients with abdominal pain compatible with pancreatic origin were enrolled. Patients underwent upper endoscopy. Intravenous secretin (0.2 mug/kg) was given immediately before scope intubation. Pancreatic juice collected from the duodenum was immediately snap-frozen in liquid nitrogen until assays were performed. Pancreatic juice levels of interleukin-8, interleukin-6, intercellular adhesion molecule 1, and transforming growth factor-beta 1 were measured by modified enzyme-linked immunosorbent assays. The final diagnosis was made by the primary gastroenterologist on the basis of medical history; laboratory, endoscopic, and imaging studies; and clinical follow-up. Fisher exact test and Kruskal-Wallis rank sum test were used for statistical analysis.\n\nOf 130 patients screened, 118 met the inclusion criteria. Multivariate analysis revealed that only interleukin-8 was able to discriminate between normal pancreas and chronic pancreatitis (P = .011), pancreatic cancer (P = .044), and the presence of pancreatic diseases (P = .007). Individual cytokine concentrations were not significantly different in chronic pancreatitis compared with pancreatic cancer.\n\n",
    "topic": "Ethical and safety considerations associated with secretin-stimulated endoscopic pancreatic sampling.",
    "response": "<document_analysis>\nThe context describes a procedure involving intravenous secretin administration followed by endoscopic collection of pancreatic juice for cytokine assays. Key elements include the invasive nature of upper endoscopy, secretin dosing, and handling of samples. Although the context focuses on cytokine measurement, the endoscopic secretin-stimulated sampling inherently carries procedural risks. The most significant and pertinent safety concern for domain experts is the induction of acute pancreatitis through pancreatic stimulation and instrumentation. This serves as the basis for a challenging question probing the expert\u2019s understanding of the primary safety issue in this protocol.\nDifficulty rating: 7/10\n</document_analysis>\n\n<output_format>\nQuestion: Which safety consideration is most critical to address when performing secretin-stimulated endoscopic pancreatic juice collection?\nA: Risk of systemic hypotension from secretin infusion  \nB: Induction of acute pancreatitis due to ductal stimulation and instrumentation  \nC: Sample contamination leading to duodenal infection  \nD: Respiratory depression from endoscopic sedation  \nExplanation: The combination of pancreatic duct stimulation by secretin and endoscopic instrumentation most significantly risks triggering acute pancreatitis, making its prevention the paramount safety concern.  \nCorrect Answer: B\n</output_format>",
    "question": "Which safety consideration is most critical to address when performing secretin-stimulated endoscopic pancreatic juice collection?",
    "choices": {
      "A": "Risk of systemic hypotension from secretin infusion",
      "B": "Induction of acute pancreatitis due to ductal stimulation and instrumentation",
      "C": "Sample contamination leading to duodenal infection",
      "D": "Respiratory depression from endoscopic sedation"
    },
    "answer": "B",
    "explanation": "The combination of pancreatic duct stimulation by secretin and endoscopic instrumentation most significantly risks triggering acute pancreatitis, making its prevention the paramount safety concern.",
    "question_token_count": 22,
    "answer_correctness_score": 10,
    "explanation_validity_score": 10,
    "question_clarity_score": 1,
    "question_difficulty_score": 8,
    "question_groundedness_score": 1,
    "avg_answer_token_count": 10
  },
  {
    "context": "The ultra high risk (UHR) for psychosis criteria have been validated in a number of studies. However, it is not known whether particular UHR criteria (Attenuated Psychotic Symptoms (APS), Brief Limited Intermittent Psychotic Symptoms (BLIPS) or Trait vulnerability criteria), or combination of criteria, is associated with a higher risk of transition to psychosis. The current study investigated this issue over a 6-month follow-up period. We hypothesised that the risk of transition would increase in the following order: Trait alone<APS alone<APS+Trait<BLIPS.\n\nData on UHR intake criteria and transition to psychosis status at 6 months were analysed for UHR patients seen at the PACE clinic, Orygen Youth Health between January 2000 and November 2008.\n\nA total of 928 new referrals were accepted into the PACE clinic over this period of whom 817 (88%) had baseline information available for analysis. The percentage of subjects who presented with APS, Trait and BLIPS were 83%, 27% and 4%, respectively. When the two intermediate groups (APS alone and APS+Trait) were combined, there was evidence that the risk of transition increased in the order of Trait alone<APS<BLIPS (p=0.024, adjusted analysis).\n\n",
    "topic": "Critically evaluate the rationale and evidence supporting the hypothesized ordering of transition risk from psychosis: Trait alone < APS alone < APS+Trait < BLIPS.",
    "response": "<document_analysis>\nThe context describes a study testing an ordered hypothesis on transition to psychosis rates across four ultra-high risk (UHR) criteria groups (Trait alone, APS alone, APS+Trait, BLIPS). It reports combining groups due to small sample sizes and finding a significant trend (p=0.024). Key methodological theme is testing a monotonic trend in a binary outcome across ordered categories.\n</document_analysis>\n\n<output_format>\nQuestion: In evaluating a priori increasing transition rates to psychosis across four ordered ultra\u2010high risk groups (Trait alone < APS alone < APS+Trait < BLIPS), which statistical test most directly assesses a linear trend in binary outcomes?\nA: Kruskal\u2013Wallis rank\u2010sum test\nB: Jonckheere\u2013Terpstra test\nC: Cochran\u2013Armitage trend test\nD: Mantel\u2013Haenszel chi\u2010square test\nExplanation: The Cochran\u2013Armitage trend test is specifically designed to detect a linear trend in proportions across ordered categorical groups.\nCorrect Answer: C\n</output_format>",
    "question": "In evaluating a priori increasing transition rates to psychosis across four ordered ultra\u2010high risk groups (Trait alone < APS alone < APS+Trait < BLIPS), which statistical test most directly assesses a linear trend in binary outcomes?",
    "choices": {
      "A": "Kruskal\u2013Wallis rank\u2010sum test",
      "B": "Jonckheere\u2013Terpstra test",
      "C": "Cochran\u2013Armitage trend test",
      "D": "Mantel\u2013Haenszel chi\u2010square test"
    },
    "answer": "C",
    "explanation": "The Cochran\u2013Armitage trend test is specifically designed to detect a linear trend in proportions across ordered categorical groups.",
    "question_token_count": 46,
    "answer_correctness_score": 10,
    "explanation_validity_score": 10,
    "question_clarity_score": 8,
    "question_difficulty_score": 7,
    "question_groundedness_score": 6,
    "avg_answer_token_count": 10
  },
  {
    "context": "To determine if clinical variables assessed in relation to Albuterol aerosol treatments accurately identify children with pathologic radiographs during their initial episode of bronchospasm.\n\nA prospective convenience sample of children with a first episode of wheezing. Data collected included demographics, baseline and post-treatment clinical score and physical examination, number of aerosols, requirement for supplemental oxygen, and disposition. Chest radiographs were obtained and interpreted, and patients were divided into 2 groups based on a pathologic versus nonpathologic radiograph interpretation. Chi2 testing was performed for categoric variables, and the student t test was performed for continuous variables. A discriminant analysis was used to develop a model.\n\nPathologic radiographs were identified in 61 patients (9%). Between groups, a significant difference was noted for pretreatment oxygen saturation only. Clinical score, respiratory rate, and presence of rales both pretreatment and posttreatment were not significantly different between groups. The discriminant analysis correctly predicted 90% of nonpathologic radiographs but only 15% of pathologic radiographs.\n\n",
    "topic": "Recommendations for future research designs, including use of validation cohorts, multicenter trials, or alternative predictive variables to improve model accuracy.",
    "response": "<document_analysis>\nThe context describes a prospective convenience-sample study developing a discriminant model to predict pathologic radiographs in children\u2019s first wheezing episode. Key findings: only pretreatment oxygen saturation differed significantly; the model had high specificity (90% nonpathologic) but very low sensitivity (15% pathologic). Future research recommendations should directly address the model\u2019s poor sensitivity and limited generalizability by proposing design enhancements (e.g., validation cohorts, multicenter trials, new predictive variables). A suitable expert-level question probes which methodological strategy will most effectively improve both sensitivity and external validity.\n</document_analysis>\n\n<output_format>\nQuestion: Considering the original discriminant model\u2019s very low sensitivity for detecting pathologic chest radiographs in first-episode pediatric bronchospasm despite high specificity, which modification to a future study design would most effectively improve both sensitivity and external validity of the predictive model?\nA: Conduct a large, multicenter, prospective validation cohort study that incorporates additional candidate predictors such as inflammatory biomarkers.\nB: Increase the number of albuterol aerosol treatments per patient to generate larger changes in clinical scores.\nC: Restrict the predictive model to the single most significant variable, pretreatment oxygen saturation, to reduce complexity.\nD: Adjust the decision threshold of the existing discriminant function post hoc to favor sensitivity over specificity.\nExplanation: A combines external validation across centers, increases sample heterogeneity including more pathologic cases, and adds novel predictors, thus directly addressing low sensitivity and improving generalizability.\nCorrect Answer: A\n</output_format>",
    "question": "Considering the original discriminant model\u2019s very low sensitivity for detecting pathologic chest radiographs in first-episode pediatric bronchospasm despite high specificity, which modification to a future study design would most effectively improve both sensitivity and external validity of the predictive model?",
    "choices": {
      "A": "Conduct a large, multicenter, prospective validation cohort study that incorporates additional candidate predictors such as inflammatory biomarkers.",
      "B": "Increase the number of albuterol aerosol treatments per patient to generate larger changes in clinical scores.",
      "C": "Restrict the predictive model to the single most significant variable, pretreatment oxygen saturation, to reduce complexity.",
      "D": "Adjust the decision threshold of the existing discriminant function post hoc to favor sensitivity over specificity."
    },
    "answer": "A",
    "explanation": "A combines external validation across centers, increases sample heterogeneity including more pathologic cases, and adds novel predictors, thus directly addressing low sensitivity and improving generalizability.",
    "question_token_count": 50,
    "answer_correctness_score": 10,
    "explanation_validity_score": 10,
    "question_clarity_score": 6,
    "question_difficulty_score": 8,
    "question_groundedness_score": 9,
    "avg_answer_token_count": 20
  },
  {
    "context": "The National Institutes of Health Stroke Scale (NIHSS) is a valid, reproducible scale that measures neurological deficit. Of 42 possible points, 7 points are directly related to measurement of language compared with only 2 points related to neglect.\n\nWe examined the placebo arm of the NINDS t-PA stroke trial to test the hypothesis that the total volume of cerebral infarction in patients with right hemisphere strokes would be greater than the volume of cerebral infarction in patients with left hemisphere strokes who have similar NIHSS scores. The volume of stroke was determined by computerized image analysis of CT films and CT images stored on computer tape and optical disks. Cube-root transformation of lesion volume was performed for each CT. Transformed lesion volume was analyzed in a logistic regression model to predict volume of stroke by NIHSS score for each hemisphere. Spearman rank correlation was used to determine the relation between the NIHSS score and lesion volume.\n\nThe volume for right hemisphere stroke was statistically greater than the volume for left hemisphere strokes, adjusting for the baseline NIHSS (P<0. 001). For each 5-point category of the NIHSS score<20, the median volume of right hemisphere strokes was approximately double the median volume of left hemisphere strokes. For example, for patients with a left hemisphere stroke and a 24-hour NIHSS score of 16 to 20, the median volume of cerebral infarction was 48 mL (interquartile range 14 to 111 mL) as compared with 133 mL (interquartile range 81 to 208 mL) for patients with a right hemisphere stroke (P<0.001). The median volume of a right hemisphere stroke was roughly equal to the median volume of a left hemisphere stroke in the next highest 5-point category of the NIHSS. The Spearman rank correlation between the 24-hour NIHSS score and 3-month lesion volume was 0.72 for patients with left hemisphere stroke and 0.71 for patients with right hemisphere stroke.\n\n",
    "topic": "Compare and contrast median infarct volumes and interquartile ranges for right versus left hemisphere strokes within 5-point NIHSS score categories.",
    "response": "<document_analysis>\nThe context describes a comparison of median infarct volumes (with interquartile ranges) within matched 5-point NIHSS score categories for right versus left hemisphere strokes. Key details: in the 16\u201320 score category, left strokes have a median of 48\u00a0mL (IQR 14\u2013111\u00a0mL) while right strokes have 133\u00a0mL (IQR 81\u2013208\u00a0mL), and the median right\u2010hemisphere volume in one NIHSS category corresponds to the median left\u2010hemisphere volume in the next higher 5\u2010point category. This implies a systematic underestimation of right hemisphere infarct severity by about one NIHSS category (5 points).\nDifficulty level: 8/10\nDecision: Generate an inference-based multiple-choice question probing the NIHSS scoring bias implied by volume comparisons.\n</document_analysis>\n\n<output_format>\nQuestion: The finding that the median infarct volume for right hemisphere strokes with NIHSS scores of 16\u201320 equals the median volume for left hemisphere strokes with NIHSS scores of 21\u201325 implies which quantitative bias in the NIHSS?\nA: It underestimates right hemisphere stroke severity by about 5 points.\nB: It underestimates right hemisphere stroke severity by about 2 points.\nC: It overestimates right hemisphere stroke severity by about 5 points.\nD: It shows no systematic hemispheric bias.\nExplanation: The equivalence of median volumes across adjacent 5-point NIHSS categories indicates right hemisphere infarcts need roughly 5 more points to match left hemisphere volume assessments.\nCorrect Answer: A\n</output_format>",
    "question": "The finding that the median infarct volume for right hemisphere strokes with NIHSS scores of 16\u201320 equals the median volume for left hemisphere strokes with NIHSS scores of 21\u201325 implies which quantitative bias in the NIHSS?",
    "choices": {
      "A": "It underestimates right hemisphere stroke severity by about 5 points.",
      "B": "It underestimates right hemisphere stroke severity by about 2 points.",
      "C": "It overestimates right hemisphere stroke severity by about 5 points.",
      "D": "It shows no systematic hemispheric bias."
    },
    "answer": "A",
    "explanation": "The equivalence of median volumes across adjacent 5-point NIHSS categories indicates right hemisphere infarcts need roughly 5 more points to match left hemisphere volume assessments.",
    "question_token_count": 48,
    "answer_correctness_score": 10,
    "explanation_validity_score": 10,
    "question_clarity_score": 6,
    "question_difficulty_score": 8,
    "question_groundedness_score": 10,
    "avg_answer_token_count": 12
  },
  {
    "context": "Postoperative CSF fistulas were described in 16 of 198 patients (8%) who underwent spine surgery between 2009 and 2010. The choice of the therapeutic strategy was based on the clinical condition of the patients, taking into account the possibility to maintain the prone position continuously and the risk of morbidity due to prolonged bed rest. Six patients were treated conservatively (position prone for three weeks), ten patients were treated by positioning an external CSF lumbar drainage for ten days. The mean follow-up period was ten months.\n\nAll patients healed their wound properly and no adverse events were recorded. Patients treated conservatively were cured in a mean period of 30 days, while patients treated with CSF drainage were cured in a mean period of 10 days.\n\n",
    "topic": "Limitations of the retrospective observational design and its impact on evidence strength.",
    "response": "<document_analysis>\nThe context describes a retrospective cohort of 16 postoperative CSF fistulas treated either conservatively or with external lumbar drainage. Treatment allocation was non-random and based on clinical condition, introducing potential confounding by indication. No randomization or blinding is mentioned, and the study\u2019s observational design limits causal inferences. The sample is small, follow-up is uniform, and outcomes are objective (healing time), reducing some biases but not selection or confounding.\nI will focus on the most critical limitation that undermines causal interpretation: confounding by indication due to non-random treatment assignment.\nDifficulty: 8/10\n</document_analysis>\n\n<output_format>\nQuestion: In evaluating the reported difference in mean healing times between prone-position therapy and external CSF lumbar drainage in this retrospective series, which methodological limitation most critically undermines the ability to draw a causal conclusion?\nA: Recall bias stemming from retrospective data extraction\nB: Confounding by indication because therapy choice depended on patient clinical status\nC: Attrition bias due to variable follow-up durations across treatment groups\nD: Observer bias resulting from knowledge of treatment during wound assessments\nExplanation: Non-random treatment allocation based on clinical condition leads to confounding by indication, which most seriously compromises causal inference in retrospective designs.\nCorrect Answer: B\n</output_format>",
    "question": "In evaluating the reported difference in mean healing times between prone-position therapy and external CSF lumbar drainage in this retrospective series, which methodological limitation most critically undermines the ability to draw a causal conclusion?",
    "choices": {
      "A": "Recall bias stemming from retrospective data extraction",
      "B": "Confounding by indication because therapy choice depended on patient clinical status",
      "C": "Attrition bias due to variable follow-up durations across treatment groups",
      "D": "Observer bias resulting from knowledge of treatment during wound assessments"
    },
    "answer": "B",
    "explanation": "Non-random treatment allocation based on clinical condition leads to confounding by indication, which most seriously compromises causal inference in retrospective designs.",
    "question_token_count": 39,
    "answer_correctness_score": 10,
    "explanation_validity_score": 10,
    "question_clarity_score": 8,
    "question_difficulty_score": 9,
    "question_groundedness_score": 10,
    "avg_answer_token_count": 11
  },
  {
    "context": "Among patients with acute stroke symptoms, delay in hospital admission is the main obstacle for the use of thrombolytic therapy and other interventions associated with decreased mortality and disability. The primary aim of this study was to assess whether an elderly clinical population correctly endorsed the response to call for emergency services when presented with signs and symptoms of stroke using a standardized questionnaire.\n\nWe performed a cross-sectional study among elderly out-patients (\u226560 years) in Buenos Aires, Argentina randomly recruited from a government funded health clinic. The correct endorsement of intention to call 911 was assessed with the Stroke Action Test and the cut-off point was set at \u226575%. Knowledge of stroke and clinical and socio-demographic indicators were also collected and evaluated as predictors of correct endorsement using logistic regression.\n\nAmong 367 elderly adults, 14% correctly endorsed intention to call 911. Presented with the most typical signs and symptoms, only 65% reported that they would call an ambulance. Amaurosis Fugax was the symptom for which was called the least (15%). On average, the correct response was chosen only 37% of the time. Compared to lower levels of education, higher levels were associated to correctly endorsed intention to call 911 (secondary School adjusted OR 3.53, 95% CI 1.59-7.86 and Tertiary/University adjusted OR 3.04, 95% CI 1.12-8.21).\n\n",
    "topic": "Statistical reporting of average correct response rate (37%) and its relevance for assessing overall awareness.",
    "response": "<document_analysis>\nThe context presents a mean correct response rate of 37% across various stroke symptom items, alongside marked variation in recognition (65% for typical signs vs 15% for amaurosis fugax). This aggregate statistic may obscure item-level heterogeneity and misrepresent true awareness patterns. The question should probe an expert\u2019s understanding of the statistical limitation of using an overall average without considering symptom-specific recognition variability.\n</document_analysis>\n\n<output_format>\nQuestion: Considering the reported 37% average correct response rate to stroke symptom recognition among elderly patients, which interpretive concern most critically undermines the validity of this aggregate statistic as an indicator of overall awareness?\nA: It conceals symptom-specific recognition gaps, notably the stark contrast between high recognition of common signs and very low identification of atypical presentations like amaurosis fugax.\nB: It artificially inflates perceived awareness because cross-sectional surveys tend to over-sample health-literate individuals.\nC: It overlooks the difference between stated intention and actual emergency action, thus misrepresenting real-world behavior.\nD: It conflicts with the predefined 75% cut-off for adequate endorsement, rendering the average below threshold statistically meaningless.\nExplanation: The average masks the wide variability in recognition across individual symptoms, failing to reveal critical gaps in awareness for less typical stroke presentations.\nCorrect Answer: A\n</output_format>",
    "question": "Considering the reported 37% average correct response rate to stroke symptom recognition among elderly patients, which interpretive concern most critically undermines the validity of this aggregate statistic as an indicator of overall awareness?",
    "choices": {
      "A": "It conceals symptom-specific recognition gaps, notably the stark contrast between high recognition of common signs and very low identification of atypical presentations like amaurosis fugax.",
      "B": "It artificially inflates perceived awareness because cross-sectional surveys tend to over-sample health-literate individuals.",
      "C": "It overlooks the difference between stated intention and actual emergency action, thus misrepresenting real-world behavior.",
      "D": "It conflicts with the predefined 75% cut-off for adequate endorsement, rendering the average below threshold statistically meaningless."
    },
    "answer": "A",
    "explanation": "The average masks the wide variability in recognition across individual symptoms, failing to reveal critical gaps in awareness for less typical stroke presentations.",
    "question_token_count": 40,
    "answer_correctness_score": 10,
    "explanation_validity_score": 10,
    "question_clarity_score": 6,
    "question_difficulty_score": 7,
    "question_groundedness_score": 10,
    "avg_answer_token_count": 24
  },
  {
    "context": "To explain China's cigarette pricing mechanism and the role of the Chinese State Tobacco Monopoly Administration (STMA) on cigarette pricing and taxation.\n\nPublished government tobacco tax documentation and statistics published by the Chinese STMA are used to analyse the interrelations among industry profits, taxes and retail price of cigarettes in China.\n\nThe 2009 excise tax increase on cigarettes in China has not translated into higher retail prices because the Chinese STMA used its policy authority to ensure that retail cigarette prices did not change. The government tax increase is being collected at both the producer and wholesale levels. As a result, the 2009 excise tax increase in China has resulted in higher tax revenue for the government and lower profits for the tobacco industry, with no increase in the retail price of cigarettes for consumers.\n\n",
    "topic": "Potential alternative strategies for ensuring that future excise tax increases translate into higher retail prices to curb consumption.",
    "response": "<document_analysis>\nThe context describes how China\u2019s State Tobacco Monopoly Administration (STMA) used its pricing authority to absorb a 2009 excise tax hike at producer and wholesale stages, preventing any retail price increase. The central issue is the institutional power of STMA over retail pricing, which undermines the intended public health impact of excise taxes. A deep, expert-level question should probe targeted policy reforms or institutional changes that would remove STMA\u2019s buffering role and compel full tax pass-through to retail prices, thereby effectively curbing consumption.\nDifficulty rating: 8/10 \u2013 requires understanding of both tax policy instruments and institutional design.\n</document_analysis>\n\n<output_format>\nQuestion: In light of the STMA\u2019s capacity to hold retail cigarette prices flat despite higher excise taxes, which reform would most directly prevent this buffering and ensure excise tax hikes raise consumer prices?\nA: Mandate an indexed minimum retail price tied to inflation and tax levels.\nB: Separate STMA\u2019s pricing authority from its commercial operations by creating an independent pricing regulator.\nC: Shift all excise tax collection exclusively to the wholesale level to bypass STMA\u2019s producer controls.\nD: Replace specific excise taxes with ad valorem taxes at the producer stage to increase variability.\nExplanation: Establishing an independent pricing regulator removes STMA\u2019s power to absorb tax increases, compelling full pass\u2011through to retail prices.\nCorrect Answer: B\n</output_format>",
    "question": "In light of the STMA\u2019s capacity to hold retail cigarette prices flat despite higher excise taxes, which reform would most directly prevent this buffering and ensure excise tax hikes raise consumer prices?",
    "choices": {
      "A": "Mandate an indexed minimum retail price tied to inflation and tax levels.",
      "B": "Separate STMA\u2019s pricing authority from its commercial operations by creating an independent pricing regulator.",
      "C": "Shift all excise tax collection exclusively to the wholesale level to bypass STMA\u2019s producer controls.",
      "D": "Replace specific excise taxes with ad valorem taxes at the producer stage to increase variability."
    },
    "answer": "B",
    "explanation": "Establishing an independent pricing regulator removes STMA\u2019s power to absorb tax increases, compelling full pass\u2011through to retail prices.",
    "question_token_count": 39,
    "answer_correctness_score": 10,
    "explanation_validity_score": 10,
    "question_clarity_score": 6,
    "question_difficulty_score": 7,
    "question_groundedness_score": 10,
    "avg_answer_token_count": 18
  },
  {
    "context": "A 2008 expert consensus statement outlined the minimum frequency of follow-up of patients with cardiovascular implantable electronic devices (CIEDs).\n\nWe studied 38 055 Medicare beneficiaries who received a new CIED between January 1, 2005, and June 30, 2009. The main outcome measure was variation of follow-up by patient factors and year of device implantation. We determined the number of patients who were eligible for and attended an in-person CIED follow-up visit within 2 to 12 weeks, 0 to 16 weeks, and 1 year after implantation. Among eligible patients, 42.4% had an initial in-person visit within 2 to 12 weeks. This visit was significantly more common among white patients than black patients and patients of other races (43.0% versus 36.8% versus 40.5%; P<0.001). Follow-up within 2 to 12 weeks improved from 40.3% in 2005 to 55.1% in 2009 (P<0.001 for trend). The rate of follow-up within 0 to 16 weeks was 65.1% and improved considerably from 2005 to 2009 (62.3%-79.6%; P<0.001 for trend). Within 1 year, 78.0% of the overall population had at least 1 in-person CIED follow-up visit.\n\n",
    "topic": "Broader impact of guideline dissemination on clinical practice patterns in cardiac device management",
    "response": "<document_analysis>\nThe context describes a trend analysis of in-person follow-up adherence after CIED implantation over three intervals: 2\u201312 weeks, 0\u201316 weeks, and within 1 year. Key nuances include (1) overall improvements in follow-up rates post-2008 guideline dissemination, (2) a greater absolute improvement in the broader 0\u201316 week window compared with the stricter 2\u201312 week window, and (3) persistent racial disparities. A high-difficulty question can probe how the comparative improvements reveal clinician interpretation of the guideline recommendations, requiring synthesis of the numerical trends and their implications for practice flexibility.\nDifficulty rating: 8/10\n</document_analysis>\n\n<output_format>\nQuestion: The fact that adherence in the 0\u201316 week window increased by approximately 17 percentage points, outpacing the roughly 15-point gain in the stricter 2\u201312 week window, most strongly suggests which about clinicians\u2019 response to the consensus recommendations?\nA: Clinicians aimed to satisfy the guideline by using a more flexible follow\u2011up window rather than adhering strictly to the 2\u201312 week interval.\nB: Clinicians rigidly followed only the 2\u201312 week recommendation, ignoring any follow\u2011up outside that window.\nC: Clinicians largely ignored the consensus statement and maintained preexisting follow\u2011up routines.\nD: Clinicians concentrated their efforts on ensuring long\u2011term (1 year) follow\u2011up at the expense of early visits.\nExplanation: The larger improvement in the broader 0\u201316 week interval versus the strict 2\u201312 week interval implies that clinicians favored meeting the guideline\u2019s intent through a flexible time frame.\nCorrect Answer: A\n</output_format>",
    "question": "The fact that adherence in the 0\u201316 week window increased by approximately 17 percentage points, outpacing the roughly 15-point gain in the stricter 2\u201312 week window, most strongly suggests which about clinicians\u2019 response to the consensus recommendations?",
    "choices": {
      "A": "Clinicians aimed to satisfy the guideline by using a more flexible follow\u2011up window rather than adhering strictly to the 2\u201312 week interval.",
      "B": "Clinicians rigidly followed only the 2\u201312 week recommendation, ignoring any follow\u2011up outside that window.",
      "C": "Clinicians largely ignored the consensus statement and maintained preexisting follow\u2011up routines.",
      "D": "Clinicians concentrated their efforts on ensuring long\u2011term (1 year) follow\u2011up at the expense of early visits."
    },
    "answer": "A",
    "explanation": "The larger improvement in the broader 0\u201316 week interval versus the strict 2\u201312 week interval implies that clinicians favored meeting the guideline\u2019s intent through a flexible time frame.",
    "question_token_count": 54,
    "answer_correctness_score": 10,
    "explanation_validity_score": 10,
    "question_clarity_score": 8,
    "question_difficulty_score": 7,
    "question_groundedness_score": 10,
    "avg_answer_token_count": 24
  },
  {
    "context": "The FOOTSTEP self-management foot care programme is a clinical and cost-effective programme for basic foot care in the elderly. The aim of this study was to determine if patients with rheumatoid arthritis (RA) would be physically able to participate.\n\nA consecutive cohort of RA patients undergoing podiatry care underwent tests for sight, reach and grip strength to determine their physical ability to undertake self-managed foot care.\n\nThirty RA patients (10 male, 20 female), with a median age of 61 years (range 42 to 84) and disease duration of 10 years (range one to 40), were recruited. All patients passed the sight test, whereas the reach and grip tests were passed by 77% and 67% of patients, respectively. Only 57% of patients passed all the physical tests. Patients who failed the physical tests were older, and had longer disease duration and higher physical disability, pain and general health scores but these were not statistically different.\n\n",
    "topic": "Study limitations including sample size, non-significant findings, and considerations for further research and programme refinement.",
    "response": "<document_analysis>\nThe context describes physical ability testing in a small cohort of 30 RA patients, reporting non-significant differences despite observable trends (older age, longer disease duration, higher disability scores). This directly points to sample size and statistical power limitations. There is no irrelevant content. A single challenging question can probe understanding of how limited sample size influences Type II error and interpretation of non-significant findings.\n</document_analysis>\n\n<output_format>\nQuestion: Which key limitation most likely led to the non-significant differences between RA patients who passed versus failed the physical tests despite apparent trends in age and disease duration?\nA: Selection bias from recruiting a consecutive cohort\nB: Type II error due to insufficient statistical power\nC: Measurement bias in grip and reach assessments\nD: Confounding by unmeasured comorbidities\nExplanation: With only 30 participants and small subgroup sizes, the study was underpowered to detect moderate differences, increasing the risk of a Type II error.\nCorrect Answer: B\n</output_format>",
    "question": "Which key limitation most likely led to the non-significant differences between RA patients who passed versus failed the physical tests despite apparent trends in age and disease duration?",
    "choices": {
      "A": "Selection bias from recruiting a consecutive cohort",
      "B": "Type II error due to insufficient statistical power",
      "C": "Measurement bias in grip and reach assessments",
      "D": "Confounding by unmeasured comorbidities"
    },
    "answer": "B",
    "explanation": "With only 30 participants and small subgroup sizes, the study was underpowered to detect moderate differences, increasing the risk of a Type II error.",
    "question_token_count": 32,
    "answer_correctness_score": 10,
    "explanation_validity_score": 10,
    "question_clarity_score": 6,
    "question_difficulty_score": 7,
    "question_groundedness_score": 10,
    "avg_answer_token_count": 8
  },
  {
    "context": "The goal of this retrospective study was to assess whether 99mTc-white blood cell (WBC) scintigraphy and upper gastrointestinal small bowel follow-through (UGI-SBFT) could exclude inflammation in children suspected of having inflammatory bowel disease (IBD).\n\nOf a population of 313 children who had a 99mTc-WBC scan, 130 children were studied exclusively to rule out IBD. Sixty-nine colonoscopies with biopsies were done within a short time interval of the 99mTc-WBC scans. There were also 51 controls studied with 99mTc-WBC scintigraphy.\n\nOf the 130 children studied to exclude IBD, the final diagnosis was Crohn's disease in 27, ulcerative colitis in nine, miscellaneous colitis in 13, probably normal in 42, and normal in 39. The 99mTc-WBC scans were positive in all but three newly diagnosed Crohn's disease, ulcerative colitis, or miscellaneous colitis children. The false-negative 99mTc-WBC studies were seen in children with mild inflammation on biopsies and normal UGI-SBFT studies. In the 46 children with a true-positive 99mTc-WBC scan, 81% (17/21) of UGI-SBFT studies were normal. In five children with equivocal UGI-SBFT studies, the 99mTc-WBC scan correctly predicted if inflammation was present in the terminal ileum.\n\n",
    "topic": "Calculate and interpret the sensitivity of 99mTc-WBC scintigraphy for detecting Crohn\u2019s disease, ulcerative colitis, and miscellaneous colitis in this cohort.",
    "response": "<document_analysis>\nThe context provides numeric counts for children with Crohn\u2019s disease (27), ulcerative colitis (9), miscellaneous colitis (13), and notes that 99mTc-WBC scintigraphy was positive in 46 of the 49 confirmed IBD cases (three false negatives). It specifies that false negatives corresponded to mild inflammation on biopsy and normal UGI-SBFT findings. This allows calculation of overall sensitivity (46 true positives out of 49 disease cases = ~93.9%) and interpretation of why false negatives occurred.\nDifficulty rating: 7/10 \u2013 requires integration of diagnostic test evaluation and pathophysiologic reasoning.\n</document_analysis>\n\n<output_format>\nQuestion: In a cohort of 49 children with confirmed Crohn\u2019s disease (27), ulcerative colitis (9), and miscellaneous colitis (13), 99mTc-WBC scintigraphy was positive in 46 cases and negative in three. What is the calculated sensitivity of this scintigraphic method, and which factor most likely explained the false-negative results?\nA: 94%; minimal leukocyte accumulation in mild inflammation  \nB: 94%; inadequate bowel preparation reducing tracer uptake  \nC: 90%; transmural lesions escaping detection due to depth  \nD: 98%; leukocyte migration to extraintestinal sites  \nExplanation: Sensitivity = 46/(46+3) \u2248 93.9% (~94%), and false negatives were seen in children with only mild mucosal inflammation leading to low WBC tracer uptake.  \nCorrect Answer: A\n</output_format>",
    "question": "In a cohort of 49 children with confirmed Crohn\u2019s disease (27), ulcerative colitis (9), and miscellaneous colitis (13), 99mTc-WBC scintigraphy was positive in 46 cases and negative in three. What is the calculated sensitivity of this scintigraphic method, and which factor most likely explained the false-negative results?",
    "choices": {
      "A": "94%; minimal leukocyte accumulation in mild inflammation",
      "B": "94%; inadequate bowel preparation reducing tracer uptake",
      "C": "90%; transmural lesions escaping detection due to depth",
      "D": "98%; leukocyte migration to extraintestinal sites"
    },
    "answer": "A",
    "explanation": "Sensitivity = 46/(46+3) \u2248 93.9% (~94%), and false negatives were seen in children with only mild mucosal inflammation leading to low WBC tracer uptake.",
    "question_token_count": 73,
    "answer_correctness_score": 10,
    "explanation_validity_score": 10,
    "question_clarity_score": 8,
    "question_difficulty_score": 6,
    "question_groundedness_score": 10,
    "avg_answer_token_count": 10
  },
  {
    "context": "The incidence of colorectal cancer in young patients is increasing. It remains unclear if the disease has unique features in this age group.\n\nThis was a single-center, retrospective cohort study which included patients diagnosed with colorectal cancer at age \u226440\u00a0years in 1997-2013 matched 1:2 by year of diagnosis with consecutive colorectal cancer patients diagnosed at age>50\u00a0years during the same period. Patients aged 41-50\u00a0years were not included in the study, to accentuate potential age-related differences. Clinicopathological characteristics, treatment, and outcome were compared between groups.\n\nThe cohort included 330 patients, followed for a median time of 65.9\u00a0months (range 4.7-211). Several significant differences were noted. The younger group had a different ethnic composition. They had higher rates of family history of colorectal cancer (p\u00a0=\u00a00.003), hereditary colorectal cancer syndromes (p\u00a0<\u00a00.0001), and inflammatory bowel disease (p\u00a0=\u00a00.007), and a lower rate of polyps (p\u00a0<\u00a00.0001). They were more likely to present with stage III or IV disease (p\u00a0=\u00a00.001), angiolymphatic invasion, signet cell ring adenocarcinoma, and rectal tumors (p\u00a0=\u00a00.02). Younger patients more frequently received treatment. Young patients had a worse estimated 5-year disease-free survival rate (57.6\u00a0 vs. 70\u00a0%, p\u00a0=\u00a00.039), but this did not retain significance when analyzed by stage (p\u00a0=\u00a00.092). Estimated 5-year overall survival rates were 59.1 and 62.1\u00a0% in the younger and the control group, respectively (p\u00a0=\u00a00.565).\n\n",
    "topic": "Statistical interpretation of disease-free survival differences and the effect of stage adjustment on significance.",
    "response": "<document_analysis>\nThe context describes a retrospective cohort study comparing colorectal cancer outcomes in patients \u226440 versus >50 years. Key findings include a significant unadjusted difference in 5-year disease-free survival (DFS) favoring older patients (70% vs 57.6%, p=0.039), which lost significance after adjustment by stage (p=0.092). Younger patients had a higher proportion of stage III/IV at presentation, indicating stage distribution could confound the age\u2013DFS association. This scenario involves interpreting why statistical significance disappears upon stage adjustment, invoking concepts of confounding, mediation, and power. A high-level expert question will probe understanding of confounding versus other bias explanations in survival analysis, ensuring nuanced distractors on power loss, effect modification, and collider bias.\n</document_analysis>\n\n<output_format>\nQuestion: In a comparative analysis of 5-year disease-free survival between younger and older colorectal cancer patients, an unadjusted p-value of 0.039 became non-significant (p=0.092) after controlling for stage at diagnosis. Which explanation best accounts for this change?\nA: The significant unadjusted survival difference was confounded by the younger group\u2019s more advanced-stage distribution, and controlling for stage reveals no independent age effect.\nB: The stage-stratified analysis suffers from reduced statistical power due to smaller subgroup sample sizes, eliminating the apparent difference.\nC: Stage at diagnosis functions as an effect modifier rather than a confounder, so interaction testing, not adjustment, is required.\nD: Adjusting for stage introduces collider bias because stage lies on the causal pathway between age and survival, invalidating the adjusted result.\nExplanation: Controlling for stage removes the confounding impact of younger patients presenting with more advanced disease, showing age alone does not independently affect disease-free survival.\nCorrect Answer: A\n</output_format>",
    "question": "In a comparative analysis of 5-year disease-free survival between younger and older colorectal cancer patients, an unadjusted p-value of 0.039 became non-significant (p=0.092) after controlling for stage at diagnosis. Which explanation best accounts for this change?",
    "choices": {
      "A": "The significant unadjusted survival difference was confounded by the younger group\u2019s more advanced-stage distribution, and controlling for stage reveals no independent age effect.",
      "B": "The stage-stratified analysis suffers from reduced statistical power due to smaller subgroup sample sizes, eliminating the apparent difference.",
      "C": "Stage at diagnosis functions as an effect modifier rather than a confounder, so interaction testing, not adjustment, is required.",
      "D": "Adjusting for stage introduces collider bias because stage lies on the causal pathway between age and survival, invalidating the adjusted result."
    },
    "answer": "A",
    "explanation": "Controlling for stage removes the confounding impact of younger patients presenting with more advanced disease, showing age alone does not independently affect disease-free survival.",
    "question_token_count": 56,
    "answer_correctness_score": 10,
    "explanation_validity_score": 10,
    "question_clarity_score": 8,
    "question_difficulty_score": 6,
    "question_groundedness_score": 10,
    "avg_answer_token_count": 26
  },
  {
    "context": "In recent years, biofeedback has become increasingly popular for its proven success in peak performance training - the psychophysiological preparation of athletes for high-stakes sport competitions, such as the Olympic games. The aim of this research was to test whether an 8-week period of exposure to biofeedback training could improve the psychophysiological control over competitive anxiety and enhance athletic performance in participating subjects.\n\nParticipants of this study were highly competent athletes, each training in different sport disciplines. The experimental group consisted of 18 athletes (4 women, 14 men), whereas the Control group had 21 athletes (4 women, 17 men). All athletes were between 16 and 34 years old. The biofeedback device, Nexus 10, was used to detect and measure the psychophysiological responses of athletes. Athletes from both groups (control and experimental) were subjected to stress tests at the beginning of the study and once again at its conclusion. In between, the experimental group received training in biofeedback techniques. We then calculated the overall percentage of athletes in the experimental group compared with those in the control group who were able to control respiration, skin conductance, heart rate, blood flow amplitude, heart rate variability, and heart respiration coherence. One year following completion of the initial study, we questioned athletes from the experimental group, to determine whether they continued to use these skills and if they could detect any subsequent enhancement in their athletic performance.\n\nWe demonstrated that a greater number of participants in the experimental group were able to successfully control their psychophysiological parameters, in comparison to their peers in the control group. Significant results (p<0.05) were noted in regulation of GSR following short stress test conditions (p = 0.037), in regulation of HR after exposure to STROOP stressor (p = 0.037), in regulation of GSR following the Math and GSR stressors (p = 0.033, p = 0.409) and in achieving HR - breathing coherence following the math stressor (p = 0.042).\n\n",
    "topic": "Interpretation and critical examination of statistical results (p-values, effect sizes, potential Type I/II errors) in evaluating biofeedback training efficacy.",
    "response": "<document_analysis>\nThe context outlines multiple hypothesis tests (five reported p-values) without mention of correction for multiple comparisons, thereby inflating the family-wise Type I error rate. An expert must recognize the need for adjustment (e.g., Bonferroni) and calculate the probability of at least one false positive across several independent tests. This scenario invites a challenging statistical interpretation question requiring domain expertise in error-rate calculations.\n</document_analysis>\n\n<output_format>\nQuestion: Given five independent hypothesis tests each conducted at \u03b1 = 0.05 with no correction for multiple comparisons, what is the approximate probability of committing at least one Type I error across all tests?\nA: 5%\nB: 22.6%\nC: 50%\nD: 10%\nExplanation: The family\u2010wise error rate is 1\u2212(1\u22120.05)^5 \u2248 0.226, or 22.6%.\nCorrect Answer: B\n</output_format>",
    "question": "Given five independent hypothesis tests each conducted at \u03b1 = 0.05 with no correction for multiple comparisons, what is the approximate probability of committing at least one Type I error across all tests?",
    "choices": {
      "A": "5%",
      "B": "22.6%",
      "C": "50%",
      "D": "10%"
    },
    "answer": "B",
    "explanation": "The family\u2010wise error rate is 1\u2212(1\u22120.05)^5 \u2248 0.226, or 22.6%.",
    "question_token_count": 39,
    "answer_correctness_score": 10,
    "explanation_validity_score": 10,
    "question_clarity_score": 10,
    "question_difficulty_score": 7,
    "question_groundedness_score": 1,
    "avg_answer_token_count": 3
  },
  {
    "context": "Delayed gastric emptying (DGE) is the most frequent postoperative complication after pylorus-preserving pancreaticoduodenectomy (PPPD). This prospective, non-randomized study was undertaken to determine whether the incidence of DGE may be reduced by modifying the original reconstructive anatomy with a retrocolic duodenojejunostomy towards an antecolic duodenojejunostomy.\n\nThe study was comprised of 51 patients who underwent PPPD between August 1994 and November 1997. The operation was carried out as originally described but was modified by performing the duodenojejunostomy antecolically. Clinical data were recorded prospectively, with special regard to DGE.\n\nAfter PPPD, the nasogastric tube could be removed at a median of 2 days (range 1-22 days) postoperatively; in two patients, the nasogastric tube was reinserted because of vomiting and nausea. A liquid diet was started at a median of 5 days (3-11 days); the patients were able to tolerate a full, regular diet at a median of 10 days (7-28 days). The overall incidence of DGE was 12% (n=6). No postoperative complications other than DGE were exhibited by 36 patients (71%). In this group, DGE was only seen in one patient (3%). In the second group, where postoperative complications other than DGE occurred (n=15), five patients (30%) exhibited DGE (P=0.002).\n\n",
    "topic": "Compare the 12% overall DGE incidence with historical data from retrocolic reconstructions and evaluate the clinical relevance of any observed differences.",
    "response": "<document_analysis>\nThe context describes a PPPD study comparing antecolic reconstructions with historical retrocolic DGE incidence (~30%). It provides the antecolic DGE rate (12%), enabling calculation of absolute risk reduction and NNT. This allows a challenging quantitative question for domain experts regarding clinical impact metrics.\nDifficulty rating: 7/10 (requires understanding of NNT and risk reduction calculation).\n</document_analysis>\n\n<output_format>\nQuestion: Switching from a historical retrocolic DGE incidence of approximately 30% to the reported antecolic incidence of 12%, what is the approximate number needed to treat (NNT) with the antecolic approach to prevent one case of delayed gastric emptying?\nA: 3\nB: 5\nC: 6\nD: 10\nExplanation: The absolute risk reduction is 30% \u2212 12% = 18%, so NNT \u2248 1 / 0.18 \u2248 5.6, rounded to 6.\nCorrect Answer: C\n</output_format>",
    "question": "Switching from a historical retrocolic DGE incidence of approximately 30% to the reported antecolic incidence of 12%, what is the approximate number needed to treat (NNT) with the antecolic approach to prevent one case of delayed gastric emptying?",
    "choices": {
      "A": "3",
      "B": "5",
      "C": "6",
      "D": "10"
    },
    "answer": "C",
    "explanation": "The absolute risk reduction is 30% \u2212 12% = 18%, so NNT \u2248 1 / 0.18 \u2248 5.6, rounded to 6.",
    "question_token_count": 56,
    "answer_correctness_score": 10,
    "explanation_validity_score": 10,
    "question_clarity_score": 8,
    "question_difficulty_score": 7,
    "question_groundedness_score": 10,
    "avg_answer_token_count": 2
  },
  {
    "context": "Treatment of obstructive hydrocephalus in children with tuberculous meningitis (TBM) depends on the level of the cerebrospinal fluid (CSF) block. Air-encephalography is regarded as the gold standard for differentiating communicating and non-communicating hydrocephalus. Since air-encephalography involves a lumbar puncture, it carries the risk of cerebral herniation. AIM. The aim of this study was to determine whether communicating and non-communicating hydrocephalus in TBM can be differentiated by means of cranial computerised tomography (CT).\n\nA number of CT indices were measured in 50 children with communicating and 34 children with non-communicating hydrocephalus according to air-encephalographic findings.\n\nThe only CT finding that correlated with the type of hydrocephalus was the shape of the third ventricle. Significantly more children with non-communicating hydrocephalus had a rounded third ventricle than those with communicating hydrocephalus.\n\n",
    "topic": "Analysis of third ventricle morphology on CT scans and its statistical correlation with communicating versus non\u2011communicating hydrocephalus.",
    "response": "<document_analysis>\nThe context describes a study aiming to differentiate communicating from non\u2011communicating hydrocephalus in children with tuberculous meningitis using cranial CT. Several quantitative CT indices were measured, yet only one\u2014a morphological feature\u2014showed a significant correlation with hydrocephalus type. Specifically, a rounded third ventricle on CT was significantly more frequent in non\u2011communicating hydrocephalus. All other measured indices (e.g., ventricular size ratios) lacked discriminative power. This pinpointed the shape of the third ventricle as the sole reliable CT marker. A challenging question can probe knowledge of standard CT indices versus this unique finding.\n</document_analysis>\n\n<output_format>\nQuestion: When evaluating CT parameters such as the bicaudate index, frontal\u2011occipital horn ratio, cortical sulcal appearance, and third ventricular morphology in pediatric tuberculous meningitis with hydrocephalus, which feature uniquely distinguished non\u2011communicating from communicating forms?\nA: Bicaudate index exceeding 0.25\nB: Frontal\u2011occipital horn ratio above 0.5\nC: Effacement of cortical sulci\nD: Rounded configuration of the third ventricle\nExplanation: Among all CT indices measured, only a rounded third ventricle correlated significantly with non\u2011communicating hydrocephalus.\nCorrect Answer: D\n</output_format>",
    "question": "When evaluating CT parameters such as the bicaudate index, frontal\u2011occipital horn ratio, cortical sulcal appearance, and third ventricular morphology in pediatric tuberculous meningitis with hydrocephalus, which feature uniquely distinguished non\u2011communicating from communicating forms?",
    "choices": {
      "A": "Bicaudate index exceeding 0.25",
      "B": "Frontal\u2011occipital horn ratio above 0.5",
      "C": "Effacement of cortical sulci",
      "D": "Rounded configuration of the third ventricle"
    },
    "answer": "D",
    "explanation": "Among all CT indices measured, only a rounded third ventricle correlated significantly with non\u2011communicating hydrocephalus.",
    "question_token_count": 54,
    "answer_correctness_score": 10,
    "explanation_validity_score": 10,
    "question_clarity_score": 8,
    "question_difficulty_score": 9,
    "question_groundedness_score": 10,
    "avg_answer_token_count": 10
  },
  {
    "context": "In vivo comparative gap measurements were performed in three different patella positions (reduced, subluxated and everted) using offset-type-force-controlled-spreader-system.\n\nProspectively, 50 knees were operated by total knee arthroplasty using a navigation-assisted gap-balancing technique. The offset-type-force-controlled-spreader-system was used for gap measurements. This commercially available instrument allows controllable tension in patella-reduced position. The mediolateral gaps of knee extension (0\u00b0) and flexion (90\u00b0) angle were recorded in three different patella positions; reduced, subluxated and everted. Any gap differences of more than 3 mm were considered as a meaningful difference. Correlation between the difference with the demographic data, preoperative radiologic alignment and intraoperative data was analysed. For statistical analysis, ANOVA and Pearson's correlation test were used.\n\nThe gaps in patella eversion demonstrated smaller gaps both in knee extension and flexion position compared to the gaps of patella reduction position. The amount of decreased gaps was more definite in knee flexion position. Statistically significant difference was observed for the lateral gap of patella eversion compared to gap of patella reduction in knee flexion position (p<0.05). There were notable cases of variability in knee flexion position. Significant portion of 12 (24 %) knees of patella subluxation and 33 (66 %) knees of patella evertion demonstrated either increased or decreased gaps in knee flexion position compared to the gaps of patella reduction position.\n\n",
    "topic": "Interpretation of ANOVA and Pearson\u2019s correlation in assessing differences and associations in gap measurement studies.",
    "response": "<document_analysis>\nThe context describes gap measurements taken in the same knees under three patella positions (reduced, subluxated, everted) at two flexion angles and analyzed with ANOVA. Because these are repeated measures on the same subjects, the appropriate ANOVA model must account for within\u2010subject correlations, invoking the sphericity assumption. Violating sphericity inflates the F\u2010statistic and elevates type I error. This nuanced requirement is often overlooked, even by experienced researchers.\nDifficulty rating: 8/10\n</document_analysis>\n\n<output_format>\nQuestion: In comparing lateral gap measurements across reduced, subluxated, and everted patella positions at 90\u00b0 knee flexion using a repeated\u2010measures ANOVA, which specific assumption must be tested and what is the primary statistical consequence if it is violated?\nA: Homogeneity of variances; it yields biased pairwise differences.\nB: Sphericity; it inflates the F\u2010statistic and increases type I error.\nC: Normality of residuals; it invalidates the calculation of means.\nD: Independence of observations; it prohibits the use of ANOVA.\nExplanation: Repeated\u2010measures ANOVA requires sphericity (equal variances of differences between conditions); violation leads to inflated F\u2010values and a higher risk of false positives.\nCorrect Answer: B\n</output_format>",
    "question": "In comparing lateral gap measurements across reduced, subluxated, and everted patella positions at 90\u00b0 knee flexion using a repeated\u2010measures ANOVA, which specific assumption must be tested and what is the primary statistical consequence if it is violated?",
    "choices": {
      "A": "Homogeneity of variances; it yields biased pairwise differences.",
      "B": "Sphericity; it inflates the F\u2010statistic and increases type I error.",
      "C": "Normality of residuals; it invalidates the calculation of means.",
      "D": "Independence of observations; it prohibits the use of ANOVA."
    },
    "answer": "B",
    "explanation": "Repeated\u2010measures ANOVA requires sphericity (equal variances of differences between conditions); violation leads to inflated F\u2010values and a higher risk of false positives.",
    "question_token_count": 50,
    "answer_correctness_score": 10,
    "explanation_validity_score": 10,
    "question_clarity_score": 8,
    "question_difficulty_score": 9,
    "question_groundedness_score": 2,
    "avg_answer_token_count": 14
  },
  {
    "context": "This investigation assesses the effect of platelet-rich plasma (PRP) gel on postoperative pain, swelling, and trismus as well as healing and bone regeneration potential on mandibular third molar extraction sockets.\n\nA prospective randomized comparative clinical study was undertaken over a 2-year period. Patients requiring surgical extraction of a single impacted third molar and who fell within the inclusion criteria and indicated willingness to return for recall visits were recruited. The predictor variable was application of PRP gel to the socket of the third molar in the test group, whereas the control group had no PRP. The outcome variables were pain, swelling, and maximum mouth opening, which were measured using a 10-point visual analog scale, tape, and millimeter caliper, respectively. Socket healing was assessed radiographically by allocating scores for lamina dura, overall density, and trabecular pattern. Quantitative data were presented as mean. Mann-Whitney test was used to compare means between groups for continuous variables, whereas Fischer exact test was used for categorical variables. Statistical significance was inferred at P<.05.\n\nSixty patients aged 19 to 35 years (mean: 24.7 \u00b1 3.6 years) were divided into both test and control groups of 30 patients each. The mean postoperative pain score (visual analog scale) was lower for the PRP group at all time points and this was statistically significant (P<.05). Although the figures for swelling and interincisal mouth opening were lower in the test group, this difference was not statistically significant. Similarly, the scores for lamina dura, trabecular pattern, and bone density were better among patients in the PRP group. This difference was also not statistically significant.\n\n",
    "topic": "Synthesize the study\u2019s findings to outline clinical recommendations for PRP use in oral surgery and identify priority areas for future research in regenerative therapies.",
    "response": "<document_analysis>\n1. Thoughtful Content Examination:\n   - Central findings: PRP gel significantly reduces postoperative pain after mandibular third molar extraction; differences in swelling, trismus, and radiographic bone healing (lamina dura, trabecular pattern, density) favor PRP but are not statistically significant.\n   - Study design: prospective randomized comparative clinical trial with 60 patients, quantitative outcome measures, P<.05 threshold.\n   - Nuanced implication: while PRP shows clear symptomatic pain relief, its impact on other healing parameters remains inconclusive, indicating areas needing further exploration.\n\n2. Concept Exploration:\n   - Implicit assumption: pain control is a primary driver for adopting PRP in clinical practice.\n   - Underlying theory: platelet-derived growth factors accelerate tissue repair and modulate inflammation.\n   - Potential applications: optimizing PRP protocols (preparation, concentration, delivery), exploring combination with bone scaffolds or adjunctive agents to enhance radiographic bone healing.\n\n3. Strategic Complexity Calibration (Difficulty: 8/10):\n   - The question requires synthesis of multiple outcome measures, an ability to translate statistical significance into clinical recommendations, and to pinpoint priority research avenues in regenerative therapies.\n\n4. Intentional Question Planning:\n   - Aim: Ask the examinee to integrate evidence on symptomatic benefits versus inconclusive bone healing, recommend a balanced clinical guideline, and identify the most pressing research question to address current gaps.\n   - Ensure plausible distractors that subtly misinterpret significance levels or propose less relevant future directions.\n</document_analysis>\n\n<output_format>\nQuestion: Which integrated clinical recommendation and future research priority best aligns with the evidence on PRP gel application in mandibular third molar extraction sockets?\nA: Advocate routine PRP gel use primarily for its proven analgesic effect, while focusing future trials on optimizing PRP concentration and preparation methods to achieve consistent soft\u2010tissue and bone healing outcomes.\nB: Reserve PRP gel for cases with anticipated difficult bone remodeling, and direct research efforts toward combining PRP with bone grafts to address trabecular pattern restoration.\nC: Recommend PRP gel solely for enhancing radiographic bone density since pain reduction was marginal, and research should compare PRP with synthetic growth factors in animal models.\nD: Discourage PRP gel use because only swelling and mouth opening trends improved, and shift future studies toward laser therapy for postoperative recovery.\nExplanation: Option A accurately reflects the study\u2019s significant pain reduction benefit, acknowledges nonsignificant results for swelling and bone healing, and prioritizes protocol standardization as the next research step.\nCorrect Answer: A\n</output_format>",
    "question": "Which integrated clinical recommendation and future research priority best aligns with the evidence on PRP gel application in mandibular third molar extraction sockets?",
    "choices": {
      "A": "Advocate routine PRP gel use primarily for its proven analgesic effect, while focusing future trials on optimizing PRP concentration and preparation methods to achieve consistent soft\u2010tissue and bone healing outcomes.",
      "B": "Reserve PRP gel for cases with anticipated difficult bone remodeling, and direct research efforts toward combining PRP with bone grafts to address trabecular pattern restoration.",
      "C": "Recommend PRP gel solely for enhancing radiographic bone density since pain reduction was marginal, and research should compare PRP with synthetic growth factors in animal models.",
      "D": "Discourage PRP gel use because only swelling and mouth opening trends improved, and shift future studies toward laser therapy for postoperative recovery."
    },
    "answer": "A",
    "explanation": "Option A accurately reflects the study\u2019s significant pain reduction benefit, acknowledges nonsignificant results for swelling and bone healing, and prioritizes protocol standardization as the next research step.",
    "question_token_count": 27,
    "answer_correctness_score": 10,
    "explanation_validity_score": 10,
    "question_clarity_score": 6,
    "question_difficulty_score": 8,
    "question_groundedness_score": 8,
    "avg_answer_token_count": 33
  },
  {
    "context": "Cutaneous infections such as impetigo contagiosum (IC), molluscum contagiosum (MC) and herpes virus infection (HI) appear to be associated with atopic dermatitis (AD), but there are no reports of concrete epidemiological evidence.\n\nWe evaluated the association of childhood AD with these infections by conducting a population-based cross-sectional study.\n\nEnrolled in this study were 1117 children aged 0-6 years old attending nursery schools in Ishigaki City, Okinawa Prefecture, Japan. Physical examination was performed by dermatologists, and a questionnaire was completed on each child's history of allergic diseases including AD, asthma, allergic rhinitis and egg allergy, and that of skin infections including IC, MC and HI, as well as familial history of AD.\n\nIn 913 children (AD; 132), a history of IC, MC or HI was observed in 45.1%, 19.7%, and 2.5%, respectively. Multiple logistic regression analysis revealed that the odds of having a history of IC were 1.8 times higher in AD children than in non-AD children. Meanwhile, a history of MC was significantly correlated to the male gender, but not to a personal history of AD. As for HI, we found no correlated factors in this study.\n\n",
    "topic": "Examination of the absence of identified risk factors for herpes virus infection in this cohort, considering statistical power, low prevalence, and potential overlooked variables.",
    "response": "<document_analysis>\nThe provided text describes a population-based cross-sectional study enrolling 1117 children (913 analyzed, 132 with AD) aged 0\u20136 in Ishigaki City, Okinawa, examining history of impetigo contagiosum (IC), molluscum contagiosum (MC), and herpes virus infection (HI). It reports 2.5% HI prevalence and the absence of any significant risk factors for HI on multivariable logistic regression. Key themes include low outcome prevalence, statistical power limitations, cross-sectional design, potential misclassification, and unmeasured confounders. For domain experts, the most challenging point is to critically evaluate why no associations were found for HI despite associations for other infections. The question will probe understanding of statistical power and methodological pitfalls in epidemiological studies with rare outcomes.\nDifficulty: 8/10\n</document_analysis>\n\n<output_format>\nQuestion: In a cross-sectional analysis of 913 children aged 0\u20136 years, herpes virus infection (HI) was reported in only 2.5% of participants, and no significant associations with atopic dermatitis or other factors were detected via logistic regression. Which methodological limitation most likely explains the failure to identify risk factors for HI in this cohort?\nA: Non-differential misclassification from parental recall of HI leading to biased associations toward the null  \nB: Insufficient statistical power due to the low number of HI cases restricting detection of moderate effects  \nC: Lack of adjustment for unmeasured environmental exposures serving as confounders  \nD: Aggregation of diverse herpesvirus subtypes into a single outcome masking subtype-specific risk patterns  \nExplanation: With only ~23 HI cases, the study had very low power to detect anything but very large effect sizes, making type II error the most plausible reason for null associations.  \nCorrect Answer: B\n</output_format>",
    "question": "In a cross-sectional analysis of 913 children aged 0\u20136 years, herpes virus infection (HI) was reported in only 2.5% of participants, and no significant associations with atopic dermatitis or other factors were detected via logistic regression. Which methodological limitation most likely explains the failure to identify risk factors for HI in this cohort?",
    "choices": {
      "A": "Non-differential misclassification from parental recall of HI leading to biased associations toward the null",
      "B": "Insufficient statistical power due to the low number of HI cases restricting detection of moderate effects",
      "C": "Lack of adjustment for unmeasured environmental exposures serving as confounders",
      "D": "Aggregation of diverse herpesvirus subtypes into a single outcome masking subtype-specific risk patterns"
    },
    "answer": "B",
    "explanation": "With only ~23 HI cases, the study had very low power to detect anything but very large effect sizes, making type II error the most plausible reason for null associations.",
    "question_token_count": 71,
    "answer_correctness_score": 10,
    "explanation_validity_score": 10,
    "question_clarity_score": 8,
    "question_difficulty_score": 7,
    "question_groundedness_score": 10,
    "avg_answer_token_count": 16
  },
  {
    "context": "Little is known about whether a routinely inserted endoscopic nasobiliary drainage (ENBD) tube improves the clinical course in patients with choledocholithiasis-induced acute cholangitis after clearance of choledocholithiasis.\n\nThe aim of this study was to investigate the need for ENBD on the clinical outcomes of patients with acute cholangitis undergoing endoscopic clearance of common bile duct (CBD) stones.\n\nProspective, randomized study.\n\nTertiary referral center.\n\nA total of 104 patients with choledocholithiasis-induced acute cholangitis who underwent primary endoscopic treatment were compared according to insertion of an ENBD tube (51 in the ENBD group and 53 in the no-ENBD group).\n\nInsertion of an ENBD tube after clearance of CBD stones.\n\nRecurrence of cholangitis and length of hospital stay after clearance of CBD stones.\n\nBaseline clinical characteristics were similar between both groups. There were no significant differences in the recurrence rate of cholangitis at 24 weeks (3.9% for the ENBD group vs 3.8% for the no-ENBD group at 24 weeks; P = .99) and length of hospital stay (7.9 days [standard error = 1.2] for the ENBD group vs 7.9 days [standard error = 0.7]for the no-ENBD group; P = .98). However, procedure time was longer (26.2 [SE = 1.8] minutes vs 22.7 [SE = 1.0]minutes, respectively; P = .01) and the discomfort score was higher (4.9 [SE = 0.4] vs 2.8 [SE = 0.3], respectively; P = .02) in the ENBD group than in the no-ENBD group.\n\nSingle-center study.\n\n",
    "topic": "Debate the cost-benefit balance of routine ENBD tube insertion, considering procedure time, discomfort, and resource utilization.",
    "response": "<document_analysis>\nThe context describes a randomized prospective comparison of endoscopic nasobiliary drainage (ENBD) tube insertion versus no ENBD after CBD stone clearance in acute cholangitis patients. Key findings: no difference in cholangitis recurrence or hospital stay, but ENBD increases procedure time by ~3.5 minutes (P=0.01) and raises discomfort score by ~2 points (P=0.02). This raises a cost-benefit question about routine ENBD use given extra time, patient discomfort, and no clinical advantage. The study is single-center, underlining generalizability limits but providing clear data to inform resource stewardship. A high-level, application-based question on practice modification is warranted to challenge experts' judgment on balancing efficiency, comfort, and resource use.\n</document_analysis>\n\n<output_format>\nQuestion: After common bile duct stone clearance in acute cholangitis, routine placement of an ENBD tube prolongs procedure time by about 3.5 minutes and increases patient discomfort, yet does not reduce 24\u2011week recurrence or hospital stay. Which modification to clinical practice best balances procedural efficiency, patient comfort, and resource utilization?\nA: Discontinue ENBD tube insertion entirely for all post\u2011clearance patients  \nB: Reserve ENBD tube insertion only for patients with evidence of incomplete biliary drainage  \nC: Expand ENBD tube insertion to all moderate\u2011to\u2011severe cholangitis cases as prophylaxis  \nD: Substitute ENBD with percutaneous transhepatic biliary drainage to reduce discomfort  \nExplanation: Targeting ENBD placement to those with inadequate drainage focuses resources where benefit is most likely, avoids unnecessary time and discomfort, and maintains efficiency.  \nCorrect Answer: B\n</output_format>",
    "question": "After common bile duct stone clearance in acute cholangitis, routine placement of an ENBD tube prolongs procedure time by about 3.5 minutes and increases patient discomfort, yet does not reduce 24\u2011week recurrence or hospital stay. Which modification to clinical practice best balances procedural efficiency, patient comfort, and resource utilization?",
    "choices": {
      "A": "Discontinue ENBD tube insertion entirely for all post\u2011clearance patients",
      "B": "Reserve ENBD tube insertion only for patients with evidence of incomplete biliary drainage",
      "C": "Expand ENBD tube insertion to all moderate\u2011to\u2011severe cholangitis cases as prophylaxis",
      "D": "Substitute ENBD with percutaneous transhepatic biliary drainage to reduce discomfort"
    },
    "answer": "B",
    "explanation": "Targeting ENBD placement to those with inadequate drainage focuses resources where benefit is most likely, avoids unnecessary time and discomfort, and maintains efficiency.",
    "question_token_count": 66,
    "answer_correctness_score": 10,
    "explanation_validity_score": 10,
    "question_clarity_score": 8,
    "question_difficulty_score": 8,
    "question_groundedness_score": 10,
    "avg_answer_token_count": 17
  },
  {
    "context": "To determine whether the OraQuick\u00ae HIV-1/2 Assay (OraSure Technologies, Inc., Bethlehem, PA, USA) in sputum is a valid tool for HIV surveillance among TB patients.\n\nA cross sectional study was carried out on sputa of patients diagnosed with tuberculosis. Sputa were tested for antibodies to HIV using OraQuick\u00ae HIV-1/2 Assay (OraSure Technologies, Inc., Bethlehem, PA, USA). The results were compared with results of serum ELISA.\n\nCompared to serum ELISA, the OraQuick\u00ae HIV-1/2 Assay in sputum specimens reported 90% sensitivity (9/10) and 100% specificity (307/307), with a positive predictive value of 100% (95%CI: 66.37%-100.00%) and a negative predictive value of 99.68% (95%CI: 98.20%-99.99%).\n\n",
    "topic": "Potential sources of bias (selection bias, verification bias, spectrum bias) in comparing sputum-based rapid tests against serum ELISA.",
    "response": "<document_analysis>\nThe context describes a cross-sectional validation of a sputum-based HIV antibody assay in a sample composed exclusively of tuberculosis (TB) patients, comparing results against serum ELISA. This selective sampling restricts the clinical spectrum of HIV disease to individuals with TB, likely enriched for advanced immunosuppression and high antibody titers. Such a design can lead to spectrum bias, where sensitivity estimates may be artificially high and not generalizable to broader populations with varying disease stages. Other biases (e.g., verification bias) are not supported by the text since all samples underwent both index and reference tests.\nDifficulty rating: 8/10 \u2013 requires understanding of diagnostic test evaluation and subtle bias distinctions.\n</document_analysis>\n\n<output_format>\nQuestion: When a sputum-based HIV antibody assay is validated solely in tuberculosis patients, which bias most threatens the generalizability of its reported sensitivity?\nA: Selection bias\nB: Verification bias\nC: Spectrum bias\nD: Observer bias\nExplanation: Restricting the sample to TB patients yields a narrowed disease spectrum with higher antibody levels, inflating sensitivity estimates.\nCorrect Answer: C\n</output_format>",
    "question": "When a sputum-based HIV antibody assay is validated solely in tuberculosis patients, which bias most threatens the generalizability of its reported sensitivity?",
    "choices": {
      "A": "Selection bias",
      "B": "Verification bias",
      "C": "Spectrum bias",
      "D": "Observer bias"
    },
    "answer": "C",
    "explanation": "Restricting the sample to TB patients yields a narrowed disease spectrum with higher antibody levels, inflating sensitivity estimates.",
    "question_token_count": 28,
    "answer_correctness_score": 10,
    "explanation_validity_score": 10,
    "question_clarity_score": 8,
    "question_difficulty_score": 9,
    "question_groundedness_score": 10,
    "avg_answer_token_count": 3
  },
  {
    "context": "Schools can play an important role in the prevention of obesity, e.g. by providing an environment that stimulates healthy eating habits and by developing a food policy to provide such an environment. The effectiveness of a school food policy is affected by the content of the policy, its implementation and its support by parents, teachers and principals. The aim of this study is to detect opportunities to improve the school food policy and/or implementation at Dutch primary schools. Therefore, this study explores the school food policy and investigates schools' (teachers and principals) and parents' opinion on the school food policy.\n\nData on the schools' perspective of the food policy was collected from principals and teachers by means of semi-structured interviews. In total 74 principals and 72 teachers from 83 Dutch primary schools were interviewed. Data on parental perceptions about the school food policy were based on a cross-sectional survey among 1,429 parents from the same schools.\n\nMost principals (87.1%) reported that their school had a written food policy; however in most cases the rules were not clearly defined. Most of the principals (87.8%) believed that their school paid sufficient attention to nutrition and health. Teachers and principals felt that parents were primarily responsible to encourage healthy eating habits among children, while 49.8% of the parents believed that it is also a responsibility of the school to foster healthy eating habits among children. Most parents reported that they appreciated the school food policy and comply with the food rules. Parents' opinion on the enforcement of the school food policy varied: 28.1% believed that the school should enforce the policy more strongly, 32.1% was satisfied, and 39.8% had no opinion on this topic.\n\n",
    "topic": "Potential biases introduced by self\u2010reported data from principals, teachers, and parents and their influence on study conclusions",
    "response": "<document_analysis>\nThe context describes a study relying entirely on self\u2010reported data from school principals, teachers, and parents regarding the presence, clarity, enforcement, and compliance of school food policies. Key findings show high reported rates of written policies and attention to nutrition\u2014despite vague definitions\u2014and strong parental compliance. These outcomes are susceptible to social desirability bias (respondents presenting themselves favorably) and self\u2010serving bias (attributing positive outcomes to one\u2019s own actions), which can inflate perceived policy clarity and effectiveness and skew conclusions about needed improvements.\n</document_analysis>\n\n<output_format>\nQuestion: In a study using semi\u2010structured interviews of principals and teachers and surveys of parents to assess school food policy implementation, which pair of biases most likely leads to inflated reports of policy clarity and compliance, potentially skewing the study\u2019s conclusions?\nA: Social desirability and self\u2010serving biases\nB: Recall and acquiescence biases\nC: Selection and confirmation biases\nD: Framing and anchoring biases\nExplanation: Respondents tend to present themselves in a favorable light (social desirability) and attribute positive outcomes to their own efforts (self\u2010serving), inflating reported clarity and compliance; the other bias pairs do not directly explain this overreporting.\nCorrect Answer: A\n</output_format>",
    "question": "In a study using semi\u2010structured interviews of principals and teachers and surveys of parents to assess school food policy implementation, which pair of biases most likely leads to inflated reports of policy clarity and compliance, potentially skewing the study\u2019s conclusions?",
    "choices": {
      "A": "Social desirability and self\u2010serving biases",
      "B": "Recall and acquiescence biases",
      "C": "Selection and confirmation biases",
      "D": "Framing and anchoring biases"
    },
    "answer": "A",
    "explanation": "Respondents tend to present themselves in a favorable light (social desirability) and attribute positive outcomes to their own efforts (self\u2010serving), inflating reported clarity and compliance; the other bias pairs do not directly explain this overreporting.",
    "question_token_count": 48,
    "answer_correctness_score": 10,
    "explanation_validity_score": 10,
    "question_clarity_score": 4,
    "question_difficulty_score": 8,
    "question_groundedness_score": 6,
    "avg_answer_token_count": 8
  },
  {
    "context": "To determine the ability of early sonogram to predict the presentation of twin A at birth.\n\nA retrospective cohort study was conducted on all twin pregnancies evaluated at our Fetal Evaluation Unit from 2007 to 2009. Sonogram records were reviewed for the presentation of twin A at seven gestational age intervals and inpatient medical records were reviewed for the presentation of twin A at delivery. The positive predictive value, sensitivity, and specificity of presentation as determined by ultrasound, at each gestational age interval, for the same presentation at delivery were calculated.\n\nTwo hundred and thirty-eight twin pregnancies met inclusion criteria. A total of 896 ultrasounds were reviewed. The positive predictive value of cephalic presentation of twin A as determined by ultrasound for the persistence of cephalic presentation at delivery reached 95% after 28 weeks gestation. The positive predictive value for noncephalic presentation as established by sonogram for noncephalic at delivery was>90% after 32 weeks gestation.\n\n",
    "topic": "The rationale for using a retrospective cohort design to assess ultrasound prediction of twin A presentation at birth.",
    "response": "<document_analysis>\nThe context describes a retrospective cohort study evaluating the predictive accuracy (PPV, sensitivity, specificity) of ultrasound-determined presentations of twin A at birth across gestational age intervals. Key methodological point: retrospective cohort allows sampling by exposure (ultrasound findings) with known denominators, enabling direct calculation of PPV/NPV\u2014impossible in case-control designs which sample by outcome and distort prevalence. This nuanced epidemiological rationale underpins choice of design. Difficulty: requires understanding of predictive accuracy metrics and study design implications.\nDifficulty rating: 8/10  \n</document_analysis>\n\n<output_format>\nQuestion: When evaluating the ability of serial ultrasounds to predict twin\u00a0A\u2019s presentation at birth, why is a retrospective cohort design preferable to a case-control design for calculating positive predictive value (PPV)?\nA: It allows establishment of temporal sequence between ultrasound findings and delivery presentation.\nB: It samples pregnancies based on ultrasound-determined presentation, preserving the true prevalence needed to compute PPV.\nC: It enables random assignment of mothers to different ultrasound schedules, reducing allocation bias.\nD: It ensures equal numbers of cephalic and noncephalic outcomes, improving statistical power for PPV.\nExplanation: A retrospective cohort design samples by exposure (ultrasound findings) and retains the actual distribution of outcomes, which is required for accurate PPV calculation; case-control sampling by outcome disrupts prevalence.\nCorrect Answer: B\n</output_format>",
    "question": "When evaluating the ability of serial ultrasounds to predict twin\u00a0A\u2019s presentation at birth, why is a retrospective cohort design preferable to a case-control design for calculating positive predictive value (PPV)?",
    "choices": {
      "A": "It allows establishment of temporal sequence between ultrasound findings and delivery presentation.",
      "B": "It samples pregnancies based on ultrasound-determined presentation, preserving the true prevalence needed to compute PPV.",
      "C": "It enables random assignment of mothers to different ultrasound schedules, reducing allocation bias.",
      "D": "It ensures equal numbers of cephalic and noncephalic outcomes, improving statistical power for PPV."
    },
    "answer": "B",
    "explanation": "A retrospective cohort design samples by exposure (ultrasound findings) and retains the actual distribution of outcomes, which is required for accurate PPV calculation; case-control sampling by outcome disrupts prevalence.",
    "question_token_count": 39,
    "answer_correctness_score": 10,
    "explanation_validity_score": 10,
    "question_clarity_score": 8,
    "question_difficulty_score": 7,
    "question_groundedness_score": 6,
    "avg_answer_token_count": 18
  },
  {
    "context": "To study the risks of haemodynamic instability, and the possible occurrence of spinal haematoma, meningitis and epidural abscess when epidural analgesia is performed for cytoreductive surgery and hyperthermic intraperitoneal chemotherapy (HIPEC).\n\nWe retrospectively analyzed the data of 35 patients treated by HIPEC with oxaliplatin or cisplatin. An epidural catheter was inserted before induction of general anaesthesia. Postoperatively, a continuous epidural infusion of ropivacain, then a patient-controlled epidural analgesia were started.\n\nThe epidural catheter was used peroperatively before HIPEC in 12 subjects (34%), and after HIPEC in 23 subjects (66%). The median dose of ropivacain given peroperatively in the epidural catheter was 40 mg (30-75). Norepinephrin was used in two subjects (6%) peroperatively (median infusion rate 0.325 \u03bcg/kg per minute [0.32-0.33]), and in four subjects (11%) in the postoperative 24 hours. No spinal haematoma, meningitis or epidural abscess were noted. Five subjects (14%) had a thrombopenia or a prothrombin time less than 60% before catheter removal. Two subjects (6%) had a leukopenia before catheter removal. No thrombopenia or blood coagulation disorders were recorded the day of catheter removal.\n\n",
    "topic": "Impact of leukopenia on infection risk and decision\u2011making for epidural catheter removal timing in oncology patients.",
    "response": "<document_analysis>\nThe context describes a retrospective study of epidural catheter use in 35 HIPEC patients, noting hematologic abnormalities prior to catheter removal: five had thrombopenia or prolonged PT, and two had leukopenia. No cases of spinal hematoma, meningitis, or epidural abscess occurred. For catheter removal, coagulopathy resolution was the emphasized safety criterion rather than leukocyte count. The study suggests that mild leukopenia without coagulopathy did not predispose to infectious complications and thus did not necessitate delaying catheter removal. This observation underpins a nuanced understanding of risk stratification for catheter removal: prioritizing coagulation parameters over leukopenia for preventing hemorrhagic complications, and recognizing that mild leukopenia alone may not increase infection risk in this setting.\nDifficulty: 8/10 (requires nuanced integration of hematologic risk factors, infection risk, and anesthesiology guidelines)\n</document_analysis>\n\n<output_format>\nQuestion: In oncologic HIPEC patients with epidural analgesia, what does the absence of infectious complications in leukopenic individuals imply for catheter removal timing?\nA: Leukopenia should delay removal until full white cell count recovery.\nB: Mild leukopenia without coagulopathy does not necessitate postponing removal.\nC: Leukopenia mandates prophylactic antibiotics before removal.\nD: Leukopenia is as critical as thrombocytopenia for preventing epidural hematoma.\nExplanation: The study reported no infections in leukopenic patients and prioritized coagulation status over leukocyte count for safe catheter removal.\nCorrect Answer: B\n</output_format>",
    "question": "In oncologic HIPEC patients with epidural analgesia, what does the absence of infectious complications in leukopenic individuals imply for catheter removal timing?",
    "choices": {
      "A": "Leukopenia should delay removal until full white cell count recovery.",
      "B": "Mild leukopenia without coagulopathy does not necessitate postponing removal.",
      "C": "Leukopenia mandates prophylactic antibiotics before removal.",
      "D": "Leukopenia is as critical as thrombocytopenia for preventing epidural hematoma."
    },
    "answer": "B",
    "explanation": "The study reported no infections in leukopenic patients and prioritized coagulation status over leukocyte count for safe catheter removal.",
    "question_token_count": 31,
    "answer_correctness_score": 10,
    "explanation_validity_score": 10,
    "question_clarity_score": 8,
    "question_difficulty_score": 9,
    "question_groundedness_score": 8,
    "avg_answer_token_count": 15
  },
  {
    "context": "Paraffin-embedded tissues in Cukurova University Faculty of Medicine Department of Pathology between January 2002 and February 2006 were searched restrospectively to investigate this issue. We performed immunohistochemistry on biopsies of 125 patients with HBV infection, grouped as: mild, moderate and severe hepatitis, cirrhosis and HCC, 25 patients in each of them, using anti c-kit monoclonal antibody. The severity of parenchymal inflammation and of interface hepatitis was semiquantitatively graded on a haematoxylin and eosin stained paraffin sections. Additionally, 50 more HCC, formed on HBV basis, were studied to determine the prevalence of c-kit overexpression.\n\nIn cirrhotic liver, lower intensity of staining and rarely c-kit positivity were present. The greatest number of the c-kit positivity and higher intensity of staining was found in the livers of patients with severe hepatitis and HCC. In chronic hepatitis B infection, the staining intensity was parallel with the grade and stage of the disease. In the areas where fibrosis was seen, c-kit positivity was rare or absent. In the HCC specimens, c-kit positivity appeared both inside and around the cancerous nodes. C-kit expression was observed in 62 of 75 HCC tissue specimens (82%) (p<0.001).\n\n",
    "topic": "Implications of c\u2011kit overexpression as a potential prognostic marker in HBV\u2010related HCC.",
    "response": "<document_analysis>\nThe context describes a retrospective immunohistochemical study of c\u2011kit expression across progressive HBV\u2010related liver lesions\u2014ranging from mild, moderate, and severe hepatitis through cirrhosis to HCC. Key findings: staining intensity of c\u2011kit parallels grade and stage of chronic hepatitis, is minimal in fibrotic areas and cirrhosis, but is highest in severe hepatitis and continues within and around HCC nodules; 82% of HCC specimens overexpress c\u2011kit. This coherent, educationally valuable content supports generating a challenging application/understanding question about the pattern of c\u2011kit expression as a potential prognostic marker in HBV\u2010related HCC.\nDifficulty rating: 8/10 (requires synthesis of staining patterns across stages and implications for prognostic use).\n</document_analysis>\n\n<output_format>\nQuestion: Which immunohistochemical pattern of c\u2011kit expression most strongly supports its use as a prognostic marker in HBV\u2010related liver disease?\nA: Uniform moderate c\u2011kit staining in all stages from mild hepatitis to HCC, indicating consistent receptor presence.\nB: Predominant c\u2011kit positivity in fibrotic septa and cirrhotic nodules, peaking just before malignant transformation.\nC: Staining intensity that rises with hepatitis severity, is scarce in fibrotic areas and cirrhosis, and remains high within and around HCC nodules.\nD: Exclusive c\u2011kit expression in non\u2010neoplastic hepatocytes during early hepatitis, disappearing entirely in HCC tissues.\nExplanation: Only option C reflects the parallel increase of c\u2011kit with inflammation grade, its reduction in fibrotic regions and cirrhosis, and its high prevalence (82%) in HCC, indicating its prognostic relevance.\nCorrect Answer: C\n</output_format>",
    "question": "Which immunohistochemical pattern of c\u2011kit expression most strongly supports its use as a prognostic marker in HBV\u2010related liver disease?",
    "choices": {
      "A": "Uniform moderate c\u2011kit staining in all stages from mild hepatitis to HCC, indicating consistent receptor presence.",
      "B": "Predominant c\u2011kit positivity in fibrotic septa and cirrhotic nodules, peaking just before malignant transformation.",
      "C": "Staining intensity that rises with hepatitis severity, is scarce in fibrotic areas and cirrhosis, and remains high within and around HCC nodules.",
      "D": "Exclusive c\u2011kit expression in non\u2010neoplastic hepatocytes during early hepatitis, disappearing entirely in HCC tissues."
    },
    "answer": "C",
    "explanation": "Only option C reflects the parallel increase of c\u2011kit with inflammation grade, its reduction in fibrotic regions and cirrhosis, and its high prevalence (82%) in HCC, indicating its prognostic relevance.",
    "question_token_count": 28,
    "answer_correctness_score": 10,
    "explanation_validity_score": 10,
    "question_clarity_score": 6,
    "question_difficulty_score": 8,
    "question_groundedness_score": 5,
    "avg_answer_token_count": 25
  },
  {
    "context": "Implant-related infections represent one of the most severe complications in orthopaedics. A fast-resorbable, antibacterial-loaded hydrogel may reduce or prevent bacterial colonization and biofilm formation of implanted biomaterials.QUESTIONS/\n\nWe asked: (1) Is a fast-resorbable hydrogel able to deliver antibacterial compounds in vitro? (2) Can a hydrogel (alone or antibacterial-loaded) coating on implants reduce bacterial colonization? And (3) is intraoperative coating feasible and resistant to press-fit implant insertion?\n\nWe tested the ability of Disposable Antibacterial Coating (DAC) hydrogel (Novagenit Srl, Mezzolombardo, Italy) to deliver antibacterial agents using spectrophotometry and a microbiologic assay. Antibacterial and antibiofilm activity were determined by broth microdilution and a crystal violet assay, respectively. Coating resistance to press-fit insertion was tested in rabbit tibias and human femurs.\n\nComplete release of all tested antibacterial compounds was observed in less than 96 hours. Bactericidal and antibiofilm effect of DAC hydrogel in combination with various antibacterials was shown in vitro. Approximately 80% of the hydrogel coating was retrieved on the implant after press-fit insertion.\n\n",
    "topic": "Strategies to modulate hydrogel formulation for optimized resorption rate and sustained antimicrobial release profiles.",
    "response": "<document_analysis>\nThe context describes a fast-resorbable antibacterial hydrogel (DAC) with complete antibiotic release in <96\u00a0h and ~80% coating retention after press-fit insertion. Key variables influencing drug release include network mesh size (crosslink density), coating thickness, polymer molecular weight, and drug loading. A deep understanding of how mesh size governs diffusion kinetics is critical for extending release profiles. Other parameters (thickness, molecular weight, loading) have secondary or indirect effects. This analysis supports a question probing strategies to modulate mesh size via crosslinking to slow release.\n</document_analysis>\n\n<output_format>\nQuestion: In tailoring a fast-resorbable antibacterial hydrogel to prolong release beyond the observed 96\u00a0h without impairing press-fit retention, which formulation change will most directly constrain drug diffusion by reducing network mesh size?\nA: Doubling the crosslinking density of the polymer network\nB: Increasing the hydrogel coating thickness by 50%\nC: Substituting the polymer with a higher molecular weight analog\nD: Elevating the initial antibiotic concentration within the hydrogel\nExplanation: Increasing crosslink density reduces the hydrogel\u2019s mesh size, directly slowing antibiotic diffusion and extending release duration.\nCorrect Answer: A\n</output_format>",
    "question": "In tailoring a fast-resorbable antibacterial hydrogel to prolong release beyond the observed 96\u00a0h without impairing press-fit retention, which formulation change will most directly constrain drug diffusion by reducing network mesh size?",
    "choices": {
      "A": "Doubling the crosslinking density of the polymer network",
      "B": "Increasing the hydrogel coating thickness by 50%",
      "C": "Substituting the polymer with a higher molecular weight analog",
      "D": "Elevating the initial antibiotic concentration within the hydrogel"
    },
    "answer": "A",
    "explanation": "Increasing crosslink density reduces the hydrogel\u2019s mesh size, directly slowing antibiotic diffusion and extending release duration.",
    "question_token_count": 43,
    "answer_correctness_score": 10,
    "explanation_validity_score": 10,
    "question_clarity_score": 6,
    "question_difficulty_score": 8,
    "question_groundedness_score": 4,
    "avg_answer_token_count": 11
  },
  {
    "context": "Laparoscopic sleeve gastrectomy (LSG) is currently being performed with increasing frequency worldwide. It offers an excellent weight loss and resolution of comorbidities in the short term with a very low incidence of complications. However, the ever present risk of a staple line leak is still a major concern.\n\nSince 2005, data from obese patients that undergo bariatric procedures in Germany are prospectively registered in an online database and analyzed at the Institute of Quality Assurance in Surgical Medicine. For the current analysis, all patients that had undergone primary sleeve gastrectomy for morbid obesity within a 7-year period were considered.\n\nUsing the GBSR, data from 5.400 LSGs were considered for analysis. Staple line leak rate decreased during the study period from 6.5 to 1.4 %. Male gender, higher BMI, concomitant sleep apnea, conversion to laparotomy, longer operation time, use of both buttresses and oversewing, and the occurrence of intraoperative complications were associated with a significantly higher leakage rate. On multivariate analysis, operation time and year of procedure only had a significant impact on staple line leak rate.\n\n",
    "topic": "Understanding the design, scope, and quality assurance mechanisms of the German Bariatric Surgery Registry (GBSR) for collecting LSG data.",
    "response": "<document_analysis>\nThe context outlines a prospective registry analysis of 5,400 LSG procedures over seven years, reporting that various factors (buttress use, oversewing, gender, BMI, sleep apnea, conversion to laparotomy, operation time, year of procedure) were univariately associated with staple line leak rates, but only operation time and year remained significant in the multivariate model. This discrepancy suggests a confounding effect, particularly that reinforcement techniques were applied more in higher-risk or more complex cases, inflating their univariate association with leaks. The most appropriate epidemiological concept is confounding by indication. Crafting a question about this bias assesses deep understanding of registry design, univariate versus multivariate interpretations, and subtle epidemiological pitfalls. Difficulty rated 8/10. \n</document_analysis>\n\n<output_format>\nQuestion: In a nationwide prospective registry of 5,400 sleeve gastrectomies over seven years, staple line buttresses and oversewing were linked to higher leak rates on univariate analysis but lost significance after adjusting for operation time and year. Which epidemiological phenomenon best explains the initial univariate association?\nA: Reverse causation\nB: Performance bias\nC: Confounding by indication\nD: Ascertainment bias\nExplanation: Reinforcement was preferentially used in higher-risk or more complex cases, creating a spurious univariate link to leaks that disappeared once key confounders were controlled.\nCorrect Answer: C\n</output_format>",
    "question": "In a nationwide prospective registry of 5,400 sleeve gastrectomies over seven years, staple line buttresses and oversewing were linked to higher leak rates on univariate analysis but lost significance after adjusting for operation time and year. Which epidemiological phenomenon best explains the initial univariate association?",
    "choices": {
      "A": "Reverse causation",
      "B": "Performance bias",
      "C": "Confounding by indication",
      "D": "Ascertainment bias"
    },
    "answer": "C",
    "explanation": "Reinforcement was preferentially used in higher-risk or more complex cases, creating a spurious univariate link to leaks that disappeared once key confounders were controlled.",
    "question_token_count": 58,
    "answer_correctness_score": 10,
    "explanation_validity_score": 10,
    "question_clarity_score": 8,
    "question_difficulty_score": 8,
    "question_groundedness_score": 10,
    "avg_answer_token_count": 4
  },
  {
    "context": "To assess the risk of death associated with work based and non-work based measures of socioeconomic status before and after retirement age.\n\nFollow up study of mortality in relation to employment grade and car ownership over 25 years.\n\nThe first Whitehall study.\n\n18,133 male civil servants aged 40-69 years who attended a screening examination between 1967 and 1970.\n\nDeath.\n\nGrade of employment was a strong predictor of mortality before retirement. For men dying at ages 40-64 the lowest employment grade had 3.12 times the mortality of the highest grade (95% confidence interval 2.4 to 4.1). After retirement the ability of grade to predict mortality declined (rate ratio 1.86; 1.6 to 2.2). A non-work based measure of socioeconomic status (car ownership) predicted mortality less well than employment grade before retirement but its ability to predict mortality declined less after retirement. Using a relative index of inequality that was sensitive to the distribution among socioeconomic groups showed employment grade and car ownership to have independent associations with mortality that were of equal magnitude after retirement. The absolute difference in death rates between the lowest and highest employment grades increased with age from 12.9 per 1000 person years at ages 40-64 to 38.3 per 1000 at ages 70-89.\n\n",
    "topic": "Comparative analysis of car ownership\u2019s predictive performance on mortality before and after retirement.",
    "response": "<document_analysis>\nThe context reports a longitudinal cohort study examining how two socioeconomic indicators\u2014employment grade and car ownership\u2014predict mortality before and after retirement. Employment grade shows a strong association with mortality pre-retirement (rate ratio 3.12) that weakens post-retirement (rate ratio 1.86). Car ownership is initially a weaker predictor but exhibits a comparatively smaller decline in predictive power after retirement. Using a relative index of inequality, both measures converge to equal predictive magnitude post-retirement. The key nuance is the differential change in predictive strengths of the two measures across the retirement transition. This insight allows construction of a challenging question about the relative declines and resulting equivalence of predictive power after retirement.\n</document_analysis>\n\n<output_format>\nQuestion: Which statement most accurately describes the comparative change in mortality prediction by employment grade versus car ownership after retirement?\nA: Employment grade\u2019s predictive power declined more after retirement than car ownership\u2019s, resulting in equal predictive strength post-retirement.\nB: Car ownership\u2019s predictive power declined more after retirement than employment grade\u2019s, maintaining employment grade as the stronger predictor.\nC: Employment grade lost all predictive power after retirement, while car ownership retained its pre-retirement predictive advantage.\nD: Both employment grade and car ownership experienced identical proportional declines in predictive power after retirement.\nExplanation: Employment grade\u2019s rate ratio falls from 3.12 pre-retirement to 1.86 post-retirement, a larger relative decline than for car ownership, so both measures reach similar predictive strength after retirement.\nCorrect Answer: A\n</output_format>",
    "question": "Which statement most accurately describes the comparative change in mortality prediction by employment grade versus car ownership after retirement?",
    "choices": {
      "A": "Employment grade\u2019s predictive power declined more after retirement than car ownership\u2019s, resulting in equal predictive strength post-retirement.",
      "B": "Car ownership\u2019s predictive power declined more after retirement than employment grade\u2019s, maintaining employment grade as the stronger predictor.",
      "C": "Employment grade lost all predictive power after retirement, while car ownership retained its pre-retirement predictive advantage.",
      "D": "Both employment grade and car ownership experienced identical proportional declines in predictive power after retirement."
    },
    "answer": "A",
    "explanation": "Employment grade\u2019s rate ratio falls from 3.12 pre-retirement to 1.86 post-retirement, a larger relative decline than for car ownership, so both measures reach similar predictive strength after retirement.",
    "question_token_count": 21,
    "answer_correctness_score": 10,
    "explanation_validity_score": 10,
    "question_clarity_score": 6,
    "question_difficulty_score": 8,
    "question_groundedness_score": 10,
    "avg_answer_token_count": 21
  },
  {
    "context": "Multislice helical computed tomography (CT), which can provide detailed 2-D and 3-D reconstructed images, is useful in imaging diagnosis for dental implant treatment. Therefore, in this study, it was performed to clarify the mandibular depiction of double-oblique reconstructed images when changing their thickness.\n\nA total of 38 sites in the mandibular molar region were examined using multislice helical CT. The thicknesses of the double-oblique images using multislice helical CT scans were reconstructed in 4 conditions: 0.3 mm, 0.9 mm, 1.6 mm, and 4.1 mm. In double-oblique images, mandibular depiction was evaluated by 5 oral radiologists using a subjective rating score.\n\nIn the alveolar crest and the whole of the mandibular canal, the highest value was obtained with 0.9 mm-thick images; however, there was no significant difference between 0.3 mm and 0.9 mm-thick images.\n\n",
    "topic": "Influence of reconstruction slice thickness on spatial resolution and partial\u2010volume artifacts",
    "response": "<document_analysis>\nThe context reports on a study of double\u2010oblique reconstructed images from multislice helical CT with four slice thicknesses: 0.3, 0.9, 1.6, and 4.1\u00a0mm. Mandibular depiction was rated subjectively by radiologists. The key finding is that depiction quality does not monotonically improve with thinner slices; instead it peaks at an intermediate thickness (0.9\u00a0mm) and plateaus relative to 0.3\u00a0mm, then declines at greater thicknesses. This implies a tradeoff between spatial resolution and partial\u2010volume effects/noise. For domain experts, the most challenging insight is recognizing this non\u2010linear relationship and its implications for optimizing reconstruction parameters. I will craft a question probing their understanding of this relationship rather than simple recall of the optimal thickness.\nDifficulty: 7/10\n</document_analysis>\n\n<output_format>\nQuestion: How does the relationship between double\u2010oblique reconstruction slice thickness and mandibular depiction quality manifest in multislice helical CT imaging?\nA: Quality improves linearly as slice thickness decreases across all tested values.\nB: Quality peaks at an intermediate thickness (around 0.9\u00a0mm) and then declines at larger and smaller thicknesses.\nC: Quality remains essentially uniform from 0.3\u00a0mm through 1.6\u00a0mm, dropping only at 4.1\u00a0mm.\nD: Quality is lowest at intermediate thicknesses and highest at both the thinnest (0.3\u00a0mm) and thickest (4.1\u00a0mm) settings.\nExplanation: Depiction scores were highest at 0.9\u00a0mm, with no significant difference from 0.3\u00a0mm, and then decreased for 1.6\u00a0mm and 4.1\u00a0mm, indicating a peak at an intermediate thickness.\nCorrect Answer: B\n</output_format>",
    "question": "How does the relationship between double\u2010oblique reconstruction slice thickness and mandibular depiction quality manifest in multislice helical CT imaging?",
    "choices": {
      "A": "Quality improves linearly as slice thickness decreases across all tested values.",
      "B": "Quality peaks at an intermediate thickness (around 0.9\u00a0mm) and then declines at larger and smaller thicknesses.",
      "C": "Quality remains essentially uniform from 0.3\u00a0mm through 1.6\u00a0mm, dropping only at 4.1\u00a0mm.",
      "D": "Quality is lowest at intermediate thicknesses and highest at both the thinnest (0.3\u00a0mm) and thickest (4.1\u00a0mm) settings."
    },
    "answer": "B",
    "explanation": "Depiction scores were highest at 0.9\u00a0mm, with no significant difference from 0.3\u00a0mm, and then decreased for 1.6\u00a0mm and 4.1\u00a0mm, indicating a peak at an intermediate thickness.",
    "question_token_count": 26,
    "answer_correctness_score": 9,
    "explanation_validity_score": 9,
    "question_clarity_score": 7,
    "question_difficulty_score": 8,
    "question_groundedness_score": 10,
    "avg_answer_token_count": 24
  },
  {
    "context": "Microbial contamination can be a marker for faulty process and is assumed to play an important role in the collection of hematopoietic progenitor cell (HPC) and infusion procedure. We aimed to determine the microbial contamination rates and evaluate the success of hematopoietic cell transplantation (HCT) in patients who received contaminated products.PATIENTS-\n\nWe analyzed microbial contamination records of HPC grafts between 2012 and 2015, retrospectively. Contamination rates of autologous donors were evaluated for at three steps: at the end of mobilization, following processing with dimethyl sulfoxide, and just before stem cell infusion. Grafts of allogeneic donors were assessed only before HCT.\n\nA total of 445 mobilization procedures were carried out on 333 (167 autologous and 166 allogeneic) donors. The microbiological contamination of peripheral blood (323/333 donations) and bone marrow (10/333 donations) products were analyzed. Bacterial contamination was detected in 18 of 1552 (1.15 %) culture bottles of 333 donors. During the study period 248 patients underwent HCT and among these patients microbial contamination rate on sample basis was 1.3 % (16/1212). Microbial contamination detected in nine patients (7 autologous; 2 allogeneic). In 8 of 9 patients, a febrile neutropenic attack was observed. The median day for the neutropenic fever was 4 days (0-9). None of the patients died within the post-transplant 30 days who received contaminated products.\n\n",
    "topic": "Best practices for documentation and reporting of microbial contamination incidents in hematopoietic cell transplantation.",
    "response": "<document_analysis>\nThe context details a retrospective evaluation of microbial contamination in hematopoietic progenitor cell grafts at defined processing stages\u2014specifically three distinct culture timepoints for autologous donors (end of mobilization, post\u2013DMSO processing, and pre-infusion) and a single pre-transplant assessment for allogeneic donors. Contamination rates and associated febrile neutropenic events are reported, with no 30\u2010day mortality. These specifics inform best practices for documentation and reporting of contamination incidents by highlighting when cultures should be performed to detect process failures and support clinical intervention.\nDifficulty rating: 6/10 (requires integration of protocol design with clinical implications)\n</document_analysis>\n\n<output_format>\nQuestion: To establish a robust documentation and reporting framework that maximizes detection of microbial contamination in hematopoietic progenitor cell grafts and guides timely clinical response, which sampling protocol should be implemented?\nA: Culture samples only at the end of mobilization for both autologous and allogeneic donors  \nB: Three\u2010step culture sampling for autologous donors (end of mobilization, post\u2013DMSO processing, pre\u2010infusion) and a single pre\u2010transplant culture for allogeneic donors  \nC: Single culture sampling for all donors immediately after DMSO processing  \nD: Culture sampling only when a patient develops febrile neutropenia post\u2010transplant  \nExplanation: A comprehensive protocol consists of multiple checkpoints for autologous grafts and a pre\u2010transplant check for allogeneic grafts to detect contamination early and support intervention.  \nCorrect Answer: B\n</output_format>",
    "question": "To establish a robust documentation and reporting framework that maximizes detection of microbial contamination in hematopoietic progenitor cell grafts and guides timely clinical response, which sampling protocol should be implemented?",
    "choices": {
      "A": "Culture samples only at the end of mobilization for both autologous and allogeneic donors",
      "B": "Three\u2010step culture sampling for autologous donors (end of mobilization, post\u2013DMSO processing, pre\u2010infusion) and a single pre\u2010transplant culture for allogeneic donors",
      "C": "Single culture sampling for all donors immediately after DMSO processing",
      "D": "Culture sampling only when a patient develops febrile neutropenia post\u2010transplant"
    },
    "answer": "B",
    "explanation": "A comprehensive protocol consists of multiple checkpoints for autologous grafts and a pre\u2010transplant check for allogeneic grafts to detect contamination early and support intervention.",
    "question_token_count": 36,
    "answer_correctness_score": 10,
    "explanation_validity_score": 10,
    "question_clarity_score": 2,
    "question_difficulty_score": 8,
    "question_groundedness_score": 1,
    "avg_answer_token_count": 22
  },
  {
    "context": "Prior literature identified the use of Performance Measurement Systems (PMS) as crucial in addressing improved processes of care. Moreover, a strategic use of PMS has been found to enhance quality, compared to non-strategic use, although a clear understanding of this linkage is still to be achieved. This paper deals with the test of direct and indirect models related to the link between the strategic use of PMS and the level of improved processes in health care organizations. Indirect models were mediated by the degree of perceived managerial discretion.\n\nA PLS analysis on a survey of 97 Italian managers working for health care organizations in the Lombardy region was conducted. The response rate was 77.6%.\n\nThe strategic use of PMS in health care organizations directly and significantly (p\u2009<\u20090.001) enhances performance in terms of improved processes. Perceived managerial discretion is positively and significantly (p\u2009<\u20090.001) affected by the strategic use of PMS, whereas the mediation effect is non-significant.\n\n",
    "topic": "Suggestions for future research to clarify mechanisms by which strategic PMS use influences quality improvement.",
    "response": "<document_analysis>\nThe context describes a study employing Partial Least Squares (PLS) to test both direct and indirect (mediated by perceived managerial discretion) effects of strategic PMS use on process improvements. The direct paths\u2014strategic PMS \u2192 improved processes and strategic PMS \u2192 managerial discretion\u2014were significant (p<0.001), but the overall mediation was not. This points to a methodological issue in establishing mediation rather than substantive non\u2010relationship. For mediation, temporal ordering and causal sequencing are critical, and cross\u2010sectional survey designs inherently limit this, undermining the ability to detect an indirect effect even when component paths are significant. Other factors (collinearity, sample size, regional scope) are less central than the inability to establish time precedence.\nDifficulty rating: 8/10 \u2013 requires nuanced understanding of mediation analysis and methodological design.\n</document_analysis>\n\n<output_format>\nQuestion: In a study where strategic use of PMS significantly predicted both process improvements and perceived managerial discretion, but the indirect effect via perceived discretion was non-significant, which methodological limitation most plausibly explains the mediation failure?\nA: Reliance on a regional sample that limits generalizability of mediation findings\nB: Use of cross-sectional survey data that prevents establishing temporal precedence\nC: Potential multicollinearity between strategic PMS use and managerial discretion constructs\nD: Small-sample bias inherent in PLS estimation undermining indirect effect detection\nExplanation: Mediation analysis requires temporal ordering to establish causality; cross-sectional designs cannot confirm that changes in managerial discretion occur prior to process improvements, making indirect effects difficult to detect.\nCorrect Answer: B\n</output_format>",
    "question": "In a study where strategic use of PMS significantly predicted both process improvements and perceived managerial discretion, but the indirect effect via perceived discretion was non-significant, which methodological limitation most plausibly explains the mediation failure?",
    "choices": {
      "A": "Reliance on a regional sample that limits generalizability of mediation findings",
      "B": "Use of cross-sectional survey data that prevents establishing temporal precedence",
      "C": "Potential multicollinearity between strategic PMS use and managerial discretion constructs",
      "D": "Small-sample bias inherent in PLS estimation undermining indirect effect detection"
    },
    "answer": "B",
    "explanation": "Mediation analysis requires temporal ordering to establish causality; cross-sectional designs cannot confirm that changes in managerial discretion occur prior to process improvements, making indirect effects difficult to detect.",
    "question_token_count": 42,
    "answer_correctness_score": 10,
    "explanation_validity_score": 10,
    "question_clarity_score": 7,
    "question_difficulty_score": 8,
    "question_groundedness_score": 10,
    "avg_answer_token_count": 13
  },
  {
    "context": "The use of open access endoscopy is increasing. Its effect on the adequacy of patient informed consent, procedure acceptance and the impact on subsequent communication/transfer of procedure results to the patient have not been evaluated. The aim of our study was to compare the extent of preknowledge of procedures and test explanation, patient medical complexity, information transfer and overall patient satisfaction between a patient group referred for outpatient open access endoscopy versus a patient group from a gastrointestinal (GI) subspecialty clinic.\n\nInformation was obtained from all patients presenting for outpatient upper and lower endoscopy by using a 1-page questionnaire. Patients from the two groups who had an outpatient upper/lower endoscopic procedure were contacted by phone after the procedure to obtain information with a standardized questionnaire.\n\nThe open access patients reported receiving significantly less information to help them identify the procedure (p<0.01) and less explanation concerning the nature of the procedure than the group of patients referred from the subspecialty clinic (p<0.005). There was no difference between the two groups in satisfaction scores for examinations performed under conscious sedation. For flexible sigmoidoscopy without sedation, however, the GI clinic patient group were more satisfied with their procedure. The majority of patients, regardless of access, were more likely to receive endoscopic results from a gastroenterologist than the referring physician. Furthermore, the patients in the GI clinic group who underwent colonoscopy felt significantly better at follow-up.\n\n",
    "topic": "Ethical considerations in patient consent and communication pathways when bypassing specialist consultations in endoscopy referral.",
    "response": "<document_analysis>\nThe context compares open access endoscopy (limited pre-procedure explanation) versus GI clinic referral (comprehensive explanation), noting equivalent satisfaction under conscious sedation despite significant differences in information provision. This suggests sedation may obscure memory of inadequate explanations. No irrelevant content detected.\nDifficulty rating: 8/10\u2014requires integration of informed consent principles with effects of sedation on patient perception.\n</document_analysis>\n\n<output_format>\nQuestion: After finding that patients with limited pre-procedure explanation reported satisfaction scores equivalent to well-informed patients when procedures were performed under conscious sedation, which inference best explains this paradox?\nA: Conscious sedation fosters a placebo-like trust that compensates for inadequate patient education.\nB: Amnestic effects of sedation diminish recall of poor explanations, equalizing satisfaction.\nC: Sedation improves physiological comfort so strongly that educational deficits become irrelevant.\nD: Similar satisfaction indicates that informed consent quality has no impact once sedation is achieved.\nExplanation: Sedation\u2019s memory-impairing properties can mask patients\u2019 awareness of inadequate explanations, thus leading to similar satisfaction despite differing consent quality.\nCorrect Answer: B\n</output_format>",
    "question": "After finding that patients with limited pre-procedure explanation reported satisfaction scores equivalent to well-informed patients when procedures were performed under conscious sedation, which inference best explains this paradox?",
    "choices": {
      "A": "Conscious sedation fosters a placebo-like trust that compensates for inadequate patient education.",
      "B": "Amnestic effects of sedation diminish recall of poor explanations, equalizing satisfaction.",
      "C": "Sedation improves physiological comfort so strongly that educational deficits become irrelevant.",
      "D": "Similar satisfaction indicates that informed consent quality has no impact once sedation is achieved."
    },
    "answer": "B",
    "explanation": "Sedation\u2019s memory-impairing properties can mask patients\u2019 awareness of inadequate explanations, thus leading to similar satisfaction despite differing consent quality.",
    "question_token_count": 34,
    "answer_correctness_score": 10,
    "explanation_validity_score": 10,
    "question_clarity_score": 7,
    "question_difficulty_score": 6,
    "question_groundedness_score": 10,
    "avg_answer_token_count": 16
  },
  {
    "context": "To determine the ability of early sonogram to predict the presentation of twin A at birth.\n\nA retrospective cohort study was conducted on all twin pregnancies evaluated at our Fetal Evaluation Unit from 2007 to 2009. Sonogram records were reviewed for the presentation of twin A at seven gestational age intervals and inpatient medical records were reviewed for the presentation of twin A at delivery. The positive predictive value, sensitivity, and specificity of presentation as determined by ultrasound, at each gestational age interval, for the same presentation at delivery were calculated.\n\nTwo hundred and thirty-eight twin pregnancies met inclusion criteria. A total of 896 ultrasounds were reviewed. The positive predictive value of cephalic presentation of twin A as determined by ultrasound for the persistence of cephalic presentation at delivery reached 95% after 28 weeks gestation. The positive predictive value for noncephalic presentation as established by sonogram for noncephalic at delivery was>90% after 32 weeks gestation.\n\n",
    "topic": "The implications of >90% PPV for noncephalic presentation established by ultrasound after 32 weeks gestation.",
    "response": "<document_analysis>\nThe context describes a study quantifying how reliably ultrasound at various gestational ages predicts twin A\u2019s presentation at delivery, notably that a noncephalic finding after 32 weeks has a >90% positive predictive value for remaining noncephalic. This implies that once a noncephalic position is identified late in gestation, it will very likely persist, which has direct management implications for delivery planning in twin pregnancies. An expert-level question should probe how this diagnostic reliability should influence clinical decision-making, specifically regarding mode of delivery, balancing risks and best practices for twins. Difficulty is calibrated at 8/10, requiring knowledge of twin delivery recommendations, the significance of PPV in clinical planning, and contraindications for version maneuvers in multiples.\n</document_analysis>\n\n<output_format>\nQuestion: Given that ultrasound identification of twin A in a noncephalic presentation after 32 weeks gestation has a >90% positive predictive value for persisting in that presentation at delivery, which management strategy most appropriately leverages this diagnostic certainty?\nA: Attempt external cephalic version to convert to cephalic and permit vaginal delivery\nB: Proceed with planned cesarean delivery to mitigate risks associated with a persistent noncephalic presentation\nC: Continue expectant management until 37 weeks in hopes of spontaneous version before deciding mode of delivery\nD: Schedule induction of labor at term with the expectation that uterine contractions might promote version\nExplanation: A noncephalic twin A after 32 weeks will almost certainly remain non-cephalic, and external version is not recommended in twin gestations; expecting spontaneous version or induction does not overcome the high persistence rate, so planning cesarean is most appropriate.\nCorrect Answer: B\n</output_format>",
    "question": "Given that ultrasound identification of twin A in a noncephalic presentation after 32 weeks gestation has a >90% positive predictive value for persisting in that presentation at delivery, which management strategy most appropriately leverages this diagnostic certainty?",
    "choices": {
      "A": "Attempt external cephalic version to convert to cephalic and permit vaginal delivery",
      "B": "Proceed with planned cesarean delivery to mitigate risks associated with a persistent noncephalic presentation",
      "C": "Continue expectant management until 37 weeks in hopes of spontaneous version before deciding mode of delivery",
      "D": "Schedule induction of labor at term with the expectation that uterine contractions might promote version"
    },
    "answer": "B",
    "explanation": "A noncephalic twin A after 32 weeks will almost certainly remain non-cephalic, and external version is not recommended in twin gestations; expecting spontaneous version or induction does not overcome the high persistence rate, so planning cesarean is most appropriate.",
    "question_token_count": 46,
    "answer_correctness_score": 10,
    "explanation_validity_score": 10,
    "question_clarity_score": 8,
    "question_difficulty_score": 9,
    "question_groundedness_score": 10,
    "avg_answer_token_count": 17
  },
  {
    "context": "Sulfasalazine is a widely used anti-inflammatory agent in the treatment of inflammatory bowel disease and several rheumatological disorders. Although as many as 20% of treated patients may experience reversible, dose-dependent side effects, less frequent but potentially severe, systemic reactions have also been reported.\n\nA severe systemic reaction to sulfasalazine developed in a 21-year old female with rheumatoid arthritis characterized by eosinophilia, granulomatous enteritis and myelotoxicity, cholestatic hepatitis, and seizures. The clinical course and management of this patient are presented as well as a review of the incidence and outcome of severe systemic reactions to sulfasalazine.\n\n",
    "topic": "Recommendations for monitoring protocols and preventive measures to detect early signs of sulfasalazine toxicity.",
    "response": "<document_analysis>\nThe context outlines sulfasalazine\u2019s common reversible side effects and its rare but severe toxicities\u2014specifically eosinophilia, myelotoxicity, cholestatic hepatitis, and granulomatous enteritis\u2014highlighting the need for early detection via laboratory monitoring. This information supports constructing a question about which tests best capture these serious adverse events. \nDifficulty rating: 6/10\u2014requires integration of the listed toxicities into an appropriate monitoring strategy.\n</document_analysis>\n\n<output_format>\nQuestion: Which baseline and periodic laboratory tests are most critical for early detection of sulfasalazine\u2019s severe toxicities such as myelotoxicity and cholestatic hepatitis?\nA: Complete blood count with differential and liver function tests\nB: Erythrocyte sedimentation rate and C\u2011reactive protein\nC: Serum creatinine and urinalysis\nD: Serum sulfasalazine concentration assay\nExplanation: Monitoring for drops in blood cell counts (myelotoxicity) and elevations in liver enzymes (cholestatic hepatitis) requires regular CBC with differential and LFTs.\nCorrect Answer: A\n</output_format>",
    "question": "Which baseline and periodic laboratory tests are most critical for early detection of sulfasalazine\u2019s severe toxicities such as myelotoxicity and cholestatic hepatitis?",
    "choices": {
      "A": "Complete blood count with differential and liver function tests",
      "B": "Erythrocyte sedimentation rate and C\u2011reactive protein",
      "C": "Serum creatinine and urinalysis",
      "D": "Serum sulfasalazine concentration assay"
    },
    "answer": "A",
    "explanation": "Monitoring for drops in blood cell counts (myelotoxicity) and elevations in liver enzymes (cholestatic hepatitis) requires regular CBC with differential and LFTs.",
    "question_token_count": 33,
    "answer_correctness_score": 10,
    "explanation_validity_score": 10,
    "question_clarity_score": 9,
    "question_difficulty_score": 8,
    "question_groundedness_score": 2,
    "avg_answer_token_count": 10
  },
  {
    "context": "Sulfasalazine is a widely used anti-inflammatory agent in the treatment of inflammatory bowel disease and several rheumatological disorders. Although as many as 20% of treated patients may experience reversible, dose-dependent side effects, less frequent but potentially severe, systemic reactions have also been reported.\n\nA severe systemic reaction to sulfasalazine developed in a 21-year old female with rheumatoid arthritis characterized by eosinophilia, granulomatous enteritis and myelotoxicity, cholestatic hepatitis, and seizures. The clinical course and management of this patient are presented as well as a review of the incidence and outcome of severe systemic reactions to sulfasalazine.\n\n",
    "topic": "Immunological mechanisms and laboratory features of sulfasalazine-induced eosinophilia.",
    "response": "<document_analysis>\nThe context describes a severe systemic reaction to sulfasalazine featuring eosinophilia, granulomatous enteritis, hepatitis, and seizures. Such presentations reflect an immunologically mediated drug hypersensitivity rather than simple dose-dependent toxicity. Key features include eosinophilic tissue infiltration and multi\u2010organ involvement, hallmarks of a Type IVb (Th2/eosinophil\u2010driven) delayed hypersensitivity. Distinct hypersensitivity types (I\u2013IV) provide an appropriate framework for challenging domain experts to identify the mechanism linking drug exposure to eosinophil\u2010predominant pathology.\nDifficulty Rating: 8/10\n</document_analysis>\n\n<output_format>\nQuestion: Which hypersensitivity mechanism best explains sulfasalazine\u2010induced systemic eosinophilia with granulomatous enteritis, cholestatic hepatitis, and seizures?\nA: Type I immediate hypersensitivity, IgE\u2010mediated mast cell degranulation  \nB: Type II cytotoxic hypersensitivity, antibody\u2010mediated cell lysis  \nC: Type III immune complex hypersensitivity, complement activation  \nD: Type IVb delayed hypersensitivity, Th2 cytokine\u2013driven eosinophilic inflammation  \nExplanation: The presence of prominent eosinophilia and Th2 cytokines driving tissue infiltration defines Type IVb delayed hypersensitivity.  \nCorrect Answer: D\n</output_format>",
    "question": "Which hypersensitivity mechanism best explains sulfasalazine\u2010induced systemic eosinophilia with granulomatous enteritis, cholestatic hepatitis, and seizures?",
    "choices": {
      "A": "Type I immediate hypersensitivity, IgE\u2010mediated mast cell degranulation",
      "B": "Type II cytotoxic hypersensitivity, antibody\u2010mediated cell lysis",
      "C": "Type III immune complex hypersensitivity, complement activation",
      "D": "Type IVb delayed hypersensitivity, Th2 cytokine\u2013driven eosinophilic inflammation"
    },
    "answer": "D",
    "explanation": "The presence of prominent eosinophilia and Th2 cytokines driving tissue infiltration defines Type IVb delayed hypersensitivity.",
    "question_token_count": 32,
    "answer_correctness_score": 10,
    "explanation_validity_score": 10,
    "question_clarity_score": 6,
    "question_difficulty_score": 9,
    "question_groundedness_score": 4,
    "avg_answer_token_count": 14
  },
  {
    "context": "Several single nucleotide polymorphisms (SNPs) at different loci have been associated with breast cancer susceptibility, accounting for around 10% of the familial component. Recent studies have found direct associations between specific SNPs and breast cancer in BRCA1/2 mutation carriers. Our aim was to determine whether validated susceptibility SNP scores improve the predictive ability of risk models in comparison/conjunction to other clinical/demographic information.\n\nFemale BRCA1/2 carriers were identified from the Manchester genetic database, and included in the study regardless of breast cancer status or age. DNA was extracted from blood samples provided by these women and used for gene and SNP profiling. Estimates of survival were examined with Kaplan-Meier curves. Multivariable Cox proportional hazards models were fit in the separate BRCA datasets and in menopausal stages screening different combinations of clinical/demographic/genetic variables. Nonlinear random survival forests were also fit to identify relevant interactions. Models were compared using Harrell's concordance index (1 - c-index).\n\n548 female BRCA1 mutation carriers and 523 BRCA2 carriers were identified from the database. Median Kaplan-Meier estimate of survival was 46.0 years (44.9-48.1) for BRCA1 carriers and 48.9 (47.3-50.4) for BRCA2. By fitting Cox models and random survival forests, including both a genetic SNP score and clinical/demographic variables, average 1 - c-index values were 0.221 (st.dev. 0.019) for BRCA1 carriers and 0.215 (st.dev. 0.018) for BRCA2 carriers.\n\n",
    "topic": "Calculation, meaning, and clinical implications of Harrell\u2019s concordance index (1 \u2013 c\u2011index) in model performance comparison",
    "response": "<document_analysis>\nThe context describes using Harrell\u2019s concordance index (reported as 1 \u2013 c\u2011index) to compare survival prediction models (Cox vs random survival forest) in BRCA1/2 mutation carriers, with 1\u2011c\u2011index values around 0.221 and 0.215. Central themes include interpretation of 1\u2011c\u2011index relative to c\u2011index (concordance rate), implications for model discrimination, and potential misinterpretations (e.g., confusing 1\u2011c\u2011index with misclassification or binary accuracy). A deep question can probe the expert\u2019s ability to correctly infer c\u2011index performance from 1\u2011c\u2011index and avoid common pitfalls in interpreting survival model metrics. Difficulty is calibrated high (8/10).\n</document_analysis>\n\n<output_format>\nQuestion: A survival model yields an average 1 \u2013 c\u2011index of 0.221 for BRCA1 mutation carriers. Which interpretation most accurately describes its discriminative performance?\nA: The model misorders roughly 78% of subject\u2010time pairs, indicating poor discrimination.\nB: The model correctly ranks event times in about 78% of comparable pairs, indicating moderate discrimination.\nC: Approximately 22% of individual binary event predictions are correctly classified by the model.\nD: The reported 1 \u2013 c\u2011index value equals the model\u2019s Brier score, reflecting overall prediction error.\nExplanation: A 1 \u2013 c\u2011index of 0.221 implies a c\u2011index of 0.779, so about 78% of all comparable pairs are correctly ordered by the model; 1\u2011c\u2011index is not equivalent to Brier score or binary accuracy.\nCorrect Answer: B\n</output_format>",
    "question": "A survival model yields an average 1 \u2013 c\u2011index of 0.221 for BRCA1 mutation carriers. Which interpretation most accurately describes its discriminative performance?",
    "choices": {
      "A": "The model misorders roughly 78% of subject\u2010time pairs, indicating poor discrimination.",
      "B": "The model correctly ranks event times in about 78% of comparable pairs, indicating moderate discrimination.",
      "C": "Approximately 22% of individual binary event predictions are correctly classified by the model.",
      "D": "The reported 1 \u2013 c\u2011index value equals the model\u2019s Brier score, reflecting overall prediction error."
    },
    "answer": "B",
    "explanation": "A 1 \u2013 c\u2011index of 0.221 implies a c\u2011index of 0.779, so about 78% of all comparable pairs are correctly ordered by the model; 1\u2011c\u2011index is not equivalent to Brier score or binary accuracy.",
    "question_token_count": 35,
    "answer_correctness_score": 10,
    "explanation_validity_score": 10,
    "question_clarity_score": 8,
    "question_difficulty_score": 7,
    "question_groundedness_score": 10,
    "avg_answer_token_count": 20
  },
  {
    "context": "To assess the relationship between the experience of pediatric housestaff and tests ordered on infants in the neonatal intensive care unit (ICU).\n\nProspective, cohort study over one full academic year.\n\nOne academic Level III neonatal intensive care nursery.\n\nData were collected prospectively on all 785 infants admitted to the neonatal ICU from July 1993 to June 1994. These infants were cared for by 14 different categorical pediatric housestaff.\n\nOur neonatal ICU has either a resident or an intern on-call by himself/herself at night, affording us a natural setting to compare intern vs. resident test ordering. The outcomes of interest were number of arterial blood gases, radiographs, and electrolytes ordered per infant by the on-call pediatric houseofficer, as tabulated the morning after the call night. Control variables included the severity-of-illness of the individual infant (using the Neonatal Therapeutic Intervention Scoring System), the workload of the houseofficer (number of patients, number of admissions), and supervision (rounding frequency and on-call attending). Controlling for the severity-of-illness of the infant, the workload on the call night, and supervision with multiple linear regression, we found that interns ordered significantly (p = .02) greater numbers of arterial blood gases per infant than residents, amounting to some 0.33 blood gases per infant per call night (3.22 vs. 2.89 arterial blood gases per infant per night). This increase of 0.33 blood gases per infant amounts to interns ordering $169 more arterial blood gases per call night at our institution. There was no difference between interns and residents in ordering radiographs or electrolytes.\n\n",
    "topic": "Ethical considerations balancing trainee autonomy, supervision levels, and patient safety in neonatal research.",
    "response": "<document_analysis>\nThe context describes a prospective cohort study comparing the number of arterial blood gases, radiographs, and electrolytes ordered by interns versus residents in a Level\u00a0III neonatal ICU. Interns, with less experience and potentially less supervision, ordered significantly more arterial blood gases per infant (3.22 vs. 2.89), incurring higher cost and exposing infants to more invasive procedures. The central theme involves balancing trainee autonomy and supervision intensity against patient safety and risk of harm due to overtesting. This raises nuanced ethical implications regarding which principles justify adjusting supervision to curb unnecessary procedures while preserving learning opportunities.\nDifficulty rating: 8/10 \u2013 requires expert-level understanding of medical ethics principles (beneficence vs. non-maleficence, autonomy, justice) and how they apply in clinical training settings.\n</document_analysis>\n\n<output_format>\nQuestion: When calibrating supervision to reduce unnecessary arterial blood gas sampling by less experienced pediatric trainees\u2014without fully removing their clinical autonomy\u2014which ethical principle primarily underpins the need to prevent potential harm from these invasive procedures?\nA: Beneficence, by promoting overall patient well-being through enhanced trainee education\nB: Non-maleficence, by avoiding harm through limiting unwarranted arterial blood gas draws\nC: Justice, by ensuring fair distribution of procedural opportunities among all trainees\nD: Respect for autonomy, by empowering trainees with full decision-making authority\nExplanation: The non-maleficence principle mandates minimizing harm to patients by curbing unnecessary invasive testing, even while preserving trainees\u2019 educational opportunities.\nCorrect Answer: B\n</output_format>",
    "question": "When calibrating supervision to reduce unnecessary arterial blood gas sampling by less experienced pediatric trainees\u2014without fully removing their clinical autonomy\u2014which ethical principle primarily underpins the need to prevent potential harm from these invasive procedures?",
    "choices": {
      "A": "Beneficence, by promoting overall patient well-being through enhanced trainee education",
      "B": "Non-maleficence, by avoiding harm through limiting unwarranted arterial blood gas draws",
      "C": "Justice, by ensuring fair distribution of procedural opportunities among all trainees",
      "D": "Respect for autonomy, by empowering trainees with full decision-making authority"
    },
    "answer": "B",
    "explanation": "The non-maleficence principle mandates minimizing harm to patients by curbing unnecessary invasive testing, even while preserving trainees\u2019 educational opportunities.",
    "question_token_count": 41,
    "answer_correctness_score": 10,
    "explanation_validity_score": 10,
    "question_clarity_score": 6,
    "question_difficulty_score": 8,
    "question_groundedness_score": 4,
    "avg_answer_token_count": 15
  },
  {
    "context": "Prostate-specific antigen (PSA) levels can show wide fluctuations when repeatedly measured. Here we investigatewd if: (a) biopsy timing influences the prostate cancer (PC) detection rate in patients with fluctuating PSA (flu-PSA) in comparison with patients with steadily increasing PSA (si-PSA); (b) PSA slope estimated in patients with flu-PSA predicts a different risk of cancer detection; (c) flu-PSA and si-PSA patients develop PC in topographically different sites; (d) the behaviour of pre-operative PSA is an expression of a disease with defferent characteristics to the following radical prostatectomy.\n\nThe study involved 211 patients who underwent at least a second biopsy after a first negative prostate biopsy. PSA Slope, PSA velocity (PSAV) and PSA doubling time (PSADT) were estimated. Flu-PSA level was defined as a PSA series with at least one PSA value lower than the one immediately preceding it.\n\n82 patients had flu-PSA levels and 129 si-PSA levels. There were no significant differences between the two groups in terms of cancer detection, clinical or pathological stage, but the si-PSA group with cancer had a higher Gleason score. No difference was found for PSA Slope between flu-PSA patients with cancer and those without.\n\n",
    "topic": "Statistical significance testing and potential confounders in comparing cancer detection and staging across PSA pattern groups.",
    "response": "<document_analysis>\nThe context describes a comparison between patients with fluctuating PSA (flu-PSA) and steadily increasing PSA (si-PSA) patterns, noting no significant differences in cancer detection rates or stages but a higher Gleason score in the si-PSA cancer subgroup. It also reports that PSA slope did not differ between flu-PSA patients with and without cancer. Key nuances include the implications of PSA slope estimation in the presence of fluctuations and the assumptions underlying its predictive utility. Generating a question about why PSA slope fails to discriminate cancer status in flu-PSA patients probes a deep understanding of PSA kinetics modeling and its statistical limitations.\nDifficulty Rating: 8/10\n</document_analysis>\n\n<output_format>\nQuestion: Which limitation inherent to PSA slope estimation most plausibly explains its failure to distinguish between cancerous and non\u2011cancerous cases in patients with fluctuating PSA levels?\nA: The slope calculation presumes a consistently increasing trend, so intermittent declines violate its core assumption.\nB: It disproportionately weights early PSA measurements, making later fluctuations negligible.\nC: It equates PSA velocity with doubling time, conflating two distinct kinetic measures.\nD: It is directly influenced by Gleason score, thus masking true PSA dynamics.\nExplanation: PSA slope relies on fitting a linear increase over time; when PSA levels dip, this breaks the monotonic assumption and degrades predictive accuracy.\nCorrect Answer: A\n</output_format>",
    "question": "Which limitation inherent to PSA slope estimation most plausibly explains its failure to distinguish between cancerous and non\u2011cancerous cases in patients with fluctuating PSA levels?",
    "choices": {
      "A": "The slope calculation presumes a consistently increasing trend, so intermittent declines violate its core assumption.",
      "B": "It disproportionately weights early PSA measurements, making later fluctuations negligible.",
      "C": "It equates PSA velocity with doubling time, conflating two distinct kinetic measures.",
      "D": "It is directly influenced by Gleason score, thus masking true PSA dynamics."
    },
    "answer": "A",
    "explanation": "PSA slope relies on fitting a linear increase over time; when PSA levels dip, this breaks the monotonic assumption and degrades predictive accuracy.",
    "question_token_count": 32,
    "answer_correctness_score": 10,
    "explanation_validity_score": 10,
    "question_clarity_score": 7,
    "question_difficulty_score": 8,
    "question_groundedness_score": 10,
    "avg_answer_token_count": 16
  },
  {
    "context": "Among patients with acute stroke symptoms, delay in hospital admission is the main obstacle for the use of thrombolytic therapy and other interventions associated with decreased mortality and disability. The primary aim of this study was to assess whether an elderly clinical population correctly endorsed the response to call for emergency services when presented with signs and symptoms of stroke using a standardized questionnaire.\n\nWe performed a cross-sectional study among elderly out-patients (\u226560 years) in Buenos Aires, Argentina randomly recruited from a government funded health clinic. The correct endorsement of intention to call 911 was assessed with the Stroke Action Test and the cut-off point was set at \u226575%. Knowledge of stroke and clinical and socio-demographic indicators were also collected and evaluated as predictors of correct endorsement using logistic regression.\n\nAmong 367 elderly adults, 14% correctly endorsed intention to call 911. Presented with the most typical signs and symptoms, only 65% reported that they would call an ambulance. Amaurosis Fugax was the symptom for which was called the least (15%). On average, the correct response was chosen only 37% of the time. Compared to lower levels of education, higher levels were associated to correctly endorsed intention to call 911 (secondary School adjusted OR 3.53, 95% CI 1.59-7.86 and Tertiary/University adjusted OR 3.04, 95% CI 1.12-8.21).\n\n",
    "topic": "Collection and role of socio-demographic variables and stroke knowledge as predictors in the logistic regression model.",
    "response": "<document_analysis>\nThe context describes a logistic regression analysis assessing predictors (including levels of education) of elderly patients\u2019 correct intention to call emergency services when presented with stroke symptoms. Key data points include adjusted odds ratios for secondary education (OR\u00a03.53, 95%\u00a0CI\u00a01.59\u20137.86) and tertiary/university education (OR\u00a03.04, 95%\u00a0CI\u00a01.12\u20138.21) compared to lower education levels. Notably, the tertiary level OR is slightly lower than that for secondary, and their confidence intervals overlap, raising questions about monotonicity in the effect of increasing education. A probing question would require interpreting these ORs and CIs to evaluate the nature of the education\u2013response relationship without assuming a simple dose-response effect.\n</document_analysis>\n\n<output_format>\nQuestion: Considering the adjusted odds ratios of 3.53 (95%\u00a0CI\u00a01.59\u20137.86) for secondary education and 3.04 (95%\u00a0CI\u00a01.12\u20138.21) for tertiary/university education in predicting correct intention to call emergency services for stroke symptoms, which conclusion about the effect of education level is most justified?\nA: A clear dose-response relationship exists, with tertiary education conferring the greatest increase in odds.\nB: Secondary education appears to confer a slightly greater increase in odds than tertiary, though both are statistically significant, indicating no strict monotonic trend.\nC: Only tertiary education reaches statistical significance as a predictor after adjustment.\nD: The overlapping confidence intervals render any inference about the role of education levels invalid.\nExplanation: Both secondary and tertiary education levels are significantly associated with increased odds versus lower education, but the tertiary OR is slightly lower and CIs overlap, so there is no clear monotonic increase with each higher education level.\nCorrect Answer: B\n</output_format>",
    "question": "Considering the adjusted odds ratios of 3.53 (95%\u00a0CI\u00a01.59\u20137.86) for secondary education and 3.04 (95%\u00a0CI\u00a01.12\u20138.21) for tertiary/university education in predicting correct intention to call emergency services for stroke symptoms, which conclusion about the effect of education level is most justified?",
    "choices": {
      "A": "A clear dose-response relationship exists, with tertiary education conferring the greatest increase in odds.",
      "B": "Secondary education appears to confer a slightly greater increase in odds than tertiary, though both are statistically significant, indicating no strict monotonic trend.",
      "C": "Only tertiary education reaches statistical significance as a predictor after adjustment.",
      "D": "The overlapping confidence intervals render any inference about the role of education levels invalid."
    },
    "answer": "B",
    "explanation": "Both secondary and tertiary education levels are significantly associated with increased odds versus lower education, but the tertiary OR is slightly lower and CIs overlap, so there is no clear monotonic increase with each higher education level.",
    "question_token_count": 76,
    "answer_correctness_score": 10,
    "explanation_validity_score": 9,
    "question_clarity_score": 8,
    "question_difficulty_score": 7,
    "question_groundedness_score": 10,
    "avg_answer_token_count": 18
  },
  {
    "context": "The purpose of this study was to determine whether there is an association between skewed X-inactivation and recurrent spontaneous abortion in a large, well-defined sample of women with recurrent loss.\n\nX-chromosome inactivation patterns were compared in 5 groups of women. Group 1 (recurrent spontaneous abortion) consisted of 357 women with 2 or more spontaneous losses. In group 2 (infertility), there were 349 subjects from infertility practices recruited at the time of a positive serum beta-human chorionic gonadotropin. Group 3 (spontaneous abortion) women (n = 81) were recruited at the time of an ultrasound diagnosis of an embryonic demise or an anembryonic gestation. Groups 4 (primiparous) and 5 (multiparous) were healthy pregnant subjects previously enrolled in another study to determine the incidence and cause of pregnancy complications, such as preeclampsia and intrauterine growth restriction. The Primiparous group included 114 women in their first pregnancy, whereas the Multiparous group consisted of 79 women with 2 or more pregnancies but without pregnancy loss.\n\nThe rate of extreme skewing (90% or greater) in the recurrent spontaneous abortion population was 8.6%, and not statistically different from any of the other groups, except the Primiparous group (1.0%, P<.01). The incidence of X-inactivation skewing of 90% or greater was no different whether there had been at least 1 live birth (9.9%), or no previous live births and at least 3 losses (5.6%, P>.05). When age and skewing of 90% or greater are compared, subjects with extreme skewing have a mean age of 2 years older than those without extreme skewing (P<.05).\n\n",
    "topic": "The criteria for defining extreme XCI skewing (\u226590%) and the laboratory methods commonly used to assess XCI patterns in peripheral blood samples.",
    "response": "<document_analysis>\nThe context describes a study comparing rates of extreme X-chromosome inactivation (XCI) skewing\u2014defined as \u226590%\u2014across five groups of women with different reproductive histories. It reports percentages, P-values, and an age difference related to extreme skewing. While laboratory methods are not detailed, the data allow formulation of a high-level question about interpreting the statistical comparisons (percentages and significance levels) linking XCI skewing to reproductive outcomes and age. I will focus on extracting and contrasting those findings to create a challenging question requiring nuanced interpretation of P-values and incidence rates.\n</document_analysis>\n\n<output_format>\nQuestion: Which of the following findings best demonstrates that prior live\u2010birth history does not significantly affect the incidence of extreme X\u2011chromosome inactivation skewing?\nA: A comparison of 8.6% skewing in women with recurrent loss versus 1.0% in primiparous women (P<.01)\nB: A comparison of 9.9% skewing in women with at least one live birth versus 5.6% in women with no live births and \u22653 losses (P>.05)\nC: The observation that rates in the recurrent loss group did not differ significantly from infertility patients\nD: The finding that women with extreme skewing were on average 2 years older than those without (P<.05)\nExplanation: Only the 9.9% versus 5.6% comparison with P>.05 indicates no significant effect of live\u2010birth history on extreme XCI skewing.\nCorrect Answer: B\n</output_format>",
    "question": "Which of the following findings best demonstrates that prior live\u2010birth history does not significantly affect the incidence of extreme X\u2011chromosome inactivation skewing?",
    "choices": {
      "A": "A comparison of 8.6% skewing in women with recurrent loss versus 1.0% in primiparous women (P<.01)",
      "B": "A comparison of 9.9% skewing in women with at least one live birth versus 5.6% in women with no live births and \u22653 losses (P>.05)",
      "C": "The observation that rates in the recurrent loss group did not differ significantly from infertility patients",
      "D": "The finding that women with extreme skewing were on average 2 years older than those without (P<.05)"
    },
    "answer": "B",
    "explanation": "Only the 9.9% versus 5.6% comparison with P>.05 indicates no significant effect of live\u2010birth history on extreme XCI skewing.",
    "question_token_count": 31,
    "answer_correctness_score": 10,
    "explanation_validity_score": 10,
    "question_clarity_score": 8,
    "question_difficulty_score": 6,
    "question_groundedness_score": 10,
    "avg_answer_token_count": 29
  },
  {
    "context": "Chronic low back pain (CLBP) is often accompanied by an abnormal motor performance. However, it has not been clarified yet whether these deviations also occur during motor tasks not involving the back and whether the performance is influenced by pain and pain-related cognitions. Therefore, the aim of the present study is to get insight in the contribution of both pain experience and pain-related cognitions to general motor task performance in CLBP.\n\n13 CLBP patients and 15 healthy subjects performed a hand-function task in three conditions: sitting, lying prone (lying) and lying prone without trunk support (provoking). The last condition was assumed to provoke pain-related cognitions, which was considered successful when a patients' pain expectancy on a numeric rating scale was at least 1 point higher than actual pain experienced. Subjects' performance was expressed in reaction time and movement time. Repeated measures analysis of variance was performed to detect main effect for group and condition. Special interest was given to group*condition interaction, since significant interaction would indicate that patients and healthy subjects performed differently throughout the three conditions.\n\nPatients were slower throughout all conditions compared to healthy subjects. With respect to the provoking condition, patients showed deteriorated performance compared to lying while healthy subjects' performance remained equal between these two conditions. Further analysis of patients' data showed that provocation was successful in 54% of the patients. Especially this group showed deteriorated performance in the provoking condition.\n\n",
    "topic": "Discuss how pain expectancy, independent of actual pain experience, may modulate motor control processes in chronic pain populations.",
    "response": "<document_analysis>\nThe context describes a study investigating how pain experience and pain-related cognitions affect motor task performance in CLBP patients using a hand-function task under three conditions. A key finding is that patients whose pain expectancy exceeded their actual pain by at least one point (successful provocation) showed additional deterioration in reaction and movement times in the provoking condition, despite no increase in actual pain. This isolates the influence of pain-related cognition (expectancy) on motor control. The critical nuance is that motor deficits were amplified by cognitive expectancy independently of nociceptive input. This interaction effect (group*condition) and the operational definition of provocation success form the basis for a deep question probing the mechanism by which expectancy modulates performance.\nDifficulty rating: 8/10\n</document_analysis>\n\n<output_format>\nQuestion: Which finding most directly demonstrates that pain expectancy, rather than actual pain intensity, drove the additional motor performance impairment in the provoking condition?\nA: Only those patients whose expected pain exceeded actual pain by at least one point showed further slowing, despite unchanged actual pain.\nB: All CLBP patients exhibited equal deterioration in reaction and movement times under provoking regardless of expectancy ratings.\nC: Healthy subjects reported higher pain expectancy but did not show any change in hand-function task performance.\nD: Actual pain ratings increased significantly in the provoking condition for all patients, confirming heightened nociceptive drive.\nExplanation: The selective performance decline in patients with provocation success (expectancy > actual pain by \u22651 point) indicates cognitive expectancy, not nociceptive input, drove the impairment.\nCorrect Answer: A\n</output_format>",
    "question": "Which finding most directly demonstrates that pain expectancy, rather than actual pain intensity, drove the additional motor performance impairment in the provoking condition?",
    "choices": {
      "A": "Only those patients whose expected pain exceeded actual pain by at least one point showed further slowing, despite unchanged actual pain.",
      "B": "All CLBP patients exhibited equal deterioration in reaction and movement times under provoking regardless of expectancy ratings.",
      "C": "Healthy subjects reported higher pain expectancy but did not show any change in hand-function task performance.",
      "D": "Actual pain ratings increased significantly in the provoking condition for all patients, confirming heightened nociceptive drive."
    },
    "answer": "A",
    "explanation": "The selective performance decline in patients with provocation success (expectancy > actual pain by \u22651 point) indicates cognitive expectancy, not nociceptive input, drove the impairment.",
    "question_token_count": 28,
    "answer_correctness_score": 10,
    "explanation_validity_score": 10,
    "question_clarity_score": 6,
    "question_difficulty_score": 8,
    "question_groundedness_score": 10,
    "avg_answer_token_count": 21
  },
  {
    "context": "There are various causes of halitosis, one of which is chronic renal failure. The objective of this study was to investigate halitosis levels in end-stage renal disease (ESRD) patients before and after peritoneal dialysis (PD) therapy.\n\n42 subjects with ESRD were included in this study. The presence of halitosis was assessed using an organoleptic measurement and compared with blood urea nitrogen (BUN) levels and salivary flow rates. Decayed, missing, and filled teeth (DMFT) index and Community Periodontal Index (CPI) were calculated. All measurements were done before and after patients had received 3 months of PD therapy.\n\nMean serum BUN level was found to be lower (46.05 \u00b1 13.30 vs 91.24 \u00b1 31.28 mg/dL), salivary flow rate higher (0.34 \u00b1 0.07 vs 0.26 \u00b1 0.04 mL/minute), and halitosis level lower (2.39 \u00b1 0.60 vs 3.90 \u00b1 0.37) at the end of 3 months of PD therapy than at the beginning of PD therapy. There was no significant difference in CPI or DMFT index before and after PD therapy (p>0.05). There was statistically significant positive correlation between the presence of halitosis and BUN levels (r = 0.702, p = 0.001 before PD; r = 0.45, p = 0.002 after PD) and a negative correlation between the presence of halitosis and salivary flow rates (r = -0.69, p = 0.000 before PD; r = -0.37, p = 0.01 after PD).\n\n",
    "topic": "Investigate the psychosocial and quality-of-life impacts of halitosis improvement on ESRD patients undergoing peritoneal dialysis.",
    "response": "<document_analysis>\nThe context presents quantitative pre- and post-dialysis data on serum BUN, salivary flow, halitosis levels, and dental indices. It shows that peritoneal dialysis (PD) lowers BUN and halitosis scores while raising salivary flow, with no change in DMFT or CPI. Notably, the strength of correlations between halitosis and both BUN and salivary flow diminishes after PD. A high-level question can require computation and comparison of proportional changes in correlation coefficients, probing a domain expert's ability to extract, calculate, and interpret these nuanced shifts in association strengths.\n</document_analysis>\n\n<output_format>\nQuestion: Which clinical variable exhibits the greatest proportional decrease in its correlation strength with halitosis after three months of peritoneal dialysis, indicating the largest relative attenuation in its association with oral malodor?\nA: Serum BUN level\nB: Salivary flow rate\nC: Community Periodontal Index (CPI)\nD: Decayed, Missing, and Filled Teeth (DMFT) index\nExplanation: Serum BUN\u2013halitosis correlation drops from r=0.702 to r=0.45 (\u224836% reduction), whereas salivary flow\u2013halitosis correlation drops from |r|=0.69 to |r|=0.37 (\u224846% reduction). CPI and DMFT showed no change in correlation strength.\nCorrect Answer: B\n</output_format>",
    "question": "Which clinical variable exhibits the greatest proportional decrease in its correlation strength with halitosis after three months of peritoneal dialysis, indicating the largest relative attenuation in its association with oral malodor?",
    "choices": {
      "A": "Serum BUN level",
      "B": "Salivary flow rate",
      "C": "Community Periodontal Index (CPI)",
      "D": "Decayed, Missing, and Filled Teeth (DMFT) index"
    },
    "answer": "B",
    "explanation": "Serum BUN\u2013halitosis correlation drops from r=0.702 to r=0.45 (\u224836% reduction), whereas salivary flow\u2013halitosis correlation drops from |r|=0.69 to |r|=0.37 (\u224846% reduction). CPI and DMFT showed no change in correlation strength.",
    "question_token_count": 38,
    "answer_correctness_score": 10,
    "explanation_validity_score": 10,
    "question_clarity_score": 3,
    "question_difficulty_score": 8,
    "question_groundedness_score": 10,
    "avg_answer_token_count": 8
  },
  {
    "context": "There is increasing pressure on mental health providers to reduce the duration of treatments, while retaining level of quality and effectiveness. The risk is that the population is underserved and therefore needs new treatment episodes. The primary aim of this study was to investigate whether duration of treatment and return into mental health care were related.\n\nThis study examined Dutch patients with an initial treatment episode in 2009 or 2010 in specialized mental health settings for depressive disorder (N\u00a0=\u00a085,754). Follow-up data about treatment episodes were available up until 2013. The data set included demographic (age, gender), and clinical factors (comorbidity with other DSM-IV Axis; scores on the 'Global Assessment of Functioning'). Cox regression analyses were used to assess whether duration of treatment and relapse into mental health care were related.\n\nThe majority of patients did not return into mental health care (86\u00a0%). Patients with a shorter duration of treatment (5-250\u00a0min; 251-500\u00a0min and 751-1000\u00a0min) were slightly more likely to return (reference group:>1000\u00a0min) (HR 1.19 95\u00a0% CI 1.13-1.26; HR 1.11 95\u00a0% CI 1.06-1.17; HR 1.18 95\u00a0% CI 1.11-1.25), adjusted for demographic and clinical variables.\n\n",
    "topic": "Principles of Cox proportional hazards regression in modeling time to return--including assumptions and interpretation",
    "response": "<document_analysis>\nThe context describes a Cox proportional hazards regression assessing how treatment duration categories relate to the hazard of returning to mental health care. Key technical points include interpretation of hazard ratios, the proportional hazards assumption, and potential model adaptations if that assumption is violated. For a domain expert, the most challenging aspect is managing non-proportional hazards: diagnosing it and modifying the model accordingly without abandoning the Cox framework. A nuanced question probes knowledge of extended Cox models and distinctions between stratification, accelerated failure time models, and time\u2010dependent covariate interactions.\n</document_analysis>\n\n<output_format>\nQuestion: In a Cox proportional hazards regression evaluating the effect of treatment duration categories (<250\u00a0min, 251\u2013500\u00a0min, 751\u20131000\u00a0min, and >1000\u00a0min reference) on time to return to mental health care, diagnostic tests indicate the hazard ratio for the <250\u00a0min group decreases over follow\u2010up, violating the proportional hazards assumption. Which approach best adapts the Cox model to accommodate this violation while still estimating a time\u2010varying effect for that group?  \nA: Include an interaction term between the <250\u00a0min indicator and a function of time (e.g., log(time)) to allow its hazard ratio to vary.  \nB: Fit an accelerated failure time model with a Weibull distribution, which inherently addresses time\u2010varying covariate effects.  \nC: Stratify the baseline hazard by treatment duration categories so each has its own unspecified hazard function.  \nD: Use Martingale residuals to adjust the original hazard ratio estimates for the time\u2010dependency.  \nExplanation: Adding a time\u2010dependent covariate interaction preserves the Cox framework while explicitly modeling non\u2010proportional hazards; the other options either change the model family or do not directly correct for a time\u2010varying covariate effect.  \nCorrect Answer: A\n</output_format>",
    "question": "In a Cox proportional hazards regression evaluating the effect of treatment duration categories (<250\u00a0min, 251\u2013500\u00a0min, 751\u20131000\u00a0min, and >1000\u00a0min reference) on time to return to mental health care, diagnostic tests indicate the hazard ratio for the <250\u00a0min group decreases over follow\u2010up, violating the proportional hazards assumption. Which approach best adapts the Cox model to accommodate this violation while still estimating a time\u2010varying effect for that group?",
    "choices": {
      "A": "Include an interaction term between the <250\u00a0min indicator and a function of time (e.g., log(time)) to allow its hazard ratio to vary.",
      "B": "Fit an accelerated failure time model with a Weibull distribution, which inherently addresses time\u2010varying covariate effects.",
      "C": "Stratify the baseline hazard by treatment duration categories so each has its own unspecified hazard function.",
      "D": "Use Martingale residuals to adjust the original hazard ratio estimates for the time\u2010dependency."
    },
    "answer": "A",
    "explanation": "Adding a time\u2010dependent covariate interaction preserves the Cox framework while explicitly modeling non\u2010proportional hazards; the other options either change the model family or do not directly correct for a time\u2010varying covariate effect.",
    "question_token_count": 96,
    "answer_correctness_score": 10,
    "explanation_validity_score": 10,
    "question_clarity_score": 8,
    "question_difficulty_score": 9,
    "question_groundedness_score": 8,
    "avg_answer_token_count": 22
  },
  {
    "context": "Bias against operating on patients with prosthetic valve endocarditis (PVE) who have multiple prostheses may preclude the use of life-saving valve replacement. We investigated the accuracy of the preoperative diagnosis of PVE in patients with both mitral and aortic prosthesis and the safety of single-valve replacement when only one valve seemed infected.\n\nPatients with a diagnosis of active PVE who had mitral and aortic prosthesis in place were assessed. We looked at the methods for diagnosis, causative agents, indication for valve replacement, operative findings and outcome.\n\nTwenty patients, who had both mitral and aortic prostheses and a diagnosis of PVE, were assessed. Streptococci and staphylococci caused 70% of cases. By means of echocardiography, the valves involved were: mitral (11 patients), aortic (six patients), and in three cases both prosthetic valves seemed infected. Surgery was undertaken in 17 patients (85%). The positive predictive value of transesophageal echocardiogram (TEE) for the preoperative diagnosis of the site of infection was 100%. In 13 patients, only the prosthetic valve that seemed infected was replaced. Four of these patients died within a week after the procedure. Nine patients survived the surgical procedure, completed a course of antimicrobial therapy and were followed up for 15.78 months (95% CI: 12.83-18.72). All were considered cured and relapses were not observed.\n\n",
    "topic": "The clinical bias against operating on patients with multiple prosthetic valves and its potential impact on valve replacement decisions in PVE.",
    "response": "<document_analysis>\nThe context describes a study on prosthetic valve endocarditis (PVE) in patients with both mitral and aortic prostheses, examining the diagnostic accuracy of transesophageal echocardiography (TEE) and outcomes of replacing only the infected valve. Key findings: TEE had a 100% positive predictive value for locating infection; among 13 patients undergoing single-valve replacement, no relapses occurred during ~16\u00a0months of follow-up, but 4 patients died within a week post\u2011surgery. The central tension lies in balancing surgical extent (single vs. multiple valve replacement) against perioperative risk and diagnostic certainty. A high\u2011difficulty question can probe inference about the cause of early deaths given accurate localization by TEE and the relapse\u2011free survival.\n</document_analysis>\n\n<output_format>\nQuestion: In PVE patients with both mitral and aortic prostheses, TEE demonstrated 100% positive predictive value for identifying the infected valve and guided single\u2011valve replacement. This approach led to no relapses over 15.8\u00a0months of follow\u2011up but incurred four early postoperative deaths. Which inference about the nature of these early deaths is most consistent with these outcomes?\nA: Early mortality resulted from TEE mislocalization causing undertreatment of occult multi-valve infection.\nB: Early deaths reflect the high perioperative risk and advanced disease severity in multi\u2011prosthetic PVE rather than diagnostic failure.\nC: Absence of relapse indicates early deaths were primarily due to antibiotic toxicity instead of surgical disease burden.\nD: These findings imply that bilateral valve replacement is needed to avoid early postoperative mortality.\nExplanation: Accurate TEE prevented relapse, so the early mortality is best explained by the critical condition and surgical complexity in patients with multiple prostheses, not by diagnostic error.\nCorrect Answer: B\n</output_format>",
    "question": "In PVE patients with both mitral and aortic prostheses, TEE demonstrated 100% positive predictive value for identifying the infected valve and guided single\u2011valve replacement. This approach led to no relapses over 15.8\u00a0months of follow\u2011up but incurred four early postoperative deaths. Which inference about the nature of these early deaths is most consistent with these outcomes?",
    "choices": {
      "A": "Early mortality resulted from TEE mislocalization causing undertreatment of occult multi-valve infection.",
      "B": "Early deaths reflect the high perioperative risk and advanced disease severity in multi\u2011prosthetic PVE rather than diagnostic failure.",
      "C": "Absence of relapse indicates early deaths were primarily due to antibiotic toxicity instead of surgical disease burden.",
      "D": "These findings imply that bilateral valve replacement is needed to avoid early postoperative mortality."
    },
    "answer": "B",
    "explanation": "Accurate TEE prevented relapse, so the early mortality is best explained by the critical condition and surgical complexity in patients with multiple prostheses, not by diagnostic error.",
    "question_token_count": 77,
    "answer_correctness_score": 10,
    "explanation_validity_score": 10,
    "question_clarity_score": 6,
    "question_difficulty_score": 8,
    "question_groundedness_score": 10,
    "avg_answer_token_count": 20
  },
  {
    "context": "Accurate and updated information on airborne pollen in specific areas can help allergic patients. Current monitoring systems are based on a morphologic identification approach, a time-consuming method that may represent a limiting factor for sampling network enhancement.\n\nTo verify the feasibility of developing a real-time polymerase chain reaction (PCR) approach, an alternative to optical analysis, as a rapid, accurate, and automated tool for the detection and quantification of airborne allergenic pollen taxa.\n\nThe traditional cetyl trimethyl ammonium bromide-based method was modified for DNA isolation from pollen. Taxon-specific DNA sequences were identified via bioinformatics or literature searches and were PCR amplified from the matching allergenic taxa; based on the sequences of PCR products, complementary or degenerate TaqMan probes were developed. The accuracy of the quantitative real-time PCR assay was tested on 3 plant species.\n\nThe setup of a modified DNA extraction protocol allowed us to achieve good-quality pollen DNA. Taxon-specific nuclear gene fragments were identified and sequenced. Designed primer pairs and probes identified selected pollen taxa, mostly at the required classification level. Pollen was properly identified even when collected on routine aerobiological tape. Preliminary quantification assays on pollen grains were successfully performed on test species and in mixes.\n\n",
    "topic": "Potential integration of real-time PCR pollen detection into existing aerobiological sampling networks.",
    "response": "<document_analysis>\nThe context describes a methodological workflow for integrating real-time PCR into aerobiological pollen monitoring. Key innovations include: (1) modification of the traditional CTAB DNA extraction protocol to yield high-quality pollen DNA from tape samples; (2) identification and sequencing of taxon-specific nuclear gene fragments for adequate taxonomic resolution; and (3) development of complementary or degenerate TaqMan probes for accurate and automated quantification. Other molecular methods (e.g., chloroplast barcoding with SYBR Green, FISH, melt\u2010curve analysis of ITS) are plausible in molecular ecology but were not implemented here. Thus, a question contrasting the described combination against other feasible but incorrect approaches would probe deep understanding of why each step is critical for rapid, specific, and automated pollen detection.\nDifficulty rating: 8/10\n</document_analysis>\n\n<output_format>\nQuestion: Which combination of methodological innovations was essential to achieve rapid, accurate, and automated detection and quantification of allergenic pollen taxa via real-time PCR from routine aerobiological tape samples?\nA: Commercial silica\u2010column DNA extraction + chloroplast DNA barcoding + SYBR Green real-time PCR  \nB: Modified CTAB-based DNA extraction + sequencing of taxon-specific nuclear gene fragments + design of complementary or degenerate TaqMan probes  \nC: Mechanical cell disruption + universal 18S rRNA primers + fluorescent in situ hybridization  \nD: Pre-concentration of air samples + ribosomal ITS region amplification + melt-curve analysis  \nExplanation: Only option B combines the specific CTAB protocol adaptation for pollen DNA, nuclear gene targets for species-level resolution, and TaqMan probe chemistry for precise quantification.  \nCorrect Answer: B\n</output_format>",
    "question": "Which combination of methodological innovations was essential to achieve rapid, accurate, and automated detection and quantification of allergenic pollen taxa via real-time PCR from routine aerobiological tape samples?",
    "choices": {
      "A": "Commercial silica\u2010column DNA extraction + chloroplast DNA barcoding + SYBR Green real-time PCR",
      "B": "Modified CTAB-based DNA extraction + sequencing of taxon-specific nuclear gene fragments + design of complementary or degenerate TaqMan probes",
      "C": "Mechanical cell disruption + universal 18S rRNA primers + fluorescent in situ hybridization",
      "D": "Pre-concentration of air samples + ribosomal ITS region amplification + melt-curve analysis"
    },
    "answer": "B",
    "explanation": "Only option B combines the specific CTAB protocol adaptation for pollen DNA, nuclear gene targets for species-level resolution, and TaqMan probe chemistry for precise quantification.",
    "question_token_count": 36,
    "answer_correctness_score": 10,
    "explanation_validity_score": 10,
    "question_clarity_score": 6,
    "question_difficulty_score": 8,
    "question_groundedness_score": 8,
    "avg_answer_token_count": 20
  },
  {
    "context": "We evaluated the usefulness of a short stay or 23-hour ward in a pediatric unit of a large teaching hospital, Westmead Hospital, and an academic Children's hospital, The New Children's Hospital, to determine if they are a useful addition to the emergency service.\n\nThis is a descriptive comparison of prospectively collected data on all children admitted to the short stay ward at Westmead Hospital (WH) during 1994 and the short stay ward at the New Children's Hospital (NCH) during 1997-98. These hospitals service an identical demographic area with the latter (NCH) a tertiary referral center. The following outcome measures were used: length of stay, appropriateness of stay, rate of admission to an in-hospital bed, and rate of unscheduled visits within 72 hours of discharge. Adverse events were reported and patient follow-up was attempted at 48 hours after discharge in all cases.\n\nThe short stay ward accounted for 10.3% (Westmead Hospital) and 14.7% (New Children's Hospital) of admissions, with 56% medical in nature, 30% surgical, and the remainder procedural or psychological. Admission patterns were similar, with asthma, gastroenteritis, convulsion, pneumonia, and simple surgical conditions accounting for most short stay ward admissions. The short stay ward increased hospital efficiency with an average length of stay of 17.5 hours (Westmead Hospital) compared to 20.5 hours (New Children's Hospital). The users of the short stay ward were children of young age less than 2 years, with stay greater than 23 hours reported in only 1% of all admissions to the short stay ward. The rate of patient admission to an in-hospital bed was low, (4% [Westmead Hospital] compared to 6% [New Children's Hospital]), with the number of unscheduled visits within 72 hours of short stay ward discharge less than 1%. There were no adverse events reported at either short stay ward, with parental satisfaction high. The short stay ward was developed through reallocation of resources from within the hospital to the short stay ward. This resulted in estimated savings of $1/2 million (Westmead Hospital) to $2.3 million (New Children's Hospital) to the hospital, due to more efficient bed usage.\n\n",
    "topic": "Clinical significance and interpretation of average length of stay differences between the two hospitals",
    "response": "<document_analysis>\nThe context describes a comparative evaluation of short stay wards in two pediatric hospitals: Westmead Hospital (WH) with an average stay of 17.5\u00a0h and the New Children\u2019s Hospital (NCH) with 20.5\u00a0h. Both wards serve the same demographic, but NCH is a tertiary referral center, implying more complex presentations. Readmission and unscheduled visit rates are low and similar, and both mean stays are under the 23\u00a0h threshold. The small 3\u00a0h difference thus likely reflects case mix complexity rather than operational inefficiency. A challenging question can probe interpretation of this differential in clinical\u2010operational terms.\nDifficulty rating: 7/10\n</document_analysis>\n\n<output_format>\nQuestion: A pediatric service quality board notes that the tertiary referral short stay ward averages 20.5\u00a0h per admission, versus 17.5\u00a0h at a general teaching hospital\u2019s ward, yet both remain below the 23\u2011hour target with similarly low readmission and unscheduled visit rates. What is the most plausible interpretation of the 3\u2011hour longer mean stay at the tertiary center?\nA: It indicates systemic inefficiency at the tertiary center, which should reduce stay to match the teaching hospital\u2019s metrics.\nB: It reflects greater patient complexity and resource intensity inherent to a tertiary referral population rather than a process failure.\nC: It predicts a higher probability of adverse events and unscheduled returns given the extended observation time.\nD: It undermines cost\u2011savings claims, since even small extensions in stay disproportionately increase operational expenses.\nExplanation: The slight increase in average stay at the tertiary referral center most plausibly arises from managing more complex cases requiring additional evaluation and intervention, not from inefficiency.\nCorrect Answer: B\n</output_format>",
    "question": "A pediatric service quality board notes that the tertiary referral short stay ward averages 20.5\u00a0h per admission, versus 17.5\u00a0h at a general teaching hospital\u2019s ward, yet both remain below the 23\u2011hour target with similarly low readmission and unscheduled visit rates. What is the most plausible interpretation of the 3\u2011hour longer mean stay at the tertiary center?",
    "choices": {
      "A": "It indicates systemic inefficiency at the tertiary center, which should reduce stay to match the teaching hospital\u2019s metrics.",
      "B": "It reflects greater patient complexity and resource intensity inherent to a tertiary referral population rather than a process failure.",
      "C": "It predicts a higher probability of adverse events and unscheduled returns given the extended observation time.",
      "D": "It undermines cost\u2011savings claims, since even small extensions in stay disproportionately increase operational expenses."
    },
    "answer": "B",
    "explanation": "The slight increase in average stay at the tertiary referral center most plausibly arises from managing more complex cases requiring additional evaluation and intervention, not from inefficiency.",
    "question_token_count": 78,
    "answer_correctness_score": 10,
    "explanation_validity_score": 10,
    "question_clarity_score": 6,
    "question_difficulty_score": 8,
    "question_groundedness_score": 10,
    "avg_answer_token_count": 21
  },
  {
    "context": "Little is known about whether a routinely inserted endoscopic nasobiliary drainage (ENBD) tube improves the clinical course in patients with choledocholithiasis-induced acute cholangitis after clearance of choledocholithiasis.\n\nThe aim of this study was to investigate the need for ENBD on the clinical outcomes of patients with acute cholangitis undergoing endoscopic clearance of common bile duct (CBD) stones.\n\nProspective, randomized study.\n\nTertiary referral center.\n\nA total of 104 patients with choledocholithiasis-induced acute cholangitis who underwent primary endoscopic treatment were compared according to insertion of an ENBD tube (51 in the ENBD group and 53 in the no-ENBD group).\n\nInsertion of an ENBD tube after clearance of CBD stones.\n\nRecurrence of cholangitis and length of hospital stay after clearance of CBD stones.\n\nBaseline clinical characteristics were similar between both groups. There were no significant differences in the recurrence rate of cholangitis at 24 weeks (3.9% for the ENBD group vs 3.8% for the no-ENBD group at 24 weeks; P = .99) and length of hospital stay (7.9 days [standard error = 1.2] for the ENBD group vs 7.9 days [standard error = 0.7]for the no-ENBD group; P = .98). However, procedure time was longer (26.2 [SE = 1.8] minutes vs 22.7 [SE = 1.0]minutes, respectively; P = .01) and the discomfort score was higher (4.9 [SE = 0.4] vs 2.8 [SE = 0.3], respectively; P = .02) in the ENBD group than in the no-ENBD group.\n\nSingle-center study.\n\n",
    "topic": "Critique the assessment and reporting of patient discomfort scores, including scale validity and reliability.",
    "response": "<document_analysis>\nAnalysis of context reveals that the study reports a quantitatively higher discomfort score in the ENBD group versus no-ENBD group (4.9 vs. 2.8; P = .02) but provides no information on how this score was derived, whether the scale was validated, its reliability, or if any blinding was used for assessment. A deep-dive question should probe the methodological implications of using an unvalidated or poorly described discomfort measure. Difficulty is calibrated at level 8, since it requires understanding of scale development, psychometric properties, and clinical trial methodology. \n</document_analysis>\n\n<output_format>\nQuestion: What is the principal methodological limitation concerning the reporting of patient discomfort in this trial that most undermines confidence in the discomfort score findings?\nA: The discomfort scale is not described as having been validated or tested for reliability, raising concerns about measurement validity.\nB: The study did not specify whether discomfort assessments were performed at multiple time points, limiting longitudinal interpretation.\nC: No blinding was implemented for the endoscopists, potentially introducing observer bias in scoring discomfort.\nD: The discomfort score was self-reported, making it inherently subjective and reducing its objectivity.\n\nExplanation: While options B\u2013D identify potential issues, the absence of any information on scale validation or reliability is the primary flaw, as it calls into question whether the measurement tool accurately and consistently captures patient discomfort.\nCorrect Answer: A\n</output_format>",
    "question": "What is the principal methodological limitation concerning the reporting of patient discomfort in this trial that most undermines confidence in the discomfort score findings?",
    "choices": {
      "A": "The discomfort scale is not described as having been validated or tested for reliability, raising concerns about measurement validity.",
      "B": "The study did not specify whether discomfort assessments were performed at multiple time points, limiting longitudinal interpretation.",
      "C": "No blinding was implemented for the endoscopists, potentially introducing observer bias in scoring discomfort.",
      "D": "The discomfort score was self-reported, making it inherently subjective and reducing its objectivity."
    },
    "answer": "A",
    "explanation": "While options B\u2013D identify potential issues, the absence of any information on scale validation or reliability is the primary flaw, as it calls into question whether the measurement tool accurately and consistently captures patient discomfort.",
    "question_token_count": 27,
    "answer_correctness_score": 10,
    "explanation_validity_score": 10,
    "question_clarity_score": 7,
    "question_difficulty_score": 9,
    "question_groundedness_score": 6,
    "avg_answer_token_count": 20
  },
  {
    "context": "To compare the effect of student examiners (SE) to that of faculty examiners (FE) on examinee performance in an OSCE as well as on post-assessment evaluation in the area of emergency medicine management.\n\nAn OSCE test-format (seven stations: Advanced Cardiac Life Support (ACLS), Basic Life Support (BLS), Trauma-Management (TM), Pediatric-Emergencies (PE), Acute-Coronary-Syndrome (ACS), Airway-Management (AM), and Obstetrical-Emergencies (OE)) was administered to 207 medical students in their third year of training after they had received didactics in emergency medicine management. Participants were randomly assigned to one of the two simultaneously run tracks: either with SE (n = 110) or with FE (n = 98). Students were asked to rate each OSCE station and to provide their overall OSCE perception by means of a standardized questionnaire. The independent samples t-test was used and effect sizes were calculated (Cohens d).\n\nStudents achieved significantly higher scores for the OSCE stations \"TM\", \"AM\", and \"OE\" as well as \"overall OSCE score\" in the SE track, whereas the station score for \"PE\" was significantly higher for students in the FE track. Mostly small effect sizes were reported. In the post-assessment evaluation portion of the study, students gave significant higher ratings for the ACS station and \"overall OSCE evaluation\" in the FE track; also with small effect sizes.\n\n",
    "topic": "Identify limitations in the study\u2019s design\u2014such as station order effects or sample size distribution\u2014and suggest methodological improvements for future research.",
    "response": "<document_analysis>\nThe study compares student versus faculty examiners on seven OSCE stations, using parallel tracks with slight sample size imbalance (110 vs 98) and reporting small effect sizes. While random assignment reduces selection bias, the fixed station order for all participants may introduce practice or fatigue effects. Additionally, examiner consistency (inter-rater reliability) is unreported, and multiple t-tests risk inflated Type I error.  \nKey focus will be on station order counterbalancing as a primary design limitation that directly threatens internal validity by confounding performance across sequential stations.  \nDifficulty level: 8/10 (requires understanding of OSCE design, potential confounds, and distinguishing between common methodological flaws).\n</document_analysis>\n\n<output_format>\nQuestion: In an OSCE comparing student and faculty examiners across seven sequential stations, which design limitation most directly threatens the validity of the observed performance differences?\nA: Slight imbalance in total sample sizes between examiner tracks\nB: Fixed station order without counterbalancing, allowing fatigue or practice effects\nC: Omission of an inter-rater reliability assessment across examiners\nD: Reliance on independent samples t-tests without correcting for multiple comparisons\nExplanation: Without counterbalancing station order, early and late stations differ in fatigue/practice levels, confounding performance comparisons.\nCorrect Answer: B\n</output_format>",
    "question": "In an OSCE comparing student and faculty examiners across seven sequential stations, which design limitation most directly threatens the validity of the observed performance differences?",
    "choices": {
      "A": "Slight imbalance in total sample sizes between examiner tracks",
      "B": "Fixed station order without counterbalancing, allowing fatigue or practice effects",
      "C": "Omission of an inter-rater reliability assessment across examiners",
      "D": "Reliance on independent samples t-tests without correcting for multiple comparisons"
    },
    "answer": "B",
    "explanation": "Without counterbalancing station order, early and late stations differ in fatigue/practice levels, confounding performance comparisons.",
    "question_token_count": 30,
    "answer_correctness_score": 10,
    "explanation_validity_score": 10,
    "question_clarity_score": 4,
    "question_difficulty_score": 8,
    "question_groundedness_score": 9,
    "avg_answer_token_count": 12
  },
  {
    "context": "Health care delivery has undertaken a major shift from inpatient management to ambulatory surgical care with increasing emphasis on quality assurance (QA) processes. Educational opportunities for medical undergraduate programmes are being sought in the day surgery environment. Our study was undertaken to explore ways in which senior medical students can actively contribute to QA processes as part of an undergraduate day surgery educational programme.\n\nHealth care delivery has undertaken a major shift from inpatient management to ambulatory surgical care with increasing emphasis on quality assurance (QA) processes. Educational opportunities for medical undergraduate programmes are being sought in the day surgery environment. Our study was undertaken to explore ways in which senior medical students can actively contribute to the QA processes as part of an undergraduate day surgery educational programme.\n\nFifty-nine final year medical students followed allocated patients with common surgical conditions through all phases of the day surgery process. Students kept records about each case in a log book and also presented their cases at weekly Problem Based Learning tutorials. An audit of student log books and review of tutorial records was conducted for the 1996 and 1997 academic years, in order to evaluate student contribution to QA.\n\nStudents followed 621 cases, representing a sampling of 14. 1% day surgery cases. Categories of problems highlighted by students included inappropriate patient and procedure selection, inadequate pain management, discharge, communication and resource issues. Students made a number of recommendations including the development of multilingual videotapes and patient information sheets for non-English speaking patients, avoidance of bilateral surgical procedures and improved links with local medical officers. They also developed new guidelines and protocols.\n\n",
    "topic": "Critically discuss the communication issues between healthcare providers and patients in day surgery and suggest interventions to enhance information exchange.",
    "response": "<document_analysis>\nThe context outlines a shift toward ambulatory (day) surgery with an emphasis on quality assurance, describing how final\u2010year medical students audited 621 cases and identified key problem categories including communication deficits, especially for non\u2013English speakers. Students proposed specific QA interventions: development of multilingual videotapes, patient information sheets for non\u2013English speakers, avoidance of bilateral procedures, and better liaison with local medical officers. Communication challenges center on language barriers and information delivery. The most targeted recommendation to bridge language-related information gaps combines visual and written content. Difficulty is calibrated at 7/10 to ensure deep recall of nuanced interventions.\n</document_analysis>\n\n<output_format>\nQuestion: Which combined visual and textual intervention was proposed to address language barriers in day surgery communication?\nA: Pictogram-based consent forms for common procedures  \nB: Multilingual videotapes and patient information sheets  \nC: On-call telephone interpreter services  \nD: Simplified one-page discharge instructions in English  \nExplanation: The only intervention that integrates both visual (videotapes) and written (information sheets) media in multiple languages to improve comprehension for non\u2013English speakers is option B.  \nCorrect Answer: B\n</output_format>",
    "question": "Which combined visual and textual intervention was proposed to address language barriers in day surgery communication?",
    "choices": {
      "A": "Pictogram-based consent forms for common procedures",
      "B": "Multilingual videotapes and patient information sheets",
      "C": "On-call telephone interpreter services",
      "D": "Simplified one-page discharge instructions in English"
    },
    "answer": "B",
    "explanation": "The only intervention that integrates both visual (videotapes) and written (information sheets) media in multiple languages to improve comprehension for non\u2013English speakers is option B.",
    "question_token_count": 18,
    "answer_correctness_score": 10,
    "explanation_validity_score": 10,
    "question_clarity_score": 8,
    "question_difficulty_score": 6,
    "question_groundedness_score": 10,
    "avg_answer_token_count": 8
  },
  {
    "context": "In literature there are only few data which describe the influence of occupation on the development of rotator cuff disease.\n\nIn a retrospective study, 760 open rotator cuff repairs were analysed and related to the profession and occupational load. Exclusion criteria were traumatic tears and sports injuries. All male persons were statistically analysed and the data compared with occupational patterns of the region, obtained from the Federal Statistical State Office.\n\nRotator cuff repairs were performed in 472 males who had no evidence for a traumatic origin. After statistical analysis (p<0.001) we found significantly more patients working in agriculture and forestry (6.38% versus 1.07% in Bavaria) and in the building industry (35.11% versus 13.40% in Bavaria).\n\n",
    "topic": "Assessment of potential confounders and biases in a surgical repair cohort when evaluating occupational risk",
    "response": "<document_analysis>\nThe context describes a retrospective analysis of 472 non\u2010traumatic rotator cuff repair cases in males, comparing their occupational distribution against aggregate regional workforce statistics. Key methodological details include exclusion of traumatic and sports\u2010related tears, male\u2010only analysis, and use of general population occupational percentages as the reference. Central themes involve potential occupational risk factors (agriculture, construction) but also highlight biases inherent in using group\u2010level (ecological) data to infer individual risk. A high\u2010level epidemiological bias question will probe understanding of the \u201cecological fallacy,\u201d a nuanced concept often overlooked in straightforward surgical cohort analyses. Difficulty is calibrated at 8/10 due to the requirement of advanced epidemiology knowledge.\n</document_analysis>\n\n<output_format>\nQuestion: In evaluating occupational risk for rotator cuff repair, what methodological error arises from comparing individual patients\u2019 job categories to aggregate regional workforce data?\nA: Healthy worker effect  \nB: Berkson\u2019s bias  \nC: Ecological fallacy  \nD: Neyman bias  \nExplanation: Inferring individual\u2010level associations from group\u2010level (aggregate) data constitutes an ecological fallacy.  \nCorrect Answer: C\n</output_format>",
    "question": "In evaluating occupational risk for rotator cuff repair, what methodological error arises from comparing individual patients\u2019 job categories to aggregate regional workforce data?",
    "choices": {
      "A": "Healthy worker effect",
      "B": "Berkson\u2019s bias",
      "C": "Ecological fallacy",
      "D": "Neyman bias"
    },
    "answer": "C",
    "explanation": "Inferring individual\u2010level associations from group\u2010level (aggregate) data constitutes an ecological fallacy.",
    "question_token_count": 28,
    "answer_correctness_score": 10,
    "explanation_validity_score": 10,
    "question_clarity_score": 8,
    "question_difficulty_score": 7,
    "question_groundedness_score": 9,
    "avg_answer_token_count": 5
  },
  {
    "context": "To assess the feasibility and safety of diagnostic or therapeutic semirigid ureteroscopy without ureteral meatus dilatation.\n\nA comparative, retrospective study was conducted of patients undergoing ureteroscopy from January 2000 to May 2008. For data analysis purposes, the population was divided into two groups based on whether ureteroscopy had been performed with (Group 1) or without (Group 2) ureteral meatus dilatation. Variables recorded included age, sex, type of procedure, surgical diagnosis, passive or active dilatation, number of stones, stone location, stone diameter, peroperative and postoperative complications, internal urinary diversion after the procedure, therapeutic success rate, operating time, and hospital stay duration. A 8-9.8 Fr Wolf semirigid ureteroscope was used. Descriptive statistics of the population and cohorts were performed, providing medians, quartiles, and limit values for non-normally distributed interval variables, and absolute and relative frequencies for categorical variables. Shapiro-Wilk's, Mann-Whitney's U, Chi-square, and Fisher's exact tests were used for statistical analysis. A value of p 2 alpha<or = 0.005 was considered statistically significant. Arcus Quickstat Biomedical 1.0 software was used.\n\nAmong the 306 ureteroscopies studied, 286 performed in 256 patients were analyzed. Median age was 50 years (16-83), 59% of patients were male, and elective ureteroscopy was performed in 183 patients (64%). Group 1: 191 ureteroscopies, Group 2: 95 ureteroscopies. Stone location: 149 in distal ureter, 60 in middle ureter, and 35 in proximal ureter. Sixty-nine percent of stones had sizes ranging from 5 and 10 mm. The overall success rate was 86.5%. There were 5 peroperative and 22 postoperative complications, with no statistically significant differences between the groups.\n\n",
    "topic": "Assess the relevance of operating time and hospital stay duration as indicators of procedural efficiency and patient safety.",
    "response": "<document_analysis>\nThe context describes a retrospective comparison of semirigid ureteroscopy performed with versus without ureteral meatus dilatation, recording variables including operating time and hospital stay as proxies for procedural efficiency and safety. The study uses nonparametric tests to compare groups, but does not report raw times; it therefore invites scrutiny of how to best control confounders when interpreting these endpoints. Key nuanced challenge: isolating true effects on operating time/hospital stay from stone burden, patient comorbidities, and surgeon factors in a retrospective design. A suitably probing question will ask which statistical strategy most robustly balances these confounders.\n</document_analysis>\n\n<output_format>\nQuestion: In a retrospective comparison of semirigid ureteroscopy with and without ureteral meatus dilatation, which analytical approach most effectively balances stone burden, patient demographics, and surgeon experience to isolate true differences in operating time and hospital stay?\nA: Stratification by stone size and location only  \nB: Multivariate regression adjusting for patient age, comorbidities, and surgeon experience  \nC: Propensity score matching incorporating stone characteristics, patient demographics, and surgeon experience  \nD: Post hoc random subgroup allocation based on passive or active dilatation  \n\nExplanation: Propensity score matching best mimics randomization by balancing all key covariates across groups.  \nCorrect Answer: C\n</output_format>",
    "question": "In a retrospective comparison of semirigid ureteroscopy with and without ureteral meatus dilatation, which analytical approach most effectively balances stone burden, patient demographics, and surgeon experience to isolate true differences in operating time and hospital stay?",
    "choices": {
      "A": "Stratification by stone size and location only",
      "B": "Multivariate regression adjusting for patient age, comorbidities, and surgeon experience",
      "C": "Propensity score matching incorporating stone characteristics, patient demographics, and surgeon experience",
      "D": "Post hoc random subgroup allocation based on passive or active dilatation"
    },
    "answer": "C",
    "explanation": "Propensity score matching best mimics randomization by balancing all key covariates across groups.",
    "question_token_count": 49,
    "answer_correctness_score": 10,
    "explanation_validity_score": 10,
    "question_clarity_score": 6,
    "question_difficulty_score": 8,
    "question_groundedness_score": 7,
    "avg_answer_token_count": 13
  },
  {
    "context": "To describe the biomechanical and wound healing characteristics of corneas after excimer laser keratorefractive surgery.\n\nHistologic, ultrastructural, and cohesive tensile strength evaluations were performed on 25 normal human corneal specimens, 206 uncomplicated LASIK specimens, 17 uncomplicated sub-Bowman's keratomileusis (SBK) specimens, 4 uncomplicated photorefractive keratectomy (PRK) specimens, 2 uncomplicated advanced surface ablation (ASA) specimens, 5 keratoconus specimens, 12 postoperative LASIK ectasia specimens, and 1 postoperative PRK ectasia specimen and compared to previously published studies.\n\nHistologic and ultrastructural studies of normal corneas showed significant differences in the direction of collagen fibrils and/or the degree of lamellar interweaving in Bowman's layer, the anterior third of the corneal stroma, the posterior two-thirds of the corneal stroma, and Descemet's membrane. Cohesive tensile strength testing directly supported these morphologic findings as the stronger, more rigid regions of the cornea were located anteriorly and peripherally. This suggests that PRK and ASA, and secondarily SBK, should be biomechanically safer than conventional LASIK with regard to risk for causing keratectasia after surgery. Because adult human corneal stromal wounds heal slowly and incompletely, all excimer laser keratorefractive surgical techniques still have some distinct disadvantages due to inadequate reparative wound healing. Despite reducing some of the risk for corneal haze compared to conventional PRK, ASA cases still can develop corneal haze or breakthrough haze from the hypercellular fibrotic stromal scarring. In contrast, similar to conventional LASIK, SBK still has the short- and long-term potential for interface wound complications from the hypocellular primitive stromal scar.\n\n",
    "topic": "Role of incomplete reparative wound healing in long-term corneal stability and visual outcomes after refractive surgery",
    "response": "<document_analysis>\nThoughtful Content Examination:\nThe context contrasts biomechanical properties and wound healing responses across excimer laser keratorefractive surgeries. It highlights: \n1) Tensile strength is greatest in anterior/peripheral cornea due to collagen orientation and lamellar interweaving.\n2) Surface ablation (PRK, ASA) preserves this anterior rigidity, whereas flap-based methods (LASIK, SBK) remove anterior stroma.\n3) Human stromal wounds heal slowly/incompletely, yielding two scar types:\n   - Hypercellular fibrotic scarring (surface ablation) associated with haze.\n   - Hypocellular primitive stromal scar (flap-based) causing interface weakness.\n\nConcept Exploration:\nIntegrating these findings, one sees a trade\u2010off: surface ablation maintains biomechanical safety yet predisposes to fibrotic haze; flap-based techniques reduce haze but risk interface complications and ectasia when too much anterior tissue is removed.\n\nStrategic Complexity Calibration:\nDifficulty rated 8/10\u2014requires synthesis of biomechanics and wound healing nuances, differentiating scar types and their clinical sequelae.\n\nIntentional Question Planning:\nPose a comparative question inviting experts to align each procedure\u2019s biomechanical benefit with its specific healing drawback, demonstrating deep grasp of the interplay between tissue removal depth and wound response.\n\n</document_analysis>\n\n<output_format>\nQuestion: Which pairing of biomechanical benefit and wound healing drawback best characterizes advanced surface ablation techniques compared to flap-based procedures?\nA: Preservation of anterior stromal mechanical strength / potential for hypercellular fibrotic haze  \nB: Reduction of keratocyte activation / primitive stromal interface weakness  \nC: Increased anterior lamellar interweaving / diminished risk of postoperative haze  \nD: Enhanced posterior stromal rigidity / hypocellular scar formation  \nExplanation: Surface ablation preserves the strong anterior stroma but, due to incomplete reparative healing, induces hypercellular fibrotic scarring that manifests as corneal haze.  \nCorrect Answer: A\n</output_format>",
    "question": "Which pairing of biomechanical benefit and wound healing drawback best characterizes advanced surface ablation techniques compared to flap-based procedures?",
    "choices": {
      "A": "Preservation of anterior stromal mechanical strength / potential for hypercellular fibrotic haze",
      "B": "Reduction of keratocyte activation / primitive stromal interface weakness",
      "C": "Increased anterior lamellar interweaving / diminished risk of postoperative haze",
      "D": "Enhanced posterior stromal rigidity / hypocellular scar formation"
    },
    "answer": "A",
    "explanation": "Surface ablation preserves the strong anterior stroma but, due to incomplete reparative healing, induces hypercellular fibrotic scarring that manifests as corneal haze.",
    "question_token_count": 23,
    "answer_correctness_score": 10,
    "explanation_validity_score": 10,
    "question_clarity_score": 8,
    "question_difficulty_score": 7,
    "question_groundedness_score": 10,
    "avg_answer_token_count": 14
  },
  {
    "context": "Among patients with acute stroke symptoms, delay in hospital admission is the main obstacle for the use of thrombolytic therapy and other interventions associated with decreased mortality and disability. The primary aim of this study was to assess whether an elderly clinical population correctly endorsed the response to call for emergency services when presented with signs and symptoms of stroke using a standardized questionnaire.\n\nWe performed a cross-sectional study among elderly out-patients (\u226560 years) in Buenos Aires, Argentina randomly recruited from a government funded health clinic. The correct endorsement of intention to call 911 was assessed with the Stroke Action Test and the cut-off point was set at \u226575%. Knowledge of stroke and clinical and socio-demographic indicators were also collected and evaluated as predictors of correct endorsement using logistic regression.\n\nAmong 367 elderly adults, 14% correctly endorsed intention to call 911. Presented with the most typical signs and symptoms, only 65% reported that they would call an ambulance. Amaurosis Fugax was the symptom for which was called the least (15%). On average, the correct response was chosen only 37% of the time. Compared to lower levels of education, higher levels were associated to correctly endorsed intention to call 911 (secondary School adjusted OR 3.53, 95% CI 1.59-7.86 and Tertiary/University adjusted OR 3.04, 95% CI 1.12-8.21).\n\n",
    "topic": "Analysis of the association between secondary and tertiary/university education levels and correct intention to call emergency services.",
    "response": "<document_analysis>\nThe context reports adjusted odds ratios (ORs) and 95% confidence intervals (CIs) for the association between secondary and tertiary/university education and correct intention to call emergency services. Key details: secondary education OR\u2009=\u20093.53 (95% CI 1.59\u20137.86); tertiary/university OR\u2009=\u20093.04 (95% CI 1.12\u20138.21). Both CIs exclude 1, indicating statistical significance. The CIs overlap, so the difference in effect sizes is not statistically significant. A nuanced question can probe interpretation of ORs and CIs, requiring deep understanding of inferential reasoning.\nDifficulty rating: 8\nQuestion planning: Ask which inference about the relative associations is most valid, emphasizing overlapping CIs and significance.\n</document_analysis>\n\n<output_format>\nQuestion: Given adjusted odds ratios of 3.53 (95% CI 1.59\u20137.86) for secondary education and 3.04 (95% CI 1.12\u20138.21) for tertiary/university education in predicting correct intention to call emergency services, which inference is most statistically valid?\nA: Secondary education exerts a significantly stronger effect than tertiary/university, as indicated by its higher OR and non-overlapping CIs.\nB: Tertiary/university education shows a significant association while secondary does not, because only the tertiary CI lies entirely above 1.\nC: Both secondary and tertiary/university education are significantly associated with correct intention, but their difference in effect size is not statistically significant due to overlapping CIs.\nD: Neither education level shows a significant association, since both confidence intervals include the null value of 1.\nExplanation: Both CIs exclude 1, confirming significance, and their overlap precludes concluding a difference between the two effect sizes.\nCorrect Answer: C\n</output_format>",
    "question": "Given adjusted odds ratios of 3.53 (95% CI 1.59\u20137.86) for secondary education and 3.04 (95% CI 1.12\u20138.21) for tertiary/university education in predicting correct intention to call emergency services, which inference is most statistically valid?",
    "choices": {
      "A": "Secondary education exerts a significantly stronger effect than tertiary/university, as indicated by its higher OR and non-overlapping CIs.",
      "B": "Tertiary/university education shows a significant association while secondary does not, because only the tertiary CI lies entirely above 1.",
      "C": "Both secondary and tertiary/university education are significantly associated with correct intention, but their difference in effect size is not statistically significant due to overlapping CIs.",
      "D": "Neither education level shows a significant association, since both confidence intervals include the null value of 1."
    },
    "answer": "C",
    "explanation": "Both CIs exclude 1, confirming significance, and their overlap precludes concluding a difference between the two effect sizes.",
    "question_token_count": 65,
    "answer_correctness_score": 10,
    "explanation_validity_score": 10,
    "question_clarity_score": 8,
    "question_difficulty_score": 7,
    "question_groundedness_score": 10,
    "avg_answer_token_count": 26
  },
  {
    "context": "Weight scales as height squared, which is an observation that forms the basis of body mass index (weight/height(2)). If, and how, circumferences, including waist circumference (WC) and hip circumference (HC), scale to height remains unclear, but this is an important consideration when developing normative ranges or applying WC/height and HC/height as risk indexes.\n\nThe study aim was to examine the scaling of weight, WC, and HC to height in NHANES (National Health and Nutrition Examination Survey) III participants.\n\nSubjects were adult non-Hispanic white, non-Hispanic black, and Mexican American men (n = 7422) and nonpregnant women (n = 7999) who had complete demographic and anthropometric data. In addition to height, allometric models were developed for each measure that controlled for age, race, and self-reported health status.\n\nAfter adjustment for age and race, weight scaled to height in men and women with mean (\u00b1SEE) powers of 2.29 \u00b1 0.11 and 1.80 \u00b1 0.07, respectively (both P<0.001). Although univariate circumference-height models were weak or nonsignificant, when adjusted for age and race WC and HC scaled to height with powers of 0.76 \u00b1 0.08 and 0.45 \u00b1 0.05, respectively, in men and 0.80 \u00b1 0.05 and 0.53 \u00b1 0.04, respectively, in women (all P<0.001). Age- and race-adjusted incremental increases in circumferences ranged from 0.2 to 0.5 cm per centimeter increase in height. Both WC/height and HC/height scaled negatively to height in men and women, and WC/HC scaled negatively to height in women only (all P<0.001). Health status-adjusted models were similar.\n\n",
    "topic": "Interpretation of negative scaling in WC/height and HC/height ratios and its consequences for anthropometric indices",
    "response": "<document_analysis>\nThe context describes allometric scaling of anthropometric measures (weight, WC, HC) with height. Key findings: weight \u221d height^2.29 (men) and \u221d height^1.80 (women), WC \u221d height^0.76 (men) and \u221d height^0.80 (women), HC \u221d height^0.45 (men) and \u221d height^0.53 (women). Because circumferences scale with exponents <1, ratios WC/height and HC/height decrease as height increases (negative scaling). This implies that using simple circumference/height ratios introduces systematic bias in risk assessment across height. A probing question explores the consequence of this negative scaling on interpreting WC/height as a height-normalized index.\n</document_analysis>\n\n<output_format>\nQuestion: Given that waist circumference scales with height to the power of approximately 0.8 in women, what systematic bias results from using the simple WC/height ratio to compare central adiposity across women of different statures?\nA: It overestimates central adiposity in taller women.\nB: It underestimates central adiposity in taller women.\nC: It completely eliminates stature-related bias.\nD: It introduces a constant additive bias unrelated to height.\nExplanation: Since WC \u221d height^0.8, WC/height \u221d height^(\u20130.2), so the ratio decreases with increasing height, leading to underestimation of central adiposity in taller individuals.\nCorrect Answer: B\n</output_format>",
    "question": "Given that waist circumference scales with height to the power of approximately 0.8 in women, what systematic bias results from using the simple WC/height ratio to compare central adiposity across women of different statures?",
    "choices": {
      "A": "It overestimates central adiposity in taller women.",
      "B": "It underestimates central adiposity in taller women.",
      "C": "It completely eliminates stature-related bias.",
      "D": "It introduces a constant additive bias unrelated to height."
    },
    "answer": "B",
    "explanation": "Since WC \u221d height^0.8, WC/height \u221d height^(\u20130.2), so the ratio decreases with increasing height, leading to underestimation of central adiposity in taller individuals.",
    "question_token_count": 44,
    "answer_correctness_score": 10,
    "explanation_validity_score": 10,
    "question_clarity_score": 9,
    "question_difficulty_score": 8,
    "question_groundedness_score": 10,
    "avg_answer_token_count": 10
  },
  {
    "context": "To determine the ability of early sonogram to predict the presentation of twin A at birth.\n\nA retrospective cohort study was conducted on all twin pregnancies evaluated at our Fetal Evaluation Unit from 2007 to 2009. Sonogram records were reviewed for the presentation of twin A at seven gestational age intervals and inpatient medical records were reviewed for the presentation of twin A at delivery. The positive predictive value, sensitivity, and specificity of presentation as determined by ultrasound, at each gestational age interval, for the same presentation at delivery were calculated.\n\nTwo hundred and thirty-eight twin pregnancies met inclusion criteria. A total of 896 ultrasounds were reviewed. The positive predictive value of cephalic presentation of twin A as determined by ultrasound for the persistence of cephalic presentation at delivery reached 95% after 28 weeks gestation. The positive predictive value for noncephalic presentation as established by sonogram for noncephalic at delivery was>90% after 32 weeks gestation.\n\n",
    "topic": "Potential biases and limitations inherent in retrospective record reviews of ultrasound data.",
    "response": "<document_analysis>\nThe context describes a retrospective cohort study reviewing stored ultrasound records for fetal presentation and comparing them to delivery records. Key methodological details include reliance on prior ultrasound acquisitions by multiple operators, potential variability in sonographic technique and interpretation, and the retrospective nature limiting control over data quality. The main biases likely involve information (misclassification) bias from non-standardized imaging, selection bias in cohort inclusion, and verification bias, but the most pervasive is interoperator variability leading to nondifferential misclassification of presentation.\n</document_analysis>\n\n<output_format>\nQuestion: In a retrospective analysis of archived ultrasound scans predicting twin A presentation at birth, which limitation most directly introduces nondifferential misclassification bias affecting reported predictive values?\nA: Interoperator variability in ultrasound acquisition and interpretation\nB: Selective verification if only certain scan findings were confirmed at delivery\nC: Exclusion of pregnancies lacking serial scans\nD: Recall bias from patient-reported delivery positions\nExplanation: Reliance on multiple sonographers and variable imaging protocols leads to inconsistent classification of fetal presentation, introducing nondifferential misclassification.\nCorrect Answer: A\n</output_format>",
    "question": "In a retrospective analysis of archived ultrasound scans predicting twin A presentation at birth, which limitation most directly introduces nondifferential misclassification bias affecting reported predictive values?",
    "choices": {
      "A": "Interoperator variability in ultrasound acquisition and interpretation",
      "B": "Selective verification if only certain scan findings were confirmed at delivery",
      "C": "Exclusion of pregnancies lacking serial scans",
      "D": "Recall bias from patient-reported delivery positions"
    },
    "answer": "A",
    "explanation": "Reliance on multiple sonographers and variable imaging protocols leads to inconsistent classification of fetal presentation, introducing nondifferential misclassification.",
    "question_token_count": 31,
    "answer_correctness_score": 10,
    "explanation_validity_score": 10,
    "question_clarity_score": 8,
    "question_difficulty_score": 9,
    "question_groundedness_score": 8,
    "avg_answer_token_count": 9
  },
  {
    "context": "To evaluate the usefulness of half-dose contrast-enhanced magnetic resonance (MR) angiography for depicting the abdominal aorta and its major branches.\n\nA total of 72 consecutive patients were randomly assigned to one of four groups that underwent MR angiography after receiving different concentrations (original or diluted to 50%) and total amounts (single or half-dose) of gadolinium chelate injected at different rates (1 or 0.5 mL/second). The signal-to-noise ratio (SNR) and contrast-to-noise ratio (CNR) of the abdominal aorta and of the common and external iliac arteries were calculated, and two blinded readers rated the respective image qualities.\n\nThe SNR and CNR of the abdominal aorta and the common iliac artery in the 0.5 mL/second groups were statistically significantly lower than those in the 1 mL/second groups. The differences in overall image quality across the four groups were not statistically significant.\n\n",
    "topic": "Analyze how the results inform future research directions in dose reduction strategies for contrast-enhanced MR angiography.",
    "response": "<document_analysis>\nThe context describes a controlled study assessing SNR, CNR, and image quality in half-dose vs full-dose gadolinium MR angiography at two injection rates. Key findings: slower injection (0.5\u00a0mL/s) significantly lowers SNR/CNR in major vessels, yet overall image quality remains unaffected across groups. The pivotal insight is that despite quantitative signal loss, diagnostic image quality is preserved, suggesting that technical strategies (beyond simply increasing dose or rate) could mitigate SNR/CNR reduction and enable further dose reduction. This implies future research should explore advanced acquisition or reconstruction techniques or alternative high\u2011efficiency agents\u2014approaches that specifically address the signal penalty from dose or rate reductions. Difficulty rating: 8/10, as the expert must integrate MR\u2010physics with study outcomes to propose an optimized research direction.\n</document_analysis>\n\n<output_format>\nQuestion: Given that slower injection rates at half-dose contrast lower SNR and CNR but do not degrade overall MR angiographic image quality, which future research avenue most directly targets compensating for the observed signal loss to enable further gadolinium dose reduction?\nA: Evaluating novel high-relaxivity gadolinium chelates to boost intrinsic vessel signal.\nB: Prolonging acquisition time with multiple signal averages to recover SNR.\nC: Implementing advanced non-Cartesian k-space sampling combined with iterative reconstruction noise suppression.\nD: Increasing spatial resolution to concentrate signal within smaller voxels.\nExplanation: Iterative reconstruction with non-Cartesian sampling specifically counteracts SNR/CNR loss, directly enabling lower contrast doses without lengthening scans.\nCorrect Answer: C\n</output_format>",
    "question": "Given that slower injection rates at half-dose contrast lower SNR and CNR but do not degrade overall MR angiographic image quality, which future research avenue most directly targets compensating for the observed signal loss to enable further gadolinium dose reduction?",
    "choices": {
      "A": "Evaluating novel high-relaxivity gadolinium chelates to boost intrinsic vessel signal.",
      "B": "Prolonging acquisition time with multiple signal averages to recover SNR.",
      "C": "Implementing advanced non-Cartesian k-space sampling combined with iterative reconstruction noise suppression.",
      "D": "Increasing spatial resolution to concentrate signal within smaller voxels."
    },
    "answer": "C",
    "explanation": "Iterative reconstruction with non-Cartesian sampling specifically counteracts SNR/CNR loss, directly enabling lower contrast doses without lengthening scans.",
    "question_token_count": 49,
    "answer_correctness_score": 10,
    "explanation_validity_score": 10,
    "question_clarity_score": 7,
    "question_difficulty_score": 8,
    "question_groundedness_score": 10,
    "avg_answer_token_count": 15
  },
  {
    "context": "Unicompartmental replacement can be an alternative to tibial osteotomy in younger, active patients with unicompartmental knee disease. In unicompartmental replacement, the other compartments and knee ligaments are largely untouched. Therefore, it was hypothesized that the knee kinematics after unicompartmental replacement may also be unchanged. To test this hypothesis, knee kinematics and quadriceps tension were recorded before and after replacement with a unicompartmental design and then with a tricompartmental design.\n\nSix human cadaver knees were tested before implantation, after implantation with a bicruciate-retaining unicompartmental knee prosthesis, and after implantation with a posterior cruciate-retaining tricompartmental knee prosthesis. The unicompartmental prosthesis was initially implanted, and it was then revised to a total condylar knee replacement. The knee kinematics were measured with use of an electromagnetic tracking device while the knee was put through dynamic simulated stair-climbing under peak flexion moments of approximately 40 N-m. Quadriceps tension was also measured for all three conditions.\n\nNo significant differences in tibial axial rotation were noted between the intact and unicompartmental conditions. However, tricompartmental replacement significantly affected tibial axial rotation (p = 0.001). Femoral rollback was not significantly affected by either unicompartmental or tricompartmental arthroplasty. Quadriceps tension was also similar among all three conditions.\n\n",
    "topic": "Describe the methodology and significance of using electromagnetic tracking to measure tibial axial rotation and femoral rollback during simulated stair climbing.",
    "response": "<document_analysis>\nThe context describes a biomechanical study using electromagnetic tracking to measure knee kinematics\u2014specifically tibial axial rotation and femoral rollback\u2014under dynamic simulated stair-climbing with peak flexion moments (\u224840\u00a0N\u00b7m). Six cadaver knees were tested intact, after unicompartmental prosthesis (bicruciate retaining), and after posterior cruciate\u2013retaining total knee. Key findings: tibial rotation unchanged in unicompartmental but significantly altered in total; femoral rollback unchanged in both; quadriceps tension unchanged in all. The study implies that unicompartmental prostheses preserve native rotational kinematics and that femoral rollback is preserved irrespective of compartmental status or PCL retention. A high-difficulty question can probe the expert\u2019s ability to infer the functional role of the PCL from these findings.\n</document_analysis>\n\n<output_format>\nQuestion: Based on electromagnetic tracking during simulated stair climbing, what does the unchanged femoral rollback across intact knees, bicruciate-retaining unicompartmental replacements, and posterior cruciate\u2013retaining total knee replacements imply about the role of the posterior cruciate ligament?\nA: It is essential for maintaining normal femoral rollback\nB: Femoral rollback is preserved regardless of PCL retention or compartmental alteration\nC: Only bicruciate retention can preserve native femoral rollback\nD: PCL retention in total knees enhances rollback compared to unicompartmental designs\nExplanation: Since femoral rollback did not change significantly in any condition, it indicates rollback is maintained independently of PCL status or compartmental replacement.\nCorrect Answer: B\n</output_format>",
    "question": "Based on electromagnetic tracking during simulated stair climbing, what does the unchanged femoral rollback across intact knees, bicruciate-retaining unicompartmental replacements, and posterior cruciate\u2013retaining total knee replacements imply about the role of the posterior cruciate ligament?",
    "choices": {
      "A": "It is essential for maintaining normal femoral rollback",
      "B": "Femoral rollback is preserved regardless of PCL retention or compartmental alteration",
      "C": "Only bicruciate retention can preserve native femoral rollback",
      "D": "PCL retention in total knees enhances rollback compared to unicompartmental designs"
    },
    "answer": "B",
    "explanation": "Since femoral rollback did not change significantly in any condition, it indicates rollback is maintained independently of PCL status or compartmental replacement.",
    "question_token_count": 52,
    "answer_correctness_score": 10,
    "explanation_validity_score": 10,
    "question_clarity_score": 8,
    "question_difficulty_score": 8,
    "question_groundedness_score": 10,
    "avg_answer_token_count": 12
  },
  {
    "context": "Cutaneous melanoma in nonwhite persons has a manifestation and a prognosis that are different than those of cutaneous melanoma in white persons.\n\nCase series.\n\nTertiary care university-affiliated community medical center located in a multiethnic state in which white persons are a minority of the population.\n\nConsecutive series of 357 patients with melanoma seen between January 1994 and August 2003.\n\nEthnicity, age, sex, primary site, tumor thickness, nodal status, stage at diagnosis, and survival.\n\nThere were 208 men and 149 women who ranged in age from 15 to 93 years (mean, 58 years). Twenty-two patients initially had unknown primary sites. Of these 357 patients, 67 (18.7%) were nonwhite. There was no statistically significant difference in the age (P =.10) or sex (P =.57) distribution of these 2 populations. Nonwhite patients at initial diagnosis had thicker tumors (P =.002), more frequently had ulcerated primary tumors (P<.001), more frequently had positive nodes (P =.004), and were at a more advanced stage (P =.002) than their white counterparts. The anatomic distribution between the 2 populations was significantly different (P<.001), with a high incidence of melanoma on the sole and subungual locations and a substantially less frequent occurrence on the head and neck, trunk, and extremities in the nonwhite population when compared with the white population. The overall survival rate of the nonwhite patients was significantly worse than that of the white patients, but when stratified by stage at initial diagnosis, there was no difference in outcome.\n\n",
    "topic": "Interpretation of demographic distributions and potential referral biases in a population where whites are a minority.",
    "response": "<document_analysis>\nThe context reports a case series of cutaneous melanoma patients at a tertiary care center in a multiethnic state where whites are the minority. Key findings: nonwhite patients present with significantly thicker, ulcerated, nodal-positive, and more advanced-stage tumors, and exhibit worse unadjusted overall survival. However, once survival is stratified by stage at diagnosis, racial differences disappear. This pattern suggests that disparities are driven by later stage at presentation\u2014likely due to diagnostic delays, referral bias, or access barriers\u2014rather than intrinsic tumor aggressiveness or treatment efficacy differences. A deep-dive question should probe the expert\u2019s ability to interpret the stage-stratified survival equivalence, distinguish between biological versus systemic factors, and identify the most plausible driver of the overall survival gap.\nDifficulty: 8/10\n</document_analysis>\n\n<output_format>\nQuestion: In a tertiary care setting where white persons are a minority and nonwhite melanoma patients present with thicker, ulcerated, nodal\u2011positive, and more advanced-stage tumors yet have equivalent stage-specific survival compared to white patients, which factor most plausibly explains the observed overall survival disparity?\nA: Intrinsic racial differences in melanoma tumor biology leading to greater metastatic potential\nB: Socioeconomic and referral barriers causing diagnostic delays resulting in advanced stage at presentation among nonwhite patients\nC: Differential treatment regimens with nonwhite patients receiving less effective therapies\nD: Higher prevalence of undetected micro-metastatic disease in nonwhite patients not captured by conventional staging  \nExplanation: The absence of racial differences in survival within each stage implies that biology and treatment efficacy are comparable; the overall disparity stems from nonwhite patients presenting at later stages due to systemic delays in diagnosis and referral.  \nCorrect Answer: B\n</output_format>",
    "question": "In a tertiary care setting where white persons are a minority and nonwhite melanoma patients present with thicker, ulcerated, nodal\u2011positive, and more advanced-stage tumors yet have equivalent stage-specific survival compared to white patients, which factor most plausibly explains the observed overall survival disparity?",
    "choices": {
      "A": "Intrinsic racial differences in melanoma tumor biology leading to greater metastatic potential",
      "B": "Socioeconomic and referral barriers causing diagnostic delays resulting in advanced stage at presentation among nonwhite patients",
      "C": "Differential treatment regimens with nonwhite patients receiving less effective therapies",
      "D": "Higher prevalence of undetected micro-metastatic disease in nonwhite patients not captured by conventional staging"
    },
    "answer": "B",
    "explanation": "The absence of racial differences in survival within each stage implies that biology and treatment efficacy are comparable; the overall disparity stems from nonwhite patients presenting at later stages due to systemic delays in diagnosis and referral.",
    "question_token_count": 56,
    "answer_correctness_score": 10,
    "explanation_validity_score": 10,
    "question_clarity_score": 6,
    "question_difficulty_score": 8,
    "question_groundedness_score": 10,
    "avg_answer_token_count": 16
  },
  {
    "context": "Recently, increasing number of literature has identified the posterior tibial slope (PTS) as one of the risk factors of primary anterior cruciate ligament (ACL) injury. However, few studies concerning the association between failure of ACL reconstruction (ACLR) and PTS have been published. The objective of this study was to explore the association between the failure of ACLR and PTS at a minimum of two years follow-up.\n\nTwo hundred and thirty eight eligible patients from June 2009 to October 2010 were identified from our database. A total of 20 failure cases of ACLR and 20 randomly selected controls were included in this retrospective study. The demographic data and the results of manual maximum side-to-side difference with KT-1000 arthrometer at 30\u00b0 of knee flexion and pivot-shift test before the ACLR and at the final follow-up were collected. The medial and lateral PTSs were measured using the magnetic resonance imaging (MRI) scan, based on Hudek's measurement. A comparison of PTS between the two groups was performed.\n\nThe overall failure rate of the present study was 8.4%. Of the 40 participants, the mean medial PTS was 4.1\u00b0 \u00b1 3.2\u00b0 and the mean lateral PTS was 4.6\u00b0 \u00b1 2.6\u00b0. The medial PTS of the ACLR failure group was significantly steeper than the control group (3.5\u00b0 \u00b1 2.5\u00b0 vs. 6.1\u00b0 \u00b1 2.1\u00b0, P = 0.000). Similarly, the lateral PTS of the ACLR failure group was significantly steeper than the control group (2.9\u00b0 \u00b1 2.1\u00b0 vs. 5.5\u00b0 \u00b1 3.0\u00b0, P = 0.006). For medial PTS \u2265 5\u00b0, the odds ratio of ACLR failure was 6.8 (P = 0.007); for lateral PTS \u22655\u00b0, the odds ratio of ACLR failure was 10.8 (P = 0.000).\n\n",
    "topic": "Implications for preoperative assessment and surgical planning, including consideration of slope\u2011altering procedures",
    "response": "<document_analysis>\nThe context reports that increased posterior tibial slope (PTS) is a significant risk factor for ACL reconstruction failure, with lateral PTS \u22655\u00b0 conferring a higher odds ratio (10.8) than medial PTS \u22655\u00b0 (6.8). This finding has direct implications for preoperative planning of slope\u2011altering procedures. A high\u2011level question for domain experts should probe understanding of why the lateral plateau slope disproportionately affects ACL graft strain and failure risk, integrating biomechanics with clinical decision\u2011making. Difficulty is set high by requiring inference of rotational and translational load mechanisms linked to lateral vs. medial PTS.\n</document_analysis>\n<output_format>\nQuestion: Given that a lateral posterior tibial slope (PTS) \u22655\u00b0 carries a markedly higher odds ratio for ACL reconstruction failure than a medial PTS \u22655\u00b0, which biomechanical rationale best supports prioritizing lateral slope correction in preoperative planning?\nA: The lateral PTS predominantly increases anterior tibial translation under pivoting loads, intensifying graft strain.\nB: The medial PTS chiefly governs varus\u2013valgus stability and has minimal impact on sagittal plane graft forces.\nC: The lateral PTS primarily affects coronal alignment without substantially altering rotational stresses on the graft.\nD: The medial PTS elevates anterior drawer forces more than lateral PTS, making it less critical for rotational stability.\nExplanation: A steeper lateral plateau slope exacerbates anterior tibial shift and rotational loads during pivot motions, placing greater strain on the ACL graft.\nCorrect Answer: A\n</output_format>",
    "question": "Given that a lateral posterior tibial slope (PTS) \u22655\u00b0 carries a markedly higher odds ratio for ACL reconstruction failure than a medial PTS \u22655\u00b0, which biomechanical rationale best supports prioritizing lateral slope correction in preoperative planning?",
    "choices": {
      "A": "The lateral PTS predominantly increases anterior tibial translation under pivoting loads, intensifying graft strain.",
      "B": "The medial PTS chiefly governs varus\u2013valgus stability and has minimal impact on sagittal plane graft forces.",
      "C": "The lateral PTS primarily affects coronal alignment without substantially altering rotational stresses on the graft.",
      "D": "The medial PTS elevates anterior drawer forces more than lateral PTS, making it less critical for rotational stability."
    },
    "answer": "A",
    "explanation": "A steeper lateral plateau slope exacerbates anterior tibial shift and rotational loads during pivot motions, placing greater strain on the ACL graft.",
    "question_token_count": 46,
    "answer_correctness_score": 10,
    "explanation_validity_score": 10,
    "question_clarity_score": 7,
    "question_difficulty_score": 8,
    "question_groundedness_score": 10,
    "avg_answer_token_count": 21
  },
  {
    "context": "In recent years, many advances in pancreatic surgery have been achieved. Nevertheless, the rate of pancreatic fistula following pancreatic tail resection does not differ between various techniques, still reaching up to 30% in prospective multicentric studies. Taking into account contradictory results concerning the usefulness of covering resection margins after distal pancreatectomy, we sought to perform a systematic, retrospective analysis of patients that underwent distal pancreatectomy at our center.\n\nWe retrospectively analysed the data of 74 patients that underwent distal pancreatectomy between 2001 and 2011 at the community hospital in Neuss. Demographic factors, indications, postoperative complications, surgical or interventional revisions, and length of hospital stay were registered to compare the outcome of patients undergoing distal pancreatectomy with coverage of the resection margins vs. patients undergoing distal pancreatectomy without coverage of the resection margins. Differences between groups were calculated using Fisher's exact and Mann-Whitney U test.\n\nMain indications for pancreatic surgery were insulinoma (n=18, 24%), ductal adenocarcinoma (n=9, 12%), non-single-insulinoma-pancreatogenic-hypoglycemia-syndrome (NSIPHS) (n=8, 11%), and pancreatic cysts with pancreatitis (n=8, 11%). In 39 of 74 (53%) patients no postoperative complications were noted. In detail we found that 23/42 (55%) patients with coverage vs. 16/32 (50%) without coverage of the resection margins had no postoperative complications. The most common complications were pancreatic fistulas in eleven patients (15%), and postoperative bleeding in nine patients (12%). Pancreatic fistulas occurred in patients without coverage of the resection margins in 7/32 (22%) vs. 4/42 (1011%) with coverage are of the resection margins, yet without reaching statistical significance. Postoperative bleeding ensued with equal frequency in both groups (12% with coverage versus 13% without coverage of the resection margins). The reoperation rate was 8%. The hospital stay for patients without coverage was 13 days (5-60) vs. 17 days (8-60) for patients with coverage.\n\n",
    "topic": "Evaluation of overall complication and reoperation rates in the context of existing multicenter prospective data reporting up to 30% fistula incidence.",
    "response": "<document_analysis>\nThe context reports a retrospective analysis comparing distal pancreatectomy with versus without coverage of resection margins, focusing on postoperative complications (pancreatic fistulas, bleeding), reoperation rates, and length of stay. Key findings: coverage group had a lower fistula incidence numerically (10% vs 22%) but not statistically significant, identical bleeding rates (~12\u201313%), an overall reoperation rate of 8%, and a longer median hospital stay (17 vs 13 days). The main tension: a modest, non-significant reduction in fistulas is offset by prolonged hospitalization, questioning the net benefit of coverage. A probing question should force integration of statistical significance, clinical trade-offs, and outcome interpretation. Difficulty level: 7/10 \u2013 requires critical thinking about study results and implications rather than recalling facts.\n</document_analysis>\n\n<output_format>\nQuestion: Despite observing a decrease in pancreatic fistula rates from 22% to 10% with coverage of resection margins, which finding most undermines the case for adopting margin coverage as a routine practice?\nA: The reduction in fistula rate did not reach statistical significance and was accompanied by a longer median hospital stay.\nB: The coverage technique led to a higher rate of postoperative bleeding compared to no coverage.\nC: The reoperation rate doubled in the coverage group relative to the non\u2011coverage group.\nD: The complication\u2011free rate increased significantly in the coverage group, implying coverage added risk.\nExplanation: Although margin coverage showed a lower fistula rate (10% vs 22%), this difference lacked statistical significance and coverage was associated with a longer median hospital stay (17 vs 13 days), negating a clear clinical benefit. Bleeding rates and reoperation rates were similar, and there was no significant change in complication\u2011free rates.\nCorrect Answer: A\n</output_format>",
    "question": "Despite observing a decrease in pancreatic fistula rates from 22% to 10% with coverage of resection margins, which finding most undermines the case for adopting margin coverage as a routine practice?",
    "choices": {
      "A": "The reduction in fistula rate did not reach statistical significance and was accompanied by a longer median hospital stay.",
      "B": "The coverage technique led to a higher rate of postoperative bleeding compared to no coverage.",
      "C": "The reoperation rate doubled in the coverage group relative to the non\u2011coverage group.",
      "D": "The complication\u2011free rate increased significantly in the coverage group, implying coverage added risk."
    },
    "answer": "A",
    "explanation": "Although margin coverage showed a lower fistula rate (10% vs 22%), this difference lacked statistical significance and coverage was associated with a longer median hospital stay (17 vs 13 days), negating a clear clinical benefit. Bleeding rates and reoperation rates were similar, and there was no significant change in complication\u2011free rates.",
    "question_token_count": 40,
    "answer_correctness_score": 10,
    "explanation_validity_score": 10,
    "question_clarity_score": 8,
    "question_difficulty_score": 8,
    "question_groundedness_score": 10,
    "avg_answer_token_count": 18
  },
  {
    "context": "Our hypothesis is that the adoption of Department of Health (DH) guidance has led to an improvement in outcome in gynaecological cancer survival.\n\nIn 1999 the DH in England introduced the Improving Outcomes in Gynaecological Cancer guidance, advising case management by multidisciplinary teams with surgical concentration in specialist hospitals. This guidance was rapidly adopted in the East of England, with a population of 2.5 million.\n\nThe population of the Anglia Cancer Network was approximately 2.3 million.\n\nFrom 1996 to 2003, details of 3406 cases of gynaecological cancer were identified in the Anglia region of England. Survival analysis was performed by Cox proportional hazards regression, relative to cases diagnosed in 1996.\n\nPrimary endpoint was survival.\n\nThe survival rates for cases diagnosed between 1996 and 1999 were broadly the same across the time period, with a marked improvement taking place in 2000, and continuing to 2003 (HR 0.71, 95% CI 0.64-0.79, comparing 2000-03 with 1996-99 diagnoses), for all gynaecological sites combined. Adjustment for treatments or method of case follow-up did not attenuate these improvements. There was a concurrent change towards major surgery being performed in specialist centres from 2000.\n\n",
    "topic": "Policy implementation science principles illustrated by the uptake and outcome evaluation of DH gynaecological cancer guidance.",
    "response": "<document_analysis>\nThe context describes a before\u2013after observational evaluation of policy implementation (DH guidance) using Cox regression to compare gynaecological cancer survival pre- and post-guidance, with adjustment for treatment and follow-up methods. Central ideas include: rapid uptake of centralisation and MDT working; marked survival improvement (HR 0.71 for 2000\u201303 vs\u00a01996\u201399); adjustments that did not attenuate the hazard ratio; and concurrent centralisation of major surgery. A key nuance is that tumour stage at diagnosis\u2014a critical prognostic factor\u2014was not mentioned as adjusted, leaving potential for stage\u2010migration or case\u2010mix confounding. The most probing question will test understanding of unmeasured confounding in survival analyses within policy evaluations. Difficulty is calibrated at level 8, requiring expert insight into causal inference and implementation science.\n</document_analysis>\n\n<output_format>\nQuestion: In assessing whether the observed 29% reduction in hazard of death after centralising gynaecological cancer services is attributable to the Department of Health guidance, which unmeasured factor would most seriously threaten the validity of this before\u2013after Cox regression analysis?\nA: Case\u2010mix differences in tumour stage at diagnosis \nB: Temporal changes in death certificate coding accuracy  \nC: Shifts in population age distribution  \nD: Variation in follow\u2010up surveillance intervals  \nExplanation: Tumour stage is a primary prognostic factor that was not adjusted for; differences in stage distribution over time could confound survival gains.  \nCorrect Answer: A\n</output_format>",
    "question": "In assessing whether the observed 29% reduction in hazard of death after centralising gynaecological cancer services is attributable to the Department of Health guidance, which unmeasured factor would most seriously threaten the validity of this before\u2013after Cox regression analysis?",
    "choices": {
      "A": "Case\u2010mix differences in tumour stage at diagnosis",
      "B": "Temporal changes in death certificate coding accuracy",
      "C": "Shifts in population age distribution",
      "D": "Variation in follow\u2010up surveillance intervals"
    },
    "answer": "A",
    "explanation": "Tumour stage is a primary prognostic factor that was not adjusted for; differences in stage distribution over time could confound survival gains.",
    "question_token_count": 51,
    "answer_correctness_score": 10,
    "explanation_validity_score": 10,
    "question_clarity_score": 7,
    "question_difficulty_score": 8,
    "question_groundedness_score": 10,
    "avg_answer_token_count": 8
  },
  {
    "context": "Prostate-specific antigen (PSA) levels can show wide fluctuations when repeatedly measured. Here we investigatewd if: (a) biopsy timing influences the prostate cancer (PC) detection rate in patients with fluctuating PSA (flu-PSA) in comparison with patients with steadily increasing PSA (si-PSA); (b) PSA slope estimated in patients with flu-PSA predicts a different risk of cancer detection; (c) flu-PSA and si-PSA patients develop PC in topographically different sites; (d) the behaviour of pre-operative PSA is an expression of a disease with defferent characteristics to the following radical prostatectomy.\n\nThe study involved 211 patients who underwent at least a second biopsy after a first negative prostate biopsy. PSA Slope, PSA velocity (PSAV) and PSA doubling time (PSADT) were estimated. Flu-PSA level was defined as a PSA series with at least one PSA value lower than the one immediately preceding it.\n\n82 patients had flu-PSA levels and 129 si-PSA levels. There were no significant differences between the two groups in terms of cancer detection, clinical or pathological stage, but the si-PSA group with cancer had a higher Gleason score. No difference was found for PSA Slope between flu-PSA patients with cancer and those without.\n\n",
    "topic": "Design considerations for longitudinal PSA monitoring studies, including sample size, inclusion criteria, and repeated biopsy protocols.",
    "response": "<document_analysis>\nThe context describes a prostate cancer study comparing fluctuating PSA (flu-PSA) and steadily increasing PSA (si-PSA) cohorts. While detection rates, clinical and pathological stages did not differ, the si-PSA group exhibited higher Gleason scores among cancer cases. For designing a longitudinal PSA monitoring study\u2014with repeated biopsies and the goal of detecting differences in tumor grade distributions\u2014one must select statistical methods that respect the ordinal nature of Gleason scores when estimating sample size and power. Asking which modelling approach best accommodates ordered categories (rather than treating Gleason score as continuous or simply dichotomous) requires domain experts to integrate biostatistical design principles with the study\u2019s findings, thus achieving high complexity and pedagogical value.\nDifficulty: 8/10\n</document_analysis>\n\n<output_format>\nQuestion: When calculating the required sample size to compare Gleason score distributions between cohorts with fluctuating versus steadily increasing PSA trajectories, which statistical approach best accommodates the ordered nature of Gleason scores and the observed intergroup shift?\nA: Two-sample t\u2011test on mean Gleason scores\nB: Chi-square test on dichotomized low versus high Gleason scores\nC: Ordinal logistic regression modeling shifts across Gleason categories\nD: Poisson regression treating Gleason score as a count outcome\nExplanation: Gleason scores are inherently ordinal; ordinal logistic regression leverages the full ordered information and is most appropriate for sample-size and power calculations when comparing ordered categories.\nCorrect Answer: C\n</output_format>",
    "question": "When calculating the required sample size to compare Gleason score distributions between cohorts with fluctuating versus steadily increasing PSA trajectories, which statistical approach best accommodates the ordered nature of Gleason scores and the observed intergroup shift?",
    "choices": {
      "A": "Two-sample t\u2011test on mean Gleason scores",
      "B": "Chi-square test on dichotomized low versus high Gleason scores",
      "C": "Ordinal logistic regression modeling shifts across Gleason categories",
      "D": "Poisson regression treating Gleason score as a count outcome"
    },
    "answer": "C",
    "explanation": "Gleason scores are inherently ordinal; ordinal logistic regression leverages the full ordered information and is most appropriate for sample-size and power calculations when comparing ordered categories.",
    "question_token_count": 43,
    "answer_correctness_score": 10,
    "explanation_validity_score": 10,
    "question_clarity_score": 8,
    "question_difficulty_score": 9,
    "question_groundedness_score": 6,
    "avg_answer_token_count": 11
  },
  {
    "context": "The aim of this study was to describe the evolution and epidemiologic characteristics of shigellosis patients over a 25 year period in a large city.\n\nShigellosis is a notifiable disease in Spain since 1988. Cases are analyzed in Barcelona residents included in the registry between 1988-2012. A descriptive analysis by sex, age, mode of transmission and Shigella species is presented. Trend analysis and time series were performed.\n\nOf the 559 cases analyzed, 60.15% were males. A sustained increase was observed in the trend since 2008 in males (p<0,05), especially at the expense of males who had no history of food poisoning or travel to endemic areas. The increasing tendency was greater in males from 21 to 60 years, both for S. flexneri (since 2009), and for S. sonnei (since 2004). In 2012 it was noted that in the men with S. flexneri, the 63% were men who have sex with men.\n\n",
    "topic": "Public health strategies for prevention and control of shigellosis in light of shifting transmission dynamics and high-risk groups",
    "response": "<document_analysis>\nThe context describes a 25\u2011year surveillance of shigellosis in Barcelona, showing a notable shift since 2008: rising cases among adult males without traditional exposures (food poisoning, travel), driven by S. flexneri and S. sonnei, with 63% of recent S. flexneri infections in 2012 occurring in men who have sex with men (MSM). This indicates a change from classic foodborne or travel\u2011associated transmission to fecal\u2011oral spread via sexual contact in MSM. A probing question should focus on tailoring public health interventions to this emerging high\u2011risk group and transmission route.\nDifficulty rating: 8/10 \u2013 requires applying epidemiologic findings to design targeted prevention strategies for a specific at\u2011risk population and transmission mode.\n</document_analysis>\n\n<output_format>\nQuestion: Given the shift toward sexual transmission of Shigella flexneri among men who have sex with men, which public health intervention would most effectively reduce incidence in this high\u2011risk group?\nA: Increase regular restaurant hygiene inspections citywide  \nB: Issue travel advisories for endemic regions  \nC: Integrate fecal\u2011oral hygiene and safe sex counseling into MSM sexual health services  \nD: Expand municipal water chlorination programs  \nExplanation: The surge among MSM reflects person\u2011to\u2011person fecal\u2011oral spread during sexual activity; targeted hygiene and safe\u2011sex counseling in venues serving MSM directly addresses this route.  \nCorrect Answer: C\n</output_format>",
    "question": "Given the shift toward sexual transmission of Shigella flexneri among men who have sex with men, which public health intervention would most effectively reduce incidence in this high\u2011risk group?",
    "choices": {
      "A": "Increase regular restaurant hygiene inspections citywide",
      "B": "Issue travel advisories for endemic regions",
      "C": "Integrate fecal\u2011oral hygiene and safe sex counseling into MSM sexual health services",
      "D": "Expand municipal water chlorination programs"
    },
    "answer": "C",
    "explanation": "The surge among MSM reflects person\u2011to\u2011person fecal\u2011oral spread during sexual activity; targeted hygiene and safe\u2011sex counseling in venues serving MSM directly addresses this route.",
    "question_token_count": 38,
    "answer_correctness_score": 10,
    "explanation_validity_score": 10,
    "question_clarity_score": 5,
    "question_difficulty_score": 7,
    "question_groundedness_score": 8,
    "avg_answer_token_count": 10
  },
  {
    "context": "A prerequisite for a hormonal influence on anal continence in women is the presence of hormone receptors in the tissues of the anal canal. Using immunohistochemical techniques, we demonstrated and localized estrogen and progesterone receptors (ER, PR) in tissue sections of the anal canal.\n\nThirty-five specimens of the anorectal region from 21 patients (14 women, seven men) were examined histologically for smooth muscle (present in specimens from ten females and in seven males), striated muscle (present in three females and five males), and perimuscular connective tissue (present in 12 females and seven males). Immunostaining for ER and PR was then performed by incubating with primary anti-ER and anti-PR antibody and visualization of specific antibody binding by the ABC technique with DAB as chromogen.\n\nPositive staining for ER and PR was seen exclusively over cell nuclei. Estrogen receptors were found in the smooth muscle cells of the internal sphincter of all females (10/10) and in four of the seven males. Staining for ER was detected in the perimuscular connective tissue of all females (12/12) and in four of the seven males. No specific staining for ER or PR was found in the nuclei of striated muscle cells of the external sphincter in males or females (n = 8). In females, about 50% of the ER-positive tissues were also found to be positive for PR. Amongst the male patients, only one exhibited staining for PR, and this was confined to the smooth muscle.\n\n",
    "topic": "Interpret the clinical relevance of partial co\u2011expression of PR in ER\u2011positive anal canal tissues of women and its impact on hormone therapy strategies.",
    "response": "<document_analysis>\nThe context reports immunohistochemical localization of ER and PR in anal canal tissues, showing that approximately half of the ER-positive tissues in women also express PR. Understanding the functional interplay of ER and PR in smooth muscle and connective tissue suggests that hormone therapy for anal incontinence may need to account for PR status. Therefore, a probing question can focus on how partial PR co-expression affects therapeutic decision\u2011making for estrogen and progesterone use. Difficulty is calibrated high (8/10) by requiring synthesis of receptor biology, hormonal pharmacotherapy, and personalized medicine principles.\n</document_analysis>\n\n<output_format>\nQuestion: Given that only about half of the ER\u2011positive anal canal tissues in women co\u2011express progesterone receptors, which hormone therapy strategy best aligns with receptor\u2011targeted optimization for anal continence?\nA: Prescribe estrogen monotherapy to all ER\u2011positive women, since PR variability indicates negligible additional benefit from progesterone.\nB: Tailor therapy: use estrogen alone for ER+/PR\u2212 patients, but combine estrogen with a progestogen for ER+/PR+ patients to engage both receptor pathways.\nC: Recommend progesterone monotherapy for ER+/PR+ women, as activating PR alone compensates for estrogen effects on anal sphincter function.\nD: Avoid any progestogen use because PR co\u2011expression is insufficiently prevalent to warrant adding progesterone in standard treatment.\nExplanation: Combining estrogen with progestogen only in those women whose tissues express both receptors leverages the full receptor complement, whereas estrogen alone suffices when PR is absent.\nCorrect Answer: B\n</output_format>",
    "question": "Given that only about half of the ER\u2011positive anal canal tissues in women co\u2011express progesterone receptors, which hormone therapy strategy best aligns with receptor\u2011targeted optimization for anal continence?",
    "choices": {
      "A": "Prescribe estrogen monotherapy to all ER\u2011positive women, since PR variability indicates negligible additional benefit from progesterone.",
      "B": "Tailor therapy: use estrogen alone for ER+/PR\u2212 patients, but combine estrogen with a progestogen for ER+/PR+ patients to engage both receptor pathways.",
      "C": "Recommend progesterone monotherapy for ER+/PR+ women, as activating PR alone compensates for estrogen effects on anal sphincter function.",
      "D": "Avoid any progestogen use because PR co\u2011expression is insufficiently prevalent to warrant adding progesterone in standard treatment."
    },
    "answer": "B",
    "explanation": "Combining estrogen with progestogen only in those women whose tissues express both receptors leverages the full receptor complement, whereas estrogen alone suffices when PR is absent.",
    "question_token_count": 40,
    "answer_correctness_score": 10,
    "explanation_validity_score": 10,
    "question_clarity_score": 8,
    "question_difficulty_score": 8,
    "question_groundedness_score": 10,
    "avg_answer_token_count": 28
  },
  {
    "context": "The prevalence of combined humeral and glenoid defects varies between 79 and 84\u00a0% in case of chronic posttraumatic anterior shoulder instability. The main goal of this study was to evaluate the relationship between humeral and glenoid defects based on quantitative radiological criteria.\n\nA retrospective study was performed between 2000 and 2011 including patients who underwent primary surgical shoulder stabilization for chronic posttraumatic anterior shoulder instability, with bone defects in both the glenoid and humerus and a healthy contralateral shoulder. The following measurements were taken: D/R ratio (Hill-Sachs lesion depth/humeral head radius) on an AP X-ray in internal rotation and the D1/D2 ratio [diameter of the involved glenoid articular surfaces (D1)/the healthy one (D2)] on a comparative Bernageau glenoid profile view. Measurements were taken by two observers. Correlations were determined by the Spearman correlation coefficients (r), Bland and Altman diagrams, and intra-class correlation coefficients (ICC). A sample size calculation was done.\n\nThirty patients were included, 25 men/5 women, mean age 29.8\u00a0\u00b1\u00a011.2\u00a0years. The mean D/R was 23\u00a0\u00b1\u00a012\u00a0% for observer 1 and 23\u00a0\u00b1\u00a010\u00a0% for observer 2. The mean D1/D2 was 95\u00a0\u00b1\u00a04\u00a0% for observer 1 and 94\u00a0\u00b1\u00a06\u00a0% for observer 2. No significant correlation was found between humeral and glenoid bone defects by observer 1 (r\u00a0=\u00a00.23, p\u00a0=\u00a00.22) or observer 2 (r\u00a0=\u00a00.05, p\u00a0=\u00a00.78). Agreement of the observers for the D/R ratio was excellent (ICC\u00a0=\u00a00.89\u00a0\u00b1\u00a00.04, p\u00a0<\u00a00.00001) and good for the D1/D2 ratio (ICC\u00a0=\u00a00.54\u00a0\u00b1\u00a00.14, p\u00a0=\u00a00.006).\n\n",
    "topic": "Threshold values and percentage cut-offs for clinically relevant Hill\u2013Sachs and glenoid defect sizes guiding surgical stabilization.",
    "response": "<document_analysis>\nThe context provides quantitative radiological measurements of humeral (D/R ratio) and glenoid (D1/D2 ratio) defects, their inter-observer reliability via intra-class correlation coefficients (ICC), and correlation analysis. Central ideas include high prevalence of combined defects, precise measurement techniques, and assessment of inter-observer agreement (ICC=0.89 for D/R, ICC=0.54 for D1/D2). No significant correlation was found between defect sizes. Key technical detail: interpretation of ICC values for measurement reliability. This lends itself to a nuanced question on reliability interpretation thresholds in clinical imaging. Difficulty rated 6/10.\n</document_analysis>\n\n<output_format>\nQuestion: Given intra-class correlation coefficients of 0.89 for the Hill\u2013Sachs D/R ratio and 0.54 for the glenoid D1/D2 ratio, which statement best describes the inter-observer reliability of these two measurements?\nA: Both ratios demonstrate excellent reliability.\nB: The D/R ratio demonstrates excellent reliability, while the D1/D2 ratio demonstrates good (moderate) reliability.\nC: The D/R ratio demonstrates good (moderate) reliability, while the D1/D2 ratio demonstrates poor reliability.\nD: Both ratios demonstrate only fair reliability.\nExplanation: An ICC above 0.75 is generally considered excellent reliability, whereas an ICC between 0.40 and 0.75 reflects good or moderate reliability.\nCorrect Answer: B\n</output_format>",
    "question": "Given intra-class correlation coefficients of 0.89 for the Hill\u2013Sachs D/R ratio and 0.54 for the glenoid D1/D2 ratio, which statement best describes the inter-observer reliability of these two measurements?",
    "choices": {
      "A": "Both ratios demonstrate excellent reliability.",
      "B": "The D/R ratio demonstrates excellent reliability, while the D1/D2 ratio demonstrates good (moderate) reliability.",
      "C": "The D/R ratio demonstrates good (moderate) reliability, while the D1/D2 ratio demonstrates poor reliability.",
      "D": "Both ratios demonstrate only fair reliability."
    },
    "answer": "B",
    "explanation": "An ICC above 0.75 is generally considered excellent reliability, whereas an ICC between 0.40 and 0.75 reflects good or moderate reliability.",
    "question_token_count": 50,
    "answer_correctness_score": 10,
    "explanation_validity_score": 10,
    "question_clarity_score": 8,
    "question_difficulty_score": 6,
    "question_groundedness_score": 10,
    "avg_answer_token_count": 15
  },
  {
    "context": "Prospective multicenter longitudinal cohort study.\n\nTo validate the prognostic value of the acute phase sacral sparing measurements with regard to chronic phase-independent ambulation in patients with traumatic spinal cord injury (SCI).\n\nEuropean Multicenter Study of Human Spinal Cord Injury (EM-SCI).\n\nIn 432 patients, acute phase (0-15 days) American Spinal Injury Association (ASIA)/International Spinal Cord Society neurological standard scale (AIS) grades, ASIA sacral sparing measurements, which are S4-5 light touch (LT), S4-5 pin prick (PP), anal sensation and voluntary anal contraction; and chronic phase (6 or 12 months) indoor mobility Spinal Cord Independence Measure (SCIM) measurements were analyzed. Calculations of positive and negative predictive values (PPV/NPV) as well as univariate and multivariate logistic regressions were performed in all four sacral sparing criteria. The area under the receiver-operating characteristic curve (AUC) ratios of all regression equations was calculated.\n\nTo achieve independent ambulation 1-year post injury, a normal S4-5 PP score showed the best PPV (96.5%, P<0.001, 95% confidence interval (95% CI): 87.9-99.6). Best NPV was reported in the S4-5 LT score (91.7%, P<0.001, 95% CI: 81.6-97.2). The use of the combination of only voluntary anal contraction and the S4-5 LT and PP sensory scores (AUC: 0.906, P<0.001, 95% CI: 0.871-0.941) showed significantly better (P<0.001, 95% CI: 0.038-0.128) discriminating results in prognosticating 1-year independent ambulation than with the use of currently used distinction between complete and incomplete SCI (AUC: 0.823, P<0.001, 95% CI: 0.781-0.864).\n\n",
    "topic": "Clinical evaluation and scoring of anal sensation and voluntary anal contraction in sacral sparing assessment.",
    "response": "<document_analysis>\nThe context reports a multicenter study evaluating acute phase sacral sparing measures (S4-5 light touch, S4-5 pin prick, anal sensation, voluntary anal contraction) for predicting independent ambulation at one year post-SCI. Key findings: S4-5 pin prick has the highest positive predictive value (96.5%) for ruling in future independent ambulation, while S4-5 light touch has the highest negative predictive value (91.7%) for ruling it out. Combining motor and sensory sacral sparing yields a superior AUC (0.906) versus the binary complete/incomplete classification (0.823). Irrelevant content is absent. A challenging question should require applying the concepts of PPV and NPV to clinical decision-making, distinguishing their complementary uses in prognostication.\nDifficulty rating: 7/10\n</document_analysis>\n\n<output_format>\nQuestion: In acute spinal cord injury prognostication for one-year independent ambulation, which sacral sparing assessments best serve respectively to confirm and to exclude the likelihood of future ambulation?\nA: S4-5 light touch to confirm, S4-5 pin prick to exclude  \nB: S4-5 pin prick to confirm, S4-5 light touch to exclude  \nC: Voluntary anal contraction to confirm, anal sensation to exclude  \nD: Combined motor and sensory scores to confirm, binary classification to exclude  \nExplanation: To \u201crule in\u201d independent ambulation use the test with highest PPV (S4-5 pin prick, 96.5%); to \u201crule out\u201d use the test with highest NPV (S4-5 light touch, 91.7%).  \nCorrect Answer: B\n</output_format>",
    "question": "In acute spinal cord injury prognostication for one-year independent ambulation, which sacral sparing assessments best serve respectively to confirm and to exclude the likelihood of future ambulation?",
    "choices": {
      "A": "S4-5 light touch to confirm, S4-5 pin prick to exclude",
      "B": "S4-5 pin prick to confirm, S4-5 light touch to exclude",
      "C": "Voluntary anal contraction to confirm, anal sensation to exclude",
      "D": "Combined motor and sensory scores to confirm, binary classification to exclude"
    },
    "answer": "B",
    "explanation": "To \u201crule in\u201d independent ambulation use the test with highest PPV (S4-5 pin prick, 96.5%); to \u201crule out\u201d use the test with highest NPV (S4-5 light touch, 91.7%).",
    "question_token_count": 36,
    "answer_correctness_score": 10,
    "explanation_validity_score": 10,
    "question_clarity_score": 8,
    "question_difficulty_score": 8,
    "question_groundedness_score": 10,
    "avg_answer_token_count": 15
  }
]