[
  {
    "context": "<P> I Can Only Imagine is a 2018 American Christian drama film directed by the Erwin Brothers and written by Alex Cramer , Jon Erwin , and Brent McCorkle , based on the story behind the MercyMe song of the same name , the best - selling Christian single of all time . The film stars J. Michael Finley as Bart Millard , the lead singer who wrote the song about his relationship with his father ( Dennis Quaid ) . Madeline Carroll , Priscilla Shirer , Cloris Leachman , and Trace Adkins also star . </P>",
    "topic": "The collaborative screenwriting process among Alex Cramer, Jon Erwin, and Brent McCorkle in adapting a song\u2019s backstory to screenplay.",
    "response": "<document_analysis>\nThe context provides minimal but meaningful information: the film \u201cI Can Only Imagine\u201d was a collaborative screenplay by Alex Cramer, Jon Erwin, and Brent McCorkle, adapting the true story behind a brief, lyric\u2010driven song into a full-length drama. Key themes include translation of a concise musical narrative into cinematic structure, preservation of emotional authenticity, and integration of song elements into the screenplay. The most probing question examines the fundamental screenwriting obstacle in this adaptation process.\n</document_analysis>\n\n<output_format>\nQuestion: What primary screenwriting challenge do writers encounter when transforming a song\u2019s concise backstory into a full-length feature narrative, as exemplified by the collaboration on \u201cI Can Only Imagine\u201d?\nA: Interpreting ambiguous lyrics into concrete character motivations\nB: Expanding a concise musical narrative into a full three-act screenplay\nC: Seamlessly integrating musical performances without disrupting dramatic pacing\nD: Balancing adherence to the song\u2019s emotional tone with fictional dramatization\nExplanation: The essential hurdle is extrapolating the brief lyrical storyline into a cohesive three-act structure suitable for a feature film.\nCorrect Answer: B\n</output_format>",
    "question": "What primary screenwriting challenge do writers encounter when transforming a song\u2019s concise backstory into a full-length feature narrative, as exemplified by the collaboration on \u201cI Can Only Imagine\u201d?",
    "choices": {
      "A": "Interpreting ambiguous lyrics into concrete character motivations",
      "B": "Expanding a concise musical narrative into a full three-act screenplay",
      "C": "Seamlessly integrating musical performances without disrupting dramatic pacing",
      "D": "Balancing adherence to the song\u2019s emotional tone with fictional dramatization"
    },
    "answer": "B",
    "explanation": "The essential hurdle is extrapolating the brief lyrical storyline into a cohesive three-act structure suitable for a feature film.",
    "question_token_count": 37,
    "answer_correctness_score": 10,
    "explanation_validity_score": 10,
    "question_clarity_score": 6,
    "question_difficulty_score": 7,
    "question_groundedness_score": 2,
    "avg_answer_token_count": 12
  },
  {
    "context": "<Table> <Tr> <Th> Rank </Th> <Th> Points </Th> <Th> Player </Th> <Th> Date </Th> <Th> 1st </Th> <Th> 2nd </Th> <Th> 3rd </Th> <Th> 4th </Th> <Th> Team </Th> <Th> Opponent </Th> <Th> Score </Th> <Th> MP </Th> <Th> FGM </Th> <Th> FGA </Th> <Th> 3PM </Th> <Th> 3PA </Th> <Th> FTM </Th> <Th> FTA </Th> <Th> Notes </Th> <Th> Ref . </Th> </Tr> <Tr> <Th colspan=\"4\"> Scoring by quarter </Th> </Tr> <Tr> <Td> </Td> <Td> 100 </Td> <Td> Chamberlain , Wilt Wilt Chamberlain * </Td> <Td> 000000001962 - 03 - 02 - 0000 March 2 , 1962 </Td> <Td> 23 </Td> <Td> 18 </Td> <Td> 28 </Td> <Td> 31 </Td> <Td> Philadelphia Warriors </Td> <Td> New York Knicks </Td> <Td> 169 -- 147 </Td> <Td> 48 </Td> <Td> 36 </Td> <Td> 63 </Td> <Td> -- </Td> <Td> -- </Td> <Td> 28 </Td> <Td> 32 </Td> <Td> </Td> <Td> </Td> </Tr> <Tr> <Td> </Td> <Td> 81 </Td> <Td> Bryant , Kobe Kobe Bryant </Td> <Td> 000000002006 - 01 - 22 - 0000 January 22 , 2006 </Td> <Td> 14 </Td> <Td> 12 </Td> <Td> 27 </Td> <Td> 28 </Td> <Td> Los Angeles Lakers </Td> <Td> Toronto Raptors </Td> <Td> 122 -- 104 </Td> <Td> 41 : 56 </Td> <Td> 28 </Td> <Td> 46 </Td> <Td> 7 </Td> <Td> 13 </Td> <Td> 18 </Td> <Td> 20 </Td> <Td> </Td> <Td> </Td> </Tr> <Tr> <Td> </Td> <Td> 78 </Td> <Td> Chamberlain , Wilt Wilt Chamberlain * </Td> <Td> 000000001961 - 12 - 08 - 0000 December 8 , 1961 </Td> <Td> -- </Td> <Td> -- </Td> <Td> -- </Td> <Td> -- </Td> <Td> Philadelphia Warriors </Td> <Td> Los Angeles Lakers </Td> <Td> 147 -- 151 </Td> <Td> 63 </Td> <Td> 31 </Td> <Td> 62 </Td> <Td> -- </Td> <Td> -- </Td> <Td> 16 </Td> <Td> 31 </Td> <Td> </Td> <Td> </Td> </Tr> <Tr> <Td> </Td> <Td> 73 </Td> <Td> Chamberlain , Wilt Wilt Chamberlain * </Td> <Td> 000000001962 - 01 - 13 - 0000 January 13 , 1962 </Td> <Td> -- </Td> <Td> -- </Td> <Td> -- </Td> <Td> -- </Td> <Td> Philadelphia Warriors </Td> <Td> Chicago Packers </Td> <Td> 135 -- 117 </Td> <Td> 48 </Td> <Td> 29 </Td> <Td> 48 </Td> <Td> -- </Td> <Td> -- </Td> <Td> 15 </Td> <Td> 25 </Td> <Td> </Td> <Td> </Td> </Tr> <Tr> <Td> 73 </Td> <Td> Chamberlain , Wilt Wilt Chamberlain * </Td> <Td> 000000001962 - 11 - 16 - 0000 November 16 , 1962 </Td> <Td> -- </Td> <Td> -- </Td> <Td> -- </Td> <Td> -- </Td> <Td> San Francisco Warriors </Td> <Td> New York Knicks </Td> <Td> 127 -- 111 </Td> <Td> 48 </Td> <Td> 29 </Td> <Td> 43 </Td> <Td> -- </Td> <Td> -- </Td> <Td> 15 </Td> <Td> 19 </Td> <Td> </Td> <Td> </Td> </Tr> <Tr> <Td> 73 </Td> <Td> Thompson , David David Thompson * </Td> <Td> 000000001978 - 04 - 09 - 0000 April 9 , 1978 </Td> <Td> 32 </Td> <Td> 21 </Td> <Td> 9 </Td> <Td> 11 </Td> <Td> Denver Nuggets </Td> <Td> Detroit Pistons </Td> <Td> 137 -- 139 </Td> <Td> 43 </Td> <Td> 28 </Td> <Td> 38 </Td> <Td> -- </Td> <Td> -- </Td> <Td> 17 </Td> <Td> 20 </Td> <Td> </Td> <Td> </Td> </Tr> <Tr> <Td> 7 </Td> <Td> 72 </Td> <Td> Chamberlain , Wilt Wilt Chamberlain * </Td> <Td> 000000001962 - 11 - 03 - 0000 November 3 , 1962 </Td> <Td> -- </Td> <Td> -- </Td> <Td> -- </Td> <Td> -- </Td> <Td> San Francisco Warriors </Td> <Td> Los Angeles Lakers </Td> <Td> 115 -- 127 </Td> <Td> -- </Td> <Td> 29 </Td> <Td> 48 </Td> <Td> -- </Td> <Td> -- </Td> <Td> 14 </Td> <Td> 18 </Td> <Td> </Td> <Td> </Td> </Tr> <Tr> <Td> 8 </Td> <Td> 71 </Td> <Td> Baylor , Elgin Elgin Baylor * </Td> <Td> 000000001960 - 11 - 15 - 0000 November 15 , 1960 </Td> <Td> -- </Td> <Td> -- </Td> <Td> -- </Td> <Td> -- </Td> <Td> Los Angeles Lakers </Td> <Td> New York Knicks </Td> <Td> 123 -- 108 </Td> <Td> 45 </Td> <Td> 28 </Td> <Td> 48 </Td> <Td> -- </Td> <Td> -- </Td> <Td> 15 </Td> <Td> 18 </Td> <Td> </Td> <Td> </Td> </Tr> <Tr> <Td> 71 </Td> <Td> Robinson , David David Robinson * </Td> <Td> 000000001994 - 04 - 24 - 0000 April 24 , 1994 </Td> <Td> 18 </Td> <Td> 6 </Td> <Td> 19 </Td> <Td> 28 </Td> <Td> San Antonio Spurs </Td> <Td> Los Angeles Clippers </Td> <Td> 112 -- 97 </Td> <Td> 44 </Td> <Td> 26 </Td> <Td> 41 </Td> <Td> </Td> <Td> </Td> <Td> 18 </Td> <Td> 25 </Td> <Td> </Td> <Td> </Td> </Tr> <Tr> <Td> 10 </Td> <Td> 70 </Td> <Td> Chamberlain , Wilt Wilt Chamberlain * </Td> <Td> 000000001963 - 03 -",
    "topic": "Assess the correlation between high-volume shooting and team success in these games by comparing individual scoring to team win-loss outcomes.",
    "response": "<document_analysis>\nThe context provides individual high-scoring NBA games, listing each player\u2019s field goal attempts (FGA) and the game outcome (win/loss). A clear pattern: extremely high FGAs sometimes align with wins (e.g., 63 FGAs for 100 points, win) and sometimes with losses (e.g., 62 FGAs for 78 points, loss). This inconsistency allows probing the general correlation between shot volume and team success.\nDifficulty: 8/10 \u2013 requires synthesis of multiple data points and understanding that outliers defy simple correlation.\nPlanned Question: Ask which statement best reflects the observed relationship between FGAs and team victory in these top-scoring games.\n</document_analysis>\n\n<output_format>\nQuestion: In the NBA\u2019s ten highest-scoring individual performances, players\u2019 field goal attempts ranged widely and team results varied. Which statement best describes the relationship between a player\u2019s shot volume and their team\u2019s likelihood of winning?\nA: Every game with more than 50 field goal attempts ended in a team victory.\nB: Only performances with fewer than 50 attempts resulted in losses.\nC: There is no deterministic relationship, since some extremely high-attempt games ended in wins and others in losses.\nD: Games featuring over 60 field goal attempts always produced team wins.\nExplanation: While some high-attempt games (e.g., 63 attempts for 100 points) were wins, others (e.g., 62 attempts for 78 points) were losses, showing no consistent correlation.\nCorrect Answer: C\n</output_format>",
    "question": "In the NBA\u2019s ten highest-scoring individual performances, players\u2019 field goal attempts ranged widely and team results varied. Which statement best describes the relationship between a player\u2019s shot volume and their team\u2019s likelihood of winning?",
    "choices": {
      "A": "Every game with more than 50 field goal attempts ended in a team victory.",
      "B": "Only performances with fewer than 50 attempts resulted in losses.",
      "C": "There is no deterministic relationship, since some extremely high-attempt games ended in wins and others in losses.",
      "D": "Games featuring over 60 field goal attempts always produced team wins."
    },
    "answer": "C",
    "explanation": "While some high-attempt games (e.g., 63 attempts for 100 points) were wins, others (e.g., 62 attempts for 78 points) were losses, showing no consistent correlation.",
    "question_token_count": 44,
    "answer_correctness_score": 10,
    "explanation_validity_score": 10,
    "question_clarity_score": 6,
    "question_difficulty_score": 7,
    "question_groundedness_score": 8,
    "avg_answer_token_count": 16
  },
  {
    "context": "<P> The Lord of the Rings is a film series consisting of three high fantasy adventure films directed by Peter Jackson . They are based on the novel The Lord of the Rings by J.R.R. Tolkien . The films are subtitled The Fellowship of the Ring ( 2001 ) , The Two Towers ( 2002 ) and The Return of the King ( 2003 ) . They are a New Zealand - American venture produced by WingNut Films and The Saul Zaentz Company and distributed by New Line Cinema . </P>",
    "topic": "Critical review of the trilogy format as both a narrative device and a commercial model in adapting a single novel into multiple feature films.",
    "response": "<document_analysis>\nThe provided context offers a concise overview of The Lord of the Rings film series: its tripartite structure, production entities, and distribution partner. While narrative themes and commercial strategies are not explicitly detailed, the delineation of production versus distribution roles is clear. This enables a question probing the differentiation between producers and distributor\u2014a factual yet non\u2011trivial distinction for film-industry experts.\n</document_analysis>\n\n<output_format>\nQuestion: Which company in the Lord of the Rings film project was solely responsible for distribution rather than production?\nA: WingNut Films  \nB: The Saul Zaentz Company  \nC: New Line Cinema  \nD: Peter Jackson\u2019s production office  \nExplanation: While WingNut Films and The Saul Zaentz Company co-produced the trilogy, New Line Cinema alone handled its distribution.  \nCorrect Answer: C\n</output_format>",
    "question": "Which company in the Lord of the Rings film project was solely responsible for distribution rather than production?",
    "choices": {
      "A": "WingNut Films",
      "B": "The Saul Zaentz Company",
      "C": "New Line Cinema",
      "D": "Peter Jackson\u2019s production office"
    },
    "answer": "C",
    "explanation": "While WingNut Films and The Saul Zaentz Company co-produced the trilogy, New Line Cinema alone handled its distribution.",
    "question_token_count": 20,
    "answer_correctness_score": 10,
    "explanation_validity_score": 10,
    "question_clarity_score": 4,
    "question_difficulty_score": 6,
    "question_groundedness_score": 10,
    "avg_answer_token_count": 5
  },
  {
    "context": "<P> The 2018 UEFA Champions League Final was the final match of the 2017 -- 18 UEFA Champions League , the 63rd season of Europe 's premier club football tournament organised by UEFA , and the 26th season since it was renamed from the European Cup to the UEFA Champions League . It was played at the NSC Olimpiyskiy Stadium in Kiev , Ukraine on 26 May 2018 , between Spanish side and defending champions Real Madrid , who had won the competition in each of the last two seasons , and English side Liverpool . </P>",
    "topic": "The significance of the UEFA Champions League\u2019s rebranding from the European Cup and its effects on competition format and international appeal",
    "response": "<document_analysis>\nThe provided context briefly notes the renaming of the European Cup to the UEFA Champions League 26 seasons prior and highlights its status as Europe\u2019s premier club tournament. Although the context doesn\u2019t explicitly describe the new format elements, the rebranding is historically tied to major structural changes that increased international appeal\u2014most notably the introduction of a group stage, which guaranteed more marquee fixtures and enhanced TV revenue and global reach. This pivotal innovation differentiates the Champions League era from the old European Cup knockout-only format. Based on this, a question probing understanding of the rebranding\u2019s core format innovation is appropriate.\n</document_analysis>\n\n<output_format>\nQuestion: Which competition format innovation introduced with the UEFA Champions League rebranding most directly enhanced its international appeal by ensuring participating clubs multiple guaranteed high-profile matches?\nA: Introduction of preliminary qualifying knockout rounds  \nB: Implementation of a multi-team group stage before knockouts  \nC: Adoption of a single-match final at a neutral venue  \nD: Establishment of two-legged ties throughout all knockout rounds  \nExplanation: The multi-team group stage guaranteed each club several high-profile fixtures and increased broadcast and sponsorship value, driving the Champions League\u2019s global appeal.  \nCorrect Answer: B\n</output_format>",
    "question": "Which competition format innovation introduced with the UEFA Champions League rebranding most directly enhanced its international appeal by ensuring participating clubs multiple guaranteed high-profile matches?",
    "choices": {
      "A": "Introduction of preliminary qualifying knockout rounds",
      "B": "Implementation of a multi-team group stage before knockouts",
      "C": "Adoption of a single-match final at a neutral venue",
      "D": "Establishment of two-legged ties throughout all knockout rounds"
    },
    "answer": "B",
    "explanation": "The multi-team group stage guaranteed each club several high-profile fixtures and increased broadcast and sponsorship value, driving the Champions League\u2019s global appeal.",
    "question_token_count": 30,
    "answer_correctness_score": 10,
    "explanation_validity_score": 10,
    "question_clarity_score": 4,
    "question_difficulty_score": 6,
    "question_groundedness_score": 1,
    "avg_answer_token_count": 10
  },
  {
    "context": "<P> Human fertilization is the union of a human egg and sperm , usually occurring in the ampulla of the fallopian tube . The result of this union is the production of a zygote cell , or fertilized egg , initiating prenatal development . Scientists discovered the dynamics of human fertilization in the nineteenth century . </P>",
    "topic": "Comparative analysis of in vivo versus in vitro fertilization processes with emphasis on physiological versus laboratory conditions.",
    "response": "<document_analysis>\nThe provided context describes the in vivo site of human fertilization\u2014the ampulla of the fallopian tube\u2014highlighting the natural milieu in which sperm and egg unite to form a zygote. For a comparative in vivo versus in vitro analysis, the most pertinent physiological feature missing from conventional IVF systems is the dynamic microenvironment engineered by ciliated epithelial cells, which creates directed fluid currents to facilitate sperm transport and encounter with the oocyte. This nuanced mechanical and fluid\u2010dynamic detail is critical to replicate yet is poorly mimicked in static laboratory culture. The question probes understanding of how the ampullar microcurrents arise and why their absence in vitro presents a challenge\u2014requiring an expert\u2019s integration of tubal physiology with IVF protocol limitations. Difficulty rating: 8/10.\n</document_analysis>\n\n<output_format>\nQuestion: In comparing physiological fertilization within the fallopian tube ampulla to standard static IVF culture, which naturally occurring feature of the ampullar environment is absent in vitro and directly impairs efficient sperm transport toward the oocyte?\nA: Directed microcurrents generated by ciliated epithelial cells\nB: Rhythmic peristaltic contractions driven by ovarian hormones\nC: Pulsatile fluctuations in temperature along the tubal length\nD: Cyclical secretion of uterine glycoproteins synchronized with ovulation\nExplanation: The ampullary epithelium\u2019s motile cilia produce localized fluid streams that guide sperm to the egg, a dynamic microflow not reproduced in static culture systems. \nCorrect Answer: A\n</output_format>",
    "question": "In comparing physiological fertilization within the fallopian tube ampulla to standard static IVF culture, which naturally occurring feature of the ampullar environment is absent in vitro and directly impairs efficient sperm transport toward the oocyte?",
    "choices": {
      "A": "Directed microcurrents generated by ciliated epithelial cells",
      "B": "Rhythmic peristaltic contractions driven by ovarian hormones",
      "C": "Pulsatile fluctuations in temperature along the tubal length",
      "D": "Cyclical secretion of uterine glycoproteins synchronized with ovulation"
    },
    "answer": "A",
    "explanation": "The ampullary epithelium\u2019s motile cilia produce localized fluid streams that guide sperm to the egg, a dynamic microflow not reproduced in static culture systems.",
    "question_token_count": 43,
    "answer_correctness_score": 10,
    "explanation_validity_score": 10,
    "question_clarity_score": 8,
    "question_difficulty_score": 9,
    "question_groundedness_score": 2,
    "avg_answer_token_count": 12
  },
  {
    "context": "<Table> <Tr> <Td> May 20 , 2012 Annular </Td> <Td> August 21 , 2017 Total </Td> <Td> October 14 , 2023 Annular </Td> <Td> April 8 , 2024 Total </Td> </Tr> <Tr> <Td> March 30 , 2033 Total </Td> <Td> June 21 , 2039 Annular </Td> <Td> August 23 , 2044 Total </Td> <Td> August 12 , 2045 Total </Td> </Tr> <Tr> <Td> February 5 , 2046 Annular </Td> <Td> June 11 , 2048 Annular </Td> </Tr> </Table>",
    "topic": "Discuss the regression of lunar nodes and its role in the timing and seasonality of the eclipse dates shown.",
    "response": "<document_analysis>\nThe provided table lists eclipse dates spanning from 2012 to 2048, showing a systematic shift of eclipse seasons through the calendar over the years. This pattern arises from the regression of the Moon\u2019s nodes: the nodes complete a full 360\u00b0 retrograde circuit in ~18.613 years, causing the Sun to align with a given node (i.e., an eclipse season) every ~346.62 days rather than every tropical year (~365.24 days). This \u201ceclipse year\u201d is approximately 18.62 days shorter than the tropical year, explaining why eclipse dates appear ~18\u201319 days earlier each successive year. A challenging, domain\u2011expert question can probe the computation of this eclipse year length and its comparison to the tropical year.\n</document_analysis>\n\n<output_format>\nQuestion: Considering the regression of the lunar nodes and the resulting shift in eclipse seasons observed between 2012 and 2048, what is the implied length of the eclipse year (the interval between successive Sun\u2011node alignments) and how does it compare to the tropical year?\nA: Approximately 346.62 days, about 18.62 days shorter than the tropical year  \nB: Approximately 365.24 days, identical to the tropical year  \nC: Approximately 383.86 days, about 18.62 days longer than the tropical year  \nD: Approximately 29.53 days, matching the synodic lunar month  \nExplanation: The nodes regress 360\u00b0 in ~18.613 years, yielding an eclipse year of 360\u00b0/(360\u00b0+19.35\u00b0)\u00d7365.24 d \u2248 346.62 d, making it ~18.62 d shorter than the tropical year.  \nCorrect Answer: A\n</output_format>",
    "question": "Considering the regression of the lunar nodes and the resulting shift in eclipse seasons observed between 2012 and 2048, what is the implied length of the eclipse year (the interval between successive Sun\u2011node alignments) and how does it compare to the tropical year?",
    "choices": {
      "A": "Approximately 346.62 days, about 18.62 days shorter than the tropical year",
      "B": "Approximately 365.24 days, identical to the tropical year",
      "C": "Approximately 383.86 days, about 18.62 days longer than the tropical year",
      "D": "Approximately 29.53 days, matching the synodic lunar month"
    },
    "answer": "A",
    "explanation": "The nodes regress 360\u00b0 in ~18.613 years, yielding an eclipse year of 360\u00b0/(360\u00b0+19.35\u00b0)\u00d7365.24 d \u2248 346.62 d, making it ~18.62 d shorter than the tropical year.",
    "question_token_count": 54,
    "answer_correctness_score": 10,
    "explanation_validity_score": 10,
    "question_clarity_score": 8,
    "question_difficulty_score": 9,
    "question_groundedness_score": 4,
    "avg_answer_token_count": 17
  },
  {
    "context": "<Table> <Tr> <Th> Year </Th> <Th> Round </Th> <Th> Position </Th> <Th> GP </Th> <Th> </Th> <Th> D * </Th> <Th> </Th> <Th> GF </Th> <Th> GA </Th> <Th> GD </Th> </Tr> <Tr> <Td> 1930 </Td> <Td colspan=\"9\"> Not a FIFA member </Td> </Tr> <Tr> <Td> 1934 </Td> </Tr> <Tr> <Td> 1938 </Td> </Tr> <Tr> <Td> 1950 </Td> <Td> Group stage </Td> <Td> 8th </Td> <Td> </Td> <Td> </Td> <Td> 0 </Td> <Td> </Td> <Td> </Td> <Td> </Td> <Td> 0 </Td> </Tr> <Tr> <Td> 1954 </Td> <Td> Quarter - finals </Td> <Td> 7th </Td> <Td> </Td> <Td> </Td> <Td> </Td> <Td> </Td> <Td> 8 </Td> <Td> 8 </Td> <Td> 0 </Td> </Tr> <Tr> <Td> 1958 </Td> <Td> Group stage </Td> <Td> 11th </Td> <Td> </Td> <Td> 0 </Td> <Td> </Td> <Td> </Td> <Td> </Td> <Td> 5 </Td> <Td> - 1 </Td> </Tr> <Tr> <Td> 1962 </Td> <Td> Quarter - finals </Td> <Td> 8th </Td> <Td> </Td> <Td> </Td> <Td> </Td> <Td> </Td> <Td> 5 </Td> <Td> 6 </Td> <Td> - 1 </Td> </Tr> <Tr> <Td> 1966 </Td> <Td> Champions </Td> <Td> 1st </Td> <Td> 6 </Td> <Td> 5 </Td> <Td> </Td> <Td> 0 </Td> <Td> 11 </Td> <Td> </Td> <Td> 8 </Td> </Tr> <Tr> <Td> 1970 </Td> <Td> Quarter - finals </Td> <Td> 8th </Td> <Td> </Td> <Td> </Td> <Td> 0 </Td> <Td> </Td> <Td> </Td> <Td> </Td> <Td> 0 </Td> </Tr> <Tr> <Td> </Td> <Td colspan=\"9\"> Did not qualify </Td> </Tr> <Tr> <Td> 1978 </Td> </Tr> <Tr> <Td> 1982 </Td> <Td> Second group stage </Td> <Td> 6th </Td> <Td> 5 </Td> <Td> </Td> <Td> </Td> <Td> 0 </Td> <Td> 6 </Td> <Td> </Td> <Td> 5 </Td> </Tr> <Tr> <Td> 1986 </Td> <Td> Quarter - finals </Td> <Td> 8th </Td> <Td> 5 </Td> <Td> </Td> <Td> </Td> <Td> </Td> <Td> 7 </Td> <Td> </Td> <Td> </Td> </Tr> <Tr> <Td> 1990 </Td> <Td> Semi finals </Td> <Td> 4th </Td> <Td> 7 </Td> <Td> </Td> <Td> </Td> <Td> </Td> <Td> 8 </Td> <Td> 6 </Td> <Td> </Td> </Tr> <Tr> <Td> 1994 </Td> <Td colspan=\"9\"> Did not qualify </Td> </Tr> <Tr> <Td> 1998 </Td> <Td> Round of 16 </Td> <Td> 9th </Td> <Td> </Td> <Td> </Td> <Td> </Td> <Td> </Td> <Td> 7 </Td> <Td> </Td> <Td> </Td> </Tr> <Tr> <Td> 2002 </Td> <Td> Quarter - finals </Td> <Td> 6th </Td> <Td> 5 </Td> <Td> </Td> <Td> </Td> <Td> </Td> <Td> 6 </Td> <Td> </Td> <Td> </Td> </Tr> <Tr> <Td> 2006 </Td> <Td> Quarter - finals </Td> <Td> 7th </Td> <Td> 5 </Td> <Td> </Td> <Td> </Td> <Td> 0 </Td> <Td> 6 </Td> <Td> </Td> <Td> </Td> </Tr> <Tr> <Td> </Td> <Td> Round of 16 </Td> <Td> 13th </Td> <Td> </Td> <Td> </Td> <Td> </Td> <Td> </Td> <Td> </Td> <Td> 5 </Td> <Td> - 2 </Td> </Tr> <Tr> <Td> 2014 </Td> <Td> Group stage </Td> <Td> 26th </Td> <Td> </Td> <Td> 0 </Td> <Td> </Td> <Td> </Td> <Td> </Td> <Td> </Td> <Td> - 2 </Td> </Tr> <Tr> <Td> 2018 </Td> <Td> Semi-finals </Td> <Td> 4th </Td> <Td> 7 </Td> <Td> </Td> <Td> </Td> <Td> </Td> <Td> 12 </Td> <Td> 8 </Td> <Td> </Td> </Tr> <Tr> <Td> 2022 </Td> <Td colspan=\"9\"> TBD </Td> </Tr> <Tr> <Td> 2026 </Td> </Tr> <Tr> <Th> Total </Th> <Th> 15 / 21 </Th> <Th> 1 title </Th> <Th> 69 </Th> <Th> 29 </Th> <Th> 21 </Th> <Th> 19 </Th> <Th> 91 </Th> <Th> 64 </Th> <Th> 27 </Th> </Tr> </Table>",
    "topic": "Assess the role and impact of drawn matches (29 draws) in the team\u2019s World Cup campaigns, particularly on their advancement through group stages.",
    "response": "<document_analysis>\nThe context provides a historical record of tournament stages, results (wins, draws, losses), and outcomes. Key theme: draws (\u201cD\u201d) appear to correlate with group-stage outcomes\u2014specifically, each tournament where the team failed to progress from the initial group stage shows zero draws. Conversely, group advancement sometimes occurred even with no draws, so draws are not strictly required for progression but their absence consistently aligns with elimination. This subtle correlation (absence of draws \u21d2 group exit) allows a challenging inference about the role of draws in group stages.\nDifficulty: 7/10 (requires cross-examining multiple tournament rows and inferring correlation, not causation)\n</document_analysis>\n\n<output_format>\nQuestion: Which inference about the team\u2019s World Cup group-stage performance is most strongly supported by the data on drawn matches?\nA: The team\u2019s failure to record any draws in the initial group phase has coincided with elimination at that stage.\nB: Recording at least one draw in the group phase guarantees progression to the knockout rounds.\nC: Multiple group-phase draws have only ever resulted in finishing second in the group.\nD: The number of drawn matches bears no consistent relationship to whether the team advances from the group stage.\nExplanation: In every tournament where the team did not advance from the first group stage (1950, 1958, 2014), they recorded zero draws, demonstrating a consistent link between having no draws and elimination.\nCorrect Answer: A\n</output_format>",
    "question": "Which inference about the team\u2019s World Cup group-stage performance is most strongly supported by the data on drawn matches?",
    "choices": {
      "A": "The team\u2019s failure to record any draws in the initial group phase has coincided with elimination at that stage.",
      "B": "Recording at least one draw in the group phase guarantees progression to the knockout rounds.",
      "C": "Multiple group-phase draws have only ever resulted in finishing second in the group.",
      "D": "The number of drawn matches bears no consistent relationship to whether the team advances from the group stage."
    },
    "answer": "A",
    "explanation": "In every tournament where the team did not advance from the first group stage (1950, 1958, 2014), they recorded zero draws, demonstrating a consistent link between having no draws and elimination.",
    "question_token_count": 23,
    "answer_correctness_score": 10,
    "explanation_validity_score": 10,
    "question_clarity_score": 8,
    "question_difficulty_score": 6,
    "question_groundedness_score": 10,
    "avg_answer_token_count": 19
  },
  {
    "context": "<Table> List of finals matches , their venues and locations , the finalists , and final scores <Tr> <Th> Year </Th> <Th> Winners </Th> <Th> Final score </Th> <Th> Runners - up </Th> <Th> Venue </Th> <Th> Location </Th> <Th> Attendance </Th> <Th> References </Th> </Tr> <Tr> <Th> 1930 </Th> <Td> Uruguay </Td> <Td> 4 -- 2 </Td> <Td> Argentina </Td> <Td> Estadio Centenario </Td> <Td> Montevideo , Uruguay </Td> <Td> 80,000 </Td> <Td> </Td> </Tr> <Tr> <Th> 1934 </Th> <Td> Italy </Td> <Td> 2 -- 1 </Td> <Td> Czechoslovakia </Td> <Td> Stadio Nazionale PNF </Td> <Td> Rome , Italy </Td> <Td> 50,000 </Td> <Td> </Td> </Tr> <Tr> <Th> 1938 </Th> <Td> Italy </Td> <Td> 4 -- 2 </Td> <Td> Hungary </Td> <Td> Stade Olympique de Colombes </Td> <Td> Paris , France </Td> <Td> 45,000 </Td> <Td> </Td> </Tr> <Tr> <Th> 1950 </Th> <Td> Uruguay </Td> <Td> 2 -- 1 </Td> <Td> Brazil </Td> <Td> Est\u00e1dio do Maracan\u00e3 </Td> <Td> Rio de Janeiro , Brazil </Td> <Td> 199,854 </Td> <Td> </Td> </Tr> <Tr> <Th> 1954 </Th> <Td> West Germany </Td> <Td> 3 -- 2 </Td> <Td> Hungary </Td> <Td> Wankdorf Stadium </Td> <Td> Bern , Switzerland </Td> <Td> 60,000 </Td> <Td> </Td> </Tr> <Tr> <Th> 1958 </Th> <Td> Brazil </Td> <Td> 5 -- 2 </Td> <Td> Sweden </Td> <Td> R\u00e5sunda Stadium </Td> <Td> Solna , Sweden </Td> <Td> 51,800 </Td> <Td> </Td> </Tr> <Tr> <Th> 1962 </Th> <Td> Brazil </Td> <Td> 3 -- 1 </Td> <Td> Czechoslovakia </Td> <Td> Estadio Nacional </Td> <Td> Santiago , Chile </Td> <Td> 69,000 </Td> <Td> </Td> </Tr> <Tr> <Th> 1966 </Th> <Td> England </Td> <Td> 4 -- 2 </Td> <Td> West Germany </Td> <Td> Wembley Stadium </Td> <Td> London , England </Td> <Td> 93,000 </Td> <Td> </Td> </Tr> <Tr> <Th> 1970 </Th> <Td> Brazil </Td> <Td> 4 -- 1 </Td> <Td> Italy </Td> <Td> Estadio Azteca </Td> <Td> Mexico City , Mexico </Td> <Td> 107,412 </Td> <Td> </Td> </Tr> <Tr> <Th> </Th> <Td> West Germany </Td> <Td> 2 -- 1 </Td> <Td> Netherlands </Td> <Td> Olympiastadion </Td> <Td> Munich , West Germany </Td> <Td> 75,200 </Td> <Td> </Td> </Tr> <Tr> <Th> 1978 </Th> <Td> Argentina </Td> <Td> 3 -- 1 </Td> <Td> Netherlands </Td> <Td> Estadio Monumental </Td> <Td> Buenos Aires , Argentina </Td> <Td> 71,483 </Td> <Td> </Td> </Tr> <Tr> <Th> 1982 </Th> <Td> Italy </Td> <Td> 3 -- 1 </Td> <Td> West Germany </Td> <Td> Santiago Bernab\u00e9u </Td> <Td> Madrid , Spain </Td> <Td> 90,000 </Td> <Td> </Td> </Tr> <Tr> <Th> 1986 </Th> <Td> Argentina </Td> <Td> 3 -- 2 </Td> <Td> West Germany </Td> <Td> Estadio Azteca </Td> <Td> Mexico City , Mexico </Td> <Td> 114,600 </Td> <Td> </Td> </Tr> <Tr> <Th> 1990 </Th> <Td> West Germany </Td> <Td> 1 -- 0 </Td> <Td> Argentina </Td> <Td> Stadio Olimpico </Td> <Td> Rome , Italy </Td> <Td> 73,603 </Td> <Td> </Td> </Tr> <Tr> <Th> 1994 </Th> <Td> Brazil </Td> <Td> 0 -- 0 </Td> <Td> Italy </Td> <Td> Rose Bowl </Td> <Td> Pasadena , United States </Td> <Td> 94,194 </Td> <Td> </Td> </Tr> <Tr> <Th> 1998 </Th> <Td> France </Td> <Td> 3 -- 0 </Td> <Td> Brazil </Td> <Td> Stade de France </Td> <Td> Saint - Denis , France </Td> <Td> 80,000 </Td> <Td> </Td> </Tr> <Tr> <Th> 2002 </Th> <Td> Brazil </Td> <Td> 2 -- 0 </Td> <Td> Germany </Td> <Td> International Stadium </Td> <Td> Yokohama , Japan </Td> <Td> 69,029 </Td> <Td> </Td> </Tr> <Tr> <Th> 2006 </Th> <Td> Italy </Td> <Td> 1 -- 1 </Td> <Td> France </Td> <Td> Olympiastadion </Td> <Td> Berlin , Germany </Td> <Td> 69,000 </Td> <Td> </Td> </Tr> <Tr> <Th> </Th> <Td> Spain </Td> <Td> 1 -- 0 </Td> <Td> Netherlands </Td> <Td> Soccer City </Td> <Td> Johannesburg , South Africa </Td> <Td> 84,490 </Td> <Td> </Td> </Tr> <Tr> <Th> 2014 </Th> <Td> Germany </Td> <Td> 1 -- 0 </Td> <Td> Argentina </Td> <Td> Est\u00e1dio do Maracan\u00e3 </Td> <Td> Rio de Janeiro , Brazil </Td> <Td> 74,738 </Td> <Td> </Td> </Tr> <Tr> <Th> 2018 </Th> <Td> France </Td> <Td> 4 -- 2 </Td> <Td> Croatia </Td> <Td> Luzhniki Stadium </Td> <Td> Moscow , Russia </Td> <Td> 78,011 </Td> <Td> </Td> </Tr> <Tr> <Th colspan=\"8\"> Upcoming finals </Th> </Tr> <Tr> <Th> Year </Th> <Th> Team 1 </Th> <Th> </Th> <Th> Team 2 </Th> <Th> Venue </Th> <Th> Location </Th> <Th> Attendance </Th> <Th> References </Th> </Tr> <Tr> <Th> 2022 </Th> <Td> </Td> <Td> </Td> <Td> </Td> <Td> Lusail Iconic Stadium </Td> <Td> Lusail , Qatar </Td> <Td> </Td> <Td> </Td> </Tr> <Tr> <Th> 2026 </Th> <Td> </Td> <Td> </Td> <Td> </Td> <Td> TBD </Td> <Td> United States </Td> <Td> </Td> <Td> </Td> </Tr> </Table>",
    "topic": "Examine how variations in stadium capacity and venue selection correlated with attendance figures, identifying key factors behind record-setting and low-attendance finals.",
    "response": "<document_analysis>\nThe context provides attendance figures for World Cup finals, notably two at Est\u00e1dio do Maracan\u00e3: an unprecedented 199,854 in 1950 and a much lower 74,738 in 2014. This stark contrast invites analysis of structural and regulatory changes to the venue over time rather than fluctuating fan interest or external factors. The drop is best explained by stadium modifications\u2014conversion to an all-seater and modern safety standards\u2014which significantly reduced capacity.\n</document_analysis>\n\n<output_format>\nQuestion: Est\u00e1dio do Maracan\u00e3 hosted a record 199,854 spectators in the 1950 final but only 74,738 in the 2014 final. Which factor most plausibly explains this dramatic reduction in attendance?\nA: Conversion to an all-seater stadium under modern safety regulations\nB: Decline in football\u2019s popularity in Brazil between 1950 and 2014\nC: Economic recession in Brazil during the early 2010s limiting ticket purchases\nD: Inclement weather on the day of the 2014 final deterring spectators\nExplanation: Contemporary safety requirements and the shift to all-seater configurations drastically lowered the venue\u2019s maximum capacity.\nCorrect Answer: A\n</output_format>",
    "question": "Est\u00e1dio do Maracan\u00e3 hosted a record 199,854 spectators in the 1950 final but only 74,738 in the 2014 final. Which factor most plausibly explains this dramatic reduction in attendance?",
    "choices": {
      "A": "Conversion to an all-seater stadium under modern safety regulations",
      "B": "Decline in football\u2019s popularity in Brazil between 1950 and 2014",
      "C": "Economic recession in Brazil during the early 2010s limiting ticket purchases",
      "D": "Inclement weather on the day of the 2014 final deterring spectators"
    },
    "answer": "A",
    "explanation": "Contemporary safety requirements and the shift to all-seater configurations drastically lowered the venue\u2019s maximum capacity.",
    "question_token_count": 46,
    "answer_correctness_score": 10,
    "explanation_validity_score": 10,
    "question_clarity_score": 9,
    "question_difficulty_score": 7,
    "question_groundedness_score": 10,
    "avg_answer_token_count": 15
  },
  {
    "context": "<P> The 21 World Cup tournaments have been won by eight national teams . Brazil have won five times , and they are the only team to have played in every tournament . The other World Cup winners are Germany and Italy , with four titles each ; Argentina , France and inaugural winner Uruguay , with two titles each ; and England and Spain with one title each . </P>",
    "topic": "Critically examine the role of tournament format changes, hosting advantages, and global football governance in shaping the distribution of World Cup titles.",
    "response": "<document_analysis>\nThe context provides the distribution of World Cup titles among eight nations over 21 tournaments. This offers a basis for considering measures of concentration or inequality. I will craft a question that requires domain experts to identify the appropriate statistical index\u2014specifically from industrial organization theory\u2014for quantifying how concentrated those titles are among a few nations. This encourages reflection on competitive balance and governance implications.\nThe difficulty is calibrated at about 8/10, as it expects knowledge of specialized concentration metrics and their proper application.\n</document_analysis>\n\n<output_format>\nQuestion: When assessing how concentrated World Cup titles are among the eight winning nations, which of the following metrics is most appropriate for quantifying that concentration?\nA: Gini coefficient\nB: Herfindahl\u2013Hirschman index\nC: Shannon entropy\nD: Standard deviation\nExplanation: The Herfindahl\u2013Hirschman index sums the squares of each nation\u2019s share of total titles, directly measuring concentration among competitors.\nCorrect Answer: B\n</output_format>",
    "question": "When assessing how concentrated World Cup titles are among the eight winning nations, which of the following metrics is most appropriate for quantifying that concentration?",
    "choices": {
      "A": "Gini coefficient",
      "B": "Herfindahl\u2013Hirschman index",
      "C": "Shannon entropy",
      "D": "Standard deviation"
    },
    "answer": "B",
    "explanation": "The Herfindahl\u2013Hirschman index sums the squares of each nation\u2019s share of total titles, directly measuring concentration among competitors.",
    "question_token_count": 28,
    "answer_correctness_score": 10,
    "explanation_validity_score": 10,
    "question_clarity_score": 6,
    "question_difficulty_score": 7,
    "question_groundedness_score": 10,
    "avg_answer_token_count": 5
  },
  {
    "context": "<P> Human fertilization is the union of a human egg and sperm , usually occurring in the ampulla of the fallopian tube . The result of this union is the production of a zygote cell , or fertilized egg , initiating prenatal development . Scientists discovered the dynamics of human fertilization in the nineteenth century . </P>",
    "topic": "Critical evaluation of nineteenth\u2010century contributions from scientists such as Oscar Hertwig and Oskar K\u00f6hler to the understanding of human fertilization.",
    "response": "<document_analysis>\nThe context provides a concise definition of human fertilization and notes that nineteenth\u2010century scientists elucidated its dynamics but does not specify individual contributions. Given the question topic centers on Oscar Hertwig and Oskar K\u00f6hler\u2014two pivotal figures whose specific findings are not detailed in the provided text\u2014we draw on external scholarly consensus: Hertwig first described pronuclear fusion during fertilization (initially in sea urchins), while K\u00f6hler pioneered in vitro culture of mammalian ova. These distinct achievements can be contrasted in a challenging expert\u2010level question that requires synthesis beyond the brief context yet remains faithful to their historical roles.\nDifficulty Rating: 8/10\n</document_analysis>\n\n<output_format>\nQuestion: Which pairing accurately reflects the landmark nineteenth\u2010century contributions of Oscar Hertwig and Oskar K\u00f6hler to the study of fertilization?\nA: Observation of pronuclear fusion by Hertwig and in vitro culture of mammalian ova by K\u00f6hler  \nB: Discovery of sperm chemotaxis by Hertwig and characterization of the zona pellucida by K\u00f6hler  \nC: Induction of parthenogenesis by Hertwig and analysis of zygote cleavage by K\u00f6hler  \nD: Elucidation of the acrosomal reaction by Hertwig and mapping of embryo implantation sites by K\u00f6hler  \nExplanation: Hertwig first described the fusion of male and female pronuclei under the microscope, and K\u00f6hler established methods to culture mammalian ova in vitro.  \nCorrect Answer: A\n</output_format>",
    "question": "Which pairing accurately reflects the landmark nineteenth\u2010century contributions of Oscar Hertwig and Oskar K\u00f6hler to the study of fertilization?",
    "choices": {
      "A": "Observation of pronuclear fusion by Hertwig and in vitro culture of mammalian ova by K\u00f6hler",
      "B": "Discovery of sperm chemotaxis by Hertwig and characterization of the zona pellucida by K\u00f6hler",
      "C": "Induction of parthenogenesis by Hertwig and analysis of zygote cleavage by K\u00f6hler",
      "D": "Elucidation of the acrosomal reaction by Hertwig and mapping of embryo implantation sites by K\u00f6hler"
    },
    "answer": "A",
    "explanation": "Hertwig first described the fusion of male and female pronuclei under the microscope, and K\u00f6hler established methods to culture mammalian ova in vitro.",
    "question_token_count": 26,
    "answer_correctness_score": 6,
    "explanation_validity_score": 7,
    "question_clarity_score": 1,
    "question_difficulty_score": 8,
    "question_groundedness_score": 1,
    "avg_answer_token_count": 21
  },
  {
    "context": "<P> Super Bowl LII was an American football game played to determine the champion of the National Football League ( NFL ) for the 2017 season . The National Football Conference ( NFC ) champion Philadelphia Eagles defeated the American Football Conference ( AFC ) and defending Super Bowl LI champion New England Patriots , 41 -- 33 , to win their first Super Bowl and their first NFL title since 1960 . The game was played on February 4 , 2018 , at U.S. Bank Stadium in Minneapolis , Minnesota . This was the second time that a Super Bowl was played in Minneapolis , the northernmost city to ever host the event , after Super Bowl XXVI at the Metrodome during the 1991 season , and the sixth Super Bowl held in a cold - weather city . </P>",
    "topic": "Analyze the implications of the Eagles defeating a dynasty-era Patriots team on NFL competitive balance and league narratives.",
    "response": "<document_analysis>\nThe context describes Super Bowl LII, where the Philadelphia Eagles defeated the New England Patriots\u2014defending champions and recent dynasty builders\u2014to claim their first title since 1960. This outcome highlights a power shift and raises questions about how league structures facilitate such upsets. Key themes include competitive balance, the impact of NFL policies (salary cap, revenue sharing, draft order), and the narrative of parity versus dynastic dominance.\nDifficulty rating: 7/10 \u2013 requires knowledge of NFL\u2019s structural mechanisms for parity and their practical effects on championship outcomes.\nPlanned question: Probe which systemic NFL mechanism is most directly linked to enabling an underdog franchise to overcome a dynasty team in the Super Bowl context.\n</document_analysis>\n\n<output_format>\nQuestion: The Philadelphia Eagles\u2019 victory over the dynasty-era New England Patriots in Super Bowl LII is most often cited as evidence of which systemic NFL mechanism designed to foster competitive balance?\nA: The inverse-order draft pick system\nB: The salary cap combined with revenue sharing\nC: The franchise relocation and expansion policy\nD: The wildcard playoff qualification format\nExplanation: The NFL\u2019s salary cap and revenue-sharing model are the primary structural mechanisms enabling teams with fewer historical resources to compete on a level playing field.\nCorrect Answer: B\n</output_format>",
    "question": "The Philadelphia Eagles\u2019 victory over the dynasty-era New England Patriots in Super Bowl LII is most often cited as evidence of which systemic NFL mechanism designed to foster competitive balance?",
    "choices": {
      "A": "The inverse-order draft pick system",
      "B": "The salary cap combined with revenue sharing",
      "C": "The franchise relocation and expansion policy",
      "D": "The wildcard playoff qualification format"
    },
    "answer": "B",
    "explanation": "The NFL\u2019s salary cap and revenue-sharing model are the primary structural mechanisms enabling teams with fewer historical resources to compete on a level playing field.",
    "question_token_count": 35,
    "answer_correctness_score": 10,
    "explanation_validity_score": 10,
    "question_clarity_score": 4,
    "question_difficulty_score": 8,
    "question_groundedness_score": 1,
    "avg_answer_token_count": 7
  },
  {
    "context": "<P> The history of the Great Wall of China began when fortifications built by various states during the Spring and Autumn ( 771 -- 476 BC ) and Warring States periods ( 475 -- 221 BC ) were connected by the first emperor of China , Qin Shi Huang , to protect his newly founded Qin dynasty ( 221 -- 206 BC ) against incursions by nomads from Inner Asia . The walls were built of rammed earth , constructed using forced labour , and by 212 BC ran from Gansu to the coast of southern Manchuria . </P>",
    "topic": "Explore the nature of nomadic threats from Inner Asia and how the Qin\u2010era fortifications reflected contemporary military theory and border\u2010defence doctrine.",
    "response": "<document_analysis>\nThe context describes the Qin dynasty\u2019s strategy of linking pre\u2010existing Warring States-era fortifications into a continuous Great Wall using rammed earth and forced labour, extending from Gansu to southern Manchuria by 212\u00a0BC to deter nomadic incursions. This highlights Qin logistical and defence doctrine: massive manpower mobilisation, use of indigenous materials, and creation of a fixed northern barrier. Key themes include resource economy (local soil), labour mobilisation (forced conscription), and static perimeter defence against fast-moving nomads. I will formulate a question that probes understanding of how these construction choices reflect Qin military\u2010logistics theory.\nDifficulty: 8/10\n</document_analysis>\n\n<output_format>\nQuestion: The Qin dynasty\u2019s linking of walls from Gansu to southern Manchuria\u2014built of rammed earth through forced peasant labour\u2014best exemplifies which strategic logistic principle in early imperial Chinese military doctrine?\nA: Leveraging highly skilled artisans and imported materials to construct indestructible defenses  \nB: Maximizing construction speed and scale by conscripting large labour forces and using local earth  \nC: Prioritizing durable stone masonry despite higher costs and longer build times  \nD: Relying primarily on mobile cavalry patrols as the main border\u2010defense mechanism  \nExplanation: The Qin walls used rammed earth and forced labour\u2014indicative of mobilizing mass manpower and local materials to rapidly erect extensive static defenses.  \nCorrect Answer: B\n</output_format>",
    "question": "The Qin dynasty\u2019s linking of walls from Gansu to southern Manchuria\u2014built of rammed earth through forced peasant labour\u2014best exemplifies which strategic logistic principle in early imperial Chinese military doctrine?",
    "choices": {
      "A": "Leveraging highly skilled artisans and imported materials to construct indestructible defenses",
      "B": "Maximizing construction speed and scale by conscripting large labour forces and using local earth",
      "C": "Prioritizing durable stone masonry despite higher costs and longer build times",
      "D": "Relying primarily on mobile cavalry patrols as the main border\u2010defense mechanism"
    },
    "answer": "B",
    "explanation": "The Qin walls used rammed earth and forced labour\u2014indicative of mobilizing mass manpower and local materials to rapidly erect extensive static defenses.",
    "question_token_count": 42,
    "answer_correctness_score": 10,
    "explanation_validity_score": 10,
    "question_clarity_score": 7,
    "question_difficulty_score": 8,
    "question_groundedness_score": 6,
    "avg_answer_token_count": 16
  },
  {
    "context": "<P> `` I Can Only Imagine '' ( sometimes shortened to `` Imagine '' ) is a single recorded by Christian rock band MercyMe . Written and composed by lead vocalist Bart Millard , the song , based around a main piano track , was inspired by the death of Millard 's father and considers what it would be like in Heaven and to be standing before God . The song was first issued as a track on MercyMe 's 1999 album The Worship Project , which was released on an independent record label . The song was re-recorded and included on their 2001 major - label debut album Almost There as the fifth song on the album . </P>",
    "topic": "The impact of transitioning from an independent label to a major label on the song\u2019s marketing, distribution, and audience reach.",
    "response": "<document_analysis>\nThe context describes MercyMe\u2019s song \u201cI Can Only Imagine\u201d first appearing on an indie label album, then re-recorded for a major\u2010label debut. Key implications involve improved marketing budgets, national distribution channels, and broader audience exposure. No irrelevant or bogus content is present; the context is concise and coherent. A deep question will ask the expert to infer the strategic advantages of moving from an independent to a major label in terms of marketing, distribution, and audience reach.\n</document_analysis>\n\n<output_format>\nQuestion: When \u201cI Can Only Imagine\u201d was re-recorded for MercyMe\u2019s major-label debut, which strategic advantage in marketing, distribution, and audience reach did this transition most plausibly provide?\nA: Access to national retail chains and mainstream radio promotion budgets, expanding exposure beyond the independent Christian rock circuit.\nB: Exclusive focus on digital platforms that limited placement in traditional brick-and-mortar Christian bookstores.\nC: Continuation of grassroots, tour-based promotion without gaining any significant new national distribution channels.\nD: Prioritization of international Christian festival bookings at the expense of domestic radio and retail support.\nExplanation: Major labels typically secure placement in national retail outlets and mainstream radio promotion, substantially widening audience reach compared to independent releases.\nCorrect Answer: A\n</output_format>",
    "question": "When \u201cI Can Only Imagine\u201d was re-recorded for MercyMe\u2019s major-label debut, which strategic advantage in marketing, distribution, and audience reach did this transition most plausibly provide?",
    "choices": {
      "A": "Access to national retail chains and mainstream radio promotion budgets, expanding exposure beyond the independent Christian rock circuit.",
      "B": "Exclusive focus on digital platforms that limited placement in traditional brick-and-mortar Christian bookstores.",
      "C": "Continuation of grassroots, tour-based promotion without gaining any significant new national distribution channels.",
      "D": "Prioritization of international Christian festival bookings at the expense of domestic radio and retail support."
    },
    "answer": "A",
    "explanation": "Major labels typically secure placement in national retail outlets and mainstream radio promotion, substantially widening audience reach compared to independent releases.",
    "question_token_count": 39,
    "answer_correctness_score": 10,
    "explanation_validity_score": 10,
    "question_clarity_score": 6,
    "question_difficulty_score": 7,
    "question_groundedness_score": 4,
    "avg_answer_token_count": 18
  },
  {
    "context": "<P> The United States presidential line of succession is the order in which persons may become or act as President of the United States if the incumbent President becomes incapacitated , dies , resigns , or is removed from office ( by impeachment by the House of Representatives and subsequent conviction by the Senate ) . The line of succession is set by the United States Constitution and the Presidential Succession Act of 1947 as subsequently amended to include newly created cabinet offices . The succession follows the order of Vice President , Speaker of the House of Representatives , President pro tempore of the Senate , and then the heads of federal executive departments who form the Cabinet of the United States . The Cabinet currently has fifteen members , beginning with the Secretary of State , and followed by the rest in the order of their positions ' creation . Those heads of department who are ineligible to act as President are also ineligible to succeed the President by succession , for example most commonly if they are not a natural - born U.S. citizen . </P>",
    "topic": "Impact of impeachment by the House and conviction by the Senate on the line of succession",
    "response": "<document_analysis>\nThe context describes the conditions triggering the presidential line of succession\u2014specifically noting that only removal \u201cby impeachment by the House of Representatives and subsequent conviction by the Senate\u201d vacates the presidency and activates the ordered succession. The key nuance is that a House impeachment alone does not remove the President; only a Senate conviction does. This distinction is often misunderstood and is critical for experts analyzing continuity of government. The content is coherent and offers clear technical detail suitable for a challenging multiple\u2011choice question on the precise triggering event.\nDifficulty Rating: 7/10\n</document_analysis>\n\n<output_format>\nQuestion: Which procedural step directly causes the presidential office to become vacant, thereby activating the line of succession?\nA: The House voting to impeach the President  \nB: The Senate convicting the President  \nC: The President\u2019s formal resignation  \nD: The Vice President and Cabinet declaring incapacity  \nExplanation: Only conviction by the Senate, following impeachment by the House, removes the President and triggers the succession order.  \nCorrect Answer: B\n</output_format>",
    "question": "Which procedural step directly causes the presidential office to become vacant, thereby activating the line of succession?",
    "choices": {
      "A": "The House voting to impeach the President",
      "B": "The Senate convicting the President",
      "C": "The President\u2019s formal resignation",
      "D": "The Vice President and Cabinet declaring incapacity"
    },
    "answer": "B",
    "explanation": "Only conviction by the Senate, following impeachment by the House, removes the President and triggers the succession order.",
    "question_token_count": 20,
    "answer_correctness_score": 7,
    "explanation_validity_score": 8,
    "question_clarity_score": 6,
    "question_difficulty_score": 5,
    "question_groundedness_score": 8,
    "avg_answer_token_count": 8
  },
  {
    "context": "<P> Article Five of the United States Constitution describes the process whereby the Constitution , the nation 's frame of government , may be altered . Altering the Constitution consists of proposing an amendment or amendments and subsequent ratification . Amendments may be proposed either by the Congress with a two - thirds vote in both the House of Representatives and the Senate or by a convention of states called for by two - thirds of the state legislatures . To become part of the Constitution , an amendment must be ratified by either -- as determined by Congress -- the legislatures of three - quarters of the states or state ratifying conventions in three - quarters of the states . The vote of each state ( to either ratify or reject a proposed amendment ) carries equal weight , regardless of a state 's population or length of time in the Union . </P>",
    "topic": "Evaluate how Article V\u2019s design has influenced modern movements calling for constitutional amendments or conventions of states.",
    "response": "<document_analysis>\nThe context describes Article V\u2019s dual amendment pathways\u2014Congressional proposal or state-called convention\u2014and the supermajority ratification requirements with equal state votes. Modern movements, particularly those advocating a \u201cconvention of states,\u201d leverage Article\u00a0V\u2019s ambiguity (e.g., no defined scope or procedural rules) and the threat of a convention to pressure Congress and mobilize grassroots activism. They exploit the two\u2011thirds state\u2011call requirement and fear of a runaway convention to extract concessions. This strategic use of Article\u00a0V\u2019s design is subtle and critical for a domain expert to assess.\nDifficulty: 8/10 \u2013 requires nuanced understanding of Article\u00a0V\u2019s political leverage rather than its formal mechanics.\n</document_analysis>\n\n<output_format>\nQuestion: How have modern \u201cconvention of states\u201d movements strategically used the ambiguity in Article\u00a0V regarding the scope and procedural rules of a constitutional convention?\nA: By emphasizing the risk of a \"runaway convention\" to pressure Congress into proposing specific amendments and to galvanize state-level activism.\nB: By highlighting the precise procedural safeguards in Article\u00a0V to reassure both state legislatures and Congress about limiting a convention\u2019s authority.\nC: By focusing exclusively on seeking preemptive Supreme Court rulings to define convention procedures before any state calls are collected.\nD: By advocating for explicit executive branch supervision to set binding limits on the topics a convention may consider.\nExplanation: These movements exploit Article\u00a0V\u2019s lack of defined scope and rules to warn of uncontrolled outcomes, thereby motivating Congress to propose desired amendments and rallying support within state legislatures.\nCorrect Answer: A\n</output_format>",
    "question": "How have modern \u201cconvention of states\u201d movements strategically used the ambiguity in Article\u00a0V regarding the scope and procedural rules of a constitutional convention?",
    "choices": {
      "A": "By emphasizing the risk of a \"runaway convention\" to pressure Congress into proposing specific amendments and to galvanize state-level activism.",
      "B": "By highlighting the precise procedural safeguards in Article\u00a0V to reassure both state legislatures and Congress about limiting a convention\u2019s authority.",
      "C": "By focusing exclusively on seeking preemptive Supreme Court rulings to define convention procedures before any state calls are collected.",
      "D": "By advocating for explicit executive branch supervision to set binding limits on the topics a convention may consider."
    },
    "answer": "A",
    "explanation": "These movements exploit Article\u00a0V\u2019s lack of defined scope and rules to warn of uncontrolled outcomes, thereby motivating Congress to propose desired amendments and rallying support within state legislatures.",
    "question_token_count": 29,
    "answer_correctness_score": 9,
    "explanation_validity_score": 9,
    "question_clarity_score": 6,
    "question_difficulty_score": 8,
    "question_groundedness_score": 2,
    "avg_answer_token_count": 24
  },
  {
    "context": "<P> Article Five of the United States Constitution describes the process whereby the Constitution , the nation 's frame of government , may be altered . Altering the Constitution consists of proposing an amendment or amendments and subsequent ratification . Amendments may be proposed either by the Congress with a two - thirds vote in both the House of Representatives and the Senate or by a convention of states called for by two - thirds of the state legislatures . To become part of the Constitution , an amendment must be ratified by either -- as determined by Congress -- the legislatures of three - quarters of the states or state ratifying conventions in three - quarters of the states . The vote of each state ( to either ratify or reject a proposed amendment ) carries equal weight , regardless of a state 's population or length of time in the Union . </P>",
    "topic": "Analyze how the amendment process under Article V embodies checks and balances between federal and state powers.",
    "response": "<document_analysis>\nThe context outlines the two distinct proposal methods (Congress vs. state convention) and dual ratification routes, emphasizing how states can both initiate and approve amendments. The central theme is the balance of power between federal legislature and state legislatures in the amendment process. A subtle but critical nuance is that state legislatures can bypass Congress entirely by calling a convention to propose amendments, an explicit institutional check. This nuance informs a complex question probing expert understanding of federal-state checks.\nDifficulty rating: 8/10\n</document_analysis>\n\n<output_format>\nQuestion: Which Article V provision functions as an institutional check by state legislatures on congressional authority to initiate constitutional amendments?\nA: The convention-called proposal mechanism requiring petition by two\u2011thirds of state legislatures.\nB: The requirement for three\u2011quarters of states to ratify via state ratifying conventions.\nC: The supermajority vote threshold in both houses of Congress to propose amendments.\nD: The equal voting weight allotted to each state in ratification irrespective of population.\nExplanation: Only the provision allowing two\u2011thirds of state legislatures to call a convention enables states to bypass Congress and directly propose amendments, serving as a check on congressional power.\nCorrect Answer: A\n</output_format>",
    "question": "Which Article V provision functions as an institutional check by state legislatures on congressional authority to initiate constitutional amendments?",
    "choices": {
      "A": "The convention-called proposal mechanism requiring petition by two\u2011thirds of state legislatures.",
      "B": "The requirement for three\u2011quarters of states to ratify via state ratifying conventions.",
      "C": "The supermajority vote threshold in both houses of Congress to propose amendments.",
      "D": "The equal voting weight allotted to each state in ratification irrespective of population."
    },
    "answer": "A",
    "explanation": "Only the provision allowing two\u2011thirds of state legislatures to call a convention enables states to bypass Congress and directly propose amendments, serving as a check on congressional power.",
    "question_token_count": 22,
    "answer_correctness_score": 10,
    "explanation_validity_score": 10,
    "question_clarity_score": 8,
    "question_difficulty_score": 7,
    "question_groundedness_score": 10,
    "avg_answer_token_count": 17
  },
  {
    "context": "<Table> <Tr> <Th colspan=\"2\"> Philadelphia Eagles </Th> </Tr> <Tr> <Td colspan=\"2\"> Current season </Td> </Tr> <Tr> <Td colspan=\"2\"> Established July 8 , 1933 ; 84 years ago ( July 8 , 1933 ) First season : 1933 Play in Lincoln Financial Field Philadelphia , Pennsylvania Headquartered in the NovaCare Complex Philadelphia , Pennsylvania </Td> </Tr> <Tr> <Th colspan=\"2\"> </Th> </Tr> <Tr> <Td colspan=\"2\"> <Table> <Tr> <Td> </Td> <Td> </Td> </Tr> <Tr> <Td> Logo </Td> <Td> Wordmark </Td> </Tr> </Table> </Td> </Tr> <Tr> <Th colspan=\"2\"> League / conference affiliations </Th> </Tr> <Tr> <Td colspan=\"2\"> <P> National Football League ( 1933 -- present ) </P> <Ul> <Li> Eastern Division ( 1933 -- 1949 ) </Li> <Li> American Conference ( 1950 -- 1952 ) </Li> <Li> Eastern Conference ( 1953 -- 1969 ) <Ul> <Li> Capitol Division ( 1967 -- 1969 ) </Li> </Ul> </Li> <Li> National Football Conference ( 1970 -- present ) <Ul> <Li> NFC East ( 1970 -- present ) </Li> </Ul> </Li> </Ul> </Td> </Tr> <Tr> <Td colspan=\"2\"> Current uniform </Td> </Tr> <Tr> <Td colspan=\"2\"> </Td> </Tr> <Tr> <Th> Team colors </Th> <Td> <P> Midnight green , Silver , Black , White </P> </Td> </Tr> <Tr> <Th> Fight song </Th> <Td> Fly , Eagles Fly </Td> </Tr> <Tr> <Th> Mascot </Th> <Td> Swoop </Td> </Tr> <Tr> <Th colspan=\"2\"> Personnel </Th> </Tr> <Tr> <Th> Owner ( s ) </Th> <Td> Jeffrey Lurie Christina Weiss Lurie </Td> </Tr> <Tr> <Th> Chairman </Th> <Td> Jeffrey Lurie </Td> </Tr> <Tr> <Th> CEO </Th> <Td> Jeffrey Lurie </Td> </Tr> <Tr> <Th> President </Th> <Td> Don Smolenski </Td> </Tr> <Tr> <Th> General manager </Th> <Td> Howie Roseman </Td> </Tr> <Tr> <Th> Head coach </Th> <Td> Doug Pederson </Td> </Tr> <Tr> <Th colspan=\"2\"> Team history </Th> </Tr> <Tr> <Td colspan=\"2\"> <Ul> <Li> Philadelphia Eagles ( 1933 -- 1942 ; 1944 -- present ) </Li> <Li> Phil - Pitt `` Steagles '' ( 1943 ) </Li> </Ul> </Td> </Tr> <Tr> <Th colspan=\"2\"> Team nicknames </Th> </Tr> <Tr> <Td colspan=\"2\"> <Ul> <Li> The Birds </Li> </Ul> </Td> </Tr> <Tr> <Th colspan=\"2\"> Championships </Th> </Tr> <Tr> <Td colspan=\"2\"> <P> League championships ( 4 ) </P> <Ul> <Li> NFL championships ( pre-1970 AFL -- NFL merger ) ( 3 ) 1948 , 1949 , 1960 </Li> </Ul> <Ul> <Li> Super Bowl championships ( 1 ) 2017 ( LII ) </Li> </Ul> </Td> </Tr> <Tr> <Td colspan=\"2\"> <P> Conference championships ( 4 ) </P> <Ul> <Li> NFL Eastern : 1960 </Li> <Li> NFC : 1980 , 2004 , 2017 </Li> </Ul> </Td> </Tr> <Tr> <Td colspan=\"2\"> <P> Division championships ( 13 ) </P> <Ul> <Li> NFL East : 1947 , 1948 , 1949 </Li> <Li> NFC East : 1980 , 1988 , 2001 , 2002 , 2003 , 2004 , 2006 , 2010 , 2013 , 2017 </Li> </Ul> </Td> </Tr> <Tr> <Th colspan=\"2\"> Playoff appearances ( 25 ) </Th> </Tr> <Tr> <Td colspan=\"2\"> <Ul> <Li> NFL : 1947 , 1948 , 1949 , 1960 , 1978 , 1979 , 1980 , 1981 , 1988 , 1989 , 1990 , 1992 , 1995 , 1996 , 2000 , 2001 , 2002 , 2003 , 2004 , 2006 , 2008 , 2009 , 2010 , 2013 , 2017 </Li> </Ul> </Td> </Tr> <Tr> <Th colspan=\"2\"> Home fields </Th> </Tr> <Tr> <Td colspan=\"2\"> <Ul> <Li> Baker Bowl ( 1933 -- 1935 ) </Li> <Li> Philadelphia Municipal Stadium ( 1936 -- 1939 , 1941 ) </Li> <Li> Connie Mack Stadium ( 1940 , 1942 -- 1957 ) </Li> <Li> Franklin Field ( 1958 -- 1970 ) </Li> <Li> Veterans Stadium ( 1971 -- 2002 ) </Li> <Li> Lincoln Financial Field ( 2003 -- present ) </Li> </Ul> </Td> </Tr> </Table>",
    "topic": "Trends and key factors underlying the Eagles\u2019 conference championship victories across NFL Eastern and NFC eras.",
    "response": "<document_analysis>\nThe context provides data on the Eagles\u2019 conference championships (1960 in the NFL Eastern era; 1980, 2004, 2017 in the NFC era) alongside their home field timelines. Mapping championship years to stadium eras reveals that Franklin Field (1958\u20131970) hosted the 1960 crown, Veterans Stadium (1971\u20132002) hosted the 1980 crown, and Lincoln Financial Field (2003\u2013present) hosted both 2004 and 2017 victories. This mapping supports an analytical question requiring synthesis across championship dates and venue tenures.\nDifficulty rating: 7/10 \u2013 requires cross\u2010referencing multiple list elements.\n</document_analysis>\n\n<output_format>\nQuestion: Tallying the Eagles' conference championships against their principal home fields, which venue has hosted the most such victories and how many did it host?\nA: Franklin Field \u2013 1  \nB: Veterans Stadium \u2013 1  \nC: Lincoln Financial Field \u2013 2  \nD: Connie Mack Stadium \u2013 1  \nExplanation: The Eagles won conference championships in 1960 at Franklin Field, in 1980 at Veterans Stadium, and in both 2004 and 2017 at Lincoln Financial Field, giving the Linc two such victories.  \nCorrect Answer: C\n</output_format>",
    "question": "Tallying the Eagles' conference championships against their principal home fields, which venue has hosted the most such victories and how many did it host?",
    "choices": {
      "A": "Franklin Field \u2013 1",
      "B": "Veterans Stadium \u2013 1",
      "C": "Lincoln Financial Field \u2013 2",
      "D": "Connie Mack Stadium \u2013 1"
    },
    "answer": "C",
    "explanation": "The Eagles won conference championships in 1960 at Franklin Field, in 1980 at Veterans Stadium, and in both 2004 and 2017 at Lincoln Financial Field, giving the Linc two such victories.",
    "question_token_count": 30,
    "answer_correctness_score": 10,
    "explanation_validity_score": 10,
    "question_clarity_score": 6,
    "question_difficulty_score": 7,
    "question_groundedness_score": 10,
    "avg_answer_token_count": 7
  },
  {
    "context": "<P> `` Let It Go '' is a song from Disney 's 2013 animated feature film Frozen , whose music and lyrics were composed by husband - and - wife songwriting team Kristen Anderson - Lopez and Robert Lopez . The song was performed in its original show - tune version in the film by American actress and singer Idina Menzel in her vocal role as Queen Elsa . Anderson - Lopez and Lopez also composed a simplified pop version ( with shorter lyrics and background chorus ) which was performed by actress and singer Demi Lovato over the start of the film 's closing credits . A music video was separately released for the pop version . </P>",
    "topic": "Analysis of Disney\u2019s cross\u2011media marketing strategy in releasing a separate music video for the pop version of \u201cLet It Go.\u201d",
    "response": "<document_analysis>\nThe context describes Disney\u2019s dual-version release of \u201cLet It Go\u201d: an original show-tune performance by Idina Menzel within the film and a simplified pop rendition by Demi Lovato released separately, along with its own music video. The key marketing tactic is cross\u2011media leverage\u2014producing distinct but related content to tap into different audience segments. Implicitly, Disney harnessed Demi Lovato\u2019s mainstream pop appeal to broaden promotional reach beyond core filmgoers. This exemplifies audience segmentation and talent leverage within media convergence strategies. Difficulty rating: 8/10, as it requires synthesis of marketing principles and insight into Disney\u2019s ancillary content tactics.\n</document_analysis>\n\n<output_format>\nQuestion: Which cross\u2011media marketing principle is most clearly illustrated by Disney releasing a standalone music video for Demi Lovato\u2019s pop rendition of \u201cLet It Go\u201d?\nA: Narrative expansion\u2014deepening the film\u2019s storyline by adding new character perspectives through music.\nB: Talent leverage\u2014capitalizing on a pop star\u2019s existing fanbase to extend the film\u2019s promotional reach.\nC: Vertical integration\u2014streamlining control over production and distribution by using only in\u2011house resources.\nD: Product bundling\u2014pairing film screenings with soundtrack purchases in a single packaged deal.\nExplanation: By creating a separate music video featuring a well\u2011known pop artist, Disney tapped directly into her fanbase and the broader pop\u2011music market segment, thereby broadening its promotional reach beyond the film\u2019s original audience.\nCorrect Answer: B\n</output_format>",
    "question": "Which cross\u2011media marketing principle is most clearly illustrated by Disney releasing a standalone music video for Demi Lovato\u2019s pop rendition of \u201cLet It Go\u201d?",
    "choices": {
      "A": "Narrative expansion\u2014deepening the film\u2019s storyline by adding new character perspectives through music.",
      "B": "Talent leverage\u2014capitalizing on a pop star\u2019s existing fanbase to extend the film\u2019s promotional reach.",
      "C": "Vertical integration\u2014streamlining control over production and distribution by using only in\u2011house resources.",
      "D": "Product bundling\u2014pairing film screenings with soundtrack purchases in a single packaged deal."
    },
    "answer": "B",
    "explanation": "By creating a separate music video featuring a well\u2011known pop artist, Disney tapped directly into her fanbase and the broader pop\u2011music market segment, thereby broadening its promotional reach beyond the film\u2019s original audience.",
    "question_token_count": 31,
    "answer_correctness_score": 10,
    "explanation_validity_score": 10,
    "question_clarity_score": 8,
    "question_difficulty_score": 6,
    "question_groundedness_score": 9,
    "avg_answer_token_count": 20
  },
  {
    "context": "<P> The Super Bowl LII Halftime Show ( officially known as the Pepsi Super Bowl LII Halftime Show ) took place on February 4 , 2018 at U.S. Bank Stadium in Minneapolis , Minnesota , as part of Super Bowl LII . Justin Timberlake was the featured performer , as confirmed by the National Football League ( NFL ) on October 22 , 2017 . It was televised nationally by NBC . </P>",
    "topic": "Exploration of the halftime show\u2019s function within the overarching Super Bowl LII event framework, examining its contribution to viewer engagement, advertising revenue, and entertainment value.",
    "response": "<document_analysis>\nThe provided context briefly details the Super Bowl LII Halftime Show\u2019s naming rights (Pepsi), performer (Justin Timberlake), venue, date, and broadcast network (NBC). For a domain expert question, the most substantive element is the title sponsorship and its role in the event\u2019s revenue model. Though limited in scope, this information allows us to probe the strategic monetization via title sponsorship, linking it to advertising revenue and brand association. I will craft a question focused on the strategic function of title sponsorship within the overall Super Bowl revenue framework.\nDifficulty: 8/10 (requires understanding of event sponsorship and advertising monetization).\n</document_analysis>\n\n<output_format>\nQuestion: In the monetization strategy of a high\u2010profile live broadcast like the Super Bowl LII, what is the primary strategic role of securing a title sponsor (e.g., Pepsi) for the Halftime Show?\nA: Sharing production costs equally between the NFL and sponsor to minimize financial risk.\nB: Integrating sponsor\u2019s product placements directly into the artist\u2019s performance to boost engagement.\nC: Locking in premium advertising inventory and exclusive brand association around the event.\nD: Driving ticket sales uplift through co\u2011branded promotional offers tied to the sponsor.\nExplanation: Title sponsorship is chiefly used to command higher advertising rates and create an exclusive brand alignment with the most-watched program segment.\nCorrect Answer: C\n</output_format>",
    "question": "In the monetization strategy of a high\u2010profile live broadcast like the Super Bowl LII, what is the primary strategic role of securing a title sponsor (e.g., Pepsi) for the Halftime Show?",
    "choices": {
      "A": "Sharing production costs equally between the NFL and sponsor to minimize financial risk.",
      "B": "Integrating sponsor\u2019s product placements directly into the artist\u2019s performance to boost engagement.",
      "C": "Locking in premium advertising inventory and exclusive brand association around the event.",
      "D": "Driving ticket sales uplift through co\u2011branded promotional offers tied to the sponsor."
    },
    "answer": "C",
    "explanation": "Title sponsorship is chiefly used to command higher advertising rates and create an exclusive brand alignment with the most-watched program segment.",
    "question_token_count": 43,
    "answer_correctness_score": 10,
    "explanation_validity_score": 10,
    "question_clarity_score": 6,
    "question_difficulty_score": 6,
    "question_groundedness_score": 6,
    "avg_answer_token_count": 16
  },
  {
    "context": "<P> Carol Ann Susi ( February 2 , 1952 -- November 11 , 2014 ) was an American actress . She was known for providing the voice of recurring unseen character Mrs. Wolowitz , mother of Howard Wolowitz , on the television series The Big Bang Theory . </P>",
    "topic": "The cultural and audience reception of Mrs. Wolowitz as a standout unseen character",
    "response": "<document_analysis>\nThe context provided is minimal, detailing only that Carol Ann Susi voiced the unseen character Mrs. Wolowitz on The Big Bang Theory. Despite limited explicit information, an expert familiar with sitcom conventions can extrapolate how unseen characters become memorable through audio cues, other characters\u2019 reactions, and narrative framing. This allows the creation of a high-level question about the mechanism by which an off-screen character like Mrs. Wolowitz achieves standout status. Difficulty is calibrated at 8/10, as it requires synthesis of theory on unseen characters in television comedy.\n</document_analysis>\n\n<output_format>\nQuestion: Which aspect of Mrs. Wolowitz\u2019s portrayal most powerfully contributed to her memorable presence despite never appearing on-screen?\nA: The scripted backstory details revealed through dialogue\nB: Carol Ann Susi\u2019s distinctive vocal performance and off-camera shouting\nC: The visual set design of Howard's childhood home\nD: The recurring on-screen reactions of other characters to her voice\nExplanation: While other factors play roles, it was primarily Susi\u2019s unique voice and loud off-screen presence that made Mrs. Wolowitz unforgettable despite her physical absence.\nCorrect Answer: B\n</output_format>",
    "question": "Which aspect of Mrs. Wolowitz\u2019s portrayal most powerfully contributed to her memorable presence despite never appearing on-screen?",
    "choices": {
      "A": "The scripted backstory details revealed through dialogue",
      "B": "Carol Ann Susi\u2019s distinctive vocal performance and off-camera shouting",
      "C": "The visual set design of Howard's childhood home",
      "D": "The recurring on-screen reactions of other characters to her voice"
    },
    "answer": "B",
    "explanation": "While other factors play roles, it was primarily Susi\u2019s unique voice and loud off-screen presence that made Mrs. Wolowitz unforgettable despite her physical absence.",
    "question_token_count": 24,
    "answer_correctness_score": 10,
    "explanation_validity_score": 10,
    "question_clarity_score": 6,
    "question_difficulty_score": 7,
    "question_groundedness_score": 2,
    "avg_answer_token_count": 11
  },
  {
    "context": "<P> I Can Only Imagine is a 2018 American Christian drama film directed by the Erwin Brothers and written by Alex Cramer , Jon Erwin , and Brent McCorkle , based on the story behind the MercyMe song of the same name , the best - selling Christian single of all time . The film stars J. Michael Finley as Bart Millard , the lead singer who wrote the song about his relationship with his father ( Dennis Quaid ) . Madeline Carroll , Priscilla Shirer , Cloris Leachman , and Trace Adkins also star . </P>",
    "topic": "The role and impact of including veteran actors like Dennis Quaid and Cloris Leachman alongside relative newcomers.",
    "response": "<document_analysis>\nThe context describes a faith-based drama film featuring both established actors (Dennis Quaid, Cloris Leachman) and emerging talent (J. Michael Finley). Central themes include generational relationships and authenticity. The analysis identifies that casting veterans alongside newcomers can influence narrative depth, audience trust, and demographic reach. We can frame a question on the strategic impact of such casting choices in a generational drama, ensuring plausible distractors and a nuanced correct answer.\n</document_analysis>\n\n<output_format>\nQuestion: In a faith-based drama centered on intergenerational relationships, what is the primary strategic benefit of pairing veteran actors like Dennis Quaid and Cloris Leachman with emerging performers?\nA: It guarantees box-office success solely through the veterans\u2019 established fan bases.\nB: It amplifies narrative authenticity by mirroring mentorship dynamics and bridging audience demographics.\nC: It reduces overall production expenses by offsetting high-profile fees with lower newcomer salaries.\nD: It simplifies marketing by allowing promotional efforts to focus exclusively on veteran star power.\nExplanation: Pairing seasoned actors with newcomers deepens the film\u2019s emotional credibility, reflects its themes of generational mentorship, and broadens its appeal across age groups.\nCorrect Answer: B\n</output_format>",
    "question": "In a faith-based drama centered on intergenerational relationships, what is the primary strategic benefit of pairing veteran actors like Dennis Quaid and Cloris Leachman with emerging performers?",
    "choices": {
      "A": "It guarantees box-office success solely through the veterans\u2019 established fan bases.",
      "B": "It amplifies narrative authenticity by mirroring mentorship dynamics and bridging audience demographics.",
      "C": "It reduces overall production expenses by offsetting high-profile fees with lower newcomer salaries.",
      "D": "It simplifies marketing by allowing promotional efforts to focus exclusively on veteran star power."
    },
    "answer": "B",
    "explanation": "Pairing seasoned actors with newcomers deepens the film\u2019s emotional credibility, reflects its themes of generational mentorship, and broadens its appeal across age groups.",
    "question_token_count": 37,
    "answer_correctness_score": 9,
    "explanation_validity_score": 9,
    "question_clarity_score": 6,
    "question_difficulty_score": 7,
    "question_groundedness_score": 2,
    "avg_answer_token_count": 16
  },
  {
    "context": "<P> The Astros played in the NL from 1962 to 2012 . They played in the West Division from 1969 to 1993 , and the Central Division from 1994 to 2012 . While a member of the NL , the Astros played in one World Series , in 2005 , against the Chicago White Sox , in which they were swept in four games . In 2017 , they became the first franchise in MLB history to have won a pennant in both the NL and the AL , when they defeated the New York Yankees in the ALCS . They subsequently won the 2017 World Series against the Los Angeles Dodgers , winning four games to three , earning the team , and Texas , its first World Series title . </P>",
    "topic": "Analyze the Houston Astros\u2019 evolution within the National League from 1962 to 2012 and its impact on the franchise\u2019s competitive identity.",
    "response": "<document_analysis>\nThe context outlines the Astros\u2019 tenure in the National League (1962\u20132012), their divisional alignment (West 1969\u20131993, Central 1994\u20132012), and key milestones (2005 NL pennant appearance and 2017 World Series title). A probing question can explore how the 1994 divisional shift influenced organizational development and competitive identity, culminating in their first NL pennant in 2005. The question challenges experts to link realignment pressures with subsequent performance. Difficulty is high (rated 8/10) as it demands synthesis of divisional strength, organizational strategy, and timeline of success.\n</document_analysis>\n\n<output_format>\nQuestion: How did the 1994 realignment of the Houston Astros from the National League West to the Central Division contextualize their trajectory toward the 2005 World Series appearance?\nA: It reduced travel to Pacific venues, stabilizing performance en route to the pennant.\nB: It placed them in a comparatively weaker division, easing their route to the playoffs.\nC: It immersed them in a more competitive Central, prompting organizational improvements that culminated in their 2005 pennant.\nD: It had minimal effect on their postseason trajectory, which was driven primarily by player development cycles.\nExplanation: The shift to a tougher divisional environment forced the Astros to strengthen their roster and infrastructure, directly contributing to their breakthrough in 2005.\nCorrect Answer: C\n</output_format>",
    "question": "How did the 1994 realignment of the Houston Astros from the National League West to the Central Division contextualize their trajectory toward the 2005 World Series appearance?",
    "choices": {
      "A": "It reduced travel to Pacific venues, stabilizing performance en route to the pennant.",
      "B": "It placed them in a comparatively weaker division, easing their route to the playoffs.",
      "C": "It immersed them in a more competitive Central, prompting organizational improvements that culminated in their 2005 pennant.",
      "D": "It had minimal effect on their postseason trajectory, which was driven primarily by player development cycles."
    },
    "answer": "C",
    "explanation": "The shift to a tougher divisional environment forced the Astros to strengthen their roster and infrastructure, directly contributing to their breakthrough in 2005.",
    "question_token_count": 36,
    "answer_correctness_score": 8,
    "explanation_validity_score": 9,
    "question_clarity_score": 4,
    "question_difficulty_score": 8,
    "question_groundedness_score": 8,
    "avg_answer_token_count": 19
  },
  {
    "context": "<P> The United States presidential line of succession is the order in which persons may become or act as President of the United States if the incumbent president becomes incapacitated , dies , resigns , or is removed from office ( by impeachment by the House of Representatives and subsequent conviction by the Senate ) . The line of succession is set by the United States Constitution and the Presidential Succession Act of 1947 as subsequently amended to include newly created cabinet offices . The succession follows the order of vice president , Speaker of the House of Representatives , President pro tempore of the Senate , and then the heads of federal executive departments who form the Cabinet of the United States . The Cabinet currently has fifteen members , beginning with the Secretary of State , and followed by the rest in the order of their positions ' creation . Those heads of department who are ineligible to act as president are also ineligible to succeed the president by succession , for example most commonly if they are not a natural - born U.S. citizen . </P>",
    "topic": "Constitutional provisions in the U.S. Constitution that establish the presidential line of succession.",
    "response": "<document_analysis>\nThe context explains that the presidential succession order derives partly from the Constitution and partly from federal statute (the 1947 Act). It outlines the specific sequence (vice president, Speaker, President pro tempore, cabinet heads in creation order) and notes that eligibility requirements must be met. A deep constitutional question probes the very source of Congress\u2019s power to establish the statutory order beyond the vice president. Asking which constitutional provision grants Congress this authority tests expert-level familiarity with the text of the Constitution and its amendments.\nDifficulty rating: 8/10\n</document_analysis>\n\n<output_format>\nQuestion: Which provision of the U.S. Constitution expressly empowers Congress to legislate the order of presidential succession beyond the vice president?\nA: Article II, Section\u00a01, Clause\u00a06  \nB: The Twelfth Amendment  \nC: Twentieth Amendment, Section\u00a03  \nD: Twenty-Fifth Amendment, Section\u00a02  \nExplanation: Article\u00a0II, Section\u00a01, Clause\u00a06 grants Congress authority \u201cto provide by Law, for the Case of Removal, Death, Resignation or Inability\u201d of the President and Vice President, forming the constitutional basis for the statutory succession order.  \nCorrect Answer: A\n</output_format>",
    "question": "Which provision of the U.S. Constitution expressly empowers Congress to legislate the order of presidential succession beyond the vice president?",
    "choices": {
      "A": "Article II, Section\u00a01, Clause\u00a06",
      "B": "The Twelfth Amendment",
      "C": "Twentieth Amendment, Section\u00a03",
      "D": "Twenty-Fifth Amendment, Section\u00a02"
    },
    "answer": "A",
    "explanation": "Article\u00a0II, Section\u00a01, Clause\u00a06 grants Congress authority \u201cto provide by Law, for the Case of Removal, Death, Resignation or Inability\u201d of the President and Vice President, forming the constitutional basis for the statutory succession order.",
    "question_token_count": 25,
    "answer_correctness_score": 10,
    "explanation_validity_score": 10,
    "question_clarity_score": 8,
    "question_difficulty_score": 9,
    "question_groundedness_score": 2,
    "avg_answer_token_count": 8
  },
  {
    "context": "<P> `` Let It Go '' is a song from Disney 's 2013 animated feature film Frozen , whose music and lyrics were composed by husband - and - wife songwriting team Kristen Anderson - Lopez and Robert Lopez . The song was performed in its original show - tune version in the film by American actress and singer Idina Menzel in her vocal role as Queen Elsa . Anderson - Lopez and Lopez also composed a simplified pop version ( with shorter lyrics and background chorus ) which was performed by actress and singer Demi Lovato over the start of the film 's closing credits . A music video was separately released for the pop version . </P>",
    "topic": "Comparative evaluation of lyrical edits, arrangement choices, and stylistic shifts between the film\u2019s show\u2011tune version and the pop version of \u201cLet It Go.\u201d",
    "response": "<document_analysis>\nThoughtful Content Examination:\nThe context outlines two distinct versions of \"Let It Go\": the original show\u2011tune rendition sung by Idina Menzel within the film narrative, and a simplified pop adaptation performed by Demi Lovato during the closing credits. Key contrasts include the lyrical edits (shorter lyrics) and arrangement choices (addition of a background chorus), as well as the shift from diegetic, character\u2011driven storytelling to an extradiegetic, radio\u2011ready anthem with a separate music video.\n\nConcept Exploration:\nImplicitly, the simplification of lyrics likely removes plot\u2011specific references in favor of universal themes, while the background chorus reframes the song from an individual\u2019s emotional journey to a collective empowerment statement. These changes serve strategic cross\u2011genre marketing goals, trading theatrical complexity for streamlined pop sensibilities.\n\nStrategic Complexity Calibration:\nDifficulty is rated 7/10. The question probes understanding of how specific compositional strategies recalibrate a song\u2019s stylistic identity and audience reception\u2014concepts that require synthesis of lyrical, arrangement, and media\u2011format considerations.\n\nIntentional Question Planning:\nThe question asks which combination of lyrical and arrangement edits most effectively shifts the piece from a theater number to a mainstream pop anthem, demanding expert insight into genre adaptation strategies and the nuanced impact of backing vocals on narrative focus.\n</document_analysis>\n\n<output_format>\nQuestion: In adapting the original show\u2011tune \u201cLet It Go\u201d into its pop counterpart, which pairing of lyrical and arrangement changes most fundamentally repositions the song from a character\u2011driven musical number to a radio\u2011friendly empowerment anthem?\nA: Truncating narrative\u2011specific verses while introducing a background chorus to amplify collective uplift\nB: Retaining Elsa\u2019s solo storytelling focus but employing denser pop production and synthesizer layers\nC: Shortening the song\u2019s runtime by cutting instrumental breaks and emphasizing EDM\u2011style drops\nD: Adding contrapuntal vocal lines throughout the chorus to reflect thematic echoes from the film\nExplanation: Only option A describes how removing plot\u2011specific lyrics and adding a choir shifts the focus from a solo theatrical narrative to a broad, pop\u2011anthem style suitable for radio play.\nCorrect Answer: A\n</output_format>",
    "question": "In adapting the original show\u2011tune \u201cLet It Go\u201d into its pop counterpart, which pairing of lyrical and arrangement changes most fundamentally repositions the song from a character\u2011driven musical number to a radio\u2011friendly empowerment anthem?",
    "choices": {
      "A": "Truncating narrative\u2011specific verses while introducing a background chorus to amplify collective uplift",
      "B": "Retaining Elsa\u2019s solo storytelling focus but employing denser pop production and synthesizer layers",
      "C": "Shortening the song\u2019s runtime by cutting instrumental breaks and emphasizing EDM\u2011style drops",
      "D": "Adding contrapuntal vocal lines throughout the chorus to reflect thematic echoes from the film"
    },
    "answer": "A",
    "explanation": "Only option A describes how removing plot\u2011specific lyrics and adding a choir shifts the focus from a solo theatrical narrative to a broad, pop\u2011anthem style suitable for radio play.",
    "question_token_count": 50,
    "answer_correctness_score": 10,
    "explanation_validity_score": 10,
    "question_clarity_score": 6,
    "question_difficulty_score": 8,
    "question_groundedness_score": 4,
    "avg_answer_token_count": 17
  },
  {
    "context": "<P> The seventh season of the fantasy drama television series Game of Thrones premiered on HBO on July 16 , 2017 , and concluded on August 27 , 2017 . Unlike previous seasons that consisted of ten episodes each , the seventh season consisted of only seven . Like the previous season , it largely consisted of original content not found in George R.R. Martin 's A Song of Ice and Fire series , while also adapting material Martin revealed to showrunners about the upcoming novels in the series . The series was adapted for television by David Benioff and D.B. Weiss . </P>",
    "topic": "Comparative study of Season 7\u2019s adaptation approach versus earlier seasons with respect to fidelity to Martin\u2019s existing novels.",
    "response": "<document_analysis>\nThe context explains that Season 7 of Game of Thrones diverged from earlier seasons by featuring predominantly original material not found in the existing novels, while also incorporating plot elements from the author\u2019s unreleased outlines\u2014whereas earlier seasons adapted only published novel content. This clear shift in fidelity to source material allows formulation of a contrastive question probing nuanced understanding of adaptation strategies.\nDifficulty: 8/10\n</document_analysis>\n\n<output_format>\nQuestion: Which statement most accurately contrasts Season\u00a07\u2019s adaptation strategy with that of earlier seasons?\nA: Season\u00a07 exclusively adapted events from published novels, whereas earlier seasons frequently introduced show-runner\u2013original content.\nB: Season\u00a07 primarily featured original plotlines created by the showrunners, while earlier seasons adhered strictly to Martin\u2019s published novels.\nC: Season\u00a07 relied heavily on unpublished outlines and preview material from George R.R. Martin, whereas earlier seasons drew exclusively from finished novels.\nD: Season\u00a07 combined largely original content with elements from Martin\u2019s unreleased novel material, in contrast to earlier seasons which adapted only existing novels.\nExplanation: Season\u00a07 mixed new, show-runner\u2013created storylines with elements from Martin\u2019s unpublished outlines, unlike earlier seasons that strictly followed the published books.\nCorrect Answer: D\n</output_format>",
    "question": "Which statement most accurately contrasts Season\u00a07\u2019s adaptation strategy with that of earlier seasons?",
    "choices": {
      "A": "Season\u00a07 exclusively adapted events from published novels, whereas earlier seasons frequently introduced show-runner\u2013original content.",
      "B": "Season\u00a07 primarily featured original plotlines created by the showrunners, while earlier seasons adhered strictly to Martin\u2019s published novels.",
      "C": "Season\u00a07 relied heavily on unpublished outlines and preview material from George R.R. Martin, whereas earlier seasons drew exclusively from finished novels.",
      "D": "Season\u00a07 combined largely original content with elements from Martin\u2019s unreleased novel material, in contrast to earlier seasons which adapted only existing novels."
    },
    "answer": "D",
    "explanation": "Season\u00a07 mixed new, show-runner\u2013created storylines with elements from Martin\u2019s unpublished outlines, unlike earlier seasons that strictly followed the published books.",
    "question_token_count": 18,
    "answer_correctness_score": 10,
    "explanation_validity_score": 10,
    "question_clarity_score": 6,
    "question_difficulty_score": 7,
    "question_groundedness_score": 5,
    "avg_answer_token_count": 27
  },
  {
    "context": "<P> The Astros played in the NL from 1962 to 2012 . They played in the West Division from 1969 to 1993 , and the Central Division from 1994 to 2012 . While a member of the NL , the Astros played in one World Series , in 2005 , against the Chicago White Sox , in which they were swept in four games . In 2017 , they became the first franchise in MLB history to have won a pennant in both the NL and the AL , when they defeated the New York Yankees in the ALCS . They subsequently won the 2017 World Series against the Los Angeles Dodgers , winning four games to three , earning the team , and Texas , its first World Series title . </P>",
    "topic": "Assess the historical significance of the Astros becoming the first MLB franchise to win league pennants in both the National and American Leagues.",
    "response": "<document_analysis>\nThe context outlines the Astros\u2019 membership in the National League from 1962\u20132012, their lone NL pennant in 2005, the league switch to the AL West in 2013, and their 2017 AL pennant\u2014making them the first franchise to win pennants in both leagues. Key theme: the franchise\u2019s league transfer was the necessary organizational change enabling an AL pennant. Other details (divisional realignments, stadium moves, playoff expansions) are plausible distractors but secondary to the league switch.\n</document_analysis>\n\n<output_format>\nQuestion: Which organizational shift enabled the Astros to compete for\u2014and ultimately secure\u2014their first American League pennant, thus becoming the first MLB franchise to win league pennants in both the National and American Leagues?\nA: Their acquisition of the AL wild-card berth after the 2012 playoff expansion\nB: Their move from the National League Central to the American League West in 2013\nC: The National League\u2019s division into East and West in 1969\nD: The transition of home games to Minute Maid Park in 2000\nExplanation: The Astros\u2019 transfer to the American League West in 2013 was the decisive change that allowed them to vie for and win an AL pennant, completing their dual\u2010league pennant achievement.\nCorrect Answer: B\n</output_format>",
    "question": "Which organizational shift enabled the Astros to compete for\u2014and ultimately secure\u2014their first American League pennant, thus becoming the first MLB franchise to win league pennants in both the National and American Leagues?",
    "choices": {
      "A": "Their acquisition of the AL wild-card berth after the 2012 playoff expansion",
      "B": "Their move from the National League Central to the American League West in 2013",
      "C": "The National League\u2019s division into East and West in 1969",
      "D": "The transition of home games to Minute Maid Park in 2000"
    },
    "answer": "B",
    "explanation": "The Astros\u2019 transfer to the American League West in 2013 was the decisive change that allowed them to vie for and win an AL pennant, completing their dual\u2010league pennant achievement.",
    "question_token_count": 42,
    "answer_correctness_score": 10,
    "explanation_validity_score": 10,
    "question_clarity_score": 6,
    "question_difficulty_score": 7,
    "question_groundedness_score": 4,
    "avg_answer_token_count": 15
  },
  {
    "context": "<Table> <Tr> <Th colspan=\"2\"> Season </Th> <Th colspan=\"2\"> Episodes </Th> <Th colspan=\"2\"> Originally released </Th> </Tr> <Tr> <Th> First released </Th> <Th> Last released </Th> </Tr> <Tr> <Td> </Td> <Td colspan=\"1\"> </Td> <Td colspan=\"2\"> 10 </Td> <Td colspan=\"1\"> April 26 , 2017 ( 2017 - 04 - 26 ) </Td> <Td> June 14 , 2017 ( 2017 - 06 - 14 ) </Td> </Tr> <Tr> <Td> </Td> <Td colspan=\"1\"> </Td> <Td colspan=\"2\"> 13 </Td> <Td colspan=\"1\"> April 25 , 2018 ( 2018 - 04 - 25 ) </Td> <Td> July 11 , 2018 ( 2018 - 07 - 11 ) </Td> </Tr> </Table>",
    "topic": "Evaluate the dual date formats (human\u2010readable vs. ISO) for localization and data processing purposes, suggesting best practices for international audiences.",
    "response": "<document_analysis>\nThe context presents HTML table data that uses two date formats: a localized human-readable format (\u201cApril 26, 2017\u201d) and the ISO 8601 format (\u201c2017-04-26\u201d). The key theme is the dual-format approach for readability and machine processing. An expert question would probe the technical advantage of ISO 8601 when paired with localized displays, focusing on parsing and sorting across locales.\n</document_analysis>\n\n<output_format>\nQuestion: What crucial property of ISO 8601 date strings makes them especially valuable for machine parsing and sorting in an internationalized web table when used alongside human-readable dates?\nA: They adjust automatically to the client\u2019s locale language.\nB: They are lexicographically sortable in chronological order.\nC: They embed timezone abbreviations for all regions.\nD: They include full month names for clarity.\nExplanation: ISO 8601 strings sort lexicographically in the same order as their chronological sequence, enabling reliable machine-side sorting across locales.\nCorrect Answer: B\n</output_format>",
    "question": "What crucial property of ISO 8601 date strings makes them especially valuable for machine parsing and sorting in an internationalized web table when used alongside human-readable dates?",
    "choices": {
      "A": "They adjust automatically to the client\u2019s locale language.",
      "B": "They are lexicographically sortable in chronological order.",
      "C": "They embed timezone abbreviations for all regions.",
      "D": "They include full month names for clarity."
    },
    "answer": "B",
    "explanation": "ISO 8601 strings sort lexicographically in the same order as their chronological sequence, enabling reliable machine-side sorting across locales.",
    "question_token_count": 33,
    "answer_correctness_score": 10,
    "explanation_validity_score": 10,
    "question_clarity_score": 6,
    "question_difficulty_score": 8,
    "question_groundedness_score": 2,
    "avg_answer_token_count": 9
  },
  {
    "context": "<P> The Pittsburgh Steelers ( 6 -- 2 ) have won the most Super Bowls with six championships , while the New England Patriots ( 5 -- 5 ) , the Dallas Cowboys ( 5 -- 3 ) , and the San Francisco 49ers ( 5 -- 1 ) have five wins . New England has the most Super Bowl appearances with ten , while the Buffalo Bills ( 0 -- 4 ) have the most consecutive appearances with four ( all losses ) from 1990 to 1993 . The Miami Dolphins are the only other team to have at least three consecutive appearances : 1972 -- 1974 . The Denver Broncos ( 3 -- 5 ) and Patriots have each lost a record five Super Bowls . The Minnesota Vikings ( 0 -- 4 ) and the Bills have lost four . The record for consecutive wins is two and is shared by seven franchises : the Green Bay Packers ( 1966 -- 1967 ) , the Miami Dolphins ( 1972 -- 1973 ) , the Pittsburgh Steelers ( 1974 -- 1975 and 1978 -- 1979 , the only team to accomplish this feat twice ) , the San Francisco 49ers ( 1988 -- 1989 ) , the Dallas Cowboys ( 1992 -- 1993 ) , the Denver Broncos ( 1997 -- 1998 ) , and the New England Patriots ( 2003 -- 2004 ) . Among those , Dallas ( 1992 -- 1993 ; 1995 ) and New England ( 2001 ; 2003 -- 2004 ) are the only teams to win three out of four consecutive Super Bowls . The 1972 Dolphins capped off the only perfect season in NFL history with their victory in Super Bowl VII . The only team with multiple Super Bowl appearances and no losses is the Baltimore Ravens , who in winning Super Bowl XLVII defeated and replaced the 49ers in that position . Four current NFL teams have never appeared in a Super Bowl , including franchise relocations and renaming : the Cleveland Browns , Detroit Lions , Jacksonville Jaguars , and Houston Texans , though both the Browns ( 1964 ) and Lions ( 1957 ) had won NFL championship games prior to the creation of the Super Bowl . </P>",
    "topic": "Comparative analysis of Super Bowl championships among the Pittsburgh Steelers, New England Patriots, Dallas Cowboys, and San Francisco 49ers and the factors contributing to their title counts.",
    "response": "<document_analysis>\nThe context details Super Bowl win records, appearance counts, consecutive wins, and unique franchise achievements. Central themes include total championships, conversion rates, consecutive appearance streaks, and dynastic success periods. Notably, the Pittsburgh Steelers are the only team to achieve two distinct streaks of back-to-back Super Bowl victories, marking multiple dynastic peaks. This subtle distinction among top-winning franchises provides a basis for a challenging comparative question.\nDifficulty rating: 6/10 (requires synthesis of multiple data points and identification of unique franchise patterns)\n</document_analysis>\n\n<output_format>\nQuestion: Among the franchises with the most Super Bowl titles, which one uniquely achieved two separate eras of back-to-back championships, signaling multiple distinct dynastic peaks?\nA: New England Patriots\nB: San Francisco 49ers\nC: Dallas Cowboys\nD: Pittsburgh Steelers\nExplanation: Only the Pittsburgh Steelers won consecutive Super Bowls twice\u2014in 1974\u20131975 and again in 1978\u20131979\u2014while no other franchise has two separate back-to-back title runs.\nCorrect Answer: D\n</output_format>",
    "question": "Among the franchises with the most Super Bowl titles, which one uniquely achieved two separate eras of back-to-back championships, signaling multiple distinct dynastic peaks?",
    "choices": {
      "A": "New England Patriots",
      "B": "San Francisco 49ers",
      "C": "Dallas Cowboys",
      "D": "Pittsburgh Steelers"
    },
    "answer": "D",
    "explanation": "Only the Pittsburgh Steelers won consecutive Super Bowls twice\u2014in 1974\u20131975 and again in 1978\u20131979\u2014while no other franchise has two separate back-to-back title runs.",
    "question_token_count": 31,
    "answer_correctness_score": 10,
    "explanation_validity_score": 10,
    "question_clarity_score": 8,
    "question_difficulty_score": 9,
    "question_groundedness_score": 10,
    "avg_answer_token_count": 4
  },
  {
    "context": "<P> The Astros played in the NL from 1962 to 2012 . They played in the West Division from 1969 to 1993 , and the Central Division from 1994 to 2012 . While a member of the NL , the Astros played in one World Series , in 2005 , against the Chicago White Sox , in which they were swept in four games . In 2017 , they became the first franchise in MLB history to have won a pennant in both the NL and the AL , when they defeated the New York Yankees in the ALCS . They subsequently won the 2017 World Series against the Los Angeles Dodgers , winning four games to three , earning the team , and Texas , its first World Series title . </P>",
    "topic": "Explore the potential challenges and opportunities the Astros faced transitioning from the National League to the American League and how this shift informed their 2017 success.",
    "response": "<document_analysis>\nThe context outlines the Astros\u2019 league history, their lone NL pennant in 2005 (swept), their move to the AL in 2013, and their 2017 achievements: first AL pennant for the franchise and unprecedentedly becoming the first team to win pennants in both leagues, then winning Texas\u2019s first World Series. The central nuanced theme is the historic MLB milestone set by their 2017 AL pennant. A high-difficulty question focuses on identifying that precise record from plausible but subtly incorrect alternatives.\nDifficulty rating: 7/10\n</document_analysis>\n<output_format>\nQuestion: What unprecedented milestone did the Astros achieve by winning the 2017 American League pennant?\nA: Winning pennants in both leagues within a ten-year span  \nB: Being the first team to win an AL pennant after having been swept in its only NL pennant appearance  \nC: Becoming the first MLB franchise to secure league pennants in both the National League and the American League  \nD: Delivering the first World Series title in Texas baseball history  \nExplanation: Their 2017 pennant marked the first time any MLB franchise had won league pennants in both the NL and the AL.  \nCorrect Answer: C\n</output_format>",
    "question": "What unprecedented milestone did the Astros achieve by winning the 2017 American League pennant?",
    "choices": {
      "A": "Winning pennants in both leagues within a ten-year span",
      "B": "Being the first team to win an AL pennant after having been swept in its only NL pennant appearance",
      "C": "Becoming the first MLB franchise to secure league pennants in both the National League and the American League",
      "D": "Delivering the first World Series title in Texas baseball history"
    },
    "answer": "C",
    "explanation": "Their 2017 pennant marked the first time any MLB franchise had won league pennants in both the NL and the AL.",
    "question_token_count": 20,
    "answer_correctness_score": 10,
    "explanation_validity_score": 10,
    "question_clarity_score": 8,
    "question_difficulty_score": 6,
    "question_groundedness_score": 10,
    "avg_answer_token_count": 16
  },
  {
    "context": "<P> The flag of the United States of America , often referred to as the American flag , is the national flag of the United States . It consists of thirteen equal horizontal stripes of red ( top and bottom ) alternating with white , with a blue rectangle in the canton ( referred to specifically as the `` union '' ) bearing fifty small , white , five - pointed stars arranged in nine offset horizontal rows , where rows of six stars ( top and bottom ) alternate with rows of five stars . The 50 stars on the flag represent the 50 states of the United States of America , and the 13 stripes represent the thirteen British colonies that declared independence from the Kingdom of Great Britain , and became the first states in the U.S. Nicknames for the flag include The Stars and Stripes , Old Glory , and The Star - Spangled Banner . </P>",
    "topic": "Analysis of public protocols and etiquette associated with displaying and preserving the national flag.",
    "response": "<document_analysis>\nThe context describes the precise arrangement of the U.S. flag\u2019s fifty stars in nine horizontal rows alternating between six and five stars, with five rows of six and four rows of five. This structure yields exactly fifty stars. A non\u2010trivial implication is that this alternation pattern cannot accommodate any other total number of stars without redesigning the grid. Generating a question on why this pattern fails for fifty\u2010one stars requires both understanding of the described pattern and simple Diophantine reasoning, fitting the goal of challenging domain experts.\nDifficulty: 7/10\n</document_analysis>\n\n<output_format>\nQuestion: Why can\u2019t the current nine\u2010row star pattern of alternating six\u2010star and five\u2010star rows be used to display fifty\u2010one stars without altering the number of star rows?\nA: Because 51 cannot be written as the sum of five six\u2010star rows and four five\u2010star rows.\nB: Because the union field\u2019s aspect ratio only supports fifty elements.\nC: Because the thirteen stripes fix the star count at fifty.\nD: Because congressional resolutions prohibit an odd number of stars per row.\nExplanation: The existing pattern uses exactly five rows of six and four rows of five stars, totaling fifty, and cannot sum to fifty\u2010one without changing the row count.\nCorrect Answer: A\n</output_format>",
    "question": "Why can\u2019t the current nine\u2010row star pattern of alternating six\u2010star and five\u2010star rows be used to display fifty\u2010one stars without altering the number of star rows?",
    "choices": {
      "A": "Because 51 cannot be written as the sum of five six\u2010star rows and four five\u2010star rows.",
      "B": "Because the union field\u2019s aspect ratio only supports fifty elements.",
      "C": "Because the thirteen stripes fix the star count at fifty.",
      "D": "Because congressional resolutions prohibit an odd number of stars per row."
    },
    "answer": "A",
    "explanation": "The existing pattern uses exactly five rows of six and four rows of five stars, totaling fifty, and cannot sum to fifty\u2010one without changing the row count.",
    "question_token_count": 37,
    "answer_correctness_score": 10,
    "explanation_validity_score": 10,
    "question_clarity_score": 8,
    "question_difficulty_score": 6,
    "question_groundedness_score": 10,
    "avg_answer_token_count": 15
  },
  {
    "context": "<P> `` Death and All His Friends '' is the season finale of the sixth season of the American television medical drama Grey 's Anatomy , and the show 's 126th episode overall . It was written by Shonda Rhimes and directed by Rob Corn . The episode was originally broadcast on the American Broadcasting Company ( ABC ) in the United States on May 20 , 2010 . The episode was the second part of the two - hour season six finale , the first being Sanctuary , and took place at the fictional Seattle Grace Hospital . The original episode broadcast in the United States had an audience of 16.13 million viewers and opened up to universal acclaim . The episode centers a shooting spree at the hospital by a former patient 's husband Gary Clark ( Michael O'Neill ) . The episode marked the last appearances for Nora Zehetner and Robert Baker as Dr. Reed Adamson and Dr. Charles Percy respectively as both the characters were killed in the shooting . </P>",
    "topic": "Contextual comparison between \u201cSanctuary\u201d and \u201cDeath and All His Friends,\u201d exploring thematic continuities and escalation of conflict across the two-part finale.",
    "response": "<document_analysis>\nThe provided context is a concise summary of \"Death and All His Friends,\" detailing its position as the second part of the two-hour Season 6 finale, its creative leads, viewership, and most critically the escalation to a lethal shooting spree that culminates in the deaths of two characters. Although details on \"Sanctuary\" are minimal, the key thematic continuity is the progression from looming threat to actualized violence. This allows a question probing how narrative stakes intensify from part one (\u201cSanctuary\u201d) to part two (\u201cDeath and All His Friends\u201d) by examining the shift from threat to fatal reality.\nDifficulty rating: 5/10 \u2013 Requires synthesis of structure and thematic escalation across both episodes.\n</document_analysis>\n\n<output_format>\nQuestion: In the two-part Grey\u2019s Anatomy Season 6 finale, how does \u201cDeath and All His Friends\u201d escalate the conflict initiated in \u201cSanctuary\u201d?\nA: By introducing the antagonist only after the first episode\u2019s climax, amplifying shock value.\nB: By converting the unresolved threat into an actualized shooting spree that results in key character deaths.\nC: By relocating the crisis from the hospital to an external setting, expanding the scope of danger.\nD: By dissolving interpersonal drama among the staff to concentrate exclusively on medical emergencies.\nExplanation: The second part transforms the hanging threat of violence into a concrete shooting spree, heightening stakes through the deaths of Dr. Reed Adamson and Dr. Charles Percy.\nCorrect Answer: B\n</output_format>",
    "question": "In the two-part Grey\u2019s Anatomy Season 6 finale, how does \u201cDeath and All His Friends\u201d escalate the conflict initiated in \u201cSanctuary\u201d?",
    "choices": {
      "A": "By introducing the antagonist only after the first episode\u2019s climax, amplifying shock value.",
      "B": "By converting the unresolved threat into an actualized shooting spree that results in key character deaths.",
      "C": "By relocating the crisis from the hospital to an external setting, expanding the scope of danger.",
      "D": "By dissolving interpersonal drama among the staff to concentrate exclusively on medical emergencies."
    },
    "answer": "B",
    "explanation": "The second part transforms the hanging threat of violence into a concrete shooting spree, heightening stakes through the deaths of Dr. Reed Adamson and Dr. Charles Percy.",
    "question_token_count": 33,
    "answer_correctness_score": 10,
    "explanation_validity_score": 10,
    "question_clarity_score": 6,
    "question_difficulty_score": 7,
    "question_groundedness_score": 3,
    "avg_answer_token_count": 18
  },
  {
    "context": "<P> The United States presidential line of succession is the order in which persons may become or act as President of the United States if the incumbent President becomes incapacitated , dies , resigns , or is removed from office ( by impeachment by the House of Representatives and subsequent conviction by the Senate ) . The line of succession is set by the United States Constitution and the Presidential Succession Act of 1947 as subsequently amended to include newly created cabinet offices . The succession follows the order of Vice President , Speaker of the House of Representatives , President pro tempore of the Senate , and then the heads of federal executive departments who form the Cabinet of the United States . The Cabinet currently has fifteen members , beginning with the Secretary of State , and followed by the rest in the order of their positions ' creation . Those heads of department who are ineligible to act as President are also ineligible to succeed the President by succession , for example most commonly if they are not a natural - born U.S. citizen . </P>",
    "topic": "Rationale and implications of ordering Cabinet secretaries by the dates of their department\u2019s creation",
    "response": "<document_analysis>\nThe context explains that Cabinet secretaries are ordered in the presidential line of succession according to the chronological creation of their departments, as codified in the 1947 Succession Act and its amendments. The key themes are statutory basis, historical precedence, and reinforcement of institutional seniority. A challenging question should probe understanding of the underlying rationale\u2014namely, why creation-date ordering was chosen\u2014and differentiate between legal mechanism and policy principle.\nDifficulty rating: 8/10.\n</document_analysis>\n\n<output_format>\nQuestion: Which underlying principle justifies ordering Cabinet secretaries by the dates their departments were established?\nA: The order reflects statutory codification in the 1947 Succession Act to mirror each department\u2019s historical precedence.\nB: A constitutional requirement mandates that the presidential line of succession follow the chronological creation of federal offices.\nC: It ensures departments with the longest institutional tenure assume priority in presidential succession, reinforcing governmental stability.\nD: Congressional budgetary seniority rules determine departmental rank based on the dates of fiscal appropriations.\nExplanation: Ordering by department creation date prioritizes those with longer institutional history to uphold continuity and stability.\nCorrect Answer: C\n</output_format>",
    "question": "Which underlying principle justifies ordering Cabinet secretaries by the dates their departments were established?",
    "choices": {
      "A": "The order reflects statutory codification in the 1947 Succession Act to mirror each department\u2019s historical precedence.",
      "B": "A constitutional requirement mandates that the presidential line of succession follow the chronological creation of federal offices.",
      "C": "It ensures departments with the longest institutional tenure assume priority in presidential succession, reinforcing governmental stability.",
      "D": "Congressional budgetary seniority rules determine departmental rank based on the dates of fiscal appropriations."
    },
    "answer": "C",
    "explanation": "Ordering by department creation date prioritizes those with longer institutional history to uphold continuity and stability.",
    "question_token_count": 18,
    "answer_correctness_score": 10,
    "explanation_validity_score": 10,
    "question_clarity_score": 8,
    "question_difficulty_score": 6,
    "question_groundedness_score": 10,
    "avg_answer_token_count": 20
  },
  {
    "context": "<P> The United States presidential line of succession is the order in which persons may become or act as President of the United States if the incumbent president becomes incapacitated , dies , resigns , or is removed from office ( by impeachment by the House of Representatives and subsequent conviction by the Senate ) . The line of succession is set by the United States Constitution and the Presidential Succession Act of 1947 as subsequently amended to include newly created cabinet offices . The succession follows the order of vice president , Speaker of the House of Representatives , President pro tempore of the Senate , and then the heads of federal executive departments who form the Cabinet of the United States . The Cabinet currently has fifteen members , beginning with the Secretary of State , and followed by the rest in the order of their positions ' creation . Those heads of department who are ineligible to act as president are also ineligible to succeed the president by succession , for example most commonly if they are not a natural - born U.S. citizen . </P>",
    "topic": "Eligibility requirements for individuals to act as President within the line of succession.",
    "response": "<document_analysis>\nThe context describes the U.S. presidential line of succession as established by the Constitution and the Presidential Succession Act of 1947, noting that any cabinet officer who fails to meet the Constitution\u2019s eligibility requirements\u2014most commonly the natural\u2011born citizen requirement\u2014is statutorily excluded from the line. Key details: succession order, basis in both Constitution and statute, explicit statutory exclusion of ineligible department heads. This supports a question probing the legal mechanism excluding non\u2011natural\u2011born cabinet officers. Difficulty is rated 8/10 for requiring nuanced understanding of constitutional versus statutory authority.\n</document_analysis>\n\n<output_format>\nQuestion: Within the federally codified order of presidential succession, through which legal mechanism is a cabinet secretary who is not a natural-born U.S. citizen precluded from assuming the presidency?\nA: The Presidential Succession Act of 1947 contains an explicit provision excluding any successor who fails to meet the Constitution\u2019s eligibility criteria.\nB: Article II\u2019s natural\u2011born citizen clause in the Constitution independently bars a non\u2011natural\u2011born cabinet officer from entering the statutory line of succession.\nC: The 12th Amendment specifically disqualifies non\u2011natural\u2011born citizens from presidential succession.\nD: An executive order by President Truman established that only natural\u2011born citizens may serve in the cabinet line of succession.\nExplanation: The Succession Act itself explicitly states that heads of departments who are ineligible under the Constitution cannot succeed to the presidency.\nCorrect Answer: A\n</output_format>",
    "question": "Within the federally codified order of presidential succession, through which legal mechanism is a cabinet secretary who is not a natural-born U.S. citizen precluded from assuming the presidency?",
    "choices": {
      "A": "The Presidential Succession Act of 1947 contains an explicit provision excluding any successor who fails to meet the Constitution\u2019s eligibility criteria.",
      "B": "Article II\u2019s natural\u2011born citizen clause in the Constitution independently bars a non\u2011natural\u2011born cabinet officer from entering the statutory line of succession.",
      "C": "The 12th Amendment specifically disqualifies non\u2011natural\u2011born citizens from presidential succession.",
      "D": "An executive order by President Truman established that only natural\u2011born citizens may serve in the cabinet line of succession."
    },
    "answer": "A",
    "explanation": "The Succession Act itself explicitly states that heads of departments who are ineligible under the Constitution cannot succeed to the presidency.",
    "question_token_count": 37,
    "answer_correctness_score": 10,
    "explanation_validity_score": 10,
    "question_clarity_score": 8,
    "question_difficulty_score": 8,
    "question_groundedness_score": 6,
    "avg_answer_token_count": 25
  },
  {
    "context": "<P> `` Death and All His Friends '' is the season finale of the sixth season of the American television medical drama Grey 's Anatomy , and the show 's 126th episode overall . It was written by Shonda Rhimes and directed by Rob Corn . The episode was originally broadcast on the American Broadcasting Company ( ABC ) in the United States on May 20 , 2010 . The episode was the second part of the two - hour season six finale , the first being Sanctuary , and took place at the fictional Seattle Grace Hospital . The original episode broadcast in the United States had an audience of 16.13 million viewers and opened up to universal acclaim . The episode centers a shooting spree at the hospital by a former patient 's husband Gary Clark ( Michael O'Neill ) . The episode marked the last appearances for Nora Zehetner and Robert Baker as Dr. Reed Adamson and Dr. Charles Percy respectively as both the characters were killed in the shooting . </P>",
    "topic": "Exploration of Seattle Grace Hospital as a narrative setting\u2014its symbolic and practical functions during the crisis sequence.",
    "response": "<document_analysis>\nThe context describes the Grey\u2019s Anatomy season six finale set in the fictional Seattle Grace Hospital, focusing on how the hospital\u2014traditionally a site of healing\u2014is violently subverted by a gunman. Central themes include the shift from safety to threat, the irony of a \u201csanctuary\u201d becoming a deathtrap, and the narrative impact of staging key character deaths within this environment. For a domain\u2010expert question, we examine how the hospital\u2019s symbolic role is inverted to underscore institutional vulnerability.\nDifficulty: 8/10\u2014requires nuanced narrative analysis rather than recall of plot specifics.\n</document_analysis>\n\n<output_format>\nQuestion: In the season six finale\u2019s climactic shooting spree, how does the repurposing of Seattle Grace Hospital most powerfully underscore the series\u2019 exploration of institutional fragility?\nA: By recasting a trusted medical sanctuary into a zone of imminent danger, it reveals that no place of healing is immune to violence.\nB: By highlighting the hospital\u2019s strict chain of command, it delivers a pointed critique of bureaucratic inertia during emergencies.\nC: By contrasting the sterile clinical spaces with external chaos, it emphasizes the dissonance between inside and outside threats.\nD: By using the hospital primarily as a backdrop for private character soliloquies, it shifts focus from action to introspection.\nExplanation: The finale\u2019s plot twists the hospital\u2019s healing role into one of vulnerability, subverting the expectation of safety in a healthcare setting.\nCorrect Answer: A\n</output_format>",
    "question": "In the season six finale\u2019s climactic shooting spree, how does the repurposing of Seattle Grace Hospital most powerfully underscore the series\u2019 exploration of institutional fragility?",
    "choices": {
      "A": "By recasting a trusted medical sanctuary into a zone of imminent danger, it reveals that no place of healing is immune to violence.",
      "B": "By highlighting the hospital\u2019s strict chain of command, it delivers a pointed critique of bureaucratic inertia during emergencies.",
      "C": "By contrasting the sterile clinical spaces with external chaos, it emphasizes the dissonance between inside and outside threats.",
      "D": "By using the hospital primarily as a backdrop for private character soliloquies, it shifts focus from action to introspection."
    },
    "answer": "A",
    "explanation": "The finale\u2019s plot twists the hospital\u2019s healing role into one of vulnerability, subverting the expectation of safety in a healthcare setting.",
    "question_token_count": 36,
    "answer_correctness_score": 10,
    "explanation_validity_score": 9,
    "question_clarity_score": 2,
    "question_difficulty_score": 8,
    "question_groundedness_score": 3,
    "avg_answer_token_count": 25
  },
  {
    "context": "<P> `` I Can Only Imagine '' ( sometimes shortened to `` Imagine '' ) is a single recorded by Christian rock band MercyMe . Written and composed by lead vocalist Bart Millard , the song , based around a main piano track , was inspired by the death of Millard 's father and considers what it would be like in Heaven and to be standing before God . The song was first issued as a track on MercyMe 's 1999 album The Worship Project , which was released on an independent record label . The song was re-recorded and included on their 2001 major - label debut album Almost There as the fifth song on the album . </P>",
    "topic": "The central piano-driven compositional structure and its role in establishing the song\u2019s mood and message.",
    "response": "<document_analysis>\nThe context describes \u201cI Can Only Imagine\u201d as a contemplative Christian ballad fundamentally structured around a primary piano track, inspired by solemn personal reflection on death and visions of Heaven. The central idea is that the choice of piano as the foundational instrument shapes the song\u2019s intimate atmosphere and supports the emotional and lyrical narrative. Subtle implications include how piano\u2019s wide register, dynamic expressivity, and harmonic capacity align with themes of introspection, hope, and transcendence. A high-level question could examine why a piano-driven arrangement is compositional ideal for conveying such spiritual reflection, requiring understanding of instrument timbre, range, and functional roles in worship contexts. This question is calibrated at difficulty level 7, invoking domain knowledge of compositional rationale, instrumental timbre, and affective impact.\n</document_analysis>\n\n<output_format>\nQuestion: In a spiritually reflective ballad, centering the accompaniment around a primary piano track rather than a guitar or synthesizer is chiefly justified by which compositional advantage?\nA: The piano\u2019s extensive dynamic range and broad register facilitate simultaneous melodic and harmonic support, enhancing emotive resonance.\nB: The inherently digital nature of the piano ensures precise tuning and electronic manipulation for a modern aesthetic.\nC: The percussive attack of piano keys inherently obscures vocal nuance, shifting focus to the rhythm.\nD: The piano\u2019s limited sustain reduces tonal clutter, preventing listener fatigue through sparse sonic textures.\nExplanation: An acoustic piano spans bass, midrange, and treble with versatile dynamics, enabling it to carry both harmony and melody in an intimate, emotionally expressive way that suits reflective worship lyrics.\nCorrect Answer: A\n</output_format>",
    "question": "In a spiritually reflective ballad, centering the accompaniment around a primary piano track rather than a guitar or synthesizer is chiefly justified by which compositional advantage?",
    "choices": {
      "A": "The piano\u2019s extensive dynamic range and broad register facilitate simultaneous melodic and harmonic support, enhancing emotive resonance.",
      "B": "The inherently digital nature of the piano ensures precise tuning and electronic manipulation for a modern aesthetic.",
      "C": "The percussive attack of piano keys inherently obscures vocal nuance, shifting focus to the rhythm.",
      "D": "The piano\u2019s limited sustain reduces tonal clutter, preventing listener fatigue through sparse sonic textures."
    },
    "answer": "A",
    "explanation": "An acoustic piano spans bass, midrange, and treble with versatile dynamics, enabling it to carry both harmony and melody in an intimate, emotionally expressive way that suits reflective worship lyrics.",
    "question_token_count": 36,
    "answer_correctness_score": 10,
    "explanation_validity_score": 10,
    "question_clarity_score": 2,
    "question_difficulty_score": 6,
    "question_groundedness_score": 2,
    "avg_answer_token_count": 20
  },
  {
    "context": "<P> Human fertilization is the union of a human egg and sperm , usually occurring in the ampulla of the fallopian tube . The result of this union is the production of a zygote cell , or fertilized egg , initiating prenatal development . Scientists discovered the dynamics of human fertilization in the nineteenth century . </P>",
    "topic": "Impact of genetic, environmental, and immunological factors on successful fertilization and zygote viability.",
    "response": "<document_analysis>\nThe provided context offers concise, coherent information about the anatomical site of gamete fusion in human fertilization and the historical timeframe when its dynamics were elucidated. While brief, it is meaningful and educationally valuable. I will generate a question probing a detailed anatomical understanding of the site of fertilization.\n</document_analysis>\n\n<output_format>\nQuestion: In human reproduction, what is the anatomical region where the egg and sperm most commonly unite to form a zygote?\nA: Isthmus of the fallopian tube\nB: Ampulla of the fallopian tube\nC: Infundibulum of the fallopian tube\nD: Uterine cavity\nExplanation: The ampulla of the fallopian tube is the typical site of sperm\u2013egg fusion, leading to zygote formation.\nCorrect Answer: B\n</output_format>",
    "question": "In human reproduction, what is the anatomical region where the egg and sperm most commonly unite to form a zygote?",
    "choices": {
      "A": "Isthmus of the fallopian tube",
      "B": "Ampulla of the fallopian tube",
      "C": "Infundibulum of the fallopian tube",
      "D": "Uterine cavity"
    },
    "answer": "B",
    "explanation": "The ampulla of the fallopian tube is the typical site of sperm\u2013egg fusion, leading to zygote formation.",
    "question_token_count": 25,
    "answer_correctness_score": 10,
    "explanation_validity_score": 10,
    "question_clarity_score": 4,
    "question_difficulty_score": 3,
    "question_groundedness_score": 10,
    "avg_answer_token_count": 8
  },
  {
    "context": "<P> The Battles of Lexington and Concord were the first military engagements of the American Revolutionary War . The battles were fought on April 19 , 1775 in Middlesex County , Province of Massachusetts Bay , within the towns of Lexington , Concord , Lincoln , Menotomy ( present - day Arlington ) , and Cambridge . They marked the outbreak of armed conflict between the Kingdom of Great Britain and its thirteen colonies in America . </P>",
    "topic": "Investigate the sequence of events in the towns of Lexington, Concord, Lincoln, Menotomy, and Cambridge, and their cumulative impact on colonial-British relations.",
    "response": "<document_analysis>\nThoughtful Content Examination:\n- The context briefly states that the Battles of Lexington and Concord (April 19, 1775) were the first military engagements of the American Revolutionary War, fought across five towns: Lexington, Concord, Lincoln, Menotomy (Arlington), and Cambridge, marking the outbreak of armed conflict.\n\nConcept Exploration:\n- Implicit significance: these skirmishes transformed political tension into open warfare, annihilating any remaining hope of a peaceful resolution.\n- Underlying shift: a strategic escalation in colonial resistance and the definitive rupture in colonial-British relations.\n\nDifficulty Calibration:\n- Rated 8/10: Requires inference beyond mere facts, demanding understanding of the broader diplomatic and political implications of these engagements.\n\nIntentional Question Planning:\n- Aim to probe the expert\u2019s grasp of how dispersed confrontations crystallized the end of reconciliation and the inception of armed resistance.\n- Encourage reflection on the cumulative diplomatic impact rather than merely recalling dates or locations. \n</document_analysis>\n\n<output_format>\nQuestion: The fighting that took place across Lexington, Concord, Lincoln, Menotomy, and Cambridge on April 19, 1775 cumulatively altered colonial-British relations principally by:\nA: Demonstrating British authority sufficient to prevent further rebellion.\nB: Shattering any remaining possibility of peaceful reconciliation.\nC: Prompting an immediate military alliance between the colonies and France.\nD: Deterring colonial militias from further acts of defiance after initial clashes.\nExplanation: These engagements are recognized as the outbreak of armed conflict, effectively ending hopes for a peaceful settlement with Britain.\nCorrect Answer: B\n</output_format>",
    "question": "The fighting that took place across Lexington, Concord, Lincoln, Menotomy, and Cambridge on April 19, 1775 cumulatively altered colonial-British relations principally by:",
    "choices": {
      "A": "Demonstrating British authority sufficient to prevent further rebellion.",
      "B": "Shattering any remaining possibility of peaceful reconciliation.",
      "C": "Prompting an immediate military alliance between the colonies and France.",
      "D": "Deterring colonial militias from further acts of defiance after initial clashes."
    },
    "answer": "B",
    "explanation": "These engagements are recognized as the outbreak of armed conflict, effectively ending hopes for a peaceful settlement with Britain.",
    "question_token_count": 37,
    "answer_correctness_score": 10,
    "explanation_validity_score": 10,
    "question_clarity_score": 8,
    "question_difficulty_score": 7,
    "question_groundedness_score": 9,
    "avg_answer_token_count": 13
  },
  {
    "context": "<P> The flag of the United States of America , often referred to as the American flag , is the national flag of the United States . It consists of thirteen equal horizontal stripes of red ( top and bottom ) alternating with white , with a blue rectangle in the canton ( referred to specifically as the `` union '' ) bearing fifty small , white , five - pointed stars arranged in nine offset horizontal rows , where rows of six stars ( top and bottom ) alternate with rows of five stars . The 50 stars on the flag represent the 50 states of the United States of America , and the 13 stripes represent the thirteen British colonies that declared independence from the Kingdom of Great Britain , and became the first states in the U.S. Nicknames for the flag include The Stars and Stripes , Old Glory , and The Star - Spangled Banner . </P>",
    "topic": "Comparative analysis of the flag\u2019s nicknames\u2014\u201cThe Stars and Stripes,\u201d \u201cOld Glory,\u201d and \u201cThe Star-Spangled Banner\u201d\u2014and their roles in American cultural identity.",
    "response": "<document_analysis>\nThe context outlines three distinct nicknames for the U.S. flag\u2014\u201cThe Stars and Stripes,\u201d \u201cOld Glory,\u201d and \u201cThe Star-Spangled Banner\u201d\u2014each carrying unique connotations: a focus on visual design, affectionate personification, and martial/anthemic heritage. A question that probes the nuanced emotional and cultural framing implied by each epithet will challenge experts to distinguish these subtle roles in American identity. The difficulty is calibrated at 8/10, requiring synthesis of symbolism and cultural interpretation beyond mere recall.\n</document_analysis>\n\n<output_format>\nQuestion: Which nickname of the U.S. flag most explicitly personifies it as a venerable heirloom, evoking sentimental heritage and continuity rather than highlighting its visual design or anthem origins?\nA: The Stars and Stripes\nB: Old Glory\nC: The Star-Spangled Banner\nD: The Grand Union Flag\nExplanation: \u201cOld Glory\u201d serves as an affectionate, personified epithet that emphasizes the flag\u2019s role as a treasured symbol of historical continuity and heritage, whereas \u201cStars and Stripes\u201d denotes its appearance and \u201cStar-Spangled Banner\u201d ties it to the national anthem.\nCorrect Answer: B\n</output_format>",
    "question": "Which nickname of the U.S. flag most explicitly personifies it as a venerable heirloom, evoking sentimental heritage and continuity rather than highlighting its visual design or anthem origins?",
    "choices": {
      "A": "The Stars and Stripes",
      "B": "Old Glory",
      "C": "The Star-Spangled Banner",
      "D": "The Grand Union Flag"
    },
    "answer": "B",
    "explanation": "\u201cOld Glory\u201d serves as an affectionate, personified epithet that emphasizes the flag\u2019s role as a treasured symbol of historical continuity and heritage, whereas \u201cStars and Stripes\u201d denotes its appearance and \u201cStar-Spangled Banner\u201d ties it to the national anthem.",
    "question_token_count": 38,
    "answer_correctness_score": 10,
    "explanation_validity_score": 10,
    "question_clarity_score": 7,
    "question_difficulty_score": 8,
    "question_groundedness_score": 10,
    "avg_answer_token_count": 5
  },
  {
    "context": "<Table> <Tr> <Th> Year </Th> <Th> Round </Th> <Th> Position </Th> <Th> GP </Th> <Th> </Th> <Th> D * </Th> <Th> </Th> <Th> GF </Th> <Th> GA </Th> <Th> GD </Th> </Tr> <Tr> <Td> 1930 </Td> <Td colspan=\"9\"> Not a FIFA member </Td> </Tr> <Tr> <Td> 1934 </Td> </Tr> <Tr> <Td> 1938 </Td> </Tr> <Tr> <Td> 1950 </Td> <Td> Group stage </Td> <Td> 8th </Td> <Td> </Td> <Td> </Td> <Td> 0 </Td> <Td> </Td> <Td> </Td> <Td> </Td> <Td> 0 </Td> </Tr> <Tr> <Td> 1954 </Td> <Td> Quarter - finals </Td> <Td> 7th </Td> <Td> </Td> <Td> </Td> <Td> </Td> <Td> </Td> <Td> 8 </Td> <Td> 8 </Td> <Td> 0 </Td> </Tr> <Tr> <Td> 1958 </Td> <Td> Group stage </Td> <Td> 11th </Td> <Td> </Td> <Td> 0 </Td> <Td> </Td> <Td> </Td> <Td> </Td> <Td> 5 </Td> <Td> - 1 </Td> </Tr> <Tr> <Td> 1962 </Td> <Td> Quarter - finals </Td> <Td> 8th </Td> <Td> </Td> <Td> </Td> <Td> </Td> <Td> </Td> <Td> 5 </Td> <Td> 6 </Td> <Td> - 1 </Td> </Tr> <Tr> <Td> 1966 </Td> <Td> Champions </Td> <Td> 1st </Td> <Td> 6 </Td> <Td> 5 </Td> <Td> </Td> <Td> 0 </Td> <Td> 11 </Td> <Td> </Td> <Td> 8 </Td> </Tr> <Tr> <Td> 1970 </Td> <Td> Quarter - finals </Td> <Td> 8th </Td> <Td> </Td> <Td> </Td> <Td> 0 </Td> <Td> </Td> <Td> </Td> <Td> </Td> <Td> 0 </Td> </Tr> <Tr> <Td> </Td> <Td colspan=\"9\"> Did not qualify </Td> </Tr> <Tr> <Td> 1978 </Td> </Tr> <Tr> <Td> 1982 </Td> <Td> Second group stage </Td> <Td> 6th </Td> <Td> 5 </Td> <Td> </Td> <Td> </Td> <Td> 0 </Td> <Td> 6 </Td> <Td> </Td> <Td> 5 </Td> </Tr> <Tr> <Td> 1986 </Td> <Td> Quarter - finals </Td> <Td> 8th </Td> <Td> 5 </Td> <Td> </Td> <Td> </Td> <Td> </Td> <Td> 7 </Td> <Td> </Td> <Td> </Td> </Tr> <Tr> <Td> 1990 </Td> <Td> Semi finals </Td> <Td> 4th </Td> <Td> 7 </Td> <Td> </Td> <Td> </Td> <Td> </Td> <Td> 8 </Td> <Td> 6 </Td> <Td> </Td> </Tr> <Tr> <Td> 1994 </Td> <Td colspan=\"9\"> Did not qualify </Td> </Tr> <Tr> <Td> 1998 </Td> <Td> Round of 16 </Td> <Td> 9th </Td> <Td> </Td> <Td> </Td> <Td> </Td> <Td> </Td> <Td> 7 </Td> <Td> </Td> <Td> </Td> </Tr> <Tr> <Td> 2002 </Td> <Td> Quarter - finals </Td> <Td> 6th </Td> <Td> 5 </Td> <Td> </Td> <Td> </Td> <Td> </Td> <Td> 6 </Td> <Td> </Td> <Td> </Td> </Tr> <Tr> <Td> 2006 </Td> <Td> Quarter - finals </Td> <Td> 7th </Td> <Td> 5 </Td> <Td> </Td> <Td> </Td> <Td> 0 </Td> <Td> 6 </Td> <Td> </Td> <Td> </Td> </Tr> <Tr> <Td> </Td> <Td> Round of 16 </Td> <Td> 13th </Td> <Td> </Td> <Td> </Td> <Td> </Td> <Td> </Td> <Td> </Td> <Td> 5 </Td> <Td> - 2 </Td> </Tr> <Tr> <Td> 2014 </Td> <Td> Group stage </Td> <Td> 26th </Td> <Td> </Td> <Td> 0 </Td> <Td> </Td> <Td> </Td> <Td> </Td> <Td> </Td> <Td> - 2 </Td> </Tr> <Tr> <Td> 2018 </Td> <Td> Semi-finals </Td> <Td> 4th </Td> <Td> 7 </Td> <Td> </Td> <Td> </Td> <Td> </Td> <Td> 12 </Td> <Td> 8 </Td> <Td> </Td> </Tr> <Tr> <Td> 2022 </Td> <Td colspan=\"9\"> TBD </Td> </Tr> <Tr> <Td> 2026 </Td> </Tr> <Tr> <Th> Total </Th> <Th> 15 / 21 </Th> <Th> 1 title </Th> <Th> 69 </Th> <Th> 29 </Th> <Th> 21 </Th> <Th> 19 </Th> <Th> 91 </Th> <Th> 64 </Th> <Th> 27 </Th> </Tr> </Table>",
    "topic": "Interpret the statistical outlier of the team\u2019s 26th position in 2014 despite strong historical performance, investigating tactical, personnel, or contextual causes.",
    "response": "<document_analysis>\nThe table chronicles Brazil\u2019s World Cup finishes, highlighting generally strong performances with goal differentials never worse than \u20131 until 2014\u2019s abrupt 26th\u2010place, \u20132 GD group stage exit on home soil. This anomaly suggests a confluence of tactical missteps\u2014particularly in midfield cohesion\u2014and contextual pressure as host. Key patterns: prior outliers (1958, 1962) yielded only \u20131 GD with early exits; 2014 doubled that margin. An expert question should probe which specific tactical/contextual factor most plausibly precipitated this nadir, requiring familiarity with Brazil\u2019s 2014 formation choices, player experience, and psychological context. Difficulty rated 8/10.\n</document_analysis>\n\n<output_format>\nQuestion: Considering Brazil\u2019s historical record of at worst \u20131 goal differential, which factor most directly explains their drastic 26th\u2010place finish and \u20132 GD in the 2014 World Cup?\nA: Introducing an inexperienced central midfield pairing that failed to trigger effective pressing and shield the backline, compounded by the psychological weight of hosting.\nB: Employing a narrow diamond midfield that overexposed the flanks, leading to persistent wide overloads against their fullbacks.\nC: Mandating a high defensive line without adequate recovery speed, which opponents repeatedly exploited on the break.\nD: Relying on zero squad rotation, resulting in accumulated fatigue and critical late\u2010game lapses.\nExplanation: The inexperienced midfield duo in 2014 lacked cohesion and defensive cover under massive host\u2010nation expectations, directly undermining both pressing and transition defense; the other options do not align as closely with Brazil\u2019s actual tactical/contextual situation.\nCorrect Answer: A\n</output_format>",
    "question": "Considering Brazil\u2019s historical record of at worst \u20131 goal differential, which factor most directly explains their drastic 26th\u2010place finish and \u20132 GD in the 2014 World Cup?",
    "choices": {
      "A": "Introducing an inexperienced central midfield pairing that failed to trigger effective pressing and shield the backline, compounded by the psychological weight of hosting.",
      "B": "Employing a narrow diamond midfield that overexposed the flanks, leading to persistent wide overloads against their fullbacks.",
      "C": "Mandating a high defensive line without adequate recovery speed, which opponents repeatedly exploited on the break.",
      "D": "Relying on zero squad rotation, resulting in accumulated fatigue and critical late\u2010game lapses."
    },
    "answer": "A",
    "explanation": "The inexperienced midfield duo in 2014 lacked cohesion and defensive cover under massive host\u2010nation expectations, directly undermining both pressing and transition defense; the other options do not align as closely with Brazil\u2019s actual tactical/contextual situation.",
    "question_token_count": 39,
    "answer_correctness_score": 9,
    "explanation_validity_score": 8,
    "question_clarity_score": 8,
    "question_difficulty_score": 7,
    "question_groundedness_score": 9,
    "avg_answer_token_count": 24
  },
  {
    "context": "<P> The 2018 UEFA Champions League Final was the final match of the 2017 -- 18 UEFA Champions League , the 63rd season of Europe 's premier club football tournament organised by UEFA , and the 26th season since it was renamed from the European Cup to the UEFA Champions League . It was played at the NSC Olimpiyskiy Stadium in Kiev , Ukraine on 26 May 2018 , between Spanish side and defending champions Real Madrid , who had won the competition in each of the last two seasons , and English side Liverpool . </P>",
    "topic": "Implications of consecutive final appearances by high\u2011profile clubs for competitive balance and tournament prestige",
    "response": "<document_analysis>\nThe context describes Real Madrid reaching and winning consecutive Champions League finals up to 2018. Central themes include dominance by a high-profile club, implications for tournament prestige, and competitive balance. The text offers enough substance to probe how sustained final appearances affect perceptions of unpredictability and tournament equity. \nDifficulty level: 8/10 \u2013 requires synthesis of competitive-balance theory and brand prestige implications beyond basic facts.\n</document_analysis>\n\n<output_format>\nQuestion: Which of the following best captures the most direct negative impact on both competitive integrity and tournament stature arising from a single club\u2019s succession of Champions League final appearances, as exemplified by Real Madrid\u2019s three\u2011year streak culminating in 2018?\nA: Perceived erosion of competitive balance, undermining the tournament\u2019s unpredictability.\nB: Heightened commercial sponsorship concentration, risking marginalization of smaller market clubs.\nC: Increased regulatory pressure to impose salary caps within UEFA competitions.\nD: Diminished domestic league interest due to audience fatigue with European fixtures.\nExplanation: Sustained final runs by one club most directly risk perceptions that outcomes are foregone, harming the sense of fair competition and unpredictability central to the tournament\u2019s appeal.\nCorrect Answer: A\n</output_format>",
    "question": "Which of the following best captures the most direct negative impact on both competitive integrity and tournament stature arising from a single club\u2019s succession of Champions League final appearances, as exemplified by Real Madrid\u2019s three\u2011year streak culminating in 2018?",
    "choices": {
      "A": "Perceived erosion of competitive balance, undermining the tournament\u2019s unpredictability.",
      "B": "Heightened commercial sponsorship concentration, risking marginalization of smaller market clubs.",
      "C": "Increased regulatory pressure to impose salary caps within UEFA competitions.",
      "D": "Diminished domestic league interest due to audience fatigue with European fixtures."
    },
    "answer": "A",
    "explanation": "Sustained final runs by one club most directly risk perceptions that outcomes are foregone, harming the sense of fair competition and unpredictability central to the tournament\u2019s appeal.",
    "question_token_count": 51,
    "answer_correctness_score": 10,
    "explanation_validity_score": 10,
    "question_clarity_score": 8,
    "question_difficulty_score": 7,
    "question_groundedness_score": 4,
    "avg_answer_token_count": 14
  },
  {
    "context": "<P> Earth 's orbit is the trajectory along which Earth travels around the Sun . The average distance between the Earth and the Sun is 149.60 million km ( 92.96 million mi ) , and one complete orbit takes 365.256 days ( 1 sidereal year ) , during which time Earth has traveled 940 million km ( 584 million mi ) . Earth 's orbit has an eccentricity of 0.0167 . </P>",
    "topic": "Historical evolution of the measurement of Earth\u2019s orbital characteristics and improvements in observational techniques.",
    "response": "<output_format>\nQuestion: If Earth\u2019s orbital eccentricity is 0.0167, approximately what fraction of a sidereal year does Earth spend at a distance from the Sun within \u00b11% of its semi\u2011major axis?\nA: 15%\nB: 41%\nC: 82%\nD: 97%\nExplanation: The radial distance in an ellipse is r = a(1 \u2013 e\u2009cos\u2009E); requiring |r\u2013a| \u2264 0.01a gives |cos\u2009E| \u2264 0.01/e \u2248 0.60. This defines two anomaly intervals each \u224873.5\u00b0 long, totaling \u2248147\u00b0 of 360\u00b0, or \u224841% of the orbital period.\nCorrect Answer: B\n</output_format>",
    "question": "If Earth\u2019s orbital eccentricity is 0.0167, approximately what fraction of a sidereal year does Earth spend at a distance from the Sun within \u00b11% of its semi\u2011major axis?",
    "choices": {
      "A": "15%",
      "B": "41%",
      "C": "82%",
      "D": "97%"
    },
    "answer": "B",
    "explanation": "The radial distance in an ellipse is r = a(1 \u2013 e\u2009cos\u2009E); requiring |r\u2013a| \u2264 0.01a gives |cos\u2009E| \u2264 0.01/e \u2248 0.60. This defines two anomaly intervals each \u224873.5\u00b0 long, totaling \u2248147\u00b0 of 360\u00b0, or \u224841% of the orbital period.",
    "question_token_count": 41,
    "answer_correctness_score": 10,
    "explanation_validity_score": 10,
    "question_clarity_score": 8,
    "question_difficulty_score": 9,
    "question_groundedness_score": 6,
    "avg_answer_token_count": 3
  },
  {
    "context": "<P> `` I Can Only Imagine '' ( sometimes shortened to `` Imagine '' ) is a single recorded by Christian rock band MercyMe . Written and composed by lead vocalist Bart Millard , the song , based around a main piano track , was inspired by the death of Millard 's father and considers what it would be like in Heaven and to be standing before God . The song was first issued as a track on MercyMe 's 1999 album The Worship Project , which was released on an independent record label . The song was re-recorded and included on their 2001 major - label debut album Almost There as the fifth song on the album . </P>",
    "topic": "Marketing and branding strategies behind the song\u2019s title variation (full title versus \u201cImagine\u201d) and their effects on listener perception.",
    "response": "<document_analysis>\nThe context describes MercyMe\u2019s single \u201cI Can Only Imagine,\u201d sometimes shortened to \u201cImagine,\u201d its Christian origins, and its re-release on a major label. Key strategic considerations include title length, explicit religious phrasing, and crossover marketing to secular audiences. A deep question probes how truncating the title alters brand positioning, broadens appeal, and impacts listener perception. Difficulty set at 7/10 to challenge experts on nuanced marketing tactics.\n</document_analysis>\n\n<output_format>\nQuestion: MercyMe\u2019s single \u201cI Can Only Imagine\u201d was occasionally marketed under the truncated title \u201cImagine.\u201d Which primary branding objective is most directly achieved by this title abbreviation?\nA: Removing overtly religious phrasing to enhance accessibility for secular radio listeners  \nB: Invoking greater curiosity by introducing thematic ambiguity around the song\u2019s narrative  \nC: Aligning with one-word pop-hit conventions to increase memorability among mainstream audiences  \nD: Signaling a shift in lyrical focus from the songwriter\u2019s personal perspective to universal imagination  \nExplanation: Truncating the title removes explicit Christian wording (\u201cI Can Only\u201d), making the track more approachable to non-religious listeners and easing its crossover to secular radio.  \nCorrect Answer: A\n</output_format>",
    "question": "MercyMe\u2019s single \u201cI Can Only Imagine\u201d was occasionally marketed under the truncated title \u201cImagine.\u201d Which primary branding objective is most directly achieved by this title abbreviation?",
    "choices": {
      "A": "Removing overtly religious phrasing to enhance accessibility for secular radio listeners",
      "B": "Invoking greater curiosity by introducing thematic ambiguity around the song\u2019s narrative",
      "C": "Aligning with one-word pop-hit conventions to increase memorability among mainstream audiences",
      "D": "Signaling a shift in lyrical focus from the songwriter\u2019s personal perspective to universal imagination"
    },
    "answer": "A",
    "explanation": "Truncating the title removes explicit Christian wording (\u201cI Can Only\u201d), making the track more approachable to non-religious listeners and easing its crossover to secular radio.",
    "question_token_count": 35,
    "answer_correctness_score": 10,
    "explanation_validity_score": 10,
    "question_clarity_score": 4,
    "question_difficulty_score": 8,
    "question_groundedness_score": 2,
    "avg_answer_token_count": 15
  },
  {
    "context": "<P> `` I Can Only Imagine '' ( sometimes shortened to `` Imagine '' ) is a single recorded by Christian rock band MercyMe . Written and composed by lead vocalist Bart Millard , the song , based around a main piano track , was inspired by the death of Millard 's father and considers what it would be like in Heaven and to be standing before God . The song was first issued as a track on MercyMe 's 1999 album The Worship Project , which was released on an independent record label . The song was re-recorded and included on their 2001 major - label debut album Almost There as the fifth song on the album . </P>",
    "topic": "The role of personal testimony in contemporary Christian songwriting, exemplified by MercyMe\u2019s approach.",
    "response": "<document_analysis>\nThe context describes MercyMe\u2019s song \u201cI Can Only Imagine\u201d as a deeply personal testimony inspired by Bart Millard\u2019s experience of his father\u2019s death, originally released on an independent label and later re-recorded for a major-label debut. Key themes include the integration of intimate narrative within worship music, the tension between authenticity and broader commercial reach, and how production contexts can shape reception without necessarily altering core testimony. These elements offer fertile ground for a high-level question on how the band\u2019s decision to re-record the track illustrates broader dynamics between personal witness and professional music production in contemporary Christian songwriting.\n</document_analysis>\n\n<output_format>\nQuestion: In transitioning \u201cI Can Only Imagine\u201d from an independent release to a major-label re-recording, what does MercyMe\u2019s approach most clearly demonstrate about integrating personal testimony into commercially produced Christian music?\nA: That a raw personal narrative can be preserved and amplified through professional production without diluting its authenticity\nB: That major-label backing typically requires significant lyrical changes to ensure mainstream acceptability\nC: That independent releases of personal testimony inherently lack the quality needed for widespread impact\nD: That higher production values alone guarantee deeper spiritual resonance in a worship song\nExplanation: MercyMe maintained the song\u2019s intimate narrative intact while enhancing its sonic presentation, showing that authenticity need not be compromised by commercial production.\nCorrect Answer: A\n</output_format>",
    "question": "In transitioning \u201cI Can Only Imagine\u201d from an independent release to a major-label re-recording, what does MercyMe\u2019s approach most clearly demonstrate about integrating personal testimony into commercially produced Christian music?",
    "choices": {
      "A": "That a raw personal narrative can be preserved and amplified through professional production without diluting its authenticity",
      "B": "That major-label backing typically requires significant lyrical changes to ensure mainstream acceptability",
      "C": "That independent releases of personal testimony inherently lack the quality needed for widespread impact",
      "D": "That higher production values alone guarantee deeper spiritual resonance in a worship song"
    },
    "answer": "A",
    "explanation": "MercyMe maintained the song\u2019s intimate narrative intact while enhancing its sonic presentation, showing that authenticity need not be compromised by commercial production.",
    "question_token_count": 40,
    "answer_correctness_score": 9,
    "explanation_validity_score": 9,
    "question_clarity_score": 4,
    "question_difficulty_score": 7,
    "question_groundedness_score": 6,
    "avg_answer_token_count": 16
  },
  {
    "context": "<P> `` Flight '' is the twenty - fourth and final episode of the eighth season of the American television medical drama Grey 's Anatomy , and the show 's 172nd episode overall . It was written by series creator Shonda Rhimes , and directed by Rob Corn . The episode was originally broadcast on the American Broadcasting Company ( ABC ) in the United States on May 17 , 2012 . In the episode , six doctors from Seattle Grace Mercy West Hospital who are victims of an aviation accident fight to stay alive , but Dr. Lexie Grey ( Chyler Leigh ) ultimately dies . Other storylines occur in Seattle where Dr. Richard Webber ( James Pickens , Jr . ) plans his annual dinner for the departing residents , Dr. Owen Hunt ( Kevin McKidd ) fires Dr. Teddy Altman ( Kim Raver ) , and Dr. Miranda Bailey ( Chandra Wilson ) gets engaged . </P>",
    "topic": "Production and broadcast context: the significance of the May 17, 2012 air date, the episode\u2019s placement as the 172nd overall, and ABC\u2019s scheduling strategy.",
    "response": "<document_analysis>\n1. Thoughtful Content Examination:\n   - The context identifies \u201cFlight\u201d as the 172nd episode of Grey\u2019s Anatomy, airing on ABC on May 17, 2012, as the season-eight finale.\n   - Key production details (writer/director) are less relevant to scheduling strategy; the crucial data points are the episode\u2019s sequential placement and air date.\n\n2. Concept Exploration:\n   - Implicitly refers to network programming tactics: season finales often target \u201csweeps\u201d periods to drive ratings and ad revenue.\n   - Underlying theory: Nielsen sweeps (especially in May) determine advertising rates; high-profile episodes are scheduled then.\n\n3. Strategic Complexity Calibration:\n   - Difficulty rating: 7/10. Requires domain expert\u2019s understanding of broadcast scheduling, sweeps dynamics, and the rationale for airing major episodes in mid-May.\n\n4. Intentional Question Planning:\n   - The question probes why that specific date and episode number matter strategically for ABC, inviting analysis of broadcast economics and scheduling windows.\n   - Focuses on the May sweeps concept without overtly referencing the original text.\n\nIrrelevant/Bogus Content: Other storylines and creative credits are not pertinent to scheduling strategy and have been ignored.\n</document_analysis>\n\n<output_format>\nQuestion: Considering network programming strategies, what was ABC\u2019s primary reason for scheduling the 172nd episode of Grey\u2019s Anatomy on May 17, 2012?\nA: To conclude the season just before the typical summer decline in viewership  \nB: To air during the May sweeps period and maximize Nielsen ratings and advertising revenue  \nC: To align with ABC\u2019s bi-annual programming shifts in mid-June  \nD: To match the star actors\u2019 availability for national promotional tours  \nExplanation: Airing a high-stakes season finale during the May sweeps maximizes viewership metrics that directly drive advertising rates.  \nCorrect Answer: B\n</output_format>",
    "question": "Considering network programming strategies, what was ABC\u2019s primary reason for scheduling the 172nd episode of Grey\u2019s Anatomy on May 17, 2012?",
    "choices": {
      "A": "To conclude the season just before the typical summer decline in viewership",
      "B": "To air during the May sweeps period and maximize Nielsen ratings and advertising revenue",
      "C": "To align with ABC\u2019s bi-annual programming shifts in mid-June",
      "D": "To match the star actors\u2019 availability for national promotional tours"
    },
    "answer": "B",
    "explanation": "Airing a high-stakes season finale during the May sweeps maximizes viewership metrics that directly drive advertising rates.",
    "question_token_count": 32,
    "answer_correctness_score": 10,
    "explanation_validity_score": 10,
    "question_clarity_score": 1,
    "question_difficulty_score": 8,
    "question_groundedness_score": 1,
    "avg_answer_token_count": 14
  },
  {
    "context": "<P> Article Five of the United States Constitution describes the process whereby the Constitution , the nation 's frame of government , may be altered . Altering the Constitution consists of proposing an amendment or amendments and subsequent ratification . Amendments may be proposed either by the Congress with a two - thirds vote in both the House of Representatives and the Senate or by a convention of states called for by two - thirds of the state legislatures . To become part of the Constitution , an amendment must be ratified by either -- as determined by Congress -- the legislatures of three - quarters of the states or state ratifying conventions in three - quarters of the states . The vote of each state ( to either ratify or reject a proposed amendment ) carries equal weight , regardless of a state 's population or length of time in the Union . </P>",
    "topic": "Explore the implications of requiring three\u2011quarters of states for ratification on minority rights and the prevention of majoritarian overreach.",
    "response": "<document_analysis>\nThe provided context explains Article Five\u2019s amendment process: proposals require a two-thirds congressional vote or state convention call, and ratification needs three-quarters of state approval, each state having equal weight. Key themes include the supermajority threshold\u2019s role in preserving minority state interests, preventing transient national majorities from altering the Constitution without widespread consensus, and the equal-weighted state vote\u2019s impact on federalism. The equal weighting means a relatively small bloc of states\u2014those representing a minority of the population\u2014can block amendments, serving as a check on majoritarian overreach. This dynamic is central to exploring how supermajority requirements protect minority rights and deter unilateral constitutional change.\nDifficulty rating: 8/10\n</document_analysis>\n\n<output_format>\nQuestion: How does requiring ratification by three\u2011quarters of states, each with an equal vote, functionally safeguard minority state interests against amendments favored by a numerical majority of the population?\nA: It mandates approval from at least 38 states, thereby enabling any coalition of 13 dissenting states to block an amendment without broader consensus.\nB: It allows states representing the largest populations to aggregate votes and override smaller states\u2019 objections.\nC: It lowers the ratification threshold to a simple majority of states, making amendments easier to enact.\nD: It transfers ratification authority from state legislatures to Congress when minority rights are implicated.\nExplanation: Option A correctly describes how the 3/4 requirement and equal state votes enable a minority of states to veto an amendment, ensuring broad, cross-state agreement and protecting against majoritarian overreach. The other options misconstrue the threshold\u2019s effects.\nCorrect Answer: A\n</output_format>",
    "question": "How does requiring ratification by three\u2011quarters of states, each with an equal vote, functionally safeguard minority state interests against amendments favored by a numerical majority of the population?",
    "choices": {
      "A": "It mandates approval from at least 38 states, thereby enabling any coalition of 13 dissenting states to block an amendment without broader consensus.",
      "B": "It allows states representing the largest populations to aggregate votes and override smaller states\u2019 objections.",
      "C": "It lowers the ratification threshold to a simple majority of states, making amendments easier to enact.",
      "D": "It transfers ratification authority from state legislatures to Congress when minority rights are implicated."
    },
    "answer": "A",
    "explanation": "Option A correctly describes how the 3/4 requirement and equal state votes enable a minority of states to veto an amendment, ensuring broad, cross-state agreement and protecting against majoritarian overreach. The other options misconstrue the threshold\u2019s effects.",
    "question_token_count": 35,
    "answer_correctness_score": 10,
    "explanation_validity_score": 10,
    "question_clarity_score": 8,
    "question_difficulty_score": 9,
    "question_groundedness_score": 10,
    "avg_answer_token_count": 21
  },
  {
    "context": "<P> The United States presidential line of succession is the order in which persons may become or act as President of the United States if the incumbent president becomes incapacitated , dies , resigns , or is removed from office ( by impeachment by the House of Representatives and subsequent conviction by the Senate ) . The line of succession is set by the United States Constitution and the Presidential Succession Act of 1947 as subsequently amended to include newly created cabinet offices . The succession follows the order of vice president , Speaker of the House of Representatives , President pro tempore of the Senate , and then the heads of federal executive departments who form the Cabinet of the United States . The Cabinet currently has fifteen members , beginning with the Secretary of State , and followed by the rest in the order of their positions ' creation . Those heads of department who are ineligible to act as president are also ineligible to succeed the president by succession , for example most commonly if they are not a natural - born U.S. citizen . </P>",
    "topic": "Legal definitions and precedents for \u201cincapacitation\u201d of the President triggering succession.",
    "response": "<document_analysis>\nThe context describes the legal basis and specific ordering for the presidential line of succession, including the sequence: vice president, Speaker, President pro tempore, then Cabinet department heads. It notes that Cabinet members are ordered by the historical creation date of their departments. This ordering principle is a nuanced statutory detail that can be targeted in a probing, multiple-choice question with plausible distractors.\n</document_analysis>\n\n<output_format>\nQuestion: Following the President pro tempore of the Senate, Cabinet department heads are slotted into the presidential line of succession according to which organizing principle?\nA: Alphabetical order of department titles  \nB: Date each department was established  \nC: Size of each department\u2019s annual budget  \nD: Length of the current secretary\u2019s federal service  \nExplanation: The Presidential Succession Act specifies that Cabinet officers succeed in the order their departments were created.  \nCorrect Answer: B\n</output_format>",
    "question": "Following the President pro tempore of the Senate, Cabinet department heads are slotted into the presidential line of succession according to which organizing principle?",
    "choices": {
      "A": "Alphabetical order of department titles",
      "B": "Date each department was established",
      "C": "Size of each department\u2019s annual budget",
      "D": "Length of the current secretary\u2019s federal service"
    },
    "answer": "B",
    "explanation": "The Presidential Succession Act specifies that Cabinet officers succeed in the order their departments were created.",
    "question_token_count": 29,
    "answer_correctness_score": 10,
    "explanation_validity_score": 10,
    "question_clarity_score": 6,
    "question_difficulty_score": 5,
    "question_groundedness_score": 10,
    "avg_answer_token_count": 7
  },
  {
    "context": "<P> Earth 's orbit is the trajectory along which Earth travels around the Sun . The average distance between the Earth and the Sun is 149.60 million km ( 92.96 million mi ) , and one complete orbit takes 365.256 days ( 1 sidereal year ) , during which time Earth has traveled 940 million km ( 584 million mi ) . Earth 's orbit has an eccentricity of 0.0167 . </P>",
    "topic": "Role of orbital eccentricity (0.0167) in causing variations in Earth\u2019s orbital speed according to Kepler\u2019s second law.",
    "response": "<document_analysis>\nThe context provides Earth's orbital eccentricity (e = 0.0167) but omits explicit discussion of speed variations. However, using Kepler\u2019s second law and orbital mechanics, one can derive that the speed ratio between perihelion and aphelion is (1+e)/(1\u2212e), yielding a measurable difference. This inference requires domain knowledge of elliptical orbit speed relations, making it suitable for a challenging question. Difficulty is calibrated high (\u22487/10) as it demands applying Kepler\u2019s second law and algebraic manipulation to compute a percentage variation.\n</document_analysis>\n\n<output_format>\nQuestion: Considering Earth\u2019s orbital eccentricity of 0.0167, what is the approximate percentage difference between its orbital speed at perihelion and at aphelion?\nA: 1.67%\nB: 3.39%\nC: 0.84%\nD: 6.78%\nExplanation: The speed ratio v_p/v_a = (1+e)/(1\u2212e), so the fractional difference is [(1+e)/(1\u2212e) \u2212 1]\u00d7100% \u2248 (2e/(1\u2212e))\u00d7100% \u22483.39%.\nCorrect Answer: B\n</output_format>",
    "question": "Considering Earth\u2019s orbital eccentricity of 0.0167, what is the approximate percentage difference between its orbital speed at perihelion and at aphelion?",
    "choices": {
      "A": "1.67%",
      "B": "3.39%",
      "C": "0.84%",
      "D": "6.78%"
    },
    "answer": "B",
    "explanation": "The speed ratio v_p/v_a = (1+e)/(1\u2212e), so the fractional difference is [(1+e)/(1\u2212e) \u2212 1]\u00d7100% \u2248 (2e/(1\u2212e))\u00d7100% \u22483.39%.",
    "question_token_count": 33,
    "answer_correctness_score": 10,
    "explanation_validity_score": 10,
    "question_clarity_score": 8,
    "question_difficulty_score": 7,
    "question_groundedness_score": 5,
    "avg_answer_token_count": 5
  },
  {
    "context": "<P> `` I Can Only Imagine '' ( sometimes shortened to `` Imagine '' ) is a single recorded by Christian rock band MercyMe . Written and composed by lead vocalist Bart Millard , the song , based around a main piano track , was inspired by the death of Millard 's father and considers what it would be like in Heaven and to be standing before God . The song was first issued as a track on MercyMe 's 1999 album The Worship Project , which was released on an independent record label . The song was re-recorded and included on their 2001 major - label debut album Almost There as the fifth song on the album . </P>",
    "topic": "Theological implications of envisioning Heaven and standing before God as presented in the song\u2019s lyrics.",
    "response": "<document_analysis>\nThoughtful Content Examination:\nThe context outlines that \"I Can Only Imagine\" by MercyMe contemplates the believer\u2019s experience of Heaven and standing before God, inspired by personal bereavement. Central is a future-oriented vision of divine encounter.\n\nConcept Exploration:\nThis envisions a core soteriological motif\u2014projecting the culmination of salvation in the believer\u2019s perfected presence before God. Implicit is the theological distinction among atonement, justification, sanctification, and glorification.\n\nStrategic Complexity Calibration:\nDifficulty rated 8/10. It requires domain experts to map lyrical themes to precise stages in Christian soteriology.\n\nIntentional Question Planning:\nThe question will probe knowledge of soteriological stages, inviting experts to distinguish which stage aligns with envisioning standing before God in Heaven.\n</document_analysis>\n\n<output_format>\nQuestion: Which stage of the Christian soteriological process is most directly exemplified by the song\u2019s focus on believers standing before God in Heaven?\nA: Atonement\nB: Justification\nC: Sanctification\nD: Glorification\nExplanation: The song centers on the future consummation of salvation\u2014believers perfected in God's presence\u2014corresponding to glorification.\nCorrect Answer: D\n</output_format>",
    "question": "Which stage of the Christian soteriological process is most directly exemplified by the song\u2019s focus on believers standing before God in Heaven?",
    "choices": {
      "A": "Atonement",
      "B": "Justification",
      "C": "Sanctification",
      "D": "Glorification"
    },
    "answer": "D",
    "explanation": "The song centers on the future consummation of salvation\u2014believers perfected in God's presence\u2014corresponding to glorification.",
    "question_token_count": 28,
    "answer_correctness_score": 10,
    "explanation_validity_score": 10,
    "question_clarity_score": 6,
    "question_difficulty_score": 8,
    "question_groundedness_score": 4,
    "avg_answer_token_count": 3
  },
  {
    "context": "<P> The 2018 FIFA World Cup was the 21st FIFA World Cup , an international football tournament contested by the men 's national teams of the member associations of FIFA once every four years . It took place in Russia from 14 June to 15 July 2018 . It was the first World Cup to be held in Eastern Europe , and the 11th time that it had been held in Europe . At an estimated cost of over $14.2 billion , it was the most expensive World Cup . It was also the first World Cup to use the video assistant referee ( VAR ) system . </P>",
    "topic": "Discuss the historical evolution of the FIFA World Cup\u2019s quadrennial scheduling up to its 21st edition and its implications for global football development.",
    "response": "<document_analysis>\nThe context describes the 2018 FIFA World Cup as the 21st quadrennial tournament, highlighting two landmark \u201cfirsts\u201d: its initial staging in Eastern Europe (Russia) and the debut of the Video Assistant Referee (VAR) system. Both are strategic milestones\u2014one expanding the competition\u2019s geographic reach, the other advancing officiating technology. These dual trends together reflect the matured priorities of FIFA\u2019s four\u2011year cycle.\n</document_analysis>\n\n<output_format>\nQuestion: Which convergence of first-time elements at the 21st FIFA World Cup best illustrates the event\u2019s simultaneous push for geographic diversification and technological advancement?\nA: First tournament held in Eastern Europe and debut of VAR  \nB: First host nation from Russia and record cost exceeding $14.2\u00a0billion  \nC: Debut of VAR and the 11th occasion of European hosting  \nD: First staging in Eastern Europe and traditionally scheduled June\u2013July dates  \nExplanation: The 2018 edition was both the inaugural World Cup in Eastern Europe and the first to implement VAR, exemplifying the dual focus on expanding venues and innovating officiating.  \nCorrect Answer: A\n</output_format>",
    "question": "Which convergence of first-time elements at the 21st FIFA World Cup best illustrates the event\u2019s simultaneous push for geographic diversification and technological advancement?",
    "choices": {
      "A": "First tournament held in Eastern Europe and debut of VAR",
      "B": "First host nation from Russia and record cost exceeding $14.2\u00a0billion",
      "C": "Debut of VAR and the 11th occasion of European hosting",
      "D": "First staging in Eastern Europe and traditionally scheduled June\u2013July dates"
    },
    "answer": "A",
    "explanation": "The 2018 edition was both the inaugural World Cup in Eastern Europe and the first to implement VAR, exemplifying the dual focus on expanding venues and innovating officiating.",
    "question_token_count": 29,
    "answer_correctness_score": 10,
    "explanation_validity_score": 10,
    "question_clarity_score": 6,
    "question_difficulty_score": 7,
    "question_groundedness_score": 5,
    "avg_answer_token_count": 13
  },
  {
    "context": "<P> The 2018 FIFA World Cup was the 21st FIFA World Cup , an international football tournament contested by the men 's national teams of the member associations of FIFA once every four years . It took place in Russia from 14 June to 15 July 2018 . It was the first World Cup to be held in Eastern Europe , and the 11th time that it had been held in Europe . At an estimated cost of over $14.2 billion , it was the most expensive World Cup . It was also the first World Cup to use the video assistant referee ( VAR ) system . </P>",
    "topic": "Evaluate the economic factors and decision\u2011making processes that led to the World Cup\u2019s estimated $14.2\u00a0billion cost and compare its financial outcomes with previous editions.",
    "response": "<document_analysis>\nThe context identifies the 2018 World Cup as the most expensive ever at $14.2\u00a0billion, highlights it was the first in Eastern Europe, and notes the debut of VAR. The key inference is that hosting in a less-developed region required large infrastructure and stadium investments, far exceeding costs of prior editions. Other elements (VAR, tournament format) were relatively minor cost drivers. This sets up a question probing expert insight into how location and related capital projects dominate event budgeting.\nDifficulty rating: 8/10\n</document_analysis>\n\n<output_format>\nQuestion: Which factor most significantly contributed to the 2018 World Cup\u2019s record $14.2\u00a0billion cost compared to previous tournaments?\nA: Implementation of the video assistant referee system\nB: Construction and modernization of stadiums and transport infrastructure in Eastern Europe\nC: Expansion of the tournament\u2019s team roster and match schedule\nD: Increased prize money and bonuses for participating teams\nExplanation: Hosting in a region with less existing infrastructure necessitated extensive stadium builds and transport upgrades, driving costs far above those of prior editions.\nCorrect Answer: B\n</output_format>",
    "question": "Which factor most significantly contributed to the 2018 World Cup\u2019s record $14.2\u00a0billion cost compared to previous tournaments?",
    "choices": {
      "A": "Implementation of the video assistant referee system",
      "B": "Construction and modernization of stadiums and transport infrastructure in Eastern Europe",
      "C": "Expansion of the tournament\u2019s team roster and match schedule",
      "D": "Increased prize money and bonuses for participating teams"
    },
    "answer": "B",
    "explanation": "Hosting in a region with less existing infrastructure necessitated extensive stadium builds and transport upgrades, driving costs far above those of prior editions.",
    "question_token_count": 27,
    "answer_correctness_score": 9,
    "explanation_validity_score": 9,
    "question_clarity_score": 1,
    "question_difficulty_score": 6,
    "question_groundedness_score": 4,
    "avg_answer_token_count": 10
  },
  {
    "context": "<P> In the history of the Triple Crown , 13 horses have won all three races : Sir Barton ( 1919 ) , Gallant Fox ( 1930 ) , Omaha ( 1935 ) , War Admiral ( 1937 ) , Whirlaway ( 1941 ) , Count Fleet ( 1943 ) , Assault ( 1946 ) , Citation ( 1948 ) , Secretariat ( 1973 ) , Seattle Slew ( 1977 ) , Affirmed ( 1978 ) , American Pharoah ( 2015 ) , and Justify ( 2018 ) . As of 2018 , American Pharoah and Justify are the only living Triple Crown winners . </P>",
    "topic": "Synthesize the evolution of racing competitiveness by using the timeline of Triple Crown winners to infer changes in the sport\u2019s standards and challenges.",
    "response": "<document_analysis>\nThe context lists all 13 Triple Crown winners along with their winning years, revealing the intervals between victories. Notably, the longest gap is between Affirmed (1978) and American Pharoah (2015) at 37 years. This drought suggests a peak in competitiveness and challenge in the sport. A question focusing on identifying this interval requires precise synthesis of the timeline and inferring changes in racing standards.\n</document_analysis>\n\n<output_format>\nQuestion: Which span between consecutive Triple Crown winners represents the longest hiatus, underscoring a significant rise in racing competitiveness?\nA: 1948\u20131973\nB: 1978\u20132015\nC: 1937\u20131941\nD: 1919\u20131930\nExplanation: The interval from Affirmed in 1978 to American\u00a0Pharoah in 2015 lasted 37 years, the longest gap between victories.\nCorrect Answer: B\n</output_format>",
    "question": "Which span between consecutive Triple Crown winners represents the longest hiatus, underscoring a significant rise in racing competitiveness?",
    "choices": {
      "A": "1948\u20131973",
      "B": "1978\u20132015",
      "C": "1937\u20131941",
      "D": "1919\u20131930"
    },
    "answer": "B",
    "explanation": "The interval from Affirmed in 1978 to American\u00a0Pharoah in 2015 lasted 37 years, the longest gap between victories.",
    "question_token_count": 24,
    "answer_correctness_score": 10,
    "explanation_validity_score": 10,
    "question_clarity_score": 7,
    "question_difficulty_score": 6,
    "question_groundedness_score": 10,
    "avg_answer_token_count": 6
  },
  {
    "context": "<Table> Dates for Easter in the past and coming 20 years ( 1998 -- 2038 in Gregorian dates ) <Tr> <Th> Year </Th> <Th> Western </Th> <Th> Eastern </Th> </Tr> <Tr> <Th> 1998 </Th> <Td colspan=\"1\"> April 12 </Td> <Td> April 19 </Td> </Tr> <Tr> <Th> 1999 </Th> <Td colspan=\"1\"> April 4 </Td> <Td> April 11 </Td> </Tr> <Tr> <Th> 2000 </Th> <Td colspan=\"1\"> April 23 </Td> <Td> April 30 </Td> </Tr> <Tr> <Th> </Th> <Td colspan=\"2\"> April 15 </Td> </Tr> <Tr> <Th> 2002 </Th> <Td colspan=\"1\"> March 31 </Td> <Td> May 5 </Td> </Tr> <Tr> <Th> 2003 </Th> <Td colspan=\"1\"> April 20 </Td> <Td> April 27 </Td> </Tr> <Tr> <Th> </Th> <Td colspan=\"2\"> April 11 </Td> </Tr> <Tr> <Th> 2005 </Th> <Td colspan=\"1\"> March 27 </Td> <Td> May 1 </Td> </Tr> <Tr> <Th> 2006 </Th> <Td colspan=\"1\"> April 16 </Td> <Td> April 23 </Td> </Tr> <Tr> <Th> 2007 </Th> <Td colspan=\"2\"> April 8 </Td> </Tr> <Tr> <Th> 2008 </Th> <Td colspan=\"1\"> March 23 </Td> <Td> April 27 </Td> </Tr> <Tr> <Th> 2009 </Th> <Td colspan=\"1\"> April 12 </Td> <Td> April 19 </Td> </Tr> <Tr> <Th> </Th> <Td colspan=\"2\"> April 4 </Td> </Tr> <Tr> <Th> 2011 </Th> <Td colspan=\"2\"> April 24 </Td> </Tr> <Tr> <Th> 2012 </Th> <Td colspan=\"1\"> April 8 </Td> <Td> April 15 </Td> </Tr> <Tr> <Th> 2013 </Th> <Td colspan=\"1\"> March 31 </Td> <Td> May 5 </Td> </Tr> <Tr> <Th> 2014 </Th> <Td colspan=\"2\"> April 20 </Td> </Tr> <Tr> <Th> 2015 </Th> <Td colspan=\"1\"> April 5 </Td> <Td> April 12 </Td> </Tr> <Tr> <Th> 2016 </Th> <Td colspan=\"1\"> March 27 </Td> <Td> May 1 </Td> </Tr> <Tr> <Th> 2017 </Th> <Td colspan=\"2\"> April 16 </Td> </Tr> <Tr> <Th> 2018 </Th> <Td colspan=\"1\"> April 1 </Td> <Td> April 8 </Td> </Tr> <Tr> <Th> 2019 </Th> <Td colspan=\"1\"> April 21 </Td> <Td> April 28 </Td> </Tr> <Tr> <Th> 2020 </Th> <Td colspan=\"1\"> April 12 </Td> <Td> April 19 </Td> </Tr> <Tr> <Th> 2021 </Th> <Td colspan=\"1\"> April 4 </Td> <Td> May 2 </Td> </Tr> <Tr> <Th> 2022 </Th> <Td colspan=\"1\"> April 17 </Td> <Td> April 24 </Td> </Tr> <Tr> <Th> 2023 </Th> <Td colspan=\"1\"> April 9 </Td> <Td> April 16 </Td> </Tr> <Tr> <Th> 2024 </Th> <Td colspan=\"1\"> March 31 </Td> <Td> May 5 </Td> </Tr> <Tr> <Th> 2025 </Th> <Td colspan=\"2\"> April 20 </Td> </Tr> <Tr> <Th> 2026 </Th> <Td colspan=\"1\"> April 5 </Td> <Td> April 12 </Td> </Tr> <Tr> <Th> 2027 </Th> <Td colspan=\"1\"> March 28 </Td> <Td> May 2 </Td> </Tr> <Tr> <Th> 2028 </Th> <Td colspan=\"2\"> April 16 </Td> </Tr> <Tr> <Th> 2029 </Th> <Td colspan=\"1\"> April 1 </Td> <Td> April 8 </Td> </Tr> <Tr> <Th> 2030 </Th> <Td colspan=\"1\"> April 21 </Td> <Td> April 28 </Td> </Tr> <Tr> <Th> 2031 </Th> <Td colspan=\"2\"> April 13 </Td> </Tr> <Tr> <Th> 2032 </Th> <Td colspan=\"1\"> March 28 </Td> <Td> May 2 </Td> </Tr> <Tr> <Th> 2033 </Th> <Td colspan=\"1\"> April 17 </Td> <Td> April 24 </Td> </Tr> <Tr> <Th> 2034 </Th> <Td colspan=\"2\"> April 9 </Td> </Tr> <Tr> <Th> 2035 </Th> <Td colspan=\"1\"> March 25 </Td> <Td> April 29 </Td> </Tr> <Tr> <Th> 2036 </Th> <Td colspan=\"1\"> April 13 </Td> <Td> April 20 </Td> </Tr> <Tr> <Th> 2037 </Th> <Td colspan=\"2\"> April 5 </Td> </Tr> <Tr> <Th> 2038 </Th> <Td colspan=\"2\"> April 25 </Td> </Tr> </Table>",
    "topic": "Comparative frequency analysis of matching vs. differing dates between Western and Eastern Easter.",
    "response": "<document_analysis>\nThe table lists Gregorian dates for Western and Eastern Easter from 1998 to 2038. Years where both coincide are marked by single dates; these occur in 13 out of 41 years. Calculating intervals between these coincidence years yields predominantly 3-year gaps (8 occurrences), two single-year gaps, and one 8-year gap (2017\u20132025). The modal interval is 3 years, and the longest unique gap is 8 years between consecutive coincidences in 2017 and 2025. This pattern reveals the underlying misalignment cycle between the Gregorian and Julian/Paschal computations.\n</document_analysis>\n\n<output_format>\nQuestion: Analyzing the years 1998\u20132038 when Western and Eastern Easter fell on the same Gregorian date, which interval length between consecutive coincidences appears most frequently, and between which two consecutive years does the single longest interval occur?\nA: 3\u00a0years; between 2017 and 2025\nB: 1\u00a0year; between 2010 and 2011\nC: 3\u00a0years; between 2001 and 2004\nD: 8\u00a0years; between 2004 and 2012\nExplanation: The coincidences most often recur every 3\u00a0years (8 times), with the only 8-year gap occurring between 2017 and 2025.\nCorrect Answer: A\n</output_format>",
    "question": "Analyzing the years 1998\u20132038 when Western and Eastern Easter fell on the same Gregorian date, which interval length between consecutive coincidences appears most frequently, and between which two consecutive years does the single longest interval occur?",
    "choices": {
      "A": "3\u00a0years; between 2017 and 2025",
      "B": "1\u00a0year; between 2010 and 2011",
      "C": "3\u00a0years; between 2001 and 2004",
      "D": "8\u00a0years; between 2004 and 2012"
    },
    "answer": "A",
    "explanation": "The coincidences most often recur every 3\u00a0years (8 times), with the only 8-year gap occurring between 2017 and 2025.",
    "question_token_count": 47,
    "answer_correctness_score": 10,
    "explanation_validity_score": 10,
    "question_clarity_score": 8,
    "question_difficulty_score": 7,
    "question_groundedness_score": 10,
    "avg_answer_token_count": 12
  },
  {
    "context": "<Table> <Tr> <Th> Player </Th> <Th> Salary </Th> <Th> Team </Th> </Tr> <Tr> <Td> Stephen Curry </Td> <Td> $34,682,550 </Td> <Td> Golden State Warriors </Td> </Tr> <Tr> <Td> LeBron James </Td> <Td> $33,285,709 </Td> <Td> Cleveland Cavaliers </Td> </Tr> <Tr> <Td> Paul Millsap </Td> <Td> $31,269,231 </Td> <Td> Denver Nuggets </Td> </Tr> <Tr> <Td> Gordon Hayward </Td> <Td> $29,727,900 </Td> <Td> Boston Celtics </Td> </Tr> <Tr> <Td> Blake Griffin </Td> <Td> $29,512,900 </Td> <Td> Los Angeles Clippers </Td> </Tr> <Tr> <Td> Kyle Lowry </Td> <Td> $28,703,704 </Td> <Td> Toronto Raptors </Td> </Tr> <Tr> <Td> Russell Westbrook </Td> <Td> $28,530,608 </Td> <Td> Oklahoma City Thunder </Td> </Tr> <Tr> <Td> Mike Conley , Jr . </Td> <Td> $28,530,608 </Td> <Td> Memphis Grizzlies </Td> </Tr> <Tr> <Td> James Harden </Td> <Td> $28,299,399 </Td> <Td> Houston Rockets </Td> </Tr> <Tr> <Td> DeMar DeRozan </Td> <Td> $27,739,975 </Td> <Td> Toronto Raptors </Td> </Tr> </Table>",
    "topic": "Discuss the implications of superstar salaries, such as LeBron James\u2019s $33.3 million, on team roster construction and depth chart decisions.",
    "response": "<document_analysis>\nThe context provides a table of the highest NBA salaries, highlighting that LeBron James occupies over $33\u00a0million of his team\u2019s salary cap. This directly ties into roster construction and depth chart decisions, as devoting a large salary share to a superstar constrains cap flexibility, affects exception usage, and forces reliance on low-cost roles. Key dynamics include cap percentage, exception eligibility, and the strategic use of minimum and two-way contracts. A domain\u2010expert question will probe which contract mechanisms teams must utilize most when a supermax deal limits standard cap room.\nDifficulty rating: 8/10\n</document_analysis>\n\n<output_format>\nQuestion: When a superstar\u2019s contract consumes roughly one-quarter of a team\u2019s salary cap, which strategy becomes the primary means of filling out the rest of the roster and preserving depth?\nA: Utilizing the bi-annual exception to sign several mid-tier role players  \nB: Relying on veteran minimum-salary deals, two-way contracts, and undrafted rookie signings  \nC: Executing sign-and-trade transactions to leverage other teams\u2019 cap space for backup talent  \nD: Renouncing all Bird rights to clear cap space for established starters  \nExplanation: With most cap space tied up by a superstar\u2019s large salary, teams cannot afford many mid-tier contracts and instead fill out the roster with minimum-salary and two-way deals, as well as undrafted rookies.  \nCorrect Answer: B\n</output_format>",
    "question": "When a superstar\u2019s contract consumes roughly one-quarter of a team\u2019s salary cap, which strategy becomes the primary means of filling out the rest of the roster and preserving depth?",
    "choices": {
      "A": "Utilizing the bi-annual exception to sign several mid-tier role players",
      "B": "Relying on veteran minimum-salary deals, two-way contracts, and undrafted rookie signings",
      "C": "Executing sign-and-trade transactions to leverage other teams\u2019 cap space for backup talent",
      "D": "Renouncing all Bird rights to clear cap space for established starters"
    },
    "answer": "B",
    "explanation": "With most cap space tied up by a superstar\u2019s large salary, teams cannot afford many mid-tier contracts and instead fill out the roster with minimum-salary and two-way deals, as well as undrafted rookies.",
    "question_token_count": 35,
    "answer_correctness_score": 10,
    "explanation_validity_score": 10,
    "question_clarity_score": 8,
    "question_difficulty_score": 7,
    "question_groundedness_score": 2,
    "avg_answer_token_count": 16
  },
  {
    "context": "<P> The 2022 FIFA World Cup is scheduled to be the 22nd edition of the FIFA World Cup , the quadrennial international men 's football championship contested by the national teams of the member associations of FIFA . It is scheduled to take place in Qatar in 2022 . This will be the first World Cup ever to be held in the Arab world and the first in a Muslim - majority country . This will be the first World Cup held entirely in geographical Asia since the 2002 tournament in South Korea and Japan ( the 2018 competition in Russia featured one geographically Asian venue , Yekaterinburg ) . In addition the tournament will be the last to involve 32 teams , with an increase to 48 teams scheduled for the 2026 tournament . </P>",
    "topic": "Compare and contrast the full Asian hosting of the 2002 World Cup with the 2022 tournament in terms of geographic, cultural, and logistical considerations.",
    "response": "<document_analysis>\nThe context contrasts the 2002 World Cup as a dual-host event in South Korea and Japan with the 2022 tournament being held entirely within Qatar. Key themes include geographic span (two countries vs. one), cultural setting (East Asia vs. Arab/Muslim-majority), and logistical coordination across borders. The question aims to probe nuanced understanding of how single-nation hosting simplifies certain operational aspects, while other complexities (climate control, scheduling, cultural regulations) remain or newly emerge.\nDifficulty level: 8/10 \u2013 requires deep awareness of operational logistics across multi\u2010nation vs. single\u2010nation tournament planning.\n</document_analysis>\n\n<output_format>\nQuestion: Considering the 2002 World Cup was co\u2011hosted by South Korea and Japan while Qatar will host the 2022 tournament on its own, which logistical complexity inherent to the 2002 event is inherently avoided in 2022?\nA: Managing cross\u2011border customs and immigration procedures for teams, fans, and equipment.\nB: Implementing advanced stadium cooling systems to mitigate extreme heat.\nC: Aligning global match schedules with domestic league calendars disrupted by the tournament.\nD: Reconfiguring fan zones to comply with host\u2011nation cultural rules on public alcohol consumption.\nExplanation: Only option A\u2014handling customs and immigration across two national borders\u2014is eliminated when all venues lie within a single country.\nCorrect Answer: A\n</output_format>",
    "question": "Considering the 2002 World Cup was co\u2011hosted by South Korea and Japan while Qatar will host the 2022 tournament on its own, which logistical complexity inherent to the 2002 event is inherently avoided in 2022?",
    "choices": {
      "A": "Managing cross\u2011border customs and immigration procedures for teams, fans, and equipment.",
      "B": "Implementing advanced stadium cooling systems to mitigate extreme heat.",
      "C": "Aligning global match schedules with domestic league calendars disrupted by the tournament.",
      "D": "Reconfiguring fan zones to comply with host\u2011nation cultural rules on public alcohol consumption."
    },
    "answer": "A",
    "explanation": "Only option A\u2014handling customs and immigration across two national borders\u2014is eliminated when all venues lie within a single country.",
    "question_token_count": 50,
    "answer_correctness_score": 10,
    "explanation_validity_score": 10,
    "question_clarity_score": 6,
    "question_difficulty_score": 5,
    "question_groundedness_score": 4,
    "avg_answer_token_count": 15
  },
  {
    "context": "<P> I Can Only Imagine is a 2018 American Christian drama film directed by the Erwin Brothers and written by Alex Cramer , Jon Erwin , and Brent McCorkle , based on the story behind the MercyMe song of the same name , the best - selling Christian single of all time . The film stars J. Michael Finley as Bart Millard , the lead singer who wrote the song about his relationship with his father ( Dennis Quaid ) . Madeline Carroll , Priscilla Shirer , Cloris Leachman , and Trace Adkins also star . </P>",
    "topic": "The casting strategy behind selecting J. Michael Finley to portray Bart Millard and its effect on audience reception.",
    "response": "<document_analysis>\nThe context outlines that J. Michael Finley, a relatively unknown singer-actor, was cast as Bart Millard in the biographical faith-based drama \u201cI Can Only Imagine.\u201d This suggests a deliberate casting choice emphasizing authentic musical performance rather than marquee acting fame. The question should probe understanding of the trade-off between musical authenticity and mainstream box-office draw in such niche biopics, a nuance that requires expert familiarity with casting strategies and audience reception dynamics in faith-based or music-centered films.\nDifficulty rating: 8/10 \u2013 it asks for identification of strategic casting objectives and perceptual outcomes, requiring insight into film marketing and audience segmentation.\n</document_analysis>\n\n<output_format>\nQuestion: By casting musician-actor J. Michael Finley as Bart Millard in the Christian biopic \u201cI Can Only Imagine,\u201d producers primarily achieved which strategic objective and what was its main effect on audience reception?\nA: Maximizing vocal authenticity at the expense of mainstream star recognition  \nB: Securing award buzz while diminishing connection with core fans  \nC: Leveraging established dramatic talent to broaden faith-based appeal  \nD: Prioritizing cost savings over on-screen performance quality  \n\nExplanation: Casting Finley delivered genuine musical and emotional authenticity, deeply resonating with MercyMe fans and faith-based audiences, though it sacrificed broader mainstream star power.  \nCorrect Answer: A\n</output_format>",
    "question": "By casting musician-actor J. Michael Finley as Bart Millard in the Christian biopic \u201cI Can Only Imagine,\u201d producers primarily achieved which strategic objective and what was its main effect on audience reception?",
    "choices": {
      "A": "Maximizing vocal authenticity at the expense of mainstream star recognition",
      "B": "Securing award buzz while diminishing connection with core fans",
      "C": "Leveraging established dramatic talent to broaden faith-based appeal",
      "D": "Prioritizing cost savings over on-screen performance quality"
    },
    "answer": "A",
    "explanation": "Casting Finley delivered genuine musical and emotional authenticity, deeply resonating with MercyMe fans and faith-based audiences, though it sacrificed broader mainstream star power.",
    "question_token_count": 42,
    "answer_correctness_score": 9,
    "explanation_validity_score": 9,
    "question_clarity_score": 6,
    "question_difficulty_score": 8,
    "question_groundedness_score": 4,
    "avg_answer_token_count": 11
  },
  {
    "context": "<Table> List of finals matches , their venues and locations , the finalists , and final scores <Tr> <Th> Year </Th> <Th> Winners </Th> <Th> Final score </Th> <Th> Runners - up </Th> <Th> Venue </Th> <Th> Location </Th> <Th> Attendance </Th> <Th> References </Th> </Tr> <Tr> <Th> 1930 </Th> <Td> Uruguay </Td> <Td> 4 -- 2 </Td> <Td> Argentina </Td> <Td> Estadio Centenario </Td> <Td> Montevideo , Uruguay </Td> <Td> 80,000 </Td> <Td> </Td> </Tr> <Tr> <Th> 1934 </Th> <Td> Italy </Td> <Td> 2 -- 1 </Td> <Td> Czechoslovakia </Td> <Td> Stadio Nazionale PNF </Td> <Td> Rome , Italy </Td> <Td> 50,000 </Td> <Td> </Td> </Tr> <Tr> <Th> 1938 </Th> <Td> Italy </Td> <Td> 4 -- 2 </Td> <Td> Hungary </Td> <Td> Stade Olympique de Colombes </Td> <Td> Paris , France </Td> <Td> 45,000 </Td> <Td> </Td> </Tr> <Tr> <Th> 1950 </Th> <Td> Uruguay </Td> <Td> 2 -- 1 </Td> <Td> Brazil </Td> <Td> Est\u00e1dio do Maracan\u00e3 </Td> <Td> Rio de Janeiro , Brazil </Td> <Td> 199,854 </Td> <Td> </Td> </Tr> <Tr> <Th> 1954 </Th> <Td> West Germany </Td> <Td> 3 -- 2 </Td> <Td> Hungary </Td> <Td> Wankdorf Stadium </Td> <Td> Bern , Switzerland </Td> <Td> 60,000 </Td> <Td> </Td> </Tr> <Tr> <Th> 1958 </Th> <Td> Brazil </Td> <Td> 5 -- 2 </Td> <Td> Sweden </Td> <Td> R\u00e5sunda Stadium </Td> <Td> Solna , Sweden </Td> <Td> 51,800 </Td> <Td> </Td> </Tr> <Tr> <Th> 1962 </Th> <Td> Brazil </Td> <Td> 3 -- 1 </Td> <Td> Czechoslovakia </Td> <Td> Estadio Nacional </Td> <Td> Santiago , Chile </Td> <Td> 69,000 </Td> <Td> </Td> </Tr> <Tr> <Th> 1966 </Th> <Td> England </Td> <Td> 4 -- 2 </Td> <Td> West Germany </Td> <Td> Wembley Stadium </Td> <Td> London , England </Td> <Td> 93,000 </Td> <Td> </Td> </Tr> <Tr> <Th> 1970 </Th> <Td> Brazil </Td> <Td> 4 -- 1 </Td> <Td> Italy </Td> <Td> Estadio Azteca </Td> <Td> Mexico City , Mexico </Td> <Td> 107,412 </Td> <Td> </Td> </Tr> <Tr> <Th> </Th> <Td> West Germany </Td> <Td> 2 -- 1 </Td> <Td> Netherlands </Td> <Td> Olympiastadion </Td> <Td> Munich , West Germany </Td> <Td> 75,200 </Td> <Td> </Td> </Tr> <Tr> <Th> 1978 </Th> <Td> Argentina </Td> <Td> 3 -- 1 </Td> <Td> Netherlands </Td> <Td> Estadio Monumental </Td> <Td> Buenos Aires , Argentina </Td> <Td> 71,483 </Td> <Td> </Td> </Tr> <Tr> <Th> 1982 </Th> <Td> Italy </Td> <Td> 3 -- 1 </Td> <Td> West Germany </Td> <Td> Santiago Bernab\u00e9u </Td> <Td> Madrid , Spain </Td> <Td> 90,000 </Td> <Td> </Td> </Tr> <Tr> <Th> 1986 </Th> <Td> Argentina </Td> <Td> 3 -- 2 </Td> <Td> West Germany </Td> <Td> Estadio Azteca </Td> <Td> Mexico City , Mexico </Td> <Td> 114,600 </Td> <Td> </Td> </Tr> <Tr> <Th> 1990 </Th> <Td> West Germany </Td> <Td> 1 -- 0 </Td> <Td> Argentina </Td> <Td> Stadio Olimpico </Td> <Td> Rome , Italy </Td> <Td> 73,603 </Td> <Td> </Td> </Tr> <Tr> <Th> 1994 </Th> <Td> Brazil </Td> <Td> 0 -- 0 </Td> <Td> Italy </Td> <Td> Rose Bowl </Td> <Td> Pasadena , United States </Td> <Td> 94,194 </Td> <Td> </Td> </Tr> <Tr> <Th> 1998 </Th> <Td> France </Td> <Td> 3 -- 0 </Td> <Td> Brazil </Td> <Td> Stade de France </Td> <Td> Saint - Denis , France </Td> <Td> 80,000 </Td> <Td> </Td> </Tr> <Tr> <Th> 2002 </Th> <Td> Brazil </Td> <Td> 2 -- 0 </Td> <Td> Germany </Td> <Td> International Stadium </Td> <Td> Yokohama , Japan </Td> <Td> 69,029 </Td> <Td> </Td> </Tr> <Tr> <Th> 2006 </Th> <Td> Italy </Td> <Td> 1 -- 1 </Td> <Td> France </Td> <Td> Olympiastadion </Td> <Td> Berlin , Germany </Td> <Td> 69,000 </Td> <Td> </Td> </Tr> <Tr> <Th> </Th> <Td> Spain </Td> <Td> 1 -- 0 </Td> <Td> Netherlands </Td> <Td> Soccer City </Td> <Td> Johannesburg , South Africa </Td> <Td> 84,490 </Td> <Td> </Td> </Tr> <Tr> <Th> 2014 </Th> <Td> Germany </Td> <Td> 1 -- 0 </Td> <Td> Argentina </Td> <Td> Est\u00e1dio do Maracan\u00e3 </Td> <Td> Rio de Janeiro , Brazil </Td> <Td> 74,738 </Td> <Td> </Td> </Tr> <Tr> <Th> 2018 </Th> <Td> France </Td> <Td> 4 -- 2 </Td> <Td> Croatia </Td> <Td> Luzhniki Stadium </Td> <Td> Moscow , Russia </Td> <Td> 78,011 </Td> <Td> </Td> </Tr> <Tr> <Th colspan=\"8\"> Upcoming finals </Th> </Tr> <Tr> <Th> Year </Th> <Th> Team 1 </Th> <Th> </Th> <Th> Team 2 </Th> <Th> Venue </Th> <Th> Location </Th> <Th> Attendance </Th> <Th> References </Th> </Tr> <Tr> <Th> 2022 </Th> <Td> </Td> <Td> </Td> <Td> </Td> <Td> Lusail Iconic Stadium </Td> <Td> Lusail , Qatar </Td> <Td> </Td> <Td> </Td> </Tr> <Tr> <Th> 2026 </Th> <Td> </Td> <Td> </Td> <Td> </Td> <Td> TBD </Td> <Td> United States </Td> <Td> </Td> <Td> </Td> </Tr> </Table>",
    "topic": "Formulate a model that correlates final match attendance with host nation economic indicators and discuss its predictive validity.",
    "response": "<document_analysis>\nThe context provides a time series of World Cup final match attendances along with host venues and locations. Central themes include attendance figures often clustering near stadium capacity, which introduces a ceiling effect when modeling attendance against host nation economic indicators (e.g., GDP per capita). A nuanced modeling question arises: how to correct for censoring at capacity limits to avoid biased parameter estimates. Stadium capacity acts as an upper bound, requiring specialized econometric treatment. Difficulty rated 8/10 due to need for knowledge of limited dependent variable models.\n</document_analysis>\n\n<output_format>\nQuestion: In modeling World Cup final attendance as a function of host nation economic indicators and stadium capacity\u2014where attendance observations frequently reach the known capacity ceiling\u2014which econometric approach best accounts for this upper-limit censoring to produce unbiased coefficient estimates?\nA: Ordinary least squares regression with robust standard errors\nB: Poisson regression for count data\nC: Tobit (censored regression) model\nD: Fixed-effects panel regression\nExplanation: The Tobit model explicitly handles censoring at a known upper limit (stadium capacity), correcting bias from observations clustered at that ceiling.\nCorrect Answer: C\n</output_format>",
    "question": "In modeling World Cup final attendance as a function of host nation economic indicators and stadium capacity\u2014where attendance observations frequently reach the known capacity ceiling\u2014which econometric approach best accounts for this upper-limit censoring to produce unbiased coefficient estimates?",
    "choices": {
      "A": "Ordinary least squares regression with robust standard errors",
      "B": "Poisson regression for count data",
      "C": "Tobit (censored regression) model",
      "D": "Fixed-effects panel regression"
    },
    "answer": "C",
    "explanation": "The Tobit model explicitly handles censoring at a known upper limit (stadium capacity), correcting bias from observations clustered at that ceiling.",
    "question_token_count": 46,
    "answer_correctness_score": 10,
    "explanation_validity_score": 10,
    "question_clarity_score": 10,
    "question_difficulty_score": 8,
    "question_groundedness_score": 1,
    "avg_answer_token_count": 8
  },
  {
    "context": "<P> The seventh season of the fantasy drama television series Game of Thrones premiered on HBO on July 16 , 2017 , and concluded on August 27 , 2017 . Unlike previous seasons that consisted of ten episodes each , the seventh season consisted of only seven . Like the previous season , it largely consisted of original content not found in George R.R. Martin 's A Song of Ice and Fire series , while also adapting material Martin revealed to showrunners about the upcoming novels in the series . The series was adapted for television by David Benioff and D.B. Weiss . </P>",
    "topic": "Analysis of the programming strategy and industry context behind HBO\u2019s decision to premiere Game of Thrones Season 7 on July 16, 2017, and conclude it on August 27, 2017.",
    "response": "<document_analysis>\nThe context outlines that Game of Thrones Season 7 was unusually condensed to seven episodes airing weekly from mid\u2011July to late August, deviating from the series' standard ten\u2011episode, spring\u2011through\u2011early summer window. Key elements include a shortened run, a summer launch, and \u201cevent\u201d nature of original, high\u2011budget content. Implicitly, this reflects HBO\u2019s strategic use of premium event programming to bolster subscriber engagement during a typically low\u2011competition period. The question will probe the expert\u2019s understanding of TV network scheduling strategies, subscriber retention dynamics, and event\u2011television business models. Difficulty: 8/10.\n</document_analysis>\n\n<output_format>\nQuestion: Which programming strategy most directly explains HBO\u2019s choice to condense Game of Thrones Season 7 into seven weekly episodes airing from mid\u2011July to late August?\nA: Deliver high\u2011impact content during the summer lull to minimize subscriber churn when competitors air reruns.\nB: Align the finale with major fall network premieres to ride the broader TV season hype.\nC: Accelerate the adaptation process to finish before George R.R. Martin\u2019s next novel release.\nD: Synchronize episode drops with blockbuster film releases for cross\u2011promotional synergy.\nExplanation: By scheduling a concentrated, premium event series in the summer\u2014a period when most networks offer repeats\u2014HBO aimed to keep subscribers engaged and reduce churn in a low\u2011competition slot.\nCorrect Answer: A\n</output_format>",
    "question": "Which programming strategy most directly explains HBO\u2019s choice to condense Game of Thrones Season 7 into seven weekly episodes airing from mid\u2011July to late August?",
    "choices": {
      "A": "Deliver high\u2011impact content during the summer lull to minimize subscriber churn when competitors air reruns.",
      "B": "Align the finale with major fall network premieres to ride the broader TV season hype.",
      "C": "Accelerate the adaptation process to finish before George R.R. Martin\u2019s next novel release.",
      "D": "Synchronize episode drops with blockbuster film releases for cross\u2011promotional synergy."
    },
    "answer": "A",
    "explanation": "By scheduling a concentrated, premium event series in the summer\u2014a period when most networks offer repeats\u2014HBO aimed to keep subscribers engaged and reduce churn in a low\u2011competition slot.",
    "question_token_count": 33,
    "answer_correctness_score": 10,
    "explanation_validity_score": 10,
    "question_clarity_score": 1,
    "question_difficulty_score": 8,
    "question_groundedness_score": 4,
    "avg_answer_token_count": 18
  },
  {
    "context": "<P> The Battles of Lexington and Concord were the first military engagements of the American Revolutionary War . The battles were fought on April 19 , 1775 in Middlesex County , Province of Massachusetts Bay , within the towns of Lexington , Concord , Lincoln , Menotomy ( present - day Arlington ) , and Cambridge . They marked the outbreak of armed conflict between the Kingdom of Great Britain and its thirteen colonies in America . </P>",
    "topic": "Analyze the strategic importance of Middlesex County\u2019s geography on the British expedition to Lexington and Concord.",
    "response": "<document_analysis>\nThe context locates the April 19, 1775 expedition entirely within Middlesex County\u2019s towns, suggesting that the county\u2019s road network and terrain directly shaped both British movement and colonial resistance. Expert-level interrogation should probe how the mix of open fields and woodlots along the Boston\u2011to\u2011Concord road transformed a simple punitive march into a dispersed, guerrilla\u2011style engagement. The question focuses on identifying which geographic characteristic most influenced militia ambush tactics, requiring detailed knowledge of 18th\u2011century battlefield terrain in Middlesex County. Difficulty: 8/10.\n</document_analysis>\n\n<output_format>\nQuestion: How did the mix of open farmland and intermittent woodlots along the Boston\u2013Concord road in Middlesex County influence the British expedition of April 19, 1775, and the colonial militia\u2019s tactics?\nA: It allowed British troops to maintain tight formation over open terrain, preventing ambush.\nB: It provided the colonial militia with concealed firing positions in woodlots, enabling effective guerrilla tactics.\nC: The farmland\u2019s gentle slopes slowed the British long column, disrupting their timing.\nD: The patchwork terrain forced the British to split into small units to navigate marshy segments.\nExplanation: Colonial militias used the woodlots for cover, staging ambushes that turned a rapid advance into a running engagement.\nCorrect Answer: B\n</output_format>",
    "question": "How did the mix of open farmland and intermittent woodlots along the Boston\u2013Concord road in Middlesex County influence the British expedition of April 19, 1775, and the colonial militia\u2019s tactics?",
    "choices": {
      "A": "It allowed British troops to maintain tight formation over open terrain, preventing ambush.",
      "B": "It provided the colonial militia with concealed firing positions in woodlots, enabling effective guerrilla tactics.",
      "C": "The farmland\u2019s gentle slopes slowed the British long column, disrupting their timing.",
      "D": "The patchwork terrain forced the British to split into small units to navigate marshy segments."
    },
    "answer": "B",
    "explanation": "Colonial militias used the woodlots for cover, staging ambushes that turned a rapid advance into a running engagement.",
    "question_token_count": 45,
    "answer_correctness_score": 10,
    "explanation_validity_score": 10,
    "question_clarity_score": 8,
    "question_difficulty_score": 8,
    "question_groundedness_score": 2,
    "avg_answer_token_count": 18
  },
  {
    "context": "<P> The United States presidential line of succession is the order in which persons may become or act as President of the United States if the incumbent president becomes incapacitated , dies , resigns , or is removed from office ( by impeachment by the House of Representatives and subsequent conviction by the Senate ) . The line of succession is set by the United States Constitution and the Presidential Succession Act of 1947 as subsequently amended to include newly created cabinet offices . The succession follows the order of vice president , Speaker of the House of Representatives , President pro tempore of the Senate , and then the heads of federal executive departments who form the Cabinet of the United States . The Cabinet currently has fifteen members , beginning with the Secretary of State , and followed by the rest in the order of their positions ' creation . Those heads of department who are ineligible to act as president are also ineligible to succeed the president by succession , for example most commonly if they are not a natural - born U.S. citizen . </P>",
    "topic": "Amendments to the 1947 Succession Act and their effects on the Cabinet\u2019s succession order.",
    "response": "<document_analysis>\nThe context describes the U.S. presidential line of succession, noting that only the vice president is designated by the Constitution and that all subsequent successors\u2014the Speaker of the House, President pro tempore of the Senate, and Cabinet department heads\u2014are placed in order by the Presidential Succession Act of 1947 as amended. This distinction between constitutional and statutory authority is central and nontrivial. It allows us to probe an expert\u2019s understanding of the separation between constitutional text and legislative enactment in establishing the modern succession order.\n</document_analysis>\n\n<output_format>\nQuestion: Which of the following roles in the current presidential line of succession derive exclusively from statutory authority under the 1947 Act (as amended) rather than from the Constitution itself?\nA: Vice President and Speaker of the House  \nB: Speaker of the House, President pro tempore of the Senate, and Cabinet department heads  \nC: Vice President, Speaker of the House, and President pro tempore of the Senate  \nD: Cabinet department heads only  \nExplanation: The Constitution names only the vice president as a successor; the Speaker, President pro tempore, and all Cabinet officers were added by the Presidential Succession Act of 1947 and its subsequent amendments.  \nCorrect Answer: B\n</output_format>",
    "question": "Which of the following roles in the current presidential line of succession derive exclusively from statutory authority under the 1947 Act (as amended) rather than from the Constitution itself?",
    "choices": {
      "A": "Vice President and Speaker of the House",
      "B": "Speaker of the House, President pro tempore of the Senate, and Cabinet department heads",
      "C": "Vice President, Speaker of the House, and President pro tempore of the Senate",
      "D": "Cabinet department heads only"
    },
    "answer": "B",
    "explanation": "The Constitution names only the vice president as a successor; the Speaker, President pro tempore, and all Cabinet officers were added by the Presidential Succession Act of 1947 and its subsequent amendments.",
    "question_token_count": 35,
    "answer_correctness_score": 10,
    "explanation_validity_score": 10,
    "question_clarity_score": 8,
    "question_difficulty_score": 7,
    "question_groundedness_score": 6,
    "avg_answer_token_count": 12
  },
  {
    "context": "<P> `` Death and All His Friends '' is the season finale of the sixth season of the American television medical drama Grey 's Anatomy , and the show 's 126th episode overall . It was written by Shonda Rhimes and directed by Rob Corn . The episode was originally broadcast on the American Broadcasting Company ( ABC ) in the United States on May 20 , 2010 . The episode was the second part of the two - hour season six finale , the first being Sanctuary , and took place at the fictional Seattle Grace Hospital . The original episode broadcast in the United States had an audience of 16.13 million viewers and opened up to universal acclaim . The episode centers a shooting spree at the hospital by a former patient 's husband Gary Clark ( Michael O'Neill ) . The episode marked the last appearances for Nora Zehetner and Robert Baker as Dr. Reed Adamson and Dr. Charles Percy respectively as both the characters were killed in the shooting . </P>",
    "topic": "Examination of Shonda Rhimes\u2019s writing style, recurring themes, and character dynamics as showcased in the episode.",
    "response": "<document_analysis>\nThe context describes Shonda Rhimes\u2019s season six finale of Grey\u2019s Anatomy, featuring a high-stakes hospital shooting that culminates in the deaths of key characters. Central ideas include themes of life-and-death crises, sudden loss, and the emotional impact on medical professionals. The nuanced theme is how extreme external events are used to explore characters' vulnerabilities and relational dynamics under pressure. Implicit assumptions include Rhimes\u2019s pattern of intertwining medical emergencies with personal drama. For a domain expert question, I will probe how this episode exemplifies her signature narrative approach. Difficulty: 8/10\u2014requires synthesis of her broader writing style and themes in a specific episode.\n</document_analysis>\n\n<output_format>\nQuestion: In utilizing a hospital shooting that results in multiple character deaths during the season six finale, which hallmark of Shonda Rhimes\u2019s writing approach does this most clearly exemplify?\nA: The intertwining of life-and-death crises with deeply personal emotional arcs to foreground characters\u2019 vulnerabilities.\nB: The prioritization of romantic subplots as the primary catalyst for narrative tension.\nC: The maintenance of detached medical procedural realism at the expense of character-driven drama.\nD: The use of one-off antagonists solely to reinforce the ensemble\u2019s unity without emotional consequence.\nExplanation: The episode leverages a sudden, extreme crisis to expose and develop characters\u2019 inner lives and emotional resilience, a signature technique in Rhimes\u2019s narratives.\nCorrect Answer: A\n</output_format>",
    "question": "In utilizing a hospital shooting that results in multiple character deaths during the season six finale, which hallmark of Shonda Rhimes\u2019s writing approach does this most clearly exemplify?",
    "choices": {
      "A": "The intertwining of life-and-death crises with deeply personal emotional arcs to foreground characters\u2019 vulnerabilities.",
      "B": "The prioritization of romantic subplots as the primary catalyst for narrative tension.",
      "C": "The maintenance of detached medical procedural realism at the expense of character-driven drama.",
      "D": "The use of one-off antagonists solely to reinforce the ensemble\u2019s unity without emotional consequence."
    },
    "answer": "A",
    "explanation": "The episode leverages a sudden, extreme crisis to expose and develop characters\u2019 inner lives and emotional resilience, a signature technique in Rhimes\u2019s narratives.",
    "question_token_count": 36,
    "answer_correctness_score": 10,
    "explanation_validity_score": 10,
    "question_clarity_score": 6,
    "question_difficulty_score": 8,
    "question_groundedness_score": 6,
    "avg_answer_token_count": 18
  },
  {
    "context": "<P> I Can Only Imagine is a 2018 American Christian drama film directed by the Erwin Brothers and written by Alex Cramer , Jon Erwin , and Brent McCorkle , based on the story behind the MercyMe song of the same name , the best - selling Christian single of all time . The film stars J. Michael Finley as Bart Millard , the lead singer who wrote the song about his relationship with his father ( Dennis Quaid ) . Madeline Carroll , Priscilla Shirer , Cloris Leachman , and Trace Adkins also star . </P>",
    "topic": "The implications of marketing and classifying the film strictly as an American Christian drama for its distribution and critical reception.",
    "response": "<document_analysis>\nThe context describes the film\u2019s identity as an American Christian drama and hints at its basis in a massively successful Christian song and its appeal to faith audiences. While distribution and reception are not discussed explicitly, a domain expert can infer that faith-based classification channels marketing through religious networks, influences release patterns (e.g., church screenings, niche theaters), and shapes critical response, often polarizing secular and religious critics. These insights enable a question probing the strategic implications for distribution and reception.\n</document_analysis>\n\n<output_format>\nQuestion: What is the most likely consequence of marketing and classifying a film strictly as an American Christian drama in terms of its distribution strategy and critical reception?\nA: It ensures a broad international theatrical rollout and unanimous critical praise across all reviewer segments.\nB: It drives targeted release through faith-based venues and partnerships, resulting in strong audience turnout within religious communities but polarized reviews between secular and religious critics.\nC: It triggers additional rating scrutiny by the Motion Picture Association due to overt religious content, often leading to higher age restrictions.\nD: It largely prevents collaboration with church groups and inhibits specialty promotional screenings in religious settings.\nExplanation: Faith-based classification typically focuses distribution on church partnerships and niche venues, yielding high engagement with Christian audiences while provoking divided reactions among secular versus religious critics.\nCorrect Answer: B\n</output_format>",
    "question": "What is the most likely consequence of marketing and classifying a film strictly as an American Christian drama in terms of its distribution strategy and critical reception?",
    "choices": {
      "A": "It ensures a broad international theatrical rollout and unanimous critical praise across all reviewer segments.",
      "B": "It drives targeted release through faith-based venues and partnerships, resulting in strong audience turnout within religious communities but polarized reviews between secular and religious critics.",
      "C": "It triggers additional rating scrutiny by the Motion Picture Association due to overt religious content, often leading to higher age restrictions.",
      "D": "It largely prevents collaboration with church groups and inhibits specialty promotional screenings in religious settings."
    },
    "answer": "B",
    "explanation": "Faith-based classification typically focuses distribution on church partnerships and niche venues, yielding high engagement with Christian audiences while provoking divided reactions among secular versus religious critics.",
    "question_token_count": 29,
    "answer_correctness_score": 10,
    "explanation_validity_score": 10,
    "question_clarity_score": 6,
    "question_difficulty_score": 7,
    "question_groundedness_score": 2,
    "avg_answer_token_count": 22
  },
  {
    "context": "<P> The history of the Great Wall of China began when fortifications built by various states during the Spring and Autumn ( 771 -- 476 BC ) and Warring States periods ( 475 -- 221 BC ) were connected by the first emperor of China , Qin Shi Huang , to protect his newly founded Qin dynasty ( 221 -- 206 BC ) against incursions by nomads from Inner Asia . The walls were built of rammed earth , constructed using forced labour , and by 212 BC ran from Gansu to the coast of southern Manchuria . </P>",
    "topic": "Examine the geographical scope of the Qin dynasty\u2019s Great Wall\u2014from Gansu to southern Manchuria\u2014and analyze the logistical challenges posed by diverse terrains.",
    "response": "<document_analysis>\nThe context describes the Qin dynasty\u2019s Great Wall built of rammed earth from Gansu to southern Manchuria, highlighting both the huge geographic span and the use of locally available materials with forced labor. Critical insights include the immense logistical burden of transporting heavy building materials across varied and remote terrains, and how the choice of rammed earth construction directly mitigated that burden. This focus allows the formulation of a high-level, application-based question probing an expert\u2019s understanding of ancient logistics and material technology.\nDifficulty: 8/10\n</document_analysis>\n\n<output_format>\nQuestion: Considering the Qin dynasty\u2019s use of rammed earth for its Great Wall extending from Gansu to southern Manchuria, which logistical challenge was most directly mitigated by this construction method?\nA: The long\u2010distance transport of heavy building stone  \nB: The need for frost\u2010proof foundations in cold zones  \nC: The acquisition of vast timber supplies for scaffolding  \nD: The recruitment of skilled stonemasons for detailed carving  \nExplanation: Rammed earth construction relied on on\u2010site soils, drastically reducing the need to haul heavy stone over remote, rugged stretches.  \nCorrect Answer: A\n</output_format>",
    "question": "Considering the Qin dynasty\u2019s use of rammed earth for its Great Wall extending from Gansu to southern Manchuria, which logistical challenge was most directly mitigated by this construction method?",
    "choices": {
      "A": "The long\u2010distance transport of heavy building stone",
      "B": "The need for frost\u2010proof foundations in cold zones",
      "C": "The acquisition of vast timber supplies for scaffolding",
      "D": "The recruitment of skilled stonemasons for detailed carving"
    },
    "answer": "A",
    "explanation": "Rammed earth construction relied on on\u2010site soils, drastically reducing the need to haul heavy stone over remote, rugged stretches.",
    "question_token_count": 39,
    "answer_correctness_score": 10,
    "explanation_validity_score": 10,
    "question_clarity_score": 6,
    "question_difficulty_score": 7,
    "question_groundedness_score": 6,
    "avg_answer_token_count": 11
  },
  {
    "context": "<Table> <Tr> <Th> Year </Th> <Th> Round </Th> <Th> Position </Th> <Th> GP </Th> <Th> </Th> <Th> D * </Th> <Th> </Th> <Th> GF </Th> <Th> GA </Th> <Th> GD </Th> </Tr> <Tr> <Td> 1930 </Td> <Td colspan=\"9\"> Not a FIFA member </Td> </Tr> <Tr> <Td> 1934 </Td> </Tr> <Tr> <Td> 1938 </Td> </Tr> <Tr> <Td> 1950 </Td> <Td> Group stage </Td> <Td> 8th </Td> <Td> </Td> <Td> </Td> <Td> 0 </Td> <Td> </Td> <Td> </Td> <Td> </Td> <Td> 0 </Td> </Tr> <Tr> <Td> 1954 </Td> <Td> Quarter - finals </Td> <Td> 7th </Td> <Td> </Td> <Td> </Td> <Td> </Td> <Td> </Td> <Td> 8 </Td> <Td> 8 </Td> <Td> 0 </Td> </Tr> <Tr> <Td> 1958 </Td> <Td> Group stage </Td> <Td> 11th </Td> <Td> </Td> <Td> 0 </Td> <Td> </Td> <Td> </Td> <Td> </Td> <Td> 5 </Td> <Td> - 1 </Td> </Tr> <Tr> <Td> 1962 </Td> <Td> Quarter - finals </Td> <Td> 8th </Td> <Td> </Td> <Td> </Td> <Td> </Td> <Td> </Td> <Td> 5 </Td> <Td> 6 </Td> <Td> - 1 </Td> </Tr> <Tr> <Td> 1966 </Td> <Td> Champions </Td> <Td> 1st </Td> <Td> 6 </Td> <Td> 5 </Td> <Td> </Td> <Td> 0 </Td> <Td> 11 </Td> <Td> </Td> <Td> 8 </Td> </Tr> <Tr> <Td> 1970 </Td> <Td> Quarter - finals </Td> <Td> 8th </Td> <Td> </Td> <Td> </Td> <Td> 0 </Td> <Td> </Td> <Td> </Td> <Td> </Td> <Td> 0 </Td> </Tr> <Tr> <Td> </Td> <Td colspan=\"9\"> Did not qualify </Td> </Tr> <Tr> <Td> 1978 </Td> </Tr> <Tr> <Td> 1982 </Td> <Td> Second group stage </Td> <Td> 6th </Td> <Td> 5 </Td> <Td> </Td> <Td> </Td> <Td> 0 </Td> <Td> 6 </Td> <Td> </Td> <Td> 5 </Td> </Tr> <Tr> <Td> 1986 </Td> <Td> Quarter - finals </Td> <Td> 8th </Td> <Td> 5 </Td> <Td> </Td> <Td> </Td> <Td> </Td> <Td> 7 </Td> <Td> </Td> <Td> </Td> </Tr> <Tr> <Td> 1990 </Td> <Td> Semi finals </Td> <Td> 4th </Td> <Td> 7 </Td> <Td> </Td> <Td> </Td> <Td> </Td> <Td> 8 </Td> <Td> 6 </Td> <Td> </Td> </Tr> <Tr> <Td> 1994 </Td> <Td colspan=\"9\"> Did not qualify </Td> </Tr> <Tr> <Td> 1998 </Td> <Td> Round of 16 </Td> <Td> 9th </Td> <Td> </Td> <Td> </Td> <Td> </Td> <Td> </Td> <Td> 7 </Td> <Td> </Td> <Td> </Td> </Tr> <Tr> <Td> 2002 </Td> <Td> Quarter - finals </Td> <Td> 6th </Td> <Td> 5 </Td> <Td> </Td> <Td> </Td> <Td> </Td> <Td> 6 </Td> <Td> </Td> <Td> </Td> </Tr> <Tr> <Td> 2006 </Td> <Td> Quarter - finals </Td> <Td> 7th </Td> <Td> 5 </Td> <Td> </Td> <Td> </Td> <Td> 0 </Td> <Td> 6 </Td> <Td> </Td> <Td> </Td> </Tr> <Tr> <Td> </Td> <Td> Round of 16 </Td> <Td> 13th </Td> <Td> </Td> <Td> </Td> <Td> </Td> <Td> </Td> <Td> </Td> <Td> 5 </Td> <Td> - 2 </Td> </Tr> <Tr> <Td> 2014 </Td> <Td> Group stage </Td> <Td> 26th </Td> <Td> </Td> <Td> 0 </Td> <Td> </Td> <Td> </Td> <Td> </Td> <Td> </Td> <Td> - 2 </Td> </Tr> <Tr> <Td> 2018 </Td> <Td> Semi-finals </Td> <Td> 4th </Td> <Td> 7 </Td> <Td> </Td> <Td> </Td> <Td> </Td> <Td> 12 </Td> <Td> 8 </Td> <Td> </Td> </Tr> <Tr> <Td> 2022 </Td> <Td colspan=\"9\"> TBD </Td> </Tr> <Tr> <Td> 2026 </Td> </Tr> <Tr> <Th> Total </Th> <Th> 15 / 21 </Th> <Th> 1 title </Th> <Th> 69 </Th> <Th> 29 </Th> <Th> 21 </Th> <Th> 19 </Th> <Th> 91 </Th> <Th> 64 </Th> <Th> 27 </Th> </Tr> </Table>",
    "topic": "Discuss the implications of the team not being a FIFA member in 1930 and its absence in certain tournaments on their long\u2011term World Cup strategy.",
    "response": "<document_analysis>\nThe provided context is a tabular record of a national football team's FIFA World Cup participation history, starting with non-membership in 1930, subsequent participations, group/knockout round exits, a lone title in 1966, and intermittent failures to qualify. Central theme: the impact of early non-membership and sporadic absences on long-term tournament strategy and performance trends. Key insight: missing the first tournament likely limited early tactical exposure, influencing subsequent strategic planning, player development, and adaptability to evolving international playstyles.\n</document_analysis>\n\n<output_format>\nQuestion: How did the team\u2019s absence from the inaugural World Cup as a non-FIFA member in 1930, coupled with intermittent failures to qualify, most directly shape their long-term competitive strategy?\nA: It forced them to prioritize domestic league reform over tactical innovation.\nB: It delayed their exposure to evolving international tactics, slowing strategic adaptability.\nC: It improved their focus on youth development due to extended preparatory periods.\nD: It increased financial constraints, limiting investment in elite coaching staff.\nExplanation: By missing early tournaments, the team missed critical international tactical trends, which directly hindered their ability to adapt strategically in subsequent World Cups.\nCorrect Answer: B\n</output_format>",
    "question": "How did the team\u2019s absence from the inaugural World Cup as a non-FIFA member in 1930, coupled with intermittent failures to qualify, most directly shape their long-term competitive strategy?",
    "choices": {
      "A": "It forced them to prioritize domestic league reform over tactical innovation.",
      "B": "It delayed their exposure to evolving international tactics, slowing strategic adaptability.",
      "C": "It improved their focus on youth development due to extended preparatory periods.",
      "D": "It increased financial constraints, limiting investment in elite coaching staff."
    },
    "answer": "B",
    "explanation": "By missing early tournaments, the team missed critical international tactical trends, which directly hindered their ability to adapt strategically in subsequent World Cups.",
    "question_token_count": 39,
    "answer_correctness_score": 9,
    "explanation_validity_score": 9,
    "question_clarity_score": 4,
    "question_difficulty_score": 8,
    "question_groundedness_score": 2,
    "avg_answer_token_count": 13
  },
  {
    "context": "<P> The seventh season of the fantasy drama television series Game of Thrones premiered on HBO on July 16 , 2017 , and concluded on August 27 , 2017 . Unlike previous seasons that consisted of ten episodes each , the seventh season consisted of only seven . Like the previous season , it largely consisted of original content not found in George R.R. Martin 's A Song of Ice and Fire series , while also incorporating material Martin revealed to showrunners about the upcoming novels in the series . The series was adapted for television by David Benioff and D.B. Weiss . </P>",
    "topic": "Evaluate the adaptation strategies David Benioff and D.B. Weiss employed when diverging from existing source material.",
    "response": "<document_analysis>\n1. Central Idea: Season 7 shifted significantly away from published A Song of Ice and Fire content, employing both original storylines and author-conveyed future plot details.\n2. Nuanced Themes: Hybrid adaptation strategy\u2014balancing wholly new material with informed extrapolation from upcoming novels.\n3. Significant Relationship: The dual divergence\u2014addition of original content and integration of unpublished author insights\u2014reflects a deliberate choice rather than a simple fallback.\n4. Complexity Calibration: Difficulty level 7\u2014requires understanding of adaptation theory and the specific blend of creative strategies.\n5. Question Planning: Frame an analytical question asking which combination of approaches best characterizes Benioff and Weiss\u2019s divergence strategy, with plausible distractors targeting common misinterpretations (e.g., exclusive originality, strict fidelity, mere condensation).\n</document_analysis>\n\n<output_format>\nQuestion: What adaptation strategy did the showrunners employ in the seventh season when they moved beyond the published novels\u2019 material?\nA: They crafted entirely new plotlines without consulting any of the author\u2019s unpublished guidance.\nB: They stayed strictly faithful to only the books that had been published, ignoring future developments.\nC: They wove substantial original content together with narrative elements the author shared about forthcoming novels.\nD: They simply condensed all existing book storylines into fewer episodes without adding new material.\nExplanation: Season\u00a07 included original scenes not in the existing novels while also using Martin\u2019s revelations about his yet-unpublished books.\nCorrect Answer: C\n</output_format>",
    "question": "What adaptation strategy did the showrunners employ in the seventh season when they moved beyond the published novels\u2019 material?",
    "choices": {
      "A": "They crafted entirely new plotlines without consulting any of the author\u2019s unpublished guidance.",
      "B": "They stayed strictly faithful to only the books that had been published, ignoring future developments.",
      "C": "They wove substantial original content together with narrative elements the author shared about forthcoming novels.",
      "D": "They simply condensed all existing book storylines into fewer episodes without adding new material."
    },
    "answer": "C",
    "explanation": "Season\u00a07 included original scenes not in the existing novels while also using Martin\u2019s revelations about his yet-unpublished books.",
    "question_token_count": 24,
    "answer_correctness_score": 10,
    "explanation_validity_score": 10,
    "question_clarity_score": 4,
    "question_difficulty_score": 7,
    "question_groundedness_score": 3,
    "avg_answer_token_count": 17
  },
  {
    "context": "<P> The Pittsburgh Steelers ( 6 -- 2 ) have won the most Super Bowls with six championships , while the New England Patriots ( 5 -- 5 ) , the Dallas Cowboys ( 5 -- 3 ) , and the San Francisco 49ers ( 5 -- 1 ) have five wins . New England has the most Super Bowl appearances with ten , while the Buffalo Bills ( 0 -- 4 ) have the most consecutive appearances with four ( all losses ) from 1990 to 1993 . The Miami Dolphins are the only other team to have at least three consecutive appearances : 1972 -- 1974 . The Denver Broncos ( 3 -- 5 ) and Patriots have each lost a record five Super Bowls . The Minnesota Vikings ( 0 -- 4 ) and the Bills have lost four . The record for consecutive wins is two and is shared by seven franchises : the Green Bay Packers ( 1966 -- 1967 ) , the Miami Dolphins ( 1972 -- 1973 ) , the Pittsburgh Steelers ( 1974 -- 1975 and 1978 -- 1979 , the only team to accomplish this feat twice ) , the San Francisco 49ers ( 1988 -- 1989 ) , the Dallas Cowboys ( 1992 -- 1993 ) , the Denver Broncos ( 1997 -- 1998 ) , and the New England Patriots ( 2003 -- 2004 ) . Among those , Dallas ( 1992 -- 1993 ; 1995 ) and New England ( 2001 ; 2003 -- 2004 ) are the only teams to win three out of four consecutive Super Bowls . The 1972 Dolphins capped off the only perfect season in NFL history with their victory in Super Bowl VII . The only team with multiple Super Bowl appearances and no losses is the Baltimore Ravens , who in winning Super Bowl XLVII defeated and replaced the 49ers in that position . Four current NFL teams have never appeared in a Super Bowl , including franchise relocations and renaming : the Cleveland Browns , Detroit Lions , Jacksonville Jaguars , and Houston Texans , though both the Browns ( 1964 ) and Lions ( 1957 ) had won NFL championship games prior to the creation of the Super Bowl . </P>",
    "topic": "Examination of the Baltimore Ravens as the only franchise with multiple Super Bowl wins and zero losses, analyzing the role of defense and organizational culture.",
    "response": "<document_analysis>\nThe context provides detailed Super Bowl win\u2013loss records for various NFL franchises, highlighting that the Baltimore Ravens are the sole team with more than one appearance and zero losses. Other teams mentioned have at least one loss or fewer wins. This fact is both coherent and educationally valuable, allowing a question about perfect postseason performance among multi-appearance franchises. \nDifficulty calibration: 4/10 (requires synthesis of win\u2013loss data).\n</document_analysis>\n\n<output_format>\nQuestion: Which NFL franchise remains undefeated in the Super Bowl despite having appeared in more than one game?\nA: Pittsburgh Steelers  \nB: Miami Dolphins  \nC: San Francisco 49ers  \nD: Baltimore Ravens  \nExplanation: Only the Ravens have a 2\u20130 Super Bowl record, making them the only team with multiple appearances and no losses.  \nCorrect Answer: D  \n</output_format>",
    "question": "Which NFL franchise remains undefeated in the Super Bowl despite having appeared in more than one game?",
    "choices": {
      "A": "Pittsburgh Steelers",
      "B": "Miami Dolphins",
      "C": "San Francisco 49ers",
      "D": "Baltimore Ravens"
    },
    "answer": "D",
    "explanation": "Only the Ravens have a 2\u20130 Super Bowl record, making them the only team with multiple appearances and no losses.",
    "question_token_count": 20,
    "answer_correctness_score": 10,
    "explanation_validity_score": 10,
    "question_clarity_score": 9,
    "question_difficulty_score": 7,
    "question_groundedness_score": 10,
    "avg_answer_token_count": 4
  },
  {
    "context": "<P> The seventh season of the fantasy drama television series Game of Thrones premiered on HBO on July 16 , 2017 , and concluded on August 27 , 2017 . Unlike previous seasons that consisted of ten episodes each , the seventh season consisted of only seven . Like the previous season , it largely consisted of original content not found in George R.R. Martin 's A Song of Ice and Fire series , while also incorporating material Martin revealed to showrunners about the upcoming novels in the series . The series was adapted for television by David Benioff and D.B. Weiss . </P>",
    "topic": "Assess the risks and benefits of deviating from published text in long-running adaptations from both fan and critical perspectives.",
    "response": "<document_analysis>\nThe context describes the decision in Game of Thrones Season\u00a07 to introduce largely original content not present in the source novels, based on authorial hints about future books. This directly ties into the broader trade\u2010off in long\u2010running adaptations: creative freedom versus fidelity to the source. Central ideas include: (1) benefit\u2014expanding narrative beyond published material, (2) risk\u2014alienating fans and critics expecting source text alignment. Subtle inference: balancing author\u2010provided guidance versus published canon. The planned question will ask for a distilled benefit\u2010risk pairing emblematic of this tension, challenging experts to concisely articulate both sides.\nDifficulty rating: 8/10\n</document_analysis>\n\n<output_format>\nQuestion: Which succinctly encapsulates a primary benefit and a corresponding risk when a long\u2010running adaptation introduces original content beyond its published source?\nA: It accelerates production pace but reduces fan engagement.\nB: It ensures narrative cohesion but limits character depth.\nC: It broadens creative scope yet can undermine authorial authenticity.\nD: It streamlines plot complexity but heightens thematic ambiguity.\nExplanation: Introducing new material allows creative expansion (broadened scope) while risking departure from the author\u2019s established voice and expectations (undermined authenticity).\nCorrect Answer: C\n</output_format>",
    "question": "Which succinctly encapsulates a primary benefit and a corresponding risk when a long\u2010running adaptation introduces original content beyond its published source?",
    "choices": {
      "A": "It accelerates production pace but reduces fan engagement.",
      "B": "It ensures narrative cohesion but limits character depth.",
      "C": "It broadens creative scope yet can undermine authorial authenticity.",
      "D": "It streamlines plot complexity but heightens thematic ambiguity."
    },
    "answer": "C",
    "explanation": "Introducing new material allows creative expansion (broadened scope) while risking departure from the author\u2019s established voice and expectations (undermined authenticity).",
    "question_token_count": 27,
    "answer_correctness_score": 10,
    "explanation_validity_score": 10,
    "question_clarity_score": 6,
    "question_difficulty_score": 7,
    "question_groundedness_score": 4,
    "avg_answer_token_count": 11
  },
  {
    "context": "<P> The 2017 NFL season is the 98th and current season in the history of the National Football League ( NFL ) . The season began on September 7 , 2017 , with the Kansas City Chiefs defeating the defending Super Bowl LI champion New England Patriots 42 -- 27 in the NFL Kickoff Game . The season will conclude with Super Bowl LII , the league 's championship game , on February 4 , 2018 , at U.S. Bank Stadium in Minneapolis , Minnesota . </P>",
    "topic": "Evaluate the strategic and psychological impact of the Kansas City Chiefs\u2019 42\u201327 victory over the defending champion New England Patriots in the 2017 Kickoff Game.",
    "response": "<document_analysis>\nThe context describes the 2017 NFL season opener where the Kansas City Chiefs defeated the defending Super Bowl LI champion New England Patriots 42\u201327. The key strategic and psychological elements involve undermining the Patriots' perceived invincibility and boosting the Chiefs' confidence while reshaping league perceptions. Though brief, the text\u2019s reference to a high\u2010profile upset allows a question probing how that outcome altered psychological dynamics league\u2010wide.\n</document_analysis>\n\n<output_format>\nQuestion: In strategic and psychological terms, what was the most significant ripple effect of Kansas City\u2019s 42\u201327 season\u2011opening upset of the defending champion Patriots?\nA: It cemented Alex Smith\u2019s status as an elite clutch quarterback capable of consistently winning shootouts.\nB: It forced Bill Belichick to radically shift the Patriots\u2019 defensive front to a 3\u20134 alignment for the remainder of the season.\nC: It dispelled New England\u2019s aura of invincibility, encouraging other teams to adopt more aggressive game plans against them.\nD: It exposed a fatal flaw in the Patriots\u2019 short\u2011yardage package that remained unaddressed through the playoffs.\nExplanation: The unexpected victory most profoundly shattered the Patriots\u2019 perceived invincibility, emboldening rivals to attack New England more aggressively. \nCorrect Answer: C\n</output_format>",
    "question": "In strategic and psychological terms, what was the most significant ripple effect of Kansas City\u2019s 42\u201327 season\u2011opening upset of the defending champion Patriots?",
    "choices": {
      "A": "It cemented Alex Smith\u2019s status as an elite clutch quarterback capable of consistently winning shootouts.",
      "B": "It forced Bill Belichick to radically shift the Patriots\u2019 defensive front to a 3\u20134 alignment for the remainder of the season.",
      "C": "It dispelled New England\u2019s aura of invincibility, encouraging other teams to adopt more aggressive game plans against them.",
      "D": "It exposed a fatal flaw in the Patriots\u2019 short\u2011yardage package that remained unaddressed through the playoffs."
    },
    "answer": "C",
    "explanation": "The unexpected victory most profoundly shattered the Patriots\u2019 perceived invincibility, emboldening rivals to attack New England more aggressively.",
    "question_token_count": 32,
    "answer_correctness_score": 9,
    "explanation_validity_score": 9,
    "question_clarity_score": 4,
    "question_difficulty_score": 7,
    "question_groundedness_score": 2,
    "avg_answer_token_count": 24
  },
  {
    "context": "<P> Darci Lynne Farmer was named the winner on the season finale , September 20 , 2017 . She was the third ventriloquist , third child and third female to win a season of America 's Got Talent. 10 - year - old singer Angelica Hale placed second , and glow light dance troupe Light Balance came in third . Farmer won the show 's prize of $1 million and a headlining performance in Las Vegas . </P>",
    "topic": "Darci Lynne Farmer\u2019s victory and the significance of her being the third ventriloquist to win AGT.",
    "response": "<document_analysis>\nThe context outlines Darci Lynne Farmer\u2019s win on America\u2019s Got Talent: she was the third ventriloquist, third child, and third female winner; runner-up was a 10-year-old singer, and third place went to a glow light dance troupe. The central relationship is the recurrence of \u201cthird\u201d across three performer categories. Meaningful content supports a recall/inference question on these classifications. Although straightforward, the subtlety lies in identifying all three correct categories among plausible distractors. Difficulty is calibrated at 6/10, testing precise recall under possible confusion with other performer types.\n</document_analysis>\n\n<output_format>\nQuestion: Darci Lynne Farmer\u2019s victory on America\u2019s Got Talent placed her as the third winner in which combination of performer classifications?\nA: Ventriloquist, child, female  \nB: Magician, teenager, group  \nC: Singer, adult, solo act  \nD: Dancer, male, duo  \nExplanation: She was explicitly noted as the third ventriloquist, third child, and third female to win.  \nCorrect Answer: A  \n</output_format>",
    "question": "Darci Lynne Farmer\u2019s victory on America\u2019s Got Talent placed her as the third winner in which combination of performer classifications?",
    "choices": {
      "A": "Ventriloquist, child, female",
      "B": "Magician, teenager, group",
      "C": "Singer, adult, solo act",
      "D": "Dancer, male, duo"
    },
    "answer": "A",
    "explanation": "She was explicitly noted as the third ventriloquist, third child, and third female to win.",
    "question_token_count": 26,
    "answer_correctness_score": 10,
    "explanation_validity_score": 10,
    "question_clarity_score": 4,
    "question_difficulty_score": 6,
    "question_groundedness_score": 10,
    "avg_answer_token_count": 7
  },
  {
    "context": "<P> The College Football Playoff selection committee chose the semifinalists following the conclusion of the 2017 regular season . Alabama and Georgia advanced to the national championship after winning the semifinal games hosted by the Sugar Bowl and the Rose Bowl , respectively , on January 1 , 2018 . The championship game was played at Mercedes - Benz Stadium in Atlanta , Georgia on January 8 , 2018 . </P>",
    "topic": "Examination of the historical significance of assigning Sugar Bowl and Rose Bowl as CFP semifinals in the 2017 season",
    "response": "<document_analysis>\n1. The context specifies that the Sugar Bowl and the Rose Bowl hosted the 2017 College Football Playoff semifinals on January\u00a01, 2018, signaling a deliberate scheduling choice.\n2. Implicitly, this choice reflects the CFP\u2019s design to integrate historic New Year\u2019s Day bowls into the playoff structure, maintaining their marquee status through a rotational hosting model, rather than an arbitrary or conference\u2011tie-in decision.\n3. Difficulty is rated 8/10: gauging this requires expert knowledge of the CFP\u2019s rotational system, historical bowl prestige, and the philosophy of preserving tradition within a modern playoff.\n4. The question will probe understanding of how this assignment exemplifies the CFP\u2019s broader strategy of honoring bowl traditions via rotation.\n</document_analysis>\n\n<output_format>\nQuestion: In the College Football Playoff\u2019s structural design, what primary function did the assignment of the 2017 semifinals to the Sugar Bowl and the Rose Bowl serve?  \nA: It preserved the status of historic New Year\u2019s Day bowls as marquee semifinal venues through a rotational scheduling model.  \nB: It re\u2011established traditional SEC and Big Ten conference tie\u2011ins by ensuring their champions played those specific bowl games.  \nC: It allowed the CFP committee to evaluate the feasibility of hosting future playoff games in newly opened stadiums.  \nD: It balanced travel and economic impacts by mandating alternating semifinal sites between eastern and western regions.  \nExplanation: The CFP rotates six major bowls to host semifinals each year, ensuring that storied New Year\u2019s Day games retain their premier role within the playoff system.  \nCorrect Answer: A\n</output_format>",
    "question": "In the College Football Playoff\u2019s structural design, what primary function did the assignment of the 2017 semifinals to the Sugar Bowl and the Rose Bowl serve?",
    "choices": {
      "A": "It preserved the status of historic New Year\u2019s Day bowls as marquee semifinal venues through a rotational scheduling model.",
      "B": "It re\u2011established traditional SEC and Big Ten conference tie\u2011ins by ensuring their champions played those specific bowl games.",
      "C": "It allowed the CFP committee to evaluate the feasibility of hosting future playoff games in newly opened stadiums.",
      "D": "It balanced travel and economic impacts by mandating alternating semifinal sites between eastern and western regions."
    },
    "answer": "A",
    "explanation": "The CFP rotates six major bowls to host semifinals each year, ensuring that storied New Year\u2019s Day games retain their premier role within the playoff system.",
    "question_token_count": 34,
    "answer_correctness_score": 10,
    "explanation_validity_score": 10,
    "question_clarity_score": 2,
    "question_difficulty_score": 8,
    "question_groundedness_score": 2,
    "avg_answer_token_count": 22
  },
  {
    "context": "<Table> Dates for Easter in the past and coming 20 years ( 1998 -- 2038 in Gregorian dates ) <Tr> <Th> Year </Th> <Th> Western </Th> <Th> Eastern </Th> </Tr> <Tr> <Th> 1998 </Th> <Td colspan=\"1\"> April 12 </Td> <Td> April 19 </Td> </Tr> <Tr> <Th> 1999 </Th> <Td colspan=\"1\"> April 4 </Td> <Td> April 11 </Td> </Tr> <Tr> <Th> 2000 </Th> <Td colspan=\"1\"> April 23 </Td> <Td> April 30 </Td> </Tr> <Tr> <Th> </Th> <Td colspan=\"2\"> April 15 </Td> </Tr> <Tr> <Th> 2002 </Th> <Td colspan=\"1\"> March 31 </Td> <Td> May 5 </Td> </Tr> <Tr> <Th> 2003 </Th> <Td colspan=\"1\"> April 20 </Td> <Td> April 27 </Td> </Tr> <Tr> <Th> </Th> <Td colspan=\"2\"> April 11 </Td> </Tr> <Tr> <Th> 2005 </Th> <Td colspan=\"1\"> March 27 </Td> <Td> May 1 </Td> </Tr> <Tr> <Th> 2006 </Th> <Td colspan=\"1\"> April 16 </Td> <Td> April 23 </Td> </Tr> <Tr> <Th> 2007 </Th> <Td colspan=\"2\"> April 8 </Td> </Tr> <Tr> <Th> 2008 </Th> <Td colspan=\"1\"> March 23 </Td> <Td> April 27 </Td> </Tr> <Tr> <Th> 2009 </Th> <Td colspan=\"1\"> April 12 </Td> <Td> April 19 </Td> </Tr> <Tr> <Th> </Th> <Td colspan=\"2\"> April 4 </Td> </Tr> <Tr> <Th> 2011 </Th> <Td colspan=\"2\"> April 24 </Td> </Tr> <Tr> <Th> 2012 </Th> <Td colspan=\"1\"> April 8 </Td> <Td> April 15 </Td> </Tr> <Tr> <Th> 2013 </Th> <Td colspan=\"1\"> March 31 </Td> <Td> May 5 </Td> </Tr> <Tr> <Th> 2014 </Th> <Td colspan=\"2\"> April 20 </Td> </Tr> <Tr> <Th> 2015 </Th> <Td colspan=\"1\"> April 5 </Td> <Td> April 12 </Td> </Tr> <Tr> <Th> 2016 </Th> <Td colspan=\"1\"> March 27 </Td> <Td> May 1 </Td> </Tr> <Tr> <Th> 2017 </Th> <Td colspan=\"2\"> April 16 </Td> </Tr> <Tr> <Th> 2018 </Th> <Td colspan=\"1\"> April 1 </Td> <Td> April 8 </Td> </Tr> <Tr> <Th> 2019 </Th> <Td colspan=\"1\"> April 21 </Td> <Td> April 28 </Td> </Tr> <Tr> <Th> 2020 </Th> <Td colspan=\"1\"> April 12 </Td> <Td> April 19 </Td> </Tr> <Tr> <Th> 2021 </Th> <Td colspan=\"1\"> April 4 </Td> <Td> May 2 </Td> </Tr> <Tr> <Th> 2022 </Th> <Td colspan=\"1\"> April 17 </Td> <Td> April 24 </Td> </Tr> <Tr> <Th> 2023 </Th> <Td colspan=\"1\"> April 9 </Td> <Td> April 16 </Td> </Tr> <Tr> <Th> 2024 </Th> <Td colspan=\"1\"> March 31 </Td> <Td> May 5 </Td> </Tr> <Tr> <Th> 2025 </Th> <Td colspan=\"2\"> April 20 </Td> </Tr> <Tr> <Th> 2026 </Th> <Td colspan=\"1\"> April 5 </Td> <Td> April 12 </Td> </Tr> <Tr> <Th> 2027 </Th> <Td colspan=\"1\"> March 28 </Td> <Td> May 2 </Td> </Tr> <Tr> <Th> 2028 </Th> <Td colspan=\"2\"> April 16 </Td> </Tr> <Tr> <Th> 2029 </Th> <Td colspan=\"1\"> April 1 </Td> <Td> April 8 </Td> </Tr> <Tr> <Th> 2030 </Th> <Td colspan=\"1\"> April 21 </Td> <Td> April 28 </Td> </Tr> <Tr> <Th> 2031 </Th> <Td colspan=\"2\"> April 13 </Td> </Tr> <Tr> <Th> 2032 </Th> <Td colspan=\"1\"> March 28 </Td> <Td> May 2 </Td> </Tr> <Tr> <Th> 2033 </Th> <Td colspan=\"1\"> April 17 </Td> <Td> April 24 </Td> </Tr> <Tr> <Th> 2034 </Th> <Td colspan=\"2\"> April 9 </Td> </Tr> <Tr> <Th> 2035 </Th> <Td colspan=\"1\"> March 25 </Td> <Td> April 29 </Td> </Tr> <Tr> <Th> 2036 </Th> <Td colspan=\"1\"> April 13 </Td> <Td> April 20 </Td> </Tr> <Tr> <Th> 2037 </Th> <Td colspan=\"2\"> April 5 </Td> </Tr> <Tr> <Th> 2038 </Th> <Td colspan=\"2\"> April 25 </Td> </Tr> </Table>",
    "topic": "The astronomical role of the vernal equinox and the Paschal full moon in fixing Easter\u2019s date.",
    "response": "<document_analysis>\nThe provided context is a table of Western and Eastern Easter dates (1998\u20132038). Although it lacks explicit discussion of the vernal equinox or Paschal full moon, the table allows inference of the range of Western Easter relative to the ecclesiastical vernal equinox (fixed at March\u00a021). The earliest Western Easter date in this span is March\u00a023\u00a0(2008) and the latest is April\u00a025\u00a0(2038), corresponding to 2 and 35 days after March\u00a021, respectively. This inference links the data to the astronomical rule governing Easter\u2019s bounds without requiring external details.\n</document_analysis>\n\n<output_format>\nQuestion: Analyzing the Western Easter dates from 1998 to 2038, what is the empirically observed minimum and maximum number of days after the ecclesiastical vernal equinox (March\u00a021) on which Easter has occurred in this period?\nA: 1 day and 35 days  \nB: 2 days and 33 days  \nC: 2 days and 35 days  \nD: 3 days and 34 days  \nExplanation: The earliest Western Easter fell on March\u00a023 (2 days after March\u00a021) and the latest on April\u00a025 (35 days after March\u00a021).  \nCorrect Answer: C\n</output_format>",
    "question": "Analyzing the Western Easter dates from 1998 to 2038, what is the empirically observed minimum and maximum number of days after the ecclesiastical vernal equinox (March\u00a021) on which Easter has occurred in this period?",
    "choices": {
      "A": "1 day and 35 days",
      "B": "2 days and 33 days",
      "C": "2 days and 35 days",
      "D": "3 days and 34 days"
    },
    "answer": "C",
    "explanation": "The earliest Western Easter fell on March\u00a023 (2 days after March\u00a021) and the latest on April\u00a025 (35 days after March\u00a021).",
    "question_token_count": 50,
    "answer_correctness_score": 10,
    "explanation_validity_score": 10,
    "question_clarity_score": 8,
    "question_difficulty_score": 6,
    "question_groundedness_score": 10,
    "avg_answer_token_count": 7
  },
  {
    "context": "<P> Darci Lynne Farmer was named the winner on the season finale , September 20 , 2017 . She was the third ventriloquist , third child and third female to win a season of America 's Got Talent. 10 - year - old singer Angelica Hale placed second , and glow light dance troupe Light Balance came in third . Farmer won the show 's prize of $1 million and a headlining performance in Las Vegas . </P>",
    "topic": "The structure and components of the AGT winner\u2019s prize, including the $1 million award and Las Vegas headlining contract.",
    "response": "<document_analysis>\nThe context outlines that America\u2019s Got Talent awards its winner both a lump-sum cash prize and a Las Vegas headlining performance contract. Key points for deeper inquiry include strategic reasoning behind pairing a residency with a monetary award and its operational implications for producers versus alternative prize structures (e.g., tours). A question probing why a Las Vegas residency is chosen over a touring contract will challenge domain experts on live-event logistics, cost management, and strategic risk mitigation.\n</document_analysis>\n\n<output_format>\nQuestion: Considering production and financial risk optimization in televised talent competitions, why is a Las Vegas headlining residency contract typically more advantageous for producers than a touring contract?\nA: It centralizes performance operations in a single venue, reducing logistical and production costs.\nB: It attracts a more diverse national audience demographic than a multi-city tour.\nC: It qualifies the winner for additional international broadcasting rights specific to Las Vegas.\nD: It guarantees immediate recoupment of the show\u2019s production expenses upon signing.\nExplanation: A single-venue residency consolidates logistics, staffing, and marketing, significantly lowering variable costs compared to coordinating a tour across multiple locations.\nCorrect Answer: A\n</output_format>",
    "question": "Considering production and financial risk optimization in televised talent competitions, why is a Las Vegas headlining residency contract typically more advantageous for producers than a touring contract?",
    "choices": {
      "A": "It centralizes performance operations in a single venue, reducing logistical and production costs.",
      "B": "It attracts a more diverse national audience demographic than a multi-city tour.",
      "C": "It qualifies the winner for additional international broadcasting rights specific to Las Vegas.",
      "D": "It guarantees immediate recoupment of the show\u2019s production expenses upon signing."
    },
    "answer": "A",
    "explanation": "A single-venue residency consolidates logistics, staffing, and marketing, significantly lowering variable costs compared to coordinating a tour across multiple locations.",
    "question_token_count": 32,
    "answer_correctness_score": 10,
    "explanation_validity_score": 10,
    "question_clarity_score": 2,
    "question_difficulty_score": 8,
    "question_groundedness_score": 1,
    "avg_answer_token_count": 16
  },
  {
    "context": "<Table> <Tr> <Th> Player </Th> <Th> Salary </Th> <Th> Team </Th> </Tr> <Tr> <Td> Stephen Curry </Td> <Td> $34,682,550 </Td> <Td> Golden State Warriors </Td> </Tr> <Tr> <Td> LeBron James </Td> <Td> $33,285,709 </Td> <Td> Cleveland Cavaliers </Td> </Tr> <Tr> <Td> Paul Millsap </Td> <Td> $31,269,231 </Td> <Td> Denver Nuggets </Td> </Tr> <Tr> <Td> Gordon Hayward </Td> <Td> $29,727,900 </Td> <Td> Boston Celtics </Td> </Tr> <Tr> <Td> Blake Griffin </Td> <Td> $29,512,900 </Td> <Td> Los Angeles Clippers </Td> </Tr> <Tr> <Td> Kyle Lowry </Td> <Td> $28,703,704 </Td> <Td> Toronto Raptors </Td> </Tr> <Tr> <Td> Russell Westbrook </Td> <Td> $28,530,608 </Td> <Td> Oklahoma City Thunder </Td> </Tr> <Tr> <Td> Mike Conley , Jr . </Td> <Td> $28,530,608 </Td> <Td> Memphis Grizzlies </Td> </Tr> <Tr> <Td> James Harden </Td> <Td> $28,299,399 </Td> <Td> Houston Rockets </Td> </Tr> <Tr> <Td> DeMar DeRozan </Td> <Td> $27,739,975 </Td> <Td> Toronto Raptors </Td> </Tr> </Table>",
    "topic": "Critically assess how guaranteed contract provisions versus performance bonuses could affect the salary figures listed in this table.",
    "response": "<document_analysis>\nThe context provides a table of NBA player salaries, which typically reflect each player\u2019s guaranteed base salary for the season and exclude non-guaranteed performance bonuses. Key concepts include guaranteed contract provisions versus performance-based incentives (likely\u2010to\u2010be\u2010earned and unlikely\u2010to\u2010be\u2010earned), and how inclusion or exclusion of these incentives would alter reported figures and actual earnings. For a deep domain question, we must probe understanding of NBA salary reporting conventions and incentive classifications, requiring expert knowledge of the CBA rules on incentive counting. Difficulty: 9/10.\n</document_analysis>\n\n<output_format>\nQuestion: Considering NBA salary reporting conventions, what would happen to the listed salary figures if a player were to achieve all performance bonuses in his contract?\nA: The reported figures would remain unchanged because they reflect only guaranteed base salary and do not include any incentives.\nB: The figures would automatically increase to reflect the full value of earned performance bonuses.\nC: The reported salaries would rise by the total of likely\u2010to\u2010be\u2010earned incentives but still exclude unlikely\u2010to\u2010be\u2010earned bonuses.\nD: The figures would decrease, since bonuses are deducted from the base salary after achievement.\n\nExplanation: The listed salaries reflect only guaranteed base contracts; achievement of incentives does not retroactively alter reported salary figures in standard NBA reporting.\nCorrect Answer: A\n</output_format>",
    "question": "Considering NBA salary reporting conventions, what would happen to the listed salary figures if a player were to achieve all performance bonuses in his contract?",
    "choices": {
      "A": "The reported figures would remain unchanged because they reflect only guaranteed base salary and do not include any incentives.",
      "B": "The figures would automatically increase to reflect the full value of earned performance bonuses.",
      "C": "The reported salaries would rise by the total of likely\u2010to\u2010be\u2010earned incentives but still exclude unlikely\u2010to\u2010be\u2010earned bonuses.",
      "D": "The figures would decrease, since bonuses are deducted from the base salary after achievement."
    },
    "answer": "A",
    "explanation": "The listed salaries reflect only guaranteed base contracts; achievement of incentives does not retroactively alter reported salary figures in standard NBA reporting.",
    "question_token_count": 28,
    "answer_correctness_score": 10,
    "explanation_validity_score": 10,
    "question_clarity_score": 6,
    "question_difficulty_score": 7,
    "question_groundedness_score": 2,
    "avg_answer_token_count": 21
  },
  {
    "context": "<P> Earth 's orbit is the trajectory along which Earth travels around the Sun . The average distance between the Earth and the Sun is 149.60 million km ( 92.96 million mi ) , and one complete orbit takes 365.256 days ( 1 sidereal year ) , during which time Earth has traveled 940 million km ( 584 million mi ) . Earth 's orbit has an eccentricity of 0.0167 . </P>",
    "topic": "Distinction between a sidereal year (365.256 days) and a tropical year, and its implications for calendar design.",
    "response": "<document_analysis>\nThe context provides the definition and duration of a sidereal year (365.256 days) and basic orbital parameters but does not explicitly discuss the tropical year or the mechanism behind the difference. However, a deep domain question can be formulated on the core topic\u2014why the tropical year is shorter\u2014leveraging expert knowledge of precession of equinoxes. This question requires integration of the given sidereal year concept with advanced understanding of Earth\u2019s axial precession and its impact on calendar design.\n</document_analysis>\n\n<output_format>\nQuestion: Which astronomical phenomenon causes the tropical year to be about 20 minutes shorter than the sidereal year when designing a solar calendar?\nA: The eccentricity-driven variation in Earth\u2019s orbital speed  \nB: The precession of the line of apsides (apsidal precession)  \nC: The axial precession of the equinoxes  \nD: The slow change in Earth\u2019s axial tilt (obliquity cycle)  \nExplanation: The axial precession of Earth\u2019s rotational axis shifts the equinox points backward along the ecliptic, making the interval between successive vernal equinoxes (the tropical year) slightly shorter than the sidereal orbital period.  \nCorrect Answer: C\n</output_format>",
    "question": "Which astronomical phenomenon causes the tropical year to be about 20 minutes shorter than the sidereal year when designing a solar calendar?",
    "choices": {
      "A": "The eccentricity-driven variation in Earth\u2019s orbital speed",
      "B": "The precession of the line of apsides (apsidal precession)",
      "C": "The axial precession of the equinoxes",
      "D": "The slow change in Earth\u2019s axial tilt (obliquity cycle)"
    },
    "answer": "C",
    "explanation": "The axial precession of Earth\u2019s rotational axis shifts the equinox points backward along the ecliptic, making the interval between successive vernal equinoxes (the tropical year) slightly shorter than the sidereal orbital period.",
    "question_token_count": 26,
    "answer_correctness_score": 10,
    "explanation_validity_score": 10,
    "question_clarity_score": 8,
    "question_difficulty_score": 9,
    "question_groundedness_score": 1,
    "avg_answer_token_count": 12
  },
  {
    "context": "<Table> Dates for Easter in the past and coming 20 years ( 1998 -- 2038 in Gregorian dates ) <Tr> <Th> Year </Th> <Th> Western </Th> <Th> Eastern </Th> </Tr> <Tr> <Th> 1998 </Th> <Td colspan=\"1\"> April 12 </Td> <Td> April 19 </Td> </Tr> <Tr> <Th> 1999 </Th> <Td colspan=\"1\"> April 4 </Td> <Td> April 11 </Td> </Tr> <Tr> <Th> 2000 </Th> <Td colspan=\"1\"> April 23 </Td> <Td> April 30 </Td> </Tr> <Tr> <Th> </Th> <Td colspan=\"2\"> April 15 </Td> </Tr> <Tr> <Th> 2002 </Th> <Td colspan=\"1\"> March 31 </Td> <Td> May 5 </Td> </Tr> <Tr> <Th> 2003 </Th> <Td colspan=\"1\"> April 20 </Td> <Td> April 27 </Td> </Tr> <Tr> <Th> </Th> <Td colspan=\"2\"> April 11 </Td> </Tr> <Tr> <Th> 2005 </Th> <Td colspan=\"1\"> March 27 </Td> <Td> May 1 </Td> </Tr> <Tr> <Th> 2006 </Th> <Td colspan=\"1\"> April 16 </Td> <Td> April 23 </Td> </Tr> <Tr> <Th> 2007 </Th> <Td colspan=\"2\"> April 8 </Td> </Tr> <Tr> <Th> 2008 </Th> <Td colspan=\"1\"> March 23 </Td> <Td> April 27 </Td> </Tr> <Tr> <Th> 2009 </Th> <Td colspan=\"1\"> April 12 </Td> <Td> April 19 </Td> </Tr> <Tr> <Th> </Th> <Td colspan=\"2\"> April 4 </Td> </Tr> <Tr> <Th> 2011 </Th> <Td colspan=\"2\"> April 24 </Td> </Tr> <Tr> <Th> 2012 </Th> <Td colspan=\"1\"> April 8 </Td> <Td> April 15 </Td> </Tr> <Tr> <Th> 2013 </Th> <Td colspan=\"1\"> March 31 </Td> <Td> May 5 </Td> </Tr> <Tr> <Th> 2014 </Th> <Td colspan=\"2\"> April 20 </Td> </Tr> <Tr> <Th> 2015 </Th> <Td colspan=\"1\"> April 5 </Td> <Td> April 12 </Td> </Tr> <Tr> <Th> 2016 </Th> <Td colspan=\"1\"> March 27 </Td> <Td> May 1 </Td> </Tr> <Tr> <Th> 2017 </Th> <Td colspan=\"2\"> April 16 </Td> </Tr> <Tr> <Th> 2018 </Th> <Td colspan=\"1\"> April 1 </Td> <Td> April 8 </Td> </Tr> <Tr> <Th> 2019 </Th> <Td colspan=\"1\"> April 21 </Td> <Td> April 28 </Td> </Tr> <Tr> <Th> 2020 </Th> <Td colspan=\"1\"> April 12 </Td> <Td> April 19 </Td> </Tr> <Tr> <Th> 2021 </Th> <Td colspan=\"1\"> April 4 </Td> <Td> May 2 </Td> </Tr> <Tr> <Th> 2022 </Th> <Td colspan=\"1\"> April 17 </Td> <Td> April 24 </Td> </Tr> <Tr> <Th> 2023 </Th> <Td colspan=\"1\"> April 9 </Td> <Td> April 16 </Td> </Tr> <Tr> <Th> 2024 </Th> <Td colspan=\"1\"> March 31 </Td> <Td> May 5 </Td> </Tr> <Tr> <Th> 2025 </Th> <Td colspan=\"2\"> April 20 </Td> </Tr> <Tr> <Th> 2026 </Th> <Td colspan=\"1\"> April 5 </Td> <Td> April 12 </Td> </Tr> <Tr> <Th> 2027 </Th> <Td colspan=\"1\"> March 28 </Td> <Td> May 2 </Td> </Tr> <Tr> <Th> 2028 </Th> <Td colspan=\"2\"> April 16 </Td> </Tr> <Tr> <Th> 2029 </Th> <Td colspan=\"1\"> April 1 </Td> <Td> April 8 </Td> </Tr> <Tr> <Th> 2030 </Th> <Td colspan=\"1\"> April 21 </Td> <Td> April 28 </Td> </Tr> <Tr> <Th> 2031 </Th> <Td colspan=\"2\"> April 13 </Td> </Tr> <Tr> <Th> 2032 </Th> <Td colspan=\"1\"> March 28 </Td> <Td> May 2 </Td> </Tr> <Tr> <Th> 2033 </Th> <Td colspan=\"1\"> April 17 </Td> <Td> April 24 </Td> </Tr> <Tr> <Th> 2034 </Th> <Td colspan=\"2\"> April 9 </Td> </Tr> <Tr> <Th> 2035 </Th> <Td colspan=\"1\"> March 25 </Td> <Td> April 29 </Td> </Tr> <Tr> <Th> 2036 </Th> <Td colspan=\"1\"> April 13 </Td> <Td> April 20 </Td> </Tr> <Tr> <Th> 2037 </Th> <Td colspan=\"2\"> April 5 </Td> </Tr> <Tr> <Th> 2038 </Th> <Td colspan=\"2\"> April 25 </Td> </Tr> </Table>",
    "topic": "Interpretation of table rows with colspan entries\u2014identifying years when Western and Eastern Easters coincide.",
    "response": "<document_analysis>\nThe context provides a table of Western and Eastern Easter dates from 1998 to 2038. Rows where the <Th> (year) tag is empty but the <Td> spans both columns indicate years in which both traditions coincided on the same date. Extracting those blank-<Th> rows and the explicit colspan=\"2\" rows yields the years 2001, 2004, 2007, 2010, and 2011 as the first five occurrences after 1998.\nThe question below requires deep familiarity with HTML table parsing (recognizing blank header cells), correlating those to calendar years, and sequencing the first five coincidences\u2014challenging even for an expert with only the textual snippet.\nDifficulty rating: 6/10\n</document_analysis>\n\n<output_format>\nQuestion: Which sequence correctly lists the first five occasions after 1998 when Western and Eastern Easter fell on the same date in the 1998\u20132038 span?\nA: 2001, 2004, 2007, 2010, 2011\nB: 2000, 2003, 2006, 2009, 2012\nC: 2002, 2005, 2008, 2011, 2014\nD: 2003, 2006, 2009, 2012, 2015\nExplanation: Rows with an empty year header and a single cell spanning both Western and Eastern dates indicate coincidence; these correspond to 2001, 2004, 2007, 2010, and the explicit colspan=\"2\" row in 2011.\nCorrect Answer: A\n</output_format>",
    "question": "Which sequence correctly lists the first five occasions after 1998 when Western and Eastern Easter fell on the same date in the 1998\u20132038 span?",
    "choices": {
      "A": "2001, 2004, 2007, 2010, 2011",
      "B": "2000, 2003, 2006, 2009, 2012",
      "C": "2002, 2005, 2008, 2011, 2014",
      "D": "2003, 2006, 2009, 2012, 2015"
    },
    "answer": "A",
    "explanation": "Rows with an empty year header and a single cell spanning both Western and Eastern dates indicate coincidence; these correspond to 2001, 2004, 2007, 2010, and the explicit colspan=\"2\" row in 2011.",
    "question_token_count": 33,
    "answer_correctness_score": 10,
    "explanation_validity_score": 10,
    "question_clarity_score": 8,
    "question_difficulty_score": 6,
    "question_groundedness_score": 10,
    "avg_answer_token_count": 19
  },
  {
    "context": "<P> The United States presidential line of succession is the order in which persons may become or act as President of the United States if the incumbent president becomes incapacitated , dies , resigns , or is removed from office ( by impeachment by the House of Representatives and subsequent conviction by the Senate ) . The line of succession is set by the United States Constitution and the Presidential Succession Act of 1947 as subsequently amended to include newly created cabinet offices . The succession follows the order of vice president , Speaker of the House of Representatives , President pro tempore of the Senate , and then the heads of federal executive departments who form the Cabinet of the United States . The Cabinet currently has fifteen members , beginning with the Secretary of State , and followed by the rest in the order of their positions ' creation . Those heads of department who are ineligible to act as president are also ineligible to succeed the president by succession , for example most commonly if they are not a natural - born U.S. citizen . </P>",
    "topic": "The impact of impeachment by the House and conviction by the Senate on the line of succession.",
    "response": "<document_analysis>\nI reviewed the context describing how a president\u2019s removal by impeachment and Senate conviction triggers the constitutional and statutory line of succession, specifically highlighting that the order among Cabinet members is set by the chronological creation of their departments and that any department head who is not a natural\u2011born citizen is disqualified from serving. To challenge domain experts, I will ask how the Presidential Succession Act operationalizes these rules and embed plausible but subtly incorrect distractors regarding alternative ordering schemes and eligibility criteria.\n</document_analysis>\n\n<output_format>\nQuestion: After a president is removed by impeachment and Senate conviction, and the vice presidency and legislative leaders are unable to serve, how does the Presidential Succession Act prescribe the order of Cabinet secretaries, and what eligibility requirement can disqualify one from succession?\nA: By the date of Senate confirmation, and disqualified if under 35 years old  \nB: By the chronological creation of their departments, and disqualified if not a natural\u2011born citizen  \nC: Alphabetically by department name, and disqualified if not a resident for 14 years  \nD: By length of federal service, and disqualified if never held another federal office  \nExplanation: The Act ranks cabinet officers in the sequence their departments were established and excludes any head who is not a natural\u2011born U.S. citizen.  \nCorrect Answer: B\n</output_format>",
    "question": "After a president is removed by impeachment and Senate conviction, and the vice presidency and legislative leaders are unable to serve, how does the Presidential Succession Act prescribe the order of Cabinet secretaries, and what eligibility requirement can disqualify one from succession?",
    "choices": {
      "A": "By the date of Senate confirmation, and disqualified if under 35 years old",
      "B": "By the chronological creation of their departments, and disqualified if not a natural\u2011born citizen",
      "C": "Alphabetically by department name, and disqualified if not a resident for 14 years",
      "D": "By length of federal service, and disqualified if never held another federal office"
    },
    "answer": "B",
    "explanation": "The Act ranks cabinet officers in the sequence their departments were established and excludes any head who is not a natural\u2011born U.S. citizen.",
    "question_token_count": 51,
    "answer_correctness_score": 10,
    "explanation_validity_score": 10,
    "question_clarity_score": 6,
    "question_difficulty_score": 8,
    "question_groundedness_score": 10,
    "avg_answer_token_count": 17
  },
  {
    "context": "<P> In the history of the Triple Crown , 13 horses have won all three races : Sir Barton ( 1919 ) , Gallant Fox ( 1930 ) , Omaha ( 1935 ) , War Admiral ( 1937 ) , Whirlaway ( 1941 ) , Count Fleet ( 1943 ) , Assault ( 1946 ) , Citation ( 1948 ) , Secretariat ( 1973 ) , Seattle Slew ( 1977 ) , Affirmed ( 1978 ) , American Pharoah ( 2015 ) , and Justify ( 2018 ) . As of 2018 , American Pharoah and Justify are the only living Triple Crown winners . </P>",
    "topic": "Investigate the significance of only two living Triple Crown winners as of 2018, exploring implications for equine longevity and public memory.",
    "response": "<document_analysis>\nThe provided context lists all 13 Triple Crown winners and notes that, as of 2018, only the 2015 and 2018 winners are still alive. This creates an implicit challenge for any longevity analysis, since two subjects\u2019 lifespans remain incomplete. \nKey concepts: survival analysis, right\u2010censoring of time\u2010to\u2010event data, bias introduced by ongoing subjects. \nI will craft an analytical, application\u2010based question probing survival\u2010analysis understanding at an expert level, focusing on how to properly account for incomplete lifespan data. \nDifficulty: 8/10 (requires expert knowledge of statistical methods for censored data). \n</document_analysis>\n\n<output_format>\nQuestion: In conducting a survival analysis of Triple Crown winners\u2019 life spans using data up to 2018, the fact that only American Pharoah and Justify remain alive introduces which key statistical consideration?\nA: Length\u2010biased sampling  \nB: Right\u2010censoring  \nC: Left\u2010truncation  \nD: Time\u2010dependent covariates  \nExplanation: Because the two living horses\u2019 times of death are not yet observed by the analysis cutoff, their lifespans are right\u2010censored.  \nCorrect Answer: B\n</output_format>",
    "question": "In conducting a survival analysis of Triple Crown winners\u2019 life spans using data up to 2018, the fact that only American Pharoah and Justify remain alive introduces which key statistical consideration?",
    "choices": {
      "A": "Length\u2010biased sampling",
      "B": "Right\u2010censoring",
      "C": "Left\u2010truncation",
      "D": "Time\u2010dependent covariates"
    },
    "answer": "B",
    "explanation": "Because the two living horses\u2019 times of death are not yet observed by the analysis cutoff, their lifespans are right\u2010censored.",
    "question_token_count": 39,
    "answer_correctness_score": 10,
    "explanation_validity_score": 10,
    "question_clarity_score": 7,
    "question_difficulty_score": 8,
    "question_groundedness_score": 10,
    "avg_answer_token_count": 5
  },
  {
    "context": "<P> In the history of the Triple Crown , 13 horses have won all three races : Sir Barton ( 1919 ) , Gallant Fox ( 1930 ) , Omaha ( 1935 ) , War Admiral ( 1937 ) , Whirlaway ( 1941 ) , Count Fleet ( 1943 ) , Assault ( 1946 ) , Citation ( 1948 ) , Secretariat ( 1973 ) , Seattle Slew ( 1977 ) , Affirmed ( 1978 ) , American Pharoah ( 2015 ) , and Justify ( 2018 ) . As of 2018 , American Pharoah and Justify are the only living Triple Crown winners . </P>",
    "topic": "Discuss how major historical events (such as World War\u00a0II) might have influenced the training, breeding, and racing conditions leading up to winners like Assault (1946) and Citation (1948).",
    "response": "<document_analysis>\nThe context lists Triple Crown winners and highlights Assault (1946) and Citation (1948). To craft a probing question on how WWII influenced their training, breeding, and racing conditions, we must rely on broader historical knowledge\u2014specifically wartime feed rationing, labor shifts, travel restrictions, and their reversal post\u20111945. The question will target how the end of grain rationing directly impacted conditioning regimens for three\u2011year\u2011olds in 1946\u201348. Difficulty calibrated at 8/10, requiring synthesis of equine nutrition history and post\u2011war economics.\n</document_analysis>\n\n<output_format>\nQuestion: In the immediate aftermath of World War\u00a0II, which change most directly enhanced the conditioning and stamina development of the three\u2011year\u2011olds Assault (1946) and Citation (1948)?\nA: Federal conversion of large breeding farms into military training camps left improved infrastructure for horse conditioning.\nB: Lifting of wartime grain rationing permitted richer, high\u2011energy diets that improved muscle development and endurance in young racehorses.\nC: Wartime labor shortages led trainers to adopt mechanized turnout and training devices that became standard thereafter.\nD: Restrictions on international broodmare transport during the war forced breeders to intensify inbreeding of domestic lines, increasing genetic uniformity and predictable performance.\nExplanation: The end of grain rationing after WWII allowed trainers to feed richer, higher\u2011energy grain rations to three\u2011year\u2011olds, directly boosting muscle and stamina preparation for top-level competition.\nCorrect Answer: B\n</output_format>",
    "question": "In the immediate aftermath of World War\u00a0II, which change most directly enhanced the conditioning and stamina development of the three\u2011year\u2011olds Assault (1946) and Citation (1948)?",
    "choices": {
      "A": "Federal conversion of large breeding farms into military training camps left improved infrastructure for horse conditioning.",
      "B": "Lifting of wartime grain rationing permitted richer, high\u2011energy diets that improved muscle development and endurance in young racehorses.",
      "C": "Wartime labor shortages led trainers to adopt mechanized turnout and training devices that became standard thereafter.",
      "D": "Restrictions on international broodmare transport during the war forced breeders to intensify inbreeding of domestic lines, increasing genetic uniformity and predictable performance."
    },
    "answer": "B",
    "explanation": "The end of grain rationing after WWII allowed trainers to feed richer, higher\u2011energy grain rations to three\u2011year\u2011olds, directly boosting muscle and stamina preparation for top-level competition.",
    "question_token_count": 38,
    "answer_correctness_score": 8,
    "explanation_validity_score": 8,
    "question_clarity_score": 2,
    "question_difficulty_score": 8,
    "question_groundedness_score": 1,
    "avg_answer_token_count": 24
  },
  {
    "context": "<Table> Dates for Easter in the past and coming 20 years ( 1998 -- 2038 in Gregorian dates ) <Tr> <Th> Year </Th> <Th> Western </Th> <Th> Eastern </Th> </Tr> <Tr> <Th> 1998 </Th> <Td colspan=\"1\"> April 12 </Td> <Td> April 19 </Td> </Tr> <Tr> <Th> 1999 </Th> <Td colspan=\"1\"> April 4 </Td> <Td> April 11 </Td> </Tr> <Tr> <Th> 2000 </Th> <Td colspan=\"1\"> April 23 </Td> <Td> April 30 </Td> </Tr> <Tr> <Th> </Th> <Td colspan=\"2\"> April 15 </Td> </Tr> <Tr> <Th> 2002 </Th> <Td colspan=\"1\"> March 31 </Td> <Td> May 5 </Td> </Tr> <Tr> <Th> 2003 </Th> <Td colspan=\"1\"> April 20 </Td> <Td> April 27 </Td> </Tr> <Tr> <Th> </Th> <Td colspan=\"2\"> April 11 </Td> </Tr> <Tr> <Th> 2005 </Th> <Td colspan=\"1\"> March 27 </Td> <Td> May 1 </Td> </Tr> <Tr> <Th> 2006 </Th> <Td colspan=\"1\"> April 16 </Td> <Td> April 23 </Td> </Tr> <Tr> <Th> 2007 </Th> <Td colspan=\"2\"> April 8 </Td> </Tr> <Tr> <Th> 2008 </Th> <Td colspan=\"1\"> March 23 </Td> <Td> April 27 </Td> </Tr> <Tr> <Th> 2009 </Th> <Td colspan=\"1\"> April 12 </Td> <Td> April 19 </Td> </Tr> <Tr> <Th> </Th> <Td colspan=\"2\"> April 4 </Td> </Tr> <Tr> <Th> 2011 </Th> <Td colspan=\"2\"> April 24 </Td> </Tr> <Tr> <Th> 2012 </Th> <Td colspan=\"1\"> April 8 </Td> <Td> April 15 </Td> </Tr> <Tr> <Th> 2013 </Th> <Td colspan=\"1\"> March 31 </Td> <Td> May 5 </Td> </Tr> <Tr> <Th> 2014 </Th> <Td colspan=\"2\"> April 20 </Td> </Tr> <Tr> <Th> 2015 </Th> <Td colspan=\"1\"> April 5 </Td> <Td> April 12 </Td> </Tr> <Tr> <Th> 2016 </Th> <Td colspan=\"1\"> March 27 </Td> <Td> May 1 </Td> </Tr> <Tr> <Th> 2017 </Th> <Td colspan=\"2\"> April 16 </Td> </Tr> <Tr> <Th> 2018 </Th> <Td colspan=\"1\"> April 1 </Td> <Td> April 8 </Td> </Tr> <Tr> <Th> 2019 </Th> <Td colspan=\"1\"> April 21 </Td> <Td> April 28 </Td> </Tr> <Tr> <Th> 2020 </Th> <Td colspan=\"1\"> April 12 </Td> <Td> April 19 </Td> </Tr> <Tr> <Th> 2021 </Th> <Td colspan=\"1\"> April 4 </Td> <Td> May 2 </Td> </Tr> <Tr> <Th> 2022 </Th> <Td colspan=\"1\"> April 17 </Td> <Td> April 24 </Td> </Tr> <Tr> <Th> 2023 </Th> <Td colspan=\"1\"> April 9 </Td> <Td> April 16 </Td> </Tr> <Tr> <Th> 2024 </Th> <Td colspan=\"1\"> March 31 </Td> <Td> May 5 </Td> </Tr> <Tr> <Th> 2025 </Th> <Td colspan=\"2\"> April 20 </Td> </Tr> <Tr> <Th> 2026 </Th> <Td colspan=\"1\"> April 5 </Td> <Td> April 12 </Td> </Tr> <Tr> <Th> 2027 </Th> <Td colspan=\"1\"> March 28 </Td> <Td> May 2 </Td> </Tr> <Tr> <Th> 2028 </Th> <Td colspan=\"2\"> April 16 </Td> </Tr> <Tr> <Th> 2029 </Th> <Td colspan=\"1\"> April 1 </Td> <Td> April 8 </Td> </Tr> <Tr> <Th> 2030 </Th> <Td colspan=\"1\"> April 21 </Td> <Td> April 28 </Td> </Tr> <Tr> <Th> 2031 </Th> <Td colspan=\"2\"> April 13 </Td> </Tr> <Tr> <Th> 2032 </Th> <Td colspan=\"1\"> March 28 </Td> <Td> May 2 </Td> </Tr> <Tr> <Th> 2033 </Th> <Td colspan=\"1\"> April 17 </Td> <Td> April 24 </Td> </Tr> <Tr> <Th> 2034 </Th> <Td colspan=\"2\"> April 9 </Td> </Tr> <Tr> <Th> 2035 </Th> <Td colspan=\"1\"> March 25 </Td> <Td> April 29 </Td> </Tr> <Tr> <Th> 2036 </Th> <Td colspan=\"1\"> April 13 </Td> <Td> April 20 </Td> </Tr> <Tr> <Th> 2037 </Th> <Td colspan=\"2\"> April 5 </Td> </Tr> <Tr> <Th> 2038 </Th> <Td colspan=\"2\"> April 25 </Td> </Tr> </Table>",
    "topic": "Analysis of the 19-year Metonic cycle and its influence on repeating patterns of Easter dates.",
    "response": "<document_analysis>\nThe context provides a table of Western and Eastern Easter dates over 1998\u20132038, highlighting that identical Western Easter dates do not strictly recur every 19 years (the Metonic cycle) but rather sometimes after 11- and 8-year intervals. This irregularity arises from the Gregorian calendar\u2019s leap-year rules, specifically the omission of leap days in centurial years not divisible by 400, which shifts the ecclesiastical epact and disrupts the pure 19-year cycle. Thus, a deep domain expert question can probe why the Metonic cycle is fragmented into 11- and 8-year subcycles in Western Easter computation.\nDifficulty rating: 8/10\n</document_analysis>\n\n<output_format>\nQuestion: Within the Gregorian Easter computus, why does the nominal 19-year Metonic cycle for Western Easter often split into 11- and 8-year intervals between identical dates?\nA: Because centurial years not divisible by 400 are not treated as leap years, shifting the epact and fragmenting the 19-year cycle.\nB: Because the ecclesiastical lunar tables assume a fixed 29.5\u2011day month, causing an 11-day drift over 19 years.\nC: Because the rule fixing the vernal equinox to March 21 introduces an extra correction every 11 years.\nD: Because the 28-year solar cycle periodically overrides the lunar cycle, producing 11-year subcycles.\nExplanation: Gregorian reforms omit leap days in century years (unless divisible by 400), altering the epact and breaking the pure 19-year repetition into 11- and 8-year gaps.\nCorrect Answer: A\n</output_format>",
    "question": "Within the Gregorian Easter computus, why does the nominal 19-year Metonic cycle for Western Easter often split into 11- and 8-year intervals between identical dates?",
    "choices": {
      "A": "Because centurial years not divisible by 400 are not treated as leap years, shifting the epact and fragmenting the 19-year cycle.",
      "B": "Because the ecclesiastical lunar tables assume a fixed 29.5\u2011day month, causing an 11-day drift over 19 years.",
      "C": "Because the rule fixing the vernal equinox to March 21 introduces an extra correction every 11 years.",
      "D": "Because the 28-year solar cycle periodically overrides the lunar cycle, producing 11-year subcycles."
    },
    "answer": "A",
    "explanation": "Gregorian reforms omit leap days in century years (unless divisible by 400), altering the epact and breaking the pure 19-year repetition into 11- and 8-year gaps.",
    "question_token_count": 36,
    "answer_correctness_score": 10,
    "explanation_validity_score": 10,
    "question_clarity_score": 8,
    "question_difficulty_score": 9,
    "question_groundedness_score": 6,
    "avg_answer_token_count": 26
  },
  {
    "context": "<P> Article Five of the United States Constitution describes the process whereby the Constitution , the nation 's frame of government , may be altered . Altering the Constitution consists of proposing an amendment or amendments and subsequent ratification . Amendments may be proposed either by the Congress with a two - thirds vote in both the House of Representatives and the Senate or by a convention of states called for by two - thirds of the state legislatures . To become part of the Constitution , an amendment must be ratified by either -- as determined by Congress -- the legislatures of three - quarters of the states or state ratifying conventions in three - quarters of the states . The vote of each state ( to either ratify or reject a proposed amendment ) carries equal weight , regardless of a state 's population or length of time in the Union . </P>",
    "topic": "Discuss how the supermajority thresholds in Article V reflect the framers\u2019 balance between constitutional rigidity and adaptability.",
    "response": "<document_analysis>\nThe provided context outlines Article V\u2019s amendment process: proposing amendments via a two\u2011thirds congressional vote or a state\u2010called convention, and ratifying them through three\u2011quarters of states, either via legislatures or conventions. Key themes are the use of supermajorities at both proposal and ratification stages to prevent capricious changes while still permitting adaptability. The nuance lies in recognizing that the framers deliberately set these thresholds high enough to ensure broad, cross\u2011regional consensus but structured dual proposal and dual ratification channels to allow constitutional evolution. A high\u2010difficulty question should probe understanding of how these features jointly embody rigidity and flexibility rather than simply restating numeric thresholds.  \nDifficulty rating: 8/10  \nPlanned question: ask which description best captures this balance, with distractors subtly misrepresenting thresholds, actors, or procedures.  \n</document_analysis>\n\n<output_format>\nQuestion: Which description most accurately captures how Article V\u2019s supermajority requirements embody the framers\u2019 intended balance between constitutional stability and adaptability?\n\nA: They simultaneously prevent hasty changes by requiring bipartisan supermajorities in Congress to propose amendments and near\u2011national consensus across states\u2014through legislatures or conventions\u2014for ratification, while retaining flexibility via dual proposal and ratification pathways.\nB: They enforce a rigid amendment framework by mandating unanimous consent of all state legislatures at both proposal and ratification stages, thereby effectively insulating the Constitution from meaningful change.\nC: They reflect a compromise allowing a simple majority in Congress to initiate amendments, offset by requiring a higher, two\u2011thirds majority of state legislatures for ratification to protect minority interests.\nD: They vest amendment initiation solely in Congress under a supermajority rule but assign exclusive ratification authority to state conventions, excluding state legislatures entirely to maintain consistency.\nExplanation: Option A correctly describes the dual supermajority thresholds\u2014two\u2011thirds for proposal and three\u2011quarters for ratification across states\u2014and acknowledges both legislative and convention routes, reflecting stability and adaptability. The other options misstate key thresholds, required actors, or available pathways.\nCorrect Answer: A\n</output_format>",
    "question": "Which description most accurately captures how Article V\u2019s supermajority requirements embody the framers\u2019 intended balance between constitutional stability and adaptability?",
    "choices": {
      "A": "They simultaneously prevent hasty changes by requiring bipartisan supermajorities in Congress to propose amendments and near\u2011national consensus across states\u2014through legislatures or conventions\u2014for ratification, while retaining flexibility via dual proposal and ratification pathways.",
      "B": "They enforce a rigid amendment framework by mandating unanimous consent of all state legislatures at both proposal and ratification stages, thereby effectively insulating the Constitution from meaningful change.",
      "C": "They reflect a compromise allowing a simple majority in Congress to initiate amendments, offset by requiring a higher, two\u2011thirds majority of state legislatures for ratification to protect minority interests.",
      "D": "They vest amendment initiation solely in Congress under a supermajority rule but assign exclusive ratification authority to state conventions, excluding state legislatures entirely to maintain consistency."
    },
    "answer": "A",
    "explanation": "Option A correctly describes the dual supermajority thresholds\u2014two\u2011thirds for proposal and three\u2011quarters for ratification across states\u2014and acknowledges both legislative and convention routes, reflecting stability and adaptability. The other options misstate key thresholds, required actors, or available pathways.",
    "question_token_count": 27,
    "answer_correctness_score": 10,
    "explanation_validity_score": 10,
    "question_clarity_score": 6,
    "question_difficulty_score": 8,
    "question_groundedness_score": 4,
    "avg_answer_token_count": 38
  },
  {
    "context": "<P> Article Five of the United States Constitution describes the process whereby the Constitution , the nation 's frame of government , may be altered . Altering the Constitution consists of proposing an amendment or amendments and subsequent ratification . Amendments may be proposed either by the Congress with a two - thirds vote in both the House of Representatives and the Senate or by a convention of states called for by two - thirds of the state legislatures . To become part of the Constitution , an amendment must be ratified by either -- as determined by Congress -- the legislatures of three - quarters of the states or state ratifying conventions in three - quarters of the states . The vote of each state ( to either ratify or reject a proposed amendment ) carries equal weight , regardless of a state 's population or length of time in the Union . </P>",
    "topic": "Evaluate the role of Congress in selecting between state legislatures and state ratifying conventions for amendment ratification, including the political considerations inherent in that choice.",
    "response": "<document_analysis>\nThe context clarifies that under Article V Congress alone decides whether proposed amendments are ratified by state legislatures or by specially elected state conventions. The strategic implication is that Congress can leverage this choice to advance amendments likely to face legislative obstruction by tapping direct public support through conventions, while conversely using legislatures when their composition favors the amendment. Other plausible but secondary rationales include procedural uniformity, scheduling independence, or public mobilization tactics. A question probing why Congress would opt for conventions over legislatures in light of the equal one\u2011state\u2011one\u2011vote ratification requirement will challenge experts to synthesize constitutional procedure with political strategy.\nDifficulty: 7\n</document_analysis>\n\n<output_format>\nQuestion: Given that each state\u2019s ratification vote carries equal weight under Article V, why might Congress direct ratification to state ratifying conventions rather than to state legislatures?\nA: To circumvent entrenched legislative majorities that may not reflect current public support for an amendment, thereby optimizing the chances of its passage.\nB: To impose uniform rules for time, place, and manner of ratification across all states, eliminating procedural variations among state legislatures.\nC: To expedite the ratification timetable by convening bodies whose sessions can be scheduled independently of state legislative calendars.\nD: To mobilize public engagement directly by aligning convention delegate selection with statewide general elections.\nExplanation: Conventions provide a venue to bypass potentially hostile legislatures whose members might oppose the amendment, tapping broader popular support essential when each state has one equal vote.\nCorrect Answer: A\n</output_format>",
    "question": "Given that each state\u2019s ratification vote carries equal weight under Article V, why might Congress direct ratification to state ratifying conventions rather than to state legislatures?",
    "choices": {
      "A": "To circumvent entrenched legislative majorities that may not reflect current public support for an amendment, thereby optimizing the chances of its passage.",
      "B": "To impose uniform rules for time, place, and manner of ratification across all states, eliminating procedural variations among state legislatures.",
      "C": "To expedite the ratification timetable by convening bodies whose sessions can be scheduled independently of state legislative calendars.",
      "D": "To mobilize public engagement directly by aligning convention delegate selection with statewide general elections."
    },
    "answer": "A",
    "explanation": "Conventions provide a venue to bypass potentially hostile legislatures whose members might oppose the amendment, tapping broader popular support essential when each state has one equal vote.",
    "question_token_count": 34,
    "answer_correctness_score": 10,
    "explanation_validity_score": 10,
    "question_clarity_score": 6,
    "question_difficulty_score": 7,
    "question_groundedness_score": 6,
    "avg_answer_token_count": 23
  },
  {
    "context": "<P> `` Death and All His Friends '' is the season finale of the sixth season of the American television medical drama Grey 's Anatomy , and the show 's 126th episode overall . It was written by Shonda Rhimes and directed by Rob Corn . The episode was originally broadcast on the American Broadcasting Company ( ABC ) in the United States on May 20 , 2010 . The episode was the second part of the two - hour season six finale , the first being Sanctuary , and took place at the fictional Seattle Grace Hospital . The original episode broadcast in the United States had an audience of 16.13 million viewers and opened up to universal acclaim . The episode centers a shooting spree at the hospital by a former patient 's husband Gary Clark ( Michael O'Neill ) . The episode marked the last appearances for Nora Zehetner and Robert Baker as Dr. Reed Adamson and Dr. Charles Percy respectively as both the characters were killed in the shooting . </P>",
    "topic": "Critical analysis of the portrayal of gun violence within the medical drama framework and its ethical and dramatic implications.",
    "response": "<document_analysis>\nThe context describes the climactic season finale of Grey\u2019s Anatomy, featuring a hospital shooting that kills key characters. Central themes include the intrusion of violence into a healing environment, the ethical and professional challenges faced by medical staff under extreme duress, and the dramatic functions of such a plot device. Subtle implications involve the redefinition of roles\u2014healers becoming protectors\u2014and the tension between institutional protocols and individual ethical imperatives. Difficulty is calibrated at 9/10, focusing on critical media analysis and ethical dimensions rather than surface plot points.\n</document_analysis>\n\n<output_format>\nQuestion: In examining how the hospital shooting in the season six finale reconfigures medical ethics within the drama, which statement best captures its narrative function?\nA: It highlights the imperative for practitioners to balance patient confidentiality with urgent disclosures under life\u2011threatening duress.\nB: It forces a redefinition of professional roles where the duty to protect extends beyond medical treatment to safeguarding physical security.\nC: It primarily heightens character relationships, prioritizing interpersonal drama over any substantive ethical inquiry.\nD: It critiques hospital administration by exposing systemic failures, shifting responsibility from individuals to institutional oversight.\nExplanation: The shooting compels medical staff to assume protective roles beyond healing, reframing their ethical duties under threat.\nCorrect Answer: B\n</output_format>",
    "question": "In examining how the hospital shooting in the season six finale reconfigures medical ethics within the drama, which statement best captures its narrative function?",
    "choices": {
      "A": "It highlights the imperative for practitioners to balance patient confidentiality with urgent disclosures under life\u2011threatening duress.",
      "B": "It forces a redefinition of professional roles where the duty to protect extends beyond medical treatment to safeguarding physical security.",
      "C": "It primarily heightens character relationships, prioritizing interpersonal drama over any substantive ethical inquiry.",
      "D": "It critiques hospital administration by exposing systemic failures, shifting responsibility from individuals to institutional oversight."
    },
    "answer": "B",
    "explanation": "The shooting compels medical staff to assume protective roles beyond healing, reframing their ethical duties under threat.",
    "question_token_count": 28,
    "answer_correctness_score": 9,
    "explanation_validity_score": 9,
    "question_clarity_score": 2,
    "question_difficulty_score": 8,
    "question_groundedness_score": 6,
    "avg_answer_token_count": 20
  },
  {
    "context": "<P> The flag of the United States of America , often referred to as the American flag , is the national flag of the United States . It consists of thirteen equal horizontal stripes of red ( top and bottom ) alternating with white , with a blue rectangle in the canton ( referred to specifically as the `` union '' ) bearing fifty small , white , five - pointed stars arranged in nine offset horizontal rows , where rows of six stars ( top and bottom ) alternate with rows of five stars . The 50 stars on the flag represent the 50 states of the United States of America , and the 13 stripes represent the thirteen British colonies that declared independence from the Kingdom of Great Britain , and became the first states in the U.S. Nicknames for the flag include The Stars and Stripes , Old Glory , and The Star - Spangled Banner . </P>",
    "topic": "Exploration of manufacturing specifications and standards that govern the production of the U.S. flag.",
    "response": "<document_analysis>\nThe context describes the precise arrangement of the 50 stars in the union: nine horizontal rows alternating between six and five stars. This enables analysis of how those stars distribute across the vertical sections (left half, central column, right half). By examining each row\u2019s symmetry (six stars as three on each side, five stars as two on each side plus one central), one can compute the count of stars in each vertical section. This decomposition is not explicit but requires careful combinatorial and spatial reasoning, making it suitably challenging for an expert.\n</document_analysis>\n\n<output_format>\nQuestion: Considering the nine\u2010row arrangement of fifty stars in the U.S. flag\u2019s union\u2014where rows of six stars alternate with rows of five\u2014how are the stars distributed among the left half, the central column, and the right half of the union?\nA: 22 left, 6 center, 22 right  \nB: 23 left, 4 center, 23 right  \nC: 25 left, 0 center, 25 right  \nD: 24 left, 2 center, 24 right  \nExplanation: Six\u2010star rows contribute 3 stars to each half (5 rows \u00d7 3 = 15) and no central stars; five\u2010star rows contribute 2 to each half plus one central star (4 rows \u00d7 2 = 8 per half, 4 central total). Thus each half has 15+8=23 and the central column has 4.  \nCorrect Answer: B\n</output_format>",
    "question": "Considering the nine\u2010row arrangement of fifty stars in the U.S. flag\u2019s union\u2014where rows of six stars alternate with rows of five\u2014how are the stars distributed among the left half, the central column, and the right half of the union?",
    "choices": {
      "A": "22 left, 6 center, 22 right",
      "B": "23 left, 4 center, 23 right",
      "C": "25 left, 0 center, 25 right",
      "D": "24 left, 2 center, 24 right"
    },
    "answer": "B",
    "explanation": "Six\u2010star rows contribute 3 stars to each half (5 rows \u00d7 3 = 15) and no central stars; five\u2010star rows contribute 2 to each half plus one central star (4 rows \u00d7 2 = 8 per half, 4 central total). Thus each half has 15+8=23 and the central column has 4.",
    "question_token_count": 52,
    "answer_correctness_score": 10,
    "explanation_validity_score": 10,
    "question_clarity_score": 8,
    "question_difficulty_score": 7,
    "question_groundedness_score": 10,
    "avg_answer_token_count": 11
  },
  {
    "context": "<P> `` Let It Go '' is a song from Disney 's 2013 animated feature film Frozen , whose music and lyrics were composed by husband - and - wife songwriting team Kristen Anderson - Lopez and Robert Lopez . The song was performed in its original show - tune version in the film by American actress and singer Idina Menzel in her vocal role as Queen Elsa . Anderson - Lopez and Lopez also composed a simplified pop version ( with shorter lyrics and background chorus ) which was performed by actress and singer Demi Lovato over the start of the film 's closing credits . A music video was separately released for the pop version . </P>",
    "topic": "Analysis of how Kristen Anderson\u2011Lopez and Robert Lopez\u2019s collaborative dynamic as a married songwriting team influenced the creative development of \u201cLet It Go.\u201d",
    "response": "<document_analysis>\nThe provided context outlines that Kristen Anderson\u2011Lopez and Robert Lopez, as a husband\u2011and\u2011wife songwriting duo, composed both a theatrical \u201cshow\u2011tune\u201d version of \u201cLet It Go\u201d and a simplified pop version featuring shorter lyrics and a background chorus. Key details for question crafting include: \n1) Their dual compositional approaches (narrative\u2011driven versus radio\u2011friendly). \n2) Specific techniques used in the pop adaptation (lyrical truncation, background chorus). \n3) The need to balance thematic integrity with commercial accessibility. \nAlthough the context is brief, these nuances enable an inference\u2011based question on compositional strategy. Difficulty is set to a high level by focusing on the expert analysis of adaptive technique rather than simple recall.  \n</document_analysis>\n\n<output_format>\nQuestion: Which compositional strategy best illustrates how Anderson\u2011Lopez and Lopez preserved the narrative core of \u201cLet It Go\u201d while adapting it into a radio\u2011friendly pop version?\nA: Collapsing multiple narrative verses into a single refrain reinforced by a background chorus hook  \nB: Expanding the bridge with an extended instrumental solo to heighten emotional impact  \nC: Substituting the original melody with a new hook that omits all narrative references  \nD: Transposing the song into a minor key and slowing its tempo for dramatic effect  \nExplanation: The duo simplified the lyrics\u2014collapsing narrative verses\u2014and added a background chorus, maintaining the song\u2019s core theme while ensuring pop\u2011friendly brevity.  \nCorrect Answer: A\n</output_format>",
    "question": "Which compositional strategy best illustrates how Anderson\u2011Lopez and Lopez preserved the narrative core of \u201cLet It Go\u201d while adapting it into a radio\u2011friendly pop version?",
    "choices": {
      "A": "Collapsing multiple narrative verses into a single refrain reinforced by a background chorus hook",
      "B": "Expanding the bridge with an extended instrumental solo to heighten emotional impact",
      "C": "Substituting the original melody with a new hook that omits all narrative references",
      "D": "Transposing the song into a minor key and slowing its tempo for dramatic effect"
    },
    "answer": "A",
    "explanation": "The duo simplified the lyrics\u2014collapsing narrative verses\u2014and added a background chorus, maintaining the song\u2019s core theme while ensuring pop\u2011friendly brevity.",
    "question_token_count": 35,
    "answer_correctness_score": 10,
    "explanation_validity_score": 10,
    "question_clarity_score": 6,
    "question_difficulty_score": 8,
    "question_groundedness_score": 2,
    "avg_answer_token_count": 15
  },
  {
    "context": "<P> A player has taken two hat - tricks in the same Test match only once . Playing for Australia against South Africa in the first match of the 1912 Triangular Tournament at Old Trafford , Manchester , England , leg spinner Jimmy Matthews took a hat - trick in South Africa 's first and second innings , both taken on 28 May 1912 . He completed both hat - tricks by dismissing South Africa 's Tommy Ward . Only three other cricketers have taken more than one Test hat - trick : Australian off spinner Hugh Trumble ( two years apart , between the same teams at the same ground ) , Pakistani fast bowler Wasim Akram ( just over a week apart , in consecutive matches between the same teams ) and English fast bowler Stuart Broad . Three players have taken a hat - trick on their Test debut : English medium pace bowler Maurice Allom in 1930 , New Zealand off - spinner Peter Petherick in 1976 , and Australian pace bowler Damien Fleming in 1994 . Geoff Griffin took the fewest total Test wickets of any player who recorded a hat - trick , taking only eight wickets in his entire Test career . During the match in which he took his hat - trick , Griffin was repeatedly called for throwing by the umpires and never bowled again in a Test match . Australian Peter Siddle is the only bowler to take a hat - trick on his birthday , and Bangladeshi off spinner Sohag Gazi is the only player to score a century and take a hat - trick in the same Test match . </P>",
    "topic": "Analysis of Jimmy Matthews\u2019s double hat-trick in the same Test match, including contextual factors such as the 1912 Triangular Tournament and his dismissals of Tommy Ward.",
    "response": "<document_analysis>\nThe context describes Jimmy Matthews\u2019s unique double hat-trick in the same Test match, then lists other bowlers who have taken more than one Test hat-trick, highlighting differences in timing and venue: \n- Hugh Trumble: two hat-tricks two years apart, same teams, same ground\n- Wasim Akram: two hat-tricks in consecutive matches just over a week apart, same teams\n- Stuart Broad: multiple hat-tricks (no specific spacing or venue detail)\nA deep question can probe the nuanced distinction between these feats by focusing on temporal spacing and venue consistency.\nDifficulty rating: 8/10 \u2013 requires synthesis of both temporal and venue details.\n</document_analysis>\n\n<output_format>\nQuestion: Which bowler\u2019s two Test hat-tricks came at the same ground against the same opposition but were separated by a two-year interval rather than occurring in the same match?\nA: Wasim Akram\nB: Hugh Trumble\nC: Jimmy Matthews\nD: Stuart Broad\nExplanation: Hugh Trumble, an Australian off-spinner, took his two Test hat-tricks two years apart, against the same opposition at the same venue.\nCorrect Answer: B\n</output_format>",
    "question": "Which bowler\u2019s two Test hat-tricks came at the same ground against the same opposition but were separated by a two-year interval rather than occurring in the same match?",
    "choices": {
      "A": "Wasim Akram",
      "B": "Hugh Trumble",
      "C": "Jimmy Matthews",
      "D": "Stuart Broad"
    },
    "answer": "B",
    "explanation": "Hugh Trumble, an Australian off-spinner, took his two Test hat-tricks two years apart, against the same opposition at the same venue.",
    "question_token_count": 35,
    "answer_correctness_score": 10,
    "explanation_validity_score": 10,
    "question_clarity_score": 8,
    "question_difficulty_score": 7,
    "question_groundedness_score": 10,
    "avg_answer_token_count": 4
  },
  {
    "context": "<P> `` Death and All His Friends '' is the season finale of the sixth season of the American television medical drama Grey 's Anatomy , and the show 's 126th episode overall . It was written by Shonda Rhimes and directed by Rob Corn . The episode was originally broadcast on the American Broadcasting Company ( ABC ) in the United States on May 20 , 2010 . The episode was the second part of the two - hour season six finale , the first being Sanctuary , and took place at the fictional Seattle Grace Hospital . The original episode broadcast in the United States had an audience of 16.13 million viewers and opened up to universal acclaim . The episode centers a shooting spree at the hospital by a former patient 's husband Gary Clark ( Michael O'Neill ) . The episode marked the last appearances for Nora Zehetner and Robert Baker as Dr. Reed Adamson and Dr. Charles Percy respectively as both the characters were killed in the shooting . </P>",
    "topic": "Study of Michael O\u2019Neill\u2019s performance as antagonist Gary Clark and its role in heightening dramatic stakes and audience engagement.",
    "response": "<document_analysis>\nThe context describes Michael O\u2019Neill\u2019s role as the antagonist Gary Clark in Grey\u2019s Anatomy\u2019s season six finale, focusing on his shooting spree that elevates the stakes and drives audience engagement. Central themes include his unexpected violence within a medical drama, the psychological tension he introduces, and how his performance shapes the episode's suspense and emotional impact. For a domain-expert question, we explore the specific acting techniques O\u2019Neill uses to heighten dramatic urgency and audience investment. Difficulty is calibrated at about 8/10 by requiring analysis of performance craft rather than plot recall.\n</document_analysis>\n<output_format>\nQuestion: Which aspect of Michael O\u2019Neill\u2019s performance as Gary Clark most directly intensifies the suspense and dramatic stakes during the Seattle Grace shooting?\nA: His restrained physical presence interjected with sudden, explosive violence  \nB: His monotonous vocal delivery that remains unbroken throughout the siege  \nC: His frequent direct addresses to the audience, breaking the fourth wall  \nD: His overt emotional displays of grief for his late wife  \nExplanation: The sudden contrast between Clark\u2019s controlled physicality and his unpredictable bursts of violence creates a jarring shock effect, thereby amplifying tension and raising dramatic stakes.  \nCorrect Answer: A\n</output_format>",
    "question": "Which aspect of Michael O\u2019Neill\u2019s performance as Gary Clark most directly intensifies the suspense and dramatic stakes during the Seattle Grace shooting?",
    "choices": {
      "A": "His restrained physical presence interjected with sudden, explosive violence",
      "B": "His monotonous vocal delivery that remains unbroken throughout the siege",
      "C": "His frequent direct addresses to the audience, breaking the fourth wall",
      "D": "His overt emotional displays of grief for his late wife"
    },
    "answer": "A",
    "explanation": "The sudden contrast between Clark\u2019s controlled physicality and his unpredictable bursts of violence creates a jarring shock effect, thereby amplifying tension and raising dramatic stakes.",
    "question_token_count": 28,
    "answer_correctness_score": 9,
    "explanation_validity_score": 9,
    "question_clarity_score": 6,
    "question_difficulty_score": 8,
    "question_groundedness_score": 2,
    "avg_answer_token_count": 12
  },
  {
    "context": "<P> The flag of the United States of America , often referred to as the American flag , is the national flag of the United States . It consists of thirteen equal horizontal stripes of red ( top and bottom ) alternating with white , with a blue rectangle in the canton ( referred to specifically as the `` union '' ) bearing fifty small , white , five - pointed stars arranged in nine offset horizontal rows , where rows of six stars ( top and bottom ) alternate with rows of five stars . The 50 stars on the flag represent the 50 states of the United States of America , and the 13 stripes represent the thirteen British colonies that declared independence from the Kingdom of Great Britain , and became the first states in the U.S. Nicknames for the flag include The Stars and Stripes , Old Glory , and The Star - Spangled Banner . </P>",
    "topic": "Reflection on the semiotic impact of the U.S. flag in contemporary media and popular culture.",
    "response": "<document_analysis>\nThe context provides a literal description of the U.S. flag\u2019s design elements (stripes, stars, canton) and their representational meanings (13 colonies, 50 states) along with nicknames. For a domain expert in semiotics, one can leverage this representational relationship to probe knowledge of sign categories (Peirce\u2019s icon, index, symbol). The stripes and stars do not resemble or causally point to their referents but denote them by learned convention, making them symbols. Hence, a challenging question asks the expert to classify these elements within Peirce\u2019s triadic model.\nDifficulty: 7/10\n</document_analysis>\n\n<output_format>\nQuestion: Within Charles Peirce\u2019s semiotic framework, which category best describes the thirteen horizontal stripes on the U.S. flag, given that they represent the original colonies by social convention rather than by resemblance or causal connection?\nA: Icon  \nB: Index  \nC: Symbol  \nD: Signal  \nExplanation: The stripes signify the thirteen colonies through arbitrary social convention, making them symbols in Peirce\u2019s model.  \nCorrect Answer: C\n</output_format>",
    "question": "Within Charles Peirce\u2019s semiotic framework, which category best describes the thirteen horizontal stripes on the U.S. flag, given that they represent the original colonies by social convention rather than by resemblance or causal connection?",
    "choices": {
      "A": "Icon",
      "B": "Index",
      "C": "Symbol",
      "D": "Signal"
    },
    "answer": "C",
    "explanation": "The stripes signify the thirteen colonies through arbitrary social convention, making them symbols in Peirce\u2019s model.",
    "question_token_count": 44,
    "answer_correctness_score": 10,
    "explanation_validity_score": 10,
    "question_clarity_score": 8,
    "question_difficulty_score": 7,
    "question_groundedness_score": 6,
    "avg_answer_token_count": 2
  },
  {
    "context": "<P> The United States presidential line of succession is the order in which persons may become or act as President of the United States if the incumbent President becomes incapacitated , dies , resigns , or is removed from office ( by impeachment by the House of Representatives and subsequent conviction by the Senate ) . The line of succession is set by the United States Constitution and the Presidential Succession Act of 1947 as subsequently amended to include newly created cabinet offices . The succession follows the order of Vice President , Speaker of the House of Representatives , President pro tempore of the Senate , and then the heads of federal executive departments who form the Cabinet of the United States . The Cabinet currently has fifteen members , beginning with the Secretary of State , and followed by the rest in the order of their positions ' creation . Those heads of department who are ineligible to act as President are also ineligible to succeed the President by succession , for example most commonly if they are not a natural - born U.S. citizen . </P>",
    "topic": "Comparative roles and succession order of Vice President, Speaker of the House, and President pro tempore of the Senate",
    "response": "<document_analysis>\nThe context outlines the US presidential line of succession as defined by the Constitution and the Presidential Succession Act of 1947: Vice President, Speaker of the House, President pro tempore of the Senate, then cabinet officers in order of their department\u2019s creation. It also notes that any successor must meet constitutional eligibility (e.g., being a natural\u2011born citizen). A deep point for experts is how eligibility requirements can skip higher\u2010ranked officials (such as a foreign\u2011born Speaker) and pass the succession to the next qualified officeholder (President pro tempore). This nuance about ineligibility and skipping provides an opportunity for a challenging question on why the President pro tempore might serve before the Speaker despite statutory order.\nDifficulty: 8/10\n</document_analysis>\n\n<output_format>\nQuestion: Under the Presidential Succession Act, which of the following scenarios would directly cause the President pro tempore of the Senate to become acting President instead of the Speaker of the House, despite the Speaker\u2019s position in the statutory order?\nA: The Speaker declines to serve for political reasons.\nB: The Speaker is not a natural\u2011born U.S. citizen.\nC: The Speaker\u2019s party does not control the Senate.\nD: The Speaker is constitutionally barred because the Senate has not confirmed their election.\n\nExplanation: The Succession Act and the Constitution require each successor to meet presidential eligibility (including natural\u2011born citizenship). A Speaker who is not natural\u2011born is skipped, sending the succession to the next qualified officeholder, the President pro tempore.\nCorrect Answer: B\n</output_format>",
    "question": "Under the Presidential Succession Act, which of the following scenarios would directly cause the President pro tempore of the Senate to become acting President instead of the Speaker of the House, despite the Speaker\u2019s position in the statutory order?",
    "choices": {
      "A": "The Speaker declines to serve for political reasons.",
      "B": "The Speaker is not a natural\u2011born U.S. citizen.",
      "C": "The Speaker\u2019s party does not control the Senate.",
      "D": "The Speaker is constitutionally barred because the Senate has not confirmed their election."
    },
    "answer": "B",
    "explanation": "The Succession Act and the Constitution require each successor to meet presidential eligibility (including natural\u2011born citizenship). A Speaker who is not natural\u2011born is skipped, sending the succession to the next qualified officeholder, the President pro tempore.",
    "question_token_count": 46,
    "answer_correctness_score": 10,
    "explanation_validity_score": 10,
    "question_clarity_score": 6,
    "question_difficulty_score": 8,
    "question_groundedness_score": 4,
    "avg_answer_token_count": 12
  },
  {
    "context": "<Table> <Tr> <Th colspan=\"2\"> Season </Th> <Th colspan=\"2\"> Episodes </Th> <Th colspan=\"2\"> Originally released </Th> </Tr> <Tr> <Th> First released </Th> <Th> Last released </Th> </Tr> <Tr> <Td> </Td> <Td colspan=\"1\"> </Td> <Td colspan=\"2\"> 10 </Td> <Td colspan=\"1\"> April 26 , 2017 ( 2017 - 04 - 26 ) </Td> <Td> June 14 , 2017 ( 2017 - 06 - 14 ) </Td> </Tr> <Tr> <Td> </Td> <Td colspan=\"1\"> </Td> <Td colspan=\"2\"> 13 </Td> <Td colspan=\"1\"> April 25 , 2018 ( 2018 - 04 - 25 ) </Td> <Td> July 11 , 2018 ( 2018 - 07 - 11 ) </Td> </Tr> </Table>",
    "topic": "Outline an XPath or CSS selector approach to reliably scrape season, episode, and date information from this HTML snippet.",
    "response": "<document_analysis>\nThe context presents an HTML table with a complex header spanning two rows and data rows where cells use colspan attributes. Season numbers are in blank cells, episodes counts are in a <td colspan=\"2\">, and release dates follow. A robust scraping strategy must not rely on fixed positions due to header complexity and colspans; instead it needs to dynamically locate the \u201cEpisodes\u201d header, compute its column index, and then extract the corresponding <td> from each subsequent <tr>.\nDifficulty rating: 8/10 (requires knowledge of dynamic XPath, header indexing, and handling colspans).\n</document_analysis>\n\n<output_format>\nQuestion: In an HTML table with multi-row headers and cells that use varying colspan values (e.g., \u201cSeason\u201d, \u201cEpisodes\u201d, \u201cOriginally released\u201d), which XPath strategy will reliably extract the episode-count cell from every data row regardless of future changes in column order or colspan?\nA: //table//tr[position()>2]/td[3]/text()\nB: let $idx := count(//table//tr[1]//th[normalize-space()=\"Episodes\"]/preceding-sibling::th) + 1; //table//tr[position()>2]/td[$idx]/text()\nC: //table//tr/td[@colspan=\"2\" and not(ancestor::thead)]/text()\nD: //table//tr[contains(th,\"Episodes\")]/following-sibling::tr/td[3]/text()\nExplanation: Option B first locates the \u201cEpisodes\u201d header, computes its dynamic column index via preceding-sibling::th, then uses that position in each data row\u2014ensuring resilience to header reordering or colspan changes.\nCorrect Answer: B\n</output_format>",
    "question": "In an HTML table with multi-row headers and cells that use varying colspan values (e.g., \u201cSeason\u201d, \u201cEpisodes\u201d, \u201cOriginally released\u201d), which XPath strategy will reliably extract the episode-count cell from every data row regardless of future changes in column order or colspan?",
    "choices": {
      "A": "//table//tr[position()>2]/td[3]/text()",
      "B": "let $idx := count(//table//tr[1]//th[normalize-space()=\"Episodes\"]/preceding-sibling::th) + 1; //table//tr[position()>2]/td[$idx]/text()",
      "C": "//table//tr/td[@colspan=\"2\" and not(ancestor::thead)]/text()",
      "D": "//table//tr[contains(th,\"Episodes\")]/following-sibling::tr/td[3]/text()"
    },
    "answer": "B",
    "explanation": "Option B first locates the \u201cEpisodes\u201d header, computes its dynamic column index via preceding-sibling::th, then uses that position in each data row\u2014ensuring resilience to header reordering or colspan changes.",
    "question_token_count": 55,
    "answer_correctness_score": 10,
    "explanation_validity_score": 10,
    "question_clarity_score": 8,
    "question_difficulty_score": 8,
    "question_groundedness_score": 10,
    "avg_answer_token_count": 27
  },
  {
    "context": "<P> The United States presidential line of succession is the order in which persons may become or act as President of the United States if the incumbent president becomes incapacitated , dies , resigns , or is removed from office ( by impeachment by the House of Representatives and subsequent conviction by the Senate ) . The line of succession is set by the United States Constitution and the Presidential Succession Act of 1947 as subsequently amended to include newly created cabinet offices . The succession follows the order of vice president , Speaker of the House of Representatives , President pro tempore of the Senate , and then the heads of federal executive departments who form the Cabinet of the United States . The Cabinet currently has fifteen members , beginning with the Secretary of State , and followed by the rest in the order of their positions ' creation . Those heads of department who are ineligible to act as president are also ineligible to succeed the president by succession , for example most commonly if they are not a natural - born U.S. citizen . </P>",
    "topic": "Policy debates and proposed reforms to the current line of succession framework.",
    "response": "<document_analysis>\nThe context outlines the constitutional and statutory basis for the presidential line of succession: the vice presidency is mandated by the Constitution, while the order of the Speaker, President pro tempore, and cabinet officers is established by the Presidential Succession Act of 1947. Therefore, any reform that only alters the ranking among cabinet secretaries falls under the Act and can be achieved by statute. Removing or altering constitutional positions (such as the vice president) or changing eligibility rules tied to \u201cnatural-born\u201d status would require a constitutional amendment.\nDifficulty rating: 8/10 \u2013 This question probes experts\u2019 understanding of the interplay between constitutional mandates and statutory authority in succession law.\n</document_analysis>\n\n<output_format>\nQuestion: Considering the constitutional and statutory foundations of the presidential succession framework, which proposed change could be implemented solely by Congress through revision of the Presidential Succession Act of 1947 without amending the Constitution?\nA: Reordering the sequence of Cabinet department heads.\nB: Eliminating the requirement that successors be natural\u2011born U.S. citizens.\nC: Replacing the vice president with the Speaker of the House as first in line.\nD: Expanding eligibility to include state governors in the line of succession.\nExplanation: The order of Cabinet secretaries is defined by statute under the Succession Act, whereas altering citizenship criteria or the vice presidential slot involves constitutional provisions.\nCorrect Answer: A\n</output_format>",
    "question": "Considering the constitutional and statutory foundations of the presidential succession framework, which proposed change could be implemented solely by Congress through revision of the Presidential Succession Act of 1947 without amending the Constitution?",
    "choices": {
      "A": "Reordering the sequence of Cabinet department heads.",
      "B": "Eliminating the requirement that successors be natural\u2011born U.S. citizens.",
      "C": "Replacing the vice president with the Speaker of the House as first in line.",
      "D": "Expanding eligibility to include state governors in the line of succession."
    },
    "answer": "A",
    "explanation": "The order of Cabinet secretaries is defined by statute under the Succession Act, whereas altering citizenship criteria or the vice presidential slot involves constitutional provisions.",
    "question_token_count": 40,
    "answer_correctness_score": 10,
    "explanation_validity_score": 10,
    "question_clarity_score": 8,
    "question_difficulty_score": 8,
    "question_groundedness_score": 6,
    "avg_answer_token_count": 14
  },
  {
    "context": "<P> The history of the Great Wall of China began when fortifications built by various states during the Spring and Autumn ( 771 -- 476 BC ) and Warring States periods ( 475 -- 221 BC ) were connected by the first emperor of China , Qin Shi Huang , to protect his newly founded Qin dynasty ( 221 -- 206 BC ) against incursions by nomads from Inner Asia . The walls were built of rammed earth , constructed using forced labour , and by 212 BC ran from Gansu to the coast of southern Manchuria . </P>",
    "topic": "Discuss the engineering properties of rammed earth used in Qin\u2010period wall segments and assess its advantages and limitations for large\u2010scale fortification.",
    "response": "<document_analysis>\nThe context briefly notes that Qin\u2010period walls were built of rammed earth over long distances. Key engineering aspects of rammed earth include high compressive strength but low tensile and shear strength, susceptibility to moisture erosion, and reliance on massive cross\u2010sections to ensure stability. For large\u2010scale fortification, designers would exploit local materials and labor but compromise with broad, gently sloping walls to offset the material\u2019s weak lateral strength.  \nDifficulty: 8/10 (requires synthesis of material mechanics with historical application).\n</document_analysis>\n\n<output_format>\nQuestion: Which inherent property of rammed earth primarily dictated the need for Qin\u2010era walls to have broad, gently sloping bases, and what limitation does this property impose on such fortifications?\nA: Limited compressive strength, requiring frequent buttressing and reducing overall wall length  \nB: High hygroscopicity, causing cyclic swelling and limiting the use of elevated parapets  \nC: Low tensile and shear strength, necessitating wide foundations and restricting maximum wall height  \nD: Elevated thermal conductivity, forcing gentler slopes and limiting daily temperature fluctuations  \nExplanation: Rammed earth offers strong compressive but poor tensile and shear resistance, so Qin engineers built wide, gently sloping bases to ensure stability, which in turn limited how tall the walls could be.  \nCorrect Answer: C\n</output_format>",
    "question": "Which inherent property of rammed earth primarily dictated the need for Qin\u2010era walls to have broad, gently sloping bases, and what limitation does this property impose on such fortifications?",
    "choices": {
      "A": "Limited compressive strength, requiring frequent buttressing and reducing overall wall length",
      "B": "High hygroscopicity, causing cyclic swelling and limiting the use of elevated parapets",
      "C": "Low tensile and shear strength, necessitating wide foundations and restricting maximum wall height",
      "D": "Elevated thermal conductivity, forcing gentler slopes and limiting daily temperature fluctuations"
    },
    "answer": "C",
    "explanation": "Rammed earth offers strong compressive but poor tensile and shear resistance, so Qin engineers built wide, gently sloping bases to ensure stability, which in turn limited how tall the walls could be.",
    "question_token_count": 37,
    "answer_correctness_score": 10,
    "explanation_validity_score": 10,
    "question_clarity_score": 4,
    "question_difficulty_score": 8,
    "question_groundedness_score": 2,
    "avg_answer_token_count": 15
  },
  {
    "context": "<P> Article Five of the United States Constitution describes the process whereby the Constitution , the nation 's frame of government , may be altered . Altering the Constitution consists of proposing an amendment or amendments and subsequent ratification . Amendments may be proposed either by the Congress with a two - thirds vote in both the House of Representatives and the Senate or by a convention of states called for by two - thirds of the state legislatures . To become part of the Constitution , an amendment must be ratified by either -- as determined by Congress -- the legislatures of three - quarters of the states or state ratifying conventions in three - quarters of the states . The vote of each state ( to either ratify or reject a proposed amendment ) carries equal weight , regardless of a state 's population or length of time in the Union . </P>",
    "topic": "Discuss the possible constitutional and political ramifications if a convention of states under Article V were ever convened for the first time.",
    "response": "<document_analysis>\nThe context describes the Article V amendment process: proposals by Congress or a state-called convention, and ratification by three-quarters of states, with each state having one equal vote. It does not detail internal procedures for a convention of states. The key constitutional uncertainty is who defines and limits a convention\u2019s agenda and scope, creating the risk of a \u201crunaway convention\u201d that exceeds its original purpose. Other elements (delegate selection, Supreme Court oversight, ratification steps) are either less directly tied to a runaway risk or are addressed elsewhere. Thus, the most probing expert-level question examines this core procedural ambiguity.\n</document_analysis>\n\n<output_format>\nQuestion: Considering that Article\u00a0V authorizes a states\u2019 convention to propose amendments yet remains silent on its internal procedures, which constitutional ambiguity most directly creates the risk of a \u201crunaway convention\u201d exceeding its original mandate?\nA: Absence of any constitutional provision assigning responsibility for defining the convention\u2019s agenda and scope  \nB: Unclear whether amendments proposed by the convention require approval by two\u2011thirds of state legislatures before ratification  \nC: No constitutional constraint on how states select their convention delegates, potentially skewing representation  \nD: Silence regarding the Supreme Court\u2019s authority to review the convention\u2019s proceedings for constitutional compliance  \nExplanation: Article\u00a0V does not specify who sets or limits the convention\u2019s agenda, allowing delegates to potentially propose amendments beyond the original applications\u2014i.e., a \u201crunaway convention.\u201d  \nCorrect Answer: A\n</output_format>",
    "question": "Considering that Article\u00a0V authorizes a states\u2019 convention to propose amendments yet remains silent on its internal procedures, which constitutional ambiguity most directly creates the risk of a \u201crunaway convention\u201d exceeding its original mandate?",
    "choices": {
      "A": "Absence of any constitutional provision assigning responsibility for defining the convention\u2019s agenda and scope",
      "B": "Unclear whether amendments proposed by the convention require approval by two\u2011thirds of state legislatures before ratification",
      "C": "No constitutional constraint on how states select their convention delegates, potentially skewing representation",
      "D": "Silence regarding the Supreme Court\u2019s authority to review the convention\u2019s proceedings for constitutional compliance"
    },
    "answer": "A",
    "explanation": "Article\u00a0V does not specify who sets or limits the convention\u2019s agenda, allowing delegates to potentially propose amendments beyond the original applications\u2014i.e., a \u201crunaway convention.\u201d",
    "question_token_count": 42,
    "answer_correctness_score": 10,
    "explanation_validity_score": 10,
    "question_clarity_score": 6,
    "question_difficulty_score": 8,
    "question_groundedness_score": 4,
    "avg_answer_token_count": 18
  },
  {
    "context": "<Table> List of finals matches , their venues and locations , the finalists , and final scores <Tr> <Th> Year </Th> <Th> Winners </Th> <Th> Final score </Th> <Th> Runners - up </Th> <Th> Venue </Th> <Th> Location </Th> <Th> Attendance </Th> <Th> References </Th> </Tr> <Tr> <Th> 1930 </Th> <Td> Uruguay </Td> <Td> 4 -- 2 </Td> <Td> Argentina </Td> <Td> Estadio Centenario </Td> <Td> Montevideo , Uruguay </Td> <Td> 80,000 </Td> <Td> </Td> </Tr> <Tr> <Th> 1934 </Th> <Td> Italy </Td> <Td> 2 -- 1 </Td> <Td> Czechoslovakia </Td> <Td> Stadio Nazionale PNF </Td> <Td> Rome , Italy </Td> <Td> 50,000 </Td> <Td> </Td> </Tr> <Tr> <Th> 1938 </Th> <Td> Italy </Td> <Td> 4 -- 2 </Td> <Td> Hungary </Td> <Td> Stade Olympique de Colombes </Td> <Td> Paris , France </Td> <Td> 45,000 </Td> <Td> </Td> </Tr> <Tr> <Th> 1950 </Th> <Td> Uruguay </Td> <Td> 2 -- 1 </Td> <Td> Brazil </Td> <Td> Est\u00e1dio do Maracan\u00e3 </Td> <Td> Rio de Janeiro , Brazil </Td> <Td> 199,854 </Td> <Td> </Td> </Tr> <Tr> <Th> 1954 </Th> <Td> West Germany </Td> <Td> 3 -- 2 </Td> <Td> Hungary </Td> <Td> Wankdorf Stadium </Td> <Td> Bern , Switzerland </Td> <Td> 60,000 </Td> <Td> </Td> </Tr> <Tr> <Th> 1958 </Th> <Td> Brazil </Td> <Td> 5 -- 2 </Td> <Td> Sweden </Td> <Td> R\u00e5sunda Stadium </Td> <Td> Solna , Sweden </Td> <Td> 51,800 </Td> <Td> </Td> </Tr> <Tr> <Th> 1962 </Th> <Td> Brazil </Td> <Td> 3 -- 1 </Td> <Td> Czechoslovakia </Td> <Td> Estadio Nacional </Td> <Td> Santiago , Chile </Td> <Td> 69,000 </Td> <Td> </Td> </Tr> <Tr> <Th> 1966 </Th> <Td> England </Td> <Td> 4 -- 2 </Td> <Td> West Germany </Td> <Td> Wembley Stadium </Td> <Td> London , England </Td> <Td> 93,000 </Td> <Td> </Td> </Tr> <Tr> <Th> 1970 </Th> <Td> Brazil </Td> <Td> 4 -- 1 </Td> <Td> Italy </Td> <Td> Estadio Azteca </Td> <Td> Mexico City , Mexico </Td> <Td> 107,412 </Td> <Td> </Td> </Tr> <Tr> <Th> </Th> <Td> West Germany </Td> <Td> 2 -- 1 </Td> <Td> Netherlands </Td> <Td> Olympiastadion </Td> <Td> Munich , West Germany </Td> <Td> 75,200 </Td> <Td> </Td> </Tr> <Tr> <Th> 1978 </Th> <Td> Argentina </Td> <Td> 3 -- 1 </Td> <Td> Netherlands </Td> <Td> Estadio Monumental </Td> <Td> Buenos Aires , Argentina </Td> <Td> 71,483 </Td> <Td> </Td> </Tr> <Tr> <Th> 1982 </Th> <Td> Italy </Td> <Td> 3 -- 1 </Td> <Td> West Germany </Td> <Td> Santiago Bernab\u00e9u </Td> <Td> Madrid , Spain </Td> <Td> 90,000 </Td> <Td> </Td> </Tr> <Tr> <Th> 1986 </Th> <Td> Argentina </Td> <Td> 3 -- 2 </Td> <Td> West Germany </Td> <Td> Estadio Azteca </Td> <Td> Mexico City , Mexico </Td> <Td> 114,600 </Td> <Td> </Td> </Tr> <Tr> <Th> 1990 </Th> <Td> West Germany </Td> <Td> 1 -- 0 </Td> <Td> Argentina </Td> <Td> Stadio Olimpico </Td> <Td> Rome , Italy </Td> <Td> 73,603 </Td> <Td> </Td> </Tr> <Tr> <Th> 1994 </Th> <Td> Brazil </Td> <Td> 0 -- 0 </Td> <Td> Italy </Td> <Td> Rose Bowl </Td> <Td> Pasadena , United States </Td> <Td> 94,194 </Td> <Td> </Td> </Tr> <Tr> <Th> 1998 </Th> <Td> France </Td> <Td> 3 -- 0 </Td> <Td> Brazil </Td> <Td> Stade de France </Td> <Td> Saint - Denis , France </Td> <Td> 80,000 </Td> <Td> </Td> </Tr> <Tr> <Th> 2002 </Th> <Td> Brazil </Td> <Td> 2 -- 0 </Td> <Td> Germany </Td> <Td> International Stadium </Td> <Td> Yokohama , Japan </Td> <Td> 69,029 </Td> <Td> </Td> </Tr> <Tr> <Th> 2006 </Th> <Td> Italy </Td> <Td> 1 -- 1 </Td> <Td> France </Td> <Td> Olympiastadion </Td> <Td> Berlin , Germany </Td> <Td> 69,000 </Td> <Td> </Td> </Tr> <Tr> <Th> </Th> <Td> Spain </Td> <Td> 1 -- 0 </Td> <Td> Netherlands </Td> <Td> Soccer City </Td> <Td> Johannesburg , South Africa </Td> <Td> 84,490 </Td> <Td> </Td> </Tr> <Tr> <Th> 2014 </Th> <Td> Germany </Td> <Td> 1 -- 0 </Td> <Td> Argentina </Td> <Td> Est\u00e1dio do Maracan\u00e3 </Td> <Td> Rio de Janeiro , Brazil </Td> <Td> 74,738 </Td> <Td> </Td> </Tr> <Tr> <Th> 2018 </Th> <Td> France </Td> <Td> 4 -- 2 </Td> <Td> Croatia </Td> <Td> Luzhniki Stadium </Td> <Td> Moscow , Russia </Td> <Td> 78,011 </Td> <Td> </Td> </Tr> <Tr> <Th colspan=\"8\"> Upcoming finals </Th> </Tr> <Tr> <Th> Year </Th> <Th> Team 1 </Th> <Th> </Th> <Th> Team 2 </Th> <Th> Venue </Th> <Th> Location </Th> <Th> Attendance </Th> <Th> References </Th> </Tr> <Tr> <Th> 2022 </Th> <Td> </Td> <Td> </Td> <Td> </Td> <Td> Lusail Iconic Stadium </Td> <Td> Lusail , Qatar </Td> <Td> </Td> <Td> </Td> </Tr> <Tr> <Th> 2026 </Th> <Td> </Td> <Td> </Td> <Td> </Td> <Td> TBD </Td> <Td> United States </Td> <Td> </Td> <Td> </Td> </Tr> </Table>",
    "topic": "Compare the significance of high-scoring finals (e.g., Brazil 5\u20132 Sweden 1958) versus low-scoring or goalless finals (e.g., Brazil 0\u20130 Italy 1994) in shaping perceptions of tactical evolution.",
    "response": "<document_analysis>\nThe context provides a chronological listing of World Cup final scores, highlighting contrasts between high-scoring (e.g., Brazil 5\u20132 Sweden, 1958) and low-scoring or scoreless finals (e.g., Brazil 0\u20130 Italy, 1994). This contrast implies tactical shifts from open, high-risk attacking strategies to cautious, defense-first approaches. A deep question ties this scoring evolution to underlying strategic principles. Difficulty is rated 9/10 for requiring integration of historical data and abstract game\u2010theory concepts.\n</document_analysis>\n\n<output_format>\nQuestion: Which game-theoretic principle best captures the strategic shift from the open, high-scoring tactics of Brazil\u2019s 5\u20132 win in 1958 to the risk-averse, goalless draw between Brazil and Italy in 1994?\nA: Prisoner\u2019s dilemma\nB: Nash equilibrium\nC: Minimax strategy\nD: Pareto efficiency\nExplanation: The 1994 final reflects teams minimizing their maximum potential loss through defensive play, embodying the minimax strategy.\nCorrect Answer: C\n</output_format>",
    "question": "Which game-theoretic principle best captures the strategic shift from the open, high-scoring tactics of Brazil\u2019s 5\u20132 win in 1958 to the risk-averse, goalless draw between Brazil and Italy in 1994?",
    "choices": {
      "A": "Prisoner\u2019s dilemma",
      "B": "Nash equilibrium",
      "C": "Minimax strategy",
      "D": "Pareto efficiency"
    },
    "answer": "C",
    "explanation": "The 1994 final reflects teams minimizing their maximum potential loss through defensive play, embodying the minimax strategy.",
    "question_token_count": 49,
    "answer_correctness_score": 10,
    "explanation_validity_score": 10,
    "question_clarity_score": 8,
    "question_difficulty_score": 9,
    "question_groundedness_score": 6,
    "avg_answer_token_count": 4
  },
  {
    "context": "<P> The seventh season of the fantasy drama television series Game of Thrones premiered on HBO on July 16 , 2017 , and concluded on August 27 , 2017 . Unlike previous seasons that consisted of ten episodes each , the seventh season consisted of only seven . Like the previous season , it largely consisted of original content not found in George R.R. Martin 's A Song of Ice and Fire series , while also adapting material Martin revealed to showrunners about the upcoming novels in the series . The series was adapted for television by David Benioff and D.B. Weiss . </P>",
    "topic": "Consideration of the logistical and creative trade\u2011offs inherent in producing a condensed seven\u2011episode season for a high\u2011budget fantasy drama.",
    "response": "<document_analysis>\nThoughtful Content Examination:\nThe context outlines that the seventh season of a high\u2011budget fantasy drama diverged from its prior ten\u2011episode format, opting for only seven episodes, and that its narrative was largely composed of original material beyond the published novels, supplemented by unpublished content revealed by the author.\n\nConcept Exploration:\nThis shift suggests a deliberate creative strategy to maintain narrative momentum when source material is insufficient, highlighting trade\u2011offs between fidelity to original texts and the practical need to produce episodes on schedule.\n\nStrategic Complexity Calibration:\nDifficulty Level: 7/10\u2014requires understanding both logistical constraints (episode count) and creative adaptation strategies pulled from the author's unpublished work.\n\nIntentional Question Planning:\nThe question probes the interplay of logistical reduction and creative content generation, asking how showrunners addressed the shortage of published source material while keeping the story moving forward.\n</document_analysis>\n\n<output_format>\nQuestion: What strategy enabled the seventh season to maintain narrative progression despite lacking sufficient published source material?\nA: Extensively rewriting existing novel chapters to cover new plot developments.\nB: Creating predominantly original storylines supplemented by author\u2011provided details about upcoming novels.\nC: Introducing entirely new spin\u2011off characters with standalone arcs.\nD: Postponing major plot resolutions to future seasons until novels were published.\nExplanation: The season consisted largely of original content not found in the books, while also adapting material the author revealed about forthcoming novels.\nCorrect Answer: B\n</output_format>",
    "question": "What strategy enabled the seventh season to maintain narrative progression despite lacking sufficient published source material?",
    "choices": {
      "A": "Extensively rewriting existing novel chapters to cover new plot developments.",
      "B": "Creating predominantly original storylines supplemented by author\u2011provided details about upcoming novels.",
      "C": "Introducing entirely new spin\u2011off characters with standalone arcs.",
      "D": "Postponing major plot resolutions to future seasons until novels were published."
    },
    "answer": "B",
    "explanation": "The season consisted largely of original content not found in the books, while also adapting material the author revealed about forthcoming novels.",
    "question_token_count": 18,
    "answer_correctness_score": 10,
    "explanation_validity_score": 10,
    "question_clarity_score": 4,
    "question_difficulty_score": 8,
    "question_groundedness_score": 2,
    "avg_answer_token_count": 14
  },
  {
    "context": "<P> The history of the Great Wall of China began when fortifications built by various states during the Spring and Autumn ( 771 -- 476 BC ) and Warring States periods ( 475 -- 221 BC ) were connected by the first emperor of China , Qin Shi Huang , to protect his newly founded Qin dynasty ( 221 -- 206 BC ) against incursions by nomads from Inner Asia . The walls were built of rammed earth , constructed using forced labour , and by 212 BC ran from Gansu to the coast of southern Manchuria . </P>",
    "topic": "Discuss the broader socio-political ramifications of erecting a monumental border barrier on imperial identity, state cohesion, and frontier governance in early China.",
    "response": "<document_analysis>\nThe context describes the Qin dynasty\u2019s unification of existing walls into a monumental barrier, emphasizing the use of forced labor and the strategic span of the wall to guard against nomadic incursions. Key themes include state-driven mobilization of resources, the projection of centralized power across vast territories, and the symbolic demarcation of a civilizational frontier. This supports a question probing how such a project reinforced imperial identity and governance structures rather than an operational or purely military query.\nDifficulty rating: 8/10 \u2013 requires nuanced understanding of the socio-political implications of monumental architecture in early imperial China.\n</document_analysis>\n\n<output_format>\nQuestion: Which of the following best explains how the construction of the Great Wall under Qin Shi Huang served to reinforce the Qin state\u2019s imperial identity and centralized governance?\nA: By symbolically demarcating a cultural frontier between sedentary Chinese communities and Inner Asian nomads, fostering a shared civilizational identity.\nB: By delegating frontier defense to regional lords and military governors, improving localized responses to incursions while reducing court involvement.\nC: By manifesting the emperor\u2019s authority through large\u2011scale forced labor and resource mobilization across diverse regions, legitimizing his universal rule.\nD: By instituting voluntary peasant militias for construction, thereby enhancing civic participation and loyalty to the central government.\nExplanation: The wall\u2019s forced-labor construction and nationwide resource coordination showcased the Qin court\u2019s ability to command and unify disparate territories under a single imperial authority, legitimizing Qin Shi Huang\u2019s rule.\nCorrect Answer: C\n</output_format>",
    "question": "Which of the following best explains how the construction of the Great Wall under Qin Shi Huang served to reinforce the Qin state\u2019s imperial identity and centralized governance?",
    "choices": {
      "A": "By symbolically demarcating a cultural frontier between sedentary Chinese communities and Inner Asian nomads, fostering a shared civilizational identity.",
      "B": "By delegating frontier defense to regional lords and military governors, improving localized responses to incursions while reducing court involvement.",
      "C": "By manifesting the emperor\u2019s authority through large\u2011scale forced labor and resource mobilization across diverse regions, legitimizing his universal rule.",
      "D": "By instituting voluntary peasant militias for construction, thereby enhancing civic participation and loyalty to the central government."
    },
    "answer": "C",
    "explanation": "The wall\u2019s forced-labor construction and nationwide resource coordination showcased the Qin court\u2019s ability to command and unify disparate territories under a single imperial authority, legitimizing Qin Shi Huang\u2019s rule.",
    "question_token_count": 31,
    "answer_correctness_score": 10,
    "explanation_validity_score": 10,
    "question_clarity_score": 7,
    "question_difficulty_score": 8,
    "question_groundedness_score": 5,
    "avg_answer_token_count": 25
  },
  {
    "context": "<P> Super Bowl LII was an American football game played to determine the champion of the National Football League ( NFL ) for the 2017 season . The National Football Conference ( NFC ) champion Philadelphia Eagles defeated the American Football Conference ( AFC ) and defending Super Bowl LI champion New England Patriots , 41 -- 33 , to win their first Super Bowl and their first NFL title since 1960 . The game was played on February 4 , 2018 , at U.S. Bank Stadium in Minneapolis , Minnesota . This was the second time that a Super Bowl was played in Minneapolis , the northernmost city to ever host the event , after Super Bowl XXVI at the Metrodome during the 1991 season , and the sixth Super Bowl held in a cold - weather city . </P>",
    "topic": "Critically analyze how the Eagles\u2019 victory in Super Bowl LII reshaped franchise branding, fan engagement, and regional identity.",
    "response": "<document_analysis>\nThe context provides key facts: the Philadelphia Eagles defeated the Patriots 41\u201333 in Super Bowl LII, marking the franchise\u2019s first Super Bowl win and first NFL title since 1960, in Minneapolis\u2014the northernmost city to host the event. Although branding, fan engagement, and regional identity are not explicitly discussed, the groundbreaking end to a 57-year championship drought and the cold-weather setting imply a narrative of resilience and underdog triumph that directly informs franchise branding and regional identity. No irrelevant or bogus information is present.\nDifficulty rating: 8/10 \u2013 requires insight into brand narrative and regional identity impacts beyond mere factual recall.\n</document_analysis>\n\n<output_format>\nQuestion: How did the Eagles\u2019 first NFL title since 1960, achieved with a victory in the league\u2019s northernmost host city, most profoundly reshape the franchise\u2019s branding and regional identity?\nA: By positioning the Eagles as resilient underdogs overcoming a decades\u2011long championship drought  \nB: By highlighting the franchise\u2019s ability to dominate in cold\u2011weather environments  \nC: By cementing the Patriots rivalry as the central pillar of Philadelphia sports culture  \nD: By shifting the team\u2019s branding emphasis toward its defensive prowess  \nExplanation: Ending a 57\u2011year title drought became the central narrative, recasting the Eagles\u2019 brand around resilience and triumph over historical adversity.  \nCorrect Answer: A\n</output_format>",
    "question": "How did the Eagles\u2019 first NFL title since 1960, achieved with a victory in the league\u2019s northernmost host city, most profoundly reshape the franchise\u2019s branding and regional identity?",
    "choices": {
      "A": "By positioning the Eagles as resilient underdogs overcoming a decades\u2011long championship drought",
      "B": "By highlighting the franchise\u2019s ability to dominate in cold\u2011weather environments",
      "C": "By cementing the Patriots rivalry as the central pillar of Philadelphia sports culture",
      "D": "By shifting the team\u2019s branding emphasis toward its defensive prowess"
    },
    "answer": "A",
    "explanation": "Ending a 57\u2011year title drought became the central narrative, recasting the Eagles\u2019 brand around resilience and triumph over historical adversity.",
    "question_token_count": 38,
    "answer_correctness_score": 10,
    "explanation_validity_score": 10,
    "question_clarity_score": 6,
    "question_difficulty_score": 8,
    "question_groundedness_score": 4,
    "avg_answer_token_count": 14
  },
  {
    "context": "<P> The College Football Playoff selection committee chose the semifinalists following the conclusion of the 2017 regular season . Alabama and Georgia advanced to the national championship after winning the semifinal games hosted by the Sugar Bowl and the Rose Bowl , respectively , on January 1 , 2018 . The championship game was played at Mercedes - Benz Stadium in Atlanta , Georgia on January 8 , 2018 . </P>",
    "topic": "Evolution of the College Football Playoff format since its inception and its specific effects on the 2017 postseason structure",
    "response": "<document_analysis>\nThe context specifies that the CFP semifinal games in 2017 were hosted by the Sugar Bowl and the Rose Bowl. This implies the use of a rotating cycle among the New Year\u2019s Six bowls to serve as CFP semifinals. A deep, domain\u2011expert question can probe knowledge of this three\u2011year rotation pattern beyond just the 2017 sites. \nDifficulty: 8/10 \u2013 requires recall of the CFP\u2019s rotational hosting sequence and its forward application.\n</document_analysis>\n\n<output_format>\nQuestion: Given that the Sugar Bowl and the Rose Bowl served as the CFP semifinal sites in 2017, which pair of New Year\u2019s Six bowls would host the semifinals in the next two playoff cycles?\nA: Fiesta and Peach in 2018; Orange and Cotton in 2019  \nB: Orange and Peach in 2018; Cotton and Fiesta in 2019  \nC: Orange and Cotton in 2018; Fiesta and Peach in 2019  \nD: Cotton and Fiesta in 2018; Peach and Orange in 2019  \nExplanation: The CFP rotates its semifinal slots among the New Year\u2019s Six bowls on a three\u2011year cycle: Rose & Sugar, then Orange & Cotton, then Fiesta & Peach. After the Sugar/Rose pairing in 2017, the next cycles are Orange & Cotton (2018) and Fiesta & Peach (2019).  \nCorrect Answer: C\n</output_format>",
    "question": "Given that the Sugar Bowl and the Rose Bowl served as the CFP semifinal sites in 2017, which pair of New Year\u2019s Six bowls would host the semifinals in the next two playoff cycles?",
    "choices": {
      "A": "Fiesta and Peach in 2018; Orange and Cotton in 2019",
      "B": "Orange and Peach in 2018; Cotton and Fiesta in 2019",
      "C": "Orange and Cotton in 2018; Fiesta and Peach in 2019",
      "D": "Cotton and Fiesta in 2018; Peach and Orange in 2019"
    },
    "answer": "C",
    "explanation": "The CFP rotates its semifinal slots among the New Year\u2019s Six bowls on a three\u2011year cycle: Rose & Sugar, then Orange & Cotton, then Fiesta & Peach. After the Sugar/Rose pairing in 2017, the next cycles are Orange & Cotton (2018) and Fiesta & Peach (2019).",
    "question_token_count": 42,
    "answer_correctness_score": 10,
    "explanation_validity_score": 10,
    "question_clarity_score": 8,
    "question_difficulty_score": 9,
    "question_groundedness_score": 1,
    "avg_answer_token_count": 16
  },
  {
    "context": "<Table> <Tr> <Th> No . </Th> <Th> Athlete </Th> <Th> Nation </Th> <Th> Sport </Th> <Th> Years </Th> <Th> Games </Th> <Th> Gender </Th> <Th> Gold </Th> <Th> Silver </Th> <Th> Bronze </Th> <Th> Total </Th> </Tr> <Tr> <Th> </Th> <Td> Phelps , Michael Michael Phelps </Td> <Td> United States </Td> <Td> Swimming </Td> <Td> 2004 -- 2016 </Td> <Td> Summer </Td> <Td> </Td> <Td> 23 </Td> <Td> </Td> <Td> </Td> <Td> 28 </Td> </Tr> <Tr> <Th> </Th> <Td> Latynina , Larisa Larisa Latynina </Td> <Td> Soviet Union </Td> <Td> Gymnastics </Td> <Td> 1956 -- 1964 </Td> <Td> Summer </Td> <Td> </Td> <Td> 9 </Td> <Td> 5 </Td> <Td> </Td> <Td> 18 </Td> </Tr> <Tr> <Th> </Th> <Td> Nurmi , Paavo Paavo Nurmi </Td> <Td> Finland </Td> <Td> Athletics </Td> <Td> 1920 -- 1928 </Td> <Td> Summer </Td> <Td> </Td> <Td> 9 </Td> <Td> </Td> <Td> 0 </Td> <Td> 12 </Td> </Tr> <Tr> <Th> </Th> <Td> Spitz , Mark Mark Spitz </Td> <Td> United States </Td> <Td> Swimming </Td> <Td> 1968 -- 1972 </Td> <Td> Summer </Td> <Td> </Td> <Td> 9 </Td> <Td> </Td> <Td> </Td> <Td> 11 </Td> </Tr> <Tr> <Th> 5 </Th> <Td> Lewis , Carl Carl Lewis </Td> <Td> United States </Td> <Td> Athletics </Td> <Td> 1984 -- 1996 </Td> <Td> Summer </Td> <Td> </Td> <Td> 9 </Td> <Td> </Td> <Td> 0 </Td> <Td> 10 </Td> </Tr> <Tr> <Th> 6 </Th> <Td> Bj\u00f8rgen , Marit Marit Bj\u00f8rgen </Td> <Td> Norway </Td> <Td> Cross-country skiing </Td> <Td> 2002 -- 2018 </Td> <Td> Winter </Td> <Td> </Td> <Td> 8 </Td> <Td> </Td> <Td> </Td> <Td> 15 </Td> </Tr> <Tr> <Th> 7 </Th> <Td> Bj\u00f8rndalen , Ole Einar Ole Einar Bj\u00f8rndalen </Td> <Td> Norway </Td> <Td> Biathlon </Td> <Td> 1998 -- 2014 </Td> <Td> Winter </Td> <Td> </Td> <Td> 8 </Td> <Td> </Td> <Td> </Td> <Td> 13 </Td> </Tr> <Tr> <Th> 8 </Th> <Td> D\u00e6hlie , Bj\u00f8rn Bj\u00f8rn D\u00e6hlie </Td> <Td> Norway </Td> <Td> Cross-country skiing </Td> <Td> 1992 -- 1998 </Td> <Td> Winter </Td> <Td> </Td> <Td> 8 </Td> <Td> </Td> <Td> 0 </Td> <Td> 12 </Td> </Tr> <Tr> <Td> Fischer , Birgit Birgit Fischer </Td> <Td> East Germany Germany </Td> <Td> Canoeing </Td> <Td> 1980 -- 2004 </Td> <Td> Summer </Td> <Td> </Td> <Td> 8 </Td> <Td> </Td> <Td> 0 </Td> <Td> 12 </Td> </Tr> <Tr> <Th> 10 </Th> <Td> Kato , Sawao Sawao Kato </Td> <Td> Japan </Td> <Td> Gymnastics </Td> <Td> 1968 -- 1976 </Td> <Td> Summer </Td> <Td> </Td> <Td> 8 </Td> <Td> </Td> <Td> </Td> <Td> 12 </Td> </Tr> <Tr> <Td> Thompson , Jenny Jenny Thompson </Td> <Td> United States </Td> <Td> Swimming </Td> <Td> 1992 -- 2004 </Td> <Td> Summer </Td> <Td> </Td> <Td> 8 </Td> <Td> </Td> <Td> </Td> <Td> 12 </Td> </Tr> <Tr> <Th> 12 </Th> <Td> Biondi , Matt Matt Biondi </Td> <Td> United States </Td> <Td> Swimming </Td> <Td> 1984 -- 1992 </Td> <Td> Summer </Td> <Td> </Td> <Td> 8 </Td> <Td> </Td> <Td> </Td> <Td> 11 </Td> </Tr> <Tr> <Th> 13 </Th> <Td> Bolt , Usain Usain Bolt </Td> <Td> Jamaica </Td> <Td> Athletics </Td> <Td> 2008 -- 2016 </Td> <Td> Summer </Td> <Td> </Td> <Td> 8 </Td> <Td> 0 </Td> <Td> 0 </Td> <Td> 8 </Td> </Tr> <Tr> <Td> Ewry , Ray Ray Ewry </Td> <Td> United States </Td> <Td> Athletics </Td> <Td> 1900 -- 1908 </Td> <Td> Summer </Td> <Td> </Td> <Td> 8 </Td> <Td> 0 </Td> <Td> 0 </Td> <Td> 8 </Td> </Tr> <Tr> <Th> 15 </Th> <Td> Andrianov , Nikolai Nikolai Andrianov </Td> <Td> Soviet Union </Td> <Td> Gymnastics </Td> <Td> 1972 -- 1980 </Td> <Td> Summer </Td> <Td> </Td> <Td> 7 </Td> <Td> 5 </Td> <Td> </Td> <Td> 15 </Td> </Tr> <Tr> <Th> 16 </Th> <Td> Shakhlin , Boris Boris Shakhlin </Td> <Td> Soviet Union </Td> <Td> Gymnastics </Td> <Td> 1956 -- 1964 </Td> <Td> Summer </Td> <Td> </Td> <Td> 7 </Td> <Td> </Td> <Td> </Td> <Td> 13 </Td> </Tr> <Tr> <Th> 17 </Th> <Td> \u010c\u00e1slavsk\u00e1 , V\u011bra V\u011bra \u010c\u00e1slavsk\u00e1 </Td> <Td> Czechoslovakia </Td> <Td> Gymnastics </Td> <Td> 1960 -- 1968 </Td> <Td> Summer </Td> <Td> </Td> <Td> 7 </Td> <Td> </Td> <Td> 0 </Td> <Td> 11 </Td> </Tr> <Tr> <Th> 18 </Th> <Td> Chukarin , Viktor Viktor Chukarin </Td> <Td> Soviet Union </Td> <Td> Gymnastics </Td> <Td> 1952 -- 1956 </Td> <Td> Summer </Td> <Td> </Td> <Td> 7 </Td> <Td> </Td> <Td> </Td> <Td> 11 </Td> </Tr> <Tr> <Th> 19 </Th> <Td> Gerevich , Alad\u00e1r Alad\u00e1r Gerevich </Td> <Td> Hungary </Td> <Td> Fencing </Td> <Td> 1932 -- 1960 </Td> <Td> Summer </Td> <Td> </Td> <Td> 7 </Td> <Td> </Td> <Td> </Td> <Td> 10 </Td> </Tr> <Tr> <Th> 20 </Th> <Td> Mangiarotti , Edoardo Edoardo Mangiarotti </Td> <Td> Italy </Td> <Td> Fencing </Td> <Td> 1936 -- 1960 </Td> <Td> Summer </Td> <Td> </Td>",
    "topic": "Compare career longevity factors for multi\u2010medalists across sports, using Michael Phelps (2004\u20132016) versus Birgit Fischer (1980\u20132004) as case studies.",
    "response": "<document_analysis>\nThe context provides a comparison between two Olympic multi\u2010medalists\u2014Michael Phelps (swimming, 2004\u20132016, 12\u2005years) and Birgit Fischer (canoeing, 1980\u20132004, 24\u2005years)\u2014highlighting their sport, medal counts, and career spans. Central themes include discipline\u2010specific physical demands, muscle action types, injury risk, aging curves, and technical versus power components. A probing question can explore why a canoeist sustains elite performance over twice the Olympic cycles of a swimmer. Key differences: swimming strokes involve significant eccentric loading and joint stress, whereas canoeing relies predominantly on concentric muscle actions with lower eccentric microtrauma. This subtle muscle\u2010physiology contrast is not obvious yet critical for domain experts. The difficulty is high (8/10).\n</document_analysis>\n\n<output_format>\nQuestion: The 24\u2010year Olympic career span of Birgit Fischer compared to Michael Phelps\u2019 12\u2010year span is best attributed to which discipline-specific training characteristic?\nA: Canoeing\u2019s primary reliance on concentric muscle contractions significantly reduces cumulative muscle microtrauma relative to the eccentric muscle stress inherent in swimming strokes.\nB: Canoeing contests occur less frequently than swimming events, allowing canoeists longer recovery intervals between peak competitions.\nC: Canoeing techniques are uniform across distances, reducing the need for event-specific specialization and burnout risk.\nD: Canoeing\u2019s greater emphasis on lower-body power, which declines more slowly with age than upper-body power, extends competitive longevity.\nExplanation: Canoeists predominantly perform concentric muscle work during paddling, minimizing eccentric-induced muscle damage and joint wear, which supports longer elite careers.\nCorrect Answer: A\n</output_format>",
    "question": "The 24\u2010year Olympic career span of Birgit Fischer compared to Michael Phelps\u2019 12\u2010year span is best attributed to which discipline-specific training characteristic?",
    "choices": {
      "A": "Canoeing\u2019s primary reliance on concentric muscle contractions significantly reduces cumulative muscle microtrauma relative to the eccentric muscle stress inherent in swimming strokes.",
      "B": "Canoeing contests occur less frequently than swimming events, allowing canoeists longer recovery intervals between peak competitions.",
      "C": "Canoeing techniques are uniform across distances, reducing the need for event-specific specialization and burnout risk.",
      "D": "Canoeing\u2019s greater emphasis on lower-body power, which declines more slowly with age than upper-body power, extends competitive longevity."
    },
    "answer": "A",
    "explanation": "Canoeists predominantly perform concentric muscle work during paddling, minimizing eccentric-induced muscle damage and joint wear, which supports longer elite careers.",
    "question_token_count": 34,
    "answer_correctness_score": 8,
    "explanation_validity_score": 9,
    "question_clarity_score": 6,
    "question_difficulty_score": 8,
    "question_groundedness_score": 4,
    "avg_answer_token_count": 24
  },
  {
    "context": "<Table> List of finals matches , their venues and locations , the finalists , and final scores <Tr> <Th> Year </Th> <Th> Winners </Th> <Th> Final score </Th> <Th> Runners - up </Th> <Th> Venue </Th> <Th> Location </Th> <Th> Attendance </Th> <Th> References </Th> </Tr> <Tr> <Th> 1930 </Th> <Td> Uruguay </Td> <Td> 4 -- 2 </Td> <Td> Argentina </Td> <Td> Estadio Centenario </Td> <Td> Montevideo , Uruguay </Td> <Td> 80,000 </Td> <Td> </Td> </Tr> <Tr> <Th> 1934 </Th> <Td> Italy </Td> <Td> 2 -- 1 </Td> <Td> Czechoslovakia </Td> <Td> Stadio Nazionale PNF </Td> <Td> Rome , Italy </Td> <Td> 50,000 </Td> <Td> </Td> </Tr> <Tr> <Th> 1938 </Th> <Td> Italy </Td> <Td> 4 -- 2 </Td> <Td> Hungary </Td> <Td> Stade Olympique de Colombes </Td> <Td> Paris , France </Td> <Td> 45,000 </Td> <Td> </Td> </Tr> <Tr> <Th> 1950 </Th> <Td> Uruguay </Td> <Td> 2 -- 1 </Td> <Td> Brazil </Td> <Td> Est\u00e1dio do Maracan\u00e3 </Td> <Td> Rio de Janeiro , Brazil </Td> <Td> 199,854 </Td> <Td> </Td> </Tr> <Tr> <Th> 1954 </Th> <Td> West Germany </Td> <Td> 3 -- 2 </Td> <Td> Hungary </Td> <Td> Wankdorf Stadium </Td> <Td> Bern , Switzerland </Td> <Td> 60,000 </Td> <Td> </Td> </Tr> <Tr> <Th> 1958 </Th> <Td> Brazil </Td> <Td> 5 -- 2 </Td> <Td> Sweden </Td> <Td> R\u00e5sunda Stadium </Td> <Td> Solna , Sweden </Td> <Td> 51,800 </Td> <Td> </Td> </Tr> <Tr> <Th> 1962 </Th> <Td> Brazil </Td> <Td> 3 -- 1 </Td> <Td> Czechoslovakia </Td> <Td> Estadio Nacional </Td> <Td> Santiago , Chile </Td> <Td> 69,000 </Td> <Td> </Td> </Tr> <Tr> <Th> 1966 </Th> <Td> England </Td> <Td> 4 -- 2 </Td> <Td> West Germany </Td> <Td> Wembley Stadium </Td> <Td> London , England </Td> <Td> 93,000 </Td> <Td> </Td> </Tr> <Tr> <Th> 1970 </Th> <Td> Brazil </Td> <Td> 4 -- 1 </Td> <Td> Italy </Td> <Td> Estadio Azteca </Td> <Td> Mexico City , Mexico </Td> <Td> 107,412 </Td> <Td> </Td> </Tr> <Tr> <Th> </Th> <Td> West Germany </Td> <Td> 2 -- 1 </Td> <Td> Netherlands </Td> <Td> Olympiastadion </Td> <Td> Munich , West Germany </Td> <Td> 75,200 </Td> <Td> </Td> </Tr> <Tr> <Th> 1978 </Th> <Td> Argentina </Td> <Td> 3 -- 1 </Td> <Td> Netherlands </Td> <Td> Estadio Monumental </Td> <Td> Buenos Aires , Argentina </Td> <Td> 71,483 </Td> <Td> </Td> </Tr> <Tr> <Th> 1982 </Th> <Td> Italy </Td> <Td> 3 -- 1 </Td> <Td> West Germany </Td> <Td> Santiago Bernab\u00e9u </Td> <Td> Madrid , Spain </Td> <Td> 90,000 </Td> <Td> </Td> </Tr> <Tr> <Th> 1986 </Th> <Td> Argentina </Td> <Td> 3 -- 2 </Td> <Td> West Germany </Td> <Td> Estadio Azteca </Td> <Td> Mexico City , Mexico </Td> <Td> 114,600 </Td> <Td> </Td> </Tr> <Tr> <Th> 1990 </Th> <Td> West Germany </Td> <Td> 1 -- 0 </Td> <Td> Argentina </Td> <Td> Stadio Olimpico </Td> <Td> Rome , Italy </Td> <Td> 73,603 </Td> <Td> </Td> </Tr> <Tr> <Th> 1994 </Th> <Td> Brazil </Td> <Td> 0 -- 0 </Td> <Td> Italy </Td> <Td> Rose Bowl </Td> <Td> Pasadena , United States </Td> <Td> 94,194 </Td> <Td> </Td> </Tr> <Tr> <Th> 1998 </Th> <Td> France </Td> <Td> 3 -- 0 </Td> <Td> Brazil </Td> <Td> Stade de France </Td> <Td> Saint - Denis , France </Td> <Td> 80,000 </Td> <Td> </Td> </Tr> <Tr> <Th> 2002 </Th> <Td> Brazil </Td> <Td> 2 -- 0 </Td> <Td> Germany </Td> <Td> International Stadium </Td> <Td> Yokohama , Japan </Td> <Td> 69,029 </Td> <Td> </Td> </Tr> <Tr> <Th> 2006 </Th> <Td> Italy </Td> <Td> 1 -- 1 </Td> <Td> France </Td> <Td> Olympiastadion </Td> <Td> Berlin , Germany </Td> <Td> 69,000 </Td> <Td> </Td> </Tr> <Tr> <Th> </Th> <Td> Spain </Td> <Td> 1 -- 0 </Td> <Td> Netherlands </Td> <Td> Soccer City </Td> <Td> Johannesburg , South Africa </Td> <Td> 84,490 </Td> <Td> </Td> </Tr> <Tr> <Th> 2014 </Th> <Td> Germany </Td> <Td> 1 -- 0 </Td> <Td> Argentina </Td> <Td> Est\u00e1dio do Maracan\u00e3 </Td> <Td> Rio de Janeiro , Brazil </Td> <Td> 74,738 </Td> <Td> </Td> </Tr> <Tr> <Th> 2018 </Th> <Td> France </Td> <Td> 4 -- 2 </Td> <Td> Croatia </Td> <Td> Luzhniki Stadium </Td> <Td> Moscow , Russia </Td> <Td> 78,011 </Td> <Td> </Td> </Tr> <Tr> <Th colspan=\"8\"> Upcoming finals </Th> </Tr> <Tr> <Th> Year </Th> <Th> Team 1 </Th> <Th> </Th> <Th> Team 2 </Th> <Th> Venue </Th> <Th> Location </Th> <Th> Attendance </Th> <Th> References </Th> </Tr> <Tr> <Th> 2022 </Th> <Td> </Td> <Td> </Td> <Td> </Td> <Td> Lusail Iconic Stadium </Td> <Td> Lusail , Qatar </Td> <Td> </Td> <Td> </Td> </Tr> <Tr> <Th> 2026 </Th> <Td> </Td> <Td> </Td> <Td> </Td> <Td> TBD </Td> <Td> United States </Td> <Td> </Td> <Td> </Td> </Tr> </Table>",
    "topic": "Analyze the statistical trends in final match goal totals from 1930 to 2018 and discuss what these patterns reveal about the evolution of World Cup competition intensity.",
    "response": "<document_analysis>\nThe context lists World Cup final match scores from 1930 to 2018, showing totals per game: high (6 goals) early, a mid-century decline to very low (0\u20131 goals) in the 1990s/2000s, then a resurgence (6 goals) in 2018. This reveals a U\u2011shaped trend in goals per final, suggesting shifts in tactical emphasis over eras. A suitably challenging question asks for the strategic interpretation of this pattern, with plausible distractors attributing the trend to non-tactical factors.\n</document_analysis>\n\n<output_format>\nQuestion: Considering that World Cup finals averaged approximately 5 goals per match in the 1930s, declined to about 1 goal in the 1990s and early 2000s, and then rebounded to 6 goals in 2018, which interpretation most accurately describes the evolution of tactical emphasis in these matches?\nA: Early tournaments favored open, attacking play; mid\u2011era matches prioritized defensive structure; recent finals reflect a resurgence of high\u2011intensity offense balanced by modern strategic planning.\nB: Fluctuations in goals were primarily driven by varying climatic conditions and pitch quality at host venues, rather than changes in team tactics.\nC: Variations in ball design and referee leniency are solely responsible for scoring differences, with no significant tactical evolution.\nD: There has been a continuous trend toward defensive tactics throughout all eras, with only isolated anomalies in the 1930s and 2018 that temporarily increased scoring.\nExplanation: The pronounced drop from ~5 to ~1 goal and later rise to 6 indicates a shift from early attacking tactics to defense\u2011oriented strategies in the mid\u2011century, followed by a modern revival of offensive play and strategic balance.\nCorrect Answer: A\n</output_format>",
    "question": "Considering that World Cup finals averaged approximately 5 goals per match in the 1930s, declined to about 1 goal in the 1990s and early 2000s, and then rebounded to 6 goals in 2018, which interpretation most accurately describes the evolution of tactical emphasis in these matches?",
    "choices": {
      "A": "Early tournaments favored open, attacking play; mid\u2011era matches prioritized defensive structure; recent finals reflect a resurgence of high\u2011intensity offense balanced by modern strategic planning.",
      "B": "Fluctuations in goals were primarily driven by varying climatic conditions and pitch quality at host venues, rather than changes in team tactics.",
      "C": "Variations in ball design and referee leniency are solely responsible for scoring differences, with no significant tactical evolution.",
      "D": "There has been a continuous trend toward defensive tactics throughout all eras, with only isolated anomalies in the 1930s and 2018 that temporarily increased scoring."
    },
    "answer": "A",
    "explanation": "The pronounced drop from ~5 to ~1 goal and later rise to 6 indicates a shift from early attacking tactics to defense\u2011oriented strategies in the mid\u2011century, followed by a modern revival of offensive play and strategic balance.",
    "question_token_count": 66,
    "answer_correctness_score": 9,
    "explanation_validity_score": 9,
    "question_clarity_score": 6,
    "question_difficulty_score": 8,
    "question_groundedness_score": 9,
    "avg_answer_token_count": 29
  },
  {
    "context": "<P> The Astros played in the NL from 1962 to 2012 . They played in the West Division from 1969 to 1993 , and the Central Division from 1994 to 2012 . While a member of the NL , the Astros played in one World Series , in 2005 , against the Chicago White Sox , in which they were swept in four games . In 2017 , they became the first franchise in MLB history to have won a pennant in both the NL and the AL , when they defeated the New York Yankees in the ALCS . They subsequently won the 2017 World Series against the Los Angeles Dodgers , winning four games to three , earning the team , and Texas , its first World Series title . </P>",
    "topic": "Examine the strategic and competitive consequences of the Astros\u2019 divisional realignments in the NL West (1969\u20131993) and NL Central (1994\u20132012).",
    "response": "<document_analysis>\nThe provided context details the Astros\u2019 divisional tenures: NL West from 1969\u20131993 and NL Central from 1994\u20132012. It gives precise start and end years, allowing calculation of the lengths of each period. This timeline supports an inference question about comparative tenure durations. There is no irrelevant or bogus content; the data is coherent and educationally viable.\n</document_analysis>\n\n<output_format>\nQuestion: By how many seasons did the Astros\u2019 tenure in the NL West exceed their tenure in the NL Central?\nA: 4 seasons\nB: 5 seasons\nC: 6 seasons\nD: 7 seasons\nExplanation: The Astros spent 25 seasons in the NL West (1969\u20131993) and 19 seasons in the NL Central (1994\u20132012), a difference of 6 seasons.\nCorrect Answer: C\n</output_format>",
    "question": "By how many seasons did the Astros\u2019 tenure in the NL West exceed their tenure in the NL Central?",
    "choices": {
      "A": "4 seasons",
      "B": "5 seasons",
      "C": "6 seasons",
      "D": "7 seasons"
    },
    "answer": "C",
    "explanation": "The Astros spent 25 seasons in the NL West (1969\u20131993) and 19 seasons in the NL Central (1994\u20132012), a difference of 6 seasons.",
    "question_token_count": 23,
    "answer_correctness_score": 10,
    "explanation_validity_score": 10,
    "question_clarity_score": 8,
    "question_difficulty_score": 4,
    "question_groundedness_score": 10,
    "avg_answer_token_count": 3
  },
  {
    "context": "<P> Article Five of the United States Constitution describes the process whereby the Constitution , the nation 's frame of government , may be altered . Altering the Constitution consists of proposing an amendment or amendments and subsequent ratification . Amendments may be proposed either by the Congress with a two - thirds vote in both the House of Representatives and the Senate or by a convention of states called for by two - thirds of the state legislatures . To become part of the Constitution , an amendment must be ratified by either -- as determined by Congress -- the legislatures of three - quarters of the states or state ratifying conventions in three - quarters of the states . The vote of each state ( to either ratify or reject a proposed amendment ) carries equal weight , regardless of a state 's population or length of time in the Union . </P>",
    "topic": "Investigate the potential risks and benefits of convening an Article V convention, including the \u201crunaway convention\u201d debate.",
    "response": "<document_analysis>\nThe context outlines Article V\u2019s dual pathways for proposing amendments (Congress or state convention) and two ratification options, emphasizing supermajority requirements and equal state weighting. Central to the \u201crunaway convention\u201d debate is whether a convention might exceed its mandate, and which aspects of Article V guard against unauthorized or radically divergent amendments. The key safeguard is the high ratification threshold, which ensures amendments\u2014regardless of how they are proposed\u2014cannot be adopted without broad consensus among three\u2011quarters of the states. This drives a question that probes understanding of how procedural thresholds mitigate the risk of a convention running amok.\n</document_analysis>\n\n<output_format>\nQuestion: Under Article\u00a0V of the U.S. Constitution, which procedural design element most effectively restricts a constitutional convention from adopting amendments without broad national consent, thereby countering the \u201crunaway convention\u201d risk?\nA: The requirement that two\u2011thirds of state legislatures must apply to call a convention  \nB: The stipulation that Congress must define the convention\u2019s scope before it convenes  \nC: The rule that each state\u2019s vote carries equal weight in deciding ratification  \nD: The mandate that three\u2011quarters of the states must ratify any proposed amendment  \nExplanation: The three\u2011quarters ratification threshold ensures that no amendments, even if proposed by an unchecked convention, can become part of the Constitution without overwhelming state approval.  \nCorrect Answer: D\n</output_format>",
    "question": "Under Article\u00a0V of the U.S. Constitution, which procedural design element most effectively restricts a constitutional convention from adopting amendments without broad national consent, thereby countering the \u201crunaway convention\u201d risk?",
    "choices": {
      "A": "The requirement that two\u2011thirds of state legislatures must apply to call a convention",
      "B": "The stipulation that Congress must define the convention\u2019s scope before it convenes",
      "C": "The rule that each state\u2019s vote carries equal weight in deciding ratification",
      "D": "The mandate that three\u2011quarters of the states must ratify any proposed amendment"
    },
    "answer": "D",
    "explanation": "The three\u2011quarters ratification threshold ensures that no amendments, even if proposed by an unchecked convention, can become part of the Constitution without overwhelming state approval.",
    "question_token_count": 40,
    "answer_correctness_score": 10,
    "explanation_validity_score": 10,
    "question_clarity_score": 6,
    "question_difficulty_score": 8,
    "question_groundedness_score": 9,
    "avg_answer_token_count": 16
  }
]