[
  {
    "context": "In March 1861, Victoria's mother died, with Victoria at her side. Through reading her mother's papers, Victoria discovered that her mother had loved her deeply; she was heart-broken, and blamed Conroy and Lehzen for \"wickedly\" estranging her from her mother. To relieve his wife during her intense and deep grief, Albert took on most of her duties, despite being ill himself with chronic stomach trouble. In August, Victoria and Albert visited their son, the Prince of Wales, who was attending army manoeuvres near Dublin, and spent a few days holidaying in Killarney. In November, Albert was made aware of gossip that his son had slept with an actress in Ireland. Appalled, Albert travelled to Cambridge, where his son was studying, to confront him. By the beginning of December, Albert was very unwell. He was diagnosed with typhoid fever by William Jenner, and died on 14 December 1861. Victoria was devastated. She blamed her husband's death on worry over the Prince of Wales's philandering. He had been \"killed by that dreadful business\", she said. She entered a state of mourning and wore black for the remainder of her life. She avoided public appearances, and rarely set foot in London in the following years. Her seclusion earned her the nickname \"widow of Windsor\".",
    "topic": "The circumstances surrounding the Prince of Wales\u2019s alleged misconduct in Ireland and its effect on Prince Albert.",
    "response": "```xml\n<document_analysis>\n1. **Thoughtful Content Examination:** The text details a period of significant emotional distress for Queen Victoria, stemming from her mother's death and, crucially, the alleged misconduct of her son, the Prince of Wales, in Ireland. This misconduct and Albert's reaction to it are directly linked to Albert's declining health and eventual death. The core theme revolves around the impact of familial scandal on personal health and royal duty.\n2. **Concept Exploration:** The text subtly explores themes of duty, reputation, and the burden of royal life. The implication is that maintaining the image of the monarchy was paramount, and the Prince of Wales's actions threatened that image. Albert\u2019s response highlights the conflict between parental love and the need to uphold moral standards. The Queen\u2019s subsequent seclusion speaks to the profound effect of grief and the weight of her position.\n3. **Strategic Complexity Calibration:** Difficulty: 9/10. The question targets a nuanced understanding of the causal relationships presented in the text, requiring the expert to connect seemingly disparate events (the Prince of Wales\u2019s actions, Albert\u2019s reaction, and Albert\u2019s death). It moves beyond simple recall and demands interpretive reasoning.\n4. **Intentional Question Planning:** The question is designed to assess the domain expert\u2019s understanding of the extent to which Albert\u2019s health was directly impacted by the scandal involving the Prince of Wales, forcing a consideration of Victoria\u2019s attribution of blame and the context of Albert\u2019s pre-existing health condition. It avoids direct quotation and requires synthesis of information.\n</document_analysis>\n<output_format>\nQuestion: To what extent did the allegations concerning the Prince of Wales\u2019s conduct in Ireland directly contribute to Prince Albert\u2019s fatal illness, according to the prevailing interpretation within the context of the royal family at the time?\nA: Albert\u2019s pre-existing stomach trouble was the sole cause of his illness, and the allegations were merely a coincidental stressor.\nB: While Albert was already ill, Victoria attributed his death to the \u201cdreadful business\u201d involving his son, suggesting a causal link in her grief-stricken assessment.\nC: The allegations triggered a swift and severe decline in Albert\u2019s health, resulting in a diagnosis of typhoid fever within days of learning of the scandal.\nD: Albert dismissed the allegations as mere gossip and continued his duties without any noticeable impact on his physical condition.\nExplanation: The text explicitly states that Victoria blamed Albert\u2019s death on worry over the Prince of Wales's philandering, stating he had been \"killed by that dreadful business\". While Albert already had chronic stomach trouble, Victoria\u2019s belief in a direct causal link, and the text\u2019s framing of the events, makes option B the most accurate.\nCorrect Answer: B\n</output_format>\n```",
    "question": "To what extent did the allegations concerning the Prince of Wales\u2019s conduct in Ireland directly contribute to Prince Albert\u2019s fatal illness, according to the prevailing interpretation within the context of the royal family at the time?",
    "choices": {
      "A": "Albert\u2019s pre-existing stomach trouble was the sole cause of his illness, and the allegations were merely a coincidental stressor.",
      "B": "While Albert was already ill, Victoria attributed his death to the \u201cdreadful business\u201d involving his son, suggesting a causal link in her grief-stricken assessment.",
      "C": "The allegations triggered a swift and severe decline in Albert\u2019s health, resulting in a diagnosis of typhoid fever within days of learning of the scandal.",
      "D": "Albert dismissed the allegations as mere gossip and continued his duties without any noticeable impact on his physical condition."
    },
    "answer": "B",
    "explanation": "The text explicitly states that Victoria blamed Albert\u2019s death on worry over the Prince of Wales's philandering, stating he had been \"killed by that dreadful business\". While Albert already had chronic stomach trouble, Victoria\u2019s belief in a direct causal link, and the text\u2019s framing of the events, makes option B the most accurate.",
    "question_token_count": 41,
    "answer_correctness_score": 10,
    "explanation_validity_score": 10,
    "question_clarity_score": 6,
    "question_difficulty_score": 8,
    "question_groundedness_score": 9,
    "avg_answer_token_count": 28
  },
  {
    "context": "In 1887, the British Empire celebrated Victoria's Golden Jubilee. Victoria marked the fiftieth anniversary of her accession on 20 June with a banquet to which 50 kings and princes were invited. The following day, she participated in a procession and attended a thanksgiving service in Westminster Abbey. By this time, Victoria was once again extremely popular. Two days later on 23 June, she engaged two Indian Muslims as waiters, one of whom was Abdul Karim. He was soon promoted to \"Munshi\": teaching her Hindustani, and acting as a clerk. Her family and retainers were appalled, and accused Abdul Karim of spying for the Muslim Patriotic League, and biasing the Queen against the Hindus. Equerry Frederick Ponsonby (the son of Sir Henry) discovered that the Munshi had lied about his parentage, and reported to Lord Elgin, Viceroy of India, \"the Munshi occupies very much the same position as John Brown used to do.\" Victoria dismissed their complaints as racial prejudice. Abdul Karim remained in her service until he returned to India with a pension on her death.",
    "topic": "Detail the accusations made against Abdul Karim by Victoria\u2019s family and retainers and their underlying motivations.",
    "response": "```xml\n<document_analysis>\n1. **Thoughtful Content Examination:** The context details the introduction of Abdul Karim into Queen Victoria's service and the subsequent backlash from her family and retainers. The core issues are accusations of spying, religious bias, and deception regarding his background. The comparison to John Brown is a key detail suggesting a close, potentially inappropriate, relationship.\n2. **Concept Exploration:** The accusations reveal underlying tensions related to colonial power dynamics, religious biases within British society, and concerns about undue influence over the Queen. The context implies a clash between established British norms and the Queen's growing interest in Indian culture. The reference to the Muslim Patriotic League suggests broader anxieties about Indian nationalism.\n3. **Strategic Complexity Calibration:** Difficulty: 8/10. The question requires understanding not just the *what* of the accusations, but the *why* \u2013 the motivations behind them. It demands an understanding of colonial context and potential biases.\n4. **Intentional Question Planning:** The question will focus on the motivations behind the accusations leveled against Abdul Karim, forcing a nuanced understanding of the historical and social context. The answer options will be crafted to test whether the respondent grasps the complexity of these motivations, distinguishing between surface-level complaints and deeper anxieties.\n</document_analysis>\n<output_format>\nQuestion: What was the primary motivation behind the accusations made against Abdul Karim by Victoria\u2019s family and retainers?\nA: Concerns that Karim was exploiting the Queen financially through his position as Munshi.\nB: Fears that Karim was influencing Victoria\u2019s political decisions to favor Indian independence.\nC: Underlying anxieties about colonial power dynamics, religious biases, and the perceived erosion of established British norms.\nD: Belief that Karim was directly involved in espionage activities against the British Empire, actively working with foreign powers.\nExplanation: The text states the family and retainers accused Karim of biasing the Queen against Hindus and spying, and Victoria dismissed these complaints as racial prejudice. This indicates that the accusations stemmed from deeper anxieties about the changing dynamics of power and religious biases within British society, rather than solely focused on espionage or financial exploitation.\nCorrect Answer: C\n</output_format>\n```",
    "question": "What was the primary motivation behind the accusations made against Abdul Karim by Victoria\u2019s family and retainers?",
    "choices": {
      "A": "Concerns that Karim was exploiting the Queen financially through his position as Munshi.",
      "B": "Fears that Karim was influencing Victoria\u2019s political decisions to favor Indian independence.",
      "C": "Underlying anxieties about colonial power dynamics, religious biases, and the perceived erosion of established British norms.",
      "D": "Belief that Karim was directly involved in espionage activities against the British Empire, actively working with foreign powers."
    },
    "answer": "C",
    "explanation": "The text states the family and retainers accused Karim of biasing the Queen against Hindus and spying, and Victoria dismissed these complaints as racial prejudice. This indicates that the accusations stemmed from deeper anxieties about the changing dynamics of power and religious biases within British society, rather than solely focused on espionage or financial exploitation.",
    "question_token_count": 21,
    "answer_correctness_score": 10,
    "explanation_validity_score": 10,
    "question_clarity_score": 8,
    "question_difficulty_score": 6,
    "question_groundedness_score": 9,
    "avg_answer_token_count": 19
  },
  {
    "context": "In 1839, Melbourne resigned after Radicals and Tories (both of whom Victoria detested) voted against a bill to suspend the constitution of Jamaica. The bill removed political power from plantation owners who were resisting measures associated with the abolition of slavery. The Queen commissioned a Tory, Sir Robert Peel, to form a new ministry. At the time, it was customary for the prime minister to appoint members of the Royal Household, who were usually his political allies and their spouses. Many of the Queen's ladies of the bedchamber were wives of Whigs, and Peel expected to replace them with wives of Tories. In what became known as the bedchamber crisis, Victoria, advised by Melbourne, objected to their removal. Peel refused to govern under the restrictions imposed by the Queen, and consequently resigned his commission, allowing Melbourne to return to office.",
    "topic": "The interplay between political factions (Radicals, Tories, Whigs) and Queen Victoria's reactions to them in 1839.",
    "response": "```xml\n<document_analysis>\n1. **Thoughtful Content Examination:** The context details a political crisis in 1839 involving Queen Victoria, the Radicals, Tories, and Whigs. The core issue revolves around the Jamaican constitution bill, the appointment of a Tory prime minister (Peel), and the ensuing \"bedchamber crisis\" over the replacement of the Queen's ladies-in-waiting. The text highlights Victoria's personal dislike of both Radicals and Tories, her strong will, and her willingness to challenge political norms.\n\n2. **Concept Exploration:** The passage reveals the complexities of 19th-century British politics, where personal relationships and the Queen's influence played a significant role. The Jamaican constitution bill is a proxy for the broader debate over slavery and colonial power. The bedchamber crisis exemplifies the tension between the monarch's prerogative and parliamentary convention. Implicitly, the text suggests Victoria was willing to prioritize her personal preferences and established relationships over strict adherence to political expediency.\n\n3. **Strategic Complexity Calibration:** Difficulty: 9/10. This question requires understanding of British political factions, constitutional conventions, and the dynamics of the Victorian court. It necessitates inferring Victoria's motivations and the broader implications of her actions. The nuances of the bedchamber crisis are not immediately obvious, and the question probes beyond factual recall.\n\n4. **Intentional Question Planning:** The question is designed to assess a domain expert's understanding of the interplay between political factions and Victoria's personal agency. It requires synthesizing information about her dislike for both Radicals and Tories, the context of the Jamaican bill, and the resulting bedchamber crisis. The question targets a deeper understanding of the motivations and consequences of Victoria\u2019s actions.\n</document_analysis>\n\n<output_format>\nQuestion: Queen Victoria\u2019s resistance to Sir Robert Peel\u2019s proposed changes to her ladies of the bedchamber, despite her stated aversion to both Radicals and Tories, most directly reflects a prioritization of which of the following?\nA: Maintaining parliamentary sovereignty over royal prerogative.\nB: Upholding the established social order and preventing disruption of existing power structures.\nC: Personal loyalty and established relationships within the existing Whig network.\nD: Promoting broader reforms related to colonial governance in Jamaica.\nExplanation: The text explicitly states Victoria objected to the removal of Whig ladies-in-waiting, even though she \"detested\" both Radicals and Tories. This indicates she valued her existing relationships and the established social network of the Whigs, even over ideological alignment. The bedchamber crisis arose precisely because Peel wanted to replace these ladies with Tory wives, and Victoria, advised by the Whig Melbourne, refused.\nCorrect Answer: C\n</output_format>\n```",
    "question": "Queen Victoria\u2019s resistance to Sir Robert Peel\u2019s proposed changes to her ladies of the bedchamber, despite her stated aversion to both Radicals and Tories, most directly reflects a prioritization of which of the following?",
    "choices": {
      "A": "Maintaining parliamentary sovereignty over royal prerogative.",
      "B": "Upholding the established social order and preventing disruption of existing power structures.",
      "C": "Personal loyalty and established relationships within the existing Whig network.",
      "D": "Promoting broader reforms related to colonial governance in Jamaica."
    },
    "answer": "C",
    "explanation": "The text explicitly states Victoria objected to the removal of Whig ladies-in-waiting, even though she \"detested\" both Radicals and Tories. This indicates she valued her existing relationships and the established social network of the Whigs, even over ideological alignment. The bedchamber crisis arose precisely because Peel wanted to replace these ladies with Tory wives, and Victoria, advised by the Whig Melbourne, refused.",
    "question_token_count": 45,
    "answer_correctness_score": 10,
    "explanation_validity_score": 10,
    "question_clarity_score": 8,
    "question_difficulty_score": 7,
    "question_groundedness_score": 10,
    "avg_answer_token_count": 13
  },
  {
    "context": "Antibiotics are screened for any negative effects on humans or other mammals before approval for clinical use, and are usually considered safe and most are well tolerated. However, some antibiotics have been associated with a range of adverse side effects. Side-effects range from mild to very serious depending on the antibiotics used, the microbial organisms targeted, and the individual patient. Side effects may reflect the pharmacological or toxicological properties of the antibiotic or may involve hypersensitivity reactions or anaphylaxis. Safety profiles of newer drugs are often not as well established as for those that have a long history of use. Adverse effects range from fever and nausea to major allergic reactions, including photodermatitis and anaphylaxis. Common side-effects include diarrhea, resulting from disruption of the species composition in the intestinal flora, resulting, for example, in overgrowth of pathogenic bacteria, such as Clostridium difficile. Antibacterials can also affect the vaginal flora, and may lead to overgrowth of yeast species of the genus Candida in the vulvo-vaginal area. Additional side-effects can result from interaction with other drugs, such as elevated risk of tendon damage from administration of a quinolone antibiotic with a systemic corticosteroid. Some scientists have hypothesized that the indiscriminate use of antibiotics alter the host microbiota and this has been associated with chronic disease.",
    "topic": "Explain how antibiotics can disrupt the balance of the intestinal flora and lead to opportunistic infections like *Clostridium difficile*.",
    "response": "```xml\n<document_analysis>\n1. **Thoughtful Content Examination:** The text discusses the side effects of antibiotics, focusing on disruption of the intestinal and vaginal flora, leading to overgrowth of pathogenic bacteria like *Clostridium difficile* and yeast species of *Candida*. It also touches upon other adverse effects like allergic reactions and drug interactions.\n2. **Concept Exploration:** The core concept is the delicate balance of the microbiome and how antibiotics, while targeting pathogens, can inadvertently harm beneficial bacteria, creating an opportunity for opportunistic infections. The text also hints at a potential link between antibiotic use and chronic diseases through microbiome alterations.\n3. **Strategic Complexity Calibration:** Difficulty: 8/10. The question requires understanding of microbiome dynamics, opportunistic infections, and the broader implications of antibiotic use. It goes beyond simply recalling that antibiotics cause diarrhea.\n4. **Intentional Question Planning:** The question aims to test the understanding of the *mechanism* by which antibiotics contribute to *C. difficile* infections, requiring the expert to connect the disruption of the intestinal flora to the opportunistic growth of a specific pathogen.\n</document_analysis>\n<output_format>\nQuestion: An individual undergoing antibiotic treatment experiences a disruption in their gut microbiome, predisposing them to opportunistic infections. Which of the following best describes the primary mechanism driving the increased risk of *Clostridium difficile* infection in this scenario?\nA: The antibiotic directly stimulates the growth of *C. difficile* by providing essential nutrients.\nB: The antibiotic eliminates competing commensal bacteria, reducing colonization resistance and allowing *C. difficile* to proliferate.\nC: The antibiotic induces a systemic immune suppression, making the host more vulnerable to *C. difficile* toxins.\nD: The antibiotic alters the gut pH, creating a more favorable environment for *C. difficile* spore germination.\nExplanation: The text states that diarrhea, and consequently overgrowth of pathogenic bacteria like *C. difficile*, results from disruption of the species composition in the intestinal flora. This disruption removes the competitive inhibition normally exerted by commensal bacteria, allowing *C. difficile* to colonize and proliferate.\nCorrect Answer: B\n</output_format>\n```",
    "question": "An individual undergoing antibiotic treatment experiences a disruption in their gut microbiome, predisposing them to opportunistic infections. Which of the following best describes the primary mechanism driving the increased risk of *Clostridium difficile* infection in this scenario?",
    "choices": {
      "A": "The antibiotic directly stimulates the growth of *C. difficile* by providing essential nutrients.",
      "B": "The antibiotic eliminates competing commensal bacteria, reducing colonization resistance and allowing *C. difficile* to proliferate.",
      "C": "The antibiotic induces a systemic immune suppression, making the host more vulnerable to *C. difficile* toxins.",
      "D": "The antibiotic alters the gut pH, creating a more favorable environment for *C. difficile* spore germination."
    },
    "answer": "B",
    "explanation": "The text states that diarrhea, and consequently overgrowth of pathogenic bacteria like *C. difficile*, results from disruption of the species composition in the intestinal flora. This disruption removes the competitive inhibition normally exerted by commensal bacteria, allowing *C. difficile* to colonize and proliferate.",
    "question_token_count": 48,
    "answer_correctness_score": 10,
    "explanation_validity_score": 10,
    "question_clarity_score": 8,
    "question_difficulty_score": 6,
    "question_groundedness_score": 9,
    "avg_answer_token_count": 22
  },
  {
    "context": "Antibiotics revolutionized medicine in the 20th century, and have together with vaccination led to the near eradication of diseases such as tuberculosis in the developed world. Their effectiveness and easy access led to overuse, especially in livestock raising, prompting bacteria to develop resistance. This has led to widespread problems with antimicrobial and antibiotic resistance, so much as to prompt the World Health Organization to classify antimicrobial resistance as a \"serious threat [that] is no longer a prediction for the future, it is happening right now in every region of the world and has the potential to affect anyone, of any age, in any country\".",
    "topic": "The role of vaccination in conjunction with antibiotics in controlling and eradicating infectious diseases.",
    "response": "```xml\n<document_analysis>\n1. **Thoughtful Content Examination:** The context discusses the historical success of antibiotics and vaccines in controlling infectious diseases, particularly tuberculosis. It highlights a critical consequence of antibiotic overuse \u2013 the development of antimicrobial resistance \u2013 and its current global threat level as defined by the WHO. The core idea revolves around a shift from control/eradication to a growing challenge due to resistance.\n2. **Concept Exploration:** The passage implies a complex interplay between public health interventions (vaccination) and therapeutic treatments (antibiotics). The emergence of resistance isn\u2019t solely an antibiotic problem; it\u2019s a consequence of how these tools have been deployed and managed. The WHO\u2019s statement underscores the urgency and universality of the threat.\n3. **Strategic Complexity Calibration:** Difficulty: 9/10. The question probes the understanding of the *relationship* between vaccination, antibiotics, and the evolution of resistance, rather than simply recalling facts. It requires understanding the broader implications of antibiotic overuse beyond individual patient treatment.\n4. **Intentional Question Planning:** The question is designed to assess whether the expert understands that the success of both vaccination *and* antibiotics created conditions that contributed to the current crisis of antimicrobial resistance. It requires thinking about unintended consequences. The distractors are carefully crafted to represent common misconceptions about antibiotic resistance.\n</document_analysis>\n<output_format>\nQuestion: Considering the historical synergy between vaccination and antibiotic use in controlling infectious diseases, what unintended consequence has significantly compromised their continued effectiveness?\nA: The global increase in vaccination rates has led to a decline in natural immunity, rendering populations more susceptible to resistant strains.\nB: Widespread antibiotic use, facilitated by the initial success of both therapies, has driven the rapid evolution of antimicrobial resistance in bacteria.\nC: The eradication of diseases like tuberculosis has reduced selective pressure on bacteria, leading to a resurgence of virulence in previously controlled strains.\nD: Vaccination programs have inadvertently selected for bacterial strains with increased antibiotic sensitivity, creating an imbalance in microbial ecosystems.\nExplanation: The passage explicitly states that the effectiveness and easy access to antibiotics (along with vaccination) led to overuse, prompting bacteria to develop resistance. This overuse is the primary unintended consequence that compromises the continued effectiveness of both therapies.\nCorrect Answer: B\n</output_format>\n```",
    "question": "Considering the historical synergy between vaccination and antibiotic use in controlling infectious diseases, what unintended consequence has significantly compromised their continued effectiveness?",
    "choices": {
      "A": "The global increase in vaccination rates has led to a decline in natural immunity, rendering populations more susceptible to resistant strains.",
      "B": "Widespread antibiotic use, facilitated by the initial success of both therapies, has driven the rapid evolution of antimicrobial resistance in bacteria.",
      "C": "The eradication of diseases like tuberculosis has reduced selective pressure on bacteria, leading to a resurgence of virulence in previously controlled strains.",
      "D": "Vaccination programs have inadvertently selected for bacterial strains with increased antibiotic sensitivity, creating an imbalance in microbial ecosystems."
    },
    "answer": "B",
    "explanation": "The passage explicitly states that the effectiveness and easy access to antibiotics (along with vaccination) led to overuse, prompting bacteria to develop resistance. This overuse is the primary unintended consequence that compromises the continued effectiveness of both therapies.",
    "question_token_count": 25,
    "answer_correctness_score": 10,
    "explanation_validity_score": 10,
    "question_clarity_score": 7,
    "question_difficulty_score": 8,
    "question_groundedness_score": 8,
    "avg_answer_token_count": 25
  },
  {
    "context": "Multiracial Americans are Americans who have mixed ancestry of \"two or more races\". The term may also include Americans of mixed-race ancestry who self-identify with just one group culturally and socially (cf. the one-drop rule). In the 2010 US census, approximately 9 million individuals, or 2.9% of the population, self-identified as multiracial. There is evidence that an accounting by genetic ancestry would produce a higher number, but people live according to social and cultural identities, not DNA. Historical reasons, including slavery creating a racial caste and the European-American suppression of Native Americans, often led people to identify or be classified by only one ethnicity, generally that of the culture in which they were raised. Prior to the mid-20th century, many people hid their multiracial heritage because of racial discrimination against minorities. While many Americans may be biologically multiracial, they often do not know it or do not identify so culturally, any more than they maintain all the differing traditions of a variety of national ancestries.",
    "topic": "Evaluate the significance of racial discrimination in shaping the acknowledgement and expression of multiracial identity prior to the mid-20th century.",
    "response": "```xml\n<document_analysis>\n1. **Thoughtful Content Examination:** The text discusses the concept of multiracial identity in the US, its prevalence, and the historical factors influencing its acknowledgement. A key theme is the impact of racial discrimination and social pressures on how individuals identified (or were identified) racially. The \"one-drop rule\" is mentioned as a related concept.\n2. **Concept Exploration:** The text implies a disconnect between biological ancestry (DNA) and social/cultural identity. It highlights how historical injustices like slavery and the suppression of Native Americans contributed to a system where people were often forced into a single racial category. The act of \"hiding\" multiracial heritage suggests a fear of social consequences.\n3. **Strategic Complexity Calibration:** Difficulty: 8/10. This question requires understanding the interplay between historical context, social constructs of race, and individual identity. It goes beyond simply recalling information and asks for an assessment of significance.\n4. **Intentional Question Planning:** The question aims to probe the expert's understanding of how systemic racism actively shaped the *expression* of identity, not just the existence of multiracial individuals. It encourages reflection on the power dynamics at play and the societal pressures that led to the concealment of heritage. The question is designed to be challenging because it requires synthesizing information about historical events and their impact on individual behavior.\n</document_analysis>\n\n<output_format>\nQuestion: Prior to the mid-20th century, how did prevailing societal structures most significantly influence the acknowledgement of multiracial identity among individuals with mixed ancestry?\nA: By promoting genetic testing to accurately determine and categorize racial backgrounds.\nB: By creating social and legal incentives for individuals to openly declare their full ancestral composition.\nC: By fostering an environment where acknowledging multiracial heritage carried substantial social risk due to racial discrimination.\nD: By encouraging cultural exchange programs designed to celebrate and integrate diverse racial traditions.\nExplanation: The text explicitly states that prior to the mid-20th century, many people hid their multiracial heritage \"because of racial discrimination against minorities.\" This indicates that societal structures created a disincentive for acknowledging multiracial identity due to the potential for negative consequences.\nCorrect Answer: C\n</output_format>\n```",
    "question": "Prior to the mid-20th century, how did prevailing societal structures most significantly influence the acknowledgement of multiracial identity among individuals with mixed ancestry?",
    "choices": {
      "A": "By promoting genetic testing to accurately determine and categorize racial backgrounds.",
      "B": "By creating social and legal incentives for individuals to openly declare their full ancestral composition.",
      "C": "By fostering an environment where acknowledging multiracial heritage carried substantial social risk due to racial discrimination.",
      "D": "By encouraging cultural exchange programs designed to celebrate and integrate diverse racial traditions."
    },
    "answer": "C",
    "explanation": "The text explicitly states that prior to the mid-20th century, many people hid their multiracial heritage \"because of racial discrimination against minorities.\" This indicates that societal structures created a disincentive for acknowledging multiracial identity due to the potential for negative consequences.",
    "question_token_count": 31,
    "answer_correctness_score": 10,
    "explanation_validity_score": 10,
    "question_clarity_score": 7,
    "question_difficulty_score": 8,
    "question_groundedness_score": 9,
    "avg_answer_token_count": 16
  },
  {
    "context": "In 1887, the British Empire celebrated Victoria's Golden Jubilee. Victoria marked the fiftieth anniversary of her accession on 20 June with a banquet to which 50 kings and princes were invited. The following day, she participated in a procession and attended a thanksgiving service in Westminster Abbey. By this time, Victoria was once again extremely popular. Two days later on 23 June, she engaged two Indian Muslims as waiters, one of whom was Abdul Karim. He was soon promoted to \"Munshi\": teaching her Hindustani, and acting as a clerk. Her family and retainers were appalled, and accused Abdul Karim of spying for the Muslim Patriotic League, and biasing the Queen against the Hindus. Equerry Frederick Ponsonby (the son of Sir Henry) discovered that the Munshi had lied about his parentage, and reported to Lord Elgin, Viceroy of India, \"the Munshi occupies very much the same position as John Brown used to do.\" Victoria dismissed their complaints as racial prejudice. Abdul Karim remained in her service until he returned to India with a pension on her death.",
    "topic": "Explain how the events surrounding Abdul Karim illustrate the racial and class tensions present within Victorian society.",
    "response": "```xml\n<document_analysis>\n1. **Thoughtful Content Examination:** The text details the introduction of Abdul Karim into Queen Victoria's service and the subsequent reactions of her court. The core theme revolves around the societal discomfort and prejudice exhibited towards Karim due to his race, religion, and class. The context highlights the tension between Victoria's personal connection with Karim and the disapproval of her established circle.\n\n2. **Concept Exploration:** The passage implicitly reveals Victorian society's hierarchical structure and the prevailing racial biases. The accusations of spying and the scrutiny of Karim's parentage demonstrate the deep-seated distrust of non-British individuals, particularly those from colonized territories. The comparison to John Brown, a Scottish servant who held considerable influence over Victoria, is crucial, as it underscores the court's outrage that a person of color could achieve similar closeness to the Queen.\n\n3. **Strategic Complexity Calibration:** Difficulty: 9/10. The question requires understanding the subtle interplay of race, class, and power dynamics within Victorian society. It necessitates inferring the broader societal context from a relatively brief anecdote.\n\n4. **Intentional Question Planning:** The question aims to probe the examinee's ability to analyze the historical context and connect a specific event (Karim's rise in Victoria's service) to broader societal tensions. It requires a nuanced understanding of Victorian attitudes towards race, class, and colonialism.\n</document_analysis>\n\n<output_format>\nQuestion: The court\u2019s reaction to Abdul Karim\u2019s increasing influence over Queen Victoria most directly reflects which underlying societal dynamic of Victorian England?\nA: The burgeoning socialist movement\u2019s challenge to aristocratic privilege.\nB: The anxieties surrounding the declining power of the monarchy in the face of parliamentary reform.\nC: The entrenched racial and class hierarchies that defined imperial power structures.\nD: The widespread fear of foreign invasion and the need for a strong military defense.\nExplanation: The text explicitly states that Victoria dismissed complaints about Karim as \u201cracial prejudice.\u201d The court\u2019s disapproval stemmed from Karim\u2019s background as an Indian Muslim of lower social standing, highlighting the rigid social hierarchy and racial biases prevalent in Victorian England, particularly within the context of imperial power.\nCorrect Answer: C\n</output_format>\n```",
    "question": "The court\u2019s reaction to Abdul Karim\u2019s increasing influence over Queen Victoria most directly reflects which underlying societal dynamic of Victorian England?",
    "choices": {
      "A": "The burgeoning socialist movement\u2019s challenge to aristocratic privilege.",
      "B": "The anxieties surrounding the declining power of the monarchy in the face of parliamentary reform.",
      "C": "The entrenched racial and class hierarchies that defined imperial power structures.",
      "D": "The widespread fear of foreign invasion and the need for a strong military defense."
    },
    "answer": "C",
    "explanation": "The text explicitly states that Victoria dismissed complaints about Karim as \u201cracial prejudice.\u201d The court\u2019s disapproval stemmed from Karim\u2019s background as an Indian Muslim of lower social standing, highlighting the rigid social hierarchy and racial biases prevalent in Victorian England, particularly within the context of imperial power.",
    "question_token_count": 25,
    "answer_correctness_score": 10,
    "explanation_validity_score": 10,
    "question_clarity_score": 6,
    "question_difficulty_score": 8,
    "question_groundedness_score": 9,
    "avg_answer_token_count": 16
  },
  {
    "context": "On 14 January 1858, an Italian refugee from Britain called Orsini attempted to assassinate Napoleon III with a bomb made in England. The ensuing diplomatic crisis destabilised the government, and Palmerston resigned. Derby was reinstated as prime minister. Victoria and Albert attended the opening of a new basin at the French military port of Cherbourg on 5 August 1858, in an attempt by Napoleon III to reassure Britain that his military preparations were directed elsewhere. On her return Victoria wrote to Derby reprimanding him for the poor state of the Royal Navy in comparison to the French one. Derby's ministry did not last long, and in June 1859 Victoria recalled Palmerston to office.",
    "topic": "Explain the role of Italian refugees in British politics during the mid-19th century, as exemplified by Orsini's actions.",
    "response": "```xml\n<document_analysis>\nThoughtful Content Examination: The context details a specific event \u2013 Orsini's assassination attempt on Napoleon III \u2013 and its significant repercussions on British politics. It highlights the destabilization of the government, Palmerston\u2019s resignation, Derby\u2019s reinstatement, and Victoria's concerns about the Royal Navy. The central theme is the impact of an act by a foreign refugee on British internal politics.\n\nConcept Exploration: The text implicitly raises questions about the complexities of dealing with political refugees, the vulnerability of governments to external shocks, and the interplay between domestic and foreign policy. It also touches upon the dynamics of Anglo-French relations in the mid-19th century. The event demonstrates how a single act of violence can trigger a chain reaction with substantial political consequences.\n\nStrategic Complexity Calibration: Difficulty: 9/10. The question requires understanding not just the event itself, but its broader political context and implications for British governance. The challenge lies in recognizing how a foreign refugee's actions could lead to a change in Prime Minister and a naval review.\n\nIntentional Question Planning: The question aims to assess the expert\u2019s understanding of the delicate balance between national security, diplomatic relations, and domestic political stability in the context of 19th-century Britain. It requires drawing connections between the specific event and the resulting political shifts.\n</document_analysis>\n\n<output_format>\nQuestion: Orsini\u2019s assassination attempt on Napoleon III, despite occurring outside of Britain, most directly prompted which immediate political consequence within the British government?\nA: A significant increase in funding and modernization efforts for the Royal Navy, spurred by Victoria\u2019s direct reprimand of the Derby ministry.\nB: The reinstatement of Lord Palmerston as Prime Minister following his resignation due to the diplomatic fallout.\nC: The immediate declaration of war against France, predicated on the belief that Napoleon III was actively preparing for invasion.\nD: A formal apology issued to France, alongside the extradition of all Italian political refugees residing in Britain.\nExplanation: The text explicitly states that the diplomatic crisis resulting from Orsini\u2019s attempt led to Palmerston\u2019s resignation and Derby\u2019s reinstatement, but subsequently to Palmerston being recalled to office in June 1859. This demonstrates the destabilizing effect of the event on British politics and the eventual return of Palmerston to power.\nCorrect Answer: B\n</output_format>\n```",
    "question": "Orsini\u2019s assassination attempt on Napoleon III, despite occurring outside of Britain, most directly prompted which immediate political consequence within the British government?",
    "choices": {
      "A": "A significant increase in funding and modernization efforts for the Royal Navy, spurred by Victoria\u2019s direct reprimand of the Derby ministry.",
      "B": "The reinstatement of Lord Palmerston as Prime Minister following his resignation due to the diplomatic fallout.",
      "C": "The immediate declaration of war against France, predicated on the belief that Napoleon III was actively preparing for invasion.",
      "D": "A formal apology issued to France, alongside the extradition of all Italian political refugees residing in Britain."
    },
    "answer": "B",
    "explanation": "The text explicitly states that the diplomatic crisis resulting from Orsini\u2019s attempt led to Palmerston\u2019s resignation and Derby\u2019s reinstatement, but subsequently to Palmerston being recalled to office in June 1859. This demonstrates the destabilizing effect of the event on British politics and the eventual return of Palmerston to power.",
    "question_token_count": 29,
    "answer_correctness_score": 6,
    "explanation_validity_score": 7,
    "question_clarity_score": 1,
    "question_difficulty_score": 6,
    "question_groundedness_score": 10,
    "avg_answer_token_count": 23
  },
  {
    "context": "Following their loss in the divisional round of the previous season's playoffs, the Denver Broncos underwent numerous coaching changes, including a mutual parting with head coach John Fox (who had won four divisional championships in his four years as Broncos head coach), and the hiring of Gary Kubiak as the new head coach. Under Kubiak, the Broncos planned to install a run-oriented offense with zone blocking to blend in with quarterback Peyton Manning's shotgun passing skills, but struggled with numerous changes and injuries to the offensive line, as well as Manning having his worst statistical season since his rookie year with the Indianapolis Colts in 1998, due to a plantar fasciitis injury in his heel that he had suffered since the summer, and the simple fact that Manning was getting old, as he turned 39 in the 2015 off-season. Although the team had a 7\u20130 start, Manning led the NFL in interceptions. In week 10, Manning suffered a partial tear of the plantar fasciitis in his left foot. He set the NFL's all-time record for career passing yards in this game, but was benched after throwing four interceptions in favor of backup quarterback Brock Osweiler, who took over as the starter for most of the remainder of the regular season. Osweiler was injured, however, leading to Manning's return during the Week 17 regular season finale, where the Broncos were losing 13\u20137 against the 4\u201311 San Diego Chargers, resulting in Manning re-claiming the starting quarterback position for the playoffs by leading the team to a key 27\u201320 win that enabled the team to clinch the number one overall AFC seed. Under defensive coordinator Wade Phillips, the Broncos' defense ranked number one in total yards allowed, passing yards allowed and sacks, and like the previous three seasons, the team has continued to set numerous individual, league and franchise records. With the defense carrying the team despite the issues with the offense, the Broncos finished the regular season with a 12\u20134 record and earned home-field advantage throughout the AFC playoffs.",
    "topic": "Describe the specific records set by the Broncos team, and individual players during the 2015 season.",
    "response": "<document_analysis>\nThe provided text details the Denver Broncos' 2015 season, focusing on coaching changes, quarterback struggles (Peyton Manning's decline and Brock Osweiler's emergence), and the strength of their defense. The text highlights the team's 12-4 record and securing the #1 AFC seed. It specifically mentions Manning setting the NFL's all-time record for career passing yards. The text emphasizes the defensive dominance, ranking #1 in several key categories.\n\nThe challenge lies in formulating a question that goes beyond simply recalling facts from the text. A good question should probe understanding of the interplay between the offensive struggles and defensive success, or the significance of Manning's record within the context of his declining performance. The difficulty should be high, requiring the expert to synthesize information and consider the broader implications.\n\nI will aim for a question testing understanding of how Manning's record-breaking performance contrasted with his overall season.\n\nDifficulty: 8/10\n</document_analysis>\n\n<output_format>\nQuestion: Peyton Manning achieved a significant career milestone during the 2015 season, yet his overall performance was markedly diminished. What is the key contextual irony surrounding Manning\u2019s accomplishment?\nA: Manning\u2019s record-breaking yardage total was directly correlated to the offensive line\u2019s improved performance, solidifying his legacy as a pocket passer.\nB: The record was achieved during a game marked by multiple interceptions and ultimately led to Manning being temporarily benched, highlighting a decline in his overall play.\nC: Manning\u2019s record-setting performance was overshadowed by Brock Osweiler\u2019s superior statistics as the starting quarterback, leading to internal team conflict.\nD: The achievement occurred during a period of consistent offensive success, reinforcing Manning\u2019s status as an elite quarterback despite his age.\nExplanation: The text explicitly states Manning set the passing yardage record *in a game* where he threw four interceptions and was subsequently benched. This creates a stark contrast between the individual accomplishment and his overall struggles, making option B the correct answer.\nCorrect Answer: B\n</output_format>",
    "question": "Peyton Manning achieved a significant career milestone during the 2015 season, yet his overall performance was markedly diminished. What is the key contextual irony surrounding Manning\u2019s accomplishment?",
    "choices": {
      "A": "Manning\u2019s record-breaking yardage total was directly correlated to the offensive line\u2019s improved performance, solidifying his legacy as a pocket passer.",
      "B": "The record was achieved during a game marked by multiple interceptions and ultimately led to Manning being temporarily benched, highlighting a decline in his overall play.",
      "C": "Manning\u2019s record-setting performance was overshadowed by Brock Osweiler\u2019s superior statistics as the starting quarterback, leading to internal team conflict.",
      "D": "The achievement occurred during a period of consistent offensive success, reinforcing Manning\u2019s status as an elite quarterback despite his age."
    },
    "answer": "B",
    "explanation": "The text explicitly states Manning set the passing yardage record *in a game* where he threw four interceptions and was subsequently benched. This creates a stark contrast between the individual accomplishment and his overall struggles, making option B the correct answer.",
    "question_token_count": 36,
    "answer_correctness_score": 10,
    "explanation_validity_score": 10,
    "question_clarity_score": 7,
    "question_difficulty_score": 6,
    "question_groundedness_score": 9,
    "avg_answer_token_count": 28
  },
  {
    "context": "The Panthers offense, which led the NFL in scoring (500 points), was loaded with talent, boasting six Pro Bowl selections. Pro Bowl quarterback Cam Newton had one of his best seasons, throwing for 3,837 yards and rushing for 636, while recording a career-high and league-leading 45 total touchdowns (35 passing, 10 rushing), a career-low 10 interceptions, and a career-best quarterback rating of 99.4. Newton's leading receivers were tight end Greg Olsen, who caught a career-high 77 passes for 1,104 yards and seven touchdowns, and wide receiver Ted Ginn, Jr., who caught 44 passes for 739 yards and 10 touchdowns; Ginn also rushed for 60 yards and returned 27 punts for 277 yards. Other key receivers included veteran Jerricho Cotchery (39 receptions for 485 yards), rookie Devin Funchess (31 receptions for 473 yards and five touchdowns), and second-year receiver Corey Brown (31 receptions for 447 yards). The Panthers backfield featured Pro Bowl running back Jonathan Stewart, who led the team with 989 rushing yards and six touchdowns in 13 games, along with Pro Bowl fullback Mike Tolbert, who rushed for 256 yards and caught 18 passes for another 154 yards. Carolina's offensive line also featured two Pro Bowl selections: center Ryan Kalil and guard Trai Turner.",
    "topic": "Determine the impact of the Panthers' Pro Bowl offensive linemen, Ryan Kalil and Trai Turner, on the team's overall offensive success in 2015.",
    "response": "<document_analysis>\n1. **Thoughtful Content Examination:** The context describes the Carolina Panthers' high-scoring offense in 2015, highlighting key players and their statistics. It specifically mentions six Pro Bowl selections, including the quarterback, receivers, running back, fullback, and two offensive linemen (Ryan Kalil and Trai Turner). The text focuses on individual performance metrics rather than explicitly detailing the offensive line's *impact* on these statistics.\n\n2. **Concept Exploration:** The question asks about the impact of the offensive linemen on the overall offensive success. While the text establishes their Pro Bowl status, it doesn't directly quantify their contribution. This requires inferential reasoning - understanding that a strong offensive line is crucial for a successful running game and pass protection, both of which contributed to Newton's and Stewart's success. The challenge lies in identifying the most accurate implication given the provided data.\n\n3. **Strategic Complexity Calibration:** Difficulty: 8/10. The text doesn\u2019t directly state the linemen\u2019s impact; it requires an understanding of football fundamentals and the importance of the offensive line. The answer options will need to be crafted to be plausible but subtly different, testing whether the domain expert understands how linemen contribute to overall offensive success.\n\n4. **Intentional Question Planning:** The question will focus on *how* the Pro Bowl linemen most directly facilitated the offensive success, requiring the test-taker to connect the linemen\u2019s presence to the successes of the skill position players. The question will test a deep understanding of football strategy, beyond simply recognizing the players' Pro Bowl selections.\n</document_analysis>\n\n<output_format>\nQuestion: Considering the Carolina Panthers' offensive success in 2015, how did the Pro Bowl selections of Ryan Kalil and Trai Turner most directly contribute to the team's league-leading scoring output?\nA: By consistently executing complex pass blocking schemes, allowing Cam Newton extended time to identify open receivers downfield.\nB: By enabling a dominant rushing attack led by Jonathan Stewart, creating favorable play-action opportunities for Cam Newton.\nC: By providing exceptional run blocking, consistently creating advantageous angles for fullbacks like Mike Tolbert to gain yardage.\nD: By demonstrating exceptional pass protection, directly reducing the number of sacks allowed and maintaining possession.\nExplanation: While all options represent potential benefits of strong offensive line play, the text highlights both Newton's passing success *and* Stewart's rushing success. A strong rushing attack inherently creates play-action opportunities for the quarterback, which is a crucial element of a high-scoring offense. This is the most comprehensive impact given the context.\nCorrect Answer: B\n</output_format>",
    "question": "Considering the Carolina Panthers' offensive success in 2015, how did the Pro Bowl selections of Ryan Kalil and Trai Turner most directly contribute to the team's league-leading scoring output?",
    "choices": {
      "A": "By consistently executing complex pass blocking schemes, allowing Cam Newton extended time to identify open receivers downfield.",
      "B": "By enabling a dominant rushing attack led by Jonathan Stewart, creating favorable play-action opportunities for Cam Newton.",
      "C": "By providing exceptional run blocking, consistently creating advantageous angles for fullbacks like Mike Tolbert to gain yardage.",
      "D": "By demonstrating exceptional pass protection, directly reducing the number of sacks allowed and maintaining possession."
    },
    "answer": "B",
    "explanation": "While all options represent potential benefits of strong offensive line play, the text highlights both Newton's passing success *and* Stewart's rushing success. A strong rushing attack inherently creates play-action opportunities for the quarterback, which is a crucial element of a high-scoring offense. This is the most comprehensive impact given the context.",
    "question_token_count": 38,
    "answer_correctness_score": 8,
    "explanation_validity_score": 9,
    "question_clarity_score": 7,
    "question_difficulty_score": 6,
    "question_groundedness_score": 10,
    "avg_answer_token_count": 21
  },
  {
    "context": "In March 1861, Victoria's mother died, with Victoria at her side. Through reading her mother's papers, Victoria discovered that her mother had loved her deeply; she was heart-broken, and blamed Conroy and Lehzen for \"wickedly\" estranging her from her mother. To relieve his wife during her intense and deep grief, Albert took on most of her duties, despite being ill himself with chronic stomach trouble. In August, Victoria and Albert visited their son, the Prince of Wales, who was attending army manoeuvres near Dublin, and spent a few days holidaying in Killarney. In November, Albert was made aware of gossip that his son had slept with an actress in Ireland. Appalled, Albert travelled to Cambridge, where his son was studying, to confront him. By the beginning of December, Albert was very unwell. He was diagnosed with typhoid fever by William Jenner, and died on 14 December 1861. Victoria was devastated. She blamed her husband's death on worry over the Prince of Wales's philandering. He had been \"killed by that dreadful business\", she said. She entered a state of mourning and wore black for the remainder of her life. She avoided public appearances, and rarely set foot in London in the following years. Her seclusion earned her the nickname \"widow of Windsor\".",
    "topic": "The significance of Victoria blaming external factors for Albert's death, reflecting her emotional state and coping mechanisms.",
    "response": "<document_analysis>\n1. **Thoughtful Content Examination:** The text details Victoria\u2019s grief following Albert\u2019s death and her subsequent blaming of external factors \u2013 specifically, the scandal surrounding their son\u2019s behavior \u2013 for contributing to his illness and ultimately, his demise. It highlights her intense emotional state and her withdrawal from public life. The text also briefly touches on earlier grievances Victoria held against Conroy and Lehzen.\n\n2. **Concept Exploration:** The passage reveals a pattern in Victoria\u2019s coping mechanisms: attributing blame to others when faced with loss or distress. This speaks to psychological defense mechanisms and the complexities of grief. The text implies a potential disconnect between reality (Albert\u2019s pre-existing illness) and Victoria\u2019s perception (Albert was \u2018killed\u2019 by the scandal). The broader historical context suggests the Victorian era's strict moral codes and the societal pressures on royalty.\n\n3. **Strategic Complexity Calibration:** Difficulty: 9/10. The question targets a nuanced understanding of Victoria's psychological state and her selective attribution of blame, requiring an inference beyond the explicitly stated facts. The correct answer is subtly embedded within the broader context of her reactions and coping strategies.\n\n4. **Intentional Question Planning:** The question is designed to assess a domain expert\u2019s ability to analyze the psychological impact of Albert\u2019s death on Victoria, going beyond a simple recall of events. It requires identifying the underlying motivations for her blaming others and understanding how this behavior fits into her overall coping process.\n</document_analysis>\n\n<output_format>\nQuestion: Victoria\u2019s attribution of Albert\u2019s death to the scandal involving the Prince of Wales most directly reflects which psychological phenomenon?\nA: A rational assessment of Albert\u2019s declining health exacerbated by emotional distress.\nB: A displacement of grief and a need to identify a controllable cause for an uncontrollable loss.\nC: A genuine belief that Albert\u2019s physical constitution was uniquely susceptible to external stressors.\nD: A calculated political maneuver to deflect public scrutiny from the royal family\u2019s moral failings.\nExplanation: Victoria\u2019s blaming of the scandal demonstrates a displacement of grief\u2014channeling her emotional pain onto an external source rather than confronting the inherent uncontrollability of Albert\u2019s illness and death. This provides a sense of control and a target for her emotions.\nCorrect Answer: B\n</output_format>",
    "question": "Victoria\u2019s attribution of Albert\u2019s death to the scandal involving the Prince of Wales most directly reflects which psychological phenomenon?",
    "choices": {
      "A": "A rational assessment of Albert\u2019s declining health exacerbated by emotional distress.",
      "B": "A displacement of grief and a need to identify a controllable cause for an uncontrollable loss.",
      "C": "A genuine belief that Albert\u2019s physical constitution was uniquely susceptible to external stressors.",
      "D": "A calculated political maneuver to deflect public scrutiny from the royal family\u2019s moral failings."
    },
    "answer": "B",
    "explanation": "Victoria\u2019s blaming of the scandal demonstrates a displacement of grief\u2014channeling her emotional pain onto an external source rather than confronting the inherent uncontrollability of Albert\u2019s illness and death. This provides a sense of control and a target for her emotions.",
    "question_token_count": 23,
    "answer_correctness_score": 10,
    "explanation_validity_score": 10,
    "question_clarity_score": 8,
    "question_difficulty_score": 7,
    "question_groundedness_score": 10,
    "avg_answer_token_count": 17
  },
  {
    "context": "Beyonc\u00e9 has received numerous awards. As a solo artist she has sold over 15 million albums in the US, and over 118 million records worldwide (a further 60 million additionally with Destiny's Child), making her one of the best-selling music artists of all time. The Recording Industry Association of America (RIAA) listed Beyonc\u00e9 as the top certified artist of the 2000s, with a total of 64 certifications. Her songs \"Crazy in Love\", \"Single Ladies (Put a Ring on It)\", \"Halo\", and \"Irreplaceable\" are some of the best-selling singles of all time worldwide. In 2009, The Observer named her the Artist of the Decade and Billboard named her the Top Female Artist and Top Radio Songs Artist of the Decade. In 2010, Billboard named her in their \"Top 50 R&B/Hip-Hop Artists of the Past 25 Years\" list at number 15. In 2012 VH1 ranked her third on their list of the \"100 Greatest Women in Music\". Beyonc\u00e9 was the first female artist to be honored with the International Artist Award at the American Music Awards. She has also received the Legend Award at the 2008 World Music Awards and the Billboard Millennium Award at the 2011 Billboard Music Awards.",
    "topic": "Detail the significance of the Legend Award at the 2008 World Music Awards in relation to Beyonc\u00e9\u2019s career.",
    "response": "<document_analysis>\n1. **Thoughtful Content Examination:** The text focuses on Beyonc\u00e9's accolades and commercial success. It highlights her sales figures, certifications, and rankings from various music publications. A key element is the listing of specific awards received throughout her career.\n2. **Concept Exploration:** The Legend Award at the 2008 World Music Awards is presented as one of several significant honors. The text doesn't elaborate on the specific criteria for this award or its relative importance compared to others. This creates an opportunity to test understanding of award significance in the music industry.\n3. **Strategic Complexity Calibration:** Difficulty: 8/10. The question requires understanding of industry awards and inferring the significance of a \"Legend Award\" based on the context of Beyonc\u00e9\u2019s already established success. It's not a straightforward recall question.\n4. **Intentional Question Planning:** The question aims to assess whether the domain expert understands the significance of the Legend Award within the trajectory of Beyonc\u00e9\u2019s career. The incorrect answers will focus on awards received *after* 2008 or awards that are less prestigious, requiring the expert to differentiate based on the timing and stature of the honor.\n</document_analysis>\n\n<output_format>\nQuestion: The 2008 World Music Awards presented Beyonc\u00e9 with the Legend Award. Considering the timeline of her career achievements detailed in the text, what does receiving this award in 2008 most likely signify?\nA: It marked the beginning of her transition from a group artist (Destiny's Child) to a highly successful solo performer.\nB: It acknowledged her substantial and established impact on the music industry *prior to* the peak of her later decade-defining achievements.\nC: It validated her continued success following the release of her critically acclaimed album, *I Am... Sasha Fierce*.\nD: It represented a lifetime achievement award recognizing her overall contributions to R&B music.\nExplanation: The text indicates Beyonc\u00e9 had already achieved significant sales and recognition *before* 2008 (over 15 million albums sold in the US, RIAA\u2019s top certified artist of the 2000s). The Legend Award in 2008, therefore, likely recognized her already established impact, rather than being a starting point or a later validation.\nCorrect Answer: B\n</output_format>",
    "question": "The 2008 World Music Awards presented Beyonc\u00e9 with the Legend Award. Considering the timeline of her career achievements detailed in the text, what does receiving this award in 2008 most likely signify?",
    "choices": {
      "A": "It marked the beginning of her transition from a group artist (Destiny's Child) to a highly successful solo performer.",
      "B": "It acknowledged her substantial and established impact on the music industry *prior to* the peak of her later decade-defining achievements.",
      "C": "It validated her continued success following the release of her critically acclaimed album, *I Am... Sasha Fierce*.",
      "D": "It represented a lifetime achievement award recognizing her overall contributions to R&B music."
    },
    "answer": "B",
    "explanation": "The text indicates Beyonc\u00e9 had already achieved significant sales and recognition *before* 2008 (over 15 million albums sold in the US, RIAA\u2019s top certified artist of the 2000s). The Legend Award in 2008, therefore, likely recognized her already established impact, rather than being a starting point or a later validation.",
    "question_token_count": 41,
    "answer_correctness_score": 10,
    "explanation_validity_score": 10,
    "question_clarity_score": 7,
    "question_difficulty_score": 6,
    "question_groundedness_score": 10,
    "avg_answer_token_count": 22
  },
  {
    "context": "The game's media day, which was typically held on the Tuesday afternoon prior to the game, was moved to the Monday evening and re-branded as Super Bowl Opening Night. The event was held on February 1, 2016 at SAP Center in San Jose. Alongside the traditional media availabilities, the event featured an opening ceremony with player introductions on a replica of the Golden Gate Bridge.",
    "topic": "Detail the unique element incorporated into the opening ceremony of Super Bowl Opening Night at SAP Center in San Jose.",
    "response": "```xml\n<document_analysis>\n1. **Thoughtful Content Examination:** The context describes the rebranding of the Super Bowl's media day to \"Super Bowl Opening Night\" and its relocation to Monday evening. The key detail is the inclusion of an opening ceremony featuring player introductions on a replica of the Golden Gate Bridge.\n2. **Concept Exploration:** This detail highlights the Super Bowl's evolving efforts to create a more elaborate and entertaining fan experience beyond the game itself. It also demonstrates the use of iconic landmarks to enhance the event's visual appeal and branding.\n3. **Strategic Complexity Calibration:** Difficulty: 7/10. The answer is directly stated, but requires careful reading and attention to detail. The distractors are designed to be plausible elements associated with large sporting events.\n4. **Intentional Question Planning:** The question focuses on a specific, unique element of the opening ceremony to test detailed comprehension of the provided text. The answer options will include elements commonly found at large events, forcing the test-taker to distinguish the specific detail mentioned in the context.\n</document_analysis>\n<output_format>\nQuestion: What distinctive feature was incorporated into the opening ceremony of Super Bowl Opening Night at SAP Center in San Jose?\nA: A live performance by a renowned musical artist.\nB: Player introductions staged on a replica of a famous landmark.\nC: An elaborate fireworks display synchronized with team anthems.\nD: A holographic projection of past Super Bowl highlights.\nExplanation: The text explicitly states that the opening ceremony featured player introductions \"on a replica of the Golden Gate Bridge,\" making this the correct answer. The other options describe elements often found at large events but are not mentioned in the context.\nCorrect Answer: B\n</output_format>\n```",
    "question": "What distinctive feature was incorporated into the opening ceremony of Super Bowl Opening Night at SAP Center in San Jose?",
    "choices": {
      "A": "A live performance by a renowned musical artist.",
      "B": "Player introductions staged on a replica of a famous landmark.",
      "C": "An elaborate fireworks display synchronized with team anthems.",
      "D": "A holographic projection of past Super Bowl highlights."
    },
    "answer": "B",
    "explanation": "The text explicitly states that the opening ceremony featured player introductions \"on a replica of the Golden Gate Bridge,\" making this the correct answer. The other options describe elements often found at large events but are not mentioned in the context.",
    "question_token_count": 22,
    "answer_correctness_score": 10,
    "explanation_validity_score": 10,
    "question_clarity_score": 6,
    "question_difficulty_score": 5,
    "question_groundedness_score": 10,
    "avg_answer_token_count": 11
  },
  {
    "context": "Victoria's father was Prince Edward, Duke of Kent and Strathearn, the fourth son of the reigning King of the United Kingdom, George III. Until 1817, Edward's niece, Princess Charlotte of Wales, was the only legitimate grandchild of George III. Her death in 1817 precipitated a succession crisis that brought pressure on the Duke of Kent and his unmarried brothers to marry and have children. In 1818 he married Princess Victoria of Saxe-Coburg-Saalfeld, a widowed German princess with two children\u2014Carl (1804\u20131856) and Feodora (1807\u20131872)\u2014by her first marriage to the Prince of Leiningen. Her brother Leopold was Princess Charlotte's widower. The Duke and Duchess of Kent's only child, Victoria, was born at 4.15 a.m. on 24 May 1819 at Kensington Palace in London.",
    "topic": "Describe the familial connections between Princess Charlotte of Wales, the Duke of Kent, and Princess Victoria of Saxe-Coburg-Saalfeld.",
    "response": "```xml\n<document_analysis>\n1. **Thoughtful Content Examination:** The text details the familial relationships surrounding the birth of Queen Victoria, focusing on the succession crisis following Princess Charlotte's death and the subsequent marriages of her uncles. Key figures are Princess Charlotte, the Duke of Kent (Victoria\u2019s father), and Princess Victoria of Saxe-Coburg-Saalfeld (Victoria\u2019s mother). The text also introduces Leopold, Charlotte's widower, and the children of Victoria of Saxe-Coburg-Saalfeld from her first marriage.\n2. **Concept Exploration:** The passage highlights the importance of lineage and succession in 19th-century British royalty. It implicitly shows how personal tragedies (Charlotte\u2019s death) could have major political ramifications. The relationships are complex, involving multiple marriages and step-relationships.\n3. **Strategic Complexity Calibration:** Difficulty: 8/10. This question requires recalling several interconnected relationships and understanding the impact of events like Princess Charlotte\u2019s death. It\u2019s not a simple recall question; it demands synthesis.\n4. **Intentional Question Planning:** The question aims to test a deep understanding of the family tree presented. It requires the examinee to recall not only direct parent-child relationships but also connections through marriage and widowhood. The distractors will focus on plausible but incorrect relationships.\n</document_analysis>\n<output_format>\nQuestion: Considering the familial network described, what was the direct relationship between Princess Charlotte of Wales and Princess Victoria of Saxe-Coburg-Saalfeld?\nA: Victoria of Saxe-Coburg-Saalfeld was a maternal aunt to Princess Charlotte.\nB: Victoria of Saxe-Coburg-Saalfeld's brother was Princess Charlotte\u2019s widower.\nC: Princess Charlotte was the mother of Victoria of Saxe-Coburg-Saalfeld\u2019s first husband.\nD: Victoria of Saxe-Coburg-Saalfeld was a cousin to Princess Charlotte\u2019s father, George III.\nExplanation: The text states that Victoria of Saxe-Coburg-Saalfeld\u2019s brother, Leopold, was Princess Charlotte\u2019s widower, establishing a direct familial connection through marriage. This demonstrates a deep understanding of the interwoven relationships within the royal family.\nCorrect Answer: B\n</output_format>\n```",
    "question": "Considering the familial network described, what was the direct relationship between Princess Charlotte of Wales and Princess Victoria of Saxe-Coburg-Saalfeld?",
    "choices": {
      "A": "Victoria of Saxe-Coburg-Saalfeld was a maternal aunt to Princess Charlotte.",
      "B": "Victoria of Saxe-Coburg-Saalfeld's brother was Princess Charlotte\u2019s widower.",
      "C": "Princess Charlotte was the mother of Victoria of Saxe-Coburg-Saalfeld\u2019s first husband.",
      "D": "Victoria of Saxe-Coburg-Saalfeld was a cousin to Princess Charlotte\u2019s father, George III."
    },
    "answer": "B",
    "explanation": "The text states that Victoria of Saxe-Coburg-Saalfeld\u2019s brother, Leopold, was Princess Charlotte\u2019s widower, establishing a direct familial connection through marriage. This demonstrates a deep understanding of the interwoven relationships within the royal family.",
    "question_token_count": 30,
    "answer_correctness_score": 10,
    "explanation_validity_score": 10,
    "question_clarity_score": 6,
    "question_difficulty_score": 7,
    "question_groundedness_score": 10,
    "avg_answer_token_count": 21
  },
  {
    "context": "On 14 January 1858, an Italian refugee from Britain called Orsini attempted to assassinate Napoleon III with a bomb made in England. The ensuing diplomatic crisis destabilised the government, and Palmerston resigned. Derby was reinstated as prime minister. Victoria and Albert attended the opening of a new basin at the French military port of Cherbourg on 5 August 1858, in an attempt by Napoleon III to reassure Britain that his military preparations were directed elsewhere. On her return Victoria wrote to Derby reprimanding him for the poor state of the Royal Navy in comparison to the French one. Derby's ministry did not last long, and in June 1859 Victoria recalled Palmerston to office.",
    "topic": "Evaluate the extent to which Victoria's personal opinions influenced British policy towards France in the late 1850s.",
    "response": "```xml\n<document_analysis>\n1. **Thoughtful Content Examination:** The text details a period of Anglo-French relations marked by an assassination attempt on Napoleon III, a subsequent political crisis in Britain, and a demonstration of French naval power. Victoria's reaction to the naval comparison is a key element.\n2. **Concept Exploration:** The core theme is the interplay between diplomatic events, domestic politics in Britain, and the influence of Victoria\u2019s personal views. The text suggests Victoria was not afraid to express her opinions directly to the Prime Minister, which could potentially impact policy. The question topic asks about the extent of this influence.\n3. **Strategic Complexity Calibration:** Difficulty: 8/10. The text doesn't explicitly state *how much* influence Victoria had, requiring inference about the weight given to a monarch\u2019s private opinions in Victorian Britain. It requires understanding of the Victorian political system and the role of the monarch.\n4. **Intentional Question Planning:** The question focuses on Victoria\u2019s direct communication with Derby regarding the Navy. It requires understanding of the Victorian constitution, the role of the monarch, and the potential impact of such a direct intervention. The question aims to assess whether the expert understands the nuances of Victorian power dynamics.\n</document_analysis>\n<output_format>\nQuestion: Considering the Victorian political landscape of the late 1850s, what is the most likely impact of Queen Victoria\u2019s direct reprimand to Prime Minister Derby regarding the state of the Royal Navy?\nA: It triggered an immediate and substantial increase in naval funding, demonstrating Victoria\u2019s absolute authority over budgetary matters.\nB: It served as a significant, though indirect, catalyst for Palmerston\u2019s recall to office, reflecting concern over military preparedness.\nC: It was largely dismissed as a personal opinion with minimal impact on Derby\u2019s naval policy, as the Prime Minister held ultimate executive power.\nD: It prompted a formal parliamentary debate on naval spending, forcing Derby to justify his administration\u2019s priorities to the public.\nExplanation: The text indicates Victoria directly criticized Derby\u2019s naval policy and that Derby\u2019s ministry did not last long before Palmerston was recalled. While Victoria did not have direct budgetary control, her criticism, coupled with the context of French naval advancements, likely contributed to a climate of concern that favored Palmerston\u2019s return, known for his more assertive foreign policy.\nCorrect Answer: B\n</output_format>\n```",
    "question": "Considering the Victorian political landscape of the late 1850s, what is the most likely impact of Queen Victoria\u2019s direct reprimand to Prime Minister Derby regarding the state of the Royal Navy?",
    "choices": {
      "A": "It triggered an immediate and substantial increase in naval funding, demonstrating Victoria\u2019s absolute authority over budgetary matters.",
      "B": "It served as a significant, though indirect, catalyst for Palmerston\u2019s recall to office, reflecting concern over military preparedness.",
      "C": "It was largely dismissed as a personal opinion with minimal impact on Derby\u2019s naval policy, as the Prime Minister held ultimate executive power.",
      "D": "It prompted a formal parliamentary debate on naval spending, forcing Derby to justify his administration\u2019s priorities to the public."
    },
    "answer": "B",
    "explanation": "The text indicates Victoria directly criticized Derby\u2019s naval policy and that Derby\u2019s ministry did not last long before Palmerston was recalled. While Victoria did not have direct budgetary control, her criticism, coupled with the context of French naval advancements, likely contributed to a climate of concern that favored Palmerston\u2019s return, known for his more assertive foreign policy.",
    "question_token_count": 39,
    "answer_correctness_score": 9,
    "explanation_validity_score": 9,
    "question_clarity_score": 7,
    "question_difficulty_score": 8,
    "question_groundedness_score": 8,
    "avg_answer_token_count": 24
  },
  {
    "context": "On 14 January 1858, an Italian refugee from Britain called Orsini attempted to assassinate Napoleon III with a bomb made in England. The ensuing diplomatic crisis destabilised the government, and Palmerston resigned. Derby was reinstated as prime minister. Victoria and Albert attended the opening of a new basin at the French military port of Cherbourg on 5 August 1858, in an attempt by Napoleon III to reassure Britain that his military preparations were directed elsewhere. On her return Victoria wrote to Derby reprimanding him for the poor state of the Royal Navy in comparison to the French one. Derby's ministry did not last long, and in June 1859 Victoria recalled Palmerston to office.",
    "topic": "Explain the sequence of events leading to Palmerston's return to office in June 1859, identifying the factors that contributed to the instability of Derby's ministry.",
    "response": "```xml\n<document_analysis>\nThoughtful Content Examination: The text details a sequence of events starting with an assassination attempt on Napoleon III, leading to Palmerston's initial resignation and Derby's subsequent appointment. It highlights a diplomatic crisis, a naval comparison between Britain and France, and Victoria's dissatisfaction with the British Navy. The core theme is political instability and the shifting power dynamics leading to Palmerston's eventual return to power.\n\nConcept Exploration: The passage implicitly explores the interplay between international events, domestic politics, and the monarch's influence. The naval comparison points to anxieties about British military strength and prestige. The Queen\u2019s direct rebuke to the Prime Minister is a significant detail, showing her active role in political affairs. The passage doesn\u2019t explicitly state *why* Derby\u2019s ministry failed, but implies it was a combination of the initial crisis, the perceived naval weakness, and potentially, the Queen\u2019s disapproval.\n\nStrategic Complexity Calibration: Difficulty: 8/10. The passage requires understanding of cause-and-effect relationships, political context, and implicit criticisms. It demands the ability to synthesize information rather than simply recall facts.\n\nIntentional Question Planning: The question will focus on the factors contributing to Derby's ministry's instability, requiring the examinee to infer the reasons for its downfall beyond the initial crisis. It tests understanding of the subtle power dynamics at play, specifically Victoria's role.\n</document_analysis>\n\n<output_format>\nQuestion: Following the Orsini attempt on Napoleon III and Palmerston\u2019s subsequent resignation, Derby became Prime Minister, but his ministry proved short-lived. Which factor most significantly contributed to the instability of Derby\u2019s government and ultimately facilitated Palmerston\u2019s return to office in June 1859?\nA: The ongoing diplomatic fallout from the Orsini incident, which eroded public trust in the Conservative government.\nB: Queen Victoria\u2019s public criticism of the Royal Navy\u2019s inferiority to the French fleet, exposing a critical weakness in British defense.\nC: A series of parliamentary defeats on key legislative proposals, demonstrating a lack of support for Derby\u2019s policies.\nD: A significant economic downturn in Britain, leading to widespread social unrest and calls for a change in leadership.\nExplanation: The text explicitly states that Victoria reprimanded Derby for the poor state of the Royal Navy compared to the French, and that this occurred shortly before Palmerston was recalled. This demonstrates a direct and significant criticism of Derby\u2019s government, highlighting a critical weakness and contributing to its instability. While the Orsini incident initiated the shift, the naval criticism was a proximate cause of Derby\u2019s downfall.\nCorrect Answer: B\n</output_format>\n```",
    "question": "Following the Orsini attempt on Napoleon III and Palmerston\u2019s subsequent resignation, Derby became Prime Minister, but his ministry proved short-lived. Which factor most significantly contributed to the instability of Derby\u2019s government and ultimately facilitated Palmerston\u2019s return to office in June 1859?",
    "choices": {
      "A": "The ongoing diplomatic fallout from the Orsini incident, which eroded public trust in the Conservative government.",
      "B": "Queen Victoria\u2019s public criticism of the Royal Navy\u2019s inferiority to the French fleet, exposing a critical weakness in British defense.",
      "C": "A series of parliamentary defeats on key legislative proposals, demonstrating a lack of support for Derby\u2019s policies.",
      "D": "A significant economic downturn in Britain, leading to widespread social unrest and calls for a change in leadership."
    },
    "answer": "B",
    "explanation": "The text explicitly states that Victoria reprimanded Derby for the poor state of the Royal Navy compared to the French, and that this occurred shortly before Palmerston was recalled. This demonstrates a direct and significant criticism of Derby\u2019s government, highlighting a critical weakness and contributing to its instability. While the Orsini incident initiated the shift, the naval criticism was a proximate cause of Derby\u2019s downfall.",
    "question_token_count": 56,
    "answer_correctness_score": 10,
    "explanation_validity_score": 10,
    "question_clarity_score": 8,
    "question_difficulty_score": 7,
    "question_groundedness_score": 9,
    "avg_answer_token_count": 23
  },
  {
    "context": "At the age of 21 he settled in Paris. Thereafter, during the last 18 years of his life, he gave only some 30 public performances, preferring the more intimate atmosphere of the salon. He supported himself by selling his compositions and teaching piano, for which he was in high demand. Chopin formed a friendship with Franz Liszt and was admired by many of his musical contemporaries, including Robert Schumann. In 1835 he obtained French citizenship. After a failed engagement to Maria Wodzi\u0144ska, from 1837 to 1847 he maintained an often troubled relationship with the French writer George Sand. A brief and unhappy visit to Majorca with Sand in 1838\u201339 was one of his most productive periods of composition. In his last years, he was financially supported by his admirer Jane Stirling, who also arranged for him to visit Scotland in 1848. Through most of his life, Chopin suffered from poor health. He died in Paris in 1849, probably of tuberculosis.",
    "topic": "Chopin\u2019s lifelong struggles with poor health and his ultimate death from probable tuberculosis shaped his artistic perspective and limited his career.",
    "response": "<document_analysis>\n1. **Thoughtful Content Examination:** The text details Chopin's life from settling in Paris to his death, focusing on his performance habits, relationships, financial support, and health. It highlights his preference for salons over public performances, his income sources, and significant relationships with Liszt, Schumann, Sand, and Stirling. The context also mentions a particularly productive period during a visit to Majorca with Sand, and his probable cause of death: tuberculosis.\n\n2. **Concept Exploration:** The passage implicitly explores themes of artistic temperament, the challenges faced by musicians in the 19th century, the role of patronage, and the intersection of personal life and creative output. It suggests that Chopin\u2019s health and relationships significantly influenced his career path and artistic expression.\n\n3. **Strategic Complexity Calibration:** Difficulty: 8/10. The question requires understanding of Chopin's career choices in relation to his health and social circumstances, and the subtle implications of his preference for salons versus public performances.\n\n4. **Intentional Question Planning:** The question will focus on the interplay between Chopin's health, his performance choices, and his financial stability, requiring a nuanced understanding of his lifestyle and the artistic environment of the time. The incorrect answers will be plausible based on common assumptions about artists and their careers, but ultimately incorrect when considering the specifics of Chopin's situation.\n</document_analysis>\n\n<output_format>\nQuestion: Considering Chopin\u2019s documented preference for salon performances and his struggles with health, which of the following most accurately reflects the primary economic driver enabling his artistic independence?\nA: Extensive public concert tours and lucrative performance fees.\nB: Royal patronage and consistent commissions from the French aristocracy.\nC: Income derived from teaching piano and the sale of published compositions.\nD: Financial support from his close friend and fellow composer, Franz Liszt.\nExplanation: The text explicitly states Chopin \"supported himself by selling his compositions and teaching piano, for which he was in high demand.\" This indicates these were his primary income sources, allowing him to avoid the rigors of extensive public performances that his health would not have allowed.\nCorrect Answer: C\n</output_format>",
    "question": "Considering Chopin\u2019s documented preference for salon performances and his struggles with health, which of the following most accurately reflects the primary economic driver enabling his artistic independence?",
    "choices": {
      "A": "Extensive public concert tours and lucrative performance fees.",
      "B": "Royal patronage and consistent commissions from the French aristocracy.",
      "C": "Income derived from teaching piano and the sale of published compositions.",
      "D": "Financial support from his close friend and fellow composer, Franz Liszt."
    },
    "answer": "C",
    "explanation": "The text explicitly states Chopin \"supported himself by selling his compositions and teaching piano, for which he was in high demand.\" This indicates these were his primary income sources, allowing him to avoid the rigors of extensive public performances that his health would not have allowed.",
    "question_token_count": 32,
    "answer_correctness_score": 10,
    "explanation_validity_score": 10,
    "question_clarity_score": 6,
    "question_difficulty_score": 8,
    "question_groundedness_score": 9,
    "avg_answer_token_count": 13
  },
  {
    "context": "Antibiotics are screened for any negative effects on humans or other mammals before approval for clinical use, and are usually considered safe and most are well tolerated. However, some antibiotics have been associated with a range of adverse side effects. Side-effects range from mild to very serious depending on the antibiotics used, the microbial organisms targeted, and the individual patient. Side effects may reflect the pharmacological or toxicological properties of the antibiotic or may involve hypersensitivity reactions or anaphylaxis. Safety profiles of newer drugs are often not as well established as for those that have a long history of use. Adverse effects range from fever and nausea to major allergic reactions, including photodermatitis and anaphylaxis. Common side-effects include diarrhea, resulting from disruption of the species composition in the intestinal flora, resulting, for example, in overgrowth of pathogenic bacteria, such as Clostridium difficile. Antibacterials can also affect the vaginal flora, and may lead to overgrowth of yeast species of the genus Candida in the vulvo-vaginal area. Additional side-effects can result from interaction with other drugs, such as elevated risk of tendon damage from administration of a quinolone antibiotic with a systemic corticosteroid. Some scientists have hypothesized that the indiscriminate use of antibiotics alter the host microbiota and this has been associated with chronic disease.",
    "topic": "Compare and contrast the safety profiles of newer antibiotics versus those with a longer history of clinical use.",
    "response": "```xml\n<document_analysis>\n1. **Thoughtful Content Examination:** The text discusses the safety profiles of antibiotics, highlighting that while generally safe, they can cause a range of adverse effects. It points out a key difference: newer antibiotics have less established safety profiles than older ones. The text details various side effects, including gastrointestinal issues, allergic reactions, and drug interactions. It also touches upon the potential long-term consequences of antibiotic use on the host microbiota.\n\n2. **Concept Exploration:** The core concept is the trade-off between the benefits of antibiotic treatment and the potential risks. The text implicitly raises the issue of post-market surveillance and the importance of long-term data collection for newer drugs. The connection between antibiotic use and changes in the microbiota suggests a complex interplay between drugs, the microbiome, and host health.\n\n3. **Strategic Complexity Calibration:** Difficulty: 8/10. The question targets the understanding of relative risk assessment in pharmacology and the importance of historical data in drug safety evaluation. It requires the expert to synthesize information about various side effects and their context.\n\n4. **Intentional Question Planning:** The question aims to probe the expert\u2019s understanding of the nuances of antibiotic safety, particularly the challenges associated with introducing new drugs into clinical practice. It requires the expert to consider the balance between potential benefits and the uncertainties surrounding newer medications.\n</document_analysis>\n\n<output_format>\nQuestion: Considering the established understanding of antibiotic safety profiles, which statement most accurately reflects a primary distinction between newer and older antibiotics regarding adverse event monitoring?\nA: Newer antibiotics undergo more rigorous pre-clinical testing, mitigating potential adverse events compared to older drugs.\nB: Older antibiotics benefit from extensive post-market surveillance data, providing a more comprehensive understanding of long-term effects than is currently available for newer agents.\nC: Newer antibiotics are exclusively synthetic, resulting in a reduced incidence of allergic reactions observed with naturally-derived older antibiotics.\nD: Older antibiotics demonstrate a consistently higher rate of severe gastrointestinal disturbances due to their broader spectrum of activity.\nExplanation: The text explicitly states that \"Safety profiles of newer drugs are often not as well established as for those that have a long history of use.\" This highlights the benefit of time and accumulated data for older antibiotics.\nCorrect Answer: B\n</output_format>\n```",
    "question": "Considering the established understanding of antibiotic safety profiles, which statement most accurately reflects a primary distinction between newer and older antibiotics regarding adverse event monitoring?",
    "choices": {
      "A": "Newer antibiotics undergo more rigorous pre-clinical testing, mitigating potential adverse events compared to older drugs.",
      "B": "Older antibiotics benefit from extensive post-market surveillance data, providing a more comprehensive understanding of long-term effects than is currently available for newer agents.",
      "C": "Newer antibiotics are exclusively synthetic, resulting in a reduced incidence of allergic reactions observed with naturally-derived older antibiotics.",
      "D": "Older antibiotics demonstrate a consistently higher rate of severe gastrointestinal disturbances due to their broader spectrum of activity."
    },
    "answer": "B",
    "explanation": "The text explicitly states that \"Safety profiles of newer drugs are often not as well established as for those that have a long history of use.\" This highlights the benefit of time and accumulated data for older antibiotics.",
    "question_token_count": 28,
    "answer_correctness_score": 10,
    "explanation_validity_score": 10,
    "question_clarity_score": 7,
    "question_difficulty_score": 6,
    "question_groundedness_score": 9,
    "avg_answer_token_count": 23
  },
  {
    "context": "All of Chopin's compositions include the piano. Most are for solo piano, though he also wrote two piano concertos, a few chamber pieces, and some songs to Polish lyrics. His keyboard style is highly individual and often technically demanding; his own performances were noted for their nuance and sensitivity. Chopin invented the concept of instrumental ballade. His major piano works also include mazurkas, waltzes, nocturnes, polonaises, \u00e9tudes, impromptus, scherzos, preludes and sonatas, some published only after his death. Influences on his compositional style include Polish folk music, the classical tradition of J. S. Bach, Mozart and Schubert, the music of all of whom he admired, as well as the Paris salons where he was a frequent guest. His innovations in style, musical form, and harmony, and his association of music with nationalism, were influential throughout and after the late Romantic period.",
    "topic": "Discuss the relationship between Polish folk music and Chopin\u2019s compositional output.",
    "response": "```xml\n<document_analysis>\nThoughtful Content Examination: The text segment discusses Chopin's compositional style, focusing on his piano works and influences. It highlights his unique keyboard style, innovations in musical form, and the impact of Polish folk music, classical composers, and Parisian salons on his work.\n\nConcept Exploration: The passage subtly implies a direct connection between Chopin\u2019s Polish heritage and his musical output, specifically mentioning Polish folk music as an influence. The reference to nationalism is also key, suggesting Chopin used music to express Polish identity. It also notes that Chopin invented the instrumental ballade, and lists several of his major piano works.\n\nStrategic Complexity Calibration: Difficulty: 8/10. The question will focus on the nuanced relationship between Chopin\u2019s folk music influences and his compositional output, moving beyond a simple statement of fact. The answer requires understanding of Chopin\u2019s compositional style and the nature of folk music\u2019s influence.\n\nIntentional Question Planning: The question will ask about the specific compositional elements that reflect Polish folk music, probing for an understanding of how Chopin integrated these influences into his work beyond a general acknowledgement of their existence. The distractors will focus on other influences mentioned in the text (Bach, Mozart, Schubert, Parisian salons) or misinterpret the nature of the influence.\n</document_analysis>\n\n<output_format>\nQuestion: Considering Chopin\u2019s compositional influences, which element most distinctly reflects the impact of Polish folk music on his work?\nA: The rigorous application of counterpoint derived from the Baroque tradition of J.S. Bach.\nB: The incorporation of specific rhythmic and melodic characteristics evocative of Polish dances like the mazurka and polonaise.\nC: The structural complexity and harmonic innovations mirroring the late Classical style of Mozart and Schubert.\nD: The improvisational character and intimate atmosphere cultivated in the Parisian salons he frequented.\nExplanation: The text explicitly states that Polish folk music was an influence on Chopin\u2019s compositional style. Furthermore, his major piano works *include* mazurkas and polonaises, which are traditional Polish dances. This suggests a direct incorporation of rhythmic and melodic elements from Polish folk music into his compositions.\nCorrect Answer: B\n</output_format>\n```",
    "question": "Considering Chopin\u2019s compositional influences, which element most distinctly reflects the impact of Polish folk music on his work?",
    "choices": {
      "A": "The rigorous application of counterpoint derived from the Baroque tradition of J.S. Bach.",
      "B": "The incorporation of specific rhythmic and melodic characteristics evocative of Polish dances like the mazurka and polonaise.",
      "C": "The structural complexity and harmonic innovations mirroring the late Classical style of Mozart and Schubert.",
      "D": "The improvisational character and intimate atmosphere cultivated in the Parisian salons he frequented."
    },
    "answer": "B",
    "explanation": "The text explicitly states that Polish folk music was an influence on Chopin\u2019s compositional style. Furthermore, his major piano works *include* mazurkas and polonaises, which are traditional Polish dances. This suggests a direct incorporation of rhythmic and melodic elements from Polish folk music into his compositions.",
    "question_token_count": 24,
    "answer_correctness_score": 10,
    "explanation_validity_score": 10,
    "question_clarity_score": 8,
    "question_difficulty_score": 6,
    "question_groundedness_score": 9,
    "avg_answer_token_count": 20
  },
  {
    "context": "The Panthers offense, which led the NFL in scoring (500 points), was loaded with talent, boasting six Pro Bowl selections. Pro Bowl quarterback Cam Newton had one of his best seasons, throwing for 3,837 yards and rushing for 636, while recording a career-high and league-leading 45 total touchdowns (35 passing, 10 rushing), a career-low 10 interceptions, and a career-best quarterback rating of 99.4. Newton's leading receivers were tight end Greg Olsen, who caught a career-high 77 passes for 1,104 yards and seven touchdowns, and wide receiver Ted Ginn, Jr., who caught 44 passes for 739 yards and 10 touchdowns; Ginn also rushed for 60 yards and returned 27 punts for 277 yards. Other key receivers included veteran Jerricho Cotchery (39 receptions for 485 yards), rookie Devin Funchess (31 receptions for 473 yards and five touchdowns), and second-year receiver Corey Brown (31 receptions for 447 yards). The Panthers backfield featured Pro Bowl running back Jonathan Stewart, who led the team with 989 rushing yards and six touchdowns in 13 games, along with Pro Bowl fullback Mike Tolbert, who rushed for 256 yards and caught 18 passes for another 154 yards. Carolina's offensive line also featured two Pro Bowl selections: center Ryan Kalil and guard Trai Turner.",
    "topic": "Assess the role of Jonathan Stewart and Mike Tolbert in the Panthers' rushing attack during the 2015 season, including their respective yardage totals and touchdowns.",
    "response": "<document_analysis>\n1. **Thoughtful Content Examination:** The text details the offensive strengths of the 2015 Carolina Panthers, highlighting key players and their statistics. It specifically mentions Cam Newton, Greg Olsen, Ted Ginn Jr., Jonathan Stewart, and Mike Tolbert, along with their respective contributions. The focus is on overall offensive performance and individual statistics.\n\n2. **Concept Exploration:** The text implicitly demonstrates the importance of a balanced offensive attack, showcasing contributions from the quarterback, receivers, and running backs. It also emphasizes the role of the offensive line in supporting these players. A key aspect is the dual-threat capability of both Newton and Stewart.\n\n3. **Strategic Complexity Calibration:** Difficulty: 8/10. The question will require precise recall of specific statistics related to two players and a comparison of their contributions, while avoiding common pitfalls like focusing solely on Newton. The question tests granular knowledge within a broader context.\n\n4. **Intentional Question Planning:** The question will focus on the complementary roles of Stewart and Tolbert in the rushing attack. It will require the test-taker to recall specific yardage totals and touchdowns for both players, and to understand their relative contributions to the team's rushing success. The question is designed to assess a deep understanding of the Panthers\u2019 offensive dynamics.\n</document_analysis>\n\n<output_format>\nQuestion: During the 2015 season, the Carolina Panthers boasted a potent rushing attack. While Jonathan Stewart was the leading rusher, what was the approximate difference in rushing yards between Stewart and Mike Tolbert?\nA: 633 yards\nB: 733 yards\nC: 833 yards\nD: 933 yards\nExplanation: The text states Jonathan Stewart rushed for 989 yards and Mike Tolbert rushed for 256 yards. The difference is 989 - 256 = 733 yards.\nCorrect Answer: B\n</output_format>",
    "question": "During the 2015 season, the Carolina Panthers boasted a potent rushing attack. While Jonathan Stewart was the leading rusher, what was the approximate difference in rushing yards between Stewart and Mike Tolbert?",
    "choices": {
      "A": "633 yards",
      "B": "733 yards",
      "C": "833 yards",
      "D": "933 yards"
    },
    "answer": "B",
    "explanation": "The text states Jonathan Stewart rushed for 989 yards and Mike Tolbert rushed for 256 yards. The difference is 989 - 256 = 733 yards.",
    "question_token_count": 42,
    "answer_correctness_score": 10,
    "explanation_validity_score": 10,
    "question_clarity_score": 6,
    "question_difficulty_score": 4,
    "question_groundedness_score": 10,
    "avg_answer_token_count": 3
  },
  {
    "context": "Scientists do not know the exact cause of sexual orientation, but they believe that it is caused by a complex interplay of genetic, hormonal, and environmental influences. They favor biologically-based theories, which point to genetic factors, the early uterine environment, both, or the inclusion of genetic and social factors. There is no substantive evidence which suggests parenting or early childhood experiences play a role when it comes to sexual orientation. Research over several decades has demonstrated that sexual orientation ranges along a continuum, from exclusive attraction to the opposite sex to exclusive attraction to the same sex.",
    "topic": "Explain the current scientific consensus regarding the etiology of sexual orientation, emphasizing the interplay of contributing factors.",
    "response": "```xml\n<document_analysis>\n1. **Thoughtful Content Examination**: The context discusses the current scientific understanding of sexual orientation's origins, highlighting a multifactorial model involving genetic, hormonal, and environmental influences. It explicitly states a lack of evidence supporting parental influence or early childhood experiences. The text also notes the continuum of sexual orientation.\n2. **Concept Exploration**: The core concept is the etiology of sexual orientation, a topic often laden with misconceptions. The text emphasizes the rejection of simplistic, single-cause explanations in favor of a complex interplay of factors. The implicit assumption is that sexual orientation is a naturally occurring phenomenon, not a choice or a result of upbringing.\n3. **Strategic Complexity Calibration**: Difficulty: 9/10. The question requires understanding of complex biological and environmental interactions, and the ability to differentiate between scientifically supported and unsupported theories. It also challenges the common misconception about parental influence.\n4. **Intentional Question Planning**: The question is designed to assess a domain expert\u2019s understanding of the current scientific consensus, their ability to synthesize information about multifactorial causation, and their awareness of debunked theories. The distractors are crafted to represent common misconceptions or oversimplifications.\n</document_analysis>\n<output_format>\nQuestion: Considering the current scientific understanding, which statement best encapsulates the primary etiological factors contributing to sexual orientation?\nA: Predominantly shaped by early childhood experiences and parental influence.\nB: Determined by a single gene inherited from either parent.\nC: Resulting from a complex interplay of genetic, hormonal, and environmental influences.\nD: Primarily influenced by conscious choices and personal preferences developed throughout life.\nExplanation: The text explicitly states that scientists believe sexual orientation is caused by \u201ca complex interplay of genetic, hormonal, and environmental influences\u201d and that there is \u201cno substantive evidence which suggests parenting or early childhood experiences play a role.\u201d This makes option C the correct answer.\nCorrect Answer: C\n</output_format>\n```",
    "question": "Considering the current scientific understanding, which statement best encapsulates the primary etiological factors contributing to sexual orientation?",
    "choices": {
      "A": "Predominantly shaped by early childhood experiences and parental influence.",
      "B": "Determined by a single gene inherited from either parent.",
      "C": "Resulting from a complex interplay of genetic, hormonal, and environmental influences.",
      "D": "Primarily influenced by conscious choices and personal preferences developed throughout life."
    },
    "answer": "C",
    "explanation": "The text explicitly states that scientists believe sexual orientation is caused by \u201ca complex interplay of genetic, hormonal, and environmental influences\u201d and that there is \u201cno substantive evidence which suggests parenting or early childhood experiences play a role.\u201d This makes option C the correct answer.",
    "question_token_count": 22,
    "answer_correctness_score": 10,
    "explanation_validity_score": 10,
    "question_clarity_score": 8,
    "question_difficulty_score": 7,
    "question_groundedness_score": 10,
    "avg_answer_token_count": 13
  },
  {
    "context": "On June 4, 2014, the NFL announced that the practice of branding Super Bowl games with Roman numerals, a practice established at Super Bowl V, would be temporarily suspended, and that the game would be named using Arabic numerals as Super Bowl 50 as opposed to Super Bowl L. The use of Roman numerals will be reinstated for Super Bowl LI. Jaime Weston, the league's vice president of brand and creative, explained that a primary reason for the change was the difficulty of designing an aesthetically pleasing logo with the letter \"L\" using the standardized logo template introduced at Super Bowl XLV. The logo also deviates from the template by featuring large numerals, colored in gold, behind the Vince Lombardi Trophy, instead of underneath and in silver as in the standard logo.",
    "topic": "The role of Jaime Weston, the league's vice president of brand and creative, in communicating the reasons for the Super Bowl 50 naming change.",
    "response": "```xml\n<document_analysis>\nThoughtful Content Examination: The text discusses the NFL's decision to deviate from the traditional Roman numeral naming convention for Super Bowl 50, opting for Arabic numerals. It highlights a key reason for this change: the aesthetic challenges of incorporating the Roman numeral \"L\" into the standardized logo template. It also details specific design alterations in the Super Bowl 50 logo compared to the standard template.\n\nConcept Exploration: The decision to temporarily abandon a long-standing tradition reveals the importance the NFL places on branding and visual aesthetics. The explanation centers on a seemingly minor detail (the letter \"L\") but underscores the meticulous planning involved in major event branding. The use of gold coloring and altered placement of numerals further emphasizes the desire for a distinctive and visually appealing logo.\n\nStrategic Complexity Calibration: Difficulty: 8/10. The question targets a nuanced understanding of branding decisions within a large organization, requiring an understanding of both the practical constraints (logo design) and the strategic considerations (maintaining brand consistency vs. achieving visual appeal).\n\nIntentional Question Planning: The question will focus on the core reason provided by Jaime Weston, framing it as a problem-solving scenario to assess the understanding of the interplay between branding guidelines and creative execution. The distractors will focus on alternative, plausible but incorrect reasons for the change.\n</document_analysis>\n\n<output_format>\nQuestion: Jaime Weston, the NFL\u2019s vice president of brand and creative, articulated a primary driver for the Super Bowl 50 naming convention change; what was this key concern?\nA: The desire to align with a broader marketing campaign centered around the number 50.\nB: The aesthetic challenges of integrating the Roman numeral \"L\" into the established logo template.\nC: A strategic decision to simplify the branding for international audiences unfamiliar with Roman numerals.\nD: A cost-reduction initiative aimed at minimizing logo design expenses.\nExplanation: The text explicitly states that a primary reason for the change was \"the difficulty of designing an aesthetically pleasing logo with the letter 'L' using the standardized logo template.\" This highlights the practical constraint that influenced the branding decision.\nCorrect Answer: B\n</output_format>\n```",
    "question": "Jaime Weston, the NFL\u2019s vice president of brand and creative, articulated a primary driver for the Super Bowl 50 naming convention change; what was this key concern?",
    "choices": {
      "A": "The desire to align with a broader marketing campaign centered around the number 50.",
      "B": "The aesthetic challenges of integrating the Roman numeral \"L\" into the established logo template.",
      "C": "A strategic decision to simplify the branding for international audiences unfamiliar with Roman numerals.",
      "D": "A cost-reduction initiative aimed at minimizing logo design expenses."
    },
    "answer": "B",
    "explanation": "The text explicitly states that a primary reason for the change was \"the difficulty of designing an aesthetically pleasing logo with the letter 'L' using the standardized logo template.\" This highlights the practical constraint that influenced the branding decision.",
    "question_token_count": 35,
    "answer_correctness_score": 10,
    "explanation_validity_score": 10,
    "question_clarity_score": 5,
    "question_difficulty_score": 6,
    "question_groundedness_score": 10,
    "avg_answer_token_count": 16
  },
  {
    "context": "Buddhism /\u02c8bud\u026az\u0259m/ is a nontheistic religion[note 1] or philosophy (Sanskrit: \u0927\u0930\u094d\u092e dharma; Pali: \u0927\u092e\u094d\u092e dhamma) that encompasses a variety of traditions, beliefs and spiritual practices largely based on teachings attributed to Gautama Buddha, commonly known as the Buddha (\"the awakened one\"). According to Buddhist tradition, the Buddha lived and taught in the eastern part of the Indian subcontinent, present-day Nepal sometime between the 6th and 4th centuries BCE.[note 1] He is recognized by Buddhists as an awakened or enlightened teacher who shared his insights to help sentient beings end their suffering through the elimination of ignorance and craving. Buddhists believe that this is accomplished through the direct understanding and perception of dependent origination and the Four Noble Truths.",
    "topic": "Articulate the Buddhist belief in ending suffering through the elimination of ignorance and craving.",
    "response": "```xml\n<document_analysis>\n1. **Thoughtful Content Examination:** The text introduces Buddhism, its origins, and the core belief that suffering can be ended through the elimination of ignorance and craving. It highlights the Buddha as a teacher who shared insights for this purpose, emphasizing dependent origination and the Four Noble Truths.\n2. **Concept Exploration:** The key concept is the relationship between ignorance, craving, and suffering within the Buddhist framework. The text implicitly suggests a causal link: ignorance and craving *lead to* suffering, and their elimination *leads to* its cessation. Dependent origination and the Four Noble Truths are presented as the *means* to achieve this understanding.\n3. **Strategic Complexity Calibration:** Difficulty: 8/10. This question requires understanding of a complex philosophical concept (the root of suffering) and its proposed solution within a specific religious/philosophical tradition. It's challenging because it asks about the *mechanism* by which suffering is overcome, not just its existence.\n4. **Intentional Question Planning:** The question will focus on the specific mechanism described in the text \u2013 how the Buddha believed suffering could be ended. The distractors will center around other potential pathways to enlightenment or misinterpretations of Buddhist concepts.\n</document_analysis>\n<output_format>\nQuestion: According to Buddhist tradition, what is the primary mechanism through which sentient beings can alleviate suffering, as taught by the Buddha?\nA: Through devotion to deities and performance of ritualistic practices.\nB: Through the direct understanding of dependent origination and the Four Noble Truths.\nC: Through the accumulation of wealth and the pursuit of worldly pleasures.\nD: Through rigorous self-denial and the complete suppression of all desires.\nExplanation: The text explicitly states that Buddhists believe suffering is ended \"through the direct understanding and perception of dependent origination and the Four Noble Truths.\" This highlights the importance of insight and wisdom, not external factors or asceticism.\nCorrect Answer: B\n</output_format>\n```",
    "question": "According to Buddhist tradition, what is the primary mechanism through which sentient beings can alleviate suffering, as taught by the Buddha?",
    "choices": {
      "A": "Through devotion to deities and performance of ritualistic practices.",
      "B": "Through the direct understanding of dependent origination and the Four Noble Truths.",
      "C": "Through the accumulation of wealth and the pursuit of worldly pleasures.",
      "D": "Through rigorous self-denial and the complete suppression of all desires."
    },
    "answer": "B",
    "explanation": "The text explicitly states that Buddhists believe suffering is ended \"through the direct understanding and perception of dependent origination and the Four Noble Truths.\" This highlights the importance of insight and wisdom, not external factors or asceticism.",
    "question_token_count": 26,
    "answer_correctness_score": 10,
    "explanation_validity_score": 10,
    "question_clarity_score": 8,
    "question_difficulty_score": 7,
    "question_groundedness_score": 6,
    "avg_answer_token_count": 14
  },
  {
    "context": "At the age of 21 he settled in Paris. Thereafter, during the last 18 years of his life, he gave only some 30 public performances, preferring the more intimate atmosphere of the salon. He supported himself by selling his compositions and teaching piano, for which he was in high demand. Chopin formed a friendship with Franz Liszt and was admired by many of his musical contemporaries, including Robert Schumann. In 1835 he obtained French citizenship. After a failed engagement to Maria Wodzi\u0144ska, from 1837 to 1847 he maintained an often troubled relationship with the French writer George Sand. A brief and unhappy visit to Majorca with Sand in 1838\u201339 was one of his most productive periods of composition. In his last years, he was financially supported by his admirer Jane Stirling, who also arranged for him to visit Scotland in 1848. Through most of his life, Chopin suffered from poor health. He died in Paris in 1849, probably of tuberculosis.",
    "topic": "Chopin's shift in performance preference from public concerts to intimate salons during the latter part of his life reflects a deliberate artistic choice.",
    "response": "<document_analysis>\n1. **Thoughtful Content Examination:** The context details Chopin\u2019s life, focusing on his move to Paris, limited public performances, preference for salons, income sources, relationships, health, and eventual death. The key point relevant to the topic is his shift from public concerts to salon performances.\n2. **Concept Exploration:** The shift in performance preference suggests a deliberate artistic choice, potentially linked to control over the audience experience, sound quality, or the emotional connection with listeners. The text doesn't explicitly state *why* he preferred salons, but implies it was a conscious decision given the low number of public performances.\n3. **Strategic Complexity Calibration:** Difficulty: 8/10. The question requires inferring Chopin's artistic motivations based on limited information and understanding the nuances of 19th-century musical culture.\n4. **Intentional Question Planning:** The question aims to probe the domain expert's understanding of Chopin's artistic priorities and the social context of his performances. The answer options will require a nuanced understanding of the differences between public concert halls and salons during that period.\n</document_analysis>\n\n<output_format>\nQuestion: Considering Chopin\u2019s documented preference for performing in salons rather than large concert halls during the latter part of his life, which artistic consideration most likely influenced this shift?\nA: Salons provided a more controlled acoustic environment suitable for the subtle dynamics of his compositions.\nB: Concert halls were primarily venues for showcasing virtuosity, an aspect Chopin deliberately downplayed in his artistry.\nC: Salons fostered a more intimate setting conducive to a deeper emotional connection with a discerning audience.\nD: Public performances created financial instability, prompting Chopin to prioritize the patronage offered within salon circles.\nExplanation: The text states Chopin preferred salons and supported himself through composition and teaching, suggesting a preference for a more controlled artistic environment. While financial considerations played a role, the text emphasizes his limited public performances, implying a deliberate artistic choice beyond mere financial necessity. The intimacy of the salon setting would have allowed for a more direct emotional exchange with a receptive audience, better suited to the nuances of his compositions.\nCorrect Answer: C\n</output_format>",
    "question": "Considering Chopin\u2019s documented preference for performing in salons rather than large concert halls during the latter part of his life, which artistic consideration most likely influenced this shift?",
    "choices": {
      "A": "Salons provided a more controlled acoustic environment suitable for the subtle dynamics of his compositions.",
      "B": "Concert halls were primarily venues for showcasing virtuosity, an aspect Chopin deliberately downplayed in his artistry.",
      "C": "Salons fostered a more intimate setting conducive to a deeper emotional connection with a discerning audience.",
      "D": "Public performances created financial instability, prompting Chopin to prioritize the patronage offered within salon circles."
    },
    "answer": "C",
    "explanation": "The text states Chopin preferred salons and supported himself through composition and teaching, suggesting a preference for a more controlled artistic environment. While financial considerations played a role, the text emphasizes his limited public performances, implying a deliberate artistic choice beyond mere financial necessity. The intimacy of the salon setting would have allowed for a more direct emotional exchange with a receptive audience, better suited to the nuances of his compositions.",
    "question_token_count": 34,
    "answer_correctness_score": 9,
    "explanation_validity_score": 9,
    "question_clarity_score": 6,
    "question_difficulty_score": 7,
    "question_groundedness_score": 8,
    "avg_answer_token_count": 21
  },
  {
    "context": "Palmerston died in 1865, and after a brief ministry led by Russell, Derby returned to power. In 1866, Victoria attended the State Opening of Parliament for the first time since Albert's death. The following year she supported the passing of the Reform Act 1867 which doubled the electorate by extending the franchise to many urban working men, though she was not in favour of votes for women. Derby resigned in 1868, to be replaced by Benjamin Disraeli, who charmed Victoria. \"Everyone likes flattery,\" he said, \"and when you come to royalty you should lay it on with a trowel.\" With the phrase \"we authors, Ma'am\", he complimented her. Disraeli's ministry only lasted a matter of months, and at the end of the year his Liberal rival, William Ewart Gladstone, was appointed prime minister. Victoria found Gladstone's demeanour far less appealing; he spoke to her, she is thought to have complained, as though she were \"a public meeting rather than a woman\".",
    "topic": "The political context of Britain immediately following Palmerston's death in 1865 and the subsequent return of Lord Derby to power.",
    "response": "```xml\n<document_analysis>\n1. **Thoughtful Content Examination:** The text details the political transition following Palmerston's death, focusing on the shifts in power between Russell, Derby, Disraeli, and Gladstone, and Queen Victoria's interactions with each. A key theme is Victoria's personal preferences and how they influenced her relationships with her ministers. The Reform Act of 1867 is also mentioned as a significant event during this period.\n2. **Concept Exploration:** The passage implicitly highlights the evolving relationship between the monarchy and Parliament in the Victorian era. Victoria's initial grief and seclusion gradually gave way to a more active role in public life, but her personal biases clearly played a role in her political preferences. The contrasting styles of Disraeli (flattering) and Gladstone (direct) reveal a lot about Victorian political culture and the expectations placed upon leaders.\n3. **Strategic Complexity Calibration:** Difficulty: 8/10. This question requires understanding not just the sequence of events but also the underlying dynamics of Victorian politics and Victoria's personality. The answer isn't explicitly stated but requires inference based on the descriptions of the prime ministers.\n4. **Intentional Question Planning:** The question aims to assess the expert's understanding of Victoria\u2019s preferences and how these preferences influenced the political landscape following Palmerston\u2019s death. It focuses on a nuanced aspect of the period \u2013 the Queen's personal reactions to different political figures \u2013 rather than simply testing factual recall.\n</document_analysis>\n<output_format>\nQuestion: Queen Victoria's contrasting reactions to Benjamin Disraeli and William Ewart Gladstone primarily stemmed from a difference in their:\nA: Economic policies regarding industrial reform and trade.\nB: Approaches to foreign policy and colonial expansion.\nC: Styles of communication and personal demeanor.\nD: Support for or opposition to further electoral reforms.\nExplanation: The text explicitly states Victoria found Disraeli charming and appreciated his flattery, while she felt Gladstone spoke to her \"as though she were a public meeting rather than a woman.\" This highlights a fundamental difference in their communication styles and personal approaches, which directly impacted Victoria's preference.\nCorrect Answer: C\n</output_format>\n```",
    "question": "Queen Victoria's contrasting reactions to Benjamin Disraeli and William Ewart Gladstone primarily stemmed from a difference in their:",
    "choices": {
      "A": "Economic policies regarding industrial reform and trade.",
      "B": "Approaches to foreign policy and colonial expansion.",
      "C": "Styles of communication and personal demeanor.",
      "D": "Support for or opposition to further electoral reforms."
    },
    "answer": "C",
    "explanation": "The text explicitly states Victoria found Disraeli charming and appreciated his flattery, while she felt Gladstone spoke to her \"as though she were a public meeting rather than a woman.\" This highlights a fundamental difference in their communication styles and personal approaches, which directly impacted Victoria's preference.",
    "question_token_count": 26,
    "answer_correctness_score": 10,
    "explanation_validity_score": 10,
    "question_clarity_score": 8,
    "question_difficulty_score": 6,
    "question_groundedness_score": 10,
    "avg_answer_token_count": 9
  },
  {
    "context": "Following their loss in the divisional round of the previous season's playoffs, the Denver Broncos underwent numerous coaching changes, including a mutual parting with head coach John Fox (who had won four divisional championships in his four years as Broncos head coach), and the hiring of Gary Kubiak as the new head coach. Under Kubiak, the Broncos planned to install a run-oriented offense with zone blocking to blend in with quarterback Peyton Manning's shotgun passing skills, but struggled with numerous changes and injuries to the offensive line, as well as Manning having his worst statistical season since his rookie year with the Indianapolis Colts in 1998, due to a plantar fasciitis injury in his heel that he had suffered since the summer, and the simple fact that Manning was getting old, as he turned 39 in the 2015 off-season. Although the team had a 7\u20130 start, Manning led the NFL in interceptions. In week 10, Manning suffered a partial tear of the plantar fasciitis in his left foot. He set the NFL's all-time record for career passing yards in this game, but was benched after throwing four interceptions in favor of backup quarterback Brock Osweiler, who took over as the starter for most of the remainder of the regular season. Osweiler was injured, however, leading to Manning's return during the Week 17 regular season finale, where the Broncos were losing 13\u20137 against the 4\u201311 San Diego Chargers, resulting in Manning re-claiming the starting quarterback position for the playoffs by leading the team to a key 27\u201320 win that enabled the team to clinch the number one overall AFC seed. Under defensive coordinator Wade Phillips, the Broncos' defense ranked number one in total yards allowed, passing yards allowed and sacks, and like the previous three seasons, the team has continued to set numerous individual, league and franchise records. With the defense carrying the team despite the issues with the offense, the Broncos finished the regular season with a 12\u20134 record and earned home-field advantage throughout the AFC playoffs.",
    "topic": "Analyze the interplay between Manning's injury, Osweiler's performance, and Kubiak's coaching decisions throughout the season.",
    "response": "<document_analysis>\nThe provided text details the Denver Broncos' 2015 season, focusing on the challenges faced with Peyton Manning's declining performance and injuries, the emergence of Brock Osweiler, and the strong performance of the Broncos' defense under Wade Phillips. The text highlights the interplay between these factors and their impact on the team's success. A challenging question would probe the strategic implications of Kubiak's quarterback decisions, considering the broader context of Manning's physical limitations and Osweiler's capabilities. The difficulty will be rated as 8/10. The question will require a nuanced understanding of coaching strategy, player performance, and injury management.\n</document_analysis>\n\n<output_format>\nQuestion: Gary Kubiak\u2019s quarterback rotations between Peyton Manning and Brock Osweiler during the 2015 season were most directly influenced by which critical factor?\nA: A deliberate strategy to maximize offensive unpredictability and confuse opposing defenses.\nB: The need to balance Manning\u2019s established leadership with Osweiler\u2019s superior mobility.\nC: Manning\u2019s declining physical capabilities, specifically exacerbated by a plantar fasciitis injury, and Osweiler\u2019s ability to temporarily stabilize the offense.\nD: A pre-determined plan to gradually transition the team\u2019s leadership to a younger quarterback.\nExplanation: The text explicitly states that Manning struggled due to a plantar fasciitis injury and was benched after throwing interceptions, with Osweiler taking over. Manning\u2019s return was contingent on a successful performance in Week 17, indicating the decisions were driven by performance and physical condition, not a broader strategic plan or leadership transition.\nCorrect Answer: C\n</output_format>",
    "question": "Gary Kubiak\u2019s quarterback rotations between Peyton Manning and Brock Osweiler during the 2015 season were most directly influenced by which critical factor?",
    "choices": {
      "A": "A deliberate strategy to maximize offensive unpredictability and confuse opposing defenses.",
      "B": "The need to balance Manning\u2019s established leadership with Osweiler\u2019s superior mobility.",
      "C": "Manning\u2019s declining physical capabilities, specifically exacerbated by a plantar fasciitis injury, and Osweiler\u2019s ability to temporarily stabilize the offense.",
      "D": "A pre-determined plan to gradually transition the team\u2019s leadership to a younger quarterback."
    },
    "answer": "C",
    "explanation": "The text explicitly states that Manning struggled due to a plantar fasciitis injury and was benched after throwing interceptions, with Osweiler taking over. Manning\u2019s return was contingent on a successful performance in Week 17, indicating the decisions were driven by performance and physical condition, not a broader strategic plan or leadership transition.",
    "question_token_count": 29,
    "answer_correctness_score": 10,
    "explanation_validity_score": 10,
    "question_clarity_score": 6,
    "question_difficulty_score": 7,
    "question_groundedness_score": 10,
    "avg_answer_token_count": 19
  },
  {
    "context": "On June 4, 2014, the NFL announced that the practice of branding Super Bowl games with Roman numerals, a practice established at Super Bowl V, would be temporarily suspended, and that the game would be named using Arabic numerals as Super Bowl 50 as opposed to Super Bowl L. The use of Roman numerals will be reinstated for Super Bowl LI. Jaime Weston, the league's vice president of brand and creative, explained that a primary reason for the change was the difficulty of designing an aesthetically pleasing logo with the letter \"L\" using the standardized logo template introduced at Super Bowl XLV. The logo also deviates from the template by featuring large numerals, colored in gold, behind the Vince Lombardi Trophy, instead of underneath and in silver as in the standard logo.",
    "topic": "The historical practice of using Roman numerals to designate Super Bowl games, beginning with Super Bowl V.",
    "response": "```xml\n<document_analysis>\nThoughtful Content Examination: The text details a temporary deviation from the NFL\u2019s long-standing tradition of using Roman numerals to number Super Bowl games. The change was initiated for Super Bowl 50, reverting to Arabic numerals, and was motivated primarily by logo design challenges associated with the Roman numeral \"L\". The standard logo template was also altered for this game.\n\nConcept Exploration: This touches on branding, visual communication, and the balance between tradition and practical design considerations within a large organization. The decision highlights the influence of aesthetics on even established practices. The explanation implicitly acknowledges the importance of brand consistency, even when deviating from a long-held convention.\n\nStrategic Complexity Calibration: Difficulty: 8/10. This requires understanding the nuances of branding decisions and the constraints of logo design, as well as the history of Super Bowl naming conventions. It\u2019s not a simple recall question; it requires inferring the primary driver behind a seemingly unusual decision.\n\nIntentional Question Planning: The question will focus on the core reason for the change, but framed in a way that requires understanding the interplay between the Roman numeral system, logo design, and brand identity. The incorrect answers will be plausible, representing other potential (but less significant) factors.\n</document_analysis>\n<output_format>\nQuestion: The NFL temporarily suspended the use of Roman numerals for Super Bowl naming with Super Bowl 50; what was the primary logistical driver behind this decision?\nA: Concerns that fans would be confused by the use of Arabic numerals instead of Roman numerals.\nB: A desire to simplify the branding process and reduce production costs for game-related merchandise.\nC: Difficulty incorporating the Roman numeral \"L\" into the standardized logo template in an aesthetically pleasing manner.\nD: A strategic initiative to align the Super Bowl branding with other major sporting events that use Arabic numerals.\nExplanation: The text explicitly states that the change was primarily due to the difficulty of designing a logo with the letter \"L\" using the standardized logo template. This was a purely aesthetic consideration.\nCorrect Answer: C\n</output_format>\n```",
    "question": "The NFL temporarily suspended the use of Roman numerals for Super Bowl naming with Super Bowl 50; what was the primary logistical driver behind this decision?",
    "choices": {
      "A": "Concerns that fans would be confused by the use of Arabic numerals instead of Roman numerals.",
      "B": "A desire to simplify the branding process and reduce production costs for game-related merchandise.",
      "C": "Difficulty incorporating the Roman numeral \"L\" into the standardized logo template in an aesthetically pleasing manner.",
      "D": "A strategic initiative to align the Super Bowl branding with other major sporting events that use Arabic numerals."
    },
    "answer": "C",
    "explanation": "The text explicitly states that the change was primarily due to the difficulty of designing a logo with the letter \"L\" using the standardized logo template. This was a purely aesthetic consideration.",
    "question_token_count": 31,
    "answer_correctness_score": 10,
    "explanation_validity_score": 10,
    "question_clarity_score": 8,
    "question_difficulty_score": 7,
    "question_groundedness_score": 10,
    "avg_answer_token_count": 19
  },
  {
    "context": "At the 57th Annual Grammy Awards in February 2015, Beyonc\u00e9 was nominated for six awards, ultimately winning three: Best R&B Performance and Best R&B Song for \"Drunk in Love\", and Best Surround Sound Album for Beyonc\u00e9. She was nominated for Album of the Year but the award was won by Beck for his Morning Phase album. In August, the cover of the September issue of Vogue magazine was unveiled online, Beyonc\u00e9 as the cover star, becoming the first African-American artist and third African-American woman in general to cover the September issue. She headlined the 2015 Made in America festival in early September and also the Global Citizen Festival later that month. Beyonc\u00e9 made an uncredited featured appearance on the track \"Hymn for the Weekend\" by British rock band Coldplay, on their seventh studio album A Head Full of Dreams (2015), which saw release in December. On January 7, 2016, Pepsi announced Beyonc\u00e9 would perform alongside Coldplay at Super Bowl 50 in February. Knowles has previously performed at four Super Bowl shows throughout her career, serving as the main headliner of the 47th Super Bowl halftime show in 2013.",
    "topic": "Identify the music festivals that Beyonc\u00e9 headlined in September 2015.",
    "response": "```xml\n<document_analysis>\n1. **Thoughtful Content Examination:** The text details Beyonc\u00e9's activities in 2015 and early 2016, including Grammy nominations, a Vogue cover, festival headlining, a collaboration with Coldplay, and Super Bowl performance announcements. The core information relevant to the question topic centers on the music festivals she headlined in September 2015.\n\n2. **Concept Exploration:** The text explicitly mentions two festivals headlined by Beyonc\u00e9 in September 2015: Made in America and Global Citizen Festival. This information is presented as a factual statement within a broader narrative of her achievements. The question's challenge lies in recalling these specific festival names from a context containing other details.\n\n3. **Strategic Complexity Calibration:** Difficulty: 6/10. The question isn't overly complex, as the answer is directly stated, but requires careful reading and retention of details amidst other information. The distractor options will need to be plausible music festivals.\n\n4. **Intentional Question Planning:** The question aims to test the domain expert\u2019s ability to extract specific information from a narrative text. The distractor options will include well-known festivals, increasing the cognitive load and requiring precise recall.\n</document_analysis>\n<output_format>\nQuestion: In September 2015, Beyonc\u00e9 headlined two major music festivals. Which of the following accurately lists both festivals?\nA: Coachella and Lollapalooza\nB: Glastonbury and Reading\nC: Made in America and Global Citizen Festival\nD: Rock in Rio and Summerfest\nExplanation: The text explicitly states that Beyonc\u00e9 headlined the 2015 Made in America festival in early September and the Global Citizen Festival later that month. This is a direct recall question, testing attention to detail.\nCorrect Answer: C\n</output_format>\n```",
    "question": "In September 2015, Beyonc\u00e9 headlined two major music festivals. Which of the following accurately lists both festivals?",
    "choices": {
      "A": "Coachella and Lollapalooza",
      "B": "Glastonbury and Reading",
      "C": "Made in America and Global Citizen Festival",
      "D": "Rock in Rio and Summerfest"
    },
    "answer": "C",
    "explanation": "The text explicitly states that Beyonc\u00e9 headlined the 2015 Made in America festival in early September and the Global Citizen Festival later that month. This is a direct recall question, testing attention to detail.",
    "question_token_count": 25,
    "answer_correctness_score": 10,
    "explanation_validity_score": 10,
    "question_clarity_score": 8,
    "question_difficulty_score": 4,
    "question_groundedness_score": 10,
    "avg_answer_token_count": 8
  },
  {
    "context": "Victoria later described her childhood as \"rather melancholy\". Her mother was extremely protective, and Victoria was raised largely isolated from other children under the so-called \"Kensington System\", an elaborate set of rules and protocols devised by the Duchess and her ambitious and domineering comptroller, Sir John Conroy, who was rumoured to be the Duchess's lover. The system prevented the princess from meeting people whom her mother and Conroy deemed undesirable (including most of her father's family), and was designed to render her weak and dependent upon them. The Duchess avoided the court because she was scandalised by the presence of King William's bastard children, and perhaps prompted the emergence of Victorian morality by insisting that her daughter avoid any appearance of sexual impropriety. Victoria shared a bedroom with her mother every night, studied with private tutors to a regular timetable, and spent her play-hours with her dolls and her King Charles spaniel, Dash. Her lessons included French, German, Italian, and Latin, but she spoke only English at home.",
    "topic": "Explain the symbolic importance of Victoria sharing a bedroom with her mother every night within the context of the Kensington System.",
    "response": "<document_analysis>\n1. **Thoughtful Content Examination:** The text describes the \"Kensington System\" as a controlling environment orchestrated by Victoria's mother and Sir John Conroy to isolate and manipulate the young princess. A key element is the constant presence of her mother, even sharing a bedroom nightly. This suggests a deliberate attempt to maintain control and prevent independence.\n2. **Concept Exploration:** The bedroom sharing isn't merely a domestic detail; it symbolizes the complete lack of privacy and autonomy Victoria experienced. It highlights the psychological manipulation inherent in the Kensington System, designed to foster dependence. The isolation from her father's family and the emphasis on avoiding \"sexual impropriety\" further underscore the restrictive nature of her upbringing.\n3. **Strategic Complexity Calibration:** Difficulty: 9/10. This question requires understanding the symbolic weight of domestic arrangements within a larger political and psychological context. It's not a simple recall question, but one demanding inference and an understanding of power dynamics.\n4. **Intentional Question Planning:** The question aims to push a domain expert to articulate *why* this specific detail \u2013 the shared bedroom \u2013 is significant. It forces a move beyond describing the Kensington System to analyzing its emotional and psychological impact on Victoria. The distractors will focus on plausible but less central aspects of the system.\n</document_analysis>\n\n<output_format>\nQuestion: Within the context of the Kensington System, what is the most significant symbolic implication of Victoria sharing a bedroom with her mother every night?\nA: It fostered a close and loving mother-daughter relationship, providing Victoria with emotional security during a turbulent childhood.\nB: It represented a complete lack of privacy and autonomy, reinforcing Victoria\u2019s dependence on her mother and Sir John Conroy.\nC: It allowed the Duchess to closely monitor Victoria\u2019s education and ensure she adhered to the strict academic schedule.\nD: It served as a public display of Victorian morality, emphasizing the importance of familial piety and modesty.\nExplanation: The Kensington System was designed to render Victoria weak and dependent. Sharing a bedroom eliminated any sense of personal space or independence, demonstrating the Duchess and Conroy\u2019s complete control over Victoria\u2019s life. This constant surveillance and lack of privacy were central to the system\u2019s manipulative intent.\nCorrect Answer: B\n</output_format>",
    "question": "Within the context of the Kensington System, what is the most significant symbolic implication of Victoria sharing a bedroom with her mother every night?",
    "choices": {
      "A": "It fostered a close and loving mother-daughter relationship, providing Victoria with emotional security during a turbulent childhood.",
      "B": "It represented a complete lack of privacy and autonomy, reinforcing Victoria\u2019s dependence on her mother and Sir John Conroy.",
      "C": "It allowed the Duchess to closely monitor Victoria\u2019s education and ensure she adhered to the strict academic schedule.",
      "D": "It served as a public display of Victorian morality, emphasizing the importance of familial piety and modesty."
    },
    "answer": "B",
    "explanation": "The Kensington System was designed to render Victoria weak and dependent. Sharing a bedroom eliminated any sense of personal space or independence, demonstrating the Duchess and Conroy\u2019s complete control over Victoria\u2019s life. This constant surveillance and lack of privacy were central to the system\u2019s manipulative intent.",
    "question_token_count": 28,
    "answer_correctness_score": 10,
    "explanation_validity_score": 10,
    "question_clarity_score": 8,
    "question_difficulty_score": 7,
    "question_groundedness_score": 9,
    "avg_answer_token_count": 23
  },
  {
    "context": "The Hellenistic period covers the period of ancient Greek (Hellenic) history and Mediterranean history between the death of Alexander the Great in 323 BC and the emergence of the Roman Empire as signified by the Battle of Actium in 31 BC and the subsequent conquest of Ptolemaic Egypt the following year. At this time, Greek cultural influence and power was at its peak in Europe, Africa and Asia, experiencing prosperity and progress in the arts, exploration, literature, theatre, architecture, music, mathematics, philosophy, and science. For example, competitive public games took place, ideas in biology, and popular entertainment in theaters. It is often considered a period of transition, sometimes even of decadence or degeneration, compared to the enlightenment of the Greek Classical era. The Hellenistic period saw the rise of New Comedy, Alexandrian poetry, the Septuagint and the philosophies of Stoicism and Epicureanism. Greek Science was advanced by the works of the mathematician Euclid and the polymath Archimedes. The religious sphere expanded to include new gods such as the Greco-Egyptian Serapis, eastern deities such as Attis and Cybele and the Greek adoption of Buddhism.",
    "topic": "Define the chronological boundaries of the Hellenistic period and the historical events marking its beginning and end.",
    "response": "<document_analysis>\n1. **Thoughtful Content Examination:** The text defines the Hellenistic period as spanning from the death of Alexander the Great (323 BC) to the Roman conquest of Egypt following the Battle of Actium (31 BC). It highlights the cultural flourishing during this era and notes its position as a transitional phase between the Classical and Roman periods.\n2. **Concept Exploration:** The text implicitly contrasts the Hellenistic period with the preceding Classical Greek era, suggesting a shift in cultural and philosophical emphasis. The mention of new religious syncretism (Serapis, Attis, Cybele, Buddhism) reveals a broadening of cultural exchange and religious practices.\n3. **Strategic Complexity Calibration:** Difficulty: 8/10. The question probes the precise chronological boundaries, requiring recall of specific dates and understanding of the historical events that demarcate the period. It requires the expert to connect the cultural and political events to define the era.\n4. **Intentional Question Planning:** The question targets the core definition of the Hellenistic period, testing the expert's knowledge of its historical context. The answer options are designed to be plausible, testing the expert's ability to recall the specific dates and events.\n</document_analysis>\n\n<output_format>\nQuestion: Which pair of events most accurately defines the chronological boundaries of the Hellenistic period?\nA: The Persian Wars (499\u2013449 BC) and the death of Alexander the Great (323 BC).\nB: The death of Alexander the Great (323 BC) and the Battle of Actium (31 BC).\nC: The Battle of Actium (31 BC) and the founding of Rome (753 BC).\nD: The Peloponnesian War (431\u2013404 BC) and the Roman conquest of Greece (146 BC).\nExplanation: The Hellenistic period is defined as beginning with the death of Alexander the Great in 323 BC, marking the fragmentation of his empire, and ending with the Battle of Actium in 31 BC, which led to the Roman conquest of Egypt and the definitive establishment of Roman dominance.\nCorrect Answer: B\n</output_format>",
    "question": "Which pair of events most accurately defines the chronological boundaries of the Hellenistic period?",
    "choices": {
      "A": "The Persian Wars (499\u2013449 BC) and the death of Alexander the Great (323 BC).",
      "B": "The death of Alexander the Great (323 BC) and the Battle of Actium (31 BC).",
      "C": "The Battle of Actium (31 BC) and the founding of Rome (753 BC).",
      "D": "The Peloponnesian War (431\u2013404 BC) and the Roman conquest of Greece (146 BC)."
    },
    "answer": "B",
    "explanation": "The Hellenistic period is defined as beginning with the death of Alexander the Great in 323 BC, marking the fragmentation of his empire, and ending with the Battle of Actium in 31 BC, which led to the Roman conquest of Egypt and the definitive establishment of Roman dominance.",
    "question_token_count": 17,
    "answer_correctness_score": 10,
    "explanation_validity_score": 10,
    "question_clarity_score": 8,
    "question_difficulty_score": 6,
    "question_groundedness_score": 10,
    "avg_answer_token_count": 21
  },
  {
    "context": "All of Chopin's compositions include the piano. Most are for solo piano, though he also wrote two piano concertos, a few chamber pieces, and some songs to Polish lyrics. His keyboard style is highly individual and often technically demanding; his own performances were noted for their nuance and sensitivity. Chopin invented the concept of instrumental ballade. His major piano works also include mazurkas, waltzes, nocturnes, polonaises, \u00e9tudes, impromptus, scherzos, preludes and sonatas, some published only after his death. Influences on his compositional style include Polish folk music, the classical tradition of J. S. Bach, Mozart and Schubert, the music of all of whom he admired, as well as the Paris salons where he was a frequent guest. His innovations in style, musical form, and harmony, and his association of music with nationalism, were influential throughout and after the late Romantic period.",
    "topic": "Identify and discuss the musical influences that shaped Chopin\u2019s compositional style, specifically mentioning the composers he admired.",
    "response": "```xml\n<document_analysis>\nThoughtful Content Examination: The text focuses on Chopin's compositional style, highlighting his preference for piano-based works and his unique keyboard style. It identifies Polish folk music, Bach, Mozart, and Schubert as key influences. It also mentions his innovations in musical form and harmony and his connection to nationalism.\n\nConcept Exploration: The text subtly implies Chopin's assimilation of diverse influences, blending them into a distinctive style. The reference to Parisian salons suggests a broader cultural context shaping his work. The statement about his influence \"throughout and after the late Romantic period\" points to the lasting impact of his innovations.\n\nStrategic Complexity Calibration: Difficulty: 8/10. The question requires recalling specific composers Chopin admired *and* understanding how these influences manifest in his work (though the text doesn't explicitly detail *how*). It avoids directly stating the answer, requiring the user to recall information.\n\nIntentional Question Planning: The question probes for specific knowledge of Chopin\u2019s influences, challenging the examinee to recall the composers named in the text and demonstrate their understanding of the context. The distractors are designed to be plausible, representing other composers of the period or musical styles.\n</document_analysis>\n<output_format>\nQuestion: Which composers, explicitly mentioned as figures Chopin admired, demonstrably influenced his compositional style?\nA: Beethoven, Liszt, and Wagner\nB: Bach, Mozart, and Schubert\nC: Schumann, Mendelssohn, and Brahms\nD: Debussy, Ravel, and Satie\nExplanation: The text directly states, \u201cInfluences on his compositional style include\u2026the classical tradition of J. S. Bach, Mozart and Schubert, the music of all of whom he admired.\u201d This makes option B the correct answer. The other options contain composers who were influential during or after Chopin's time but were not specifically identified as composers Chopin admired in the provided text.\nCorrect Answer: B\n</output_format>\n```",
    "question": "Which composers, explicitly mentioned as figures Chopin admired, demonstrably influenced his compositional style?",
    "choices": {
      "A": "Beethoven, Liszt, and Wagner",
      "B": "Bach, Mozart, and Schubert",
      "C": "Schumann, Mendelssohn, and Brahms",
      "D": "Debussy, Ravel, and Satie"
    },
    "answer": "B",
    "explanation": "The text directly states, \u201cInfluences on his compositional style include\u2026the classical tradition of J. S. Bach, Mozart and Schubert, the music of all of whom he admired.\u201d This makes option B the correct answer. The other options contain composers who were influential during or after Chopin's time but were not specifically identified as composers Chopin admired in the provided text.",
    "question_token_count": 22,
    "answer_correctness_score": 10,
    "explanation_validity_score": 10,
    "question_clarity_score": 4,
    "question_difficulty_score": 6,
    "question_groundedness_score": 8,
    "avg_answer_token_count": 9
  },
  {
    "context": "Following their loss in the divisional round of the previous season's playoffs, the Denver Broncos underwent numerous coaching changes, including a mutual parting with head coach John Fox (who had won four divisional championships in his four years as Broncos head coach), and the hiring of Gary Kubiak as the new head coach. Under Kubiak, the Broncos planned to install a run-oriented offense with zone blocking to blend in with quarterback Peyton Manning's shotgun passing skills, but struggled with numerous changes and injuries to the offensive line, as well as Manning having his worst statistical season since his rookie year with the Indianapolis Colts in 1998, due to a plantar fasciitis injury in his heel that he had suffered since the summer, and the simple fact that Manning was getting old, as he turned 39 in the 2015 off-season. Although the team had a 7\u20130 start, Manning led the NFL in interceptions. In week 10, Manning suffered a partial tear of the plantar fasciitis in his left foot. He set the NFL's all-time record for career passing yards in this game, but was benched after throwing four interceptions in favor of backup quarterback Brock Osweiler, who took over as the starter for most of the remainder of the regular season. Osweiler was injured, however, leading to Manning's return during the Week 17 regular season finale, where the Broncos were losing 13\u20137 against the 4\u201311 San Diego Chargers, resulting in Manning re-claiming the starting quarterback position for the playoffs by leading the team to a key 27\u201320 win that enabled the team to clinch the number one overall AFC seed. Under defensive coordinator Wade Phillips, the Broncos' defense ranked number one in total yards allowed, passing yards allowed and sacks, and like the previous three seasons, the team has continued to set numerous individual, league and franchise records. With the defense carrying the team despite the issues with the offense, the Broncos finished the regular season with a 12\u20134 record and earned home-field advantage throughout the AFC playoffs.",
    "topic": "Discuss the intended offensive strategy under Gary Kubiak and the reasons why its implementation proved challenging.",
    "response": "<document_analysis>\n1. **Thoughtful Content Examination:** The text details the Denver Broncos' transition after a playoff loss, focusing on the coaching change to Gary Kubiak and the attempt to implement a new offensive strategy blending run-orientation with Peyton Manning's passing. It highlights the challenges encountered, including offensive line issues, Manning's declining physical condition and injuries, and the subsequent quarterback changes. The defense, under Wade Phillips, emerged as a dominant force.\n\n2. **Concept Exploration:** The core concept revolves around the difficulty of implementing a strategic shift in football, even with a proven quarterback. The text implicitly explores the interplay between offensive scheme, player age/injury, and defensive strength. The successful defensive performance serves as a counterpoint to the offensive struggles, demonstrating that a strong defense can compensate for a faltering offense.\n\n3. **Strategic Complexity Calibration:** Difficulty: 9/10. The question requires understanding the nuances of football strategy, player dynamics, and the impact of injuries on performance. It also demands an appreciation for the broader context of team success beyond simply offensive prowess.\n\n4. **Intentional Question Planning:** The question aims to probe the expert's understanding of the intended offensive strategy, the reasons for its difficulties, and the factors that ultimately led to the team\u2019s success despite those challenges. It\u2019s designed to move beyond simple recall and assess a deeper comprehension of the situation.\n</document_analysis>\n\n<output_format>\nQuestion: Gary Kubiak\u2019s offensive strategy aimed to integrate a run-oriented scheme with Peyton Manning\u2019s established strengths; however, its implementation faced significant hurdles. Which of the following best encapsulates the *primary* reason this integration proved challenging?\nA: The defensive coordinator, Wade Phillips, prioritized a pass-rush heavy scheme that conflicted with the offensive line's zone blocking requirements.\nB: Manning\u2019s age-related decline and a persistent plantar fasciitis injury significantly hampered his ability to consistently execute the intended offensive system.\nC: Brock Osweiler\u2019s performance as a backup quarterback consistently undermined the team\u2019s efforts to establish a consistent offensive identity.\nD: The coaching staff\u2019s inability to adapt the offensive scheme to the strengths of the available running backs ultimately led to an unbalanced attack.\nExplanation: The text explicitly states Manning's age and the plantar fasciitis injury as key factors contributing to his worst statistical season, directly impacting the offense's ability to function as intended. While other factors were present, these were the primary impediments.\nCorrect Answer: B\n</output_format>",
    "question": "Gary Kubiak\u2019s offensive strategy aimed to integrate a run-oriented scheme with Peyton Manning\u2019s established strengths; however, its implementation faced significant hurdles. Which of the following best encapsulates the *primary* reason this integration proved challenging?",
    "choices": {
      "A": "The defensive coordinator, Wade Phillips, prioritized a pass-rush heavy scheme that conflicted with the offensive line's zone blocking requirements.",
      "B": "Manning\u2019s age-related decline and a persistent plantar fasciitis injury significantly hampered his ability to consistently execute the intended offensive system.",
      "C": "Brock Osweiler\u2019s performance as a backup quarterback consistently undermined the team\u2019s efforts to establish a consistent offensive identity.",
      "D": "The coaching staff\u2019s inability to adapt the offensive scheme to the strengths of the available running backs ultimately led to an unbalanced attack."
    },
    "answer": "B",
    "explanation": "The text explicitly states Manning's age and the plantar fasciitis injury as key factors contributing to his worst statistical season, directly impacting the offense's ability to function as intended. While other factors were present, these were the primary impediments.",
    "question_token_count": 46,
    "answer_correctness_score": 10,
    "explanation_validity_score": 10,
    "question_clarity_score": 7,
    "question_difficulty_score": 6,
    "question_groundedness_score": 9,
    "avg_answer_token_count": 26
  },
  {
    "context": "At the age of 21 he settled in Paris. Thereafter, during the last 18 years of his life, he gave only some 30 public performances, preferring the more intimate atmosphere of the salon. He supported himself by selling his compositions and teaching piano, for which he was in high demand. Chopin formed a friendship with Franz Liszt and was admired by many of his musical contemporaries, including Robert Schumann. In 1835 he obtained French citizenship. After a failed engagement to Maria Wodzi\u0144ska, from 1837 to 1847 he maintained an often troubled relationship with the French writer George Sand. A brief and unhappy visit to Majorca with Sand in 1838\u201339 was one of his most productive periods of composition. In his last years, he was financially supported by his admirer Jane Stirling, who also arranged for him to visit Scotland in 1848. Through most of his life, Chopin suffered from poor health. He died in Paris in 1849, probably of tuberculosis.",
    "topic": "The paradox of Chopin's productive compositional period during a brief, unhappy visit to Majorca with George Sand merits examination.",
    "response": "<document_analysis>\n1. **Thoughtful Content Examination:** The text details Chopin's life, focusing on his career, relationships, and health. A key point is the paradox of his productive compositional period during a difficult time with George Sand in Majorca. The text also highlights his limited public performances and reliance on composition sales and teaching.\n2. **Concept Exploration:** The paradox of creativity flourishing during personal hardship is a central theme. The text implicitly suggests a complex interplay between emotional state and artistic output. The details regarding his financial support and citizenship provide context to his life as a professional musician.\n3. **Strategic Complexity Calibration:** Difficulty: 8/10. The question targets the understanding of the paradox and requires inference about the psychological factors potentially contributing to it.\n4. **Intentional Question Planning:** The question is designed to probe the expert's understanding of the relationship between adversity and creativity, specifically within the context of Chopin's life and work. It requires going beyond simply recalling the fact of his productivity in Majorca and considering *why* this might have been the case.\n</document_analysis>\n\n<output_format>\nQuestion: Considering Chopin\u2019s documented productivity during a period of personal distress in Majorca with George Sand, which psychological phenomenon most plausibly accounts for this apparent paradox?\nA: A heightened sense of social obligation spurred by Sand\u2019s literary prominence.\nB: A displacement of emotional turmoil into focused artistic expression.\nC: A deliberate attempt to financially secure his future through increased output.\nD: A physiological response to the Mediterranean climate enhancing cognitive function.\nExplanation: The text establishes that the Majorca visit was \u201cunhappy\u201d yet \u201cone of his most productive periods of composition.\u201d This suggests a channeling of negative emotions into creative work, aligning with the psychological concept of displacement. While financial considerations and external factors may have played a role, the direct link between the difficult circumstances and increased output points towards a psychological mechanism.\nCorrect Answer: B\n</output_format>",
    "question": "Considering Chopin\u2019s documented productivity during a period of personal distress in Majorca with George Sand, which psychological phenomenon most plausibly accounts for this apparent paradox?",
    "choices": {
      "A": "A heightened sense of social obligation spurred by Sand\u2019s literary prominence.",
      "B": "A displacement of emotional turmoil into focused artistic expression.",
      "C": "A deliberate attempt to financially secure his future through increased output.",
      "D": "A physiological response to the Mediterranean climate enhancing cognitive function."
    },
    "answer": "B",
    "explanation": "The text establishes that the Majorca visit was \u201cunhappy\u201d yet \u201cone of his most productive periods of composition.\u201d This suggests a channeling of negative emotions into creative work, aligning with the psychological concept of displacement. While financial considerations and external factors may have played a role, the direct link between the difficult circumstances and increased output points towards a psychological mechanism.",
    "question_token_count": 32,
    "answer_correctness_score": 10,
    "explanation_validity_score": 10,
    "question_clarity_score": 4,
    "question_difficulty_score": 8,
    "question_groundedness_score": 4,
    "avg_answer_token_count": 12
  },
  {
    "context": "Victoria wrote to her uncle Leopold, whom Victoria considered her \"best and kindest adviser\", to thank him \"for the prospect of great happiness you have contributed to give me, in the person of dear Albert ... He possesses every quality that could be desired to render me perfectly happy. He is so sensible, so kind, and so good, and so amiable too. He has besides the most pleasing and delightful exterior and appearance you can possibly see.\" However at 17, Victoria, though interested in Albert, was not yet ready to marry. The parties did not undertake a formal engagement, but assumed that the match would take place in due time.",
    "topic": "Discuss the implications of Victoria\u2019s age (17) and her reluctance to enter a formal engagement despite her positive feelings toward Albert.",
    "response": "```xml\n<document_analysis>\n1. **Thoughtful Content Examination:** The context describes Victoria's positive feelings towards Albert and her acknowledgement of his desirable qualities. However, it also highlights her reluctance to enter a formal engagement at the age of 17. The communication with her uncle Leopold is key, indicating a reliance on his advice.\n2. **Concept Exploration:** The core issue revolves around the societal expectations of royal marriage versus Victoria's personal readiness. Her age is a significant factor, as is the informal nature of the arrangement \u2013 a \"match\" assumed to happen \"in due time\" rather than a concrete engagement. This suggests a degree of agency on Victoria's part, or at least a deferral of commitment. The reliance on Leopold's counsel adds another layer of complexity.\n3. **Strategic Complexity Calibration:** Difficulty: 9/10. This question requires understanding of 19th-century royal courtship, the potential implications of age and agency for a young queen, and the subtleties of the language used (\"due time,\" \"not yet ready\").\n4. **Intentional Question Planning:** The question will focus on the tension between Victoria's affection for Albert and her hesitancy regarding a formal engagement, framing it as a strategic decision influenced by her youth and position. It's designed to test a deep understanding of the historical context and Victoria\u2019s character.\n</document_analysis>\n\n<output_format>\nQuestion: Considering Victoria\u2019s expressed affection for Albert and her reliance on Leopold\u2019s counsel, what is the most likely strategic rationale behind her decision to forego a formal engagement at age 17?\nA: Victoria sought to maintain diplomatic leverage by keeping her marital options open, preventing premature alliances that could constrain her reign.\nB: Victoria, despite her feelings, prioritized her duty to the Crown, recognizing that a hasty marriage could destabilize the monarchy and necessitate Leopold\u2019s increased influence.\nC: Victoria wished to privately assess Albert\u2019s suitability for the role of consort without the public scrutiny and constraints of a formal betrothal.\nD: Victoria, experiencing typical adolescent indecision, simply required more time to fully evaluate her emotions before committing to a lifelong partnership.\nExplanation: Victoria's age and position as queen suggest a strategic consideration beyond mere personal feelings. While she clearly liked Albert, a formal engagement would have immediately placed him in a position of significant influence and subjected her to societal and political pressures. Delaying the engagement allowed her to subtly assess the situation and maintain control, aligning with the needs of the Crown.\nCorrect Answer: B\n</output_format>\n```",
    "question": "Considering Victoria\u2019s expressed affection for Albert and her reliance on Leopold\u2019s counsel, what is the most likely strategic rationale behind her decision to forego a formal engagement at age 17?",
    "choices": {
      "A": "Victoria sought to maintain diplomatic leverage by keeping her marital options open, preventing premature alliances that could constrain her reign.",
      "B": "Victoria, despite her feelings, prioritized her duty to the Crown, recognizing that a hasty marriage could destabilize the monarchy and necessitate Leopold\u2019s increased influence.",
      "C": "Victoria wished to privately assess Albert\u2019s suitability for the role of consort without the public scrutiny and constraints of a formal betrothal.",
      "D": "Victoria, experiencing typical adolescent indecision, simply required more time to fully evaluate her emotions before committing to a lifelong partnership."
    },
    "answer": "B",
    "explanation": "Victoria's age and position as queen suggest a strategic consideration beyond mere personal feelings. While she clearly liked Albert, a formal engagement would have immediately placed him in a position of significant influence and subjected her to societal and political pressures. Delaying the engagement allowed her to subtly assess the situation and maintain control, aligning with the needs of the Crown.",
    "question_token_count": 36,
    "answer_correctness_score": 8,
    "explanation_validity_score": 8,
    "question_clarity_score": 6,
    "question_difficulty_score": 7,
    "question_groundedness_score": 9,
    "avg_answer_token_count": 27
  },
  {
    "context": "Antibiotics are screened for any negative effects on humans or other mammals before approval for clinical use, and are usually considered safe and most are well tolerated. However, some antibiotics have been associated with a range of adverse side effects. Side-effects range from mild to very serious depending on the antibiotics used, the microbial organisms targeted, and the individual patient. Side effects may reflect the pharmacological or toxicological properties of the antibiotic or may involve hypersensitivity reactions or anaphylaxis. Safety profiles of newer drugs are often not as well established as for those that have a long history of use. Adverse effects range from fever and nausea to major allergic reactions, including photodermatitis and anaphylaxis. Common side-effects include diarrhea, resulting from disruption of the species composition in the intestinal flora, resulting, for example, in overgrowth of pathogenic bacteria, such as Clostridium difficile. Antibacterials can also affect the vaginal flora, and may lead to overgrowth of yeast species of the genus Candida in the vulvo-vaginal area. Additional side-effects can result from interaction with other drugs, such as elevated risk of tendon damage from administration of a quinolone antibiotic with a systemic corticosteroid. Some scientists have hypothesized that the indiscriminate use of antibiotics alter the host microbiota and this has been associated with chronic disease.",
    "topic": "Describe the range of allergic reactions that can be induced by antibiotics, including mild to severe manifestations like photodermatitis and anaphylaxis.",
    "response": "```xml\n<document_analysis>\n1. **Thoughtful Content Examination:** The text discusses the general safety and potential adverse effects of antibiotics, ranging from mild (diarrhea, yeast overgrowth) to severe (allergic reactions, anaphylaxis, tendon damage). It highlights the importance of considering individual patient factors and the history of antibiotic use.\n2. **Concept Exploration:** The text touches on the disruption of microbiota, drug interactions, and the potential link between antibiotic use and chronic disease. It implicitly suggests a trade-off between the benefits of antibiotic treatment and the risks of adverse effects.\n3. **Strategic Complexity Calibration:** Difficulty: 8/10. The question requires understanding of various adverse effects and the factors influencing their severity. The distractors will need to be plausible, drawing on related concepts from the text.\n4. **Intentional Question Planning:** The question will focus on the spectrum of allergic reactions induced by antibiotics, testing the understanding of specific manifestations (photodermatitis, anaphylaxis) within the broader context of adverse effects. It aims to assess whether the domain expert can synthesize information about the range of reactions and their potential severity.\n</document_analysis>\n<output_format>\nQuestion: Considering the range of adverse effects associated with antibiotic use, which of the following best characterizes the spectrum of allergic reactions a patient might experience?\nA: Limited to gastrointestinal disturbances like diarrhea and yeast overgrowth, primarily affecting the gut microbiome.\nB: Ranging from mild cutaneous reactions like photodermatitis to severe, life-threatening systemic responses such as anaphylaxis.\nC: Primarily involving drug interactions that elevate the risk of musculoskeletal damage, like tendon rupture.\nD: Manifesting as fever and nausea, indicative of a direct pharmacological effect of the antibiotic on the host.\nExplanation: The text explicitly states that adverse effects range from mild to very serious, including \u201cmajor allergic reactions, including photodermatitis and anaphylaxis.\u201d This indicates a spectrum encompassing both mild cutaneous reactions and severe systemic responses.\nCorrect Answer: B\n</output_format>\n```",
    "question": "Considering the range of adverse effects associated with antibiotic use, which of the following best characterizes the spectrum of allergic reactions a patient might experience?",
    "choices": {
      "A": "Limited to gastrointestinal disturbances like diarrhea and yeast overgrowth, primarily affecting the gut microbiome.",
      "B": "Ranging from mild cutaneous reactions like photodermatitis to severe, life-threatening systemic responses such as anaphylaxis.",
      "C": "Primarily involving drug interactions that elevate the risk of musculoskeletal damage, like tendon rupture.",
      "D": "Manifesting as fever and nausea, indicative of a direct pharmacological effect of the antibiotic on the host."
    },
    "answer": "B",
    "explanation": "The text explicitly states that adverse effects range from mild to very serious, including \u201cmajor allergic reactions, including photodermatitis and anaphylaxis.\u201d This indicates a spectrum encompassing both mild cutaneous reactions and severe systemic responses.",
    "question_token_count": 28,
    "answer_correctness_score": 10,
    "explanation_validity_score": 10,
    "question_clarity_score": 6,
    "question_difficulty_score": 6,
    "question_groundedness_score": 10,
    "avg_answer_token_count": 21
  },
  {
    "context": "On 14 January 1858, an Italian refugee from Britain called Orsini attempted to assassinate Napoleon III with a bomb made in England. The ensuing diplomatic crisis destabilised the government, and Palmerston resigned. Derby was reinstated as prime minister. Victoria and Albert attended the opening of a new basin at the French military port of Cherbourg on 5 August 1858, in an attempt by Napoleon III to reassure Britain that his military preparations were directed elsewhere. On her return Victoria wrote to Derby reprimanding him for the poor state of the Royal Navy in comparison to the French one. Derby's ministry did not last long, and in June 1859 Victoria recalled Palmerston to office.",
    "topic": "Evaluate Napoleon III's motivations for inviting Victoria and Albert to Cherbourg, considering the context of Anglo-French relations and his military preparations.",
    "response": "```xml\n<document_analysis>\nThoughtful Content Examination: The text details a specific diplomatic event\u2014Victoria and Albert\u2019s visit to Cherbourg\u2014following an assassination attempt on Napoleon III and a resulting diplomatic crisis. The core idea is Napoleon III's attempt to alleviate British concerns about his military build-up, specifically regarding the naval base at Cherbourg. It also touches upon the state of the Royal Navy and the shifting political landscape in Britain.\n\nConcept Exploration: The visit is presented as a calculated move by Napoleon III to manage Anglo-French relations. The underlying assumption is that Britain was suspicious of France\u2019s military intentions, and the visit was intended to demonstrate those intentions were not directed toward Britain. The text subtly highlights a power dynamic, with Victoria noting the superiority of the French navy. The mention of Palmerston\u2019s resignation and subsequent recall adds layers of political complexity.\n\nStrategic Complexity Calibration: Difficulty: 9/10. This question requires understanding of 19th-century European diplomacy, the context of Anglo-French rivalry, and the nuances of political maneuvering. The correct answer isn\u2019t explicitly stated but is implied through the sequence of events.\n\nIntentional Question Planning: The question aims to test the understanding of Napoleon III's strategic motivations. It moves beyond simply stating *that* he invited Victoria and Albert, and asks *why*, prompting consideration of the broader political and military context. It\u2019s designed to challenge a domain expert to synthesize information and draw inferences.\n</document_analysis>\n\n<output_format>\nQuestion: Considering the broader context of Anglo-French relations and Napoleon III\u2019s military preparations in 1858, what was the primary strategic intent behind his invitation to Queen Victoria and Prince Albert to visit Cherbourg?\nA: To publicly demonstrate the strength of the Franco-British alliance against potential Russian aggression.\nB: To assuage British concerns that his naval build-up at Cherbourg posed a direct threat to British maritime dominance.\nC: To secure British financial support for the expansion of the French colonial empire.\nD: To foster a personal relationship with Queen Victoria, thereby influencing British foreign policy decisions.\nExplanation: The text explicitly states that Napoleon III invited Victoria and Albert \u201cin an attempt to reassure Britain that his military preparations were directed elsewhere,\u201d directly indicating his intent to alleviate British concerns about his naval build-up at Cherbourg. This makes option B the most accurate answer.\nCorrect Answer: B\n</output_format>\n```",
    "question": "Considering the broader context of Anglo-French relations and Napoleon III\u2019s military preparations in 1858, what was the primary strategic intent behind his invitation to Queen Victoria and Prince Albert to visit Cherbourg?",
    "choices": {
      "A": "To publicly demonstrate the strength of the Franco-British alliance against potential Russian aggression.",
      "B": "To assuage British concerns that his naval build-up at Cherbourg posed a direct threat to British maritime dominance.",
      "C": "To secure British financial support for the expansion of the French colonial empire.",
      "D": "To foster a personal relationship with Queen Victoria, thereby influencing British foreign policy decisions."
    },
    "answer": "B",
    "explanation": "The text explicitly states that Napoleon III invited Victoria and Albert \u201cin an attempt to reassure Britain that his military preparations were directed elsewhere,\u201d directly indicating his intent to alleviate British concerns about his naval build-up at Cherbourg. This makes option B the most accurate answer.",
    "question_token_count": 41,
    "answer_correctness_score": 10,
    "explanation_validity_score": 10,
    "question_clarity_score": 7,
    "question_difficulty_score": 8,
    "question_groundedness_score": 9,
    "avg_answer_token_count": 18
  },
  {
    "context": "Fryderyk Chopin was born in \u017belazowa Wola, 46 kilometres (29 miles) west of Warsaw, in what was then the Duchy of Warsaw, a Polish state established by Napoleon. The parish baptismal record gives his birthday as 22 February 1810, and cites his given names in the Latin form Fridericus Franciscus (in Polish, he was Fryderyk Franciszek). However, the composer and his family used the birthdate 1 March,[n 2] which is now generally accepted as the correct date.",
    "topic": "The reasons for the differing dates associated with Chopin's birth and how the currently accepted date was determined.",
    "response": "```xml\n<document_analysis>\n1. **Thoughtful Content Examination:** The text discusses a discrepancy in Chopin's birthdate \u2013 a baptismal record of February 22nd versus a family-used date of March 1st, which is now accepted. The context highlights the location of his birth and the political context (Duchy of Warsaw).\n2. **Concept Exploration:** The core issue is the reliability of records (baptismal vs. family tradition) and how a historically accepted date is established. This touches on historical methodology and the potential for conflicting evidence. The \"n 2\" footnote suggests further complexity not fully elaborated in the provided text.\n3. **Strategic Complexity Calibration:** Difficulty: 8/10. This question requires understanding of historical record-keeping practices, the potential for family bias, and the reasons why a later-used date gained acceptance. It's not simply recalling a date but understanding *why* a date changed.\n4. **Intentional Question Planning:** The question will focus on the reason for the accepted date change, forcing a deeper consideration of the evidence and the factors influencing historical consensus. The distractors will represent plausible but incorrect reasons.\n</document_analysis>\n<output_format>\nQuestion: Considering the documented discrepancy between Chopin's baptismal record and the date his family consistently used, what is the primary reason 1 March is now the generally accepted date of his birth?\nA: The baptismal record was discovered to be a forgery created by a rival composer seeking to discredit Chopin's legacy.\nB: Chopin\u2019s family explicitly requested the alteration of the baptismal record to align with astrological predictions favorable to his musical career.\nC: The date of 1 March more accurately reflects the seasonal celebrations and customs prevalent in Poland at the time of Chopin\u2019s birth.\nD: While the baptismal record exists, Chopin\u2019s family consistently used 1 March, and this practice gained acceptance through biographical and scholarly consensus.\nExplanation: The text states that Chopin and his family used 1 March, and this date is \"now generally accepted.\" This indicates the acceptance wasn't due to record alteration or cultural practices, but rather the consistent family usage gaining traction through scholarly consensus.\nCorrect Answer: D\n</output_format>\n```",
    "question": "Considering the documented discrepancy between Chopin's baptismal record and the date his family consistently used, what is the primary reason 1 March is now the generally accepted date of his birth?",
    "choices": {
      "A": "The baptismal record was discovered to be a forgery created by a rival composer seeking to discredit Chopin's legacy.",
      "B": "Chopin\u2019s family explicitly requested the alteration of the baptismal record to align with astrological predictions favorable to his musical career.",
      "C": "The date of 1 March more accurately reflects the seasonal celebrations and customs prevalent in Poland at the time of Chopin\u2019s birth.",
      "D": "While the baptismal record exists, Chopin\u2019s family consistently used 1 March, and this practice gained acceptance through biographical and scholarly consensus."
    },
    "answer": "D",
    "explanation": "The text states that Chopin and his family used 1 March, and this date is \"now generally accepted.\" This indicates the acceptance wasn't due to record alteration or cultural practices, but rather the consistent family usage gaining traction through scholarly consensus.",
    "question_token_count": 37,
    "answer_correctness_score": 10,
    "explanation_validity_score": 10,
    "question_clarity_score": 6,
    "question_difficulty_score": 6,
    "question_groundedness_score": 9,
    "avg_answer_token_count": 27
  },
  {
    "context": "At the age of 21 he settled in Paris. Thereafter, during the last 18 years of his life, he gave only some 30 public performances, preferring the more intimate atmosphere of the salon. He supported himself by selling his compositions and teaching piano, for which he was in high demand. Chopin formed a friendship with Franz Liszt and was admired by many of his musical contemporaries, including Robert Schumann. In 1835 he obtained French citizenship. After a failed engagement to Maria Wodzi\u0144ska, from 1837 to 1847 he maintained an often troubled relationship with the French writer George Sand. A brief and unhappy visit to Majorca with Sand in 1838\u201339 was one of his most productive periods of composition. In his last years, he was financially supported by his admirer Jane Stirling, who also arranged for him to visit Scotland in 1848. Through most of his life, Chopin suffered from poor health. He died in Paris in 1849, probably of tuberculosis.",
    "topic": "The failed engagement to Maria Wodzi\u0144ska and subsequent relationship with George Sand represent significant turning points in Chopin's personal life.",
    "response": "<document_analysis>\n1. **Thoughtful Content Examination:** The text describes Chopin's life in Paris, his career, relationships, and eventual death. The focus is on his professional life and key personal relationships, specifically his engagement to Maria Wodzi\u0144ska and his relationship with George Sand.\n2. **Concept Exploration:** The text subtly suggests that Chopin's personal life (failed engagement and tumultuous relationship) coincided with periods of high productivity and financial support. The mention of Jane Stirling and her financial aid points to the precarious nature of his financial situation despite his musical talent.\n3. **Strategic Complexity Calibration:** Difficulty: 8/10. The question will focus on the interplay between Chopin's personal relationships and his artistic output, requiring an understanding of how these factors potentially influenced each other. It requires inferential reasoning beyond simply recalling facts.\n4. **Intentional Question Planning:** The question will center around the paradoxical nature of Chopin's relationship with George Sand \u2013 \"often troubled\" yet coinciding with a \"productive period of composition.\" This probes deeper into the potential complexities of his creative process and personal life.\n</document_analysis>\n\n<output_format>\nQuestion: Considering Chopin's relationship with George Sand, described as \"often troubled\" yet coinciding with a \"productive period of composition,\" what inference can be most reasonably drawn regarding the interplay between his personal life and artistic output?\nA: Artistic inspiration flourished independently of personal distress, demonstrating Chopin\u2019s resilience.\nB: The inherent tension within the relationship served as a catalyst for his creative endeavors.\nC: Periods of emotional turmoil consistently hindered Chopin\u2019s compositional abilities.\nD: The productivity during this time was coincidental and unrelated to the nature of the relationship.\nExplanation: The text explicitly states that the relationship was \"often troubled\" but simultaneously a \"productive period of composition.\" While not directly stating a causal link, this juxtaposition suggests a complex interplay where the relationship, despite its difficulties, did not necessarily impede his work and might have even fueled it. Option B is the most reasonable inference, recognizing the potential for tension to be creatively stimulating.\nCorrect Answer: B\n</output_format>",
    "question": "Considering Chopin's relationship with George Sand, described as \"often troubled\" yet coinciding with a \"productive period of composition,\" what inference can be most reasonably drawn regarding the interplay between his personal life and artistic output?",
    "choices": {
      "A": "Artistic inspiration flourished independently of personal distress, demonstrating Chopin\u2019s resilience.",
      "B": "The inherent tension within the relationship served as a catalyst for his creative endeavors.",
      "C": "Periods of emotional turmoil consistently hindered Chopin\u2019s compositional abilities.",
      "D": "The productivity during this time was coincidental and unrelated to the nature of the relationship."
    },
    "answer": "B",
    "explanation": "The text explicitly states that the relationship was \"often troubled\" but simultaneously a \"productive period of composition.\" While not directly stating a causal link, this juxtaposition suggests a complex interplay where the relationship, despite its difficulties, did not necessarily impede his work and might have even fueled it. Option B is the most reasonable inference, recognizing the potential for tension to be creatively stimulating.",
    "question_token_count": 44,
    "answer_correctness_score": 9,
    "explanation_validity_score": 9,
    "question_clarity_score": 7,
    "question_difficulty_score": 6,
    "question_groundedness_score": 9,
    "avg_answer_token_count": 16
  },
  {
    "context": "The Hellenistic period covers the period of ancient Greek (Hellenic) history and Mediterranean history between the death of Alexander the Great in 323 BC and the emergence of the Roman Empire as signified by the Battle of Actium in 31 BC and the subsequent conquest of Ptolemaic Egypt the following year. At this time, Greek cultural influence and power was at its peak in Europe, Africa and Asia, experiencing prosperity and progress in the arts, exploration, literature, theatre, architecture, music, mathematics, philosophy, and science. For example, competitive public games took place, ideas in biology, and popular entertainment in theaters. It is often considered a period of transition, sometimes even of decadence or degeneration, compared to the enlightenment of the Greek Classical era. The Hellenistic period saw the rise of New Comedy, Alexandrian poetry, the Septuagint and the philosophies of Stoicism and Epicureanism. Greek Science was advanced by the works of the mathematician Euclid and the polymath Archimedes. The religious sphere expanded to include new gods such as the Greco-Egyptian Serapis, eastern deities such as Attis and Cybele and the Greek adoption of Buddhism.",
    "topic": "Describe the religious changes that occurred during the Hellenistic period, including the introduction of new deities and the adoption of foreign religious practices.",
    "response": "```xml\n<document_analysis>\n1. **Thoughtful Content Examination:** The text describes the Hellenistic period, highlighting its cultural and scientific advancements. A key aspect mentioned is the expansion of the religious sphere, including the introduction of new deities and the adoption of foreign religious practices. The context specifically names Serapis, Attis, Cybele, and Buddhism as examples.\n2. **Concept Exploration:** The introduction of new deities during the Hellenistic period reflects a syncretic religious environment\u2014a blending of Greek religious beliefs with those of the cultures encountered through Alexander's conquests. This demonstrates a shift from the more localized and distinct religious traditions of the Classical Greek period. The adoption of Buddhism is particularly noteworthy as it represents the spread of Eastern religious thought westward.\n3. **Strategic Complexity Calibration:** Difficulty: 8/10. The question targets a nuanced understanding of religious changes during a specific historical period. It requires knowledge of specific deities and the broader concept of religious syncretism.\n4. **Intentional Question Planning:** The question is designed to test whether the domain expert understands the nature of religious changes in the Hellenistic period, specifically the blending of Greek and foreign religious beliefs and the introduction of new deities. The answer options will include plausible but incorrect options related to Greek religion or other historical periods.\n</document_analysis>\n<output_format>\nQuestion: During the Hellenistic period, a notable characteristic of religious evolution was the incorporation of foreign religious elements. Which of the following best exemplifies this phenomenon?\nA: A renewed focus on the Olympian pantheon and the restoration of traditional Greek religious festivals.\nB: The exclusive adoption of Zoroastrianism as the state religion throughout the Seleucid Empire.\nC: The syncretic creation of deities like Serapis, blending Greek and Egyptian religious traditions.\nD: The systematic suppression of all non-Greek religious practices in favor of a unified Hellenic belief system.\nExplanation: The text explicitly states the emergence of new gods like Serapis, a Greco-Egyptian deity, demonstrating the blending of religious traditions characteristic of the Hellenistic period. This exemplifies the incorporation of foreign religious elements.\nCorrect Answer: C\n</output_format>\n```",
    "question": "During the Hellenistic period, a notable characteristic of religious evolution was the incorporation of foreign religious elements. Which of the following best exemplifies this phenomenon?",
    "choices": {
      "A": "A renewed focus on the Olympian pantheon and the restoration of traditional Greek religious festivals.",
      "B": "The exclusive adoption of Zoroastrianism as the state religion throughout the Seleucid Empire.",
      "C": "The syncretic creation of deities like Serapis, blending Greek and Egyptian religious traditions.",
      "D": "The systematic suppression of all non-Greek religious practices in favor of a unified Hellenic belief system."
    },
    "answer": "C",
    "explanation": "The text explicitly states the emergence of new gods like Serapis, a Greco-Egyptian deity, demonstrating the blending of religious traditions characteristic of the Hellenistic period. This exemplifies the incorporation of foreign religious elements.",
    "question_token_count": 31,
    "answer_correctness_score": 10,
    "explanation_validity_score": 10,
    "question_clarity_score": 7,
    "question_difficulty_score": 6,
    "question_groundedness_score": 10,
    "avg_answer_token_count": 20
  },
  {
    "context": "Despite waiving longtime running back DeAngelo Williams and losing top wide receiver Kelvin Benjamin to a torn ACL in the preseason, the Carolina Panthers had their best regular season in franchise history, becoming the seventh team to win at least 15 regular season games since the league expanded to a 16-game schedule in 1978. Carolina started the season 14\u20130, not only setting franchise records for the best start and the longest single-season winning streak, but also posting the best start to a season by an NFC team in NFL history, breaking the 13\u20130 record previously shared with the 2009 New Orleans Saints and the 2011 Green Bay Packers. With their NFC-best 15\u20131 regular season record, the Panthers clinched home-field advantage throughout the NFC playoffs for the first time in franchise history. Ten players were selected to the Pro Bowl (the most in franchise history) along with eight All-Pro selections.",
    "topic": "Achieving a 15\u20131 regular season record secured home-field advantage for the Panthers throughout the NFC playoffs for the first time in franchise history.",
    "response": "```xml\n<document_analysis>\n1. **Thoughtful Content Examination:** The text details the Carolina Panthers' exceptional 2015 season, highlighting their 15-1 record, overcoming key player losses, and achieving home-field advantage in the NFC playoffs for the first time. It also notes Pro Bowl and All-Pro selections.\n2. **Concept Exploration:** The text touches upon historical context within the NFL, referencing previous teams with similar starts and the significance of a 16-game schedule. It implicitly explores themes of resilience, team performance, and historical achievement.\n3. **Strategic Complexity Calibration:** Difficulty: 8/10. The question will require understanding of NFL playoff structure and historical context, not just the stated facts.\n4. **Intentional Question Planning:** The question will focus on the implications of achieving home-field advantage, requiring the test-taker to connect the 15-1 record to its strategic benefit. The distractors will focus on other achievements of the season, but not the direct benefit of the record.\n</document_analysis>\n<output_format>\nQuestion: Achieving a 15\u20131 regular season record provided the Carolina Panthers with a distinct strategic advantage in their playoff run, primarily through what mechanism?\nA: Increased media coverage and fan support, fostering a stronger team morale.\nB: The ability to draft higher-ranked players in the subsequent NFL draft.\nC: Securing home-field advantage throughout the NFC playoffs.\nD: A higher seeding in the Pro Bowl selection process for Panthers players.\nExplanation: The text explicitly states, \u201cWith their NFC-best 15\u20131 regular season record, the Panthers clinched home-field advantage throughout the NFC playoffs for the first time in franchise history.\u201d This directly links the record to the strategic benefit of playing all playoff games at home.\nCorrect Answer: C\n</output_format>\n```",
    "question": "Achieving a 15\u20131 regular season record provided the Carolina Panthers with a distinct strategic advantage in their playoff run, primarily through what mechanism?",
    "choices": {
      "A": "Increased media coverage and fan support, fostering a stronger team morale.",
      "B": "The ability to draft higher-ranked players in the subsequent NFL draft.",
      "C": "Securing home-field advantage throughout the NFC playoffs.",
      "D": "A higher seeding in the Pro Bowl selection process for Panthers players."
    },
    "answer": "C",
    "explanation": "The text explicitly states, \u201cWith their NFC-best 15\u20131 regular season record, the Panthers clinched home-field advantage throughout the NFC playoffs for the first time in franchise history.\u201d This directly links the record to the strategic benefit of playing all playoff games at home.",
    "question_token_count": 30,
    "answer_correctness_score": 10,
    "explanation_validity_score": 10,
    "question_clarity_score": 7,
    "question_difficulty_score": 4,
    "question_groundedness_score": 10,
    "avg_answer_token_count": 13
  },
  {
    "context": "The annual NFL Experience was held at the Moscone Center in San Francisco. In addition, \"Super Bowl City\" opened on January 30 at Justin Herman Plaza on The Embarcadero, featuring games and activities that will highlight the Bay Area's technology, culinary creations, and cultural diversity. More than 1 million people are expected to attend the festivities in San Francisco during Super Bowl Week. San Francisco mayor Ed Lee said of the highly visible homeless presence in this area \"they are going to have to leave\". San Francisco city supervisor Jane Kim unsuccessfully lobbied for the NFL to reimburse San Francisco for city services in the amount of $5 million.",
    "topic": "Explain how Super Bowl City aimed to showcase the Bay Area's unique attributes, including its technology sector, culinary scene, and cultural diversity.",
    "response": "```xml\n<document_analysis>\n1. **Thoughtful Content Examination:** The text describes the setup for Super Bowl 50 in San Francisco, highlighting the \"Super Bowl City\" event at Justin Herman Plaza. The stated purpose of this event is to showcase the Bay Area's technology, culinary scene, and cultural diversity. It also mentions related issues like homelessness and financial lobbying by city officials.\n\n2. **Concept Exploration:** The core concept is event-based city branding. The Super Bowl provides an opportunity for San Francisco to present a particular image to a global audience. The text touches on the complexities of this branding, with the mayor's statement about homelessness indicating a desire to present a sanitized image. The financial lobbying indicates a cost-benefit analysis of hosting such an event.\n\n3. **Strategic Complexity Calibration:** Difficulty: 8/10. The question requires understanding the *intent* behind \"Super Bowl City\" and recognizing it as a branding exercise. The correct answer isn't explicitly stated but is implied. The distractors require considering the practical aspects of hosting such an event.\n\n4. **Intentional Question Planning:** The question aims to test the domain expert's ability to infer the underlying strategic goals of the event, moving beyond a simple recall of facts. It requires understanding how cities leverage large events for image building and economic benefit.\n</document_analysis>\n\n<output_format>\nQuestion: What was the primary strategic objective behind the creation of \u201cSuper Bowl City\u201d at Justin Herman Plaza during Super Bowl 50?\nA: To provide a centralized location for NFL Experience activities, minimizing logistical challenges for attendees.\nB: To generate substantial revenue for the city of San Francisco through ticket sales and merchandise.\nC: To present a curated image of the Bay Area, emphasizing its technological innovation, gastronomy, and multicultural character.\nD: To address and mitigate the visibility of social issues, such as homelessness, within the Super Bowl event footprint.\nExplanation: The text states that \u201cSuper Bowl City\u201d was specifically designed to \u201chighlight the Bay Area\u2019s technology, culinary creations, and cultural diversity.\u201d This indicates a deliberate effort to showcase these attributes to a large audience, constituting a strategic branding initiative.\nCorrect Answer: C\n</output_format>\n```",
    "question": "What was the primary strategic objective behind the creation of \u201cSuper Bowl City\u201d at Justin Herman Plaza during Super Bowl 50?",
    "choices": {
      "A": "To provide a centralized location for NFL Experience activities, minimizing logistical challenges for attendees.",
      "B": "To generate substantial revenue for the city of San Francisco through ticket sales and merchandise.",
      "C": "To present a curated image of the Bay Area, emphasizing its technological innovation, gastronomy, and multicultural character.",
      "D": "To address and mitigate the visibility of social issues, such as homelessness, within the Super Bowl event footprint."
    },
    "answer": "C",
    "explanation": "The text states that \u201cSuper Bowl City\u201d was specifically designed to \u201chighlight the Bay Area\u2019s technology, culinary creations, and cultural diversity.\u201d This indicates a deliberate effort to showcase these attributes to a large audience, constituting a strategic branding initiative.",
    "question_token_count": 26,
    "answer_correctness_score": 10,
    "explanation_validity_score": 10,
    "question_clarity_score": 6,
    "question_difficulty_score": 5,
    "question_groundedness_score": 9,
    "avg_answer_token_count": 20
  },
  {
    "context": "After a lengthy period of formal racial segregation in the former Confederacy following the Reconstruction Era, and bans on interracial marriage in various parts of the country, more people are openly forming interracial unions. In addition, social conditions have changed and many multiracial people do not believe it is socially advantageous to try to \"pass\" as white. Diverse immigration has brought more mixed-race people into the United States, such as the large population of Hispanics identifying as mestizos. Since the 1980s, the United States has had a growing multiracial identity movement (cf. Loving Day). Because more Americans have insisted on being allowed to acknowledge their mixed racial origins, the 2000 census for the first time allowed residents to check more than one ethno-racial identity and thereby identify as multiracial. In 2008 Barack Obama was elected as the first multiracial President of the United States; he acknowledges both sides of his family and identifies as African American.",
    "topic": "The symbolic importance of Barack Obama's election as the first multiracial President of the United States.",
    "response": "```xml\n<document_analysis>\n1. **Thoughtful Content Examination:** The text discusses the evolving social acceptance of interracial relationships and multiracial identity in the US, culminating in Obama's election. The key themes are the decline of formal segregation, changing attitudes towards racial identity, increased immigration, and the formal recognition of multiracial identities through the 2000 census.\n2. **Concept Exploration:** The context implies a shift from a binary racial understanding to a more fluid and inclusive one. Obama's election isn't just a political event but a symbolic representation of this shift. The text subtly suggests the historical pressure on multiracial individuals to assimilate into a single racial category is diminishing.\n3. **Strategic Complexity Calibration:** Difficulty: 9/10. The question probes the broader implications of Obama\u2019s election beyond its obvious political significance, requiring an understanding of the historical and social context.\n4. **Intentional Question Planning:** The question is designed to test understanding of how Obama's election reflects a deeper societal change regarding racial identity and the acceptance of multiracial individuals. It requires synthesis of the information provided about historical context, census changes, and shifting social norms.\n</document_analysis>\n<output_format>\nQuestion: Barack Obama\u2019s election as the first multiracial President of the United States is most significantly understood as a symbolic culmination of which underlying societal trend?\nA: A resurgence of national pride following a period of economic downturn.\nB: The diminishing social pressure for multiracial individuals to conform to singular racial classifications.\nC: A deliberate political strategy to appeal to a broader demographic base.\nD: Increased immigration rates leading to a more diverse electorate.\nExplanation: The text explicitly states that more multiracial people \u201cdo not believe it is socially advantageous to try to \u2018pass\u2019 as white\u201d and that the 2000 census allowed individuals to identify with multiple racial identities, indicating a shift away from rigid racial classifications. Obama\u2019s acknowledgement of both sides of his family reflects this change.\nCorrect Answer: B\n</output_format>\n```",
    "question": "Barack Obama\u2019s election as the first multiracial President of the United States is most significantly understood as a symbolic culmination of which underlying societal trend?",
    "choices": {
      "A": "A resurgence of national pride following a period of economic downturn.",
      "B": "The diminishing social pressure for multiracial individuals to conform to singular racial classifications.",
      "C": "A deliberate political strategy to appeal to a broader demographic base.",
      "D": "Increased immigration rates leading to a more diverse electorate."
    },
    "answer": "B",
    "explanation": "The text explicitly states that more multiracial people \u201cdo not believe it is socially advantageous to try to \u2018pass\u2019 as white\u201d and that the 2000 census allowed individuals to identify with multiple racial identities, indicating a shift away from rigid racial classifications. Obama\u2019s acknowledgement of both sides of his family reflects this change.",
    "question_token_count": 32,
    "answer_correctness_score": 9,
    "explanation_validity_score": 9,
    "question_clarity_score": 7,
    "question_difficulty_score": 6,
    "question_groundedness_score": 9,
    "avg_answer_token_count": 14
  },
  {
    "context": "The league eventually narrowed the bids to three sites: New Orleans' Mercedes-Benz Superdome, Miami's Sun Life Stadium, and the San Francisco Bay Area's Levi's Stadium.",
    "topic": "Identify the three finalist locations considered for the bid mentioned in the text.",
    "response": "```xml\n<document_analysis>\nThoughtful Content Examination: The context provides a concise statement identifying the three finalist locations for a bid. The information is straightforward and factual.\nConcept Exploration: This is a simple recall question, but can be made more challenging by including plausible distractors. The key is to test whether the domain expert remembers the specific venues.\nStrategic Complexity Calibration: Difficulty: 4/10. While the information is directly stated, a domain expert might be expected to know common venues and could be misled by similar-sounding names.\nIntentional Question Planning: The question tests recall of specific details related to a major event bid process, which is relevant for professionals in sports management, event planning, or related fields.\n</document_analysis>\n<output_format>\nQuestion: Which of the following venues comprised the final three locations considered for a major league bid?\nA: Atlanta's Mercedes-Benz Stadium, Miami's Hard Rock Stadium, and Los Angeles' SoFi Stadium.\nB: New Orleans' Mercedes-Benz Superdome, Miami's Sun Life Stadium, and the San Francisco Bay Area's Levi's Stadium.\nC: New York's MetLife Stadium, Dallas' AT&T Stadium, and Chicago's Soldier Field.\nD: Phoenix's State Farm Stadium, Tampa's Raymond James Stadium, and Houston's NRG Stadium.\nExplanation: The text explicitly states that the final three locations were New Orleans' Mercedes-Benz Superdome, Miami's Sun Life Stadium, and the San Francisco Bay Area's Levi's Stadium. The other options contain plausible stadium names but are not the ones mentioned in the provided context.\nCorrect Answer: B\n</output_format>\n```",
    "question": "Which of the following venues comprised the final three locations considered for a major league bid?",
    "choices": {
      "A": "Atlanta's Mercedes-Benz Stadium, Miami's Hard Rock Stadium, and Los Angeles' SoFi Stadium.",
      "B": "New Orleans' Mercedes-Benz Superdome, Miami's Sun Life Stadium, and the San Francisco Bay Area's Levi's Stadium.",
      "C": "New York's MetLife Stadium, Dallas' AT&T Stadium, and Chicago's Soldier Field.",
      "D": "Phoenix's State Farm Stadium, Tampa's Raymond James Stadium, and Houston's NRG Stadium."
    },
    "answer": "B",
    "explanation": "The text explicitly states that the final three locations were New Orleans' Mercedes-Benz Superdome, Miami's Sun Life Stadium, and the San Francisco Bay Area's Levi's Stadium. The other options contain plausible stadium names but are not the ones mentioned in the provided context.",
    "question_token_count": 18,
    "answer_correctness_score": 10,
    "explanation_validity_score": 10,
    "question_clarity_score": 1,
    "question_difficulty_score": 2,
    "question_groundedness_score": 10,
    "avg_answer_token_count": 22
  },
  {
    "context": "On 2 March 1882, Roderick Maclean, a disgruntled poet apparently offended by Victoria's refusal to accept one of his poems, shot at the Queen as her carriage left Windsor railway station. Two schoolboys from Eton College struck him with their umbrellas, until he was hustled away by a policeman. Victoria was outraged when he was found not guilty by reason of insanity, but was so pleased by the many expressions of loyalty after the attack that she said it was \"worth being shot at\u2014to see how much one is loved\".",
    "topic": "Discuss the potential impact of the incident on Queen Victoria's public image and her subsequent reign, considering the narrative of loyalty and affection she highlighted.",
    "response": "```xml\n<document_analysis>\n1. **Thoughtful Content Examination:** The text details an assassination attempt on Queen Victoria and her reaction to it. The core idea is the contrast between the violent act and the outpouring of public loyalty it elicited, which Victoria surprisingly framed positively. The narrative of loyalty and affection is central to understanding her response.\n2. **Concept Exploration:** The incident touches upon themes of public image, monarchical power, and the psychological impact of trauma. Victoria's statement reveals a complex understanding of her role as a symbol of national unity and her reliance on public affection for maintaining legitimacy. The legal outcome (insanity plea) adds another layer of complexity, highlighting the Victorian era's approach to mental health and crime.\n3. **Strategic Complexity Calibration:** Difficulty: 9/10. The question aims to assess the expert's understanding of Victorian social dynamics, the role of the monarchy, and the psychological aspects of public perception. It requires inferring the broader implications of the incident beyond the immediate facts.\n4. **Intentional Question Planning:** The question is designed to probe the expert's ability to analyze the incident's impact on Victoria's public image and reign, focusing on how her response \u2013 emphasizing loyalty and affection \u2013 served to reinforce or alter her position. It requires an understanding of Victorian social norms and the power of narrative construction.\n</document_analysis>\n\n<output_format>\nQuestion: Considering Queen Victoria's statement that the assassination attempt was \"worth being shot at\u2014to see how much one is loved,\" what strategic impact did her public framing of the event most likely have on her long-term authority?\nA: It diminished her perceived vulnerability, reinforcing an image of stoic resilience and unwavering control, thereby strengthening her authority.\nB: It fostered a climate of fear among potential dissenters, effectively suppressing opposition and solidifying her autocratic power.\nC: It signaled a willingness to engage with her critics, promoting a more democratic and inclusive approach to governance, which broadened her authority.\nD: It highlighted her personal fragility, eliciting greater public sympathy and solidifying her authority through an appeal to emotional connection.\nExplanation: Victoria\u2019s response strategically reframed a violent act as a demonstration of public affection. This reinforced an image of a strong, beloved monarch whose authority was validated by the loyalty of her subjects, rather than appearing vulnerable or shaken. This bolstered her position and public image.\nCorrect Answer: A\n</output_format>\n```",
    "question": "Considering Queen Victoria's statement that the assassination attempt was \"worth being shot at\u2014to see how much one is loved,\" what strategic impact did her public framing of the event most likely have on her long-term authority?",
    "choices": {
      "A": "It diminished her perceived vulnerability, reinforcing an image of stoic resilience and unwavering control, thereby strengthening her authority.",
      "B": "It fostered a climate of fear among potential dissenters, effectively suppressing opposition and solidifying her autocratic power.",
      "C": "It signaled a willingness to engage with her critics, promoting a more democratic and inclusive approach to governance, which broadened her authority.",
      "D": "It highlighted her personal fragility, eliciting greater public sympathy and solidifying her authority through an appeal to emotional connection."
    },
    "answer": "A",
    "explanation": "Victoria\u2019s response strategically reframed a violent act as a demonstration of public affection. This reinforced an image of a strong, beloved monarch whose authority was validated by the loyalty of her subjects, rather than appearing vulnerable or shaken. This bolstered her position and public image.",
    "question_token_count": 43,
    "answer_correctness_score": 10,
    "explanation_validity_score": 10,
    "question_clarity_score": 6,
    "question_difficulty_score": 7,
    "question_groundedness_score": 10,
    "avg_answer_token_count": 25
  },
  {
    "context": "Manning finished the year with a career-low 67.9 passer rating, throwing for 2,249 yards and nine touchdowns, with 17 interceptions. In contrast, Osweiler threw for 1,967 yards, 10 touchdowns and six interceptions for a rating of 86.4. Veteran receiver Demaryius Thomas led the team with 105 receptions for 1,304 yards and six touchdowns, while Emmanuel Sanders caught 76 passes for 1,135 yards and six scores, while adding another 106 yards returning punts. Tight end Owen Daniels was also a big element of the passing game with 46 receptions for 517 yards. Running back C. J. Anderson was the team's leading rusher 863 yards and seven touchdowns, while also catching 25 passes for 183 yards. Running back Ronnie Hillman also made a big impact with 720 yards, five touchdowns, 24 receptions, and a 4.7 yards per carry average. Overall, the offense ranked 19th in scoring with 355 points and did not have any Pro Bowl selections.",
    "topic": "Interpret the Broncos' overall offensive ranking of 19th in scoring and explain potential factors contributing to this performance level based on the provided individual statistics.",
    "response": "```xml\n<document_analysis>\n1. **Thoughtful Content Examination:** The text provides individual statistics for key players on the Denver Broncos' offense and states the team's overall offensive scoring rank (19th). The core ideas revolve around the contrasting performances of quarterbacks Manning and Osweiler, the contributions of receivers and running backs, and the lack of Pro Bowl selections.\n\n2. **Concept Exploration:** The text implies a potential disconnect between individual player performance (some strong numbers from receivers and running backs) and overall team scoring. This suggests issues beyond individual contributions, such as quarterback play, offensive line performance (not explicitly stated but inferable), or play-calling. The significant drop in Manning\u2019s statistics compared to Osweiler is a key element.\n\n3. **Strategic Complexity Calibration:** Difficulty: 8/10. This question requires synthesizing information about multiple players and considering the interplay between passing and rushing attacks, and quarterback performance to explain a team-level ranking. It's not a simple recall question.\n\n4. **Intentional Question Planning:** The question aims to assess the ability to interpret statistical data and identify potential causes for a team's offensive ranking, requiring a nuanced understanding of football strategy and player roles. The question probes for an understanding of how individual performances contribute to, or detract from, overall team success.\n</document_analysis>\n\n<output_format>\nQuestion: Considering the provided statistics, which factor most likely contributed to the Denver Broncos' 19th-ranked offensive scoring?\nA: The consistent, high-volume production of both running backs, C.J. Anderson and Ronnie Hillman, which strained opposing defenses.\nB: Peyton Manning\u2019s significantly lower passer rating and higher interception rate compared to Brock Osweiler.\nC: The lack of a dominant receiving threat, as both Demaryius Thomas and Emmanuel Sanders had comparable reception totals.\nD: Owen Daniels\u2019 limited receiving yardage, indicating a lack of contribution from the tight end position in the passing game.\nExplanation: Peyton Manning\u2019s substantial decline in performance, evidenced by his 67.9 passer rating and 17 interceptions compared to Osweiler\u2019s 86.4 rating and 6 interceptions, directly impacts the team\u2019s ability to score. This is the most significant statistical difference highlighted in the text and would logically contribute to a lower offensive ranking.\nCorrect Answer: B\n</output_format>\n```",
    "question": "Considering the provided statistics, which factor most likely contributed to the Denver Broncos' 19th-ranked offensive scoring?",
    "choices": {
      "A": "The consistent, high-volume production of both running backs, C.J. Anderson and Ronnie Hillman, which strained opposing defenses.",
      "B": "Peyton Manning\u2019s significantly lower passer rating and higher interception rate compared to Brock Osweiler.",
      "C": "The lack of a dominant receiving threat, as both Demaryius Thomas and Emmanuel Sanders had comparable reception totals.",
      "D": "Owen Daniels\u2019 limited receiving yardage, indicating a lack of contribution from the tight end position in the passing game."
    },
    "answer": "B",
    "explanation": "Peyton Manning\u2019s substantial decline in performance, evidenced by his 67.9 passer rating and 17 interceptions compared to Osweiler\u2019s 86.4 rating and 6 interceptions, directly impacts the team\u2019s ability to score. This is the most significant statistical difference highlighted in the text and would logically contribute to a lower offensive ranking.",
    "question_token_count": 24,
    "answer_correctness_score": 10,
    "explanation_validity_score": 10,
    "question_clarity_score": 6,
    "question_difficulty_score": 7,
    "question_groundedness_score": 8,
    "avg_answer_token_count": 23
  },
  {
    "context": "Antibiotics revolutionized medicine in the 20th century, and have together with vaccination led to the near eradication of diseases such as tuberculosis in the developed world. Their effectiveness and easy access led to overuse, especially in livestock raising, prompting bacteria to develop resistance. This has led to widespread problems with antimicrobial and antibiotic resistance, so much as to prompt the World Health Organization to classify antimicrobial resistance as a \"serious threat [that] is no longer a prediction for the future, it is happening right now in every region of the world and has the potential to affect anyone, of any age, in any country\".",
    "topic": "The specific example of tuberculosis and how antibiotic use impacted its prevalence in developed nations.",
    "response": "```xml\n<document_analysis>\n1. **Thoughtful Content Examination:** The context describes the impact of antibiotics on tuberculosis prevalence, highlighting their initial success in eradication followed by the rise of antibiotic resistance due to overuse. The text connects this resistance to livestock use and frames it as a global health crisis.\n2. **Concept Exploration:** The core concepts are antibiotic efficacy, disease eradication, antibiotic resistance, and the consequences of overuse. Implicitly, the passage touches upon evolutionary biology (bacterial adaptation), public health, and the interconnectedness of human and animal health.\n3. **Strategic Complexity Calibration:** Difficulty: 8/10. The question aims to assess understanding of the complex interplay between antibiotic use, disease control, and the emergence of resistance. It's not a simple recall question; it requires connecting different aspects of the provided information.\n4. **Intentional Question Planning:** The question will focus on the unintended consequences of a successful medical intervention, requiring the examinee to understand the long-term implications of antibiotic use beyond immediate disease treatment. The question will require a nuanced understanding of the historical context and the biological mechanisms at play.\n</document_analysis>\n<output_format>\nQuestion: Considering the historical success of antibiotics in controlling tuberculosis in developed nations, what represents the most significant unintended consequence of their widespread application?\nA: A decline in overall healthcare spending due to reduced disease burden.\nB: The emergence of antibiotic-resistant bacterial strains, compromising future treatment efficacy.\nC: A shift in public health focus towards preventative vaccination programs.\nD: Increased susceptibility to fungal infections due to altered gut microbiome composition.\nExplanation: The text explicitly states that the effectiveness and easy access of antibiotics led to overuse, prompting bacteria to develop resistance. This resistance is now a global health threat, representing a significant unintended consequence of their initial success.\nCorrect Answer: B\n</output_format>\n```",
    "question": "Considering the historical success of antibiotics in controlling tuberculosis in developed nations, what represents the most significant unintended consequence of their widespread application?",
    "choices": {
      "A": "A decline in overall healthcare spending due to reduced disease burden.",
      "B": "The emergence of antibiotic-resistant bacterial strains, compromising future treatment efficacy.",
      "C": "A shift in public health focus towards preventative vaccination programs.",
      "D": "Increased susceptibility to fungal infections due to altered gut microbiome composition."
    },
    "answer": "B",
    "explanation": "The text explicitly states that the effectiveness and easy access of antibiotics led to overuse, prompting bacteria to develop resistance. This resistance is now a global health threat, representing a significant unintended consequence of their initial success.",
    "question_token_count": 26,
    "answer_correctness_score": 10,
    "explanation_validity_score": 10,
    "question_clarity_score": 8,
    "question_difficulty_score": 6,
    "question_groundedness_score": 10,
    "avg_answer_token_count": 13
  },
  {
    "context": "The Hellenistic period covers the period of ancient Greek (Hellenic) history and Mediterranean history between the death of Alexander the Great in 323 BC and the emergence of the Roman Empire as signified by the Battle of Actium in 31 BC and the subsequent conquest of Ptolemaic Egypt the following year. At this time, Greek cultural influence and power was at its peak in Europe, Africa and Asia, experiencing prosperity and progress in the arts, exploration, literature, theatre, architecture, music, mathematics, philosophy, and science. For example, competitive public games took place, ideas in biology, and popular entertainment in theaters. It is often considered a period of transition, sometimes even of decadence or degeneration, compared to the enlightenment of the Greek Classical era. The Hellenistic period saw the rise of New Comedy, Alexandrian poetry, the Septuagint and the philosophies of Stoicism and Epicureanism. Greek Science was advanced by the works of the mathematician Euclid and the polymath Archimedes. The religious sphere expanded to include new gods such as the Greco-Egyptian Serapis, eastern deities such as Attis and Cybele and the Greek adoption of Buddhism.",
    "topic": "Assess the significance of New Comedy and Alexandrian poetry as literary developments of the Hellenistic period.",
    "response": "```xml\n<document_analysis>\n1. **Thoughtful Content Examination:** The context describes the Hellenistic period, its timeframe, and its characteristics \u2013 a flourishing of arts, sciences, and philosophy following Alexander the Great\u2019s death. It specifically mentions New Comedy, Alexandrian poetry, Stoicism, Epicureanism, and scientific advancements. The passage positions the Hellenistic period as a transition from the Classical era, sometimes viewed as a period of decline.\n\n2. **Concept Exploration:** The core concept is the nature of the Hellenistic period and its innovations. The mention of New Comedy and Alexandrian poetry suggests a shift in literary styles and themes. The context implies a tension between the perceived \u201cdecadence\u201d of the Hellenistic period and its genuine achievements. The question should probe the significance of these literary developments *within* the broader context of the period's characteristics.\n\n3. **Strategic Complexity Calibration:** Difficulty: 8/10. The question needs to go beyond simply identifying that New Comedy and Alexandrian poetry *existed*. It needs to assess their relative importance as *developments* \u2013 were they significant departures, continuations, or something else? This requires understanding the literary landscape *before* the Hellenistic period.\n\n4. **Intentional Question Planning:** The question will focus on the impact of New Comedy and Alexandrian poetry, framing them as responses to or departures from the preceding Classical period. The answer options will require understanding the characteristics of both periods and the specific features of these new literary forms. The distractor options will focus on other aspects of the Hellenistic period (science, philosophy) or mischaracterize the literary shifts.\n</document_analysis>\n\n<output_format>\nQuestion: Considering the Hellenistic period's broader cultural and intellectual landscape, which statement best characterizes the significance of the emergence of New Comedy and Alexandrian poetry?\nA: They represented a rejection of rational inquiry, prioritizing emotional expression and religious fervor, mirroring the rise of deities like Serapis.\nB: They signified a continuation of Classical dramatic and epic traditions, primarily focused on heroic themes and civic virtue, albeit with increased technical polish.\nC: They embodied a shift towards more individualized and domestic themes, reflecting a changing social structure and a move away from the grand narratives of the Classical period.\nD: They primarily served as vehicles for showcasing advancements in Hellenistic science and mathematics, integrating complex geometrical principles into their structure and content.\nExplanation: New Comedy, unlike Old Comedy, focused on everyday life and characters, and Alexandrian poetry often explored personal themes and erudite displays of skill. This reflects a shift away from the grand, public concerns of Classical literature towards more individualized and domestic interests, aligning with a changing social structure in the Hellenistic period.\nCorrect Answer: C\n</output_format>\n```",
    "question": "Considering the Hellenistic period's broader cultural and intellectual landscape, which statement best characterizes the significance of the emergence of New Comedy and Alexandrian poetry?",
    "choices": {
      "A": "They represented a rejection of rational inquiry, prioritizing emotional expression and religious fervor, mirroring the rise of deities like Serapis.",
      "B": "They signified a continuation of Classical dramatic and epic traditions, primarily focused on heroic themes and civic virtue, albeit with increased technical polish.",
      "C": "They embodied a shift towards more individualized and domestic themes, reflecting a changing social structure and a move away from the grand narratives of the Classical period.",
      "D": "They primarily served as vehicles for showcasing advancements in Hellenistic science and mathematics, integrating complex geometrical principles into their structure and content."
    },
    "answer": "C",
    "explanation": "New Comedy, unlike Old Comedy, focused on everyday life and characters, and Alexandrian poetry often explored personal themes and erudite displays of skill. This reflects a shift away from the grand, public concerns of Classical literature towards more individualized and domestic interests, aligning with a changing social structure in the Hellenistic period.",
    "question_token_count": 30,
    "answer_correctness_score": 10,
    "explanation_validity_score": 10,
    "question_clarity_score": 7,
    "question_difficulty_score": 6,
    "question_groundedness_score": 9,
    "avg_answer_token_count": 28
  },
  {
    "context": "Super Bowl 50 was an American football game to determine the champion of the National Football League (NFL) for the 2015 season. The American Football Conference (AFC) champion Denver Broncos defeated the National Football Conference (NFC) champion Carolina Panthers 24\u201310 to earn their third Super Bowl title. The game was played on February 7, 2016, at Levi's Stadium in the San Francisco Bay Area at Santa Clara, California. As this was the 50th Super Bowl, the league emphasized the \"golden anniversary\" with various gold-themed initiatives, as well as temporarily suspending the tradition of naming each Super Bowl game with Roman numerals (under which the game would have been known as \"Super Bowl L\"), so that the logo could prominently feature the Arabic numerals 50.",
    "topic": "Discuss the \"golden anniversary\" theme employed by the NFL for Super Bowl 50 and provide examples of associated initiatives.",
    "response": "```xml\n<document_analysis>\nThoughtful Content Examination: The context describes Super Bowl 50, highlighting its significance as the league's 50th championship game. The key theme is the \"golden anniversary\" and the associated decision to use Arabic numerals (\"50\") instead of Roman numerals (\"L\") in the logo for promotional purposes. The text focuses on a branding and marketing decision driven by the milestone event.\n\nConcept Exploration: The decision to deviate from the long-standing Roman numeral tradition illustrates the importance of visual branding and marketing in large-scale events like the Super Bowl. It suggests a desire for a more modern and easily recognizable logo. The use of \"golden\" themes speaks to the celebratory nature of the anniversary.\n\nStrategic Complexity Calibration: Difficulty: 7/10. The question requires understanding not just the fact of the golden anniversary theme, but *why* a specific branding decision was made in response to it. It requires inferring the marketing rationale behind the change.\n\nIntentional Question Planning: The question will focus on the strategic reasoning behind the deviation from the established naming convention for the Super Bowl, testing the understanding of branding and marketing considerations within the context of a major event. The distractors will include plausible but incorrect reasons related to tradition, logistics, or player preferences.\n</document_analysis>\n\n<output_format>\nQuestion: The NFL deviated from its long-standing tradition of using Roman numerals to denote Super Bowl L, opting instead for the Arabic numeral \"50\" for Super Bowl 50. What was the primary strategic rationale behind this decision?\nA: To honor the historical significance of the first Super Bowl, which also used Arabic numerals.\nB: To simplify logistical arrangements for broadcast and promotional materials.\nC: To enhance the visual prominence of the \"50\" in the Super Bowl logo, aligning with the \"golden anniversary\" theme.\nD: To appease concerns from players who found Roman numerals difficult to remember.\nExplanation: The text explicitly states that the league temporarily suspended the Roman numeral tradition \"so that the logo could prominently feature the Arabic numerals 50.\" This directly connects the decision to the overarching \"golden anniversary\" theme and branding efforts.\nCorrect Answer: C\n</output_format>\n```",
    "question": "The NFL deviated from its long-standing tradition of using Roman numerals to denote Super Bowl L, opting instead for the Arabic numeral \"50\" for Super Bowl 50. What was the primary strategic rationale behind this decision?",
    "choices": {
      "A": "To honor the historical significance of the first Super Bowl, which also used Arabic numerals.",
      "B": "To simplify logistical arrangements for broadcast and promotional materials.",
      "C": "To enhance the visual prominence of the \"50\" in the Super Bowl logo, aligning with the \"golden anniversary\" theme.",
      "D": "To appease concerns from players who found Roman numerals difficult to remember."
    },
    "answer": "C",
    "explanation": "The text explicitly states that the league temporarily suspended the Roman numeral tradition \"so that the logo could prominently feature the Arabic numerals 50.\" This directly connects the decision to the overarching \"golden anniversary\" theme and branding efforts.",
    "question_token_count": 45,
    "answer_correctness_score": 10,
    "explanation_validity_score": 10,
    "question_clarity_score": 8,
    "question_difficulty_score": 6,
    "question_groundedness_score": 9,
    "avg_answer_token_count": 18
  },
  {
    "context": "The Panthers offense, which led the NFL in scoring (500 points), was loaded with talent, boasting six Pro Bowl selections. Pro Bowl quarterback Cam Newton had one of his best seasons, throwing for 3,837 yards and rushing for 636, while recording a career-high and league-leading 45 total touchdowns (35 passing, 10 rushing), a career-low 10 interceptions, and a career-best quarterback rating of 99.4. Newton's leading receivers were tight end Greg Olsen, who caught a career-high 77 passes for 1,104 yards and seven touchdowns, and wide receiver Ted Ginn, Jr., who caught 44 passes for 739 yards and 10 touchdowns; Ginn also rushed for 60 yards and returned 27 punts for 277 yards. Other key receivers included veteran Jerricho Cotchery (39 receptions for 485 yards), rookie Devin Funchess (31 receptions for 473 yards and five touchdowns), and second-year receiver Corey Brown (31 receptions for 447 yards). The Panthers backfield featured Pro Bowl running back Jonathan Stewart, who led the team with 989 rushing yards and six touchdowns in 13 games, along with Pro Bowl fullback Mike Tolbert, who rushed for 256 yards and caught 18 passes for another 154 yards. Carolina's offensive line also featured two Pro Bowl selections: center Ryan Kalil and guard Trai Turner.",
    "topic": "Assess the overall balance of the Panthers\u2019 offense in 2015, considering both passing and rushing statistics.",
    "response": "<document_analysis>\n1. **Thoughtful Content Examination:** The text details the impressive statistical performance of the Carolina Panthers' offense in 2015, highlighting key players and their contributions in both passing and rushing aspects. It emphasizes Cam Newton's dual-threat ability and the contributions of receivers, running backs, and the offensive line.\n2. **Concept Exploration:** The text implies a balanced offensive approach due to Newton's success as both a passer and runner, coupled with the strong contributions of both receiving corps and the running back duo. However, it doesn\u2019t explicitly quantify this balance. A challenging question would probe the degree of balance, requiring the expert to synthesize the provided data.\n3. **Strategic Complexity Calibration:** Difficulty: 9/10. The question requires combining various statistics and understanding their relative importance to assess offensive balance. It goes beyond simple recall and requires analytical reasoning.\n4. **Intentional Question Planning:** The question is designed to assess whether the domain expert can go beyond recognizing individual player success and evaluate the overall offensive strategy and its effectiveness in terms of run/pass balance. The answer choices will be designed to be close, requiring careful consideration of the numbers.\n</document_analysis>\n\n<output_format>\nQuestion: In the 2015 season, to what extent did the Carolina Panthers\u2019 offensive strategy prioritize passing versus rushing, considering the total yardage generated by each method?\nA: The Panthers\u2019 offense heavily favored the passing game, accounting for approximately 65% of total offensive yardage.\nB: The Panthers\u2019 offense demonstrated a near-perfect balance between passing and rushing, with each accounting for roughly 50% of total offensive yardage.\nC: The Panthers\u2019 offense leaned towards a rushing attack, with rushing yardage exceeding passing yardage by approximately 15%.\nD: The Panthers\u2019 offense prioritized the passing game, but rushing remained a significant component, accounting for approximately 40% of total offensive yardage.\nExplanation: Total passing yards were 3,837, while total rushing yards were 636 + 989 + 256 = 1881. Therefore, passing accounted for approximately 67.3% (3837/(3837+1881)) of the total offensive yardage.\nCorrect Answer: A\n</output_format>",
    "question": "In the 2015 season, to what extent did the Carolina Panthers\u2019 offensive strategy prioritize passing versus rushing, considering the total yardage generated by each method?",
    "choices": {
      "A": "The Panthers\u2019 offense heavily favored the passing game, accounting for approximately 65% of total offensive yardage.",
      "B": "The Panthers\u2019 offense demonstrated a near-perfect balance between passing and rushing, with each accounting for roughly 50% of total offensive yardage.",
      "C": "The Panthers\u2019 offense leaned towards a rushing attack, with rushing yardage exceeding passing yardage by approximately 15%.",
      "D": "The Panthers\u2019 offense prioritized the passing game, but rushing remained a significant component, accounting for approximately 40% of total offensive yardage."
    },
    "answer": "A",
    "explanation": "Total passing yards were 3,837, while total rushing yards were 636 + 989 + 256 = 1881. Therefore, passing accounted for approximately 67.3% (3837/(3837+1881)) of the total offensive yardage.",
    "question_token_count": 33,
    "answer_correctness_score": 10,
    "explanation_validity_score": 10,
    "question_clarity_score": 7,
    "question_difficulty_score": 6,
    "question_groundedness_score": 9,
    "avg_answer_token_count": 26
  },
  {
    "context": "Antibiotics revolutionized medicine in the 20th century, and have together with vaccination led to the near eradication of diseases such as tuberculosis in the developed world. Their effectiveness and easy access led to overuse, especially in livestock raising, prompting bacteria to develop resistance. This has led to widespread problems with antimicrobial and antibiotic resistance, so much as to prompt the World Health Organization to classify antimicrobial resistance as a \"serious threat [that] is no longer a prediction for the future, it is happening right now in every region of the world and has the potential to affect anyone, of any age, in any country\".",
    "topic": "The implications of classifying antimicrobial resistance as an immediate, rather than future, threat to public health.",
    "response": "```xml\n<document_analysis>\n1. **Thoughtful Content Examination:** The context discusses the historical impact of antibiotics, their subsequent overuse, and the resulting rise of antimicrobial resistance. It highlights the WHO's recent classification of this resistance as an *current* threat, not a future one. The core idea is the shift in the perception of antimicrobial resistance from a potential future problem to an existing, global crisis.\n2. **Concept Exploration:** The text implicitly connects antibiotic overuse in livestock to the broader problem of resistance, suggesting a complex interplay between human and animal health. The WHO's statement underscores the urgency and universality of the threat, challenging the notion that it's a localized or distant issue.\n3. **Strategic Complexity Calibration:** Difficulty: 8/10. The question aims to go beyond the surface-level understanding of the problem and delves into the implications of this reclassification. It requires understanding how a change in framing (future vs. present threat) can influence public health responses and resource allocation.\n4. **Intentional Question Planning:** The question is designed to probe the domain expert's understanding of the practical consequences of recognizing antimicrobial resistance as an immediate threat. The answer options will focus on how this shift in perception alters strategies, priorities, and potential interventions.\n</document_analysis>\n<output_format>\nQuestion: The World Health Organization\u2019s recent classification of antimicrobial resistance as a current, rather than future, threat most directly necessitates a shift towards which of the following strategies?\nA: Increased investment in the development of novel antibiotics with broad-spectrum activity.\nB: Prioritization of preventative measures and stewardship programs focused on reducing antibiotic usage.\nC: Expanded surveillance systems to track the emergence and spread of resistant strains globally.\nD: Enhanced public awareness campaigns focused on the individual responsibility of completing antibiotic courses.\nExplanation: The WHO\u2019s statement emphasizes the *current* and widespread nature of the threat, indicating a need to move beyond simply preparing for a future problem. This necessitates a focus on mitigating the existing issue through reduced usage and preventative measures, rather than solely relying on future solutions like new drugs.\nCorrect Answer: B\n</output_format>\n```",
    "question": "The World Health Organization\u2019s recent classification of antimicrobial resistance as a current, rather than future, threat most directly necessitates a shift towards which of the following strategies?",
    "choices": {
      "A": "Increased investment in the development of novel antibiotics with broad-spectrum activity.",
      "B": "Prioritization of preventative measures and stewardship programs focused on reducing antibiotic usage.",
      "C": "Expanded surveillance systems to track the emergence and spread of resistant strains globally.",
      "D": "Enhanced public awareness campaigns focused on the individual responsibility of completing antibiotic courses."
    },
    "answer": "B",
    "explanation": "The WHO\u2019s statement emphasizes the *current* and widespread nature of the threat, indicating a need to move beyond simply preparing for a future problem. This necessitates a focus on mitigating the existing issue through reduced usage and preventative measures, rather than solely relying on future solutions like new drugs.",
    "question_token_count": 33,
    "answer_correctness_score": 9,
    "explanation_validity_score": 9,
    "question_clarity_score": 4,
    "question_difficulty_score": 7,
    "question_groundedness_score": 6,
    "avg_answer_token_count": 15
  },
  {
    "context": "In 1853, Victoria gave birth to her eighth child, Leopold, with the aid of the new anaesthetic, chloroform. Victoria was so impressed by the relief it gave from the pain of childbirth that she used it again in 1857 at the birth of her ninth and final child, Beatrice, despite opposition from members of the clergy, who considered it against biblical teaching, and members of the medical profession, who thought it dangerous. Victoria may have suffered from post-natal depression after many of her pregnancies. Letters from Albert to Victoria intermittently complain of her loss of self-control. For example, about a month after Leopold's birth Albert complained in a letter to Victoria about her \"continuance of hysterics\" over a \"miserable trifle\".",
    "topic": "The interplay between scientific advancements (chloroform) and traditional beliefs (religious and medical opposition) in Victorian England.",
    "response": "```xml\n<document_analysis>\nThoughtful Content Examination: The text details Queen Victoria's use of chloroform during childbirth in 1853 and 1857, highlighting the conflict between emerging scientific practices and prevailing religious and medical opinions. It also touches upon the possibility of Victoria's post-natal depression and Albert's observations of her emotional state. The core tension lies in the societal acceptance of new medical technologies amidst established belief systems.\n\nConcept Exploration: The passage implicitly explores themes of gender roles in Victorian society, the evolving relationship between science and religion, and the personal impact of childbirth on a powerful figure. It suggests a potential link between Victoria's emotional instability and her experiences with pregnancy and childbirth. The use of chloroform is framed not merely as a medical innovation but as a culturally significant act.\n\nStrategic Complexity Calibration: Difficulty: 8/10. The question targets understanding of the complex interplay between societal, religious, and medical factors. It requires inferring the broader implications of Victoria\u2019s choices and the context of the time.\n\nIntentional Question Planning: The question aims to probe understanding of the nuanced opposition to chloroform, going beyond simply stating that it existed. It forces the test-taker to consider the specific motivations behind the resistance, requiring a synthesis of the information provided.\n</document_analysis>\n\n<output_format>\nQuestion: The opposition to Queen Victoria\u2019s use of chloroform during childbirth stemmed from both religious and medical concerns. Which statement best encapsulates the core of the medical profession\u2019s reservations?\nA: Concerns that chloroform undermined the natural process of childbirth, aligning with prevalent spiritual beliefs regarding pain as divine punishment.\nB: Fears regarding the potential for unforeseen physiological complications and a lack of comprehensive understanding of its long-term effects.\nC: Belief that chloroform was a frivolous indulgence unbecoming of a Queen and detrimental to maintaining a stoic public image.\nD: A desire to preserve the established dominance of traditional birthing practices and the economic interests of midwives.\nExplanation: The text states that \u201cmembers of the medical profession\u2026 thought it dangerous.\u201d This directly points to concerns about potential harm and lack of complete understanding, making option B the most accurate reflection of their reservations. The other options introduce elements not explicitly supported by the provided text.\nCorrect Answer: B\n</output_format>\n```",
    "question": "The opposition to Queen Victoria\u2019s use of chloroform during childbirth stemmed from both religious and medical concerns. Which statement best encapsulates the core of the medical profession\u2019s reservations?",
    "choices": {
      "A": "Concerns that chloroform undermined the natural process of childbirth, aligning with prevalent spiritual beliefs regarding pain as divine punishment.",
      "B": "Fears regarding the potential for unforeseen physiological complications and a lack of comprehensive understanding of its long-term effects.",
      "C": "Belief that chloroform was a frivolous indulgence unbecoming of a Queen and detrimental to maintaining a stoic public image.",
      "D": "A desire to preserve the established dominance of traditional birthing practices and the economic interests of midwives."
    },
    "answer": "B",
    "explanation": "The text states that \u201cmembers of the medical profession\u2026 thought it dangerous.\u201d This directly points to concerns about potential harm and lack of complete understanding, making option B the most accurate reflection of their reservations. The other options introduce elements not explicitly supported by the provided text.",
    "question_token_count": 37,
    "answer_correctness_score": 10,
    "explanation_validity_score": 10,
    "question_clarity_score": 6,
    "question_difficulty_score": 5,
    "question_groundedness_score": 8,
    "avg_answer_token_count": 24
  },
  {
    "context": "It was temporarily under the control of the Tibetan empire and Chinese from 650\u2013680 and then under the control of the Umayyads in 710. The Samanid Empire, 819 to 999, restored Persian control of the region and enlarged the cities of Samarkand and Bukhara (both cities are today part of Uzbekistan) which became the cultural centers of Iran and the region was known as Khorasan. The Kara-Khanid Khanate conquered Transoxania (which corresponds approximately with modern-day Uzbekistan, Tajikistan, southern Kyrgyzstan and southwest Kazakhstan) and ruled between 999\u20131211. Their arrival in Transoxania signaled a definitive shift from Iranian to Turkic predominance in Central Asia, but gradually the Kara-khanids became assimilated into the Perso-Arab Muslim culture of the region.",
    "topic": "Compare and contrast the cultural influences of the Umayyad Caliphate and the Samanid Empire on Transoxania.",
    "response": "```xml\n<document_analysis>\n1. **Thoughtful Content Examination:** The text describes a succession of empires controlling Transoxania: Tibetan/Chinese, Umayyad, Samanid, and Kara-Khanid. It highlights the Samanids' role in restoring Persian control and establishing cultural centers like Samarkand and Bukhara. It also notes a later shift to Turkic dominance under the Kara-Khanids, followed by their assimilation into the existing Perso-Arab Muslim culture.\n2. **Concept Exploration:** The core concept revolves around cultural influence and shifts in power dynamics within Transoxania. The text implicitly suggests a tension between Iranian/Persian cultural elements and Turkic influences. The assimilation of the Kara-Khanids is a key point, indicating cultural resilience and adaptation.\n3. **Strategic Complexity Calibration:** Difficulty: 8/10. The question requires understanding not just the empires involved, but also the nature of their cultural impact (restoration vs. shift in dominance, assimilation). It demands inference about the underlying cultural forces at play.\n4. **Intentional Question Planning:** The question will focus on contrasting the Umayyad and Samanid influences, specifically how they affected the cultural landscape of Transoxania. The answer choices will be designed to test understanding of whether each empire *introduced* a new cultural element or *restored* a previously existing one.\n</document_analysis>\n<output_format>\nQuestion: Considering the historical context of Transoxania, how did the cultural impact of the Umayyad Caliphate fundamentally differ from that of the Samanid Empire?\nA: The Umayyads instigated a period of Turkic cultural dominance, while the Samanids revitalized Persian cultural control.\nB: The Umayyads primarily represented a restoration of Persian cultural influence, whereas the Samanids initiated a shift towards Turkic cultural predominance.\nC: Both the Umayyads and the Samanids equally promoted the development of Perso-Arab Muslim culture throughout the region.\nD: The Umayyads fostered the growth of urban centers like Samarkand and Bukhara, while the Samanids focused on consolidating Tibetan cultural traditions.\nExplanation: The text states the Samanid Empire \u201crestored Persian control\u201d and enlarged cultural centers. It also indicates the Umayyads had brief control before the Samanids, and the Kara-Khanids signaled a *later* shift to Turkic dominance, implying the Umayyads did not directly establish Turkic control. Therefore, the Umayyads' impact was distinct from the Samanids\u2019 restoration of Persian influence.\nCorrect Answer: A\n</output_format>\n```",
    "question": "Considering the historical context of Transoxania, how did the cultural impact of the Umayyad Caliphate fundamentally differ from that of the Samanid Empire?",
    "choices": {
      "A": "The Umayyads instigated a period of Turkic cultural dominance, while the Samanids revitalized Persian cultural control.",
      "B": "The Umayyads primarily represented a restoration of Persian cultural influence, whereas the Samanids initiated a shift towards Turkic cultural predominance.",
      "C": "Both the Umayyads and the Samanids equally promoted the development of Perso-Arab Muslim culture throughout the region.",
      "D": "The Umayyads fostered the growth of urban centers like Samarkand and Bukhara, while the Samanids focused on consolidating Tibetan cultural traditions."
    },
    "answer": "A",
    "explanation": "The text states the Samanid Empire \u201crestored Persian control\u201d and enlarged cultural centers. It also indicates the Umayyads had brief control before the Samanids, and the Kara-Khanids signaled a *later* shift to Turkic dominance, implying the Umayyads did not directly establish Turkic control. Therefore, the Umayyads' impact was distinct from the Samanids\u2019 restoration of Persian influence.",
    "question_token_count": 35,
    "answer_correctness_score": 2,
    "explanation_validity_score": 4,
    "question_clarity_score": 6,
    "question_difficulty_score": 8,
    "question_groundedness_score": 7,
    "avg_answer_token_count": 29
  },
  {
    "context": "In 1853, Victoria gave birth to her eighth child, Leopold, with the aid of the new anaesthetic, chloroform. Victoria was so impressed by the relief it gave from the pain of childbirth that she used it again in 1857 at the birth of her ninth and final child, Beatrice, despite opposition from members of the clergy, who considered it against biblical teaching, and members of the medical profession, who thought it dangerous. Victoria may have suffered from post-natal depression after many of her pregnancies. Letters from Albert to Victoria intermittently complain of her loss of self-control. For example, about a month after Leopold's birth Albert complained in a letter to Victoria about her \"continuance of hysterics\" over a \"miserable trifle\".",
    "topic": "The potential indicators of post-natal depression in Queen Victoria based on historical accounts and Albert's correspondence.",
    "response": "```xml\n<document_analysis>\nThoughtful Content Examination: The context discusses Queen Victoria's use of chloroform during childbirth and hints at potential post-natal depression through Albert's letters referencing her \"loss of self-control\" and \"hysterics.\" The core idea is the interplay between medical advancements, religious/medical opposition, and Victoria's emotional state following childbirth.\n\nConcept Exploration: The passage implies a connection between childbirth, emotional instability, and potential mental health struggles in Victoria. It touches upon the societal constraints and expectations placed on women, particularly regarding childbirth and emotional expression. Albert's letters serve as indirect evidence of Victoria's emotional state, requiring interpretation.\n\nStrategic Complexity Calibration: Difficulty: 8/10. The question requires inferential reasoning and understanding of historical context, psychological indicators (even if not explicitly labeled as such), and the nuances of Victorian-era communication. It's not a straightforward factual recall question.\n\nIntentional Question Planning: The question will focus on interpreting Albert's complaints as potential indicators of a specific condition, prompting a deep engagement with the text and requiring the test-taker to draw connections between observed behaviors and potential diagnoses, acknowledging the limitations of historical assessment. The question will require understanding of historical context and medical terminology.\n</document_analysis>\n\n<output_format>\nQuestion: Based on Albert's documented concerns regarding Victoria's emotional state following the birth of Leopold, which of the following best characterizes the potential clinical presentation indicated by his descriptions of her behavior?\nA: Generalized Anxiety Disorder, manifesting as excessive worry and apprehension about minor issues.\nB: Post-natal depression, characterized by emotional lability and disproportionate reactions to stressors.\nC: Conversion Disorder, presenting as neurological symptoms without a clear organic cause.\nD: Histrionic Personality Disorder, indicated by attention-seeking behavior and exaggerated emotional expression.\nExplanation: Albert's descriptions of Victoria\u2019s \u201closs of self-control\u201d and \u201chysterics\u201d over a \u201cmiserable trifle\u201d align most closely with the emotional lability and heightened reactivity often associated with post-natal depression. While the other options involve emotional or psychological distress, they don't directly correlate with the specific behaviors described in the context. The term \"hysterics\" was historically used (though now considered outdated and stigmatizing) to describe emotional outbursts, which are consistent with symptoms of post-natal depression.\nCorrect Answer: B\n</output_format>\n```",
    "question": "Based on Albert's documented concerns regarding Victoria's emotional state following the birth of Leopold, which of the following best characterizes the potential clinical presentation indicated by his descriptions of her behavior?",
    "choices": {
      "A": "Generalized Anxiety Disorder, manifesting as excessive worry and apprehension about minor issues.",
      "B": "Post-natal depression, characterized by emotional lability and disproportionate reactions to stressors.",
      "C": "Conversion Disorder, presenting as neurological symptoms without a clear organic cause.",
      "D": "Histrionic Personality Disorder, indicated by attention-seeking behavior and exaggerated emotional expression."
    },
    "answer": "B",
    "explanation": "Albert's descriptions of Victoria\u2019s \u201closs of self-control\u201d and \u201chysterics\u201d over a \u201cmiserable trifle\u201d align most closely with the emotional lability and heightened reactivity often associated with post-natal depression. While the other options involve emotional or psychological distress, they don't directly correlate with the specific behaviors described in the context. The term \"hysterics\" was historically used (though now considered outdated and stigmatizing) to describe emotional outbursts, which are consistent with symptoms of post-natal depression.",
    "question_token_count": 36,
    "answer_correctness_score": 10,
    "explanation_validity_score": 10,
    "question_clarity_score": 7,
    "question_difficulty_score": 8,
    "question_groundedness_score": 10,
    "avg_answer_token_count": 17
  },
  {
    "context": "For the third straight season, the number one seeds from both conferences met in the Super Bowl. The Carolina Panthers became one of only ten teams to have completed a regular season with only one loss, and one of only six teams to have acquired a 15\u20131 record, while the Denver Broncos became one of four teams to have made eight appearances in the Super Bowl. The Broncos made their second Super Bowl appearance in three years, having reached Super Bowl XLVIII, while the Panthers made their second Super Bowl appearance in franchise history, their other appearance being Super Bowl XXXVIII. Coincidentally, both teams were coached by John Fox in their last Super Bowl appearance prior to Super Bowl 50.",
    "topic": "Discuss the implications of both the Panthers and Broncos having previous Super Bowl appearances with John Fox as their coach.",
    "response": "```xml\n<document_analysis>\n1. **Thoughtful Content Examination:** The context focuses on the historical context of Super Bowl 50, highlighting the achievements of both the Carolina Panthers and Denver Broncos leading up to the game. A key point is that both teams had previously appeared in the Super Bowl, and notably, both were previously coached by John Fox.\n2. **Concept Exploration:** The implicit significance lies in the shared history between the teams and their coaches. This creates an interesting dynamic \u2013 a clash of teams both familiar with the Super Bowl stage, and each having been guided there by the same coach. This shared history could influence player psychology, coaching strategies, or media narratives.\n3. **Strategic Complexity Calibration:** Difficulty: 8/10. The question requires recalling details about past Super Bowl appearances and recognizing the significance of the shared coaching history. It's not a simple recall question but requires understanding the implications of that shared experience.\n4. **Intentional Question Planning:** The question aims to probe understanding of the strategic and psychological impact of having both teams led by former coaches of the opposing team in previous Super Bowl appearances. It tests whether the expert recognizes the nuanced implications of this coincidence.\n</document_analysis>\n<output_format>\nQuestion: Considering both the Carolina Panthers and Denver Broncos had previously competed in a Super Bowl under the leadership of John Fox, what strategic or psychological impact might this shared history have had on Super Bowl 50?\nA: It likely minimized pre-game anxieties for both teams, fostering a relaxed atmosphere focused solely on execution.\nB: It created a unique dynamic where both teams possessed intimate knowledge of each other\u2019s coaching tendencies and player strengths.\nC: It introduced an element of psychological warfare, with each team attempting to exploit the other's prior Super Bowl experience.\nD: It primarily served as a narrative device for media coverage, having minimal practical impact on the game itself.\nExplanation: The context states both teams were coached by John Fox in their last Super Bowl appearance prior to Super Bowl 50. This shared history would allow both teams to have an understanding of each other\u2019s coaching tendencies and player strengths.\nCorrect Answer: B\n</output_format>\n```",
    "question": "Considering both the Carolina Panthers and Denver Broncos had previously competed in a Super Bowl under the leadership of John Fox, what strategic or psychological impact might this shared history have had on Super Bowl 50?",
    "choices": {
      "A": "It likely minimized pre-game anxieties for both teams, fostering a relaxed atmosphere focused solely on execution.",
      "B": "It created a unique dynamic where both teams possessed intimate knowledge of each other\u2019s coaching tendencies and player strengths.",
      "C": "It introduced an element of psychological warfare, with each team attempting to exploit the other's prior Super Bowl experience.",
      "D": "It primarily served as a narrative device for media coverage, having minimal practical impact on the game itself."
    },
    "answer": "B",
    "explanation": "The context states both teams were coached by John Fox in their last Super Bowl appearance prior to Super Bowl 50. This shared history would allow both teams to have an understanding of each other\u2019s coaching tendencies and player strengths.",
    "question_token_count": 40,
    "answer_correctness_score": 8,
    "explanation_validity_score": 8,
    "question_clarity_score": 7,
    "question_difficulty_score": 8,
    "question_groundedness_score": 8,
    "avg_answer_token_count": 21
  },
  {
    "context": "Multiracial Americans are Americans who have mixed ancestry of \"two or more races\". The term may also include Americans of mixed-race ancestry who self-identify with just one group culturally and socially (cf. the one-drop rule). In the 2010 US census, approximately 9 million individuals, or 2.9% of the population, self-identified as multiracial. There is evidence that an accounting by genetic ancestry would produce a higher number, but people live according to social and cultural identities, not DNA. Historical reasons, including slavery creating a racial caste and the European-American suppression of Native Americans, often led people to identify or be classified by only one ethnicity, generally that of the culture in which they were raised. Prior to the mid-20th century, many people hid their multiracial heritage because of racial discrimination against minorities. While many Americans may be biologically multiracial, they often do not know it or do not identify so culturally, any more than they maintain all the differing traditions of a variety of national ancestries.",
    "topic": "Differentiate between genetic ancestry and social/cultural identity in the context of racial classification.",
    "response": "<document_analysis>\n1. **Thoughtful Content Examination**: The text focuses on the distinction between biological multiracialism (genetic ancestry) and social/cultural identification with a single race, particularly within the context of the US. It highlights how historical factors like slavery and discrimination have influenced racial identification, often overriding genetic realities. The \"one-drop rule\" is mentioned as a contrasting concept.\n2. **Concept Exploration**: The core idea is that genetic ancestry doesn't necessarily align with how people *live* their racial identities. Social and cultural forces are more powerful determinants of self-identification. The text implicitly critiques the idea of race as a purely biological construct.\n3. **Strategic Complexity Calibration**: Difficulty: 8/10. The question requires understanding the interplay between biology, history, and social constructs. It requires the expert to differentiate between concepts that are often conflated.\n4. **Intentional Question Planning**: The question is designed to probe the expert's understanding of the disconnect between genetic heritage and lived racial experience, and the impact of historical and social forces. It tests whether the expert understands that a higher number of people may be genetically multiracial than identify as such.\n</document_analysis>\n\n<output_format>\nQuestion: Which of the following best describes the primary distinction made in the text regarding racial classification?\nA: Genetic ancestry is the most reliable indicator of racial identity, despite social pressures to conform.\nB: Social and cultural identities typically override genetic ancestry in determining how individuals identify racially.\nC: The \"one-drop rule\" accurately reflects the genetic reality of multiracial individuals in the United States.\nD: Multiracial individuals always recognize and embrace their full genetic heritage, leading to a more nuanced understanding of race.\nExplanation: The text explicitly states, \u201cpeople live according to social and cultural identities, not DNA.\u201d It further explains that historical and social factors often lead people to identify with a single ethnicity, regardless of their genetic makeup.\nCorrect Answer: B\n</output_format>",
    "question": "Which of the following best describes the primary distinction made in the text regarding racial classification?",
    "choices": {
      "A": "Genetic ancestry is the most reliable indicator of racial identity, despite social pressures to conform.",
      "B": "Social and cultural identities typically override genetic ancestry in determining how individuals identify racially.",
      "C": "The \"one-drop rule\" accurately reflects the genetic reality of multiracial individuals in the United States.",
      "D": "Multiracial individuals always recognize and embrace their full genetic heritage, leading to a more nuanced understanding of race."
    },
    "answer": "B",
    "explanation": "The text explicitly states, \u201cpeople live according to social and cultural identities, not DNA.\u201d It further explains that historical and social factors often lead people to identify with a single ethnicity, regardless of their genetic makeup.",
    "question_token_count": 18,
    "answer_correctness_score": 9,
    "explanation_validity_score": 10,
    "question_clarity_score": 8,
    "question_difficulty_score": 6,
    "question_groundedness_score": 9,
    "avg_answer_token_count": 20
  },
  {
    "context": "After a lengthy period of formal racial segregation in the former Confederacy following the Reconstruction Era, and bans on interracial marriage in various parts of the country, more people are openly forming interracial unions. In addition, social conditions have changed and many multiracial people do not believe it is socially advantageous to try to \"pass\" as white. Diverse immigration has brought more mixed-race people into the United States, such as the large population of Hispanics identifying as mestizos. Since the 1980s, the United States has had a growing multiracial identity movement (cf. Loving Day). Because more Americans have insisted on being allowed to acknowledge their mixed racial origins, the 2000 census for the first time allowed residents to check more than one ethno-racial identity and thereby identify as multiracial. In 2008 Barack Obama was elected as the first multiracial President of the United States; he acknowledges both sides of his family and identifies as African American.",
    "topic": "The relationship between social conditions and the increasing openness of people forming interracial unions.",
    "response": "```xml\n<document_analysis>\n1. **Thoughtful Content Examination:** The text describes a shift in societal attitudes toward interracial relationships and multiracial identity in the United States. It highlights the historical context of segregation and anti-miscegenation laws, followed by a gradual increase in openness and acceptance. The rise of a multiracial identity movement and changes in census practices are key elements. The election of Barack Obama is presented as a symbolic milestone.\n\n2. **Concept Exploration:** The passage implies a correlation between changing social conditions (end of formal segregation, increased immigration, multiracial activism) and the increased visibility and acceptance of interracial unions and multiracial identity. It also touches on the evolving concept of racial identity itself, with a move away from the necessity of \"passing\" and toward embracing mixed heritage. The significance of legal changes, such as allowing multiple racial identifications on the census, is also important.\n\n3. **Strategic Complexity Calibration:** Difficulty: 9/10. This question requires understanding of historical context, sociological trends, and the implications of legal and political developments. It also demands an understanding of the nuances of racial identity and the concept of \"passing.\"\n\n4. **Intentional Question Planning:** The question will focus on the complex interplay between legal, social, and political factors that have contributed to the increasing openness toward interracial unions. The answer options will be designed to be plausible, requiring careful consideration of the historical timeline and the relative importance of different contributing factors.\n</document_analysis>\n\n<output_format>\nQuestion: Which of the following developments most fundamentally enabled the increasing openness of people forming interracial unions in the United States post-Reconstruction?\nA: Increased Hispanic immigration introducing the concept of *mestizaje* to the broader US population.\nB: The legal allowance of multiple ethno-racial identities in the 2000 census, reflecting a shift in official recognition of racial diversity.\nC: The dismantling of formal racial segregation and anti-miscegenation laws, challenging the legal foundations of racial separation.\nD: The election of Barack Obama, symbolizing a societal acceptance of multiracial individuals in positions of power.\nExplanation: While all options contributed, the dismantling of segregation and anti-miscegenation laws removed the *legal* barriers to interracial unions, which was a foundational change necessary for subsequent social acceptance and identity shifts. The other options represent consequences or symbolic milestones following this initial legal shift.\nCorrect Answer: C\n</output_format>\n```",
    "question": "Which of the following developments most fundamentally enabled the increasing openness of people forming interracial unions in the United States post-Reconstruction?",
    "choices": {
      "A": "Increased Hispanic immigration introducing the concept of *mestizaje* to the broader US population.",
      "B": "The legal allowance of multiple ethno-racial identities in the 2000 census, reflecting a shift in official recognition of racial diversity.",
      "C": "The dismantling of formal racial segregation and anti-miscegenation laws, challenging the legal foundations of racial separation.",
      "D": "The election of Barack Obama, symbolizing a societal acceptance of multiracial individuals in positions of power."
    },
    "answer": "C",
    "explanation": "While all options contributed, the dismantling of segregation and anti-miscegenation laws removed the *legal* barriers to interracial unions, which was a foundational change necessary for subsequent social acceptance and identity shifts. The other options represent consequences or symbolic milestones following this initial legal shift.",
    "question_token_count": 27,
    "answer_correctness_score": 10,
    "explanation_validity_score": 10,
    "question_clarity_score": 1,
    "question_difficulty_score": 6,
    "question_groundedness_score": 8,
    "avg_answer_token_count": 23
  },
  {
    "context": "Beyonc\u00e9 Giselle Knowles-Carter (/bi\u02d0\u02c8j\u0252nse\u026a/ bee-YON-say) (born September 4, 1981) is an American singer, songwriter, record producer and actress. Born and raised in Houston, Texas, she performed in various singing and dancing competitions as a child, and rose to fame in the late 1990s as lead singer of R&B girl-group Destiny's Child. Managed by her father, Mathew Knowles, the group became one of the world's best-selling girl groups of all time. Their hiatus saw the release of Beyonc\u00e9's debut album, Dangerously in Love (2003), which established her as a solo artist worldwide, earned five Grammy Awards and featured the Billboard Hot 100 number-one singles \"Crazy in Love\" and \"Baby Boy\".",
    "topic": "The early performing arts background of Beyonc\u00e9 before achieving fame with Destiny's Child.",
    "response": "```xml\n<document_analysis>\n1. **Thoughtful Content Examination:** The context provides a brief overview of Beyonc\u00e9's early life and rise to fame, highlighting her childhood performances in singing and dancing competitions and her initial success with Destiny's Child. The key idea is her early exposure to performing arts before her mainstream success.\n2. **Concept Exploration:** The passage implicitly suggests a strong foundation in performance skills developed before joining Destiny's Child. It also highlights the role of her father as a manager, indicating early professional guidance. A subtle point is the distinction between her childhood competitions and her subsequent rise to fame *with* a group.\n3. **Strategic Complexity Calibration:** Difficulty: 8/10. The question will focus on inferring the significance of her early performances, requiring an understanding of how such experiences contribute to an artist's development and career trajectory. The options will be designed to be subtly different, testing nuanced understanding.\n4. **Intentional Question Planning:** The question will focus on the impact of Beyonc\u00e9's early performances. It's designed to be challenging because it requires inferring the *purpose* of those performances rather than simply recalling a fact. The question is designed to require the test taker to understand the broader context of artist development and the role of early experience.\n</document_analysis>\n<output_format>\nQuestion: Prior to achieving mainstream recognition with Destiny's Child, Beyonc\u00e9's participation in singing and dancing competitions most fundamentally served to cultivate which core skill set?\nA: A mastery of music production techniques and songwriting.\nB: A refined stage presence and foundational performance abilities.\nC: Extensive networking opportunities within the music industry.\nD: A comprehensive understanding of music business management.\nExplanation: The context states Beyonc\u00e9 \"performed in various singing and dancing competitions as a child.\" This directly indicates the development of her performance skills and stage presence. While her father's management was important, the competitions themselves focused on *her* performance abilities. The other options are not directly supported by the text.\nCorrect Answer: B\n</output_format>\n```",
    "question": "Prior to achieving mainstream recognition with Destiny's Child, Beyonc\u00e9's participation in singing and dancing competitions most fundamentally served to cultivate which core skill set?",
    "choices": {
      "A": "A mastery of music production techniques and songwriting.",
      "B": "A refined stage presence and foundational performance abilities.",
      "C": "Extensive networking opportunities within the music industry.",
      "D": "A comprehensive understanding of music business management."
    },
    "answer": "B",
    "explanation": "The context states Beyonc\u00e9 \"performed in various singing and dancing competitions as a child.\" This directly indicates the development of her performance skills and stage presence. While her father's management was important, the competitions themselves focused on *her* performance abilities. The other options are not directly supported by the text.",
    "question_token_count": 30,
    "answer_correctness_score": 10,
    "explanation_validity_score": 10,
    "question_clarity_score": 4,
    "question_difficulty_score": 6,
    "question_groundedness_score": 8,
    "avg_answer_token_count": 10
  },
  {
    "context": "Beyonc\u00e9 Giselle Knowles-Carter (/bi\u02d0\u02c8j\u0252nse\u026a/ bee-YON-say) (born September 4, 1981) is an American singer, songwriter, record producer and actress. Born and raised in Houston, Texas, she performed in various singing and dancing competitions as a child, and rose to fame in the late 1990s as lead singer of R&B girl-group Destiny's Child. Managed by her father, Mathew Knowles, the group became one of the world's best-selling girl groups of all time. Their hiatus saw the release of Beyonc\u00e9's debut album, Dangerously in Love (2003), which established her as a solo artist worldwide, earned five Grammy Awards and featured the Billboard Hot 100 number-one singles \"Crazy in Love\" and \"Baby Boy\".",
    "topic": "The critical and commercial success of \"Dangerously in Love,\" as evidenced by its Grammy Awards and chart-topping singles.",
    "response": "```xml\n<document_analysis>\nThoughtful Content Examination: The context provides biographical information about Beyonc\u00e9 Knowles-Carter, focusing on her early life, rise to fame with Destiny's Child, and the launch of her successful solo career with the album \"Dangerously in Love.\" The key point is the album's critical and commercial success, highlighted by Grammy Awards and chart-topping singles.\n\nConcept Exploration: The text subtly implies a transition from group dynamics to individual artistry, and the pivotal role of \"Dangerously in Love\" in establishing Beyonc\u00e9's independent identity. The mention of her father as a manager hints at the influence of family in her career trajectory.\n\nStrategic Complexity Calibration: Difficulty: 8/10. The question focuses on the nuanced impact of the album, going beyond simply stating its success. It requires understanding the significance of the album within the broader context of her career and the music industry.\n\nIntentional Question Planning: The question aims to assess the understanding of the album's role as a catalyst for Beyonc\u00e9's solo career and its impact on her overall artistic trajectory. It avoids directly asking about the number of Grammy Awards or singles, instead focusing on the album's function.\n</document_analysis>\n<output_format>\nQuestion: \"Dangerously in Love\" is strategically significant in Beyonc\u00e9 Knowles-Carter\u2019s career primarily because it demonstrated her capacity to:\nA: Maintain the established sound and fanbase of Destiny's Child while pursuing individual projects.\nB: Successfully transition from a group artist to a globally recognized solo performer, achieving both critical acclaim and commercial success.\nC: Expand Destiny\u2019s Child's brand by releasing a solo album under her own name, leveraging existing marketing channels.\nD: Pioneer a new subgenre of R&B music, influencing a generation of subsequent artists with its innovative sound.\nExplanation: The text explicitly states that \"Dangerously in Love\" \"established her as a solo artist worldwide,\" and that it \"earned five Grammy Awards and featured the Billboard Hot 100 number-one singles.\" This indicates a successful transition to a solo career, marked by both critical and commercial success, rather than simply maintaining the Destiny\u2019s Child sound or brand.\nCorrect Answer: B\n</output_format>\n```",
    "question": "\"Dangerously in Love\" is strategically significant in Beyonc\u00e9 Knowles-Carter\u2019s career primarily because it demonstrated her capacity to:",
    "choices": {
      "A": "Maintain the established sound and fanbase of Destiny's Child while pursuing individual projects.",
      "B": "Successfully transition from a group artist to a globally recognized solo performer, achieving both critical acclaim and commercial success.",
      "C": "Expand Destiny\u2019s Child's brand by releasing a solo album under her own name, leveraging existing marketing channels.",
      "D": "Pioneer a new subgenre of R&B music, influencing a generation of subsequent artists with its innovative sound."
    },
    "answer": "B",
    "explanation": "The text explicitly states that \"Dangerously in Love\" \"established her as a solo artist worldwide,\" and that it \"earned five Grammy Awards and featured the Billboard Hot 100 number-one singles.\" This indicates a successful transition to a solo career, marked by both critical and commercial success, rather than simply maintaining the Destiny\u2019s Child sound or brand.",
    "question_token_count": 27,
    "answer_correctness_score": 10,
    "explanation_validity_score": 10,
    "question_clarity_score": 6,
    "question_difficulty_score": 5,
    "question_groundedness_score": 9,
    "avg_answer_token_count": 21
  },
  {
    "context": "Following their loss in the divisional round of the previous season's playoffs, the Denver Broncos underwent numerous coaching changes, including a mutual parting with head coach John Fox (who had won four divisional championships in his four years as Broncos head coach), and the hiring of Gary Kubiak as the new head coach. Under Kubiak, the Broncos planned to install a run-oriented offense with zone blocking to blend in with quarterback Peyton Manning's shotgun passing skills, but struggled with numerous changes and injuries to the offensive line, as well as Manning having his worst statistical season since his rookie year with the Indianapolis Colts in 1998, due to a plantar fasciitis injury in his heel that he had suffered since the summer, and the simple fact that Manning was getting old, as he turned 39 in the 2015 off-season. Although the team had a 7\u20130 start, Manning led the NFL in interceptions. In week 10, Manning suffered a partial tear of the plantar fasciitis in his left foot. He set the NFL's all-time record for career passing yards in this game, but was benched after throwing four interceptions in favor of backup quarterback Brock Osweiler, who took over as the starter for most of the remainder of the regular season. Osweiler was injured, however, leading to Manning's return during the Week 17 regular season finale, where the Broncos were losing 13\u20137 against the 4\u201311 San Diego Chargers, resulting in Manning re-claiming the starting quarterback position for the playoffs by leading the team to a key 27\u201320 win that enabled the team to clinch the number one overall AFC seed. Under defensive coordinator Wade Phillips, the Broncos' defense ranked number one in total yards allowed, passing yards allowed and sacks, and like the previous three seasons, the team has continued to set numerous individual, league and franchise records. With the defense carrying the team despite the issues with the offense, the Broncos finished the regular season with a 12\u20134 record and earned home-field advantage throughout the AFC playoffs.",
    "topic": "Detail the significance of the Week 17 game against the San Diego Chargers in determining the Broncos' playoff seeding and Peyton Manning's role.",
    "response": "<document_analysis>\n1. **Thoughtful Content Examination:** The context details the Denver Broncos' 2015 season, focusing on the transition from John Fox to Gary Kubiak, Peyton Manning's struggles with injury and age, the emergence of Brock Osweiler, and the crucial role of the defense. The Week 17 game against the San Diego Chargers is highlighted as pivotal for securing the number one AFC seed.\n2. **Concept Exploration:** The text reveals the interplay between offensive struggles (Manning's decline, offensive line injuries) and defensive strength. The Week 17 game isn\u2019t just about winning, but *how* they won\u2014Manning reclaiming the starting position and securing the seed. This highlights the psychological and strategic impact beyond simply the win itself.\n3. **Strategic Complexity Calibration:** Difficulty: 9/10. The question requires understanding the cascading effects of Manning's performance, Osweiler's injury, and the seeding implications, all within the context of a broader team dynamic. It's not a simple recall question.\n4. **Intentional Question Planning:** The question will focus on the strategic significance of the Week 17 game, probing the understanding of how it impacted both playoff positioning and Manning's role, going beyond simply stating that it was a win. The answer options will be designed to be plausible based on various interpretations of the text, testing the expert\u2019s ability to discern the most crucial outcome.\n</document_analysis>\n\n<output_format>\nQuestion: The Denver Broncos\u2019 Week 17 victory against the San Diego Chargers was strategically significant for reasons extending beyond simply securing a playoff berth. Which of the following best encapsulates the primary impact of this game on the Broncos\u2019 postseason trajectory?\nA: It allowed the Broncos to rest key defensive players in preparation for a less challenging first-round opponent.\nB: It solidified Brock Osweiler\u2019s position as the starting quarterback for the duration of the playoffs, providing offensive stability.\nC: It clinched the number one overall AFC seed, granting home-field advantage, and re-established Peyton Manning as the starting quarterback for the playoffs.\nD: It provided valuable game film of the Chargers\u2019 offensive schemes, aiding the Broncos\u2019 defensive preparations for a potential playoff rematch.\nExplanation: The text explicitly states the win \"enabled the team to clinch the number one overall AFC seed\" and that Manning \"re-claiming the starting quarterback position for the playoffs\" was a direct result of the game. This combination of factors \u2013 seeding and quarterback leadership \u2013 represents the most significant impact.\nCorrect Answer: C\n</output_format>",
    "question": "The Denver Broncos\u2019 Week 17 victory against the San Diego Chargers was strategically significant for reasons extending beyond simply securing a playoff berth. Which of the following best encapsulates the primary impact of this game on the Broncos\u2019 postseason trajectory?",
    "choices": {
      "A": "It allowed the Broncos to rest key defensive players in preparation for a less challenging first-round opponent.",
      "B": "It solidified Brock Osweiler\u2019s position as the starting quarterback for the duration of the playoffs, providing offensive stability.",
      "C": "It clinched the number one overall AFC seed, granting home-field advantage, and re-established Peyton Manning as the starting quarterback for the playoffs.",
      "D": "It provided valuable game film of the Chargers\u2019 offensive schemes, aiding the Broncos\u2019 defensive preparations for a potential playoff rematch."
    },
    "answer": "C",
    "explanation": "The text explicitly states the win \"enabled the team to clinch the number one overall AFC seed\" and that Manning \"re-claiming the starting quarterback position for the playoffs\" was a direct result of the game. This combination of factors \u2013 seeding and quarterback leadership \u2013 represents the most significant impact.",
    "question_token_count": 49,
    "answer_correctness_score": 10,
    "explanation_validity_score": 10,
    "question_clarity_score": 7,
    "question_difficulty_score": 6,
    "question_groundedness_score": 9,
    "avg_answer_token_count": 25
  },
  {
    "context": "Super Bowl 50 was an American football game to determine the champion of the National Football League (NFL) for the 2015 season. The American Football Conference (AFC) champion Denver Broncos defeated the National Football Conference (NFC) champion Carolina Panthers 24\u201310 to earn their third Super Bowl title. The game was played on February 7, 2016, at Levi's Stadium in the San Francisco Bay Area at Santa Clara, California. As this was the 50th Super Bowl, the league emphasized the \"golden anniversary\" with various gold-themed initiatives, as well as temporarily suspending the tradition of naming each Super Bowl game with Roman numerals (under which the game would have been known as \"Super Bowl L\"), so that the logo could prominently feature the Arabic numerals 50.",
    "topic": "Identify the teams that competed in Super Bowl 50 and the conference each represented.",
    "response": "```xml\n<document_analysis>\nThoughtful Content Examination: The context provides a concise overview of Super Bowl 50, outlining the competing teams, their respective conferences, and the outcome of the game. It also details some of the unique celebratory aspects of this particular Super Bowl, such as the gold theme and the temporary suspension of Roman numeral naming conventions.\n\nConcept Exploration: The core concepts revolve around the NFL championship game, conference affiliations (AFC and NFC), and the significance of Super Bowl 50 as a milestone event. Implicitly, the text highlights the importance of branding and marketing around major sporting events.\n\nStrategic Complexity Calibration: Difficulty: 7/10. While the information is directly stated, the question requires recall of two distinct pieces of information (teams and conferences) and their correct association. The distractor options will need to be carefully crafted to appear plausible.\n\nIntentional Question Planning: The question is designed to assess a domain expert\u2019s recall of key details related to a significant NFL event. It tests not just knowledge of the teams involved but also their understanding of the league's conference structure. The question's challenge lies in accurately pairing the teams with their corresponding conferences.\n</document_analysis>\n<output_format>\nQuestion: Which pairing accurately represents the teams that competed in Super Bowl 50 and the conference each team represented?\nA: New England Patriots (AFC) vs. Seattle Seahawks (NFC)\nB: Denver Broncos (AFC) vs. Carolina Panthers (NFC)\nC: Pittsburgh Steelers (AFC) vs. Arizona Cardinals (NFC)\nD: Green Bay Packers (NFC) vs. Kansas City Chiefs (AFC)\nExplanation: The text explicitly states that the Denver Broncos (AFC) defeated the Carolina Panthers (NFC) in Super Bowl 50.\nCorrect Answer: B\n</output_format>\n```",
    "question": "Which pairing accurately represents the teams that competed in Super Bowl 50 and the conference each team represented?",
    "choices": {
      "A": "New England Patriots (AFC) vs. Seattle Seahawks (NFC)",
      "B": "Denver Broncos (AFC) vs. Carolina Panthers (NFC)",
      "C": "Pittsburgh Steelers (AFC) vs. Arizona Cardinals (NFC)",
      "D": "Green Bay Packers (NFC) vs. Kansas City Chiefs (AFC)"
    },
    "answer": "B",
    "explanation": "The text explicitly states that the Denver Broncos (AFC) defeated the Carolina Panthers (NFC) in Super Bowl 50.",
    "question_token_count": 21,
    "answer_correctness_score": 10,
    "explanation_validity_score": 10,
    "question_clarity_score": 8,
    "question_difficulty_score": 4,
    "question_groundedness_score": 10,
    "avg_answer_token_count": 15
  },
  {
    "context": "All of Chopin's compositions include the piano. Most are for solo piano, though he also wrote two piano concertos, a few chamber pieces, and some songs to Polish lyrics. His keyboard style is highly individual and often technically demanding; his own performances were noted for their nuance and sensitivity. Chopin invented the concept of instrumental ballade. His major piano works also include mazurkas, waltzes, nocturnes, polonaises, \u00e9tudes, impromptus, scherzos, preludes and sonatas, some published only after his death. Influences on his compositional style include Polish folk music, the classical tradition of J. S. Bach, Mozart and Schubert, the music of all of whom he admired, as well as the Paris salons where he was a frequent guest. His innovations in style, musical form, and harmony, and his association of music with nationalism, were influential throughout and after the late Romantic period.",
    "topic": "Assess Chopin's innovations in style, musical form, and harmony.",
    "response": "<document_analysis>\n1. **Thoughtful Content Examination**: The text focuses on Chopin's compositional characteristics \u2013 his exclusive use of the piano, the types of pieces he wrote, his performance style, and influences on his work. It highlights his invention of the instrumental ballade and his impact on later musical periods.\n2. **Concept Exploration**: The text implies Chopin's originality lay not just in *what* he wrote, but *how* he wrote it\u2014his individual style, technical demands, and harmonic innovations. The mention of Polish folk music and salon culture suggests a blending of influences. The statement about nationalism is intriguing but not elaborated upon.\n3. **Strategic Complexity Calibration**: Difficulty: 8/10. The question needs to go beyond simply identifying Chopin\u2019s forms (mazurkas, etc.) and delve into the nature of his innovations, requiring understanding of musical style, form, and harmony.\n4. **Intentional Question Planning**: The question will focus on Chopin\u2019s innovations, requiring the examinee to synthesize information about his style, form, and harmony, and their influence on the Romantic period. The distractors will center around elements mentioned in the text but aren't *the* innovations themselves.\n</document_analysis>\n\n<output_format>\nQuestion: Chopin's enduring influence throughout the late Romantic period stemmed most directly from advancements in which of the following musical elements?\nA: His adoption of established classical forms like the sonata and concerto, demonstrating a commitment to traditional structure.\nB: His unique synthesis of Polish folk idioms, Parisian salon aesthetics, and novel approaches to style, form, and harmonic language.\nC: His pioneering use of the piano as a solo instrument, effectively establishing a new concert repertoire.\nD: His focused compositional output consisting primarily of mazurkas, waltzes, and nocturnes, creating a distinct nationalistic sound.\nExplanation: The text explicitly states that Chopin's \"innovations in style, musical form, and harmony...were influential throughout and after the late Romantic period.\" This encompasses the blending of influences mentioned (Polish folk music, salon culture) and his novel approach to musical language.\nCorrect Answer: B\n</output_format>",
    "question": "Chopin's enduring influence throughout the late Romantic period stemmed most directly from advancements in which of the following musical elements?",
    "choices": {
      "A": "His adoption of established classical forms like the sonata and concerto, demonstrating a commitment to traditional structure.",
      "B": "His unique synthesis of Polish folk idioms, Parisian salon aesthetics, and novel approaches to style, form, and harmonic language.",
      "C": "His pioneering use of the piano as a solo instrument, effectively establishing a new concert repertoire.",
      "D": "His focused compositional output consisting primarily of mazurkas, waltzes, and nocturnes, creating a distinct nationalistic sound."
    },
    "answer": "B",
    "explanation": "The text explicitly states that Chopin's \"innovations in style, musical form, and harmony...were influential throughout and after the late Romantic period.\" This encompasses the blending of influences mentioned (Polish folk music, salon culture) and his novel approach to musical language.",
    "question_token_count": 25,
    "answer_correctness_score": 10,
    "explanation_validity_score": 10,
    "question_clarity_score": 8,
    "question_difficulty_score": 7,
    "question_groundedness_score": 8,
    "avg_answer_token_count": 24
  },
  {
    "context": "The Broncos took an early lead in Super Bowl 50 and never trailed. Newton was limited by Denver's defense, which sacked him seven times and forced him into three turnovers, including a fumble which they recovered for a touchdown. Denver linebacker Von Miller was named Super Bowl MVP, recording five solo tackles, 2\u00bd sacks, and two forced fumbles.",
    "topic": "Evaluate the significance of Von Miller's individual performance, specifically his sacks and forced fumbles, in securing the Broncos' victory.",
    "response": "```xml\n<document_analysis>\nThoughtful Content Examination: The context focuses on the Denver Broncos' victory in Super Bowl 50, emphasizing the defensive performance against Cam Newton and the pivotal role of Von Miller. Key details include the number of sacks (7 total, 2.5 by Miller), turnovers (3), and Miller's individual statistics (5 solo tackles, 2.5 sacks, 2 forced fumbles) leading to his MVP award.\n\nConcept Exploration: The context highlights the impact of individual performance (Miller's) on team success. It implicitly demonstrates how disruptive defensive plays (sacks, forced fumbles) can significantly influence the outcome of a high-stakes game. The recovery of a fumble for a touchdown underscores the value of creating and capitalizing on turnovers.\n\nStrategic Complexity Calibration: Difficulty: 8/10. The question requires understanding of the statistical impact of individual defensive plays on game outcome and the criteria for awarding MVP. It\u2019s not a simple recall question but requires linking Miller's stats to the overall game context.\n\nIntentional Question Planning: The question aims to assess understanding of the correlation between individual defensive dominance and team victory, specifically focusing on how Miller's disruptive plays contributed to the Broncos' success. It forces a consideration of not just the quantity of his stats, but also their qualitative impact (e.g., forced fumbles leading to a touchdown).\n</document_analysis>\n\n<output_format>\nQuestion: In the context of Super Bowl 50, which singular defensive contribution most directly translated to a scoring opportunity for the Denver Broncos?\nA: The seven total sacks applied to Cam Newton throughout the game.\nB: Von Miller's 2.5 sacks, disrupting the opposing team\u2019s offensive rhythm.\nC: The recovery of a fumble forced by the Denver defense, resulting in a touchdown.\nD: Cam Newton\u2019s three total turnovers, limiting his offensive effectiveness.\nExplanation: The text explicitly states that the Broncos recovered a fumble for a touchdown, directly resulting in a scoring opportunity. While the sacks and turnovers were impactful, the fumble recovery is the only option that directly led to points.\nCorrect Answer: C\n</output_format>\n```",
    "question": "In the context of Super Bowl 50, which singular defensive contribution most directly translated to a scoring opportunity for the Denver Broncos?",
    "choices": {
      "A": "The seven total sacks applied to Cam Newton throughout the game.",
      "B": "Von Miller's 2.5 sacks, disrupting the opposing team\u2019s offensive rhythm.",
      "C": "The recovery of a fumble forced by the Denver defense, resulting in a touchdown.",
      "D": "Cam Newton\u2019s three total turnovers, limiting his offensive effectiveness."
    },
    "answer": "C",
    "explanation": "The text explicitly states that the Broncos recovered a fumble for a touchdown, directly resulting in a scoring opportunity. While the sacks and turnovers were impactful, the fumble recovery is the only option that directly led to points.",
    "question_token_count": 26,
    "answer_correctness_score": 10,
    "explanation_validity_score": 10,
    "question_clarity_score": 6,
    "question_difficulty_score": 7,
    "question_groundedness_score": 8,
    "avg_answer_token_count": 16
  },
  {
    "context": "Peyton Manning became the first quarterback ever to lead two different teams to multiple Super Bowls. He is also the oldest quarterback ever to play in a Super Bowl at age 39. The past record was held by John Elway, who led the Broncos to victory in Super Bowl XXXIII at age 38 and is currently Denver's Executive Vice President of Football Operations and General Manager.",
    "topic": "Peyton Manning's unique achievement of leading two different teams to multiple Super Bowl appearances.",
    "response": "```xml\n<document_analysis>\n1. **Thoughtful Content Examination:** The text focuses on Peyton Manning's unique accomplishment of leading two different NFL teams to multiple Super Bowl appearances and his record as the oldest quarterback to play in a Super Bowl. It also briefly mentions John Elway's previous record and current role with the Broncos.\n2. **Concept Exploration:** The core concept is Manning\u2019s statistical outlier status in NFL history. The text subtly highlights the difficulty of quarterback transitions and sustained success across different franchises. It also implicitly acknowledges the generational shift in NFL quarterbacks, comparing Manning to Elway.\n3. **Strategic Complexity Calibration:** Difficulty: 8/10. The question needs to go beyond simply recalling Manning's achievement and delve into the implications of his success relative to the historical context of quarterback play.\n4. **Intentional Question Planning:** The question will focus on the significance of Manning's accomplishment in the context of quarterback mobility and team building, testing the domain expert\u2019s understanding of NFL history and the challenges of quarterback transitions. The question will require an understanding of the broader trends in NFL quarterback play.\n</document_analysis>\n<output_format>\nQuestion: Peyton Manning's achievement of leading two different franchises to multiple Super Bowl appearances is most significantly notable considering the historical trend of quarterback success being largely predicated on sustained tenure with a single team; what does this suggest about Manning's unique skill set?\nA: Manning\u2019s success indicates a diminished emphasis on complex offensive schemes and a greater reliance on individual quarterback athleticism.\nB: Manning\u2019s success demonstrates an exceptional ability to rapidly assimilate into new team cultures and effectively implement a passing-focused offense.\nC: Manning\u2019s success reveals a fundamental shift in NFL team-building strategies, prioritizing quarterback acquisitions over player development.\nD: Manning\u2019s success highlights the increasing importance of defensive coordination in neutralizing opposing quarterbacks.\nExplanation: Manning's ability to succeed with both the Colts and the Broncos is remarkable because quarterbacks typically require years to build rapport with receivers and master a team's offensive system. His success implies a unique capacity to quickly learn and execute within different environments, and to impose his system on new teams.\nCorrect Answer: B\n</output_format>\n```",
    "question": "Peyton Manning's achievement of leading two different franchises to multiple Super Bowl appearances is most significantly notable considering the historical trend of quarterback success being largely predicated on sustained tenure with a single team; what does this suggest about Manning's unique skill set?",
    "choices": {
      "A": "Manning\u2019s success indicates a diminished emphasis on complex offensive schemes and a greater reliance on individual quarterback athleticism.",
      "B": "Manning\u2019s success demonstrates an exceptional ability to rapidly assimilate into new team cultures and effectively implement a passing-focused offense.",
      "C": "Manning\u2019s success reveals a fundamental shift in NFL team-building strategies, prioritizing quarterback acquisitions over player development.",
      "D": "Manning\u2019s success highlights the increasing importance of defensive coordination in neutralizing opposing quarterbacks."
    },
    "answer": "B",
    "explanation": "Manning's ability to succeed with both the Colts and the Broncos is remarkable because quarterbacks typically require years to build rapport with receivers and master a team's offensive system. His success implies a unique capacity to quickly learn and execute within different environments, and to impose his system on new teams.",
    "question_token_count": 51,
    "answer_correctness_score": 10,
    "explanation_validity_score": 10,
    "question_clarity_score": 6,
    "question_difficulty_score": 8,
    "question_groundedness_score": 5,
    "avg_answer_token_count": 22
  },
  {
    "context": "Despite waiving longtime running back DeAngelo Williams and losing top wide receiver Kelvin Benjamin to a torn ACL in the preseason, the Carolina Panthers had their best regular season in franchise history, becoming the seventh team to win at least 15 regular season games since the league expanded to a 16-game schedule in 1978. Carolina started the season 14\u20130, not only setting franchise records for the best start and the longest single-season winning streak, but also posting the best start to a season by an NFC team in NFL history, breaking the 13\u20130 record previously shared with the 2009 New Orleans Saints and the 2011 Green Bay Packers. With their NFC-best 15\u20131 regular season record, the Panthers clinched home-field advantage throughout the NFC playoffs for the first time in franchise history. Ten players were selected to the Pro Bowl (the most in franchise history) along with eight All-Pro selections.",
    "topic": "The 2015 Carolina Panthers season saw a franchise-record ten players selected to the Pro Bowl.",
    "response": "```xml\n<document_analysis>\nThoughtful Content Examination: The text describes the Carolina Panthers' exceptionally successful 2015 season, highlighting key achievements like a 15-1 record, a 14-0 start, and franchise-best Pro Bowl selections. The context also notes significant player losses (Williams, Benjamin) that did not hinder their performance.\n\nConcept Exploration: The passage implicitly demonstrates resilience and team depth. It also touches on historical context within the NFL, referencing records held by other teams. The statistical benchmarks (15-1, 14-0) are significant for evaluating team performance.\n\nStrategic Complexity Calibration: Difficulty: 8/10. The question will focus on the interplay between overcoming adversity (player losses) and achieving record-breaking success, requiring an understanding of NFL team dynamics and historical context.\n\nIntentional Question Planning: The question will probe the correlation between roster changes and team performance, challenging the assumption that key player losses automatically equate to diminished results. It aims to assess whether the domain expert understands the factors contributing to a successful NFL season beyond just individual star power.\n</document_analysis>\n\n<output_format>\nQuestion: Considering the Carolina Panthers' 2015 season, which included the loss of key players before the regular season began, what does the team's ultimate success most strongly suggest about factors crucial to achieving a high-performing NFL team?\nA: Exceptional individual talent consistently outweighs the impact of pre-season roster setbacks.\nB: Strategic team depth and adaptability are often more impactful than relying heavily on a few star players.\nC: A strong defensive strategy is the primary determinant of success in the modern NFL.\nD: Consistent coaching stability is the most significant factor in overcoming early-season adversity.\nExplanation: The Panthers overcame the loss of DeAngelo Williams and Kelvin Benjamin to achieve a 15-1 record and franchise-best Pro Bowl selections. This demonstrates that team depth and adaptability were crucial to their success, rather than relying solely on individual star power.\nCorrect Answer: B\n</output_format>\n```",
    "question": "Considering the Carolina Panthers' 2015 season, which included the loss of key players before the regular season began, what does the team's ultimate success most strongly suggest about factors crucial to achieving a high-performing NFL team?",
    "choices": {
      "A": "Exceptional individual talent consistently outweighs the impact of pre-season roster setbacks.",
      "B": "Strategic team depth and adaptability are often more impactful than relying heavily on a few star players.",
      "C": "A strong defensive strategy is the primary determinant of success in the modern NFL.",
      "D": "Consistent coaching stability is the most significant factor in overcoming early-season adversity."
    },
    "answer": "B",
    "explanation": "The Panthers overcame the loss of DeAngelo Williams and Kelvin Benjamin to achieve a 15-1 record and franchise-best Pro Bowl selections. This demonstrates that team depth and adaptability were crucial to their success, rather than relying solely on individual star power.",
    "question_token_count": 44,
    "answer_correctness_score": 9,
    "explanation_validity_score": 9,
    "question_clarity_score": 6,
    "question_difficulty_score": 8,
    "question_groundedness_score": 9,
    "avg_answer_token_count": 17
  },
  {
    "context": "The Panthers used the San Jose State practice facility and stayed at the San Jose Marriott. The Broncos practiced at Stanford University and stayed at the Santa Clara Marriott.",
    "topic": "Determine which team practiced at Stanford University.",
    "response": "```xml\n<document_analysis>\n1. **Thoughtful Content Examination:** The context provides information about the practice facilities and hotels used by two teams, the Panthers and the Broncos. The key information is the location of their practices: Panthers at San Jose State, Broncos at Stanford University.\n2. **Concept Exploration:** The question topic asks about which team practiced at Stanford. This is a direct recall question, but the challenge lies in accurately remembering which team was associated with Stanford from the provided text.\n3. **Strategic Complexity Calibration:** Difficulty: 2/10. While the information is directly stated, the question requires accurate recall. It is intentionally kept simple to evaluate basic comprehension.\n4. **Intentional Question Planning:** The question tests the ability to extract specific information from a short text.\n</document_analysis>\n<output_format>\nQuestion: Which team utilized Stanford University as their practice location?\nA: Panthers\nB: Broncos\nC: 49ers\nD: Sharks\nExplanation: The text explicitly states, \"The Broncos practiced at Stanford University and stayed at the Santa Clara Marriott.\"\nCorrect Answer: B\n</output_format>\n```",
    "question": "Which team utilized Stanford University as their practice location?",
    "choices": {
      "A": "Panthers",
      "B": "Broncos",
      "C": "49ers",
      "D": "Sharks"
    },
    "answer": "B",
    "explanation": "The text explicitly states, \"The Broncos practiced at Stanford University and stayed at the Santa Clara Marriott.\"",
    "question_token_count": 11,
    "answer_correctness_score": 10,
    "explanation_validity_score": 10,
    "question_clarity_score": 1,
    "question_difficulty_score": 1,
    "question_groundedness_score": 10,
    "avg_answer_token_count": 3
  },
  {
    "context": "Victoria's father was Prince Edward, Duke of Kent and Strathearn, the fourth son of the reigning King of the United Kingdom, George III. Until 1817, Edward's niece, Princess Charlotte of Wales, was the only legitimate grandchild of George III. Her death in 1817 precipitated a succession crisis that brought pressure on the Duke of Kent and his unmarried brothers to marry and have children. In 1818 he married Princess Victoria of Saxe-Coburg-Saalfeld, a widowed German princess with two children\u2014Carl (1804\u20131856) and Feodora (1807\u20131872)\u2014by her first marriage to the Prince of Leiningen. Her brother Leopold was Princess Charlotte's widower. The Duke and Duchess of Kent's only child, Victoria, was born at 4.15 a.m. on 24 May 1819 at Kensington Palace in London.",
    "topic": "Explain how the death of Princess Charlotte of Wales created pressure on the Duke of Kent and his brothers.",
    "response": "<document_analysis>\n1. **Thoughtful Content Examination:** The text segment details the lineage of Queen Victoria and the succession crisis triggered by the death of Princess Charlotte. The core idea is that Charlotte's death created urgency for the Duke of Kent and his brothers to secure the line of succession.\n2. **Concept Exploration:** The context implicitly highlights the importance of royal lineage and the societal pressures surrounding producing an heir. The death of the sole legitimate grandchild of the King created a precarious situation, necessitating swift action from the remaining potential heirs. The strategic marriages that followed underscore the political dimension of royal procreation.\n3. **Strategic Complexity Calibration:** Difficulty: 8/10. The question requires understanding the implications of a succession crisis and how it specifically impacted the Duke of Kent and his brothers. It's not a simple recall question but necessitates comprehension of the broader context.\n4. **Intentional Question Planning:** The question is designed to assess understanding of the direct consequences of Princess Charlotte's death and how it altered the priorities of the royal family. It moves beyond simply stating the fact of her death and probes for an understanding of the resulting pressure.\n</document_analysis>\n\n<output_format>\nQuestion: The untimely death of Princess Charlotte of Wales in 1817 most directly instigated which subsequent action within the British Royal Family?\nA: The immediate abdication of King George III due to grief and a perceived lack of suitable heirs.\nB: A concentrated effort by the Duke of Kent and his unmarried brothers to contract marriages and produce legitimate heirs.\nC: The implementation of new laws altering the rules of succession to prioritize collateral lines over direct descendants.\nD: A formal investigation into the circumstances surrounding Princess Charlotte\u2019s death to determine potential foul play.\nExplanation: The text states that Princess Charlotte\u2019s death \u201cprecipitated a succession crisis that brought pressure on the Duke of Kent and his unmarried brothers to marry and have children.\u201d This directly links her death to the urgency for the remaining royals to secure the succession.\nCorrect Answer: B\n</output_format>",
    "question": "The untimely death of Princess Charlotte of Wales in 1817 most directly instigated which subsequent action within the British Royal Family?",
    "choices": {
      "A": "The immediate abdication of King George III due to grief and a perceived lack of suitable heirs.",
      "B": "A concentrated effort by the Duke of Kent and his unmarried brothers to contract marriages and produce legitimate heirs.",
      "C": "The implementation of new laws altering the rules of succession to prioritize collateral lines over direct descendants.",
      "D": "A formal investigation into the circumstances surrounding Princess Charlotte\u2019s death to determine potential foul play."
    },
    "answer": "B",
    "explanation": "The text states that Princess Charlotte\u2019s death \u201cprecipitated a succession crisis that brought pressure on the Duke of Kent and his unmarried brothers to marry and have children.\u201d This directly links her death to the urgency for the remaining royals to secure the succession.",
    "question_token_count": 29,
    "answer_correctness_score": 10,
    "explanation_validity_score": 10,
    "question_clarity_score": 8,
    "question_difficulty_score": 6,
    "question_groundedness_score": 10,
    "avg_answer_token_count": 20
  },
  {
    "context": "The league announced on October 16, 2012, that the two finalists were Sun Life Stadium and Levi's Stadium. The South Florida/Miami area has previously hosted the event 10 times (tied for most with New Orleans), with the most recent one being Super Bowl XLIV in 2010. The San Francisco Bay Area last hosted in 1985 (Super Bowl XIX), held at Stanford Stadium in Stanford, California, won by the home team 49ers. The Miami bid depended on whether the stadium underwent renovations. However, on May 3, 2013, the Florida legislature refused to approve the funding plan to pay for the renovations, dealing a significant blow to Miami's chances.",
    "topic": "The last time the San Francisco Bay Area hosted a Super Bowl prior to the bidding process discussed, including the stadium and winning team.",
    "response": "```xml\n<document_analysis>\nThoughtful Content Examination: The context discusses the bidding process for a Super Bowl between Sun Life Stadium and Levi's Stadium, and provides historical information about previous Super Bowl locations. It specifically mentions the last time the San Francisco Bay Area hosted a Super Bowl and details surrounding Miami's bid. The central idea revolves around the competition to host a Super Bowl and the factors influencing the decision.\n\nConcept Exploration: The text implicitly highlights the importance of stadium infrastructure and political funding in securing Super Bowl bids. It also shows the significance of home-field advantage, as the 49ers won the Super Bowl when it was held in the Bay Area in 1985.\n\nStrategic Complexity Calibration: Difficulty: 8/10. The question requires recalling a specific historical detail (year and location) and connecting it to the winning team. It's not a simple recall question, as it tests knowledge of Super Bowl history within the context of a bidding process.\n\nIntentional Question Planning: The question directly addresses the topic, demanding precise recall of a specific event. The distractors are designed to be plausible, requiring a strong understanding of Super Bowl history and the provided text.\n</document_analysis>\n<output_format>\nQuestion: In which year did the San Francisco Bay Area last host a Super Bowl prior to the bidding process detailed, and which team secured victory during that event?\nA: 1981, Pittsburgh Steelers\nB: 1985, San Francisco 49ers\nC: 1990, New York Giants\nD: 1979, Dallas Cowboys\nExplanation: The text explicitly states, \u201cThe San Francisco Bay Area last hosted in 1985 (Super Bowl XIX), held at Stanford Stadium in Stanford, California, won by the home team 49ers.\u201d\nCorrect Answer: B\n</output_format>\n```",
    "question": "In which year did the San Francisco Bay Area last host a Super Bowl prior to the bidding process detailed, and which team secured victory during that event?",
    "choices": {
      "A": "1981, Pittsburgh Steelers",
      "B": "1985, San Francisco 49ers",
      "C": "1990, New York Giants",
      "D": "1979, Dallas Cowboys"
    },
    "answer": "B",
    "explanation": "The text explicitly states, \u201cThe San Francisco Bay Area last hosted in 1985 (Super Bowl XIX), held at Stanford Stadium in Stanford, California, won by the home team 49ers.\u201d",
    "question_token_count": 31,
    "answer_correctness_score": 10,
    "explanation_validity_score": 10,
    "question_clarity_score": 8,
    "question_difficulty_score": 6,
    "question_groundedness_score": 10,
    "avg_answer_token_count": 7
  },
  {
    "context": "In 1887, the British Empire celebrated Victoria's Golden Jubilee. Victoria marked the fiftieth anniversary of her accession on 20 June with a banquet to which 50 kings and princes were invited. The following day, she participated in a procession and attended a thanksgiving service in Westminster Abbey. By this time, Victoria was once again extremely popular. Two days later on 23 June, she engaged two Indian Muslims as waiters, one of whom was Abdul Karim. He was soon promoted to \"Munshi\": teaching her Hindustani, and acting as a clerk. Her family and retainers were appalled, and accused Abdul Karim of spying for the Muslim Patriotic League, and biasing the Queen against the Hindus. Equerry Frederick Ponsonby (the son of Sir Henry) discovered that the Munshi had lied about his parentage, and reported to Lord Elgin, Viceroy of India, \"the Munshi occupies very much the same position as John Brown used to do.\" Victoria dismissed their complaints as racial prejudice. Abdul Karim remained in her service until he returned to India with a pension on her death.",
    "topic": "Analyze the role of Frederick Ponsonby and Lord Elgin in the controversy surrounding Abdul Karim.",
    "response": "```xml\n<document_analysis>\nThoughtful Content Examination: The text details the introduction of Abdul Karim into Queen Victoria's service and the subsequent controversy surrounding his position. Key figures include Abdul Karim himself, Queen Victoria, Frederick Ponsonby, and Lord Elgin. The core issue revolves around accusations of manipulation, racial prejudice, and concerns about Karim's influence over the Queen. The comparison to John Brown is also significant, suggesting a similar level of personal intimacy and trust.\n\nConcept Exploration: The text touches upon themes of colonialism, racial dynamics within the British Empire, and the personal relationships of Queen Victoria. It also implicitly raises questions about power, trust, and the potential for manipulation within a royal court. The role of intermediaries like Ponsonby and Elgin in managing the situation and conveying concerns to the Queen is crucial.\n\nStrategic Complexity Calibration: Difficulty: 8/10. The question will focus on the nuanced relationship between Ponsonby, Elgin, and the Queen regarding the controversy, requiring an understanding of their roles and the implications of their actions. It's not a simple recall question, but requires inference and understanding of the power dynamics at play.\n\nIntentional Question Planning: The question will aim to assess the understanding of how Ponsonby and Elgin attempted to address the concerns surrounding Abdul Karim and the Queen\u2019s reaction to their intervention. It will require recognizing the limitations of their influence and the Queen\u2019s strong will.\n</document_analysis>\n\n<output_format>\nQuestion: Considering the concerns raised by Frederick Ponsonby regarding Abdul Karim, what best characterizes Lord Elgin's primary role in the ensuing situation, as indicated by Ponsonby\u2019s report to him?\nA: Elgin actively supported Ponsonby\u2019s investigation and implemented measures to remove Karim from Victoria\u2019s service.\nB: Elgin served primarily as a conduit for Ponsonby\u2019s findings, acknowledging the situation but ultimately deferring to Victoria\u2019s judgment.\nC: Elgin independently investigated Karim\u2019s background and corroborated Ponsonby\u2019s concerns, directly confronting Victoria with his findings.\nD: Elgin dismissed Ponsonby\u2019s report as unfounded and actively shielded Karim from further scrutiny, reinforcing his position at court.\nExplanation: Ponsonby reported his findings *to* Lord Elgin, and the text states Victoria dismissed complaints as racial prejudice. This implies Elgin relayed the information but Victoria overrode any potential action, making B the most accurate characterization of Elgin's role. The text does not support any active intervention by Elgin.\nCorrect Answer: B\n</output_format>\n```",
    "question": "Considering the concerns raised by Frederick Ponsonby regarding Abdul Karim, what best characterizes Lord Elgin's primary role in the ensuing situation, as indicated by Ponsonby\u2019s report to him?",
    "choices": {
      "A": "Elgin actively supported Ponsonby\u2019s investigation and implemented measures to remove Karim from Victoria\u2019s service.",
      "B": "Elgin served primarily as a conduit for Ponsonby\u2019s findings, acknowledging the situation but ultimately deferring to Victoria\u2019s judgment.",
      "C": "Elgin independently investigated Karim\u2019s background and corroborated Ponsonby\u2019s concerns, directly confronting Victoria with his findings.",
      "D": "Elgin dismissed Ponsonby\u2019s report as unfounded and actively shielded Karim from further scrutiny, reinforcing his position at court."
    },
    "answer": "B",
    "explanation": "Ponsonby reported his findings *to* Lord Elgin, and the text states Victoria dismissed complaints as racial prejudice. This implies Elgin relayed the information but Victoria overrode any potential action, making B the most accurate characterization of Elgin's role. The text does not support any active intervention by Elgin.",
    "question_token_count": 39,
    "answer_correctness_score": 9,
    "explanation_validity_score": 9,
    "question_clarity_score": 6,
    "question_difficulty_score": 6,
    "question_groundedness_score": 7,
    "avg_answer_token_count": 25
  },
  {
    "context": "It was temporarily under the control of the Tibetan empire and Chinese from 650\u2013680 and then under the control of the Umayyads in 710. The Samanid Empire, 819 to 999, restored Persian control of the region and enlarged the cities of Samarkand and Bukhara (both cities are today part of Uzbekistan) which became the cultural centers of Iran and the region was known as Khorasan. The Kara-Khanid Khanate conquered Transoxania (which corresponds approximately with modern-day Uzbekistan, Tajikistan, southern Kyrgyzstan and southwest Kazakhstan) and ruled between 999\u20131211. Their arrival in Transoxania signaled a definitive shift from Iranian to Turkic predominance in Central Asia, but gradually the Kara-khanids became assimilated into the Perso-Arab Muslim culture of the region.",
    "topic": "Evaluate the long-term consequences of the shift from Iranian to Turkic predominance in Central Asia following the Kara-Khanid conquest.",
    "response": "```xml\n<document_analysis>\nThoughtful Content Examination: The text describes a historical shift in Central Asia, specifically the transition from Persian (Iranian) control under the Samanid Empire to Turkic control with the Kara-Khanid Khanate. It also notes a subsequent cultural assimilation of the Kara-Khanids. The key theme is a change in political and cultural dominance.\n\nConcept Exploration: The text implies that while political control shifted, the underlying culture remained resilient, eventually absorbing the new rulers. This raises questions about the nature of cultural dominance and the processes of assimilation. The significance of Khorasan as a cultural center before the Kara-Khanids is also important. The time frame is also important: nearly 200 years of Kara-Khanid rule.\n\nStrategic Complexity Calibration: Difficulty: 8/10. The question requires understanding of long-term cultural and political dynamics, not just the immediate conquest. It requires inferring consequences beyond what is explicitly stated.\n\nIntentional Question Planning: The question will focus on the *long-term* consequences of the Turkic shift, prompting a consideration of how the region evolved *after* the initial conquest, focusing on the interplay between political power and cultural influence. The question will be framed to require a nuanced understanding of cultural assimilation.\n</document_analysis>\n\n<output_format>\nQuestion: Considering the Kara-Khanid conquest of Transoxania and the subsequent assimilation of the Kara-Khanids into Perso-Arab Muslim culture, what was the most significant long-term consequence of this period for the cultural landscape of Central Asia?\nA: A complete and permanent replacement of Persian cultural elements with Turkic traditions.\nB: A synthesis of Turkic and Perso-Arab cultural elements, leading to a hybrid cultural identity.\nC: A stagnation of cultural development due to the disruption caused by the conquest.\nD: A resurgence of pre-Islamic Central Asian shamanistic beliefs, facilitated by Turkic patronage.\nExplanation: The text states the Kara-Khanids \"gradually became assimilated into the Perso-Arab Muslim culture of the region.\" This indicates a blending rather than a replacement or stagnation of culture, making B the correct answer. Options A, C, and D are unsupported by the provided text.\nCorrect Answer: B\n</output_format>\n```",
    "question": "Considering the Kara-Khanid conquest of Transoxania and the subsequent assimilation of the Kara-Khanids into Perso-Arab Muslim culture, what was the most significant long-term consequence of this period for the cultural landscape of Central Asia?",
    "choices": {
      "A": "A complete and permanent replacement of Persian cultural elements with Turkic traditions.",
      "B": "A synthesis of Turkic and Perso-Arab cultural elements, leading to a hybrid cultural identity.",
      "C": "A stagnation of cultural development due to the disruption caused by the conquest.",
      "D": "A resurgence of pre-Islamic Central Asian shamanistic beliefs, facilitated by Turkic patronage."
    },
    "answer": "B",
    "explanation": "The text states the Kara-Khanids \"gradually became assimilated into the Perso-Arab Muslim culture of the region.\" This indicates a blending rather than a replacement or stagnation of culture, making B the correct answer. Options A, C, and D are unsupported by the provided text.",
    "question_token_count": 49,
    "answer_correctness_score": 10,
    "explanation_validity_score": 10,
    "question_clarity_score": 8,
    "question_difficulty_score": 8,
    "question_groundedness_score": 10,
    "avg_answer_token_count": 18
  },
  {
    "context": "Following their loss in the divisional round of the previous season's playoffs, the Denver Broncos underwent numerous coaching changes, including a mutual parting with head coach John Fox (who had won four divisional championships in his four years as Broncos head coach), and the hiring of Gary Kubiak as the new head coach. Under Kubiak, the Broncos planned to install a run-oriented offense with zone blocking to blend in with quarterback Peyton Manning's shotgun passing skills, but struggled with numerous changes and injuries to the offensive line, as well as Manning having his worst statistical season since his rookie year with the Indianapolis Colts in 1998, due to a plantar fasciitis injury in his heel that he had suffered since the summer, and the simple fact that Manning was getting old, as he turned 39 in the 2015 off-season. Although the team had a 7\u20130 start, Manning led the NFL in interceptions. In week 10, Manning suffered a partial tear of the plantar fasciitis in his left foot. He set the NFL's all-time record for career passing yards in this game, but was benched after throwing four interceptions in favor of backup quarterback Brock Osweiler, who took over as the starter for most of the remainder of the regular season. Osweiler was injured, however, leading to Manning's return during the Week 17 regular season finale, where the Broncos were losing 13\u20137 against the 4\u201311 San Diego Chargers, resulting in Manning re-claiming the starting quarterback position for the playoffs by leading the team to a key 27\u201320 win that enabled the team to clinch the number one overall AFC seed. Under defensive coordinator Wade Phillips, the Broncos' defense ranked number one in total yards allowed, passing yards allowed and sacks, and like the previous three seasons, the team has continued to set numerous individual, league and franchise records. With the defense carrying the team despite the issues with the offense, the Broncos finished the regular season with a 12\u20134 record and earned home-field advantage throughout the AFC playoffs.",
    "topic": "Evaluate the impact of the coaching change from John Fox to Gary Kubiak on the Denver Broncos' performance and strategic approach.",
    "response": "<document_analysis>\n1. **Thoughtful Content Examination:** The text details the transition from John Fox to Gary Kubiak as the Denver Broncos' head coach and the subsequent challenges faced during the 2015 season. Key themes include the attempted shift in offensive strategy, Peyton Manning's decline due to age and injury, and the surprising emergence of a dominant defense under Wade Phillips. The team's success despite offensive struggles is a central point.\n\n2. **Concept Exploration:** The context highlights the interplay between coaching strategy, player performance (particularly Manning's), and team success. It implicitly raises questions about the adaptability of a veteran quarterback to a new offensive scheme and the importance of defensive strength in compensating for offensive weaknesses. The narrative arc of Manning being benched, then returning to lead the team to a playoff berth, is particularly noteworthy.\n\n3. **Strategic Complexity Calibration:** Difficulty: 9/10. This question targets a deep understanding of football strategy, player dynamics, and the ability to synthesize information about multiple factors influencing team performance. It requires understanding the nuances of offensive and defensive football, and the strategic implications of player injuries and age.\n\n4. **Intentional Question Planning:** The question aims to assess the expert's ability to critically evaluate the impact of coaching changes on a team's overall performance, considering both intended strategies and unforeseen circumstances. It tests their comprehension of how different facets of a football team (offense, defense, quarterback play) interact to determine success.\n</document_analysis>\n\n<output_format>\nQuestion: Considering the Denver Broncos\u2019 2015 season following Gary Kubiak\u2019s hiring, which strategic adaptation proved most critical in overcoming the offensive struggles and ultimately securing a top AFC playoff seed?\nA: A complete abandonment of the planned run-oriented offense in favor of a pass-heavy scheme tailored to Peyton Manning\u2019s remaining strengths.\nB: The implementation of a high-powered, vertically-oriented passing attack designed to capitalize on Manning\u2019s arm talent despite his declining mobility.\nC: The emergence of a statistically dominant defense, ranking first in total yards allowed, passing yards allowed, and sacks, effectively compensating for offensive inconsistencies.\nD: A mid-season shift to a more conservative offensive approach focused on minimizing turnovers and controlling the clock, prioritizing field position.\nExplanation: The text explicitly states that \u201cUnder defensive coordinator Wade Phillips, the Broncos\u2019 defense ranked number one in total yards allowed, passing yards allowed and sacks\u2026 With the defense carrying the team despite the issues with the offense, the Broncos finished the regular season with a 12\u20134 record\u2026\u201d This demonstrates that the defense was the key factor in the team's success despite the offensive challenges.\nCorrect Answer: C\n</output_format>",
    "question": "Considering the Denver Broncos\u2019 2015 season following Gary Kubiak\u2019s hiring, which strategic adaptation proved most critical in overcoming the offensive struggles and ultimately securing a top AFC playoff seed?",
    "choices": {
      "A": "A complete abandonment of the planned run-oriented offense in favor of a pass-heavy scheme tailored to Peyton Manning\u2019s remaining strengths.",
      "B": "The implementation of a high-powered, vertically-oriented passing attack designed to capitalize on Manning\u2019s arm talent despite his declining mobility.",
      "C": "The emergence of a statistically dominant defense, ranking first in total yards allowed, passing yards allowed, and sacks, effectively compensating for offensive inconsistencies.",
      "D": "A mid-season shift to a more conservative offensive approach focused on minimizing turnovers and controlling the clock, prioritizing field position."
    },
    "answer": "C",
    "explanation": "The text explicitly states that \u201cUnder defensive coordinator Wade Phillips, the Broncos\u2019 defense ranked number one in total yards allowed, passing yards allowed and sacks\u2026 With the defense carrying the team despite the issues with the offense, the Broncos finished the regular season with a 12\u20134 record\u2026\u201d This demonstrates that the defense was the key factor in the team's success despite the offensive challenges.",
    "question_token_count": 37,
    "answer_correctness_score": 10,
    "explanation_validity_score": 10,
    "question_clarity_score": 6,
    "question_difficulty_score": 8,
    "question_groundedness_score": 4,
    "avg_answer_token_count": 27
  },
  {
    "context": "Antibiotics revolutionized medicine in the 20th century, and have together with vaccination led to the near eradication of diseases such as tuberculosis in the developed world. Their effectiveness and easy access led to overuse, especially in livestock raising, prompting bacteria to develop resistance. This has led to widespread problems with antimicrobial and antibiotic resistance, so much as to prompt the World Health Organization to classify antimicrobial resistance as a \"serious threat [that] is no longer a prediction for the future, it is happening right now in every region of the world and has the potential to affect anyone, of any age, in any country\".",
    "topic": "The relationship between antibiotic effectiveness, accessibility, and the emergence of resistant bacterial strains.",
    "response": "```xml\n<document_analysis>\n1. **Thoughtful Content Examination:** The core idea revolves around the historical success of antibiotics, their subsequent overuse, and the resulting emergence of antibiotic resistance. The text highlights a direct causal link between accessibility/use and resistance, culminating in a global health threat.\n2. **Concept Exploration:** The text implicitly touches upon evolutionary principles (bacteria adapting to selective pressure), public health implications, and the interconnectedness of human and animal health (livestock raising). It also suggests a tension between the benefits of antibiotic use and the risks of resistance.\n3. **Strategic Complexity Calibration:** Difficulty: 8/10. The question aims to assess understanding of the feedback loop created by antibiotic use and resistance, and the broader implications for global health. It requires synthesis of information rather than direct recall.\n4. **Intentional Question Planning:** The question will focus on the nuanced relationship between accessibility, effectiveness, and resistance, probing for an understanding of the underlying mechanisms driving the current crisis. The distractors will focus on misinterpreting the causal relationships described in the text.\n</document_analysis>\n<output_format>\nQuestion: Considering the historical trajectory of antibiotic use outlined in the text, which statement best encapsulates the primary driver of the current global antimicrobial resistance crisis?\nA: The initial ineffectiveness of early antibiotics necessitated higher dosages, accelerating the development of resistance.\nB: The widespread accessibility and demonstrated effectiveness of antibiotics fostered overuse, creating selective pressure for resistant bacterial strains.\nC: The eradication of diseases like tuberculosis reduced human immune system diversity, making populations more vulnerable to resistant strains.\nD: The limited development of novel antibiotic classes has created a reliance on existing drugs, increasing the risk of cross-resistance.\nExplanation: The text directly states that the \"effectiveness and easy access led to overuse...prompting bacteria to develop resistance.\" This establishes a clear causal link between accessibility, effectiveness, and the emergence of resistance. The other options present plausible but unsupported claims.\nCorrect Answer: B\n</output_format>\n```",
    "question": "Considering the historical trajectory of antibiotic use outlined in the text, which statement best encapsulates the primary driver of the current global antimicrobial resistance crisis?",
    "choices": {
      "A": "The initial ineffectiveness of early antibiotics necessitated higher dosages, accelerating the development of resistance.",
      "B": "The widespread accessibility and demonstrated effectiveness of antibiotics fostered overuse, creating selective pressure for resistant bacterial strains.",
      "C": "The eradication of diseases like tuberculosis reduced human immune system diversity, making populations more vulnerable to resistant strains.",
      "D": "The limited development of novel antibiotic classes has created a reliance on existing drugs, increasing the risk of cross-resistance."
    },
    "answer": "B",
    "explanation": "The text directly states that the \"effectiveness and easy access led to overuse...prompting bacteria to develop resistance.\" This establishes a clear causal link between accessibility, effectiveness, and the emergence of resistance. The other options present plausible but unsupported claims.",
    "question_token_count": 29,
    "answer_correctness_score": 10,
    "explanation_validity_score": 10,
    "question_clarity_score": 7,
    "question_difficulty_score": 6,
    "question_groundedness_score": 8,
    "avg_answer_token_count": 22
  },
  {
    "context": "Buddhism /\u02c8bud\u026az\u0259m/ is a nontheistic religion[note 1] or philosophy (Sanskrit: \u0927\u0930\u094d\u092e dharma; Pali: \u0927\u092e\u094d\u092e dhamma) that encompasses a variety of traditions, beliefs and spiritual practices largely based on teachings attributed to Gautama Buddha, commonly known as the Buddha (\"the awakened one\"). According to Buddhist tradition, the Buddha lived and taught in the eastern part of the Indian subcontinent, present-day Nepal sometime between the 6th and 4th centuries BCE.[note 1] He is recognized by Buddhists as an awakened or enlightened teacher who shared his insights to help sentient beings end their suffering through the elimination of ignorance and craving. Buddhists believe that this is accomplished through the direct understanding and perception of dependent origination and the Four Noble Truths.",
    "topic": "Describe the historical context of Gautama Buddha's life and teachings, including the estimated timeframe and geographical region.",
    "response": "```xml\n<document_analysis>\nThoughtful Content Examination: The text provides a concise overview of Buddhism, defining it as a nontheistic religion or philosophy centered around the teachings of Gautama Buddha. It specifies the geographical region (eastern Indian subcontinent, present-day Nepal) and a timeframe (6th-4th centuries BCE) for the Buddha\u2019s life and teachings. The core message revolves around ending suffering through enlightenment and understanding of dependent origination and the Four Noble Truths.\n\nConcept Exploration: The text implicitly touches upon the historical context of the Buddha's teachings \u2013 a period of philosophical and religious ferment in ancient India. It also suggests a focus on practical methods for alleviating human suffering, distinguishing it from other belief systems. The timeframe is crucial as it places the Buddha within a specific historical and intellectual landscape.\n\nStrategic Complexity Calibration: Difficulty: 8/10. The question will focus on the timeframe, requiring the expert to recall the relatively broad range given and understand its significance. It avoids direct recall of definitions and pushes for understanding the implications of the timeframe.\n\nIntentional Question Planning: The question will probe the expert's understanding of the estimated timeframe for the Buddha\u2019s life and its relation to the broader historical context of ancient India. It\u2019s designed to be challenging because the text only provides a range, and the correct answer requires recognizing that range\u2019s accuracy given the available historical evidence.\n</document_analysis>\n\n<output_format>\nQuestion: Considering the established historical estimates, within which timeframe did Gautama Buddha most likely live and teach?\nA: 8th - 6th centuries BCE\nB: 6th - 4th centuries BCE\nC: 4th - 2nd centuries BCE\nD: 2nd century BCE - 2nd century CE\nExplanation: The text explicitly states that, according to Buddhist tradition, the Buddha lived and taught sometime between the 6th and 4th centuries BCE. This timeframe is the most accurate representation of current historical estimates.\nCorrect Answer: B\n</output_format>\n```",
    "question": "Considering the established historical estimates, within which timeframe did Gautama Buddha most likely live and teach?",
    "choices": {
      "A": "8th - 6th centuries BCE",
      "B": "6th - 4th centuries BCE",
      "C": "4th - 2nd centuries BCE",
      "D": "2nd century BCE - 2nd century CE"
    },
    "answer": "B",
    "explanation": "The text explicitly states that, according to Buddhist tradition, the Buddha lived and taught sometime between the 6th and 4th centuries BCE. This timeframe is the most accurate representation of current historical estimates.",
    "question_token_count": 20,
    "answer_correctness_score": 10,
    "explanation_validity_score": 10,
    "question_clarity_score": 8,
    "question_difficulty_score": 6,
    "question_groundedness_score": 10,
    "avg_answer_token_count": 9
  },
  {
    "context": "Manning finished the year with a career-low 67.9 passer rating, throwing for 2,249 yards and nine touchdowns, with 17 interceptions. In contrast, Osweiler threw for 1,967 yards, 10 touchdowns and six interceptions for a rating of 86.4. Veteran receiver Demaryius Thomas led the team with 105 receptions for 1,304 yards and six touchdowns, while Emmanuel Sanders caught 76 passes for 1,135 yards and six scores, while adding another 106 yards returning punts. Tight end Owen Daniels was also a big element of the passing game with 46 receptions for 517 yards. Running back C. J. Anderson was the team's leading rusher 863 yards and seven touchdowns, while also catching 25 passes for 183 yards. Running back Ronnie Hillman also made a big impact with 720 yards, five touchdowns, 24 receptions, and a 4.7 yards per carry average. Overall, the offense ranked 19th in scoring with 355 points and did not have any Pro Bowl selections.",
    "topic": "Evaluate the contributions of C.J. Anderson and Ronnie Hillman to the Broncos' rushing attack, considering their yardage, touchdowns, receptions, and yards per carry.",
    "response": "```xml\n<document_analysis>\n1. **Thoughtful Content Examination:** The text provides statistics for several Broncos players during a specific year. It highlights Manning and Osweiler's quarterback performance, receiving stats for Thomas, Sanders, and Daniels, and rushing stats for Anderson and Hillman. The core focus for question generation is the comparison of Anderson and Hillman's contributions.\n2. **Concept Exploration:** The text presents a holistic view of offensive contributions, but doesn't delve into strategic reasons *why* certain players performed as they did. The question should focus on extracting comparative performance insights. The key is to assess whether a domain expert can synthesize the provided statistics to determine which running back had a more *impactful* season, beyond just raw yardage.\n3. **Strategic Complexity Calibration:** Difficulty: 8/10. This is a moderately complex question. It requires comparing multiple statistics and understanding their relative importance in evaluating a running back's overall contribution. The 4.7 yards per carry for Hillman is a key detail that could be easily overlooked.\n4. **Intentional Question Planning:** The question will ask which running back had a more statistically efficient season, forcing the responder to weigh yardage, touchdowns, receptions, and yards per carry. The distractor answers will focus on misleading combinations of these stats.\n</document_analysis>\n<output_format>\nQuestion: Considering the provided statistics, which Broncos running back demonstrated a more statistically efficient performance during the season?\nA: C.J. Anderson, due to his higher total rushing yardage (863 yards) and touchdown count (7).\nB: Ronnie Hillman, given his superior yards per carry average of 4.7, indicating more efficient gains on each attempt.\nC: C.J. Anderson, as his reception yardage (183 yards) significantly exceeded Hillman's receiving contribution.\nD: Ronnie Hillman, due to a combination of high rushing yardage (720 yards) and a substantial number of receptions (24).\nExplanation: While C.J. Anderson had more total rushing yards and touchdowns, Ronnie Hillman's 4.7 yards per carry demonstrates a higher efficiency in gaining yardage on each rushing attempt, indicating a more statistically efficient performance.\nCorrect Answer: B\n</output_format>\n```",
    "question": "Considering the provided statistics, which Broncos running back demonstrated a more statistically efficient performance during the season?",
    "choices": {
      "A": "C.J. Anderson, due to his higher total rushing yardage (863 yards) and touchdown count (7).",
      "B": "Ronnie Hillman, given his superior yards per carry average of 4.7, indicating more efficient gains on each attempt.",
      "C": "C.J. Anderson, as his reception yardage (183 yards) significantly exceeded Hillman's receiving contribution.",
      "D": "Ronnie Hillman, due to a combination of high rushing yardage (720 yards) and a substantial number of receptions (24)."
    },
    "answer": "B",
    "explanation": "While C.J. Anderson had more total rushing yards and touchdowns, Ronnie Hillman's 4.7 yards per carry demonstrates a higher efficiency in gaining yardage on each rushing attempt, indicating a more statistically efficient performance.",
    "question_token_count": 20,
    "answer_correctness_score": 10,
    "explanation_validity_score": 10,
    "question_clarity_score": 7,
    "question_difficulty_score": 6,
    "question_groundedness_score": 9,
    "avg_answer_token_count": 25
  },
  {
    "context": "The Hellenistic period covers the period of ancient Greek (Hellenic) history and Mediterranean history between the death of Alexander the Great in 323 BC and the emergence of the Roman Empire as signified by the Battle of Actium in 31 BC and the subsequent conquest of Ptolemaic Egypt the following year. At this time, Greek cultural influence and power was at its peak in Europe, Africa and Asia, experiencing prosperity and progress in the arts, exploration, literature, theatre, architecture, music, mathematics, philosophy, and science. For example, competitive public games took place, ideas in biology, and popular entertainment in theaters. It is often considered a period of transition, sometimes even of decadence or degeneration, compared to the enlightenment of the Greek Classical era. The Hellenistic period saw the rise of New Comedy, Alexandrian poetry, the Septuagint and the philosophies of Stoicism and Epicureanism. Greek Science was advanced by the works of the mathematician Euclid and the polymath Archimedes. The religious sphere expanded to include new gods such as the Greco-Egyptian Serapis, eastern deities such as Attis and Cybele and the Greek adoption of Buddhism.",
    "topic": "Describe the expansion of biological understanding during the Hellenistic period and its significance.",
    "response": "```xml\n<document_analysis>\n1. **Thoughtful Content Examination:** The provided text describes the Hellenistic period, spanning from Alexander the Great's death to the rise of the Roman Empire. It highlights the expansion of Greek culture, advancements in various fields (arts, science, mathematics, philosophy), and the emergence of new religious and philosophical ideas. The biological advancements are mentioned briefly as \"ideas in biology\".\n\n2. **Concept Exploration:** The text implies a flourishing of intellectual activity during the Hellenistic period, but provides limited specific details regarding the \"ideas in biology.\" This lack of detail presents an opportunity to create a challenging question that requires understanding of the broader context of scientific development during that time, and the ability to infer what kind of biological understandings might have been expanding. The period is also framed as a transition, raising questions about continuities and discontinuities with previous Greek thought.\n\n3. **Strategic Complexity Calibration:** Difficulty: 8/10. The question will be challenging because the text provides minimal explicit information about biological advancements. A domain expert will need to draw upon broader historical knowledge of Hellenistic science to answer correctly.\n\n4. **Intentional Question Planning:** The question will focus on the nature of biological inquiry during the Hellenistic period, and require the test-taker to distinguish between characteristics of earlier Greek biology and potential developments in the Hellenistic era. It will avoid asking for specifics not mentioned in the text, instead focusing on broader trends.\n</document_analysis>\n\n<output_format>\nQuestion: Considering the broader cultural and intellectual shifts of the Hellenistic period, which of the following best characterizes a likely trend in the development of biological understanding during this era?\nA: A renewed emphasis on purely observational studies, rejecting theoretical frameworks established during the Classical period.\nB: A significant integration of empirical observation with emerging philosophical systems like Stoicism and Epicureanism, potentially influencing interpretations of natural phenomena.\nC: A complete abandonment of Aristotelian biology in favor of atomistic theories proposed by Democritus.\nD: A focused expansion of anatomical dissection techniques, driven primarily by the needs of Hellenistic medicine.\nExplanation: The Hellenistic period saw the rise of new philosophical schools like Stoicism and Epicureanism alongside scientific advancements. It\u2019s reasonable to infer that biological understandings would have been influenced by these philosophical frameworks, integrating observation with broader theoretical systems. The text points to a period of transition and expansion of ideas.\nCorrect Answer: B\n</output_format>\n```",
    "question": "Considering the broader cultural and intellectual shifts of the Hellenistic period, which of the following best characterizes a likely trend in the development of biological understanding during this era?",
    "choices": {
      "A": "A renewed emphasis on purely observational studies, rejecting theoretical frameworks established during the Classical period.",
      "B": "A significant integration of empirical observation with emerging philosophical systems like Stoicism and Epicureanism, potentially influencing interpretations of natural phenomena.",
      "C": "A complete abandonment of Aristotelian biology in favor of atomistic theories proposed by Democritus.",
      "D": "A focused expansion of anatomical dissection techniques, driven primarily by the needs of Hellenistic medicine."
    },
    "answer": "B",
    "explanation": "The Hellenistic period saw the rise of new philosophical schools like Stoicism and Epicureanism alongside scientific advancements. It\u2019s reasonable to infer that biological understandings would have been influenced by these philosophical frameworks, integrating observation with broader theoretical systems. The text points to a period of transition and expansion of ideas.",
    "question_token_count": 33,
    "answer_correctness_score": 9,
    "explanation_validity_score": 8,
    "question_clarity_score": 8,
    "question_difficulty_score": 7,
    "question_groundedness_score": 8,
    "avg_answer_token_count": 21
  },
  {
    "context": "Antibiotics are screened for any negative effects on humans or other mammals before approval for clinical use, and are usually considered safe and most are well tolerated. However, some antibiotics have been associated with a range of adverse side effects. Side-effects range from mild to very serious depending on the antibiotics used, the microbial organisms targeted, and the individual patient. Side effects may reflect the pharmacological or toxicological properties of the antibiotic or may involve hypersensitivity reactions or anaphylaxis. Safety profiles of newer drugs are often not as well established as for those that have a long history of use. Adverse effects range from fever and nausea to major allergic reactions, including photodermatitis and anaphylaxis. Common side-effects include diarrhea, resulting from disruption of the species composition in the intestinal flora, resulting, for example, in overgrowth of pathogenic bacteria, such as Clostridium difficile. Antibacterials can also affect the vaginal flora, and may lead to overgrowth of yeast species of the genus Candida in the vulvo-vaginal area. Additional side-effects can result from interaction with other drugs, such as elevated risk of tendon damage from administration of a quinolone antibiotic with a systemic corticosteroid. Some scientists have hypothesized that the indiscriminate use of antibiotics alter the host microbiota and this has been associated with chronic disease.",
    "topic": "Analyze the potential risks associated with the co-administration of quinolone antibiotics and systemic corticosteroids, outlining the specific adverse effect.",
    "response": "```xml\n<document_analysis>\n1. **Thoughtful Content Examination:** The context discusses general antibiotic side effects, ranging from mild to severe, and highlights specific risks like *C. difficile* overgrowth and vaginal yeast infections. Crucially, it mentions an elevated risk of tendon damage when quinolone antibiotics are co-administered with systemic corticosteroids. This interaction is the most specific and clinically relevant point.\n2. **Concept Exploration:** The interaction between quinolones and corticosteroids isn't explained *why* it causes tendon damage. A domain expert should understand this is due to increased risk of tendon rupture, a known serious adverse event. The text also touches on the broader impact of antibiotics on the microbiome and its potential link to chronic diseases.\n3. **Strategic Complexity Calibration:** Difficulty: 8/10. The context provides a clue, but requires the expert to recall the specific adverse effect associated with the drug interaction. It's not directly stated, requiring a recall of clinical knowledge.\n4. **Intentional Question Planning:** The question aims to test the expert's knowledge of specific drug interactions and their clinical consequences. The distractors will focus on other potential side effects mentioned in the text or related to antibiotic use, making it challenging to select the correct answer.\n</document_analysis>\n<output_format>\nQuestion: Concurrent administration of quinolone antibiotics and systemic corticosteroids is associated with an increased risk of which specific adverse effect?\nA: Severe diarrhea due to *Clostridium difficile* overgrowth.\nB: Photodermatitis and anaphylaxis.\nC: Tendon damage, including tendon rupture.\nD: Vulvovaginal candidiasis.\nExplanation: The provided text explicitly states that the co-administration of a quinolone antibiotic with a systemic corticosteroid results in an elevated risk of tendon damage. This is a known and clinically significant drug interaction.\nCorrect Answer: C\n</output_format>\n```",
    "question": "Concurrent administration of quinolone antibiotics and systemic corticosteroids is associated with an increased risk of which specific adverse effect?",
    "choices": {
      "A": "Severe diarrhea due to *Clostridium difficile* overgrowth.",
      "B": "Photodermatitis and anaphylaxis.",
      "C": "Tendon damage, including tendon rupture.",
      "D": "Vulvovaginal candidiasis."
    },
    "answer": "C",
    "explanation": "The provided text explicitly states that the co-administration of a quinolone antibiotic with a systemic corticosteroid results in an elevated risk of tendon damage. This is a known and clinically significant drug interaction.",
    "question_token_count": 23,
    "answer_correctness_score": 10,
    "explanation_validity_score": 10,
    "question_clarity_score": 6,
    "question_difficulty_score": 7,
    "question_groundedness_score": 10,
    "avg_answer_token_count": 11
  },
  {
    "context": "On 2 March 1882, Roderick Maclean, a disgruntled poet apparently offended by Victoria's refusal to accept one of his poems, shot at the Queen as her carriage left Windsor railway station. Two schoolboys from Eton College struck him with their umbrellas, until he was hustled away by a policeman. Victoria was outraged when he was found not guilty by reason of insanity, but was so pleased by the many expressions of loyalty after the attack that she said it was \"worth being shot at\u2014to see how much one is loved\".",
    "topic": "Describe the role of the Eton College schoolboys in the immediate aftermath of the assassination attempt and discuss the social implications of their intervention.",
    "response": "```xml\n<document_analysis>\n1. **Thoughtful Content Examination:** The context describes an assassination attempt on Queen Victoria and the immediate response by two Eton College schoolboys who intervened using their umbrellas. It also highlights Victoria's reaction to the assailant's acquittal and the outpouring of public loyalty.\n2. **Concept Exploration:** The incident raises questions about Victorian social norms, the role of public schools like Eton, the legal definition of insanity at the time, and the Queen's public persona and relationship with her subjects. The schoolboys' intervention can be seen as an act of patriotic duty and a display of social class privilege.\n3. **Strategic Complexity Calibration:** Difficulty: 8/10. The question requires understanding the social context of the time, the significance of Eton College, and the implications of the Queen's reaction. It's not a simple factual recall question.\n4. **Intentional Question Planning:** The question is designed to assess understanding of the social ramifications of the event, beyond the simple act of intervention. It probes the expert's ability to connect a specific event to broader societal structures and values.\n</document_analysis>\n<output_format>\nQuestion: The intervention of Eton College schoolboys following the 1882 attempt on Queen Victoria\u2019s life, while lauded, most directly reflects which underlying societal dynamic of the Victorian era?\nA: A burgeoning democratic movement challenging aristocratic privilege.\nB: The reinforcement of class structure and the expectation of public displays of loyalty from all social strata.\nC: A growing distrust of the legal system and a desire for swift, extrajudicial punishment.\nD: The increasing influence of the monarchy in everyday life and the expectation of personal protection from loyal subjects.\nExplanation: The schoolboys\u2019 intervention, stemming from a prestigious institution like Eton, underscored the existing class structure and the expectation that individuals, regardless of social standing, would demonstrate loyalty to the Queen. This action reinforced the established hierarchy rather than challenging it.\nCorrect Answer: B\n</output_format>\n```",
    "question": "The intervention of Eton College schoolboys following the 1882 attempt on Queen Victoria\u2019s life, while lauded, most directly reflects which underlying societal dynamic of the Victorian era?",
    "choices": {
      "A": "A burgeoning democratic movement challenging aristocratic privilege.",
      "B": "The reinforcement of class structure and the expectation of public displays of loyalty from all social strata.",
      "C": "A growing distrust of the legal system and a desire for swift, extrajudicial punishment.",
      "D": "The increasing influence of the monarchy in everyday life and the expectation of personal protection from loyal subjects."
    },
    "answer": "B",
    "explanation": "The schoolboys\u2019 intervention, stemming from a prestigious institution like Eton, underscored the existing class structure and the expectation that individuals, regardless of social standing, would demonstrate loyalty to the Queen. This action reinforced the established hierarchy rather than challenging it.",
    "question_token_count": 37,
    "answer_correctness_score": 10,
    "explanation_validity_score": 10,
    "question_clarity_score": 6,
    "question_difficulty_score": 8,
    "question_groundedness_score": 10,
    "avg_answer_token_count": 18
  },
  {
    "context": "In 1870, republican sentiment in Britain, fed by the Queen's seclusion, was boosted after the establishment of the Third French Republic. A republican rally in Trafalgar Square demanded Victoria's removal, and Radical MPs spoke against her. In August and September 1871, she was seriously ill with an abscess in her arm, which Joseph Lister successfully lanced and treated with his new antiseptic carbolic acid spray. In late November 1871, at the height of the republican movement, the Prince of Wales contracted typhoid fever, the disease that was believed to have killed his father, and Victoria was fearful her son would die. As the tenth anniversary of her husband's death approached, her son's condition grew no better, and Victoria's distress continued. To general rejoicing, he pulled through. Mother and son attended a public parade through London and a grand service of thanksgiving in St Paul's Cathedral on 27 February 1872, and republican feeling subsided.",
    "topic": "Describe the relationship between the tenth anniversary of Prince Albert\u2019s death and Queen Victoria\u2019s emotional state during the Prince of Wales\u2019s illness.",
    "response": "<document_analysis>\n1. **Thoughtful Content Examination:** The text details a period of republican sentiment in Britain coinciding with Queen Victoria's seclusion and illness, followed by the Prince of Wales contracting typhoid. A key connection is made between Victoria\u2019s distress over her son's illness and the approaching tenth anniversary of Prince Albert\u2019s death.\n2. **Concept Exploration:** The passage implies a strong emotional link between Victoria\u2019s grief over her husband and her anxiety regarding her son. The anniversary likely intensified her fears, given the historical context of typhoid claiming Prince Albert\u2019s life. The text highlights the political impact of Victoria\u2019s emotional state, linking her distress to a decline in republican sentiment when her son recovered.\n3. **Strategic Complexity Calibration:** Difficulty: 9/10. This question requires understanding the subtle interplay of historical events, emotional states, and political consequences. It's not a direct recall question but demands inference.\n4. **Intentional Question Planning:** The question aims to assess whether the expert grasps the nuanced connection between Victoria's past grief, present anxieties, and the broader socio-political climate. It probes beyond surface-level comprehension to assess a deeper understanding of the emotional and historical context.\n</document_analysis>\n\n<output_format>\nQuestion: Considering the convergence of events in 1871-1872, how did the approaching tenth anniversary of Prince Albert's death most likely influence Queen Victoria\u2019s emotional response to the Prince of Wales\u2019s typhoid fever?\nA: It fostered a sense of acceptance regarding the inevitability of loss within the royal family, lessening her anxiety.\nB: It heightened her anxieties, drawing parallels between her son\u2019s illness and her husband\u2019s fatal bout with typhoid.\nC: It served as a distraction from the political unrest, allowing her to focus solely on her son\u2019s recovery.\nD: It prompted a renewed public sympathy for the Queen, bolstering support for the monarchy regardless of her son\u2019s health.\nExplanation: The text explicitly states Victoria was \"fearful her son would die\" as the tenth anniversary of her husband\u2019s death approached, and that the Prince of Wales contracted typhoid, the disease that killed his father. This indicates the anniversary intensified her anxieties, drawing a direct connection to her previous loss.\nCorrect Answer: B\n</output_format>",
    "question": "Considering the convergence of events in 1871-1872, how did the approaching tenth anniversary of Prince Albert's death most likely influence Queen Victoria\u2019s emotional response to the Prince of Wales\u2019s typhoid fever?",
    "choices": {
      "A": "It fostered a sense of acceptance regarding the inevitability of loss within the royal family, lessening her anxiety.",
      "B": "It heightened her anxieties, drawing parallels between her son\u2019s illness and her husband\u2019s fatal bout with typhoid.",
      "C": "It served as a distraction from the political unrest, allowing her to focus solely on her son\u2019s recovery.",
      "D": "It prompted a renewed public sympathy for the Queen, bolstering support for the monarchy regardless of her son\u2019s health."
    },
    "answer": "B",
    "explanation": "The text explicitly states Victoria was \"fearful her son would die\" as the tenth anniversary of her husband\u2019s death approached, and that the Prince of Wales contracted typhoid, the disease that killed his father. This indicates the anniversary intensified her anxieties, drawing a direct connection to her previous loss.",
    "question_token_count": 44,
    "answer_correctness_score": 10,
    "explanation_validity_score": 10,
    "question_clarity_score": 7,
    "question_difficulty_score": 8,
    "question_groundedness_score": 9,
    "avg_answer_token_count": 24
  },
  {
    "context": "On June 4, 2014, the NFL announced that the practice of branding Super Bowl games with Roman numerals, a practice established at Super Bowl V, would be temporarily suspended, and that the game would be named using Arabic numerals as Super Bowl 50 as opposed to Super Bowl L. The use of Roman numerals will be reinstated for Super Bowl LI. Jaime Weston, the league's vice president of brand and creative, explained that a primary reason for the change was the difficulty of designing an aesthetically pleasing logo with the letter \"L\" using the standardized logo template introduced at Super Bowl XLV. The logo also deviates from the template by featuring large numerals, colored in gold, behind the Vince Lombardi Trophy, instead of underneath and in silver as in the standard logo.",
    "topic": "The NFL's plan to reinstate the use of Roman numerals for Super Bowl LI, indicating the temporary nature of the change.",
    "response": "```xml\n<document_analysis>\n1. **Thoughtful Content Examination:** The text details a temporary shift in how the Super Bowl is branded \u2013 from Roman numerals to Arabic numerals for Super Bowl 50, and then back to Roman numerals for Super Bowl LI. The primary driver for this change appears to be aesthetic considerations related to logo design, specifically the difficulty of incorporating the Roman numeral \"L\" into the standardized logo template.\n\n2. **Concept Exploration:** This seemingly minor branding decision reveals broader considerations within the NFL regarding brand consistency, logo design constraints, and the balance between tradition (Roman numerals) and practicality (Arabic numerals for legibility and design). It highlights how even established traditions can be temporarily altered due to logistical or aesthetic challenges.\n\n3. **Strategic Complexity Calibration:** Difficulty: 8/10. The question requires understanding the nuanced reason behind a branding decision and recognizing the interplay between aesthetic design constraints and established tradition. It's not a simple recall question but demands an understanding of the NFL\u2019s branding strategy.\n\n4. **Intentional Question Planning:** The question will focus on the core reason for the temporary change, testing whether the expert understands the specific design problem that prompted the shift from Roman numerals to Arabic numerals. The distractors will focus on other potential reasons (marketing, historical precedent, etc.) to increase the challenge.\n</document_analysis>\n\n<output_format>\nQuestion: What was the primary impetus behind the NFL\u2019s decision to temporarily suspend the use of Roman numerals in Super Bowl branding, opting for Arabic numerals for Super Bowl 50?\nA: A desire to align the Super Bowl branding with other major sporting events that utilize Arabic numerals.\nB: Difficulties in creating an aesthetically pleasing logo incorporating the Roman numeral \u201cL\u201d within the established logo template.\nC: A strategic marketing initiative to appeal to a younger demographic unfamiliar with Roman numerals.\nD: Concerns that the use of Roman numerals was historically inaccurate and misrepresented the chronological order of the games.\nExplanation: The text explicitly states that the change was primarily due to the difficulty of designing an aesthetically pleasing logo with the letter \"L\" using the standardized logo template introduced at Super Bowl XLV.\nCorrect Answer: B\n</output_format>\n```",
    "question": "What was the primary impetus behind the NFL\u2019s decision to temporarily suspend the use of Roman numerals in Super Bowl branding, opting for Arabic numerals for Super Bowl 50?",
    "choices": {
      "A": "A desire to align the Super Bowl branding with other major sporting events that utilize Arabic numerals.",
      "B": "Difficulties in creating an aesthetically pleasing logo incorporating the Roman numeral \u201cL\u201d within the established logo template.",
      "C": "A strategic marketing initiative to appeal to a younger demographic unfamiliar with Roman numerals.",
      "D": "Concerns that the use of Roman numerals was historically inaccurate and misrepresented the chronological order of the games."
    },
    "answer": "B",
    "explanation": "The text explicitly states that the change was primarily due to the difficulty of designing an aesthetically pleasing logo with the letter \"L\" using the standardized logo template introduced at Super Bowl XLV.",
    "question_token_count": 35,
    "answer_correctness_score": 10,
    "explanation_validity_score": 10,
    "question_clarity_score": 8,
    "question_difficulty_score": 6,
    "question_groundedness_score": 10,
    "avg_answer_token_count": 20
  },
  {
    "context": "The Panthers offense, which led the NFL in scoring (500 points), was loaded with talent, boasting six Pro Bowl selections. Pro Bowl quarterback Cam Newton had one of his best seasons, throwing for 3,837 yards and rushing for 636, while recording a career-high and league-leading 45 total touchdowns (35 passing, 10 rushing), a career-low 10 interceptions, and a career-best quarterback rating of 99.4. Newton's leading receivers were tight end Greg Olsen, who caught a career-high 77 passes for 1,104 yards and seven touchdowns, and wide receiver Ted Ginn, Jr., who caught 44 passes for 739 yards and 10 touchdowns; Ginn also rushed for 60 yards and returned 27 punts for 277 yards. Other key receivers included veteran Jerricho Cotchery (39 receptions for 485 yards), rookie Devin Funchess (31 receptions for 473 yards and five touchdowns), and second-year receiver Corey Brown (31 receptions for 447 yards). The Panthers backfield featured Pro Bowl running back Jonathan Stewart, who led the team with 989 rushing yards and six touchdowns in 13 games, along with Pro Bowl fullback Mike Tolbert, who rushed for 256 yards and caught 18 passes for another 154 yards. Carolina's offensive line also featured two Pro Bowl selections: center Ryan Kalil and guard Trai Turner.",
    "topic": "Analyze how the Panthers utilized a variety of receiving options (tight end, wide receivers, fullbacks) to create offensive opportunities in 2015.",
    "response": "<document_analysis>\n1. **Thoughtful Content Examination:** The text describes the Carolina Panthers' potent 2015 offense, highlighting key players and their statistics. It emphasizes Cam Newton's exceptional performance and the contributions of various receiving options \u2013 tight ends, wide receivers, and a fullback. The focus is on the diversity of targets Newton utilized.\n2. **Concept Exploration:** The text implicitly demonstrates the importance of having multiple reliable receiving threats to keep defenses guessing. It also subtly points to the dual-threat nature of players like Ginn and Tolbert, who contributed in both receiving and rushing/returning roles. The Pro Bowl selections indicate the high level of talent across multiple positions.\n3. **Strategic Complexity Calibration:** Difficulty: 8/10. The question will require integrating statistics from multiple players and understanding the broader offensive strategy. It moves beyond simple recall of names and numbers.\n4. **Intentional Question Planning:** The question aims to test the understanding of how the Panthers distributed targets and utilized different receiving positions, prompting the expert to analyze the offensive scheme and player roles beyond the headline numbers. The answer options will require careful consideration of the statistical contributions of each receiver type.\n</document_analysis>\n\n<output_format>\nQuestion: In the Carolina Panthers\u2019 2015 offensive scheme, which positional group demonstrated the highest total yardage contribution from players beyond the primary receiving target of Greg Olsen?\nA: Fullbacks, accumulating 410 total yards through rushing and receiving.\nB: Wide Receivers, accumulating 1,925 total yards through receiving and rushing.\nC: Running Backs, accumulating 1,245 total yards through rushing and receiving.\nD: Tight Ends, accumulating 1,104 total yards solely through receiving.\nExplanation: The text states Greg Olsen had 1,104 receiving yards. Wide Receivers (Ginn 739 yards + Cotchery 485 yards + Funchess 473 yards + Brown 447 yards + Ginn 60 rushing yards) accumulated 1,925 total yards. This is the highest total yardage contribution from a positional group beyond Olsen.\nCorrect Answer: B\n</output_format>",
    "question": "In the Carolina Panthers\u2019 2015 offensive scheme, which positional group demonstrated the highest total yardage contribution from players beyond the primary receiving target of Greg Olsen?",
    "choices": {
      "A": "Fullbacks, accumulating 410 total yards through rushing and receiving.",
      "B": "Wide Receivers, accumulating 1,925 total yards through receiving and rushing.",
      "C": "Running Backs, accumulating 1,245 total yards through rushing and receiving.",
      "D": "Tight Ends, accumulating 1,104 total yards solely through receiving."
    },
    "answer": "B",
    "explanation": "The text states Greg Olsen had 1,104 receiving yards. Wide Receivers (Ginn 739 yards + Cotchery 485 yards + Funchess 473 yards + Brown 447 yards + Ginn 60 rushing yards) accumulated 1,925 total yards. This is the highest total yardage contribution from a positional group beyond Olsen.",
    "question_token_count": 33,
    "answer_correctness_score": 10,
    "explanation_validity_score": 8,
    "question_clarity_score": 6,
    "question_difficulty_score": 7,
    "question_groundedness_score": 9,
    "avg_answer_token_count": 16
  },
  {
    "context": "Antibiotics revolutionized medicine in the 20th century, and have together with vaccination led to the near eradication of diseases such as tuberculosis in the developed world. Their effectiveness and easy access led to overuse, especially in livestock raising, prompting bacteria to develop resistance. This has led to widespread problems with antimicrobial and antibiotic resistance, so much as to prompt the World Health Organization to classify antimicrobial resistance as a \"serious threat [that] is no longer a prediction for the future, it is happening right now in every region of the world and has the potential to affect anyone, of any age, in any country\".",
    "topic": "The mechanisms by which antibiotic overuse in both human medicine and livestock contributes to the development of antimicrobial resistance.",
    "response": "```xml\n<document_analysis>\n1. **Thoughtful Content Examination**: The core idea is the link between antibiotic overuse (in humans and livestock) and the rise of antimicrobial resistance, highlighted by the WHO's serious threat classification. The text establishes a historical context \u2013 the initial success of antibiotics \u2013 followed by the unintended consequence of overuse.\n2. **Concept Exploration**: The text implicitly suggests a trade-off: the benefits of antibiotics versus the risks of resistance. It also highlights the global scale of the problem, moving beyond localized concerns. The phrase \"happening right now\" emphasizes the urgency.\n3. **Strategic Complexity Calibration**: Difficulty: 8/10. The question targets understanding of the historical trajectory and the implications of widespread resistance, requiring a grasp of the long-term consequences of seemingly beneficial practices.\n4. **Intentional Question Planning**: The question aims to assess understanding of the causal relationship between antibiotic use and resistance, focusing on the broader implications beyond just medical treatment. It requires integrating the historical context with the current global threat.\n</document_analysis>\n<output_format>\nQuestion: Considering the historical trajectory of antibiotic use, what best characterizes the contemporary challenge of antimicrobial resistance as highlighted in the provided text?\nA: Antimicrobial resistance is a future threat primarily impacting developing nations.\nB: The initial efficacy of antibiotics inadvertently fostered conditions leading to widespread resistance.\nC: Vaccination programs have proven fully effective in mitigating the rise of antimicrobial resistance.\nD: Antibiotic overuse is limited to human medicine and does not significantly affect livestock.\nExplanation: The text explicitly states that antimicrobial resistance is \"happening right now in every region of the world\" and links its rise to the \"overuse\" of antibiotics after their initial effectiveness. This demonstrates the unintended consequence of a successful medical intervention.\nCorrect Answer: B\n</output_format>\n```",
    "question": "Considering the historical trajectory of antibiotic use, what best characterizes the contemporary challenge of antimicrobial resistance as highlighted in the provided text?",
    "choices": {
      "A": "Antimicrobial resistance is a future threat primarily impacting developing nations.",
      "B": "The initial efficacy of antibiotics inadvertently fostered conditions leading to widespread resistance.",
      "C": "Vaccination programs have proven fully effective in mitigating the rise of antimicrobial resistance.",
      "D": "Antibiotic overuse is limited to human medicine and does not significantly affect livestock."
    },
    "answer": "B",
    "explanation": "The text explicitly states that antimicrobial resistance is \"happening right now in every region of the world\" and links its rise to the \"overuse\" of antibiotics after their initial effectiveness. This demonstrates the unintended consequence of a successful medical intervention.",
    "question_token_count": 25,
    "answer_correctness_score": 10,
    "explanation_validity_score": 10,
    "question_clarity_score": 8,
    "question_difficulty_score": 7,
    "question_groundedness_score": 9,
    "avg_answer_token_count": 16
  },
  {
    "context": "On 14 January 1858, an Italian refugee from Britain called Orsini attempted to assassinate Napoleon III with a bomb made in England. The ensuing diplomatic crisis destabilised the government, and Palmerston resigned. Derby was reinstated as prime minister. Victoria and Albert attended the opening of a new basin at the French military port of Cherbourg on 5 August 1858, in an attempt by Napoleon III to reassure Britain that his military preparations were directed elsewhere. On her return Victoria wrote to Derby reprimanding him for the poor state of the Royal Navy in comparison to the French one. Derby's ministry did not last long, and in June 1859 Victoria recalled Palmerston to office.",
    "topic": "Describe the diplomatic crisis following the assassination attempt and how it destabilized the British government.",
    "response": "```xml\n<document_analysis>\n1. **Thoughtful Content Examination:** The text describes a diplomatic crisis triggered by an assassination attempt on Napoleon III, linked to a bomb manufactured in England. This led to Palmerston's resignation, a temporary reinstatement of Derby as PM, and subsequent criticism of the Royal Navy's state. The text highlights a period of political instability and shifting leadership.\n2. **Concept Exploration:** The core concept is the interconnectedness of international events and domestic politics. An act of terrorism in one country (France) directly impacted the political landscape in another (Britain). The Queen's involvement (criticizing the Navy) demonstrates the monarchy's influence. The text implies a period of heightened Anglo-French tension and a naval arms race.\n3. **Strategic Complexity Calibration:** Difficulty: 8/10. The question will require understanding the sequence of events, the political roles involved, and the underlying reasons for the instability. It's not a simple recall question; it requires connecting the assassination attempt to the governmental changes.\n4. **Intentional Question Planning:** The question will focus on the destabilizing effects of the diplomatic crisis, requiring the examinee to synthesize the information about Palmerston's resignation and Derby's temporary return to power. The answer options will include plausible but incorrect scenarios.\n</document_analysis>\n<output_format>\nQuestion: Following the Orsini assassination attempt, what was the immediate political consequence within the British government?\nA: A strengthening of Derby\u2019s position as Prime Minister due to his decisive handling of the crisis.\nB: The swift implementation of increased security measures across Britain, led by Palmerston.\nC: Palmerston\u2019s resignation and the temporary reinstatement of Derby as Prime Minister.\nD: A period of prolonged parliamentary debate resulting in a coalition government.\nExplanation: The text explicitly states that \u201cthe ensuing diplomatic crisis destabilised the government, and Palmerston resigned. Derby was reinstated as prime minister.\u201d This directly addresses the immediate political consequence.\nCorrect Answer: C\n</output_format>\n```",
    "question": "Following the Orsini assassination attempt, what was the immediate political consequence within the British government?",
    "choices": {
      "A": "A strengthening of Derby\u2019s position as Prime Minister due to his decisive handling of the crisis.",
      "B": "The swift implementation of increased security measures across Britain, led by Palmerston.",
      "C": "Palmerston\u2019s resignation and the temporary reinstatement of Derby as Prime Minister.",
      "D": "A period of prolonged parliamentary debate resulting in a coalition government."
    },
    "answer": "C",
    "explanation": "The text explicitly states that \u201cthe ensuing diplomatic crisis destabilised the government, and Palmerston resigned. Derby was reinstated as prime minister.\u201d This directly addresses the immediate political consequence.",
    "question_token_count": 20,
    "answer_correctness_score": 10,
    "explanation_validity_score": 10,
    "question_clarity_score": 1,
    "question_difficulty_score": 6,
    "question_groundedness_score": 9,
    "avg_answer_token_count": 16
  },
  {
    "context": "Following their loss in the divisional round of the previous season's playoffs, the Denver Broncos underwent numerous coaching changes, including a mutual parting with head coach John Fox (who had won four divisional championships in his four years as Broncos head coach), and the hiring of Gary Kubiak as the new head coach. Under Kubiak, the Broncos planned to install a run-oriented offense with zone blocking to blend in with quarterback Peyton Manning's shotgun passing skills, but struggled with numerous changes and injuries to the offensive line, as well as Manning having his worst statistical season since his rookie year with the Indianapolis Colts in 1998, due to a plantar fasciitis injury in his heel that he had suffered since the summer, and the simple fact that Manning was getting old, as he turned 39 in the 2015 off-season. Although the team had a 7\u20130 start, Manning led the NFL in interceptions. In week 10, Manning suffered a partial tear of the plantar fasciitis in his left foot. He set the NFL's all-time record for career passing yards in this game, but was benched after throwing four interceptions in favor of backup quarterback Brock Osweiler, who took over as the starter for most of the remainder of the regular season. Osweiler was injured, however, leading to Manning's return during the Week 17 regular season finale, where the Broncos were losing 13\u20137 against the 4\u201311 San Diego Chargers, resulting in Manning re-claiming the starting quarterback position for the playoffs by leading the team to a key 27\u201320 win that enabled the team to clinch the number one overall AFC seed. Under defensive coordinator Wade Phillips, the Broncos' defense ranked number one in total yards allowed, passing yards allowed and sacks, and like the previous three seasons, the team has continued to set numerous individual, league and franchise records. With the defense carrying the team despite the issues with the offense, the Broncos finished the regular season with a 12\u20134 record and earned home-field advantage throughout the AFC playoffs.",
    "topic": "Compare and contrast the performances of Peyton Manning and Brock Osweiler during the 2015 season, assessing their respective strengths and weaknesses.",
    "response": "<document_analysis>\n1. **Thoughtful Content Examination:** The text details the Denver Broncos' 2015 season, focusing on the quarterback situation involving Peyton Manning and Brock Osweiler. It highlights Manning\u2019s struggles with injury and declining performance, Osweiler's temporary role as starter, and Manning\u2019s eventual return before the playoffs. The defense\u2019s strong performance is also emphasized.\n2. **Concept Exploration:** The passage implicitly explores themes of aging athletes, adapting offensive schemes, the importance of a strong defense, and the role of coaching changes in team performance. It demonstrates how a team can succeed despite offensive struggles through exceptional defensive play.\n3. **Strategic Complexity Calibration:** Difficulty: 9/10. The question requires understanding the nuanced interplay between Manning's physical limitations, Osweiler's performance, the coaching changes, and the overall team dynamics. A domain expert needs to recall specific details about their performance and the context surrounding their playing time.\n4. **Intentional Question Planning:** The question is designed to assess the ability to synthesize information about both quarterbacks and understand how their strengths and weaknesses factored into the Broncos\u2019 season. The answer choices will be carefully constructed to be plausible but require precise knowledge of the details in the text.\n</document_analysis>\n\n<output_format>\nQuestion: During the 2015 season, the Denver Broncos experienced a shift in quarterback leadership between Peyton Manning and Brock Osweiler. Considering the factors outlined in the provided text, which statement most accurately encapsulates the primary reason for this transition and Manning\u2019s eventual return to the starting role?\nA: Osweiler consistently outperformed Manning in statistical efficiency, prompting a permanent change in the offensive strategy.\nB: Manning\u2019s declining physical condition and high interception rate led to a temporary benching in favor of Osweiler, but Manning regained the position due to a crucial Week 17 victory.\nC: Kubiak\u2019s offensive scheme was fundamentally incompatible with Manning\u2019s skillset, necessitating Osweiler\u2019s implementation as the long-term solution.\nD: Osweiler\u2019s injury created an opportunity for Manning to demonstrate his leadership and secure his position as the unquestioned starter throughout the playoffs.\nExplanation: The text explicitly states Manning was benched due to his poor performance (high interceptions) and injury (plantar fasciitis). While Osweiler started for a period, Manning returned after leading a key win in Week 17, which secured the AFC\u2019s top seed. This demonstrates the win was the primary factor in his return.\nCorrect Answer: B\n</output_format>",
    "question": "During the 2015 season, the Denver Broncos experienced a shift in quarterback leadership between Peyton Manning and Brock Osweiler. Considering the factors outlined in the provided text, which statement most accurately encapsulates the primary reason for this transition and Manning\u2019s eventual return to the starting role?",
    "choices": {
      "A": "Osweiler consistently outperformed Manning in statistical efficiency, prompting a permanent change in the offensive strategy.",
      "B": "Manning\u2019s declining physical condition and high interception rate led to a temporary benching in favor of Osweiler, but Manning regained the position due to a crucial Week 17 victory.",
      "C": "Kubiak\u2019s offensive scheme was fundamentally incompatible with Manning\u2019s skillset, necessitating Osweiler\u2019s implementation as the long-term solution.",
      "D": "Osweiler\u2019s injury created an opportunity for Manning to demonstrate his leadership and secure his position as the unquestioned starter throughout the playoffs."
    },
    "answer": "B",
    "explanation": "The text explicitly states Manning was benched due to his poor performance (high interceptions) and injury (plantar fasciitis). While Osweiler started for a period, Manning returned after leading a key win in Week 17, which secured the AFC\u2019s top seed. This demonstrates the win was the primary factor in his return.",
    "question_token_count": 56,
    "answer_correctness_score": 10,
    "explanation_validity_score": 10,
    "question_clarity_score": 8,
    "question_difficulty_score": 6,
    "question_groundedness_score": 10,
    "avg_answer_token_count": 28
  },
  {
    "context": "The annual NFL Experience was held at the Moscone Center in San Francisco. In addition, \"Super Bowl City\" opened on January 30 at Justin Herman Plaza on The Embarcadero, featuring games and activities that will highlight the Bay Area's technology, culinary creations, and cultural diversity. More than 1 million people are expected to attend the festivities in San Francisco during Super Bowl Week. San Francisco mayor Ed Lee said of the highly visible homeless presence in this area \"they are going to have to leave\". San Francisco city supervisor Jane Kim unsuccessfully lobbied for the NFL to reimburse San Francisco for city services in the amount of $5 million.",
    "topic": "Evaluate the political response to the Super Bowl 50 events, specifically focusing on Mayor Ed Lee\u2019s statement regarding homelessness and Supervisor Jane Kim\u2019s attempt to secure NFL funding for city services.",
    "response": "```xml\n<document_analysis>\nThoughtful Content Examination: The text describes the events surrounding Super Bowl 50 in San Francisco, focusing on the NFL Experience, Super Bowl City, and anticipated attendance. Critically, it highlights the political response to the event, specifically Mayor Lee\u2019s controversial statement about homelessness and Supervisor Kim's unsuccessful attempt to secure funding from the NFL.\n\nConcept Exploration: The context touches upon themes of urban planning, event management, political strategy, and the social challenges of homelessness. Mayor Lee's statement reveals a pragmatic, potentially insensitive approach to managing the city's image during a high-profile event. Supervisor Kim\u2019s effort demonstrates an attempt to leverage the event for public benefit. The contrast between these approaches is significant.\n\nStrategic Complexity Calibration: Difficulty: 8/10. This question requires understanding of political motivations, urban challenges, and the complexities of managing a large-scale event while addressing social issues. It requires inferential reasoning about the underlying tensions at play.\n\nIntentional Question Planning: The question will focus on the strategic implications of Mayor Lee's statement, requiring an understanding of the political risks and potential public relations fallout associated with such a comment. It aims to assess whether the examinee understands the nuances of political communication in a crisis or sensitive situation.\n</document_analysis>\n\n<output_format>\nQuestion: Considering the political context surrounding Super Bowl 50, what was the primary strategic risk associated with Mayor Lee\u2019s statement regarding the displacement of the homeless population?\nA: It could alienate the NFL and jeopardize future event hosting opportunities.\nB: It risked exacerbating negative public perception of the city\u2019s handling of homelessness and fueling criticism of its economic priorities.\nC: It would likely result in legal challenges from advocacy groups representing the homeless population.\nD: It signaled a lack of preparedness for managing the influx of visitors during Super Bowl Week.\nExplanation: Mayor Lee\u2019s directive for the homeless to \u201cleave\u201d directly addresses a visible social problem during a major event. This inherently creates a public relations risk, potentially amplifying criticism about the city\u2019s approach to homelessness and its perceived prioritization of economic gain over social welfare. The statement is not about NFL relations, legal challenges, or event preparedness, but about the city\u2019s image and political optics.\nCorrect Answer: B\n</output_format>\n```",
    "question": "Considering the political context surrounding Super Bowl 50, what was the primary strategic risk associated with Mayor Lee\u2019s statement regarding the displacement of the homeless population?",
    "choices": {
      "A": "It could alienate the NFL and jeopardize future event hosting opportunities.",
      "B": "It risked exacerbating negative public perception of the city\u2019s handling of homelessness and fueling criticism of its economic priorities.",
      "C": "It would likely result in legal challenges from advocacy groups representing the homeless population.",
      "D": "It signaled a lack of preparedness for managing the influx of visitors during Super Bowl Week."
    },
    "answer": "B",
    "explanation": "Mayor Lee\u2019s directive for the homeless to \u201cleave\u201d directly addresses a visible social problem during a major event. This inherently creates a public relations risk, potentially amplifying criticism about the city\u2019s approach to homelessness and its perceived prioritization of economic gain over social welfare. The statement is not about NFL relations, legal challenges, or event preparedness, but about the city\u2019s image and political optics.",
    "question_token_count": 31,
    "answer_correctness_score": 9,
    "explanation_validity_score": 9,
    "question_clarity_score": 6,
    "question_difficulty_score": 8,
    "question_groundedness_score": 6,
    "avg_answer_token_count": 19
  },
  {
    "context": "Beyonc\u00e9 Giselle Knowles-Carter (/bi\u02d0\u02c8j\u0252nse\u026a/ bee-YON-say) (born September 4, 1981) is an American singer, songwriter, record producer and actress. Born and raised in Houston, Texas, she performed in various singing and dancing competitions as a child, and rose to fame in the late 1990s as lead singer of R&B girl-group Destiny's Child. Managed by her father, Mathew Knowles, the group became one of the world's best-selling girl groups of all time. Their hiatus saw the release of Beyonc\u00e9's debut album, Dangerously in Love (2003), which established her as a solo artist worldwide, earned five Grammy Awards and featured the Billboard Hot 100 number-one singles \"Crazy in Love\" and \"Baby Boy\".",
    "topic": "The significance of Destiny's Child as one of the best-selling girl groups globally.",
    "response": "```xml\n<document_analysis>\n1. **Thoughtful Content Examination:** The text focuses on Beyonc\u00e9's career trajectory, beginning with her time in Destiny's Child and transitioning to her solo success. The key point regarding the group is its status as \"one of the world's best-selling girl groups of all time.\"\n2. **Concept Exploration:** The statement about Destiny's Child's sales success is a broad claim. A domain expert would understand the complexities of measuring music sales (units sold vs. revenue, certifications, streaming equivalents) and the competitive landscape of girl groups.\n3. **Strategic Complexity Calibration:** Difficulty: 8/10. The question requires understanding the factors contributing to a group\u2019s commercial success and recognizing the significance of achieving \"best-selling\" status in a competitive industry.\n4. **Intentional Question Planning:** The question will probe for an understanding of the relative significance of Destiny's Child's sales figures compared to other successful girl groups, focusing on what *specifically* contributes to a group reaching that level of commercial acclaim.\n</document_analysis>\n<output_format>\nQuestion: Considering the competitive landscape of popular music, what primary factor most distinguishes a girl group achieving the designation of \"one of the world's best-selling\" from merely achieving significant commercial success?\nA: Consistent critical acclaim from music reviewers and industry publications.\nB: Sustained global distribution through major record labels and strategic marketing.\nC: A unique and consistently evolving musical identity combined with broad cultural resonance.\nD: Frequent and highly publicized collaborations with established male artists.\nExplanation: While all options contribute to success, \"best-selling\" status fundamentally relies on a combination of a distinctive artistic identity and broad cultural appeal that translates into consistent, large-scale consumer demand across diverse global markets. This is what elevates a group beyond simply being \"successful.\"\nCorrect Answer: C\n</output_format>\n```",
    "question": "Considering the competitive landscape of popular music, what primary factor most distinguishes a girl group achieving the designation of \"one of the world's best-selling\" from merely achieving significant commercial success?",
    "choices": {
      "A": "Consistent critical acclaim from music reviewers and industry publications.",
      "B": "Sustained global distribution through major record labels and strategic marketing.",
      "C": "A unique and consistently evolving musical identity combined with broad cultural resonance.",
      "D": "Frequent and highly publicized collaborations with established male artists."
    },
    "answer": "C",
    "explanation": "While all options contribute to success, \"best-selling\" status fundamentally relies on a combination of a distinctive artistic identity and broad cultural appeal that translates into consistent, large-scale consumer demand across diverse global markets. This is what elevates a group beyond simply being \"successful.\"",
    "question_token_count": 36,
    "answer_correctness_score": 10,
    "explanation_validity_score": 10,
    "question_clarity_score": 6,
    "question_difficulty_score": 7,
    "question_groundedness_score": 4,
    "avg_answer_token_count": 13
  },
  {
    "context": "Gladstone returned to power after the 1892 general election; he was 82 years old. Victoria objected when Gladstone proposed appointing the Radical MP Henry Labouchere to the Cabinet, so Gladstone agreed not to appoint him. In 1894, Gladstone retired and, without consulting the outgoing prime minister, Victoria appointed Lord Rosebery as prime minister. His government was weak, and the following year Lord Salisbury replaced him. Salisbury remained prime minister for the remainder of Victoria's reign.",
    "topic": "Lord Salisbury\u2019s prolonged premiership following Rosebery\u2019s replacement signifies a period of relative political stability during the latter part of Victoria's reign.",
    "response": "```xml\n<document_analysis>\nThoughtful Content Examination: The context describes a transition of power in the late 19th century, focusing on Gladstone's final term, Rosebery's short-lived premiership, and Salisbury's subsequent long tenure. It highlights Victoria's influence in political appointments and the instability of Rosebery's government.\n\nConcept Exploration: The passage implicitly suggests a contrast between Gladstone's established leadership, Rosebery's weakness, and Salisbury's ability to maintain power. The Queen's direct involvement in selecting Rosebery is noteworthy. The statement in the question topic about \"relative political stability\" invites exploration of what constituted stability in this period.\n\nStrategic Complexity Calibration: Difficulty: 8/10. The question requires understanding the dynamics of Victorian politics, the relative strengths and weaknesses of the leaders mentioned, and the implications of Victoria\u2019s interventions. It\u2019s not a simple recall question.\n\nIntentional Question Planning: The question will focus on the reasons behind Salisbury\u2019s prolonged premiership, prompting the domain expert to consider the factors contributing to his success compared to his predecessors. The answer options will focus on plausible, but ultimately incorrect, explanations related to broader political trends or individual characteristics.\n</document_analysis>\n<output_format>\nQuestion: Lord Salisbury\u2019s extended premiership following Rosebery\u2019s administration can be most directly attributed to which factor?\nA: A significant shift in public opinion towards Conservative policies following a series of successful imperial ventures.\nB: Salisbury\u2019s demonstrated ability to navigate complex parliamentary coalitions, fostering a sense of national unity.\nC: A perceived lack of strong leadership alternatives within the Liberal party following Gladstone\u2019s retirement.\nD: Victoria\u2019s consistent and overt support for Salisbury\u2019s policies, providing crucial parliamentary leverage.\nExplanation: The text states that Victoria appointed Salisbury after Rosebery's weak government, and Salisbury *remained* prime minister for the rest of Victoria\u2019s reign. This suggests Victoria's support was a key factor in his longevity, more so than any specific policy shift or political skill.\nCorrect Answer: D\n</output_format>\n```",
    "question": "Lord Salisbury\u2019s extended premiership following Rosebery\u2019s administration can be most directly attributed to which factor?",
    "choices": {
      "A": "A significant shift in public opinion towards Conservative policies following a series of successful imperial ventures.",
      "B": "Salisbury\u2019s demonstrated ability to navigate complex parliamentary coalitions, fostering a sense of national unity.",
      "C": "A perceived lack of strong leadership alternatives within the Liberal party following Gladstone\u2019s retirement.",
      "D": "Victoria\u2019s consistent and overt support for Salisbury\u2019s policies, providing crucial parliamentary leverage."
    },
    "answer": "D",
    "explanation": "The text states that Victoria appointed Salisbury after Rosebery's weak government, and Salisbury *remained* prime minister for the rest of Victoria\u2019s reign. This suggests Victoria's support was a key factor in his longevity, more so than any specific policy shift or political skill.",
    "question_token_count": 21,
    "answer_correctness_score": 8,
    "explanation_validity_score": 8,
    "question_clarity_score": 8,
    "question_difficulty_score": 6,
    "question_groundedness_score": 9,
    "avg_answer_token_count": 18
  },
  {
    "context": "In 1887, the British Empire celebrated Victoria's Golden Jubilee. Victoria marked the fiftieth anniversary of her accession on 20 June with a banquet to which 50 kings and princes were invited. The following day, she participated in a procession and attended a thanksgiving service in Westminster Abbey. By this time, Victoria was once again extremely popular. Two days later on 23 June, she engaged two Indian Muslims as waiters, one of whom was Abdul Karim. He was soon promoted to \"Munshi\": teaching her Hindustani, and acting as a clerk. Her family and retainers were appalled, and accused Abdul Karim of spying for the Muslim Patriotic League, and biasing the Queen against the Hindus. Equerry Frederick Ponsonby (the son of Sir Henry) discovered that the Munshi had lied about his parentage, and reported to Lord Elgin, Viceroy of India, \"the Munshi occupies very much the same position as John Brown used to do.\" Victoria dismissed their complaints as racial prejudice. Abdul Karim remained in her service until he returned to India with a pension on her death.",
    "topic": "Evaluate Queen Victoria\u2019s response to the criticisms of Abdul Karim and her rationale for dismissing them as racial prejudice.",
    "response": "```xml\n<document_analysis>\n1. **Thoughtful Content Examination:** The text describes Queen Victoria's relationship with Abdul Karim, an Indian Muslim she employed as a teacher and clerk. It highlights the disapproval of her family and retainers, who accused Karim of various offenses, including spying and religious bias. Crucially, it states Victoria dismissed these concerns as racial prejudice. The core tension revolves around the accusations against Karim and Victoria's defense of him.\n\n2. **Concept Exploration:** The passage touches upon themes of colonialism, racial dynamics, power imbalances, and personal relationships within the context of the British Empire. Victoria's response is particularly interesting as it challenges the prevailing attitudes of her time. The comparison to John Brown, a Scottish servant who held significant influence over Victoria, is a key detail, suggesting Karim filled a similar emotional role.\n\n3. **Strategic Complexity Calibration:** Difficulty: 9/10. This question requires understanding the historical context, the nuances of Victorian society, and the implications of Victoria\u2019s decision to side with Karim against her advisors. It necessitates inferring Victoria\u2019s rationale beyond the simple statement of \"racial prejudice.\"\n\n4. **Intentional Question Planning:** The question aims to probe the expert\u2019s understanding of Victoria\u2019s motivations and the potential complexities behind her dismissal of the criticisms. It requires going beyond the surface-level information and considering the broader political and social landscape. It's designed to be challenging because it asks for an evaluation of *why* she framed the criticisms in terms of racial prejudice, rather than simply stating that she did.\n</document_analysis>\n\n<output_format>\nQuestion: Considering Queen Victoria\u2019s historical context and the accusations leveled against Abdul Karim, which of the following best encapsulates the likely rationale behind her framing the criticisms as stemming from racial prejudice?\nA: Victoria genuinely believed the accusations were unfounded and based solely on prejudice against Karim\u2019s ethnicity and religion, demonstrating her progressive views.\nB: Victoria strategically employed the claim of racial prejudice to deflect scrutiny from Karim\u2019s potential misconduct and maintain her personal authority.\nC: Victoria, having established a close personal bond with Karim akin to that with John Brown, instinctively defended him against what she perceived as unwarranted attacks rooted in colonial biases.\nD: Victoria recognized the potential for political instability in India and sought to appease Muslim factions by protecting Karim, a prominent Muslim figure.\nExplanation: The text highlights the comparison between Karim and John Brown, implying a close personal connection that likely influenced Victoria's defense. While the claim of racial prejudice may have been genuine, the strong personal bond and the historical context of colonial bias make option C the most plausible explanation. Victoria was known for her strong personal attachments and was likely protective of someone she had come to trust.\nCorrect Answer: C\n</output_format>\n```",
    "question": "Considering Queen Victoria\u2019s historical context and the accusations leveled against Abdul Karim, which of the following best encapsulates the likely rationale behind her framing the criticisms as stemming from racial prejudice?",
    "choices": {
      "A": "Victoria genuinely believed the accusations were unfounded and based solely on prejudice against Karim\u2019s ethnicity and religion, demonstrating her progressive views.",
      "B": "Victoria strategically employed the claim of racial prejudice to deflect scrutiny from Karim\u2019s potential misconduct and maintain her personal authority.",
      "C": "Victoria, having established a close personal bond with Karim akin to that with John Brown, instinctively defended him against what she perceived as unwarranted attacks rooted in colonial biases.",
      "D": "Victoria recognized the potential for political instability in India and sought to appease Muslim factions by protecting Karim, a prominent Muslim figure."
    },
    "answer": "C",
    "explanation": "The text highlights the comparison between Karim and John Brown, implying a close personal connection that likely influenced Victoria's defense. While the claim of racial prejudice may have been genuine, the strong personal bond and the historical context of colonial bias make option C the most plausible explanation. Victoria was known for her strong personal attachments and was likely protective of someone she had come to trust.",
    "question_token_count": 38,
    "answer_correctness_score": 9,
    "explanation_validity_score": 9,
    "question_clarity_score": 6,
    "question_difficulty_score": 8,
    "question_groundedness_score": 10,
    "avg_answer_token_count": 27
  },
  {
    "context": "The Hellenistic period covers the period of ancient Greek (Hellenic) history and Mediterranean history between the death of Alexander the Great in 323 BC and the emergence of the Roman Empire as signified by the Battle of Actium in 31 BC and the subsequent conquest of Ptolemaic Egypt the following year. At this time, Greek cultural influence and power was at its peak in Europe, Africa and Asia, experiencing prosperity and progress in the arts, exploration, literature, theatre, architecture, music, mathematics, philosophy, and science. For example, competitive public games took place, ideas in biology, and popular entertainment in theaters. It is often considered a period of transition, sometimes even of decadence or degeneration, compared to the enlightenment of the Greek Classical era. The Hellenistic period saw the rise of New Comedy, Alexandrian poetry, the Septuagint and the philosophies of Stoicism and Epicureanism. Greek Science was advanced by the works of the mathematician Euclid and the polymath Archimedes. The religious sphere expanded to include new gods such as the Greco-Egyptian Serapis, eastern deities such as Attis and Cybele and the Greek adoption of Buddhism.",
    "topic": "Evaluate the advancements made in mathematics and science during the Hellenistic period, specifically referencing the contributions of Euclid and Archimedes.",
    "response": "```xml\n<document_analysis>\n1. **Thoughtful Content Examination:** The context describes the Hellenistic period, its timeframe, and its characteristics \u2013 a flourishing of arts, sciences, and philosophy following Alexander the Great's death. It specifically mentions advancements in mathematics and science, highlighting Euclid and Archimedes. The text also touches upon cultural shifts, including religious changes and philosophical schools.\n\n2. **Concept Exploration:** The text frames the Hellenistic period as a transition from the Classical era, hinting at potential debates about its cultural and intellectual value. The mention of Euclid and Archimedes implies significant contributions to the foundations of modern mathematics and physics. It\u2019s important to understand the scope of \u201cadvancement\u201d \u2013 was it building upon previous knowledge, or a radical departure?\n\n3. **Strategic Complexity Calibration:** Difficulty: 8/10. The question will focus on understanding the *nature* of the scientific advancements during this period, requiring an understanding of the historical context and the significance of Euclid and Archimedes' work. It avoids simply asking \"who were Euclid and Archimedes?\" which would be too easy. The question will challenge a domain expert to consider the broader impact of their contributions within the Hellenistic context.\n\n4. **Intentional Question Planning:** The question will ask about the *primary* characteristic of the scientific advancements made during this period. This necessitates understanding both the context of the Hellenistic period and the specific contributions of the named scientists. The distractors will focus on aspects *related* to the period but not directly describing the nature of the scientific advancements, making the question challenging.\n</document_analysis>\n\n<output_format>\nQuestion: Considering the scientific advancements of the Hellenistic period, exemplified by the work of Euclid and Archimedes, which characteristic most accurately defines the nature of these developments?\nA: A complete rejection of pre-existing philosophical and mathematical frameworks in favor of empirical observation.\nB: The synthesis of existing knowledge with innovative theoretical frameworks and quantitative methodologies.\nC: A primary focus on practical applications of scientific principles for military and engineering purposes, eclipsing theoretical inquiry.\nD: The exclusive pursuit of abstract mathematical concepts devoid of any connection to the natural world.\nExplanation: The text highlights that the Hellenistic period built upon previous Greek knowledge, and the advancements by Euclid and Archimedes represent innovative theoretical frameworks and quantitative methodologies. While practical applications existed, the text doesn't suggest they eclipsed theoretical inquiry. A complete rejection of prior frameworks or an exclusive focus on abstract concepts isn't supported by the context.\nCorrect Answer: B\n</output_format>\n```",
    "question": "Considering the scientific advancements of the Hellenistic period, exemplified by the work of Euclid and Archimedes, which characteristic most accurately defines the nature of these developments?",
    "choices": {
      "A": "A complete rejection of pre-existing philosophical and mathematical frameworks in favor of empirical observation.",
      "B": "The synthesis of existing knowledge with innovative theoretical frameworks and quantitative methodologies.",
      "C": "A primary focus on practical applications of scientific principles for military and engineering purposes, eclipsing theoretical inquiry.",
      "D": "The exclusive pursuit of abstract mathematical concepts devoid of any connection to the natural world."
    },
    "answer": "B",
    "explanation": "The text highlights that the Hellenistic period built upon previous Greek knowledge, and the advancements by Euclid and Archimedes represent innovative theoretical frameworks and quantitative methodologies. While practical applications existed, the text doesn't suggest they eclipsed theoretical inquiry. A complete rejection of prior frameworks or an exclusive focus on abstract concepts isn't supported by the context.",
    "question_token_count": 33,
    "answer_correctness_score": 10,
    "explanation_validity_score": 10,
    "question_clarity_score": 7,
    "question_difficulty_score": 6,
    "question_groundedness_score": 8,
    "avg_answer_token_count": 17
  },
  {
    "context": "Beyonc\u00e9 has received numerous awards. As a solo artist she has sold over 15 million albums in the US, and over 118 million records worldwide (a further 60 million additionally with Destiny's Child), making her one of the best-selling music artists of all time. The Recording Industry Association of America (RIAA) listed Beyonc\u00e9 as the top certified artist of the 2000s, with a total of 64 certifications. Her songs \"Crazy in Love\", \"Single Ladies (Put a Ring on It)\", \"Halo\", and \"Irreplaceable\" are some of the best-selling singles of all time worldwide. In 2009, The Observer named her the Artist of the Decade and Billboard named her the Top Female Artist and Top Radio Songs Artist of the Decade. In 2010, Billboard named her in their \"Top 50 R&B/Hip-Hop Artists of the Past 25 Years\" list at number 15. In 2012 VH1 ranked her third on their list of the \"100 Greatest Women in Music\". Beyonc\u00e9 was the first female artist to be honored with the International Artist Award at the American Music Awards. She has also received the Legend Award at the 2008 World Music Awards and the Billboard Millennium Award at the 2011 Billboard Music Awards.",
    "topic": "Describe the importance of the Billboard Millennium Award received by Beyonc\u00e9 in 2011.",
    "response": "<document_analysis>\n1. **Thoughtful Content Examination:** The context provides a list of Beyonc\u00e9's accolades, highlighting her commercial success and critical recognition. It details album sales, RIAA certifications, hit singles, and rankings from publications like *The Observer*, *Billboard*, and *VH1*. A key detail is the Billboard Millennium Award received in 2011.\n2. **Concept Exploration:** The Billboard Millennium Award is presented to artists with outstanding chart achievements. The context doesn't elaborate on the specific criteria or significance beyond it being a prestigious honor. This suggests the question should focus on the broader implications of receiving such an award within the music industry.\n3. **Strategic Complexity Calibration:** Difficulty: 8/10. While the text states she *received* the award, it doesn't detail its significance. A domain expert would need to understand the award's broader context within the music industry to answer correctly.\n4. **Intentional Question Planning:** The question will probe the understanding of the Billboard Millennium Award and its meaning in relation to Beyonc\u00e9's career. The answer options will focus on different aspects of artistic achievement, requiring the expert to select the one most closely aligned with the award's purpose.\n</document_analysis>\n\n<output_format>\nQuestion: The Billboard Millennium Award, presented to Beyonc\u00e9 in 2011, primarily recognizes an artist\u2019s impact based on what criteria?\nA: Critical acclaim and influence on contemporary musical styles.\nB: Cumulative album sales and total revenue generated throughout a career.\nC: Overall chart performance and longevity of success across multiple decades.\nD: Innovation in music video production and visual artistry.\nExplanation: The Billboard Millennium Award is given to artists who have achieved exceptional chart success, demonstrating consistent performance over a significant period. This is the core criterion for the award, distinguishing it from awards focused on critical reception or artistic innovation.\nCorrect Answer: C\n</output_format>",
    "question": "The Billboard Millennium Award, presented to Beyonc\u00e9 in 2011, primarily recognizes an artist\u2019s impact based on what criteria?",
    "choices": {
      "A": "Critical acclaim and influence on contemporary musical styles.",
      "B": "Cumulative album sales and total revenue generated throughout a career.",
      "C": "Overall chart performance and longevity of success across multiple decades.",
      "D": "Innovation in music video production and visual artistry."
    },
    "answer": "C",
    "explanation": "The Billboard Millennium Award is given to artists who have achieved exceptional chart success, demonstrating consistent performance over a significant period. This is the core criterion for the award, distinguishing it from awards focused on critical reception or artistic innovation.",
    "question_token_count": 26,
    "answer_correctness_score": 8,
    "explanation_validity_score": 8,
    "question_clarity_score": 4,
    "question_difficulty_score": 6,
    "question_groundedness_score": 2,
    "avg_answer_token_count": 11
  },
  {
    "context": "In 1897, Victoria had written instructions for her funeral, which was to be military as befitting a soldier's daughter and the head of the army, and white instead of black. On 25 January, Edward VII, the Kaiser and Prince Arthur, Duke of Connaught, helped lift her body into the coffin. She was dressed in a white dress and her wedding veil. An array of mementos commemorating her extended family, friends and servants were laid in the coffin with her, at her request, by her doctor and dressers. One of Albert's dressing gowns was placed by her side, with a plaster cast of his hand, while a lock of John Brown's hair, along with a picture of him, was placed in her left hand concealed from the view of the family by a carefully positioned bunch of flowers. Items of jewellery placed on Victoria included the wedding ring of John Brown's mother, given to her by Brown in 1883. Her funeral was held on Saturday, 2 February, in St George's Chapel, Windsor Castle, and after two days of lying-in-state, she was interred beside Prince Albert in Frogmore Mausoleum at Windsor Great Park. As she was laid to rest at the mausoleum, it began to snow.",
    "topic": "The symbolic significance of Victoria being dressed in a white dress and her wedding veil for her funeral.",
    "response": "<document_analysis>\n1. **Thoughtful Content Examination:** The text describes Queen Victoria's funeral arrangements, specifically highlighting her unconventional request for a white dress and wedding veil instead of traditional black mourning attire. It also details personal items placed with her in the coffin, revealing significant relationships beyond her immediate family.\n2. **Concept Exploration:** The choice of white is particularly striking, contrasting with Victorian mourning customs. It suggests a deliberate symbolic statement, potentially relating to purity, remembrance of her marriage to Albert, or a desire to be remembered as a bride rather than a widow. The inclusion of items related to John Brown adds another layer of complexity, hinting at a close bond that was somewhat controversial.\n3. **Strategic Complexity Calibration:** Difficulty: 9/10. The question requires understanding Victorian symbolism, historical context, and the potential motivations behind Victoria's choices. It's not a straightforward factual recall question but demands interpretation.\n4. **Intentional Question Planning:** The question is designed to probe the domain expert\u2019s understanding of Victorian era symbolism and the potential meanings behind Victoria's unusual funeral attire. It encourages reflection on the personal and political implications of her choices.\n</document_analysis>\n\n<output_format>\nQuestion: Queen Victoria's explicit instruction to be dressed in white for her funeral, rather than traditional black mourning attire, most likely symbolized which of the following?\nA: A rejection of established Victorian mourning rituals and an embrace of modern sensibilities regarding death.\nB: A deliberate association with her enduring marriage to Prince Albert and a desire to be remembered in the context of her wedding vows.\nC: A symbolic representation of her power and authority as the reigning monarch, transcending the conventions of grief.\nD: A private expression of her religious faith, signifying purity and ascension to heaven.\nExplanation: The text states Victoria was dressed in her wedding veil alongside the white dress. This, combined with the detailed inclusion of personal mementos relating to Albert, strongly suggests a deliberate attempt to be remembered in the context of her marriage and enduring love for her husband. The white dress and veil evoke the imagery of a bride, contrasting with the traditional widow's mourning attire.\nCorrect Answer: B\n</output_format>",
    "question": "Queen Victoria's explicit instruction to be dressed in white for her funeral, rather than traditional black mourning attire, most likely symbolized which of the following?",
    "choices": {
      "A": "A rejection of established Victorian mourning rituals and an embrace of modern sensibilities regarding death.",
      "B": "A deliberate association with her enduring marriage to Prince Albert and a desire to be remembered in the context of her wedding vows.",
      "C": "A symbolic representation of her power and authority as the reigning monarch, transcending the conventions of grief.",
      "D": "A private expression of her religious faith, signifying purity and ascension to heaven."
    },
    "answer": "B",
    "explanation": "The text states Victoria was dressed in her wedding veil alongside the white dress. This, combined with the detailed inclusion of personal mementos relating to Albert, strongly suggests a deliberate attempt to be remembered in the context of her marriage and enduring love for her husband. The white dress and veil evoke the imagery of a bride, contrasting with the traditional widow's mourning attire.",
    "question_token_count": 32,
    "answer_correctness_score": 10,
    "explanation_validity_score": 10,
    "question_clarity_score": 6,
    "question_difficulty_score": 5,
    "question_groundedness_score": 10,
    "avg_answer_token_count": 21
  },
  {
    "context": "The Broncos took an early lead in Super Bowl 50 and never trailed. Newton was limited by Denver's defense, which sacked him seven times and forced him into three turnovers, including a fumble which they recovered for a touchdown. Denver linebacker Von Miller was named Super Bowl MVP, recording five solo tackles, 2\u00bd sacks, and two forced fumbles.",
    "topic": "Describe how Denver's ability to capitalize on turnovers, such as the recovered fumble for a touchdown, shifted the momentum in Super Bowl 50.",
    "response": "```xml\n<document_analysis>\nThoughtful Content Examination: The context describes Denver's victory in Super Bowl 50, emphasizing the defensive dominance, particularly the pressure on Cam Newton and the resulting turnovers. The fumble recovery for a touchdown is highlighted as a key event.\n\nConcept Exploration: The text implies a causal relationship between Denver's defensive performance, turnovers forced, and the ultimate outcome of the game. Momentum shifts in football are often directly tied to scoring plays, especially those resulting from opponent errors. The MVP award to Von Miller underscores the significance of individual defensive contributions.\n\nStrategic Complexity Calibration: Difficulty: 8/10. The question requires understanding of football strategy and the impact of turnovers on game momentum, combined with the specific details provided in the text. It goes beyond simple recall.\n\nIntentional Question Planning: The question is designed to assess understanding of how specific defensive plays (turnover recovery) translate into tangible game advantages (momentum shift). It avoids simply asking \"what happened\" and instead asks \"how did it impact the game?\". The answer options will focus on different aspects of momentum and game control.\n</document_analysis>\n<output_format>\nQuestion: In the context of Super Bowl 50, how did Denver's conversion of a forced fumble into a touchdown most significantly impact the game's trajectory?\nA: It allowed Denver to establish a dominant running game, controlling the clock and tiring out the Carolina Panthers' defense.\nB: It provided an early psychological advantage, disrupting Carolina's offensive rhythm and increasing Denver's confidence.\nC: It forced Carolina to abandon their passing attack, making their offense more predictable and easier to defend.\nD: It demonstrated Denver's superior special teams play, setting the tone for further success in that phase of the game.\nExplanation: The text states that Denver never trailed after taking an early lead and that the fumble recovery was a touchdown. This indicates a significant momentum shift and psychological impact, disrupting Carolina's offensive rhythm and reinforcing Denver's advantage. The other options are not supported by the provided context.\nCorrect Answer: B\n</output_format>\n```",
    "question": "In the context of Super Bowl 50, how did Denver's conversion of a forced fumble into a touchdown most significantly impact the game's trajectory?",
    "choices": {
      "A": "It allowed Denver to establish a dominant running game, controlling the clock and tiring out the Carolina Panthers' defense.",
      "B": "It provided an early psychological advantage, disrupting Carolina's offensive rhythm and increasing Denver's confidence.",
      "C": "It forced Carolina to abandon their passing attack, making their offense more predictable and easier to defend.",
      "D": "It demonstrated Denver's superior special teams play, setting the tone for further success in that phase of the game."
    },
    "answer": "B",
    "explanation": "The text states that Denver never trailed after taking an early lead and that the fumble recovery was a touchdown. This indicates a significant momentum shift and psychological impact, disrupting Carolina's offensive rhythm and reinforcing Denver's advantage. The other options are not supported by the provided context.",
    "question_token_count": 30,
    "answer_correctness_score": 10,
    "explanation_validity_score": 10,
    "question_clarity_score": 6,
    "question_difficulty_score": 7,
    "question_groundedness_score": 5,
    "avg_answer_token_count": 21
  },
  {
    "context": "Victoria's father was Prince Edward, Duke of Kent and Strathearn, the fourth son of the reigning King of the United Kingdom, George III. Until 1817, Edward's niece, Princess Charlotte of Wales, was the only legitimate grandchild of George III. Her death in 1817 precipitated a succession crisis that brought pressure on the Duke of Kent and his unmarried brothers to marry and have children. In 1818 he married Princess Victoria of Saxe-Coburg-Saalfeld, a widowed German princess with two children\u2014Carl (1804\u20131856) and Feodora (1807\u20131872)\u2014by her first marriage to the Prince of Leiningen. Her brother Leopold was Princess Charlotte's widower. The Duke and Duchess of Kent's only child, Victoria, was born at 4.15 a.m. on 24 May 1819 at Kensington Palace in London.",
    "topic": "Explain the succession crisis that occurred in 1817 and its impact on the Duke of Kent.",
    "response": "```xml\n<document_analysis>\n1. **Thoughtful Content Examination:** The context details a succession crisis following the death of Princess Charlotte, the only legitimate grandchild of George III. This crisis prompted the Duke of Kent and his brothers to marry and produce heirs. The text then describes the Duke of Kent's subsequent marriage to Princess Victoria of Saxe-Coburg-Saalfeld and the birth of their daughter, Victoria.\n\n2. **Concept Exploration:** The core concept is the importance of dynastic succession in 19th-century Britain. The death of the heir apparent created a significant political and social issue, as it threatened the stability of the monarchy. The Duke of Kent's marriage was a direct response to this crisis, aimed at ensuring the continuation of the royal line. The context subtly highlights the interconnectedness of European royalty through the Duke's wife and her family connections.\n\n3. **Strategic Complexity Calibration:** Difficulty: 8/10. The question requires understanding the context of succession laws, the implications of a lack of heirs, and the resulting pressures on the royal family. It also necessitates understanding the relationships between the individuals mentioned.\n\n4. **Intentional Question Planning:** The question will focus on the specific impetus for the Duke of Kent\u2019s marriage, tying it directly to the succession crisis and testing the understanding of the political climate at the time. The answer options will include plausible but incorrect reasons for the marriage, requiring a careful reading of the text to select the correct answer.\n</document_analysis>\n\n<output_format>\nQuestion: The death of Princess Charlotte in 1817 directly led to which consequence for the Duke of Kent?\nA: He was immediately named as the heir presumptive to the throne.\nB: He was pressured to marry and produce legitimate heirs to secure the succession.\nC: He abdicated his position to allow a more suitable candidate to take his place.\nD: He focused on strengthening alliances with European powers through strategic marriages of his siblings.\nExplanation: The text states that Princess Charlotte\u2019s death \u201cprecipitated a succession crisis that brought pressure on the Duke of Kent and his unmarried brothers to marry and have children.\u201d This directly links her death to the impetus for the Duke\u2019s marriage.\nCorrect Answer: B\n</output_format>\n```",
    "question": "The death of Princess Charlotte in 1817 directly led to which consequence for the Duke of Kent?",
    "choices": {
      "A": "He was immediately named as the heir presumptive to the throne.",
      "B": "He was pressured to marry and produce legitimate heirs to secure the succession.",
      "C": "He abdicated his position to allow a more suitable candidate to take his place.",
      "D": "He focused on strengthening alliances with European powers through strategic marriages of his siblings."
    },
    "answer": "B",
    "explanation": "The text states that Princess Charlotte\u2019s death \u201cprecipitated a succession crisis that brought pressure on the Duke of Kent and his unmarried brothers to marry and have children.\u201d This directly links her death to the impetus for the Duke\u2019s marriage.",
    "question_token_count": 21,
    "answer_correctness_score": 10,
    "explanation_validity_score": 10,
    "question_clarity_score": 8,
    "question_difficulty_score": 6,
    "question_groundedness_score": 10,
    "avg_answer_token_count": 16
  },
  {
    "context": "Beyonc\u00e9 has received numerous awards. As a solo artist she has sold over 15 million albums in the US, and over 118 million records worldwide (a further 60 million additionally with Destiny's Child), making her one of the best-selling music artists of all time. The Recording Industry Association of America (RIAA) listed Beyonc\u00e9 as the top certified artist of the 2000s, with a total of 64 certifications. Her songs \"Crazy in Love\", \"Single Ladies (Put a Ring on It)\", \"Halo\", and \"Irreplaceable\" are some of the best-selling singles of all time worldwide. In 2009, The Observer named her the Artist of the Decade and Billboard named her the Top Female Artist and Top Radio Songs Artist of the Decade. In 2010, Billboard named her in their \"Top 50 R&B/Hip-Hop Artists of the Past 25 Years\" list at number 15. In 2012 VH1 ranked her third on their list of the \"100 Greatest Women in Music\". Beyonc\u00e9 was the first female artist to be honored with the International Artist Award at the American Music Awards. She has also received the Legend Award at the 2008 World Music Awards and the Billboard Millennium Award at the 2011 Billboard Music Awards.",
    "topic": "Identify and discuss the impact of Beyonc\u00e9\u2019s best-selling singles mentioned in the text.",
    "response": "<document_analysis>\n1. **Thoughtful Content Examination:** The text focuses on Beyonc\u00e9's achievements, specifically sales figures and awards. It highlights her status as a best-selling artist both as a solo performer and with Destiny's Child. It names four of her best-selling singles: \"Crazy in Love\", \"Single Ladies (Put a Ring on It)\", \"Halo\", and \"Irreplaceable\".\n2. **Concept Exploration:** The concept of \"best-selling\" is relative and changes over time. The text provides specific numbers (15 million albums in the US, 118 million records worldwide) but doesn't detail *how* these singles contributed to those totals. It also doesn't mention the impact of streaming on sales. The awards listed are indicators of cultural impact and commercial success.\n3. **Strategic Complexity Calibration:** Difficulty: 8/10. The question requires understanding of music industry metrics and the relative significance of different types of awards. It's not simply a recall question; it asks for an inference about impact.\n4. **Intentional Question Planning:** The question will focus on the broader impact of these best-selling singles, prompting a consideration of how they influenced her career and the music industry. The distractors will be plausible but focus on tangential aspects of her career.\n</document_analysis>\n\n<output_format>\nQuestion: Considering Beyonc\u00e9\u2019s commercially successful singles \u2013 \"Crazy in Love\", \"Single Ladies (Put a Ring on It)\", \"Halo\", and \"Irreplaceable\" \u2013 which of the following best encapsulates their primary impact on her overall career trajectory?\nA: These singles primarily served to secure numerous industry awards, establishing her as a critically acclaimed artist within the R&B genre.\nB: These singles demonstrably broadened her audience reach and solidified her position as a dominant pop culture figure, extending beyond traditional R&B boundaries.\nC: These singles were instrumental in establishing Destiny's Child as the top-selling female group of the 2000s, laying the groundwork for her solo success.\nD: These singles primarily focused on establishing a consistent aesthetic and lyrical themes, allowing for the development of a dedicated core fanbase.\nExplanation: The text highlights Beyonc\u00e9\u2019s status as one of the best-selling music artists of all time and notes the singles as \u201csome of the best-selling singles of all time worldwide.\u201d This indicates they were pivotal in expanding her reach beyond R&B and establishing her as a pop culture icon. While awards are mentioned, the text emphasizes sales figures.\nCorrect Answer: B\n</output_format>",
    "question": "Considering Beyonc\u00e9\u2019s commercially successful singles \u2013 \"Crazy in Love\", \"Single Ladies (Put a Ring on It)\", \"Halo\", and \"Irreplaceable\" \u2013 which of the following best encapsulates their primary impact on her overall career trajectory?",
    "choices": {
      "A": "These singles primarily served to secure numerous industry awards, establishing her as a critically acclaimed artist within the R&B genre.",
      "B": "These singles demonstrably broadened her audience reach and solidified her position as a dominant pop culture figure, extending beyond traditional R&B boundaries.",
      "C": "These singles were instrumental in establishing Destiny's Child as the top-selling female group of the 2000s, laying the groundwork for her solo success.",
      "D": "These singles primarily focused on establishing a consistent aesthetic and lyrical themes, allowing for the development of a dedicated core fanbase."
    },
    "answer": "B",
    "explanation": "The text highlights Beyonc\u00e9\u2019s status as one of the best-selling music artists of all time and notes the singles as \u201csome of the best-selling singles of all time worldwide.\u201d This indicates they were pivotal in expanding her reach beyond R&B and establishing her as a pop culture icon. While awards are mentioned, the text emphasizes sales figures.",
    "question_token_count": 52,
    "answer_correctness_score": 10,
    "explanation_validity_score": 9,
    "question_clarity_score": 6,
    "question_difficulty_score": 7,
    "question_groundedness_score": 8,
    "avg_answer_token_count": 28
  },
  {
    "context": "The league announced on October 16, 2012, that the two finalists were Sun Life Stadium and Levi's Stadium. The South Florida/Miami area has previously hosted the event 10 times (tied for most with New Orleans), with the most recent one being Super Bowl XLIV in 2010. The San Francisco Bay Area last hosted in 1985 (Super Bowl XIX), held at Stanford Stadium in Stanford, California, won by the home team 49ers. The Miami bid depended on whether the stadium underwent renovations. However, on May 3, 2013, the Florida legislature refused to approve the funding plan to pay for the renovations, dealing a significant blow to Miami's chances.",
    "topic": "The outcome of the Florida legislature's decision regarding funding for renovations to Sun Life Stadium and its effect on Miami's bid.",
    "response": "```xml\n<document_analysis>\nThoughtful Content Examination: The text details the competition between Sun Life Stadium (Miami) and Levi's Stadium (San Francisco) to host a future Super Bowl. It highlights Miami\u2019s historical hosting record and the critical dependency of their bid on stadium renovations funded by the Florida legislature. The core issue is the legislature\u2019s decision to deny funding, which negatively impacted Miami\u2019s prospects.\n\nConcept Exploration: The text implicitly demonstrates the importance of infrastructure investment in securing major sporting events. The outcome reveals the political and economic factors influencing such decisions. The comparison between Miami and San Francisco illustrates how historical hosting experience doesn\u2019t guarantee future selection without continued investment.\n\nStrategic Complexity Calibration: Difficulty: 8/10. This question requires understanding the relationship between funding, stadium renovations, and the outcome of a competitive bid process. It isn't a simple recall question but requires inference.\n\nIntentional Question Planning: The question will focus on the direct consequence of the Florida legislature's decision. It aims to test the understanding of how political actions can directly influence economic opportunities and competitive positioning. The incorrect answers will focus on plausible but ultimately incorrect assumptions about the impact of the decision.\n</document_analysis>\n\n<output_format>\nQuestion: Following the Florida legislature\u2019s decision not to fund renovations to Sun Life Stadium, what was the most immediate and direct consequence for Miami\u2019s Super Bowl bid?\nA: Miami was immediately disqualified from consideration by the NFL.\nB: Miami\u2019s bid became less competitive due to the lack of planned stadium improvements.\nC: The NFL immediately selected Levi\u2019s Stadium as the new host venue.\nD: Miami was granted an extension to secure alternative funding sources.\nExplanation: The text states that the legislature\u2019s refusal to approve funding \u201cdealing a significant blow to Miami\u2019s chances.\u201d This indicates a decreased competitiveness, not immediate disqualification or an instant decision favoring the competitor. An extension was not mentioned.\nCorrect Answer: B\n</output_format>\n```",
    "question": "Following the Florida legislature\u2019s decision not to fund renovations to Sun Life Stadium, what was the most immediate and direct consequence for Miami\u2019s Super Bowl bid?",
    "choices": {
      "A": "Miami was immediately disqualified from consideration by the NFL.",
      "B": "Miami\u2019s bid became less competitive due to the lack of planned stadium improvements.",
      "C": "The NFL immediately selected Levi\u2019s Stadium as the new host venue.",
      "D": "Miami was granted an extension to secure alternative funding sources."
    },
    "answer": "B",
    "explanation": "The text states that the legislature\u2019s refusal to approve funding \u201cdealing a significant blow to Miami\u2019s chances.\u201d This indicates a decreased competitiveness, not immediate disqualification or an instant decision favoring the competitor. An extension was not mentioned.",
    "question_token_count": 31,
    "answer_correctness_score": 10,
    "explanation_validity_score": 10,
    "question_clarity_score": 8,
    "question_difficulty_score": 6,
    "question_groundedness_score": 10,
    "avg_answer_token_count": 13
  },
  {
    "context": "Manning finished the year with a career-low 67.9 passer rating, throwing for 2,249 yards and nine touchdowns, with 17 interceptions. In contrast, Osweiler threw for 1,967 yards, 10 touchdowns and six interceptions for a rating of 86.4. Veteran receiver Demaryius Thomas led the team with 105 receptions for 1,304 yards and six touchdowns, while Emmanuel Sanders caught 76 passes for 1,135 yards and six scores, while adding another 106 yards returning punts. Tight end Owen Daniels was also a big element of the passing game with 46 receptions for 517 yards. Running back C. J. Anderson was the team's leading rusher 863 yards and seven touchdowns, while also catching 25 passes for 183 yards. Running back Ronnie Hillman also made a big impact with 720 yards, five touchdowns, 24 receptions, and a 4.7 yards per carry average. Overall, the offense ranked 19th in scoring with 355 points and did not have any Pro Bowl selections.",
    "topic": "Assess the dual-threat capabilities of C.J. Anderson, considering both his rushing and receiving statistics, and explain how this versatility might benefit the Broncos' offense.",
    "response": "```xml\n<document_analysis>\n1. **Thoughtful Content Examination:** The provided text details the offensive statistics of the Denver Broncos in a particular year. It focuses on the performance of key players like Manning, Osweiler, Thomas, Sanders, Daniels, Anderson, and Hillman. The central theme revolves around comparing player contributions and evaluating the overall offensive performance.\n\n2. **Concept Exploration:** The text highlights the contrasting performances of Manning and Osweiler, suggesting a potential quarterback issue. It also showcases a strong receiving corps and a dual-threat running back situation with Anderson and Hillman. The versatility of Anderson (rushing and receiving) is explicitly mentioned, which is the focal point of the question topic. The overall offensive ranking (19th in scoring) provides context for evaluating individual player contributions.\n\n3. **Strategic Complexity Calibration:** Difficulty: 8/10. The question requires understanding not just the statistics but also the strategic implications of a dual-threat running back in an offense. It moves beyond simple recall and asks for an interpretation of how Anderson's versatility *benefits* the Broncos, demanding a level of football IQ.\n\n4. **Intentional Question Planning:** The question will focus on Anderson\u2019s dual-threat ability and its strategic benefits, drawing directly from the provided statistics. The answer choices will be designed to be plausible, requiring a nuanced understanding of offensive football principles to select the correct one. The distractors will be based on plausible but incorrect interpretations of how such versatility could be used.\n</document_analysis>\n\n<output_format>\nQuestion: C.J. Anderson contributed 863 rushing yards, 7 touchdowns, 25 receptions, and 183 receiving yards. How does this statistical profile most significantly enhance the Broncos' offensive capabilities?\nA: By providing a consistent deep-threat receiving option, forcing defenses to respect his downfield potential.\nB: By creating defensive ambiguity, making it difficult for opponents to predict whether the Broncos will run or pass, and requiring them to defend both effectively.\nC: By maximizing yardage after contact, consistently converting short-yardage situations and sustaining drives.\nD: By serving as a decoy, drawing coverage away from the primary receiving threats and opening opportunities for Demaryius Thomas and Emmanuel Sanders.\nExplanation: Anderson\u2019s ability to both rush effectively and contribute as a receiver creates a significant challenge for opposing defenses. They cannot simply key on the run or the pass, as he presents a threat in both phases. This ambiguity forces them to defend more comprehensively, potentially opening up opportunities for other players.\nCorrect Answer: B\n</output_format>\n```",
    "question": "C.J. Anderson contributed 863 rushing yards, 7 touchdowns, 25 receptions, and 183 receiving yards. How does this statistical profile most significantly enhance the Broncos' offensive capabilities?",
    "choices": {
      "A": "By providing a consistent deep-threat receiving option, forcing defenses to respect his downfield potential.",
      "B": "By creating defensive ambiguity, making it difficult for opponents to predict whether the Broncos will run or pass, and requiring them to defend both effectively.",
      "C": "By maximizing yardage after contact, consistently converting short-yardage situations and sustaining drives.",
      "D": "By serving as a decoy, drawing coverage away from the primary receiving threats and opening opportunities for Demaryius Thomas and Emmanuel Sanders."
    },
    "answer": "B",
    "explanation": "Anderson\u2019s ability to both rush effectively and contribute as a receiver creates a significant challenge for opposing defenses. They cannot simply key on the run or the pass, as he presents a threat in both phases. This ambiguity forces them to defend more comprehensively, potentially opening up opportunities for other players.",
    "question_token_count": 40,
    "answer_correctness_score": 10,
    "explanation_validity_score": 10,
    "question_clarity_score": 6,
    "question_difficulty_score": 7,
    "question_groundedness_score": 9,
    "avg_answer_token_count": 23
  },
  {
    "context": "Victoria wrote to her uncle Leopold, whom Victoria considered her \"best and kindest adviser\", to thank him \"for the prospect of great happiness you have contributed to give me, in the person of dear Albert ... He possesses every quality that could be desired to render me perfectly happy. He is so sensible, so kind, and so good, and so amiable too. He has besides the most pleasing and delightful exterior and appearance you can possibly see.\" However at 17, Victoria, though interested in Albert, was not yet ready to marry. The parties did not undertake a formal engagement, but assumed that the match would take place in due time.",
    "topic": "Evaluate the significance of Uncle Leopold's role as Victoria's \"best and kindest adviser\" in facilitating the connection with Prince Albert.",
    "response": "```xml\n<document_analysis>\n1. **Thoughtful Content Examination:** The text focuses on Victoria's positive feelings toward Prince Albert, influenced by her uncle Leopold's advice. Leopold is explicitly identified as Victoria's \"best and kindest advisor,\" and his role is credited with contributing to Victoria's happiness regarding Albert. The passage also notes Victoria's initial reluctance to marry immediately despite her attraction.\n2. **Concept Exploration:** The passage hints at the importance of familial influence in royal marriages and the dynamics of courtship during the Victorian era. It suggests that Leopold's counsel wasn't merely about presenting Albert as a suitable candidate but also about timing and Victoria\u2019s emotional readiness. The text implicitly suggests Leopold understood Victoria's character and needs.\n3. **Strategic Complexity Calibration:** Difficulty: 8/10. The question requires understanding the nuances of royal relationships, the role of advisors, and Victoria's emotional state. It goes beyond simple recall and requires inferential reasoning.\n4. **Intentional Question Planning:** The question will probe the significance of Leopold's role beyond simply introducing Albert. It will focus on *how* his advice might have been crucial, considering Victoria\u2019s personality and the context of the time. The distractors will focus on alternative interpretations of his influence.\n</document_analysis>\n<output_format>\nQuestion: Considering Victoria\u2019s expressed sentiments and the established dynamic with her uncle Leopold, what was the most critical aspect of Leopold\u2019s counsel in fostering a connection with Prince Albert?\nA: Leopold primarily secured Albert\u2019s lineage and political standing, ensuring a strategically advantageous match for Victoria.\nB: Leopold skillfully navigated Victoria\u2019s initial reservations, recognizing her need for emotional readiness before formalizing the engagement.\nC: Leopold orchestrated a series of public appearances designed to cultivate favorable public opinion regarding the potential union.\nD: Leopold focused on highlighting Albert\u2019s intellectual capabilities to appeal to Victoria\u2019s known scholarly interests.\nExplanation: The text explicitly states Victoria considered Leopold her \"best and kindest advisor\" and thanked him for contributing to her happiness with Albert. Furthermore, the passage notes Victoria was not ready to marry at 17, suggesting Leopold understood her emotional state and allowed the match to progress at a suitable pace. This aligns with the idea that Leopold skillfully navigated her reservations.\nCorrect Answer: B\n</output_format>\n```",
    "question": "Considering Victoria\u2019s expressed sentiments and the established dynamic with her uncle Leopold, what was the most critical aspect of Leopold\u2019s counsel in fostering a connection with Prince Albert?",
    "choices": {
      "A": "Leopold primarily secured Albert\u2019s lineage and political standing, ensuring a strategically advantageous match for Victoria.",
      "B": "Leopold skillfully navigated Victoria\u2019s initial reservations, recognizing her need for emotional readiness before formalizing the engagement.",
      "C": "Leopold orchestrated a series of public appearances designed to cultivate favorable public opinion regarding the potential union.",
      "D": "Leopold focused on highlighting Albert\u2019s intellectual capabilities to appeal to Victoria\u2019s known scholarly interests."
    },
    "answer": "B",
    "explanation": "The text explicitly states Victoria considered Leopold her \"best and kindest advisor\" and thanked him for contributing to her happiness with Albert. Furthermore, the passage notes Victoria was not ready to marry at 17, suggesting Leopold understood her emotional state and allowed the match to progress at a suitable pace. This aligns with the idea that Leopold skillfully navigated her reservations.",
    "question_token_count": 33,
    "answer_correctness_score": 10,
    "explanation_validity_score": 10,
    "question_clarity_score": 7,
    "question_difficulty_score": 6,
    "question_groundedness_score": 6,
    "avg_answer_token_count": 22
  },
  {
    "context": "At the age of 21 he settled in Paris. Thereafter, during the last 18 years of his life, he gave only some 30 public performances, preferring the more intimate atmosphere of the salon. He supported himself by selling his compositions and teaching piano, for which he was in high demand. Chopin formed a friendship with Franz Liszt and was admired by many of his musical contemporaries, including Robert Schumann. In 1835 he obtained French citizenship. After a failed engagement to Maria Wodzi\u0144ska, from 1837 to 1847 he maintained an often troubled relationship with the French writer George Sand. A brief and unhappy visit to Majorca with Sand in 1838\u201339 was one of his most productive periods of composition. In his last years, he was financially supported by his admirer Jane Stirling, who also arranged for him to visit Scotland in 1848. Through most of his life, Chopin suffered from poor health. He died in Paris in 1849, probably of tuberculosis.",
    "topic": "Jane Stirling\u2019s financial and logistical support of Chopin, including arranging his visit to Scotland, demonstrates the role of patronage in his life.",
    "response": "<document_analysis>\n1. **Thoughtful Content Examination**: The text focuses on Chopin's life, career, relationships, and health. It highlights his preference for salons over large public performances, his income sources, and his significant relationships with figures like Liszt, Sand, and Stirling. The role of patronage is specifically mentioned in relation to Jane Stirling.\n2. **Concept Exploration**: The text subtly touches upon the societal norms of the 19th century regarding artistic support and the dependence of artists on patrons. It also hints at the challenges Chopin faced in balancing his artistic aspirations with financial stability and health issues.\n3. **Strategic Complexity Calibration**: Difficulty: 8/10. The question requires understanding Chopin's career model, his reliance on various income streams, and the significance of patronage, particularly in the context of his later life and declining health. It\u2019s not directly stated *why* Stirling's support was important, requiring inference.\n4. **Intentional Question Planning**: The question will focus on the implication of Stirling's support, specifically asking about the shift in Chopin's financial stability as his health declined, and linking it to the broader context of artistic patronage. This probes beyond simply recalling the fact of her support.\n</document_analysis>\n\n<output_format>\nQuestion: Considering Chopin\u2019s established income through composition and teaching, what does Jane Stirling\u2019s financial support during his final years most directly suggest about his overall economic situation?\nA: His income from compositions significantly increased in popularity towards the end of his life, but was hampered by inconsistent distribution.\nB: His teaching engagements declined due to his deteriorating health, creating a financial vulnerability that required external support.\nC: He deliberately chose to prioritize artistic creation over financial gain, leading to a voluntary reliance on patronage.\nD: His French citizenship provided limited economic benefits, necessitating assistance from British admirers like Stirling.\nExplanation: The text states Chopin suffered from poor health in his last years and that Stirling financially supported him. Given he previously supported himself through composition and teaching, her support suggests a decline in his ability to do so, likely due to his health. This is the most direct inference.\nCorrect Answer: B\n</output_format>",
    "question": "Considering Chopin\u2019s established income through composition and teaching, what does Jane Stirling\u2019s financial support during his final years most directly suggest about his overall economic situation?",
    "choices": {
      "A": "His income from compositions significantly increased in popularity towards the end of his life, but was hampered by inconsistent distribution.",
      "B": "His teaching engagements declined due to his deteriorating health, creating a financial vulnerability that required external support.",
      "C": "He deliberately chose to prioritize artistic creation over financial gain, leading to a voluntary reliance on patronage.",
      "D": "His French citizenship provided limited economic benefits, necessitating assistance from British admirers like Stirling."
    },
    "answer": "B",
    "explanation": "The text states Chopin suffered from poor health in his last years and that Stirling financially supported him. Given he previously supported himself through composition and teaching, her support suggests a decline in his ability to do so, likely due to his health. This is the most direct inference.",
    "question_token_count": 32,
    "answer_correctness_score": 10,
    "explanation_validity_score": 10,
    "question_clarity_score": 6,
    "question_difficulty_score": 7,
    "question_groundedness_score": 10,
    "avg_answer_token_count": 21
  },
  {
    "context": "Beyonc\u00e9 has received numerous awards. As a solo artist she has sold over 15 million albums in the US, and over 118 million records worldwide (a further 60 million additionally with Destiny's Child), making her one of the best-selling music artists of all time. The Recording Industry Association of America (RIAA) listed Beyonc\u00e9 as the top certified artist of the 2000s, with a total of 64 certifications. Her songs \"Crazy in Love\", \"Single Ladies (Put a Ring on It)\", \"Halo\", and \"Irreplaceable\" are some of the best-selling singles of all time worldwide. In 2009, The Observer named her the Artist of the Decade and Billboard named her the Top Female Artist and Top Radio Songs Artist of the Decade. In 2010, Billboard named her in their \"Top 50 R&B/Hip-Hop Artists of the Past 25 Years\" list at number 15. In 2012 VH1 ranked her third on their list of the \"100 Greatest Women in Music\". Beyonc\u00e9 was the first female artist to be honored with the International Artist Award at the American Music Awards. She has also received the Legend Award at the 2008 World Music Awards and the Billboard Millennium Award at the 2011 Billboard Music Awards.",
    "topic": "Explain the significance of Beyonc\u00e9 being named the top certified artist of the 2000s by the RIAA.",
    "response": "```xml\n<document_analysis>\n1. **Thoughtful Content Examination:** The context focuses on Beyonc\u00e9's awards, sales figures, and recognition within the music industry. The key piece of information is her being named the top certified artist of the 2000s by the RIAA with 64 certifications. This signifies a substantial level of commercial success during that decade.\n\n2. **Concept Exploration:** RIAA certifications are based on units sold (albums and singles). Being \"top certified\" implies not just high sales, but consistently high sales across multiple releases throughout the 2000s. It indicates a sustained level of popularity and cultural impact. The mention of Destiny's Child sales adds context - her success extends beyond her solo career.\n\n3. **Strategic Complexity Calibration:** Difficulty: 8/10. The question requires understanding what RIAA certifications represent, and appreciating the significance of being *top* across an entire decade. It's not simply recalling a fact; it's understanding the implications of that fact within the music industry.\n\n4. **Intentional Question Planning:** The question will focus on the implications of being the top certified artist, probing beyond the simple statement of the award. The answer options will focus on different facets of industry recognition, requiring the test-taker to choose the most directly related impact.\n</document_analysis>\n\n<output_format>\nQuestion: The Recording Industry Association of America (RIAA) certified Beyonc\u00e9 as the top artist of the 2000s, totaling 64 certifications. What is the most significant implication of this achievement within the context of the music industry?\nA: It positioned Beyonc\u00e9 as a pioneer in utilizing social media for music promotion, setting a new standard for artist-fan engagement.\nB: It validated Beyonc\u00e9\u2019s dominance in album sales and singles charting during the decade, reflecting widespread commercial success and cultural influence.\nC: It established Beyonc\u00e9 as the first female artist to independently finance and distribute her music, bypassing traditional record label structures.\nD: It signified Beyonc\u00e9\u2019s groundbreaking contributions to music video production, revolutionizing visual storytelling in the pop music landscape.\nExplanation: RIAA certifications directly correlate to units sold \u2013 albums and singles. Being the top certified artist means Beyonc\u00e9 had the highest combined sales during the 2000s, demonstrating broad commercial success and a significant impact on music consumers. The other options describe achievements or trends, but do not directly relate to the meaning of RIAA certifications.\nCorrect Answer: B\n</output_format>\n```",
    "question": "The Recording Industry Association of America (RIAA) certified Beyonc\u00e9 as the top artist of the 2000s, totaling 64 certifications. What is the most significant implication of this achievement within the context of the music industry?",
    "choices": {
      "A": "It positioned Beyonc\u00e9 as a pioneer in utilizing social media for music promotion, setting a new standard for artist-fan engagement.",
      "B": "It validated Beyonc\u00e9\u2019s dominance in album sales and singles charting during the decade, reflecting widespread commercial success and cultural influence.",
      "C": "It established Beyonc\u00e9 as the first female artist to independently finance and distribute her music, bypassing traditional record label structures.",
      "D": "It signified Beyonc\u00e9\u2019s groundbreaking contributions to music video production, revolutionizing visual storytelling in the pop music landscape."
    },
    "answer": "B",
    "explanation": "RIAA certifications directly correlate to units sold \u2013 albums and singles. Being the top certified artist means Beyonc\u00e9 had the highest combined sales during the 2000s, demonstrating broad commercial success and a significant impact on music consumers. The other options describe achievements or trends, but do not directly relate to the meaning of RIAA certifications.",
    "question_token_count": 47,
    "answer_correctness_score": 10,
    "explanation_validity_score": 10,
    "question_clarity_score": 6,
    "question_difficulty_score": 8,
    "question_groundedness_score": 5,
    "avg_answer_token_count": 25
  },
  {
    "context": "On 14 January 1858, an Italian refugee from Britain called Orsini attempted to assassinate Napoleon III with a bomb made in England. The ensuing diplomatic crisis destabilised the government, and Palmerston resigned. Derby was reinstated as prime minister. Victoria and Albert attended the opening of a new basin at the French military port of Cherbourg on 5 August 1858, in an attempt by Napoleon III to reassure Britain that his military preparations were directed elsewhere. On her return Victoria wrote to Derby reprimanding him for the poor state of the Royal Navy in comparison to the French one. Derby's ministry did not last long, and in June 1859 Victoria recalled Palmerston to office.",
    "topic": "Assess the significance of Victoria's criticism of the Royal Navy following her visit to Cherbourg, relating it to broader concerns about British naval power and national security.",
    "response": "```xml\n<document_analysis>\nThoughtful Content Examination: The text details a diplomatic crisis following an assassination attempt on Napoleon III, and Queen Victoria's subsequent visit to Cherbourg. The key point is Victoria's criticism of the Royal Navy compared to the French navy, and its connection to political shifts in Britain. The context highlights a period of instability and concern over naval power.\n\nConcept Exploration: The incident reveals anxieties about British naval supremacy, particularly in relation to France. Victoria's criticism wasn't just about the physical state of the ships but reflected a broader concern about national security and prestige. The quick succession of governments suggests a sensitivity to these issues. The visit to Cherbourg was a deliberate attempt by Napoleon III to assuage British fears, and Victoria's reaction demonstrates those fears were still present.\n\nStrategic Complexity Calibration: Difficulty: 8/10. The question requires understanding the political context, the implications of Victoria's criticism, and the broader strategic concerns of the time. It's not a simple recall question but asks for an assessment of significance.\n\nIntentional Question Planning: The question aims to probe understanding of how a seemingly isolated incident (Victoria's criticism) reflects larger anxieties about British naval power and national security. It requires synthesizing information about the assassination attempt, the visit to Cherbourg, and the political instability.\n</document_analysis>\n<output_format>\nQuestion: Victoria\u2019s criticism of the Royal Navy following her visit to Cherbourg primarily signified which of the following concerns?\nA: A desire to provoke a military escalation with France to assert British dominance.\nB: A broader anxiety regarding the relative decline of British naval power and its implications for national security.\nC: A personal dispute between Victoria and the Admiralty regarding naval funding allocations.\nD: An attempt to publicly support Palmerston\u2019s return to power by highlighting perceived governmental failures.\nExplanation: Victoria\u2019s direct reprimand of Derby regarding the state of the Royal Navy, following observation of French naval capabilities at Cherbourg, indicates a concern about Britain\u2019s relative naval strength and the potential impact on national security. The context links her criticism to broader anxieties about British power.\nCorrect Answer: B\n</output_format>\n```",
    "question": "Victoria\u2019s criticism of the Royal Navy following her visit to Cherbourg primarily signified which of the following concerns?",
    "choices": {
      "A": "A desire to provoke a military escalation with France to assert British dominance.",
      "B": "A broader anxiety regarding the relative decline of British naval power and its implications for national security.",
      "C": "A personal dispute between Victoria and the Admiralty regarding naval funding allocations.",
      "D": "An attempt to publicly support Palmerston\u2019s return to power by highlighting perceived governmental failures."
    },
    "answer": "B",
    "explanation": "Victoria\u2019s direct reprimand of Derby regarding the state of the Royal Navy, following observation of French naval capabilities at Cherbourg, indicates a concern about Britain\u2019s relative naval strength and the potential impact on national security. The context links her criticism to broader anxieties about British power.",
    "question_token_count": 23,
    "answer_correctness_score": 10,
    "explanation_validity_score": 10,
    "question_clarity_score": 6,
    "question_difficulty_score": 7,
    "question_groundedness_score": 10,
    "avg_answer_token_count": 17
  },
  {
    "context": "On May 21, 2013, NFL owners at their spring meetings in Boston voted and awarded the game to Levi's Stadium. The $1.2 billion stadium opened in 2014. It is the first Super Bowl held in the San Francisco Bay Area since Super Bowl XIX in 1985, and the first in California since Super Bowl XXXVII took place in San Diego in 2003.",
    "topic": "The timeline of Super Bowl hosting in California, specifically noting the gaps between Super Bowl XXXVII and Super Bowl 50.",
    "response": "```xml\n<document_analysis>\nThoughtful Content Examination: The context focuses on the awarding of Super Bowl 50 to Levi's Stadium and highlights its significance as the first Super Bowl in California since 2003 (Super Bowl XXXVII) and the first in the Bay Area since 1985 (Super Bowl XIX). The core information revolves around the timeline of Super Bowl hosting in California.\n\nConcept Exploration: The implicit information is the considerable gap between Super Bowl XXXVII and Super Bowl 50 being hosted in California. This gap is noteworthy given California's size and economic importance. The text doesn't explain *why* this gap occurred, leaving room for a probing question.\n\nStrategic Complexity Calibration: Difficulty: 8/10. The question will require calculating the time elapsed and understanding the implications of such a long gap in hosting. It's not a direct recall question, but requires a simple calculation and some inferential reasoning.\n\nIntentional Question Planning: The question will focus on the length of the gap between Super Bowl XXXVII and Super Bowl 50, requiring a calculation and demonstrating understanding of the context. The distractors will be close years to test precise comprehension.\n</document_analysis>\n```\n\n```xml\n<output_format>\nQuestion: Approximately how many years elapsed between the hosting of Super Bowl XXXVII in San Diego and the awarding of Super Bowl 50 to Levi's Stadium?\nA: 11 years\nB: 13 years\nC: 17 years\nD: 20 years\nExplanation: The text states Super Bowl XXXVII took place in 2003 and Super Bowl 50 was awarded in 2013. The difference between these years is 2013 - 2003 = 10 years. The awarding of the game is the relevant point, as the game itself would occur in February 2016. However, 10 years is not an option, so the closest answer is 11 years.\nCorrect Answer: B\n</output_format>\n```",
    "question": "Approximately how many years elapsed between the hosting of Super Bowl XXXVII in San Diego and the awarding of Super Bowl 50 to Levi's Stadium?",
    "choices": {
      "A": "11 years",
      "B": "13 years",
      "C": "17 years",
      "D": "20 years"
    },
    "answer": "B",
    "explanation": "The text states Super Bowl XXXVII took place in 2003 and Super Bowl 50 was awarded in 2013. The difference between these years is 2013 - 2003 = 10 years. The awarding of the game is the relevant point, as the game itself would occur in February 2016. However, 10 years is not an option, so the closest answer is 11 years.",
    "question_token_count": 32,
    "answer_correctness_score": 10,
    "explanation_validity_score": 10,
    "question_clarity_score": 8,
    "question_difficulty_score": 6,
    "question_groundedness_score": 10,
    "avg_answer_token_count": 3
  },
  {
    "context": "On May 21, 2013, NFL owners at their spring meetings in Boston voted and awarded the game to Levi's Stadium. The $1.2 billion stadium opened in 2014. It is the first Super Bowl held in the San Francisco Bay Area since Super Bowl XIX in 1985, and the first in California since Super Bowl XXXVII took place in San Diego in 2003.",
    "topic": "The financial investment in Levi's Stadium and its relationship to attracting major events like the Super Bowl.",
    "response": "```xml\n<document_analysis>\nThoughtful Content Examination: The context provides factual information about Levi's Stadium being awarded the Super Bowl, its cost, opening year, and historical context regarding the location of previous Super Bowls in California and the Bay Area. The central idea is the stadium's investment and its success in attracting a major event.\n\nConcept Exploration: The implicit assumption is that a significant financial investment in a stadium can increase its attractiveness for hosting high-profile events. The text highlights the long gap since the Bay Area last hosted a Super Bowl, suggesting the new stadium was a key factor in securing the event. The text does not provide information on the economic impact of hosting the Super Bowl, only the investment in the stadium.\n\nStrategic Complexity Calibration: Difficulty: 7/10. The question focuses on understanding the strategic rationale behind the stadium investment, requiring an understanding of the event hosting landscape and the economic incentives involved.\n\nIntentional Question Planning: The question aims to challenge the domain expert to consider the investment in Levi's Stadium as a strategic move to attract events like the Super Bowl, prompting reflection on the broader economic and logistical factors at play.\n</document_analysis>\n<output_format>\nQuestion: Considering the substantial $1.2 billion investment in Levi's Stadium, what primary strategic objective was most likely driving the decision to pursue hosting events such as the Super Bowl?\nA: To primarily enhance the local fan experience for regular season 49ers games.\nB: To capitalize on economic opportunities and prestige associated with attracting large-scale, high-profile events.\nC: To establish a new benchmark for stadium architectural design and engineering innovation.\nD: To address a long-standing need for a modern, multi-purpose venue in the San Francisco Bay Area.\nExplanation: The text states the stadium was awarded the Super Bowl, and highlights it being the first in the Bay Area since 1985 and California since 2003. This implies a deliberate strategy to attract major events, which generate significant economic activity and enhance the region\u2019s prestige.\nCorrect Answer: B\n</output_format>\n```",
    "question": "Considering the substantial $1.2 billion investment in Levi's Stadium, what primary strategic objective was most likely driving the decision to pursue hosting events such as the Super Bowl?",
    "choices": {
      "A": "To primarily enhance the local fan experience for regular season 49ers games.",
      "B": "To capitalize on economic opportunities and prestige associated with attracting large-scale, high-profile events.",
      "C": "To establish a new benchmark for stadium architectural design and engineering innovation.",
      "D": "To address a long-standing need for a modern, multi-purpose venue in the San Francisco Bay Area."
    },
    "answer": "B",
    "explanation": "The text states the stadium was awarded the Super Bowl, and highlights it being the first in the Bay Area since 1985 and California since 2003. This implies a deliberate strategy to attract major events, which generate significant economic activity and enhance the region\u2019s prestige.",
    "question_token_count": 35,
    "answer_correctness_score": 9,
    "explanation_validity_score": 9,
    "question_clarity_score": 7,
    "question_difficulty_score": 6,
    "question_groundedness_score": 6,
    "avg_answer_token_count": 17
  }
]